Sheet: ExcelTemplate
A1: BỘ GIAO THÔNG VẬN TẢI | L1: 2015/04 | V1: Ngày in báo cáo: | W1: Ngày in báo cáo : ___/___/_____ | AU1: Ngày in báo cáo : ___/___/_____
A2: TỔNG CÔNG TY CẢNG HÀNG KHÔNG VIỆT NAM | W2: Trang in báo cáo : ___/___ | AU2: Trang in báo cáo : ___/___
A3: ="BẢNG TIỀN LƯƠNG THÁNG "&RIGHT(R[-2]C[11],2)&" NĂM "&LEFT(R[-2]C[11],4) -> BẢNG TIỀN LƯƠNG THÁNG 04 NĂM 2015
A4: ĐƠN VỊ: | C4: =R[5]C[-2] -> Công ty Phục vụ mặt đất Hà Nội (HGS)
A6: STT | B6: Mã NV | C6: Họ và tên | E6: Số TK | F6: Lương chức danh | G6: Lương cơ bản | H6: Các khoản phụ cấp | L6: Ăn giữa ca | M6: Bổ sung lương | N6: Tiền thêm giờ | O6: Tiền làm đêm | P6: Các khoản trừ vào lương | Q6: Tổng | R6: Các khoản phải nộp | W6: Thực lĩnh | AU6: Thực lĩnh | AW6: Tăng ca không chịu thuế | AX6: Tổng tiền tăng ca | AY6: Tăng ca chịu thuế
D7: Chức vụ | H7: PCCV | I7: PCCV o BH | J7: PCCV | K7: PCTN | R7: BHXH | S7: BHYT | T7: BHTN | U7: ĐPCĐ | V7: TTN tạm tính | X7: Đi đường | Y7: Nghỉ phép trong chế độ | Z7: H6 | AA7: Nghỉ TNLD | AB7: Nghỉ việc riêng hưởng nguyên lương (ma chay, cưới hỏi …) | AC7: Làm thêm CN b.đêm | AD7: Làm thêm CN b.ngày | AE7: Làm thêm LT b.đêm | AF7: Làm thêm LT b.ngày | AG7: Làm thêm NT b.đêm | AH7: Làm thêm NT b.ngày | AI7: X | AJ7: TS | AK7: ST | AL7: CT | AM7: H1 | AN7: H2 | AO7: H3 | AP7: H4 | AQ7: H5 | AV7: DC
A8: 1 | B8: 2 | C8: 3 | E8: 4 | F8: 22 | G8: 23 | H8: 24 | K8: 25 | L8: 26 | M8: 27 | N8: 28 | O8: 29 | Q8: 30 | R8: 31 | S8: 32 | T8: 33 | U8: 34 | V8: 35 | W8: 36 | AC8: 79 | AD8: 80 | AE8: 81 | AF8: 82 | AG8: 83 | AH8: 84 | AU8: 36
A9: Công ty Phục vụ mặt đất Hà Nội (HGS)
A10: Phòng Điều hành, tài liệu và hướng dẫn chất xếp (HGS) | F10: =R[4]C -> 780000 | G10: =R[4]C -> 0 | H10: =R[4]C -> 0 | I10: =R[4]C -> 0 | J10: =R[4]C -> 0 | K10: =R[4]C -> 0 | L10: =R[4]C -> 0 | M10: =R[4]C -> 0 | N10: =R[4]C -> 0 | O10: =R[4]C -> 0 | P10: =R[4]C -> 0 | Q10: =R[4]C -> 780000 | R10: =R[4]C -> 0 | S10: =R[4]C -> 0 | T10: =R[4]C -> 0 | U10: =R[4]C -> 7800 | V10: =R[4]C -> 0 | W10: =R[4]C -> 772200 | X10: =R[4]C -> 0 | Y10: =R[4]C -> 0 | Z10: =R[4]C -> 0 | AA10: =R[4]C -> 0 | AB10: =R[4]C -> 0 | AC10: =R[4]C -> 0 | AD10: =R[4]C -> 0 | AE10: =R[4]C -> 0 | AF10: =R[4]C -> 0 | AG10: =R[4]C -> 0 | AH10: =R[4]C -> 0 | AI10: =R[4]C -> 780000 | AJ10: =R[4]C -> 0 | AK10: =R[4]C -> 0 | AL10: =R[4]C -> 0 | AM10: =R[4]C -> 0 | AN10: =R[4]C -> 0 | AO10: =R[4]C -> 0 | AP10: =R[4]C -> 0 | AQ10: =R[4]C -> 0 | AR10: =R[4]C -> 1 | AS10: =R[4]C -> 0 | AT10: =R[4]C -> 0 | AU10: =R[4]C -> 772200 | AW10: =R[4]C -> 0 | AX10: =R[4]C -> 0 | AY10: =R[4]C -> 0
F11: =R[2]C -> 780000 | G11: =R[2]C -> 0 | H11: =R[2]C -> 0 | I11: =R[2]C -> 0 | J11: =R[2]C -> 0 | K11: =R[2]C -> 0 | L11: =R[2]C -> 0 | M11: =R[2]C -> 0 | N11: =R[2]C -> 0 | O11: =R[2]C -> 0 | P11: =R[2]C -> 0 | Q11: =R[2]C -> 780000 | R11: =R[2]C -> 0 | S11: =R[2]C -> 0 | T11: =R[2]C -> 0 | U11: =R[2]C -> 7800 | V11: =R[2]C -> 0 | W11: =R[2]C -> 772200 | X11: =R[2]C -> 0 | Y11: =R[2]C -> 0 | Z11: =R[2]C -> 0 | AA11: =R[2]C -> 0 | AB11: =R[2]C -> 0 | AC11: =R[2]C -> 0 | AD11: =R[2]C -> 0 | AE11: =R[2]C -> 0 | AF11: =R[2]C -> 0 | AG11: =R[2]C -> 0 | AH11: =R[2]C -> 0 | AI11: =R[2]C -> 780000 | AJ11: =R[2]C -> 0 | AK11: =R[2]C -> 0 | AL11: =R[2]C -> 0 | AM11: =R[2]C -> 0 | AN11: =R[2]C -> 0 | AO11: =R[2]C -> 0 | AP11: =R[2]C -> 0 | AQ11: =R[2]C -> 0 | AR11: =R[2]C -> 1 | AS11: =R[2]C -> 0 | AT11: =R[2]C -> 0 | AU11: =R[2]C -> 772200 | AW11: =R[2]C -> 0 | AX11: =R[2]C -> 0 | AY11: =R[2]C -> 0
A12: 1 | B12: 013669 | C12: Nguyễn Duy Hải | D12: NV ULD | F12: =RC[29]+RC[30]+RC[31]+RC[32]+RC[33]+RC[34]+RC[35]+RC[36]+RC[37] -> 780000 | G12: =RC[17]+RC[18]++RC[19]+RC[20]+RC[21]+RC[38]+RC[39]+RC[41] -> 0 | H12: 0 | I12: 0 | J12: =RC[-2]+RC[-1] -> 0 | K12: 0 | L12: 0 | M12: 0 | N12: =RC[15]+RC[16]+RC[17]+RC[18]+RC[19]+RC[20] -> 0 | O12: 0 | P12: 0 | Q12: 780000 | R12: 0 | S12: 0 | T12: 0 | U12: 7800 | V12: 0 | W12: 772200 | X12: 0 | Y12: 0 | Z12: 0 | AA12: 0 | AB12: 0 | AC12: 0 | AD12: 0 | AE12: 0 | AF12: 0 | AG12: 0 | AH12: 0 | AI12: 780000 | AJ12: 0 | AK12: 0 | AL12: 0 | AM12: 0 | AN12: 0 | AO12: 0 | AP12: 0 | AQ12: 0 | AR12: =1 -> 1 | AS12: 0 | AT12: 0 | AU12: =RC[-30]-RC[-29]-RC[-28]-RC[-27]-RC[-26]-RC[-25] -> 772200 | AV12: 0 | AW12: =RC[1]-RC[2] -> 0 | AX12: 0 | AY12: 0 | AZ12: =RC[-46] -> 780000 | BA12: =RC[-46] -> 0 | BB12: =RC[-46] -> 0 | BC12: =RC[-46] -> 0 | BD12: =RC[-46] -> 0 | BE12: =RC[-46] -> 0 | BF12: =RC[-46] -> 0 | BG12: =RC[-46] -> 0 | BH12: =RC[-46] -> 0 | BI12: =RC[-46] -> 0 | BJ12: =RC[-46] -> 0 | BK12: =RC[-46] -> 780000 | BL12: =RC[-46] -> 0 | BM12: =RC[-46] -> 0 | BN12: =RC[-46] -> 0 | BO12: =RC[-46] -> 7800 | BP12: =RC[-46] -> 0 | BQ12: =RC[-46] -> 772200 | BR12: =RC[-46] -> 0 | BS12: =RC[-46] -> 0 | BT12: =RC[-46] -> 0 | BU12: =RC[-46] -> 0 | BV12: =RC[-46] -> 0 | BW12: =RC[-46] -> 0 | BX12: =RC[-46] -> 0 | BY12: =RC[-46] -> 0 | BZ12: =RC[-46] -> 0 | CA12: =RC[-46] -> 0 | CB12: =RC[-46] -> 0 | CC12: =RC[-46] -> 780000 | CD12: =RC[-46] -> 0 | CE12: =RC[-46] -> 0 | CF12: =RC[-46] -> 0 | CG12: =RC[-46] -> 0 | CH12: =RC[-46] -> 0 | CI12: =RC[-46] -> 0 | CJ12: =RC[-46] -> 0 | CK12: =RC[-46] -> 0 | CL12: =RC[-46] -> 1 | CM12: =RC[-46] -> 0 | CN12: =RC[-46] -> 0 | CO12: =RC[-46] -> 772200 | CP12: =RC[-46] -> 0 | CQ12: =RC[-46] -> 0 | CR12: =RC[-46] -> 0 | CS12: =RC[-46] -> 0
F13: =SUM(R[-1]C:R[-1]C) -> 780000 | G13: =SUM(R[-1]C:R[-1]C) -> 0 | H13: =SUM(R[-1]C:R[-1]C) -> 0 | I13: =SUM(R[-1]C:R[-1]C) -> 0 | J13: =SUM(R[-1]C:R[-1]C) -> 0 | K13: =SUM(R[-1]C:R[-1]C) -> 0 | L13: =SUM(R[-1]C:R[-1]C) -> 0 | M13: =SUM(R[-1]C:R[-1]C) -> 0 | N13: =SUM(R[-1]C:R[-1]C) -> 0 | O13: =SUM(R[-1]C:R[-1]C) -> 0 | P13: =SUM(R[-1]C:R[-1]C) -> 0 | Q13: =SUM(R[-1]C:R[-1]C) -> 780000 | R13: =SUM(R[-1]C:R[-1]C) -> 0 | S13: =SUM(R[-1]C:R[-1]C) -> 0 | T13: =SUM(R[-1]C:R[-1]C) -> 0 | U13: =SUM(R[-1]C:R[-1]C) -> 7800 | V13: =SUM(R[-1]C:R[-1]C) -> 0 | W13: =SUM(R[-1]C:R[-1]C) -> 772200 | X13: =SUM(R[-1]C:R[-1]C) -> 0 | Y13: =SUM(R[-1]C:R[-1]C) -> 0 | Z13: =SUM(R[-1]C:R[-1]C) -> 0 | AA13: =SUM(R[-1]C:R[-1]C) -> 0 | AB13: =SUM(R[-1]C:R[-1]C) -> 0 | AC13: =SUM(R[-1]C:R[-1]C) -> 0 | AD13: =SUM(R[-1]C:R[-1]C) -> 0 | AE13: =SUM(R[-1]C:R[-1]C) -> 0 | AF13: =SUM(R[-1]C:R[-1]C) -> 0 | AG13: =SUM(R[-1]C:R[-1]C) -> 0 | AH13: =SUM(R[-1]C:R[-1]C) -> 0 | AI13: =SUM(R[-1]C:R[-1]C) -> 780000 | AJ13: =SUM(R[-1]C:R[-1]C) -> 0 | AK13: =SUM(R[-1]C:R[-1]C) -> 0 | AL13: =SUM(R[-1]C:R[-1]C) -> 0 | AM13: =SUM(R[-1]C:R[-1]C) -> 0 | AN13: =SUM(R[-1]C:R[-1]C) -> 0 | AO13: =SUM(R[-1]C:R[-1]C) -> 0 | AP13: =SUM(R[-1]C:R[-1]C) -> 0 | AQ13: =SUM(R[-1]C:R[-1]C) -> 0 | AR13: =SUM(R[-1]C:R[-1]C) -> 1 | AS13: =SUM(R[-1]C:R[-1]C) -> 0 | AT13: =SUM(R[-1]C:R[-1]C) -> 0 | AU13: =SUM(R[-1]C:R[-1]C) -> 772200 | AV13: =SUM(R[-1]C:R[-1]C) -> 0 | AW13: =SUM(R[-1]C:R[-1]C) -> 0 | AX13: =SUM(R[-1]C:R[-1]C) -> 0 | AY13: =SUM(R[-1]C:R[-1]C) -> 0
A14: Phòng Điều hành, tài liệu và hướng dẫn chất xếp (HGS) | F14: =SUM(R[-3]C[46]:R[-1]C[46]) -> 780000 | G14: =SUM(R[-3]C[46]:R[-1]C[46]) -> 0 | H14: =SUM(R[-3]C[46]:R[-1]C[46]) -> 0 | I14: =SUM(R[-3]C[46]:R[-1]C[46]) -> 0 | J14: =SUM(R[-3]C[46]:R[-1]C[46]) -> 0 | K14: =SUM(R[-3]C[46]:R[-1]C[46]) -> 0 | L14: =SUM(R[-3]C[46]:R[-1]C[46]) -> 0 | M14: =SUM(R[-3]C[46]:R[-1]C[46]) -> 0 | N14: =SUM(R[-3]C[46]:R[-1]C[46]) -> 0 | O14: =SUM(R[-3]C[46]:R[-1]C[46]) -> 0 | P14: =SUM(R[-3]C[46]:R[-1]C[46]) -> 0 | Q14: =SUM(R[-3]C[46]:R[-1]C[46]) -> 780000 | R14: =SUM(R[-3]C[46]:R[-1]C[46]) -> 0 | S14: =SUM(R[-3]C[46]:R[-1]C[46]) -> 0 | T14: =SUM(R[-3]C[46]:R[-1]C[46]) -> 0 | U14: =SUM(R[-3]C[46]:R[-1]C[46]) -> 7800 | V14: =SUM(R[-3]C[46]:R[-1]C[46]) -> 0 | W14: =SUM(R[-3]C[46]:R[-1]C[46]) -> 772200 | X14: =SUM(R[-3]C[46]:R[-1]C[46]) -> 0 | Y14: =SUM(R[-3]C[46]:R[-1]C[46]) -> 0 | Z14: =SUM(R[-3]C[46]:R[-1]C[46]) -> 0 | AA14: =SUM(R[-3]C[46]:R[-1]C[46]) -> 0 | AB14: =SUM(R[-3]C[46]:R[-1]C[46]) -> 0 | AC14: =SUM(R[-3]C[46]:R[-1]C[46]) -> 0 | AD14: =SUM(R[-3]C[46]:R[-1]C[46]) -> 0 | AE14: =SUM(R[-3]C[46]:R[-1]C[46]) -> 0 | AF14: =SUM(R[-3]C[46]:R[-1]C[46]) -> 0 | AG14: =SUM(R[-3]C[46]:R[-1]C[46]) -> 0 | AH14: =SUM(R[-3]C[46]:R[-1]C[46]) -> 0 | AI14: =SUM(R[-3]C[46]:R[-1]C[46]) -> 780000 | AJ14: =SUM(R[-3]C[46]:R[-1]C[46]) -> 0 | AK14: =SUM(R[-3]C[46]:R[-1]C[46]) -> 0 | AL14: =SUM(R[-3]C[46]:R[-1]C[46]) -> 0 | AM14: =SUM(R[-3]C[46]:R[-1]C[46]) -> 0 | AN14: =SUM(R[-3]C[46]:R[-1]C[46]) -> 0 | AO14: =SUM(R[-3]C[46]:R[-1]C[46]) -> 0 | AP14: =SUM(R[-3]C[46]:R[-1]C[46]) -> 0 | AQ14: =SUM(R[-3]C[46]:R[-1]C[46]) -> 0 | AR14: =SUM(R[-3]C[46]:R[-1]C[46]) -> 1 | AS14: =SUM(R[-3]C[46]:R[-1]C[46]) -> 0 | AT14: =SUM(R[-3]C[46]:R[-1]C[46]) -> 0 | AU14: =SUM(R[-3]C[46]:R[-1]C[46]) -> 772200 | AV14: =SUM(R[-3]C[46]:R[-1]C[46]) -> 0 | AW14: =SUM(R[-3]C[46]:R[-1]C[46]) -> 0 | AX14: =SUM(R[-3]C[46]:R[-1]C[46]) -> 0 | AY14: =SUM(R[-3]C[46]:R[-1]C[46]) -> 0
A15: Công ty Phục vụ mặt đất Hà Nội (HGS) | B15: =RC[42] -> 1 | C15: TỔNG CỘNG: | F15: =SUM(R[-5]C[46]:R[-1]C[46]) -> 780000 | G15: =SUM(R[-5]C[46]:R[-1]C[46]) -> 0 | H15: =SUM(R[-5]C[46]:R[-1]C[46]) -> 0 | I15: =SUM(R[-5]C[46]:R[-1]C[46]) -> 0 | J15: =SUM(R[-5]C[46]:R[-1]C[46]) -> 0 | K15: =SUM(R[-5]C[46]:R[-1]C[46]) -> 0 | L15: =SUM(R[-5]C[46]:R[-1]C[46]) -> 0 | M15: =SUM(R[-5]C[46]:R[-1]C[46]) -> 0 | N15: =SUM(R[-5]C[46]:R[-1]C[46]) -> 0 | O15: =SUM(R[-5]C[46]:R[-1]C[46]) -> 0 | P15: =SUM(R[-5]C[46]:R[-1]C[46]) -> 0 | Q15: =SUM(R[-5]C[46]:R[-1]C[46]) -> 780000 | R15: =SUM(R[-5]C[46]:R[-1]C[46]) -> 0 | S15: =SUM(R[-5]C[46]:R[-1]C[46]) -> 0 | T15: =SUM(R[-5]C[46]:R[-1]C[46]) -> 0 | U15: =SUM(R[-5]C[46]:R[-1]C[46]) -> 7800 | V15: =SUM(R[-5]C[46]:R[-1]C[46]) -> 0 | W15: =SUM(R[-5]C[46]:R[-1]C[46]) -> 772200 | X15: =SUM(R[-5]C[46]:R[-1]C[46]) -> 0 | Y15: =SUM(R[-5]C[46]:R[-1]C[46]) -> 0 | Z15: =SUM(R[-5]C[46]:R[-1]C[46]) -> 0 | AA15: =SUM(R[-5]C[46]:R[-1]C[46]) -> 0 | AB15: =SUM(R[-5]C[46]:R[-1]C[46]) -> 0 | AC15: =SUM(R[-5]C[46]:R[-1]C[46]) -> 0 | AD15: =SUM(R[-5]C[46]:R[-1]C[46]) -> 0 | AE15: =SUM(R[-5]C[46]:R[-1]C[46]) -> 0 | AF15: =SUM(R[-5]C[46]:R[-1]C[46]) -> 0 | AG15: =SUM(R[-5]C[46]:R[-1]C[46]) -> 0 | AH15: =SUM(R[-5]C[46]:R[-1]C[46]) -> 0 | AI15: =SUM(R[-5]C[46]:R[-1]C[46]) -> 780000 | AJ15: =SUM(R[-5]C[46]:R[-1]C[46]) -> 0 | AK15: =SUM(R[-5]C[46]:R[-1]C[46]) -> 0 | AL15: =SUM(R[-5]C[46]:R[-1]C[46]) -> 0 | AM15: =SUM(R[-5]C[46]:R[-1]C[46]) -> 0 | AN15: =SUM(R[-5]C[46]:R[-1]C[46]) -> 0 | AO15: =SUM(R[-5]C[46]:R[-1]C[46]) -> 0 | AP15: =SUM(R[-5]C[46]:R[-1]C[46]) -> 0 | AQ15: =SUM(R[-5]C[46]:R[-1]C[46]) -> 0 | AR15: =SUM(R[-5]C[46]:R[-1]C[46]) -> 1 | AS15: =SUM(R[-5]C[46]:R[-1]C[46]) -> 0 | AT15: =SUM(R[-5]C[46]:R[-1]C[46]) -> 0 | AU15: =SUM(R[-5]C[46]:R[-1]C[46]) -> 772200 | AV15: =SUM(R[-5]C[46]:R[-1]C[46]) -> 0 | AW15: =SUM(R[-5]C[46]:R[-1]C[46]) -> 0 | AX15: =SUM(R[-5]C[46]:R[-1]C[46]) -> 0 | AY15: =SUM(R[-5]C[46]:R[-1]C[46]) -> 0
C17: NGƯỜI LẬP BẢNG | H17: THỦ TRƯỞNG ĐƠN VỊ | J17: THỦ TRƯỞNG ĐƠN VỊ | O17: BAN TCCB-LĐTL | R17: =+R[-2]C/8*26 -> 0 | S17: =+R[-2]C/1.5*4.5 -> 0 | T17: =+R[-2]C*2 -> 0 | U17: BAN TCKT
C22: VŨ THỊ HÒA