Sheet: ExcelTemplate
A1: BỘ GIAO THÔNG VẬN TẢI | L1: 2015/01 | V1: Ngày in báo cáo: | W1: Ngày in báo cáo : ___/___/_____ | AU1: Ngày in báo cáo : ___/___/_____
A2: TỔNG CÔNG TY CẢNG HÀNG KHÔNG VIỆT NAM | W2: Trang in báo cáo : ___/___ | AU2: Trang in báo cáo : ___/___
A3: ="BẢNG TIỀN LƯƠNG THÁNG "&RIGHT(R[-2]C[11],2)&" NĂM "&LEFT(R[-2]C[11],4) -> BẢNG TIỀN LƯƠNG THÁNG 01 NĂM 2015
A4: ĐƠN VỊ: | C4: =R[5]C[-2] -> Công ty Phục vụ mặt đất Hà Nội (HGS)
A6: STT | B6: Mã NV | C6: Họ và tên | E6: Số TK | F6: Lương chức danh | G6: Lương cơ bản | H6: Các khoản phụ cấp | L6: Ăn giữa ca | M6: Bổ sung lương | N6: Tiền thêm giờ | O6: Tiền làm đêm | P6: Các khoản trừ vào lương | Q6: Tổng | R6: Các khoản phải nộp | W6: Thực lĩnh | AU6: Thực lĩnh | AW6: Tăng ca không chịu thuế | AX6: Tổng tiền tăng ca | AY6: Tăng ca chịu thuế
D7: Chức vụ | H7: PCCV | I7: PCCV o BH | J7: PCCV | K7: PCTN | R7: BHXH | S7: BHYT | T7: BHTN | U7: ĐPCĐ | V7: TTN tạm tính | X7: Đi đường | Y7: Nghỉ phép trong chế độ | Z7: H6 | AA7: Nghỉ TNLD | AB7: Nghỉ việc riêng hưởng nguyên lương (ma chay, cưới hỏi …) | AC7: Làm thêm CN b.đêm | AD7: Làm thêm CN b.ngày | AE7: Làm thêm LT b.đêm | AF7: Làm thêm LT b.ngày | AG7: Làm thêm NT b.đêm | AH7: Làm thêm NT b.ngày | AI7: X | AJ7: TS | AK7: ST | AL7: CT | AM7: H1 | AN7: H2 | AO7: H3 | AP7: H4 | AQ7: H5 | AV7: DC
A8: 1 | B8: 2 | C8: 3 | E8: 4 | F8: 22 | G8: 23 | H8: 24 | K8: 25 | L8: 26 | M8: 27 | N8: 28 | O8: 29 | Q8: 30 | R8: 31 | S8: 32 | T8: 33 | U8: 34 | V8: 35 | W8: 36 | AC8: 79 | AD8: 80 | AE8: 81 | AF8: 82 | AG8: 83 | AH8: 84 | AU8: 36
A9: Công ty Phục vụ mặt đất Hà Nội (HGS)
A10: Phòng Điều hành, tài liệu và hướng dẫn chất xếp (HGS) | F10: =R[9]C -> 4860000 | G10: =R[9]C -> 0 | H10: =R[9]C -> 0 | I10: =R[9]C -> 0 | J10: =R[9]C -> 0 | K10: =R[9]C -> 0 | L10: =R[9]C -> 0 | M10: =R[9]C -> 0 | N10: =R[9]C -> 0 | O10: =R[9]C -> 0 | P10: =R[9]C -> 0 | Q10: =R[9]C -> 4860000 | R10: =R[9]C -> 0 | S10: =R[9]C -> 0 | T10: =R[9]C -> 0 | U10: =R[9]C -> 48600 | V10: =R[9]C -> 0 | W10: =R[9]C -> 4811400 | X10: =R[9]C -> 0 | Y10: =R[9]C -> 0 | Z10: =R[9]C -> 0 | AA10: =R[9]C -> 0 | AB10: =R[9]C -> 0 | AC10: =R[9]C -> 0 | AD10: =R[9]C -> 0 | AE10: =R[9]C -> 0 | AF10: =R[9]C -> 0 | AG10: =R[9]C -> 0 | AH10: =R[9]C -> 0 | AI10: =R[9]C -> 4860000 | AJ10: =R[9]C -> 0 | AK10: =R[9]C -> 0 | AL10: =R[9]C -> 0 | AM10: =R[9]C -> 0 | AN10: =R[9]C -> 0 | AO10: =R[9]C -> 0 | AP10: =R[9]C -> 0 | AQ10: =R[9]C -> 0 | AR10: =R[9]C -> 6 | AS10: =R[9]C -> 0 | AT10: =R[9]C -> 0 | AU10: =R[9]C -> 4811400 | AW10: =R[9]C -> 0 | AX10: =R[9]C -> 0 | AY10: =R[9]C -> 0
F11: =R[7]C -> 4860000 | G11: =R[7]C -> 0 | H11: =R[7]C -> 0 | I11: =R[7]C -> 0 | J11: =R[7]C -> 0 | K11: =R[7]C -> 0 | L11: =R[7]C -> 0 | M11: =R[7]C -> 0 | N11: =R[7]C -> 0 | O11: =R[7]C -> 0 | P11: =R[7]C -> 0 | Q11: =R[7]C -> 4860000 | R11: =R[7]C -> 0 | S11: =R[7]C -> 0 | T11: =R[7]C -> 0 | U11: =R[7]C -> 48600 | V11: =R[7]C -> 0 | W11: =R[7]C -> 4811400 | X11: =R[7]C -> 0 | Y11: =R[7]C -> 0 | Z11: =R[7]C -> 0 | AA11: =R[7]C -> 0 | AB11: =R[7]C -> 0 | AC11: =R[7]C -> 0 | AD11: =R[7]C -> 0 | AE11: =R[7]C -> 0 | AF11: =R[7]C -> 0 | AG11: =R[7]C -> 0 | AH11: =R[7]C -> 0 | AI11: =R[7]C -> 4860000 | AJ11: =R[7]C -> 0 | AK11: =R[7]C -> 0 | AL11: =R[7]C -> 0 | AM11: =R[7]C -> 0 | AN11: =R[7]C -> 0 | AO11: =R[7]C -> 0 | AP11: =R[7]C -> 0 | AQ11: =R[7]C -> 0 | AR11: =R[7]C -> 6 | AS11: =R[7]C -> 0 | AT11: =R[7]C -> 0 | AU11: =R[7]C -> 4811400 | AW11: =R[7]C -> 0 | AX11: =R[7]C -> 0 | AY11: =R[7]C -> 0
A12: 1 | B12: 013356 | C12: Trần Anh Sơn | D12: NV Tài liệu và HDCX | F12: =RC[29]+RC[30]+RC[31]+RC[32]+RC[33]+RC[34]+RC[35]+RC[36]+RC[37] -> 810000 | G12: =RC[17]+RC[18]++RC[19]+RC[20]+RC[21]+RC[38]+RC[39]+RC[41] -> 0 | H12: 0 | I12: 0 | J12: =RC[-2]+RC[-1] -> 0 | K12: 0 | L12: 0 | M12: 0 | N12: =RC[15]+RC[16]+RC[17]+RC[18]+RC[19]+RC[20] -> 0 | O12: 0 | P12: 0 | Q12: 810000 | R12: 0 | S12: 0 | T12: 0 | U12: 8100 | V12: 0 | W12: 801900 | X12: 0 | Y12: 0 | Z12: 0 | AA12: 0 | AB12: 0 | AC12: 0 | AD12: 0 | AE12: 0 | AF12: 0 | AG12: 0 | AH12: 0 | AI12: 810000 | AJ12: 0 | AK12: 0 | AL12: 0 | AM12: 0 | AN12: 0 | AO12: 0 | AP12: 0 | AQ12: 0 | AR12: =1 -> 1 | AS12: 0 | AT12: 0 | AU12: =RC[-30]-RC[-29]-RC[-28]-RC[-27]-RC[-26]-RC[-25] -> 801900 | AV12: 0 | AW12: =RC[1]-RC[2] -> 0 | AX12: 0 | AY12: 0 | AZ12: =RC[-46] -> 810000 | BA12: =RC[-46] -> 0 | BB12: =RC[-46] -> 0 | BC12: =RC[-46] -> 0 | BD12: =RC[-46] -> 0 | BE12: =RC[-46] -> 0 | BF12: =RC[-46] -> 0 | BG12: =RC[-46] -> 0 | BH12: =RC[-46] -> 0 | BI12: =RC[-46] -> 0 | BJ12: =RC[-46] -> 0 | BK12: =RC[-46] -> 810000 | BL12: =RC[-46] -> 0 | BM12: =RC[-46] -> 0 | BN12: =RC[-46] -> 0 | BO12: =RC[-46] -> 8100 | BP12: =RC[-46] -> 0 | BQ12: =RC[-46] -> 801900 | BR12: =RC[-46] -> 0 | BS12: =RC[-46] -> 0 | BT12: =RC[-46] -> 0 | BU12: =RC[-46] -> 0 | BV12: =RC[-46] -> 0 | BW12: =RC[-46] -> 0 | BX12: =RC[-46] -> 0 | BY12: =RC[-46] -> 0 | BZ12: =RC[-46] -> 0 | CA12: =RC[-46] -> 0 | CB12: =RC[-46] -> 0 | CC12: =RC[-46] -> 810000 | CD12: =RC[-46] -> 0 | CE12: =RC[-46] -> 0 | CF12: =RC[-46] -> 0 | CG12: =RC[-46] -> 0 | CH12: =RC[-46] -> 0 | CI12: =RC[-46] -> 0 | CJ12: =RC[-46] -> 0 | CK12: =RC[-46] -> 0 | CL12: =RC[-46] -> 1 | CM12: =RC[-46] -> 0 | CN12: =RC[-46] -> 0 | CO12: =RC[-46] -> 801900 | CP12: =RC[-46] -> 0 | CQ12: =RC[-46] -> 0 | CR12: =RC[-46] -> 0 | CS12: =RC[-46] -> 0
A13: 2 | B13: 013357 | C13: Nguyễn Trường Giang | D13: NV Tài liệu và HDCX | F13: =RC[29]+RC[30]+RC[31]+RC[32]+RC[33]+RC[34]+RC[35]+RC[36]+RC[37] -> 810000 | G13: =RC[17]+RC[18]++RC[19]+RC[20]+RC[21]+RC[38]+RC[39]+RC[41] -> 0 | H13: 0 | I13: 0 | J13: =RC[-2]+RC[-1] -> 0 | K13: 0 | L13: 0 | M13: 0 | N13: =RC[15]+RC[16]+RC[17]+RC[18]+RC[19]+RC[20] -> 0 | O13: 0 | P13: 0 | Q13: 810000 | R13: 0 | S13: 0 | T13: 0 | U13: 8100 | V13: 0 | W13: 801900 | X13: 0 | Y13: 0 | Z13: 0 | AA13: 0 | AB13: 0 | AC13: 0 | AD13: 0 | AE13: 0 | AF13: 0 | AG13: 0 | AH13: 0 | AI13: 810000 | AJ13: 0 | AK13: 0 | AL13: 0 | AM13: 0 | AN13: 0 | AO13: 0 | AP13: 0 | AQ13: 0 | AR13: =1 -> 1 | AS13: 0 | AT13: 0 | AU13: =RC[-30]-RC[-29]-RC[-28]-RC[-27]-RC[-26]-RC[-25] -> 801900 | AV13: 0 | AW13: =RC[1]-RC[2] -> 0 | AX13: 0 | AY13: 0 | AZ13: =RC[-46] -> 810000 | BA13: =RC[-46] -> 0 | BB13: =RC[-46] -> 0 | BC13: =RC[-46] -> 0 | BD13: =RC[-46] -> 0 | BE13: =RC[-46] -> 0 | BF13: =RC[-46] -> 0 | BG13: =RC[-46] -> 0 | BH13: =RC[-46] -> 0 | BI13: =RC[-46] -> 0 | BJ13: =RC[-46] -> 0 | BK13: =RC[-46] -> 810000 | BL13: =RC[-46] -> 0 | BM13: =RC[-46] -> 0 | BN13: =RC[-46] -> 0 | BO13: =RC[-46] -> 8100 | BP13: =RC[-46] -> 0 | BQ13: =RC[-46] -> 801900 | BR13: =RC[-46] -> 0 | BS13: =RC[-46] -> 0 | BT13: =RC[-46] -> 0 | BU13: =RC[-46] -> 0 | BV13: =RC[-46] -> 0 | BW13: =RC[-46] -> 0 | BX13: =RC[-46] -> 0 | BY13: =RC[-46] -> 0 | BZ13: =RC[-46] -> 0 | CA13: =RC[-46] -> 0 | CB13: =RC[-46] -> 0 | CC13: =RC[-46] -> 810000 | CD13: =RC[-46] -> 0 | CE13: =RC[-46] -> 0 | CF13: =RC[-46] -> 0 | CG13: =RC[-46] -> 0 | CH13: =RC[-46] -> 0 | CI13: =RC[-46] -> 0 | CJ13: =RC[-46] -> 0 | CK13: =RC[-46] -> 0 | CL13: =RC[-46] -> 1 | CM13: =RC[-46] -> 0 | CN13: =RC[-46] -> 0 | CO13: =RC[-46] -> 801900 | CP13: =RC[-46] -> 0 | CQ13: =RC[-46] -> 0 | CR13: =RC[-46] -> 0 | CS13: =RC[-46] -> 0
A14: 3 | B14: 013358 | C14: Phan Thế Chung | D14: NV Tài liệu và HDCX | F14: =RC[29]+RC[30]+RC[31]+RC[32]+RC[33]+RC[34]+RC[35]+RC[36]+RC[37] -> 810000 | G14: =RC[17]+RC[18]++RC[19]+RC[20]+RC[21]+RC[38]+RC[39]+RC[41] -> 0 | H14: 0 | I14: 0 | J14: =RC[-2]+RC[-1] -> 0 | K14: 0 | L14: 0 | M14: 0 | N14: =RC[15]+RC[16]+RC[17]+RC[18]+RC[19]+RC[20] -> 0 | O14: 0 | P14: 0 | Q14: 810000 | R14: 0 | S14: 0 | T14: 0 | U14: 8100 | V14: 0 | W14: 801900 | X14: 0 | Y14: 0 | Z14: 0 | AA14: 0 | AB14: 0 | AC14: 0 | AD14: 0 | AE14: 0 | AF14: 0 | AG14: 0 | AH14: 0 | AI14: 810000 | AJ14: 0 | AK14: 0 | AL14: 0 | AM14: 0 | AN14: 0 | AO14: 0 | AP14: 0 | AQ14: 0 | AR14: =1 -> 1 | AS14: 0 | AT14: 0 | AU14: =RC[-30]-RC[-29]-RC[-28]-RC[-27]-RC[-26]-RC[-25] -> 801900 | AV14: 0 | AW14: =RC[1]-RC[2] -> 0 | AX14: 0 | AY14: 0 | AZ14: =RC[-46] -> 810000 | BA14: =RC[-46] -> 0 | BB14: =RC[-46] -> 0 | BC14: =RC[-46] -> 0 | BD14: =RC[-46] -> 0 | BE14: =RC[-46] -> 0 | BF14: =RC[-46] -> 0 | BG14: =RC[-46] -> 0 | BH14: =RC[-46] -> 0 | BI14: =RC[-46] -> 0 | BJ14: =RC[-46] -> 0 | BK14: =RC[-46] -> 810000 | BL14: =RC[-46] -> 0 | BM14: =RC[-46] -> 0 | BN14: =RC[-46] -> 0 | BO14: =RC[-46] -> 8100 | BP14: =RC[-46] -> 0 | BQ14: =RC[-46] -> 801900 | BR14: =RC[-46] -> 0 | BS14: =RC[-46] -> 0 | BT14: =RC[-46] -> 0 | BU14: =RC[-46] -> 0 | BV14: =RC[-46] -> 0 | BW14: =RC[-46] -> 0 | BX14: =RC[-46] -> 0 | BY14: =RC[-46] -> 0 | BZ14: =RC[-46] -> 0 | CA14: =RC[-46] -> 0 | CB14: =RC[-46] -> 0 | CC14: =RC[-46] -> 810000 | CD14: =RC[-46] -> 0 | CE14: =RC[-46] -> 0 | CF14: =RC[-46] -> 0 | CG14: =RC[-46] -> 0 | CH14: =RC[-46] -> 0 | CI14: =RC[-46] -> 0 | CJ14: =RC[-46] -> 0 | CK14: =RC[-46] -> 0 | CL14: =RC[-46] -> 1 | CM14: =RC[-46] -> 0 | CN14: =RC[-46] -> 0 | CO14: =RC[-46] -> 801900 | CP14: =RC[-46] -> 0 | CQ14: =RC[-46] -> 0 | CR14: =RC[-46] -> 0 | CS14: =RC[-46] -> 0
A15: 4 | B15: 013359 | C15: Dương Đức An | D15: NV Tài liệu và HDCX | F15: =RC[29]+RC[30]+RC[31]+RC[32]+RC[33]+RC[34]+RC[35]+RC[36]+RC[37] -> 810000 | G15: =RC[17]+RC[18]++RC[19]+RC[20]+RC[21]+RC[38]+RC[39]+RC[41] -> 0 | H15: 0 | I15: 0 | J15: =RC[-2]+RC[-1] -> 0 | K15: 0 | L15: 0 | M15: 0 | N15: =RC[15]+RC[16]+RC[17]+RC[18]+RC[19]+RC[20] -> 0 | O15: 0 | P15: 0 | Q15: 810000 | R15: 0 | S15: 0 | T15: 0 | U15: 8100 | V15: 0 | W15: 801900 | X15: 0 | Y15: 0 | Z15: 0 | AA15: 0 | AB15: 0 | AC15: 0 | AD15: 0 | AE15: 0 | AF15: 0 | AG15: 0 | AH15: 0 | AI15: 810000 | AJ15: 0 | AK15: 0 | AL15: 0 | AM15: 0 | AN15: 0 | AO15: 0 | AP15: 0 | AQ15: 0 | AR15: =1 -> 1 | AS15: 0 | AT15: 0 | AU15: =RC[-30]-RC[-29]-RC[-28]-RC[-27]-RC[-26]-RC[-25] -> 801900 | AV15: 0 | AW15: =RC[1]-RC[2] -> 0 | AX15: 0 | AY15: 0 | AZ15: =RC[-46] -> 810000 | BA15: =RC[-46] -> 0 | BB15: =RC[-46] -> 0 | BC15: =RC[-46] -> 0 | BD15: =RC[-46] -> 0 | BE15: =RC[-46] -> 0 | BF15: =RC[-46] -> 0 | BG15: =RC[-46] -> 0 | BH15: =RC[-46] -> 0 | BI15: =RC[-46] -> 0 | BJ15: =RC[-46] -> 0 | BK15: =RC[-46] -> 810000 | BL15: =RC[-46] -> 0 | BM15: =RC[-46] -> 0 | BN15: =RC[-46] -> 0 | BO15: =RC[-46] -> 8100 | BP15: =RC[-46] -> 0 | BQ15: =RC[-46] -> 801900 | BR15: =RC[-46] -> 0 | BS15: =RC[-46] -> 0 | BT15: =RC[-46] -> 0 | BU15: =RC[-46] -> 0 | BV15: =RC[-46] -> 0 | BW15: =RC[-46] -> 0 | BX15: =RC[-46] -> 0 | BY15: =RC[-46] -> 0 | BZ15: =RC[-46] -> 0 | CA15: =RC[-46] -> 0 | CB15: =RC[-46] -> 0 | CC15: =RC[-46] -> 810000 | CD15: =RC[-46] -> 0 | CE15: =RC[-46] -> 0 | CF15: =RC[-46] -> 0 | CG15: =RC[-46] -> 0 | CH15: =RC[-46] -> 0 | CI15: =RC[-46] -> 0 | CJ15: =RC[-46] -> 0 | CK15: =RC[-46] -> 0 | CL15: =RC[-46] -> 1 | CM15: =RC[-46] -> 0 | CN15: =RC[-46] -> 0 | CO15: =RC[-46] -> 801900 | CP15: =RC[-46] -> 0 | CQ15: =RC[-46] -> 0 | CR15: =RC[-46] -> 0 | CS15: =RC[-46] -> 0
A16: 5 | B16: 013360 | C16: Nguyễn Tự Tuyền | D16: NV Tài liệu và HDCX | F16: =RC[29]+RC[30]+RC[31]+RC[32]+RC[33]+RC[34]+RC[35]+RC[36]+RC[37] -> 810000 | G16: =RC[17]+RC[18]++RC[19]+RC[20]+RC[21]+RC[38]+RC[39]+RC[41] -> 0 | H16: 0 | I16: 0 | J16: =RC[-2]+RC[-1] -> 0 | K16: 0 | L16: 0 | M16: 0 | N16: =RC[15]+RC[16]+RC[17]+RC[18]+RC[19]+RC[20] -> 0 | O16: 0 | P16: 0 | Q16: 810000 | R16: 0 | S16: 0 | T16: 0 | U16: 8100 | V16: 0 | W16: 801900 | X16: 0 | Y16: 0 | Z16: 0 | AA16: 0 | AB16: 0 | AC16: 0 | AD16: 0 | AE16: 0 | AF16: 0 | AG16: 0 | AH16: 0 | AI16: 810000 | AJ16: 0 | AK16: 0 | AL16: 0 | AM16: 0 | AN16: 0 | AO16: 0 | AP16: 0 | AQ16: 0 | AR16: =1 -> 1 | AS16: 0 | AT16: 0 | AU16: =RC[-30]-RC[-29]-RC[-28]-RC[-27]-RC[-26]-RC[-25] -> 801900 | AV16: 0 | AW16: =RC[1]-RC[2] -> 0 | AX16: 0 | AY16: 0 | AZ16: =RC[-46] -> 810000 | BA16: =RC[-46] -> 0 | BB16: =RC[-46] -> 0 | BC16: =RC[-46] -> 0 | BD16: =RC[-46] -> 0 | BE16: =RC[-46] -> 0 | BF16: =RC[-46] -> 0 | BG16: =RC[-46] -> 0 | BH16: =RC[-46] -> 0 | BI16: =RC[-46] -> 0 | BJ16: =RC[-46] -> 0 | BK16: =RC[-46] -> 810000 | BL16: =RC[-46] -> 0 | BM16: =RC[-46] -> 0 | BN16: =RC[-46] -> 0 | BO16: =RC[-46] -> 8100 | BP16: =RC[-46] -> 0 | BQ16: =RC[-46] -> 801900 | BR16: =RC[-46] -> 0 | BS16: =RC[-46] -> 0 | BT16: =RC[-46] -> 0 | BU16: =RC[-46] -> 0 | BV16: =RC[-46] -> 0 | BW16: =RC[-46] -> 0 | BX16: =RC[-46] -> 0 | BY16: =RC[-46] -> 0 | BZ16: =RC[-46] -> 0 | CA16: =RC[-46] -> 0 | CB16: =RC[-46] -> 0 | CC16: =RC[-46] -> 810000 | CD16: =RC[-46] -> 0 | CE16: =RC[-46] -> 0 | CF16: =RC[-46] -> 0 | CG16: =RC[-46] -> 0 | CH16: =RC[-46] -> 0 | CI16: =RC[-46] -> 0 | CJ16: =RC[-46] -> 0 | CK16: =RC[-46] -> 0 | CL16: =RC[-46] -> 1 | CM16: =RC[-46] -> 0 | CN16: =RC[-46] -> 0 | CO16: =RC[-46] -> 801900 | CP16: =RC[-46] -> 0 | CQ16: =RC[-46] -> 0 | CR16: =RC[-46] -> 0 | CS16: =RC[-46] -> 0
A17: 6 | B17: 013102 | C17: Ngô Văn Sơn | D17: Nviên HDCX | E17: 19028834685011 | F17: =RC[29]+RC[30]+RC[31]+RC[32]+RC[33]+RC[34]+RC[35]+RC[36]+RC[37] -> 810000 | G17: =RC[17]+RC[18]++RC[19]+RC[20]+RC[21]+RC[38]+RC[39]+RC[41] -> 0 | H17: 0 | I17: 0 | J17: =RC[-2]+RC[-1] -> 0 | K17: 0 | L17: 0 | M17: 0 | N17: =RC[15]+RC[16]+RC[17]+RC[18]+RC[19]+RC[20] -> 0 | O17: 0 | P17: 0 | Q17: 810000 | R17: 0 | S17: 0 | T17: 0 | U17: 8100 | V17: 0 | W17: 801900 | X17: 0 | Y17: 0 | Z17: 0 | AA17: 0 | AB17: 0 | AC17: 0 | AD17: 0 | AE17: 0 | AF17: 0 | AG17: 0 | AH17: 0 | AI17: 810000 | AJ17: 0 | AK17: 0 | AL17: 0 | AM17: 0 | AN17: 0 | AO17: 0 | AP17: 0 | AQ17: 0 | AR17: =1 -> 1 | AS17: 0 | AT17: 0 | AU17: =RC[-30]-RC[-29]-RC[-28]-RC[-27]-RC[-26]-RC[-25] -> 801900 | AV17: 0 | AW17: =RC[1]-RC[2] -> 0 | AX17: 0 | AY17: 0 | AZ17: =RC[-46] -> 810000 | BA17: =RC[-46] -> 0 | BB17: =RC[-46] -> 0 | BC17: =RC[-46] -> 0 | BD17: =RC[-46] -> 0 | BE17: =RC[-46] -> 0 | BF17: =RC[-46] -> 0 | BG17: =RC[-46] -> 0 | BH17: =RC[-46] -> 0 | BI17: =RC[-46] -> 0 | BJ17: =RC[-46] -> 0 | BK17: =RC[-46] -> 810000 | BL17: =RC[-46] -> 0 | BM17: =RC[-46] -> 0 | BN17: =RC[-46] -> 0 | BO17: =RC[-46] -> 8100 | BP17: =RC[-46] -> 0 | BQ17: =RC[-46] -> 801900 | BR17: =RC[-46] -> 0 | BS17: =RC[-46] -> 0 | BT17: =RC[-46] -> 0 | BU17: =RC[-46] -> 0 | BV17: =RC[-46] -> 0 | BW17: =RC[-46] -> 0 | BX17: =RC[-46] -> 0 | BY17: =RC[-46] -> 0 | BZ17: =RC[-46] -> 0 | CA17: =RC[-46] -> 0 | CB17: =RC[-46] -> 0 | CC17: =RC[-46] -> 810000 | CD17: =RC[-46] -> 0 | CE17: =RC[-46] -> 0 | CF17: =RC[-46] -> 0 | CG17: =RC[-46] -> 0 | CH17: =RC[-46] -> 0 | CI17: =RC[-46] -> 0 | CJ17: =RC[-46] -> 0 | CK17: =RC[-46] -> 0 | CL17: =RC[-46] -> 1 | CM17: =RC[-46] -> 0 | CN17: =RC[-46] -> 0 | CO17: =RC[-46] -> 801900 | CP17: =RC[-46] -> 0 | CQ17: =RC[-46] -> 0 | CR17: =RC[-46] -> 0 | CS17: =RC[-46] -> 0
F18: =SUM(R[-6]C:R[-1]C) -> 4860000 | G18: =SUM(R[-6]C:R[-1]C) -> 0 | H18: =SUM(R[-6]C:R[-1]C) -> 0 | I18: =SUM(R[-6]C:R[-1]C) -> 0 | J18: =SUM(R[-6]C:R[-1]C) -> 0 | K18: =SUM(R[-6]C:R[-1]C) -> 0 | L18: =SUM(R[-6]C:R[-1]C) -> 0 | M18: =SUM(R[-6]C:R[-1]C) -> 0 | N18: =SUM(R[-6]C:R[-1]C) -> 0 | O18: =SUM(R[-6]C:R[-1]C) -> 0 | P18: =SUM(R[-6]C:R[-1]C) -> 0 | Q18: =SUM(R[-6]C:R[-1]C) -> 4860000 | R18: =SUM(R[-6]C:R[-1]C) -> 0 | S18: =SUM(R[-6]C:R[-1]C) -> 0 | T18: =SUM(R[-6]C:R[-1]C) -> 0 | U18: =SUM(R[-6]C:R[-1]C) -> 48600 | V18: =SUM(R[-6]C:R[-1]C) -> 0 | W18: =SUM(R[-6]C:R[-1]C) -> 4811400 | X18: =SUM(R[-6]C:R[-1]C) -> 0 | Y18: =SUM(R[-6]C:R[-1]C) -> 0 | Z18: =SUM(R[-6]C:R[-1]C) -> 0 | AA18: =SUM(R[-6]C:R[-1]C) -> 0 | AB18: =SUM(R[-6]C:R[-1]C) -> 0 | AC18: =SUM(R[-6]C:R[-1]C) -> 0 | AD18: =SUM(R[-6]C:R[-1]C) -> 0 | AE18: =SUM(R[-6]C:R[-1]C) -> 0 | AF18: =SUM(R[-6]C:R[-1]C) -> 0 | AG18: =SUM(R[-6]C:R[-1]C) -> 0 | AH18: =SUM(R[-6]C:R[-1]C) -> 0 | AI18: =SUM(R[-6]C:R[-1]C) -> 4860000 | AJ18: =SUM(R[-6]C:R[-1]C) -> 0 | AK18: =SUM(R[-6]C:R[-1]C) -> 0 | AL18: =SUM(R[-6]C:R[-1]C) -> 0 | AM18: =SUM(R[-6]C:R[-1]C) -> 0 | AN18: =SUM(R[-6]C:R[-1]C) -> 0 | AO18: =SUM(R[-6]C:R[-1]C) -> 0 | AP18: =SUM(R[-6]C:R[-1]C) -> 0 | AQ18: =SUM(R[-6]C:R[-1]C) -> 0 | AR18: =SUM(R[-6]C:R[-1]C) -> 6 | AS18: =SUM(R[-6]C:R[-1]C) -> 0 | AT18: =SUM(R[-6]C:R[-1]C) -> 0 | AU18: =SUM(R[-6]C:R[-1]C) -> 4811400 | AV18: =SUM(R[-6]C:R[-1]C) -> 0 | AW18: =SUM(R[-6]C:R[-1]C) -> 0 | AX18: =SUM(R[-6]C:R[-1]C) -> 0 | AY18: =SUM(R[-6]C:R[-1]C) -> 0
A19: Phòng Điều hành, tài liệu và hướng dẫn chất xếp (HGS) | F19: =SUM(R[-8]C[46]:R[-1]C[46]) -> 4860000 | G19: =SUM(R[-8]C[46]:R[-1]C[46]) -> 0 | H19: =SUM(R[-8]C[46]:R[-1]C[46]) -> 0 | I19: =SUM(R[-8]C[46]:R[-1]C[46]) -> 0 | J19: =SUM(R[-8]C[46]:R[-1]C[46]) -> 0 | K19: =SUM(R[-8]C[46]:R[-1]C[46]) -> 0 | L19: =SUM(R[-8]C[46]:R[-1]C[46]) -> 0 | M19: =SUM(R[-8]C[46]:R[-1]C[46]) -> 0 | N19: =SUM(R[-8]C[46]:R[-1]C[46]) -> 0 | O19: =SUM(R[-8]C[46]:R[-1]C[46]) -> 0 | P19: =SUM(R[-8]C[46]:R[-1]C[46]) -> 0 | Q19: =SUM(R[-8]C[46]:R[-1]C[46]) -> 4860000 | R19: =SUM(R[-8]C[46]:R[-1]C[46]) -> 0 | S19: =SUM(R[-8]C[46]:R[-1]C[46]) -> 0 | T19: =SUM(R[-8]C[46]:R[-1]C[46]) -> 0 | U19: =SUM(R[-8]C[46]:R[-1]C[46]) -> 48600 | V19: =SUM(R[-8]C[46]:R[-1]C[46]) -> 0 | W19: =SUM(R[-8]C[46]:R[-1]C[46]) -> 4811400 | X19: =SUM(R[-8]C[46]:R[-1]C[46]) -> 0 | Y19: =SUM(R[-8]C[46]:R[-1]C[46]) -> 0 | Z19: =SUM(R[-8]C[46]:R[-1]C[46]) -> 0 | AA19: =SUM(R[-8]C[46]:R[-1]C[46]) -> 0 | AB19: =SUM(R[-8]C[46]:R[-1]C[46]) -> 0 | AC19: =SUM(R[-8]C[46]:R[-1]C[46]) -> 0 | AD19: =SUM(R[-8]C[46]:R[-1]C[46]) -> 0 | AE19: =SUM(R[-8]C[46]:R[-1]C[46]) -> 0 | AF19: =SUM(R[-8]C[46]:R[-1]C[46]) -> 0 | AG19: =SUM(R[-8]C[46]:R[-1]C[46]) -> 0 | AH19: =SUM(R[-8]C[46]:R[-1]C[46]) -> 0 | AI19: =SUM(R[-8]C[46]:R[-1]C[46]) -> 4860000 | AJ19: =SUM(R[-8]C[46]:R[-1]C[46]) -> 0 | AK19: =SUM(R[-8]C[46]:R[-1]C[46]) -> 0 | AL19: =SUM(R[-8]C[46]:R[-1]C[46]) -> 0 | AM19: =SUM(R[-8]C[46]:R[-1]C[46]) -> 0 | AN19: =SUM(R[-8]C[46]:R[-1]C[46]) -> 0 | AO19: =SUM(R[-8]C[46]:R[-1]C[46]) -> 0 | AP19: =SUM(R[-8]C[46]:R[-1]C[46]) -> 0 | AQ19: =SUM(R[-8]C[46]:R[-1]C[46]) -> 0 | AR19: =SUM(R[-8]C[46]:R[-1]C[46]) -> 6 | AS19: =SUM(R[-8]C[46]:R[-1]C[46]) -> 0 | AT19: =SUM(R[-8]C[46]:R[-1]C[46]) -> 0 | AU19: =SUM(R[-8]C[46]:R[-1]C[46]) -> 4811400 | AV19: =SUM(R[-8]C[46]:R[-1]C[46]) -> 0 | AW19: =SUM(R[-8]C[46]:R[-1]C[46]) -> 0 | AX19: =SUM(R[-8]C[46]:R[-1]C[46]) -> 0 | AY19: =SUM(R[-8]C[46]:R[-1]C[46]) -> 0
A20: Phòng Phục vụ hành khách (HGS) | F20: =R[23]C -> 14580000 | G20: =R[23]C -> 0 | H20: =R[23]C -> 0 | I20: =R[23]C -> 0 | J20: =R[23]C -> 0 | K20: =R[23]C -> 0 | L20: =R[23]C -> 0 | M20: =R[23]C -> 0 | N20: =R[23]C -> 0 | O20: =R[23]C -> 0 | P20: =R[23]C -> 0 | Q20: =R[23]C -> 14580000 | R20: =R[23]C -> 0 | S20: =R[23]C -> 0 | T20: =R[23]C -> 0 | U20: =R[23]C -> 145800 | V20: =R[23]C -> 0 | W20: =R[23]C -> 14434200 | X20: =R[23]C -> 0 | Y20: =R[23]C -> 0 | Z20: =R[23]C -> 0 | AA20: =R[23]C -> 0 | AB20: =R[23]C -> 0 | AC20: =R[23]C -> 0 | AD20: =R[23]C -> 0 | AE20: =R[23]C -> 0 | AF20: =R[23]C -> 0 | AG20: =R[23]C -> 0 | AH20: =R[23]C -> 0 | AI20: =R[23]C -> 14580000 | AJ20: =R[23]C -> 0 | AK20: =R[23]C -> 0 | AL20: =R[23]C -> 0 | AM20: =R[23]C -> 0 | AN20: =R[23]C -> 0 | AO20: =R[23]C -> 0 | AP20: =R[23]C -> 0 | AQ20: =R[23]C -> 0 | AR20: =R[23]C -> 18 | AS20: =R[23]C -> 0 | AT20: =R[23]C -> 0 | AU20: =R[23]C -> 14434200 | AW20: =R[23]C -> 0 | AX20: =R[23]C -> 0 | AY20: =R[23]C -> 0
F21: =R[16]C -> 12150000 | G21: =R[16]C -> 0 | H21: =R[16]C -> 0 | I21: =R[16]C -> 0 | J21: =R[16]C -> 0 | K21: =R[16]C -> 0 | L21: =R[16]C -> 0 | M21: =R[16]C -> 0 | N21: =R[16]C -> 0 | O21: =R[16]C -> 0 | P21: =R[16]C -> 0 | Q21: =R[16]C -> 12150000 | R21: =R[16]C -> 0 | S21: =R[16]C -> 0 | T21: =R[16]C -> 0 | U21: =R[16]C -> 121500 | V21: =R[16]C -> 0 | W21: =R[16]C -> 12028500 | X21: =R[16]C -> 0 | Y21: =R[16]C -> 0 | Z21: =R[16]C -> 0 | AA21: =R[16]C -> 0 | AB21: =R[16]C -> 0 | AC21: =R[16]C -> 0 | AD21: =R[16]C -> 0 | AE21: =R[16]C -> 0 | AF21: =R[16]C -> 0 | AG21: =R[16]C -> 0 | AH21: =R[16]C -> 0 | AI21: =R[16]C -> 12150000 | AJ21: =R[16]C -> 0 | AK21: =R[16]C -> 0 | AL21: =R[16]C -> 0 | AM21: =R[16]C -> 0 | AN21: =R[16]C -> 0 | AO21: =R[16]C -> 0 | AP21: =R[16]C -> 0 | AQ21: =R[16]C -> 0 | AR21: =R[16]C -> 15 | AS21: =R[16]C -> 0 | AT21: =R[16]C -> 0 | AU21: =R[16]C -> 12028500 | AW21: =R[16]C -> 0 | AX21: =R[16]C -> 0 | AY21: =R[16]C -> 0
A22: 1 | B22: 013361 | C22: Mai Thế Anh | D22: Nhân viên phục vụ hành khách hàng hóa | F22: =RC[29]+RC[30]+RC[31]+RC[32]+RC[33]+RC[34]+RC[35]+RC[36]+RC[37] -> 810000 | G22: =RC[17]+RC[18]++RC[19]+RC[20]+RC[21]+RC[38]+RC[39]+RC[41] -> 0 | H22: 0 | I22: 0 | J22: =RC[-2]+RC[-1] -> 0 | K22: 0 | L22: 0 | M22: 0 | N22: =RC[15]+RC[16]+RC[17]+RC[18]+RC[19]+RC[20] -> 0 | O22: 0 | P22: 0 | Q22: 810000 | R22: 0 | S22: 0 | T22: 0 | U22: 8100 | V22: 0 | W22: 801900 | X22: 0 | Y22: 0 | Z22: 0 | AA22: 0 | AB22: 0 | AC22: 0 | AD22: 0 | AE22: 0 | AF22: 0 | AG22: 0 | AH22: 0 | AI22: 810000 | AJ22: 0 | AK22: 0 | AL22: 0 | AM22: 0 | AN22: 0 | AO22: 0 | AP22: 0 | AQ22: 0 | AR22: =1 -> 1 | AS22: 0 | AT22: 0 | AU22: =RC[-30]-RC[-29]-RC[-28]-RC[-27]-RC[-26]-RC[-25] -> 801900 | AV22: 0 | AW22: =RC[1]-RC[2] -> 0 | AX22: 0 | AY22: 0 | AZ22: =RC[-46] -> 810000 | BA22: =RC[-46] -> 0 | BB22: =RC[-46] -> 0 | BC22: =RC[-46] -> 0 | BD22: =RC[-46] -> 0 | BE22: =RC[-46] -> 0 | BF22: =RC[-46] -> 0 | BG22: =RC[-46] -> 0 | BH22: =RC[-46] -> 0 | BI22: =RC[-46] -> 0 | BJ22: =RC[-46] -> 0 | BK22: =RC[-46] -> 810000 | BL22: =RC[-46] -> 0 | BM22: =RC[-46] -> 0 | BN22: =RC[-46] -> 0 | BO22: =RC[-46] -> 8100 | BP22: =RC[-46] -> 0 | BQ22: =RC[-46] -> 801900 | BR22: =RC[-46] -> 0 | BS22: =RC[-46] -> 0 | BT22: =RC[-46] -> 0 | BU22: =RC[-46] -> 0 | BV22: =RC[-46] -> 0 | BW22: =RC[-46] -> 0 | BX22: =RC[-46] -> 0 | BY22: =RC[-46] -> 0 | BZ22: =RC[-46] -> 0 | CA22: =RC[-46] -> 0 | CB22: =RC[-46] -> 0 | CC22: =RC[-46] -> 810000 | CD22: =RC[-46] -> 0 | CE22: =RC[-46] -> 0 | CF22: =RC[-46] -> 0 | CG22: =RC[-46] -> 0 | CH22: =RC[-46] -> 0 | CI22: =RC[-46] -> 0 | CJ22: =RC[-46] -> 0 | CK22: =RC[-46] -> 0 | CL22: =RC[-46] -> 1 | CM22: =RC[-46] -> 0 | CN22: =RC[-46] -> 0 | CO22: =RC[-46] -> 801900 | CP22: =RC[-46] -> 0 | CQ22: =RC[-46] -> 0 | CR22: =RC[-46] -> 0 | CS22: =RC[-46] -> 0
A23: 2 | B23: 013370 | C23: Đinh Đức Điệp | D23: Nhân viên phục vụ hành khách hàng hóa | F23: =RC[29]+RC[30]+RC[31]+RC[32]+RC[33]+RC[34]+RC[35]+RC[36]+RC[37] -> 810000 | G23: =RC[17]+RC[18]++RC[19]+RC[20]+RC[21]+RC[38]+RC[39]+RC[41] -> 0 | H23: 0 | I23: 0 | J23: =RC[-2]+RC[-1] -> 0 | K23: 0 | L23: 0 | M23: 0 | N23: =RC[15]+RC[16]+RC[17]+RC[18]+RC[19]+RC[20] -> 0 | O23: 0 | P23: 0 | Q23: 810000 | R23: 0 | S23: 0 | T23: 0 | U23: 8100 | V23: 0 | W23: 801900 | X23: 0 | Y23: 0 | Z23: 0 | AA23: 0 | AB23: 0 | AC23: 0 | AD23: 0 | AE23: 0 | AF23: 0 | AG23: 0 | AH23: 0 | AI23: 810000 | AJ23: 0 | AK23: 0 | AL23: 0 | AM23: 0 | AN23: 0 | AO23: 0 | AP23: 0 | AQ23: 0 | AR23: =1 -> 1 | AS23: 0 | AT23: 0 | AU23: =RC[-30]-RC[-29]-RC[-28]-RC[-27]-RC[-26]-RC[-25] -> 801900 | AV23: 0 | AW23: =RC[1]-RC[2] -> 0 | AX23: 0 | AY23: 0 | AZ23: =RC[-46] -> 810000 | BA23: =RC[-46] -> 0 | BB23: =RC[-46] -> 0 | BC23: =RC[-46] -> 0 | BD23: =RC[-46] -> 0 | BE23: =RC[-46] -> 0 | BF23: =RC[-46] -> 0 | BG23: =RC[-46] -> 0 | BH23: =RC[-46] -> 0 | BI23: =RC[-46] -> 0 | BJ23: =RC[-46] -> 0 | BK23: =RC[-46] -> 810000 | BL23: =RC[-46] -> 0 | BM23: =RC[-46] -> 0 | BN23: =RC[-46] -> 0 | BO23: =RC[-46] -> 8100 | BP23: =RC[-46] -> 0 | BQ23: =RC[-46] -> 801900 | BR23: =RC[-46] -> 0 | BS23: =RC[-46] -> 0 | BT23: =RC[-46] -> 0 | BU23: =RC[-46] -> 0 | BV23: =RC[-46] -> 0 | BW23: =RC[-46] -> 0 | BX23: =RC[-46] -> 0 | BY23: =RC[-46] -> 0 | BZ23: =RC[-46] -> 0 | CA23: =RC[-46] -> 0 | CB23: =RC[-46] -> 0 | CC23: =RC[-46] -> 810000 | CD23: =RC[-46] -> 0 | CE23: =RC[-46] -> 0 | CF23: =RC[-46] -> 0 | CG23: =RC[-46] -> 0 | CH23: =RC[-46] -> 0 | CI23: =RC[-46] -> 0 | CJ23: =RC[-46] -> 0 | CK23: =RC[-46] -> 0 | CL23: =RC[-46] -> 1 | CM23: =RC[-46] -> 0 | CN23: =RC[-46] -> 0 | CO23: =RC[-46] -> 801900 | CP23: =RC[-46] -> 0 | CQ23: =RC[-46] -> 0 | CR23: =RC[-46] -> 0 | CS23: =RC[-46] -> 0
A24: 3 | B24: 013371 | C24: Triệu Hà Phương Anh | D24: Nhân viên phục vụ hành khách hàng hóa | F24: =RC[29]+RC[30]+RC[31]+RC[32]+RC[33]+RC[34]+RC[35]+RC[36]+RC[37] -> 810000 | G24: =RC[17]+RC[18]++RC[19]+RC[20]+RC[21]+RC[38]+RC[39]+RC[41] -> 0 | H24: 0 | I24: 0 | J24: =RC[-2]+RC[-1] -> 0 | K24: 0 | L24: 0 | M24: 0 | N24: =RC[15]+RC[16]+RC[17]+RC[18]+RC[19]+RC[20] -> 0 | O24: 0 | P24: 0 | Q24: 810000 | R24: 0 | S24: 0 | T24: 0 | U24: 8100 | V24: 0 | W24: 801900 | X24: 0 | Y24: 0 | Z24: 0 | AA24: 0 | AB24: 0 | AC24: 0 | AD24: 0 | AE24: 0 | AF24: 0 | AG24: 0 | AH24: 0 | AI24: 810000 | AJ24: 0 | AK24: 0 | AL24: 0 | AM24: 0 | AN24: 0 | AO24: 0 | AP24: 0 | AQ24: 0 | AR24: =1 -> 1 | AS24: 0 | AT24: 0 | AU24: =RC[-30]-RC[-29]-RC[-28]-RC[-27]-RC[-26]-RC[-25] -> 801900 | AV24: 0 | AW24: =RC[1]-RC[2] -> 0 | AX24: 0 | AY24: 0 | AZ24: =RC[-46] -> 810000 | BA24: =RC[-46] -> 0 | BB24: =RC[-46] -> 0 | BC24: =RC[-46] -> 0 | BD24: =RC[-46] -> 0 | BE24: =RC[-46] -> 0 | BF24: =RC[-46] -> 0 | BG24: =RC[-46] -> 0 | BH24: =RC[-46] -> 0 | BI24: =RC[-46] -> 0 | BJ24: =RC[-46] -> 0 | BK24: =RC[-46] -> 810000 | BL24: =RC[-46] -> 0 | BM24: =RC[-46] -> 0 | BN24: =RC[-46] -> 0 | BO24: =RC[-46] -> 8100 | BP24: =RC[-46] -> 0 | BQ24: =RC[-46] -> 801900 | BR24: =RC[-46] -> 0 | BS24: =RC[-46] -> 0 | BT24: =RC[-46] -> 0 | BU24: =RC[-46] -> 0 | BV24: =RC[-46] -> 0 | BW24: =RC[-46] -> 0 | BX24: =RC[-46] -> 0 | BY24: =RC[-46] -> 0 | BZ24: =RC[-46] -> 0 | CA24: =RC[-46] -> 0 | CB24: =RC[-46] -> 0 | CC24: =RC[-46] -> 810000 | CD24: =RC[-46] -> 0 | CE24: =RC[-46] -> 0 | CF24: =RC[-46] -> 0 | CG24: =RC[-46] -> 0 | CH24: =RC[-46] -> 0 | CI24: =RC[-46] -> 0 | CJ24: =RC[-46] -> 0 | CK24: =RC[-46] -> 0 | CL24: =RC[-46] -> 1 | CM24: =RC[-46] -> 0 | CN24: =RC[-46] -> 0 | CO24: =RC[-46] -> 801900 | CP24: =RC[-46] -> 0 | CQ24: =RC[-46] -> 0 | CR24: =RC[-46] -> 0 | CS24: =RC[-46] -> 0
A25: 4 | B25: 013372 | C25: Trần Thị Hoa Lý | D25: Nhân viên phục vụ hành khách hàng hóa | F25: =RC[29]+RC[30]+RC[31]+RC[32]+RC[33]+RC[34]+RC[35]+RC[36]+RC[37] -> 810000 | G25: =RC[17]+RC[18]++RC[19]+RC[20]+RC[21]+RC[38]+RC[39]+RC[41] -> 0 | H25: 0 | I25: 0 | J25: =RC[-2]+RC[-1] -> 0 | K25: 0 | L25: 0 | M25: 0 | N25: =RC[15]+RC[16]+RC[17]+RC[18]+RC[19]+RC[20] -> 0 | O25: 0 | P25: 0 | Q25: 810000 | R25: 0 | S25: 0 | T25: 0 | U25: 8100 | V25: 0 | W25: 801900 | X25: 0 | Y25: 0 | Z25: 0 | AA25: 0 | AB25: 0 | AC25: 0 | AD25: 0 | AE25: 0 | AF25: 0 | AG25: 0 | AH25: 0 | AI25: 810000 | AJ25: 0 | AK25: 0 | AL25: 0 | AM25: 0 | AN25: 0 | AO25: 0 | AP25: 0 | AQ25: 0 | AR25: =1 -> 1 | AS25: 0 | AT25: 0 | AU25: =RC[-30]-RC[-29]-RC[-28]-RC[-27]-RC[-26]-RC[-25] -> 801900 | AV25: 0 | AW25: =RC[1]-RC[2] -> 0 | AX25: 0 | AY25: 0 | AZ25: =RC[-46] -> 810000 | BA25: =RC[-46] -> 0 | BB25: =RC[-46] -> 0 | BC25: =RC[-46] -> 0 | BD25: =RC[-46] -> 0 | BE25: =RC[-46] -> 0 | BF25: =RC[-46] -> 0 | BG25: =RC[-46] -> 0 | BH25: =RC[-46] -> 0 | BI25: =RC[-46] -> 0 | BJ25: =RC[-46] -> 0 | BK25: =RC[-46] -> 810000 | BL25: =RC[-46] -> 0 | BM25: =RC[-46] -> 0 | BN25: =RC[-46] -> 0 | BO25: =RC[-46] -> 8100 | BP25: =RC[-46] -> 0 | BQ25: =RC[-46] -> 801900 | BR25: =RC[-46] -> 0 | BS25: =RC[-46] -> 0 | BT25: =RC[-46] -> 0 | BU25: =RC[-46] -> 0 | BV25: =RC[-46] -> 0 | BW25: =RC[-46] -> 0 | BX25: =RC[-46] -> 0 | BY25: =RC[-46] -> 0 | BZ25: =RC[-46] -> 0 | CA25: =RC[-46] -> 0 | CB25: =RC[-46] -> 0 | CC25: =RC[-46] -> 810000 | CD25: =RC[-46] -> 0 | CE25: =RC[-46] -> 0 | CF25: =RC[-46] -> 0 | CG25: =RC[-46] -> 0 | CH25: =RC[-46] -> 0 | CI25: =RC[-46] -> 0 | CJ25: =RC[-46] -> 0 | CK25: =RC[-46] -> 0 | CL25: =RC[-46] -> 1 | CM25: =RC[-46] -> 0 | CN25: =RC[-46] -> 0 | CO25: =RC[-46] -> 801900 | CP25: =RC[-46] -> 0 | CQ25: =RC[-46] -> 0 | CR25: =RC[-46] -> 0 | CS25: =RC[-46] -> 0
A26: 5 | B26: 013373 | C26: Trần Thị Sơn | D26: Nhân viên phục vụ hành khách hàng hóa | F26: =RC[29]+RC[30]+RC[31]+RC[32]+RC[33]+RC[34]+RC[35]+RC[36]+RC[37] -> 810000 | G26: =RC[17]+RC[18]++RC[19]+RC[20]+RC[21]+RC[38]+RC[39]+RC[41] -> 0 | H26: 0 | I26: 0 | J26: =RC[-2]+RC[-1] -> 0 | K26: 0 | L26: 0 | M26: 0 | N26: =RC[15]+RC[16]+RC[17]+RC[18]+RC[19]+RC[20] -> 0 | O26: 0 | P26: 0 | Q26: 810000 | R26: 0 | S26: 0 | T26: 0 | U26: 8100 | V26: 0 | W26: 801900 | X26: 0 | Y26: 0 | Z26: 0 | AA26: 0 | AB26: 0 | AC26: 0 | AD26: 0 | AE26: 0 | AF26: 0 | AG26: 0 | AH26: 0 | AI26: 810000 | AJ26: 0 | AK26: 0 | AL26: 0 | AM26: 0 | AN26: 0 | AO26: 0 | AP26: 0 | AQ26: 0 | AR26: =1 -> 1 | AS26: 0 | AT26: 0 | AU26: =RC[-30]-RC[-29]-RC[-28]-RC[-27]-RC[-26]-RC[-25] -> 801900 | AV26: 0 | AW26: =RC[1]-RC[2] -> 0 | AX26: 0 | AY26: 0 | AZ26: =RC[-46] -> 810000 | BA26: =RC[-46] -> 0 | BB26: =RC[-46] -> 0 | BC26: =RC[-46] -> 0 | BD26: =RC[-46] -> 0 | BE26: =RC[-46] -> 0 | BF26: =RC[-46] -> 0 | BG26: =RC[-46] -> 0 | BH26: =RC[-46] -> 0 | BI26: =RC[-46] -> 0 | BJ26: =RC[-46] -> 0 | BK26: =RC[-46] -> 810000 | BL26: =RC[-46] -> 0 | BM26: =RC[-46] -> 0 | BN26: =RC[-46] -> 0 | BO26: =RC[-46] -> 8100 | BP26: =RC[-46] -> 0 | BQ26: =RC[-46] -> 801900 | BR26: =RC[-46] -> 0 | BS26: =RC[-46] -> 0 | BT26: =RC[-46] -> 0 | BU26: =RC[-46] -> 0 | BV26: =RC[-46] -> 0 | BW26: =RC[-46] -> 0 | BX26: =RC[-46] -> 0 | BY26: =RC[-46] -> 0 | BZ26: =RC[-46] -> 0 | CA26: =RC[-46] -> 0 | CB26: =RC[-46] -> 0 | CC26: =RC[-46] -> 810000 | CD26: =RC[-46] -> 0 | CE26: =RC[-46] -> 0 | CF26: =RC[-46] -> 0 | CG26: =RC[-46] -> 0 | CH26: =RC[-46] -> 0 | CI26: =RC[-46] -> 0 | CJ26: =RC[-46] -> 0 | CK26: =RC[-46] -> 0 | CL26: =RC[-46] -> 1 | CM26: =RC[-46] -> 0 | CN26: =RC[-46] -> 0 | CO26: =RC[-46] -> 801900 | CP26: =RC[-46] -> 0 | CQ26: =RC[-46] -> 0 | CR26: =RC[-46] -> 0 | CS26: =RC[-46] -> 0
A27: 6 | B27: 013374 | C27: Trần Thị Ngọc Hoa | D27: Nhân viên phục vụ hành khách hàng hóa | F27: =RC[29]+RC[30]+RC[31]+RC[32]+RC[33]+RC[34]+RC[35]+RC[36]+RC[37] -> 810000 | G27: =RC[17]+RC[18]++RC[19]+RC[20]+RC[21]+RC[38]+RC[39]+RC[41] -> 0 | H27: 0 | I27: 0 | J27: =RC[-2]+RC[-1] -> 0 | K27: 0 | L27: 0 | M27: 0 | N27: =RC[15]+RC[16]+RC[17]+RC[18]+RC[19]+RC[20] -> 0 | O27: 0 | P27: 0 | Q27: 810000 | R27: 0 | S27: 0 | T27: 0 | U27: 8100 | V27: 0 | W27: 801900 | X27: 0 | Y27: 0 | Z27: 0 | AA27: 0 | AB27: 0 | AC27: 0 | AD27: 0 | AE27: 0 | AF27: 0 | AG27: 0 | AH27: 0 | AI27: 810000 | AJ27: 0 | AK27: 0 | AL27: 0 | AM27: 0 | AN27: 0 | AO27: 0 | AP27: 0 | AQ27: 0 | AR27: =1 -> 1 | AS27: 0 | AT27: 0 | AU27: =RC[-30]-RC[-29]-RC[-28]-RC[-27]-RC[-26]-RC[-25] -> 801900 | AV27: 0 | AW27: =RC[1]-RC[2] -> 0 | AX27: 0 | AY27: 0 | AZ27: =RC[-46] -> 810000 | BA27: =RC[-46] -> 0 | BB27: =RC[-46] -> 0 | BC27: =RC[-46] -> 0 | BD27: =RC[-46] -> 0 | BE27: =RC[-46] -> 0 | BF27: =RC[-46] -> 0 | BG27: =RC[-46] -> 0 | BH27: =RC[-46] -> 0 | BI27: =RC[-46] -> 0 | BJ27: =RC[-46] -> 0 | BK27: =RC[-46] -> 810000 | BL27: =RC[-46] -> 0 | BM27: =RC[-46] -> 0 | BN27: =RC[-46] -> 0 | BO27: =RC[-46] -> 8100 | BP27: =RC[-46] -> 0 | BQ27: =RC[-46] -> 801900 | BR27: =RC[-46] -> 0 | BS27: =RC[-46] -> 0 | BT27: =RC[-46] -> 0 | BU27: =RC[-46] -> 0 | BV27: =RC[-46] -> 0 | BW27: =RC[-46] -> 0 | BX27: =RC[-46] -> 0 | BY27: =RC[-46] -> 0 | BZ27: =RC[-46] -> 0 | CA27: =RC[-46] -> 0 | CB27: =RC[-46] -> 0 | CC27: =RC[-46] -> 810000 | CD27: =RC[-46] -> 0 | CE27: =RC[-46] -> 0 | CF27: =RC[-46] -> 0 | CG27: =RC[-46] -> 0 | CH27: =RC[-46] -> 0 | CI27: =RC[-46] -> 0 | CJ27: =RC[-46] -> 0 | CK27: =RC[-46] -> 0 | CL27: =RC[-46] -> 1 | CM27: =RC[-46] -> 0 | CN27: =RC[-46] -> 0 | CO27: =RC[-46] -> 801900 | CP27: =RC[-46] -> 0 | CQ27: =RC[-46] -> 0 | CR27: =RC[-46] -> 0 | CS27: =RC[-46] -> 0
A28: 7 | B28: 013375 | C28: Nguyễn Thị Oanh | D28: Nhân viên phục vụ hành khách hàng hóa | F28: =RC[29]+RC[30]+RC[31]+RC[32]+RC[33]+RC[34]+RC[35]+RC[36]+RC[37] -> 810000 | G28: =RC[17]+RC[18]++RC[19]+RC[20]+RC[21]+RC[38]+RC[39]+RC[41] -> 0 | H28: 0 | I28: 0 | J28: =RC[-2]+RC[-1] -> 0 | K28: 0 | L28: 0 | M28: 0 | N28: =RC[15]+RC[16]+RC[17]+RC[18]+RC[19]+RC[20] -> 0 | O28: 0 | P28: 0 | Q28: 810000 | R28: 0 | S28: 0 | T28: 0 | U28: 8100 | V28: 0 | W28: 801900 | X28: 0 | Y28: 0 | Z28: 0 | AA28: 0 | AB28: 0 | AC28: 0 | AD28: 0 | AE28: 0 | AF28: 0 | AG28: 0 | AH28: 0 | AI28: 810000 | AJ28: 0 | AK28: 0 | AL28: 0 | AM28: 0 | AN28: 0 | AO28: 0 | AP28: 0 | AQ28: 0 | AR28: =1 -> 1 | AS28: 0 | AT28: 0 | AU28: =RC[-30]-RC[-29]-RC[-28]-RC[-27]-RC[-26]-RC[-25] -> 801900 | AV28: 0 | AW28: =RC[1]-RC[2] -> 0 | AX28: 0 | AY28: 0 | AZ28: =RC[-46] -> 810000 | BA28: =RC[-46] -> 0 | BB28: =RC[-46] -> 0 | BC28: =RC[-46] -> 0 | BD28: =RC[-46] -> 0 | BE28: =RC[-46] -> 0 | BF28: =RC[-46] -> 0 | BG28: =RC[-46] -> 0 | BH28: =RC[-46] -> 0 | BI28: =RC[-46] -> 0 | BJ28: =RC[-46] -> 0 | BK28: =RC[-46] -> 810000 | BL28: =RC[-46] -> 0 | BM28: =RC[-46] -> 0 | BN28: =RC[-46] -> 0 | BO28: =RC[-46] -> 8100 | BP28: =RC[-46] -> 0 | BQ28: =RC[-46] -> 801900 | BR28: =RC[-46] -> 0 | BS28: =RC[-46] -> 0 | BT28: =RC[-46] -> 0 | BU28: =RC[-46] -> 0 | BV28: =RC[-46] -> 0 | BW28: =RC[-46] -> 0 | BX28: =RC[-46] -> 0 | BY28: =RC[-46] -> 0 | BZ28: =RC[-46] -> 0 | CA28: =RC[-46] -> 0 | CB28: =RC[-46] -> 0 | CC28: =RC[-46] -> 810000 | CD28: =RC[-46] -> 0 | CE28: =RC[-46] -> 0 | CF28: =RC[-46] -> 0 | CG28: =RC[-46] -> 0 | CH28: =RC[-46] -> 0 | CI28: =RC[-46] -> 0 | CJ28: =RC[-46] -> 0 | CK28: =RC[-46] -> 0 | CL28: =RC[-46] -> 1 | CM28: =RC[-46] -> 0 | CN28: =RC[-46] -> 0 | CO28: =RC[-46] -> 801900 | CP28: =RC[-46] -> 0 | CQ28: =RC[-46] -> 0 | CR28: =RC[-46] -> 0 | CS28: =RC[-46] -> 0
A29: 8 | B29: 013376 | C29: Vũ Thùy Linh | D29: Nhân viên phục vụ hành khách hàng hóa | F29: =RC[29]+RC[30]+RC[31]+RC[32]+RC[33]+RC[34]+RC[35]+RC[36]+RC[37] -> 810000 | G29: =RC[17]+RC[18]++RC[19]+RC[20]+RC[21]+RC[38]+RC[39]+RC[41] -> 0 | H29: 0 | I29: 0 | J29: =RC[-2]+RC[-1] -> 0 | K29: 0 | L29: 0 | M29: 0 | N29: =RC[15]+RC[16]+RC[17]+RC[18]+RC[19]+RC[20] -> 0 | O29: 0 | P29: 0 | Q29: 810000 | R29: 0 | S29: 0 | T29: 0 | U29: 8100 | V29: 0 | W29: 801900 | X29: 0 | Y29: 0 | Z29: 0 | AA29: 0 | AB29: 0 | AC29: 0 | AD29: 0 | AE29: 0 | AF29: 0 | AG29: 0 | AH29: 0 | AI29: 810000 | AJ29: 0 | AK29: 0 | AL29: 0 | AM29: 0 | AN29: 0 | AO29: 0 | AP29: 0 | AQ29: 0 | AR29: =1 -> 1 | AS29: 0 | AT29: 0 | AU29: =RC[-30]-RC[-29]-RC[-28]-RC[-27]-RC[-26]-RC[-25] -> 801900 | AV29: 0 | AW29: =RC[1]-RC[2] -> 0 | AX29: 0 | AY29: 0 | AZ29: =RC[-46] -> 810000 | BA29: =RC[-46] -> 0 | BB29: =RC[-46] -> 0 | BC29: =RC[-46] -> 0 | BD29: =RC[-46] -> 0 | BE29: =RC[-46] -> 0 | BF29: =RC[-46] -> 0 | BG29: =RC[-46] -> 0 | BH29: =RC[-46] -> 0 | BI29: =RC[-46] -> 0 | BJ29: =RC[-46] -> 0 | BK29: =RC[-46] -> 810000 | BL29: =RC[-46] -> 0 | BM29: =RC[-46] -> 0 | BN29: =RC[-46] -> 0 | BO29: =RC[-46] -> 8100 | BP29: =RC[-46] -> 0 | BQ29: =RC[-46] -> 801900 | BR29: =RC[-46] -> 0 | BS29: =RC[-46] -> 0 | BT29: =RC[-46] -> 0 | BU29: =RC[-46] -> 0 | BV29: =RC[-46] -> 0 | BW29: =RC[-46] -> 0 | BX29: =RC[-46] -> 0 | BY29: =RC[-46] -> 0 | BZ29: =RC[-46] -> 0 | CA29: =RC[-46] -> 0 | CB29: =RC[-46] -> 0 | CC29: =RC[-46] -> 810000 | CD29: =RC[-46] -> 0 | CE29: =RC[-46] -> 0 | CF29: =RC[-46] -> 0 | CG29: =RC[-46] -> 0 | CH29: =RC[-46] -> 0 | CI29: =RC[-46] -> 0 | CJ29: =RC[-46] -> 0 | CK29: =RC[-46] -> 0 | CL29: =RC[-46] -> 1 | CM29: =RC[-46] -> 0 | CN29: =RC[-46] -> 0 | CO29: =RC[-46] -> 801900 | CP29: =RC[-46] -> 0 | CQ29: =RC[-46] -> 0 | CR29: =RC[-46] -> 0 | CS29: =RC[-46] -> 0
A30: 9 | B30: 013377 | C30: Vũ Thị Bích Dung | D30: Nhân viên phục vụ hành khách hàng hóa | F30: =RC[29]+RC[30]+RC[31]+RC[32]+RC[33]+RC[34]+RC[35]+RC[36]+RC[37] -> 810000 | G30: =RC[17]+RC[18]++RC[19]+RC[20]+RC[21]+RC[38]+RC[39]+RC[41] -> 0 | H30: 0 | I30: 0 | J30: =RC[-2]+RC[-1] -> 0 | K30: 0 | L30: 0 | M30: 0 | N30: =RC[15]+RC[16]+RC[17]+RC[18]+RC[19]+RC[20] -> 0 | O30: 0 | P30: 0 | Q30: 810000 | R30: 0 | S30: 0 | T30: 0 | U30: 8100 | V30: 0 | W30: 801900 | X30: 0 | Y30: 0 | Z30: 0 | AA30: 0 | AB30: 0 | AC30: 0 | AD30: 0 | AE30: 0 | AF30: 0 | AG30: 0 | AH30: 0 | AI30: 810000 | AJ30: 0 | AK30: 0 | AL30: 0 | AM30: 0 | AN30: 0 | AO30: 0 | AP30: 0 | AQ30: 0 | AR30: =1 -> 1 | AS30: 0 | AT30: 0 | AU30: =RC[-30]-RC[-29]-RC[-28]-RC[-27]-RC[-26]-RC[-25] -> 801900 | AV30: 0 | AW30: =RC[1]-RC[2] -> 0 | AX30: 0 | AY30: 0 | AZ30: =RC[-46] -> 810000 | BA30: =RC[-46] -> 0 | BB30: =RC[-46] -> 0 | BC30: =RC[-46] -> 0 | BD30: =RC[-46] -> 0 | BE30: =RC[-46] -> 0 | BF30: =RC[-46] -> 0 | BG30: =RC[-46] -> 0 | BH30: =RC[-46] -> 0 | BI30: =RC[-46] -> 0 | BJ30: =RC[-46] -> 0 | BK30: =RC[-46] -> 810000 | BL30: =RC[-46] -> 0 | BM30: =RC[-46] -> 0 | BN30: =RC[-46] -> 0 | BO30: =RC[-46] -> 8100 | BP30: =RC[-46] -> 0 | BQ30: =RC[-46] -> 801900 | BR30: =RC[-46] -> 0 | BS30: =RC[-46] -> 0 | BT30: =RC[-46] -> 0 | BU30: =RC[-46] -> 0 | BV30: =RC[-46] -> 0 | BW30: =RC[-46] -> 0 | BX30: =RC[-46] -> 0 | BY30: =RC[-46] -> 0 | BZ30: =RC[-46] -> 0 | CA30: =RC[-46] -> 0 | CB30: =RC[-46] -> 0 | CC30: =RC[-46] -> 810000 | CD30: =RC[-46] -> 0 | CE30: =RC[-46] -> 0 | CF30: =RC[-46] -> 0 | CG30: =RC[-46] -> 0 | CH30: =RC[-46] -> 0 | CI30: =RC[-46] -> 0 | CJ30: =RC[-46] -> 0 | CK30: =RC[-46] -> 0 | CL30: =RC[-46] -> 1 | CM30: =RC[-46] -> 0 | CN30: =RC[-46] -> 0 | CO30: =RC[-46] -> 801900 | CP30: =RC[-46] -> 0 | CQ30: =RC[-46] -> 0 | CR30: =RC[-46] -> 0 | CS30: =RC[-46] -> 0
A31: 10 | B31: 013378 | C31: Nguyễn Bảo Ngân | D31: Nhân viên phục vụ hành khách hàng hóa | F31: =RC[29]+RC[30]+RC[31]+RC[32]+RC[33]+RC[34]+RC[35]+RC[36]+RC[37] -> 810000 | G31: =RC[17]+RC[18]++RC[19]+RC[20]+RC[21]+RC[38]+RC[39]+RC[41] -> 0 | H31: 0 | I31: 0 | J31: =RC[-2]+RC[-1] -> 0 | K31: 0 | L31: 0 | M31: 0 | N31: =RC[15]+RC[16]+RC[17]+RC[18]+RC[19]+RC[20] -> 0 | O31: 0 | P31: 0 | Q31: 810000 | R31: 0 | S31: 0 | T31: 0 | U31: 8100 | V31: 0 | W31: 801900 | X31: 0 | Y31: 0 | Z31: 0 | AA31: 0 | AB31: 0 | AC31: 0 | AD31: 0 | AE31: 0 | AF31: 0 | AG31: 0 | AH31: 0 | AI31: 810000 | AJ31: 0 | AK31: 0 | AL31: 0 | AM31: 0 | AN31: 0 | AO31: 0 | AP31: 0 | AQ31: 0 | AR31: =1 -> 1 | AS31: 0 | AT31: 0 | AU31: =RC[-30]-RC[-29]-RC[-28]-RC[-27]-RC[-26]-RC[-25] -> 801900 | AV31: 0 | AW31: =RC[1]-RC[2] -> 0 | AX31: 0 | AY31: 0 | AZ31: =RC[-46] -> 810000 | BA31: =RC[-46] -> 0 | BB31: =RC[-46] -> 0 | BC31: =RC[-46] -> 0 | BD31: =RC[-46] -> 0 | BE31: =RC[-46] -> 0 | BF31: =RC[-46] -> 0 | BG31: =RC[-46] -> 0 | BH31: =RC[-46] -> 0 | BI31: =RC[-46] -> 0 | BJ31: =RC[-46] -> 0 | BK31: =RC[-46] -> 810000 | BL31: =RC[-46] -> 0 | BM31: =RC[-46] -> 0 | BN31: =RC[-46] -> 0 | BO31: =RC[-46] -> 8100 | BP31: =RC[-46] -> 0 | BQ31: =RC[-46] -> 801900 | BR31: =RC[-46] -> 0 | BS31: =RC[-46] -> 0 | BT31: =RC[-46] -> 0 | BU31: =RC[-46] -> 0 | BV31: =RC[-46] -> 0 | BW31: =RC[-46] -> 0 | BX31: =RC[-46] -> 0 | BY31: =RC[-46] -> 0 | BZ31: =RC[-46] -> 0 | CA31: =RC[-46] -> 0 | CB31: =RC[-46] -> 0 | CC31: =RC[-46] -> 810000 | CD31: =RC[-46] -> 0 | CE31: =RC[-46] -> 0 | CF31: =RC[-46] -> 0 | CG31: =RC[-46] -> 0 | CH31: =RC[-46] -> 0 | CI31: =RC[-46] -> 0 | CJ31: =RC[-46] -> 0 | CK31: =RC[-46] -> 0 | CL31: =RC[-46] -> 1 | CM31: =RC[-46] -> 0 | CN31: =RC[-46] -> 0 | CO31: =RC[-46] -> 801900 | CP31: =RC[-46] -> 0 | CQ31: =RC[-46] -> 0 | CR31: =RC[-46] -> 0 | CS31: =RC[-46] -> 0
A32: 11 | B32: 013379 | C32: Nguyễn Thùy Linh | D32: Nhân viên phục vụ hành khách hàng hóa | F32: =RC[29]+RC[30]+RC[31]+RC[32]+RC[33]+RC[34]+RC[35]+RC[36]+RC[37] -> 810000 | G32: =RC[17]+RC[18]++RC[19]+RC[20]+RC[21]+RC[38]+RC[39]+RC[41] -> 0 | H32: 0 | I32: 0 | J32: =RC[-2]+RC[-1] -> 0 | K32: 0 | L32: 0 | M32: 0 | N32: =RC[15]+RC[16]+RC[17]+RC[18]+RC[19]+RC[20] -> 0 | O32: 0 | P32: 0 | Q32: 810000 | R32: 0 | S32: 0 | T32: 0 | U32: 8100 | V32: 0 | W32: 801900 | X32: 0 | Y32: 0 | Z32: 0 | AA32: 0 | AB32: 0 | AC32: 0 | AD32: 0 | AE32: 0 | AF32: 0 | AG32: 0 | AH32: 0 | AI32: 810000 | AJ32: 0 | AK32: 0 | AL32: 0 | AM32: 0 | AN32: 0 | AO32: 0 | AP32: 0 | AQ32: 0 | AR32: =1 -> 1 | AS32: 0 | AT32: 0 | AU32: =RC[-30]-RC[-29]-RC[-28]-RC[-27]-RC[-26]-RC[-25] -> 801900 | AV32: 0 | AW32: =RC[1]-RC[2] -> 0 | AX32: 0 | AY32: 0 | AZ32: =RC[-46] -> 810000 | BA32: =RC[-46] -> 0 | BB32: =RC[-46] -> 0 | BC32: =RC[-46] -> 0 | BD32: =RC[-46] -> 0 | BE32: =RC[-46] -> 0 | BF32: =RC[-46] -> 0 | BG32: =RC[-46] -> 0 | BH32: =RC[-46] -> 0 | BI32: =RC[-46] -> 0 | BJ32: =RC[-46] -> 0 | BK32: =RC[-46] -> 810000 | BL32: =RC[-46] -> 0 | BM32: =RC[-46] -> 0 | BN32: =RC[-46] -> 0 | BO32: =RC[-46] -> 8100 | BP32: =RC[-46] -> 0 | BQ32: =RC[-46] -> 801900 | BR32: =RC[-46] -> 0 | BS32: =RC[-46] -> 0 | BT32: =RC[-46] -> 0 | BU32: =RC[-46] -> 0 | BV32: =RC[-46] -> 0 | BW32: =RC[-46] -> 0 | BX32: =RC[-46] -> 0 | BY32: =RC[-46] -> 0 | BZ32: =RC[-46] -> 0 | CA32: =RC[-46] -> 0 | CB32: =RC[-46] -> 0 | CC32: =RC[-46] -> 810000 | CD32: =RC[-46] -> 0 | CE32: =RC[-46] -> 0 | CF32: =RC[-46] -> 0 | CG32: =RC[-46] -> 0 | CH32: =RC[-46] -> 0 | CI32: =RC[-46] -> 0 | CJ32: =RC[-46] -> 0 | CK32: =RC[-46] -> 0 | CL32: =RC[-46] -> 1 | CM32: =RC[-46] -> 0 | CN32: =RC[-46] -> 0 | CO32: =RC[-46] -> 801900 | CP32: =RC[-46] -> 0 | CQ32: =RC[-46] -> 0 | CR32: =RC[-46] -> 0 | CS32: =RC[-46] -> 0
A33: 12 | B33: 013380 | C33: Nguyễn Thị Yến Hương | D33: Nhân viên phục vụ hành khách hàng hóa | F33: =RC[29]+RC[30]+RC[31]+RC[32]+RC[33]+RC[34]+RC[35]+RC[36]+RC[37] -> 810000 | G33: =RC[17]+RC[18]++RC[19]+RC[20]+RC[21]+RC[38]+RC[39]+RC[41] -> 0 | H33: 0 | I33: 0 | J33: =RC[-2]+RC[-1] -> 0 | K33: 0 | L33: 0 | M33: 0 | N33: =RC[15]+RC[16]+RC[17]+RC[18]+RC[19]+RC[20] -> 0 | O33: 0 | P33: 0 | Q33: 810000 | R33: 0 | S33: 0 | T33: 0 | U33: 8100 | V33: 0 | W33: 801900 | X33: 0 | Y33: 0 | Z33: 0 | AA33: 0 | AB33: 0 | AC33: 0 | AD33: 0 | AE33: 0 | AF33: 0 | AG33: 0 | AH33: 0 | AI33: 810000 | AJ33: 0 | AK33: 0 | AL33: 0 | AM33: 0 | AN33: 0 | AO33: 0 | AP33: 0 | AQ33: 0 | AR33: =1 -> 1 | AS33: 0 | AT33: 0 | AU33: =RC[-30]-RC[-29]-RC[-28]-RC[-27]-RC[-26]-RC[-25] -> 801900 | AV33: 0 | AW33: =RC[1]-RC[2] -> 0 | AX33: 0 | AY33: 0 | AZ33: =RC[-46] -> 810000 | BA33: =RC[-46] -> 0 | BB33: =RC[-46] -> 0 | BC33: =RC[-46] -> 0 | BD33: =RC[-46] -> 0 | BE33: =RC[-46] -> 0 | BF33: =RC[-46] -> 0 | BG33: =RC[-46] -> 0 | BH33: =RC[-46] -> 0 | BI33: =RC[-46] -> 0 | BJ33: =RC[-46] -> 0 | BK33: =RC[-46] -> 810000 | BL33: =RC[-46] -> 0 | BM33: =RC[-46] -> 0 | BN33: =RC[-46] -> 0 | BO33: =RC[-46] -> 8100 | BP33: =RC[-46] -> 0 | BQ33: =RC[-46] -> 801900 | BR33: =RC[-46] -> 0 | BS33: =RC[-46] -> 0 | BT33: =RC[-46] -> 0 | BU33: =RC[-46] -> 0 | BV33: =RC[-46] -> 0 | BW33: =RC[-46] -> 0 | BX33: =RC[-46] -> 0 | BY33: =RC[-46] -> 0 | BZ33: =RC[-46] -> 0 | CA33: =RC[-46] -> 0 | CB33: =RC[-46] -> 0 | CC33: =RC[-46] -> 810000 | CD33: =RC[-46] -> 0 | CE33: =RC[-46] -> 0 | CF33: =RC[-46] -> 0 | CG33: =RC[-46] -> 0 | CH33: =RC[-46] -> 0 | CI33: =RC[-46] -> 0 | CJ33: =RC[-46] -> 0 | CK33: =RC[-46] -> 0 | CL33: =RC[-46] -> 1 | CM33: =RC[-46] -> 0 | CN33: =RC[-46] -> 0 | CO33: =RC[-46] -> 801900 | CP33: =RC[-46] -> 0 | CQ33: =RC[-46] -> 0 | CR33: =RC[-46] -> 0 | CS33: =RC[-46] -> 0
A34: 13 | B34: 013381 | C34: Phạm Thị Thanh Tú | D34: Nhân viên phục vụ hành khách hàng hóa | F34: =RC[29]+RC[30]+RC[31]+RC[32]+RC[33]+RC[34]+RC[35]+RC[36]+RC[37] -> 810000 | G34: =RC[17]+RC[18]++RC[19]+RC[20]+RC[21]+RC[38]+RC[39]+RC[41] -> 0 | H34: 0 | I34: 0 | J34: =RC[-2]+RC[-1] -> 0 | K34: 0 | L34: 0 | M34: 0 | N34: =RC[15]+RC[16]+RC[17]+RC[18]+RC[19]+RC[20] -> 0 | O34: 0 | P34: 0 | Q34: 810000 | R34: 0 | S34: 0 | T34: 0 | U34: 8100 | V34: 0 | W34: 801900 | X34: 0 | Y34: 0 | Z34: 0 | AA34: 0 | AB34: 0 | AC34: 0 | AD34: 0 | AE34: 0 | AF34: 0 | AG34: 0 | AH34: 0 | AI34: 810000 | AJ34: 0 | AK34: 0 | AL34: 0 | AM34: 0 | AN34: 0 | AO34: 0 | AP34: 0 | AQ34: 0 | AR34: =1 -> 1 | AS34: 0 | AT34: 0 | AU34: =RC[-30]-RC[-29]-RC[-28]-RC[-27]-RC[-26]-RC[-25] -> 801900 | AV34: 0 | AW34: =RC[1]-RC[2] -> 0 | AX34: 0 | AY34: 0 | AZ34: =RC[-46] -> 810000 | BA34: =RC[-46] -> 0 | BB34: =RC[-46] -> 0 | BC34: =RC[-46] -> 0 | BD34: =RC[-46] -> 0 | BE34: =RC[-46] -> 0 | BF34: =RC[-46] -> 0 | BG34: =RC[-46] -> 0 | BH34: =RC[-46] -> 0 | BI34: =RC[-46] -> 0 | BJ34: =RC[-46] -> 0 | BK34: =RC[-46] -> 810000 | BL34: =RC[-46] -> 0 | BM34: =RC[-46] -> 0 | BN34: =RC[-46] -> 0 | BO34: =RC[-46] -> 8100 | BP34: =RC[-46] -> 0 | BQ34: =RC[-46] -> 801900 | BR34: =RC[-46] -> 0 | BS34: =RC[-46] -> 0 | BT34: =RC[-46] -> 0 | BU34: =RC[-46] -> 0 | BV34: =RC[-46] -> 0 | BW34: =RC[-46] -> 0 | BX34: =RC[-46] -> 0 | BY34: =RC[-46] -> 0 | BZ34: =RC[-46] -> 0 | CA34: =RC[-46] -> 0 | CB34: =RC[-46] -> 0 | CC34: =RC[-46] -> 810000 | CD34: =RC[-46] -> 0 | CE34: =RC[-46] -> 0 | CF34: =RC[-46] -> 0 | CG34: =RC[-46] -> 0 | CH34: =RC[-46] -> 0 | CI34: =RC[-46] -> 0 | CJ34: =RC[-46] -> 0 | CK34: =RC[-46] -> 0 | CL34: =RC[-46] -> 1 | CM34: =RC[-46] -> 0 | CN34: =RC[-46] -> 0 | CO34: =RC[-46] -> 801900 | CP34: =RC[-46] -> 0 | CQ34: =RC[-46] -> 0 | CR34: =RC[-46] -> 0 | CS34: =RC[-46] -> 0
A35: 14 | B35: 013382 | C35: Nguyễn Thị Bích Thảo | D35: Nhân viên phục vụ hành khách hàng hóa | F35: =RC[29]+RC[30]+RC[31]+RC[32]+RC[33]+RC[34]+RC[35]+RC[36]+RC[37] -> 810000 | G35: =RC[17]+RC[18]++RC[19]+RC[20]+RC[21]+RC[38]+RC[39]+RC[41] -> 0 | H35: 0 | I35: 0 | J35: =RC[-2]+RC[-1] -> 0 | K35: 0 | L35: 0 | M35: 0 | N35: =RC[15]+RC[16]+RC[17]+RC[18]+RC[19]+RC[20] -> 0 | O35: 0 | P35: 0 | Q35: 810000 | R35: 0 | S35: 0 | T35: 0 | U35: 8100 | V35: 0 | W35: 801900 | X35: 0 | Y35: 0 | Z35: 0 | AA35: 0 | AB35: 0 | AC35: 0 | AD35: 0 | AE35: 0 | AF35: 0 | AG35: 0 | AH35: 0 | AI35: 810000 | AJ35: 0 | AK35: 0 | AL35: 0 | AM35: 0 | AN35: 0 | AO35: 0 | AP35: 0 | AQ35: 0 | AR35: =1 -> 1 | AS35: 0 | AT35: 0 | AU35: =RC[-30]-RC[-29]-RC[-28]-RC[-27]-RC[-26]-RC[-25] -> 801900 | AV35: 0 | AW35: =RC[1]-RC[2] -> 0 | AX35: 0 | AY35: 0 | AZ35: =RC[-46] -> 810000 | BA35: =RC[-46] -> 0 | BB35: =RC[-46] -> 0 | BC35: =RC[-46] -> 0 | BD35: =RC[-46] -> 0 | BE35: =RC[-46] -> 0 | BF35: =RC[-46] -> 0 | BG35: =RC[-46] -> 0 | BH35: =RC[-46] -> 0 | BI35: =RC[-46] -> 0 | BJ35: =RC[-46] -> 0 | BK35: =RC[-46] -> 810000 | BL35: =RC[-46] -> 0 | BM35: =RC[-46] -> 0 | BN35: =RC[-46] -> 0 | BO35: =RC[-46] -> 8100 | BP35: =RC[-46] -> 0 | BQ35: =RC[-46] -> 801900 | BR35: =RC[-46] -> 0 | BS35: =RC[-46] -> 0 | BT35: =RC[-46] -> 0 | BU35: =RC[-46] -> 0 | BV35: =RC[-46] -> 0 | BW35: =RC[-46] -> 0 | BX35: =RC[-46] -> 0 | BY35: =RC[-46] -> 0 | BZ35: =RC[-46] -> 0 | CA35: =RC[-46] -> 0 | CB35: =RC[-46] -> 0 | CC35: =RC[-46] -> 810000 | CD35: =RC[-46] -> 0 | CE35: =RC[-46] -> 0 | CF35: =RC[-46] -> 0 | CG35: =RC[-46] -> 0 | CH35: =RC[-46] -> 0 | CI35: =RC[-46] -> 0 | CJ35: =RC[-46] -> 0 | CK35: =RC[-46] -> 0 | CL35: =RC[-46] -> 1 | CM35: =RC[-46] -> 0 | CN35: =RC[-46] -> 0 | CO35: =RC[-46] -> 801900 | CP35: =RC[-46] -> 0 | CQ35: =RC[-46] -> 0 | CR35: =RC[-46] -> 0 | CS35: =RC[-46] -> 0
A36: 15 | B36: 013405 | C36: Nguyễn Thị Thúy Hằng | D36: Nhân viên phục vụ hành khách hàng hóa | F36: =RC[29]+RC[30]+RC[31]+RC[32]+RC[33]+RC[34]+RC[35]+RC[36]+RC[37] -> 810000 | G36: =RC[17]+RC[18]++RC[19]+RC[20]+RC[21]+RC[38]+RC[39]+RC[41] -> 0 | H36: 0 | I36: 0 | J36: =RC[-2]+RC[-1] -> 0 | K36: 0 | L36: 0 | M36: 0 | N36: =RC[15]+RC[16]+RC[17]+RC[18]+RC[19]+RC[20] -> 0 | O36: 0 | P36: 0 | Q36: 810000 | R36: 0 | S36: 0 | T36: 0 | U36: 8100 | V36: 0 | W36: 801900 | X36: 0 | Y36: 0 | Z36: 0 | AA36: 0 | AB36: 0 | AC36: 0 | AD36: 0 | AE36: 0 | AF36: 0 | AG36: 0 | AH36: 0 | AI36: 810000 | AJ36: 0 | AK36: 0 | AL36: 0 | AM36: 0 | AN36: 0 | AO36: 0 | AP36: 0 | AQ36: 0 | AR36: =1 -> 1 | AS36: 0 | AT36: 0 | AU36: =RC[-30]-RC[-29]-RC[-28]-RC[-27]-RC[-26]-RC[-25] -> 801900 | AV36: 0 | AW36: =RC[1]-RC[2] -> 0 | AX36: 0 | AY36: 0 | AZ36: =RC[-46] -> 810000 | BA36: =RC[-46] -> 0 | BB36: =RC[-46] -> 0 | BC36: =RC[-46] -> 0 | BD36: =RC[-46] -> 0 | BE36: =RC[-46] -> 0 | BF36: =RC[-46] -> 0 | BG36: =RC[-46] -> 0 | BH36: =RC[-46] -> 0 | BI36: =RC[-46] -> 0 | BJ36: =RC[-46] -> 0 | BK36: =RC[-46] -> 810000 | BL36: =RC[-46] -> 0 | BM36: =RC[-46] -> 0 | BN36: =RC[-46] -> 0 | BO36: =RC[-46] -> 8100 | BP36: =RC[-46] -> 0 | BQ36: =RC[-46] -> 801900 | BR36: =RC[-46] -> 0 | BS36: =RC[-46] -> 0 | BT36: =RC[-46] -> 0 | BU36: =RC[-46] -> 0 | BV36: =RC[-46] -> 0 | BW36: =RC[-46] -> 0 | BX36: =RC[-46] -> 0 | BY36: =RC[-46] -> 0 | BZ36: =RC[-46] -> 0 | CA36: =RC[-46] -> 0 | CB36: =RC[-46] -> 0 | CC36: =RC[-46] -> 810000 | CD36: =RC[-46] -> 0 | CE36: =RC[-46] -> 0 | CF36: =RC[-46] -> 0 | CG36: =RC[-46] -> 0 | CH36: =RC[-46] -> 0 | CI36: =RC[-46] -> 0 | CJ36: =RC[-46] -> 0 | CK36: =RC[-46] -> 0 | CL36: =RC[-46] -> 1 | CM36: =RC[-46] -> 0 | CN36: =RC[-46] -> 0 | CO36: =RC[-46] -> 801900 | CP36: =RC[-46] -> 0 | CQ36: =RC[-46] -> 0 | CR36: =RC[-46] -> 0 | CS36: =RC[-46] -> 0
F37: =SUM(R[-15]C:R[-1]C) -> 12150000 | G37: =SUM(R[-15]C:R[-1]C) -> 0 | H37: =SUM(R[-15]C:R[-1]C) -> 0 | I37: =SUM(R[-15]C:R[-1]C) -> 0 | J37: =SUM(R[-15]C:R[-1]C) -> 0 | K37: =SUM(R[-15]C:R[-1]C) -> 0 | L37: =SUM(R[-15]C:R[-1]C) -> 0 | M37: =SUM(R[-15]C:R[-1]C) -> 0 | N37: =SUM(R[-15]C:R[-1]C) -> 0 | O37: =SUM(R[-15]C:R[-1]C) -> 0 | P37: =SUM(R[-15]C:R[-1]C) -> 0 | Q37: =SUM(R[-15]C:R[-1]C) -> 12150000 | R37: =SUM(R[-15]C:R[-1]C) -> 0 | S37: =SUM(R[-15]C:R[-1]C) -> 0 | T37: =SUM(R[-15]C:R[-1]C) -> 0 | U37: =SUM(R[-15]C:R[-1]C) -> 121500 | V37: =SUM(R[-15]C:R[-1]C) -> 0 | W37: =SUM(R[-15]C:R[-1]C) -> 12028500 | X37: =SUM(R[-15]C:R[-1]C) -> 0 | Y37: =SUM(R[-15]C:R[-1]C) -> 0 | Z37: =SUM(R[-15]C:R[-1]C) -> 0 | AA37: =SUM(R[-15]C:R[-1]C) -> 0 | AB37: =SUM(R[-15]C:R[-1]C) -> 0 | AC37: =SUM(R[-15]C:R[-1]C) -> 0 | AD37: =SUM(R[-15]C:R[-1]C) -> 0 | AE37: =SUM(R[-15]C:R[-1]C) -> 0 | AF37: =SUM(R[-15]C:R[-1]C) -> 0 | AG37: =SUM(R[-15]C:R[-1]C) -> 0 | AH37: =SUM(R[-15]C:R[-1]C) -> 0 | AI37: =SUM(R[-15]C:R[-1]C) -> 12150000 | AJ37: =SUM(R[-15]C:R[-1]C) -> 0 | AK37: =SUM(R[-15]C:R[-1]C) -> 0 | AL37: =SUM(R[-15]C:R[-1]C) -> 0 | AM37: =SUM(R[-15]C:R[-1]C) -> 0 | AN37: =SUM(R[-15]C:R[-1]C) -> 0 | AO37: =SUM(R[-15]C:R[-1]C) -> 0 | AP37: =SUM(R[-15]C:R[-1]C) -> 0 | AQ37: =SUM(R[-15]C:R[-1]C) -> 0 | AR37: =SUM(R[-15]C:R[-1]C) -> 15 | AS37: =SUM(R[-15]C:R[-1]C) -> 0 | AT37: =SUM(R[-15]C:R[-1]C) -> 0 | AU37: =SUM(R[-15]C:R[-1]C) -> 12028500 | AV37: =SUM(R[-15]C:R[-1]C) -> 0 | AW37: =SUM(R[-15]C:R[-1]C) -> 0 | AX37: =SUM(R[-15]C:R[-1]C) -> 0 | AY37: =SUM(R[-15]C:R[-1]C) -> 0
A38: Đội phục vụ hành khách đi (HGS) | F38: =R[4]C -> 2430000 | G38: =R[4]C -> 0 | H38: =R[4]C -> 0 | I38: =R[4]C -> 0 | J38: =R[4]C -> 0 | K38: =R[4]C -> 0 | L38: =R[4]C -> 0 | M38: =R[4]C -> 0 | N38: =R[4]C -> 0 | O38: =R[4]C -> 0 | P38: =R[4]C -> 0 | Q38: =R[4]C -> 2430000 | R38: =R[4]C -> 0 | S38: =R[4]C -> 0 | T38: =R[4]C -> 0 | U38: =R[4]C -> 24300 | V38: =R[4]C -> 0 | W38: =R[4]C -> 2405700 | X38: =R[4]C -> 0 | Y38: =R[4]C -> 0 | Z38: =R[4]C -> 0 | AA38: =R[4]C -> 0 | AB38: =R[4]C -> 0 | AC38: =R[4]C -> 0 | AD38: =R[4]C -> 0 | AE38: =R[4]C -> 0 | AF38: =R[4]C -> 0 | AG38: =R[4]C -> 0 | AH38: =R[4]C -> 0 | AI38: =R[4]C -> 2430000 | AJ38: =R[4]C -> 0 | AK38: =R[4]C -> 0 | AL38: =R[4]C -> 0 | AM38: =R[4]C -> 0 | AN38: =R[4]C -> 0 | AO38: =R[4]C -> 0 | AP38: =R[4]C -> 0 | AQ38: =R[4]C -> 0 | AR38: =R[4]C -> 3 | AS38: =R[4]C -> 0 | AT38: =R[4]C -> 0 | AU38: =R[4]C -> 2405700 | AW38: =R[4]C -> 0 | AX38: =R[4]C -> 0 | AY38: =R[4]C -> 0
A39: 1 | B39: 013096 | C39: Đinh Văn Long | D39: NV PVHK | E39: 19028834682012 | F39: =RC[29]+RC[30]+RC[31]+RC[32]+RC[33]+RC[34]+RC[35]+RC[36]+RC[37] -> 810000 | G39: =RC[17]+RC[18]++RC[19]+RC[20]+RC[21]+RC[38]+RC[39]+RC[41] -> 0 | H39: 0 | I39: 0 | J39: =RC[-2]+RC[-1] -> 0 | K39: 0 | L39: 0 | M39: 0 | N39: =RC[15]+RC[16]+RC[17]+RC[18]+RC[19]+RC[20] -> 0 | O39: 0 | P39: 0 | Q39: 810000 | R39: 0 | S39: 0 | T39: 0 | U39: 8100 | V39: 0 | W39: 801900 | X39: 0 | Y39: 0 | Z39: 0 | AA39: 0 | AB39: 0 | AC39: 0 | AD39: 0 | AE39: 0 | AF39: 0 | AG39: 0 | AH39: 0 | AI39: 810000 | AJ39: 0 | AK39: 0 | AL39: 0 | AM39: 0 | AN39: 0 | AO39: 0 | AP39: 0 | AQ39: 0 | AR39: =1 -> 1 | AS39: 0 | AT39: 0 | AU39: =RC[-30]-RC[-29]-RC[-28]-RC[-27]-RC[-26]-RC[-25] -> 801900 | AV39: 0 | AW39: =RC[1]-RC[2] -> 0 | AX39: 0 | AY39: 0 | AZ39: =RC[-46] -> 810000 | BA39: =RC[-46] -> 0 | BB39: =RC[-46] -> 0 | BC39: =RC[-46] -> 0 | BD39: =RC[-46] -> 0 | BE39: =RC[-46] -> 0 | BF39: =RC[-46] -> 0 | BG39: =RC[-46] -> 0 | BH39: =RC[-46] -> 0 | BI39: =RC[-46] -> 0 | BJ39: =RC[-46] -> 0 | BK39: =RC[-46] -> 810000 | BL39: =RC[-46] -> 0 | BM39: =RC[-46] -> 0 | BN39: =RC[-46] -> 0 | BO39: =RC[-46] -> 8100 | BP39: =RC[-46] -> 0 | BQ39: =RC[-46] -> 801900 | BR39: =RC[-46] -> 0 | BS39: =RC[-46] -> 0 | BT39: =RC[-46] -> 0 | BU39: =RC[-46] -> 0 | BV39: =RC[-46] -> 0 | BW39: =RC[-46] -> 0 | BX39: =RC[-46] -> 0 | BY39: =RC[-46] -> 0 | BZ39: =RC[-46] -> 0 | CA39: =RC[-46] -> 0 | CB39: =RC[-46] -> 0 | CC39: =RC[-46] -> 810000 | CD39: =RC[-46] -> 0 | CE39: =RC[-46] -> 0 | CF39: =RC[-46] -> 0 | CG39: =RC[-46] -> 0 | CH39: =RC[-46] -> 0 | CI39: =RC[-46] -> 0 | CJ39: =RC[-46] -> 0 | CK39: =RC[-46] -> 0 | CL39: =RC[-46] -> 1 | CM39: =RC[-46] -> 0 | CN39: =RC[-46] -> 0 | CO39: =RC[-46] -> 801900 | CP39: =RC[-46] -> 0 | CQ39: =RC[-46] -> 0 | CR39: =RC[-46] -> 0 | CS39: =RC[-46] -> 0
A40: 2 | B40: 013097 | C40: Nguyễn Thu Quỳnh | D40: NV PVHK | E40: 19028834686018 | F40: =RC[29]+RC[30]+RC[31]+RC[32]+RC[33]+RC[34]+RC[35]+RC[36]+RC[37] -> 810000 | G40: =RC[17]+RC[18]++RC[19]+RC[20]+RC[21]+RC[38]+RC[39]+RC[41] -> 0 | H40: 0 | I40: 0 | J40: =RC[-2]+RC[-1] -> 0 | K40: 0 | L40: 0 | M40: 0 | N40: =RC[15]+RC[16]+RC[17]+RC[18]+RC[19]+RC[20] -> 0 | O40: 0 | P40: 0 | Q40: 810000 | R40: 0 | S40: 0 | T40: 0 | U40: 8100 | V40: 0 | W40: 801900 | X40: 0 | Y40: 0 | Z40: 0 | AA40: 0 | AB40: 0 | AC40: 0 | AD40: 0 | AE40: 0 | AF40: 0 | AG40: 0 | AH40: 0 | AI40: 810000 | AJ40: 0 | AK40: 0 | AL40: 0 | AM40: 0 | AN40: 0 | AO40: 0 | AP40: 0 | AQ40: 0 | AR40: =1 -> 1 | AS40: 0 | AT40: 0 | AU40: =RC[-30]-RC[-29]-RC[-28]-RC[-27]-RC[-26]-RC[-25] -> 801900 | AV40: 0 | AW40: =RC[1]-RC[2] -> 0 | AX40: 0 | AY40: 0 | AZ40: =RC[-46] -> 810000 | BA40: =RC[-46] -> 0 | BB40: =RC[-46] -> 0 | BC40: =RC[-46] -> 0 | BD40: =RC[-46] -> 0 | BE40: =RC[-46] -> 0 | BF40: =RC[-46] -> 0 | BG40: =RC[-46] -> 0 | BH40: =RC[-46] -> 0 | BI40: =RC[-46] -> 0 | BJ40: =RC[-46] -> 0 | BK40: =RC[-46] -> 810000 | BL40: =RC[-46] -> 0 | BM40: =RC[-46] -> 0 | BN40: =RC[-46] -> 0 | BO40: =RC[-46] -> 8100 | BP40: =RC[-46] -> 0 | BQ40: =RC[-46] -> 801900 | BR40: =RC[-46] -> 0 | BS40: =RC[-46] -> 0 | BT40: =RC[-46] -> 0 | BU40: =RC[-46] -> 0 | BV40: =RC[-46] -> 0 | BW40: =RC[-46] -> 0 | BX40: =RC[-46] -> 0 | BY40: =RC[-46] -> 0 | BZ40: =RC[-46] -> 0 | CA40: =RC[-46] -> 0 | CB40: =RC[-46] -> 0 | CC40: =RC[-46] -> 810000 | CD40: =RC[-46] -> 0 | CE40: =RC[-46] -> 0 | CF40: =RC[-46] -> 0 | CG40: =RC[-46] -> 0 | CH40: =RC[-46] -> 0 | CI40: =RC[-46] -> 0 | CJ40: =RC[-46] -> 0 | CK40: =RC[-46] -> 0 | CL40: =RC[-46] -> 1 | CM40: =RC[-46] -> 0 | CN40: =RC[-46] -> 0 | CO40: =RC[-46] -> 801900 | CP40: =RC[-46] -> 0 | CQ40: =RC[-46] -> 0 | CR40: =RC[-46] -> 0 | CS40: =RC[-46] -> 0
A41: 3 | B41: 013101 | C41: Trần Thị Huệ | D41: NV PVHK | E41: 19028834680011 | F41: =RC[29]+RC[30]+RC[31]+RC[32]+RC[33]+RC[34]+RC[35]+RC[36]+RC[37] -> 810000 | G41: =RC[17]+RC[18]++RC[19]+RC[20]+RC[21]+RC[38]+RC[39]+RC[41] -> 0 | H41: 0 | I41: 0 | J41: =RC[-2]+RC[-1] -> 0 | K41: 0 | L41: 0 | M41: 0 | N41: =RC[15]+RC[16]+RC[17]+RC[18]+RC[19]+RC[20] -> 0 | O41: 0 | P41: 0 | Q41: 810000 | R41: 0 | S41: 0 | T41: 0 | U41: 8100 | V41: 0 | W41: 801900 | X41: 0 | Y41: 0 | Z41: 0 | AA41: 0 | AB41: 0 | AC41: 0 | AD41: 0 | AE41: 0 | AF41: 0 | AG41: 0 | AH41: 0 | AI41: 810000 | AJ41: 0 | AK41: 0 | AL41: 0 | AM41: 0 | AN41: 0 | AO41: 0 | AP41: 0 | AQ41: 0 | AR41: =1 -> 1 | AS41: 0 | AT41: 0 | AU41: =RC[-30]-RC[-29]-RC[-28]-RC[-27]-RC[-26]-RC[-25] -> 801900 | AV41: 0 | AW41: =RC[1]-RC[2] -> 0 | AX41: 0 | AY41: 0 | AZ41: =RC[-46] -> 810000 | BA41: =RC[-46] -> 0 | BB41: =RC[-46] -> 0 | BC41: =RC[-46] -> 0 | BD41: =RC[-46] -> 0 | BE41: =RC[-46] -> 0 | BF41: =RC[-46] -> 0 | BG41: =RC[-46] -> 0 | BH41: =RC[-46] -> 0 | BI41: =RC[-46] -> 0 | BJ41: =RC[-46] -> 0 | BK41: =RC[-46] -> 810000 | BL41: =RC[-46] -> 0 | BM41: =RC[-46] -> 0 | BN41: =RC[-46] -> 0 | BO41: =RC[-46] -> 8100 | BP41: =RC[-46] -> 0 | BQ41: =RC[-46] -> 801900 | BR41: =RC[-46] -> 0 | BS41: =RC[-46] -> 0 | BT41: =RC[-46] -> 0 | BU41: =RC[-46] -> 0 | BV41: =RC[-46] -> 0 | BW41: =RC[-46] -> 0 | BX41: =RC[-46] -> 0 | BY41: =RC[-46] -> 0 | BZ41: =RC[-46] -> 0 | CA41: =RC[-46] -> 0 | CB41: =RC[-46] -> 0 | CC41: =RC[-46] -> 810000 | CD41: =RC[-46] -> 0 | CE41: =RC[-46] -> 0 | CF41: =RC[-46] -> 0 | CG41: =RC[-46] -> 0 | CH41: =RC[-46] -> 0 | CI41: =RC[-46] -> 0 | CJ41: =RC[-46] -> 0 | CK41: =RC[-46] -> 0 | CL41: =RC[-46] -> 1 | CM41: =RC[-46] -> 0 | CN41: =RC[-46] -> 0 | CO41: =RC[-46] -> 801900 | CP41: =RC[-46] -> 0 | CQ41: =RC[-46] -> 0 | CR41: =RC[-46] -> 0 | CS41: =RC[-46] -> 0
A42: Đội phục vụ hành khách đi (HGS) | F42: =SUM(R[-3]C:R[-1]C) -> 2430000 | G42: =SUM(R[-3]C:R[-1]C) -> 0 | H42: =SUM(R[-3]C:R[-1]C) -> 0 | I42: =SUM(R[-3]C:R[-1]C) -> 0 | J42: =SUM(R[-3]C:R[-1]C) -> 0 | K42: =SUM(R[-3]C:R[-1]C) -> 0 | L42: =SUM(R[-3]C:R[-1]C) -> 0 | M42: =SUM(R[-3]C:R[-1]C) -> 0 | N42: =SUM(R[-3]C:R[-1]C) -> 0 | O42: =SUM(R[-3]C:R[-1]C) -> 0 | P42: =SUM(R[-3]C:R[-1]C) -> 0 | Q42: =SUM(R[-3]C:R[-1]C) -> 2430000 | R42: =SUM(R[-3]C:R[-1]C) -> 0 | S42: =SUM(R[-3]C:R[-1]C) -> 0 | T42: =SUM(R[-3]C:R[-1]C) -> 0 | U42: =SUM(R[-3]C:R[-1]C) -> 24300 | V42: =SUM(R[-3]C:R[-1]C) -> 0 | W42: =SUM(R[-3]C:R[-1]C) -> 2405700 | X42: =SUM(R[-3]C:R[-1]C) -> 0 | Y42: =SUM(R[-3]C:R[-1]C) -> 0 | Z42: =SUM(R[-3]C:R[-1]C) -> 0 | AA42: =SUM(R[-3]C:R[-1]C) -> 0 | AB42: =SUM(R[-3]C:R[-1]C) -> 0 | AC42: =SUM(R[-3]C:R[-1]C) -> 0 | AD42: =SUM(R[-3]C:R[-1]C) -> 0 | AE42: =SUM(R[-3]C:R[-1]C) -> 0 | AF42: =SUM(R[-3]C:R[-1]C) -> 0 | AG42: =SUM(R[-3]C:R[-1]C) -> 0 | AH42: =SUM(R[-3]C:R[-1]C) -> 0 | AI42: =SUM(R[-3]C:R[-1]C) -> 2430000 | AJ42: =SUM(R[-3]C:R[-1]C) -> 0 | AK42: =SUM(R[-3]C:R[-1]C) -> 0 | AL42: =SUM(R[-3]C:R[-1]C) -> 0 | AM42: =SUM(R[-3]C:R[-1]C) -> 0 | AN42: =SUM(R[-3]C:R[-1]C) -> 0 | AO42: =SUM(R[-3]C:R[-1]C) -> 0 | AP42: =SUM(R[-3]C:R[-1]C) -> 0 | AQ42: =SUM(R[-3]C:R[-1]C) -> 0 | AR42: =SUM(R[-3]C:R[-1]C) -> 3 | AS42: =SUM(R[-3]C:R[-1]C) -> 0 | AT42: =SUM(R[-3]C:R[-1]C) -> 0 | AU42: =SUM(R[-3]C:R[-1]C) -> 2405700 | AV42: =SUM(R[-3]C:R[-1]C) -> 0 | AW42: =SUM(R[-3]C:R[-1]C) -> 0 | AX42: =SUM(R[-3]C:R[-1]C) -> 0 | AY42: =SUM(R[-3]C:R[-1]C) -> 0
A43: Phòng Phục vụ hành khách (HGS) | F43: =SUM(R[-22]C[46]:R[-1]C[46]) -> 14580000 | G43: =SUM(R[-22]C[46]:R[-1]C[46]) -> 0 | H43: =SUM(R[-22]C[46]:R[-1]C[46]) -> 0 | I43: =SUM(R[-22]C[46]:R[-1]C[46]) -> 0 | J43: =SUM(R[-22]C[46]:R[-1]C[46]) -> 0 | K43: =SUM(R[-22]C[46]:R[-1]C[46]) -> 0 | L43: =SUM(R[-22]C[46]:R[-1]C[46]) -> 0 | M43: =SUM(R[-22]C[46]:R[-1]C[46]) -> 0 | N43: =SUM(R[-22]C[46]:R[-1]C[46]) -> 0 | O43: =SUM(R[-22]C[46]:R[-1]C[46]) -> 0 | P43: =SUM(R[-22]C[46]:R[-1]C[46]) -> 0 | Q43: =SUM(R[-22]C[46]:R[-1]C[46]) -> 14580000 | R43: =SUM(R[-22]C[46]:R[-1]C[46]) -> 0 | S43: =SUM(R[-22]C[46]:R[-1]C[46]) -> 0 | T43: =SUM(R[-22]C[46]:R[-1]C[46]) -> 0 | U43: =SUM(R[-22]C[46]:R[-1]C[46]) -> 145800 | V43: =SUM(R[-22]C[46]:R[-1]C[46]) -> 0 | W43: =SUM(R[-22]C[46]:R[-1]C[46]) -> 14434200 | X43: =SUM(R[-22]C[46]:R[-1]C[46]) -> 0 | Y43: =SUM(R[-22]C[46]:R[-1]C[46]) -> 0 | Z43: =SUM(R[-22]C[46]:R[-1]C[46]) -> 0 | AA43: =SUM(R[-22]C[46]:R[-1]C[46]) -> 0 | AB43: =SUM(R[-22]C[46]:R[-1]C[46]) -> 0 | AC43: =SUM(R[-22]C[46]:R[-1]C[46]) -> 0 | AD43: =SUM(R[-22]C[46]:R[-1]C[46]) -> 0 | AE43: =SUM(R[-22]C[46]:R[-1]C[46]) -> 0 | AF43: =SUM(R[-22]C[46]:R[-1]C[46]) -> 0 | AG43: =SUM(R[-22]C[46]:R[-1]C[46]) -> 0 | AH43: =SUM(R[-22]C[46]:R[-1]C[46]) -> 0 | AI43: =SUM(R[-22]C[46]:R[-1]C[46]) -> 14580000 | AJ43: =SUM(R[-22]C[46]:R[-1]C[46]) -> 0 | AK43: =SUM(R[-22]C[46]:R[-1]C[46]) -> 0 | AL43: =SUM(R[-22]C[46]:R[-1]C[46]) -> 0 | AM43: =SUM(R[-22]C[46]:R[-1]C[46]) -> 0 | AN43: =SUM(R[-22]C[46]:R[-1]C[46]) -> 0 | AO43: =SUM(R[-22]C[46]:R[-1]C[46]) -> 0 | AP43: =SUM(R[-22]C[46]:R[-1]C[46]) -> 0 | AQ43: =SUM(R[-22]C[46]:R[-1]C[46]) -> 0 | AR43: =SUM(R[-22]C[46]:R[-1]C[46]) -> 18 | AS43: =SUM(R[-22]C[46]:R[-1]C[46]) -> 0 | AT43: =SUM(R[-22]C[46]:R[-1]C[46]) -> 0 | AU43: =SUM(R[-22]C[46]:R[-1]C[46]) -> 14434200 | AV43: =SUM(R[-22]C[46]:R[-1]C[46]) -> 0 | AW43: =SUM(R[-22]C[46]:R[-1]C[46]) -> 0 | AX43: =SUM(R[-22]C[46]:R[-1]C[46]) -> 0 | AY43: =SUM(R[-22]C[46]:R[-1]C[46]) -> 0
A44: Phòng Phục vụ kỹ thuật sân đỗ (HGS) | F44: =R[32]C -> 23490000 | G44: =R[32]C -> 0 | H44: =R[32]C -> 0 | I44: =R[32]C -> 0 | J44: =R[32]C -> 0 | K44: =R[32]C -> 0 | L44: =R[32]C -> 0 | M44: =R[32]C -> 0 | N44: =R[32]C -> 0 | O44: =R[32]C -> 0 | P44: =R[32]C -> 0 | Q44: =R[32]C -> 23490000 | R44: =R[32]C -> 0 | S44: =R[32]C -> 0 | T44: =R[32]C -> 0 | U44: =R[32]C -> 234900 | V44: =R[32]C -> 0 | W44: =R[32]C -> 23255100 | X44: =R[32]C -> 0 | Y44: =R[32]C -> 0 | Z44: =R[32]C -> 0 | AA44: =R[32]C -> 0 | AB44: =R[32]C -> 0 | AC44: =R[32]C -> 0 | AD44: =R[32]C -> 0 | AE44: =R[32]C -> 0 | AF44: =R[32]C -> 0 | AG44: =R[32]C -> 0 | AH44: =R[32]C -> 0 | AI44: =R[32]C -> 23490000 | AJ44: =R[32]C -> 0 | AK44: =R[32]C -> 0 | AL44: =R[32]C -> 0 | AM44: =R[32]C -> 0 | AN44: =R[32]C -> 0 | AO44: =R[32]C -> 0 | AP44: =R[32]C -> 0 | AQ44: =R[32]C -> 0 | AR44: =R[32]C -> 29 | AS44: =R[32]C -> 0 | AT44: =R[32]C -> 0 | AU44: =R[32]C -> 23255100 | AW44: =R[32]C -> 0 | AX44: =R[32]C -> 0 | AY44: =R[32]C -> 0
A45: Đội phục vụ hành lý hàng hóa (HGS) | F45: =R[30]C -> 23490000 | G45: =R[30]C -> 0 | H45: =R[30]C -> 0 | I45: =R[30]C -> 0 | J45: =R[30]C -> 0 | K45: =R[30]C -> 0 | L45: =R[30]C -> 0 | M45: =R[30]C -> 0 | N45: =R[30]C -> 0 | O45: =R[30]C -> 0 | P45: =R[30]C -> 0 | Q45: =R[30]C -> 23490000 | R45: =R[30]C -> 0 | S45: =R[30]C -> 0 | T45: =R[30]C -> 0 | U45: =R[30]C -> 234900 | V45: =R[30]C -> 0 | W45: =R[30]C -> 23255100 | X45: =R[30]C -> 0 | Y45: =R[30]C -> 0 | Z45: =R[30]C -> 0 | AA45: =R[30]C -> 0 | AB45: =R[30]C -> 0 | AC45: =R[30]C -> 0 | AD45: =R[30]C -> 0 | AE45: =R[30]C -> 0 | AF45: =R[30]C -> 0 | AG45: =R[30]C -> 0 | AH45: =R[30]C -> 0 | AI45: =R[30]C -> 23490000 | AJ45: =R[30]C -> 0 | AK45: =R[30]C -> 0 | AL45: =R[30]C -> 0 | AM45: =R[30]C -> 0 | AN45: =R[30]C -> 0 | AO45: =R[30]C -> 0 | AP45: =R[30]C -> 0 | AQ45: =R[30]C -> 0 | AR45: =R[30]C -> 29 | AS45: =R[30]C -> 0 | AT45: =R[30]C -> 0 | AU45: =R[30]C -> 23255100 | AW45: =R[30]C -> 0 | AX45: =R[30]C -> 0 | AY45: =R[30]C -> 0
A46: 1 | B46: 013424 | C46: Bùi Tuấn Anh | D46: Nhân viên Bốc xếp | F46: =RC[29]+RC[30]+RC[31]+RC[32]+RC[33]+RC[34]+RC[35]+RC[36]+RC[37] -> 810000 | G46: =RC[17]+RC[18]++RC[19]+RC[20]+RC[21]+RC[38]+RC[39]+RC[41] -> 0 | H46: 0 | I46: 0 | J46: =RC[-2]+RC[-1] -> 0 | K46: 0 | L46: 0 | M46: 0 | N46: =RC[15]+RC[16]+RC[17]+RC[18]+RC[19]+RC[20] -> 0 | O46: 0 | P46: 0 | Q46: 810000 | R46: 0 | S46: 0 | T46: 0 | U46: 8100 | V46: 0 | W46: 801900 | X46: 0 | Y46: 0 | Z46: 0 | AA46: 0 | AB46: 0 | AC46: 0 | AD46: 0 | AE46: 0 | AF46: 0 | AG46: 0 | AH46: 0 | AI46: 810000 | AJ46: 0 | AK46: 0 | AL46: 0 | AM46: 0 | AN46: 0 | AO46: 0 | AP46: 0 | AQ46: 0 | AR46: =1 -> 1 | AS46: 0 | AT46: 0 | AU46: =RC[-30]-RC[-29]-RC[-28]-RC[-27]-RC[-26]-RC[-25] -> 801900 | AV46: 0 | AW46: =RC[1]-RC[2] -> 0 | AX46: 0 | AY46: 0 | AZ46: =RC[-46] -> 810000 | BA46: =RC[-46] -> 0 | BB46: =RC[-46] -> 0 | BC46: =RC[-46] -> 0 | BD46: =RC[-46] -> 0 | BE46: =RC[-46] -> 0 | BF46: =RC[-46] -> 0 | BG46: =RC[-46] -> 0 | BH46: =RC[-46] -> 0 | BI46: =RC[-46] -> 0 | BJ46: =RC[-46] -> 0 | BK46: =RC[-46] -> 810000 | BL46: =RC[-46] -> 0 | BM46: =RC[-46] -> 0 | BN46: =RC[-46] -> 0 | BO46: =RC[-46] -> 8100 | BP46: =RC[-46] -> 0 | BQ46: =RC[-46] -> 801900 | BR46: =RC[-46] -> 0 | BS46: =RC[-46] -> 0 | BT46: =RC[-46] -> 0 | BU46: =RC[-46] -> 0 | BV46: =RC[-46] -> 0 | BW46: =RC[-46] -> 0 | BX46: =RC[-46] -> 0 | BY46: =RC[-46] -> 0 | BZ46: =RC[-46] -> 0 | CA46: =RC[-46] -> 0 | CB46: =RC[-46] -> 0 | CC46: =RC[-46] -> 810000 | CD46: =RC[-46] -> 0 | CE46: =RC[-46] -> 0 | CF46: =RC[-46] -> 0 | CG46: =RC[-46] -> 0 | CH46: =RC[-46] -> 0 | CI46: =RC[-46] -> 0 | CJ46: =RC[-46] -> 0 | CK46: =RC[-46] -> 0 | CL46: =RC[-46] -> 1 | CM46: =RC[-46] -> 0 | CN46: =RC[-46] -> 0 | CO46: =RC[-46] -> 801900 | CP46: =RC[-46] -> 0 | CQ46: =RC[-46] -> 0 | CR46: =RC[-46] -> 0 | CS46: =RC[-46] -> 0
A47: 2 | B47: 013425 | C47: Nguyễn Duy Trinh | D47: Nhân viên Bốc xếp | F47: =RC[29]+RC[30]+RC[31]+RC[32]+RC[33]+RC[34]+RC[35]+RC[36]+RC[37] -> 810000 | G47: =RC[17]+RC[18]++RC[19]+RC[20]+RC[21]+RC[38]+RC[39]+RC[41] -> 0 | H47: 0 | I47: 0 | J47: =RC[-2]+RC[-1] -> 0 | K47: 0 | L47: 0 | M47: 0 | N47: =RC[15]+RC[16]+RC[17]+RC[18]+RC[19]+RC[20] -> 0 | O47: 0 | P47: 0 | Q47: 810000 | R47: 0 | S47: 0 | T47: 0 | U47: 8100 | V47: 0 | W47: 801900 | X47: 0 | Y47: 0 | Z47: 0 | AA47: 0 | AB47: 0 | AC47: 0 | AD47: 0 | AE47: 0 | AF47: 0 | AG47: 0 | AH47: 0 | AI47: 810000 | AJ47: 0 | AK47: 0 | AL47: 0 | AM47: 0 | AN47: 0 | AO47: 0 | AP47: 0 | AQ47: 0 | AR47: =1 -> 1 | AS47: 0 | AT47: 0 | AU47: =RC[-30]-RC[-29]-RC[-28]-RC[-27]-RC[-26]-RC[-25] -> 801900 | AV47: 0 | AW47: =RC[1]-RC[2] -> 0 | AX47: 0 | AY47: 0 | AZ47: =RC[-46] -> 810000 | BA47: =RC[-46] -> 0 | BB47: =RC[-46] -> 0 | BC47: =RC[-46] -> 0 | BD47: =RC[-46] -> 0 | BE47: =RC[-46] -> 0 | BF47: =RC[-46] -> 0 | BG47: =RC[-46] -> 0 | BH47: =RC[-46] -> 0 | BI47: =RC[-46] -> 0 | BJ47: =RC[-46] -> 0 | BK47: =RC[-46] -> 810000 | BL47: =RC[-46] -> 0 | BM47: =RC[-46] -> 0 | BN47: =RC[-46] -> 0 | BO47: =RC[-46] -> 8100 | BP47: =RC[-46] -> 0 | BQ47: =RC[-46] -> 801900 | BR47: =RC[-46] -> 0 | BS47: =RC[-46] -> 0 | BT47: =RC[-46] -> 0 | BU47: =RC[-46] -> 0 | BV47: =RC[-46] -> 0 | BW47: =RC[-46] -> 0 | BX47: =RC[-46] -> 0 | BY47: =RC[-46] -> 0 | BZ47: =RC[-46] -> 0 | CA47: =RC[-46] -> 0 | CB47: =RC[-46] -> 0 | CC47: =RC[-46] -> 810000 | CD47: =RC[-46] -> 0 | CE47: =RC[-46] -> 0 | CF47: =RC[-46] -> 0 | CG47: =RC[-46] -> 0 | CH47: =RC[-46] -> 0 | CI47: =RC[-46] -> 0 | CJ47: =RC[-46] -> 0 | CK47: =RC[-46] -> 0 | CL47: =RC[-46] -> 1 | CM47: =RC[-46] -> 0 | CN47: =RC[-46] -> 0 | CO47: =RC[-46] -> 801900 | CP47: =RC[-46] -> 0 | CQ47: =RC[-46] -> 0 | CR47: =RC[-46] -> 0 | CS47: =RC[-46] -> 0
A48: 3 | B48: 013436 | C48: Lê Văn Thư | D48: Nhân viên Bốc xếp | F48: =RC[29]+RC[30]+RC[31]+RC[32]+RC[33]+RC[34]+RC[35]+RC[36]+RC[37] -> 810000 | G48: =RC[17]+RC[18]++RC[19]+RC[20]+RC[21]+RC[38]+RC[39]+RC[41] -> 0 | H48: 0 | I48: 0 | J48: =RC[-2]+RC[-1] -> 0 | K48: 0 | L48: 0 | M48: 0 | N48: =RC[15]+RC[16]+RC[17]+RC[18]+RC[19]+RC[20] -> 0 | O48: 0 | P48: 0 | Q48: 810000 | R48: 0 | S48: 0 | T48: 0 | U48: 8100 | V48: 0 | W48: 801900 | X48: 0 | Y48: 0 | Z48: 0 | AA48: 0 | AB48: 0 | AC48: 0 | AD48: 0 | AE48: 0 | AF48: 0 | AG48: 0 | AH48: 0 | AI48: 810000 | AJ48: 0 | AK48: 0 | AL48: 0 | AM48: 0 | AN48: 0 | AO48: 0 | AP48: 0 | AQ48: 0 | AR48: =1 -> 1 | AS48: 0 | AT48: 0 | AU48: =RC[-30]-RC[-29]-RC[-28]-RC[-27]-RC[-26]-RC[-25] -> 801900 | AV48: 0 | AW48: =RC[1]-RC[2] -> 0 | AX48: 0 | AY48: 0 | AZ48: =RC[-46] -> 810000 | BA48: =RC[-46] -> 0 | BB48: =RC[-46] -> 0 | BC48: =RC[-46] -> 0 | BD48: =RC[-46] -> 0 | BE48: =RC[-46] -> 0 | BF48: =RC[-46] -> 0 | BG48: =RC[-46] -> 0 | BH48: =RC[-46] -> 0 | BI48: =RC[-46] -> 0 | BJ48: =RC[-46] -> 0 | BK48: =RC[-46] -> 810000 | BL48: =RC[-46] -> 0 | BM48: =RC[-46] -> 0 | BN48: =RC[-46] -> 0 | BO48: =RC[-46] -> 8100 | BP48: =RC[-46] -> 0 | BQ48: =RC[-46] -> 801900 | BR48: =RC[-46] -> 0 | BS48: =RC[-46] -> 0 | BT48: =RC[-46] -> 0 | BU48: =RC[-46] -> 0 | BV48: =RC[-46] -> 0 | BW48: =RC[-46] -> 0 | BX48: =RC[-46] -> 0 | BY48: =RC[-46] -> 0 | BZ48: =RC[-46] -> 0 | CA48: =RC[-46] -> 0 | CB48: =RC[-46] -> 0 | CC48: =RC[-46] -> 810000 | CD48: =RC[-46] -> 0 | CE48: =RC[-46] -> 0 | CF48: =RC[-46] -> 0 | CG48: =RC[-46] -> 0 | CH48: =RC[-46] -> 0 | CI48: =RC[-46] -> 0 | CJ48: =RC[-46] -> 0 | CK48: =RC[-46] -> 0 | CL48: =RC[-46] -> 1 | CM48: =RC[-46] -> 0 | CN48: =RC[-46] -> 0 | CO48: =RC[-46] -> 801900 | CP48: =RC[-46] -> 0 | CQ48: =RC[-46] -> 0 | CR48: =RC[-46] -> 0 | CS48: =RC[-46] -> 0
A49: 4 | B49: 013437 | C49: Phạm Ngọc Huấn | D49: Nhân viên Bốc xếp | F49: =RC[29]+RC[30]+RC[31]+RC[32]+RC[33]+RC[34]+RC[35]+RC[36]+RC[37] -> 810000 | G49: =RC[17]+RC[18]++RC[19]+RC[20]+RC[21]+RC[38]+RC[39]+RC[41] -> 0 | H49: 0 | I49: 0 | J49: =RC[-2]+RC[-1] -> 0 | K49: 0 | L49: 0 | M49: 0 | N49: =RC[15]+RC[16]+RC[17]+RC[18]+RC[19]+RC[20] -> 0 | O49: 0 | P49: 0 | Q49: 810000 | R49: 0 | S49: 0 | T49: 0 | U49: 8100 | V49: 0 | W49: 801900 | X49: 0 | Y49: 0 | Z49: 0 | AA49: 0 | AB49: 0 | AC49: 0 | AD49: 0 | AE49: 0 | AF49: 0 | AG49: 0 | AH49: 0 | AI49: 810000 | AJ49: 0 | AK49: 0 | AL49: 0 | AM49: 0 | AN49: 0 | AO49: 0 | AP49: 0 | AQ49: 0 | AR49: =1 -> 1 | AS49: 0 | AT49: 0 | AU49: =RC[-30]-RC[-29]-RC[-28]-RC[-27]-RC[-26]-RC[-25] -> 801900 | AV49: 0 | AW49: =RC[1]-RC[2] -> 0 | AX49: 0 | AY49: 0 | AZ49: =RC[-46] -> 810000 | BA49: =RC[-46] -> 0 | BB49: =RC[-46] -> 0 | BC49: =RC[-46] -> 0 | BD49: =RC[-46] -> 0 | BE49: =RC[-46] -> 0 | BF49: =RC[-46] -> 0 | BG49: =RC[-46] -> 0 | BH49: =RC[-46] -> 0 | BI49: =RC[-46] -> 0 | BJ49: =RC[-46] -> 0 | BK49: =RC[-46] -> 810000 | BL49: =RC[-46] -> 0 | BM49: =RC[-46] -> 0 | BN49: =RC[-46] -> 0 | BO49: =RC[-46] -> 8100 | BP49: =RC[-46] -> 0 | BQ49: =RC[-46] -> 801900 | BR49: =RC[-46] -> 0 | BS49: =RC[-46] -> 0 | BT49: =RC[-46] -> 0 | BU49: =RC[-46] -> 0 | BV49: =RC[-46] -> 0 | BW49: =RC[-46] -> 0 | BX49: =RC[-46] -> 0 | BY49: =RC[-46] -> 0 | BZ49: =RC[-46] -> 0 | CA49: =RC[-46] -> 0 | CB49: =RC[-46] -> 0 | CC49: =RC[-46] -> 810000 | CD49: =RC[-46] -> 0 | CE49: =RC[-46] -> 0 | CF49: =RC[-46] -> 0 | CG49: =RC[-46] -> 0 | CH49: =RC[-46] -> 0 | CI49: =RC[-46] -> 0 | CJ49: =RC[-46] -> 0 | CK49: =RC[-46] -> 0 | CL49: =RC[-46] -> 1 | CM49: =RC[-46] -> 0 | CN49: =RC[-46] -> 0 | CO49: =RC[-46] -> 801900 | CP49: =RC[-46] -> 0 | CQ49: =RC[-46] -> 0 | CR49: =RC[-46] -> 0 | CS49: =RC[-46] -> 0
A50: 5 | B50: 013446 | C50: Dương Công Tú | D50: Nhân viên Bốc xếp | F50: =RC[29]+RC[30]+RC[31]+RC[32]+RC[33]+RC[34]+RC[35]+RC[36]+RC[37] -> 810000 | G50: =RC[17]+RC[18]++RC[19]+RC[20]+RC[21]+RC[38]+RC[39]+RC[41] -> 0 | H50: 0 | I50: 0 | J50: =RC[-2]+RC[-1] -> 0 | K50: 0 | L50: 0 | M50: 0 | N50: =RC[15]+RC[16]+RC[17]+RC[18]+RC[19]+RC[20] -> 0 | O50: 0 | P50: 0 | Q50: 810000 | R50: 0 | S50: 0 | T50: 0 | U50: 8100 | V50: 0 | W50: 801900 | X50: 0 | Y50: 0 | Z50: 0 | AA50: 0 | AB50: 0 | AC50: 0 | AD50: 0 | AE50: 0 | AF50: 0 | AG50: 0 | AH50: 0 | AI50: 810000 | AJ50: 0 | AK50: 0 | AL50: 0 | AM50: 0 | AN50: 0 | AO50: 0 | AP50: 0 | AQ50: 0 | AR50: =1 -> 1 | AS50: 0 | AT50: 0 | AU50: =RC[-30]-RC[-29]-RC[-28]-RC[-27]-RC[-26]-RC[-25] -> 801900 | AV50: 0 | AW50: =RC[1]-RC[2] -> 0 | AX50: 0 | AY50: 0 | AZ50: =RC[-46] -> 810000 | BA50: =RC[-46] -> 0 | BB50: =RC[-46] -> 0 | BC50: =RC[-46] -> 0 | BD50: =RC[-46] -> 0 | BE50: =RC[-46] -> 0 | BF50: =RC[-46] -> 0 | BG50: =RC[-46] -> 0 | BH50: =RC[-46] -> 0 | BI50: =RC[-46] -> 0 | BJ50: =RC[-46] -> 0 | BK50: =RC[-46] -> 810000 | BL50: =RC[-46] -> 0 | BM50: =RC[-46] -> 0 | BN50: =RC[-46] -> 0 | BO50: =RC[-46] -> 8100 | BP50: =RC[-46] -> 0 | BQ50: =RC[-46] -> 801900 | BR50: =RC[-46] -> 0 | BS50: =RC[-46] -> 0 | BT50: =RC[-46] -> 0 | BU50: =RC[-46] -> 0 | BV50: =RC[-46] -> 0 | BW50: =RC[-46] -> 0 | BX50: =RC[-46] -> 0 | BY50: =RC[-46] -> 0 | BZ50: =RC[-46] -> 0 | CA50: =RC[-46] -> 0 | CB50: =RC[-46] -> 0 | CC50: =RC[-46] -> 810000 | CD50: =RC[-46] -> 0 | CE50: =RC[-46] -> 0 | CF50: =RC[-46] -> 0 | CG50: =RC[-46] -> 0 | CH50: =RC[-46] -> 0 | CI50: =RC[-46] -> 0 | CJ50: =RC[-46] -> 0 | CK50: =RC[-46] -> 0 | CL50: =RC[-46] -> 1 | CM50: =RC[-46] -> 0 | CN50: =RC[-46] -> 0 | CO50: =RC[-46] -> 801900 | CP50: =RC[-46] -> 0 | CQ50: =RC[-46] -> 0 | CR50: =RC[-46] -> 0 | CS50: =RC[-46] -> 0
A51: 6 | B51: 013448 | C51: Nguyễn Hùng Anh | D51: Nhân viên Bốc xếp | F51: =RC[29]+RC[30]+RC[31]+RC[32]+RC[33]+RC[34]+RC[35]+RC[36]+RC[37] -> 810000 | G51: =RC[17]+RC[18]++RC[19]+RC[20]+RC[21]+RC[38]+RC[39]+RC[41] -> 0 | H51: 0 | I51: 0 | J51: =RC[-2]+RC[-1] -> 0 | K51: 0 | L51: 0 | M51: 0 | N51: =RC[15]+RC[16]+RC[17]+RC[18]+RC[19]+RC[20] -> 0 | O51: 0 | P51: 0 | Q51: 810000 | R51: 0 | S51: 0 | T51: 0 | U51: 8100 | V51: 0 | W51: 801900 | X51: 0 | Y51: 0 | Z51: 0 | AA51: 0 | AB51: 0 | AC51: 0 | AD51: 0 | AE51: 0 | AF51: 0 | AG51: 0 | AH51: 0 | AI51: 810000 | AJ51: 0 | AK51: 0 | AL51: 0 | AM51: 0 | AN51: 0 | AO51: 0 | AP51: 0 | AQ51: 0 | AR51: =1 -> 1 | AS51: 0 | AT51: 0 | AU51: =RC[-30]-RC[-29]-RC[-28]-RC[-27]-RC[-26]-RC[-25] -> 801900 | AV51: 0 | AW51: =RC[1]-RC[2] -> 0 | AX51: 0 | AY51: 0 | AZ51: =RC[-46] -> 810000 | BA51: =RC[-46] -> 0 | BB51: =RC[-46] -> 0 | BC51: =RC[-46] -> 0 | BD51: =RC[-46] -> 0 | BE51: =RC[-46] -> 0 | BF51: =RC[-46] -> 0 | BG51: =RC[-46] -> 0 | BH51: =RC[-46] -> 0 | BI51: =RC[-46] -> 0 | BJ51: =RC[-46] -> 0 | BK51: =RC[-46] -> 810000 | BL51: =RC[-46] -> 0 | BM51: =RC[-46] -> 0 | BN51: =RC[-46] -> 0 | BO51: =RC[-46] -> 8100 | BP51: =RC[-46] -> 0 | BQ51: =RC[-46] -> 801900 | BR51: =RC[-46] -> 0 | BS51: =RC[-46] -> 0 | BT51: =RC[-46] -> 0 | BU51: =RC[-46] -> 0 | BV51: =RC[-46] -> 0 | BW51: =RC[-46] -> 0 | BX51: =RC[-46] -> 0 | BY51: =RC[-46] -> 0 | BZ51: =RC[-46] -> 0 | CA51: =RC[-46] -> 0 | CB51: =RC[-46] -> 0 | CC51: =RC[-46] -> 810000 | CD51: =RC[-46] -> 0 | CE51: =RC[-46] -> 0 | CF51: =RC[-46] -> 0 | CG51: =RC[-46] -> 0 | CH51: =RC[-46] -> 0 | CI51: =RC[-46] -> 0 | CJ51: =RC[-46] -> 0 | CK51: =RC[-46] -> 0 | CL51: =RC[-46] -> 1 | CM51: =RC[-46] -> 0 | CN51: =RC[-46] -> 0 | CO51: =RC[-46] -> 801900 | CP51: =RC[-46] -> 0 | CQ51: =RC[-46] -> 0 | CR51: =RC[-46] -> 0 | CS51: =RC[-46] -> 0
A52: 7 | B52: 013450 | C52: Phạm Văn Mạnh | D52: Nhân viên Bốc xếp | F52: =RC[29]+RC[30]+RC[31]+RC[32]+RC[33]+RC[34]+RC[35]+RC[36]+RC[37] -> 810000 | G52: =RC[17]+RC[18]++RC[19]+RC[20]+RC[21]+RC[38]+RC[39]+RC[41] -> 0 | H52: 0 | I52: 0 | J52: =RC[-2]+RC[-1] -> 0 | K52: 0 | L52: 0 | M52: 0 | N52: =RC[15]+RC[16]+RC[17]+RC[18]+RC[19]+RC[20] -> 0 | O52: 0 | P52: 0 | Q52: 810000 | R52: 0 | S52: 0 | T52: 0 | U52: 8100 | V52: 0 | W52: 801900 | X52: 0 | Y52: 0 | Z52: 0 | AA52: 0 | AB52: 0 | AC52: 0 | AD52: 0 | AE52: 0 | AF52: 0 | AG52: 0 | AH52: 0 | AI52: 810000 | AJ52: 0 | AK52: 0 | AL52: 0 | AM52: 0 | AN52: 0 | AO52: 0 | AP52: 0 | AQ52: 0 | AR52: =1 -> 1 | AS52: 0 | AT52: 0 | AU52: =RC[-30]-RC[-29]-RC[-28]-RC[-27]-RC[-26]-RC[-25] -> 801900 | AV52: 0 | AW52: =RC[1]-RC[2] -> 0 | AX52: 0 | AY52: 0 | AZ52: =RC[-46] -> 810000 | BA52: =RC[-46] -> 0 | BB52: =RC[-46] -> 0 | BC52: =RC[-46] -> 0 | BD52: =RC[-46] -> 0 | BE52: =RC[-46] -> 0 | BF52: =RC[-46] -> 0 | BG52: =RC[-46] -> 0 | BH52: =RC[-46] -> 0 | BI52: =RC[-46] -> 0 | BJ52: =RC[-46] -> 0 | BK52: =RC[-46] -> 810000 | BL52: =RC[-46] -> 0 | BM52: =RC[-46] -> 0 | BN52: =RC[-46] -> 0 | BO52: =RC[-46] -> 8100 | BP52: =RC[-46] -> 0 | BQ52: =RC[-46] -> 801900 | BR52: =RC[-46] -> 0 | BS52: =RC[-46] -> 0 | BT52: =RC[-46] -> 0 | BU52: =RC[-46] -> 0 | BV52: =RC[-46] -> 0 | BW52: =RC[-46] -> 0 | BX52: =RC[-46] -> 0 | BY52: =RC[-46] -> 0 | BZ52: =RC[-46] -> 0 | CA52: =RC[-46] -> 0 | CB52: =RC[-46] -> 0 | CC52: =RC[-46] -> 810000 | CD52: =RC[-46] -> 0 | CE52: =RC[-46] -> 0 | CF52: =RC[-46] -> 0 | CG52: =RC[-46] -> 0 | CH52: =RC[-46] -> 0 | CI52: =RC[-46] -> 0 | CJ52: =RC[-46] -> 0 | CK52: =RC[-46] -> 0 | CL52: =RC[-46] -> 1 | CM52: =RC[-46] -> 0 | CN52: =RC[-46] -> 0 | CO52: =RC[-46] -> 801900 | CP52: =RC[-46] -> 0 | CQ52: =RC[-46] -> 0 | CR52: =RC[-46] -> 0 | CS52: =RC[-46] -> 0
A53: 8 | B53: 013451 | C53: Vũ Minh Tiến | D53: Nhân viên Bốc xếp | F53: =RC[29]+RC[30]+RC[31]+RC[32]+RC[33]+RC[34]+RC[35]+RC[36]+RC[37] -> 810000 | G53: =RC[17]+RC[18]++RC[19]+RC[20]+RC[21]+RC[38]+RC[39]+RC[41] -> 0 | H53: 0 | I53: 0 | J53: =RC[-2]+RC[-1] -> 0 | K53: 0 | L53: 0 | M53: 0 | N53: =RC[15]+RC[16]+RC[17]+RC[18]+RC[19]+RC[20] -> 0 | O53: 0 | P53: 0 | Q53: 810000 | R53: 0 | S53: 0 | T53: 0 | U53: 8100 | V53: 0 | W53: 801900 | X53: 0 | Y53: 0 | Z53: 0 | AA53: 0 | AB53: 0 | AC53: 0 | AD53: 0 | AE53: 0 | AF53: 0 | AG53: 0 | AH53: 0 | AI53: 810000 | AJ53: 0 | AK53: 0 | AL53: 0 | AM53: 0 | AN53: 0 | AO53: 0 | AP53: 0 | AQ53: 0 | AR53: =1 -> 1 | AS53: 0 | AT53: 0 | AU53: =RC[-30]-RC[-29]-RC[-28]-RC[-27]-RC[-26]-RC[-25] -> 801900 | AV53: 0 | AW53: =RC[1]-RC[2] -> 0 | AX53: 0 | AY53: 0 | AZ53: =RC[-46] -> 810000 | BA53: =RC[-46] -> 0 | BB53: =RC[-46] -> 0 | BC53: =RC[-46] -> 0 | BD53: =RC[-46] -> 0 | BE53: =RC[-46] -> 0 | BF53: =RC[-46] -> 0 | BG53: =RC[-46] -> 0 | BH53: =RC[-46] -> 0 | BI53: =RC[-46] -> 0 | BJ53: =RC[-46] -> 0 | BK53: =RC[-46] -> 810000 | BL53: =RC[-46] -> 0 | BM53: =RC[-46] -> 0 | BN53: =RC[-46] -> 0 | BO53: =RC[-46] -> 8100 | BP53: =RC[-46] -> 0 | BQ53: =RC[-46] -> 801900 | BR53: =RC[-46] -> 0 | BS53: =RC[-46] -> 0 | BT53: =RC[-46] -> 0 | BU53: =RC[-46] -> 0 | BV53: =RC[-46] -> 0 | BW53: =RC[-46] -> 0 | BX53: =RC[-46] -> 0 | BY53: =RC[-46] -> 0 | BZ53: =RC[-46] -> 0 | CA53: =RC[-46] -> 0 | CB53: =RC[-46] -> 0 | CC53: =RC[-46] -> 810000 | CD53: =RC[-46] -> 0 | CE53: =RC[-46] -> 0 | CF53: =RC[-46] -> 0 | CG53: =RC[-46] -> 0 | CH53: =RC[-46] -> 0 | CI53: =RC[-46] -> 0 | CJ53: =RC[-46] -> 0 | CK53: =RC[-46] -> 0 | CL53: =RC[-46] -> 1 | CM53: =RC[-46] -> 0 | CN53: =RC[-46] -> 0 | CO53: =RC[-46] -> 801900 | CP53: =RC[-46] -> 0 | CQ53: =RC[-46] -> 0 | CR53: =RC[-46] -> 0 | CS53: =RC[-46] -> 0
A54: 9 | B54: 013453 | C54: Nguyễn Văn Khiêm | D54: Nhân viên Bốc xếp | F54: =RC[29]+RC[30]+RC[31]+RC[32]+RC[33]+RC[34]+RC[35]+RC[36]+RC[37] -> 810000 | G54: =RC[17]+RC[18]++RC[19]+RC[20]+RC[21]+RC[38]+RC[39]+RC[41] -> 0 | H54: 0 | I54: 0 | J54: =RC[-2]+RC[-1] -> 0 | K54: 0 | L54: 0 | M54: 0 | N54: =RC[15]+RC[16]+RC[17]+RC[18]+RC[19]+RC[20] -> 0 | O54: 0 | P54: 0 | Q54: 810000 | R54: 0 | S54: 0 | T54: 0 | U54: 8100 | V54: 0 | W54: 801900 | X54: 0 | Y54: 0 | Z54: 0 | AA54: 0 | AB54: 0 | AC54: 0 | AD54: 0 | AE54: 0 | AF54: 0 | AG54: 0 | AH54: 0 | AI54: 810000 | AJ54: 0 | AK54: 0 | AL54: 0 | AM54: 0 | AN54: 0 | AO54: 0 | AP54: 0 | AQ54: 0 | AR54: =1 -> 1 | AS54: 0 | AT54: 0 | AU54: =RC[-30]-RC[-29]-RC[-28]-RC[-27]-RC[-26]-RC[-25] -> 801900 | AV54: 0 | AW54: =RC[1]-RC[2] -> 0 | AX54: 0 | AY54: 0 | AZ54: =RC[-46] -> 810000 | BA54: =RC[-46] -> 0 | BB54: =RC[-46] -> 0 | BC54: =RC[-46] -> 0 | BD54: =RC[-46] -> 0 | BE54: =RC[-46] -> 0 | BF54: =RC[-46] -> 0 | BG54: =RC[-46] -> 0 | BH54: =RC[-46] -> 0 | BI54: =RC[-46] -> 0 | BJ54: =RC[-46] -> 0 | BK54: =RC[-46] -> 810000 | BL54: =RC[-46] -> 0 | BM54: =RC[-46] -> 0 | BN54: =RC[-46] -> 0 | BO54: =RC[-46] -> 8100 | BP54: =RC[-46] -> 0 | BQ54: =RC[-46] -> 801900 | BR54: =RC[-46] -> 0 | BS54: =RC[-46] -> 0 | BT54: =RC[-46] -> 0 | BU54: =RC[-46] -> 0 | BV54: =RC[-46] -> 0 | BW54: =RC[-46] -> 0 | BX54: =RC[-46] -> 0 | BY54: =RC[-46] -> 0 | BZ54: =RC[-46] -> 0 | CA54: =RC[-46] -> 0 | CB54: =RC[-46] -> 0 | CC54: =RC[-46] -> 810000 | CD54: =RC[-46] -> 0 | CE54: =RC[-46] -> 0 | CF54: =RC[-46] -> 0 | CG54: =RC[-46] -> 0 | CH54: =RC[-46] -> 0 | CI54: =RC[-46] -> 0 | CJ54: =RC[-46] -> 0 | CK54: =RC[-46] -> 0 | CL54: =RC[-46] -> 1 | CM54: =RC[-46] -> 0 | CN54: =RC[-46] -> 0 | CO54: =RC[-46] -> 801900 | CP54: =RC[-46] -> 0 | CQ54: =RC[-46] -> 0 | CR54: =RC[-46] -> 0 | CS54: =RC[-46] -> 0
A55: 10 | B55: 013454 | C55: Nguyễn Xuân Hải | D55: Nhân viên Bốc xếp | F55: =RC[29]+RC[30]+RC[31]+RC[32]+RC[33]+RC[34]+RC[35]+RC[36]+RC[37] -> 810000 | G55: =RC[17]+RC[18]++RC[19]+RC[20]+RC[21]+RC[38]+RC[39]+RC[41] -> 0 | H55: 0 | I55: 0 | J55: =RC[-2]+RC[-1] -> 0 | K55: 0 | L55: 0 | M55: 0 | N55: =RC[15]+RC[16]+RC[17]+RC[18]+RC[19]+RC[20] -> 0 | O55: 0 | P55: 0 | Q55: 810000 | R55: 0 | S55: 0 | T55: 0 | U55: 8100 | V55: 0 | W55: 801900 | X55: 0 | Y55: 0 | Z55: 0 | AA55: 0 | AB55: 0 | AC55: 0 | AD55: 0 | AE55: 0 | AF55: 0 | AG55: 0 | AH55: 0 | AI55: 810000 | AJ55: 0 | AK55: 0 | AL55: 0 | AM55: 0 | AN55: 0 | AO55: 0 | AP55: 0 | AQ55: 0 | AR55: =1 -> 1 | AS55: 0 | AT55: 0 | AU55: =RC[-30]-RC[-29]-RC[-28]-RC[-27]-RC[-26]-RC[-25] -> 801900 | AV55: 0 | AW55: =RC[1]-RC[2] -> 0 | AX55: 0 | AY55: 0 | AZ55: =RC[-46] -> 810000 | BA55: =RC[-46] -> 0 | BB55: =RC[-46] -> 0 | BC55: =RC[-46] -> 0 | BD55: =RC[-46] -> 0 | BE55: =RC[-46] -> 0 | BF55: =RC[-46] -> 0 | BG55: =RC[-46] -> 0 | BH55: =RC[-46] -> 0 | BI55: =RC[-46] -> 0 | BJ55: =RC[-46] -> 0 | BK55: =RC[-46] -> 810000 | BL55: =RC[-46] -> 0 | BM55: =RC[-46] -> 0 | BN55: =RC[-46] -> 0 | BO55: =RC[-46] -> 8100 | BP55: =RC[-46] -> 0 | BQ55: =RC[-46] -> 801900 | BR55: =RC[-46] -> 0 | BS55: =RC[-46] -> 0 | BT55: =RC[-46] -> 0 | BU55: =RC[-46] -> 0 | BV55: =RC[-46] -> 0 | BW55: =RC[-46] -> 0 | BX55: =RC[-46] -> 0 | BY55: =RC[-46] -> 0 | BZ55: =RC[-46] -> 0 | CA55: =RC[-46] -> 0 | CB55: =RC[-46] -> 0 | CC55: =RC[-46] -> 810000 | CD55: =RC[-46] -> 0 | CE55: =RC[-46] -> 0 | CF55: =RC[-46] -> 0 | CG55: =RC[-46] -> 0 | CH55: =RC[-46] -> 0 | CI55: =RC[-46] -> 0 | CJ55: =RC[-46] -> 0 | CK55: =RC[-46] -> 0 | CL55: =RC[-46] -> 1 | CM55: =RC[-46] -> 0 | CN55: =RC[-46] -> 0 | CO55: =RC[-46] -> 801900 | CP55: =RC[-46] -> 0 | CQ55: =RC[-46] -> 0 | CR55: =RC[-46] -> 0 | CS55: =RC[-46] -> 0
A56: 11 | B56: 013455 | C56: Nguyễn Như Tuấn | D56: Nhân viên Bốc xếp | F56: =RC[29]+RC[30]+RC[31]+RC[32]+RC[33]+RC[34]+RC[35]+RC[36]+RC[37] -> 810000 | G56: =RC[17]+RC[18]++RC[19]+RC[20]+RC[21]+RC[38]+RC[39]+RC[41] -> 0 | H56: 0 | I56: 0 | J56: =RC[-2]+RC[-1] -> 0 | K56: 0 | L56: 0 | M56: 0 | N56: =RC[15]+RC[16]+RC[17]+RC[18]+RC[19]+RC[20] -> 0 | O56: 0 | P56: 0 | Q56: 810000 | R56: 0 | S56: 0 | T56: 0 | U56: 8100 | V56: 0 | W56: 801900 | X56: 0 | Y56: 0 | Z56: 0 | AA56: 0 | AB56: 0 | AC56: 0 | AD56: 0 | AE56: 0 | AF56: 0 | AG56: 0 | AH56: 0 | AI56: 810000 | AJ56: 0 | AK56: 0 | AL56: 0 | AM56: 0 | AN56: 0 | AO56: 0 | AP56: 0 | AQ56: 0 | AR56: =1 -> 1 | AS56: 0 | AT56: 0 | AU56: =RC[-30]-RC[-29]-RC[-28]-RC[-27]-RC[-26]-RC[-25] -> 801900 | AV56: 0 | AW56: =RC[1]-RC[2] -> 0 | AX56: 0 | AY56: 0 | AZ56: =RC[-46] -> 810000 | BA56: =RC[-46] -> 0 | BB56: =RC[-46] -> 0 | BC56: =RC[-46] -> 0 | BD56: =RC[-46] -> 0 | BE56: =RC[-46] -> 0 | BF56: =RC[-46] -> 0 | BG56: =RC[-46] -> 0 | BH56: =RC[-46] -> 0 | BI56: =RC[-46] -> 0 | BJ56: =RC[-46] -> 0 | BK56: =RC[-46] -> 810000 | BL56: =RC[-46] -> 0 | BM56: =RC[-46] -> 0 | BN56: =RC[-46] -> 0 | BO56: =RC[-46] -> 8100 | BP56: =RC[-46] -> 0 | BQ56: =RC[-46] -> 801900 | BR56: =RC[-46] -> 0 | BS56: =RC[-46] -> 0 | BT56: =RC[-46] -> 0 | BU56: =RC[-46] -> 0 | BV56: =RC[-46] -> 0 | BW56: =RC[-46] -> 0 | BX56: =RC[-46] -> 0 | BY56: =RC[-46] -> 0 | BZ56: =RC[-46] -> 0 | CA56: =RC[-46] -> 0 | CB56: =RC[-46] -> 0 | CC56: =RC[-46] -> 810000 | CD56: =RC[-46] -> 0 | CE56: =RC[-46] -> 0 | CF56: =RC[-46] -> 0 | CG56: =RC[-46] -> 0 | CH56: =RC[-46] -> 0 | CI56: =RC[-46] -> 0 | CJ56: =RC[-46] -> 0 | CK56: =RC[-46] -> 0 | CL56: =RC[-46] -> 1 | CM56: =RC[-46] -> 0 | CN56: =RC[-46] -> 0 | CO56: =RC[-46] -> 801900 | CP56: =RC[-46] -> 0 | CQ56: =RC[-46] -> 0 | CR56: =RC[-46] -> 0 | CS56: =RC[-46] -> 0
A57: 12 | B57: 013457 | C57: Trần Thanh Tuấn | D57: Nhân viên Bốc xếp | F57: =RC[29]+RC[30]+RC[31]+RC[32]+RC[33]+RC[34]+RC[35]+RC[36]+RC[37] -> 810000 | G57: =RC[17]+RC[18]++RC[19]+RC[20]+RC[21]+RC[38]+RC[39]+RC[41] -> 0 | H57: 0 | I57: 0 | J57: =RC[-2]+RC[-1] -> 0 | K57: 0 | L57: 0 | M57: 0 | N57: =RC[15]+RC[16]+RC[17]+RC[18]+RC[19]+RC[20] -> 0 | O57: 0 | P57: 0 | Q57: 810000 | R57: 0 | S57: 0 | T57: 0 | U57: 8100 | V57: 0 | W57: 801900 | X57: 0 | Y57: 0 | Z57: 0 | AA57: 0 | AB57: 0 | AC57: 0 | AD57: 0 | AE57: 0 | AF57: 0 | AG57: 0 | AH57: 0 | AI57: 810000 | AJ57: 0 | AK57: 0 | AL57: 0 | AM57: 0 | AN57: 0 | AO57: 0 | AP57: 0 | AQ57: 0 | AR57: =1 -> 1 | AS57: 0 | AT57: 0 | AU57: =RC[-30]-RC[-29]-RC[-28]-RC[-27]-RC[-26]-RC[-25] -> 801900 | AV57: 0 | AW57: =RC[1]-RC[2] -> 0 | AX57: 0 | AY57: 0 | AZ57: =RC[-46] -> 810000 | BA57: =RC[-46] -> 0 | BB57: =RC[-46] -> 0 | BC57: =RC[-46] -> 0 | BD57: =RC[-46] -> 0 | BE57: =RC[-46] -> 0 | BF57: =RC[-46] -> 0 | BG57: =RC[-46] -> 0 | BH57: =RC[-46] -> 0 | BI57: =RC[-46] -> 0 | BJ57: =RC[-46] -> 0 | BK57: =RC[-46] -> 810000 | BL57: =RC[-46] -> 0 | BM57: =RC[-46] -> 0 | BN57: =RC[-46] -> 0 | BO57: =RC[-46] -> 8100 | BP57: =RC[-46] -> 0 | BQ57: =RC[-46] -> 801900 | BR57: =RC[-46] -> 0 | BS57: =RC[-46] -> 0 | BT57: =RC[-46] -> 0 | BU57: =RC[-46] -> 0 | BV57: =RC[-46] -> 0 | BW57: =RC[-46] -> 0 | BX57: =RC[-46] -> 0 | BY57: =RC[-46] -> 0 | BZ57: =RC[-46] -> 0 | CA57: =RC[-46] -> 0 | CB57: =RC[-46] -> 0 | CC57: =RC[-46] -> 810000 | CD57: =RC[-46] -> 0 | CE57: =RC[-46] -> 0 | CF57: =RC[-46] -> 0 | CG57: =RC[-46] -> 0 | CH57: =RC[-46] -> 0 | CI57: =RC[-46] -> 0 | CJ57: =RC[-46] -> 0 | CK57: =RC[-46] -> 0 | CL57: =RC[-46] -> 1 | CM57: =RC[-46] -> 0 | CN57: =RC[-46] -> 0 | CO57: =RC[-46] -> 801900 | CP57: =RC[-46] -> 0 | CQ57: =RC[-46] -> 0 | CR57: =RC[-46] -> 0 | CS57: =RC[-46] -> 0
A58: 13 | B58: 013458 | C58: Nguyễn Việt Hải | D58: Nhân viên Bốc xếp | F58: =RC[29]+RC[30]+RC[31]+RC[32]+RC[33]+RC[34]+RC[35]+RC[36]+RC[37] -> 810000 | G58: =RC[17]+RC[18]++RC[19]+RC[20]+RC[21]+RC[38]+RC[39]+RC[41] -> 0 | H58: 0 | I58: 0 | J58: =RC[-2]+RC[-1] -> 0 | K58: 0 | L58: 0 | M58: 0 | N58: =RC[15]+RC[16]+RC[17]+RC[18]+RC[19]+RC[20] -> 0 | O58: 0 | P58: 0 | Q58: 810000 | R58: 0 | S58: 0 | T58: 0 | U58: 8100 | V58: 0 | W58: 801900 | X58: 0 | Y58: 0 | Z58: 0 | AA58: 0 | AB58: 0 | AC58: 0 | AD58: 0 | AE58: 0 | AF58: 0 | AG58: 0 | AH58: 0 | AI58: 810000 | AJ58: 0 | AK58: 0 | AL58: 0 | AM58: 0 | AN58: 0 | AO58: 0 | AP58: 0 | AQ58: 0 | AR58: =1 -> 1 | AS58: 0 | AT58: 0 | AU58: =RC[-30]-RC[-29]-RC[-28]-RC[-27]-RC[-26]-RC[-25] -> 801900 | AV58: 0 | AW58: =RC[1]-RC[2] -> 0 | AX58: 0 | AY58: 0 | AZ58: =RC[-46] -> 810000 | BA58: =RC[-46] -> 0 | BB58: =RC[-46] -> 0 | BC58: =RC[-46] -> 0 | BD58: =RC[-46] -> 0 | BE58: =RC[-46] -> 0 | BF58: =RC[-46] -> 0 | BG58: =RC[-46] -> 0 | BH58: =RC[-46] -> 0 | BI58: =RC[-46] -> 0 | BJ58: =RC[-46] -> 0 | BK58: =RC[-46] -> 810000 | BL58: =RC[-46] -> 0 | BM58: =RC[-46] -> 0 | BN58: =RC[-46] -> 0 | BO58: =RC[-46] -> 8100 | BP58: =RC[-46] -> 0 | BQ58: =RC[-46] -> 801900 | BR58: =RC[-46] -> 0 | BS58: =RC[-46] -> 0 | BT58: =RC[-46] -> 0 | BU58: =RC[-46] -> 0 | BV58: =RC[-46] -> 0 | BW58: =RC[-46] -> 0 | BX58: =RC[-46] -> 0 | BY58: =RC[-46] -> 0 | BZ58: =RC[-46] -> 0 | CA58: =RC[-46] -> 0 | CB58: =RC[-46] -> 0 | CC58: =RC[-46] -> 810000 | CD58: =RC[-46] -> 0 | CE58: =RC[-46] -> 0 | CF58: =RC[-46] -> 0 | CG58: =RC[-46] -> 0 | CH58: =RC[-46] -> 0 | CI58: =RC[-46] -> 0 | CJ58: =RC[-46] -> 0 | CK58: =RC[-46] -> 0 | CL58: =RC[-46] -> 1 | CM58: =RC[-46] -> 0 | CN58: =RC[-46] -> 0 | CO58: =RC[-46] -> 801900 | CP58: =RC[-46] -> 0 | CQ58: =RC[-46] -> 0 | CR58: =RC[-46] -> 0 | CS58: =RC[-46] -> 0
A59: 14 | B59: 013461 | C59: Cao Văn Mạnh | D59: Nhân viên Bốc xếp | F59: =RC[29]+RC[30]+RC[31]+RC[32]+RC[33]+RC[34]+RC[35]+RC[36]+RC[37] -> 810000 | G59: =RC[17]+RC[18]++RC[19]+RC[20]+RC[21]+RC[38]+RC[39]+RC[41] -> 0 | H59: 0 | I59: 0 | J59: =RC[-2]+RC[-1] -> 0 | K59: 0 | L59: 0 | M59: 0 | N59: =RC[15]+RC[16]+RC[17]+RC[18]+RC[19]+RC[20] -> 0 | O59: 0 | P59: 0 | Q59: 810000 | R59: 0 | S59: 0 | T59: 0 | U59: 8100 | V59: 0 | W59: 801900 | X59: 0 | Y59: 0 | Z59: 0 | AA59: 0 | AB59: 0 | AC59: 0 | AD59: 0 | AE59: 0 | AF59: 0 | AG59: 0 | AH59: 0 | AI59: 810000 | AJ59: 0 | AK59: 0 | AL59: 0 | AM59: 0 | AN59: 0 | AO59: 0 | AP59: 0 | AQ59: 0 | AR59: =1 -> 1 | AS59: 0 | AT59: 0 | AU59: =RC[-30]-RC[-29]-RC[-28]-RC[-27]-RC[-26]-RC[-25] -> 801900 | AV59: 0 | AW59: =RC[1]-RC[2] -> 0 | AX59: 0 | AY59: 0 | AZ59: =RC[-46] -> 810000 | BA59: =RC[-46] -> 0 | BB59: =RC[-46] -> 0 | BC59: =RC[-46] -> 0 | BD59: =RC[-46] -> 0 | BE59: =RC[-46] -> 0 | BF59: =RC[-46] -> 0 | BG59: =RC[-46] -> 0 | BH59: =RC[-46] -> 0 | BI59: =RC[-46] -> 0 | BJ59: =RC[-46] -> 0 | BK59: =RC[-46] -> 810000 | BL59: =RC[-46] -> 0 | BM59: =RC[-46] -> 0 | BN59: =RC[-46] -> 0 | BO59: =RC[-46] -> 8100 | BP59: =RC[-46] -> 0 | BQ59: =RC[-46] -> 801900 | BR59: =RC[-46] -> 0 | BS59: =RC[-46] -> 0 | BT59: =RC[-46] -> 0 | BU59: =RC[-46] -> 0 | BV59: =RC[-46] -> 0 | BW59: =RC[-46] -> 0 | BX59: =RC[-46] -> 0 | BY59: =RC[-46] -> 0 | BZ59: =RC[-46] -> 0 | CA59: =RC[-46] -> 0 | CB59: =RC[-46] -> 0 | CC59: =RC[-46] -> 810000 | CD59: =RC[-46] -> 0 | CE59: =RC[-46] -> 0 | CF59: =RC[-46] -> 0 | CG59: =RC[-46] -> 0 | CH59: =RC[-46] -> 0 | CI59: =RC[-46] -> 0 | CJ59: =RC[-46] -> 0 | CK59: =RC[-46] -> 0 | CL59: =RC[-46] -> 1 | CM59: =RC[-46] -> 0 | CN59: =RC[-46] -> 0 | CO59: =RC[-46] -> 801900 | CP59: =RC[-46] -> 0 | CQ59: =RC[-46] -> 0 | CR59: =RC[-46] -> 0 | CS59: =RC[-46] -> 0
A60: 15 | B60: 013464 | C60: Phạm Văn Dũng | D60: Nhân viên Bốc xếp | F60: =RC[29]+RC[30]+RC[31]+RC[32]+RC[33]+RC[34]+RC[35]+RC[36]+RC[37] -> 810000 | G60: =RC[17]+RC[18]++RC[19]+RC[20]+RC[21]+RC[38]+RC[39]+RC[41] -> 0 | H60: 0 | I60: 0 | J60: =RC[-2]+RC[-1] -> 0 | K60: 0 | L60: 0 | M60: 0 | N60: =RC[15]+RC[16]+RC[17]+RC[18]+RC[19]+RC[20] -> 0 | O60: 0 | P60: 0 | Q60: 810000 | R60: 0 | S60: 0 | T60: 0 | U60: 8100 | V60: 0 | W60: 801900 | X60: 0 | Y60: 0 | Z60: 0 | AA60: 0 | AB60: 0 | AC60: 0 | AD60: 0 | AE60: 0 | AF60: 0 | AG60: 0 | AH60: 0 | AI60: 810000 | AJ60: 0 | AK60: 0 | AL60: 0 | AM60: 0 | AN60: 0 | AO60: 0 | AP60: 0 | AQ60: 0 | AR60: =1 -> 1 | AS60: 0 | AT60: 0 | AU60: =RC[-30]-RC[-29]-RC[-28]-RC[-27]-RC[-26]-RC[-25] -> 801900 | AV60: 0 | AW60: =RC[1]-RC[2] -> 0 | AX60: 0 | AY60: 0 | AZ60: =RC[-46] -> 810000 | BA60: =RC[-46] -> 0 | BB60: =RC[-46] -> 0 | BC60: =RC[-46] -> 0 | BD60: =RC[-46] -> 0 | BE60: =RC[-46] -> 0 | BF60: =RC[-46] -> 0 | BG60: =RC[-46] -> 0 | BH60: =RC[-46] -> 0 | BI60: =RC[-46] -> 0 | BJ60: =RC[-46] -> 0 | BK60: =RC[-46] -> 810000 | BL60: =RC[-46] -> 0 | BM60: =RC[-46] -> 0 | BN60: =RC[-46] -> 0 | BO60: =RC[-46] -> 8100 | BP60: =RC[-46] -> 0 | BQ60: =RC[-46] -> 801900 | BR60: =RC[-46] -> 0 | BS60: =RC[-46] -> 0 | BT60: =RC[-46] -> 0 | BU60: =RC[-46] -> 0 | BV60: =RC[-46] -> 0 | BW60: =RC[-46] -> 0 | BX60: =RC[-46] -> 0 | BY60: =RC[-46] -> 0 | BZ60: =RC[-46] -> 0 | CA60: =RC[-46] -> 0 | CB60: =RC[-46] -> 0 | CC60: =RC[-46] -> 810000 | CD60: =RC[-46] -> 0 | CE60: =RC[-46] -> 0 | CF60: =RC[-46] -> 0 | CG60: =RC[-46] -> 0 | CH60: =RC[-46] -> 0 | CI60: =RC[-46] -> 0 | CJ60: =RC[-46] -> 0 | CK60: =RC[-46] -> 0 | CL60: =RC[-46] -> 1 | CM60: =RC[-46] -> 0 | CN60: =RC[-46] -> 0 | CO60: =RC[-46] -> 801900 | CP60: =RC[-46] -> 0 | CQ60: =RC[-46] -> 0 | CR60: =RC[-46] -> 0 | CS60: =RC[-46] -> 0
A61: 16 | B61: 013465 | C61: Vũ Văn Tuyền | D61: Nhân viên Bốc xếp | F61: =RC[29]+RC[30]+RC[31]+RC[32]+RC[33]+RC[34]+RC[35]+RC[36]+RC[37] -> 810000 | G61: =RC[17]+RC[18]++RC[19]+RC[20]+RC[21]+RC[38]+RC[39]+RC[41] -> 0 | H61: 0 | I61: 0 | J61: =RC[-2]+RC[-1] -> 0 | K61: 0 | L61: 0 | M61: 0 | N61: =RC[15]+RC[16]+RC[17]+RC[18]+RC[19]+RC[20] -> 0 | O61: 0 | P61: 0 | Q61: 810000 | R61: 0 | S61: 0 | T61: 0 | U61: 8100 | V61: 0 | W61: 801900 | X61: 0 | Y61: 0 | Z61: 0 | AA61: 0 | AB61: 0 | AC61: 0 | AD61: 0 | AE61: 0 | AF61: 0 | AG61: 0 | AH61: 0 | AI61: 810000 | AJ61: 0 | AK61: 0 | AL61: 0 | AM61: 0 | AN61: 0 | AO61: 0 | AP61: 0 | AQ61: 0 | AR61: =1 -> 1 | AS61: 0 | AT61: 0 | AU61: =RC[-30]-RC[-29]-RC[-28]-RC[-27]-RC[-26]-RC[-25] -> 801900 | AV61: 0 | AW61: =RC[1]-RC[2] -> 0 | AX61: 0 | AY61: 0 | AZ61: =RC[-46] -> 810000 | BA61: =RC[-46] -> 0 | BB61: =RC[-46] -> 0 | BC61: =RC[-46] -> 0 | BD61: =RC[-46] -> 0 | BE61: =RC[-46] -> 0 | BF61: =RC[-46] -> 0 | BG61: =RC[-46] -> 0 | BH61: =RC[-46] -> 0 | BI61: =RC[-46] -> 0 | BJ61: =RC[-46] -> 0 | BK61: =RC[-46] -> 810000 | BL61: =RC[-46] -> 0 | BM61: =RC[-46] -> 0 | BN61: =RC[-46] -> 0 | BO61: =RC[-46] -> 8100 | BP61: =RC[-46] -> 0 | BQ61: =RC[-46] -> 801900 | BR61: =RC[-46] -> 0 | BS61: =RC[-46] -> 0 | BT61: =RC[-46] -> 0 | BU61: =RC[-46] -> 0 | BV61: =RC[-46] -> 0 | BW61: =RC[-46] -> 0 | BX61: =RC[-46] -> 0 | BY61: =RC[-46] -> 0 | BZ61: =RC[-46] -> 0 | CA61: =RC[-46] -> 0 | CB61: =RC[-46] -> 0 | CC61: =RC[-46] -> 810000 | CD61: =RC[-46] -> 0 | CE61: =RC[-46] -> 0 | CF61: =RC[-46] -> 0 | CG61: =RC[-46] -> 0 | CH61: =RC[-46] -> 0 | CI61: =RC[-46] -> 0 | CJ61: =RC[-46] -> 0 | CK61: =RC[-46] -> 0 | CL61: =RC[-46] -> 1 | CM61: =RC[-46] -> 0 | CN61: =RC[-46] -> 0 | CO61: =RC[-46] -> 801900 | CP61: =RC[-46] -> 0 | CQ61: =RC[-46] -> 0 | CR61: =RC[-46] -> 0 | CS61: =RC[-46] -> 0
A62: 17 | B62: 013466 | C62: Nguyễn Viết Phi | D62: Nhân viên Bốc xếp | F62: =RC[29]+RC[30]+RC[31]+RC[32]+RC[33]+RC[34]+RC[35]+RC[36]+RC[37] -> 810000 | G62: =RC[17]+RC[18]++RC[19]+RC[20]+RC[21]+RC[38]+RC[39]+RC[41] -> 0 | H62: 0 | I62: 0 | J62: =RC[-2]+RC[-1] -> 0 | K62: 0 | L62: 0 | M62: 0 | N62: =RC[15]+RC[16]+RC[17]+RC[18]+RC[19]+RC[20] -> 0 | O62: 0 | P62: 0 | Q62: 810000 | R62: 0 | S62: 0 | T62: 0 | U62: 8100 | V62: 0 | W62: 801900 | X62: 0 | Y62: 0 | Z62: 0 | AA62: 0 | AB62: 0 | AC62: 0 | AD62: 0 | AE62: 0 | AF62: 0 | AG62: 0 | AH62: 0 | AI62: 810000 | AJ62: 0 | AK62: 0 | AL62: 0 | AM62: 0 | AN62: 0 | AO62: 0 | AP62: 0 | AQ62: 0 | AR62: =1 -> 1 | AS62: 0 | AT62: 0 | AU62: =RC[-30]-RC[-29]-RC[-28]-RC[-27]-RC[-26]-RC[-25] -> 801900 | AV62: 0 | AW62: =RC[1]-RC[2] -> 0 | AX62: 0 | AY62: 0 | AZ62: =RC[-46] -> 810000 | BA62: =RC[-46] -> 0 | BB62: =RC[-46] -> 0 | BC62: =RC[-46] -> 0 | BD62: =RC[-46] -> 0 | BE62: =RC[-46] -> 0 | BF62: =RC[-46] -> 0 | BG62: =RC[-46] -> 0 | BH62: =RC[-46] -> 0 | BI62: =RC[-46] -> 0 | BJ62: =RC[-46] -> 0 | BK62: =RC[-46] -> 810000 | BL62: =RC[-46] -> 0 | BM62: =RC[-46] -> 0 | BN62: =RC[-46] -> 0 | BO62: =RC[-46] -> 8100 | BP62: =RC[-46] -> 0 | BQ62: =RC[-46] -> 801900 | BR62: =RC[-46] -> 0 | BS62: =RC[-46] -> 0 | BT62: =RC[-46] -> 0 | BU62: =RC[-46] -> 0 | BV62: =RC[-46] -> 0 | BW62: =RC[-46] -> 0 | BX62: =RC[-46] -> 0 | BY62: =RC[-46] -> 0 | BZ62: =RC[-46] -> 0 | CA62: =RC[-46] -> 0 | CB62: =RC[-46] -> 0 | CC62: =RC[-46] -> 810000 | CD62: =RC[-46] -> 0 | CE62: =RC[-46] -> 0 | CF62: =RC[-46] -> 0 | CG62: =RC[-46] -> 0 | CH62: =RC[-46] -> 0 | CI62: =RC[-46] -> 0 | CJ62: =RC[-46] -> 0 | CK62: =RC[-46] -> 0 | CL62: =RC[-46] -> 1 | CM62: =RC[-46] -> 0 | CN62: =RC[-46] -> 0 | CO62: =RC[-46] -> 801900 | CP62: =RC[-46] -> 0 | CQ62: =RC[-46] -> 0 | CR62: =RC[-46] -> 0 | CS62: =RC[-46] -> 0
A63: 18 | B63: 013467 | C63: Tăng Văn Hải | D63: Nhân viên Bốc xếp | F63: =RC[29]+RC[30]+RC[31]+RC[32]+RC[33]+RC[34]+RC[35]+RC[36]+RC[37] -> 810000 | G63: =RC[17]+RC[18]++RC[19]+RC[20]+RC[21]+RC[38]+RC[39]+RC[41] -> 0 | H63: 0 | I63: 0 | J63: =RC[-2]+RC[-1] -> 0 | K63: 0 | L63: 0 | M63: 0 | N63: =RC[15]+RC[16]+RC[17]+RC[18]+RC[19]+RC[20] -> 0 | O63: 0 | P63: 0 | Q63: 810000 | R63: 0 | S63: 0 | T63: 0 | U63: 8100 | V63: 0 | W63: 801900 | X63: 0 | Y63: 0 | Z63: 0 | AA63: 0 | AB63: 0 | AC63: 0 | AD63: 0 | AE63: 0 | AF63: 0 | AG63: 0 | AH63: 0 | AI63: 810000 | AJ63: 0 | AK63: 0 | AL63: 0 | AM63: 0 | AN63: 0 | AO63: 0 | AP63: 0 | AQ63: 0 | AR63: =1 -> 1 | AS63: 0 | AT63: 0 | AU63: =RC[-30]-RC[-29]-RC[-28]-RC[-27]-RC[-26]-RC[-25] -> 801900 | AV63: 0 | AW63: =RC[1]-RC[2] -> 0 | AX63: 0 | AY63: 0 | AZ63: =RC[-46] -> 810000 | BA63: =RC[-46] -> 0 | BB63: =RC[-46] -> 0 | BC63: =RC[-46] -> 0 | BD63: =RC[-46] -> 0 | BE63: =RC[-46] -> 0 | BF63: =RC[-46] -> 0 | BG63: =RC[-46] -> 0 | BH63: =RC[-46] -> 0 | BI63: =RC[-46] -> 0 | BJ63: =RC[-46] -> 0 | BK63: =RC[-46] -> 810000 | BL63: =RC[-46] -> 0 | BM63: =RC[-46] -> 0 | BN63: =RC[-46] -> 0 | BO63: =RC[-46] -> 8100 | BP63: =RC[-46] -> 0 | BQ63: =RC[-46] -> 801900 | BR63: =RC[-46] -> 0 | BS63: =RC[-46] -> 0 | BT63: =RC[-46] -> 0 | BU63: =RC[-46] -> 0 | BV63: =RC[-46] -> 0 | BW63: =RC[-46] -> 0 | BX63: =RC[-46] -> 0 | BY63: =RC[-46] -> 0 | BZ63: =RC[-46] -> 0 | CA63: =RC[-46] -> 0 | CB63: =RC[-46] -> 0 | CC63: =RC[-46] -> 810000 | CD63: =RC[-46] -> 0 | CE63: =RC[-46] -> 0 | CF63: =RC[-46] -> 0 | CG63: =RC[-46] -> 0 | CH63: =RC[-46] -> 0 | CI63: =RC[-46] -> 0 | CJ63: =RC[-46] -> 0 | CK63: =RC[-46] -> 0 | CL63: =RC[-46] -> 1 | CM63: =RC[-46] -> 0 | CN63: =RC[-46] -> 0 | CO63: =RC[-46] -> 801900 | CP63: =RC[-46] -> 0 | CQ63: =RC[-46] -> 0 | CR63: =RC[-46] -> 0 | CS63: =RC[-46] -> 0
A64: 19 | B64: 013468 | C64: Lê Trọng Tài | D64: Nhân viên Bốc xếp | F64: =RC[29]+RC[30]+RC[31]+RC[32]+RC[33]+RC[34]+RC[35]+RC[36]+RC[37] -> 810000 | G64: =RC[17]+RC[18]++RC[19]+RC[20]+RC[21]+RC[38]+RC[39]+RC[41] -> 0 | H64: 0 | I64: 0 | J64: =RC[-2]+RC[-1] -> 0 | K64: 0 | L64: 0 | M64: 0 | N64: =RC[15]+RC[16]+RC[17]+RC[18]+RC[19]+RC[20] -> 0 | O64: 0 | P64: 0 | Q64: 810000 | R64: 0 | S64: 0 | T64: 0 | U64: 8100 | V64: 0 | W64: 801900 | X64: 0 | Y64: 0 | Z64: 0 | AA64: 0 | AB64: 0 | AC64: 0 | AD64: 0 | AE64: 0 | AF64: 0 | AG64: 0 | AH64: 0 | AI64: 810000 | AJ64: 0 | AK64: 0 | AL64: 0 | AM64: 0 | AN64: 0 | AO64: 0 | AP64: 0 | AQ64: 0 | AR64: =1 -> 1 | AS64: 0 | AT64: 0 | AU64: =RC[-30]-RC[-29]-RC[-28]-RC[-27]-RC[-26]-RC[-25] -> 801900 | AV64: 0 | AW64: =RC[1]-RC[2] -> 0 | AX64: 0 | AY64: 0 | AZ64: =RC[-46] -> 810000 | BA64: =RC[-46] -> 0 | BB64: =RC[-46] -> 0 | BC64: =RC[-46] -> 0 | BD64: =RC[-46] -> 0 | BE64: =RC[-46] -> 0 | BF64: =RC[-46] -> 0 | BG64: =RC[-46] -> 0 | BH64: =RC[-46] -> 0 | BI64: =RC[-46] -> 0 | BJ64: =RC[-46] -> 0 | BK64: =RC[-46] -> 810000 | BL64: =RC[-46] -> 0 | BM64: =RC[-46] -> 0 | BN64: =RC[-46] -> 0 | BO64: =RC[-46] -> 8100 | BP64: =RC[-46] -> 0 | BQ64: =RC[-46] -> 801900 | BR64: =RC[-46] -> 0 | BS64: =RC[-46] -> 0 | BT64: =RC[-46] -> 0 | BU64: =RC[-46] -> 0 | BV64: =RC[-46] -> 0 | BW64: =RC[-46] -> 0 | BX64: =RC[-46] -> 0 | BY64: =RC[-46] -> 0 | BZ64: =RC[-46] -> 0 | CA64: =RC[-46] -> 0 | CB64: =RC[-46] -> 0 | CC64: =RC[-46] -> 810000 | CD64: =RC[-46] -> 0 | CE64: =RC[-46] -> 0 | CF64: =RC[-46] -> 0 | CG64: =RC[-46] -> 0 | CH64: =RC[-46] -> 0 | CI64: =RC[-46] -> 0 | CJ64: =RC[-46] -> 0 | CK64: =RC[-46] -> 0 | CL64: =RC[-46] -> 1 | CM64: =RC[-46] -> 0 | CN64: =RC[-46] -> 0 | CO64: =RC[-46] -> 801900 | CP64: =RC[-46] -> 0 | CQ64: =RC[-46] -> 0 | CR64: =RC[-46] -> 0 | CS64: =RC[-46] -> 0
A65: 20 | B65: 013406 | C65: Hoàng Đình Mạnh | D65: NV Lái xe - VHTTB | F65: =RC[29]+RC[30]+RC[31]+RC[32]+RC[33]+RC[34]+RC[35]+RC[36]+RC[37] -> 810000 | G65: =RC[17]+RC[18]++RC[19]+RC[20]+RC[21]+RC[38]+RC[39]+RC[41] -> 0 | H65: 0 | I65: 0 | J65: =RC[-2]+RC[-1] -> 0 | K65: 0 | L65: 0 | M65: 0 | N65: =RC[15]+RC[16]+RC[17]+RC[18]+RC[19]+RC[20] -> 0 | O65: 0 | P65: 0 | Q65: 810000 | R65: 0 | S65: 0 | T65: 0 | U65: 8100 | V65: 0 | W65: 801900 | X65: 0 | Y65: 0 | Z65: 0 | AA65: 0 | AB65: 0 | AC65: 0 | AD65: 0 | AE65: 0 | AF65: 0 | AG65: 0 | AH65: 0 | AI65: 810000 | AJ65: 0 | AK65: 0 | AL65: 0 | AM65: 0 | AN65: 0 | AO65: 0 | AP65: 0 | AQ65: 0 | AR65: =1 -> 1 | AS65: 0 | AT65: 0 | AU65: =RC[-30]-RC[-29]-RC[-28]-RC[-27]-RC[-26]-RC[-25] -> 801900 | AV65: 0 | AW65: =RC[1]-RC[2] -> 0 | AX65: 0 | AY65: 0 | AZ65: =RC[-46] -> 810000 | BA65: =RC[-46] -> 0 | BB65: =RC[-46] -> 0 | BC65: =RC[-46] -> 0 | BD65: =RC[-46] -> 0 | BE65: =RC[-46] -> 0 | BF65: =RC[-46] -> 0 | BG65: =RC[-46] -> 0 | BH65: =RC[-46] -> 0 | BI65: =RC[-46] -> 0 | BJ65: =RC[-46] -> 0 | BK65: =RC[-46] -> 810000 | BL65: =RC[-46] -> 0 | BM65: =RC[-46] -> 0 | BN65: =RC[-46] -> 0 | BO65: =RC[-46] -> 8100 | BP65: =RC[-46] -> 0 | BQ65: =RC[-46] -> 801900 | BR65: =RC[-46] -> 0 | BS65: =RC[-46] -> 0 | BT65: =RC[-46] -> 0 | BU65: =RC[-46] -> 0 | BV65: =RC[-46] -> 0 | BW65: =RC[-46] -> 0 | BX65: =RC[-46] -> 0 | BY65: =RC[-46] -> 0 | BZ65: =RC[-46] -> 0 | CA65: =RC[-46] -> 0 | CB65: =RC[-46] -> 0 | CC65: =RC[-46] -> 810000 | CD65: =RC[-46] -> 0 | CE65: =RC[-46] -> 0 | CF65: =RC[-46] -> 0 | CG65: =RC[-46] -> 0 | CH65: =RC[-46] -> 0 | CI65: =RC[-46] -> 0 | CJ65: =RC[-46] -> 0 | CK65: =RC[-46] -> 0 | CL65: =RC[-46] -> 1 | CM65: =RC[-46] -> 0 | CN65: =RC[-46] -> 0 | CO65: =RC[-46] -> 801900 | CP65: =RC[-46] -> 0 | CQ65: =RC[-46] -> 0 | CR65: =RC[-46] -> 0 | CS65: =RC[-46] -> 0
A66: 21 | B66: 013407 | C66: Vương Văn Tiến | D66: NV Lái xe - VHTTB | F66: =RC[29]+RC[30]+RC[31]+RC[32]+RC[33]+RC[34]+RC[35]+RC[36]+RC[37] -> 810000 | G66: =RC[17]+RC[18]++RC[19]+RC[20]+RC[21]+RC[38]+RC[39]+RC[41] -> 0 | H66: 0 | I66: 0 | J66: =RC[-2]+RC[-1] -> 0 | K66: 0 | L66: 0 | M66: 0 | N66: =RC[15]+RC[16]+RC[17]+RC[18]+RC[19]+RC[20] -> 0 | O66: 0 | P66: 0 | Q66: 810000 | R66: 0 | S66: 0 | T66: 0 | U66: 8100 | V66: 0 | W66: 801900 | X66: 0 | Y66: 0 | Z66: 0 | AA66: 0 | AB66: 0 | AC66: 0 | AD66: 0 | AE66: 0 | AF66: 0 | AG66: 0 | AH66: 0 | AI66: 810000 | AJ66: 0 | AK66: 0 | AL66: 0 | AM66: 0 | AN66: 0 | AO66: 0 | AP66: 0 | AQ66: 0 | AR66: =1 -> 1 | AS66: 0 | AT66: 0 | AU66: =RC[-30]-RC[-29]-RC[-28]-RC[-27]-RC[-26]-RC[-25] -> 801900 | AV66: 0 | AW66: =RC[1]-RC[2] -> 0 | AX66: 0 | AY66: 0 | AZ66: =RC[-46] -> 810000 | BA66: =RC[-46] -> 0 | BB66: =RC[-46] -> 0 | BC66: =RC[-46] -> 0 | BD66: =RC[-46] -> 0 | BE66: =RC[-46] -> 0 | BF66: =RC[-46] -> 0 | BG66: =RC[-46] -> 0 | BH66: =RC[-46] -> 0 | BI66: =RC[-46] -> 0 | BJ66: =RC[-46] -> 0 | BK66: =RC[-46] -> 810000 | BL66: =RC[-46] -> 0 | BM66: =RC[-46] -> 0 | BN66: =RC[-46] -> 0 | BO66: =RC[-46] -> 8100 | BP66: =RC[-46] -> 0 | BQ66: =RC[-46] -> 801900 | BR66: =RC[-46] -> 0 | BS66: =RC[-46] -> 0 | BT66: =RC[-46] -> 0 | BU66: =RC[-46] -> 0 | BV66: =RC[-46] -> 0 | BW66: =RC[-46] -> 0 | BX66: =RC[-46] -> 0 | BY66: =RC[-46] -> 0 | BZ66: =RC[-46] -> 0 | CA66: =RC[-46] -> 0 | CB66: =RC[-46] -> 0 | CC66: =RC[-46] -> 810000 | CD66: =RC[-46] -> 0 | CE66: =RC[-46] -> 0 | CF66: =RC[-46] -> 0 | CG66: =RC[-46] -> 0 | CH66: =RC[-46] -> 0 | CI66: =RC[-46] -> 0 | CJ66: =RC[-46] -> 0 | CK66: =RC[-46] -> 0 | CL66: =RC[-46] -> 1 | CM66: =RC[-46] -> 0 | CN66: =RC[-46] -> 0 | CO66: =RC[-46] -> 801900 | CP66: =RC[-46] -> 0 | CQ66: =RC[-46] -> 0 | CR66: =RC[-46] -> 0 | CS66: =RC[-46] -> 0
A67: 22 | B67: 013408 | C67: Nguyễn Phương Thắng | D67: NV Lái xe - VHTTB | F67: =RC[29]+RC[30]+RC[31]+RC[32]+RC[33]+RC[34]+RC[35]+RC[36]+RC[37] -> 810000 | G67: =RC[17]+RC[18]++RC[19]+RC[20]+RC[21]+RC[38]+RC[39]+RC[41] -> 0 | H67: 0 | I67: 0 | J67: =RC[-2]+RC[-1] -> 0 | K67: 0 | L67: 0 | M67: 0 | N67: =RC[15]+RC[16]+RC[17]+RC[18]+RC[19]+RC[20] -> 0 | O67: 0 | P67: 0 | Q67: 810000 | R67: 0 | S67: 0 | T67: 0 | U67: 8100 | V67: 0 | W67: 801900 | X67: 0 | Y67: 0 | Z67: 0 | AA67: 0 | AB67: 0 | AC67: 0 | AD67: 0 | AE67: 0 | AF67: 0 | AG67: 0 | AH67: 0 | AI67: 810000 | AJ67: 0 | AK67: 0 | AL67: 0 | AM67: 0 | AN67: 0 | AO67: 0 | AP67: 0 | AQ67: 0 | AR67: =1 -> 1 | AS67: 0 | AT67: 0 | AU67: =RC[-30]-RC[-29]-RC[-28]-RC[-27]-RC[-26]-RC[-25] -> 801900 | AV67: 0 | AW67: =RC[1]-RC[2] -> 0 | AX67: 0 | AY67: 0 | AZ67: =RC[-46] -> 810000 | BA67: =RC[-46] -> 0 | BB67: =RC[-46] -> 0 | BC67: =RC[-46] -> 0 | BD67: =RC[-46] -> 0 | BE67: =RC[-46] -> 0 | BF67: =RC[-46] -> 0 | BG67: =RC[-46] -> 0 | BH67: =RC[-46] -> 0 | BI67: =RC[-46] -> 0 | BJ67: =RC[-46] -> 0 | BK67: =RC[-46] -> 810000 | BL67: =RC[-46] -> 0 | BM67: =RC[-46] -> 0 | BN67: =RC[-46] -> 0 | BO67: =RC[-46] -> 8100 | BP67: =RC[-46] -> 0 | BQ67: =RC[-46] -> 801900 | BR67: =RC[-46] -> 0 | BS67: =RC[-46] -> 0 | BT67: =RC[-46] -> 0 | BU67: =RC[-46] -> 0 | BV67: =RC[-46] -> 0 | BW67: =RC[-46] -> 0 | BX67: =RC[-46] -> 0 | BY67: =RC[-46] -> 0 | BZ67: =RC[-46] -> 0 | CA67: =RC[-46] -> 0 | CB67: =RC[-46] -> 0 | CC67: =RC[-46] -> 810000 | CD67: =RC[-46] -> 0 | CE67: =RC[-46] -> 0 | CF67: =RC[-46] -> 0 | CG67: =RC[-46] -> 0 | CH67: =RC[-46] -> 0 | CI67: =RC[-46] -> 0 | CJ67: =RC[-46] -> 0 | CK67: =RC[-46] -> 0 | CL67: =RC[-46] -> 1 | CM67: =RC[-46] -> 0 | CN67: =RC[-46] -> 0 | CO67: =RC[-46] -> 801900 | CP67: =RC[-46] -> 0 | CQ67: =RC[-46] -> 0 | CR67: =RC[-46] -> 0 | CS67: =RC[-46] -> 0
A68: 23 | B68: 013409 | C68: Lê Tuấn Anh | D68: NV Lái xe - VHTTB | F68: =RC[29]+RC[30]+RC[31]+RC[32]+RC[33]+RC[34]+RC[35]+RC[36]+RC[37] -> 810000 | G68: =RC[17]+RC[18]++RC[19]+RC[20]+RC[21]+RC[38]+RC[39]+RC[41] -> 0 | H68: 0 | I68: 0 | J68: =RC[-2]+RC[-1] -> 0 | K68: 0 | L68: 0 | M68: 0 | N68: =RC[15]+RC[16]+RC[17]+RC[18]+RC[19]+RC[20] -> 0 | O68: 0 | P68: 0 | Q68: 810000 | R68: 0 | S68: 0 | T68: 0 | U68: 8100 | V68: 0 | W68: 801900 | X68: 0 | Y68: 0 | Z68: 0 | AA68: 0 | AB68: 0 | AC68: 0 | AD68: 0 | AE68: 0 | AF68: 0 | AG68: 0 | AH68: 0 | AI68: 810000 | AJ68: 0 | AK68: 0 | AL68: 0 | AM68: 0 | AN68: 0 | AO68: 0 | AP68: 0 | AQ68: 0 | AR68: =1 -> 1 | AS68: 0 | AT68: 0 | AU68: =RC[-30]-RC[-29]-RC[-28]-RC[-27]-RC[-26]-RC[-25] -> 801900 | AV68: 0 | AW68: =RC[1]-RC[2] -> 0 | AX68: 0 | AY68: 0 | AZ68: =RC[-46] -> 810000 | BA68: =RC[-46] -> 0 | BB68: =RC[-46] -> 0 | BC68: =RC[-46] -> 0 | BD68: =RC[-46] -> 0 | BE68: =RC[-46] -> 0 | BF68: =RC[-46] -> 0 | BG68: =RC[-46] -> 0 | BH68: =RC[-46] -> 0 | BI68: =RC[-46] -> 0 | BJ68: =RC[-46] -> 0 | BK68: =RC[-46] -> 810000 | BL68: =RC[-46] -> 0 | BM68: =RC[-46] -> 0 | BN68: =RC[-46] -> 0 | BO68: =RC[-46] -> 8100 | BP68: =RC[-46] -> 0 | BQ68: =RC[-46] -> 801900 | BR68: =RC[-46] -> 0 | BS68: =RC[-46] -> 0 | BT68: =RC[-46] -> 0 | BU68: =RC[-46] -> 0 | BV68: =RC[-46] -> 0 | BW68: =RC[-46] -> 0 | BX68: =RC[-46] -> 0 | BY68: =RC[-46] -> 0 | BZ68: =RC[-46] -> 0 | CA68: =RC[-46] -> 0 | CB68: =RC[-46] -> 0 | CC68: =RC[-46] -> 810000 | CD68: =RC[-46] -> 0 | CE68: =RC[-46] -> 0 | CF68: =RC[-46] -> 0 | CG68: =RC[-46] -> 0 | CH68: =RC[-46] -> 0 | CI68: =RC[-46] -> 0 | CJ68: =RC[-46] -> 0 | CK68: =RC[-46] -> 0 | CL68: =RC[-46] -> 1 | CM68: =RC[-46] -> 0 | CN68: =RC[-46] -> 0 | CO68: =RC[-46] -> 801900 | CP68: =RC[-46] -> 0 | CQ68: =RC[-46] -> 0 | CR68: =RC[-46] -> 0 | CS68: =RC[-46] -> 0
A69: 24 | B69: 013410 | C69: Đoàn Văn Phương | D69: NV Lái xe - VHTTB | F69: =RC[29]+RC[30]+RC[31]+RC[32]+RC[33]+RC[34]+RC[35]+RC[36]+RC[37] -> 810000 | G69: =RC[17]+RC[18]++RC[19]+RC[20]+RC[21]+RC[38]+RC[39]+RC[41] -> 0 | H69: 0 | I69: 0 | J69: =RC[-2]+RC[-1] -> 0 | K69: 0 | L69: 0 | M69: 0 | N69: =RC[15]+RC[16]+RC[17]+RC[18]+RC[19]+RC[20] -> 0 | O69: 0 | P69: 0 | Q69: 810000 | R69: 0 | S69: 0 | T69: 0 | U69: 8100 | V69: 0 | W69: 801900 | X69: 0 | Y69: 0 | Z69: 0 | AA69: 0 | AB69: 0 | AC69: 0 | AD69: 0 | AE69: 0 | AF69: 0 | AG69: 0 | AH69: 0 | AI69: 810000 | AJ69: 0 | AK69: 0 | AL69: 0 | AM69: 0 | AN69: 0 | AO69: 0 | AP69: 0 | AQ69: 0 | AR69: =1 -> 1 | AS69: 0 | AT69: 0 | AU69: =RC[-30]-RC[-29]-RC[-28]-RC[-27]-RC[-26]-RC[-25] -> 801900 | AV69: 0 | AW69: =RC[1]-RC[2] -> 0 | AX69: 0 | AY69: 0 | AZ69: =RC[-46] -> 810000 | BA69: =RC[-46] -> 0 | BB69: =RC[-46] -> 0 | BC69: =RC[-46] -> 0 | BD69: =RC[-46] -> 0 | BE69: =RC[-46] -> 0 | BF69: =RC[-46] -> 0 | BG69: =RC[-46] -> 0 | BH69: =RC[-46] -> 0 | BI69: =RC[-46] -> 0 | BJ69: =RC[-46] -> 0 | BK69: =RC[-46] -> 810000 | BL69: =RC[-46] -> 0 | BM69: =RC[-46] -> 0 | BN69: =RC[-46] -> 0 | BO69: =RC[-46] -> 8100 | BP69: =RC[-46] -> 0 | BQ69: =RC[-46] -> 801900 | BR69: =RC[-46] -> 0 | BS69: =RC[-46] -> 0 | BT69: =RC[-46] -> 0 | BU69: =RC[-46] -> 0 | BV69: =RC[-46] -> 0 | BW69: =RC[-46] -> 0 | BX69: =RC[-46] -> 0 | BY69: =RC[-46] -> 0 | BZ69: =RC[-46] -> 0 | CA69: =RC[-46] -> 0 | CB69: =RC[-46] -> 0 | CC69: =RC[-46] -> 810000 | CD69: =RC[-46] -> 0 | CE69: =RC[-46] -> 0 | CF69: =RC[-46] -> 0 | CG69: =RC[-46] -> 0 | CH69: =RC[-46] -> 0 | CI69: =RC[-46] -> 0 | CJ69: =RC[-46] -> 0 | CK69: =RC[-46] -> 0 | CL69: =RC[-46] -> 1 | CM69: =RC[-46] -> 0 | CN69: =RC[-46] -> 0 | CO69: =RC[-46] -> 801900 | CP69: =RC[-46] -> 0 | CQ69: =RC[-46] -> 0 | CR69: =RC[-46] -> 0 | CS69: =RC[-46] -> 0
A70: 25 | B70: 013411 | C70: Nguyễn Văn Hà | D70: NV Lái xe - VHTTB | F70: =RC[29]+RC[30]+RC[31]+RC[32]+RC[33]+RC[34]+RC[35]+RC[36]+RC[37] -> 810000 | G70: =RC[17]+RC[18]++RC[19]+RC[20]+RC[21]+RC[38]+RC[39]+RC[41] -> 0 | H70: 0 | I70: 0 | J70: =RC[-2]+RC[-1] -> 0 | K70: 0 | L70: 0 | M70: 0 | N70: =RC[15]+RC[16]+RC[17]+RC[18]+RC[19]+RC[20] -> 0 | O70: 0 | P70: 0 | Q70: 810000 | R70: 0 | S70: 0 | T70: 0 | U70: 8100 | V70: 0 | W70: 801900 | X70: 0 | Y70: 0 | Z70: 0 | AA70: 0 | AB70: 0 | AC70: 0 | AD70: 0 | AE70: 0 | AF70: 0 | AG70: 0 | AH70: 0 | AI70: 810000 | AJ70: 0 | AK70: 0 | AL70: 0 | AM70: 0 | AN70: 0 | AO70: 0 | AP70: 0 | AQ70: 0 | AR70: =1 -> 1 | AS70: 0 | AT70: 0 | AU70: =RC[-30]-RC[-29]-RC[-28]-RC[-27]-RC[-26]-RC[-25] -> 801900 | AV70: 0 | AW70: =RC[1]-RC[2] -> 0 | AX70: 0 | AY70: 0 | AZ70: =RC[-46] -> 810000 | BA70: =RC[-46] -> 0 | BB70: =RC[-46] -> 0 | BC70: =RC[-46] -> 0 | BD70: =RC[-46] -> 0 | BE70: =RC[-46] -> 0 | BF70: =RC[-46] -> 0 | BG70: =RC[-46] -> 0 | BH70: =RC[-46] -> 0 | BI70: =RC[-46] -> 0 | BJ70: =RC[-46] -> 0 | BK70: =RC[-46] -> 810000 | BL70: =RC[-46] -> 0 | BM70: =RC[-46] -> 0 | BN70: =RC[-46] -> 0 | BO70: =RC[-46] -> 8100 | BP70: =RC[-46] -> 0 | BQ70: =RC[-46] -> 801900 | BR70: =RC[-46] -> 0 | BS70: =RC[-46] -> 0 | BT70: =RC[-46] -> 0 | BU70: =RC[-46] -> 0 | BV70: =RC[-46] -> 0 | BW70: =RC[-46] -> 0 | BX70: =RC[-46] -> 0 | BY70: =RC[-46] -> 0 | BZ70: =RC[-46] -> 0 | CA70: =RC[-46] -> 0 | CB70: =RC[-46] -> 0 | CC70: =RC[-46] -> 810000 | CD70: =RC[-46] -> 0 | CE70: =RC[-46] -> 0 | CF70: =RC[-46] -> 0 | CG70: =RC[-46] -> 0 | CH70: =RC[-46] -> 0 | CI70: =RC[-46] -> 0 | CJ70: =RC[-46] -> 0 | CK70: =RC[-46] -> 0 | CL70: =RC[-46] -> 1 | CM70: =RC[-46] -> 0 | CN70: =RC[-46] -> 0 | CO70: =RC[-46] -> 801900 | CP70: =RC[-46] -> 0 | CQ70: =RC[-46] -> 0 | CR70: =RC[-46] -> 0 | CS70: =RC[-46] -> 0
A71: 26 | B71: 013412 | C71: Nguyễn Mạnh Hiếu | D71: NV Lái xe - VHTTB | F71: =RC[29]+RC[30]+RC[31]+RC[32]+RC[33]+RC[34]+RC[35]+RC[36]+RC[37] -> 810000 | G71: =RC[17]+RC[18]++RC[19]+RC[20]+RC[21]+RC[38]+RC[39]+RC[41] -> 0 | H71: 0 | I71: 0 | J71: =RC[-2]+RC[-1] -> 0 | K71: 0 | L71: 0 | M71: 0 | N71: =RC[15]+RC[16]+RC[17]+RC[18]+RC[19]+RC[20] -> 0 | O71: 0 | P71: 0 | Q71: 810000 | R71: 0 | S71: 0 | T71: 0 | U71: 8100 | V71: 0 | W71: 801900 | X71: 0 | Y71: 0 | Z71: 0 | AA71: 0 | AB71: 0 | AC71: 0 | AD71: 0 | AE71: 0 | AF71: 0 | AG71: 0 | AH71: 0 | AI71: 810000 | AJ71: 0 | AK71: 0 | AL71: 0 | AM71: 0 | AN71: 0 | AO71: 0 | AP71: 0 | AQ71: 0 | AR71: =1 -> 1 | AS71: 0 | AT71: 0 | AU71: =RC[-30]-RC[-29]-RC[-28]-RC[-27]-RC[-26]-RC[-25] -> 801900 | AV71: 0 | AW71: =RC[1]-RC[2] -> 0 | AX71: 0 | AY71: 0 | AZ71: =RC[-46] -> 810000 | BA71: =RC[-46] -> 0 | BB71: =RC[-46] -> 0 | BC71: =RC[-46] -> 0 | BD71: =RC[-46] -> 0 | BE71: =RC[-46] -> 0 | BF71: =RC[-46] -> 0 | BG71: =RC[-46] -> 0 | BH71: =RC[-46] -> 0 | BI71: =RC[-46] -> 0 | BJ71: =RC[-46] -> 0 | BK71: =RC[-46] -> 810000 | BL71: =RC[-46] -> 0 | BM71: =RC[-46] -> 0 | BN71: =RC[-46] -> 0 | BO71: =RC[-46] -> 8100 | BP71: =RC[-46] -> 0 | BQ71: =RC[-46] -> 801900 | BR71: =RC[-46] -> 0 | BS71: =RC[-46] -> 0 | BT71: =RC[-46] -> 0 | BU71: =RC[-46] -> 0 | BV71: =RC[-46] -> 0 | BW71: =RC[-46] -> 0 | BX71: =RC[-46] -> 0 | BY71: =RC[-46] -> 0 | BZ71: =RC[-46] -> 0 | CA71: =RC[-46] -> 0 | CB71: =RC[-46] -> 0 | CC71: =RC[-46] -> 810000 | CD71: =RC[-46] -> 0 | CE71: =RC[-46] -> 0 | CF71: =RC[-46] -> 0 | CG71: =RC[-46] -> 0 | CH71: =RC[-46] -> 0 | CI71: =RC[-46] -> 0 | CJ71: =RC[-46] -> 0 | CK71: =RC[-46] -> 0 | CL71: =RC[-46] -> 1 | CM71: =RC[-46] -> 0 | CN71: =RC[-46] -> 0 | CO71: =RC[-46] -> 801900 | CP71: =RC[-46] -> 0 | CQ71: =RC[-46] -> 0 | CR71: =RC[-46] -> 0 | CS71: =RC[-46] -> 0
A72: 27 | B72: 013413 | C72: Vũ Việt Hùng | D72: NV Lái xe - VHTTB | F72: =RC[29]+RC[30]+RC[31]+RC[32]+RC[33]+RC[34]+RC[35]+RC[36]+RC[37] -> 810000 | G72: =RC[17]+RC[18]++RC[19]+RC[20]+RC[21]+RC[38]+RC[39]+RC[41] -> 0 | H72: 0 | I72: 0 | J72: =RC[-2]+RC[-1] -> 0 | K72: 0 | L72: 0 | M72: 0 | N72: =RC[15]+RC[16]+RC[17]+RC[18]+RC[19]+RC[20] -> 0 | O72: 0 | P72: 0 | Q72: 810000 | R72: 0 | S72: 0 | T72: 0 | U72: 8100 | V72: 0 | W72: 801900 | X72: 0 | Y72: 0 | Z72: 0 | AA72: 0 | AB72: 0 | AC72: 0 | AD72: 0 | AE72: 0 | AF72: 0 | AG72: 0 | AH72: 0 | AI72: 810000 | AJ72: 0 | AK72: 0 | AL72: 0 | AM72: 0 | AN72: 0 | AO72: 0 | AP72: 0 | AQ72: 0 | AR72: =1 -> 1 | AS72: 0 | AT72: 0 | AU72: =RC[-30]-RC[-29]-RC[-28]-RC[-27]-RC[-26]-RC[-25] -> 801900 | AV72: 0 | AW72: =RC[1]-RC[2] -> 0 | AX72: 0 | AY72: 0 | AZ72: =RC[-46] -> 810000 | BA72: =RC[-46] -> 0 | BB72: =RC[-46] -> 0 | BC72: =RC[-46] -> 0 | BD72: =RC[-46] -> 0 | BE72: =RC[-46] -> 0 | BF72: =RC[-46] -> 0 | BG72: =RC[-46] -> 0 | BH72: =RC[-46] -> 0 | BI72: =RC[-46] -> 0 | BJ72: =RC[-46] -> 0 | BK72: =RC[-46] -> 810000 | BL72: =RC[-46] -> 0 | BM72: =RC[-46] -> 0 | BN72: =RC[-46] -> 0 | BO72: =RC[-46] -> 8100 | BP72: =RC[-46] -> 0 | BQ72: =RC[-46] -> 801900 | BR72: =RC[-46] -> 0 | BS72: =RC[-46] -> 0 | BT72: =RC[-46] -> 0 | BU72: =RC[-46] -> 0 | BV72: =RC[-46] -> 0 | BW72: =RC[-46] -> 0 | BX72: =RC[-46] -> 0 | BY72: =RC[-46] -> 0 | BZ72: =RC[-46] -> 0 | CA72: =RC[-46] -> 0 | CB72: =RC[-46] -> 0 | CC72: =RC[-46] -> 810000 | CD72: =RC[-46] -> 0 | CE72: =RC[-46] -> 0 | CF72: =RC[-46] -> 0 | CG72: =RC[-46] -> 0 | CH72: =RC[-46] -> 0 | CI72: =RC[-46] -> 0 | CJ72: =RC[-46] -> 0 | CK72: =RC[-46] -> 0 | CL72: =RC[-46] -> 1 | CM72: =RC[-46] -> 0 | CN72: =RC[-46] -> 0 | CO72: =RC[-46] -> 801900 | CP72: =RC[-46] -> 0 | CQ72: =RC[-46] -> 0 | CR72: =RC[-46] -> 0 | CS72: =RC[-46] -> 0
A73: 28 | B73: 013414 | C73: Lê Hữu Hóa | D73: NV Lái xe - VHTTB | F73: =RC[29]+RC[30]+RC[31]+RC[32]+RC[33]+RC[34]+RC[35]+RC[36]+RC[37] -> 810000 | G73: =RC[17]+RC[18]++RC[19]+RC[20]+RC[21]+RC[38]+RC[39]+RC[41] -> 0 | H73: 0 | I73: 0 | J73: =RC[-2]+RC[-1] -> 0 | K73: 0 | L73: 0 | M73: 0 | N73: =RC[15]+RC[16]+RC[17]+RC[18]+RC[19]+RC[20] -> 0 | O73: 0 | P73: 0 | Q73: 810000 | R73: 0 | S73: 0 | T73: 0 | U73: 8100 | V73: 0 | W73: 801900 | X73: 0 | Y73: 0 | Z73: 0 | AA73: 0 | AB73: 0 | AC73: 0 | AD73: 0 | AE73: 0 | AF73: 0 | AG73: 0 | AH73: 0 | AI73: 810000 | AJ73: 0 | AK73: 0 | AL73: 0 | AM73: 0 | AN73: 0 | AO73: 0 | AP73: 0 | AQ73: 0 | AR73: =1 -> 1 | AS73: 0 | AT73: 0 | AU73: =RC[-30]-RC[-29]-RC[-28]-RC[-27]-RC[-26]-RC[-25] -> 801900 | AV73: 0 | AW73: =RC[1]-RC[2] -> 0 | AX73: 0 | AY73: 0 | AZ73: =RC[-46] -> 810000 | BA73: =RC[-46] -> 0 | BB73: =RC[-46] -> 0 | BC73: =RC[-46] -> 0 | BD73: =RC[-46] -> 0 | BE73: =RC[-46] -> 0 | BF73: =RC[-46] -> 0 | BG73: =RC[-46] -> 0 | BH73: =RC[-46] -> 0 | BI73: =RC[-46] -> 0 | BJ73: =RC[-46] -> 0 | BK73: =RC[-46] -> 810000 | BL73: =RC[-46] -> 0 | BM73: =RC[-46] -> 0 | BN73: =RC[-46] -> 0 | BO73: =RC[-46] -> 8100 | BP73: =RC[-46] -> 0 | BQ73: =RC[-46] -> 801900 | BR73: =RC[-46] -> 0 | BS73: =RC[-46] -> 0 | BT73: =RC[-46] -> 0 | BU73: =RC[-46] -> 0 | BV73: =RC[-46] -> 0 | BW73: =RC[-46] -> 0 | BX73: =RC[-46] -> 0 | BY73: =RC[-46] -> 0 | BZ73: =RC[-46] -> 0 | CA73: =RC[-46] -> 0 | CB73: =RC[-46] -> 0 | CC73: =RC[-46] -> 810000 | CD73: =RC[-46] -> 0 | CE73: =RC[-46] -> 0 | CF73: =RC[-46] -> 0 | CG73: =RC[-46] -> 0 | CH73: =RC[-46] -> 0 | CI73: =RC[-46] -> 0 | CJ73: =RC[-46] -> 0 | CK73: =RC[-46] -> 0 | CL73: =RC[-46] -> 1 | CM73: =RC[-46] -> 0 | CN73: =RC[-46] -> 0 | CO73: =RC[-46] -> 801900 | CP73: =RC[-46] -> 0 | CQ73: =RC[-46] -> 0 | CR73: =RC[-46] -> 0 | CS73: =RC[-46] -> 0
A74: 29 | B74: 013415 | C74: Đinh Văn Duyên | D74: NV Lái xe - VHTTB | F74: =RC[29]+RC[30]+RC[31]+RC[32]+RC[33]+RC[34]+RC[35]+RC[36]+RC[37] -> 810000 | G74: =RC[17]+RC[18]++RC[19]+RC[20]+RC[21]+RC[38]+RC[39]+RC[41] -> 0 | H74: 0 | I74: 0 | J74: =RC[-2]+RC[-1] -> 0 | K74: 0 | L74: 0 | M74: 0 | N74: =RC[15]+RC[16]+RC[17]+RC[18]+RC[19]+RC[20] -> 0 | O74: 0 | P74: 0 | Q74: 810000 | R74: 0 | S74: 0 | T74: 0 | U74: 8100 | V74: 0 | W74: 801900 | X74: 0 | Y74: 0 | Z74: 0 | AA74: 0 | AB74: 0 | AC74: 0 | AD74: 0 | AE74: 0 | AF74: 0 | AG74: 0 | AH74: 0 | AI74: 810000 | AJ74: 0 | AK74: 0 | AL74: 0 | AM74: 0 | AN74: 0 | AO74: 0 | AP74: 0 | AQ74: 0 | AR74: =1 -> 1 | AS74: 0 | AT74: 0 | AU74: =RC[-30]-RC[-29]-RC[-28]-RC[-27]-RC[-26]-RC[-25] -> 801900 | AV74: 0 | AW74: =RC[1]-RC[2] -> 0 | AX74: 0 | AY74: 0 | AZ74: =RC[-46] -> 810000 | BA74: =RC[-46] -> 0 | BB74: =RC[-46] -> 0 | BC74: =RC[-46] -> 0 | BD74: =RC[-46] -> 0 | BE74: =RC[-46] -> 0 | BF74: =RC[-46] -> 0 | BG74: =RC[-46] -> 0 | BH74: =RC[-46] -> 0 | BI74: =RC[-46] -> 0 | BJ74: =RC[-46] -> 0 | BK74: =RC[-46] -> 810000 | BL74: =RC[-46] -> 0 | BM74: =RC[-46] -> 0 | BN74: =RC[-46] -> 0 | BO74: =RC[-46] -> 8100 | BP74: =RC[-46] -> 0 | BQ74: =RC[-46] -> 801900 | BR74: =RC[-46] -> 0 | BS74: =RC[-46] -> 0 | BT74: =RC[-46] -> 0 | BU74: =RC[-46] -> 0 | BV74: =RC[-46] -> 0 | BW74: =RC[-46] -> 0 | BX74: =RC[-46] -> 0 | BY74: =RC[-46] -> 0 | BZ74: =RC[-46] -> 0 | CA74: =RC[-46] -> 0 | CB74: =RC[-46] -> 0 | CC74: =RC[-46] -> 810000 | CD74: =RC[-46] -> 0 | CE74: =RC[-46] -> 0 | CF74: =RC[-46] -> 0 | CG74: =RC[-46] -> 0 | CH74: =RC[-46] -> 0 | CI74: =RC[-46] -> 0 | CJ74: =RC[-46] -> 0 | CK74: =RC[-46] -> 0 | CL74: =RC[-46] -> 1 | CM74: =RC[-46] -> 0 | CN74: =RC[-46] -> 0 | CO74: =RC[-46] -> 801900 | CP74: =RC[-46] -> 0 | CQ74: =RC[-46] -> 0 | CR74: =RC[-46] -> 0 | CS74: =RC[-46] -> 0
A75: Đội phục vụ hành lý hàng hóa (HGS) | F75: =SUM(R[-29]C:R[-1]C) -> 23490000 | G75: =SUM(R[-29]C:R[-1]C) -> 0 | H75: =SUM(R[-29]C:R[-1]C) -> 0 | I75: =SUM(R[-29]C:R[-1]C) -> 0 | J75: =SUM(R[-29]C:R[-1]C) -> 0 | K75: =SUM(R[-29]C:R[-1]C) -> 0 | L75: =SUM(R[-29]C:R[-1]C) -> 0 | M75: =SUM(R[-29]C:R[-1]C) -> 0 | N75: =SUM(R[-29]C:R[-1]C) -> 0 | O75: =SUM(R[-29]C:R[-1]C) -> 0 | P75: =SUM(R[-29]C:R[-1]C) -> 0 | Q75: =SUM(R[-29]C:R[-1]C) -> 23490000 | R75: =SUM(R[-29]C:R[-1]C) -> 0 | S75: =SUM(R[-29]C:R[-1]C) -> 0 | T75: =SUM(R[-29]C:R[-1]C) -> 0 | U75: =SUM(R[-29]C:R[-1]C) -> 234900 | V75: =SUM(R[-29]C:R[-1]C) -> 0 | W75: =SUM(R[-29]C:R[-1]C) -> 23255100 | X75: =SUM(R[-29]C:R[-1]C) -> 0 | Y75: =SUM(R[-29]C:R[-1]C) -> 0 | Z75: =SUM(R[-29]C:R[-1]C) -> 0 | AA75: =SUM(R[-29]C:R[-1]C) -> 0 | AB75: =SUM(R[-29]C:R[-1]C) -> 0 | AC75: =SUM(R[-29]C:R[-1]C) -> 0 | AD75: =SUM(R[-29]C:R[-1]C) -> 0 | AE75: =SUM(R[-29]C:R[-1]C) -> 0 | AF75: =SUM(R[-29]C:R[-1]C) -> 0 | AG75: =SUM(R[-29]C:R[-1]C) -> 0 | AH75: =SUM(R[-29]C:R[-1]C) -> 0 | AI75: =SUM(R[-29]C:R[-1]C) -> 23490000 | AJ75: =SUM(R[-29]C:R[-1]C) -> 0 | AK75: =SUM(R[-29]C:R[-1]C) -> 0 | AL75: =SUM(R[-29]C:R[-1]C) -> 0 | AM75: =SUM(R[-29]C:R[-1]C) -> 0 | AN75: =SUM(R[-29]C:R[-1]C) -> 0 | AO75: =SUM(R[-29]C:R[-1]C) -> 0 | AP75: =SUM(R[-29]C:R[-1]C) -> 0 | AQ75: =SUM(R[-29]C:R[-1]C) -> 0 | AR75: =SUM(R[-29]C:R[-1]C) -> 29 | AS75: =SUM(R[-29]C:R[-1]C) -> 0 | AT75: =SUM(R[-29]C:R[-1]C) -> 0 | AU75: =SUM(R[-29]C:R[-1]C) -> 23255100 | AV75: =SUM(R[-29]C:R[-1]C) -> 0 | AW75: =SUM(R[-29]C:R[-1]C) -> 0 | AX75: =SUM(R[-29]C:R[-1]C) -> 0 | AY75: =SUM(R[-29]C:R[-1]C) -> 0
A76: Phòng Phục vụ kỹ thuật sân đỗ (HGS) | F76: =SUM(R[-31]C[46]:R[-1]C[46]) -> 23490000 | G76: =SUM(R[-31]C[46]:R[-1]C[46]) -> 0 | H76: =SUM(R[-31]C[46]:R[-1]C[46]) -> 0 | I76: =SUM(R[-31]C[46]:R[-1]C[46]) -> 0 | J76: =SUM(R[-31]C[46]:R[-1]C[46]) -> 0 | K76: =SUM(R[-31]C[46]:R[-1]C[46]) -> 0 | L76: =SUM(R[-31]C[46]:R[-1]C[46]) -> 0 | M76: =SUM(R[-31]C[46]:R[-1]C[46]) -> 0 | N76: =SUM(R[-31]C[46]:R[-1]C[46]) -> 0 | O76: =SUM(R[-31]C[46]:R[-1]C[46]) -> 0 | P76: =SUM(R[-31]C[46]:R[-1]C[46]) -> 0 | Q76: =SUM(R[-31]C[46]:R[-1]C[46]) -> 23490000 | R76: =SUM(R[-31]C[46]:R[-1]C[46]) -> 0 | S76: =SUM(R[-31]C[46]:R[-1]C[46]) -> 0 | T76: =SUM(R[-31]C[46]:R[-1]C[46]) -> 0 | U76: =SUM(R[-31]C[46]:R[-1]C[46]) -> 234900 | V76: =SUM(R[-31]C[46]:R[-1]C[46]) -> 0 | W76: =SUM(R[-31]C[46]:R[-1]C[46]) -> 23255100 | X76: =SUM(R[-31]C[46]:R[-1]C[46]) -> 0 | Y76: =SUM(R[-31]C[46]:R[-1]C[46]) -> 0 | Z76: =SUM(R[-31]C[46]:R[-1]C[46]) -> 0 | AA76: =SUM(R[-31]C[46]:R[-1]C[46]) -> 0 | AB76: =SUM(R[-31]C[46]:R[-1]C[46]) -> 0 | AC76: =SUM(R[-31]C[46]:R[-1]C[46]) -> 0 | AD76: =SUM(R[-31]C[46]:R[-1]C[46]) -> 0 | AE76: =SUM(R[-31]C[46]:R[-1]C[46]) -> 0 | AF76: =SUM(R[-31]C[46]:R[-1]C[46]) -> 0 | AG76: =SUM(R[-31]C[46]:R[-1]C[46]) -> 0 | AH76: =SUM(R[-31]C[46]:R[-1]C[46]) -> 0 | AI76: =SUM(R[-31]C[46]:R[-1]C[46]) -> 23490000 | AJ76: =SUM(R[-31]C[46]:R[-1]C[46]) -> 0 | AK76: =SUM(R[-31]C[46]:R[-1]C[46]) -> 0 | AL76: =SUM(R[-31]C[46]:R[-1]C[46]) -> 0 | AM76: =SUM(R[-31]C[46]:R[-1]C[46]) -> 0 | AN76: =SUM(R[-31]C[46]:R[-1]C[46]) -> 0 | AO76: =SUM(R[-31]C[46]:R[-1]C[46]) -> 0 | AP76: =SUM(R[-31]C[46]:R[-1]C[46]) -> 0 | AQ76: =SUM(R[-31]C[46]:R[-1]C[46]) -> 0 | AR76: =SUM(R[-31]C[46]:R[-1]C[46]) -> 29 | AS76: =SUM(R[-31]C[46]:R[-1]C[46]) -> 0 | AT76: =SUM(R[-31]C[46]:R[-1]C[46]) -> 0 | AU76: =SUM(R[-31]C[46]:R[-1]C[46]) -> 23255100 | AV76: =SUM(R[-31]C[46]:R[-1]C[46]) -> 0 | AW76: =SUM(R[-31]C[46]:R[-1]C[46]) -> 0 | AX76: =SUM(R[-31]C[46]:R[-1]C[46]) -> 0 | AY76: =SUM(R[-31]C[46]:R[-1]C[46]) -> 0
A77: Công ty Phục vụ mặt đất Hà Nội (HGS) | B77: =RC[42] -> 53 | C77: TỔNG CỘNG: | F77: =SUM(R[-67]C[46]:R[-1]C[46]) -> 42930000 | G77: =SUM(R[-67]C[46]:R[-1]C[46]) -> 0 | H77: =SUM(R[-67]C[46]:R[-1]C[46]) -> 0 | I77: =SUM(R[-67]C[46]:R[-1]C[46]) -> 0 | J77: =SUM(R[-67]C[46]:R[-1]C[46]) -> 0 | K77: =SUM(R[-67]C[46]:R[-1]C[46]) -> 0 | L77: =SUM(R[-67]C[46]:R[-1]C[46]) -> 0 | M77: =SUM(R[-67]C[46]:R[-1]C[46]) -> 0 | N77: =SUM(R[-67]C[46]:R[-1]C[46]) -> 0 | O77: =SUM(R[-67]C[46]:R[-1]C[46]) -> 0 | P77: =SUM(R[-67]C[46]:R[-1]C[46]) -> 0 | Q77: =SUM(R[-67]C[46]:R[-1]C[46]) -> 42930000 | R77: =SUM(R[-67]C[46]:R[-1]C[46]) -> 0 | S77: =SUM(R[-67]C[46]:R[-1]C[46]) -> 0 | T77: =SUM(R[-67]C[46]:R[-1]C[46]) -> 0 | U77: =SUM(R[-67]C[46]:R[-1]C[46]) -> 429300 | V77: =SUM(R[-67]C[46]:R[-1]C[46]) -> 0 | W77: =SUM(R[-67]C[46]:R[-1]C[46]) -> 42500700 | X77: =SUM(R[-67]C[46]:R[-1]C[46]) -> 0 | Y77: =SUM(R[-67]C[46]:R[-1]C[46]) -> 0 | Z77: =SUM(R[-67]C[46]:R[-1]C[46]) -> 0 | AA77: =SUM(R[-67]C[46]:R[-1]C[46]) -> 0 | AB77: =SUM(R[-67]C[46]:R[-1]C[46]) -> 0 | AC77: =SUM(R[-67]C[46]:R[-1]C[46]) -> 0 | AD77: =SUM(R[-67]C[46]:R[-1]C[46]) -> 0 | AE77: =SUM(R[-67]C[46]:R[-1]C[46]) -> 0 | AF77: =SUM(R[-67]C[46]:R[-1]C[46]) -> 0 | AG77: =SUM(R[-67]C[46]:R[-1]C[46]) -> 0 | AH77: =SUM(R[-67]C[46]:R[-1]C[46]) -> 0 | AI77: =SUM(R[-67]C[46]:R[-1]C[46]) -> 42930000 | AJ77: =SUM(R[-67]C[46]:R[-1]C[46]) -> 0 | AK77: =SUM(R[-67]C[46]:R[-1]C[46]) -> 0 | AL77: =SUM(R[-67]C[46]:R[-1]C[46]) -> 0 | AM77: =SUM(R[-67]C[46]:R[-1]C[46]) -> 0 | AN77: =SUM(R[-67]C[46]:R[-1]C[46]) -> 0 | AO77: =SUM(R[-67]C[46]:R[-1]C[46]) -> 0 | AP77: =SUM(R[-67]C[46]:R[-1]C[46]) -> 0 | AQ77: =SUM(R[-67]C[46]:R[-1]C[46]) -> 0 | AR77: =SUM(R[-67]C[46]:R[-1]C[46]) -> 53 | AS77: =SUM(R[-67]C[46]:R[-1]C[46]) -> 0 | AT77: =SUM(R[-67]C[46]:R[-1]C[46]) -> 0 | AU77: =SUM(R[-67]C[46]:R[-1]C[46]) -> 42500700 | AV77: =SUM(R[-67]C[46]:R[-1]C[46]) -> 0 | AW77: =SUM(R[-67]C[46]:R[-1]C[46]) -> 0 | AX77: =SUM(R[-67]C[46]:R[-1]C[46]) -> 0 | AY77: =SUM(R[-67]C[46]:R[-1]C[46]) -> 0
C79: NGƯỜI LẬP BẢNG | H79: THỦ TRƯỞNG ĐƠN VỊ | J79: THỦ TRƯỞNG ĐƠN VỊ | O79: BAN TCCB-LĐTL | U79: BAN TCKT
C81: =396+6-5 -> 397