Sheet: ExcelTemplate
A2: TỔNG CÔNG TY CẢNG HÀNG KHÔNG VIỆT NAM | H2: Ngày ___ tháng ___ năm _____
A3: ="ĐƠN VỊ :"&R[7]C -> ĐƠN VỊ :Công ty Phục vụ mặt đất Hà Nội (HGS)
A5: BẢNG TIỀN THƯỞNG TẾT ẤT MÙI 2015 | K5: 2015/01
A8: STT | B8: MÃ NV | C8: HỌ VÀ TÊN | D8: Thêm TK vào ô này | E8: CHỨC DANH CÔNG VIỆC | F8: SỐ THÁNG LÀM VIỆC | G8: SỐ TIỀN ĐƯỢC LĨNH | H8: KÝ NHẬN
A9: 1 | C9: 2 | E9: 3 | F9: 4 | G9: 5 | H9: 6
A10: Công ty Phục vụ mặt đất Hà Nội (HGS)
A11: Ban Giám đốc (HGS)
A13: 1 | B13: 010530 | C13: Bùi Tuấn Anh | E13: Giám đốc | F13: 12 | G13: 3600000 | I13: =1 -> 1 | J13: =RC[-4] -> 12 | K13: =RC[-4] -> 3600000 | L13: =RC[-3] -> 1
A14: 2 | B14: 010531 | C14: Nguyễn Huy Luân | E14: Phó Giám đốc | F14: 12 | G14: 3600000 | I14: =1 -> 1 | J14: =RC[-4] -> 12 | K14: =RC[-4] -> 3600000 | L14: =RC[-3] -> 1
A15: 3 | B15: 010532 | C15: Vũ Trung Thành | E15: Phó Giám đốc | F15: 12 | G15: 3600000 | I15: =1 -> 1 | J15: =RC[-4] -> 12 | K15: =RC[-4] -> 3600000 | L15: =RC[-3] -> 1
A16: 4 | B16: 010533 | C16: Trần Sỹ Hiến | E16: Phó Giám đốc | F16: 12 | G16: 3600000 | I16: =1 -> 1 | J16: =RC[-4] -> 12 | K16: =RC[-4] -> 3600000 | L16: =RC[-3] -> 1
F17: =SUM(R[-4]C:R[-1]C) -> 48 | G17: =SUM(R[-4]C:R[-1]C) -> 14400000 | I17: =SUM(R[-4]C:R[-1]C) -> 4
A18: Ban Giám đốc (HGS) | F18: =SUM(R[-6]C[4]:R[-1]C[4]) -> 48 | G18: =SUM(R[-6]C[4]:R[-1]C[4]) -> 14400000 | I18: =SUM(R[-6]C[3]:R[-1]C[3]) -> 4
A19: Phòng Điều hành, tài liệu và hướng dẫn chất xếp (HGS)
A21: 1 | B21: 010555 | C21: Nguyễn Ngọc Nguyên | E21: Trưởng phòng | F21: 12 | G21: 3600000 | I21: =1 -> 1 | J21: =RC[-4] -> 12 | K21: =RC[-4] -> 3600000 | L21: =RC[-3] -> 1
A22: 2 | B22: 010554 | C22: Nguyễn Đình Tuyến | E22: Phó Trưởng Phòng | F22: 12 | G22: 3600000 | I22: =1 -> 1 | J22: =RC[-4] -> 12 | K22: =RC[-4] -> 3600000 | L22: =RC[-3] -> 1
A23: 3 | B23: 010534 | C23: Nguyễn Tiến Hải | E23: KS CNTT | F23: 12 | G23: 3600000 | I23: =1 -> 1 | J23: =RC[-4] -> 12 | K23: =RC[-4] -> 3600000 | L23: =RC[-3] -> 1
A24: 4 | B24: 011084 | C24: Ngô Trí Dũng | E24: KS CNTT | F24: 12 | G24: 3600000 | I24: =1 -> 1 | J24: =RC[-4] -> 12 | K24: =RC[-4] -> 3600000 | L24: =RC[-3] -> 1
A25: 5 | B25: 011085 | C25: Phạm Văn Chiến | E25: KS CNTT | F25: 12 | G25: 3600000 | I25: =1 -> 1 | J25: =RC[-4] -> 12 | K25: =RC[-4] -> 3600000 | L25: =RC[-3] -> 1
A26: 6 | B26: 011862 | C26: Đỗ Việt Anh | E26: Nhân viên CNTT | F26: 12 | G26: 3600000 | I26: =1 -> 1 | J26: =RC[-4] -> 12 | K26: =RC[-4] -> 3600000 | L26: =RC[-3] -> 1
A27: 7 | B27: 011767 | C27: Nguyễn Thành Trung | E27: NV HDCX - CBTT | F27: 12 | G27: 3600000 | I27: =1 -> 1 | J27: =RC[-4] -> 12 | K27: =RC[-4] -> 3600000 | L27: =RC[-3] -> 1
A28: 8 | B28: 010622 | C28: Trịnh Xuân Hải | E28: NV PVHK | F28: 12 | G28: 3600000 | I28: =1 -> 1 | J28: =RC[-4] -> 12 | K28: =RC[-4] -> 3600000 | L28: =RC[-3] -> 1
A29: 9 | B29: 010537 | C29: Bùi Anh Khắc | E29: NV Tài liệu và HDCX | F29: 12 | G29: 3600000 | I29: =1 -> 1 | J29: =RC[-4] -> 12 | K29: =RC[-4] -> 3600000 | L29: =RC[-3] -> 1
A30: 10 | B30: 010538 | C30: Nguyễn Danh Trường | E30: NV Tài liệu và HDCX | F30: 12 | G30: 3600000 | I30: =1 -> 1 | J30: =RC[-4] -> 12 | K30: =RC[-4] -> 3600000 | L30: =RC[-3] -> 1
A31: 11 | B31: 010540 | C31: Nguyễn Thị Việt Hà | E31: NV Tài liệu và HDCX | F31: 12 | G31: 3600000 | I31: =1 -> 1 | J31: =RC[-4] -> 12 | K31: =RC[-4] -> 3600000 | L31: =RC[-3] -> 1
A32: 12 | B32: 010541 | C32: Nguyễn Thái Nam | E32: NV Tài liệu và HDCX | F32: 12 | G32: 3600000 | I32: =1 -> 1 | J32: =RC[-4] -> 12 | K32: =RC[-4] -> 3600000 | L32: =RC[-3] -> 1
A33: 13 | B33: 010542 | C33: Trần Minh Hải | E33: NV Tài liệu và HDCX | F33: 12 | G33: 3600000 | I33: =1 -> 1 | J33: =RC[-4] -> 12 | K33: =RC[-4] -> 3600000 | L33: =RC[-3] -> 1
A34: 14 | B34: 010543 | C34: Nguyễn Thị Thơm | E34: NV Tài liệu và HDCX | F34: 12 | G34: 3600000 | I34: =1 -> 1 | J34: =RC[-4] -> 12 | K34: =RC[-4] -> 3600000 | L34: =RC[-3] -> 1
A35: 15 | B35: 010544 | C35: Trần Thị Yến Nga | E35: NV Tài liệu và HDCX | F35: 12 | G35: 3600000 | I35: =1 -> 1 | J35: =RC[-4] -> 12 | K35: =RC[-4] -> 3600000 | L35: =RC[-3] -> 1
A36: 16 | B36: 010545 | C36: Ngô Thanh Hiệp | E36: NV Tài liệu và HDCX | F36: 12 | G36: 3600000 | I36: =1 -> 1 | J36: =RC[-4] -> 12 | K36: =RC[-4] -> 3600000 | L36: =RC[-3] -> 1
A37: 17 | B37: 010546 | C37: Tạ Đăng Việt | E37: NV Tài liệu và HDCX | F37: 12 | G37: 3600000 | I37: =1 -> 1 | J37: =RC[-4] -> 12 | K37: =RC[-4] -> 3600000 | L37: =RC[-3] -> 1
A38: 18 | B38: 010547 | C38: Đào Thanh Hải | E38: NV Tài liệu và HDCX | F38: 12 | G38: 3600000 | I38: =1 -> 1 | J38: =RC[-4] -> 12 | K38: =RC[-4] -> 3600000 | L38: =RC[-3] -> 1
A39: 19 | B39: 010548 | C39: Đỗ Vũ Hồng Quân | E39: NV Tài liệu và HDCX | F39: 12 | G39: 3600000 | I39: =1 -> 1 | J39: =RC[-4] -> 12 | K39: =RC[-4] -> 3600000 | L39: =RC[-3] -> 1
A40: 20 | B40: 010549 | C40: Nguyễn Thanh Hải | E40: NV Tài liệu và HDCX | F40: 12 | G40: 3600000 | I40: =1 -> 1 | J40: =RC[-4] -> 12 | K40: =RC[-4] -> 3600000 | L40: =RC[-3] -> 1
A41: 21 | B41: 010550 | C41: Vũ Đức Thiện | E41: NV Tài liệu và HDCX | F41: 12 | G41: 3600000 | I41: =1 -> 1 | J41: =RC[-4] -> 12 | K41: =RC[-4] -> 3600000 | L41: =RC[-3] -> 1
A42: 22 | B42: 010551 | C42: Ngô Ngọc Long | E42: NV Tài liệu và HDCX | F42: 12 | G42: 3600000 | I42: =1 -> 1 | J42: =RC[-4] -> 12 | K42: =RC[-4] -> 3600000 | L42: =RC[-3] -> 1
A43: 23 | B43: 010552 | C43: Nguyễn Thuý Hà | E43: NV Tài liệu và HDCX | F43: 12 | G43: 3600000 | I43: =1 -> 1 | J43: =RC[-4] -> 12 | K43: =RC[-4] -> 3600000 | L43: =RC[-3] -> 1
A44: 24 | B44: 010553 | C44: Đỗ Thanh Tùng | E44: NV Tài liệu và HDCX | F44: 12 | G44: 3600000 | I44: =1 -> 1 | J44: =RC[-4] -> 12 | K44: =RC[-4] -> 3600000 | L44: =RC[-3] -> 1
A45: 25 | B45: 011126 | C45: Nguyễn Thị Thanh Hoa | E45: NV Tài liệu và HDCX | F45: 12 | G45: 3600000 | I45: =1 -> 1 | J45: =RC[-4] -> 12 | K45: =RC[-4] -> 3600000 | L45: =RC[-3] -> 1
A46: 26 | B46: 011127 | C46: Phí Thị Huyền Trang | E46: NV Tài liệu và HDCX | F46: 12 | G46: 3600000 | I46: =1 -> 1 | J46: =RC[-4] -> 12 | K46: =RC[-4] -> 3600000 | L46: =RC[-3] -> 1
A47: 27 | B47: 011128 | C47: Hoàng Thị Yến | E47: NV Tài liệu và HDCX | F47: 12 | G47: 3600000 | I47: =1 -> 1 | J47: =RC[-4] -> 12 | K47: =RC[-4] -> 3600000 | L47: =RC[-3] -> 1
A48: 28 | B48: 011129 | C48: Nguyễn Văn Hiệp | E48: NV Tài liệu và HDCX | F48: 12 | G48: 3600000 | I48: =1 -> 1 | J48: =RC[-4] -> 12 | K48: =RC[-4] -> 3600000 | L48: =RC[-3] -> 1
A49: 29 | B49: 011130 | C49: Nguyễn Đình Trung | E49: NV Tài liệu và HDCX | F49: 12 | G49: 3600000 | I49: =1 -> 1 | J49: =RC[-4] -> 12 | K49: =RC[-4] -> 3600000 | L49: =RC[-3] -> 1
A50: 30 | B50: 011131 | C50: Vũ Tuấn Anh | E50: NV Tài liệu và HDCX | F50: 12 | G50: 3600000 | I50: =1 -> 1 | J50: =RC[-4] -> 12 | K50: =RC[-4] -> 3600000 | L50: =RC[-3] -> 1
A51: 31 | B51: 012552 | C51: Mai Hoàng Phương | E51: NV Tài liệu và HDCX | F51: 6 | G51: 1800000 | I51: =1 -> 1 | J51: =RC[-4] -> 6 | K51: =RC[-4] -> 1800000 | L51: =RC[-3] -> 1
A52: 32 | B52: 012553 | C52: Phạm Duy Hải | E52: NV Tài liệu và HDCX | F52: 6 | G52: 1800000 | I52: =1 -> 1 | J52: =RC[-4] -> 6 | K52: =RC[-4] -> 1800000 | L52: =RC[-3] -> 1
A53: 33 | B53: 012565 | C53: Vũ Trọng Nghĩa | E53: NV Tài liệu và HDCX | F53: 6 | G53: 1800000 | I53: =1 -> 1 | J53: =RC[-4] -> 6 | K53: =RC[-4] -> 1800000 | L53: =RC[-3] -> 1
A54: 34 | B54: 012566 | C54: Hoàng Duy Thái | E54: NV Tài liệu và HDCX | F54: 6 | G54: 1800000 | I54: =1 -> 1 | J54: =RC[-4] -> 6 | K54: =RC[-4] -> 1800000 | L54: =RC[-3] -> 1
A55: =+R[-1]C+1 -> 35 | B55: 010535 | C55: Nguyễn Văn Duẩn | E55: Nv Thống kê | F55: 12 | G55: 3600000 | I55: =1 -> 1 | J55: =RC[-4] -> 12 | K55: =RC[-4] -> 3600000 | L55: =RC[-3] -> 1
A56: =+R[-1]C+1 -> 36 | B56: 010536 | C56: Nguyễn Tiến Dũng | E56: NV ULD | F56: 12 | G56: 3600000 | I56: =1 -> 1 | J56: =RC[-4] -> 12 | K56: =RC[-4] -> 3600000 | L56: =RC[-3] -> 1
A57: =+R[-1]C+1 -> 37 | B57: 011355 | C57: Văn Anh Tuấn | E57: NV ULD | F57: 12 | G57: 3600000 | I57: =1 -> 1 | J57: =RC[-4] -> 12 | K57: =RC[-4] -> 3600000 | L57: =RC[-3] -> 1
A58: =+R[-1]C+1 -> 38 | B58: 012593 | C58: Phạm Trần Tuấn Minh | E58: NV ULD | F58: 6 | G58: 1800000 | I58: =1 -> 1 | J58: =RC[-4] -> 6 | K58: =RC[-4] -> 1800000 | L58: =RC[-3] -> 1
A59: =+R[-1]C+1 -> 39 | B59: 012594 | C59: Đỗ Đình Quân | E59: NV ULD | F59: 6 | G59: 1800000 | I59: =1 -> 1 | J59: =RC[-4] -> 6 | K59: =RC[-4] -> 1800000 | L59: =RC[-3] -> 1
A60: =+R[-1]C+1 -> 40 | B60: 012595 | C60: Lê Văn Lương | E60: NV ULD | F60: 6 | G60: 1800000 | I60: =1 -> 1 | J60: =RC[-4] -> 6 | K60: =RC[-4] -> 1800000 | L60: =RC[-3] -> 1
A61: =+R[-1]C+1 -> 41 | B61: 013102 | C61: Ngô Văn Sơn | E61: Nviên HDCX | F61: 2 | G61: 600000 | I61: =1 -> 1 | J61: =RC[-4] -> 2 | K61: =RC[-4] -> 600000 | L61: =RC[-3] -> 1
F62: =SUM(R[-41]C:R[-1]C) -> 440 | G62: =SUM(R[-41]C:R[-1]C) -> 132000000 | I62: =SUM(R[-41]C:R[-1]C) -> 41
A63: Phòng Điều hành, tài liệu và hướng dẫn chất xếp (HGS) | F63: =SUM(R[-43]C[4]:R[-1]C[4]) -> 440 | G63: =SUM(R[-43]C[4]:R[-1]C[4]) -> 132000000 | I63: =SUM(R[-43]C[3]:R[-1]C[3]) -> 41
A64: Phòng Kế hoạch - Kinh doanh (HGS)
A66: 1 | B66: 010563 | C66: Lưu Xuân Cường | E66: Phó Trưởng Phòng | F66: 12 | G66: 3600000 | I66: =1 -> 1 | J66: =RC[-4] -> 12 | K66: =RC[-4] -> 3600000 | L66: =RC[-3] -> 1
A67: 2 | B67: 010642 | C67: Lương Văn Thăng | E67: Phó Trưởng Phòng | F67: 12 | G67: 3600000 | I67: =1 -> 1 | J67: =RC[-4] -> 12 | K67: =RC[-4] -> 3600000 | L67: =RC[-3] -> 1
A68: 3 | B68: 010559 | C68: Nguyễn Tiến Hiệp | E68: NV Kế hoạch | F68: 12 | G68: 3600000 | I68: =1 -> 1 | J68: =RC[-4] -> 12 | K68: =RC[-4] -> 3600000 | L68: =RC[-3] -> 1
A69: 4 | B69: 010594 | C69: Lê Thị Thu Huyền | E69: NV Kế hoạch | F69: 12 | G69: 3600000 | I69: =1 -> 1 | J69: =RC[-4] -> 12 | K69: =RC[-4] -> 3600000 | L69: =RC[-3] -> 1
A70: 5 | B70: 011146 | C70: Trần Việt Phương | E70: NV Kế hoạch | F70: 12 | G70: 3600000 | I70: =1 -> 1 | J70: =RC[-4] -> 12 | K70: =RC[-4] -> 3600000 | L70: =RC[-3] -> 1
A71: 6 | B71: 010623 | C71: Bùi Đức Hưng | E71: NV Marketing | F71: 12 | G71: 3600000 | I71: =1 -> 1 | J71: =RC[-4] -> 12 | K71: =RC[-4] -> 3600000 | L71: =RC[-3] -> 1
A72: 7 | B72: 010561 | C72: Vũ Quảng Ba | E72: NV Thủ kho | F72: 12 | G72: 3600000 | I72: =1 -> 1 | J72: =RC[-4] -> 12 | K72: =RC[-4] -> 3600000 | L72: =RC[-3] -> 1
A73: 8 | B73: 010562 | C73: Phạm Thị Thịnh | E73: NV Thủ kho | F73: 12 | G73: 3600000 | I73: =1 -> 1 | J73: =RC[-4] -> 12 | K73: =RC[-4] -> 3600000 | L73: =RC[-3] -> 1
A74: 9 | B74: 010558 | C74: Vương Hoàng Linh | E74: Chuyên viên pháp lý | F74: 12 | G74: 3600000 | I74: =1 -> 1 | J74: =RC[-4] -> 12 | K74: =RC[-4] -> 3600000 | L74: =RC[-3] -> 1
F75: =SUM(R[-9]C:R[-1]C) -> 108 | G75: =SUM(R[-9]C:R[-1]C) -> 32400000 | I75: =SUM(R[-9]C:R[-1]C) -> 9
A76: Phòng Kế hoạch - Kinh doanh (HGS) | F76: =SUM(R[-11]C[4]:R[-1]C[4]) -> 108 | G76: =SUM(R[-11]C[4]:R[-1]C[4]) -> 32400000 | I76: =SUM(R[-11]C[3]:R[-1]C[3]) -> 9
A77: Phòng Phục vụ hành khách (HGS)
A78: Bộ phận nghiệp vụ PPVHK (HGS)
A79: 1 | B79: 010564 | C79: Nguyễn Thị Quỳnh Anh | E79: Nv Thống kê | F79: 12 | G79: 3600000 | I79: =1 -> 1 | J79: =RC[-4] -> 12 | K79: =RC[-4] -> 3600000 | L79: =RC[-3] -> 1
A80: Bộ phận nghiệp vụ PPVHK (HGS) | F80: =SUM(R[-1]C:R[-1]C) -> 12 | G80: =SUM(R[-1]C:R[-1]C) -> 3600000 | I80: =SUM(R[-1]C:R[-1]C) -> 1
A81: Cán bộ Phòng Phục vụ Hành khách (HGS)
A82: 1 | B82: 010641 | C82: Nguyễn Kim Oanh | E82: Trưởng phòng | F82: 12 | G82: 3600000 | I82: =1 -> 1 | J82: =RC[-4] -> 12 | K82: =RC[-4] -> 3600000 | L82: =RC[-3] -> 1
A83: 2 | B83: 010640 | C83: Trần Phương Dung | E83: Phó Trưởng Phòng | F83: 12 | G83: 3600000 | I83: =1 -> 1 | J83: =RC[-4] -> 12 | K83: =RC[-4] -> 3600000 | L83: =RC[-3] -> 1
A84: Cán bộ Phòng Phục vụ Hành khách (HGS) | F84: =SUM(R[-2]C:R[-1]C) -> 24 | G84: =SUM(R[-2]C:R[-1]C) -> 7200000 | I84: =SUM(R[-2]C:R[-1]C) -> 2
A85: Đội phục vụ hành khách đến (HGS)
A86: 1 | B86: 010629 | C86: Nguyễn Thị Cúc | E86: Đội trưởng | F86: 12 | G86: 3600000 | I86: =1 -> 1 | J86: =RC[-4] -> 12 | K86: =RC[-4] -> 3600000 | L86: =RC[-3] -> 1
A87: 2 | B87: 010628 | C87: Nguyễn Thị Thu Hà | E87: Đội phó | F87: 12 | G87: 3600000 | I87: =1 -> 1 | J87: =RC[-4] -> 12 | K87: =RC[-4] -> 3600000 | L87: =RC[-3] -> 1
A88: 3 | B88: 010570 | C88: Phạm Anh Dũng | E88: NV PVHK | F88: 12 | G88: 3600000 | I88: =1 -> 1 | J88: =RC[-4] -> 12 | K88: =RC[-4] -> 3600000 | L88: =RC[-3] -> 1
A89: 4 | B89: 010583 | C89: Nguyễn Thanh Huy | E89: NV PVHK | F89: 12 | G89: 3600000 | I89: =1 -> 1 | J89: =RC[-4] -> 12 | K89: =RC[-4] -> 3600000 | L89: =RC[-3] -> 1
A90: 5 | B90: 010585 | C90: Nguyễn Thị Minh Thu | E90: NV PVHK | F90: 12 | G90: 3600000 | I90: =1 -> 1 | J90: =RC[-4] -> 12 | K90: =RC[-4] -> 3600000 | L90: =RC[-3] -> 1
A91: 6 | B91: 010586 | C91: Nguyễn Thu Hằng | E91: NV PVHK | F91: 12 | G91: 3600000 | I91: =1 -> 1 | J91: =RC[-4] -> 12 | K91: =RC[-4] -> 3600000 | L91: =RC[-3] -> 1
A92: 7 | B92: 010590 | C92: Phạm Thị Hồng Hà | E92: NV PVHK | F92: 12 | G92: 3600000 | I92: =1 -> 1 | J92: =RC[-4] -> 12 | K92: =RC[-4] -> 3600000 | L92: =RC[-3] -> 1
A93: 8 | B93: 010600 | C93: Nguyễn Thị Vân Anh | E93: NV PVHK | F93: 12 | G93: 3600000 | I93: =1 -> 1 | J93: =RC[-4] -> 12 | K93: =RC[-4] -> 3600000 | L93: =RC[-3] -> 1
A94: 9 | B94: 010601 | C94: Phan Thị Hạnh | E94: NV PVHK | F94: 12 | G94: 3600000 | I94: =1 -> 1 | J94: =RC[-4] -> 12 | K94: =RC[-4] -> 3600000 | L94: =RC[-3] -> 1
A95: 10 | B95: 010608 | C95: Nguyễn Thị Hương | E95: NV PVHK | F95: 12 | G95: 3600000 | I95: =1 -> 1 | J95: =RC[-4] -> 12 | K95: =RC[-4] -> 3600000 | L95: =RC[-3] -> 1
A96: 11 | B96: 010624 | C96: Nguyễn Huyền Trang | E96: NV PVHK | F96: 12 | G96: 3600000 | I96: =1 -> 1 | J96: =RC[-4] -> 12 | K96: =RC[-4] -> 3600000 | L96: =RC[-3] -> 1
A97: 12 | B97: 010625 | C97: Vương Thị Thanh Nhàn | E97: NV PVHK | F97: 12 | G97: 3600000 | I97: =1 -> 1 | J97: =RC[-4] -> 12 | K97: =RC[-4] -> 3600000 | L97: =RC[-3] -> 1
A98: 13 | B98: 010633 | C98: Quàng Thị Phúc | E98: NV PVHK | F98: 12 | G98: 3600000 | I98: =1 -> 1 | J98: =RC[-4] -> 12 | K98: =RC[-4] -> 3600000 | L98: =RC[-3] -> 1
A99: 14 | B99: 010634 | C99: Phạm Thị Thanh Hoa | E99: NV PVHK | F99: 12 | G99: 3600000 | I99: =1 -> 1 | J99: =RC[-4] -> 12 | K99: =RC[-4] -> 3600000 | L99: =RC[-3] -> 1
A100: 15 | B100: 010635 | C100: Đào Thị Mận | E100: NV PVHK | F100: 12 | G100: 3600000 | I100: =1 -> 1 | J100: =RC[-4] -> 12 | K100: =RC[-4] -> 3600000 | L100: =RC[-3] -> 1
A101: 16 | B101: 010636 | C101: Trần Khánh Ly | E101: NV PVHK | F101: 2 | G101: 600000 | I101: =1 -> 1 | J101: =RC[-4] -> 2 | K101: =RC[-4] -> 600000 | L101: =RC[-3] -> 1
A102: 17 | B102: 011104 | C102: Lê Thị Thanh Huyền | E102: NV PVHK | F102: 12 | G102: 3600000 | I102: =1 -> 1 | J102: =RC[-4] -> 12 | K102: =RC[-4] -> 3600000 | L102: =RC[-3] -> 1
A103: 18 | B103: 011105 | C103: Ngô Minh Thanh | E103: NV PVHK | F103: 12 | G103: 3600000 | I103: =1 -> 1 | J103: =RC[-4] -> 12 | K103: =RC[-4] -> 3600000 | L103: =RC[-3] -> 1
A104: 19 | B104: 011106 | C104: Lê Thị Trang Nhung | E104: NV PVHK | F104: 12 | G104: 3600000 | I104: =1 -> 1 | J104: =RC[-4] -> 12 | K104: =RC[-4] -> 3600000 | L104: =RC[-3] -> 1
A105: 20 | B105: 011107 | C105: Vũ Thị Thơm | E105: NV PVHK | F105: 12 | G105: 3600000 | I105: =1 -> 1 | J105: =RC[-4] -> 12 | K105: =RC[-4] -> 3600000 | L105: =RC[-3] -> 1
A106: 21 | B106: 011108 | C106: Phạm Thùy Dung | E106: NV PVHK | F106: 12 | G106: 3600000 | I106: =1 -> 1 | J106: =RC[-4] -> 12 | K106: =RC[-4] -> 3600000 | L106: =RC[-3] -> 1
A107: 22 | B107: 011109 | C107: Phạm Thành Việt | E107: NV PVHK | F107: 12 | G107: 3600000 | I107: =1 -> 1 | J107: =RC[-4] -> 12 | K107: =RC[-4] -> 3600000 | L107: =RC[-3] -> 1
A108: 23 | B108: 011766 | C108: Nguyễn Thị Vân | E108: NV PVHK | F108: 12 | G108: 3600000 | I108: =1 -> 1 | J108: =RC[-4] -> 12 | K108: =RC[-4] -> 3600000 | L108: =RC[-3] -> 1
A109: 24 | B109: 010637 | C109: Trần Đình Cát | E109: NV trông giữ hành lý | F109: 12 | G109: 3600000 | I109: =1 -> 1 | J109: =RC[-4] -> 12 | K109: =RC[-4] -> 3600000 | L109: =RC[-3] -> 1
A110: 25 | B110: 010778 | C110: Nguyễn Thị Hồng Anh | E110: Nv VS MB | F110: 12 | G110: 3600000 | I110: =1 -> 1 | J110: =RC[-4] -> 12 | K110: =RC[-4] -> 3600000 | L110: =RC[-3] -> 1
A111: Đội phục vụ hành khách đến (HGS) | F111: =SUM(R[-25]C:R[-1]C) -> 290 | G111: =SUM(R[-25]C:R[-1]C) -> 87000000 | I111: =SUM(R[-25]C:R[-1]C) -> 25
A112: Đội phục vụ hành khách đi (HGS)
A113: 1 | B113: 010631 | C113: Nguyễn Thị Phương Mai | E113: Đội trưởng | F113: 12 | G113: 3600000 | I113: =1 -> 1 | J113: =RC[-4] -> 12 | K113: =RC[-4] -> 3600000 | L113: =RC[-3] -> 1
A114: 2 | B114: 010630 | C114: Nguyễn Thị Thu Hương | E114: Đội phó | F114: 12 | G114: 3600000 | I114: =1 -> 1 | J114: =RC[-4] -> 12 | K114: =RC[-4] -> 3600000 | L114: =RC[-3] -> 1
A115: 3 | B115: 010632 | C115: Trần Thanh Hiếu | E115: Đội phó | F115: 12 | G115: 3600000 | I115: =1 -> 1 | J115: =RC[-4] -> 12 | K115: =RC[-4] -> 3600000 | L115: =RC[-3] -> 1
A116: 4 | B116: 012549 | C116: Nguyễn Tuấn Linh | E116: Nhân viên phục vụ hành khách hàng hóa | F116: 6 | G116: 1800000 | I116: =1 -> 1 | J116: =RC[-4] -> 6 | K116: =RC[-4] -> 1800000 | L116: =RC[-3] -> 1
A117: 5 | B117: 012554 | C117: Ngô Thị Tuyết Nhung | E117: Nhân viên phục vụ hành khách hàng hóa | F117: 6 | G117: 1800000 | I117: =1 -> 1 | J117: =RC[-4] -> 6 | K117: =RC[-4] -> 1800000 | L117: =RC[-3] -> 1
A118: 6 | B118: 012555 | C118: Đinh Thanh Ngân | E118: Nhân viên phục vụ hành khách hàng hóa | F118: 6 | G118: 1800000 | I118: =1 -> 1 | J118: =RC[-4] -> 6 | K118: =RC[-4] -> 1800000 | L118: =RC[-3] -> 1
A119: 7 | B119: 012557 | C119: Nguyễn Thị Lan | E119: Nhân viên phục vụ hành khách hàng hóa | F119: 6 | G119: 1800000 | I119: =1 -> 1 | J119: =RC[-4] -> 6 | K119: =RC[-4] -> 1800000 | L119: =RC[-3] -> 1
A120: 8 | B120: 012558 | C120: Tạ Hồng Hạnh | E120: Nhân viên phục vụ hành khách hàng hóa | F120: 6 | G120: 1800000 | I120: =1 -> 1 | J120: =RC[-4] -> 6 | K120: =RC[-4] -> 1800000 | L120: =RC[-3] -> 1
A121: 9 | B121: 012559 | C121: Phạm Thị Mai Giang | E121: Nhân viên phục vụ hành khách hàng hóa | F121: 6 | G121: 1800000 | I121: =1 -> 1 | J121: =RC[-4] -> 6 | K121: =RC[-4] -> 1800000 | L121: =RC[-3] -> 1
A122: 10 | B122: 012561 | C122: Lê Thị Hồng Vân | E122: Nhân viên phục vụ hành khách hàng hóa | F122: 6 | G122: 1800000 | I122: =1 -> 1 | J122: =RC[-4] -> 6 | K122: =RC[-4] -> 1800000 | L122: =RC[-3] -> 1
A123: 11 | B123: 012562 | C123: Đỗ Thị Thu Trang | E123: Nhân viên phục vụ hành khách hàng hóa | F123: 6 | G123: 1800000 | I123: =1 -> 1 | J123: =RC[-4] -> 6 | K123: =RC[-4] -> 1800000 | L123: =RC[-3] -> 1
A124: 12 | B124: 012563 | C124: Trịnh Khánh Linh | E124: Nhân viên phục vụ hành khách hàng hóa | F124: 6 | G124: 1800000 | I124: =1 -> 1 | J124: =RC[-4] -> 6 | K124: =RC[-4] -> 1800000 | L124: =RC[-3] -> 1
A125: 13 | B125: 012564 | C125: Đặng Thị Thu Hà | E125: Nhân viên phục vụ hành khách hàng hóa | F125: 6 | G125: 1800000 | I125: =1 -> 1 | J125: =RC[-4] -> 6 | K125: =RC[-4] -> 1800000 | L125: =RC[-3] -> 1
A126: 14 | B126: 012567 | C126: Nguyễn Thị Hải Yến | E126: Nhân viên phục vụ hành khách hàng hóa | F126: 6 | G126: 1800000 | I126: =1 -> 1 | J126: =RC[-4] -> 6 | K126: =RC[-4] -> 1800000 | L126: =RC[-3] -> 1
A127: 15 | B127: 012568 | C127: Nguyễn Thị Hồng Minh | E127: Nhân viên phục vụ hành khách hàng hóa | F127: 6 | G127: 1800000 | I127: =1 -> 1 | J127: =RC[-4] -> 6 | K127: =RC[-4] -> 1800000 | L127: =RC[-3] -> 1
A128: 16 | B128: 012569 | C128: Cấn Hà An | E128: Nhân viên phục vụ hành khách hàng hóa | F128: 6 | G128: 1800000 | I128: =1 -> 1 | J128: =RC[-4] -> 6 | K128: =RC[-4] -> 1800000 | L128: =RC[-3] -> 1
A129: 17 | B129: 012570 | C129: Nguyễn Hoàng Hải | E129: Nhân viên phục vụ hành khách hàng hóa | F129: 6 | G129: 1800000 | I129: =1 -> 1 | J129: =RC[-4] -> 6 | K129: =RC[-4] -> 1800000 | L129: =RC[-3] -> 1
A130: 18 | B130: 012571 | C130: Ngô Thị Diễm Quỳnh | E130: Nhân viên phục vụ hành khách hàng hóa | F130: 6 | G130: 1800000 | I130: =1 -> 1 | J130: =RC[-4] -> 6 | K130: =RC[-4] -> 1800000 | L130: =RC[-3] -> 1
A131: 19 | B131: 010569 | C131: Đàm Thu Hường | E131: NV PVHK | F131: 12 | G131: 3600000 | I131: =1 -> 1 | J131: =RC[-4] -> 12 | K131: =RC[-4] -> 3600000 | L131: =RC[-3] -> 1
A132: 20 | B132: 010571 | C132: Nguyễn Thị Thuỳ Dung | E132: NV PVHK | F132: 12 | G132: 3600000 | I132: =1 -> 1 | J132: =RC[-4] -> 12 | K132: =RC[-4] -> 3600000 | L132: =RC[-3] -> 1
A133: 21 | B133: 010572 | C133: Võ Thị Hồng Minh | E133: NV PVHK | F133: 12 | G133: 3600000 | I133: =1 -> 1 | J133: =RC[-4] -> 12 | K133: =RC[-4] -> 3600000 | L133: =RC[-3] -> 1
A134: 22 | B134: 010574 | C134: Nguyễn Thị Hồng Duyên | E134: NV PVHK | F134: 12 | G134: 3600000 | I134: =1 -> 1 | J134: =RC[-4] -> 12 | K134: =RC[-4] -> 3600000 | L134: =RC[-3] -> 1
A135: 23 | B135: 010575 | C135: Phan Thị Thu Hường | E135: NV PVHK | F135: 12 | G135: 3600000 | I135: =1 -> 1 | J135: =RC[-4] -> 12 | K135: =RC[-4] -> 3600000 | L135: =RC[-3] -> 1
A136: 24 | B136: 010578 | C136: Bùi Việt Quang | E136: NV PVHK | F136: 12 | G136: 3600000 | I136: =1 -> 1 | J136: =RC[-4] -> 12 | K136: =RC[-4] -> 3600000 | L136: =RC[-3] -> 1
A137: 25 | B137: 010579 | C137: Tạ Thị Cẩm Vân | E137: NV PVHK | F137: 11 | G137: 3300000 | I137: =1 -> 1 | J137: =RC[-4] -> 11 | K137: =RC[-4] -> 3300000 | L137: =RC[-3] -> 1
A138: 26 | B138: 010581 | C138: Nguyễn Thị Hoài | E138: NV PVHK | F138: 12 | G138: 3600000 | I138: =1 -> 1 | J138: =RC[-4] -> 12 | K138: =RC[-4] -> 3600000 | L138: =RC[-3] -> 1
A139: 27 | B139: 010582 | C139: Nguyễn Mạnh Hùng | E139: NV PVHK | F139: 11 | G139: 3300000 | I139: =1 -> 1 | J139: =RC[-4] -> 11 | K139: =RC[-4] -> 3300000 | L139: =RC[-3] -> 1
A140: 28 | B140: 010587 | C140: Nguyễn Thị Tú Oanh | E140: NV PVHK | F140: 12 | G140: 3600000 | I140: =1 -> 1 | J140: =RC[-4] -> 12 | K140: =RC[-4] -> 3600000 | L140: =RC[-3] -> 1
A141: 29 | B141: 010589 | C141: Phạm Thị Ba | E141: NV PVHK | F141: 12 | G141: 3600000 | I141: =1 -> 1 | J141: =RC[-4] -> 12 | K141: =RC[-4] -> 3600000 | L141: =RC[-3] -> 1
A142: 30 | B142: 010591 | C142: Vũ Phương Thanh | E142: NV PVHK | F142: 12 | G142: 3600000 | I142: =1 -> 1 | J142: =RC[-4] -> 12 | K142: =RC[-4] -> 3600000 | L142: =RC[-3] -> 1
A143: 31 | B143: 010592 | C143: Trần Thị Thu Huyền | E143: NV PVHK | F143: 12 | G143: 3600000 | I143: =1 -> 1 | J143: =RC[-4] -> 12 | K143: =RC[-4] -> 3600000 | L143: =RC[-3] -> 1
A144: 32 | B144: 010596 | C144: Phạm Thị Ánh Hồng | E144: NV PVHK | F144: 12 | G144: 3600000 | I144: =1 -> 1 | J144: =RC[-4] -> 12 | K144: =RC[-4] -> 3600000 | L144: =RC[-3] -> 1
A145: 33 | B145: 010597 | C145: Nguyễn Thị Thu Sang | E145: NV PVHK | F145: 12 | G145: 3600000 | I145: =1 -> 1 | J145: =RC[-4] -> 12 | K145: =RC[-4] -> 3600000 | L145: =RC[-3] -> 1
A146: 34 | B146: 010598 | C146: Nguyễn Ngọc Quân | E146: NV PVHK | F146: 12 | G146: 3600000 | I146: =1 -> 1 | J146: =RC[-4] -> 12 | K146: =RC[-4] -> 3600000 | L146: =RC[-3] -> 1
A147: 35 | B147: 010599 | C147: Đào Thu Giang | E147: NV PVHK | F147: 12 | G147: 3600000 | I147: =1 -> 1 | J147: =RC[-4] -> 12 | K147: =RC[-4] -> 3600000 | L147: =RC[-3] -> 1
A148: 36 | B148: 010602 | C148: Nguyễn Thị Thu Trang | E148: NV PVHK | F148: 12 | G148: 3600000 | I148: =1 -> 1 | J148: =RC[-4] -> 12 | K148: =RC[-4] -> 3600000 | L148: =RC[-3] -> 1
A149: 37 | B149: 010603 | C149: Nguyễn Thị Vân Anh | E149: NV PVHK | F149: 12 | G149: 3600000 | I149: =1 -> 1 | J149: =RC[-4] -> 12 | K149: =RC[-4] -> 3600000 | L149: =RC[-3] -> 1
A150: 38 | B150: 010604 | C150: Nguyễn Thị Hồng | E150: NV PVHK | F150: 12 | G150: 3600000 | I150: =1 -> 1 | J150: =RC[-4] -> 12 | K150: =RC[-4] -> 3600000 | L150: =RC[-3] -> 1
A151: 39 | B151: 010605 | C151: Nguyễn Thị Thuỳ Dương | E151: NV PVHK | F151: 12 | G151: 3600000 | I151: =1 -> 1 | J151: =RC[-4] -> 12 | K151: =RC[-4] -> 3600000 | L151: =RC[-3] -> 1
A152: 40 | B152: 010606 | C152: Lê Thị Thao | E152: NV PVHK | F152: 12 | G152: 3600000 | I152: =1 -> 1 | J152: =RC[-4] -> 12 | K152: =RC[-4] -> 3600000 | L152: =RC[-3] -> 1
A153: 41 | B153: 010611 | C153: Hoàng Thị Huyền Diệu | E153: NV PVHK | F153: 12 | G153: 3600000 | I153: =1 -> 1 | J153: =RC[-4] -> 12 | K153: =RC[-4] -> 3600000 | L153: =RC[-3] -> 1
A154: 42 | B154: 010612 | C154: Tạ Thị Phượng | E154: NV PVHK | F154: 12 | G154: 3600000 | I154: =1 -> 1 | J154: =RC[-4] -> 12 | K154: =RC[-4] -> 3600000 | L154: =RC[-3] -> 1
A155: 43 | B155: 010613 | C155: Nguyễn Thị Hường | E155: NV PVHK | F155: 12 | G155: 3600000 | I155: =1 -> 1 | J155: =RC[-4] -> 12 | K155: =RC[-4] -> 3600000 | L155: =RC[-3] -> 1
A156: 44 | B156: 010616 | C156: Đỗ Thanh Thuỷ | E156: NV PVHK | F156: 12 | G156: 3600000 | I156: =1 -> 1 | J156: =RC[-4] -> 12 | K156: =RC[-4] -> 3600000 | L156: =RC[-3] -> 1
A157: 45 | B157: 010617 | C157: Ngô Thị Hường | E157: NV PVHK | F157: 12 | G157: 3600000 | I157: =1 -> 1 | J157: =RC[-4] -> 12 | K157: =RC[-4] -> 3600000 | L157: =RC[-3] -> 1
A158: 46 | B158: 010618 | C158: Nguyễn Thị Hằng | E158: NV PVHK | F158: 12 | G158: 3600000 | I158: =1 -> 1 | J158: =RC[-4] -> 12 | K158: =RC[-4] -> 3600000 | L158: =RC[-3] -> 1
A159: 47 | B159: 010619 | C159: Phạm Thị Thu Hương | E159: NV PVHK | F159: 12 | G159: 3600000 | I159: =1 -> 1 | J159: =RC[-4] -> 12 | K159: =RC[-4] -> 3600000 | L159: =RC[-3] -> 1
A160: 48 | B160: 010620 | C160: Trần Thị Thu | E160: NV PVHK | F160: 12 | G160: 3600000 | I160: =1 -> 1 | J160: =RC[-4] -> 12 | K160: =RC[-4] -> 3600000 | L160: =RC[-3] -> 1
A161: 49 | B161: 010621 | C161: Hoàng Anh Trang | E161: NV PVHK | F161: 10 | G161: 3000000 | I161: =1 -> 1 | J161: =RC[-4] -> 10 | K161: =RC[-4] -> 3000000 | L161: =RC[-3] -> 1
A162: 50 | B162: 010627 | C162: Trần Thị Thu | E162: NV PVHK | F162: 12 | G162: 3600000 | I162: =1 -> 1 | J162: =RC[-4] -> 12 | K162: =RC[-4] -> 3600000 | L162: =RC[-3] -> 1
A163: 51 | B163: 011110 | C163: Đinh Thị Vân Anh | E163: NV PVHK | F163: 12 | G163: 3600000 | I163: =1 -> 1 | J163: =RC[-4] -> 12 | K163: =RC[-4] -> 3600000 | L163: =RC[-3] -> 1
A164: 52 | B164: 011111 | C164: Phạm Kim Hoàn | E164: NV PVHK | F164: 12 | G164: 3600000 | I164: =1 -> 1 | J164: =RC[-4] -> 12 | K164: =RC[-4] -> 3600000 | L164: =RC[-3] -> 1
A165: 53 | B165: 011112 | C165: Đào Xuân Tuân | E165: NV PVHK | F165: 12 | G165: 3600000 | I165: =1 -> 1 | J165: =RC[-4] -> 12 | K165: =RC[-4] -> 3600000 | L165: =RC[-3] -> 1
A166: 54 | B166: 011113 | C166: Trịnh Thị Hạnh | E166: NV PVHK | F166: 12 | G166: 3600000 | I166: =1 -> 1 | J166: =RC[-4] -> 12 | K166: =RC[-4] -> 3600000 | L166: =RC[-3] -> 1
A167: 55 | B167: 011114 | C167: Đoàn Thu Hoa | E167: NV PVHK | F167: 12 | G167: 3600000 | I167: =1 -> 1 | J167: =RC[-4] -> 12 | K167: =RC[-4] -> 3600000 | L167: =RC[-3] -> 1
A168: 56 | B168: 011115 | C168: Mai Thị Ngọc | E168: NV PVHK | F168: 12 | G168: 3600000 | I168: =1 -> 1 | J168: =RC[-4] -> 12 | K168: =RC[-4] -> 3600000 | L168: =RC[-3] -> 1
A169: 57 | B169: 011116 | C169: Đỗ Thanh Bình | E169: NV PVHK | F169: 12 | G169: 3600000 | I169: =1 -> 1 | J169: =RC[-4] -> 12 | K169: =RC[-4] -> 3600000 | L169: =RC[-3] -> 1
A170: 58 | B170: 011117 | C170: Nguyễn Hương Giang | E170: NV PVHK | F170: 12 | G170: 3600000 | I170: =1 -> 1 | J170: =RC[-4] -> 12 | K170: =RC[-4] -> 3600000 | L170: =RC[-3] -> 1
A171: 59 | B171: 011118 | C171: Lã Thị Thu Hương | E171: NV PVHK | F171: 12 | G171: 3600000 | I171: =1 -> 1 | J171: =RC[-4] -> 12 | K171: =RC[-4] -> 3600000 | L171: =RC[-3] -> 1
A172: 60 | B172: 011119 | C172: Nguyễn Hương Quỳnh | E172: NV PVHK | F172: 12 | G172: 3600000 | I172: =1 -> 1 | J172: =RC[-4] -> 12 | K172: =RC[-4] -> 3600000 | L172: =RC[-3] -> 1
A173: 61 | B173: 011120 | C173: Đỗ Hương Trà | E173: NV PVHK | F173: 12 | G173: 3600000 | I173: =1 -> 1 | J173: =RC[-4] -> 12 | K173: =RC[-4] -> 3600000 | L173: =RC[-3] -> 1
A174: 62 | B174: 011121 | C174: Nguyễn Hiền Hạnh | E174: NV PVHK | F174: 12 | G174: 3600000 | I174: =1 -> 1 | J174: =RC[-4] -> 12 | K174: =RC[-4] -> 3600000 | L174: =RC[-3] -> 1
A175: 63 | B175: 011122 | C175: Nguyễn Thị Huyền | E175: NV PVHK | F175: 12 | G175: 3600000 | I175: =1 -> 1 | J175: =RC[-4] -> 12 | K175: =RC[-4] -> 3600000 | L175: =RC[-3] -> 1
A176: 64 | B176: 011123 | C176: Bùi Thị Bảo Ngọc | E176: NV PVHK | F176: 12 | G176: 3600000 | I176: =1 -> 1 | J176: =RC[-4] -> 12 | K176: =RC[-4] -> 3600000 | L176: =RC[-3] -> 1
A177: 65 | B177: 011764 | C177: Nguyễn Thu Huyền | E177: NV PVHK | F177: 11 | G177: 3300000 | I177: =1 -> 1 | J177: =RC[-4] -> 11 | K177: =RC[-4] -> 3300000 | L177: =RC[-3] -> 1
A178: 66 | B178: 011765 | C178: Hoàng Thị Hồng Nhung | E178: NV PVHK | F178: 12 | G178: 3600000 | I178: =1 -> 1 | J178: =RC[-4] -> 12 | K178: =RC[-4] -> 3600000 | L178: =RC[-3] -> 1
A179: 67 | B179: 012281 | C179: Nguyễn Minh Phương | E179: NV PVHK | F179: 11 | G179: 3300000 | I179: =1 -> 1 | J179: =RC[-4] -> 11 | K179: =RC[-4] -> 3300000 | L179: =RC[-3] -> 1
A180: 68 | B180: 013096 | C180: Đinh Văn Long | E180: NV PVHK | F180: 2 | G180: 600000 | I180: =1 -> 1 | J180: =RC[-4] -> 2 | K180: =RC[-4] -> 600000 | L180: =RC[-3] -> 1
A181: 69 | B181: 013097 | C181: Nguyễn Thu Quỳnh | E181: NV PVHK | F181: 2 | G181: 600000 | I181: =1 -> 1 | J181: =RC[-4] -> 2 | K181: =RC[-4] -> 600000 | L181: =RC[-3] -> 1
A182: 70 | B182: 013101 | C182: Trần Thị Huệ | E182: NV PVHK | F182: 2 | G182: 600000 | I182: =1 -> 1 | J182: =RC[-4] -> 2 | K182: =RC[-4] -> 600000 | L182: =RC[-3] -> 1
A183: 71 | B183: 011357 | C183: Nguyễn Việt Dũng | E183: NV PVHKĐB | F183: 12 | G183: 3600000 | I183: =1 -> 1 | J183: =RC[-4] -> 12 | K183: =RC[-4] -> 3600000 | L183: =RC[-3] -> 1
A184: Đội phục vụ hành khách đi (HGS) | F184: =SUM(R[-71]C:R[-1]C) -> 726 | G184: =SUM(R[-71]C:R[-1]C) -> 217800000 | I184: =SUM(R[-71]C:R[-1]C) -> 71
A185: Phòng Phục vụ hành khách (HGS) | F185: =SUM(R[-107]C[4]:R[-1]C[4]) -> 1052 | G185: =SUM(R[-107]C[4]:R[-1]C[4]) -> 315600000 | I185: =SUM(R[-107]C[3]:R[-1]C[3]) -> 99
A186: Phòng Phục vụ kỹ thuật sân đỗ (HGS)
A187: 1 | B187: 010765 | C187: Nguyễn Thị Thuý | E187: Nv Thống kê | F187: 12 | G187: 3600000 | I187: =1 -> 1 | J187: =RC[-4] -> 12 | K187: =RC[-4] -> 3600000 | L187: =RC[-3] -> 1
F188: =SUM(R[-1]C:R[-1]C) -> 12 | G188: =SUM(R[-1]C:R[-1]C) -> 3600000 | I188: =SUM(R[-1]C:R[-1]C) -> 1
A189: Cán bộ Phòng Phục vụ Kỹ thuật sân đỗ (HGS)
A190: 1 | B190: 010787 | C190: Lê Đình Tuấn | E190: Trưởng phòng | F190: 12 | G190: 3600000 | I190: =1 -> 1 | J190: =RC[-4] -> 12 | K190: =RC[-4] -> 3600000 | L190: =RC[-3] -> 1
A191: 2 | B191: 010785 | C191: Nguyễn Duy Thái | E191: Phó Trưởng Phòng | F191: 12 | G191: 3600000 | I191: =1 -> 1 | J191: =RC[-4] -> 12 | K191: =RC[-4] -> 3600000 | L191: =RC[-3] -> 1
A192: 3 | B192: 010786 | C192: Nguyễn Hà Thanh | E192: Phó Trưởng Phòng | F192: 12 | G192: 3600000 | I192: =1 -> 1 | J192: =RC[-4] -> 12 | K192: =RC[-4] -> 3600000 | L192: =RC[-3] -> 1
A193: Cán bộ Phòng Phục vụ Kỹ thuật sân đỗ (HGS) | F193: =SUM(R[-3]C:R[-1]C) -> 36 | G193: =SUM(R[-3]C:R[-1]C) -> 10800000 | I193: =SUM(R[-3]C:R[-1]C) -> 3
A194: Đội cầu, xe kéo đẩy (HGS)
A195: 1 | B195: 010753 | C195: Hoàng Việt Cường | E195: Đội trưởng | F195: 12 | G195: 3600000 | I195: =1 -> 1 | J195: =RC[-4] -> 12 | K195: =RC[-4] -> 3600000 | L195: =RC[-3] -> 1
A196: 2 | B196: 010704 | C196: Ngô Quốc Khánh | E196: Đội phó | F196: 12 | G196: 3600000 | I196: =1 -> 1 | J196: =RC[-4] -> 12 | K196: =RC[-4] -> 3600000 | L196: =RC[-3] -> 1
A197: 3 | B197: 010686 | C197: Đỗ Anh Tuấn | E197: NV Lái xe - VHTTB | F197: 12 | G197: 3600000 | I197: =1 -> 1 | J197: =RC[-4] -> 12 | K197: =RC[-4] -> 3600000 | L197: =RC[-3] -> 1
A198: 4 | B198: 010687 | C198: Lê Hồng Nam | E198: NV Lái xe - VHTTB | F198: 12 | G198: 3600000 | I198: =1 -> 1 | J198: =RC[-4] -> 12 | K198: =RC[-4] -> 3600000 | L198: =RC[-3] -> 1
A199: 5 | B199: 010688 | C199: Cao Thế Vinh | E199: NV Lái xe - VHTTB | F199: 12 | G199: 3600000 | I199: =1 -> 1 | J199: =RC[-4] -> 12 | K199: =RC[-4] -> 3600000 | L199: =RC[-3] -> 1
A200: 6 | B200: 010689 | C200: Đỗ Minh Hải | E200: NV Lái xe - VHTTB | F200: 12 | G200: 3600000 | I200: =1 -> 1 | J200: =RC[-4] -> 12 | K200: =RC[-4] -> 3600000 | L200: =RC[-3] -> 1
A201: 7 | B201: 010690 | C201: Phạm Đăng Khoa | E201: NV Lái xe - VHTTB | F201: 12 | G201: 3600000 | I201: =1 -> 1 | J201: =RC[-4] -> 12 | K201: =RC[-4] -> 3600000 | L201: =RC[-3] -> 1
A202: 8 | B202: 010691 | C202: Hoàng Văn Thanh | E202: NV Lái xe - VHTTB | F202: 12 | G202: 3600000 | I202: =1 -> 1 | J202: =RC[-4] -> 12 | K202: =RC[-4] -> 3600000 | L202: =RC[-3] -> 1
A203: 9 | B203: 010692 | C203: Đỗ Quang Tiến | E203: NV Lái xe - VHTTB | F203: 12 | G203: 3600000 | I203: =1 -> 1 | J203: =RC[-4] -> 12 | K203: =RC[-4] -> 3600000 | L203: =RC[-3] -> 1
A204: 10 | B204: 010693 | C204: Hoàng Sơn | E204: NV Lái xe - VHTTB | F204: 12 | G204: 3600000 | I204: =1 -> 1 | J204: =RC[-4] -> 12 | K204: =RC[-4] -> 3600000 | L204: =RC[-3] -> 1
A205: 11 | B205: 010694 | C205: Trần Văn Trà | E205: NV Lái xe - VHTTB | F205: 12 | G205: 3600000 | I205: =1 -> 1 | J205: =RC[-4] -> 12 | K205: =RC[-4] -> 3600000 | L205: =RC[-3] -> 1
A206: 12 | B206: 010696 | C206: Nguyễn Đình Thiện | E206: NV Lái xe - VHTTB | F206: 12 | G206: 3600000 | I206: =1 -> 1 | J206: =RC[-4] -> 12 | K206: =RC[-4] -> 3600000 | L206: =RC[-3] -> 1
A207: 13 | B207: 010697 | C207: Trần Hưng Nhân | E207: NV Lái xe - VHTTB | F207: 12 | G207: 3600000 | I207: =1 -> 1 | J207: =RC[-4] -> 12 | K207: =RC[-4] -> 3600000 | L207: =RC[-3] -> 1
A208: 14 | B208: 010698 | C208: Nguyễn Ngọc Toàn | E208: NV Lái xe - VHTTB | F208: 12 | G208: 3600000 | I208: =1 -> 1 | J208: =RC[-4] -> 12 | K208: =RC[-4] -> 3600000 | L208: =RC[-3] -> 1
A209: 15 | B209: 010700 | C209: Đặng Đức Mạnh | E209: NV Lái xe - VHTTB | F209: 12 | G209: 3600000 | I209: =1 -> 1 | J209: =RC[-4] -> 12 | K209: =RC[-4] -> 3600000 | L209: =RC[-3] -> 1
A210: 16 | B210: 010701 | C210: Đỗ Ngọc Lân | E210: NV Lái xe - VHTTB | F210: 12 | G210: 3600000 | I210: =1 -> 1 | J210: =RC[-4] -> 12 | K210: =RC[-4] -> 3600000 | L210: =RC[-3] -> 1
A211: 17 | B211: 010702 | C211: Nguyễn Tuấn Anh | E211: NV Lái xe - VHTTB | F211: 12 | G211: 3600000 | I211: =1 -> 1 | J211: =RC[-4] -> 12 | K211: =RC[-4] -> 3600000 | L211: =RC[-3] -> 1
A212: 18 | B212: 010703 | C212: Trần Văn Dậu | E212: NV Lái xe - VHTTB | F212: 12 | G212: 3600000 | I212: =1 -> 1 | J212: =RC[-4] -> 12 | K212: =RC[-4] -> 3600000 | L212: =RC[-3] -> 1
A213: 19 | B213: 011140 | C213: Nguyễn Chí Công | E213: NV Lái xe - VHTTB | F213: 12 | G213: 3600000 | I213: =1 -> 1 | J213: =RC[-4] -> 12 | K213: =RC[-4] -> 3600000 | L213: =RC[-3] -> 1
A214: Đội cầu, xe kéo đẩy (HGS) | F214: =SUM(R[-19]C:R[-1]C) -> 228 | G214: =SUM(R[-19]C:R[-1]C) -> 68400000 | I214: =SUM(R[-19]C:R[-1]C) -> 19
A215: Đội phục vụ hành lý hàng hóa (HGS)
A216: 1 | B216: 010685 | C216: Hà Minh Trí | E216: Đội trưởng | F216: 12 | G216: 3600000 | I216: =1 -> 1 | J216: =RC[-4] -> 12 | K216: =RC[-4] -> 3600000 | L216: =RC[-3] -> 1
A217: 2 | B217: 010709 | C217: Lê Hữu Thịnh | E217: Đội phó | F217: 12 | G217: 3600000 | I217: =1 -> 1 | J217: =RC[-4] -> 12 | K217: =RC[-4] -> 3600000 | L217: =RC[-3] -> 1
A218: 3 | B218: 010715 | C218: Trần Văn Lộc | E218: Đội phó | F218: 12 | G218: 3600000 | I218: =1 -> 1 | J218: =RC[-4] -> 12 | K218: =RC[-4] -> 3600000 | L218: =RC[-3] -> 1
A219: 4 | B219: 010734 | C219: Trần Duy Hải | E219: Đội phó | F219: 12 | G219: 3600000 | I219: =1 -> 1 | J219: =RC[-4] -> 12 | K219: =RC[-4] -> 3600000 | L219: =RC[-3] -> 1
A220: 5 | B220: 010646 | C220: Lê Ngọc Cường | E220: Nhân viên Bốc xếp | F220: 12 | G220: 3600000 | I220: =1 -> 1 | J220: =RC[-4] -> 12 | K220: =RC[-4] -> 3600000 | L220: =RC[-3] -> 1
A221: 6 | B221: 010647 | C221: Nguyễn Tiến Anh | E221: Nhân viên Bốc xếp | F221: 12 | G221: 3600000 | I221: =1 -> 1 | J221: =RC[-4] -> 12 | K221: =RC[-4] -> 3600000 | L221: =RC[-3] -> 1
A222: 7 | B222: 010648 | C222: Phạm Minh Thành | E222: Nhân viên Bốc xếp | F222: 12 | G222: 3600000 | I222: =1 -> 1 | J222: =RC[-4] -> 12 | K222: =RC[-4] -> 3600000 | L222: =RC[-3] -> 1
A223: 8 | B223: 010649 | C223: Vũ Minh Tú | E223: Nhân viên Bốc xếp | F223: 12 | G223: 3600000 | I223: =1 -> 1 | J223: =RC[-4] -> 12 | K223: =RC[-4] -> 3600000 | L223: =RC[-3] -> 1
A224: 9 | B224: 010650 | C224: Ngô Ngọc Hảo | E224: Nhân viên Bốc xếp | F224: 12 | G224: 3600000 | I224: =1 -> 1 | J224: =RC[-4] -> 12 | K224: =RC[-4] -> 3600000 | L224: =RC[-3] -> 1
A225: 10 | B225: 010651 | C225: Đỗ Văn Chính | E225: Nhân viên Bốc xếp | F225: 12 | G225: 3600000 | I225: =1 -> 1 | J225: =RC[-4] -> 12 | K225: =RC[-4] -> 3600000 | L225: =RC[-3] -> 1
A226: 11 | B226: 010652 | C226: Trương Văn Triệu | E226: Nhân viên Bốc xếp | F226: 11 | G226: 3300000 | I226: =1 -> 1 | J226: =RC[-4] -> 11 | K226: =RC[-4] -> 3300000 | L226: =RC[-3] -> 1
A227: 12 | B227: 010653 | C227: Nguyễn Ngọc Nam | E227: Nhân viên Bốc xếp | F227: 12 | G227: 3600000 | I227: =1 -> 1 | J227: =RC[-4] -> 12 | K227: =RC[-4] -> 3600000 | L227: =RC[-3] -> 1
A228: 13 | B228: 010655 | C228: Nguyễn Chiến Thắng | E228: Nhân viên Bốc xếp | F228: 12 | G228: 3600000 | I228: =1 -> 1 | J228: =RC[-4] -> 12 | K228: =RC[-4] -> 3600000 | L228: =RC[-3] -> 1
A229: 14 | B229: 010656 | C229: Bùi Việt Bắc | E229: Nhân viên Bốc xếp | F229: 12 | G229: 3600000 | I229: =1 -> 1 | J229: =RC[-4] -> 12 | K229: =RC[-4] -> 3600000 | L229: =RC[-3] -> 1
A230: 15 | B230: 010658 | C230: Nguyễn Phương Tuấn | E230: Nhân viên Bốc xếp | F230: 12 | G230: 3600000 | I230: =1 -> 1 | J230: =RC[-4] -> 12 | K230: =RC[-4] -> 3600000 | L230: =RC[-3] -> 1
A231: 16 | B231: 010659 | C231: Ngô Ngọc Tiến | E231: Nhân viên Bốc xếp | F231: 12 | G231: 3600000 | I231: =1 -> 1 | J231: =RC[-4] -> 12 | K231: =RC[-4] -> 3600000 | L231: =RC[-3] -> 1
A232: 17 | B232: 010662 | C232: Trần Văn Tĩnh | E232: Nhân viên Bốc xếp | F232: 12 | G232: 3600000 | I232: =1 -> 1 | J232: =RC[-4] -> 12 | K232: =RC[-4] -> 3600000 | L232: =RC[-3] -> 1
A233: 18 | B233: 010663 | C233: Khổng Vũ Hùng | E233: Nhân viên Bốc xếp | F233: 12 | G233: 3600000 | I233: =1 -> 1 | J233: =RC[-4] -> 12 | K233: =RC[-4] -> 3600000 | L233: =RC[-3] -> 1
A234: 19 | B234: 010664 | C234: Phan Bá Tráng | E234: Nhân viên Bốc xếp | F234: 11 | G234: 3300000 | I234: =1 -> 1 | J234: =RC[-4] -> 11 | K234: =RC[-4] -> 3300000 | L234: =RC[-3] -> 1
A235: 20 | B235: 010665 | C235: Trần Hồng Sơn | E235: Nhân viên Bốc xếp | F235: 12 | G235: 3600000 | I235: =1 -> 1 | J235: =RC[-4] -> 12 | K235: =RC[-4] -> 3600000 | L235: =RC[-3] -> 1
A236: 21 | B236: 010666 | C236: Phạm Quang Trung | E236: Nhân viên Bốc xếp | F236: 11 | G236: 3300000 | I236: =1 -> 1 | J236: =RC[-4] -> 11 | K236: =RC[-4] -> 3300000 | L236: =RC[-3] -> 1
A237: 22 | B237: 010667 | C237: Nguyễn Phi Trường | E237: Nhân viên Bốc xếp | F237: 11 | G237: 3300000 | I237: =1 -> 1 | J237: =RC[-4] -> 11 | K237: =RC[-4] -> 3300000 | L237: =RC[-3] -> 1
A238: 23 | B238: 010668 | C238: Đới Minh Khoa | E238: Nhân viên Bốc xếp | F238: 12 | G238: 3600000 | I238: =1 -> 1 | J238: =RC[-4] -> 12 | K238: =RC[-4] -> 3600000 | L238: =RC[-3] -> 1
A239: 24 | B239: 010669 | C239: Nguyễn Xuân Tân | E239: Nhân viên Bốc xếp | F239: 12 | G239: 3600000 | I239: =1 -> 1 | J239: =RC[-4] -> 12 | K239: =RC[-4] -> 3600000 | L239: =RC[-3] -> 1
A240: 25 | B240: 010670 | C240: Nguyễn Văn Toàn | E240: Nhân viên Bốc xếp | F240: 12 | G240: 3600000 | I240: =1 -> 1 | J240: =RC[-4] -> 12 | K240: =RC[-4] -> 3600000 | L240: =RC[-3] -> 1
A241: 26 | B241: 010671 | C241: Lê Đức Duy | E241: Nhân viên Bốc xếp | F241: 12 | G241: 3600000 | I241: =1 -> 1 | J241: =RC[-4] -> 12 | K241: =RC[-4] -> 3600000 | L241: =RC[-3] -> 1
A242: 27 | B242: 010672 | C242: Triệu Tuấn Anh | E242: Nhân viên Bốc xếp | F242: 12 | G242: 3600000 | I242: =1 -> 1 | J242: =RC[-4] -> 12 | K242: =RC[-4] -> 3600000 | L242: =RC[-3] -> 1
A243: 28 | B243: 010673 | C243: Đặng Xuân Sơn | E243: Nhân viên Bốc xếp | F243: 12 | G243: 3600000 | I243: =1 -> 1 | J243: =RC[-4] -> 12 | K243: =RC[-4] -> 3600000 | L243: =RC[-3] -> 1
A244: 29 | B244: 010674 | C244: Nguyễn Văn Tuế | E244: Nhân viên Bốc xếp | F244: 12 | G244: 3600000 | I244: =1 -> 1 | J244: =RC[-4] -> 12 | K244: =RC[-4] -> 3600000 | L244: =RC[-3] -> 1
A245: 30 | B245: 010675 | C245: Phạm Văn Bảy | E245: Nhân viên Bốc xếp | F245: 12 | G245: 3600000 | I245: =1 -> 1 | J245: =RC[-4] -> 12 | K245: =RC[-4] -> 3600000 | L245: =RC[-3] -> 1
A246: 31 | B246: 010676 | C246: Vương Khắc Hoà | E246: Nhân viên Bốc xếp | F246: 12 | G246: 3600000 | I246: =1 -> 1 | J246: =RC[-4] -> 12 | K246: =RC[-4] -> 3600000 | L246: =RC[-3] -> 1
A247: 32 | B247: 010677 | C247: Vũ Văn Thành | E247: Nhân viên Bốc xếp | F247: 12 | G247: 3600000 | I247: =1 -> 1 | J247: =RC[-4] -> 12 | K247: =RC[-4] -> 3600000 | L247: =RC[-3] -> 1
A248: 33 | B248: 010678 | C248: Phạm Thanh Quang | E248: Nhân viên Bốc xếp | F248: 12 | G248: 3600000 | I248: =1 -> 1 | J248: =RC[-4] -> 12 | K248: =RC[-4] -> 3600000 | L248: =RC[-3] -> 1
A249: 34 | B249: 010679 | C249: Lã Văn Thảo | E249: Nhân viên Bốc xếp | F249: 12 | G249: 3600000 | I249: =1 -> 1 | J249: =RC[-4] -> 12 | K249: =RC[-4] -> 3600000 | L249: =RC[-3] -> 1
A250: 35 | B250: 010680 | C250: Nguyễn Thanh Bình | E250: Nhân viên Bốc xếp | F250: 12 | G250: 3600000 | I250: =1 -> 1 | J250: =RC[-4] -> 12 | K250: =RC[-4] -> 3600000 | L250: =RC[-3] -> 1
A251: 36 | B251: 011086 | C251: Nguyễn Quốc Dũng | E251: Nhân viên Bốc xếp | F251: 12 | G251: 3600000 | I251: =1 -> 1 | J251: =RC[-4] -> 12 | K251: =RC[-4] -> 3600000 | L251: =RC[-3] -> 1
A252: 37 | B252: 011087 | C252: Phan Thế Hòa | E252: Nhân viên Bốc xếp | F252: 12 | G252: 3600000 | I252: =1 -> 1 | J252: =RC[-4] -> 12 | K252: =RC[-4] -> 3600000 | L252: =RC[-3] -> 1
A253: 38 | B253: 011090 | C253: Nguyễn Trương Lộc | E253: Nhân viên Bốc xếp | F253: 12 | G253: 3600000 | I253: =1 -> 1 | J253: =RC[-4] -> 12 | K253: =RC[-4] -> 3600000 | L253: =RC[-3] -> 1
A254: 39 | B254: 011091 | C254: Nguyễn Như Cương | E254: Nhân viên Bốc xếp | F254: 12 | G254: 3600000 | I254: =1 -> 1 | J254: =RC[-4] -> 12 | K254: =RC[-4] -> 3600000 | L254: =RC[-3] -> 1
A255: 40 | B255: 011092 | C255: Nguyễn Thành Long | E255: Nhân viên Bốc xếp | F255: 12 | G255: 3600000 | I255: =1 -> 1 | J255: =RC[-4] -> 12 | K255: =RC[-4] -> 3600000 | L255: =RC[-3] -> 1
A256: 41 | B256: 011093 | C256: Đỗ Chí Thanh | E256: Nhân viên Bốc xếp | F256: 12 | G256: 3600000 | I256: =1 -> 1 | J256: =RC[-4] -> 12 | K256: =RC[-4] -> 3600000 | L256: =RC[-3] -> 1
A257: 42 | B257: 011094 | C257: Nguyễn Xuân Đỏ | E257: Nhân viên Bốc xếp | F257: 12 | G257: 3600000 | I257: =1 -> 1 | J257: =RC[-4] -> 12 | K257: =RC[-4] -> 3600000 | L257: =RC[-3] -> 1
A258: 43 | B258: 011095 | C258: Đỗ Văn Phụng | E258: Nhân viên Bốc xếp | F258: 12 | G258: 3600000 | I258: =1 -> 1 | J258: =RC[-4] -> 12 | K258: =RC[-4] -> 3600000 | L258: =RC[-3] -> 1
A259: 44 | B259: 011097 | C259: Trần Đình Thăng | E259: Nhân viên Bốc xếp | F259: 12 | G259: 3600000 | I259: =1 -> 1 | J259: =RC[-4] -> 12 | K259: =RC[-4] -> 3600000 | L259: =RC[-3] -> 1
A260: 45 | B260: 011098 | C260: Lương Bá Huỳnh | E260: Nhân viên Bốc xếp | F260: 12 | G260: 3600000 | I260: =1 -> 1 | J260: =RC[-4] -> 12 | K260: =RC[-4] -> 3600000 | L260: =RC[-3] -> 1
A261: 46 | B261: 012572 | C261: Trần Quốc Việt | E261: Nhân viên Bốc xếp | F261: 6 | G261: 1800000 | I261: =1 -> 1 | J261: =RC[-4] -> 6 | K261: =RC[-4] -> 1800000 | L261: =RC[-3] -> 1
A262: 47 | B262: 012573 | C262: Trần Thế Khánh | E262: Nhân viên Bốc xếp | F262: 6 | G262: 1800000 | I262: =1 -> 1 | J262: =RC[-4] -> 6 | K262: =RC[-4] -> 1800000 | L262: =RC[-3] -> 1
A263: 48 | B263: 012574 | C263: Lê Văn Hùng | E263: Nhân viên Bốc xếp | F263: 6 | G263: 1800000 | I263: =1 -> 1 | J263: =RC[-4] -> 6 | K263: =RC[-4] -> 1800000 | L263: =RC[-3] -> 1
A264: 49 | B264: 012575 | C264: Nguyễn Văn Thắng | E264: Nhân viên Bốc xếp | F264: 6 | G264: 1800000 | I264: =1 -> 1 | J264: =RC[-4] -> 6 | K264: =RC[-4] -> 1800000 | L264: =RC[-3] -> 1
A265: 50 | B265: 012576 | C265: Nguyễn Tùng Giang | E265: Nhân viên Bốc xếp | F265: 6 | G265: 1800000 | I265: =1 -> 1 | J265: =RC[-4] -> 6 | K265: =RC[-4] -> 1800000 | L265: =RC[-3] -> 1
A266: 51 | B266: 012577 | C266: Lê Ngọc Hùng | E266: Nhân viên Bốc xếp | F266: 6 | G266: 1800000 | I266: =1 -> 1 | J266: =RC[-4] -> 6 | K266: =RC[-4] -> 1800000 | L266: =RC[-3] -> 1
A267: 52 | B267: 012578 | C267: Bùi Bảo Long | E267: Nhân viên Bốc xếp | F267: 6 | G267: 1800000 | I267: =1 -> 1 | J267: =RC[-4] -> 6 | K267: =RC[-4] -> 1800000 | L267: =RC[-3] -> 1
A268: 53 | B268: 012579 | C268: Nguyễn Ngọc Công | E268: Nhân viên Bốc xếp | F268: 6 | G268: 1800000 | I268: =1 -> 1 | J268: =RC[-4] -> 6 | K268: =RC[-4] -> 1800000 | L268: =RC[-3] -> 1
A269: 54 | B269: 012580 | C269: Đào Công Duẩn | E269: Nhân viên Bốc xếp | F269: 6 | G269: 1800000 | I269: =1 -> 1 | J269: =RC[-4] -> 6 | K269: =RC[-4] -> 1800000 | L269: =RC[-3] -> 1
A270: =+R[-1]C+1 -> 55 | B270: 012581 | C270: Nguyễn Gia Thắng | E270: Nhân viên Bốc xếp | F270: 6 | G270: 1800000 | I270: =1 -> 1 | J270: =RC[-4] -> 6 | K270: =RC[-4] -> 1800000 | L270: =RC[-3] -> 1
A271: =+R[-1]C+1 -> 56 | B271: 012583 | C271: Nguyễn Huy Đáp | E271: Nhân viên Bốc xếp | F271: 6 | G271: 1800000 | I271: =1 -> 1 | J271: =RC[-4] -> 6 | K271: =RC[-4] -> 1800000 | L271: =RC[-3] -> 1
A272: =+R[-1]C+1 -> 57 | B272: 012584 | C272: Lê Văn Thịnh | E272: Nhân viên Bốc xếp | F272: 6 | G272: 1800000 | I272: =1 -> 1 | J272: =RC[-4] -> 6 | K272: =RC[-4] -> 1800000 | L272: =RC[-3] -> 1
A273: =+R[-1]C+1 -> 58 | B273: 012585 | C273: Nguyễn Tuấn Anh | E273: Nhân viên Bốc xếp | F273: 6 | G273: 1800000 | I273: =1 -> 1 | J273: =RC[-4] -> 6 | K273: =RC[-4] -> 1800000 | L273: =RC[-3] -> 1
A274: =+R[-1]C+1 -> 59 | B274: 012586 | C274: Phạm Văn Trường | E274: Nhân viên Bốc xếp | F274: 6 | G274: 1800000 | I274: =1 -> 1 | J274: =RC[-4] -> 6 | K274: =RC[-4] -> 1800000 | L274: =RC[-3] -> 1
A275: =+R[-1]C+1 -> 60 | B275: 012587 | C275: Nguyễn Minh Dũng | E275: Nhân viên Bốc xếp | F275: 6 | G275: 1800000 | I275: =1 -> 1 | J275: =RC[-4] -> 6 | K275: =RC[-4] -> 1800000 | L275: =RC[-3] -> 1
A276: =+R[-1]C+1 -> 61 | B276: 012588 | C276: Đào Huy Phong | E276: Nhân viên Bốc xếp | F276: 6 | G276: 1800000 | I276: =1 -> 1 | J276: =RC[-4] -> 6 | K276: =RC[-4] -> 1800000 | L276: =RC[-3] -> 1
A277: =+R[-1]C+1 -> 62 | B277: 012589 | C277: Lê Văn Thiện | E277: Nhân viên Bốc xếp | F277: 6 | G277: 1800000 | I277: =1 -> 1 | J277: =RC[-4] -> 6 | K277: =RC[-4] -> 1800000 | L277: =RC[-3] -> 1
A278: =+R[-1]C+1 -> 63 | B278: 012590 | C278: Nguyễn Mạnh Hòa | E278: Nhân viên Bốc xếp | F278: 6 | G278: 1800000 | I278: =1 -> 1 | J278: =RC[-4] -> 6 | K278: =RC[-4] -> 1800000 | L278: =RC[-3] -> 1
A279: =+R[-1]C+1 -> 64 | B279: 012591 | C279: Nguyễn Xuân Quý | E279: Nhân viên Bốc xếp | F279: 6 | G279: 1800000 | I279: =1 -> 1 | J279: =RC[-4] -> 6 | K279: =RC[-4] -> 1800000 | L279: =RC[-3] -> 1
A280: =+R[-1]C+1 -> 65 | B280: 012592 | C280: Lê Minh Huy | E280: Nhân viên Bốc xếp | F280: 6 | G280: 1800000 | I280: =1 -> 1 | J280: =RC[-4] -> 6 | K280: =RC[-4] -> 1800000 | L280: =RC[-3] -> 1
A281: =+R[-1]C+1 -> 66 | B281: 010681 | C281: Trần Văn Minh | E281: NV Lái xe - VHTTB | F281: 12 | G281: 3600000 | I281: =1 -> 1 | J281: =RC[-4] -> 12 | K281: =RC[-4] -> 3600000 | L281: =RC[-3] -> 1
A282: =+R[-1]C+1 -> 67 | B282: 010682 | C282: Nguyễn Gia Chiến | E282: NV Lái xe - VHTTB | F282: 12 | G282: 3600000 | I282: =1 -> 1 | J282: =RC[-4] -> 12 | K282: =RC[-4] -> 3600000 | L282: =RC[-3] -> 1
A283: =+R[-1]C+1 -> 68 | B283: 010683 | C283: Nguyễn Trung Sơn | E283: NV Lái xe - VHTTB | F283: 12 | G283: 3600000 | I283: =1 -> 1 | J283: =RC[-4] -> 12 | K283: =RC[-4] -> 3600000 | L283: =RC[-3] -> 1
A284: =+R[-1]C+1 -> 69 | B284: 010684 | C284: Lê Quang Hợp | E284: NV Lái xe - VHTTB | F284: 12 | G284: 3600000 | I284: =1 -> 1 | J284: =RC[-4] -> 12 | K284: =RC[-4] -> 3600000 | L284: =RC[-3] -> 1
A285: =+R[-1]C+1 -> 70 | B285: 010705 | C285: Nguyễn Hữu Nam | E285: NV Lái xe - VHTTB | F285: 12 | G285: 3600000 | I285: =1 -> 1 | J285: =RC[-4] -> 12 | K285: =RC[-4] -> 3600000 | L285: =RC[-3] -> 1
A286: =+R[-1]C+1 -> 71 | B286: 010706 | C286: Đặng Đình Phương | E286: NV Lái xe - VHTTB | F286: 12 | G286: 3600000 | I286: =1 -> 1 | J286: =RC[-4] -> 12 | K286: =RC[-4] -> 3600000 | L286: =RC[-3] -> 1
A287: =+R[-1]C+1 -> 72 | B287: 010707 | C287: Phù Trung Ninh | E287: NV Lái xe - VHTTB | F287: 12 | G287: 3600000 | I287: =1 -> 1 | J287: =RC[-4] -> 12 | K287: =RC[-4] -> 3600000 | L287: =RC[-3] -> 1
A288: =+R[-1]C+1 -> 73 | B288: 010708 | C288: Phạm Đình Thuần | E288: NV Lái xe - VHTTB | F288: 12 | G288: 3600000 | I288: =1 -> 1 | J288: =RC[-4] -> 12 | K288: =RC[-4] -> 3600000 | L288: =RC[-3] -> 1
A289: =+R[-1]C+1 -> 74 | B289: 010710 | C289: Nguyễn Anh Dũng | E289: NV Lái xe - VHTTB | F289: 12 | G289: 3600000 | I289: =1 -> 1 | J289: =RC[-4] -> 12 | K289: =RC[-4] -> 3600000 | L289: =RC[-3] -> 1
A290: =+R[-1]C+1 -> 75 | B290: 010711 | C290: Nguyễn Ngọc Hà | E290: NV Lái xe - VHTTB | F290: 12 | G290: 3600000 | I290: =1 -> 1 | J290: =RC[-4] -> 12 | K290: =RC[-4] -> 3600000 | L290: =RC[-3] -> 1
A291: =+R[-1]C+1 -> 76 | B291: 010712 | C291: Phạm Đức Long | E291: NV Lái xe - VHTTB | F291: 11 | G291: 3300000 | I291: =1 -> 1 | J291: =RC[-4] -> 11 | K291: =RC[-4] -> 3300000 | L291: =RC[-3] -> 1
A292: =+R[-1]C+1 -> 77 | B292: 010713 | C292: Trịnh Văn Mạnh | E292: NV Lái xe - VHTTB | F292: 12 | G292: 3600000 | I292: =1 -> 1 | J292: =RC[-4] -> 12 | K292: =RC[-4] -> 3600000 | L292: =RC[-3] -> 1
A293: =+R[-1]C+1 -> 78 | B293: 010714 | C293: Phạm Văn Hải | E293: NV Lái xe - VHTTB | F293: 12 | G293: 3600000 | I293: =1 -> 1 | J293: =RC[-4] -> 12 | K293: =RC[-4] -> 3600000 | L293: =RC[-3] -> 1
A294: =+R[-1]C+1 -> 79 | B294: 010716 | C294: Bùi Văn Thành | E294: NV Lái xe - VHTTB | F294: 12 | G294: 3600000 | I294: =1 -> 1 | J294: =RC[-4] -> 12 | K294: =RC[-4] -> 3600000 | L294: =RC[-3] -> 1
A295: =+R[-1]C+1 -> 80 | B295: 010717 | C295: Bùi Chí Công | E295: NV Lái xe - VHTTB | F295: 12 | G295: 3600000 | I295: =1 -> 1 | J295: =RC[-4] -> 12 | K295: =RC[-4] -> 3600000 | L295: =RC[-3] -> 1
A296: =+R[-1]C+1 -> 81 | B296: 010718 | C296: Nguyễn Văn Định | E296: NV Lái xe - VHTTB | F296: 12 | G296: 3600000 | I296: =1 -> 1 | J296: =RC[-4] -> 12 | K296: =RC[-4] -> 3600000 | L296: =RC[-3] -> 1
A297: =+R[-1]C+1 -> 82 | B297: 010719 | C297: Nguyễn Hải Anh | E297: NV Lái xe - VHTTB | F297: 12 | G297: 3600000 | I297: =1 -> 1 | J297: =RC[-4] -> 12 | K297: =RC[-4] -> 3600000 | L297: =RC[-3] -> 1
A298: =+R[-1]C+1 -> 83 | B298: 010720 | C298: Bùi Kiên Trung | E298: NV Lái xe - VHTTB | F298: 12 | G298: 3600000 | I298: =1 -> 1 | J298: =RC[-4] -> 12 | K298: =RC[-4] -> 3600000 | L298: =RC[-3] -> 1
A299: =+R[-1]C+1 -> 84 | B299: 010721 | C299: Vũ Quốc Cường | E299: NV Lái xe - VHTTB | F299: 12 | G299: 3600000 | I299: =1 -> 1 | J299: =RC[-4] -> 12 | K299: =RC[-4] -> 3600000 | L299: =RC[-3] -> 1
A300: =+R[-1]C+1 -> 85 | B300: 010722 | C300: Vũ Văn Dương | E300: NV Lái xe - VHTTB | F300: 12 | G300: 3600000 | I300: =1 -> 1 | J300: =RC[-4] -> 12 | K300: =RC[-4] -> 3600000 | L300: =RC[-3] -> 1
A301: =+R[-1]C+1 -> 86 | B301: 010723 | C301: Vũ Văn Thái | E301: NV Lái xe - VHTTB | F301: 12 | G301: 3600000 | I301: =1 -> 1 | J301: =RC[-4] -> 12 | K301: =RC[-4] -> 3600000 | L301: =RC[-3] -> 1
A302: =+R[-1]C+1 -> 87 | B302: 010725 | C302: Phạm Quang Sơn | E302: NV Lái xe - VHTTB | F302: 12 | G302: 3600000 | I302: =1 -> 1 | J302: =RC[-4] -> 12 | K302: =RC[-4] -> 3600000 | L302: =RC[-3] -> 1
A303: =+R[-1]C+1 -> 88 | B303: 010726 | C303: Vũ Mạnh Hùng | E303: NV Lái xe - VHTTB | F303: 12 | G303: 3600000 | I303: =1 -> 1 | J303: =RC[-4] -> 12 | K303: =RC[-4] -> 3600000 | L303: =RC[-3] -> 1
A304: =+R[-1]C+1 -> 89 | B304: 010727 | C304: Trần Mạnh Hùng | E304: NV Lái xe - VHTTB | F304: 12 | G304: 3600000 | I304: =1 -> 1 | J304: =RC[-4] -> 12 | K304: =RC[-4] -> 3600000 | L304: =RC[-3] -> 1
A305: =+R[-1]C+1 -> 90 | B305: 010728 | C305: Nguyễn Mạnh Hùng | E305: NV Lái xe - VHTTB | F305: 12 | G305: 3600000 | I305: =1 -> 1 | J305: =RC[-4] -> 12 | K305: =RC[-4] -> 3600000 | L305: =RC[-3] -> 1
A306: =+R[-1]C+1 -> 91 | B306: 010729 | C306: Nguyễn Thanh Quyết | E306: NV Lái xe - VHTTB | F306: 12 | G306: 3600000 | I306: =1 -> 1 | J306: =RC[-4] -> 12 | K306: =RC[-4] -> 3600000 | L306: =RC[-3] -> 1
A307: =+R[-1]C+1 -> 92 | B307: 010730 | C307: Nguyễn Thanh Bình | E307: NV Lái xe - VHTTB | F307: 12 | G307: 3600000 | I307: =1 -> 1 | J307: =RC[-4] -> 12 | K307: =RC[-4] -> 3600000 | L307: =RC[-3] -> 1
A308: =+R[-1]C+1 -> 93 | B308: 010731 | C308: Vũ Tiến Lịch | E308: NV Lái xe - VHTTB | F308: 12 | G308: 3600000 | I308: =1 -> 1 | J308: =RC[-4] -> 12 | K308: =RC[-4] -> 3600000 | L308: =RC[-3] -> 1
A309: =+R[-1]C+1 -> 94 | B309: 010732 | C309: Nguyễn Xuân Hợi | E309: NV Lái xe - VHTTB | F309: 12 | G309: 3600000 | I309: =1 -> 1 | J309: =RC[-4] -> 12 | K309: =RC[-4] -> 3600000 | L309: =RC[-3] -> 1
A310: =+R[-1]C+1 -> 95 | B310: 010733 | C310: Nguyễn Văn Sơn | E310: NV Lái xe - VHTTB | F310: 12 | G310: 3600000 | I310: =1 -> 1 | J310: =RC[-4] -> 12 | K310: =RC[-4] -> 3600000 | L310: =RC[-3] -> 1
A311: =+R[-1]C+1 -> 96 | B311: 011132 | C311: Nguyễn Hữu Chức | E311: NV Lái xe - VHTTB | F311: 12 | G311: 3600000 | I311: =1 -> 1 | J311: =RC[-4] -> 12 | K311: =RC[-4] -> 3600000 | L311: =RC[-3] -> 1
A312: =+R[-1]C+1 -> 97 | B312: 011133 | C312: Phù Định | E312: NV Lái xe - VHTTB | F312: 12 | G312: 3600000 | I312: =1 -> 1 | J312: =RC[-4] -> 12 | K312: =RC[-4] -> 3600000 | L312: =RC[-3] -> 1
A313: =+R[-1]C+1 -> 98 | B313: 011134 | C313: Hồ Ngọc Hà | E313: NV Lái xe - VHTTB | F313: 12 | G313: 3600000 | I313: =1 -> 1 | J313: =RC[-4] -> 12 | K313: =RC[-4] -> 3600000 | L313: =RC[-3] -> 1
A314: =+R[-1]C+1 -> 99 | B314: 011135 | C314: Nguyễn Đắc Thanh | E314: NV Lái xe - VHTTB | F314: 12 | G314: 3600000 | I314: =1 -> 1 | J314: =RC[-4] -> 12 | K314: =RC[-4] -> 3600000 | L314: =RC[-3] -> 1
A315: =+R[-1]C+1 -> 100 | B315: 011136 | C315: Nguyễn Huy Dũng | E315: NV Lái xe - VHTTB | F315: 12 | G315: 3600000 | I315: =1 -> 1 | J315: =RC[-4] -> 12 | K315: =RC[-4] -> 3600000 | L315: =RC[-3] -> 1
A316: =+R[-1]C+1 -> 101 | B316: 011137 | C316: Nguyễn Văn Phong | E316: NV Lái xe - VHTTB | F316: 12 | G316: 3600000 | I316: =1 -> 1 | J316: =RC[-4] -> 12 | K316: =RC[-4] -> 3600000 | L316: =RC[-3] -> 1
A317: =+R[-1]C+1 -> 102 | B317: 011138 | C317: Phạm Việt Tùng | E317: NV Lái xe - VHTTB | F317: 12 | G317: 3600000 | I317: =1 -> 1 | J317: =RC[-4] -> 12 | K317: =RC[-4] -> 3600000 | L317: =RC[-3] -> 1
A318: =+R[-1]C+1 -> 103 | B318: 011139 | C318: Phùng Viết Dũng | E318: NV Lái xe - VHTTB | F318: 12 | G318: 3600000 | I318: =1 -> 1 | J318: =RC[-4] -> 12 | K318: =RC[-4] -> 3600000 | L318: =RC[-3] -> 1
A319: =+R[-1]C+1 -> 104 | B319: 011141 | C319: Lê Trọng Lệ | E319: NV Lái xe - VHTTB | F319: 12 | G319: 3600000 | I319: =1 -> 1 | J319: =RC[-4] -> 12 | K319: =RC[-4] -> 3600000 | L319: =RC[-3] -> 1
A320: =+R[-1]C+1 -> 105 | B320: 011142 | C320: Trần Văn Chính | E320: NV Lái xe - VHTTB | F320: 12 | G320: 3600000 | I320: =1 -> 1 | J320: =RC[-4] -> 12 | K320: =RC[-4] -> 3600000 | L320: =RC[-3] -> 1
A321: =+R[-1]C+1 -> 106 | B321: 011143 | C321: Phù Xuân Tiền | E321: NV Lái xe - VHTTB | F321: 12 | G321: 3600000 | I321: =1 -> 1 | J321: =RC[-4] -> 12 | K321: =RC[-4] -> 3600000 | L321: =RC[-3] -> 1
A322: =+R[-1]C+1 -> 107 | B322: 011144 | C322: Đinh Văn Bền | E322: NV Lái xe - VHTTB | F322: 12 | G322: 3600000 | I322: =1 -> 1 | J322: =RC[-4] -> 12 | K322: =RC[-4] -> 3600000 | L322: =RC[-3] -> 1
A323: =+R[-1]C+1 -> 108 | B323: 011145 | C323: Nguyễn Tiến Ngọc | E323: NV Lái xe - VHTTB | F323: 12 | G323: 3600000 | I323: =1 -> 1 | J323: =RC[-4] -> 12 | K323: =RC[-4] -> 3600000 | L323: =RC[-3] -> 1
A324: Đội phục vụ hành lý hàng hóa (HGS) | F324: =SUM(R[-108]C:R[-1]C) -> 1171 | G324: =SUM(R[-108]C:R[-1]C) -> 351300000 | I324: =SUM(R[-108]C:R[-1]C) -> 108
A325: Đội phục vụ tàu bay (HGS)
A326: 1 | B326: 010758 | C326: Trương Thị Minh Phượng | E326: Đội phó | F326: 12 | G326: 3600000 | I326: =1 -> 1 | J326: =RC[-4] -> 12 | K326: =RC[-4] -> 3600000 | L326: =RC[-3] -> 1
A327: 2 | B327: 010644 | C327: Nguyễn Văn Bình | E327: KTV mặt đất | F327: 12 | G327: 3600000 | I327: =1 -> 1 | J327: =RC[-4] -> 12 | K327: =RC[-4] -> 3600000 | L327: =RC[-3] -> 1
A328: 3 | B328: 010645 | C328: Thân Hoài Nam | E328: KTV mặt đất | F328: 12 | G328: 3600000 | I328: =1 -> 1 | J328: =RC[-4] -> 12 | K328: =RC[-4] -> 3600000 | L328: =RC[-3] -> 1
A329: 4 | B329: 012508 | C329: Nguyễn Hồng Nhung | E329: Nv vệ sinh | F329: 5 | G329: 1500000 | I329: =1 -> 1 | J329: =RC[-4] -> 5 | K329: =RC[-4] -> 1500000 | L329: =RC[-3] -> 1
A330: 5 | B330: 012596 | C330: Phan Thị Hải Yến | E330: Nv vệ sinh | F330: 6 | G330: 1800000 | I330: =1 -> 1 | J330: =RC[-4] -> 6 | K330: =RC[-4] -> 1800000 | L330: =RC[-3] -> 1
A331: 6 | B331: 012597 | C331: Doãn Thị Thanh Hà | E331: Nv vệ sinh | F331: 6 | G331: 1800000 | I331: =1 -> 1 | J331: =RC[-4] -> 6 | K331: =RC[-4] -> 1800000 | L331: =RC[-3] -> 1
A332: 7 | B332: 013098 | C332: Đặng Thị Thúy Hằng | E332: Nv vệ sinh | F332: 2 | G332: 600000 | I332: =1 -> 1 | J332: =RC[-4] -> 2 | K332: =RC[-4] -> 600000 | L332: =RC[-3] -> 1
A333: 8 | B333: 013100 | C333: Nguyễn Thị Mến | E333: Nv vệ sinh | F333: 2 | G333: 600000 | I333: =1 -> 1 | J333: =RC[-4] -> 2 | K333: =RC[-4] -> 600000 | L333: =RC[-3] -> 1
A334: 9 | B334: 010754 | C334: Đào Hồng Phúc | E334: Nv VS MB | F334: 12 | G334: 3600000 | I334: =1 -> 1 | J334: =RC[-4] -> 12 | K334: =RC[-4] -> 3600000 | L334: =RC[-3] -> 1
A335: 10 | B335: 010755 | C335: Quàng Thị Hạnh | E335: Nv VS MB | F335: 12 | G335: 3600000 | I335: =1 -> 1 | J335: =RC[-4] -> 12 | K335: =RC[-4] -> 3600000 | L335: =RC[-3] -> 1
A336: 11 | B336: 010756 | C336: Nguyễn Thị Bình Minh | E336: Nv VS MB | F336: 12 | G336: 3600000 | I336: =1 -> 1 | J336: =RC[-4] -> 12 | K336: =RC[-4] -> 3600000 | L336: =RC[-3] -> 1
A337: 12 | B337: 010757 | C337: Nguyễn Văn Quý | E337: Nv VS MB | F337: 12 | G337: 3600000 | I337: =1 -> 1 | J337: =RC[-4] -> 12 | K337: =RC[-4] -> 3600000 | L337: =RC[-3] -> 1
A338: 13 | B338: 010759 | C338: Nguyễn Anh Đức | E338: Nv VS MB | F338: 12 | G338: 3600000 | I338: =1 -> 1 | J338: =RC[-4] -> 12 | K338: =RC[-4] -> 3600000 | L338: =RC[-3] -> 1
A339: 14 | B339: 010760 | C339: Trần Thị Ngọc Lan | E339: Nv VS MB | F339: 12 | G339: 3600000 | I339: =1 -> 1 | J339: =RC[-4] -> 12 | K339: =RC[-4] -> 3600000 | L339: =RC[-3] -> 1
A340: 15 | B340: 010761 | C340: Nguyễn Thị Anh Thơ | E340: Nv VS MB | F340: 12 | G340: 3600000 | I340: =1 -> 1 | J340: =RC[-4] -> 12 | K340: =RC[-4] -> 3600000 | L340: =RC[-3] -> 1
A341: 16 | B341: 010762 | C341: Nguyễn Thị Kim Thu | E341: Nv VS MB | F341: 12 | G341: 3600000 | I341: =1 -> 1 | J341: =RC[-4] -> 12 | K341: =RC[-4] -> 3600000 | L341: =RC[-3] -> 1
A342: 17 | B342: 010763 | C342: Nguyễn Thị Ngà | E342: Nv VS MB | F342: 12 | G342: 3600000 | I342: =1 -> 1 | J342: =RC[-4] -> 12 | K342: =RC[-4] -> 3600000 | L342: =RC[-3] -> 1
A343: 18 | B343: 010764 | C343: Nguyễn Thị Kim Anh | E343: Nv VS MB | F343: 12 | G343: 3600000 | I343: =1 -> 1 | J343: =RC[-4] -> 12 | K343: =RC[-4] -> 3600000 | L343: =RC[-3] -> 1
A344: 19 | B344: 010766 | C344: Nguyễn Thị Mai | E344: Nv VS MB | F344: 12 | G344: 3600000 | I344: =1 -> 1 | J344: =RC[-4] -> 12 | K344: =RC[-4] -> 3600000 | L344: =RC[-3] -> 1
A345: 20 | B345: 010767 | C345: Nguyễn Thị Huệ | E345: Nv VS MB | F345: 12 | G345: 3600000 | I345: =1 -> 1 | J345: =RC[-4] -> 12 | K345: =RC[-4] -> 3600000 | L345: =RC[-3] -> 1
A346: 21 | B346: 010768 | C346: Trần Duyên Hải | E346: Nv VS MB | F346: 12 | G346: 3600000 | I346: =1 -> 1 | J346: =RC[-4] -> 12 | K346: =RC[-4] -> 3600000 | L346: =RC[-3] -> 1
A347: 22 | B347: 010769 | C347: Nguyễn Thị Hải Yến | E347: Nv VS MB | F347: 12 | G347: 3600000 | I347: =1 -> 1 | J347: =RC[-4] -> 12 | K347: =RC[-4] -> 3600000 | L347: =RC[-3] -> 1
A348: 23 | B348: 010770 | C348: Trần Trọng Anh Chí | E348: Nv VS MB | F348: 12 | G348: 3600000 | I348: =1 -> 1 | J348: =RC[-4] -> 12 | K348: =RC[-4] -> 3600000 | L348: =RC[-3] -> 1
A349: 24 | B349: 010771 | C349: Trần Thị Thu Thuỷ | E349: Nv VS MB | F349: 12 | G349: 3600000 | I349: =1 -> 1 | J349: =RC[-4] -> 12 | K349: =RC[-4] -> 3600000 | L349: =RC[-3] -> 1
A350: 25 | B350: 010772 | C350: Đậu Thị Hồng Nguyệt | E350: Nv VS MB | F350: 11 | G350: 3300000 | I350: =1 -> 1 | J350: =RC[-4] -> 11 | K350: =RC[-4] -> 3300000 | L350: =RC[-3] -> 1
A351: 26 | B351: 010773 | C351: Nguyễn Thị Mến | E351: Nv VS MB | F351: 12 | G351: 3600000 | I351: =1 -> 1 | J351: =RC[-4] -> 12 | K351: =RC[-4] -> 3600000 | L351: =RC[-3] -> 1
A352: 27 | B352: 010774 | C352: Lò Thị Phượng | E352: Nv VS MB | F352: 11 | G352: 3300000 | I352: =1 -> 1 | J352: =RC[-4] -> 11 | K352: =RC[-4] -> 3300000 | L352: =RC[-3] -> 1
A353: 28 | B353: 010775 | C353: Đặng Thị Thu Hường | E353: Nv VS MB | F353: 12 | G353: 3600000 | I353: =1 -> 1 | J353: =RC[-4] -> 12 | K353: =RC[-4] -> 3600000 | L353: =RC[-3] -> 1
A354: 29 | B354: 010776 | C354: Nguyễn Thị Thu | E354: Nv VS MB | F354: 12 | G354: 3600000 | I354: =1 -> 1 | J354: =RC[-4] -> 12 | K354: =RC[-4] -> 3600000 | L354: =RC[-3] -> 1
A355: 30 | B355: 010777 | C355: Nguyễn Thị Lý | E355: Nv VS MB | F355: 12 | G355: 3600000 | I355: =1 -> 1 | J355: =RC[-4] -> 12 | K355: =RC[-4] -> 3600000 | L355: =RC[-3] -> 1
A356: 31 | B356: 010780 | C356: Hoàng Hải Yến | E356: Nv VS MB | F356: 12 | G356: 3600000 | I356: =1 -> 1 | J356: =RC[-4] -> 12 | K356: =RC[-4] -> 3600000 | L356: =RC[-3] -> 1
A357: 32 | B357: 010781 | C357: Lê Phương Huyền | E357: Nv VS MB | F357: 12 | G357: 3600000 | I357: =1 -> 1 | J357: =RC[-4] -> 12 | K357: =RC[-4] -> 3600000 | L357: =RC[-3] -> 1
A358: 33 | B358: 010782 | C358: Phạm Thị Lan Phương | E358: Nv VS MB | F358: 12 | G358: 3600000 | I358: =1 -> 1 | J358: =RC[-4] -> 12 | K358: =RC[-4] -> 3600000 | L358: =RC[-3] -> 1
A359: 34 | B359: 010783 | C359: Phạm Thị Thuý Ngà | E359: Nv VS MB | F359: 12 | G359: 3600000 | I359: =1 -> 1 | J359: =RC[-4] -> 12 | K359: =RC[-4] -> 3600000 | L359: =RC[-3] -> 1
A360: 35 | B360: 010784 | C360: Lê Thị Thạch | E360: Nv VS MB | F360: 12 | G360: 3600000 | I360: =1 -> 1 | J360: =RC[-4] -> 12 | K360: =RC[-4] -> 3600000 | L360: =RC[-3] -> 1
A361: 36 | B361: 011769 | C361: Ngô Thị Hường | E361: Nv VS MB | F361: 12 | G361: 3600000 | I361: =1 -> 1 | J361: =RC[-4] -> 12 | K361: =RC[-4] -> 3600000 | L361: =RC[-3] -> 1
A362: Đội phục vụ tàu bay (HGS) | F362: =SUM(R[-36]C:R[-1]C) -> 391 | G362: =SUM(R[-36]C:R[-1]C) -> 117300000 | I362: =SUM(R[-36]C:R[-1]C) -> 36
A363: Đội sửa chữa, bảo dưỡng trang thiết bị (HGS)
A364: 1 | B364: 011082 | C364: Hoàng Trung Dũng | E364: CV Kỹ thuật | F364: 12 | G364: 3600000 | I364: =1 -> 1 | J364: =RC[-4] -> 12 | K364: =RC[-4] -> 3600000 | L364: =RC[-3] -> 1
A365: 2 | B365: 011083 | C365: Bùi Văn Nam | E365: CV Kỹ thuật | F365: 12 | G365: 3600000 | I365: =1 -> 1 | J365: =RC[-4] -> 12 | K365: =RC[-4] -> 3600000 | L365: =RC[-3] -> 1
A366: 3 | B366: 010643 | C366: Nguyễn Văn Thành | E366: KTV mặt đất | F366: 12 | G366: 3600000 | I366: =1 -> 1 | J366: =RC[-4] -> 12 | K366: =RC[-4] -> 3600000 | L366: =RC[-3] -> 1
A367: 4 | B367: 013049 | C367: Nguyễn Đức Anh | E367: Nhân viên kỹ thuật | F367: 3 | G367: 900000 | I367: =1 -> 1 | J367: =RC[-4] -> 3 | K367: =RC[-4] -> 900000 | L367: =RC[-3] -> 1
A368: Đội sửa chữa, bảo dưỡng trang thiết bị (HGS) | F368: =SUM(R[-4]C:R[-1]C) -> 39 | G368: =SUM(R[-4]C:R[-1]C) -> 11700000 | I368: =SUM(R[-4]C:R[-1]C) -> 4
A369: Phòng Phục vụ kỹ thuật sân đỗ (HGS) | F369: =SUM(R[-182]C[4]:R[-1]C[4]) -> 1877 | G369: =SUM(R[-182]C[4]:R[-1]C[4]) -> 563100000 | I369: =SUM(R[-182]C[3]:R[-1]C[3]) -> 171
A370: Phòng Tài chính - Kế toán (HGS)
A372: 1 | B372: 010796 | C372: Trần Thị Thúy Oanh | E372: Trưởng phòng | F372: 12 | G372: 3600000 | I372: =1 -> 1 | J372: =RC[-4] -> 12 | K372: =RC[-4] -> 3600000 | L372: =RC[-3] -> 1
A373: 2 | B373: 010595 | C373: Lê Thị Mai | E373: Nhân viên kế toán | F373: 12 | G373: 3600000 | I373: =1 -> 1 | J373: =RC[-4] -> 12 | K373: =RC[-4] -> 3600000 | L373: =RC[-3] -> 1
A374: 3 | B374: 010793 | C374: Lê Thị Thuý | E374: Nhân viên kế toán | F374: 12 | G374: 3600000 | I374: =1 -> 1 | J374: =RC[-4] -> 12 | K374: =RC[-4] -> 3600000 | L374: =RC[-3] -> 1
A375: 4 | B375: 012660 | C375: Bùi Thị Thu | E375: Nhân viên kế toán | F375: 6 | G375: 1800000 | I375: =1 -> 1 | J375: =RC[-4] -> 6 | K375: =RC[-4] -> 1800000 | L375: =RC[-3] -> 1
A376: 5 | B376: 010794 | C376: Nguyễn Thị Kim Huệ | E376: NV Thủ Quỹ | F376: 12 | G376: 3600000 | I376: =1 -> 1 | J376: =RC[-4] -> 12 | K376: =RC[-4] -> 3600000 | L376: =RC[-3] -> 1
A377: 6 | B377: 010788 | C377: Phạm Thị Thu Hiền | E377: Chuyên viên TCKT | F377: 12 | G377: 3600000 | I377: =1 -> 1 | J377: =RC[-4] -> 12 | K377: =RC[-4] -> 3600000 | L377: =RC[-3] -> 1
A378: 7 | B378: 010789 | C378: Hoàng Thị Trang Nhung | E378: Chuyên viên TCKT | F378: 12 | G378: 3600000 | I378: =1 -> 1 | J378: =RC[-4] -> 12 | K378: =RC[-4] -> 3600000 | L378: =RC[-3] -> 1
A379: 8 | B379: 010790 | C379: Đào Thị Chín | E379: Chuyên viên TCKT | F379: 12 | G379: 3600000 | I379: =1 -> 1 | J379: =RC[-4] -> 12 | K379: =RC[-4] -> 3600000 | L379: =RC[-3] -> 1
A380: 9 | B380: 010791 | C380: Trần Thu Trang | E380: Chuyên viên TCKT | F380: 12 | G380: 3600000 | I380: =1 -> 1 | J380: =RC[-4] -> 12 | K380: =RC[-4] -> 3600000 | L380: =RC[-3] -> 1
A381: 10 | B381: 011147 | C381: Vũ Chí Kiên | E381: Chuyên viên TCKT | F381: 12 | G381: 3600000 | I381: =1 -> 1 | J381: =RC[-4] -> 12 | K381: =RC[-4] -> 3600000 | L381: =RC[-3] -> 1
F382: =SUM(R[-10]C:R[-1]C) -> 114 | G382: =SUM(R[-10]C:R[-1]C) -> 34200000 | I382: =SUM(R[-10]C:R[-1]C) -> 10
A383: Phòng Tài chính - Kế toán (HGS) | F383: =SUM(R[-12]C[4]:R[-1]C[4]) -> 114 | G383: =SUM(R[-12]C[4]:R[-1]C[4]) -> 34200000 | I383: =SUM(R[-12]C[3]:R[-1]C[3]) -> 10
A384: Phòng Tổ chức - Hành chính (HGS)
A386: 1 | B386: 010806 | C386: Phương Hồng Minh | E386: Trưởng phòng | F386: 12 | G386: 3600000 | I386: =1 -> 1 | J386: =RC[-4] -> 12 | K386: =RC[-4] -> 3600000 | L386: =RC[-3] -> 1
A387: 2 | B387: 010556 | C387: Nguyễn Thị Thuỳ Linh | E387: Phó Trưởng Phòng | F387: 12 | G387: 3600000 | I387: =1 -> 1 | J387: =RC[-4] -> 12 | K387: =RC[-4] -> 3600000 | L387: =RC[-3] -> 1
A388: 3 | B388: 010797 | C388: Nguyễn Hữu Hạ | E388: CV Đảng Đoàn - Thi đua | F388: 12 | G388: 3600000 | I388: =1 -> 1 | J388: =RC[-4] -> 12 | K388: =RC[-4] -> 3600000 | L388: =RC[-3] -> 1
A389: 4 | B389: 010803 | C389: Hà Duyên Lâm | E389: Lái xe CT | F389: 12 | G389: 3600000 | I389: =1 -> 1 | J389: =RC[-4] -> 12 | K389: =RC[-4] -> 3600000 | L389: =RC[-3] -> 1
A390: 5 | B390: 010800 | C390: Hoàng Thuỳ Lan | E390: NV đào tạo huấn luyện | F390: 12 | G390: 3600000 | I390: =1 -> 1 | J390: =RC[-4] -> 12 | K390: =RC[-4] -> 3600000 | L390: =RC[-3] -> 1
A391: 6 | B391: 010801 | C391: Diệu Linh | E391: NV đào tạo huấn luyện | F391: 12 | G391: 3600000 | I391: =1 -> 1 | J391: =RC[-4] -> 12 | K391: =RC[-4] -> 3600000 | L391: =RC[-3] -> 1
A392: 7 | B392: 010802 | C392: Hà Phương Thảo | E392: NV hành chính | F392: 12 | G392: 3600000 | I392: =1 -> 1 | J392: =RC[-4] -> 12 | K392: =RC[-4] -> 3600000 | L392: =RC[-3] -> 1
A393: 8 | B393: 010805 | C393: Trịnh Thị Thu Hằng | E393: NV Hành chính - VT | F393: 11 | G393: 3300000 | I393: =1 -> 1 | J393: =RC[-4] -> 11 | K393: =RC[-4] -> 3300000 | L393: =RC[-3] -> 1
A394: 9 | B394: 010566 | C394: Nguyễn Thị Ngọc | E394: NV Kế hoạch - Quản lý chất lượng | F394: 12 | G394: 3600000 | I394: =1 -> 1 | J394: =RC[-4] -> 12 | K394: =RC[-4] -> 3600000 | L394: =RC[-3] -> 1
A395: 10 | B395: 010804 | C395: Vũ Thị Hoà | E395: NV Lao động tiền lương | F395: 12 | G395: 3600000 | I395: =1 -> 1 | J395: =RC[-4] -> 12 | K395: =RC[-4] -> 3600000 | L395: =RC[-3] -> 1
A396: 11 | B396: 010735 | C396: Nguyễn Thị Phương Lan | E396: NV Thống kê - Tổng hợp | F396: 12 | G396: 3600000 | I396: =1 -> 1 | J396: =RC[-4] -> 12 | K396: =RC[-4] -> 3600000 | L396: =RC[-3] -> 1
A397: 12 | B397: 010799 | C397: Phương Lan | E397: Chuyên viên lao động tiền lương | F397: 12 | G397: 3600000 | I397: =1 -> 1 | J397: =RC[-4] -> 12 | K397: =RC[-4] -> 3600000 | L397: =RC[-3] -> 1
F398: =SUM(R[-12]C:R[-1]C) -> 143 | G398: =SUM(R[-12]C:R[-1]C) -> 42900000 | I398: =SUM(R[-12]C:R[-1]C) -> 12
A399: Phòng Tổ chức - Hành chính (HGS) | F399: =SUM(R[-14]C[4]:R[-1]C[4]) -> 143 | G399: =SUM(R[-14]C[4]:R[-1]C[4]) -> 42900000 | I399: =SUM(R[-14]C[3]:R[-1]C[3]) -> 12
A400: Công ty Phục vụ mặt đất Hà Nội (HGS) | B400: =RC[7] -> 346 | C400: Tổng cộng: | F400: =SUM(R[-389]C[4]:R[-1]C[4]) -> 3782 | G400: =SUM(R[-389]C[4]:R[-1]C[4]) -> 1134600000 | I400: =SUM(R[-389]C[3]:R[-1]C[3]) -> 346
B403: NGƯỜI LẬP BẢNG | E403: THỦ TRƯỞNG ĐƠN VỊ | F403: BAN TCCB-LĐTL | H403: BAN TCKT