Sheet: ExcelTemplate
A1: BỘ GIAO THÔNG VẬN TẢI | L1: 2015/02 | V1: Ngày in báo cáo: | W1: Ngày in báo cáo : ___/___/_____ | AU1: Ngày in báo cáo : ___/___/_____
A2: TỔNG CÔNG TY CẢNG HÀNG KHÔNG VIỆT NAM | W2: Trang in báo cáo : ___/___ | AU2: Trang in báo cáo : ___/___
A3: ="BẢNG TIỀN LƯƠNG THÁNG "&RIGHT(R[-2]C[11],2)&" NĂM "&LEFT(R[-2]C[11],4) -> BẢNG TIỀN LƯƠNG THÁNG 02 NĂM 2015
A4: ĐƠN VỊ: | C4: =R[5]C[-2] -> Công ty Phục vụ mặt đất Hà Nội (HGS)
A6: STT | B6: Mã NV | C6: Họ và tên | E6: Số TK | F6: Lương chức danh | G6: Lương cơ bản | H6: Các khoản phụ cấp | L6: Ăn giữa ca | M6: Bổ sung lương | N6: Tiền thêm giờ | O6: Tiền làm đêm | P6: Các khoản trừ vào lương | Q6: Tổng | R6: Các khoản phải nộp | W6: Thực lĩnh | AU6: Thực lĩnh | AW6: Tăng ca không chịu thuế | AX6: Tổng tiền tăng ca | AY6: Tăng ca chịu thuế
D7: Chức vụ | H7: PCCV | I7: PCCV o BH | J7: PCCV | K7: PCTN | R7: BHXH | S7: BHYT | T7: BHTN | U7: ĐPCĐ | V7: TTN tạm tính | X7: Đi đường | Y7: Nghỉ phép trong chế độ | Z7: H6 | AA7: Nghỉ TNLD | AB7: Nghỉ việc riêng hưởng nguyên lương (ma chay, cưới hỏi …) | AC7: Làm thêm CN b.đêm | AD7: Làm thêm CN b.ngày | AE7: Làm thêm LT b.đêm | AF7: Làm thêm LT b.ngày | AG7: Làm thêm NT b.đêm | AH7: Làm thêm NT b.ngày | AI7: X | AJ7: TS | AK7: ST | AL7: CT | AM7: H1 | AN7: H2 | AO7: H3 | AP7: H4 | AQ7: H5 | AV7: DC
A8: 1 | B8: 2 | C8: 3 | E8: 4 | F8: 22 | G8: 23 | H8: 24 | K8: 25 | L8: 26 | M8: 27 | N8: 28 | O8: 29 | Q8: 30 | R8: 31 | S8: 32 | T8: 33 | U8: 34 | V8: 35 | W8: 36 | AC8: 79 | AD8: 80 | AE8: 81 | AF8: 82 | AG8: 83 | AH8: 84 | AU8: 36
A9: Công ty Phục vụ mặt đất Hà Nội (HGS)
A10: Phòng Điều hành, tài liệu và hướng dẫn chất xếp (HGS) | F10: =R[11]C -> 5760000 | G10: =R[11]C -> 0 | H10: =R[11]C -> 0 | I10: =R[11]C -> 0 | J10: =R[11]C -> 0 | K10: =R[11]C -> 0 | L10: =R[11]C -> 0 | M10: =R[11]C -> 0 | N10: =R[11]C -> 0 | O10: =R[11]C -> 0 | P10: =R[11]C -> 0 | Q10: =R[11]C -> 5760000 | R10: =R[11]C -> 0 | S10: =R[11]C -> 0 | T10: =R[11]C -> 0 | U10: =R[11]C -> 57600 | V10: =R[11]C -> 0 | W10: =R[11]C -> 5702400 | X10: =R[11]C -> 0 | Y10: =R[11]C -> 0 | Z10: =R[11]C -> 0 | AA10: =R[11]C -> 0 | AB10: =R[11]C -> 0 | AC10: =R[11]C -> 0 | AD10: =R[11]C -> 0 | AE10: =R[11]C -> 0 | AF10: =R[11]C -> 0 | AG10: =R[11]C -> 0 | AH10: =R[11]C -> 0 | AI10: =R[11]C -> 5760000 | AJ10: =R[11]C -> 0 | AK10: =R[11]C -> 0 | AL10: =R[11]C -> 0 | AM10: =R[11]C -> 0 | AN10: =R[11]C -> 0 | AO10: =R[11]C -> 0 | AP10: =R[11]C -> 0 | AQ10: =R[11]C -> 0 | AR10: =R[11]C -> 8 | AS10: =R[11]C -> 0 | AT10: =R[11]C -> 0 | AU10: =R[11]C -> 5702400 | AW10: =R[11]C -> 0 | AX10: =R[11]C -> 0 | AY10: =R[11]C -> 0
F11: =R[9]C -> 5760000 | G11: =R[9]C -> 0 | H11: =R[9]C -> 0 | I11: =R[9]C -> 0 | J11: =R[9]C -> 0 | K11: =R[9]C -> 0 | L11: =R[9]C -> 0 | M11: =R[9]C -> 0 | N11: =R[9]C -> 0 | O11: =R[9]C -> 0 | P11: =R[9]C -> 0 | Q11: =R[9]C -> 5760000 | R11: =R[9]C -> 0 | S11: =R[9]C -> 0 | T11: =R[9]C -> 0 | U11: =R[9]C -> 57600 | V11: =R[9]C -> 0 | W11: =R[9]C -> 5702400 | X11: =R[9]C -> 0 | Y11: =R[9]C -> 0 | Z11: =R[9]C -> 0 | AA11: =R[9]C -> 0 | AB11: =R[9]C -> 0 | AC11: =R[9]C -> 0 | AD11: =R[9]C -> 0 | AE11: =R[9]C -> 0 | AF11: =R[9]C -> 0 | AG11: =R[9]C -> 0 | AH11: =R[9]C -> 0 | AI11: =R[9]C -> 5760000 | AJ11: =R[9]C -> 0 | AK11: =R[9]C -> 0 | AL11: =R[9]C -> 0 | AM11: =R[9]C -> 0 | AN11: =R[9]C -> 0 | AO11: =R[9]C -> 0 | AP11: =R[9]C -> 0 | AQ11: =R[9]C -> 0 | AR11: =R[9]C -> 8 | AS11: =R[9]C -> 0 | AT11: =R[9]C -> 0 | AU11: =R[9]C -> 5702400 | AW11: =R[9]C -> 0 | AX11: =R[9]C -> 0 | AY11: =R[9]C -> 0
A12: 1 | B12: 013356 | C12: Trần Anh Sơn | D12: NV Tài liệu và HDCX | E12: 19023495883011 | F12: =RC[29]+RC[30]+RC[31]+RC[32]+RC[33]+RC[34]+RC[35]+RC[36]+RC[37] -> 720000 | G12: =RC[17]+RC[18]++RC[19]+RC[20]+RC[21]+RC[38]+RC[39]+RC[41] -> 0 | H12: 0 | I12: 0 | J12: =RC[-2]+RC[-1] -> 0 | K12: 0 | L12: 0 | M12: 0 | N12: =RC[15]+RC[16]+RC[17]+RC[18]+RC[19]+RC[20] -> 0 | O12: 0 | P12: 0 | Q12: 720000 | R12: 0 | S12: 0 | T12: 0 | U12: 7200 | V12: 0 | W12: 712800 | X12: 0 | Y12: 0 | Z12: 0 | AA12: 0 | AB12: 0 | AC12: 0 | AD12: 0 | AE12: 0 | AF12: 0 | AG12: 0 | AH12: 0 | AI12: 720000 | AJ12: 0 | AK12: 0 | AL12: 0 | AM12: 0 | AN12: 0 | AO12: 0 | AP12: 0 | AQ12: 0 | AR12: =1 -> 1 | AS12: 0 | AT12: 0 | AU12: =RC[-30]-RC[-29]-RC[-28]-RC[-27]-RC[-26]-RC[-25] -> 712800 | AV12: 0 | AW12: =RC[1]-RC[2] -> 0 | AX12: 0 | AY12: 0 | AZ12: =RC[-46] -> 720000 | BA12: =RC[-46] -> 0 | BB12: =RC[-46] -> 0 | BC12: =RC[-46] -> 0 | BD12: =RC[-46] -> 0 | BE12: =RC[-46] -> 0 | BF12: =RC[-46] -> 0 | BG12: =RC[-46] -> 0 | BH12: =RC[-46] -> 0 | BI12: =RC[-46] -> 0 | BJ12: =RC[-46] -> 0 | BK12: =RC[-46] -> 720000 | BL12: =RC[-46] -> 0 | BM12: =RC[-46] -> 0 | BN12: =RC[-46] -> 0 | BO12: =RC[-46] -> 7200 | BP12: =RC[-46] -> 0 | BQ12: =RC[-46] -> 712800 | BR12: =RC[-46] -> 0 | BS12: =RC[-46] -> 0 | BT12: =RC[-46] -> 0 | BU12: =RC[-46] -> 0 | BV12: =RC[-46] -> 0 | BW12: =RC[-46] -> 0 | BX12: =RC[-46] -> 0 | BY12: =RC[-46] -> 0 | BZ12: =RC[-46] -> 0 | CA12: =RC[-46] -> 0 | CB12: =RC[-46] -> 0 | CC12: =RC[-46] -> 720000 | CD12: =RC[-46] -> 0 | CE12: =RC[-46] -> 0 | CF12: =RC[-46] -> 0 | CG12: =RC[-46] -> 0 | CH12: =RC[-46] -> 0 | CI12: =RC[-46] -> 0 | CJ12: =RC[-46] -> 0 | CK12: =RC[-46] -> 0 | CL12: =RC[-46] -> 1 | CM12: =RC[-46] -> 0 | CN12: =RC[-46] -> 0 | CO12: =RC[-46] -> 712800 | CP12: =RC[-46] -> 0 | CQ12: =RC[-46] -> 0 | CR12: =RC[-46] -> 0 | CS12: =RC[-46] -> 0
A13: 2 | B13: 013357 | C13: Nguyễn Trường Giang | D13: NV Tài liệu và HDCX | E13: 19028960246015 | F13: =RC[29]+RC[30]+RC[31]+RC[32]+RC[33]+RC[34]+RC[35]+RC[36]+RC[37] -> 720000 | G13: =RC[17]+RC[18]++RC[19]+RC[20]+RC[21]+RC[38]+RC[39]+RC[41] -> 0 | H13: 0 | I13: 0 | J13: =RC[-2]+RC[-1] -> 0 | K13: 0 | L13: 0 | M13: 0 | N13: =RC[15]+RC[16]+RC[17]+RC[18]+RC[19]+RC[20] -> 0 | O13: 0 | P13: 0 | Q13: 720000 | R13: 0 | S13: 0 | T13: 0 | U13: 7200 | V13: 0 | W13: 712800 | X13: 0 | Y13: 0 | Z13: 0 | AA13: 0 | AB13: 0 | AC13: 0 | AD13: 0 | AE13: 0 | AF13: 0 | AG13: 0 | AH13: 0 | AI13: 720000 | AJ13: 0 | AK13: 0 | AL13: 0 | AM13: 0 | AN13: 0 | AO13: 0 | AP13: 0 | AQ13: 0 | AR13: =1 -> 1 | AS13: 0 | AT13: 0 | AU13: =RC[-30]-RC[-29]-RC[-28]-RC[-27]-RC[-26]-RC[-25] -> 712800 | AV13: 0 | AW13: =RC[1]-RC[2] -> 0 | AX13: 0 | AY13: 0 | AZ13: =RC[-46] -> 720000 | BA13: =RC[-46] -> 0 | BB13: =RC[-46] -> 0 | BC13: =RC[-46] -> 0 | BD13: =RC[-46] -> 0 | BE13: =RC[-46] -> 0 | BF13: =RC[-46] -> 0 | BG13: =RC[-46] -> 0 | BH13: =RC[-46] -> 0 | BI13: =RC[-46] -> 0 | BJ13: =RC[-46] -> 0 | BK13: =RC[-46] -> 720000 | BL13: =RC[-46] -> 0 | BM13: =RC[-46] -> 0 | BN13: =RC[-46] -> 0 | BO13: =RC[-46] -> 7200 | BP13: =RC[-46] -> 0 | BQ13: =RC[-46] -> 712800 | BR13: =RC[-46] -> 0 | BS13: =RC[-46] -> 0 | BT13: =RC[-46] -> 0 | BU13: =RC[-46] -> 0 | BV13: =RC[-46] -> 0 | BW13: =RC[-46] -> 0 | BX13: =RC[-46] -> 0 | BY13: =RC[-46] -> 0 | BZ13: =RC[-46] -> 0 | CA13: =RC[-46] -> 0 | CB13: =RC[-46] -> 0 | CC13: =RC[-46] -> 720000 | CD13: =RC[-46] -> 0 | CE13: =RC[-46] -> 0 | CF13: =RC[-46] -> 0 | CG13: =RC[-46] -> 0 | CH13: =RC[-46] -> 0 | CI13: =RC[-46] -> 0 | CJ13: =RC[-46] -> 0 | CK13: =RC[-46] -> 0 | CL13: =RC[-46] -> 1 | CM13: =RC[-46] -> 0 | CN13: =RC[-46] -> 0 | CO13: =RC[-46] -> 712800 | CP13: =RC[-46] -> 0 | CQ13: =RC[-46] -> 0 | CR13: =RC[-46] -> 0 | CS13: =RC[-46] -> 0
A14: 3 | B14: 013358 | C14: Phan Thế Chung | D14: NV Tài liệu và HDCX | E14: 19028960243016 | F14: =RC[29]+RC[30]+RC[31]+RC[32]+RC[33]+RC[34]+RC[35]+RC[36]+RC[37] -> 720000 | G14: =RC[17]+RC[18]++RC[19]+RC[20]+RC[21]+RC[38]+RC[39]+RC[41] -> 0 | H14: 0 | I14: 0 | J14: =RC[-2]+RC[-1] -> 0 | K14: 0 | L14: 0 | M14: 0 | N14: =RC[15]+RC[16]+RC[17]+RC[18]+RC[19]+RC[20] -> 0 | O14: 0 | P14: 0 | Q14: 720000 | R14: 0 | S14: 0 | T14: 0 | U14: 7200 | V14: 0 | W14: 712800 | X14: 0 | Y14: 0 | Z14: 0 | AA14: 0 | AB14: 0 | AC14: 0 | AD14: 0 | AE14: 0 | AF14: 0 | AG14: 0 | AH14: 0 | AI14: 720000 | AJ14: 0 | AK14: 0 | AL14: 0 | AM14: 0 | AN14: 0 | AO14: 0 | AP14: 0 | AQ14: 0 | AR14: =1 -> 1 | AS14: 0 | AT14: 0 | AU14: =RC[-30]-RC[-29]-RC[-28]-RC[-27]-RC[-26]-RC[-25] -> 712800 | AV14: 0 | AW14: =RC[1]-RC[2] -> 0 | AX14: 0 | AY14: 0 | AZ14: =RC[-46] -> 720000 | BA14: =RC[-46] -> 0 | BB14: =RC[-46] -> 0 | BC14: =RC[-46] -> 0 | BD14: =RC[-46] -> 0 | BE14: =RC[-46] -> 0 | BF14: =RC[-46] -> 0 | BG14: =RC[-46] -> 0 | BH14: =RC[-46] -> 0 | BI14: =RC[-46] -> 0 | BJ14: =RC[-46] -> 0 | BK14: =RC[-46] -> 720000 | BL14: =RC[-46] -> 0 | BM14: =RC[-46] -> 0 | BN14: =RC[-46] -> 0 | BO14: =RC[-46] -> 7200 | BP14: =RC[-46] -> 0 | BQ14: =RC[-46] -> 712800 | BR14: =RC[-46] -> 0 | BS14: =RC[-46] -> 0 | BT14: =RC[-46] -> 0 | BU14: =RC[-46] -> 0 | BV14: =RC[-46] -> 0 | BW14: =RC[-46] -> 0 | BX14: =RC[-46] -> 0 | BY14: =RC[-46] -> 0 | BZ14: =RC[-46] -> 0 | CA14: =RC[-46] -> 0 | CB14: =RC[-46] -> 0 | CC14: =RC[-46] -> 720000 | CD14: =RC[-46] -> 0 | CE14: =RC[-46] -> 0 | CF14: =RC[-46] -> 0 | CG14: =RC[-46] -> 0 | CH14: =RC[-46] -> 0 | CI14: =RC[-46] -> 0 | CJ14: =RC[-46] -> 0 | CK14: =RC[-46] -> 0 | CL14: =RC[-46] -> 1 | CM14: =RC[-46] -> 0 | CN14: =RC[-46] -> 0 | CO14: =RC[-46] -> 712800 | CP14: =RC[-46] -> 0 | CQ14: =RC[-46] -> 0 | CR14: =RC[-46] -> 0 | CS14: =RC[-46] -> 0
A15: 4 | B15: 013359 | C15: Dương Đức An | D15: NV Tài liệu và HDCX | E15: 19028960251019 | F15: =RC[29]+RC[30]+RC[31]+RC[32]+RC[33]+RC[34]+RC[35]+RC[36]+RC[37] -> 720000 | G15: =RC[17]+RC[18]++RC[19]+RC[20]+RC[21]+RC[38]+RC[39]+RC[41] -> 0 | H15: 0 | I15: 0 | J15: =RC[-2]+RC[-1] -> 0 | K15: 0 | L15: 0 | M15: 0 | N15: =RC[15]+RC[16]+RC[17]+RC[18]+RC[19]+RC[20] -> 0 | O15: 0 | P15: 0 | Q15: 720000 | R15: 0 | S15: 0 | T15: 0 | U15: 7200 | V15: 0 | W15: 712800 | X15: 0 | Y15: 0 | Z15: 0 | AA15: 0 | AB15: 0 | AC15: 0 | AD15: 0 | AE15: 0 | AF15: 0 | AG15: 0 | AH15: 0 | AI15: 720000 | AJ15: 0 | AK15: 0 | AL15: 0 | AM15: 0 | AN15: 0 | AO15: 0 | AP15: 0 | AQ15: 0 | AR15: =1 -> 1 | AS15: 0 | AT15: 0 | AU15: =RC[-30]-RC[-29]-RC[-28]-RC[-27]-RC[-26]-RC[-25] -> 712800 | AV15: 0 | AW15: =RC[1]-RC[2] -> 0 | AX15: 0 | AY15: 0 | AZ15: =RC[-46] -> 720000 | BA15: =RC[-46] -> 0 | BB15: =RC[-46] -> 0 | BC15: =RC[-46] -> 0 | BD15: =RC[-46] -> 0 | BE15: =RC[-46] -> 0 | BF15: =RC[-46] -> 0 | BG15: =RC[-46] -> 0 | BH15: =RC[-46] -> 0 | BI15: =RC[-46] -> 0 | BJ15: =RC[-46] -> 0 | BK15: =RC[-46] -> 720000 | BL15: =RC[-46] -> 0 | BM15: =RC[-46] -> 0 | BN15: =RC[-46] -> 0 | BO15: =RC[-46] -> 7200 | BP15: =RC[-46] -> 0 | BQ15: =RC[-46] -> 712800 | BR15: =RC[-46] -> 0 | BS15: =RC[-46] -> 0 | BT15: =RC[-46] -> 0 | BU15: =RC[-46] -> 0 | BV15: =RC[-46] -> 0 | BW15: =RC[-46] -> 0 | BX15: =RC[-46] -> 0 | BY15: =RC[-46] -> 0 | BZ15: =RC[-46] -> 0 | CA15: =RC[-46] -> 0 | CB15: =RC[-46] -> 0 | CC15: =RC[-46] -> 720000 | CD15: =RC[-46] -> 0 | CE15: =RC[-46] -> 0 | CF15: =RC[-46] -> 0 | CG15: =RC[-46] -> 0 | CH15: =RC[-46] -> 0 | CI15: =RC[-46] -> 0 | CJ15: =RC[-46] -> 0 | CK15: =RC[-46] -> 0 | CL15: =RC[-46] -> 1 | CM15: =RC[-46] -> 0 | CN15: =RC[-46] -> 0 | CO15: =RC[-46] -> 712800 | CP15: =RC[-46] -> 0 | CQ15: =RC[-46] -> 0 | CR15: =RC[-46] -> 0 | CS15: =RC[-46] -> 0
A16: 5 | B16: 013360 | C16: Nguyễn Tự Tuyền | D16: NV Tài liệu và HDCX | E16: 19028960178011 | F16: =RC[29]+RC[30]+RC[31]+RC[32]+RC[33]+RC[34]+RC[35]+RC[36]+RC[37] -> 720000 | G16: =RC[17]+RC[18]++RC[19]+RC[20]+RC[21]+RC[38]+RC[39]+RC[41] -> 0 | H16: 0 | I16: 0 | J16: =RC[-2]+RC[-1] -> 0 | K16: 0 | L16: 0 | M16: 0 | N16: =RC[15]+RC[16]+RC[17]+RC[18]+RC[19]+RC[20] -> 0 | O16: 0 | P16: 0 | Q16: 720000 | R16: 0 | S16: 0 | T16: 0 | U16: 7200 | V16: 0 | W16: 712800 | X16: 0 | Y16: 0 | Z16: 0 | AA16: 0 | AB16: 0 | AC16: 0 | AD16: 0 | AE16: 0 | AF16: 0 | AG16: 0 | AH16: 0 | AI16: 720000 | AJ16: 0 | AK16: 0 | AL16: 0 | AM16: 0 | AN16: 0 | AO16: 0 | AP16: 0 | AQ16: 0 | AR16: =1 -> 1 | AS16: 0 | AT16: 0 | AU16: =RC[-30]-RC[-29]-RC[-28]-RC[-27]-RC[-26]-RC[-25] -> 712800 | AV16: 0 | AW16: =RC[1]-RC[2] -> 0 | AX16: 0 | AY16: 0 | AZ16: =RC[-46] -> 720000 | BA16: =RC[-46] -> 0 | BB16: =RC[-46] -> 0 | BC16: =RC[-46] -> 0 | BD16: =RC[-46] -> 0 | BE16: =RC[-46] -> 0 | BF16: =RC[-46] -> 0 | BG16: =RC[-46] -> 0 | BH16: =RC[-46] -> 0 | BI16: =RC[-46] -> 0 | BJ16: =RC[-46] -> 0 | BK16: =RC[-46] -> 720000 | BL16: =RC[-46] -> 0 | BM16: =RC[-46] -> 0 | BN16: =RC[-46] -> 0 | BO16: =RC[-46] -> 7200 | BP16: =RC[-46] -> 0 | BQ16: =RC[-46] -> 712800 | BR16: =RC[-46] -> 0 | BS16: =RC[-46] -> 0 | BT16: =RC[-46] -> 0 | BU16: =RC[-46] -> 0 | BV16: =RC[-46] -> 0 | BW16: =RC[-46] -> 0 | BX16: =RC[-46] -> 0 | BY16: =RC[-46] -> 0 | BZ16: =RC[-46] -> 0 | CA16: =RC[-46] -> 0 | CB16: =RC[-46] -> 0 | CC16: =RC[-46] -> 720000 | CD16: =RC[-46] -> 0 | CE16: =RC[-46] -> 0 | CF16: =RC[-46] -> 0 | CG16: =RC[-46] -> 0 | CH16: =RC[-46] -> 0 | CI16: =RC[-46] -> 0 | CJ16: =RC[-46] -> 0 | CK16: =RC[-46] -> 0 | CL16: =RC[-46] -> 1 | CM16: =RC[-46] -> 0 | CN16: =RC[-46] -> 0 | CO16: =RC[-46] -> 712800 | CP16: =RC[-46] -> 0 | CQ16: =RC[-46] -> 0 | CR16: =RC[-46] -> 0 | CS16: =RC[-46] -> 0
A17: 6 | B17: 013527 | C17: Chu Lữ Thu Phương | D17: NV Thủ tục bay, không báo | E17: 19027546517027 | F17: =RC[29]+RC[30]+RC[31]+RC[32]+RC[33]+RC[34]+RC[35]+RC[36]+RC[37] -> 720000 | G17: =RC[17]+RC[18]++RC[19]+RC[20]+RC[21]+RC[38]+RC[39]+RC[41] -> 0 | H17: 0 | I17: 0 | J17: =RC[-2]+RC[-1] -> 0 | K17: 0 | L17: 0 | M17: 0 | N17: =RC[15]+RC[16]+RC[17]+RC[18]+RC[19]+RC[20] -> 0 | O17: 0 | P17: 0 | Q17: 720000 | R17: 0 | S17: 0 | T17: 0 | U17: 7200 | V17: 0 | W17: 712800 | X17: 0 | Y17: 0 | Z17: 0 | AA17: 0 | AB17: 0 | AC17: 0 | AD17: 0 | AE17: 0 | AF17: 0 | AG17: 0 | AH17: 0 | AI17: 720000 | AJ17: 0 | AK17: 0 | AL17: 0 | AM17: 0 | AN17: 0 | AO17: 0 | AP17: 0 | AQ17: 0 | AR17: =1 -> 1 | AS17: 0 | AT17: 0 | AU17: =RC[-30]-RC[-29]-RC[-28]-RC[-27]-RC[-26]-RC[-25] -> 712800 | AV17: 0 | AW17: =RC[1]-RC[2] -> 0 | AX17: 0 | AY17: 0 | AZ17: =RC[-46] -> 720000 | BA17: =RC[-46] -> 0 | BB17: =RC[-46] -> 0 | BC17: =RC[-46] -> 0 | BD17: =RC[-46] -> 0 | BE17: =RC[-46] -> 0 | BF17: =RC[-46] -> 0 | BG17: =RC[-46] -> 0 | BH17: =RC[-46] -> 0 | BI17: =RC[-46] -> 0 | BJ17: =RC[-46] -> 0 | BK17: =RC[-46] -> 720000 | BL17: =RC[-46] -> 0 | BM17: =RC[-46] -> 0 | BN17: =RC[-46] -> 0 | BO17: =RC[-46] -> 7200 | BP17: =RC[-46] -> 0 | BQ17: =RC[-46] -> 712800 | BR17: =RC[-46] -> 0 | BS17: =RC[-46] -> 0 | BT17: =RC[-46] -> 0 | BU17: =RC[-46] -> 0 | BV17: =RC[-46] -> 0 | BW17: =RC[-46] -> 0 | BX17: =RC[-46] -> 0 | BY17: =RC[-46] -> 0 | BZ17: =RC[-46] -> 0 | CA17: =RC[-46] -> 0 | CB17: =RC[-46] -> 0 | CC17: =RC[-46] -> 720000 | CD17: =RC[-46] -> 0 | CE17: =RC[-46] -> 0 | CF17: =RC[-46] -> 0 | CG17: =RC[-46] -> 0 | CH17: =RC[-46] -> 0 | CI17: =RC[-46] -> 0 | CJ17: =RC[-46] -> 0 | CK17: =RC[-46] -> 0 | CL17: =RC[-46] -> 1 | CM17: =RC[-46] -> 0 | CN17: =RC[-46] -> 0 | CO17: =RC[-46] -> 712800 | CP17: =RC[-46] -> 0 | CQ17: =RC[-46] -> 0 | CR17: =RC[-46] -> 0 | CS17: =RC[-46] -> 0
A18: 7 | B18: 013528 | C18: Cao Thị Trà Giang | D18: NV Thủ tục bay, không báo | E18: 19028960119013 | F18: =RC[29]+RC[30]+RC[31]+RC[32]+RC[33]+RC[34]+RC[35]+RC[36]+RC[37] -> 720000 | G18: =RC[17]+RC[18]++RC[19]+RC[20]+RC[21]+RC[38]+RC[39]+RC[41] -> 0 | H18: 0 | I18: 0 | J18: =RC[-2]+RC[-1] -> 0 | K18: 0 | L18: 0 | M18: 0 | N18: =RC[15]+RC[16]+RC[17]+RC[18]+RC[19]+RC[20] -> 0 | O18: 0 | P18: 0 | Q18: 720000 | R18: 0 | S18: 0 | T18: 0 | U18: 7200 | V18: 0 | W18: 712800 | X18: 0 | Y18: 0 | Z18: 0 | AA18: 0 | AB18: 0 | AC18: 0 | AD18: 0 | AE18: 0 | AF18: 0 | AG18: 0 | AH18: 0 | AI18: 720000 | AJ18: 0 | AK18: 0 | AL18: 0 | AM18: 0 | AN18: 0 | AO18: 0 | AP18: 0 | AQ18: 0 | AR18: =1 -> 1 | AS18: 0 | AT18: 0 | AU18: =RC[-30]-RC[-29]-RC[-28]-RC[-27]-RC[-26]-RC[-25] -> 712800 | AV18: 0 | AW18: =RC[1]-RC[2] -> 0 | AX18: 0 | AY18: 0 | AZ18: =RC[-46] -> 720000 | BA18: =RC[-46] -> 0 | BB18: =RC[-46] -> 0 | BC18: =RC[-46] -> 0 | BD18: =RC[-46] -> 0 | BE18: =RC[-46] -> 0 | BF18: =RC[-46] -> 0 | BG18: =RC[-46] -> 0 | BH18: =RC[-46] -> 0 | BI18: =RC[-46] -> 0 | BJ18: =RC[-46] -> 0 | BK18: =RC[-46] -> 720000 | BL18: =RC[-46] -> 0 | BM18: =RC[-46] -> 0 | BN18: =RC[-46] -> 0 | BO18: =RC[-46] -> 7200 | BP18: =RC[-46] -> 0 | BQ18: =RC[-46] -> 712800 | BR18: =RC[-46] -> 0 | BS18: =RC[-46] -> 0 | BT18: =RC[-46] -> 0 | BU18: =RC[-46] -> 0 | BV18: =RC[-46] -> 0 | BW18: =RC[-46] -> 0 | BX18: =RC[-46] -> 0 | BY18: =RC[-46] -> 0 | BZ18: =RC[-46] -> 0 | CA18: =RC[-46] -> 0 | CB18: =RC[-46] -> 0 | CC18: =RC[-46] -> 720000 | CD18: =RC[-46] -> 0 | CE18: =RC[-46] -> 0 | CF18: =RC[-46] -> 0 | CG18: =RC[-46] -> 0 | CH18: =RC[-46] -> 0 | CI18: =RC[-46] -> 0 | CJ18: =RC[-46] -> 0 | CK18: =RC[-46] -> 0 | CL18: =RC[-46] -> 1 | CM18: =RC[-46] -> 0 | CN18: =RC[-46] -> 0 | CO18: =RC[-46] -> 712800 | CP18: =RC[-46] -> 0 | CQ18: =RC[-46] -> 0 | CR18: =RC[-46] -> 0 | CS18: =RC[-46] -> 0
A19: 8 | B19: 013102 | C19: Ngô Văn Sơn | D19: Nviên HDCX | E19: 19028834685011 | F19: =RC[29]+RC[30]+RC[31]+RC[32]+RC[33]+RC[34]+RC[35]+RC[36]+RC[37] -> 720000 | G19: =RC[17]+RC[18]++RC[19]+RC[20]+RC[21]+RC[38]+RC[39]+RC[41] -> 0 | H19: 0 | I19: 0 | J19: =RC[-2]+RC[-1] -> 0 | K19: 0 | L19: 0 | M19: 0 | N19: =RC[15]+RC[16]+RC[17]+RC[18]+RC[19]+RC[20] -> 0 | O19: 0 | P19: 0 | Q19: 720000 | R19: 0 | S19: 0 | T19: 0 | U19: 7200 | V19: 0 | W19: 712800 | X19: 0 | Y19: 0 | Z19: 0 | AA19: 0 | AB19: 0 | AC19: 0 | AD19: 0 | AE19: 0 | AF19: 0 | AG19: 0 | AH19: 0 | AI19: 720000 | AJ19: 0 | AK19: 0 | AL19: 0 | AM19: 0 | AN19: 0 | AO19: 0 | AP19: 0 | AQ19: 0 | AR19: =1 -> 1 | AS19: 0 | AT19: 0 | AU19: =RC[-30]-RC[-29]-RC[-28]-RC[-27]-RC[-26]-RC[-25] -> 712800 | AV19: 0 | AW19: =RC[1]-RC[2] -> 0 | AX19: 0 | AY19: 0 | AZ19: =RC[-46] -> 720000 | BA19: =RC[-46] -> 0 | BB19: =RC[-46] -> 0 | BC19: =RC[-46] -> 0 | BD19: =RC[-46] -> 0 | BE19: =RC[-46] -> 0 | BF19: =RC[-46] -> 0 | BG19: =RC[-46] -> 0 | BH19: =RC[-46] -> 0 | BI19: =RC[-46] -> 0 | BJ19: =RC[-46] -> 0 | BK19: =RC[-46] -> 720000 | BL19: =RC[-46] -> 0 | BM19: =RC[-46] -> 0 | BN19: =RC[-46] -> 0 | BO19: =RC[-46] -> 7200 | BP19: =RC[-46] -> 0 | BQ19: =RC[-46] -> 712800 | BR19: =RC[-46] -> 0 | BS19: =RC[-46] -> 0 | BT19: =RC[-46] -> 0 | BU19: =RC[-46] -> 0 | BV19: =RC[-46] -> 0 | BW19: =RC[-46] -> 0 | BX19: =RC[-46] -> 0 | BY19: =RC[-46] -> 0 | BZ19: =RC[-46] -> 0 | CA19: =RC[-46] -> 0 | CB19: =RC[-46] -> 0 | CC19: =RC[-46] -> 720000 | CD19: =RC[-46] -> 0 | CE19: =RC[-46] -> 0 | CF19: =RC[-46] -> 0 | CG19: =RC[-46] -> 0 | CH19: =RC[-46] -> 0 | CI19: =RC[-46] -> 0 | CJ19: =RC[-46] -> 0 | CK19: =RC[-46] -> 0 | CL19: =RC[-46] -> 1 | CM19: =RC[-46] -> 0 | CN19: =RC[-46] -> 0 | CO19: =RC[-46] -> 712800 | CP19: =RC[-46] -> 0 | CQ19: =RC[-46] -> 0 | CR19: =RC[-46] -> 0 | CS19: =RC[-46] -> 0
F20: =SUM(R[-8]C:R[-1]C) -> 5760000 | G20: =SUM(R[-8]C:R[-1]C) -> 0 | H20: =SUM(R[-8]C:R[-1]C) -> 0 | I20: =SUM(R[-8]C:R[-1]C) -> 0 | J20: =SUM(R[-8]C:R[-1]C) -> 0 | K20: =SUM(R[-8]C:R[-1]C) -> 0 | L20: =SUM(R[-8]C:R[-1]C) -> 0 | M20: =SUM(R[-8]C:R[-1]C) -> 0 | N20: =SUM(R[-8]C:R[-1]C) -> 0 | O20: =SUM(R[-8]C:R[-1]C) -> 0 | P20: =SUM(R[-8]C:R[-1]C) -> 0 | Q20: =SUM(R[-8]C:R[-1]C) -> 5760000 | R20: =SUM(R[-8]C:R[-1]C) -> 0 | S20: =SUM(R[-8]C:R[-1]C) -> 0 | T20: =SUM(R[-8]C:R[-1]C) -> 0 | U20: =SUM(R[-8]C:R[-1]C) -> 57600 | V20: =SUM(R[-8]C:R[-1]C) -> 0 | W20: =SUM(R[-8]C:R[-1]C) -> 5702400 | X20: =SUM(R[-8]C:R[-1]C) -> 0 | Y20: =SUM(R[-8]C:R[-1]C) -> 0 | Z20: =SUM(R[-8]C:R[-1]C) -> 0 | AA20: =SUM(R[-8]C:R[-1]C) -> 0 | AB20: =SUM(R[-8]C:R[-1]C) -> 0 | AC20: =SUM(R[-8]C:R[-1]C) -> 0 | AD20: =SUM(R[-8]C:R[-1]C) -> 0 | AE20: =SUM(R[-8]C:R[-1]C) -> 0 | AF20: =SUM(R[-8]C:R[-1]C) -> 0 | AG20: =SUM(R[-8]C:R[-1]C) -> 0 | AH20: =SUM(R[-8]C:R[-1]C) -> 0 | AI20: =SUM(R[-8]C:R[-1]C) -> 5760000 | AJ20: =SUM(R[-8]C:R[-1]C) -> 0 | AK20: =SUM(R[-8]C:R[-1]C) -> 0 | AL20: =SUM(R[-8]C:R[-1]C) -> 0 | AM20: =SUM(R[-8]C:R[-1]C) -> 0 | AN20: =SUM(R[-8]C:R[-1]C) -> 0 | AO20: =SUM(R[-8]C:R[-1]C) -> 0 | AP20: =SUM(R[-8]C:R[-1]C) -> 0 | AQ20: =SUM(R[-8]C:R[-1]C) -> 0 | AR20: =SUM(R[-8]C:R[-1]C) -> 8 | AS20: =SUM(R[-8]C:R[-1]C) -> 0 | AT20: =SUM(R[-8]C:R[-1]C) -> 0 | AU20: =SUM(R[-8]C:R[-1]C) -> 5702400 | AV20: =SUM(R[-8]C:R[-1]C) -> 0 | AW20: =SUM(R[-8]C:R[-1]C) -> 0 | AX20: =SUM(R[-8]C:R[-1]C) -> 0 | AY20: =SUM(R[-8]C:R[-1]C) -> 0
A21: Phòng Điều hành, tài liệu và hướng dẫn chất xếp (HGS) | F21: =SUM(R[-10]C[46]:R[-1]C[46]) -> 5760000 | G21: =SUM(R[-10]C[46]:R[-1]C[46]) -> 0 | H21: =SUM(R[-10]C[46]:R[-1]C[46]) -> 0 | I21: =SUM(R[-10]C[46]:R[-1]C[46]) -> 0 | J21: =SUM(R[-10]C[46]:R[-1]C[46]) -> 0 | K21: =SUM(R[-10]C[46]:R[-1]C[46]) -> 0 | L21: =SUM(R[-10]C[46]:R[-1]C[46]) -> 0 | M21: =SUM(R[-10]C[46]:R[-1]C[46]) -> 0 | N21: =SUM(R[-10]C[46]:R[-1]C[46]) -> 0 | O21: =SUM(R[-10]C[46]:R[-1]C[46]) -> 0 | P21: =SUM(R[-10]C[46]:R[-1]C[46]) -> 0 | Q21: =SUM(R[-10]C[46]:R[-1]C[46]) -> 5760000 | R21: =SUM(R[-10]C[46]:R[-1]C[46]) -> 0 | S21: =SUM(R[-10]C[46]:R[-1]C[46]) -> 0 | T21: =SUM(R[-10]C[46]:R[-1]C[46]) -> 0 | U21: =SUM(R[-10]C[46]:R[-1]C[46]) -> 57600 | V21: =SUM(R[-10]C[46]:R[-1]C[46]) -> 0 | W21: =SUM(R[-10]C[46]:R[-1]C[46]) -> 5702400 | X21: =SUM(R[-10]C[46]:R[-1]C[46]) -> 0 | Y21: =SUM(R[-10]C[46]:R[-1]C[46]) -> 0 | Z21: =SUM(R[-10]C[46]:R[-1]C[46]) -> 0 | AA21: =SUM(R[-10]C[46]:R[-1]C[46]) -> 0 | AB21: =SUM(R[-10]C[46]:R[-1]C[46]) -> 0 | AC21: =SUM(R[-10]C[46]:R[-1]C[46]) -> 0 | AD21: =SUM(R[-10]C[46]:R[-1]C[46]) -> 0 | AE21: =SUM(R[-10]C[46]:R[-1]C[46]) -> 0 | AF21: =SUM(R[-10]C[46]:R[-1]C[46]) -> 0 | AG21: =SUM(R[-10]C[46]:R[-1]C[46]) -> 0 | AH21: =SUM(R[-10]C[46]:R[-1]C[46]) -> 0 | AI21: =SUM(R[-10]C[46]:R[-1]C[46]) -> 5760000 | AJ21: =SUM(R[-10]C[46]:R[-1]C[46]) -> 0 | AK21: =SUM(R[-10]C[46]:R[-1]C[46]) -> 0 | AL21: =SUM(R[-10]C[46]:R[-1]C[46]) -> 0 | AM21: =SUM(R[-10]C[46]:R[-1]C[46]) -> 0 | AN21: =SUM(R[-10]C[46]:R[-1]C[46]) -> 0 | AO21: =SUM(R[-10]C[46]:R[-1]C[46]) -> 0 | AP21: =SUM(R[-10]C[46]:R[-1]C[46]) -> 0 | AQ21: =SUM(R[-10]C[46]:R[-1]C[46]) -> 0 | AR21: =SUM(R[-10]C[46]:R[-1]C[46]) -> 8 | AS21: =SUM(R[-10]C[46]:R[-1]C[46]) -> 0 | AT21: =SUM(R[-10]C[46]:R[-1]C[46]) -> 0 | AU21: =SUM(R[-10]C[46]:R[-1]C[46]) -> 5702400 | AV21: =SUM(R[-10]C[46]:R[-1]C[46]) -> 0 | AW21: =SUM(R[-10]C[46]:R[-1]C[46]) -> 0 | AX21: =SUM(R[-10]C[46]:R[-1]C[46]) -> 0 | AY21: =SUM(R[-10]C[46]:R[-1]C[46]) -> 0
A22: Phòng Phục vụ hành khách (HGS) | F22: =R[24]C -> 13680000 | G22: =R[24]C -> 0 | H22: =R[24]C -> 0 | I22: =R[24]C -> 0 | J22: =R[24]C -> 0 | K22: =R[24]C -> 0 | L22: =R[24]C -> 0 | M22: =R[24]C -> 0 | N22: =R[24]C -> 0 | O22: =R[24]C -> 0 | P22: =R[24]C -> 0 | Q22: =R[24]C -> 13680000 | R22: =R[24]C -> 0 | S22: =R[24]C -> 0 | T22: =R[24]C -> 0 | U22: =R[24]C -> 136800 | V22: =R[24]C -> 0 | W22: =R[24]C -> 13543200 | X22: =R[24]C -> 0 | Y22: =R[24]C -> 0 | Z22: =R[24]C -> 0 | AA22: =R[24]C -> 0 | AB22: =R[24]C -> 0 | AC22: =R[24]C -> 0 | AD22: =R[24]C -> 0 | AE22: =R[24]C -> 0 | AF22: =R[24]C -> 0 | AG22: =R[24]C -> 0 | AH22: =R[24]C -> 0 | AI22: =R[24]C -> 13680000 | AJ22: =R[24]C -> 0 | AK22: =R[24]C -> 0 | AL22: =R[24]C -> 0 | AM22: =R[24]C -> 0 | AN22: =R[24]C -> 0 | AO22: =R[24]C -> 0 | AP22: =R[24]C -> 0 | AQ22: =R[24]C -> 0 | AR22: =R[24]C -> 19 | AS22: =R[24]C -> 0 | AT22: =R[24]C -> 0 | AU22: =R[24]C -> 13543200 | AW22: =R[24]C -> 0 | AX22: =R[24]C -> 0 | AY22: =R[24]C -> 0
F23: =R[17]C -> 11520000 | G23: =R[17]C -> 0 | H23: =R[17]C -> 0 | I23: =R[17]C -> 0 | J23: =R[17]C -> 0 | K23: =R[17]C -> 0 | L23: =R[17]C -> 0 | M23: =R[17]C -> 0 | N23: =R[17]C -> 0 | O23: =R[17]C -> 0 | P23: =R[17]C -> 0 | Q23: =R[17]C -> 11520000 | R23: =R[17]C -> 0 | S23: =R[17]C -> 0 | T23: =R[17]C -> 0 | U23: =R[17]C -> 115200 | V23: =R[17]C -> 0 | W23: =R[17]C -> 11404800 | X23: =R[17]C -> 0 | Y23: =R[17]C -> 0 | Z23: =R[17]C -> 0 | AA23: =R[17]C -> 0 | AB23: =R[17]C -> 0 | AC23: =R[17]C -> 0 | AD23: =R[17]C -> 0 | AE23: =R[17]C -> 0 | AF23: =R[17]C -> 0 | AG23: =R[17]C -> 0 | AH23: =R[17]C -> 0 | AI23: =R[17]C -> 11520000 | AJ23: =R[17]C -> 0 | AK23: =R[17]C -> 0 | AL23: =R[17]C -> 0 | AM23: =R[17]C -> 0 | AN23: =R[17]C -> 0 | AO23: =R[17]C -> 0 | AP23: =R[17]C -> 0 | AQ23: =R[17]C -> 0 | AR23: =R[17]C -> 16 | AS23: =R[17]C -> 0 | AT23: =R[17]C -> 0 | AU23: =R[17]C -> 11404800 | AW23: =R[17]C -> 0 | AX23: =R[17]C -> 0 | AY23: =R[17]C -> 0
A24: 1 | B24: 013361 | C24: Mai Thế Anh | D24: Nhân viên phục vụ hành khách hàng hóa | E24: 19028779459015 | F24: =RC[29]+RC[30]+RC[31]+RC[32]+RC[33]+RC[34]+RC[35]+RC[36]+RC[37] -> 720000 | G24: =RC[17]+RC[18]++RC[19]+RC[20]+RC[21]+RC[38]+RC[39]+RC[41] -> 0 | H24: 0 | I24: 0 | J24: =RC[-2]+RC[-1] -> 0 | K24: 0 | L24: 0 | M24: 0 | N24: =RC[15]+RC[16]+RC[17]+RC[18]+RC[19]+RC[20] -> 0 | O24: 0 | P24: 0 | Q24: 720000 | R24: 0 | S24: 0 | T24: 0 | U24: 7200 | V24: 0 | W24: 712800 | X24: 0 | Y24: 0 | Z24: 0 | AA24: 0 | AB24: 0 | AC24: 0 | AD24: 0 | AE24: 0 | AF24: 0 | AG24: 0 | AH24: 0 | AI24: 720000 | AJ24: 0 | AK24: 0 | AL24: 0 | AM24: 0 | AN24: 0 | AO24: 0 | AP24: 0 | AQ24: 0 | AR24: =1 -> 1 | AS24: 0 | AT24: 0 | AU24: =RC[-30]-RC[-29]-RC[-28]-RC[-27]-RC[-26]-RC[-25] -> 712800 | AV24: 0 | AW24: =RC[1]-RC[2] -> 0 | AX24: 0 | AY24: 0 | AZ24: =RC[-46] -> 720000 | BA24: =RC[-46] -> 0 | BB24: =RC[-46] -> 0 | BC24: =RC[-46] -> 0 | BD24: =RC[-46] -> 0 | BE24: =RC[-46] -> 0 | BF24: =RC[-46] -> 0 | BG24: =RC[-46] -> 0 | BH24: =RC[-46] -> 0 | BI24: =RC[-46] -> 0 | BJ24: =RC[-46] -> 0 | BK24: =RC[-46] -> 720000 | BL24: =RC[-46] -> 0 | BM24: =RC[-46] -> 0 | BN24: =RC[-46] -> 0 | BO24: =RC[-46] -> 7200 | BP24: =RC[-46] -> 0 | BQ24: =RC[-46] -> 712800 | BR24: =RC[-46] -> 0 | BS24: =RC[-46] -> 0 | BT24: =RC[-46] -> 0 | BU24: =RC[-46] -> 0 | BV24: =RC[-46] -> 0 | BW24: =RC[-46] -> 0 | BX24: =RC[-46] -> 0 | BY24: =RC[-46] -> 0 | BZ24: =RC[-46] -> 0 | CA24: =RC[-46] -> 0 | CB24: =RC[-46] -> 0 | CC24: =RC[-46] -> 720000 | CD24: =RC[-46] -> 0 | CE24: =RC[-46] -> 0 | CF24: =RC[-46] -> 0 | CG24: =RC[-46] -> 0 | CH24: =RC[-46] -> 0 | CI24: =RC[-46] -> 0 | CJ24: =RC[-46] -> 0 | CK24: =RC[-46] -> 0 | CL24: =RC[-46] -> 1 | CM24: =RC[-46] -> 0 | CN24: =RC[-46] -> 0 | CO24: =RC[-46] -> 712800 | CP24: =RC[-46] -> 0 | CQ24: =RC[-46] -> 0 | CR24: =RC[-46] -> 0 | CS24: =RC[-46] -> 0
A25: 2 | B25: 013370 | C25: Đinh Đức Điệp | D25: Nhân viên phục vụ hành khách hàng hóa | E25: 19027124776021 | F25: =RC[29]+RC[30]+RC[31]+RC[32]+RC[33]+RC[34]+RC[35]+RC[36]+RC[37] -> 720000 | G25: =RC[17]+RC[18]++RC[19]+RC[20]+RC[21]+RC[38]+RC[39]+RC[41] -> 0 | H25: 0 | I25: 0 | J25: =RC[-2]+RC[-1] -> 0 | K25: 0 | L25: 0 | M25: 0 | N25: =RC[15]+RC[16]+RC[17]+RC[18]+RC[19]+RC[20] -> 0 | O25: 0 | P25: 0 | Q25: 720000 | R25: 0 | S25: 0 | T25: 0 | U25: 7200 | V25: 0 | W25: 712800 | X25: 0 | Y25: 0 | Z25: 0 | AA25: 0 | AB25: 0 | AC25: 0 | AD25: 0 | AE25: 0 | AF25: 0 | AG25: 0 | AH25: 0 | AI25: 720000 | AJ25: 0 | AK25: 0 | AL25: 0 | AM25: 0 | AN25: 0 | AO25: 0 | AP25: 0 | AQ25: 0 | AR25: =1 -> 1 | AS25: 0 | AT25: 0 | AU25: =RC[-30]-RC[-29]-RC[-28]-RC[-27]-RC[-26]-RC[-25] -> 712800 | AV25: 0 | AW25: =RC[1]-RC[2] -> 0 | AX25: 0 | AY25: 0 | AZ25: =RC[-46] -> 720000 | BA25: =RC[-46] -> 0 | BB25: =RC[-46] -> 0 | BC25: =RC[-46] -> 0 | BD25: =RC[-46] -> 0 | BE25: =RC[-46] -> 0 | BF25: =RC[-46] -> 0 | BG25: =RC[-46] -> 0 | BH25: =RC[-46] -> 0 | BI25: =RC[-46] -> 0 | BJ25: =RC[-46] -> 0 | BK25: =RC[-46] -> 720000 | BL25: =RC[-46] -> 0 | BM25: =RC[-46] -> 0 | BN25: =RC[-46] -> 0 | BO25: =RC[-46] -> 7200 | BP25: =RC[-46] -> 0 | BQ25: =RC[-46] -> 712800 | BR25: =RC[-46] -> 0 | BS25: =RC[-46] -> 0 | BT25: =RC[-46] -> 0 | BU25: =RC[-46] -> 0 | BV25: =RC[-46] -> 0 | BW25: =RC[-46] -> 0 | BX25: =RC[-46] -> 0 | BY25: =RC[-46] -> 0 | BZ25: =RC[-46] -> 0 | CA25: =RC[-46] -> 0 | CB25: =RC[-46] -> 0 | CC25: =RC[-46] -> 720000 | CD25: =RC[-46] -> 0 | CE25: =RC[-46] -> 0 | CF25: =RC[-46] -> 0 | CG25: =RC[-46] -> 0 | CH25: =RC[-46] -> 0 | CI25: =RC[-46] -> 0 | CJ25: =RC[-46] -> 0 | CK25: =RC[-46] -> 0 | CL25: =RC[-46] -> 1 | CM25: =RC[-46] -> 0 | CN25: =RC[-46] -> 0 | CO25: =RC[-46] -> 712800 | CP25: =RC[-46] -> 0 | CQ25: =RC[-46] -> 0 | CR25: =RC[-46] -> 0 | CS25: =RC[-46] -> 0
A26: 3 | B26: 013371 | C26: Triệu Hà Phương Anh | D26: Nhân viên phục vụ hành khách hàng hóa | E26: 19028960158019 | F26: =RC[29]+RC[30]+RC[31]+RC[32]+RC[33]+RC[34]+RC[35]+RC[36]+RC[37] -> 720000 | G26: =RC[17]+RC[18]++RC[19]+RC[20]+RC[21]+RC[38]+RC[39]+RC[41] -> 0 | H26: 0 | I26: 0 | J26: =RC[-2]+RC[-1] -> 0 | K26: 0 | L26: 0 | M26: 0 | N26: =RC[15]+RC[16]+RC[17]+RC[18]+RC[19]+RC[20] -> 0 | O26: 0 | P26: 0 | Q26: 720000 | R26: 0 | S26: 0 | T26: 0 | U26: 7200 | V26: 0 | W26: 712800 | X26: 0 | Y26: 0 | Z26: 0 | AA26: 0 | AB26: 0 | AC26: 0 | AD26: 0 | AE26: 0 | AF26: 0 | AG26: 0 | AH26: 0 | AI26: 720000 | AJ26: 0 | AK26: 0 | AL26: 0 | AM26: 0 | AN26: 0 | AO26: 0 | AP26: 0 | AQ26: 0 | AR26: =1 -> 1 | AS26: 0 | AT26: 0 | AU26: =RC[-30]-RC[-29]-RC[-28]-RC[-27]-RC[-26]-RC[-25] -> 712800 | AV26: 0 | AW26: =RC[1]-RC[2] -> 0 | AX26: 0 | AY26: 0 | AZ26: =RC[-46] -> 720000 | BA26: =RC[-46] -> 0 | BB26: =RC[-46] -> 0 | BC26: =RC[-46] -> 0 | BD26: =RC[-46] -> 0 | BE26: =RC[-46] -> 0 | BF26: =RC[-46] -> 0 | BG26: =RC[-46] -> 0 | BH26: =RC[-46] -> 0 | BI26: =RC[-46] -> 0 | BJ26: =RC[-46] -> 0 | BK26: =RC[-46] -> 720000 | BL26: =RC[-46] -> 0 | BM26: =RC[-46] -> 0 | BN26: =RC[-46] -> 0 | BO26: =RC[-46] -> 7200 | BP26: =RC[-46] -> 0 | BQ26: =RC[-46] -> 712800 | BR26: =RC[-46] -> 0 | BS26: =RC[-46] -> 0 | BT26: =RC[-46] -> 0 | BU26: =RC[-46] -> 0 | BV26: =RC[-46] -> 0 | BW26: =RC[-46] -> 0 | BX26: =RC[-46] -> 0 | BY26: =RC[-46] -> 0 | BZ26: =RC[-46] -> 0 | CA26: =RC[-46] -> 0 | CB26: =RC[-46] -> 0 | CC26: =RC[-46] -> 720000 | CD26: =RC[-46] -> 0 | CE26: =RC[-46] -> 0 | CF26: =RC[-46] -> 0 | CG26: =RC[-46] -> 0 | CH26: =RC[-46] -> 0 | CI26: =RC[-46] -> 0 | CJ26: =RC[-46] -> 0 | CK26: =RC[-46] -> 0 | CL26: =RC[-46] -> 1 | CM26: =RC[-46] -> 0 | CN26: =RC[-46] -> 0 | CO26: =RC[-46] -> 712800 | CP26: =RC[-46] -> 0 | CQ26: =RC[-46] -> 0 | CR26: =RC[-46] -> 0 | CS26: =RC[-46] -> 0
A27: 4 | B27: 013372 | C27: Trần Thị Hoa Lý | D27: Nhân viên phục vụ hành khách hàng hóa | E27: 19028960245019 | F27: =RC[29]+RC[30]+RC[31]+RC[32]+RC[33]+RC[34]+RC[35]+RC[36]+RC[37] -> 720000 | G27: =RC[17]+RC[18]++RC[19]+RC[20]+RC[21]+RC[38]+RC[39]+RC[41] -> 0 | H27: 0 | I27: 0 | J27: =RC[-2]+RC[-1] -> 0 | K27: 0 | L27: 0 | M27: 0 | N27: =RC[15]+RC[16]+RC[17]+RC[18]+RC[19]+RC[20] -> 0 | O27: 0 | P27: 0 | Q27: 720000 | R27: 0 | S27: 0 | T27: 0 | U27: 7200 | V27: 0 | W27: 712800 | X27: 0 | Y27: 0 | Z27: 0 | AA27: 0 | AB27: 0 | AC27: 0 | AD27: 0 | AE27: 0 | AF27: 0 | AG27: 0 | AH27: 0 | AI27: 720000 | AJ27: 0 | AK27: 0 | AL27: 0 | AM27: 0 | AN27: 0 | AO27: 0 | AP27: 0 | AQ27: 0 | AR27: =1 -> 1 | AS27: 0 | AT27: 0 | AU27: =RC[-30]-RC[-29]-RC[-28]-RC[-27]-RC[-26]-RC[-25] -> 712800 | AV27: 0 | AW27: =RC[1]-RC[2] -> 0 | AX27: 0 | AY27: 0 | AZ27: =RC[-46] -> 720000 | BA27: =RC[-46] -> 0 | BB27: =RC[-46] -> 0 | BC27: =RC[-46] -> 0 | BD27: =RC[-46] -> 0 | BE27: =RC[-46] -> 0 | BF27: =RC[-46] -> 0 | BG27: =RC[-46] -> 0 | BH27: =RC[-46] -> 0 | BI27: =RC[-46] -> 0 | BJ27: =RC[-46] -> 0 | BK27: =RC[-46] -> 720000 | BL27: =RC[-46] -> 0 | BM27: =RC[-46] -> 0 | BN27: =RC[-46] -> 0 | BO27: =RC[-46] -> 7200 | BP27: =RC[-46] -> 0 | BQ27: =RC[-46] -> 712800 | BR27: =RC[-46] -> 0 | BS27: =RC[-46] -> 0 | BT27: =RC[-46] -> 0 | BU27: =RC[-46] -> 0 | BV27: =RC[-46] -> 0 | BW27: =RC[-46] -> 0 | BX27: =RC[-46] -> 0 | BY27: =RC[-46] -> 0 | BZ27: =RC[-46] -> 0 | CA27: =RC[-46] -> 0 | CB27: =RC[-46] -> 0 | CC27: =RC[-46] -> 720000 | CD27: =RC[-46] -> 0 | CE27: =RC[-46] -> 0 | CF27: =RC[-46] -> 0 | CG27: =RC[-46] -> 0 | CH27: =RC[-46] -> 0 | CI27: =RC[-46] -> 0 | CJ27: =RC[-46] -> 0 | CK27: =RC[-46] -> 0 | CL27: =RC[-46] -> 1 | CM27: =RC[-46] -> 0 | CN27: =RC[-46] -> 0 | CO27: =RC[-46] -> 712800 | CP27: =RC[-46] -> 0 | CQ27: =RC[-46] -> 0 | CR27: =RC[-46] -> 0 | CS27: =RC[-46] -> 0
A28: 5 | B28: 013373 | C28: Trần Thị Sơn | D28: Nhân viên phục vụ hành khách hàng hóa | E28: 19028960201011 | F28: =RC[29]+RC[30]+RC[31]+RC[32]+RC[33]+RC[34]+RC[35]+RC[36]+RC[37] -> 720000 | G28: =RC[17]+RC[18]++RC[19]+RC[20]+RC[21]+RC[38]+RC[39]+RC[41] -> 0 | H28: 0 | I28: 0 | J28: =RC[-2]+RC[-1] -> 0 | K28: 0 | L28: 0 | M28: 0 | N28: =RC[15]+RC[16]+RC[17]+RC[18]+RC[19]+RC[20] -> 0 | O28: 0 | P28: 0 | Q28: 720000 | R28: 0 | S28: 0 | T28: 0 | U28: 7200 | V28: 0 | W28: 712800 | X28: 0 | Y28: 0 | Z28: 0 | AA28: 0 | AB28: 0 | AC28: 0 | AD28: 0 | AE28: 0 | AF28: 0 | AG28: 0 | AH28: 0 | AI28: 720000 | AJ28: 0 | AK28: 0 | AL28: 0 | AM28: 0 | AN28: 0 | AO28: 0 | AP28: 0 | AQ28: 0 | AR28: =1 -> 1 | AS28: 0 | AT28: 0 | AU28: =RC[-30]-RC[-29]-RC[-28]-RC[-27]-RC[-26]-RC[-25] -> 712800 | AV28: 0 | AW28: =RC[1]-RC[2] -> 0 | AX28: 0 | AY28: 0 | AZ28: =RC[-46] -> 720000 | BA28: =RC[-46] -> 0 | BB28: =RC[-46] -> 0 | BC28: =RC[-46] -> 0 | BD28: =RC[-46] -> 0 | BE28: =RC[-46] -> 0 | BF28: =RC[-46] -> 0 | BG28: =RC[-46] -> 0 | BH28: =RC[-46] -> 0 | BI28: =RC[-46] -> 0 | BJ28: =RC[-46] -> 0 | BK28: =RC[-46] -> 720000 | BL28: =RC[-46] -> 0 | BM28: =RC[-46] -> 0 | BN28: =RC[-46] -> 0 | BO28: =RC[-46] -> 7200 | BP28: =RC[-46] -> 0 | BQ28: =RC[-46] -> 712800 | BR28: =RC[-46] -> 0 | BS28: =RC[-46] -> 0 | BT28: =RC[-46] -> 0 | BU28: =RC[-46] -> 0 | BV28: =RC[-46] -> 0 | BW28: =RC[-46] -> 0 | BX28: =RC[-46] -> 0 | BY28: =RC[-46] -> 0 | BZ28: =RC[-46] -> 0 | CA28: =RC[-46] -> 0 | CB28: =RC[-46] -> 0 | CC28: =RC[-46] -> 720000 | CD28: =RC[-46] -> 0 | CE28: =RC[-46] -> 0 | CF28: =RC[-46] -> 0 | CG28: =RC[-46] -> 0 | CH28: =RC[-46] -> 0 | CI28: =RC[-46] -> 0 | CJ28: =RC[-46] -> 0 | CK28: =RC[-46] -> 0 | CL28: =RC[-46] -> 1 | CM28: =RC[-46] -> 0 | CN28: =RC[-46] -> 0 | CO28: =RC[-46] -> 712800 | CP28: =RC[-46] -> 0 | CQ28: =RC[-46] -> 0 | CR28: =RC[-46] -> 0 | CS28: =RC[-46] -> 0
A29: 6 | B29: 013374 | C29: Trần Thị Ngọc Hoa | D29: Nhân viên phục vụ hành khách hàng hóa | E29: 19025879138020 | F29: =RC[29]+RC[30]+RC[31]+RC[32]+RC[33]+RC[34]+RC[35]+RC[36]+RC[37] -> 720000 | G29: =RC[17]+RC[18]++RC[19]+RC[20]+RC[21]+RC[38]+RC[39]+RC[41] -> 0 | H29: 0 | I29: 0 | J29: =RC[-2]+RC[-1] -> 0 | K29: 0 | L29: 0 | M29: 0 | N29: =RC[15]+RC[16]+RC[17]+RC[18]+RC[19]+RC[20] -> 0 | O29: 0 | P29: 0 | Q29: 720000 | R29: 0 | S29: 0 | T29: 0 | U29: 7200 | V29: 0 | W29: 712800 | X29: 0 | Y29: 0 | Z29: 0 | AA29: 0 | AB29: 0 | AC29: 0 | AD29: 0 | AE29: 0 | AF29: 0 | AG29: 0 | AH29: 0 | AI29: 720000 | AJ29: 0 | AK29: 0 | AL29: 0 | AM29: 0 | AN29: 0 | AO29: 0 | AP29: 0 | AQ29: 0 | AR29: =1 -> 1 | AS29: 0 | AT29: 0 | AU29: =RC[-30]-RC[-29]-RC[-28]-RC[-27]-RC[-26]-RC[-25] -> 712800 | AV29: 0 | AW29: =RC[1]-RC[2] -> 0 | AX29: 0 | AY29: 0 | AZ29: =RC[-46] -> 720000 | BA29: =RC[-46] -> 0 | BB29: =RC[-46] -> 0 | BC29: =RC[-46] -> 0 | BD29: =RC[-46] -> 0 | BE29: =RC[-46] -> 0 | BF29: =RC[-46] -> 0 | BG29: =RC[-46] -> 0 | BH29: =RC[-46] -> 0 | BI29: =RC[-46] -> 0 | BJ29: =RC[-46] -> 0 | BK29: =RC[-46] -> 720000 | BL29: =RC[-46] -> 0 | BM29: =RC[-46] -> 0 | BN29: =RC[-46] -> 0 | BO29: =RC[-46] -> 7200 | BP29: =RC[-46] -> 0 | BQ29: =RC[-46] -> 712800 | BR29: =RC[-46] -> 0 | BS29: =RC[-46] -> 0 | BT29: =RC[-46] -> 0 | BU29: =RC[-46] -> 0 | BV29: =RC[-46] -> 0 | BW29: =RC[-46] -> 0 | BX29: =RC[-46] -> 0 | BY29: =RC[-46] -> 0 | BZ29: =RC[-46] -> 0 | CA29: =RC[-46] -> 0 | CB29: =RC[-46] -> 0 | CC29: =RC[-46] -> 720000 | CD29: =RC[-46] -> 0 | CE29: =RC[-46] -> 0 | CF29: =RC[-46] -> 0 | CG29: =RC[-46] -> 0 | CH29: =RC[-46] -> 0 | CI29: =RC[-46] -> 0 | CJ29: =RC[-46] -> 0 | CK29: =RC[-46] -> 0 | CL29: =RC[-46] -> 1 | CM29: =RC[-46] -> 0 | CN29: =RC[-46] -> 0 | CO29: =RC[-46] -> 712800 | CP29: =RC[-46] -> 0 | CQ29: =RC[-46] -> 0 | CR29: =RC[-46] -> 0 | CS29: =RC[-46] -> 0
A30: 7 | B30: 013375 | C30: Nguyễn Thị Oanh | D30: Nhân viên phục vụ hành khách hàng hóa | E30: 19026811113026 | F30: =RC[29]+RC[30]+RC[31]+RC[32]+RC[33]+RC[34]+RC[35]+RC[36]+RC[37] -> 720000 | G30: =RC[17]+RC[18]++RC[19]+RC[20]+RC[21]+RC[38]+RC[39]+RC[41] -> 0 | H30: 0 | I30: 0 | J30: =RC[-2]+RC[-1] -> 0 | K30: 0 | L30: 0 | M30: 0 | N30: =RC[15]+RC[16]+RC[17]+RC[18]+RC[19]+RC[20] -> 0 | O30: 0 | P30: 0 | Q30: 720000 | R30: 0 | S30: 0 | T30: 0 | U30: 7200 | V30: 0 | W30: 712800 | X30: 0 | Y30: 0 | Z30: 0 | AA30: 0 | AB30: 0 | AC30: 0 | AD30: 0 | AE30: 0 | AF30: 0 | AG30: 0 | AH30: 0 | AI30: 720000 | AJ30: 0 | AK30: 0 | AL30: 0 | AM30: 0 | AN30: 0 | AO30: 0 | AP30: 0 | AQ30: 0 | AR30: =1 -> 1 | AS30: 0 | AT30: 0 | AU30: =RC[-30]-RC[-29]-RC[-28]-RC[-27]-RC[-26]-RC[-25] -> 712800 | AV30: 0 | AW30: =RC[1]-RC[2] -> 0 | AX30: 0 | AY30: 0 | AZ30: =RC[-46] -> 720000 | BA30: =RC[-46] -> 0 | BB30: =RC[-46] -> 0 | BC30: =RC[-46] -> 0 | BD30: =RC[-46] -> 0 | BE30: =RC[-46] -> 0 | BF30: =RC[-46] -> 0 | BG30: =RC[-46] -> 0 | BH30: =RC[-46] -> 0 | BI30: =RC[-46] -> 0 | BJ30: =RC[-46] -> 0 | BK30: =RC[-46] -> 720000 | BL30: =RC[-46] -> 0 | BM30: =RC[-46] -> 0 | BN30: =RC[-46] -> 0 | BO30: =RC[-46] -> 7200 | BP30: =RC[-46] -> 0 | BQ30: =RC[-46] -> 712800 | BR30: =RC[-46] -> 0 | BS30: =RC[-46] -> 0 | BT30: =RC[-46] -> 0 | BU30: =RC[-46] -> 0 | BV30: =RC[-46] -> 0 | BW30: =RC[-46] -> 0 | BX30: =RC[-46] -> 0 | BY30: =RC[-46] -> 0 | BZ30: =RC[-46] -> 0 | CA30: =RC[-46] -> 0 | CB30: =RC[-46] -> 0 | CC30: =RC[-46] -> 720000 | CD30: =RC[-46] -> 0 | CE30: =RC[-46] -> 0 | CF30: =RC[-46] -> 0 | CG30: =RC[-46] -> 0 | CH30: =RC[-46] -> 0 | CI30: =RC[-46] -> 0 | CJ30: =RC[-46] -> 0 | CK30: =RC[-46] -> 0 | CL30: =RC[-46] -> 1 | CM30: =RC[-46] -> 0 | CN30: =RC[-46] -> 0 | CO30: =RC[-46] -> 712800 | CP30: =RC[-46] -> 0 | CQ30: =RC[-46] -> 0 | CR30: =RC[-46] -> 0 | CS30: =RC[-46] -> 0
A31: 8 | B31: 013376 | C31: Vũ Thùy Linh | D31: Nhân viên phục vụ hành khách hàng hóa | E31: 19028369955023 | F31: =RC[29]+RC[30]+RC[31]+RC[32]+RC[33]+RC[34]+RC[35]+RC[36]+RC[37] -> 720000 | G31: =RC[17]+RC[18]++RC[19]+RC[20]+RC[21]+RC[38]+RC[39]+RC[41] -> 0 | H31: 0 | I31: 0 | J31: =RC[-2]+RC[-1] -> 0 | K31: 0 | L31: 0 | M31: 0 | N31: =RC[15]+RC[16]+RC[17]+RC[18]+RC[19]+RC[20] -> 0 | O31: 0 | P31: 0 | Q31: 720000 | R31: 0 | S31: 0 | T31: 0 | U31: 7200 | V31: 0 | W31: 712800 | X31: 0 | Y31: 0 | Z31: 0 | AA31: 0 | AB31: 0 | AC31: 0 | AD31: 0 | AE31: 0 | AF31: 0 | AG31: 0 | AH31: 0 | AI31: 720000 | AJ31: 0 | AK31: 0 | AL31: 0 | AM31: 0 | AN31: 0 | AO31: 0 | AP31: 0 | AQ31: 0 | AR31: =1 -> 1 | AS31: 0 | AT31: 0 | AU31: =RC[-30]-RC[-29]-RC[-28]-RC[-27]-RC[-26]-RC[-25] -> 712800 | AV31: 0 | AW31: =RC[1]-RC[2] -> 0 | AX31: 0 | AY31: 0 | AZ31: =RC[-46] -> 720000 | BA31: =RC[-46] -> 0 | BB31: =RC[-46] -> 0 | BC31: =RC[-46] -> 0 | BD31: =RC[-46] -> 0 | BE31: =RC[-46] -> 0 | BF31: =RC[-46] -> 0 | BG31: =RC[-46] -> 0 | BH31: =RC[-46] -> 0 | BI31: =RC[-46] -> 0 | BJ31: =RC[-46] -> 0 | BK31: =RC[-46] -> 720000 | BL31: =RC[-46] -> 0 | BM31: =RC[-46] -> 0 | BN31: =RC[-46] -> 0 | BO31: =RC[-46] -> 7200 | BP31: =RC[-46] -> 0 | BQ31: =RC[-46] -> 712800 | BR31: =RC[-46] -> 0 | BS31: =RC[-46] -> 0 | BT31: =RC[-46] -> 0 | BU31: =RC[-46] -> 0 | BV31: =RC[-46] -> 0 | BW31: =RC[-46] -> 0 | BX31: =RC[-46] -> 0 | BY31: =RC[-46] -> 0 | BZ31: =RC[-46] -> 0 | CA31: =RC[-46] -> 0 | CB31: =RC[-46] -> 0 | CC31: =RC[-46] -> 720000 | CD31: =RC[-46] -> 0 | CE31: =RC[-46] -> 0 | CF31: =RC[-46] -> 0 | CG31: =RC[-46] -> 0 | CH31: =RC[-46] -> 0 | CI31: =RC[-46] -> 0 | CJ31: =RC[-46] -> 0 | CK31: =RC[-46] -> 0 | CL31: =RC[-46] -> 1 | CM31: =RC[-46] -> 0 | CN31: =RC[-46] -> 0 | CO31: =RC[-46] -> 712800 | CP31: =RC[-46] -> 0 | CQ31: =RC[-46] -> 0 | CR31: =RC[-46] -> 0 | CS31: =RC[-46] -> 0
A32: 9 | B32: 013377 | C32: Vũ Thị Bích Dung | D32: Nhân viên phục vụ hành khách hàng hóa | E32: 19028960285010 | F32: =RC[29]+RC[30]+RC[31]+RC[32]+RC[33]+RC[34]+RC[35]+RC[36]+RC[37] -> 720000 | G32: =RC[17]+RC[18]++RC[19]+RC[20]+RC[21]+RC[38]+RC[39]+RC[41] -> 0 | H32: 0 | I32: 0 | J32: =RC[-2]+RC[-1] -> 0 | K32: 0 | L32: 0 | M32: 0 | N32: =RC[15]+RC[16]+RC[17]+RC[18]+RC[19]+RC[20] -> 0 | O32: 0 | P32: 0 | Q32: 720000 | R32: 0 | S32: 0 | T32: 0 | U32: 7200 | V32: 0 | W32: 712800 | X32: 0 | Y32: 0 | Z32: 0 | AA32: 0 | AB32: 0 | AC32: 0 | AD32: 0 | AE32: 0 | AF32: 0 | AG32: 0 | AH32: 0 | AI32: 720000 | AJ32: 0 | AK32: 0 | AL32: 0 | AM32: 0 | AN32: 0 | AO32: 0 | AP32: 0 | AQ32: 0 | AR32: =1 -> 1 | AS32: 0 | AT32: 0 | AU32: =RC[-30]-RC[-29]-RC[-28]-RC[-27]-RC[-26]-RC[-25] -> 712800 | AV32: 0 | AW32: =RC[1]-RC[2] -> 0 | AX32: 0 | AY32: 0 | AZ32: =RC[-46] -> 720000 | BA32: =RC[-46] -> 0 | BB32: =RC[-46] -> 0 | BC32: =RC[-46] -> 0 | BD32: =RC[-46] -> 0 | BE32: =RC[-46] -> 0 | BF32: =RC[-46] -> 0 | BG32: =RC[-46] -> 0 | BH32: =RC[-46] -> 0 | BI32: =RC[-46] -> 0 | BJ32: =RC[-46] -> 0 | BK32: =RC[-46] -> 720000 | BL32: =RC[-46] -> 0 | BM32: =RC[-46] -> 0 | BN32: =RC[-46] -> 0 | BO32: =RC[-46] -> 7200 | BP32: =RC[-46] -> 0 | BQ32: =RC[-46] -> 712800 | BR32: =RC[-46] -> 0 | BS32: =RC[-46] -> 0 | BT32: =RC[-46] -> 0 | BU32: =RC[-46] -> 0 | BV32: =RC[-46] -> 0 | BW32: =RC[-46] -> 0 | BX32: =RC[-46] -> 0 | BY32: =RC[-46] -> 0 | BZ32: =RC[-46] -> 0 | CA32: =RC[-46] -> 0 | CB32: =RC[-46] -> 0 | CC32: =RC[-46] -> 720000 | CD32: =RC[-46] -> 0 | CE32: =RC[-46] -> 0 | CF32: =RC[-46] -> 0 | CG32: =RC[-46] -> 0 | CH32: =RC[-46] -> 0 | CI32: =RC[-46] -> 0 | CJ32: =RC[-46] -> 0 | CK32: =RC[-46] -> 0 | CL32: =RC[-46] -> 1 | CM32: =RC[-46] -> 0 | CN32: =RC[-46] -> 0 | CO32: =RC[-46] -> 712800 | CP32: =RC[-46] -> 0 | CQ32: =RC[-46] -> 0 | CR32: =RC[-46] -> 0 | CS32: =RC[-46] -> 0
A33: 10 | B33: 013378 | C33: Nguyễn Bảo Ngân | D33: Nhân viên phục vụ hành khách hàng hóa | E33: 19028960204010 | F33: =RC[29]+RC[30]+RC[31]+RC[32]+RC[33]+RC[34]+RC[35]+RC[36]+RC[37] -> 720000 | G33: =RC[17]+RC[18]++RC[19]+RC[20]+RC[21]+RC[38]+RC[39]+RC[41] -> 0 | H33: 0 | I33: 0 | J33: =RC[-2]+RC[-1] -> 0 | K33: 0 | L33: 0 | M33: 0 | N33: =RC[15]+RC[16]+RC[17]+RC[18]+RC[19]+RC[20] -> 0 | O33: 0 | P33: 0 | Q33: 720000 | R33: 0 | S33: 0 | T33: 0 | U33: 7200 | V33: 0 | W33: 712800 | X33: 0 | Y33: 0 | Z33: 0 | AA33: 0 | AB33: 0 | AC33: 0 | AD33: 0 | AE33: 0 | AF33: 0 | AG33: 0 | AH33: 0 | AI33: 720000 | AJ33: 0 | AK33: 0 | AL33: 0 | AM33: 0 | AN33: 0 | AO33: 0 | AP33: 0 | AQ33: 0 | AR33: =1 -> 1 | AS33: 0 | AT33: 0 | AU33: =RC[-30]-RC[-29]-RC[-28]-RC[-27]-RC[-26]-RC[-25] -> 712800 | AV33: 0 | AW33: =RC[1]-RC[2] -> 0 | AX33: 0 | AY33: 0 | AZ33: =RC[-46] -> 720000 | BA33: =RC[-46] -> 0 | BB33: =RC[-46] -> 0 | BC33: =RC[-46] -> 0 | BD33: =RC[-46] -> 0 | BE33: =RC[-46] -> 0 | BF33: =RC[-46] -> 0 | BG33: =RC[-46] -> 0 | BH33: =RC[-46] -> 0 | BI33: =RC[-46] -> 0 | BJ33: =RC[-46] -> 0 | BK33: =RC[-46] -> 720000 | BL33: =RC[-46] -> 0 | BM33: =RC[-46] -> 0 | BN33: =RC[-46] -> 0 | BO33: =RC[-46] -> 7200 | BP33: =RC[-46] -> 0 | BQ33: =RC[-46] -> 712800 | BR33: =RC[-46] -> 0 | BS33: =RC[-46] -> 0 | BT33: =RC[-46] -> 0 | BU33: =RC[-46] -> 0 | BV33: =RC[-46] -> 0 | BW33: =RC[-46] -> 0 | BX33: =RC[-46] -> 0 | BY33: =RC[-46] -> 0 | BZ33: =RC[-46] -> 0 | CA33: =RC[-46] -> 0 | CB33: =RC[-46] -> 0 | CC33: =RC[-46] -> 720000 | CD33: =RC[-46] -> 0 | CE33: =RC[-46] -> 0 | CF33: =RC[-46] -> 0 | CG33: =RC[-46] -> 0 | CH33: =RC[-46] -> 0 | CI33: =RC[-46] -> 0 | CJ33: =RC[-46] -> 0 | CK33: =RC[-46] -> 0 | CL33: =RC[-46] -> 1 | CM33: =RC[-46] -> 0 | CN33: =RC[-46] -> 0 | CO33: =RC[-46] -> 712800 | CP33: =RC[-46] -> 0 | CQ33: =RC[-46] -> 0 | CR33: =RC[-46] -> 0 | CS33: =RC[-46] -> 0
A34: 11 | B34: 013379 | C34: Nguyễn Thùy Linh | D34: Nhân viên phục vụ hành khách hàng hóa | E34: 19021868567013 | F34: =RC[29]+RC[30]+RC[31]+RC[32]+RC[33]+RC[34]+RC[35]+RC[36]+RC[37] -> 720000 | G34: =RC[17]+RC[18]++RC[19]+RC[20]+RC[21]+RC[38]+RC[39]+RC[41] -> 0 | H34: 0 | I34: 0 | J34: =RC[-2]+RC[-1] -> 0 | K34: 0 | L34: 0 | M34: 0 | N34: =RC[15]+RC[16]+RC[17]+RC[18]+RC[19]+RC[20] -> 0 | O34: 0 | P34: 0 | Q34: 720000 | R34: 0 | S34: 0 | T34: 0 | U34: 7200 | V34: 0 | W34: 712800 | X34: 0 | Y34: 0 | Z34: 0 | AA34: 0 | AB34: 0 | AC34: 0 | AD34: 0 | AE34: 0 | AF34: 0 | AG34: 0 | AH34: 0 | AI34: 720000 | AJ34: 0 | AK34: 0 | AL34: 0 | AM34: 0 | AN34: 0 | AO34: 0 | AP34: 0 | AQ34: 0 | AR34: =1 -> 1 | AS34: 0 | AT34: 0 | AU34: =RC[-30]-RC[-29]-RC[-28]-RC[-27]-RC[-26]-RC[-25] -> 712800 | AV34: 0 | AW34: =RC[1]-RC[2] -> 0 | AX34: 0 | AY34: 0 | AZ34: =RC[-46] -> 720000 | BA34: =RC[-46] -> 0 | BB34: =RC[-46] -> 0 | BC34: =RC[-46] -> 0 | BD34: =RC[-46] -> 0 | BE34: =RC[-46] -> 0 | BF34: =RC[-46] -> 0 | BG34: =RC[-46] -> 0 | BH34: =RC[-46] -> 0 | BI34: =RC[-46] -> 0 | BJ34: =RC[-46] -> 0 | BK34: =RC[-46] -> 720000 | BL34: =RC[-46] -> 0 | BM34: =RC[-46] -> 0 | BN34: =RC[-46] -> 0 | BO34: =RC[-46] -> 7200 | BP34: =RC[-46] -> 0 | BQ34: =RC[-46] -> 712800 | BR34: =RC[-46] -> 0 | BS34: =RC[-46] -> 0 | BT34: =RC[-46] -> 0 | BU34: =RC[-46] -> 0 | BV34: =RC[-46] -> 0 | BW34: =RC[-46] -> 0 | BX34: =RC[-46] -> 0 | BY34: =RC[-46] -> 0 | BZ34: =RC[-46] -> 0 | CA34: =RC[-46] -> 0 | CB34: =RC[-46] -> 0 | CC34: =RC[-46] -> 720000 | CD34: =RC[-46] -> 0 | CE34: =RC[-46] -> 0 | CF34: =RC[-46] -> 0 | CG34: =RC[-46] -> 0 | CH34: =RC[-46] -> 0 | CI34: =RC[-46] -> 0 | CJ34: =RC[-46] -> 0 | CK34: =RC[-46] -> 0 | CL34: =RC[-46] -> 1 | CM34: =RC[-46] -> 0 | CN34: =RC[-46] -> 0 | CO34: =RC[-46] -> 712800 | CP34: =RC[-46] -> 0 | CQ34: =RC[-46] -> 0 | CR34: =RC[-46] -> 0 | CS34: =RC[-46] -> 0
A35: 12 | B35: 013380 | C35: Nguyễn Thị Yến Hương | D35: Nhân viên phục vụ hành khách hàng hóa | E35: 19028960284014 | F35: =RC[29]+RC[30]+RC[31]+RC[32]+RC[33]+RC[34]+RC[35]+RC[36]+RC[37] -> 720000 | G35: =RC[17]+RC[18]++RC[19]+RC[20]+RC[21]+RC[38]+RC[39]+RC[41] -> 0 | H35: 0 | I35: 0 | J35: =RC[-2]+RC[-1] -> 0 | K35: 0 | L35: 0 | M35: 0 | N35: =RC[15]+RC[16]+RC[17]+RC[18]+RC[19]+RC[20] -> 0 | O35: 0 | P35: 0 | Q35: 720000 | R35: 0 | S35: 0 | T35: 0 | U35: 7200 | V35: 0 | W35: 712800 | X35: 0 | Y35: 0 | Z35: 0 | AA35: 0 | AB35: 0 | AC35: 0 | AD35: 0 | AE35: 0 | AF35: 0 | AG35: 0 | AH35: 0 | AI35: 720000 | AJ35: 0 | AK35: 0 | AL35: 0 | AM35: 0 | AN35: 0 | AO35: 0 | AP35: 0 | AQ35: 0 | AR35: =1 -> 1 | AS35: 0 | AT35: 0 | AU35: =RC[-30]-RC[-29]-RC[-28]-RC[-27]-RC[-26]-RC[-25] -> 712800 | AV35: 0 | AW35: =RC[1]-RC[2] -> 0 | AX35: 0 | AY35: 0 | AZ35: =RC[-46] -> 720000 | BA35: =RC[-46] -> 0 | BB35: =RC[-46] -> 0 | BC35: =RC[-46] -> 0 | BD35: =RC[-46] -> 0 | BE35: =RC[-46] -> 0 | BF35: =RC[-46] -> 0 | BG35: =RC[-46] -> 0 | BH35: =RC[-46] -> 0 | BI35: =RC[-46] -> 0 | BJ35: =RC[-46] -> 0 | BK35: =RC[-46] -> 720000 | BL35: =RC[-46] -> 0 | BM35: =RC[-46] -> 0 | BN35: =RC[-46] -> 0 | BO35: =RC[-46] -> 7200 | BP35: =RC[-46] -> 0 | BQ35: =RC[-46] -> 712800 | BR35: =RC[-46] -> 0 | BS35: =RC[-46] -> 0 | BT35: =RC[-46] -> 0 | BU35: =RC[-46] -> 0 | BV35: =RC[-46] -> 0 | BW35: =RC[-46] -> 0 | BX35: =RC[-46] -> 0 | BY35: =RC[-46] -> 0 | BZ35: =RC[-46] -> 0 | CA35: =RC[-46] -> 0 | CB35: =RC[-46] -> 0 | CC35: =RC[-46] -> 720000 | CD35: =RC[-46] -> 0 | CE35: =RC[-46] -> 0 | CF35: =RC[-46] -> 0 | CG35: =RC[-46] -> 0 | CH35: =RC[-46] -> 0 | CI35: =RC[-46] -> 0 | CJ35: =RC[-46] -> 0 | CK35: =RC[-46] -> 0 | CL35: =RC[-46] -> 1 | CM35: =RC[-46] -> 0 | CN35: =RC[-46] -> 0 | CO35: =RC[-46] -> 712800 | CP35: =RC[-46] -> 0 | CQ35: =RC[-46] -> 0 | CR35: =RC[-46] -> 0 | CS35: =RC[-46] -> 0
A36: 13 | B36: 013381 | C36: Phạm Thị Thanh Tú | D36: Nhân viên phục vụ hành khách hàng hóa | E36: 19028960155011 | F36: =RC[29]+RC[30]+RC[31]+RC[32]+RC[33]+RC[34]+RC[35]+RC[36]+RC[37] -> 720000 | G36: =RC[17]+RC[18]++RC[19]+RC[20]+RC[21]+RC[38]+RC[39]+RC[41] -> 0 | H36: 0 | I36: 0 | J36: =RC[-2]+RC[-1] -> 0 | K36: 0 | L36: 0 | M36: 0 | N36: =RC[15]+RC[16]+RC[17]+RC[18]+RC[19]+RC[20] -> 0 | O36: 0 | P36: 0 | Q36: 720000 | R36: 0 | S36: 0 | T36: 0 | U36: 7200 | V36: 0 | W36: 712800 | X36: 0 | Y36: 0 | Z36: 0 | AA36: 0 | AB36: 0 | AC36: 0 | AD36: 0 | AE36: 0 | AF36: 0 | AG36: 0 | AH36: 0 | AI36: 720000 | AJ36: 0 | AK36: 0 | AL36: 0 | AM36: 0 | AN36: 0 | AO36: 0 | AP36: 0 | AQ36: 0 | AR36: =1 -> 1 | AS36: 0 | AT36: 0 | AU36: =RC[-30]-RC[-29]-RC[-28]-RC[-27]-RC[-26]-RC[-25] -> 712800 | AV36: 0 | AW36: =RC[1]-RC[2] -> 0 | AX36: 0 | AY36: 0 | AZ36: =RC[-46] -> 720000 | BA36: =RC[-46] -> 0 | BB36: =RC[-46] -> 0 | BC36: =RC[-46] -> 0 | BD36: =RC[-46] -> 0 | BE36: =RC[-46] -> 0 | BF36: =RC[-46] -> 0 | BG36: =RC[-46] -> 0 | BH36: =RC[-46] -> 0 | BI36: =RC[-46] -> 0 | BJ36: =RC[-46] -> 0 | BK36: =RC[-46] -> 720000 | BL36: =RC[-46] -> 0 | BM36: =RC[-46] -> 0 | BN36: =RC[-46] -> 0 | BO36: =RC[-46] -> 7200 | BP36: =RC[-46] -> 0 | BQ36: =RC[-46] -> 712800 | BR36: =RC[-46] -> 0 | BS36: =RC[-46] -> 0 | BT36: =RC[-46] -> 0 | BU36: =RC[-46] -> 0 | BV36: =RC[-46] -> 0 | BW36: =RC[-46] -> 0 | BX36: =RC[-46] -> 0 | BY36: =RC[-46] -> 0 | BZ36: =RC[-46] -> 0 | CA36: =RC[-46] -> 0 | CB36: =RC[-46] -> 0 | CC36: =RC[-46] -> 720000 | CD36: =RC[-46] -> 0 | CE36: =RC[-46] -> 0 | CF36: =RC[-46] -> 0 | CG36: =RC[-46] -> 0 | CH36: =RC[-46] -> 0 | CI36: =RC[-46] -> 0 | CJ36: =RC[-46] -> 0 | CK36: =RC[-46] -> 0 | CL36: =RC[-46] -> 1 | CM36: =RC[-46] -> 0 | CN36: =RC[-46] -> 0 | CO36: =RC[-46] -> 712800 | CP36: =RC[-46] -> 0 | CQ36: =RC[-46] -> 0 | CR36: =RC[-46] -> 0 | CS36: =RC[-46] -> 0
A37: 14 | B37: 013382 | C37: Nguyễn Thị Bích Thảo | D37: Nhân viên phục vụ hành khách hàng hóa | E37: 19028960225018 | F37: =RC[29]+RC[30]+RC[31]+RC[32]+RC[33]+RC[34]+RC[35]+RC[36]+RC[37] -> 720000 | G37: =RC[17]+RC[18]++RC[19]+RC[20]+RC[21]+RC[38]+RC[39]+RC[41] -> 0 | H37: 0 | I37: 0 | J37: =RC[-2]+RC[-1] -> 0 | K37: 0 | L37: 0 | M37: 0 | N37: =RC[15]+RC[16]+RC[17]+RC[18]+RC[19]+RC[20] -> 0 | O37: 0 | P37: 0 | Q37: 720000 | R37: 0 | S37: 0 | T37: 0 | U37: 7200 | V37: 0 | W37: 712800 | X37: 0 | Y37: 0 | Z37: 0 | AA37: 0 | AB37: 0 | AC37: 0 | AD37: 0 | AE37: 0 | AF37: 0 | AG37: 0 | AH37: 0 | AI37: 720000 | AJ37: 0 | AK37: 0 | AL37: 0 | AM37: 0 | AN37: 0 | AO37: 0 | AP37: 0 | AQ37: 0 | AR37: =1 -> 1 | AS37: 0 | AT37: 0 | AU37: =RC[-30]-RC[-29]-RC[-28]-RC[-27]-RC[-26]-RC[-25] -> 712800 | AV37: 0 | AW37: =RC[1]-RC[2] -> 0 | AX37: 0 | AY37: 0 | AZ37: =RC[-46] -> 720000 | BA37: =RC[-46] -> 0 | BB37: =RC[-46] -> 0 | BC37: =RC[-46] -> 0 | BD37: =RC[-46] -> 0 | BE37: =RC[-46] -> 0 | BF37: =RC[-46] -> 0 | BG37: =RC[-46] -> 0 | BH37: =RC[-46] -> 0 | BI37: =RC[-46] -> 0 | BJ37: =RC[-46] -> 0 | BK37: =RC[-46] -> 720000 | BL37: =RC[-46] -> 0 | BM37: =RC[-46] -> 0 | BN37: =RC[-46] -> 0 | BO37: =RC[-46] -> 7200 | BP37: =RC[-46] -> 0 | BQ37: =RC[-46] -> 712800 | BR37: =RC[-46] -> 0 | BS37: =RC[-46] -> 0 | BT37: =RC[-46] -> 0 | BU37: =RC[-46] -> 0 | BV37: =RC[-46] -> 0 | BW37: =RC[-46] -> 0 | BX37: =RC[-46] -> 0 | BY37: =RC[-46] -> 0 | BZ37: =RC[-46] -> 0 | CA37: =RC[-46] -> 0 | CB37: =RC[-46] -> 0 | CC37: =RC[-46] -> 720000 | CD37: =RC[-46] -> 0 | CE37: =RC[-46] -> 0 | CF37: =RC[-46] -> 0 | CG37: =RC[-46] -> 0 | CH37: =RC[-46] -> 0 | CI37: =RC[-46] -> 0 | CJ37: =RC[-46] -> 0 | CK37: =RC[-46] -> 0 | CL37: =RC[-46] -> 1 | CM37: =RC[-46] -> 0 | CN37: =RC[-46] -> 0 | CO37: =RC[-46] -> 712800 | CP37: =RC[-46] -> 0 | CQ37: =RC[-46] -> 0 | CR37: =RC[-46] -> 0 | CS37: =RC[-46] -> 0
A38: 15 | B38: 013405 | C38: Nguyễn Thị Thúy Hằng | D38: Nhân viên phục vụ hành khách hàng hóa | E38: 19028178495022 | F38: =RC[29]+RC[30]+RC[31]+RC[32]+RC[33]+RC[34]+RC[35]+RC[36]+RC[37] -> 720000 | G38: =RC[17]+RC[18]++RC[19]+RC[20]+RC[21]+RC[38]+RC[39]+RC[41] -> 0 | H38: 0 | I38: 0 | J38: =RC[-2]+RC[-1] -> 0 | K38: 0 | L38: 0 | M38: 0 | N38: =RC[15]+RC[16]+RC[17]+RC[18]+RC[19]+RC[20] -> 0 | O38: 0 | P38: 0 | Q38: 720000 | R38: 0 | S38: 0 | T38: 0 | U38: 7200 | V38: 0 | W38: 712800 | X38: 0 | Y38: 0 | Z38: 0 | AA38: 0 | AB38: 0 | AC38: 0 | AD38: 0 | AE38: 0 | AF38: 0 | AG38: 0 | AH38: 0 | AI38: 720000 | AJ38: 0 | AK38: 0 | AL38: 0 | AM38: 0 | AN38: 0 | AO38: 0 | AP38: 0 | AQ38: 0 | AR38: =1 -> 1 | AS38: 0 | AT38: 0 | AU38: =RC[-30]-RC[-29]-RC[-28]-RC[-27]-RC[-26]-RC[-25] -> 712800 | AV38: 0 | AW38: =RC[1]-RC[2] -> 0 | AX38: 0 | AY38: 0 | AZ38: =RC[-46] -> 720000 | BA38: =RC[-46] -> 0 | BB38: =RC[-46] -> 0 | BC38: =RC[-46] -> 0 | BD38: =RC[-46] -> 0 | BE38: =RC[-46] -> 0 | BF38: =RC[-46] -> 0 | BG38: =RC[-46] -> 0 | BH38: =RC[-46] -> 0 | BI38: =RC[-46] -> 0 | BJ38: =RC[-46] -> 0 | BK38: =RC[-46] -> 720000 | BL38: =RC[-46] -> 0 | BM38: =RC[-46] -> 0 | BN38: =RC[-46] -> 0 | BO38: =RC[-46] -> 7200 | BP38: =RC[-46] -> 0 | BQ38: =RC[-46] -> 712800 | BR38: =RC[-46] -> 0 | BS38: =RC[-46] -> 0 | BT38: =RC[-46] -> 0 | BU38: =RC[-46] -> 0 | BV38: =RC[-46] -> 0 | BW38: =RC[-46] -> 0 | BX38: =RC[-46] -> 0 | BY38: =RC[-46] -> 0 | BZ38: =RC[-46] -> 0 | CA38: =RC[-46] -> 0 | CB38: =RC[-46] -> 0 | CC38: =RC[-46] -> 720000 | CD38: =RC[-46] -> 0 | CE38: =RC[-46] -> 0 | CF38: =RC[-46] -> 0 | CG38: =RC[-46] -> 0 | CH38: =RC[-46] -> 0 | CI38: =RC[-46] -> 0 | CJ38: =RC[-46] -> 0 | CK38: =RC[-46] -> 0 | CL38: =RC[-46] -> 1 | CM38: =RC[-46] -> 0 | CN38: =RC[-46] -> 0 | CO38: =RC[-46] -> 712800 | CP38: =RC[-46] -> 0 | CQ38: =RC[-46] -> 0 | CR38: =RC[-46] -> 0 | CS38: =RC[-46] -> 0
A39: 16 | B39: 013532 | C39: Nguyễn Tuấn Cường | D39: NV PVHK | E39: 19028960219018 | F39: =RC[29]+RC[30]+RC[31]+RC[32]+RC[33]+RC[34]+RC[35]+RC[36]+RC[37] -> 720000 | G39: =RC[17]+RC[18]++RC[19]+RC[20]+RC[21]+RC[38]+RC[39]+RC[41] -> 0 | H39: 0 | I39: 0 | J39: =RC[-2]+RC[-1] -> 0 | K39: 0 | L39: 0 | M39: 0 | N39: =RC[15]+RC[16]+RC[17]+RC[18]+RC[19]+RC[20] -> 0 | O39: 0 | P39: 0 | Q39: 720000 | R39: 0 | S39: 0 | T39: 0 | U39: 7200 | V39: 0 | W39: 712800 | X39: 0 | Y39: 0 | Z39: 0 | AA39: 0 | AB39: 0 | AC39: 0 | AD39: 0 | AE39: 0 | AF39: 0 | AG39: 0 | AH39: 0 | AI39: 720000 | AJ39: 0 | AK39: 0 | AL39: 0 | AM39: 0 | AN39: 0 | AO39: 0 | AP39: 0 | AQ39: 0 | AR39: =1 -> 1 | AS39: 0 | AT39: 0 | AU39: =RC[-30]-RC[-29]-RC[-28]-RC[-27]-RC[-26]-RC[-25] -> 712800 | AV39: 0 | AW39: =RC[1]-RC[2] -> 0 | AX39: 0 | AY39: 0 | AZ39: =RC[-46] -> 720000 | BA39: =RC[-46] -> 0 | BB39: =RC[-46] -> 0 | BC39: =RC[-46] -> 0 | BD39: =RC[-46] -> 0 | BE39: =RC[-46] -> 0 | BF39: =RC[-46] -> 0 | BG39: =RC[-46] -> 0 | BH39: =RC[-46] -> 0 | BI39: =RC[-46] -> 0 | BJ39: =RC[-46] -> 0 | BK39: =RC[-46] -> 720000 | BL39: =RC[-46] -> 0 | BM39: =RC[-46] -> 0 | BN39: =RC[-46] -> 0 | BO39: =RC[-46] -> 7200 | BP39: =RC[-46] -> 0 | BQ39: =RC[-46] -> 712800 | BR39: =RC[-46] -> 0 | BS39: =RC[-46] -> 0 | BT39: =RC[-46] -> 0 | BU39: =RC[-46] -> 0 | BV39: =RC[-46] -> 0 | BW39: =RC[-46] -> 0 | BX39: =RC[-46] -> 0 | BY39: =RC[-46] -> 0 | BZ39: =RC[-46] -> 0 | CA39: =RC[-46] -> 0 | CB39: =RC[-46] -> 0 | CC39: =RC[-46] -> 720000 | CD39: =RC[-46] -> 0 | CE39: =RC[-46] -> 0 | CF39: =RC[-46] -> 0 | CG39: =RC[-46] -> 0 | CH39: =RC[-46] -> 0 | CI39: =RC[-46] -> 0 | CJ39: =RC[-46] -> 0 | CK39: =RC[-46] -> 0 | CL39: =RC[-46] -> 1 | CM39: =RC[-46] -> 0 | CN39: =RC[-46] -> 0 | CO39: =RC[-46] -> 712800 | CP39: =RC[-46] -> 0 | CQ39: =RC[-46] -> 0 | CR39: =RC[-46] -> 0 | CS39: =RC[-46] -> 0
F40: =SUM(R[-16]C:R[-1]C) -> 11520000 | G40: =SUM(R[-16]C:R[-1]C) -> 0 | H40: =SUM(R[-16]C:R[-1]C) -> 0 | I40: =SUM(R[-16]C:R[-1]C) -> 0 | J40: =SUM(R[-16]C:R[-1]C) -> 0 | K40: =SUM(R[-16]C:R[-1]C) -> 0 | L40: =SUM(R[-16]C:R[-1]C) -> 0 | M40: =SUM(R[-16]C:R[-1]C) -> 0 | N40: =SUM(R[-16]C:R[-1]C) -> 0 | O40: =SUM(R[-16]C:R[-1]C) -> 0 | P40: =SUM(R[-16]C:R[-1]C) -> 0 | Q40: =SUM(R[-16]C:R[-1]C) -> 11520000 | R40: =SUM(R[-16]C:R[-1]C) -> 0 | S40: =SUM(R[-16]C:R[-1]C) -> 0 | T40: =SUM(R[-16]C:R[-1]C) -> 0 | U40: =SUM(R[-16]C:R[-1]C) -> 115200 | V40: =SUM(R[-16]C:R[-1]C) -> 0 | W40: =SUM(R[-16]C:R[-1]C) -> 11404800 | X40: =SUM(R[-16]C:R[-1]C) -> 0 | Y40: =SUM(R[-16]C:R[-1]C) -> 0 | Z40: =SUM(R[-16]C:R[-1]C) -> 0 | AA40: =SUM(R[-16]C:R[-1]C) -> 0 | AB40: =SUM(R[-16]C:R[-1]C) -> 0 | AC40: =SUM(R[-16]C:R[-1]C) -> 0 | AD40: =SUM(R[-16]C:R[-1]C) -> 0 | AE40: =SUM(R[-16]C:R[-1]C) -> 0 | AF40: =SUM(R[-16]C:R[-1]C) -> 0 | AG40: =SUM(R[-16]C:R[-1]C) -> 0 | AH40: =SUM(R[-16]C:R[-1]C) -> 0 | AI40: =SUM(R[-16]C:R[-1]C) -> 11520000 | AJ40: =SUM(R[-16]C:R[-1]C) -> 0 | AK40: =SUM(R[-16]C:R[-1]C) -> 0 | AL40: =SUM(R[-16]C:R[-1]C) -> 0 | AM40: =SUM(R[-16]C:R[-1]C) -> 0 | AN40: =SUM(R[-16]C:R[-1]C) -> 0 | AO40: =SUM(R[-16]C:R[-1]C) -> 0 | AP40: =SUM(R[-16]C:R[-1]C) -> 0 | AQ40: =SUM(R[-16]C:R[-1]C) -> 0 | AR40: =SUM(R[-16]C:R[-1]C) -> 16 | AS40: =SUM(R[-16]C:R[-1]C) -> 0 | AT40: =SUM(R[-16]C:R[-1]C) -> 0 | AU40: =SUM(R[-16]C:R[-1]C) -> 11404800 | AV40: =SUM(R[-16]C:R[-1]C) -> 0 | AW40: =SUM(R[-16]C:R[-1]C) -> 0 | AX40: =SUM(R[-16]C:R[-1]C) -> 0 | AY40: =SUM(R[-16]C:R[-1]C) -> 0
A41: Đội phục vụ hành khách đi (HGS) | F41: =R[4]C -> 2160000 | G41: =R[4]C -> 0 | H41: =R[4]C -> 0 | I41: =R[4]C -> 0 | J41: =R[4]C -> 0 | K41: =R[4]C -> 0 | L41: =R[4]C -> 0 | M41: =R[4]C -> 0 | N41: =R[4]C -> 0 | O41: =R[4]C -> 0 | P41: =R[4]C -> 0 | Q41: =R[4]C -> 2160000 | R41: =R[4]C -> 0 | S41: =R[4]C -> 0 | T41: =R[4]C -> 0 | U41: =R[4]C -> 21600 | V41: =R[4]C -> 0 | W41: =R[4]C -> 2138400 | X41: =R[4]C -> 0 | Y41: =R[4]C -> 0 | Z41: =R[4]C -> 0 | AA41: =R[4]C -> 0 | AB41: =R[4]C -> 0 | AC41: =R[4]C -> 0 | AD41: =R[4]C -> 0 | AE41: =R[4]C -> 0 | AF41: =R[4]C -> 0 | AG41: =R[4]C -> 0 | AH41: =R[4]C -> 0 | AI41: =R[4]C -> 2160000 | AJ41: =R[4]C -> 0 | AK41: =R[4]C -> 0 | AL41: =R[4]C -> 0 | AM41: =R[4]C -> 0 | AN41: =R[4]C -> 0 | AO41: =R[4]C -> 0 | AP41: =R[4]C -> 0 | AQ41: =R[4]C -> 0 | AR41: =R[4]C -> 3 | AS41: =R[4]C -> 0 | AT41: =R[4]C -> 0 | AU41: =R[4]C -> 2138400 | AW41: =R[4]C -> 0 | AX41: =R[4]C -> 0 | AY41: =R[4]C -> 0
A42: 1 | B42: 013096 | C42: Đinh Văn Long | D42: NV PVHK | E42: 19028834682012 | F42: =RC[29]+RC[30]+RC[31]+RC[32]+RC[33]+RC[34]+RC[35]+RC[36]+RC[37] -> 720000 | G42: =RC[17]+RC[18]++RC[19]+RC[20]+RC[21]+RC[38]+RC[39]+RC[41] -> 0 | H42: 0 | I42: 0 | J42: =RC[-2]+RC[-1] -> 0 | K42: 0 | L42: 0 | M42: 0 | N42: =RC[15]+RC[16]+RC[17]+RC[18]+RC[19]+RC[20] -> 0 | O42: 0 | P42: 0 | Q42: 720000 | R42: 0 | S42: 0 | T42: 0 | U42: 7200 | V42: 0 | W42: 712800 | X42: 0 | Y42: 0 | Z42: 0 | AA42: 0 | AB42: 0 | AC42: 0 | AD42: 0 | AE42: 0 | AF42: 0 | AG42: 0 | AH42: 0 | AI42: 720000 | AJ42: 0 | AK42: 0 | AL42: 0 | AM42: 0 | AN42: 0 | AO42: 0 | AP42: 0 | AQ42: 0 | AR42: =1 -> 1 | AS42: 0 | AT42: 0 | AU42: =RC[-30]-RC[-29]-RC[-28]-RC[-27]-RC[-26]-RC[-25] -> 712800 | AV42: 0 | AW42: =RC[1]-RC[2] -> 0 | AX42: 0 | AY42: 0 | AZ42: =RC[-46] -> 720000 | BA42: =RC[-46] -> 0 | BB42: =RC[-46] -> 0 | BC42: =RC[-46] -> 0 | BD42: =RC[-46] -> 0 | BE42: =RC[-46] -> 0 | BF42: =RC[-46] -> 0 | BG42: =RC[-46] -> 0 | BH42: =RC[-46] -> 0 | BI42: =RC[-46] -> 0 | BJ42: =RC[-46] -> 0 | BK42: =RC[-46] -> 720000 | BL42: =RC[-46] -> 0 | BM42: =RC[-46] -> 0 | BN42: =RC[-46] -> 0 | BO42: =RC[-46] -> 7200 | BP42: =RC[-46] -> 0 | BQ42: =RC[-46] -> 712800 | BR42: =RC[-46] -> 0 | BS42: =RC[-46] -> 0 | BT42: =RC[-46] -> 0 | BU42: =RC[-46] -> 0 | BV42: =RC[-46] -> 0 | BW42: =RC[-46] -> 0 | BX42: =RC[-46] -> 0 | BY42: =RC[-46] -> 0 | BZ42: =RC[-46] -> 0 | CA42: =RC[-46] -> 0 | CB42: =RC[-46] -> 0 | CC42: =RC[-46] -> 720000 | CD42: =RC[-46] -> 0 | CE42: =RC[-46] -> 0 | CF42: =RC[-46] -> 0 | CG42: =RC[-46] -> 0 | CH42: =RC[-46] -> 0 | CI42: =RC[-46] -> 0 | CJ42: =RC[-46] -> 0 | CK42: =RC[-46] -> 0 | CL42: =RC[-46] -> 1 | CM42: =RC[-46] -> 0 | CN42: =RC[-46] -> 0 | CO42: =RC[-46] -> 712800 | CP42: =RC[-46] -> 0 | CQ42: =RC[-46] -> 0 | CR42: =RC[-46] -> 0 | CS42: =RC[-46] -> 0
A43: 2 | B43: 013097 | C43: Nguyễn Thu Quỳnh | D43: NV PVHK | E43: 19028834686018 | F43: =RC[29]+RC[30]+RC[31]+RC[32]+RC[33]+RC[34]+RC[35]+RC[36]+RC[37] -> 720000 | G43: =RC[17]+RC[18]++RC[19]+RC[20]+RC[21]+RC[38]+RC[39]+RC[41] -> 0 | H43: 0 | I43: 0 | J43: =RC[-2]+RC[-1] -> 0 | K43: 0 | L43: 0 | M43: 0 | N43: =RC[15]+RC[16]+RC[17]+RC[18]+RC[19]+RC[20] -> 0 | O43: 0 | P43: 0 | Q43: 720000 | R43: 0 | S43: 0 | T43: 0 | U43: 7200 | V43: 0 | W43: 712800 | X43: 0 | Y43: 0 | Z43: 0 | AA43: 0 | AB43: 0 | AC43: 0 | AD43: 0 | AE43: 0 | AF43: 0 | AG43: 0 | AH43: 0 | AI43: 720000 | AJ43: 0 | AK43: 0 | AL43: 0 | AM43: 0 | AN43: 0 | AO43: 0 | AP43: 0 | AQ43: 0 | AR43: =1 -> 1 | AS43: 0 | AT43: 0 | AU43: =RC[-30]-RC[-29]-RC[-28]-RC[-27]-RC[-26]-RC[-25] -> 712800 | AV43: 0 | AW43: =RC[1]-RC[2] -> 0 | AX43: 0 | AY43: 0 | AZ43: =RC[-46] -> 720000 | BA43: =RC[-46] -> 0 | BB43: =RC[-46] -> 0 | BC43: =RC[-46] -> 0 | BD43: =RC[-46] -> 0 | BE43: =RC[-46] -> 0 | BF43: =RC[-46] -> 0 | BG43: =RC[-46] -> 0 | BH43: =RC[-46] -> 0 | BI43: =RC[-46] -> 0 | BJ43: =RC[-46] -> 0 | BK43: =RC[-46] -> 720000 | BL43: =RC[-46] -> 0 | BM43: =RC[-46] -> 0 | BN43: =RC[-46] -> 0 | BO43: =RC[-46] -> 7200 | BP43: =RC[-46] -> 0 | BQ43: =RC[-46] -> 712800 | BR43: =RC[-46] -> 0 | BS43: =RC[-46] -> 0 | BT43: =RC[-46] -> 0 | BU43: =RC[-46] -> 0 | BV43: =RC[-46] -> 0 | BW43: =RC[-46] -> 0 | BX43: =RC[-46] -> 0 | BY43: =RC[-46] -> 0 | BZ43: =RC[-46] -> 0 | CA43: =RC[-46] -> 0 | CB43: =RC[-46] -> 0 | CC43: =RC[-46] -> 720000 | CD43: =RC[-46] -> 0 | CE43: =RC[-46] -> 0 | CF43: =RC[-46] -> 0 | CG43: =RC[-46] -> 0 | CH43: =RC[-46] -> 0 | CI43: =RC[-46] -> 0 | CJ43: =RC[-46] -> 0 | CK43: =RC[-46] -> 0 | CL43: =RC[-46] -> 1 | CM43: =RC[-46] -> 0 | CN43: =RC[-46] -> 0 | CO43: =RC[-46] -> 712800 | CP43: =RC[-46] -> 0 | CQ43: =RC[-46] -> 0 | CR43: =RC[-46] -> 0 | CS43: =RC[-46] -> 0
A44: 3 | B44: 013101 | C44: Trần Thị Huệ | D44: NV PVHK | E44: 19028834680011 | F44: =RC[29]+RC[30]+RC[31]+RC[32]+RC[33]+RC[34]+RC[35]+RC[36]+RC[37] -> 720000 | G44: =RC[17]+RC[18]++RC[19]+RC[20]+RC[21]+RC[38]+RC[39]+RC[41] -> 0 | H44: 0 | I44: 0 | J44: =RC[-2]+RC[-1] -> 0 | K44: 0 | L44: 0 | M44: 0 | N44: =RC[15]+RC[16]+RC[17]+RC[18]+RC[19]+RC[20] -> 0 | O44: 0 | P44: 0 | Q44: 720000 | R44: 0 | S44: 0 | T44: 0 | U44: 7200 | V44: 0 | W44: 712800 | X44: 0 | Y44: 0 | Z44: 0 | AA44: 0 | AB44: 0 | AC44: 0 | AD44: 0 | AE44: 0 | AF44: 0 | AG44: 0 | AH44: 0 | AI44: 720000 | AJ44: 0 | AK44: 0 | AL44: 0 | AM44: 0 | AN44: 0 | AO44: 0 | AP44: 0 | AQ44: 0 | AR44: =1 -> 1 | AS44: 0 | AT44: 0 | AU44: =RC[-30]-RC[-29]-RC[-28]-RC[-27]-RC[-26]-RC[-25] -> 712800 | AV44: 0 | AW44: =RC[1]-RC[2] -> 0 | AX44: 0 | AY44: 0 | AZ44: =RC[-46] -> 720000 | BA44: =RC[-46] -> 0 | BB44: =RC[-46] -> 0 | BC44: =RC[-46] -> 0 | BD44: =RC[-46] -> 0 | BE44: =RC[-46] -> 0 | BF44: =RC[-46] -> 0 | BG44: =RC[-46] -> 0 | BH44: =RC[-46] -> 0 | BI44: =RC[-46] -> 0 | BJ44: =RC[-46] -> 0 | BK44: =RC[-46] -> 720000 | BL44: =RC[-46] -> 0 | BM44: =RC[-46] -> 0 | BN44: =RC[-46] -> 0 | BO44: =RC[-46] -> 7200 | BP44: =RC[-46] -> 0 | BQ44: =RC[-46] -> 712800 | BR44: =RC[-46] -> 0 | BS44: =RC[-46] -> 0 | BT44: =RC[-46] -> 0 | BU44: =RC[-46] -> 0 | BV44: =RC[-46] -> 0 | BW44: =RC[-46] -> 0 | BX44: =RC[-46] -> 0 | BY44: =RC[-46] -> 0 | BZ44: =RC[-46] -> 0 | CA44: =RC[-46] -> 0 | CB44: =RC[-46] -> 0 | CC44: =RC[-46] -> 720000 | CD44: =RC[-46] -> 0 | CE44: =RC[-46] -> 0 | CF44: =RC[-46] -> 0 | CG44: =RC[-46] -> 0 | CH44: =RC[-46] -> 0 | CI44: =RC[-46] -> 0 | CJ44: =RC[-46] -> 0 | CK44: =RC[-46] -> 0 | CL44: =RC[-46] -> 1 | CM44: =RC[-46] -> 0 | CN44: =RC[-46] -> 0 | CO44: =RC[-46] -> 712800 | CP44: =RC[-46] -> 0 | CQ44: =RC[-46] -> 0 | CR44: =RC[-46] -> 0 | CS44: =RC[-46] -> 0
A45: Đội phục vụ hành khách đi (HGS) | F45: =SUM(R[-3]C:R[-1]C) -> 2160000 | G45: =SUM(R[-3]C:R[-1]C) -> 0 | H45: =SUM(R[-3]C:R[-1]C) -> 0 | I45: =SUM(R[-3]C:R[-1]C) -> 0 | J45: =SUM(R[-3]C:R[-1]C) -> 0 | K45: =SUM(R[-3]C:R[-1]C) -> 0 | L45: =SUM(R[-3]C:R[-1]C) -> 0 | M45: =SUM(R[-3]C:R[-1]C) -> 0 | N45: =SUM(R[-3]C:R[-1]C) -> 0 | O45: =SUM(R[-3]C:R[-1]C) -> 0 | P45: =SUM(R[-3]C:R[-1]C) -> 0 | Q45: =SUM(R[-3]C:R[-1]C) -> 2160000 | R45: =SUM(R[-3]C:R[-1]C) -> 0 | S45: =SUM(R[-3]C:R[-1]C) -> 0 | T45: =SUM(R[-3]C:R[-1]C) -> 0 | U45: =SUM(R[-3]C:R[-1]C) -> 21600 | V45: =SUM(R[-3]C:R[-1]C) -> 0 | W45: =SUM(R[-3]C:R[-1]C) -> 2138400 | X45: =SUM(R[-3]C:R[-1]C) -> 0 | Y45: =SUM(R[-3]C:R[-1]C) -> 0 | Z45: =SUM(R[-3]C:R[-1]C) -> 0 | AA45: =SUM(R[-3]C:R[-1]C) -> 0 | AB45: =SUM(R[-3]C:R[-1]C) -> 0 | AC45: =SUM(R[-3]C:R[-1]C) -> 0 | AD45: =SUM(R[-3]C:R[-1]C) -> 0 | AE45: =SUM(R[-3]C:R[-1]C) -> 0 | AF45: =SUM(R[-3]C:R[-1]C) -> 0 | AG45: =SUM(R[-3]C:R[-1]C) -> 0 | AH45: =SUM(R[-3]C:R[-1]C) -> 0 | AI45: =SUM(R[-3]C:R[-1]C) -> 2160000 | AJ45: =SUM(R[-3]C:R[-1]C) -> 0 | AK45: =SUM(R[-3]C:R[-1]C) -> 0 | AL45: =SUM(R[-3]C:R[-1]C) -> 0 | AM45: =SUM(R[-3]C:R[-1]C) -> 0 | AN45: =SUM(R[-3]C:R[-1]C) -> 0 | AO45: =SUM(R[-3]C:R[-1]C) -> 0 | AP45: =SUM(R[-3]C:R[-1]C) -> 0 | AQ45: =SUM(R[-3]C:R[-1]C) -> 0 | AR45: =SUM(R[-3]C:R[-1]C) -> 3 | AS45: =SUM(R[-3]C:R[-1]C) -> 0 | AT45: =SUM(R[-3]C:R[-1]C) -> 0 | AU45: =SUM(R[-3]C:R[-1]C) -> 2138400 | AV45: =SUM(R[-3]C:R[-1]C) -> 0 | AW45: =SUM(R[-3]C:R[-1]C) -> 0 | AX45: =SUM(R[-3]C:R[-1]C) -> 0 | AY45: =SUM(R[-3]C:R[-1]C) -> 0
A46: Phòng Phục vụ hành khách (HGS) | F46: =SUM(R[-23]C[46]:R[-1]C[46]) -> 13680000 | G46: =SUM(R[-23]C[46]:R[-1]C[46]) -> 0 | H46: =SUM(R[-23]C[46]:R[-1]C[46]) -> 0 | I46: =SUM(R[-23]C[46]:R[-1]C[46]) -> 0 | J46: =SUM(R[-23]C[46]:R[-1]C[46]) -> 0 | K46: =SUM(R[-23]C[46]:R[-1]C[46]) -> 0 | L46: =SUM(R[-23]C[46]:R[-1]C[46]) -> 0 | M46: =SUM(R[-23]C[46]:R[-1]C[46]) -> 0 | N46: =SUM(R[-23]C[46]:R[-1]C[46]) -> 0 | O46: =SUM(R[-23]C[46]:R[-1]C[46]) -> 0 | P46: =SUM(R[-23]C[46]:R[-1]C[46]) -> 0 | Q46: =SUM(R[-23]C[46]:R[-1]C[46]) -> 13680000 | R46: =SUM(R[-23]C[46]:R[-1]C[46]) -> 0 | S46: =SUM(R[-23]C[46]:R[-1]C[46]) -> 0 | T46: =SUM(R[-23]C[46]:R[-1]C[46]) -> 0 | U46: =SUM(R[-23]C[46]:R[-1]C[46]) -> 136800 | V46: =SUM(R[-23]C[46]:R[-1]C[46]) -> 0 | W46: =SUM(R[-23]C[46]:R[-1]C[46]) -> 13543200 | X46: =SUM(R[-23]C[46]:R[-1]C[46]) -> 0 | Y46: =SUM(R[-23]C[46]:R[-1]C[46]) -> 0 | Z46: =SUM(R[-23]C[46]:R[-1]C[46]) -> 0 | AA46: =SUM(R[-23]C[46]:R[-1]C[46]) -> 0 | AB46: =SUM(R[-23]C[46]:R[-1]C[46]) -> 0 | AC46: =SUM(R[-23]C[46]:R[-1]C[46]) -> 0 | AD46: =SUM(R[-23]C[46]:R[-1]C[46]) -> 0 | AE46: =SUM(R[-23]C[46]:R[-1]C[46]) -> 0 | AF46: =SUM(R[-23]C[46]:R[-1]C[46]) -> 0 | AG46: =SUM(R[-23]C[46]:R[-1]C[46]) -> 0 | AH46: =SUM(R[-23]C[46]:R[-1]C[46]) -> 0 | AI46: =SUM(R[-23]C[46]:R[-1]C[46]) -> 13680000 | AJ46: =SUM(R[-23]C[46]:R[-1]C[46]) -> 0 | AK46: =SUM(R[-23]C[46]:R[-1]C[46]) -> 0 | AL46: =SUM(R[-23]C[46]:R[-1]C[46]) -> 0 | AM46: =SUM(R[-23]C[46]:R[-1]C[46]) -> 0 | AN46: =SUM(R[-23]C[46]:R[-1]C[46]) -> 0 | AO46: =SUM(R[-23]C[46]:R[-1]C[46]) -> 0 | AP46: =SUM(R[-23]C[46]:R[-1]C[46]) -> 0 | AQ46: =SUM(R[-23]C[46]:R[-1]C[46]) -> 0 | AR46: =SUM(R[-23]C[46]:R[-1]C[46]) -> 19 | AS46: =SUM(R[-23]C[46]:R[-1]C[46]) -> 0 | AT46: =SUM(R[-23]C[46]:R[-1]C[46]) -> 0 | AU46: =SUM(R[-23]C[46]:R[-1]C[46]) -> 13543200 | AV46: =SUM(R[-23]C[46]:R[-1]C[46]) -> 0 | AW46: =SUM(R[-23]C[46]:R[-1]C[46]) -> 0 | AX46: =SUM(R[-23]C[46]:R[-1]C[46]) -> 0 | AY46: =SUM(R[-23]C[46]:R[-1]C[46]) -> 0
A47: Phòng Phục vụ kỹ thuật sân đỗ (HGS) | F47: =R[37]C -> 23040000 | G47: =R[37]C -> 0 | H47: =R[37]C -> 0 | I47: =R[37]C -> 0 | J47: =R[37]C -> 0 | K47: =R[37]C -> 0 | L47: =R[37]C -> 0 | M47: =R[37]C -> 0 | N47: =R[37]C -> 0 | O47: =R[37]C -> 0 | P47: =R[37]C -> 0 | Q47: =R[37]C -> 23040000 | R47: =R[37]C -> 0 | S47: =R[37]C -> 0 | T47: =R[37]C -> 0 | U47: =R[37]C -> 230400 | V47: =R[37]C -> 0 | W47: =R[37]C -> 22809600 | X47: =R[37]C -> 0 | Y47: =R[37]C -> 0 | Z47: =R[37]C -> 0 | AA47: =R[37]C -> 0 | AB47: =R[37]C -> 0 | AC47: =R[37]C -> 0 | AD47: =R[37]C -> 0 | AE47: =R[37]C -> 0 | AF47: =R[37]C -> 0 | AG47: =R[37]C -> 0 | AH47: =R[37]C -> 0 | AI47: =R[37]C -> 23040000 | AJ47: =R[37]C -> 0 | AK47: =R[37]C -> 0 | AL47: =R[37]C -> 0 | AM47: =R[37]C -> 0 | AN47: =R[37]C -> 0 | AO47: =R[37]C -> 0 | AP47: =R[37]C -> 0 | AQ47: =R[37]C -> 0 | AR47: =R[37]C -> 32 | AS47: =R[37]C -> 0 | AT47: =R[37]C -> 0 | AU47: =R[37]C -> 22809600 | AW47: =R[37]C -> 0 | AX47: =R[37]C -> 0 | AY47: =R[37]C -> 0
A48: Đội phục vụ hành lý hàng hóa (HGS) | F48: =R[32]C -> 22320000 | G48: =R[32]C -> 0 | H48: =R[32]C -> 0 | I48: =R[32]C -> 0 | J48: =R[32]C -> 0 | K48: =R[32]C -> 0 | L48: =R[32]C -> 0 | M48: =R[32]C -> 0 | N48: =R[32]C -> 0 | O48: =R[32]C -> 0 | P48: =R[32]C -> 0 | Q48: =R[32]C -> 22320000 | R48: =R[32]C -> 0 | S48: =R[32]C -> 0 | T48: =R[32]C -> 0 | U48: =R[32]C -> 223200 | V48: =R[32]C -> 0 | W48: =R[32]C -> 22096800 | X48: =R[32]C -> 0 | Y48: =R[32]C -> 0 | Z48: =R[32]C -> 0 | AA48: =R[32]C -> 0 | AB48: =R[32]C -> 0 | AC48: =R[32]C -> 0 | AD48: =R[32]C -> 0 | AE48: =R[32]C -> 0 | AF48: =R[32]C -> 0 | AG48: =R[32]C -> 0 | AH48: =R[32]C -> 0 | AI48: =R[32]C -> 22320000 | AJ48: =R[32]C -> 0 | AK48: =R[32]C -> 0 | AL48: =R[32]C -> 0 | AM48: =R[32]C -> 0 | AN48: =R[32]C -> 0 | AO48: =R[32]C -> 0 | AP48: =R[32]C -> 0 | AQ48: =R[32]C -> 0 | AR48: =R[32]C -> 31 | AS48: =R[32]C -> 0 | AT48: =R[32]C -> 0 | AU48: =R[32]C -> 22096800 | AW48: =R[32]C -> 0 | AX48: =R[32]C -> 0 | AY48: =R[32]C -> 0
A49: 1 | B49: 013424 | C49: Bùi Tuấn Anh | D49: Nhân viên Bốc xếp | E49: 19028960235013 | F49: =RC[29]+RC[30]+RC[31]+RC[32]+RC[33]+RC[34]+RC[35]+RC[36]+RC[37] -> 720000 | G49: =RC[17]+RC[18]++RC[19]+RC[20]+RC[21]+RC[38]+RC[39]+RC[41] -> 0 | H49: 0 | I49: 0 | J49: =RC[-2]+RC[-1] -> 0 | K49: 0 | L49: 0 | M49: 0 | N49: =RC[15]+RC[16]+RC[17]+RC[18]+RC[19]+RC[20] -> 0 | O49: 0 | P49: 0 | Q49: 720000 | R49: 0 | S49: 0 | T49: 0 | U49: 7200 | V49: 0 | W49: 712800 | X49: 0 | Y49: 0 | Z49: 0 | AA49: 0 | AB49: 0 | AC49: 0 | AD49: 0 | AE49: 0 | AF49: 0 | AG49: 0 | AH49: 0 | AI49: 720000 | AJ49: 0 | AK49: 0 | AL49: 0 | AM49: 0 | AN49: 0 | AO49: 0 | AP49: 0 | AQ49: 0 | AR49: =1 -> 1 | AS49: 0 | AT49: 0 | AU49: =RC[-30]-RC[-29]-RC[-28]-RC[-27]-RC[-26]-RC[-25] -> 712800 | AV49: 0 | AW49: =RC[1]-RC[2] -> 0 | AX49: 0 | AY49: 0 | AZ49: =RC[-46] -> 720000 | BA49: =RC[-46] -> 0 | BB49: =RC[-46] -> 0 | BC49: =RC[-46] -> 0 | BD49: =RC[-46] -> 0 | BE49: =RC[-46] -> 0 | BF49: =RC[-46] -> 0 | BG49: =RC[-46] -> 0 | BH49: =RC[-46] -> 0 | BI49: =RC[-46] -> 0 | BJ49: =RC[-46] -> 0 | BK49: =RC[-46] -> 720000 | BL49: =RC[-46] -> 0 | BM49: =RC[-46] -> 0 | BN49: =RC[-46] -> 0 | BO49: =RC[-46] -> 7200 | BP49: =RC[-46] -> 0 | BQ49: =RC[-46] -> 712800 | BR49: =RC[-46] -> 0 | BS49: =RC[-46] -> 0 | BT49: =RC[-46] -> 0 | BU49: =RC[-46] -> 0 | BV49: =RC[-46] -> 0 | BW49: =RC[-46] -> 0 | BX49: =RC[-46] -> 0 | BY49: =RC[-46] -> 0 | BZ49: =RC[-46] -> 0 | CA49: =RC[-46] -> 0 | CB49: =RC[-46] -> 0 | CC49: =RC[-46] -> 720000 | CD49: =RC[-46] -> 0 | CE49: =RC[-46] -> 0 | CF49: =RC[-46] -> 0 | CG49: =RC[-46] -> 0 | CH49: =RC[-46] -> 0 | CI49: =RC[-46] -> 0 | CJ49: =RC[-46] -> 0 | CK49: =RC[-46] -> 0 | CL49: =RC[-46] -> 1 | CM49: =RC[-46] -> 0 | CN49: =RC[-46] -> 0 | CO49: =RC[-46] -> 712800 | CP49: =RC[-46] -> 0 | CQ49: =RC[-46] -> 0 | CR49: =RC[-46] -> 0 | CS49: =RC[-46] -> 0
A50: 2 | B50: 013425 | C50: Nguyễn Duy Trinh | D50: Nhân viên Bốc xếp | E50: 19020203734011 | F50: =RC[29]+RC[30]+RC[31]+RC[32]+RC[33]+RC[34]+RC[35]+RC[36]+RC[37] -> 720000 | G50: =RC[17]+RC[18]++RC[19]+RC[20]+RC[21]+RC[38]+RC[39]+RC[41] -> 0 | H50: 0 | I50: 0 | J50: =RC[-2]+RC[-1] -> 0 | K50: 0 | L50: 0 | M50: 0 | N50: =RC[15]+RC[16]+RC[17]+RC[18]+RC[19]+RC[20] -> 0 | O50: 0 | P50: 0 | Q50: 720000 | R50: 0 | S50: 0 | T50: 0 | U50: 7200 | V50: 0 | W50: 712800 | X50: 0 | Y50: 0 | Z50: 0 | AA50: 0 | AB50: 0 | AC50: 0 | AD50: 0 | AE50: 0 | AF50: 0 | AG50: 0 | AH50: 0 | AI50: 720000 | AJ50: 0 | AK50: 0 | AL50: 0 | AM50: 0 | AN50: 0 | AO50: 0 | AP50: 0 | AQ50: 0 | AR50: =1 -> 1 | AS50: 0 | AT50: 0 | AU50: =RC[-30]-RC[-29]-RC[-28]-RC[-27]-RC[-26]-RC[-25] -> 712800 | AV50: 0 | AW50: =RC[1]-RC[2] -> 0 | AX50: 0 | AY50: 0 | AZ50: =RC[-46] -> 720000 | BA50: =RC[-46] -> 0 | BB50: =RC[-46] -> 0 | BC50: =RC[-46] -> 0 | BD50: =RC[-46] -> 0 | BE50: =RC[-46] -> 0 | BF50: =RC[-46] -> 0 | BG50: =RC[-46] -> 0 | BH50: =RC[-46] -> 0 | BI50: =RC[-46] -> 0 | BJ50: =RC[-46] -> 0 | BK50: =RC[-46] -> 720000 | BL50: =RC[-46] -> 0 | BM50: =RC[-46] -> 0 | BN50: =RC[-46] -> 0 | BO50: =RC[-46] -> 7200 | BP50: =RC[-46] -> 0 | BQ50: =RC[-46] -> 712800 | BR50: =RC[-46] -> 0 | BS50: =RC[-46] -> 0 | BT50: =RC[-46] -> 0 | BU50: =RC[-46] -> 0 | BV50: =RC[-46] -> 0 | BW50: =RC[-46] -> 0 | BX50: =RC[-46] -> 0 | BY50: =RC[-46] -> 0 | BZ50: =RC[-46] -> 0 | CA50: =RC[-46] -> 0 | CB50: =RC[-46] -> 0 | CC50: =RC[-46] -> 720000 | CD50: =RC[-46] -> 0 | CE50: =RC[-46] -> 0 | CF50: =RC[-46] -> 0 | CG50: =RC[-46] -> 0 | CH50: =RC[-46] -> 0 | CI50: =RC[-46] -> 0 | CJ50: =RC[-46] -> 0 | CK50: =RC[-46] -> 0 | CL50: =RC[-46] -> 1 | CM50: =RC[-46] -> 0 | CN50: =RC[-46] -> 0 | CO50: =RC[-46] -> 712800 | CP50: =RC[-46] -> 0 | CQ50: =RC[-46] -> 0 | CR50: =RC[-46] -> 0 | CS50: =RC[-46] -> 0
A51: 3 | B51: 013436 | C51: Lê Văn Thư | D51: Nhân viên Bốc xếp | E51: 19028960271011 | F51: =RC[29]+RC[30]+RC[31]+RC[32]+RC[33]+RC[34]+RC[35]+RC[36]+RC[37] -> 720000 | G51: =RC[17]+RC[18]++RC[19]+RC[20]+RC[21]+RC[38]+RC[39]+RC[41] -> 0 | H51: 0 | I51: 0 | J51: =RC[-2]+RC[-1] -> 0 | K51: 0 | L51: 0 | M51: 0 | N51: =RC[15]+RC[16]+RC[17]+RC[18]+RC[19]+RC[20] -> 0 | O51: 0 | P51: 0 | Q51: 720000 | R51: 0 | S51: 0 | T51: 0 | U51: 7200 | V51: 0 | W51: 712800 | X51: 0 | Y51: 0 | Z51: 0 | AA51: 0 | AB51: 0 | AC51: 0 | AD51: 0 | AE51: 0 | AF51: 0 | AG51: 0 | AH51: 0 | AI51: 720000 | AJ51: 0 | AK51: 0 | AL51: 0 | AM51: 0 | AN51: 0 | AO51: 0 | AP51: 0 | AQ51: 0 | AR51: =1 -> 1 | AS51: 0 | AT51: 0 | AU51: =RC[-30]-RC[-29]-RC[-28]-RC[-27]-RC[-26]-RC[-25] -> 712800 | AV51: 0 | AW51: =RC[1]-RC[2] -> 0 | AX51: 0 | AY51: 0 | AZ51: =RC[-46] -> 720000 | BA51: =RC[-46] -> 0 | BB51: =RC[-46] -> 0 | BC51: =RC[-46] -> 0 | BD51: =RC[-46] -> 0 | BE51: =RC[-46] -> 0 | BF51: =RC[-46] -> 0 | BG51: =RC[-46] -> 0 | BH51: =RC[-46] -> 0 | BI51: =RC[-46] -> 0 | BJ51: =RC[-46] -> 0 | BK51: =RC[-46] -> 720000 | BL51: =RC[-46] -> 0 | BM51: =RC[-46] -> 0 | BN51: =RC[-46] -> 0 | BO51: =RC[-46] -> 7200 | BP51: =RC[-46] -> 0 | BQ51: =RC[-46] -> 712800 | BR51: =RC[-46] -> 0 | BS51: =RC[-46] -> 0 | BT51: =RC[-46] -> 0 | BU51: =RC[-46] -> 0 | BV51: =RC[-46] -> 0 | BW51: =RC[-46] -> 0 | BX51: =RC[-46] -> 0 | BY51: =RC[-46] -> 0 | BZ51: =RC[-46] -> 0 | CA51: =RC[-46] -> 0 | CB51: =RC[-46] -> 0 | CC51: =RC[-46] -> 720000 | CD51: =RC[-46] -> 0 | CE51: =RC[-46] -> 0 | CF51: =RC[-46] -> 0 | CG51: =RC[-46] -> 0 | CH51: =RC[-46] -> 0 | CI51: =RC[-46] -> 0 | CJ51: =RC[-46] -> 0 | CK51: =RC[-46] -> 0 | CL51: =RC[-46] -> 1 | CM51: =RC[-46] -> 0 | CN51: =RC[-46] -> 0 | CO51: =RC[-46] -> 712800 | CP51: =RC[-46] -> 0 | CQ51: =RC[-46] -> 0 | CR51: =RC[-46] -> 0 | CS51: =RC[-46] -> 0
A52: 4 | B52: 013437 | C52: Phạm Ngọc Huấn | D52: Nhân viên Bốc xếp | E52: 19028960192012 | F52: =RC[29]+RC[30]+RC[31]+RC[32]+RC[33]+RC[34]+RC[35]+RC[36]+RC[37] -> 720000 | G52: =RC[17]+RC[18]++RC[19]+RC[20]+RC[21]+RC[38]+RC[39]+RC[41] -> 0 | H52: 0 | I52: 0 | J52: =RC[-2]+RC[-1] -> 0 | K52: 0 | L52: 0 | M52: 0 | N52: =RC[15]+RC[16]+RC[17]+RC[18]+RC[19]+RC[20] -> 0 | O52: 0 | P52: 0 | Q52: 720000 | R52: 0 | S52: 0 | T52: 0 | U52: 7200 | V52: 0 | W52: 712800 | X52: 0 | Y52: 0 | Z52: 0 | AA52: 0 | AB52: 0 | AC52: 0 | AD52: 0 | AE52: 0 | AF52: 0 | AG52: 0 | AH52: 0 | AI52: 720000 | AJ52: 0 | AK52: 0 | AL52: 0 | AM52: 0 | AN52: 0 | AO52: 0 | AP52: 0 | AQ52: 0 | AR52: =1 -> 1 | AS52: 0 | AT52: 0 | AU52: =RC[-30]-RC[-29]-RC[-28]-RC[-27]-RC[-26]-RC[-25] -> 712800 | AV52: 0 | AW52: =RC[1]-RC[2] -> 0 | AX52: 0 | AY52: 0 | AZ52: =RC[-46] -> 720000 | BA52: =RC[-46] -> 0 | BB52: =RC[-46] -> 0 | BC52: =RC[-46] -> 0 | BD52: =RC[-46] -> 0 | BE52: =RC[-46] -> 0 | BF52: =RC[-46] -> 0 | BG52: =RC[-46] -> 0 | BH52: =RC[-46] -> 0 | BI52: =RC[-46] -> 0 | BJ52: =RC[-46] -> 0 | BK52: =RC[-46] -> 720000 | BL52: =RC[-46] -> 0 | BM52: =RC[-46] -> 0 | BN52: =RC[-46] -> 0 | BO52: =RC[-46] -> 7200 | BP52: =RC[-46] -> 0 | BQ52: =RC[-46] -> 712800 | BR52: =RC[-46] -> 0 | BS52: =RC[-46] -> 0 | BT52: =RC[-46] -> 0 | BU52: =RC[-46] -> 0 | BV52: =RC[-46] -> 0 | BW52: =RC[-46] -> 0 | BX52: =RC[-46] -> 0 | BY52: =RC[-46] -> 0 | BZ52: =RC[-46] -> 0 | CA52: =RC[-46] -> 0 | CB52: =RC[-46] -> 0 | CC52: =RC[-46] -> 720000 | CD52: =RC[-46] -> 0 | CE52: =RC[-46] -> 0 | CF52: =RC[-46] -> 0 | CG52: =RC[-46] -> 0 | CH52: =RC[-46] -> 0 | CI52: =RC[-46] -> 0 | CJ52: =RC[-46] -> 0 | CK52: =RC[-46] -> 0 | CL52: =RC[-46] -> 1 | CM52: =RC[-46] -> 0 | CN52: =RC[-46] -> 0 | CO52: =RC[-46] -> 712800 | CP52: =RC[-46] -> 0 | CQ52: =RC[-46] -> 0 | CR52: =RC[-46] -> 0 | CS52: =RC[-46] -> 0
A53: 5 | B53: 013446 | C53: Dương Công Tú | D53: Nhân viên Bốc xếp | E53: 19028960173018 | F53: =RC[29]+RC[30]+RC[31]+RC[32]+RC[33]+RC[34]+RC[35]+RC[36]+RC[37] -> 720000 | G53: =RC[17]+RC[18]++RC[19]+RC[20]+RC[21]+RC[38]+RC[39]+RC[41] -> 0 | H53: 0 | I53: 0 | J53: =RC[-2]+RC[-1] -> 0 | K53: 0 | L53: 0 | M53: 0 | N53: =RC[15]+RC[16]+RC[17]+RC[18]+RC[19]+RC[20] -> 0 | O53: 0 | P53: 0 | Q53: 720000 | R53: 0 | S53: 0 | T53: 0 | U53: 7200 | V53: 0 | W53: 712800 | X53: 0 | Y53: 0 | Z53: 0 | AA53: 0 | AB53: 0 | AC53: 0 | AD53: 0 | AE53: 0 | AF53: 0 | AG53: 0 | AH53: 0 | AI53: 720000 | AJ53: 0 | AK53: 0 | AL53: 0 | AM53: 0 | AN53: 0 | AO53: 0 | AP53: 0 | AQ53: 0 | AR53: =1 -> 1 | AS53: 0 | AT53: 0 | AU53: =RC[-30]-RC[-29]-RC[-28]-RC[-27]-RC[-26]-RC[-25] -> 712800 | AV53: 0 | AW53: =RC[1]-RC[2] -> 0 | AX53: 0 | AY53: 0 | AZ53: =RC[-46] -> 720000 | BA53: =RC[-46] -> 0 | BB53: =RC[-46] -> 0 | BC53: =RC[-46] -> 0 | BD53: =RC[-46] -> 0 | BE53: =RC[-46] -> 0 | BF53: =RC[-46] -> 0 | BG53: =RC[-46] -> 0 | BH53: =RC[-46] -> 0 | BI53: =RC[-46] -> 0 | BJ53: =RC[-46] -> 0 | BK53: =RC[-46] -> 720000 | BL53: =RC[-46] -> 0 | BM53: =RC[-46] -> 0 | BN53: =RC[-46] -> 0 | BO53: =RC[-46] -> 7200 | BP53: =RC[-46] -> 0 | BQ53: =RC[-46] -> 712800 | BR53: =RC[-46] -> 0 | BS53: =RC[-46] -> 0 | BT53: =RC[-46] -> 0 | BU53: =RC[-46] -> 0 | BV53: =RC[-46] -> 0 | BW53: =RC[-46] -> 0 | BX53: =RC[-46] -> 0 | BY53: =RC[-46] -> 0 | BZ53: =RC[-46] -> 0 | CA53: =RC[-46] -> 0 | CB53: =RC[-46] -> 0 | CC53: =RC[-46] -> 720000 | CD53: =RC[-46] -> 0 | CE53: =RC[-46] -> 0 | CF53: =RC[-46] -> 0 | CG53: =RC[-46] -> 0 | CH53: =RC[-46] -> 0 | CI53: =RC[-46] -> 0 | CJ53: =RC[-46] -> 0 | CK53: =RC[-46] -> 0 | CL53: =RC[-46] -> 1 | CM53: =RC[-46] -> 0 | CN53: =RC[-46] -> 0 | CO53: =RC[-46] -> 712800 | CP53: =RC[-46] -> 0 | CQ53: =RC[-46] -> 0 | CR53: =RC[-46] -> 0 | CS53: =RC[-46] -> 0
A54: 6 | B54: 013448 | C54: Nguyễn Hùng Anh | D54: Nhân viên Bốc xếp | E54: 19028960229013 | F54: =RC[29]+RC[30]+RC[31]+RC[32]+RC[33]+RC[34]+RC[35]+RC[36]+RC[37] -> 720000 | G54: =RC[17]+RC[18]++RC[19]+RC[20]+RC[21]+RC[38]+RC[39]+RC[41] -> 0 | H54: 0 | I54: 0 | J54: =RC[-2]+RC[-1] -> 0 | K54: 0 | L54: 0 | M54: 0 | N54: =RC[15]+RC[16]+RC[17]+RC[18]+RC[19]+RC[20] -> 0 | O54: 0 | P54: 0 | Q54: 720000 | R54: 0 | S54: 0 | T54: 0 | U54: 7200 | V54: 0 | W54: 712800 | X54: 0 | Y54: 0 | Z54: 0 | AA54: 0 | AB54: 0 | AC54: 0 | AD54: 0 | AE54: 0 | AF54: 0 | AG54: 0 | AH54: 0 | AI54: 720000 | AJ54: 0 | AK54: 0 | AL54: 0 | AM54: 0 | AN54: 0 | AO54: 0 | AP54: 0 | AQ54: 0 | AR54: =1 -> 1 | AS54: 0 | AT54: 0 | AU54: =RC[-30]-RC[-29]-RC[-28]-RC[-27]-RC[-26]-RC[-25] -> 712800 | AV54: 0 | AW54: =RC[1]-RC[2] -> 0 | AX54: 0 | AY54: 0 | AZ54: =RC[-46] -> 720000 | BA54: =RC[-46] -> 0 | BB54: =RC[-46] -> 0 | BC54: =RC[-46] -> 0 | BD54: =RC[-46] -> 0 | BE54: =RC[-46] -> 0 | BF54: =RC[-46] -> 0 | BG54: =RC[-46] -> 0 | BH54: =RC[-46] -> 0 | BI54: =RC[-46] -> 0 | BJ54: =RC[-46] -> 0 | BK54: =RC[-46] -> 720000 | BL54: =RC[-46] -> 0 | BM54: =RC[-46] -> 0 | BN54: =RC[-46] -> 0 | BO54: =RC[-46] -> 7200 | BP54: =RC[-46] -> 0 | BQ54: =RC[-46] -> 712800 | BR54: =RC[-46] -> 0 | BS54: =RC[-46] -> 0 | BT54: =RC[-46] -> 0 | BU54: =RC[-46] -> 0 | BV54: =RC[-46] -> 0 | BW54: =RC[-46] -> 0 | BX54: =RC[-46] -> 0 | BY54: =RC[-46] -> 0 | BZ54: =RC[-46] -> 0 | CA54: =RC[-46] -> 0 | CB54: =RC[-46] -> 0 | CC54: =RC[-46] -> 720000 | CD54: =RC[-46] -> 0 | CE54: =RC[-46] -> 0 | CF54: =RC[-46] -> 0 | CG54: =RC[-46] -> 0 | CH54: =RC[-46] -> 0 | CI54: =RC[-46] -> 0 | CJ54: =RC[-46] -> 0 | CK54: =RC[-46] -> 0 | CL54: =RC[-46] -> 1 | CM54: =RC[-46] -> 0 | CN54: =RC[-46] -> 0 | CO54: =RC[-46] -> 712800 | CP54: =RC[-46] -> 0 | CQ54: =RC[-46] -> 0 | CR54: =RC[-46] -> 0 | CS54: =RC[-46] -> 0
A55: 7 | B55: 013450 | C55: Phạm Văn Mạnh | D55: Nhân viên Bốc xếp | E55: 19027722431029 | F55: =RC[29]+RC[30]+RC[31]+RC[32]+RC[33]+RC[34]+RC[35]+RC[36]+RC[37] -> 720000 | G55: =RC[17]+RC[18]++RC[19]+RC[20]+RC[21]+RC[38]+RC[39]+RC[41] -> 0 | H55: 0 | I55: 0 | J55: =RC[-2]+RC[-1] -> 0 | K55: 0 | L55: 0 | M55: 0 | N55: =RC[15]+RC[16]+RC[17]+RC[18]+RC[19]+RC[20] -> 0 | O55: 0 | P55: 0 | Q55: 720000 | R55: 0 | S55: 0 | T55: 0 | U55: 7200 | V55: 0 | W55: 712800 | X55: 0 | Y55: 0 | Z55: 0 | AA55: 0 | AB55: 0 | AC55: 0 | AD55: 0 | AE55: 0 | AF55: 0 | AG55: 0 | AH55: 0 | AI55: 720000 | AJ55: 0 | AK55: 0 | AL55: 0 | AM55: 0 | AN55: 0 | AO55: 0 | AP55: 0 | AQ55: 0 | AR55: =1 -> 1 | AS55: 0 | AT55: 0 | AU55: =RC[-30]-RC[-29]-RC[-28]-RC[-27]-RC[-26]-RC[-25] -> 712800 | AV55: 0 | AW55: =RC[1]-RC[2] -> 0 | AX55: 0 | AY55: 0 | AZ55: =RC[-46] -> 720000 | BA55: =RC[-46] -> 0 | BB55: =RC[-46] -> 0 | BC55: =RC[-46] -> 0 | BD55: =RC[-46] -> 0 | BE55: =RC[-46] -> 0 | BF55: =RC[-46] -> 0 | BG55: =RC[-46] -> 0 | BH55: =RC[-46] -> 0 | BI55: =RC[-46] -> 0 | BJ55: =RC[-46] -> 0 | BK55: =RC[-46] -> 720000 | BL55: =RC[-46] -> 0 | BM55: =RC[-46] -> 0 | BN55: =RC[-46] -> 0 | BO55: =RC[-46] -> 7200 | BP55: =RC[-46] -> 0 | BQ55: =RC[-46] -> 712800 | BR55: =RC[-46] -> 0 | BS55: =RC[-46] -> 0 | BT55: =RC[-46] -> 0 | BU55: =RC[-46] -> 0 | BV55: =RC[-46] -> 0 | BW55: =RC[-46] -> 0 | BX55: =RC[-46] -> 0 | BY55: =RC[-46] -> 0 | BZ55: =RC[-46] -> 0 | CA55: =RC[-46] -> 0 | CB55: =RC[-46] -> 0 | CC55: =RC[-46] -> 720000 | CD55: =RC[-46] -> 0 | CE55: =RC[-46] -> 0 | CF55: =RC[-46] -> 0 | CG55: =RC[-46] -> 0 | CH55: =RC[-46] -> 0 | CI55: =RC[-46] -> 0 | CJ55: =RC[-46] -> 0 | CK55: =RC[-46] -> 0 | CL55: =RC[-46] -> 1 | CM55: =RC[-46] -> 0 | CN55: =RC[-46] -> 0 | CO55: =RC[-46] -> 712800 | CP55: =RC[-46] -> 0 | CQ55: =RC[-46] -> 0 | CR55: =RC[-46] -> 0 | CS55: =RC[-46] -> 0
A56: 8 | B56: 013451 | C56: Vũ Minh Tiến | D56: Nhân viên Bốc xếp | E56: 19028960266016 | F56: =RC[29]+RC[30]+RC[31]+RC[32]+RC[33]+RC[34]+RC[35]+RC[36]+RC[37] -> 720000 | G56: =RC[17]+RC[18]++RC[19]+RC[20]+RC[21]+RC[38]+RC[39]+RC[41] -> 0 | H56: 0 | I56: 0 | J56: =RC[-2]+RC[-1] -> 0 | K56: 0 | L56: 0 | M56: 0 | N56: =RC[15]+RC[16]+RC[17]+RC[18]+RC[19]+RC[20] -> 0 | O56: 0 | P56: 0 | Q56: 720000 | R56: 0 | S56: 0 | T56: 0 | U56: 7200 | V56: 0 | W56: 712800 | X56: 0 | Y56: 0 | Z56: 0 | AA56: 0 | AB56: 0 | AC56: 0 | AD56: 0 | AE56: 0 | AF56: 0 | AG56: 0 | AH56: 0 | AI56: 720000 | AJ56: 0 | AK56: 0 | AL56: 0 | AM56: 0 | AN56: 0 | AO56: 0 | AP56: 0 | AQ56: 0 | AR56: =1 -> 1 | AS56: 0 | AT56: 0 | AU56: =RC[-30]-RC[-29]-RC[-28]-RC[-27]-RC[-26]-RC[-25] -> 712800 | AV56: 0 | AW56: =RC[1]-RC[2] -> 0 | AX56: 0 | AY56: 0 | AZ56: =RC[-46] -> 720000 | BA56: =RC[-46] -> 0 | BB56: =RC[-46] -> 0 | BC56: =RC[-46] -> 0 | BD56: =RC[-46] -> 0 | BE56: =RC[-46] -> 0 | BF56: =RC[-46] -> 0 | BG56: =RC[-46] -> 0 | BH56: =RC[-46] -> 0 | BI56: =RC[-46] -> 0 | BJ56: =RC[-46] -> 0 | BK56: =RC[-46] -> 720000 | BL56: =RC[-46] -> 0 | BM56: =RC[-46] -> 0 | BN56: =RC[-46] -> 0 | BO56: =RC[-46] -> 7200 | BP56: =RC[-46] -> 0 | BQ56: =RC[-46] -> 712800 | BR56: =RC[-46] -> 0 | BS56: =RC[-46] -> 0 | BT56: =RC[-46] -> 0 | BU56: =RC[-46] -> 0 | BV56: =RC[-46] -> 0 | BW56: =RC[-46] -> 0 | BX56: =RC[-46] -> 0 | BY56: =RC[-46] -> 0 | BZ56: =RC[-46] -> 0 | CA56: =RC[-46] -> 0 | CB56: =RC[-46] -> 0 | CC56: =RC[-46] -> 720000 | CD56: =RC[-46] -> 0 | CE56: =RC[-46] -> 0 | CF56: =RC[-46] -> 0 | CG56: =RC[-46] -> 0 | CH56: =RC[-46] -> 0 | CI56: =RC[-46] -> 0 | CJ56: =RC[-46] -> 0 | CK56: =RC[-46] -> 0 | CL56: =RC[-46] -> 1 | CM56: =RC[-46] -> 0 | CN56: =RC[-46] -> 0 | CO56: =RC[-46] -> 712800 | CP56: =RC[-46] -> 0 | CQ56: =RC[-46] -> 0 | CR56: =RC[-46] -> 0 | CS56: =RC[-46] -> 0
A57: 9 | B57: 013453 | C57: Nguyễn Văn Khiêm | D57: Nhân viên Bốc xếp | E57: 19027527604016 | F57: =RC[29]+RC[30]+RC[31]+RC[32]+RC[33]+RC[34]+RC[35]+RC[36]+RC[37] -> 720000 | G57: =RC[17]+RC[18]++RC[19]+RC[20]+RC[21]+RC[38]+RC[39]+RC[41] -> 0 | H57: 0 | I57: 0 | J57: =RC[-2]+RC[-1] -> 0 | K57: 0 | L57: 0 | M57: 0 | N57: =RC[15]+RC[16]+RC[17]+RC[18]+RC[19]+RC[20] -> 0 | O57: 0 | P57: 0 | Q57: 720000 | R57: 0 | S57: 0 | T57: 0 | U57: 7200 | V57: 0 | W57: 712800 | X57: 0 | Y57: 0 | Z57: 0 | AA57: 0 | AB57: 0 | AC57: 0 | AD57: 0 | AE57: 0 | AF57: 0 | AG57: 0 | AH57: 0 | AI57: 720000 | AJ57: 0 | AK57: 0 | AL57: 0 | AM57: 0 | AN57: 0 | AO57: 0 | AP57: 0 | AQ57: 0 | AR57: =1 -> 1 | AS57: 0 | AT57: 0 | AU57: =RC[-30]-RC[-29]-RC[-28]-RC[-27]-RC[-26]-RC[-25] -> 712800 | AV57: 0 | AW57: =RC[1]-RC[2] -> 0 | AX57: 0 | AY57: 0 | AZ57: =RC[-46] -> 720000 | BA57: =RC[-46] -> 0 | BB57: =RC[-46] -> 0 | BC57: =RC[-46] -> 0 | BD57: =RC[-46] -> 0 | BE57: =RC[-46] -> 0 | BF57: =RC[-46] -> 0 | BG57: =RC[-46] -> 0 | BH57: =RC[-46] -> 0 | BI57: =RC[-46] -> 0 | BJ57: =RC[-46] -> 0 | BK57: =RC[-46] -> 720000 | BL57: =RC[-46] -> 0 | BM57: =RC[-46] -> 0 | BN57: =RC[-46] -> 0 | BO57: =RC[-46] -> 7200 | BP57: =RC[-46] -> 0 | BQ57: =RC[-46] -> 712800 | BR57: =RC[-46] -> 0 | BS57: =RC[-46] -> 0 | BT57: =RC[-46] -> 0 | BU57: =RC[-46] -> 0 | BV57: =RC[-46] -> 0 | BW57: =RC[-46] -> 0 | BX57: =RC[-46] -> 0 | BY57: =RC[-46] -> 0 | BZ57: =RC[-46] -> 0 | CA57: =RC[-46] -> 0 | CB57: =RC[-46] -> 0 | CC57: =RC[-46] -> 720000 | CD57: =RC[-46] -> 0 | CE57: =RC[-46] -> 0 | CF57: =RC[-46] -> 0 | CG57: =RC[-46] -> 0 | CH57: =RC[-46] -> 0 | CI57: =RC[-46] -> 0 | CJ57: =RC[-46] -> 0 | CK57: =RC[-46] -> 0 | CL57: =RC[-46] -> 1 | CM57: =RC[-46] -> 0 | CN57: =RC[-46] -> 0 | CO57: =RC[-46] -> 712800 | CP57: =RC[-46] -> 0 | CQ57: =RC[-46] -> 0 | CR57: =RC[-46] -> 0 | CS57: =RC[-46] -> 0
A58: 10 | B58: 013454 | C58: Nguyễn Xuân Hải | D58: Nhân viên Bốc xếp | E58: 19028960290014 | F58: =RC[29]+RC[30]+RC[31]+RC[32]+RC[33]+RC[34]+RC[35]+RC[36]+RC[37] -> 720000 | G58: =RC[17]+RC[18]++RC[19]+RC[20]+RC[21]+RC[38]+RC[39]+RC[41] -> 0 | H58: 0 | I58: 0 | J58: =RC[-2]+RC[-1] -> 0 | K58: 0 | L58: 0 | M58: 0 | N58: =RC[15]+RC[16]+RC[17]+RC[18]+RC[19]+RC[20] -> 0 | O58: 0 | P58: 0 | Q58: 720000 | R58: 0 | S58: 0 | T58: 0 | U58: 7200 | V58: 0 | W58: 712800 | X58: 0 | Y58: 0 | Z58: 0 | AA58: 0 | AB58: 0 | AC58: 0 | AD58: 0 | AE58: 0 | AF58: 0 | AG58: 0 | AH58: 0 | AI58: 720000 | AJ58: 0 | AK58: 0 | AL58: 0 | AM58: 0 | AN58: 0 | AO58: 0 | AP58: 0 | AQ58: 0 | AR58: =1 -> 1 | AS58: 0 | AT58: 0 | AU58: =RC[-30]-RC[-29]-RC[-28]-RC[-27]-RC[-26]-RC[-25] -> 712800 | AV58: 0 | AW58: =RC[1]-RC[2] -> 0 | AX58: 0 | AY58: 0 | AZ58: =RC[-46] -> 720000 | BA58: =RC[-46] -> 0 | BB58: =RC[-46] -> 0 | BC58: =RC[-46] -> 0 | BD58: =RC[-46] -> 0 | BE58: =RC[-46] -> 0 | BF58: =RC[-46] -> 0 | BG58: =RC[-46] -> 0 | BH58: =RC[-46] -> 0 | BI58: =RC[-46] -> 0 | BJ58: =RC[-46] -> 0 | BK58: =RC[-46] -> 720000 | BL58: =RC[-46] -> 0 | BM58: =RC[-46] -> 0 | BN58: =RC[-46] -> 0 | BO58: =RC[-46] -> 7200 | BP58: =RC[-46] -> 0 | BQ58: =RC[-46] -> 712800 | BR58: =RC[-46] -> 0 | BS58: =RC[-46] -> 0 | BT58: =RC[-46] -> 0 | BU58: =RC[-46] -> 0 | BV58: =RC[-46] -> 0 | BW58: =RC[-46] -> 0 | BX58: =RC[-46] -> 0 | BY58: =RC[-46] -> 0 | BZ58: =RC[-46] -> 0 | CA58: =RC[-46] -> 0 | CB58: =RC[-46] -> 0 | CC58: =RC[-46] -> 720000 | CD58: =RC[-46] -> 0 | CE58: =RC[-46] -> 0 | CF58: =RC[-46] -> 0 | CG58: =RC[-46] -> 0 | CH58: =RC[-46] -> 0 | CI58: =RC[-46] -> 0 | CJ58: =RC[-46] -> 0 | CK58: =RC[-46] -> 0 | CL58: =RC[-46] -> 1 | CM58: =RC[-46] -> 0 | CN58: =RC[-46] -> 0 | CO58: =RC[-46] -> 712800 | CP58: =RC[-46] -> 0 | CQ58: =RC[-46] -> 0 | CR58: =RC[-46] -> 0 | CS58: =RC[-46] -> 0
A59: 11 | B59: 013455 | C59: Nguyễn Như Tuấn | D59: Nhân viên Bốc xếp | E59: 19028960241013 | F59: =RC[29]+RC[30]+RC[31]+RC[32]+RC[33]+RC[34]+RC[35]+RC[36]+RC[37] -> 720000 | G59: =RC[17]+RC[18]++RC[19]+RC[20]+RC[21]+RC[38]+RC[39]+RC[41] -> 0 | H59: 0 | I59: 0 | J59: =RC[-2]+RC[-1] -> 0 | K59: 0 | L59: 0 | M59: 0 | N59: =RC[15]+RC[16]+RC[17]+RC[18]+RC[19]+RC[20] -> 0 | O59: 0 | P59: 0 | Q59: 720000 | R59: 0 | S59: 0 | T59: 0 | U59: 7200 | V59: 0 | W59: 712800 | X59: 0 | Y59: 0 | Z59: 0 | AA59: 0 | AB59: 0 | AC59: 0 | AD59: 0 | AE59: 0 | AF59: 0 | AG59: 0 | AH59: 0 | AI59: 720000 | AJ59: 0 | AK59: 0 | AL59: 0 | AM59: 0 | AN59: 0 | AO59: 0 | AP59: 0 | AQ59: 0 | AR59: =1 -> 1 | AS59: 0 | AT59: 0 | AU59: =RC[-30]-RC[-29]-RC[-28]-RC[-27]-RC[-26]-RC[-25] -> 712800 | AV59: 0 | AW59: =RC[1]-RC[2] -> 0 | AX59: 0 | AY59: 0 | AZ59: =RC[-46] -> 720000 | BA59: =RC[-46] -> 0 | BB59: =RC[-46] -> 0 | BC59: =RC[-46] -> 0 | BD59: =RC[-46] -> 0 | BE59: =RC[-46] -> 0 | BF59: =RC[-46] -> 0 | BG59: =RC[-46] -> 0 | BH59: =RC[-46] -> 0 | BI59: =RC[-46] -> 0 | BJ59: =RC[-46] -> 0 | BK59: =RC[-46] -> 720000 | BL59: =RC[-46] -> 0 | BM59: =RC[-46] -> 0 | BN59: =RC[-46] -> 0 | BO59: =RC[-46] -> 7200 | BP59: =RC[-46] -> 0 | BQ59: =RC[-46] -> 712800 | BR59: =RC[-46] -> 0 | BS59: =RC[-46] -> 0 | BT59: =RC[-46] -> 0 | BU59: =RC[-46] -> 0 | BV59: =RC[-46] -> 0 | BW59: =RC[-46] -> 0 | BX59: =RC[-46] -> 0 | BY59: =RC[-46] -> 0 | BZ59: =RC[-46] -> 0 | CA59: =RC[-46] -> 0 | CB59: =RC[-46] -> 0 | CC59: =RC[-46] -> 720000 | CD59: =RC[-46] -> 0 | CE59: =RC[-46] -> 0 | CF59: =RC[-46] -> 0 | CG59: =RC[-46] -> 0 | CH59: =RC[-46] -> 0 | CI59: =RC[-46] -> 0 | CJ59: =RC[-46] -> 0 | CK59: =RC[-46] -> 0 | CL59: =RC[-46] -> 1 | CM59: =RC[-46] -> 0 | CN59: =RC[-46] -> 0 | CO59: =RC[-46] -> 712800 | CP59: =RC[-46] -> 0 | CQ59: =RC[-46] -> 0 | CR59: =RC[-46] -> 0 | CS59: =RC[-46] -> 0
A60: 12 | B60: 013457 | C60: Trần Thanh Tuấn | D60: Nhân viên Bốc xếp | E60: 10521547311017 | F60: =RC[29]+RC[30]+RC[31]+RC[32]+RC[33]+RC[34]+RC[35]+RC[36]+RC[37] -> 720000 | G60: =RC[17]+RC[18]++RC[19]+RC[20]+RC[21]+RC[38]+RC[39]+RC[41] -> 0 | H60: 0 | I60: 0 | J60: =RC[-2]+RC[-1] -> 0 | K60: 0 | L60: 0 | M60: 0 | N60: =RC[15]+RC[16]+RC[17]+RC[18]+RC[19]+RC[20] -> 0 | O60: 0 | P60: 0 | Q60: 720000 | R60: 0 | S60: 0 | T60: 0 | U60: 7200 | V60: 0 | W60: 712800 | X60: 0 | Y60: 0 | Z60: 0 | AA60: 0 | AB60: 0 | AC60: 0 | AD60: 0 | AE60: 0 | AF60: 0 | AG60: 0 | AH60: 0 | AI60: 720000 | AJ60: 0 | AK60: 0 | AL60: 0 | AM60: 0 | AN60: 0 | AO60: 0 | AP60: 0 | AQ60: 0 | AR60: =1 -> 1 | AS60: 0 | AT60: 0 | AU60: =RC[-30]-RC[-29]-RC[-28]-RC[-27]-RC[-26]-RC[-25] -> 712800 | AV60: 0 | AW60: =RC[1]-RC[2] -> 0 | AX60: 0 | AY60: 0 | AZ60: =RC[-46] -> 720000 | BA60: =RC[-46] -> 0 | BB60: =RC[-46] -> 0 | BC60: =RC[-46] -> 0 | BD60: =RC[-46] -> 0 | BE60: =RC[-46] -> 0 | BF60: =RC[-46] -> 0 | BG60: =RC[-46] -> 0 | BH60: =RC[-46] -> 0 | BI60: =RC[-46] -> 0 | BJ60: =RC[-46] -> 0 | BK60: =RC[-46] -> 720000 | BL60: =RC[-46] -> 0 | BM60: =RC[-46] -> 0 | BN60: =RC[-46] -> 0 | BO60: =RC[-46] -> 7200 | BP60: =RC[-46] -> 0 | BQ60: =RC[-46] -> 712800 | BR60: =RC[-46] -> 0 | BS60: =RC[-46] -> 0 | BT60: =RC[-46] -> 0 | BU60: =RC[-46] -> 0 | BV60: =RC[-46] -> 0 | BW60: =RC[-46] -> 0 | BX60: =RC[-46] -> 0 | BY60: =RC[-46] -> 0 | BZ60: =RC[-46] -> 0 | CA60: =RC[-46] -> 0 | CB60: =RC[-46] -> 0 | CC60: =RC[-46] -> 720000 | CD60: =RC[-46] -> 0 | CE60: =RC[-46] -> 0 | CF60: =RC[-46] -> 0 | CG60: =RC[-46] -> 0 | CH60: =RC[-46] -> 0 | CI60: =RC[-46] -> 0 | CJ60: =RC[-46] -> 0 | CK60: =RC[-46] -> 0 | CL60: =RC[-46] -> 1 | CM60: =RC[-46] -> 0 | CN60: =RC[-46] -> 0 | CO60: =RC[-46] -> 712800 | CP60: =RC[-46] -> 0 | CQ60: =RC[-46] -> 0 | CR60: =RC[-46] -> 0 | CS60: =RC[-46] -> 0
A61: 13 | B61: 013458 | C61: Nguyễn Việt Hải | D61: Nhân viên Bốc xếp | E61: 19028960261014 | F61: =RC[29]+RC[30]+RC[31]+RC[32]+RC[33]+RC[34]+RC[35]+RC[36]+RC[37] -> 720000 | G61: =RC[17]+RC[18]++RC[19]+RC[20]+RC[21]+RC[38]+RC[39]+RC[41] -> 0 | H61: 0 | I61: 0 | J61: =RC[-2]+RC[-1] -> 0 | K61: 0 | L61: 0 | M61: 0 | N61: =RC[15]+RC[16]+RC[17]+RC[18]+RC[19]+RC[20] -> 0 | O61: 0 | P61: 0 | Q61: 720000 | R61: 0 | S61: 0 | T61: 0 | U61: 7200 | V61: 0 | W61: 712800 | X61: 0 | Y61: 0 | Z61: 0 | AA61: 0 | AB61: 0 | AC61: 0 | AD61: 0 | AE61: 0 | AF61: 0 | AG61: 0 | AH61: 0 | AI61: 720000 | AJ61: 0 | AK61: 0 | AL61: 0 | AM61: 0 | AN61: 0 | AO61: 0 | AP61: 0 | AQ61: 0 | AR61: =1 -> 1 | AS61: 0 | AT61: 0 | AU61: =RC[-30]-RC[-29]-RC[-28]-RC[-27]-RC[-26]-RC[-25] -> 712800 | AV61: 0 | AW61: =RC[1]-RC[2] -> 0 | AX61: 0 | AY61: 0 | AZ61: =RC[-46] -> 720000 | BA61: =RC[-46] -> 0 | BB61: =RC[-46] -> 0 | BC61: =RC[-46] -> 0 | BD61: =RC[-46] -> 0 | BE61: =RC[-46] -> 0 | BF61: =RC[-46] -> 0 | BG61: =RC[-46] -> 0 | BH61: =RC[-46] -> 0 | BI61: =RC[-46] -> 0 | BJ61: =RC[-46] -> 0 | BK61: =RC[-46] -> 720000 | BL61: =RC[-46] -> 0 | BM61: =RC[-46] -> 0 | BN61: =RC[-46] -> 0 | BO61: =RC[-46] -> 7200 | BP61: =RC[-46] -> 0 | BQ61: =RC[-46] -> 712800 | BR61: =RC[-46] -> 0 | BS61: =RC[-46] -> 0 | BT61: =RC[-46] -> 0 | BU61: =RC[-46] -> 0 | BV61: =RC[-46] -> 0 | BW61: =RC[-46] -> 0 | BX61: =RC[-46] -> 0 | BY61: =RC[-46] -> 0 | BZ61: =RC[-46] -> 0 | CA61: =RC[-46] -> 0 | CB61: =RC[-46] -> 0 | CC61: =RC[-46] -> 720000 | CD61: =RC[-46] -> 0 | CE61: =RC[-46] -> 0 | CF61: =RC[-46] -> 0 | CG61: =RC[-46] -> 0 | CH61: =RC[-46] -> 0 | CI61: =RC[-46] -> 0 | CJ61: =RC[-46] -> 0 | CK61: =RC[-46] -> 0 | CL61: =RC[-46] -> 1 | CM61: =RC[-46] -> 0 | CN61: =RC[-46] -> 0 | CO61: =RC[-46] -> 712800 | CP61: =RC[-46] -> 0 | CQ61: =RC[-46] -> 0 | CR61: =RC[-46] -> 0 | CS61: =RC[-46] -> 0
A62: 14 | B62: 013461 | C62: Cao Văn Mạnh | D62: Nhân viên Bốc xếp | E62: 19028960231018 | F62: =RC[29]+RC[30]+RC[31]+RC[32]+RC[33]+RC[34]+RC[35]+RC[36]+RC[37] -> 720000 | G62: =RC[17]+RC[18]++RC[19]+RC[20]+RC[21]+RC[38]+RC[39]+RC[41] -> 0 | H62: 0 | I62: 0 | J62: =RC[-2]+RC[-1] -> 0 | K62: 0 | L62: 0 | M62: 0 | N62: =RC[15]+RC[16]+RC[17]+RC[18]+RC[19]+RC[20] -> 0 | O62: 0 | P62: 0 | Q62: 720000 | R62: 0 | S62: 0 | T62: 0 | U62: 7200 | V62: 0 | W62: 712800 | X62: 0 | Y62: 0 | Z62: 0 | AA62: 0 | AB62: 0 | AC62: 0 | AD62: 0 | AE62: 0 | AF62: 0 | AG62: 0 | AH62: 0 | AI62: 720000 | AJ62: 0 | AK62: 0 | AL62: 0 | AM62: 0 | AN62: 0 | AO62: 0 | AP62: 0 | AQ62: 0 | AR62: =1 -> 1 | AS62: 0 | AT62: 0 | AU62: =RC[-30]-RC[-29]-RC[-28]-RC[-27]-RC[-26]-RC[-25] -> 712800 | AV62: 0 | AW62: =RC[1]-RC[2] -> 0 | AX62: 0 | AY62: 0 | AZ62: =RC[-46] -> 720000 | BA62: =RC[-46] -> 0 | BB62: =RC[-46] -> 0 | BC62: =RC[-46] -> 0 | BD62: =RC[-46] -> 0 | BE62: =RC[-46] -> 0 | BF62: =RC[-46] -> 0 | BG62: =RC[-46] -> 0 | BH62: =RC[-46] -> 0 | BI62: =RC[-46] -> 0 | BJ62: =RC[-46] -> 0 | BK62: =RC[-46] -> 720000 | BL62: =RC[-46] -> 0 | BM62: =RC[-46] -> 0 | BN62: =RC[-46] -> 0 | BO62: =RC[-46] -> 7200 | BP62: =RC[-46] -> 0 | BQ62: =RC[-46] -> 712800 | BR62: =RC[-46] -> 0 | BS62: =RC[-46] -> 0 | BT62: =RC[-46] -> 0 | BU62: =RC[-46] -> 0 | BV62: =RC[-46] -> 0 | BW62: =RC[-46] -> 0 | BX62: =RC[-46] -> 0 | BY62: =RC[-46] -> 0 | BZ62: =RC[-46] -> 0 | CA62: =RC[-46] -> 0 | CB62: =RC[-46] -> 0 | CC62: =RC[-46] -> 720000 | CD62: =RC[-46] -> 0 | CE62: =RC[-46] -> 0 | CF62: =RC[-46] -> 0 | CG62: =RC[-46] -> 0 | CH62: =RC[-46] -> 0 | CI62: =RC[-46] -> 0 | CJ62: =RC[-46] -> 0 | CK62: =RC[-46] -> 0 | CL62: =RC[-46] -> 1 | CM62: =RC[-46] -> 0 | CN62: =RC[-46] -> 0 | CO62: =RC[-46] -> 712800 | CP62: =RC[-46] -> 0 | CQ62: =RC[-46] -> 0 | CR62: =RC[-46] -> 0 | CS62: =RC[-46] -> 0
A63: 15 | B63: 013464 | C63: Phạm Văn Dũng | D63: Nhân viên Bốc xếp | E63: 19028960254018 | F63: =RC[29]+RC[30]+RC[31]+RC[32]+RC[33]+RC[34]+RC[35]+RC[36]+RC[37] -> 720000 | G63: =RC[17]+RC[18]++RC[19]+RC[20]+RC[21]+RC[38]+RC[39]+RC[41] -> 0 | H63: 0 | I63: 0 | J63: =RC[-2]+RC[-1] -> 0 | K63: 0 | L63: 0 | M63: 0 | N63: =RC[15]+RC[16]+RC[17]+RC[18]+RC[19]+RC[20] -> 0 | O63: 0 | P63: 0 | Q63: 720000 | R63: 0 | S63: 0 | T63: 0 | U63: 7200 | V63: 0 | W63: 712800 | X63: 0 | Y63: 0 | Z63: 0 | AA63: 0 | AB63: 0 | AC63: 0 | AD63: 0 | AE63: 0 | AF63: 0 | AG63: 0 | AH63: 0 | AI63: 720000 | AJ63: 0 | AK63: 0 | AL63: 0 | AM63: 0 | AN63: 0 | AO63: 0 | AP63: 0 | AQ63: 0 | AR63: =1 -> 1 | AS63: 0 | AT63: 0 | AU63: =RC[-30]-RC[-29]-RC[-28]-RC[-27]-RC[-26]-RC[-25] -> 712800 | AV63: 0 | AW63: =RC[1]-RC[2] -> 0 | AX63: 0 | AY63: 0 | AZ63: =RC[-46] -> 720000 | BA63: =RC[-46] -> 0 | BB63: =RC[-46] -> 0 | BC63: =RC[-46] -> 0 | BD63: =RC[-46] -> 0 | BE63: =RC[-46] -> 0 | BF63: =RC[-46] -> 0 | BG63: =RC[-46] -> 0 | BH63: =RC[-46] -> 0 | BI63: =RC[-46] -> 0 | BJ63: =RC[-46] -> 0 | BK63: =RC[-46] -> 720000 | BL63: =RC[-46] -> 0 | BM63: =RC[-46] -> 0 | BN63: =RC[-46] -> 0 | BO63: =RC[-46] -> 7200 | BP63: =RC[-46] -> 0 | BQ63: =RC[-46] -> 712800 | BR63: =RC[-46] -> 0 | BS63: =RC[-46] -> 0 | BT63: =RC[-46] -> 0 | BU63: =RC[-46] -> 0 | BV63: =RC[-46] -> 0 | BW63: =RC[-46] -> 0 | BX63: =RC[-46] -> 0 | BY63: =RC[-46] -> 0 | BZ63: =RC[-46] -> 0 | CA63: =RC[-46] -> 0 | CB63: =RC[-46] -> 0 | CC63: =RC[-46] -> 720000 | CD63: =RC[-46] -> 0 | CE63: =RC[-46] -> 0 | CF63: =RC[-46] -> 0 | CG63: =RC[-46] -> 0 | CH63: =RC[-46] -> 0 | CI63: =RC[-46] -> 0 | CJ63: =RC[-46] -> 0 | CK63: =RC[-46] -> 0 | CL63: =RC[-46] -> 1 | CM63: =RC[-46] -> 0 | CN63: =RC[-46] -> 0 | CO63: =RC[-46] -> 712800 | CP63: =RC[-46] -> 0 | CQ63: =RC[-46] -> 0 | CR63: =RC[-46] -> 0 | CS63: =RC[-46] -> 0
A64: 16 | B64: 013465 | C64: Vũ Văn Tuyền | D64: Nhân viên Bốc xếp | E64: 19028960218011 | F64: =RC[29]+RC[30]+RC[31]+RC[32]+RC[33]+RC[34]+RC[35]+RC[36]+RC[37] -> 720000 | G64: =RC[17]+RC[18]++RC[19]+RC[20]+RC[21]+RC[38]+RC[39]+RC[41] -> 0 | H64: 0 | I64: 0 | J64: =RC[-2]+RC[-1] -> 0 | K64: 0 | L64: 0 | M64: 0 | N64: =RC[15]+RC[16]+RC[17]+RC[18]+RC[19]+RC[20] -> 0 | O64: 0 | P64: 0 | Q64: 720000 | R64: 0 | S64: 0 | T64: 0 | U64: 7200 | V64: 0 | W64: 712800 | X64: 0 | Y64: 0 | Z64: 0 | AA64: 0 | AB64: 0 | AC64: 0 | AD64: 0 | AE64: 0 | AF64: 0 | AG64: 0 | AH64: 0 | AI64: 720000 | AJ64: 0 | AK64: 0 | AL64: 0 | AM64: 0 | AN64: 0 | AO64: 0 | AP64: 0 | AQ64: 0 | AR64: =1 -> 1 | AS64: 0 | AT64: 0 | AU64: =RC[-30]-RC[-29]-RC[-28]-RC[-27]-RC[-26]-RC[-25] -> 712800 | AV64: 0 | AW64: =RC[1]-RC[2] -> 0 | AX64: 0 | AY64: 0 | AZ64: =RC[-46] -> 720000 | BA64: =RC[-46] -> 0 | BB64: =RC[-46] -> 0 | BC64: =RC[-46] -> 0 | BD64: =RC[-46] -> 0 | BE64: =RC[-46] -> 0 | BF64: =RC[-46] -> 0 | BG64: =RC[-46] -> 0 | BH64: =RC[-46] -> 0 | BI64: =RC[-46] -> 0 | BJ64: =RC[-46] -> 0 | BK64: =RC[-46] -> 720000 | BL64: =RC[-46] -> 0 | BM64: =RC[-46] -> 0 | BN64: =RC[-46] -> 0 | BO64: =RC[-46] -> 7200 | BP64: =RC[-46] -> 0 | BQ64: =RC[-46] -> 712800 | BR64: =RC[-46] -> 0 | BS64: =RC[-46] -> 0 | BT64: =RC[-46] -> 0 | BU64: =RC[-46] -> 0 | BV64: =RC[-46] -> 0 | BW64: =RC[-46] -> 0 | BX64: =RC[-46] -> 0 | BY64: =RC[-46] -> 0 | BZ64: =RC[-46] -> 0 | CA64: =RC[-46] -> 0 | CB64: =RC[-46] -> 0 | CC64: =RC[-46] -> 720000 | CD64: =RC[-46] -> 0 | CE64: =RC[-46] -> 0 | CF64: =RC[-46] -> 0 | CG64: =RC[-46] -> 0 | CH64: =RC[-46] -> 0 | CI64: =RC[-46] -> 0 | CJ64: =RC[-46] -> 0 | CK64: =RC[-46] -> 0 | CL64: =RC[-46] -> 1 | CM64: =RC[-46] -> 0 | CN64: =RC[-46] -> 0 | CO64: =RC[-46] -> 712800 | CP64: =RC[-46] -> 0 | CQ64: =RC[-46] -> 0 | CR64: =RC[-46] -> 0 | CS64: =RC[-46] -> 0
A65: 17 | B65: 013466 | C65: Nguyễn Viết Phi | D65: Nhân viên Bốc xếp | E65: 19028609457026 | F65: =RC[29]+RC[30]+RC[31]+RC[32]+RC[33]+RC[34]+RC[35]+RC[36]+RC[37] -> 720000 | G65: =RC[17]+RC[18]++RC[19]+RC[20]+RC[21]+RC[38]+RC[39]+RC[41] -> 0 | H65: 0 | I65: 0 | J65: =RC[-2]+RC[-1] -> 0 | K65: 0 | L65: 0 | M65: 0 | N65: =RC[15]+RC[16]+RC[17]+RC[18]+RC[19]+RC[20] -> 0 | O65: 0 | P65: 0 | Q65: 720000 | R65: 0 | S65: 0 | T65: 0 | U65: 7200 | V65: 0 | W65: 712800 | X65: 0 | Y65: 0 | Z65: 0 | AA65: 0 | AB65: 0 | AC65: 0 | AD65: 0 | AE65: 0 | AF65: 0 | AG65: 0 | AH65: 0 | AI65: 720000 | AJ65: 0 | AK65: 0 | AL65: 0 | AM65: 0 | AN65: 0 | AO65: 0 | AP65: 0 | AQ65: 0 | AR65: =1 -> 1 | AS65: 0 | AT65: 0 | AU65: =RC[-30]-RC[-29]-RC[-28]-RC[-27]-RC[-26]-RC[-25] -> 712800 | AV65: 0 | AW65: =RC[1]-RC[2] -> 0 | AX65: 0 | AY65: 0 | AZ65: =RC[-46] -> 720000 | BA65: =RC[-46] -> 0 | BB65: =RC[-46] -> 0 | BC65: =RC[-46] -> 0 | BD65: =RC[-46] -> 0 | BE65: =RC[-46] -> 0 | BF65: =RC[-46] -> 0 | BG65: =RC[-46] -> 0 | BH65: =RC[-46] -> 0 | BI65: =RC[-46] -> 0 | BJ65: =RC[-46] -> 0 | BK65: =RC[-46] -> 720000 | BL65: =RC[-46] -> 0 | BM65: =RC[-46] -> 0 | BN65: =RC[-46] -> 0 | BO65: =RC[-46] -> 7200 | BP65: =RC[-46] -> 0 | BQ65: =RC[-46] -> 712800 | BR65: =RC[-46] -> 0 | BS65: =RC[-46] -> 0 | BT65: =RC[-46] -> 0 | BU65: =RC[-46] -> 0 | BV65: =RC[-46] -> 0 | BW65: =RC[-46] -> 0 | BX65: =RC[-46] -> 0 | BY65: =RC[-46] -> 0 | BZ65: =RC[-46] -> 0 | CA65: =RC[-46] -> 0 | CB65: =RC[-46] -> 0 | CC65: =RC[-46] -> 720000 | CD65: =RC[-46] -> 0 | CE65: =RC[-46] -> 0 | CF65: =RC[-46] -> 0 | CG65: =RC[-46] -> 0 | CH65: =RC[-46] -> 0 | CI65: =RC[-46] -> 0 | CJ65: =RC[-46] -> 0 | CK65: =RC[-46] -> 0 | CL65: =RC[-46] -> 1 | CM65: =RC[-46] -> 0 | CN65: =RC[-46] -> 0 | CO65: =RC[-46] -> 712800 | CP65: =RC[-46] -> 0 | CQ65: =RC[-46] -> 0 | CR65: =RC[-46] -> 0 | CS65: =RC[-46] -> 0
A66: 18 | B66: 013467 | C66: Tăng Văn Hải | D66: Nhân viên Bốc xếp | E66: 19028960196018 | F66: =RC[29]+RC[30]+RC[31]+RC[32]+RC[33]+RC[34]+RC[35]+RC[36]+RC[37] -> 720000 | G66: =RC[17]+RC[18]++RC[19]+RC[20]+RC[21]+RC[38]+RC[39]+RC[41] -> 0 | H66: 0 | I66: 0 | J66: =RC[-2]+RC[-1] -> 0 | K66: 0 | L66: 0 | M66: 0 | N66: =RC[15]+RC[16]+RC[17]+RC[18]+RC[19]+RC[20] -> 0 | O66: 0 | P66: 0 | Q66: 720000 | R66: 0 | S66: 0 | T66: 0 | U66: 7200 | V66: 0 | W66: 712800 | X66: 0 | Y66: 0 | Z66: 0 | AA66: 0 | AB66: 0 | AC66: 0 | AD66: 0 | AE66: 0 | AF66: 0 | AG66: 0 | AH66: 0 | AI66: 720000 | AJ66: 0 | AK66: 0 | AL66: 0 | AM66: 0 | AN66: 0 | AO66: 0 | AP66: 0 | AQ66: 0 | AR66: =1 -> 1 | AS66: 0 | AT66: 0 | AU66: =RC[-30]-RC[-29]-RC[-28]-RC[-27]-RC[-26]-RC[-25] -> 712800 | AV66: 0 | AW66: =RC[1]-RC[2] -> 0 | AX66: 0 | AY66: 0 | AZ66: =RC[-46] -> 720000 | BA66: =RC[-46] -> 0 | BB66: =RC[-46] -> 0 | BC66: =RC[-46] -> 0 | BD66: =RC[-46] -> 0 | BE66: =RC[-46] -> 0 | BF66: =RC[-46] -> 0 | BG66: =RC[-46] -> 0 | BH66: =RC[-46] -> 0 | BI66: =RC[-46] -> 0 | BJ66: =RC[-46] -> 0 | BK66: =RC[-46] -> 720000 | BL66: =RC[-46] -> 0 | BM66: =RC[-46] -> 0 | BN66: =RC[-46] -> 0 | BO66: =RC[-46] -> 7200 | BP66: =RC[-46] -> 0 | BQ66: =RC[-46] -> 712800 | BR66: =RC[-46] -> 0 | BS66: =RC[-46] -> 0 | BT66: =RC[-46] -> 0 | BU66: =RC[-46] -> 0 | BV66: =RC[-46] -> 0 | BW66: =RC[-46] -> 0 | BX66: =RC[-46] -> 0 | BY66: =RC[-46] -> 0 | BZ66: =RC[-46] -> 0 | CA66: =RC[-46] -> 0 | CB66: =RC[-46] -> 0 | CC66: =RC[-46] -> 720000 | CD66: =RC[-46] -> 0 | CE66: =RC[-46] -> 0 | CF66: =RC[-46] -> 0 | CG66: =RC[-46] -> 0 | CH66: =RC[-46] -> 0 | CI66: =RC[-46] -> 0 | CJ66: =RC[-46] -> 0 | CK66: =RC[-46] -> 0 | CL66: =RC[-46] -> 1 | CM66: =RC[-46] -> 0 | CN66: =RC[-46] -> 0 | CO66: =RC[-46] -> 712800 | CP66: =RC[-46] -> 0 | CQ66: =RC[-46] -> 0 | CR66: =RC[-46] -> 0 | CS66: =RC[-46] -> 0
A67: 19 | B67: 013468 | C67: Lê Trọng Tài | D67: Nhân viên Bốc xếp | E67: 19028960213011 | F67: =RC[29]+RC[30]+RC[31]+RC[32]+RC[33]+RC[34]+RC[35]+RC[36]+RC[37] -> 720000 | G67: =RC[17]+RC[18]++RC[19]+RC[20]+RC[21]+RC[38]+RC[39]+RC[41] -> 0 | H67: 0 | I67: 0 | J67: =RC[-2]+RC[-1] -> 0 | K67: 0 | L67: 0 | M67: 0 | N67: =RC[15]+RC[16]+RC[17]+RC[18]+RC[19]+RC[20] -> 0 | O67: 0 | P67: 0 | Q67: 720000 | R67: 0 | S67: 0 | T67: 0 | U67: 7200 | V67: 0 | W67: 712800 | X67: 0 | Y67: 0 | Z67: 0 | AA67: 0 | AB67: 0 | AC67: 0 | AD67: 0 | AE67: 0 | AF67: 0 | AG67: 0 | AH67: 0 | AI67: 720000 | AJ67: 0 | AK67: 0 | AL67: 0 | AM67: 0 | AN67: 0 | AO67: 0 | AP67: 0 | AQ67: 0 | AR67: =1 -> 1 | AS67: 0 | AT67: 0 | AU67: =RC[-30]-RC[-29]-RC[-28]-RC[-27]-RC[-26]-RC[-25] -> 712800 | AV67: 0 | AW67: =RC[1]-RC[2] -> 0 | AX67: 0 | AY67: 0 | AZ67: =RC[-46] -> 720000 | BA67: =RC[-46] -> 0 | BB67: =RC[-46] -> 0 | BC67: =RC[-46] -> 0 | BD67: =RC[-46] -> 0 | BE67: =RC[-46] -> 0 | BF67: =RC[-46] -> 0 | BG67: =RC[-46] -> 0 | BH67: =RC[-46] -> 0 | BI67: =RC[-46] -> 0 | BJ67: =RC[-46] -> 0 | BK67: =RC[-46] -> 720000 | BL67: =RC[-46] -> 0 | BM67: =RC[-46] -> 0 | BN67: =RC[-46] -> 0 | BO67: =RC[-46] -> 7200 | BP67: =RC[-46] -> 0 | BQ67: =RC[-46] -> 712800 | BR67: =RC[-46] -> 0 | BS67: =RC[-46] -> 0 | BT67: =RC[-46] -> 0 | BU67: =RC[-46] -> 0 | BV67: =RC[-46] -> 0 | BW67: =RC[-46] -> 0 | BX67: =RC[-46] -> 0 | BY67: =RC[-46] -> 0 | BZ67: =RC[-46] -> 0 | CA67: =RC[-46] -> 0 | CB67: =RC[-46] -> 0 | CC67: =RC[-46] -> 720000 | CD67: =RC[-46] -> 0 | CE67: =RC[-46] -> 0 | CF67: =RC[-46] -> 0 | CG67: =RC[-46] -> 0 | CH67: =RC[-46] -> 0 | CI67: =RC[-46] -> 0 | CJ67: =RC[-46] -> 0 | CK67: =RC[-46] -> 0 | CL67: =RC[-46] -> 1 | CM67: =RC[-46] -> 0 | CN67: =RC[-46] -> 0 | CO67: =RC[-46] -> 712800 | CP67: =RC[-46] -> 0 | CQ67: =RC[-46] -> 0 | CR67: =RC[-46] -> 0 | CS67: =RC[-46] -> 0
A68: 20 | B68: 013406 | C68: Hoàng Đình Mạnh | D68: NV Lái xe - VHTTB | E68: 19028960166011 | F68: =RC[29]+RC[30]+RC[31]+RC[32]+RC[33]+RC[34]+RC[35]+RC[36]+RC[37] -> 720000 | G68: =RC[17]+RC[18]++RC[19]+RC[20]+RC[21]+RC[38]+RC[39]+RC[41] -> 0 | H68: 0 | I68: 0 | J68: =RC[-2]+RC[-1] -> 0 | K68: 0 | L68: 0 | M68: 0 | N68: =RC[15]+RC[16]+RC[17]+RC[18]+RC[19]+RC[20] -> 0 | O68: 0 | P68: 0 | Q68: 720000 | R68: 0 | S68: 0 | T68: 0 | U68: 7200 | V68: 0 | W68: 712800 | X68: 0 | Y68: 0 | Z68: 0 | AA68: 0 | AB68: 0 | AC68: 0 | AD68: 0 | AE68: 0 | AF68: 0 | AG68: 0 | AH68: 0 | AI68: 720000 | AJ68: 0 | AK68: 0 | AL68: 0 | AM68: 0 | AN68: 0 | AO68: 0 | AP68: 0 | AQ68: 0 | AR68: =1 -> 1 | AS68: 0 | AT68: 0 | AU68: =RC[-30]-RC[-29]-RC[-28]-RC[-27]-RC[-26]-RC[-25] -> 712800 | AV68: 0 | AW68: =RC[1]-RC[2] -> 0 | AX68: 0 | AY68: 0 | AZ68: =RC[-46] -> 720000 | BA68: =RC[-46] -> 0 | BB68: =RC[-46] -> 0 | BC68: =RC[-46] -> 0 | BD68: =RC[-46] -> 0 | BE68: =RC[-46] -> 0 | BF68: =RC[-46] -> 0 | BG68: =RC[-46] -> 0 | BH68: =RC[-46] -> 0 | BI68: =RC[-46] -> 0 | BJ68: =RC[-46] -> 0 | BK68: =RC[-46] -> 720000 | BL68: =RC[-46] -> 0 | BM68: =RC[-46] -> 0 | BN68: =RC[-46] -> 0 | BO68: =RC[-46] -> 7200 | BP68: =RC[-46] -> 0 | BQ68: =RC[-46] -> 712800 | BR68: =RC[-46] -> 0 | BS68: =RC[-46] -> 0 | BT68: =RC[-46] -> 0 | BU68: =RC[-46] -> 0 | BV68: =RC[-46] -> 0 | BW68: =RC[-46] -> 0 | BX68: =RC[-46] -> 0 | BY68: =RC[-46] -> 0 | BZ68: =RC[-46] -> 0 | CA68: =RC[-46] -> 0 | CB68: =RC[-46] -> 0 | CC68: =RC[-46] -> 720000 | CD68: =RC[-46] -> 0 | CE68: =RC[-46] -> 0 | CF68: =RC[-46] -> 0 | CG68: =RC[-46] -> 0 | CH68: =RC[-46] -> 0 | CI68: =RC[-46] -> 0 | CJ68: =RC[-46] -> 0 | CK68: =RC[-46] -> 0 | CL68: =RC[-46] -> 1 | CM68: =RC[-46] -> 0 | CN68: =RC[-46] -> 0 | CO68: =RC[-46] -> 712800 | CP68: =RC[-46] -> 0 | CQ68: =RC[-46] -> 0 | CR68: =RC[-46] -> 0 | CS68: =RC[-46] -> 0
A69: 21 | B69: 013407 | C69: Vương Văn Tiến | D69: NV Lái xe - VHTTB | E69: 19028973518014 | F69: =RC[29]+RC[30]+RC[31]+RC[32]+RC[33]+RC[34]+RC[35]+RC[36]+RC[37] -> 720000 | G69: =RC[17]+RC[18]++RC[19]+RC[20]+RC[21]+RC[38]+RC[39]+RC[41] -> 0 | H69: 0 | I69: 0 | J69: =RC[-2]+RC[-1] -> 0 | K69: 0 | L69: 0 | M69: 0 | N69: =RC[15]+RC[16]+RC[17]+RC[18]+RC[19]+RC[20] -> 0 | O69: 0 | P69: 0 | Q69: 720000 | R69: 0 | S69: 0 | T69: 0 | U69: 7200 | V69: 0 | W69: 712800 | X69: 0 | Y69: 0 | Z69: 0 | AA69: 0 | AB69: 0 | AC69: 0 | AD69: 0 | AE69: 0 | AF69: 0 | AG69: 0 | AH69: 0 | AI69: 720000 | AJ69: 0 | AK69: 0 | AL69: 0 | AM69: 0 | AN69: 0 | AO69: 0 | AP69: 0 | AQ69: 0 | AR69: =1 -> 1 | AS69: 0 | AT69: 0 | AU69: =RC[-30]-RC[-29]-RC[-28]-RC[-27]-RC[-26]-RC[-25] -> 712800 | AV69: 0 | AW69: =RC[1]-RC[2] -> 0 | AX69: 0 | AY69: 0 | AZ69: =RC[-46] -> 720000 | BA69: =RC[-46] -> 0 | BB69: =RC[-46] -> 0 | BC69: =RC[-46] -> 0 | BD69: =RC[-46] -> 0 | BE69: =RC[-46] -> 0 | BF69: =RC[-46] -> 0 | BG69: =RC[-46] -> 0 | BH69: =RC[-46] -> 0 | BI69: =RC[-46] -> 0 | BJ69: =RC[-46] -> 0 | BK69: =RC[-46] -> 720000 | BL69: =RC[-46] -> 0 | BM69: =RC[-46] -> 0 | BN69: =RC[-46] -> 0 | BO69: =RC[-46] -> 7200 | BP69: =RC[-46] -> 0 | BQ69: =RC[-46] -> 712800 | BR69: =RC[-46] -> 0 | BS69: =RC[-46] -> 0 | BT69: =RC[-46] -> 0 | BU69: =RC[-46] -> 0 | BV69: =RC[-46] -> 0 | BW69: =RC[-46] -> 0 | BX69: =RC[-46] -> 0 | BY69: =RC[-46] -> 0 | BZ69: =RC[-46] -> 0 | CA69: =RC[-46] -> 0 | CB69: =RC[-46] -> 0 | CC69: =RC[-46] -> 720000 | CD69: =RC[-46] -> 0 | CE69: =RC[-46] -> 0 | CF69: =RC[-46] -> 0 | CG69: =RC[-46] -> 0 | CH69: =RC[-46] -> 0 | CI69: =RC[-46] -> 0 | CJ69: =RC[-46] -> 0 | CK69: =RC[-46] -> 0 | CL69: =RC[-46] -> 1 | CM69: =RC[-46] -> 0 | CN69: =RC[-46] -> 0 | CO69: =RC[-46] -> 712800 | CP69: =RC[-46] -> 0 | CQ69: =RC[-46] -> 0 | CR69: =RC[-46] -> 0 | CS69: =RC[-46] -> 0
A70: 22 | B70: 013408 | C70: Nguyễn Phương Thắng | D70: NV Lái xe - VHTTB | E70: 19028960268019 | F70: =RC[29]+RC[30]+RC[31]+RC[32]+RC[33]+RC[34]+RC[35]+RC[36]+RC[37] -> 720000 | G70: =RC[17]+RC[18]++RC[19]+RC[20]+RC[21]+RC[38]+RC[39]+RC[41] -> 0 | H70: 0 | I70: 0 | J70: =RC[-2]+RC[-1] -> 0 | K70: 0 | L70: 0 | M70: 0 | N70: =RC[15]+RC[16]+RC[17]+RC[18]+RC[19]+RC[20] -> 0 | O70: 0 | P70: 0 | Q70: 720000 | R70: 0 | S70: 0 | T70: 0 | U70: 7200 | V70: 0 | W70: 712800 | X70: 0 | Y70: 0 | Z70: 0 | AA70: 0 | AB70: 0 | AC70: 0 | AD70: 0 | AE70: 0 | AF70: 0 | AG70: 0 | AH70: 0 | AI70: 720000 | AJ70: 0 | AK70: 0 | AL70: 0 | AM70: 0 | AN70: 0 | AO70: 0 | AP70: 0 | AQ70: 0 | AR70: =1 -> 1 | AS70: 0 | AT70: 0 | AU70: =RC[-30]-RC[-29]-RC[-28]-RC[-27]-RC[-26]-RC[-25] -> 712800 | AV70: 0 | AW70: =RC[1]-RC[2] -> 0 | AX70: 0 | AY70: 0 | AZ70: =RC[-46] -> 720000 | BA70: =RC[-46] -> 0 | BB70: =RC[-46] -> 0 | BC70: =RC[-46] -> 0 | BD70: =RC[-46] -> 0 | BE70: =RC[-46] -> 0 | BF70: =RC[-46] -> 0 | BG70: =RC[-46] -> 0 | BH70: =RC[-46] -> 0 | BI70: =RC[-46] -> 0 | BJ70: =RC[-46] -> 0 | BK70: =RC[-46] -> 720000 | BL70: =RC[-46] -> 0 | BM70: =RC[-46] -> 0 | BN70: =RC[-46] -> 0 | BO70: =RC[-46] -> 7200 | BP70: =RC[-46] -> 0 | BQ70: =RC[-46] -> 712800 | BR70: =RC[-46] -> 0 | BS70: =RC[-46] -> 0 | BT70: =RC[-46] -> 0 | BU70: =RC[-46] -> 0 | BV70: =RC[-46] -> 0 | BW70: =RC[-46] -> 0 | BX70: =RC[-46] -> 0 | BY70: =RC[-46] -> 0 | BZ70: =RC[-46] -> 0 | CA70: =RC[-46] -> 0 | CB70: =RC[-46] -> 0 | CC70: =RC[-46] -> 720000 | CD70: =RC[-46] -> 0 | CE70: =RC[-46] -> 0 | CF70: =RC[-46] -> 0 | CG70: =RC[-46] -> 0 | CH70: =RC[-46] -> 0 | CI70: =RC[-46] -> 0 | CJ70: =RC[-46] -> 0 | CK70: =RC[-46] -> 0 | CL70: =RC[-46] -> 1 | CM70: =RC[-46] -> 0 | CN70: =RC[-46] -> 0 | CO70: =RC[-46] -> 712800 | CP70: =RC[-46] -> 0 | CQ70: =RC[-46] -> 0 | CR70: =RC[-46] -> 0 | CS70: =RC[-46] -> 0
A71: 23 | B71: 013409 | C71: Lê Tuấn Anh | D71: NV Lái xe - VHTTB | E71: 19026625319021 | F71: =RC[29]+RC[30]+RC[31]+RC[32]+RC[33]+RC[34]+RC[35]+RC[36]+RC[37] -> 720000 | G71: =RC[17]+RC[18]++RC[19]+RC[20]+RC[21]+RC[38]+RC[39]+RC[41] -> 0 | H71: 0 | I71: 0 | J71: =RC[-2]+RC[-1] -> 0 | K71: 0 | L71: 0 | M71: 0 | N71: =RC[15]+RC[16]+RC[17]+RC[18]+RC[19]+RC[20] -> 0 | O71: 0 | P71: 0 | Q71: 720000 | R71: 0 | S71: 0 | T71: 0 | U71: 7200 | V71: 0 | W71: 712800 | X71: 0 | Y71: 0 | Z71: 0 | AA71: 0 | AB71: 0 | AC71: 0 | AD71: 0 | AE71: 0 | AF71: 0 | AG71: 0 | AH71: 0 | AI71: 720000 | AJ71: 0 | AK71: 0 | AL71: 0 | AM71: 0 | AN71: 0 | AO71: 0 | AP71: 0 | AQ71: 0 | AR71: =1 -> 1 | AS71: 0 | AT71: 0 | AU71: =RC[-30]-RC[-29]-RC[-28]-RC[-27]-RC[-26]-RC[-25] -> 712800 | AV71: 0 | AW71: =RC[1]-RC[2] -> 0 | AX71: 0 | AY71: 0 | AZ71: =RC[-46] -> 720000 | BA71: =RC[-46] -> 0 | BB71: =RC[-46] -> 0 | BC71: =RC[-46] -> 0 | BD71: =RC[-46] -> 0 | BE71: =RC[-46] -> 0 | BF71: =RC[-46] -> 0 | BG71: =RC[-46] -> 0 | BH71: =RC[-46] -> 0 | BI71: =RC[-46] -> 0 | BJ71: =RC[-46] -> 0 | BK71: =RC[-46] -> 720000 | BL71: =RC[-46] -> 0 | BM71: =RC[-46] -> 0 | BN71: =RC[-46] -> 0 | BO71: =RC[-46] -> 7200 | BP71: =RC[-46] -> 0 | BQ71: =RC[-46] -> 712800 | BR71: =RC[-46] -> 0 | BS71: =RC[-46] -> 0 | BT71: =RC[-46] -> 0 | BU71: =RC[-46] -> 0 | BV71: =RC[-46] -> 0 | BW71: =RC[-46] -> 0 | BX71: =RC[-46] -> 0 | BY71: =RC[-46] -> 0 | BZ71: =RC[-46] -> 0 | CA71: =RC[-46] -> 0 | CB71: =RC[-46] -> 0 | CC71: =RC[-46] -> 720000 | CD71: =RC[-46] -> 0 | CE71: =RC[-46] -> 0 | CF71: =RC[-46] -> 0 | CG71: =RC[-46] -> 0 | CH71: =RC[-46] -> 0 | CI71: =RC[-46] -> 0 | CJ71: =RC[-46] -> 0 | CK71: =RC[-46] -> 0 | CL71: =RC[-46] -> 1 | CM71: =RC[-46] -> 0 | CN71: =RC[-46] -> 0 | CO71: =RC[-46] -> 712800 | CP71: =RC[-46] -> 0 | CQ71: =RC[-46] -> 0 | CR71: =RC[-46] -> 0 | CS71: =RC[-46] -> 0
A72: 24 | B72: 013410 | C72: Đoàn Văn Phương | D72: NV Lái xe - VHTTB | E72: 19028960279010 | F72: =RC[29]+RC[30]+RC[31]+RC[32]+RC[33]+RC[34]+RC[35]+RC[36]+RC[37] -> 720000 | G72: =RC[17]+RC[18]++RC[19]+RC[20]+RC[21]+RC[38]+RC[39]+RC[41] -> 0 | H72: 0 | I72: 0 | J72: =RC[-2]+RC[-1] -> 0 | K72: 0 | L72: 0 | M72: 0 | N72: =RC[15]+RC[16]+RC[17]+RC[18]+RC[19]+RC[20] -> 0 | O72: 0 | P72: 0 | Q72: 720000 | R72: 0 | S72: 0 | T72: 0 | U72: 7200 | V72: 0 | W72: 712800 | X72: 0 | Y72: 0 | Z72: 0 | AA72: 0 | AB72: 0 | AC72: 0 | AD72: 0 | AE72: 0 | AF72: 0 | AG72: 0 | AH72: 0 | AI72: 720000 | AJ72: 0 | AK72: 0 | AL72: 0 | AM72: 0 | AN72: 0 | AO72: 0 | AP72: 0 | AQ72: 0 | AR72: =1 -> 1 | AS72: 0 | AT72: 0 | AU72: =RC[-30]-RC[-29]-RC[-28]-RC[-27]-RC[-26]-RC[-25] -> 712800 | AV72: 0 | AW72: =RC[1]-RC[2] -> 0 | AX72: 0 | AY72: 0 | AZ72: =RC[-46] -> 720000 | BA72: =RC[-46] -> 0 | BB72: =RC[-46] -> 0 | BC72: =RC[-46] -> 0 | BD72: =RC[-46] -> 0 | BE72: =RC[-46] -> 0 | BF72: =RC[-46] -> 0 | BG72: =RC[-46] -> 0 | BH72: =RC[-46] -> 0 | BI72: =RC[-46] -> 0 | BJ72: =RC[-46] -> 0 | BK72: =RC[-46] -> 720000 | BL72: =RC[-46] -> 0 | BM72: =RC[-46] -> 0 | BN72: =RC[-46] -> 0 | BO72: =RC[-46] -> 7200 | BP72: =RC[-46] -> 0 | BQ72: =RC[-46] -> 712800 | BR72: =RC[-46] -> 0 | BS72: =RC[-46] -> 0 | BT72: =RC[-46] -> 0 | BU72: =RC[-46] -> 0 | BV72: =RC[-46] -> 0 | BW72: =RC[-46] -> 0 | BX72: =RC[-46] -> 0 | BY72: =RC[-46] -> 0 | BZ72: =RC[-46] -> 0 | CA72: =RC[-46] -> 0 | CB72: =RC[-46] -> 0 | CC72: =RC[-46] -> 720000 | CD72: =RC[-46] -> 0 | CE72: =RC[-46] -> 0 | CF72: =RC[-46] -> 0 | CG72: =RC[-46] -> 0 | CH72: =RC[-46] -> 0 | CI72: =RC[-46] -> 0 | CJ72: =RC[-46] -> 0 | CK72: =RC[-46] -> 0 | CL72: =RC[-46] -> 1 | CM72: =RC[-46] -> 0 | CN72: =RC[-46] -> 0 | CO72: =RC[-46] -> 712800 | CP72: =RC[-46] -> 0 | CQ72: =RC[-46] -> 0 | CR72: =RC[-46] -> 0 | CS72: =RC[-46] -> 0
A73: 25 | B73: 013411 | C73: Nguyễn Văn Hà | D73: NV Lái xe - VHTTB | E73: 19028960239019 | F73: =RC[29]+RC[30]+RC[31]+RC[32]+RC[33]+RC[34]+RC[35]+RC[36]+RC[37] -> 720000 | G73: =RC[17]+RC[18]++RC[19]+RC[20]+RC[21]+RC[38]+RC[39]+RC[41] -> 0 | H73: 0 | I73: 0 | J73: =RC[-2]+RC[-1] -> 0 | K73: 0 | L73: 0 | M73: 0 | N73: =RC[15]+RC[16]+RC[17]+RC[18]+RC[19]+RC[20] -> 0 | O73: 0 | P73: 0 | Q73: 720000 | R73: 0 | S73: 0 | T73: 0 | U73: 7200 | V73: 0 | W73: 712800 | X73: 0 | Y73: 0 | Z73: 0 | AA73: 0 | AB73: 0 | AC73: 0 | AD73: 0 | AE73: 0 | AF73: 0 | AG73: 0 | AH73: 0 | AI73: 720000 | AJ73: 0 | AK73: 0 | AL73: 0 | AM73: 0 | AN73: 0 | AO73: 0 | AP73: 0 | AQ73: 0 | AR73: =1 -> 1 | AS73: 0 | AT73: 0 | AU73: =RC[-30]-RC[-29]-RC[-28]-RC[-27]-RC[-26]-RC[-25] -> 712800 | AV73: 0 | AW73: =RC[1]-RC[2] -> 0 | AX73: 0 | AY73: 0 | AZ73: =RC[-46] -> 720000 | BA73: =RC[-46] -> 0 | BB73: =RC[-46] -> 0 | BC73: =RC[-46] -> 0 | BD73: =RC[-46] -> 0 | BE73: =RC[-46] -> 0 | BF73: =RC[-46] -> 0 | BG73: =RC[-46] -> 0 | BH73: =RC[-46] -> 0 | BI73: =RC[-46] -> 0 | BJ73: =RC[-46] -> 0 | BK73: =RC[-46] -> 720000 | BL73: =RC[-46] -> 0 | BM73: =RC[-46] -> 0 | BN73: =RC[-46] -> 0 | BO73: =RC[-46] -> 7200 | BP73: =RC[-46] -> 0 | BQ73: =RC[-46] -> 712800 | BR73: =RC[-46] -> 0 | BS73: =RC[-46] -> 0 | BT73: =RC[-46] -> 0 | BU73: =RC[-46] -> 0 | BV73: =RC[-46] -> 0 | BW73: =RC[-46] -> 0 | BX73: =RC[-46] -> 0 | BY73: =RC[-46] -> 0 | BZ73: =RC[-46] -> 0 | CA73: =RC[-46] -> 0 | CB73: =RC[-46] -> 0 | CC73: =RC[-46] -> 720000 | CD73: =RC[-46] -> 0 | CE73: =RC[-46] -> 0 | CF73: =RC[-46] -> 0 | CG73: =RC[-46] -> 0 | CH73: =RC[-46] -> 0 | CI73: =RC[-46] -> 0 | CJ73: =RC[-46] -> 0 | CK73: =RC[-46] -> 0 | CL73: =RC[-46] -> 1 | CM73: =RC[-46] -> 0 | CN73: =RC[-46] -> 0 | CO73: =RC[-46] -> 712800 | CP73: =RC[-46] -> 0 | CQ73: =RC[-46] -> 0 | CR73: =RC[-46] -> 0 | CS73: =RC[-46] -> 0
A74: 26 | B74: 013412 | C74: Nguyễn Mạnh Hiếu | D74: NV Lái xe - VHTTB | E74: 19023520863010 | F74: =RC[29]+RC[30]+RC[31]+RC[32]+RC[33]+RC[34]+RC[35]+RC[36]+RC[37] -> 720000 | G74: =RC[17]+RC[18]++RC[19]+RC[20]+RC[21]+RC[38]+RC[39]+RC[41] -> 0 | H74: 0 | I74: 0 | J74: =RC[-2]+RC[-1] -> 0 | K74: 0 | L74: 0 | M74: 0 | N74: =RC[15]+RC[16]+RC[17]+RC[18]+RC[19]+RC[20] -> 0 | O74: 0 | P74: 0 | Q74: 720000 | R74: 0 | S74: 0 | T74: 0 | U74: 7200 | V74: 0 | W74: 712800 | X74: 0 | Y74: 0 | Z74: 0 | AA74: 0 | AB74: 0 | AC74: 0 | AD74: 0 | AE74: 0 | AF74: 0 | AG74: 0 | AH74: 0 | AI74: 720000 | AJ74: 0 | AK74: 0 | AL74: 0 | AM74: 0 | AN74: 0 | AO74: 0 | AP74: 0 | AQ74: 0 | AR74: =1 -> 1 | AS74: 0 | AT74: 0 | AU74: =RC[-30]-RC[-29]-RC[-28]-RC[-27]-RC[-26]-RC[-25] -> 712800 | AV74: 0 | AW74: =RC[1]-RC[2] -> 0 | AX74: 0 | AY74: 0 | AZ74: =RC[-46] -> 720000 | BA74: =RC[-46] -> 0 | BB74: =RC[-46] -> 0 | BC74: =RC[-46] -> 0 | BD74: =RC[-46] -> 0 | BE74: =RC[-46] -> 0 | BF74: =RC[-46] -> 0 | BG74: =RC[-46] -> 0 | BH74: =RC[-46] -> 0 | BI74: =RC[-46] -> 0 | BJ74: =RC[-46] -> 0 | BK74: =RC[-46] -> 720000 | BL74: =RC[-46] -> 0 | BM74: =RC[-46] -> 0 | BN74: =RC[-46] -> 0 | BO74: =RC[-46] -> 7200 | BP74: =RC[-46] -> 0 | BQ74: =RC[-46] -> 712800 | BR74: =RC[-46] -> 0 | BS74: =RC[-46] -> 0 | BT74: =RC[-46] -> 0 | BU74: =RC[-46] -> 0 | BV74: =RC[-46] -> 0 | BW74: =RC[-46] -> 0 | BX74: =RC[-46] -> 0 | BY74: =RC[-46] -> 0 | BZ74: =RC[-46] -> 0 | CA74: =RC[-46] -> 0 | CB74: =RC[-46] -> 0 | CC74: =RC[-46] -> 720000 | CD74: =RC[-46] -> 0 | CE74: =RC[-46] -> 0 | CF74: =RC[-46] -> 0 | CG74: =RC[-46] -> 0 | CH74: =RC[-46] -> 0 | CI74: =RC[-46] -> 0 | CJ74: =RC[-46] -> 0 | CK74: =RC[-46] -> 0 | CL74: =RC[-46] -> 1 | CM74: =RC[-46] -> 0 | CN74: =RC[-46] -> 0 | CO74: =RC[-46] -> 712800 | CP74: =RC[-46] -> 0 | CQ74: =RC[-46] -> 0 | CR74: =RC[-46] -> 0 | CS74: =RC[-46] -> 0
A75: 27 | B75: 013413 | C75: Vũ Việt Hùng | D75: NV Lái xe - VHTTB | E75: 19023520871013 | F75: =RC[29]+RC[30]+RC[31]+RC[32]+RC[33]+RC[34]+RC[35]+RC[36]+RC[37] -> 720000 | G75: =RC[17]+RC[18]++RC[19]+RC[20]+RC[21]+RC[38]+RC[39]+RC[41] -> 0 | H75: 0 | I75: 0 | J75: =RC[-2]+RC[-1] -> 0 | K75: 0 | L75: 0 | M75: 0 | N75: =RC[15]+RC[16]+RC[17]+RC[18]+RC[19]+RC[20] -> 0 | O75: 0 | P75: 0 | Q75: 720000 | R75: 0 | S75: 0 | T75: 0 | U75: 7200 | V75: 0 | W75: 712800 | X75: 0 | Y75: 0 | Z75: 0 | AA75: 0 | AB75: 0 | AC75: 0 | AD75: 0 | AE75: 0 | AF75: 0 | AG75: 0 | AH75: 0 | AI75: 720000 | AJ75: 0 | AK75: 0 | AL75: 0 | AM75: 0 | AN75: 0 | AO75: 0 | AP75: 0 | AQ75: 0 | AR75: =1 -> 1 | AS75: 0 | AT75: 0 | AU75: =RC[-30]-RC[-29]-RC[-28]-RC[-27]-RC[-26]-RC[-25] -> 712800 | AV75: 0 | AW75: =RC[1]-RC[2] -> 0 | AX75: 0 | AY75: 0 | AZ75: =RC[-46] -> 720000 | BA75: =RC[-46] -> 0 | BB75: =RC[-46] -> 0 | BC75: =RC[-46] -> 0 | BD75: =RC[-46] -> 0 | BE75: =RC[-46] -> 0 | BF75: =RC[-46] -> 0 | BG75: =RC[-46] -> 0 | BH75: =RC[-46] -> 0 | BI75: =RC[-46] -> 0 | BJ75: =RC[-46] -> 0 | BK75: =RC[-46] -> 720000 | BL75: =RC[-46] -> 0 | BM75: =RC[-46] -> 0 | BN75: =RC[-46] -> 0 | BO75: =RC[-46] -> 7200 | BP75: =RC[-46] -> 0 | BQ75: =RC[-46] -> 712800 | BR75: =RC[-46] -> 0 | BS75: =RC[-46] -> 0 | BT75: =RC[-46] -> 0 | BU75: =RC[-46] -> 0 | BV75: =RC[-46] -> 0 | BW75: =RC[-46] -> 0 | BX75: =RC[-46] -> 0 | BY75: =RC[-46] -> 0 | BZ75: =RC[-46] -> 0 | CA75: =RC[-46] -> 0 | CB75: =RC[-46] -> 0 | CC75: =RC[-46] -> 720000 | CD75: =RC[-46] -> 0 | CE75: =RC[-46] -> 0 | CF75: =RC[-46] -> 0 | CG75: =RC[-46] -> 0 | CH75: =RC[-46] -> 0 | CI75: =RC[-46] -> 0 | CJ75: =RC[-46] -> 0 | CK75: =RC[-46] -> 0 | CL75: =RC[-46] -> 1 | CM75: =RC[-46] -> 0 | CN75: =RC[-46] -> 0 | CO75: =RC[-46] -> 712800 | CP75: =RC[-46] -> 0 | CQ75: =RC[-46] -> 0 | CR75: =RC[-46] -> 0 | CS75: =RC[-46] -> 0
A76: 28 | B76: 013414 | C76: Lê Hữu Hóa | D76: NV Lái xe - VHTTB | E76: 19028960282011 | F76: =RC[29]+RC[30]+RC[31]+RC[32]+RC[33]+RC[34]+RC[35]+RC[36]+RC[37] -> 720000 | G76: =RC[17]+RC[18]++RC[19]+RC[20]+RC[21]+RC[38]+RC[39]+RC[41] -> 0 | H76: 0 | I76: 0 | J76: =RC[-2]+RC[-1] -> 0 | K76: 0 | L76: 0 | M76: 0 | N76: =RC[15]+RC[16]+RC[17]+RC[18]+RC[19]+RC[20] -> 0 | O76: 0 | P76: 0 | Q76: 720000 | R76: 0 | S76: 0 | T76: 0 | U76: 7200 | V76: 0 | W76: 712800 | X76: 0 | Y76: 0 | Z76: 0 | AA76: 0 | AB76: 0 | AC76: 0 | AD76: 0 | AE76: 0 | AF76: 0 | AG76: 0 | AH76: 0 | AI76: 720000 | AJ76: 0 | AK76: 0 | AL76: 0 | AM76: 0 | AN76: 0 | AO76: 0 | AP76: 0 | AQ76: 0 | AR76: =1 -> 1 | AS76: 0 | AT76: 0 | AU76: =RC[-30]-RC[-29]-RC[-28]-RC[-27]-RC[-26]-RC[-25] -> 712800 | AV76: 0 | AW76: =RC[1]-RC[2] -> 0 | AX76: 0 | AY76: 0 | AZ76: =RC[-46] -> 720000 | BA76: =RC[-46] -> 0 | BB76: =RC[-46] -> 0 | BC76: =RC[-46] -> 0 | BD76: =RC[-46] -> 0 | BE76: =RC[-46] -> 0 | BF76: =RC[-46] -> 0 | BG76: =RC[-46] -> 0 | BH76: =RC[-46] -> 0 | BI76: =RC[-46] -> 0 | BJ76: =RC[-46] -> 0 | BK76: =RC[-46] -> 720000 | BL76: =RC[-46] -> 0 | BM76: =RC[-46] -> 0 | BN76: =RC[-46] -> 0 | BO76: =RC[-46] -> 7200 | BP76: =RC[-46] -> 0 | BQ76: =RC[-46] -> 712800 | BR76: =RC[-46] -> 0 | BS76: =RC[-46] -> 0 | BT76: =RC[-46] -> 0 | BU76: =RC[-46] -> 0 | BV76: =RC[-46] -> 0 | BW76: =RC[-46] -> 0 | BX76: =RC[-46] -> 0 | BY76: =RC[-46] -> 0 | BZ76: =RC[-46] -> 0 | CA76: =RC[-46] -> 0 | CB76: =RC[-46] -> 0 | CC76: =RC[-46] -> 720000 | CD76: =RC[-46] -> 0 | CE76: =RC[-46] -> 0 | CF76: =RC[-46] -> 0 | CG76: =RC[-46] -> 0 | CH76: =RC[-46] -> 0 | CI76: =RC[-46] -> 0 | CJ76: =RC[-46] -> 0 | CK76: =RC[-46] -> 0 | CL76: =RC[-46] -> 1 | CM76: =RC[-46] -> 0 | CN76: =RC[-46] -> 0 | CO76: =RC[-46] -> 712800 | CP76: =RC[-46] -> 0 | CQ76: =RC[-46] -> 0 | CR76: =RC[-46] -> 0 | CS76: =RC[-46] -> 0
A77: 29 | B77: 013415 | C77: Đinh Văn Duyên | D77: NV Lái xe - VHTTB | E77: 19028960226014 | F77: =RC[29]+RC[30]+RC[31]+RC[32]+RC[33]+RC[34]+RC[35]+RC[36]+RC[37] -> 720000 | G77: =RC[17]+RC[18]++RC[19]+RC[20]+RC[21]+RC[38]+RC[39]+RC[41] -> 0 | H77: 0 | I77: 0 | J77: =RC[-2]+RC[-1] -> 0 | K77: 0 | L77: 0 | M77: 0 | N77: =RC[15]+RC[16]+RC[17]+RC[18]+RC[19]+RC[20] -> 0 | O77: 0 | P77: 0 | Q77: 720000 | R77: 0 | S77: 0 | T77: 0 | U77: 7200 | V77: 0 | W77: 712800 | X77: 0 | Y77: 0 | Z77: 0 | AA77: 0 | AB77: 0 | AC77: 0 | AD77: 0 | AE77: 0 | AF77: 0 | AG77: 0 | AH77: 0 | AI77: 720000 | AJ77: 0 | AK77: 0 | AL77: 0 | AM77: 0 | AN77: 0 | AO77: 0 | AP77: 0 | AQ77: 0 | AR77: =1 -> 1 | AS77: 0 | AT77: 0 | AU77: =RC[-30]-RC[-29]-RC[-28]-RC[-27]-RC[-26]-RC[-25] -> 712800 | AV77: 0 | AW77: =RC[1]-RC[2] -> 0 | AX77: 0 | AY77: 0 | AZ77: =RC[-46] -> 720000 | BA77: =RC[-46] -> 0 | BB77: =RC[-46] -> 0 | BC77: =RC[-46] -> 0 | BD77: =RC[-46] -> 0 | BE77: =RC[-46] -> 0 | BF77: =RC[-46] -> 0 | BG77: =RC[-46] -> 0 | BH77: =RC[-46] -> 0 | BI77: =RC[-46] -> 0 | BJ77: =RC[-46] -> 0 | BK77: =RC[-46] -> 720000 | BL77: =RC[-46] -> 0 | BM77: =RC[-46] -> 0 | BN77: =RC[-46] -> 0 | BO77: =RC[-46] -> 7200 | BP77: =RC[-46] -> 0 | BQ77: =RC[-46] -> 712800 | BR77: =RC[-46] -> 0 | BS77: =RC[-46] -> 0 | BT77: =RC[-46] -> 0 | BU77: =RC[-46] -> 0 | BV77: =RC[-46] -> 0 | BW77: =RC[-46] -> 0 | BX77: =RC[-46] -> 0 | BY77: =RC[-46] -> 0 | BZ77: =RC[-46] -> 0 | CA77: =RC[-46] -> 0 | CB77: =RC[-46] -> 0 | CC77: =RC[-46] -> 720000 | CD77: =RC[-46] -> 0 | CE77: =RC[-46] -> 0 | CF77: =RC[-46] -> 0 | CG77: =RC[-46] -> 0 | CH77: =RC[-46] -> 0 | CI77: =RC[-46] -> 0 | CJ77: =RC[-46] -> 0 | CK77: =RC[-46] -> 0 | CL77: =RC[-46] -> 1 | CM77: =RC[-46] -> 0 | CN77: =RC[-46] -> 0 | CO77: =RC[-46] -> 712800 | CP77: =RC[-46] -> 0 | CQ77: =RC[-46] -> 0 | CR77: =RC[-46] -> 0 | CS77: =RC[-46] -> 0
A78: 30 | B78: 013530 | C78: Lương Văn Dư | D78: NV Lái xe - VHTTB | E78: 19021243324015 | F78: =RC[29]+RC[30]+RC[31]+RC[32]+RC[33]+RC[34]+RC[35]+RC[36]+RC[37] -> 720000 | G78: =RC[17]+RC[18]++RC[19]+RC[20]+RC[21]+RC[38]+RC[39]+RC[41] -> 0 | H78: 0 | I78: 0 | J78: =RC[-2]+RC[-1] -> 0 | K78: 0 | L78: 0 | M78: 0 | N78: =RC[15]+RC[16]+RC[17]+RC[18]+RC[19]+RC[20] -> 0 | O78: 0 | P78: 0 | Q78: 720000 | R78: 0 | S78: 0 | T78: 0 | U78: 7200 | V78: 0 | W78: 712800 | X78: 0 | Y78: 0 | Z78: 0 | AA78: 0 | AB78: 0 | AC78: 0 | AD78: 0 | AE78: 0 | AF78: 0 | AG78: 0 | AH78: 0 | AI78: 720000 | AJ78: 0 | AK78: 0 | AL78: 0 | AM78: 0 | AN78: 0 | AO78: 0 | AP78: 0 | AQ78: 0 | AR78: =1 -> 1 | AS78: 0 | AT78: 0 | AU78: =RC[-30]-RC[-29]-RC[-28]-RC[-27]-RC[-26]-RC[-25] -> 712800 | AV78: 0 | AW78: =RC[1]-RC[2] -> 0 | AX78: 0 | AY78: 0 | AZ78: =RC[-46] -> 720000 | BA78: =RC[-46] -> 0 | BB78: =RC[-46] -> 0 | BC78: =RC[-46] -> 0 | BD78: =RC[-46] -> 0 | BE78: =RC[-46] -> 0 | BF78: =RC[-46] -> 0 | BG78: =RC[-46] -> 0 | BH78: =RC[-46] -> 0 | BI78: =RC[-46] -> 0 | BJ78: =RC[-46] -> 0 | BK78: =RC[-46] -> 720000 | BL78: =RC[-46] -> 0 | BM78: =RC[-46] -> 0 | BN78: =RC[-46] -> 0 | BO78: =RC[-46] -> 7200 | BP78: =RC[-46] -> 0 | BQ78: =RC[-46] -> 712800 | BR78: =RC[-46] -> 0 | BS78: =RC[-46] -> 0 | BT78: =RC[-46] -> 0 | BU78: =RC[-46] -> 0 | BV78: =RC[-46] -> 0 | BW78: =RC[-46] -> 0 | BX78: =RC[-46] -> 0 | BY78: =RC[-46] -> 0 | BZ78: =RC[-46] -> 0 | CA78: =RC[-46] -> 0 | CB78: =RC[-46] -> 0 | CC78: =RC[-46] -> 720000 | CD78: =RC[-46] -> 0 | CE78: =RC[-46] -> 0 | CF78: =RC[-46] -> 0 | CG78: =RC[-46] -> 0 | CH78: =RC[-46] -> 0 | CI78: =RC[-46] -> 0 | CJ78: =RC[-46] -> 0 | CK78: =RC[-46] -> 0 | CL78: =RC[-46] -> 1 | CM78: =RC[-46] -> 0 | CN78: =RC[-46] -> 0 | CO78: =RC[-46] -> 712800 | CP78: =RC[-46] -> 0 | CQ78: =RC[-46] -> 0 | CR78: =RC[-46] -> 0 | CS78: =RC[-46] -> 0
A79: 31 | B79: 013529 | C79: Cao Thế Vĩnh | D79: NV Thủ tục bay, không báo | E79: 10520632990016 | F79: =RC[29]+RC[30]+RC[31]+RC[32]+RC[33]+RC[34]+RC[35]+RC[36]+RC[37] -> 720000 | G79: =RC[17]+RC[18]++RC[19]+RC[20]+RC[21]+RC[38]+RC[39]+RC[41] -> 0 | H79: 0 | I79: 0 | J79: =RC[-2]+RC[-1] -> 0 | K79: 0 | L79: 0 | M79: 0 | N79: =RC[15]+RC[16]+RC[17]+RC[18]+RC[19]+RC[20] -> 0 | O79: 0 | P79: 0 | Q79: 720000 | R79: 0 | S79: 0 | T79: 0 | U79: 7200 | V79: 0 | W79: 712800 | X79: 0 | Y79: 0 | Z79: 0 | AA79: 0 | AB79: 0 | AC79: 0 | AD79: 0 | AE79: 0 | AF79: 0 | AG79: 0 | AH79: 0 | AI79: 720000 | AJ79: 0 | AK79: 0 | AL79: 0 | AM79: 0 | AN79: 0 | AO79: 0 | AP79: 0 | AQ79: 0 | AR79: =1 -> 1 | AS79: 0 | AT79: 0 | AU79: =RC[-30]-RC[-29]-RC[-28]-RC[-27]-RC[-26]-RC[-25] -> 712800 | AV79: 0 | AW79: =RC[1]-RC[2] -> 0 | AX79: 0 | AY79: 0 | AZ79: =RC[-46] -> 720000 | BA79: =RC[-46] -> 0 | BB79: =RC[-46] -> 0 | BC79: =RC[-46] -> 0 | BD79: =RC[-46] -> 0 | BE79: =RC[-46] -> 0 | BF79: =RC[-46] -> 0 | BG79: =RC[-46] -> 0 | BH79: =RC[-46] -> 0 | BI79: =RC[-46] -> 0 | BJ79: =RC[-46] -> 0 | BK79: =RC[-46] -> 720000 | BL79: =RC[-46] -> 0 | BM79: =RC[-46] -> 0 | BN79: =RC[-46] -> 0 | BO79: =RC[-46] -> 7200 | BP79: =RC[-46] -> 0 | BQ79: =RC[-46] -> 712800 | BR79: =RC[-46] -> 0 | BS79: =RC[-46] -> 0 | BT79: =RC[-46] -> 0 | BU79: =RC[-46] -> 0 | BV79: =RC[-46] -> 0 | BW79: =RC[-46] -> 0 | BX79: =RC[-46] -> 0 | BY79: =RC[-46] -> 0 | BZ79: =RC[-46] -> 0 | CA79: =RC[-46] -> 0 | CB79: =RC[-46] -> 0 | CC79: =RC[-46] -> 720000 | CD79: =RC[-46] -> 0 | CE79: =RC[-46] -> 0 | CF79: =RC[-46] -> 0 | CG79: =RC[-46] -> 0 | CH79: =RC[-46] -> 0 | CI79: =RC[-46] -> 0 | CJ79: =RC[-46] -> 0 | CK79: =RC[-46] -> 0 | CL79: =RC[-46] -> 1 | CM79: =RC[-46] -> 0 | CN79: =RC[-46] -> 0 | CO79: =RC[-46] -> 712800 | CP79: =RC[-46] -> 0 | CQ79: =RC[-46] -> 0 | CR79: =RC[-46] -> 0 | CS79: =RC[-46] -> 0
A80: Đội phục vụ hành lý hàng hóa (HGS) | F80: =SUM(R[-31]C:R[-1]C) -> 22320000 | G80: =SUM(R[-31]C:R[-1]C) -> 0 | H80: =SUM(R[-31]C:R[-1]C) -> 0 | I80: =SUM(R[-31]C:R[-1]C) -> 0 | J80: =SUM(R[-31]C:R[-1]C) -> 0 | K80: =SUM(R[-31]C:R[-1]C) -> 0 | L80: =SUM(R[-31]C:R[-1]C) -> 0 | M80: =SUM(R[-31]C:R[-1]C) -> 0 | N80: =SUM(R[-31]C:R[-1]C) -> 0 | O80: =SUM(R[-31]C:R[-1]C) -> 0 | P80: =SUM(R[-31]C:R[-1]C) -> 0 | Q80: =SUM(R[-31]C:R[-1]C) -> 22320000 | R80: =SUM(R[-31]C:R[-1]C) -> 0 | S80: =SUM(R[-31]C:R[-1]C) -> 0 | T80: =SUM(R[-31]C:R[-1]C) -> 0 | U80: =SUM(R[-31]C:R[-1]C) -> 223200 | V80: =SUM(R[-31]C:R[-1]C) -> 0 | W80: =SUM(R[-31]C:R[-1]C) -> 22096800 | X80: =SUM(R[-31]C:R[-1]C) -> 0 | Y80: =SUM(R[-31]C:R[-1]C) -> 0 | Z80: =SUM(R[-31]C:R[-1]C) -> 0 | AA80: =SUM(R[-31]C:R[-1]C) -> 0 | AB80: =SUM(R[-31]C:R[-1]C) -> 0 | AC80: =SUM(R[-31]C:R[-1]C) -> 0 | AD80: =SUM(R[-31]C:R[-1]C) -> 0 | AE80: =SUM(R[-31]C:R[-1]C) -> 0 | AF80: =SUM(R[-31]C:R[-1]C) -> 0 | AG80: =SUM(R[-31]C:R[-1]C) -> 0 | AH80: =SUM(R[-31]C:R[-1]C) -> 0 | AI80: =SUM(R[-31]C:R[-1]C) -> 22320000 | AJ80: =SUM(R[-31]C:R[-1]C) -> 0 | AK80: =SUM(R[-31]C:R[-1]C) -> 0 | AL80: =SUM(R[-31]C:R[-1]C) -> 0 | AM80: =SUM(R[-31]C:R[-1]C) -> 0 | AN80: =SUM(R[-31]C:R[-1]C) -> 0 | AO80: =SUM(R[-31]C:R[-1]C) -> 0 | AP80: =SUM(R[-31]C:R[-1]C) -> 0 | AQ80: =SUM(R[-31]C:R[-1]C) -> 0 | AR80: =SUM(R[-31]C:R[-1]C) -> 31 | AS80: =SUM(R[-31]C:R[-1]C) -> 0 | AT80: =SUM(R[-31]C:R[-1]C) -> 0 | AU80: =SUM(R[-31]C:R[-1]C) -> 22096800 | AV80: =SUM(R[-31]C:R[-1]C) -> 0 | AW80: =SUM(R[-31]C:R[-1]C) -> 0 | AX80: =SUM(R[-31]C:R[-1]C) -> 0 | AY80: =SUM(R[-31]C:R[-1]C) -> 0
A81: Đội phục vụ tàu bay (HGS) | F81: =R[2]C -> 720000 | G81: =R[2]C -> 0 | H81: =R[2]C -> 0 | I81: =R[2]C -> 0 | J81: =R[2]C -> 0 | K81: =R[2]C -> 0 | L81: =R[2]C -> 0 | M81: =R[2]C -> 0 | N81: =R[2]C -> 0 | O81: =R[2]C -> 0 | P81: =R[2]C -> 0 | Q81: =R[2]C -> 720000 | R81: =R[2]C -> 0 | S81: =R[2]C -> 0 | T81: =R[2]C -> 0 | U81: =R[2]C -> 7200 | V81: =R[2]C -> 0 | W81: =R[2]C -> 712800 | X81: =R[2]C -> 0 | Y81: =R[2]C -> 0 | Z81: =R[2]C -> 0 | AA81: =R[2]C -> 0 | AB81: =R[2]C -> 0 | AC81: =R[2]C -> 0 | AD81: =R[2]C -> 0 | AE81: =R[2]C -> 0 | AF81: =R[2]C -> 0 | AG81: =R[2]C -> 0 | AH81: =R[2]C -> 0 | AI81: =R[2]C -> 720000 | AJ81: =R[2]C -> 0 | AK81: =R[2]C -> 0 | AL81: =R[2]C -> 0 | AM81: =R[2]C -> 0 | AN81: =R[2]C -> 0 | AO81: =R[2]C -> 0 | AP81: =R[2]C -> 0 | AQ81: =R[2]C -> 0 | AR81: =R[2]C -> 1 | AS81: =R[2]C -> 0 | AT81: =R[2]C -> 0 | AU81: =R[2]C -> 712800 | AW81: =R[2]C -> 0 | AX81: =R[2]C -> 0 | AY81: =R[2]C -> 0
A82: 1 | B82: 013531 | C82: Võ Thị Vân | D82: Nhân viên vệ sinh khu bay | E82: 19028960288011 | F82: =RC[29]+RC[30]+RC[31]+RC[32]+RC[33]+RC[34]+RC[35]+RC[36]+RC[37] -> 720000 | G82: =RC[17]+RC[18]++RC[19]+RC[20]+RC[21]+RC[38]+RC[39]+RC[41] -> 0 | H82: 0 | I82: 0 | J82: =RC[-2]+RC[-1] -> 0 | K82: 0 | L82: 0 | M82: 0 | N82: =RC[15]+RC[16]+RC[17]+RC[18]+RC[19]+RC[20] -> 0 | O82: 0 | P82: 0 | Q82: 720000 | R82: 0 | S82: 0 | T82: 0 | U82: 7200 | V82: 0 | W82: 712800 | X82: 0 | Y82: 0 | Z82: 0 | AA82: 0 | AB82: 0 | AC82: 0 | AD82: 0 | AE82: 0 | AF82: 0 | AG82: 0 | AH82: 0 | AI82: 720000 | AJ82: 0 | AK82: 0 | AL82: 0 | AM82: 0 | AN82: 0 | AO82: 0 | AP82: 0 | AQ82: 0 | AR82: =1 -> 1 | AS82: 0 | AT82: 0 | AU82: =RC[-30]-RC[-29]-RC[-28]-RC[-27]-RC[-26]-RC[-25] -> 712800 | AV82: 0 | AW82: =RC[1]-RC[2] -> 0 | AX82: 0 | AY82: 0 | AZ82: =RC[-46] -> 720000 | BA82: =RC[-46] -> 0 | BB82: =RC[-46] -> 0 | BC82: =RC[-46] -> 0 | BD82: =RC[-46] -> 0 | BE82: =RC[-46] -> 0 | BF82: =RC[-46] -> 0 | BG82: =RC[-46] -> 0 | BH82: =RC[-46] -> 0 | BI82: =RC[-46] -> 0 | BJ82: =RC[-46] -> 0 | BK82: =RC[-46] -> 720000 | BL82: =RC[-46] -> 0 | BM82: =RC[-46] -> 0 | BN82: =RC[-46] -> 0 | BO82: =RC[-46] -> 7200 | BP82: =RC[-46] -> 0 | BQ82: =RC[-46] -> 712800 | BR82: =RC[-46] -> 0 | BS82: =RC[-46] -> 0 | BT82: =RC[-46] -> 0 | BU82: =RC[-46] -> 0 | BV82: =RC[-46] -> 0 | BW82: =RC[-46] -> 0 | BX82: =RC[-46] -> 0 | BY82: =RC[-46] -> 0 | BZ82: =RC[-46] -> 0 | CA82: =RC[-46] -> 0 | CB82: =RC[-46] -> 0 | CC82: =RC[-46] -> 720000 | CD82: =RC[-46] -> 0 | CE82: =RC[-46] -> 0 | CF82: =RC[-46] -> 0 | CG82: =RC[-46] -> 0 | CH82: =RC[-46] -> 0 | CI82: =RC[-46] -> 0 | CJ82: =RC[-46] -> 0 | CK82: =RC[-46] -> 0 | CL82: =RC[-46] -> 1 | CM82: =RC[-46] -> 0 | CN82: =RC[-46] -> 0 | CO82: =RC[-46] -> 712800 | CP82: =RC[-46] -> 0 | CQ82: =RC[-46] -> 0 | CR82: =RC[-46] -> 0 | CS82: =RC[-46] -> 0
A83: Đội phục vụ tàu bay (HGS) | F83: =SUM(R[-1]C:R[-1]C) -> 720000 | G83: =SUM(R[-1]C:R[-1]C) -> 0 | H83: =SUM(R[-1]C:R[-1]C) -> 0 | I83: =SUM(R[-1]C:R[-1]C) -> 0 | J83: =SUM(R[-1]C:R[-1]C) -> 0 | K83: =SUM(R[-1]C:R[-1]C) -> 0 | L83: =SUM(R[-1]C:R[-1]C) -> 0 | M83: =SUM(R[-1]C:R[-1]C) -> 0 | N83: =SUM(R[-1]C:R[-1]C) -> 0 | O83: =SUM(R[-1]C:R[-1]C) -> 0 | P83: =SUM(R[-1]C:R[-1]C) -> 0 | Q83: =SUM(R[-1]C:R[-1]C) -> 720000 | R83: =SUM(R[-1]C:R[-1]C) -> 0 | S83: =SUM(R[-1]C:R[-1]C) -> 0 | T83: =SUM(R[-1]C:R[-1]C) -> 0 | U83: =SUM(R[-1]C:R[-1]C) -> 7200 | V83: =SUM(R[-1]C:R[-1]C) -> 0 | W83: =SUM(R[-1]C:R[-1]C) -> 712800 | X83: =SUM(R[-1]C:R[-1]C) -> 0 | Y83: =SUM(R[-1]C:R[-1]C) -> 0 | Z83: =SUM(R[-1]C:R[-1]C) -> 0 | AA83: =SUM(R[-1]C:R[-1]C) -> 0 | AB83: =SUM(R[-1]C:R[-1]C) -> 0 | AC83: =SUM(R[-1]C:R[-1]C) -> 0 | AD83: =SUM(R[-1]C:R[-1]C) -> 0 | AE83: =SUM(R[-1]C:R[-1]C) -> 0 | AF83: =SUM(R[-1]C:R[-1]C) -> 0 | AG83: =SUM(R[-1]C:R[-1]C) -> 0 | AH83: =SUM(R[-1]C:R[-1]C) -> 0 | AI83: =SUM(R[-1]C:R[-1]C) -> 720000 | AJ83: =SUM(R[-1]C:R[-1]C) -> 0 | AK83: =SUM(R[-1]C:R[-1]C) -> 0 | AL83: =SUM(R[-1]C:R[-1]C) -> 0 | AM83: =SUM(R[-1]C:R[-1]C) -> 0 | AN83: =SUM(R[-1]C:R[-1]C) -> 0 | AO83: =SUM(R[-1]C:R[-1]C) -> 0 | AP83: =SUM(R[-1]C:R[-1]C) -> 0 | AQ83: =SUM(R[-1]C:R[-1]C) -> 0 | AR83: =SUM(R[-1]C:R[-1]C) -> 1 | AS83: =SUM(R[-1]C:R[-1]C) -> 0 | AT83: =SUM(R[-1]C:R[-1]C) -> 0 | AU83: =SUM(R[-1]C:R[-1]C) -> 712800 | AV83: =SUM(R[-1]C:R[-1]C) -> 0 | AW83: =SUM(R[-1]C:R[-1]C) -> 0 | AX83: =SUM(R[-1]C:R[-1]C) -> 0 | AY83: =SUM(R[-1]C:R[-1]C) -> 0
A84: Phòng Phục vụ kỹ thuật sân đỗ (HGS) | F84: =SUM(R[-36]C[46]:R[-1]C[46]) -> 23040000 | G84: =SUM(R[-36]C[46]:R[-1]C[46]) -> 0 | H84: =SUM(R[-36]C[46]:R[-1]C[46]) -> 0 | I84: =SUM(R[-36]C[46]:R[-1]C[46]) -> 0 | J84: =SUM(R[-36]C[46]:R[-1]C[46]) -> 0 | K84: =SUM(R[-36]C[46]:R[-1]C[46]) -> 0 | L84: =SUM(R[-36]C[46]:R[-1]C[46]) -> 0 | M84: =SUM(R[-36]C[46]:R[-1]C[46]) -> 0 | N84: =SUM(R[-36]C[46]:R[-1]C[46]) -> 0 | O84: =SUM(R[-36]C[46]:R[-1]C[46]) -> 0 | P84: =SUM(R[-36]C[46]:R[-1]C[46]) -> 0 | Q84: =SUM(R[-36]C[46]:R[-1]C[46]) -> 23040000 | R84: =SUM(R[-36]C[46]:R[-1]C[46]) -> 0 | S84: =SUM(R[-36]C[46]:R[-1]C[46]) -> 0 | T84: =SUM(R[-36]C[46]:R[-1]C[46]) -> 0 | U84: =SUM(R[-36]C[46]:R[-1]C[46]) -> 230400 | V84: =SUM(R[-36]C[46]:R[-1]C[46]) -> 0 | W84: =SUM(R[-36]C[46]:R[-1]C[46]) -> 22809600 | X84: =SUM(R[-36]C[46]:R[-1]C[46]) -> 0 | Y84: =SUM(R[-36]C[46]:R[-1]C[46]) -> 0 | Z84: =SUM(R[-36]C[46]:R[-1]C[46]) -> 0 | AA84: =SUM(R[-36]C[46]:R[-1]C[46]) -> 0 | AB84: =SUM(R[-36]C[46]:R[-1]C[46]) -> 0 | AC84: =SUM(R[-36]C[46]:R[-1]C[46]) -> 0 | AD84: =SUM(R[-36]C[46]:R[-1]C[46]) -> 0 | AE84: =SUM(R[-36]C[46]:R[-1]C[46]) -> 0 | AF84: =SUM(R[-36]C[46]:R[-1]C[46]) -> 0 | AG84: =SUM(R[-36]C[46]:R[-1]C[46]) -> 0 | AH84: =SUM(R[-36]C[46]:R[-1]C[46]) -> 0 | AI84: =SUM(R[-36]C[46]:R[-1]C[46]) -> 23040000 | AJ84: =SUM(R[-36]C[46]:R[-1]C[46]) -> 0 | AK84: =SUM(R[-36]C[46]:R[-1]C[46]) -> 0 | AL84: =SUM(R[-36]C[46]:R[-1]C[46]) -> 0 | AM84: =SUM(R[-36]C[46]:R[-1]C[46]) -> 0 | AN84: =SUM(R[-36]C[46]:R[-1]C[46]) -> 0 | AO84: =SUM(R[-36]C[46]:R[-1]C[46]) -> 0 | AP84: =SUM(R[-36]C[46]:R[-1]C[46]) -> 0 | AQ84: =SUM(R[-36]C[46]:R[-1]C[46]) -> 0 | AR84: =SUM(R[-36]C[46]:R[-1]C[46]) -> 32 | AS84: =SUM(R[-36]C[46]:R[-1]C[46]) -> 0 | AT84: =SUM(R[-36]C[46]:R[-1]C[46]) -> 0 | AU84: =SUM(R[-36]C[46]:R[-1]C[46]) -> 22809600 | AV84: =SUM(R[-36]C[46]:R[-1]C[46]) -> 0 | AW84: =SUM(R[-36]C[46]:R[-1]C[46]) -> 0 | AX84: =SUM(R[-36]C[46]:R[-1]C[46]) -> 0 | AY84: =SUM(R[-36]C[46]:R[-1]C[46]) -> 0
A85: Công ty Phục vụ mặt đất Hà Nội (HGS) | B85: =RC[42] -> 59 | C85: TỔNG CỘNG: | F85: =SUM(R[-75]C[46]:R[-1]C[46]) -> 42480000 | G85: =SUM(R[-75]C[46]:R[-1]C[46]) -> 0 | H85: =SUM(R[-75]C[46]:R[-1]C[46]) -> 0 | I85: =SUM(R[-75]C[46]:R[-1]C[46]) -> 0 | J85: =SUM(R[-75]C[46]:R[-1]C[46]) -> 0 | K85: =SUM(R[-75]C[46]:R[-1]C[46]) -> 0 | L85: =SUM(R[-75]C[46]:R[-1]C[46]) -> 0 | M85: =SUM(R[-75]C[46]:R[-1]C[46]) -> 0 | N85: =SUM(R[-75]C[46]:R[-1]C[46]) -> 0 | O85: =SUM(R[-75]C[46]:R[-1]C[46]) -> 0 | P85: =SUM(R[-75]C[46]:R[-1]C[46]) -> 0 | Q85: =SUM(R[-75]C[46]:R[-1]C[46]) -> 42480000 | R85: =SUM(R[-75]C[46]:R[-1]C[46]) -> 0 | S85: =SUM(R[-75]C[46]:R[-1]C[46]) -> 0 | T85: =SUM(R[-75]C[46]:R[-1]C[46]) -> 0 | U85: =SUM(R[-75]C[46]:R[-1]C[46]) -> 424800 | V85: =SUM(R[-75]C[46]:R[-1]C[46]) -> 0 | W85: =SUM(R[-75]C[46]:R[-1]C[46]) -> 42055200 | X85: =SUM(R[-75]C[46]:R[-1]C[46]) -> 0 | Y85: =SUM(R[-75]C[46]:R[-1]C[46]) -> 0 | Z85: =SUM(R[-75]C[46]:R[-1]C[46]) -> 0 | AA85: =SUM(R[-75]C[46]:R[-1]C[46]) -> 0 | AB85: =SUM(R[-75]C[46]:R[-1]C[46]) -> 0 | AC85: =SUM(R[-75]C[46]:R[-1]C[46]) -> 0 | AD85: =SUM(R[-75]C[46]:R[-1]C[46]) -> 0 | AE85: =SUM(R[-75]C[46]:R[-1]C[46]) -> 0 | AF85: =SUM(R[-75]C[46]:R[-1]C[46]) -> 0 | AG85: =SUM(R[-75]C[46]:R[-1]C[46]) -> 0 | AH85: =SUM(R[-75]C[46]:R[-1]C[46]) -> 0 | AI85: =SUM(R[-75]C[46]:R[-1]C[46]) -> 42480000 | AJ85: =SUM(R[-75]C[46]:R[-1]C[46]) -> 0 | AK85: =SUM(R[-75]C[46]:R[-1]C[46]) -> 0 | AL85: =SUM(R[-75]C[46]:R[-1]C[46]) -> 0 | AM85: =SUM(R[-75]C[46]:R[-1]C[46]) -> 0 | AN85: =SUM(R[-75]C[46]:R[-1]C[46]) -> 0 | AO85: =SUM(R[-75]C[46]:R[-1]C[46]) -> 0 | AP85: =SUM(R[-75]C[46]:R[-1]C[46]) -> 0 | AQ85: =SUM(R[-75]C[46]:R[-1]C[46]) -> 0 | AR85: =SUM(R[-75]C[46]:R[-1]C[46]) -> 59 | AS85: =SUM(R[-75]C[46]:R[-1]C[46]) -> 0 | AT85: =SUM(R[-75]C[46]:R[-1]C[46]) -> 0 | AU85: =SUM(R[-75]C[46]:R[-1]C[46]) -> 42055200 | AV85: =SUM(R[-75]C[46]:R[-1]C[46]) -> 0 | AW85: =SUM(R[-75]C[46]:R[-1]C[46]) -> 0 | AX85: =SUM(R[-75]C[46]:R[-1]C[46]) -> 0 | AY85: =SUM(R[-75]C[46]:R[-1]C[46]) -> 0
C87: NGƯỜI LẬP BẢNG | H87: THỦ TRƯỞNG ĐƠN VỊ | J87: THỦ TRƯỞNG ĐƠN VỊ | O87: BAN TCCB-LĐTL | U87: BAN TCKT