Sheet: ExcelTemplate
A1: BỘ GIAO THÔNG VẬN TẢI | L1: 2015/03 | V1: Ngày in báo cáo: | W1: Ngày in báo cáo : ___/___/_____ | AU1: Ngày in báo cáo : ___/___/_____
A2: TỔNG CÔNG TY CẢNG HÀNG KHÔNG VIỆT NAM | W2: Trang in báo cáo : ___/___ | AU2: Trang in báo cáo : ___/___
A3: ="BẢNG TIỀN LƯƠNG THÁNG "&RIGHT(R[-2]C[11],2)&" NĂM "&LEFT(R[-2]C[11],4) -> BẢNG TIỀN LƯƠNG THÁNG 03 NĂM 2015
A4: ĐƠN VỊ: | C4: =R[5]C[-2] -> Công ty Phục vụ mặt đất Hà Nội (HGS)
A6: STT | B6: Mã NV | C6: Họ và tên | E6: Số TK | F6: Lương chức danh | G6: Lương cơ bản | H6: Các khoản phụ cấp | L6: Ăn giữa ca | M6: Bổ sung lương | N6: Tiền thêm giờ | O6: Tiền làm đêm | P6: Các khoản trừ vào lương | Q6: Tổng | R6: Các khoản phải nộp | W6: Thực lĩnh | AU6: Thực lĩnh | AW6: Tăng ca không chịu thuế | AX6: Tổng tiền tăng ca | AY6: Tăng ca chịu thuế
D7: Chức vụ | H7: PCCV | I7: PCCV o BH | J7: PCCV | K7: PCTN | R7: BHXH | S7: BHYT | T7: BHTN | U7: ĐPCĐ | V7: TTN tạm tính | X7: Đi đường | Y7: Nghỉ phép trong chế độ | Z7: H6 | AA7: Nghỉ TNLD | AB7: Nghỉ việc riêng hưởng nguyên lương (ma chay, cưới hỏi …) | AC7: Làm thêm CN b.đêm | AD7: Làm thêm CN b.ngày | AE7: Làm thêm LT b.đêm | AF7: Làm thêm LT b.ngày | AG7: Làm thêm NT b.đêm | AH7: Làm thêm NT b.ngày | AI7: X | AJ7: TS | AK7: ST | AL7: CT | AM7: H1 | AN7: H2 | AO7: H3 | AP7: H4 | AQ7: H5 | AV7: DC
A8: 1 | B8: 2 | C8: 3 | E8: 4 | F8: 22 | G8: 23 | H8: 24 | K8: 25 | L8: 26 | M8: 27 | N8: 28 | O8: 29 | Q8: 30 | R8: 31 | S8: 32 | T8: 33 | U8: 34 | V8: 35 | W8: 36 | AC8: 79 | AD8: 80 | AE8: 81 | AF8: 82 | AG8: 83 | AH8: 84 | AU8: 36
A9: Công ty Phục vụ mặt đất Hà Nội (HGS)
A10: Ban Giám đốc (HGS) | F10: =R[8]C -> 106520985 | G10: =R[8]C -> 0 | H10: =R[8]C -> 3255000 | I10: =R[8]C -> 0 | J10: =R[8]C -> 3255000 | K10: =R[8]C -> 0 | L10: =R[8]C -> 3400000 | M10: =R[8]C -> 2685481 | N10: =R[8]C -> 0 | O10: =R[8]C -> 0 | P10: =R[8]C -> 0 | Q10: =R[8]C -> 115861466 | R10: =R[8]C -> 2046080 | S10: =R[8]C -> 383641 | T10: =R[8]C -> 255760 | U10: =R[8]C -> 575000 | V10: =R[8]C -> 1422145 | W10: =R[8]C -> 111178840 | X10: =R[8]C -> 0 | Y10: =R[8]C -> 0 | Z10: =R[8]C -> 0 | AA10: =R[8]C -> 0 | AB10: =R[8]C -> 0 | AC10: =R[8]C -> 0 | AD10: =R[8]C -> 0 | AE10: =R[8]C -> 0 | AF10: =R[8]C -> 0 | AG10: =R[8]C -> 0 | AH10: =R[8]C -> 0 | AI10: =R[8]C -> 106520985 | AJ10: =R[8]C -> 0 | AK10: =R[8]C -> 0 | AL10: =R[8]C -> 0 | AM10: =R[8]C -> 0 | AN10: =R[8]C -> 0 | AO10: =R[8]C -> 0 | AP10: =R[8]C -> 0 | AQ10: =R[8]C -> 0 | AR10: =R[8]C -> 5 | AS10: =R[8]C -> 0 | AT10: =R[8]C -> 0 | AU10: =R[8]C -> 111178840 | AW10: =R[8]C -> 0 | AX10: =R[8]C -> 0 | AY10: =R[8]C -> 0
F11: =R[6]C -> 106520985 | G11: =R[6]C -> 0 | H11: =R[6]C -> 3255000 | I11: =R[6]C -> 0 | J11: =R[6]C -> 3255000 | K11: =R[6]C -> 0 | L11: =R[6]C -> 3400000 | M11: =R[6]C -> 2685481 | N11: =R[6]C -> 0 | O11: =R[6]C -> 0 | P11: =R[6]C -> 0 | Q11: =R[6]C -> 115861466 | R11: =R[6]C -> 2046080 | S11: =R[6]C -> 383641 | T11: =R[6]C -> 255760 | U11: =R[6]C -> 575000 | V11: =R[6]C -> 1422145 | W11: =R[6]C -> 111178840 | X11: =R[6]C -> 0 | Y11: =R[6]C -> 0 | Z11: =R[6]C -> 0 | AA11: =R[6]C -> 0 | AB11: =R[6]C -> 0 | AC11: =R[6]C -> 0 | AD11: =R[6]C -> 0 | AE11: =R[6]C -> 0 | AF11: =R[6]C -> 0 | AG11: =R[6]C -> 0 | AH11: =R[6]C -> 0 | AI11: =R[6]C -> 106520985 | AJ11: =R[6]C -> 0 | AK11: =R[6]C -> 0 | AL11: =R[6]C -> 0 | AM11: =R[6]C -> 0 | AN11: =R[6]C -> 0 | AO11: =R[6]C -> 0 | AP11: =R[6]C -> 0 | AQ11: =R[6]C -> 0 | AR11: =R[6]C -> 5 | AS11: =R[6]C -> 0 | AT11: =R[6]C -> 0 | AU11: =R[6]C -> 111178840 | AW11: =R[6]C -> 0 | AX11: =R[6]C -> 0 | AY11: =R[6]C -> 0
A12: 1 | B12: 010530 | C12: Bùi Tuấn Anh | D12: Giám đốc | E12: 10520054658011 | F12: =RC[29]+RC[30]+RC[31]+RC[32]+RC[33]+RC[34]+RC[35]+RC[36]+RC[37] -> 25098095 | G12: =RC[17]+RC[18]++RC[19]+RC[20]+RC[21]+RC[38]+RC[39]+RC[41] -> 0 | H12: 735000 | I12: 0 | J12: =RC[-2]+RC[-1] -> 735000 | K12: 0 | L12: 680000 | M12: 554243 | N12: =RC[15]+RC[16]+RC[17]+RC[18]+RC[19]+RC[20] -> 0 | O12: 0 | P12: 0 | Q12: 27067338 | R12: 422280 | S12: 79178 | T12: 52785 | U12: 115000 | V12: 713310 | W12: 25684785 | X12: 0 | Y12: 0 | Z12: 0 | AA12: 0 | AB12: 0 | AC12: 0 | AD12: 0 | AE12: 0 | AF12: 0 | AG12: 0 | AH12: 0 | AI12: 25098095 | AJ12: 0 | AK12: 0 | AL12: 0 | AM12: 0 | AN12: 0 | AO12: 0 | AP12: 0 | AQ12: 0 | AR12: =1 -> 1 | AS12: 0 | AT12: 0 | AU12: =RC[-30]-RC[-29]-RC[-28]-RC[-27]-RC[-26]-RC[-25] -> 25684785 | AV12: 0 | AW12: =RC[1]-RC[2] -> 0 | AX12: 0 | AY12: 0 | AZ12: =RC[-46] -> 25098095 | BA12: =RC[-46] -> 0 | BB12: =RC[-46] -> 735000 | BC12: =RC[-46] -> 0 | BD12: =RC[-46] -> 735000 | BE12: =RC[-46] -> 0 | BF12: =RC[-46] -> 680000 | BG12: =RC[-46] -> 554243 | BH12: =RC[-46] -> 0 | BI12: =RC[-46] -> 0 | BJ12: =RC[-46] -> 0 | BK12: =RC[-46] -> 27067338 | BL12: =RC[-46] -> 422280 | BM12: =RC[-46] -> 79178 | BN12: =RC[-46] -> 52785 | BO12: =RC[-46] -> 115000 | BP12: =RC[-46] -> 713310 | BQ12: =RC[-46] -> 25684785 | BR12: =RC[-46] -> 0 | BS12: =RC[-46] -> 0 | BT12: =RC[-46] -> 0 | BU12: =RC[-46] -> 0 | BV12: =RC[-46] -> 0 | BW12: =RC[-46] -> 0 | BX12: =RC[-46] -> 0 | BY12: =RC[-46] -> 0 | BZ12: =RC[-46] -> 0 | CA12: =RC[-46] -> 0 | CB12: =RC[-46] -> 0 | CC12: =RC[-46] -> 25098095 | CD12: =RC[-46] -> 0 | CE12: =RC[-46] -> 0 | CF12: =RC[-46] -> 0 | CG12: =RC[-46] -> 0 | CH12: =RC[-46] -> 0 | CI12: =RC[-46] -> 0 | CJ12: =RC[-46] -> 0 | CK12: =RC[-46] -> 0 | CL12: =RC[-46] -> 1 | CM12: =RC[-46] -> 0 | CN12: =RC[-46] -> 0 | CO12: =RC[-46] -> 25684785 | CP12: =RC[-46] -> 0 | CQ12: =RC[-46] -> 0 | CR12: =RC[-46] -> 0 | CS12: =RC[-46] -> 0
A13: 2 | B13: 010531 | C13: Nguyễn Huy Luân | D13: Phó Giám đốc | E13: 10521460955015 | F13: =RC[29]+RC[30]+RC[31]+RC[32]+RC[33]+RC[34]+RC[35]+RC[36]+RC[37] -> 20603785 | G13: =RC[17]+RC[18]++RC[19]+RC[20]+RC[21]+RC[38]+RC[39]+RC[41] -> 0 | H13: 630000 | I13: 0 | J13: =RC[-2]+RC[-1] -> 630000 | K13: 0 | L13: 680000 | M13: 579600 | N13: =RC[15]+RC[16]+RC[17]+RC[18]+RC[19]+RC[20] -> 0 | O13: 0 | P13: 0 | Q13: 22493385 | R13: 441600 | S13: 82800 | T13: 55200 | U13: 115000 | V13: 253379 | W13: 21545406 | X13: 0 | Y13: 0 | Z13: 0 | AA13: 0 | AB13: 0 | AC13: 0 | AD13: 0 | AE13: 0 | AF13: 0 | AG13: 0 | AH13: 0 | AI13: 20603785 | AJ13: 0 | AK13: 0 | AL13: 0 | AM13: 0 | AN13: 0 | AO13: 0 | AP13: 0 | AQ13: 0 | AR13: =1 -> 1 | AS13: 0 | AT13: 0 | AU13: =RC[-30]-RC[-29]-RC[-28]-RC[-27]-RC[-26]-RC[-25] -> 21545406 | AV13: 0 | AW13: =RC[1]-RC[2] -> 0 | AX13: 0 | AY13: 0 | AZ13: =RC[-46] -> 20603785 | BA13: =RC[-46] -> 0 | BB13: =RC[-46] -> 630000 | BC13: =RC[-46] -> 0 | BD13: =RC[-46] -> 630000 | BE13: =RC[-46] -> 0 | BF13: =RC[-46] -> 680000 | BG13: =RC[-46] -> 579600 | BH13: =RC[-46] -> 0 | BI13: =RC[-46] -> 0 | BJ13: =RC[-46] -> 0 | BK13: =RC[-46] -> 22493385 | BL13: =RC[-46] -> 441600 | BM13: =RC[-46] -> 82800 | BN13: =RC[-46] -> 55200 | BO13: =RC[-46] -> 115000 | BP13: =RC[-46] -> 253379 | BQ13: =RC[-46] -> 21545406 | BR13: =RC[-46] -> 0 | BS13: =RC[-46] -> 0 | BT13: =RC[-46] -> 0 | BU13: =RC[-46] -> 0 | BV13: =RC[-46] -> 0 | BW13: =RC[-46] -> 0 | BX13: =RC[-46] -> 0 | BY13: =RC[-46] -> 0 | BZ13: =RC[-46] -> 0 | CA13: =RC[-46] -> 0 | CB13: =RC[-46] -> 0 | CC13: =RC[-46] -> 20603785 | CD13: =RC[-46] -> 0 | CE13: =RC[-46] -> 0 | CF13: =RC[-46] -> 0 | CG13: =RC[-46] -> 0 | CH13: =RC[-46] -> 0 | CI13: =RC[-46] -> 0 | CJ13: =RC[-46] -> 0 | CK13: =RC[-46] -> 0 | CL13: =RC[-46] -> 1 | CM13: =RC[-46] -> 0 | CN13: =RC[-46] -> 0 | CO13: =RC[-46] -> 21545406 | CP13: =RC[-46] -> 0 | CQ13: =RC[-46] -> 0 | CR13: =RC[-46] -> 0 | CS13: =RC[-46] -> 0
A14: 3 | B14: 010532 | C14: Vũ Trung Thành | D14: Phó Giám đốc | E14: 10520047943010 | F14: =RC[29]+RC[30]+RC[31]+RC[32]+RC[33]+RC[34]+RC[35]+RC[36]+RC[37] -> 20603785 | G14: =RC[17]+RC[18]++RC[19]+RC[20]+RC[21]+RC[38]+RC[39]+RC[41] -> 0 | H14: 630000 | I14: 0 | J14: =RC[-2]+RC[-1] -> 630000 | K14: 0 | L14: 680000 | M14: 542168 | N14: =RC[15]+RC[16]+RC[17]+RC[18]+RC[19]+RC[20] -> 0 | O14: 0 | P14: 0 | Q14: 22455953 | R14: 413080 | S14: 77453 | T14: 51635 | U14: 115000 | V14: 253379 | W14: 21545406 | X14: 0 | Y14: 0 | Z14: 0 | AA14: 0 | AB14: 0 | AC14: 0 | AD14: 0 | AE14: 0 | AF14: 0 | AG14: 0 | AH14: 0 | AI14: 20603785 | AJ14: 0 | AK14: 0 | AL14: 0 | AM14: 0 | AN14: 0 | AO14: 0 | AP14: 0 | AQ14: 0 | AR14: =1 -> 1 | AS14: 0 | AT14: 0 | AU14: =RC[-30]-RC[-29]-RC[-28]-RC[-27]-RC[-26]-RC[-25] -> 21545406 | AV14: 0 | AW14: =RC[1]-RC[2] -> 0 | AX14: 0 | AY14: 0 | AZ14: =RC[-46] -> 20603785 | BA14: =RC[-46] -> 0 | BB14: =RC[-46] -> 630000 | BC14: =RC[-46] -> 0 | BD14: =RC[-46] -> 630000 | BE14: =RC[-46] -> 0 | BF14: =RC[-46] -> 680000 | BG14: =RC[-46] -> 542168 | BH14: =RC[-46] -> 0 | BI14: =RC[-46] -> 0 | BJ14: =RC[-46] -> 0 | BK14: =RC[-46] -> 22455953 | BL14: =RC[-46] -> 413080 | BM14: =RC[-46] -> 77453 | BN14: =RC[-46] -> 51635 | BO14: =RC[-46] -> 115000 | BP14: =RC[-46] -> 253379 | BQ14: =RC[-46] -> 21545406 | BR14: =RC[-46] -> 0 | BS14: =RC[-46] -> 0 | BT14: =RC[-46] -> 0 | BU14: =RC[-46] -> 0 | BV14: =RC[-46] -> 0 | BW14: =RC[-46] -> 0 | BX14: =RC[-46] -> 0 | BY14: =RC[-46] -> 0 | BZ14: =RC[-46] -> 0 | CA14: =RC[-46] -> 0 | CB14: =RC[-46] -> 0 | CC14: =RC[-46] -> 20603785 | CD14: =RC[-46] -> 0 | CE14: =RC[-46] -> 0 | CF14: =RC[-46] -> 0 | CG14: =RC[-46] -> 0 | CH14: =RC[-46] -> 0 | CI14: =RC[-46] -> 0 | CJ14: =RC[-46] -> 0 | CK14: =RC[-46] -> 0 | CL14: =RC[-46] -> 1 | CM14: =RC[-46] -> 0 | CN14: =RC[-46] -> 0 | CO14: =RC[-46] -> 21545406 | CP14: =RC[-46] -> 0 | CQ14: =RC[-46] -> 0 | CR14: =RC[-46] -> 0 | CS14: =RC[-46] -> 0
A15: 4 | B15: 010533 | C15: Trần Sỹ Hiến | D15: Phó Giám đốc | E15: 10520004906014 | F15: =RC[29]+RC[30]+RC[31]+RC[32]+RC[33]+RC[34]+RC[35]+RC[36]+RC[37] -> 20603785 | G15: =RC[17]+RC[18]++RC[19]+RC[20]+RC[21]+RC[38]+RC[39]+RC[41] -> 0 | H15: 630000 | I15: 0 | J15: =RC[-2]+RC[-1] -> 630000 | K15: 0 | L15: 680000 | M15: 579600 | N15: =RC[15]+RC[16]+RC[17]+RC[18]+RC[19]+RC[20] -> 0 | O15: 0 | P15: 0 | Q15: 22493385 | R15: 441600 | S15: 82800 | T15: 55200 | U15: 115000 | V15: 0 | W15: 21798785 | X15: 0 | Y15: 0 | Z15: 0 | AA15: 0 | AB15: 0 | AC15: 0 | AD15: 0 | AE15: 0 | AF15: 0 | AG15: 0 | AH15: 0 | AI15: 20603785 | AJ15: 0 | AK15: 0 | AL15: 0 | AM15: 0 | AN15: 0 | AO15: 0 | AP15: 0 | AQ15: 0 | AR15: =1 -> 1 | AS15: 0 | AT15: 0 | AU15: =RC[-30]-RC[-29]-RC[-28]-RC[-27]-RC[-26]-RC[-25] -> 21798785 | AV15: 0 | AW15: =RC[1]-RC[2] -> 0 | AX15: 0 | AY15: 0 | AZ15: =RC[-46] -> 20603785 | BA15: =RC[-46] -> 0 | BB15: =RC[-46] -> 630000 | BC15: =RC[-46] -> 0 | BD15: =RC[-46] -> 630000 | BE15: =RC[-46] -> 0 | BF15: =RC[-46] -> 680000 | BG15: =RC[-46] -> 579600 | BH15: =RC[-46] -> 0 | BI15: =RC[-46] -> 0 | BJ15: =RC[-46] -> 0 | BK15: =RC[-46] -> 22493385 | BL15: =RC[-46] -> 441600 | BM15: =RC[-46] -> 82800 | BN15: =RC[-46] -> 55200 | BO15: =RC[-46] -> 115000 | BP15: =RC[-46] -> 0 | BQ15: =RC[-46] -> 21798785 | BR15: =RC[-46] -> 0 | BS15: =RC[-46] -> 0 | BT15: =RC[-46] -> 0 | BU15: =RC[-46] -> 0 | BV15: =RC[-46] -> 0 | BW15: =RC[-46] -> 0 | BX15: =RC[-46] -> 0 | BY15: =RC[-46] -> 0 | BZ15: =RC[-46] -> 0 | CA15: =RC[-46] -> 0 | CB15: =RC[-46] -> 0 | CC15: =RC[-46] -> 20603785 | CD15: =RC[-46] -> 0 | CE15: =RC[-46] -> 0 | CF15: =RC[-46] -> 0 | CG15: =RC[-46] -> 0 | CH15: =RC[-46] -> 0 | CI15: =RC[-46] -> 0 | CJ15: =RC[-46] -> 0 | CK15: =RC[-46] -> 0 | CL15: =RC[-46] -> 1 | CM15: =RC[-46] -> 0 | CN15: =RC[-46] -> 0 | CO15: =RC[-46] -> 21798785 | CP15: =RC[-46] -> 0 | CQ15: =RC[-46] -> 0 | CR15: =RC[-46] -> 0 | CS15: =RC[-46] -> 0
A16: 5 | B16: 010806 | C16: Phương Hồng Minh | D16: Phó Giám đốc | E16: 10520973265018 | F16: =RC[29]+RC[30]+RC[31]+RC[32]+RC[33]+RC[34]+RC[35]+RC[36]+RC[37] -> 19611535 | G16: =RC[17]+RC[18]++RC[19]+RC[20]+RC[21]+RC[38]+RC[39]+RC[41] -> 0 | H16: 630000 | I16: 0 | J16: =RC[-2]+RC[-1] -> 630000 | K16: 0 | L16: 680000 | M16: 429870 | N16: =RC[15]+RC[16]+RC[17]+RC[18]+RC[19]+RC[20] -> 0 | O16: 0 | P16: 0 | Q16: 21351405 | R16: 327520 | S16: 61410 | T16: 40940 | U16: 115000 | V16: 202077 | W16: 20604458 | X16: 0 | Y16: 0 | Z16: 0 | AA16: 0 | AB16: 0 | AC16: 0 | AD16: 0 | AE16: 0 | AF16: 0 | AG16: 0 | AH16: 0 | AI16: 19611535 | AJ16: 0 | AK16: 0 | AL16: 0 | AM16: 0 | AN16: 0 | AO16: 0 | AP16: 0 | AQ16: 0 | AR16: =1 -> 1 | AS16: 0 | AT16: 0 | AU16: =RC[-30]-RC[-29]-RC[-28]-RC[-27]-RC[-26]-RC[-25] -> 20604458 | AV16: 0 | AW16: =RC[1]-RC[2] -> 0 | AX16: 0 | AY16: 0 | AZ16: =RC[-46] -> 19611535 | BA16: =RC[-46] -> 0 | BB16: =RC[-46] -> 630000 | BC16: =RC[-46] -> 0 | BD16: =RC[-46] -> 630000 | BE16: =RC[-46] -> 0 | BF16: =RC[-46] -> 680000 | BG16: =RC[-46] -> 429870 | BH16: =RC[-46] -> 0 | BI16: =RC[-46] -> 0 | BJ16: =RC[-46] -> 0 | BK16: =RC[-46] -> 21351405 | BL16: =RC[-46] -> 327520 | BM16: =RC[-46] -> 61410 | BN16: =RC[-46] -> 40940 | BO16: =RC[-46] -> 115000 | BP16: =RC[-46] -> 202077 | BQ16: =RC[-46] -> 20604458 | BR16: =RC[-46] -> 0 | BS16: =RC[-46] -> 0 | BT16: =RC[-46] -> 0 | BU16: =RC[-46] -> 0 | BV16: =RC[-46] -> 0 | BW16: =RC[-46] -> 0 | BX16: =RC[-46] -> 0 | BY16: =RC[-46] -> 0 | BZ16: =RC[-46] -> 0 | CA16: =RC[-46] -> 0 | CB16: =RC[-46] -> 0 | CC16: =RC[-46] -> 19611535 | CD16: =RC[-46] -> 0 | CE16: =RC[-46] -> 0 | CF16: =RC[-46] -> 0 | CG16: =RC[-46] -> 0 | CH16: =RC[-46] -> 0 | CI16: =RC[-46] -> 0 | CJ16: =RC[-46] -> 0 | CK16: =RC[-46] -> 0 | CL16: =RC[-46] -> 1 | CM16: =RC[-46] -> 0 | CN16: =RC[-46] -> 0 | CO16: =RC[-46] -> 20604458 | CP16: =RC[-46] -> 0 | CQ16: =RC[-46] -> 0 | CR16: =RC[-46] -> 0 | CS16: =RC[-46] -> 0
F17: =SUM(R[-5]C:R[-1]C) -> 106520985 | G17: =SUM(R[-5]C:R[-1]C) -> 0 | H17: =SUM(R[-5]C:R[-1]C) -> 3255000 | I17: =SUM(R[-5]C:R[-1]C) -> 0 | J17: =SUM(R[-5]C:R[-1]C) -> 3255000 | K17: =SUM(R[-5]C:R[-1]C) -> 0 | L17: =SUM(R[-5]C:R[-1]C) -> 3400000 | M17: =SUM(R[-5]C:R[-1]C) -> 2685481 | N17: =SUM(R[-5]C:R[-1]C) -> 0 | O17: =SUM(R[-5]C:R[-1]C) -> 0 | P17: =SUM(R[-5]C:R[-1]C) -> 0 | Q17: =SUM(R[-5]C:R[-1]C) -> 115861466 | R17: =SUM(R[-5]C:R[-1]C) -> 2046080 | S17: =SUM(R[-5]C:R[-1]C) -> 383641 | T17: =SUM(R[-5]C:R[-1]C) -> 255760 | U17: =SUM(R[-5]C:R[-1]C) -> 575000 | V17: =SUM(R[-5]C:R[-1]C) -> 1422145 | W17: =SUM(R[-5]C:R[-1]C) -> 111178840 | X17: =SUM(R[-5]C:R[-1]C) -> 0 | Y17: =SUM(R[-5]C:R[-1]C) -> 0 | Z17: =SUM(R[-5]C:R[-1]C) -> 0 | AA17: =SUM(R[-5]C:R[-1]C) -> 0 | AB17: =SUM(R[-5]C:R[-1]C) -> 0 | AC17: =SUM(R[-5]C:R[-1]C) -> 0 | AD17: =SUM(R[-5]C:R[-1]C) -> 0 | AE17: =SUM(R[-5]C:R[-1]C) -> 0 | AF17: =SUM(R[-5]C:R[-1]C) -> 0 | AG17: =SUM(R[-5]C:R[-1]C) -> 0 | AH17: =SUM(R[-5]C:R[-1]C) -> 0 | AI17: =SUM(R[-5]C:R[-1]C) -> 106520985 | AJ17: =SUM(R[-5]C:R[-1]C) -> 0 | AK17: =SUM(R[-5]C:R[-1]C) -> 0 | AL17: =SUM(R[-5]C:R[-1]C) -> 0 | AM17: =SUM(R[-5]C:R[-1]C) -> 0 | AN17: =SUM(R[-5]C:R[-1]C) -> 0 | AO17: =SUM(R[-5]C:R[-1]C) -> 0 | AP17: =SUM(R[-5]C:R[-1]C) -> 0 | AQ17: =SUM(R[-5]C:R[-1]C) -> 0 | AR17: =SUM(R[-5]C:R[-1]C) -> 5 | AS17: =SUM(R[-5]C:R[-1]C) -> 0 | AT17: =SUM(R[-5]C:R[-1]C) -> 0 | AU17: =SUM(R[-5]C:R[-1]C) -> 111178840 | AV17: =SUM(R[-5]C:R[-1]C) -> 0 | AW17: =SUM(R[-5]C:R[-1]C) -> 0 | AX17: =SUM(R[-5]C:R[-1]C) -> 0 | AY17: =SUM(R[-5]C:R[-1]C) -> 0
A18: Ban Giám đốc (HGS) | F18: =SUM(R[-7]C[46]:R[-1]C[46]) -> 106520985 | G18: =SUM(R[-7]C[46]:R[-1]C[46]) -> 0 | H18: =SUM(R[-7]C[46]:R[-1]C[46]) -> 3255000 | I18: =SUM(R[-7]C[46]:R[-1]C[46]) -> 0 | J18: =SUM(R[-7]C[46]:R[-1]C[46]) -> 3255000 | K18: =SUM(R[-7]C[46]:R[-1]C[46]) -> 0 | L18: =SUM(R[-7]C[46]:R[-1]C[46]) -> 3400000 | M18: =SUM(R[-7]C[46]:R[-1]C[46]) -> 2685481 | N18: =SUM(R[-7]C[46]:R[-1]C[46]) -> 0 | O18: =SUM(R[-7]C[46]:R[-1]C[46]) -> 0 | P18: =SUM(R[-7]C[46]:R[-1]C[46]) -> 0 | Q18: =SUM(R[-7]C[46]:R[-1]C[46]) -> 115861466 | R18: =SUM(R[-7]C[46]:R[-1]C[46]) -> 2046080 | S18: =SUM(R[-7]C[46]:R[-1]C[46]) -> 383641 | T18: =SUM(R[-7]C[46]:R[-1]C[46]) -> 255760 | U18: =SUM(R[-7]C[46]:R[-1]C[46]) -> 575000 | V18: =SUM(R[-7]C[46]:R[-1]C[46]) -> 1422145 | W18: =SUM(R[-7]C[46]:R[-1]C[46]) -> 111178840 | X18: =SUM(R[-7]C[46]:R[-1]C[46]) -> 0 | Y18: =SUM(R[-7]C[46]:R[-1]C[46]) -> 0 | Z18: =SUM(R[-7]C[46]:R[-1]C[46]) -> 0 | AA18: =SUM(R[-7]C[46]:R[-1]C[46]) -> 0 | AB18: =SUM(R[-7]C[46]:R[-1]C[46]) -> 0 | AC18: =SUM(R[-7]C[46]:R[-1]C[46]) -> 0 | AD18: =SUM(R[-7]C[46]:R[-1]C[46]) -> 0 | AE18: =SUM(R[-7]C[46]:R[-1]C[46]) -> 0 | AF18: =SUM(R[-7]C[46]:R[-1]C[46]) -> 0 | AG18: =SUM(R[-7]C[46]:R[-1]C[46]) -> 0 | AH18: =SUM(R[-7]C[46]:R[-1]C[46]) -> 0 | AI18: =SUM(R[-7]C[46]:R[-1]C[46]) -> 106520985 | AJ18: =SUM(R[-7]C[46]:R[-1]C[46]) -> 0 | AK18: =SUM(R[-7]C[46]:R[-1]C[46]) -> 0 | AL18: =SUM(R[-7]C[46]:R[-1]C[46]) -> 0 | AM18: =SUM(R[-7]C[46]:R[-1]C[46]) -> 0 | AN18: =SUM(R[-7]C[46]:R[-1]C[46]) -> 0 | AO18: =SUM(R[-7]C[46]:R[-1]C[46]) -> 0 | AP18: =SUM(R[-7]C[46]:R[-1]C[46]) -> 0 | AQ18: =SUM(R[-7]C[46]:R[-1]C[46]) -> 0 | AR18: =SUM(R[-7]C[46]:R[-1]C[46]) -> 5 | AS18: =SUM(R[-7]C[46]:R[-1]C[46]) -> 0 | AT18: =SUM(R[-7]C[46]:R[-1]C[46]) -> 0 | AU18: =SUM(R[-7]C[46]:R[-1]C[46]) -> 111178840 | AV18: =SUM(R[-7]C[46]:R[-1]C[46]) -> 0 | AW18: =SUM(R[-7]C[46]:R[-1]C[46]) -> 0 | AX18: =SUM(R[-7]C[46]:R[-1]C[46]) -> 0 | AY18: =SUM(R[-7]C[46]:R[-1]C[46]) -> 0
A19: Phòng Điều hành, tài liệu và hướng dẫn chất xếp (HGS) | F19: =R[49]C -> 262680749 | G19: =R[49]C -> 581538 | H19: =R[49]C -> 0 | I19: =R[49]C -> 735000 | J19: =R[49]C -> 735000 | K19: =R[49]C -> 420000 | L19: =R[49]C -> 29736923 | M19: =R[49]C -> 9989660 | N19: =R[49]C -> 2877406 | O19: =R[49]C -> 0 | P19: =R[49]C -> 0 | Q19: =R[49]C -> 307021276 | R19: =R[49]C -> 7611160 | S19: =R[49]C -> 1427105 | T19: =R[49]C -> 951395 | U19: =R[49]C -> 2869521.4299999988 | V19: =R[49]C -> 2903 | W19: =R[49]C -> 294159191.57000005 | X19: =R[49]C -> 0 | Y19: =R[49]C -> 581538 | Z19: =R[49]C -> 0 | AA19: =R[49]C -> 0 | AB19: =R[49]C -> 0 | AC19: =R[49]C -> 0 | AD19: =R[49]C -> 0 | AE19: =R[49]C -> 0 | AF19: =R[49]C -> 0 | AG19: =R[49]C -> 0 | AH19: =R[49]C -> 2877406 | AI19: =R[49]C -> 260293512 | AJ19: =R[49]C -> 2387237 | AK19: =R[49]C -> 0 | AL19: =R[49]C -> 0 | AM19: =R[49]C -> 0 | AN19: =R[49]C -> 0 | AO19: =R[49]C -> 0 | AP19: =R[49]C -> 0 | AQ19: =R[49]C -> 0 | AR19: =R[49]C -> 46 | AS19: =R[49]C -> 0 | AT19: =R[49]C -> 0 | AU19: =R[49]C -> 294159191.57000005 | AW19: =R[49]C -> 959135.32999999984 | AX19: =R[49]C -> 2877406 | AY19: =R[49]C -> 1918270.6699999995
F20: =R[47]C -> 262680749 | G20: =R[47]C -> 581538 | H20: =R[47]C -> 0 | I20: =R[47]C -> 735000 | J20: =R[47]C -> 735000 | K20: =R[47]C -> 420000 | L20: =R[47]C -> 29736923 | M20: =R[47]C -> 9989660 | N20: =R[47]C -> 2877406 | O20: =R[47]C -> 0 | P20: =R[47]C -> 0 | Q20: =R[47]C -> 307021276 | R20: =R[47]C -> 7611160 | S20: =R[47]C -> 1427105 | T20: =R[47]C -> 951395 | U20: =R[47]C -> 2869521.4299999988 | V20: =R[47]C -> 2903 | W20: =R[47]C -> 294159191.57000005 | X20: =R[47]C -> 0 | Y20: =R[47]C -> 581538 | Z20: =R[47]C -> 0 | AA20: =R[47]C -> 0 | AB20: =R[47]C -> 0 | AC20: =R[47]C -> 0 | AD20: =R[47]C -> 0 | AE20: =R[47]C -> 0 | AF20: =R[47]C -> 0 | AG20: =R[47]C -> 0 | AH20: =R[47]C -> 2877406 | AI20: =R[47]C -> 260293512 | AJ20: =R[47]C -> 2387237 | AK20: =R[47]C -> 0 | AL20: =R[47]C -> 0 | AM20: =R[47]C -> 0 | AN20: =R[47]C -> 0 | AO20: =R[47]C -> 0 | AP20: =R[47]C -> 0 | AQ20: =R[47]C -> 0 | AR20: =R[47]C -> 46 | AS20: =R[47]C -> 0 | AT20: =R[47]C -> 0 | AU20: =R[47]C -> 294159191.57000005 | AW20: =R[47]C -> 959135.32999999984 | AX20: =R[47]C -> 2877406 | AY20: =R[47]C -> 1918270.6699999995
A21: 1 | B21: 010555 | C21: Nguyễn Ngọc Nguyên | D21: Trưởng phòng | E21: 10520003354018 | F21: =RC[29]+RC[30]+RC[31]+RC[32]+RC[33]+RC[34]+RC[35]+RC[36]+RC[37] -> 15838065 | G21: =RC[17]+RC[18]++RC[19]+RC[20]+RC[21]+RC[38]+RC[39]+RC[41] -> 0 | H21: 0 | I21: 420000 | J21: =RC[-2]+RC[-1] -> 420000 | K21: 0 | L21: 680000 | M21: 319988 | N21: =RC[15]+RC[16]+RC[17]+RC[18]+RC[19]+RC[20] -> 0 | O21: 0 | P21: 0 | Q21: 17258053 | R21: 243800 | S21: 45713 | T21: 30475 | U21: 115000 | V21: 2903 | W21: 16820162 | X21: 0 | Y21: 0 | Z21: 0 | AA21: 0 | AB21: 0 | AC21: 0 | AD21: 0 | AE21: 0 | AF21: 0 | AG21: 0 | AH21: 0 | AI21: 15838065 | AJ21: 0 | AK21: 0 | AL21: 0 | AM21: 0 | AN21: 0 | AO21: 0 | AP21: 0 | AQ21: 0 | AR21: =1 -> 1 | AS21: 0 | AT21: 0 | AU21: =RC[-30]-RC[-29]-RC[-28]-RC[-27]-RC[-26]-RC[-25] -> 16820162 | AV21: 0 | AW21: =RC[1]-RC[2] -> 0 | AX21: 0 | AY21: 0 | AZ21: =RC[-46] -> 15838065 | BA21: =RC[-46] -> 0 | BB21: =RC[-46] -> 0 | BC21: =RC[-46] -> 420000 | BD21: =RC[-46] -> 420000 | BE21: =RC[-46] -> 0 | BF21: =RC[-46] -> 680000 | BG21: =RC[-46] -> 319988 | BH21: =RC[-46] -> 0 | BI21: =RC[-46] -> 0 | BJ21: =RC[-46] -> 0 | BK21: =RC[-46] -> 17258053 | BL21: =RC[-46] -> 243800 | BM21: =RC[-46] -> 45713 | BN21: =RC[-46] -> 30475 | BO21: =RC[-46] -> 115000 | BP21: =RC[-46] -> 2903 | BQ21: =RC[-46] -> 16820162 | BR21: =RC[-46] -> 0 | BS21: =RC[-46] -> 0 | BT21: =RC[-46] -> 0 | BU21: =RC[-46] -> 0 | BV21: =RC[-46] -> 0 | BW21: =RC[-46] -> 0 | BX21: =RC[-46] -> 0 | BY21: =RC[-46] -> 0 | BZ21: =RC[-46] -> 0 | CA21: =RC[-46] -> 0 | CB21: =RC[-46] -> 0 | CC21: =RC[-46] -> 15838065 | CD21: =RC[-46] -> 0 | CE21: =RC[-46] -> 0 | CF21: =RC[-46] -> 0 | CG21: =RC[-46] -> 0 | CH21: =RC[-46] -> 0 | CI21: =RC[-46] -> 0 | CJ21: =RC[-46] -> 0 | CK21: =RC[-46] -> 0 | CL21: =RC[-46] -> 1 | CM21: =RC[-46] -> 0 | CN21: =RC[-46] -> 0 | CO21: =RC[-46] -> 16820162 | CP21: =RC[-46] -> 0 | CQ21: =RC[-46] -> 0 | CR21: =RC[-46] -> 0 | CS21: =RC[-46] -> 0
A22: 2 | B22: 010554 | C22: Nguyễn Đình Tuyến | D22: Phó Trưởng Phòng | E22: 10520220398015 | F22: =RC[29]+RC[30]+RC[31]+RC[32]+RC[33]+RC[34]+RC[35]+RC[36]+RC[37] -> 15146408 | G22: =RC[17]+RC[18]++RC[19]+RC[20]+RC[21]+RC[38]+RC[39]+RC[41] -> 0 | H22: 0 | I22: 315000 | J22: =RC[-2]+RC[-1] -> 315000 | K22: 0 | L22: 680000 | M22: 319988 | N22: =RC[15]+RC[16]+RC[17]+RC[18]+RC[19]+RC[20] -> 0 | O22: 0 | P22: 0 | Q22: 16461396 | R22: 243800 | S22: 45713 | T22: 30475 | U22: 115000 | V22: 0 | W22: 16026408 | X22: 0 | Y22: 0 | Z22: 0 | AA22: 0 | AB22: 0 | AC22: 0 | AD22: 0 | AE22: 0 | AF22: 0 | AG22: 0 | AH22: 0 | AI22: 15146408 | AJ22: 0 | AK22: 0 | AL22: 0 | AM22: 0 | AN22: 0 | AO22: 0 | AP22: 0 | AQ22: 0 | AR22: =1 -> 1 | AS22: 0 | AT22: 0 | AU22: =RC[-30]-RC[-29]-RC[-28]-RC[-27]-RC[-26]-RC[-25] -> 16026408 | AV22: 0 | AW22: =RC[1]-RC[2] -> 0 | AX22: 0 | AY22: 0 | AZ22: =RC[-46] -> 15146408 | BA22: =RC[-46] -> 0 | BB22: =RC[-46] -> 0 | BC22: =RC[-46] -> 315000 | BD22: =RC[-46] -> 315000 | BE22: =RC[-46] -> 0 | BF22: =RC[-46] -> 680000 | BG22: =RC[-46] -> 319988 | BH22: =RC[-46] -> 0 | BI22: =RC[-46] -> 0 | BJ22: =RC[-46] -> 0 | BK22: =RC[-46] -> 16461396 | BL22: =RC[-46] -> 243800 | BM22: =RC[-46] -> 45713 | BN22: =RC[-46] -> 30475 | BO22: =RC[-46] -> 115000 | BP22: =RC[-46] -> 0 | BQ22: =RC[-46] -> 16026408 | BR22: =RC[-46] -> 0 | BS22: =RC[-46] -> 0 | BT22: =RC[-46] -> 0 | BU22: =RC[-46] -> 0 | BV22: =RC[-46] -> 0 | BW22: =RC[-46] -> 0 | BX22: =RC[-46] -> 0 | BY22: =RC[-46] -> 0 | BZ22: =RC[-46] -> 0 | CA22: =RC[-46] -> 0 | CB22: =RC[-46] -> 0 | CC22: =RC[-46] -> 15146408 | CD22: =RC[-46] -> 0 | CE22: =RC[-46] -> 0 | CF22: =RC[-46] -> 0 | CG22: =RC[-46] -> 0 | CH22: =RC[-46] -> 0 | CI22: =RC[-46] -> 0 | CJ22: =RC[-46] -> 0 | CK22: =RC[-46] -> 0 | CL22: =RC[-46] -> 1 | CM22: =RC[-46] -> 0 | CN22: =RC[-46] -> 0 | CO22: =RC[-46] -> 16026408 | CP22: =RC[-46] -> 0 | CQ22: =RC[-46] -> 0 | CR22: =RC[-46] -> 0 | CS22: =RC[-46] -> 0
A23: 3 | B23: 010534 | C23: Nguyễn Tiến Hải | D23: KS CNTT | E23: 10523640510014 | F23: =RC[29]+RC[30]+RC[31]+RC[32]+RC[33]+RC[34]+RC[35]+RC[36]+RC[37] -> 8054737 | G23: =RC[17]+RC[18]++RC[19]+RC[20]+RC[21]+RC[38]+RC[39]+RC[41] -> 0 | H23: 0 | I23: 0 | J23: =RC[-2]+RC[-1] -> 0 | K23: 0 | L23: 680000 | M23: 319988 | N23: =RC[15]+RC[16]+RC[17]+RC[18]+RC[19]+RC[20] -> 160529 | O23: 0 | P23: 0 | Q23: 9215254 | R23: 243800 | S23: 45713 | T23: 30475 | U23: 88952.66 | V23: 0 | W23: 8806313.3399999999 | X23: 0 | Y23: 0 | Z23: 0 | AA23: 0 | AB23: 0 | AC23: 0 | AD23: 0 | AE23: 0 | AF23: 0 | AG23: 0 | AH23: 160529 | AI23: 8054737 | AJ23: 0 | AK23: 0 | AL23: 0 | AM23: 0 | AN23: 0 | AO23: 0 | AP23: 0 | AQ23: 0 | AR23: =1 -> 1 | AS23: 0 | AT23: 0 | AU23: =RC[-30]-RC[-29]-RC[-28]-RC[-27]-RC[-26]-RC[-25] -> 8806313.3399999999 | AV23: 0 | AW23: =RC[1]-RC[2] -> 53509.667000000001 | AX23: 160529 | AY23: 107019.333 | AZ23: =RC[-46] -> 8054737 | BA23: =RC[-46] -> 0 | BB23: =RC[-46] -> 0 | BC23: =RC[-46] -> 0 | BD23: =RC[-46] -> 0 | BE23: =RC[-46] -> 0 | BF23: =RC[-46] -> 680000 | BG23: =RC[-46] -> 319988 | BH23: =RC[-46] -> 160529 | BI23: =RC[-46] -> 0 | BJ23: =RC[-46] -> 0 | BK23: =RC[-46] -> 9215254 | BL23: =RC[-46] -> 243800 | BM23: =RC[-46] -> 45713 | BN23: =RC[-46] -> 30475 | BO23: =RC[-46] -> 88952.66 | BP23: =RC[-46] -> 0 | BQ23: =RC[-46] -> 8806313.3399999999 | BR23: =RC[-46] -> 0 | BS23: =RC[-46] -> 0 | BT23: =RC[-46] -> 0 | BU23: =RC[-46] -> 0 | BV23: =RC[-46] -> 0 | BW23: =RC[-46] -> 0 | BX23: =RC[-46] -> 0 | BY23: =RC[-46] -> 0 | BZ23: =RC[-46] -> 0 | CA23: =RC[-46] -> 0 | CB23: =RC[-46] -> 160529 | CC23: =RC[-46] -> 8054737 | CD23: =RC[-46] -> 0 | CE23: =RC[-46] -> 0 | CF23: =RC[-46] -> 0 | CG23: =RC[-46] -> 0 | CH23: =RC[-46] -> 0 | CI23: =RC[-46] -> 0 | CJ23: =RC[-46] -> 0 | CK23: =RC[-46] -> 0 | CL23: =RC[-46] -> 1 | CM23: =RC[-46] -> 0 | CN23: =RC[-46] -> 0 | CO23: =RC[-46] -> 8806313.3399999999 | CP23: =RC[-46] -> 0 | CQ23: =RC[-46] -> 53509.667000000001 | CR23: =RC[-46] -> 160529 | CS23: =RC[-46] -> 107019.333
A24: 4 | B24: 011084 | C24: Ngô Trí Dũng | D24: KS CNTT | E24: 19026970084010 | F24: =RC[29]+RC[30]+RC[31]+RC[32]+RC[33]+RC[34]+RC[35]+RC[36]+RC[37] -> 6712281 | G24: =RC[17]+RC[18]++RC[19]+RC[20]+RC[21]+RC[38]+RC[39]+RC[41] -> 0 | H24: 0 | I24: 0 | J24: =RC[-2]+RC[-1] -> 0 | K24: 0 | L24: 680000 | M24: 282555 | N24: =RC[15]+RC[16]+RC[17]+RC[18]+RC[19]+RC[20] -> 0 | O24: 0 | P24: 0 | Q24: 7674836 | R24: 215280 | S24: 40365 | T24: 26910 | U24: 73922.81 | V24: 0 | W24: 7318358.1900000004 | X24: 0 | Y24: 0 | Z24: 0 | AA24: 0 | AB24: 0 | AC24: 0 | AD24: 0 | AE24: 0 | AF24: 0 | AG24: 0 | AH24: 0 | AI24: 6712281 | AJ24: 0 | AK24: 0 | AL24: 0 | AM24: 0 | AN24: 0 | AO24: 0 | AP24: 0 | AQ24: 0 | AR24: =1 -> 1 | AS24: 0 | AT24: 0 | AU24: =RC[-30]-RC[-29]-RC[-28]-RC[-27]-RC[-26]-RC[-25] -> 7318358.1900000004 | AV24: 0 | AW24: =RC[1]-RC[2] -> 0 | AX24: 0 | AY24: 0 | AZ24: =RC[-46] -> 6712281 | BA24: =RC[-46] -> 0 | BB24: =RC[-46] -> 0 | BC24: =RC[-46] -> 0 | BD24: =RC[-46] -> 0 | BE24: =RC[-46] -> 0 | BF24: =RC[-46] -> 680000 | BG24: =RC[-46] -> 282555 | BH24: =RC[-46] -> 0 | BI24: =RC[-46] -> 0 | BJ24: =RC[-46] -> 0 | BK24: =RC[-46] -> 7674836 | BL24: =RC[-46] -> 215280 | BM24: =RC[-46] -> 40365 | BN24: =RC[-46] -> 26910 | BO24: =RC[-46] -> 73922.81 | BP24: =RC[-46] -> 0 | BQ24: =RC[-46] -> 7318358.1900000004 | BR24: =RC[-46] -> 0 | BS24: =RC[-46] -> 0 | BT24: =RC[-46] -> 0 | BU24: =RC[-46] -> 0 | BV24: =RC[-46] -> 0 | BW24: =RC[-46] -> 0 | BX24: =RC[-46] -> 0 | BY24: =RC[-46] -> 0 | BZ24: =RC[-46] -> 0 | CA24: =RC[-46] -> 0 | CB24: =RC[-46] -> 0 | CC24: =RC[-46] -> 6712281 | CD24: =RC[-46] -> 0 | CE24: =RC[-46] -> 0 | CF24: =RC[-46] -> 0 | CG24: =RC[-46] -> 0 | CH24: =RC[-46] -> 0 | CI24: =RC[-46] -> 0 | CJ24: =RC[-46] -> 0 | CK24: =RC[-46] -> 0 | CL24: =RC[-46] -> 1 | CM24: =RC[-46] -> 0 | CN24: =RC[-46] -> 0 | CO24: =RC[-46] -> 7318358.1900000004 | CP24: =RC[-46] -> 0 | CQ24: =RC[-46] -> 0 | CR24: =RC[-46] -> 0 | CS24: =RC[-46] -> 0
A25: 5 | B25: 011085 | C25: Phạm Văn Chiến | D25: KS CNTT | E25: 19025934754011 | F25: =RC[29]+RC[30]+RC[31]+RC[32]+RC[33]+RC[34]+RC[35]+RC[36]+RC[37] -> 6712281 | G25: =RC[17]+RC[18]++RC[19]+RC[20]+RC[21]+RC[38]+RC[39]+RC[41] -> 0 | H25: 0 | I25: 0 | J25: =RC[-2]+RC[-1] -> 0 | K25: 0 | L25: 680000 | M25: 282555 | N25: =RC[15]+RC[16]+RC[17]+RC[18]+RC[19]+RC[20] -> 141750 | O25: 0 | P25: 0 | Q25: 7816586 | R25: 215280 | S25: 40365 | T25: 26910 | U25: 75340.31 | V25: 0 | W25: 7458690.6900000004 | X25: 0 | Y25: 0 | Z25: 0 | AA25: 0 | AB25: 0 | AC25: 0 | AD25: 0 | AE25: 0 | AF25: 0 | AG25: 0 | AH25: 141750 | AI25: 6712281 | AJ25: 0 | AK25: 0 | AL25: 0 | AM25: 0 | AN25: 0 | AO25: 0 | AP25: 0 | AQ25: 0 | AR25: =1 -> 1 | AS25: 0 | AT25: 0 | AU25: =RC[-30]-RC[-29]-RC[-28]-RC[-27]-RC[-26]-RC[-25] -> 7458690.6900000004 | AV25: 0 | AW25: =RC[1]-RC[2] -> 47250 | AX25: 141750 | AY25: 94500 | AZ25: =RC[-46] -> 6712281 | BA25: =RC[-46] -> 0 | BB25: =RC[-46] -> 0 | BC25: =RC[-46] -> 0 | BD25: =RC[-46] -> 0 | BE25: =RC[-46] -> 0 | BF25: =RC[-46] -> 680000 | BG25: =RC[-46] -> 282555 | BH25: =RC[-46] -> 141750 | BI25: =RC[-46] -> 0 | BJ25: =RC[-46] -> 0 | BK25: =RC[-46] -> 7816586 | BL25: =RC[-46] -> 215280 | BM25: =RC[-46] -> 40365 | BN25: =RC[-46] -> 26910 | BO25: =RC[-46] -> 75340.31 | BP25: =RC[-46] -> 0 | BQ25: =RC[-46] -> 7458690.6900000004 | BR25: =RC[-46] -> 0 | BS25: =RC[-46] -> 0 | BT25: =RC[-46] -> 0 | BU25: =RC[-46] -> 0 | BV25: =RC[-46] -> 0 | BW25: =RC[-46] -> 0 | BX25: =RC[-46] -> 0 | BY25: =RC[-46] -> 0 | BZ25: =RC[-46] -> 0 | CA25: =RC[-46] -> 0 | CB25: =RC[-46] -> 141750 | CC25: =RC[-46] -> 6712281 | CD25: =RC[-46] -> 0 | CE25: =RC[-46] -> 0 | CF25: =RC[-46] -> 0 | CG25: =RC[-46] -> 0 | CH25: =RC[-46] -> 0 | CI25: =RC[-46] -> 0 | CJ25: =RC[-46] -> 0 | CK25: =RC[-46] -> 0 | CL25: =RC[-46] -> 1 | CM25: =RC[-46] -> 0 | CN25: =RC[-46] -> 0 | CO25: =RC[-46] -> 7458690.6900000004 | CP25: =RC[-46] -> 0 | CQ25: =RC[-46] -> 47250 | CR25: =RC[-46] -> 141750 | CS25: =RC[-46] -> 94500
A26: 6 | B26: 011862 | C26: Đỗ Việt Anh | D26: Nhân viên CNTT | E26: 19027844882013 | F26: =RC[29]+RC[30]+RC[31]+RC[32]+RC[33]+RC[34]+RC[35]+RC[36]+RC[37] -> 7047895 | G26: =RC[17]+RC[18]++RC[19]+RC[20]+RC[21]+RC[38]+RC[39]+RC[41] -> 0 | H26: 0 | I26: 0 | J26: =RC[-2]+RC[-1] -> 0 | K26: 0 | L26: 680000 | M26: 282555 | N26: =RC[15]+RC[16]+RC[17]+RC[18]+RC[19]+RC[20] -> 0 | O26: 0 | P26: 0 | Q26: 8010450 | R26: 215280 | S26: 40365 | T26: 26910 | U26: 77278.95 | V26: 0 | W26: 7650616.0499999998 | X26: 0 | Y26: 0 | Z26: 0 | AA26: 0 | AB26: 0 | AC26: 0 | AD26: 0 | AE26: 0 | AF26: 0 | AG26: 0 | AH26: 0 | AI26: 7047895 | AJ26: 0 | AK26: 0 | AL26: 0 | AM26: 0 | AN26: 0 | AO26: 0 | AP26: 0 | AQ26: 0 | AR26: =1 -> 1 | AS26: 0 | AT26: 0 | AU26: =RC[-30]-RC[-29]-RC[-28]-RC[-27]-RC[-26]-RC[-25] -> 7650616.0499999998 | AV26: 0 | AW26: =RC[1]-RC[2] -> 0 | AX26: 0 | AY26: 0 | AZ26: =RC[-46] -> 7047895 | BA26: =RC[-46] -> 0 | BB26: =RC[-46] -> 0 | BC26: =RC[-46] -> 0 | BD26: =RC[-46] -> 0 | BE26: =RC[-46] -> 0 | BF26: =RC[-46] -> 680000 | BG26: =RC[-46] -> 282555 | BH26: =RC[-46] -> 0 | BI26: =RC[-46] -> 0 | BJ26: =RC[-46] -> 0 | BK26: =RC[-46] -> 8010450 | BL26: =RC[-46] -> 215280 | BM26: =RC[-46] -> 40365 | BN26: =RC[-46] -> 26910 | BO26: =RC[-46] -> 77278.95 | BP26: =RC[-46] -> 0 | BQ26: =RC[-46] -> 7650616.0499999998 | BR26: =RC[-46] -> 0 | BS26: =RC[-46] -> 0 | BT26: =RC[-46] -> 0 | BU26: =RC[-46] -> 0 | BV26: =RC[-46] -> 0 | BW26: =RC[-46] -> 0 | BX26: =RC[-46] -> 0 | BY26: =RC[-46] -> 0 | BZ26: =RC[-46] -> 0 | CA26: =RC[-46] -> 0 | CB26: =RC[-46] -> 0 | CC26: =RC[-46] -> 7047895 | CD26: =RC[-46] -> 0 | CE26: =RC[-46] -> 0 | CF26: =RC[-46] -> 0 | CG26: =RC[-46] -> 0 | CH26: =RC[-46] -> 0 | CI26: =RC[-46] -> 0 | CJ26: =RC[-46] -> 0 | CK26: =RC[-46] -> 0 | CL26: =RC[-46] -> 1 | CM26: =RC[-46] -> 0 | CN26: =RC[-46] -> 0 | CO26: =RC[-46] -> 7650616.0499999998 | CP26: =RC[-46] -> 0 | CQ26: =RC[-46] -> 0 | CR26: =RC[-46] -> 0 | CS26: =RC[-46] -> 0
A27: 7 | B27: 011767 | C27: Nguyễn Thành Trung | D27: NV HDCX - CBTT | E27: 19027358691011 | F27: =RC[29]+RC[30]+RC[31]+RC[32]+RC[33]+RC[34]+RC[35]+RC[36]+RC[37] -> 5253090 | G27: =RC[17]+RC[18]++RC[19]+RC[20]+RC[21]+RC[38]+RC[39]+RC[41] -> 0 | H27: 0 | I27: 0 | J27: =RC[-2]+RC[-1] -> 0 | K27: 0 | L27: 680000 | M27: 247538 | N27: =RC[15]+RC[16]+RC[17]+RC[18]+RC[19]+RC[20] -> 124183 | O27: 0 | P27: 0 | Q27: 6304811 | R27: 188600 | S27: 35363 | T27: 23575 | U27: 60572.73 | V27: 0 | W27: 5996700.2699999996 | X27: 0 | Y27: 0 | Z27: 0 | AA27: 0 | AB27: 0 | AC27: 0 | AD27: 0 | AE27: 0 | AF27: 0 | AG27: 0 | AH27: 124183 | AI27: 5253090 | AJ27: 0 | AK27: 0 | AL27: 0 | AM27: 0 | AN27: 0 | AO27: 0 | AP27: 0 | AQ27: 0 | AR27: =1 -> 1 | AS27: 0 | AT27: 0 | AU27: =RC[-30]-RC[-29]-RC[-28]-RC[-27]-RC[-26]-RC[-25] -> 5996700.2699999996 | AV27: 0 | AW27: =RC[1]-RC[2] -> 41394.332999999999 | AX27: 124183 | AY27: 82788.667000000001 | AZ27: =RC[-46] -> 5253090 | BA27: =RC[-46] -> 0 | BB27: =RC[-46] -> 0 | BC27: =RC[-46] -> 0 | BD27: =RC[-46] -> 0 | BE27: =RC[-46] -> 0 | BF27: =RC[-46] -> 680000 | BG27: =RC[-46] -> 247538 | BH27: =RC[-46] -> 124183 | BI27: =RC[-46] -> 0 | BJ27: =RC[-46] -> 0 | BK27: =RC[-46] -> 6304811 | BL27: =RC[-46] -> 188600 | BM27: =RC[-46] -> 35363 | BN27: =RC[-46] -> 23575 | BO27: =RC[-46] -> 60572.73 | BP27: =RC[-46] -> 0 | BQ27: =RC[-46] -> 5996700.2699999996 | BR27: =RC[-46] -> 0 | BS27: =RC[-46] -> 0 | BT27: =RC[-46] -> 0 | BU27: =RC[-46] -> 0 | BV27: =RC[-46] -> 0 | BW27: =RC[-46] -> 0 | BX27: =RC[-46] -> 0 | BY27: =RC[-46] -> 0 | BZ27: =RC[-46] -> 0 | CA27: =RC[-46] -> 0 | CB27: =RC[-46] -> 124183 | CC27: =RC[-46] -> 5253090 | CD27: =RC[-46] -> 0 | CE27: =RC[-46] -> 0 | CF27: =RC[-46] -> 0 | CG27: =RC[-46] -> 0 | CH27: =RC[-46] -> 0 | CI27: =RC[-46] -> 0 | CJ27: =RC[-46] -> 0 | CK27: =RC[-46] -> 0 | CL27: =RC[-46] -> 1 | CM27: =RC[-46] -> 0 | CN27: =RC[-46] -> 0 | CO27: =RC[-46] -> 5996700.2699999996 | CP27: =RC[-46] -> 0 | CQ27: =RC[-46] -> 41394.332999999999 | CR27: =RC[-46] -> 124183 | CS27: =RC[-46] -> 82788.667000000001
A28: 8 | B28: 010622 | C28: Trịnh Xuân Hải | D28: NV PVHK | E28: 10523498967011 | F28: =RC[29]+RC[30]+RC[31]+RC[32]+RC[33]+RC[34]+RC[35]+RC[36]+RC[37] -> 0 | G28: =RC[17]+RC[18]++RC[19]+RC[20]+RC[21]+RC[38]+RC[39]+RC[41] -> 581538 | H28: 0 | I28: 0 | J28: =RC[-2]+RC[-1] -> 0 | K28: 0 | L28: 0 | M28: 289800 | N28: =RC[15]+RC[16]+RC[17]+RC[18]+RC[19]+RC[20] -> 0 | O28: 0 | P28: 0 | Q28: 871338 | R28: 220800 | S28: 41400 | T28: 27600 | U28: 5815.38 | V28: 0 | W28: 575722.62 | X28: 0 | Y28: 581538 | Z28: 0 | AA28: 0 | AB28: 0 | AC28: 0 | AD28: 0 | AE28: 0 | AF28: 0 | AG28: 0 | AH28: 0 | AI28: 0 | AJ28: 0 | AK28: 0 | AL28: 0 | AM28: 0 | AN28: 0 | AO28: 0 | AP28: 0 | AQ28: 0 | AR28: =1 -> 1 | AS28: 0 | AT28: 0 | AU28: =RC[-30]-RC[-29]-RC[-28]-RC[-27]-RC[-26]-RC[-25] -> 575722.62 | AV28: 0 | AW28: =RC[1]-RC[2] -> 0 | AX28: 0 | AY28: 0 | AZ28: =RC[-46] -> 0 | BA28: =RC[-46] -> 581538 | BB28: =RC[-46] -> 0 | BC28: =RC[-46] -> 0 | BD28: =RC[-46] -> 0 | BE28: =RC[-46] -> 0 | BF28: =RC[-46] -> 0 | BG28: =RC[-46] -> 289800 | BH28: =RC[-46] -> 0 | BI28: =RC[-46] -> 0 | BJ28: =RC[-46] -> 0 | BK28: =RC[-46] -> 871338 | BL28: =RC[-46] -> 220800 | BM28: =RC[-46] -> 41400 | BN28: =RC[-46] -> 27600 | BO28: =RC[-46] -> 5815.38 | BP28: =RC[-46] -> 0 | BQ28: =RC[-46] -> 575722.62 | BR28: =RC[-46] -> 0 | BS28: =RC[-46] -> 581538 | BT28: =RC[-46] -> 0 | BU28: =RC[-46] -> 0 | BV28: =RC[-46] -> 0 | BW28: =RC[-46] -> 0 | BX28: =RC[-46] -> 0 | BY28: =RC[-46] -> 0 | BZ28: =RC[-46] -> 0 | CA28: =RC[-46] -> 0 | CB28: =RC[-46] -> 0 | CC28: =RC[-46] -> 0 | CD28: =RC[-46] -> 0 | CE28: =RC[-46] -> 0 | CF28: =RC[-46] -> 0 | CG28: =RC[-46] -> 0 | CH28: =RC[-46] -> 0 | CI28: =RC[-46] -> 0 | CJ28: =RC[-46] -> 0 | CK28: =RC[-46] -> 0 | CL28: =RC[-46] -> 1 | CM28: =RC[-46] -> 0 | CN28: =RC[-46] -> 0 | CO28: =RC[-46] -> 575722.62 | CP28: =RC[-46] -> 0 | CQ28: =RC[-46] -> 0 | CR28: =RC[-46] -> 0 | CS28: =RC[-46] -> 0
A29: 9 | B29: 010537 | C29: Bùi Anh Khắc | D29: NV Tài liệu và HDCX | E29: 10520235212015 | F29: =RC[29]+RC[30]+RC[31]+RC[32]+RC[33]+RC[34]+RC[35]+RC[36]+RC[37] -> 7529428 | G29: =RC[17]+RC[18]++RC[19]+RC[20]+RC[21]+RC[38]+RC[39]+RC[41] -> 0 | H29: 0 | I29: 0 | J29: =RC[-2]+RC[-1] -> 0 | K29: 210000 | L29: 680000 | M29: 339308 | N29: =RC[15]+RC[16]+RC[17]+RC[18]+RC[19]+RC[20] -> 170221 | O29: 0 | P29: 0 | Q29: 8928957 | R29: 258520 | S29: 48473 | T29: 32315 | U29: 85896.49 | V29: 0 | W29: 8503752.5099999998 | X29: 0 | Y29: 0 | Z29: 0 | AA29: 0 | AB29: 0 | AC29: 0 | AD29: 0 | AE29: 0 | AF29: 0 | AG29: 0 | AH29: 170221 | AI29: 7529428 | AJ29: 0 | AK29: 0 | AL29: 0 | AM29: 0 | AN29: 0 | AO29: 0 | AP29: 0 | AQ29: 0 | AR29: =1 -> 1 | AS29: 0 | AT29: 0 | AU29: =RC[-30]-RC[-29]-RC[-28]-RC[-27]-RC[-26]-RC[-25] -> 8503752.5099999998 | AV29: 0 | AW29: =RC[1]-RC[2] -> 56740.332999999999 | AX29: 170221 | AY29: 113480.667 | AZ29: =RC[-46] -> 7529428 | BA29: =RC[-46] -> 0 | BB29: =RC[-46] -> 0 | BC29: =RC[-46] -> 0 | BD29: =RC[-46] -> 0 | BE29: =RC[-46] -> 210000 | BF29: =RC[-46] -> 680000 | BG29: =RC[-46] -> 339308 | BH29: =RC[-46] -> 170221 | BI29: =RC[-46] -> 0 | BJ29: =RC[-46] -> 0 | BK29: =RC[-46] -> 8928957 | BL29: =RC[-46] -> 258520 | BM29: =RC[-46] -> 48473 | BN29: =RC[-46] -> 32315 | BO29: =RC[-46] -> 85896.49 | BP29: =RC[-46] -> 0 | BQ29: =RC[-46] -> 8503752.5099999998 | BR29: =RC[-46] -> 0 | BS29: =RC[-46] -> 0 | BT29: =RC[-46] -> 0 | BU29: =RC[-46] -> 0 | BV29: =RC[-46] -> 0 | BW29: =RC[-46] -> 0 | BX29: =RC[-46] -> 0 | BY29: =RC[-46] -> 0 | BZ29: =RC[-46] -> 0 | CA29: =RC[-46] -> 0 | CB29: =RC[-46] -> 170221 | CC29: =RC[-46] -> 7529428 | CD29: =RC[-46] -> 0 | CE29: =RC[-46] -> 0 | CF29: =RC[-46] -> 0 | CG29: =RC[-46] -> 0 | CH29: =RC[-46] -> 0 | CI29: =RC[-46] -> 0 | CJ29: =RC[-46] -> 0 | CK29: =RC[-46] -> 0 | CL29: =RC[-46] -> 1 | CM29: =RC[-46] -> 0 | CN29: =RC[-46] -> 0 | CO29: =RC[-46] -> 8503752.5099999998 | CP29: =RC[-46] -> 0 | CQ29: =RC[-46] -> 56740.332999999999 | CR29: =RC[-46] -> 170221 | CS29: =RC[-46] -> 113480.667
A30: 10 | B30: 010538 | C30: Nguyễn Danh Trường | D30: NV Tài liệu và HDCX | E30: 10522162555019 | F30: =RC[29]+RC[30]+RC[31]+RC[32]+RC[33]+RC[34]+RC[35]+RC[36]+RC[37] -> 5778399 | G30: =RC[17]+RC[18]++RC[19]+RC[20]+RC[21]+RC[38]+RC[39]+RC[41] -> 0 | H30: 0 | I30: 0 | J30: =RC[-2]+RC[-1] -> 0 | K30: 0 | L30: 680000 | M30: 339308 | N30: =RC[15]+RC[16]+RC[17]+RC[18]+RC[19]+RC[20] -> 170221 | O30: 0 | P30: 0 | Q30: 6967928 | R30: 258520 | S30: 48473 | T30: 32315 | U30: 66286.2 | V30: 0 | W30: 6562333.7999999998 | X30: 0 | Y30: 0 | Z30: 0 | AA30: 0 | AB30: 0 | AC30: 0 | AD30: 0 | AE30: 0 | AF30: 0 | AG30: 0 | AH30: 170221 | AI30: 5778399 | AJ30: 0 | AK30: 0 | AL30: 0 | AM30: 0 | AN30: 0 | AO30: 0 | AP30: 0 | AQ30: 0 | AR30: =1 -> 1 | AS30: 0 | AT30: 0 | AU30: =RC[-30]-RC[-29]-RC[-28]-RC[-27]-RC[-26]-RC[-25] -> 6562333.7999999998 | AV30: 0 | AW30: =RC[1]-RC[2] -> 56740.332999999999 | AX30: 170221 | AY30: 113480.667 | AZ30: =RC[-46] -> 5778399 | BA30: =RC[-46] -> 0 | BB30: =RC[-46] -> 0 | BC30: =RC[-46] -> 0 | BD30: =RC[-46] -> 0 | BE30: =RC[-46] -> 0 | BF30: =RC[-46] -> 680000 | BG30: =RC[-46] -> 339308 | BH30: =RC[-46] -> 170221 | BI30: =RC[-46] -> 0 | BJ30: =RC[-46] -> 0 | BK30: =RC[-46] -> 6967928 | BL30: =RC[-46] -> 258520 | BM30: =RC[-46] -> 48473 | BN30: =RC[-46] -> 32315 | BO30: =RC[-46] -> 66286.2 | BP30: =RC[-46] -> 0 | BQ30: =RC[-46] -> 6562333.7999999998 | BR30: =RC[-46] -> 0 | BS30: =RC[-46] -> 0 | BT30: =RC[-46] -> 0 | BU30: =RC[-46] -> 0 | BV30: =RC[-46] -> 0 | BW30: =RC[-46] -> 0 | BX30: =RC[-46] -> 0 | BY30: =RC[-46] -> 0 | BZ30: =RC[-46] -> 0 | CA30: =RC[-46] -> 0 | CB30: =RC[-46] -> 170221 | CC30: =RC[-46] -> 5778399 | CD30: =RC[-46] -> 0 | CE30: =RC[-46] -> 0 | CF30: =RC[-46] -> 0 | CG30: =RC[-46] -> 0 | CH30: =RC[-46] -> 0 | CI30: =RC[-46] -> 0 | CJ30: =RC[-46] -> 0 | CK30: =RC[-46] -> 0 | CL30: =RC[-46] -> 1 | CM30: =RC[-46] -> 0 | CN30: =RC[-46] -> 0 | CO30: =RC[-46] -> 6562333.7999999998 | CP30: =RC[-46] -> 0 | CQ30: =RC[-46] -> 56740.332999999999 | CR30: =RC[-46] -> 170221 | CS30: =RC[-46] -> 113480.667
A31: 11 | B31: 010540 | C31: Nguyễn Thị Việt Hà | D31: NV Tài liệu và HDCX | E31: 10520381936017 | F31: =RC[29]+RC[30]+RC[31]+RC[32]+RC[33]+RC[34]+RC[35]+RC[36]+RC[37] -> 5399009 | G31: =RC[17]+RC[18]++RC[19]+RC[20]+RC[21]+RC[38]+RC[39]+RC[41] -> 0 | H31: 0 | I31: 0 | J31: =RC[-2]+RC[-1] -> 0 | K31: 0 | L31: 680000 | M31: 247538 | N31: =RC[15]+RC[16]+RC[17]+RC[18]+RC[19]+RC[20] -> 124183 | O31: 0 | P31: 0 | Q31: 6450730 | R31: 188600 | S31: 35363 | T31: 23575 | U31: 62031.92 | V31: 0 | W31: 6141160.0800000001 | X31: 0 | Y31: 0 | Z31: 0 | AA31: 0 | AB31: 0 | AC31: 0 | AD31: 0 | AE31: 0 | AF31: 0 | AG31: 0 | AH31: 124183 | AI31: 5399009 | AJ31: 0 | AK31: 0 | AL31: 0 | AM31: 0 | AN31: 0 | AO31: 0 | AP31: 0 | AQ31: 0 | AR31: =1 -> 1 | AS31: 0 | AT31: 0 | AU31: =RC[-30]-RC[-29]-RC[-28]-RC[-27]-RC[-26]-RC[-25] -> 6141160.0800000001 | AV31: 0 | AW31: =RC[1]-RC[2] -> 41394.332999999999 | AX31: 124183 | AY31: 82788.667000000001 | AZ31: =RC[-46] -> 5399009 | BA31: =RC[-46] -> 0 | BB31: =RC[-46] -> 0 | BC31: =RC[-46] -> 0 | BD31: =RC[-46] -> 0 | BE31: =RC[-46] -> 0 | BF31: =RC[-46] -> 680000 | BG31: =RC[-46] -> 247538 | BH31: =RC[-46] -> 124183 | BI31: =RC[-46] -> 0 | BJ31: =RC[-46] -> 0 | BK31: =RC[-46] -> 6450730 | BL31: =RC[-46] -> 188600 | BM31: =RC[-46] -> 35363 | BN31: =RC[-46] -> 23575 | BO31: =RC[-46] -> 62031.92 | BP31: =RC[-46] -> 0 | BQ31: =RC[-46] -> 6141160.0800000001 | BR31: =RC[-46] -> 0 | BS31: =RC[-46] -> 0 | BT31: =RC[-46] -> 0 | BU31: =RC[-46] -> 0 | BV31: =RC[-46] -> 0 | BW31: =RC[-46] -> 0 | BX31: =RC[-46] -> 0 | BY31: =RC[-46] -> 0 | BZ31: =RC[-46] -> 0 | CA31: =RC[-46] -> 0 | CB31: =RC[-46] -> 124183 | CC31: =RC[-46] -> 5399009 | CD31: =RC[-46] -> 0 | CE31: =RC[-46] -> 0 | CF31: =RC[-46] -> 0 | CG31: =RC[-46] -> 0 | CH31: =RC[-46] -> 0 | CI31: =RC[-46] -> 0 | CJ31: =RC[-46] -> 0 | CK31: =RC[-46] -> 0 | CL31: =RC[-46] -> 1 | CM31: =RC[-46] -> 0 | CN31: =RC[-46] -> 0 | CO31: =RC[-46] -> 6141160.0800000001 | CP31: =RC[-46] -> 0 | CQ31: =RC[-46] -> 41394.332999999999 | CR31: =RC[-46] -> 124183 | CS31: =RC[-46] -> 82788.667000000001
A32: 12 | B32: 010542 | C32: Trần Minh Hải | D32: NV Tài liệu và HDCX | E32: 10520489632014 | F32: =RC[29]+RC[30]+RC[31]+RC[32]+RC[33]+RC[34]+RC[35]+RC[36]+RC[37] -> 7587796 | G32: =RC[17]+RC[18]++RC[19]+RC[20]+RC[21]+RC[38]+RC[39]+RC[41] -> 0 | H32: 0 | I32: 0 | J32: =RC[-2]+RC[-1] -> 0 | K32: 0 | L32: 680000 | M32: 263235 | N32: =RC[15]+RC[16]+RC[17]+RC[18]+RC[19]+RC[20] -> 0 | O32: 0 | P32: 0 | Q32: 8531031 | R32: 200560 | S32: 37605 | T32: 25070 | U32: 82677.960000000006 | V32: 0 | W32: 8185118.04 | X32: 0 | Y32: 0 | Z32: 0 | AA32: 0 | AB32: 0 | AC32: 0 | AD32: 0 | AE32: 0 | AF32: 0 | AG32: 0 | AH32: 0 | AI32: 7587796 | AJ32: 0 | AK32: 0 | AL32: 0 | AM32: 0 | AN32: 0 | AO32: 0 | AP32: 0 | AQ32: 0 | AR32: =1 -> 1 | AS32: 0 | AT32: 0 | AU32: =RC[-30]-RC[-29]-RC[-28]-RC[-27]-RC[-26]-RC[-25] -> 8185118.04 | AV32: 0 | AW32: =RC[1]-RC[2] -> 0 | AX32: 0 | AY32: 0 | AZ32: =RC[-46] -> 7587796 | BA32: =RC[-46] -> 0 | BB32: =RC[-46] -> 0 | BC32: =RC[-46] -> 0 | BD32: =RC[-46] -> 0 | BE32: =RC[-46] -> 0 | BF32: =RC[-46] -> 680000 | BG32: =RC[-46] -> 263235 | BH32: =RC[-46] -> 0 | BI32: =RC[-46] -> 0 | BJ32: =RC[-46] -> 0 | BK32: =RC[-46] -> 8531031 | BL32: =RC[-46] -> 200560 | BM32: =RC[-46] -> 37605 | BN32: =RC[-46] -> 25070 | BO32: =RC[-46] -> 82677.960000000006 | BP32: =RC[-46] -> 0 | BQ32: =RC[-46] -> 8185118.04 | BR32: =RC[-46] -> 0 | BS32: =RC[-46] -> 0 | BT32: =RC[-46] -> 0 | BU32: =RC[-46] -> 0 | BV32: =RC[-46] -> 0 | BW32: =RC[-46] -> 0 | BX32: =RC[-46] -> 0 | BY32: =RC[-46] -> 0 | BZ32: =RC[-46] -> 0 | CA32: =RC[-46] -> 0 | CB32: =RC[-46] -> 0 | CC32: =RC[-46] -> 7587796 | CD32: =RC[-46] -> 0 | CE32: =RC[-46] -> 0 | CF32: =RC[-46] -> 0 | CG32: =RC[-46] -> 0 | CH32: =RC[-46] -> 0 | CI32: =RC[-46] -> 0 | CJ32: =RC[-46] -> 0 | CK32: =RC[-46] -> 0 | CL32: =RC[-46] -> 1 | CM32: =RC[-46] -> 0 | CN32: =RC[-46] -> 0 | CO32: =RC[-46] -> 8185118.04 | CP32: =RC[-46] -> 0 | CQ32: =RC[-46] -> 0 | CR32: =RC[-46] -> 0 | CS32: =RC[-46] -> 0
A33: 13 | B33: 010543 | C33: Nguyễn Thị Thơm | D33: NV Tài liệu và HDCX | E33: 10525139522013 | F33: =RC[29]+RC[30]+RC[31]+RC[32]+RC[33]+RC[34]+RC[35]+RC[36]+RC[37] -> 2387237 | G33: =RC[17]+RC[18]++RC[19]+RC[20]+RC[21]+RC[38]+RC[39]+RC[41] -> 0 | H33: 0 | I33: 0 | J33: =RC[-2]+RC[-1] -> 0 | K33: 0 | L33: 0 | M33: 0 | N33: =RC[15]+RC[16]+RC[17]+RC[18]+RC[19]+RC[20] -> 0 | O33: 0 | P33: 0 | Q33: 2387237 | R33: 0 | S33: 0 | T33: 0 | U33: 23872.37 | V33: 0 | W33: 2363364.63 | X33: 0 | Y33: 0 | Z33: 0 | AA33: 0 | AB33: 0 | AC33: 0 | AD33: 0 | AE33: 0 | AF33: 0 | AG33: 0 | AH33: 0 | AI33: 0 | AJ33: 2387237 | AK33: 0 | AL33: 0 | AM33: 0 | AN33: 0 | AO33: 0 | AP33: 0 | AQ33: 0 | AR33: =1 -> 1 | AS33: 0 | AT33: 0 | AU33: =RC[-30]-RC[-29]-RC[-28]-RC[-27]-RC[-26]-RC[-25] -> 2363364.63 | AV33: 0 | AW33: =RC[1]-RC[2] -> 0 | AX33: 0 | AY33: 0 | AZ33: =RC[-46] -> 2387237 | BA33: =RC[-46] -> 0 | BB33: =RC[-46] -> 0 | BC33: =RC[-46] -> 0 | BD33: =RC[-46] -> 0 | BE33: =RC[-46] -> 0 | BF33: =RC[-46] -> 0 | BG33: =RC[-46] -> 0 | BH33: =RC[-46] -> 0 | BI33: =RC[-46] -> 0 | BJ33: =RC[-46] -> 0 | BK33: =RC[-46] -> 2387237 | BL33: =RC[-46] -> 0 | BM33: =RC[-46] -> 0 | BN33: =RC[-46] -> 0 | BO33: =RC[-46] -> 23872.37 | BP33: =RC[-46] -> 0 | BQ33: =RC[-46] -> 2363364.63 | BR33: =RC[-46] -> 0 | BS33: =RC[-46] -> 0 | BT33: =RC[-46] -> 0 | BU33: =RC[-46] -> 0 | BV33: =RC[-46] -> 0 | BW33: =RC[-46] -> 0 | BX33: =RC[-46] -> 0 | BY33: =RC[-46] -> 0 | BZ33: =RC[-46] -> 0 | CA33: =RC[-46] -> 0 | CB33: =RC[-46] -> 0 | CC33: =RC[-46] -> 0 | CD33: =RC[-46] -> 2387237 | CE33: =RC[-46] -> 0 | CF33: =RC[-46] -> 0 | CG33: =RC[-46] -> 0 | CH33: =RC[-46] -> 0 | CI33: =RC[-46] -> 0 | CJ33: =RC[-46] -> 0 | CK33: =RC[-46] -> 0 | CL33: =RC[-46] -> 1 | CM33: =RC[-46] -> 0 | CN33: =RC[-46] -> 0 | CO33: =RC[-46] -> 2363364.63 | CP33: =RC[-46] -> 0 | CQ33: =RC[-46] -> 0 | CR33: =RC[-46] -> 0 | CS33: =RC[-46] -> 0
A34: 14 | B34: 010544 | C34: Trần Thị Yến Nga | D34: NV Tài liệu và HDCX | E34: 10525139524016 | F34: =RC[29]+RC[30]+RC[31]+RC[32]+RC[33]+RC[34]+RC[35]+RC[36]+RC[37] -> 3945654 | G34: =RC[17]+RC[18]++RC[19]+RC[20]+RC[21]+RC[38]+RC[39]+RC[41] -> 0 | H34: 0 | I34: 0 | J34: =RC[-2]+RC[-1] -> 0 | K34: 0 | L34: 496923 | M34: 247538 | N34: =RC[15]+RC[16]+RC[17]+RC[18]+RC[19]+RC[20] -> 0 | O34: 0 | P34: 0 | Q34: 4690115 | R34: 188600 | S34: 35363 | T34: 23575 | U34: 44425.77 | V34: 0 | W34: 4398151.2300000004 | X34: 0 | Y34: 0 | Z34: 0 | AA34: 0 | AB34: 0 | AC34: 0 | AD34: 0 | AE34: 0 | AF34: 0 | AG34: 0 | AH34: 0 | AI34: 3945654 | AJ34: 0 | AK34: 0 | AL34: 0 | AM34: 0 | AN34: 0 | AO34: 0 | AP34: 0 | AQ34: 0 | AR34: =1 -> 1 | AS34: 0 | AT34: 0 | AU34: =RC[-30]-RC[-29]-RC[-28]-RC[-27]-RC[-26]-RC[-25] -> 4398151.2300000004 | AV34: 0 | AW34: =RC[1]-RC[2] -> 0 | AX34: 0 | AY34: 0 | AZ34: =RC[-46] -> 3945654 | BA34: =RC[-46] -> 0 | BB34: =RC[-46] -> 0 | BC34: =RC[-46] -> 0 | BD34: =RC[-46] -> 0 | BE34: =RC[-46] -> 0 | BF34: =RC[-46] -> 496923 | BG34: =RC[-46] -> 247538 | BH34: =RC[-46] -> 0 | BI34: =RC[-46] -> 0 | BJ34: =RC[-46] -> 0 | BK34: =RC[-46] -> 4690115 | BL34: =RC[-46] -> 188600 | BM34: =RC[-46] -> 35363 | BN34: =RC[-46] -> 23575 | BO34: =RC[-46] -> 44425.77 | BP34: =RC[-46] -> 0 | BQ34: =RC[-46] -> 4398151.2300000004 | BR34: =RC[-46] -> 0 | BS34: =RC[-46] -> 0 | BT34: =RC[-46] -> 0 | BU34: =RC[-46] -> 0 | BV34: =RC[-46] -> 0 | BW34: =RC[-46] -> 0 | BX34: =RC[-46] -> 0 | BY34: =RC[-46] -> 0 | BZ34: =RC[-46] -> 0 | CA34: =RC[-46] -> 0 | CB34: =RC[-46] -> 0 | CC34: =RC[-46] -> 3945654 | CD34: =RC[-46] -> 0 | CE34: =RC[-46] -> 0 | CF34: =RC[-46] -> 0 | CG34: =RC[-46] -> 0 | CH34: =RC[-46] -> 0 | CI34: =RC[-46] -> 0 | CJ34: =RC[-46] -> 0 | CK34: =RC[-46] -> 0 | CL34: =RC[-46] -> 1 | CM34: =RC[-46] -> 0 | CN34: =RC[-46] -> 0 | CO34: =RC[-46] -> 4398151.2300000004 | CP34: =RC[-46] -> 0 | CQ34: =RC[-46] -> 0 | CR34: =RC[-46] -> 0 | CS34: =RC[-46] -> 0
A35: 15 | B35: 010545 | C35: Ngô Thanh Hiệp | D35: NV Tài liệu và HDCX | E35: 10320765759016 | F35: =RC[29]+RC[30]+RC[31]+RC[32]+RC[33]+RC[34]+RC[35]+RC[36]+RC[37] -> 7587796 | G35: =RC[17]+RC[18]++RC[19]+RC[20]+RC[21]+RC[38]+RC[39]+RC[41] -> 0 | H35: 0 | I35: 0 | J35: =RC[-2]+RC[-1] -> 0 | K35: 0 | L35: 680000 | M35: 263235 | N35: =RC[15]+RC[16]+RC[17]+RC[18]+RC[19]+RC[20] -> 132058 | O35: 0 | P35: 0 | Q35: 8663089 | R35: 200560 | S35: 37605 | T35: 25070 | U35: 83998.54 | V35: 0 | W35: 8315855.46 | X35: 0 | Y35: 0 | Z35: 0 | AA35: 0 | AB35: 0 | AC35: 0 | AD35: 0 | AE35: 0 | AF35: 0 | AG35: 0 | AH35: 132058 | AI35: 7587796 | AJ35: 0 | AK35: 0 | AL35: 0 | AM35: 0 | AN35: 0 | AO35: 0 | AP35: 0 | AQ35: 0 | AR35: =1 -> 1 | AS35: 0 | AT35: 0 | AU35: =RC[-30]-RC[-29]-RC[-28]-RC[-27]-RC[-26]-RC[-25] -> 8315855.46 | AV35: 0 | AW35: =RC[1]-RC[2] -> 44019.332999999999 | AX35: 132058 | AY35: 88038.667000000001 | AZ35: =RC[-46] -> 7587796 | BA35: =RC[-46] -> 0 | BB35: =RC[-46] -> 0 | BC35: =RC[-46] -> 0 | BD35: =RC[-46] -> 0 | BE35: =RC[-46] -> 0 | BF35: =RC[-46] -> 680000 | BG35: =RC[-46] -> 263235 | BH35: =RC[-46] -> 132058 | BI35: =RC[-46] -> 0 | BJ35: =RC[-46] -> 0 | BK35: =RC[-46] -> 8663089 | BL35: =RC[-46] -> 200560 | BM35: =RC[-46] -> 37605 | BN35: =RC[-46] -> 25070 | BO35: =RC[-46] -> 83998.54 | BP35: =RC[-46] -> 0 | BQ35: =RC[-46] -> 8315855.46 | BR35: =RC[-46] -> 0 | BS35: =RC[-46] -> 0 | BT35: =RC[-46] -> 0 | BU35: =RC[-46] -> 0 | BV35: =RC[-46] -> 0 | BW35: =RC[-46] -> 0 | BX35: =RC[-46] -> 0 | BY35: =RC[-46] -> 0 | BZ35: =RC[-46] -> 0 | CA35: =RC[-46] -> 0 | CB35: =RC[-46] -> 132058 | CC35: =RC[-46] -> 7587796 | CD35: =RC[-46] -> 0 | CE35: =RC[-46] -> 0 | CF35: =RC[-46] -> 0 | CG35: =RC[-46] -> 0 | CH35: =RC[-46] -> 0 | CI35: =RC[-46] -> 0 | CJ35: =RC[-46] -> 0 | CK35: =RC[-46] -> 0 | CL35: =RC[-46] -> 1 | CM35: =RC[-46] -> 0 | CN35: =RC[-46] -> 0 | CO35: =RC[-46] -> 8315855.46 | CP35: =RC[-46] -> 0 | CQ35: =RC[-46] -> 44019.332999999999 | CR35: =RC[-46] -> 132058 | CS35: =RC[-46] -> 88038.667000000001
A36: 16 | B36: 010546 | C36: Tạ Đăng Việt | D36: NV Tài liệu và HDCX | E36: 10525139515017 | F36: =RC[29]+RC[30]+RC[31]+RC[32]+RC[33]+RC[34]+RC[35]+RC[36]+RC[37] -> 6070237 | G36: =RC[17]+RC[18]++RC[19]+RC[20]+RC[21]+RC[38]+RC[39]+RC[41] -> 0 | H36: 0 | I36: 0 | J36: =RC[-2]+RC[-1] -> 0 | K36: 0 | L36: 680000 | M36: 247538 | N36: =RC[15]+RC[16]+RC[17]+RC[18]+RC[19]+RC[20] -> 248365 | O36: 0 | P36: 0 | Q36: 7246140 | R36: 188600 | S36: 35363 | T36: 23575 | U36: 69986.02 | V36: 0 | W36: 6928615.9800000004 | X36: 0 | Y36: 0 | Z36: 0 | AA36: 0 | AB36: 0 | AC36: 0 | AD36: 0 | AE36: 0 | AF36: 0 | AG36: 0 | AH36: 248365 | AI36: 6070237 | AJ36: 0 | AK36: 0 | AL36: 0 | AM36: 0 | AN36: 0 | AO36: 0 | AP36: 0 | AQ36: 0 | AR36: =1 -> 1 | AS36: 0 | AT36: 0 | AU36: =RC[-30]-RC[-29]-RC[-28]-RC[-27]-RC[-26]-RC[-25] -> 6928615.9800000004 | AV36: 0 | AW36: =RC[1]-RC[2] -> 82788.333000000013 | AX36: 248365 | AY36: 165576.66699999999 | AZ36: =RC[-46] -> 6070237 | BA36: =RC[-46] -> 0 | BB36: =RC[-46] -> 0 | BC36: =RC[-46] -> 0 | BD36: =RC[-46] -> 0 | BE36: =RC[-46] -> 0 | BF36: =RC[-46] -> 680000 | BG36: =RC[-46] -> 247538 | BH36: =RC[-46] -> 248365 | BI36: =RC[-46] -> 0 | BJ36: =RC[-46] -> 0 | BK36: =RC[-46] -> 7246140 | BL36: =RC[-46] -> 188600 | BM36: =RC[-46] -> 35363 | BN36: =RC[-46] -> 23575 | BO36: =RC[-46] -> 69986.02 | BP36: =RC[-46] -> 0 | BQ36: =RC[-46] -> 6928615.9800000004 | BR36: =RC[-46] -> 0 | BS36: =RC[-46] -> 0 | BT36: =RC[-46] -> 0 | BU36: =RC[-46] -> 0 | BV36: =RC[-46] -> 0 | BW36: =RC[-46] -> 0 | BX36: =RC[-46] -> 0 | BY36: =RC[-46] -> 0 | BZ36: =RC[-46] -> 0 | CA36: =RC[-46] -> 0 | CB36: =RC[-46] -> 248365 | CC36: =RC[-46] -> 6070237 | CD36: =RC[-46] -> 0 | CE36: =RC[-46] -> 0 | CF36: =RC[-46] -> 0 | CG36: =RC[-46] -> 0 | CH36: =RC[-46] -> 0 | CI36: =RC[-46] -> 0 | CJ36: =RC[-46] -> 0 | CK36: =RC[-46] -> 0 | CL36: =RC[-46] -> 1 | CM36: =RC[-46] -> 0 | CN36: =RC[-46] -> 0 | CO36: =RC[-46] -> 6928615.9800000004 | CP36: =RC[-46] -> 0 | CQ36: =RC[-46] -> 82788.333000000013 | CR36: =RC[-46] -> 248365 | CS36: =RC[-46] -> 165576.66699999999
A37: 17 | B37: 010547 | C37: Đào Thanh Hải | D37: NV Tài liệu và HDCX | E37: 10525139517011 | F37: =RC[29]+RC[30]+RC[31]+RC[32]+RC[33]+RC[34]+RC[35]+RC[36]+RC[37] -> 5544928 | G37: =RC[17]+RC[18]++RC[19]+RC[20]+RC[21]+RC[38]+RC[39]+RC[41] -> 0 | H37: 0 | I37: 0 | J37: =RC[-2]+RC[-1] -> 0 | K37: 0 | L37: 680000 | M37: 247538 | N37: =RC[15]+RC[16]+RC[17]+RC[18]+RC[19]+RC[20] -> 0 | O37: 0 | P37: 0 | Q37: 6472466 | R37: 188600 | S37: 35363 | T37: 23575 | U37: 62249.279999999999 | V37: 0 | W37: 6162678.7199999997 | X37: 0 | Y37: 0 | Z37: 0 | AA37: 0 | AB37: 0 | AC37: 0 | AD37: 0 | AE37: 0 | AF37: 0 | AG37: 0 | AH37: 0 | AI37: 5544928 | AJ37: 0 | AK37: 0 | AL37: 0 | AM37: 0 | AN37: 0 | AO37: 0 | AP37: 0 | AQ37: 0 | AR37: =1 -> 1 | AS37: 0 | AT37: 0 | AU37: =RC[-30]-RC[-29]-RC[-28]-RC[-27]-RC[-26]-RC[-25] -> 6162678.7199999997 | AV37: 0 | AW37: =RC[1]-RC[2] -> 0 | AX37: 0 | AY37: 0 | AZ37: =RC[-46] -> 5544928 | BA37: =RC[-46] -> 0 | BB37: =RC[-46] -> 0 | BC37: =RC[-46] -> 0 | BD37: =RC[-46] -> 0 | BE37: =RC[-46] -> 0 | BF37: =RC[-46] -> 680000 | BG37: =RC[-46] -> 247538 | BH37: =RC[-46] -> 0 | BI37: =RC[-46] -> 0 | BJ37: =RC[-46] -> 0 | BK37: =RC[-46] -> 6472466 | BL37: =RC[-46] -> 188600 | BM37: =RC[-46] -> 35363 | BN37: =RC[-46] -> 23575 | BO37: =RC[-46] -> 62249.279999999999 | BP37: =RC[-46] -> 0 | BQ37: =RC[-46] -> 6162678.7199999997 | BR37: =RC[-46] -> 0 | BS37: =RC[-46] -> 0 | BT37: =RC[-46] -> 0 | BU37: =RC[-46] -> 0 | BV37: =RC[-46] -> 0 | BW37: =RC[-46] -> 0 | BX37: =RC[-46] -> 0 | BY37: =RC[-46] -> 0 | BZ37: =RC[-46] -> 0 | CA37: =RC[-46] -> 0 | CB37: =RC[-46] -> 0 | CC37: =RC[-46] -> 5544928 | CD37: =RC[-46] -> 0 | CE37: =RC[-46] -> 0 | CF37: =RC[-46] -> 0 | CG37: =RC[-46] -> 0 | CH37: =RC[-46] -> 0 | CI37: =RC[-46] -> 0 | CJ37: =RC[-46] -> 0 | CK37: =RC[-46] -> 0 | CL37: =RC[-46] -> 1 | CM37: =RC[-46] -> 0 | CN37: =RC[-46] -> 0 | CO37: =RC[-46] -> 6162678.7199999997 | CP37: =RC[-46] -> 0 | CQ37: =RC[-46] -> 0 | CR37: =RC[-46] -> 0 | CS37: =RC[-46] -> 0
A38: 18 | B38: 010548 | C38: Đỗ Vũ Hồng Quân | D38: NV Tài liệu và HDCX | E38: 10523498959017 | F38: =RC[29]+RC[30]+RC[31]+RC[32]+RC[33]+RC[34]+RC[35]+RC[36]+RC[37] -> 3872694 | G38: =RC[17]+RC[18]++RC[19]+RC[20]+RC[21]+RC[38]+RC[39]+RC[41] -> 0 | H38: 0 | I38: 0 | J38: =RC[-2]+RC[-1] -> 0 | K38: 0 | L38: 680000 | M38: 289800 | N38: =RC[15]+RC[16]+RC[17]+RC[18]+RC[19]+RC[20] -> 0 | O38: 0 | P38: 0 | Q38: 4842494 | R38: 220800 | S38: 41400 | T38: 27600 | U38: 45526.94 | V38: 0 | W38: 4507167.0599999996 | X38: 0 | Y38: 0 | Z38: 0 | AA38: 0 | AB38: 0 | AC38: 0 | AD38: 0 | AE38: 0 | AF38: 0 | AG38: 0 | AH38: 0 | AI38: 3872694 | AJ38: 0 | AK38: 0 | AL38: 0 | AM38: 0 | AN38: 0 | AO38: 0 | AP38: 0 | AQ38: 0 | AR38: =1 -> 1 | AS38: 0 | AT38: 0 | AU38: =RC[-30]-RC[-29]-RC[-28]-RC[-27]-RC[-26]-RC[-25] -> 4507167.0599999996 | AV38: 0 | AW38: =RC[1]-RC[2] -> 0 | AX38: 0 | AY38: 0 | AZ38: =RC[-46] -> 3872694 | BA38: =RC[-46] -> 0 | BB38: =RC[-46] -> 0 | BC38: =RC[-46] -> 0 | BD38: =RC[-46] -> 0 | BE38: =RC[-46] -> 0 | BF38: =RC[-46] -> 680000 | BG38: =RC[-46] -> 289800 | BH38: =RC[-46] -> 0 | BI38: =RC[-46] -> 0 | BJ38: =RC[-46] -> 0 | BK38: =RC[-46] -> 4842494 | BL38: =RC[-46] -> 220800 | BM38: =RC[-46] -> 41400 | BN38: =RC[-46] -> 27600 | BO38: =RC[-46] -> 45526.94 | BP38: =RC[-46] -> 0 | BQ38: =RC[-46] -> 4507167.0599999996 | BR38: =RC[-46] -> 0 | BS38: =RC[-46] -> 0 | BT38: =RC[-46] -> 0 | BU38: =RC[-46] -> 0 | BV38: =RC[-46] -> 0 | BW38: =RC[-46] -> 0 | BX38: =RC[-46] -> 0 | BY38: =RC[-46] -> 0 | BZ38: =RC[-46] -> 0 | CA38: =RC[-46] -> 0 | CB38: =RC[-46] -> 0 | CC38: =RC[-46] -> 3872694 | CD38: =RC[-46] -> 0 | CE38: =RC[-46] -> 0 | CF38: =RC[-46] -> 0 | CG38: =RC[-46] -> 0 | CH38: =RC[-46] -> 0 | CI38: =RC[-46] -> 0 | CJ38: =RC[-46] -> 0 | CK38: =RC[-46] -> 0 | CL38: =RC[-46] -> 1 | CM38: =RC[-46] -> 0 | CN38: =RC[-46] -> 0 | CO38: =RC[-46] -> 4507167.0599999996 | CP38: =RC[-46] -> 0 | CQ38: =RC[-46] -> 0 | CR38: =RC[-46] -> 0 | CS38: =RC[-46] -> 0
A39: 19 | B39: 010549 | C39: Nguyễn Thanh Hải | D39: NV Tài liệu và HDCX | E39: 10523498941010 | F39: =RC[29]+RC[30]+RC[31]+RC[32]+RC[33]+RC[34]+RC[35]+RC[36]+RC[37] -> 6373749 | G39: =RC[17]+RC[18]++RC[19]+RC[20]+RC[21]+RC[38]+RC[39]+RC[41] -> 0 | H39: 0 | I39: 0 | J39: =RC[-2]+RC[-1] -> 0 | K39: 0 | L39: 680000 | M39: 289800 | N39: =RC[15]+RC[16]+RC[17]+RC[18]+RC[19]+RC[20] -> 145385 | O39: 0 | P39: 0 | Q39: 7488934 | R39: 220800 | S39: 41400 | T39: 27600 | U39: 71991.34 | V39: 0 | W39: 7127142.6600000001 | X39: 0 | Y39: 0 | Z39: 0 | AA39: 0 | AB39: 0 | AC39: 0 | AD39: 0 | AE39: 0 | AF39: 0 | AG39: 0 | AH39: 145385 | AI39: 6373749 | AJ39: 0 | AK39: 0 | AL39: 0 | AM39: 0 | AN39: 0 | AO39: 0 | AP39: 0 | AQ39: 0 | AR39: =1 -> 1 | AS39: 0 | AT39: 0 | AU39: =RC[-30]-RC[-29]-RC[-28]-RC[-27]-RC[-26]-RC[-25] -> 7127142.6600000001 | AV39: 0 | AW39: =RC[1]-RC[2] -> 48461.667000000001 | AX39: 145385 | AY39: 96923.332999999999 | AZ39: =RC[-46] -> 6373749 | BA39: =RC[-46] -> 0 | BB39: =RC[-46] -> 0 | BC39: =RC[-46] -> 0 | BD39: =RC[-46] -> 0 | BE39: =RC[-46] -> 0 | BF39: =RC[-46] -> 680000 | BG39: =RC[-46] -> 289800 | BH39: =RC[-46] -> 145385 | BI39: =RC[-46] -> 0 | BJ39: =RC[-46] -> 0 | BK39: =RC[-46] -> 7488934 | BL39: =RC[-46] -> 220800 | BM39: =RC[-46] -> 41400 | BN39: =RC[-46] -> 27600 | BO39: =RC[-46] -> 71991.34 | BP39: =RC[-46] -> 0 | BQ39: =RC[-46] -> 7127142.6600000001 | BR39: =RC[-46] -> 0 | BS39: =RC[-46] -> 0 | BT39: =RC[-46] -> 0 | BU39: =RC[-46] -> 0 | BV39: =RC[-46] -> 0 | BW39: =RC[-46] -> 0 | BX39: =RC[-46] -> 0 | BY39: =RC[-46] -> 0 | BZ39: =RC[-46] -> 0 | CA39: =RC[-46] -> 0 | CB39: =RC[-46] -> 145385 | CC39: =RC[-46] -> 6373749 | CD39: =RC[-46] -> 0 | CE39: =RC[-46] -> 0 | CF39: =RC[-46] -> 0 | CG39: =RC[-46] -> 0 | CH39: =RC[-46] -> 0 | CI39: =RC[-46] -> 0 | CJ39: =RC[-46] -> 0 | CK39: =RC[-46] -> 0 | CL39: =RC[-46] -> 1 | CM39: =RC[-46] -> 0 | CN39: =RC[-46] -> 0 | CO39: =RC[-46] -> 7127142.6600000001 | CP39: =RC[-46] -> 0 | CQ39: =RC[-46] -> 48461.667000000001 | CR39: =RC[-46] -> 145385 | CS39: =RC[-46] -> 96923.332999999999
A40: 20 | B40: 010550 | C40: Vũ Đức Thiện | D40: NV Tài liệu và HDCX | E40: 10522162572010 | F40: =RC[29]+RC[30]+RC[31]+RC[32]+RC[33]+RC[34]+RC[35]+RC[36]+RC[37] -> 6239503 | G40: =RC[17]+RC[18]++RC[19]+RC[20]+RC[21]+RC[38]+RC[39]+RC[41] -> 0 | H40: 0 | I40: 0 | J40: =RC[-2]+RC[-1] -> 0 | K40: 0 | L40: 680000 | M40: 289800 | N40: =RC[15]+RC[16]+RC[17]+RC[18]+RC[19]+RC[20] -> 145385 | O40: 0 | P40: 0 | Q40: 7354688 | R40: 220800 | S40: 41400 | T40: 27600 | U40: 70648.88 | V40: 0 | W40: 6994239.1200000001 | X40: 0 | Y40: 0 | Z40: 0 | AA40: 0 | AB40: 0 | AC40: 0 | AD40: 0 | AE40: 0 | AF40: 0 | AG40: 0 | AH40: 145385 | AI40: 6239503 | AJ40: 0 | AK40: 0 | AL40: 0 | AM40: 0 | AN40: 0 | AO40: 0 | AP40: 0 | AQ40: 0 | AR40: =1 -> 1 | AS40: 0 | AT40: 0 | AU40: =RC[-30]-RC[-29]-RC[-28]-RC[-27]-RC[-26]-RC[-25] -> 6994239.1200000001 | AV40: 0 | AW40: =RC[1]-RC[2] -> 48461.667000000001 | AX40: 145385 | AY40: 96923.332999999999 | AZ40: =RC[-46] -> 6239503 | BA40: =RC[-46] -> 0 | BB40: =RC[-46] -> 0 | BC40: =RC[-46] -> 0 | BD40: =RC[-46] -> 0 | BE40: =RC[-46] -> 0 | BF40: =RC[-46] -> 680000 | BG40: =RC[-46] -> 289800 | BH40: =RC[-46] -> 145385 | BI40: =RC[-46] -> 0 | BJ40: =RC[-46] -> 0 | BK40: =RC[-46] -> 7354688 | BL40: =RC[-46] -> 220800 | BM40: =RC[-46] -> 41400 | BN40: =RC[-46] -> 27600 | BO40: =RC[-46] -> 70648.88 | BP40: =RC[-46] -> 0 | BQ40: =RC[-46] -> 6994239.1200000001 | BR40: =RC[-46] -> 0 | BS40: =RC[-46] -> 0 | BT40: =RC[-46] -> 0 | BU40: =RC[-46] -> 0 | BV40: =RC[-46] -> 0 | BW40: =RC[-46] -> 0 | BX40: =RC[-46] -> 0 | BY40: =RC[-46] -> 0 | BZ40: =RC[-46] -> 0 | CA40: =RC[-46] -> 0 | CB40: =RC[-46] -> 145385 | CC40: =RC[-46] -> 6239503 | CD40: =RC[-46] -> 0 | CE40: =RC[-46] -> 0 | CF40: =RC[-46] -> 0 | CG40: =RC[-46] -> 0 | CH40: =RC[-46] -> 0 | CI40: =RC[-46] -> 0 | CJ40: =RC[-46] -> 0 | CK40: =RC[-46] -> 0 | CL40: =RC[-46] -> 1 | CM40: =RC[-46] -> 0 | CN40: =RC[-46] -> 0 | CO40: =RC[-46] -> 6994239.1200000001 | CP40: =RC[-46] -> 0 | CQ40: =RC[-46] -> 48461.667000000001 | CR40: =RC[-46] -> 145385 | CS40: =RC[-46] -> 96923.332999999999
A41: 21 | B41: 010551 | C41: Ngô Ngọc Long | D41: NV Tài liệu và HDCX | E41: 10521242995013 | F41: =RC[29]+RC[30]+RC[31]+RC[32]+RC[33]+RC[34]+RC[35]+RC[36]+RC[37] -> 7967186 | G41: =RC[17]+RC[18]++RC[19]+RC[20]+RC[21]+RC[38]+RC[39]+RC[41] -> 0 | H41: 0 | I41: 0 | J41: =RC[-2]+RC[-1] -> 0 | K41: 0 | L41: 680000 | M41: 309120 | N41: =RC[15]+RC[16]+RC[17]+RC[18]+RC[19]+RC[20] -> 155077 | O41: 0 | P41: 0 | Q41: 9111383 | R41: 235520 | S41: 44160 | T41: 29440 | U41: 88022.63 | V41: 0 | W41: 8714240.3699999992 | X41: 0 | Y41: 0 | Z41: 0 | AA41: 0 | AB41: 0 | AC41: 0 | AD41: 0 | AE41: 0 | AF41: 0 | AG41: 0 | AH41: 155077 | AI41: 7967186 | AJ41: 0 | AK41: 0 | AL41: 0 | AM41: 0 | AN41: 0 | AO41: 0 | AP41: 0 | AQ41: 0 | AR41: =1 -> 1 | AS41: 0 | AT41: 0 | AU41: =RC[-30]-RC[-29]-RC[-28]-RC[-27]-RC[-26]-RC[-25] -> 8714240.3699999992 | AV41: 0 | AW41: =RC[1]-RC[2] -> 51692.332999999999 | AX41: 155077 | AY41: 103384.667 | AZ41: =RC[-46] -> 7967186 | BA41: =RC[-46] -> 0 | BB41: =RC[-46] -> 0 | BC41: =RC[-46] -> 0 | BD41: =RC[-46] -> 0 | BE41: =RC[-46] -> 0 | BF41: =RC[-46] -> 680000 | BG41: =RC[-46] -> 309120 | BH41: =RC[-46] -> 155077 | BI41: =RC[-46] -> 0 | BJ41: =RC[-46] -> 0 | BK41: =RC[-46] -> 9111383 | BL41: =RC[-46] -> 235520 | BM41: =RC[-46] -> 44160 | BN41: =RC[-46] -> 29440 | BO41: =RC[-46] -> 88022.63 | BP41: =RC[-46] -> 0 | BQ41: =RC[-46] -> 8714240.3699999992 | BR41: =RC[-46] -> 0 | BS41: =RC[-46] -> 0 | BT41: =RC[-46] -> 0 | BU41: =RC[-46] -> 0 | BV41: =RC[-46] -> 0 | BW41: =RC[-46] -> 0 | BX41: =RC[-46] -> 0 | BY41: =RC[-46] -> 0 | BZ41: =RC[-46] -> 0 | CA41: =RC[-46] -> 0 | CB41: =RC[-46] -> 155077 | CC41: =RC[-46] -> 7967186 | CD41: =RC[-46] -> 0 | CE41: =RC[-46] -> 0 | CF41: =RC[-46] -> 0 | CG41: =RC[-46] -> 0 | CH41: =RC[-46] -> 0 | CI41: =RC[-46] -> 0 | CJ41: =RC[-46] -> 0 | CK41: =RC[-46] -> 0 | CL41: =RC[-46] -> 1 | CM41: =RC[-46] -> 0 | CN41: =RC[-46] -> 0 | CO41: =RC[-46] -> 8714240.3699999992 | CP41: =RC[-46] -> 0 | CQ41: =RC[-46] -> 51692.332999999999 | CR41: =RC[-46] -> 155077 | CS41: =RC[-46] -> 103384.667
A42: 22 | B42: 010552 | C42: Nguyễn Thuý Hà | D42: NV Tài liệu và HDCX | E42: 10521137536011 | F42: =RC[29]+RC[30]+RC[31]+RC[32]+RC[33]+RC[34]+RC[35]+RC[36]+RC[37] -> 6186972 | G42: =RC[17]+RC[18]++RC[19]+RC[20]+RC[21]+RC[38]+RC[39]+RC[41] -> 0 | H42: 0 | I42: 0 | J42: =RC[-2]+RC[-1] -> 0 | K42: 0 | L42: 680000 | M42: 289800 | N42: =RC[15]+RC[16]+RC[17]+RC[18]+RC[19]+RC[20] -> 0 | O42: 0 | P42: 0 | Q42: 7156772 | R42: 220800 | S42: 41400 | T42: 27600 | U42: 68669.72 | V42: 0 | W42: 6798302.2800000003 | X42: 0 | Y42: 0 | Z42: 0 | AA42: 0 | AB42: 0 | AC42: 0 | AD42: 0 | AE42: 0 | AF42: 0 | AG42: 0 | AH42: 0 | AI42: 6186972 | AJ42: 0 | AK42: 0 | AL42: 0 | AM42: 0 | AN42: 0 | AO42: 0 | AP42: 0 | AQ42: 0 | AR42: =1 -> 1 | AS42: 0 | AT42: 0 | AU42: =RC[-30]-RC[-29]-RC[-28]-RC[-27]-RC[-26]-RC[-25] -> 6798302.2800000003 | AV42: 0 | AW42: =RC[1]-RC[2] -> 0 | AX42: 0 | AY42: 0 | AZ42: =RC[-46] -> 6186972 | BA42: =RC[-46] -> 0 | BB42: =RC[-46] -> 0 | BC42: =RC[-46] -> 0 | BD42: =RC[-46] -> 0 | BE42: =RC[-46] -> 0 | BF42: =RC[-46] -> 680000 | BG42: =RC[-46] -> 289800 | BH42: =RC[-46] -> 0 | BI42: =RC[-46] -> 0 | BJ42: =RC[-46] -> 0 | BK42: =RC[-46] -> 7156772 | BL42: =RC[-46] -> 220800 | BM42: =RC[-46] -> 41400 | BN42: =RC[-46] -> 27600 | BO42: =RC[-46] -> 68669.72 | BP42: =RC[-46] -> 0 | BQ42: =RC[-46] -> 6798302.2800000003 | BR42: =RC[-46] -> 0 | BS42: =RC[-46] -> 0 | BT42: =RC[-46] -> 0 | BU42: =RC[-46] -> 0 | BV42: =RC[-46] -> 0 | BW42: =RC[-46] -> 0 | BX42: =RC[-46] -> 0 | BY42: =RC[-46] -> 0 | BZ42: =RC[-46] -> 0 | CA42: =RC[-46] -> 0 | CB42: =RC[-46] -> 0 | CC42: =RC[-46] -> 6186972 | CD42: =RC[-46] -> 0 | CE42: =RC[-46] -> 0 | CF42: =RC[-46] -> 0 | CG42: =RC[-46] -> 0 | CH42: =RC[-46] -> 0 | CI42: =RC[-46] -> 0 | CJ42: =RC[-46] -> 0 | CK42: =RC[-46] -> 0 | CL42: =RC[-46] -> 1 | CM42: =RC[-46] -> 0 | CN42: =RC[-46] -> 0 | CO42: =RC[-46] -> 6798302.2800000003 | CP42: =RC[-46] -> 0 | CQ42: =RC[-46] -> 0 | CR42: =RC[-46] -> 0 | CS42: =RC[-46] -> 0
A43: 23 | B43: 010553 | C43: Đỗ Thanh Tùng | D43: NV Tài liệu và HDCX | E43: 10522162201012 | F43: =RC[29]+RC[30]+RC[31]+RC[32]+RC[33]+RC[34]+RC[35]+RC[36]+RC[37] -> 6770649 | G43: =RC[17]+RC[18]++RC[19]+RC[20]+RC[21]+RC[38]+RC[39]+RC[41] -> 0 | H43: 0 | I43: 0 | J43: =RC[-2]+RC[-1] -> 0 | K43: 210000 | L43: 680000 | M43: 289800 | N43: =RC[15]+RC[16]+RC[17]+RC[18]+RC[19]+RC[20] -> 290769 | O43: 0 | P43: 0 | Q43: 8241218 | R43: 220800 | S43: 41400 | T43: 27600 | U43: 79514.179999999993 | V43: 0 | W43: 7871903.8200000003 | X43: 0 | Y43: 0 | Z43: 0 | AA43: 0 | AB43: 0 | AC43: 0 | AD43: 0 | AE43: 0 | AF43: 0 | AG43: 0 | AH43: 290769 | AI43: 6770649 | AJ43: 0 | AK43: 0 | AL43: 0 | AM43: 0 | AN43: 0 | AO43: 0 | AP43: 0 | AQ43: 0 | AR43: =1 -> 1 | AS43: 0 | AT43: 0 | AU43: =RC[-30]-RC[-29]-RC[-28]-RC[-27]-RC[-26]-RC[-25] -> 7871903.8200000003 | AV43: 0 | AW43: =RC[1]-RC[2] -> 96923 | AX43: 290769 | AY43: 193846 | AZ43: =RC[-46] -> 6770649 | BA43: =RC[-46] -> 0 | BB43: =RC[-46] -> 0 | BC43: =RC[-46] -> 0 | BD43: =RC[-46] -> 0 | BE43: =RC[-46] -> 210000 | BF43: =RC[-46] -> 680000 | BG43: =RC[-46] -> 289800 | BH43: =RC[-46] -> 290769 | BI43: =RC[-46] -> 0 | BJ43: =RC[-46] -> 0 | BK43: =RC[-46] -> 8241218 | BL43: =RC[-46] -> 220800 | BM43: =RC[-46] -> 41400 | BN43: =RC[-46] -> 27600 | BO43: =RC[-46] -> 79514.179999999993 | BP43: =RC[-46] -> 0 | BQ43: =RC[-46] -> 7871903.8200000003 | BR43: =RC[-46] -> 0 | BS43: =RC[-46] -> 0 | BT43: =RC[-46] -> 0 | BU43: =RC[-46] -> 0 | BV43: =RC[-46] -> 0 | BW43: =RC[-46] -> 0 | BX43: =RC[-46] -> 0 | BY43: =RC[-46] -> 0 | BZ43: =RC[-46] -> 0 | CA43: =RC[-46] -> 0 | CB43: =RC[-46] -> 290769 | CC43: =RC[-46] -> 6770649 | CD43: =RC[-46] -> 0 | CE43: =RC[-46] -> 0 | CF43: =RC[-46] -> 0 | CG43: =RC[-46] -> 0 | CH43: =RC[-46] -> 0 | CI43: =RC[-46] -> 0 | CJ43: =RC[-46] -> 0 | CK43: =RC[-46] -> 0 | CL43: =RC[-46] -> 1 | CM43: =RC[-46] -> 0 | CN43: =RC[-46] -> 0 | CO43: =RC[-46] -> 7871903.8200000003 | CP43: =RC[-46] -> 0 | CQ43: =RC[-46] -> 96923 | CR43: =RC[-46] -> 290769 | CS43: =RC[-46] -> 193846
A44: 24 | B44: 011126 | C44: Nguyễn Thị Thanh Hoa | D44: NV Tài liệu và HDCX | E44: 19025464200022 | F44: =RC[29]+RC[30]+RC[31]+RC[32]+RC[33]+RC[34]+RC[35]+RC[36]+RC[37] -> 5130518 | G44: =RC[17]+RC[18]++RC[19]+RC[20]+RC[21]+RC[38]+RC[39]+RC[41] -> 0 | H44: 0 | I44: 0 | J44: =RC[-2]+RC[-1] -> 0 | K44: 0 | L44: 680000 | M44: 247538 | N44: =RC[15]+RC[16]+RC[17]+RC[18]+RC[19]+RC[20] -> 124183 | O44: 0 | P44: 0 | Q44: 6182239 | R44: 188600 | S44: 35363 | T44: 23575 | U44: 59347.01 | V44: 0 | W44: 5875353.9900000002 | X44: 0 | Y44: 0 | Z44: 0 | AA44: 0 | AB44: 0 | AC44: 0 | AD44: 0 | AE44: 0 | AF44: 0 | AG44: 0 | AH44: 124183 | AI44: 5130518 | AJ44: 0 | AK44: 0 | AL44: 0 | AM44: 0 | AN44: 0 | AO44: 0 | AP44: 0 | AQ44: 0 | AR44: =1 -> 1 | AS44: 0 | AT44: 0 | AU44: =RC[-30]-RC[-29]-RC[-28]-RC[-27]-RC[-26]-RC[-25] -> 5875353.9900000002 | AV44: 0 | AW44: =RC[1]-RC[2] -> 41394.332999999999 | AX44: 124183 | AY44: 82788.667000000001 | AZ44: =RC[-46] -> 5130518 | BA44: =RC[-46] -> 0 | BB44: =RC[-46] -> 0 | BC44: =RC[-46] -> 0 | BD44: =RC[-46] -> 0 | BE44: =RC[-46] -> 0 | BF44: =RC[-46] -> 680000 | BG44: =RC[-46] -> 247538 | BH44: =RC[-46] -> 124183 | BI44: =RC[-46] -> 0 | BJ44: =RC[-46] -> 0 | BK44: =RC[-46] -> 6182239 | BL44: =RC[-46] -> 188600 | BM44: =RC[-46] -> 35363 | BN44: =RC[-46] -> 23575 | BO44: =RC[-46] -> 59347.01 | BP44: =RC[-46] -> 0 | BQ44: =RC[-46] -> 5875353.9900000002 | BR44: =RC[-46] -> 0 | BS44: =RC[-46] -> 0 | BT44: =RC[-46] -> 0 | BU44: =RC[-46] -> 0 | BV44: =RC[-46] -> 0 | BW44: =RC[-46] -> 0 | BX44: =RC[-46] -> 0 | BY44: =RC[-46] -> 0 | BZ44: =RC[-46] -> 0 | CA44: =RC[-46] -> 0 | CB44: =RC[-46] -> 124183 | CC44: =RC[-46] -> 5130518 | CD44: =RC[-46] -> 0 | CE44: =RC[-46] -> 0 | CF44: =RC[-46] -> 0 | CG44: =RC[-46] -> 0 | CH44: =RC[-46] -> 0 | CI44: =RC[-46] -> 0 | CJ44: =RC[-46] -> 0 | CK44: =RC[-46] -> 0 | CL44: =RC[-46] -> 1 | CM44: =RC[-46] -> 0 | CN44: =RC[-46] -> 0 | CO44: =RC[-46] -> 5875353.9900000002 | CP44: =RC[-46] -> 0 | CQ44: =RC[-46] -> 41394.332999999999 | CR44: =RC[-46] -> 124183 | CS44: =RC[-46] -> 82788.667000000001
A45: 25 | B45: 011127 | C45: Phí Thị Huyền Trang | D45: NV Tài liệu và HDCX | E45: 19026970087011 | F45: =RC[29]+RC[30]+RC[31]+RC[32]+RC[33]+RC[34]+RC[35]+RC[36]+RC[37] -> 5399009 | G45: =RC[17]+RC[18]++RC[19]+RC[20]+RC[21]+RC[38]+RC[39]+RC[41] -> 0 | H45: 0 | I45: 0 | J45: =RC[-2]+RC[-1] -> 0 | K45: 0 | L45: 680000 | M45: 247538 | N45: =RC[15]+RC[16]+RC[17]+RC[18]+RC[19]+RC[20] -> 0 | O45: 0 | P45: 0 | Q45: 6326547 | R45: 188600 | S45: 35363 | T45: 23575 | U45: 60790.09 | V45: 0 | W45: 6018218.9100000001 | X45: 0 | Y45: 0 | Z45: 0 | AA45: 0 | AB45: 0 | AC45: 0 | AD45: 0 | AE45: 0 | AF45: 0 | AG45: 0 | AH45: 0 | AI45: 5399009 | AJ45: 0 | AK45: 0 | AL45: 0 | AM45: 0 | AN45: 0 | AO45: 0 | AP45: 0 | AQ45: 0 | AR45: =1 -> 1 | AS45: 0 | AT45: 0 | AU45: =RC[-30]-RC[-29]-RC[-28]-RC[-27]-RC[-26]-RC[-25] -> 6018218.9100000001 | AV45: 0 | AW45: =RC[1]-RC[2] -> 0 | AX45: 0 | AY45: 0 | AZ45: =RC[-46] -> 5399009 | BA45: =RC[-46] -> 0 | BB45: =RC[-46] -> 0 | BC45: =RC[-46] -> 0 | BD45: =RC[-46] -> 0 | BE45: =RC[-46] -> 0 | BF45: =RC[-46] -> 680000 | BG45: =RC[-46] -> 247538 | BH45: =RC[-46] -> 0 | BI45: =RC[-46] -> 0 | BJ45: =RC[-46] -> 0 | BK45: =RC[-46] -> 6326547 | BL45: =RC[-46] -> 188600 | BM45: =RC[-46] -> 35363 | BN45: =RC[-46] -> 23575 | BO45: =RC[-46] -> 60790.09 | BP45: =RC[-46] -> 0 | BQ45: =RC[-46] -> 6018218.9100000001 | BR45: =RC[-46] -> 0 | BS45: =RC[-46] -> 0 | BT45: =RC[-46] -> 0 | BU45: =RC[-46] -> 0 | BV45: =RC[-46] -> 0 | BW45: =RC[-46] -> 0 | BX45: =RC[-46] -> 0 | BY45: =RC[-46] -> 0 | BZ45: =RC[-46] -> 0 | CA45: =RC[-46] -> 0 | CB45: =RC[-46] -> 0 | CC45: =RC[-46] -> 5399009 | CD45: =RC[-46] -> 0 | CE45: =RC[-46] -> 0 | CF45: =RC[-46] -> 0 | CG45: =RC[-46] -> 0 | CH45: =RC[-46] -> 0 | CI45: =RC[-46] -> 0 | CJ45: =RC[-46] -> 0 | CK45: =RC[-46] -> 0 | CL45: =RC[-46] -> 1 | CM45: =RC[-46] -> 0 | CN45: =RC[-46] -> 0 | CO45: =RC[-46] -> 6018218.9100000001 | CP45: =RC[-46] -> 0 | CQ45: =RC[-46] -> 0 | CR45: =RC[-46] -> 0 | CS45: =RC[-46] -> 0
A46: 26 | B46: 011128 | C46: Hoàng Thị Yến | D46: NV Tài liệu và HDCX | E46: 19026970088016 | F46: =RC[29]+RC[30]+RC[31]+RC[32]+RC[33]+RC[34]+RC[35]+RC[36]+RC[37] -> 5399009 | G46: =RC[17]+RC[18]++RC[19]+RC[20]+RC[21]+RC[38]+RC[39]+RC[41] -> 0 | H46: 0 | I46: 0 | J46: =RC[-2]+RC[-1] -> 0 | K46: 0 | L46: 680000 | M46: 247538 | N46: =RC[15]+RC[16]+RC[17]+RC[18]+RC[19]+RC[20] -> 124183 | O46: 0 | P46: 0 | Q46: 6450730 | R46: 188600 | S46: 35363 | T46: 23575 | U46: 62031.92 | V46: 0 | W46: 6141160.0800000001 | X46: 0 | Y46: 0 | Z46: 0 | AA46: 0 | AB46: 0 | AC46: 0 | AD46: 0 | AE46: 0 | AF46: 0 | AG46: 0 | AH46: 124183 | AI46: 5399009 | AJ46: 0 | AK46: 0 | AL46: 0 | AM46: 0 | AN46: 0 | AO46: 0 | AP46: 0 | AQ46: 0 | AR46: =1 -> 1 | AS46: 0 | AT46: 0 | AU46: =RC[-30]-RC[-29]-RC[-28]-RC[-27]-RC[-26]-RC[-25] -> 6141160.0800000001 | AV46: 0 | AW46: =RC[1]-RC[2] -> 41394.332999999999 | AX46: 124183 | AY46: 82788.667000000001 | AZ46: =RC[-46] -> 5399009 | BA46: =RC[-46] -> 0 | BB46: =RC[-46] -> 0 | BC46: =RC[-46] -> 0 | BD46: =RC[-46] -> 0 | BE46: =RC[-46] -> 0 | BF46: =RC[-46] -> 680000 | BG46: =RC[-46] -> 247538 | BH46: =RC[-46] -> 124183 | BI46: =RC[-46] -> 0 | BJ46: =RC[-46] -> 0 | BK46: =RC[-46] -> 6450730 | BL46: =RC[-46] -> 188600 | BM46: =RC[-46] -> 35363 | BN46: =RC[-46] -> 23575 | BO46: =RC[-46] -> 62031.92 | BP46: =RC[-46] -> 0 | BQ46: =RC[-46] -> 6141160.0800000001 | BR46: =RC[-46] -> 0 | BS46: =RC[-46] -> 0 | BT46: =RC[-46] -> 0 | BU46: =RC[-46] -> 0 | BV46: =RC[-46] -> 0 | BW46: =RC[-46] -> 0 | BX46: =RC[-46] -> 0 | BY46: =RC[-46] -> 0 | BZ46: =RC[-46] -> 0 | CA46: =RC[-46] -> 0 | CB46: =RC[-46] -> 124183 | CC46: =RC[-46] -> 5399009 | CD46: =RC[-46] -> 0 | CE46: =RC[-46] -> 0 | CF46: =RC[-46] -> 0 | CG46: =RC[-46] -> 0 | CH46: =RC[-46] -> 0 | CI46: =RC[-46] -> 0 | CJ46: =RC[-46] -> 0 | CK46: =RC[-46] -> 0 | CL46: =RC[-46] -> 1 | CM46: =RC[-46] -> 0 | CN46: =RC[-46] -> 0 | CO46: =RC[-46] -> 6141160.0800000001 | CP46: =RC[-46] -> 0 | CQ46: =RC[-46] -> 41394.332999999999 | CR46: =RC[-46] -> 124183 | CS46: =RC[-46] -> 82788.667000000001
A47: 27 | B47: 011130 | C47: Nguyễn Đình Trung | D47: NV Tài liệu và HDCX | E47: 19026970089012 | F47: =RC[29]+RC[30]+RC[31]+RC[32]+RC[33]+RC[34]+RC[35]+RC[36]+RC[37] -> 5544928 | G47: =RC[17]+RC[18]++RC[19]+RC[20]+RC[21]+RC[38]+RC[39]+RC[41] -> 0 | H47: 0 | I47: 0 | J47: =RC[-2]+RC[-1] -> 0 | K47: 0 | L47: 680000 | M47: 247538 | N47: =RC[15]+RC[16]+RC[17]+RC[18]+RC[19]+RC[20] -> 124183 | O47: 0 | P47: 0 | Q47: 6596649 | R47: 188600 | S47: 35363 | T47: 23575 | U47: 63491.11 | V47: 0 | W47: 6285619.8899999997 | X47: 0 | Y47: 0 | Z47: 0 | AA47: 0 | AB47: 0 | AC47: 0 | AD47: 0 | AE47: 0 | AF47: 0 | AG47: 0 | AH47: 124183 | AI47: 5544928 | AJ47: 0 | AK47: 0 | AL47: 0 | AM47: 0 | AN47: 0 | AO47: 0 | AP47: 0 | AQ47: 0 | AR47: =1 -> 1 | AS47: 0 | AT47: 0 | AU47: =RC[-30]-RC[-29]-RC[-28]-RC[-27]-RC[-26]-RC[-25] -> 6285619.8899999997 | AV47: 0 | AW47: =RC[1]-RC[2] -> 41394.332999999999 | AX47: 124183 | AY47: 82788.667000000001 | AZ47: =RC[-46] -> 5544928 | BA47: =RC[-46] -> 0 | BB47: =RC[-46] -> 0 | BC47: =RC[-46] -> 0 | BD47: =RC[-46] -> 0 | BE47: =RC[-46] -> 0 | BF47: =RC[-46] -> 680000 | BG47: =RC[-46] -> 247538 | BH47: =RC[-46] -> 124183 | BI47: =RC[-46] -> 0 | BJ47: =RC[-46] -> 0 | BK47: =RC[-46] -> 6596649 | BL47: =RC[-46] -> 188600 | BM47: =RC[-46] -> 35363 | BN47: =RC[-46] -> 23575 | BO47: =RC[-46] -> 63491.11 | BP47: =RC[-46] -> 0 | BQ47: =RC[-46] -> 6285619.8899999997 | BR47: =RC[-46] -> 0 | BS47: =RC[-46] -> 0 | BT47: =RC[-46] -> 0 | BU47: =RC[-46] -> 0 | BV47: =RC[-46] -> 0 | BW47: =RC[-46] -> 0 | BX47: =RC[-46] -> 0 | BY47: =RC[-46] -> 0 | BZ47: =RC[-46] -> 0 | CA47: =RC[-46] -> 0 | CB47: =RC[-46] -> 124183 | CC47: =RC[-46] -> 5544928 | CD47: =RC[-46] -> 0 | CE47: =RC[-46] -> 0 | CF47: =RC[-46] -> 0 | CG47: =RC[-46] -> 0 | CH47: =RC[-46] -> 0 | CI47: =RC[-46] -> 0 | CJ47: =RC[-46] -> 0 | CK47: =RC[-46] -> 0 | CL47: =RC[-46] -> 1 | CM47: =RC[-46] -> 0 | CN47: =RC[-46] -> 0 | CO47: =RC[-46] -> 6285619.8899999997 | CP47: =RC[-46] -> 0 | CQ47: =RC[-46] -> 41394.332999999999 | CR47: =RC[-46] -> 124183 | CS47: =RC[-46] -> 82788.667000000001
A48: 28 | B48: 011131 | C48: Vũ Tuấn Anh | D48: NV Tài liệu và HDCX | E48: 19026970090010 | F48: =RC[29]+RC[30]+RC[31]+RC[32]+RC[33]+RC[34]+RC[35]+RC[36]+RC[37] -> 5544928 | G48: =RC[17]+RC[18]++RC[19]+RC[20]+RC[21]+RC[38]+RC[39]+RC[41] -> 0 | H48: 0 | I48: 0 | J48: =RC[-2]+RC[-1] -> 0 | K48: 0 | L48: 680000 | M48: 247538 | N48: =RC[15]+RC[16]+RC[17]+RC[18]+RC[19]+RC[20] -> 0 | O48: 0 | P48: 0 | Q48: 6472466 | R48: 188600 | S48: 35363 | T48: 23575 | U48: 62249.279999999999 | V48: 0 | W48: 6162678.7199999997 | X48: 0 | Y48: 0 | Z48: 0 | AA48: 0 | AB48: 0 | AC48: 0 | AD48: 0 | AE48: 0 | AF48: 0 | AG48: 0 | AH48: 0 | AI48: 5544928 | AJ48: 0 | AK48: 0 | AL48: 0 | AM48: 0 | AN48: 0 | AO48: 0 | AP48: 0 | AQ48: 0 | AR48: =1 -> 1 | AS48: 0 | AT48: 0 | AU48: =RC[-30]-RC[-29]-RC[-28]-RC[-27]-RC[-26]-RC[-25] -> 6162678.7199999997 | AV48: 0 | AW48: =RC[1]-RC[2] -> 0 | AX48: 0 | AY48: 0 | AZ48: =RC[-46] -> 5544928 | BA48: =RC[-46] -> 0 | BB48: =RC[-46] -> 0 | BC48: =RC[-46] -> 0 | BD48: =RC[-46] -> 0 | BE48: =RC[-46] -> 0 | BF48: =RC[-46] -> 680000 | BG48: =RC[-46] -> 247538 | BH48: =RC[-46] -> 0 | BI48: =RC[-46] -> 0 | BJ48: =RC[-46] -> 0 | BK48: =RC[-46] -> 6472466 | BL48: =RC[-46] -> 188600 | BM48: =RC[-46] -> 35363 | BN48: =RC[-46] -> 23575 | BO48: =RC[-46] -> 62249.279999999999 | BP48: =RC[-46] -> 0 | BQ48: =RC[-46] -> 6162678.7199999997 | BR48: =RC[-46] -> 0 | BS48: =RC[-46] -> 0 | BT48: =RC[-46] -> 0 | BU48: =RC[-46] -> 0 | BV48: =RC[-46] -> 0 | BW48: =RC[-46] -> 0 | BX48: =RC[-46] -> 0 | BY48: =RC[-46] -> 0 | BZ48: =RC[-46] -> 0 | CA48: =RC[-46] -> 0 | CB48: =RC[-46] -> 0 | CC48: =RC[-46] -> 5544928 | CD48: =RC[-46] -> 0 | CE48: =RC[-46] -> 0 | CF48: =RC[-46] -> 0 | CG48: =RC[-46] -> 0 | CH48: =RC[-46] -> 0 | CI48: =RC[-46] -> 0 | CJ48: =RC[-46] -> 0 | CK48: =RC[-46] -> 0 | CL48: =RC[-46] -> 1 | CM48: =RC[-46] -> 0 | CN48: =RC[-46] -> 0 | CO48: =RC[-46] -> 6162678.7199999997 | CP48: =RC[-46] -> 0 | CQ48: =RC[-46] -> 0 | CR48: =RC[-46] -> 0 | CS48: =RC[-46] -> 0
A49: 29 | B49: 012552 | C49: Mai Hoàng Phương | D49: NV Tài liệu và HDCX | E49: 19022145551026 | F49: =RC[29]+RC[30]+RC[31]+RC[32]+RC[33]+RC[34]+RC[35]+RC[36]+RC[37] -> 5515744 | G49: =RC[17]+RC[18]++RC[19]+RC[20]+RC[21]+RC[38]+RC[39]+RC[41] -> 0 | H49: 0 | I49: 0 | J49: =RC[-2]+RC[-1] -> 0 | K49: 0 | L49: 680000 | M49: 247538 | N49: =RC[15]+RC[16]+RC[17]+RC[18]+RC[19]+RC[20] -> 124183 | O49: 0 | P49: 0 | Q49: 6567465 | R49: 188600 | S49: 35363 | T49: 23575 | U49: 63199.27 | V49: 0 | W49: 6256727.7300000004 | X49: 0 | Y49: 0 | Z49: 0 | AA49: 0 | AB49: 0 | AC49: 0 | AD49: 0 | AE49: 0 | AF49: 0 | AG49: 0 | AH49: 124183 | AI49: 5515744 | AJ49: 0 | AK49: 0 | AL49: 0 | AM49: 0 | AN49: 0 | AO49: 0 | AP49: 0 | AQ49: 0 | AR49: =1 -> 1 | AS49: 0 | AT49: 0 | AU49: =RC[-30]-RC[-29]-RC[-28]-RC[-27]-RC[-26]-RC[-25] -> 6256727.7300000004 | AV49: 0 | AW49: =RC[1]-RC[2] -> 41394.332999999999 | AX49: 124183 | AY49: 82788.667000000001 | AZ49: =RC[-46] -> 5515744 | BA49: =RC[-46] -> 0 | BB49: =RC[-46] -> 0 | BC49: =RC[-46] -> 0 | BD49: =RC[-46] -> 0 | BE49: =RC[-46] -> 0 | BF49: =RC[-46] -> 680000 | BG49: =RC[-46] -> 247538 | BH49: =RC[-46] -> 124183 | BI49: =RC[-46] -> 0 | BJ49: =RC[-46] -> 0 | BK49: =RC[-46] -> 6567465 | BL49: =RC[-46] -> 188600 | BM49: =RC[-46] -> 35363 | BN49: =RC[-46] -> 23575 | BO49: =RC[-46] -> 63199.27 | BP49: =RC[-46] -> 0 | BQ49: =RC[-46] -> 6256727.7300000004 | BR49: =RC[-46] -> 0 | BS49: =RC[-46] -> 0 | BT49: =RC[-46] -> 0 | BU49: =RC[-46] -> 0 | BV49: =RC[-46] -> 0 | BW49: =RC[-46] -> 0 | BX49: =RC[-46] -> 0 | BY49: =RC[-46] -> 0 | BZ49: =RC[-46] -> 0 | CA49: =RC[-46] -> 0 | CB49: =RC[-46] -> 124183 | CC49: =RC[-46] -> 5515744 | CD49: =RC[-46] -> 0 | CE49: =RC[-46] -> 0 | CF49: =RC[-46] -> 0 | CG49: =RC[-46] -> 0 | CH49: =RC[-46] -> 0 | CI49: =RC[-46] -> 0 | CJ49: =RC[-46] -> 0 | CK49: =RC[-46] -> 0 | CL49: =RC[-46] -> 1 | CM49: =RC[-46] -> 0 | CN49: =RC[-46] -> 0 | CO49: =RC[-46] -> 6256727.7300000004 | CP49: =RC[-46] -> 0 | CQ49: =RC[-46] -> 41394.332999999999 | CR49: =RC[-46] -> 124183 | CS49: =RC[-46] -> 82788.667000000001
A50: 30 | B50: 012553 | C50: Phạm Duy Hải | D50: NV Tài liệu và HDCX | E50: 19028385527015 | F50: =RC[29]+RC[30]+RC[31]+RC[32]+RC[33]+RC[34]+RC[35]+RC[36]+RC[37] -> 5253090 | G50: =RC[17]+RC[18]++RC[19]+RC[20]+RC[21]+RC[38]+RC[39]+RC[41] -> 0 | H50: 0 | I50: 0 | J50: =RC[-2]+RC[-1] -> 0 | K50: 0 | L50: 680000 | M50: 247538 | N50: =RC[15]+RC[16]+RC[17]+RC[18]+RC[19]+RC[20] -> 248365 | O50: 0 | P50: 0 | Q50: 6428993 | R50: 188600 | S50: 35363 | T50: 23575 | U50: 61814.55 | V50: 0 | W50: 6119640.4500000002 | X50: 0 | Y50: 0 | Z50: 0 | AA50: 0 | AB50: 0 | AC50: 0 | AD50: 0 | AE50: 0 | AF50: 0 | AG50: 0 | AH50: 248365 | AI50: 5253090 | AJ50: 0 | AK50: 0 | AL50: 0 | AM50: 0 | AN50: 0 | AO50: 0 | AP50: 0 | AQ50: 0 | AR50: =1 -> 1 | AS50: 0 | AT50: 0 | AU50: =RC[-30]-RC[-29]-RC[-28]-RC[-27]-RC[-26]-RC[-25] -> 6119640.4500000002 | AV50: 0 | AW50: =RC[1]-RC[2] -> 82788.333000000013 | AX50: 248365 | AY50: 165576.66699999999 | AZ50: =RC[-46] -> 5253090 | BA50: =RC[-46] -> 0 | BB50: =RC[-46] -> 0 | BC50: =RC[-46] -> 0 | BD50: =RC[-46] -> 0 | BE50: =RC[-46] -> 0 | BF50: =RC[-46] -> 680000 | BG50: =RC[-46] -> 247538 | BH50: =RC[-46] -> 248365 | BI50: =RC[-46] -> 0 | BJ50: =RC[-46] -> 0 | BK50: =RC[-46] -> 6428993 | BL50: =RC[-46] -> 188600 | BM50: =RC[-46] -> 35363 | BN50: =RC[-46] -> 23575 | BO50: =RC[-46] -> 61814.55 | BP50: =RC[-46] -> 0 | BQ50: =RC[-46] -> 6119640.4500000002 | BR50: =RC[-46] -> 0 | BS50: =RC[-46] -> 0 | BT50: =RC[-46] -> 0 | BU50: =RC[-46] -> 0 | BV50: =RC[-46] -> 0 | BW50: =RC[-46] -> 0 | BX50: =RC[-46] -> 0 | BY50: =RC[-46] -> 0 | BZ50: =RC[-46] -> 0 | CA50: =RC[-46] -> 0 | CB50: =RC[-46] -> 248365 | CC50: =RC[-46] -> 5253090 | CD50: =RC[-46] -> 0 | CE50: =RC[-46] -> 0 | CF50: =RC[-46] -> 0 | CG50: =RC[-46] -> 0 | CH50: =RC[-46] -> 0 | CI50: =RC[-46] -> 0 | CJ50: =RC[-46] -> 0 | CK50: =RC[-46] -> 0 | CL50: =RC[-46] -> 1 | CM50: =RC[-46] -> 0 | CN50: =RC[-46] -> 0 | CO50: =RC[-46] -> 6119640.4500000002 | CP50: =RC[-46] -> 0 | CQ50: =RC[-46] -> 82788.333000000013 | CR50: =RC[-46] -> 248365 | CS50: =RC[-46] -> 165576.66699999999
A51: 31 | B51: 012565 | C51: Vũ Trọng Nghĩa | D51: NV Tài liệu và HDCX | E51: 19028385473012 | F51: =RC[29]+RC[30]+RC[31]+RC[32]+RC[33]+RC[34]+RC[35]+RC[36]+RC[37] -> 5253090 | G51: =RC[17]+RC[18]++RC[19]+RC[20]+RC[21]+RC[38]+RC[39]+RC[41] -> 0 | H51: 0 | I51: 0 | J51: =RC[-2]+RC[-1] -> 0 | K51: 0 | L51: 680000 | M51: 247538 | N51: =RC[15]+RC[16]+RC[17]+RC[18]+RC[19]+RC[20] -> 0 | O51: 0 | P51: 0 | Q51: 6180628 | R51: 188600 | S51: 35363 | T51: 23575 | U51: 59330.9 | V51: 0 | W51: 5873759.0999999996 | X51: 0 | Y51: 0 | Z51: 0 | AA51: 0 | AB51: 0 | AC51: 0 | AD51: 0 | AE51: 0 | AF51: 0 | AG51: 0 | AH51: 0 | AI51: 5253090 | AJ51: 0 | AK51: 0 | AL51: 0 | AM51: 0 | AN51: 0 | AO51: 0 | AP51: 0 | AQ51: 0 | AR51: =1 -> 1 | AS51: 0 | AT51: 0 | AU51: =RC[-30]-RC[-29]-RC[-28]-RC[-27]-RC[-26]-RC[-25] -> 5873759.0999999996 | AV51: 0 | AW51: =RC[1]-RC[2] -> 0 | AX51: 0 | AY51: 0 | AZ51: =RC[-46] -> 5253090 | BA51: =RC[-46] -> 0 | BB51: =RC[-46] -> 0 | BC51: =RC[-46] -> 0 | BD51: =RC[-46] -> 0 | BE51: =RC[-46] -> 0 | BF51: =RC[-46] -> 680000 | BG51: =RC[-46] -> 247538 | BH51: =RC[-46] -> 0 | BI51: =RC[-46] -> 0 | BJ51: =RC[-46] -> 0 | BK51: =RC[-46] -> 6180628 | BL51: =RC[-46] -> 188600 | BM51: =RC[-46] -> 35363 | BN51: =RC[-46] -> 23575 | BO51: =RC[-46] -> 59330.9 | BP51: =RC[-46] -> 0 | BQ51: =RC[-46] -> 5873759.0999999996 | BR51: =RC[-46] -> 0 | BS51: =RC[-46] -> 0 | BT51: =RC[-46] -> 0 | BU51: =RC[-46] -> 0 | BV51: =RC[-46] -> 0 | BW51: =RC[-46] -> 0 | BX51: =RC[-46] -> 0 | BY51: =RC[-46] -> 0 | BZ51: =RC[-46] -> 0 | CA51: =RC[-46] -> 0 | CB51: =RC[-46] -> 0 | CC51: =RC[-46] -> 5253090 | CD51: =RC[-46] -> 0 | CE51: =RC[-46] -> 0 | CF51: =RC[-46] -> 0 | CG51: =RC[-46] -> 0 | CH51: =RC[-46] -> 0 | CI51: =RC[-46] -> 0 | CJ51: =RC[-46] -> 0 | CK51: =RC[-46] -> 0 | CL51: =RC[-46] -> 1 | CM51: =RC[-46] -> 0 | CN51: =RC[-46] -> 0 | CO51: =RC[-46] -> 5873759.0999999996 | CP51: =RC[-46] -> 0 | CQ51: =RC[-46] -> 0 | CR51: =RC[-46] -> 0 | CS51: =RC[-46] -> 0
A52: 32 | B52: 012566 | C52: Hoàng Duy Thái | D52: NV Tài liệu và HDCX | E52: 19028385510015 | F52: =RC[29]+RC[30]+RC[31]+RC[32]+RC[33]+RC[34]+RC[35]+RC[36]+RC[37] -> 5515744 | G52: =RC[17]+RC[18]++RC[19]+RC[20]+RC[21]+RC[38]+RC[39]+RC[41] -> 0 | H52: 0 | I52: 0 | J52: =RC[-2]+RC[-1] -> 0 | K52: 0 | L52: 680000 | M52: 247538 | N52: =RC[15]+RC[16]+RC[17]+RC[18]+RC[19]+RC[20] -> 124183 | O52: 0 | P52: 0 | Q52: 6567465 | R52: 188600 | S52: 35363 | T52: 23575 | U52: 63199.27 | V52: 0 | W52: 6256727.7300000004 | X52: 0 | Y52: 0 | Z52: 0 | AA52: 0 | AB52: 0 | AC52: 0 | AD52: 0 | AE52: 0 | AF52: 0 | AG52: 0 | AH52: 124183 | AI52: 5515744 | AJ52: 0 | AK52: 0 | AL52: 0 | AM52: 0 | AN52: 0 | AO52: 0 | AP52: 0 | AQ52: 0 | AR52: =1 -> 1 | AS52: 0 | AT52: 0 | AU52: =RC[-30]-RC[-29]-RC[-28]-RC[-27]-RC[-26]-RC[-25] -> 6256727.7300000004 | AV52: 0 | AW52: =RC[1]-RC[2] -> 41394.332999999999 | AX52: 124183 | AY52: 82788.667000000001 | AZ52: =RC[-46] -> 5515744 | BA52: =RC[-46] -> 0 | BB52: =RC[-46] -> 0 | BC52: =RC[-46] -> 0 | BD52: =RC[-46] -> 0 | BE52: =RC[-46] -> 0 | BF52: =RC[-46] -> 680000 | BG52: =RC[-46] -> 247538 | BH52: =RC[-46] -> 124183 | BI52: =RC[-46] -> 0 | BJ52: =RC[-46] -> 0 | BK52: =RC[-46] -> 6567465 | BL52: =RC[-46] -> 188600 | BM52: =RC[-46] -> 35363 | BN52: =RC[-46] -> 23575 | BO52: =RC[-46] -> 63199.27 | BP52: =RC[-46] -> 0 | BQ52: =RC[-46] -> 6256727.7300000004 | BR52: =RC[-46] -> 0 | BS52: =RC[-46] -> 0 | BT52: =RC[-46] -> 0 | BU52: =RC[-46] -> 0 | BV52: =RC[-46] -> 0 | BW52: =RC[-46] -> 0 | BX52: =RC[-46] -> 0 | BY52: =RC[-46] -> 0 | BZ52: =RC[-46] -> 0 | CA52: =RC[-46] -> 0 | CB52: =RC[-46] -> 124183 | CC52: =RC[-46] -> 5515744 | CD52: =RC[-46] -> 0 | CE52: =RC[-46] -> 0 | CF52: =RC[-46] -> 0 | CG52: =RC[-46] -> 0 | CH52: =RC[-46] -> 0 | CI52: =RC[-46] -> 0 | CJ52: =RC[-46] -> 0 | CK52: =RC[-46] -> 0 | CL52: =RC[-46] -> 1 | CM52: =RC[-46] -> 0 | CN52: =RC[-46] -> 0 | CO52: =RC[-46] -> 6256727.7300000004 | CP52: =RC[-46] -> 0 | CQ52: =RC[-46] -> 41394.332999999999 | CR52: =RC[-46] -> 124183 | CS52: =RC[-46] -> 82788.667000000001
A53: 33 | B53: 013356 | C53: Trần Anh Sơn | D53: NV Tài liệu và HDCX | E53: 19023495883011 | F53: =RC[29]+RC[30]+RC[31]+RC[32]+RC[33]+RC[34]+RC[35]+RC[36]+RC[37] -> 3677163 | G53: =RC[17]+RC[18]++RC[19]+RC[20]+RC[21]+RC[38]+RC[39]+RC[41] -> 0 | H53: 0 | I53: 0 | J53: =RC[-2]+RC[-1] -> 0 | K53: 0 | L53: 680000 | M53: 0 | N53: =RC[15]+RC[16]+RC[17]+RC[18]+RC[19]+RC[20] -> 0 | O53: 0 | P53: 0 | Q53: 4357163 | R53: 0 | S53: 0 | T53: 0 | U53: 43571.63 | V53: 0 | W53: 4313591.37 | X53: 0 | Y53: 0 | Z53: 0 | AA53: 0 | AB53: 0 | AC53: 0 | AD53: 0 | AE53: 0 | AF53: 0 | AG53: 0 | AH53: 0 | AI53: 3677163 | AJ53: 0 | AK53: 0 | AL53: 0 | AM53: 0 | AN53: 0 | AO53: 0 | AP53: 0 | AQ53: 0 | AR53: =1 -> 1 | AS53: 0 | AT53: 0 | AU53: =RC[-30]-RC[-29]-RC[-28]-RC[-27]-RC[-26]-RC[-25] -> 4313591.37 | AV53: 0 | AW53: =RC[1]-RC[2] -> 0 | AX53: 0 | AY53: 0 | AZ53: =RC[-46] -> 3677163 | BA53: =RC[-46] -> 0 | BB53: =RC[-46] -> 0 | BC53: =RC[-46] -> 0 | BD53: =RC[-46] -> 0 | BE53: =RC[-46] -> 0 | BF53: =RC[-46] -> 680000 | BG53: =RC[-46] -> 0 | BH53: =RC[-46] -> 0 | BI53: =RC[-46] -> 0 | BJ53: =RC[-46] -> 0 | BK53: =RC[-46] -> 4357163 | BL53: =RC[-46] -> 0 | BM53: =RC[-46] -> 0 | BN53: =RC[-46] -> 0 | BO53: =RC[-46] -> 43571.63 | BP53: =RC[-46] -> 0 | BQ53: =RC[-46] -> 4313591.37 | BR53: =RC[-46] -> 0 | BS53: =RC[-46] -> 0 | BT53: =RC[-46] -> 0 | BU53: =RC[-46] -> 0 | BV53: =RC[-46] -> 0 | BW53: =RC[-46] -> 0 | BX53: =RC[-46] -> 0 | BY53: =RC[-46] -> 0 | BZ53: =RC[-46] -> 0 | CA53: =RC[-46] -> 0 | CB53: =RC[-46] -> 0 | CC53: =RC[-46] -> 3677163 | CD53: =RC[-46] -> 0 | CE53: =RC[-46] -> 0 | CF53: =RC[-46] -> 0 | CG53: =RC[-46] -> 0 | CH53: =RC[-46] -> 0 | CI53: =RC[-46] -> 0 | CJ53: =RC[-46] -> 0 | CK53: =RC[-46] -> 0 | CL53: =RC[-46] -> 1 | CM53: =RC[-46] -> 0 | CN53: =RC[-46] -> 0 | CO53: =RC[-46] -> 4313591.37 | CP53: =RC[-46] -> 0 | CQ53: =RC[-46] -> 0 | CR53: =RC[-46] -> 0 | CS53: =RC[-46] -> 0
A54: 34 | B54: 013357 | C54: Nguyễn Trường Giang | D54: NV Tài liệu và HDCX | E54: 19028960246015 | F54: =RC[29]+RC[30]+RC[31]+RC[32]+RC[33]+RC[34]+RC[35]+RC[36]+RC[37] -> 3677163 | G54: =RC[17]+RC[18]++RC[19]+RC[20]+RC[21]+RC[38]+RC[39]+RC[41] -> 0 | H54: 0 | I54: 0 | J54: =RC[-2]+RC[-1] -> 0 | K54: 0 | L54: 680000 | M54: 0 | N54: =RC[15]+RC[16]+RC[17]+RC[18]+RC[19]+RC[20] -> 0 | O54: 0 | P54: 0 | Q54: 4357163 | R54: 0 | S54: 0 | T54: 0 | U54: 43571.63 | V54: 0 | W54: 4313591.37 | X54: 0 | Y54: 0 | Z54: 0 | AA54: 0 | AB54: 0 | AC54: 0 | AD54: 0 | AE54: 0 | AF54: 0 | AG54: 0 | AH54: 0 | AI54: 3677163 | AJ54: 0 | AK54: 0 | AL54: 0 | AM54: 0 | AN54: 0 | AO54: 0 | AP54: 0 | AQ54: 0 | AR54: =1 -> 1 | AS54: 0 | AT54: 0 | AU54: =RC[-30]-RC[-29]-RC[-28]-RC[-27]-RC[-26]-RC[-25] -> 4313591.37 | AV54: 0 | AW54: =RC[1]-RC[2] -> 0 | AX54: 0 | AY54: 0 | AZ54: =RC[-46] -> 3677163 | BA54: =RC[-46] -> 0 | BB54: =RC[-46] -> 0 | BC54: =RC[-46] -> 0 | BD54: =RC[-46] -> 0 | BE54: =RC[-46] -> 0 | BF54: =RC[-46] -> 680000 | BG54: =RC[-46] -> 0 | BH54: =RC[-46] -> 0 | BI54: =RC[-46] -> 0 | BJ54: =RC[-46] -> 0 | BK54: =RC[-46] -> 4357163 | BL54: =RC[-46] -> 0 | BM54: =RC[-46] -> 0 | BN54: =RC[-46] -> 0 | BO54: =RC[-46] -> 43571.63 | BP54: =RC[-46] -> 0 | BQ54: =RC[-46] -> 4313591.37 | BR54: =RC[-46] -> 0 | BS54: =RC[-46] -> 0 | BT54: =RC[-46] -> 0 | BU54: =RC[-46] -> 0 | BV54: =RC[-46] -> 0 | BW54: =RC[-46] -> 0 | BX54: =RC[-46] -> 0 | BY54: =RC[-46] -> 0 | BZ54: =RC[-46] -> 0 | CA54: =RC[-46] -> 0 | CB54: =RC[-46] -> 0 | CC54: =RC[-46] -> 3677163 | CD54: =RC[-46] -> 0 | CE54: =RC[-46] -> 0 | CF54: =RC[-46] -> 0 | CG54: =RC[-46] -> 0 | CH54: =RC[-46] -> 0 | CI54: =RC[-46] -> 0 | CJ54: =RC[-46] -> 0 | CK54: =RC[-46] -> 0 | CL54: =RC[-46] -> 1 | CM54: =RC[-46] -> 0 | CN54: =RC[-46] -> 0 | CO54: =RC[-46] -> 4313591.37 | CP54: =RC[-46] -> 0 | CQ54: =RC[-46] -> 0 | CR54: =RC[-46] -> 0 | CS54: =RC[-46] -> 0
A55: 35 | B55: 013358 | C55: Phan Thế Chung | D55: NV Tài liệu và HDCX | E55: 19028960243016 | F55: =RC[29]+RC[30]+RC[31]+RC[32]+RC[33]+RC[34]+RC[35]+RC[36]+RC[37] -> 3677163 | G55: =RC[17]+RC[18]++RC[19]+RC[20]+RC[21]+RC[38]+RC[39]+RC[41] -> 0 | H55: 0 | I55: 0 | J55: =RC[-2]+RC[-1] -> 0 | K55: 0 | L55: 680000 | M55: 0 | N55: =RC[15]+RC[16]+RC[17]+RC[18]+RC[19]+RC[20] -> 0 | O55: 0 | P55: 0 | Q55: 4357163 | R55: 0 | S55: 0 | T55: 0 | U55: 43571.63 | V55: 0 | W55: 4313591.37 | X55: 0 | Y55: 0 | Z55: 0 | AA55: 0 | AB55: 0 | AC55: 0 | AD55: 0 | AE55: 0 | AF55: 0 | AG55: 0 | AH55: 0 | AI55: 3677163 | AJ55: 0 | AK55: 0 | AL55: 0 | AM55: 0 | AN55: 0 | AO55: 0 | AP55: 0 | AQ55: 0 | AR55: =1 -> 1 | AS55: 0 | AT55: 0 | AU55: =RC[-30]-RC[-29]-RC[-28]-RC[-27]-RC[-26]-RC[-25] -> 4313591.37 | AV55: 0 | AW55: =RC[1]-RC[2] -> 0 | AX55: 0 | AY55: 0 | AZ55: =RC[-46] -> 3677163 | BA55: =RC[-46] -> 0 | BB55: =RC[-46] -> 0 | BC55: =RC[-46] -> 0 | BD55: =RC[-46] -> 0 | BE55: =RC[-46] -> 0 | BF55: =RC[-46] -> 680000 | BG55: =RC[-46] -> 0 | BH55: =RC[-46] -> 0 | BI55: =RC[-46] -> 0 | BJ55: =RC[-46] -> 0 | BK55: =RC[-46] -> 4357163 | BL55: =RC[-46] -> 0 | BM55: =RC[-46] -> 0 | BN55: =RC[-46] -> 0 | BO55: =RC[-46] -> 43571.63 | BP55: =RC[-46] -> 0 | BQ55: =RC[-46] -> 4313591.37 | BR55: =RC[-46] -> 0 | BS55: =RC[-46] -> 0 | BT55: =RC[-46] -> 0 | BU55: =RC[-46] -> 0 | BV55: =RC[-46] -> 0 | BW55: =RC[-46] -> 0 | BX55: =RC[-46] -> 0 | BY55: =RC[-46] -> 0 | BZ55: =RC[-46] -> 0 | CA55: =RC[-46] -> 0 | CB55: =RC[-46] -> 0 | CC55: =RC[-46] -> 3677163 | CD55: =RC[-46] -> 0 | CE55: =RC[-46] -> 0 | CF55: =RC[-46] -> 0 | CG55: =RC[-46] -> 0 | CH55: =RC[-46] -> 0 | CI55: =RC[-46] -> 0 | CJ55: =RC[-46] -> 0 | CK55: =RC[-46] -> 0 | CL55: =RC[-46] -> 1 | CM55: =RC[-46] -> 0 | CN55: =RC[-46] -> 0 | CO55: =RC[-46] -> 4313591.37 | CP55: =RC[-46] -> 0 | CQ55: =RC[-46] -> 0 | CR55: =RC[-46] -> 0 | CS55: =RC[-46] -> 0
A56: 36 | B56: 013359 | C56: Dương Đức An | D56: NV Tài liệu và HDCX | E56: 19028960251019 | F56: =RC[29]+RC[30]+RC[31]+RC[32]+RC[33]+RC[34]+RC[35]+RC[36]+RC[37] -> 3677163 | G56: =RC[17]+RC[18]++RC[19]+RC[20]+RC[21]+RC[38]+RC[39]+RC[41] -> 0 | H56: 0 | I56: 0 | J56: =RC[-2]+RC[-1] -> 0 | K56: 0 | L56: 680000 | M56: 0 | N56: =RC[15]+RC[16]+RC[17]+RC[18]+RC[19]+RC[20] -> 0 | O56: 0 | P56: 0 | Q56: 4357163 | R56: 0 | S56: 0 | T56: 0 | U56: 43571.63 | V56: 0 | W56: 4313591.37 | X56: 0 | Y56: 0 | Z56: 0 | AA56: 0 | AB56: 0 | AC56: 0 | AD56: 0 | AE56: 0 | AF56: 0 | AG56: 0 | AH56: 0 | AI56: 3677163 | AJ56: 0 | AK56: 0 | AL56: 0 | AM56: 0 | AN56: 0 | AO56: 0 | AP56: 0 | AQ56: 0 | AR56: =1 -> 1 | AS56: 0 | AT56: 0 | AU56: =RC[-30]-RC[-29]-RC[-28]-RC[-27]-RC[-26]-RC[-25] -> 4313591.37 | AV56: 0 | AW56: =RC[1]-RC[2] -> 0 | AX56: 0 | AY56: 0 | AZ56: =RC[-46] -> 3677163 | BA56: =RC[-46] -> 0 | BB56: =RC[-46] -> 0 | BC56: =RC[-46] -> 0 | BD56: =RC[-46] -> 0 | BE56: =RC[-46] -> 0 | BF56: =RC[-46] -> 680000 | BG56: =RC[-46] -> 0 | BH56: =RC[-46] -> 0 | BI56: =RC[-46] -> 0 | BJ56: =RC[-46] -> 0 | BK56: =RC[-46] -> 4357163 | BL56: =RC[-46] -> 0 | BM56: =RC[-46] -> 0 | BN56: =RC[-46] -> 0 | BO56: =RC[-46] -> 43571.63 | BP56: =RC[-46] -> 0 | BQ56: =RC[-46] -> 4313591.37 | BR56: =RC[-46] -> 0 | BS56: =RC[-46] -> 0 | BT56: =RC[-46] -> 0 | BU56: =RC[-46] -> 0 | BV56: =RC[-46] -> 0 | BW56: =RC[-46] -> 0 | BX56: =RC[-46] -> 0 | BY56: =RC[-46] -> 0 | BZ56: =RC[-46] -> 0 | CA56: =RC[-46] -> 0 | CB56: =RC[-46] -> 0 | CC56: =RC[-46] -> 3677163 | CD56: =RC[-46] -> 0 | CE56: =RC[-46] -> 0 | CF56: =RC[-46] -> 0 | CG56: =RC[-46] -> 0 | CH56: =RC[-46] -> 0 | CI56: =RC[-46] -> 0 | CJ56: =RC[-46] -> 0 | CK56: =RC[-46] -> 0 | CL56: =RC[-46] -> 1 | CM56: =RC[-46] -> 0 | CN56: =RC[-46] -> 0 | CO56: =RC[-46] -> 4313591.37 | CP56: =RC[-46] -> 0 | CQ56: =RC[-46] -> 0 | CR56: =RC[-46] -> 0 | CS56: =RC[-46] -> 0
A57: 37 | B57: 013360 | C57: Nguyễn Tự Tuyền | D57: NV Tài liệu và HDCX | E57: 19028960178011 | F57: =RC[29]+RC[30]+RC[31]+RC[32]+RC[33]+RC[34]+RC[35]+RC[36]+RC[37] -> 3677163 | G57: =RC[17]+RC[18]++RC[19]+RC[20]+RC[21]+RC[38]+RC[39]+RC[41] -> 0 | H57: 0 | I57: 0 | J57: =RC[-2]+RC[-1] -> 0 | K57: 0 | L57: 680000 | M57: 0 | N57: =RC[15]+RC[16]+RC[17]+RC[18]+RC[19]+RC[20] -> 0 | O57: 0 | P57: 0 | Q57: 4357163 | R57: 0 | S57: 0 | T57: 0 | U57: 43571.63 | V57: 0 | W57: 4313591.37 | X57: 0 | Y57: 0 | Z57: 0 | AA57: 0 | AB57: 0 | AC57: 0 | AD57: 0 | AE57: 0 | AF57: 0 | AG57: 0 | AH57: 0 | AI57: 3677163 | AJ57: 0 | AK57: 0 | AL57: 0 | AM57: 0 | AN57: 0 | AO57: 0 | AP57: 0 | AQ57: 0 | AR57: =1 -> 1 | AS57: 0 | AT57: 0 | AU57: =RC[-30]-RC[-29]-RC[-28]-RC[-27]-RC[-26]-RC[-25] -> 4313591.37 | AV57: 0 | AW57: =RC[1]-RC[2] -> 0 | AX57: 0 | AY57: 0 | AZ57: =RC[-46] -> 3677163 | BA57: =RC[-46] -> 0 | BB57: =RC[-46] -> 0 | BC57: =RC[-46] -> 0 | BD57: =RC[-46] -> 0 | BE57: =RC[-46] -> 0 | BF57: =RC[-46] -> 680000 | BG57: =RC[-46] -> 0 | BH57: =RC[-46] -> 0 | BI57: =RC[-46] -> 0 | BJ57: =RC[-46] -> 0 | BK57: =RC[-46] -> 4357163 | BL57: =RC[-46] -> 0 | BM57: =RC[-46] -> 0 | BN57: =RC[-46] -> 0 | BO57: =RC[-46] -> 43571.63 | BP57: =RC[-46] -> 0 | BQ57: =RC[-46] -> 4313591.37 | BR57: =RC[-46] -> 0 | BS57: =RC[-46] -> 0 | BT57: =RC[-46] -> 0 | BU57: =RC[-46] -> 0 | BV57: =RC[-46] -> 0 | BW57: =RC[-46] -> 0 | BX57: =RC[-46] -> 0 | BY57: =RC[-46] -> 0 | BZ57: =RC[-46] -> 0 | CA57: =RC[-46] -> 0 | CB57: =RC[-46] -> 0 | CC57: =RC[-46] -> 3677163 | CD57: =RC[-46] -> 0 | CE57: =RC[-46] -> 0 | CF57: =RC[-46] -> 0 | CG57: =RC[-46] -> 0 | CH57: =RC[-46] -> 0 | CI57: =RC[-46] -> 0 | CJ57: =RC[-46] -> 0 | CK57: =RC[-46] -> 0 | CL57: =RC[-46] -> 1 | CM57: =RC[-46] -> 0 | CN57: =RC[-46] -> 0 | CO57: =RC[-46] -> 4313591.37 | CP57: =RC[-46] -> 0 | CQ57: =RC[-46] -> 0 | CR57: =RC[-46] -> 0 | CS57: =RC[-46] -> 0
A58: 38 | B58: 010535 | C58: Nguyễn Văn Duẩn | D58: Nv Thống kê | E58: 10522162547016 | F58: =RC[29]+RC[30]+RC[31]+RC[32]+RC[33]+RC[34]+RC[35]+RC[36]+RC[37] -> 6420443 | G58: =RC[17]+RC[18]++RC[19]+RC[20]+RC[21]+RC[38]+RC[39]+RC[41] -> 0 | H58: 0 | I58: 0 | J58: =RC[-2]+RC[-1] -> 0 | K58: 0 | L58: 680000 | M58: 286178 | N58: =RC[15]+RC[16]+RC[17]+RC[18]+RC[19]+RC[20] -> 0 | O58: 0 | P58: 0 | Q58: 7386621 | R58: 218040 | S58: 40883 | T58: 27255 | U58: 71004.429999999993 | V58: 0 | W58: 7029438.5700000003 | X58: 0 | Y58: 0 | Z58: 0 | AA58: 0 | AB58: 0 | AC58: 0 | AD58: 0 | AE58: 0 | AF58: 0 | AG58: 0 | AH58: 0 | AI58: 6420443 | AJ58: 0 | AK58: 0 | AL58: 0 | AM58: 0 | AN58: 0 | AO58: 0 | AP58: 0 | AQ58: 0 | AR58: =1 -> 1 | AS58: 0 | AT58: 0 | AU58: =RC[-30]-RC[-29]-RC[-28]-RC[-27]-RC[-26]-RC[-25] -> 7029438.5700000003 | AV58: 0 | AW58: =RC[1]-RC[2] -> 0 | AX58: 0 | AY58: 0 | AZ58: =RC[-46] -> 6420443 | BA58: =RC[-46] -> 0 | BB58: =RC[-46] -> 0 | BC58: =RC[-46] -> 0 | BD58: =RC[-46] -> 0 | BE58: =RC[-46] -> 0 | BF58: =RC[-46] -> 680000 | BG58: =RC[-46] -> 286178 | BH58: =RC[-46] -> 0 | BI58: =RC[-46] -> 0 | BJ58: =RC[-46] -> 0 | BK58: =RC[-46] -> 7386621 | BL58: =RC[-46] -> 218040 | BM58: =RC[-46] -> 40883 | BN58: =RC[-46] -> 27255 | BO58: =RC[-46] -> 71004.429999999993 | BP58: =RC[-46] -> 0 | BQ58: =RC[-46] -> 7029438.5700000003 | BR58: =RC[-46] -> 0 | BS58: =RC[-46] -> 0 | BT58: =RC[-46] -> 0 | BU58: =RC[-46] -> 0 | BV58: =RC[-46] -> 0 | BW58: =RC[-46] -> 0 | BX58: =RC[-46] -> 0 | BY58: =RC[-46] -> 0 | BZ58: =RC[-46] -> 0 | CA58: =RC[-46] -> 0 | CB58: =RC[-46] -> 0 | CC58: =RC[-46] -> 6420443 | CD58: =RC[-46] -> 0 | CE58: =RC[-46] -> 0 | CF58: =RC[-46] -> 0 | CG58: =RC[-46] -> 0 | CH58: =RC[-46] -> 0 | CI58: =RC[-46] -> 0 | CJ58: =RC[-46] -> 0 | CK58: =RC[-46] -> 0 | CL58: =RC[-46] -> 1 | CM58: =RC[-46] -> 0 | CN58: =RC[-46] -> 0 | CO58: =RC[-46] -> 7029438.5700000003 | CP58: =RC[-46] -> 0 | CQ58: =RC[-46] -> 0 | CR58: =RC[-46] -> 0 | CS58: =RC[-46] -> 0
A59: 39 | B59: 013527 | C59: Chu Lữ Thu Phương | D59: NV Thủ tục bay, không báo | E59: 19027546517027 | F59: =RC[29]+RC[30]+RC[31]+RC[32]+RC[33]+RC[34]+RC[35]+RC[36]+RC[37] -> 3881450 | G59: =RC[17]+RC[18]++RC[19]+RC[20]+RC[21]+RC[38]+RC[39]+RC[41] -> 0 | H59: 0 | I59: 0 | J59: =RC[-2]+RC[-1] -> 0 | K59: 0 | L59: 680000 | M59: 0 | N59: =RC[15]+RC[16]+RC[17]+RC[18]+RC[19]+RC[20] -> 0 | O59: 0 | P59: 0 | Q59: 4561450 | R59: 0 | S59: 0 | T59: 0 | U59: 45614.5 | V59: 0 | W59: 4515835.5 | X59: 0 | Y59: 0 | Z59: 0 | AA59: 0 | AB59: 0 | AC59: 0 | AD59: 0 | AE59: 0 | AF59: 0 | AG59: 0 | AH59: 0 | AI59: 3881450 | AJ59: 0 | AK59: 0 | AL59: 0 | AM59: 0 | AN59: 0 | AO59: 0 | AP59: 0 | AQ59: 0 | AR59: =1 -> 1 | AS59: 0 | AT59: 0 | AU59: =RC[-30]-RC[-29]-RC[-28]-RC[-27]-RC[-26]-RC[-25] -> 4515835.5 | AV59: 0 | AW59: =RC[1]-RC[2] -> 0 | AX59: 0 | AY59: 0 | AZ59: =RC[-46] -> 3881450 | BA59: =RC[-46] -> 0 | BB59: =RC[-46] -> 0 | BC59: =RC[-46] -> 0 | BD59: =RC[-46] -> 0 | BE59: =RC[-46] -> 0 | BF59: =RC[-46] -> 680000 | BG59: =RC[-46] -> 0 | BH59: =RC[-46] -> 0 | BI59: =RC[-46] -> 0 | BJ59: =RC[-46] -> 0 | BK59: =RC[-46] -> 4561450 | BL59: =RC[-46] -> 0 | BM59: =RC[-46] -> 0 | BN59: =RC[-46] -> 0 | BO59: =RC[-46] -> 45614.5 | BP59: =RC[-46] -> 0 | BQ59: =RC[-46] -> 4515835.5 | BR59: =RC[-46] -> 0 | BS59: =RC[-46] -> 0 | BT59: =RC[-46] -> 0 | BU59: =RC[-46] -> 0 | BV59: =RC[-46] -> 0 | BW59: =RC[-46] -> 0 | BX59: =RC[-46] -> 0 | BY59: =RC[-46] -> 0 | BZ59: =RC[-46] -> 0 | CA59: =RC[-46] -> 0 | CB59: =RC[-46] -> 0 | CC59: =RC[-46] -> 3881450 | CD59: =RC[-46] -> 0 | CE59: =RC[-46] -> 0 | CF59: =RC[-46] -> 0 | CG59: =RC[-46] -> 0 | CH59: =RC[-46] -> 0 | CI59: =RC[-46] -> 0 | CJ59: =RC[-46] -> 0 | CK59: =RC[-46] -> 0 | CL59: =RC[-46] -> 1 | CM59: =RC[-46] -> 0 | CN59: =RC[-46] -> 0 | CO59: =RC[-46] -> 4515835.5 | CP59: =RC[-46] -> 0 | CQ59: =RC[-46] -> 0 | CR59: =RC[-46] -> 0 | CS59: =RC[-46] -> 0
A60: 40 | B60: 013528 | C60: Cao Thị Trà Giang | D60: NV Thủ tục bay, không báo | E60: 19028960119013 | F60: =RC[29]+RC[30]+RC[31]+RC[32]+RC[33]+RC[34]+RC[35]+RC[36]+RC[37] -> 3881450 | G60: =RC[17]+RC[18]++RC[19]+RC[20]+RC[21]+RC[38]+RC[39]+RC[41] -> 0 | H60: 0 | I60: 0 | J60: =RC[-2]+RC[-1] -> 0 | K60: 0 | L60: 680000 | M60: 0 | N60: =RC[15]+RC[16]+RC[17]+RC[18]+RC[19]+RC[20] -> 0 | O60: 0 | P60: 0 | Q60: 4561450 | R60: 0 | S60: 0 | T60: 0 | U60: 45614.5 | V60: 0 | W60: 4515835.5 | X60: 0 | Y60: 0 | Z60: 0 | AA60: 0 | AB60: 0 | AC60: 0 | AD60: 0 | AE60: 0 | AF60: 0 | AG60: 0 | AH60: 0 | AI60: 3881450 | AJ60: 0 | AK60: 0 | AL60: 0 | AM60: 0 | AN60: 0 | AO60: 0 | AP60: 0 | AQ60: 0 | AR60: =1 -> 1 | AS60: 0 | AT60: 0 | AU60: =RC[-30]-RC[-29]-RC[-28]-RC[-27]-RC[-26]-RC[-25] -> 4515835.5 | AV60: 0 | AW60: =RC[1]-RC[2] -> 0 | AX60: 0 | AY60: 0 | AZ60: =RC[-46] -> 3881450 | BA60: =RC[-46] -> 0 | BB60: =RC[-46] -> 0 | BC60: =RC[-46] -> 0 | BD60: =RC[-46] -> 0 | BE60: =RC[-46] -> 0 | BF60: =RC[-46] -> 680000 | BG60: =RC[-46] -> 0 | BH60: =RC[-46] -> 0 | BI60: =RC[-46] -> 0 | BJ60: =RC[-46] -> 0 | BK60: =RC[-46] -> 4561450 | BL60: =RC[-46] -> 0 | BM60: =RC[-46] -> 0 | BN60: =RC[-46] -> 0 | BO60: =RC[-46] -> 45614.5 | BP60: =RC[-46] -> 0 | BQ60: =RC[-46] -> 4515835.5 | BR60: =RC[-46] -> 0 | BS60: =RC[-46] -> 0 | BT60: =RC[-46] -> 0 | BU60: =RC[-46] -> 0 | BV60: =RC[-46] -> 0 | BW60: =RC[-46] -> 0 | BX60: =RC[-46] -> 0 | BY60: =RC[-46] -> 0 | BZ60: =RC[-46] -> 0 | CA60: =RC[-46] -> 0 | CB60: =RC[-46] -> 0 | CC60: =RC[-46] -> 3881450 | CD60: =RC[-46] -> 0 | CE60: =RC[-46] -> 0 | CF60: =RC[-46] -> 0 | CG60: =RC[-46] -> 0 | CH60: =RC[-46] -> 0 | CI60: =RC[-46] -> 0 | CJ60: =RC[-46] -> 0 | CK60: =RC[-46] -> 0 | CL60: =RC[-46] -> 1 | CM60: =RC[-46] -> 0 | CN60: =RC[-46] -> 0 | CO60: =RC[-46] -> 4515835.5 | CP60: =RC[-46] -> 0 | CQ60: =RC[-46] -> 0 | CR60: =RC[-46] -> 0 | CS60: =RC[-46] -> 0
A61: 41 | B61: 010536 | C61: Nguyễn Tiến Dũng | D61: NV ULD | E61: 10523873640015 | F61: =RC[29]+RC[30]+RC[31]+RC[32]+RC[33]+RC[34]+RC[35]+RC[36]+RC[37] -> 4961251 | G61: =RC[17]+RC[18]++RC[19]+RC[20]+RC[21]+RC[38]+RC[39]+RC[41] -> 0 | H61: 0 | I61: 0 | J61: =RC[-2]+RC[-1] -> 0 | K61: 0 | L61: 680000 | M61: 235463 | N61: =RC[15]+RC[16]+RC[17]+RC[18]+RC[19]+RC[20] -> 0 | O61: 0 | P61: 0 | Q61: 5876714 | R61: 179400 | S61: 33638 | T61: 22425 | U61: 56412.51 | V61: 0 | W61: 5584838.4900000002 | X61: 0 | Y61: 0 | Z61: 0 | AA61: 0 | AB61: 0 | AC61: 0 | AD61: 0 | AE61: 0 | AF61: 0 | AG61: 0 | AH61: 0 | AI61: 4961251 | AJ61: 0 | AK61: 0 | AL61: 0 | AM61: 0 | AN61: 0 | AO61: 0 | AP61: 0 | AQ61: 0 | AR61: =1 -> 1 | AS61: 0 | AT61: 0 | AU61: =RC[-30]-RC[-29]-RC[-28]-RC[-27]-RC[-26]-RC[-25] -> 5584838.4900000002 | AV61: 0 | AW61: =RC[1]-RC[2] -> 0 | AX61: 0 | AY61: 0 | AZ61: =RC[-46] -> 4961251 | BA61: =RC[-46] -> 0 | BB61: =RC[-46] -> 0 | BC61: =RC[-46] -> 0 | BD61: =RC[-46] -> 0 | BE61: =RC[-46] -> 0 | BF61: =RC[-46] -> 680000 | BG61: =RC[-46] -> 235463 | BH61: =RC[-46] -> 0 | BI61: =RC[-46] -> 0 | BJ61: =RC[-46] -> 0 | BK61: =RC[-46] -> 5876714 | BL61: =RC[-46] -> 179400 | BM61: =RC[-46] -> 33638 | BN61: =RC[-46] -> 22425 | BO61: =RC[-46] -> 56412.51 | BP61: =RC[-46] -> 0 | BQ61: =RC[-46] -> 5584838.4900000002 | BR61: =RC[-46] -> 0 | BS61: =RC[-46] -> 0 | BT61: =RC[-46] -> 0 | BU61: =RC[-46] -> 0 | BV61: =RC[-46] -> 0 | BW61: =RC[-46] -> 0 | BX61: =RC[-46] -> 0 | BY61: =RC[-46] -> 0 | BZ61: =RC[-46] -> 0 | CA61: =RC[-46] -> 0 | CB61: =RC[-46] -> 0 | CC61: =RC[-46] -> 4961251 | CD61: =RC[-46] -> 0 | CE61: =RC[-46] -> 0 | CF61: =RC[-46] -> 0 | CG61: =RC[-46] -> 0 | CH61: =RC[-46] -> 0 | CI61: =RC[-46] -> 0 | CJ61: =RC[-46] -> 0 | CK61: =RC[-46] -> 0 | CL61: =RC[-46] -> 1 | CM61: =RC[-46] -> 0 | CN61: =RC[-46] -> 0 | CO61: =RC[-46] -> 5584838.4900000002 | CP61: =RC[-46] -> 0 | CQ61: =RC[-46] -> 0 | CR61: =RC[-46] -> 0 | CS61: =RC[-46] -> 0
A62: 42 | B62: 011355 | C62: Văn Anh Tuấn | D62: NV ULD | E62: 19027089339010 | F62: =RC[29]+RC[30]+RC[31]+RC[32]+RC[33]+RC[34]+RC[35]+RC[36]+RC[37] -> 4902884 | G62: =RC[17]+RC[18]++RC[19]+RC[20]+RC[21]+RC[38]+RC[39]+RC[41] -> 0 | H62: 0 | I62: 0 | J62: =RC[-2]+RC[-1] -> 0 | K62: 0 | L62: 680000 | M62: 235463 | N62: =RC[15]+RC[16]+RC[17]+RC[18]+RC[19]+RC[20] -> 0 | O62: 0 | P62: 0 | Q62: 5818347 | R62: 179400 | S62: 33638 | T62: 22425 | U62: 55828.84 | V62: 0 | W62: 5527055.1600000001 | X62: 0 | Y62: 0 | Z62: 0 | AA62: 0 | AB62: 0 | AC62: 0 | AD62: 0 | AE62: 0 | AF62: 0 | AG62: 0 | AH62: 0 | AI62: 4902884 | AJ62: 0 | AK62: 0 | AL62: 0 | AM62: 0 | AN62: 0 | AO62: 0 | AP62: 0 | AQ62: 0 | AR62: =1 -> 1 | AS62: 0 | AT62: 0 | AU62: =RC[-30]-RC[-29]-RC[-28]-RC[-27]-RC[-26]-RC[-25] -> 5527055.1600000001 | AV62: 0 | AW62: =RC[1]-RC[2] -> 0 | AX62: 0 | AY62: 0 | AZ62: =RC[-46] -> 4902884 | BA62: =RC[-46] -> 0 | BB62: =RC[-46] -> 0 | BC62: =RC[-46] -> 0 | BD62: =RC[-46] -> 0 | BE62: =RC[-46] -> 0 | BF62: =RC[-46] -> 680000 | BG62: =RC[-46] -> 235463 | BH62: =RC[-46] -> 0 | BI62: =RC[-46] -> 0 | BJ62: =RC[-46] -> 0 | BK62: =RC[-46] -> 5818347 | BL62: =RC[-46] -> 179400 | BM62: =RC[-46] -> 33638 | BN62: =RC[-46] -> 22425 | BO62: =RC[-46] -> 55828.84 | BP62: =RC[-46] -> 0 | BQ62: =RC[-46] -> 5527055.1600000001 | BR62: =RC[-46] -> 0 | BS62: =RC[-46] -> 0 | BT62: =RC[-46] -> 0 | BU62: =RC[-46] -> 0 | BV62: =RC[-46] -> 0 | BW62: =RC[-46] -> 0 | BX62: =RC[-46] -> 0 | BY62: =RC[-46] -> 0 | BZ62: =RC[-46] -> 0 | CA62: =RC[-46] -> 0 | CB62: =RC[-46] -> 0 | CC62: =RC[-46] -> 4902884 | CD62: =RC[-46] -> 0 | CE62: =RC[-46] -> 0 | CF62: =RC[-46] -> 0 | CG62: =RC[-46] -> 0 | CH62: =RC[-46] -> 0 | CI62: =RC[-46] -> 0 | CJ62: =RC[-46] -> 0 | CK62: =RC[-46] -> 0 | CL62: =RC[-46] -> 1 | CM62: =RC[-46] -> 0 | CN62: =RC[-46] -> 0 | CO62: =RC[-46] -> 5527055.1600000001 | CP62: =RC[-46] -> 0 | CQ62: =RC[-46] -> 0 | CR62: =RC[-46] -> 0 | CS62: =RC[-46] -> 0
A63: 43 | B63: 012593 | C63: Phạm Trần Tuấn Minh | D63: NV ULD | E63: 19028385628016 | F63: =RC[29]+RC[30]+RC[31]+RC[32]+RC[33]+RC[34]+RC[35]+RC[36]+RC[37] -> 4669413 | G63: =RC[17]+RC[18]++RC[19]+RC[20]+RC[21]+RC[38]+RC[39]+RC[41] -> 0 | H63: 0 | I63: 0 | J63: =RC[-2]+RC[-1] -> 0 | K63: 0 | L63: 680000 | M63: 235463 | N63: =RC[15]+RC[16]+RC[17]+RC[18]+RC[19]+RC[20] -> 0 | O63: 0 | P63: 0 | Q63: 5584876 | R63: 179400 | S63: 33638 | T63: 22425 | U63: 53494.13 | V63: 0 | W63: 5295918.87 | X63: 0 | Y63: 0 | Z63: 0 | AA63: 0 | AB63: 0 | AC63: 0 | AD63: 0 | AE63: 0 | AF63: 0 | AG63: 0 | AH63: 0 | AI63: 4669413 | AJ63: 0 | AK63: 0 | AL63: 0 | AM63: 0 | AN63: 0 | AO63: 0 | AP63: 0 | AQ63: 0 | AR63: =1 -> 1 | AS63: 0 | AT63: 0 | AU63: =RC[-30]-RC[-29]-RC[-28]-RC[-27]-RC[-26]-RC[-25] -> 5295918.87 | AV63: 0 | AW63: =RC[1]-RC[2] -> 0 | AX63: 0 | AY63: 0 | AZ63: =RC[-46] -> 4669413 | BA63: =RC[-46] -> 0 | BB63: =RC[-46] -> 0 | BC63: =RC[-46] -> 0 | BD63: =RC[-46] -> 0 | BE63: =RC[-46] -> 0 | BF63: =RC[-46] -> 680000 | BG63: =RC[-46] -> 235463 | BH63: =RC[-46] -> 0 | BI63: =RC[-46] -> 0 | BJ63: =RC[-46] -> 0 | BK63: =RC[-46] -> 5584876 | BL63: =RC[-46] -> 179400 | BM63: =RC[-46] -> 33638 | BN63: =RC[-46] -> 22425 | BO63: =RC[-46] -> 53494.13 | BP63: =RC[-46] -> 0 | BQ63: =RC[-46] -> 5295918.87 | BR63: =RC[-46] -> 0 | BS63: =RC[-46] -> 0 | BT63: =RC[-46] -> 0 | BU63: =RC[-46] -> 0 | BV63: =RC[-46] -> 0 | BW63: =RC[-46] -> 0 | BX63: =RC[-46] -> 0 | BY63: =RC[-46] -> 0 | BZ63: =RC[-46] -> 0 | CA63: =RC[-46] -> 0 | CB63: =RC[-46] -> 0 | CC63: =RC[-46] -> 4669413 | CD63: =RC[-46] -> 0 | CE63: =RC[-46] -> 0 | CF63: =RC[-46] -> 0 | CG63: =RC[-46] -> 0 | CH63: =RC[-46] -> 0 | CI63: =RC[-46] -> 0 | CJ63: =RC[-46] -> 0 | CK63: =RC[-46] -> 0 | CL63: =RC[-46] -> 1 | CM63: =RC[-46] -> 0 | CN63: =RC[-46] -> 0 | CO63: =RC[-46] -> 5295918.87 | CP63: =RC[-46] -> 0 | CQ63: =RC[-46] -> 0 | CR63: =RC[-46] -> 0 | CS63: =RC[-46] -> 0
A64: 44 | B64: 012594 | C64: Đỗ Đình Quân | D64: NV ULD | E64: 19028385626013 | F64: =RC[29]+RC[30]+RC[31]+RC[32]+RC[33]+RC[34]+RC[35]+RC[36]+RC[37] -> 4669413 | G64: =RC[17]+RC[18]++RC[19]+RC[20]+RC[21]+RC[38]+RC[39]+RC[41] -> 0 | H64: 0 | I64: 0 | J64: =RC[-2]+RC[-1] -> 0 | K64: 0 | L64: 680000 | M64: 235463 | N64: =RC[15]+RC[16]+RC[17]+RC[18]+RC[19]+RC[20] -> 0 | O64: 0 | P64: 0 | Q64: 5584876 | R64: 179400 | S64: 33638 | T64: 22425 | U64: 53494.13 | V64: 0 | W64: 5295918.87 | X64: 0 | Y64: 0 | Z64: 0 | AA64: 0 | AB64: 0 | AC64: 0 | AD64: 0 | AE64: 0 | AF64: 0 | AG64: 0 | AH64: 0 | AI64: 4669413 | AJ64: 0 | AK64: 0 | AL64: 0 | AM64: 0 | AN64: 0 | AO64: 0 | AP64: 0 | AQ64: 0 | AR64: =1 -> 1 | AS64: 0 | AT64: 0 | AU64: =RC[-30]-RC[-29]-RC[-28]-RC[-27]-RC[-26]-RC[-25] -> 5295918.87 | AV64: 0 | AW64: =RC[1]-RC[2] -> 0 | AX64: 0 | AY64: 0 | AZ64: =RC[-46] -> 4669413 | BA64: =RC[-46] -> 0 | BB64: =RC[-46] -> 0 | BC64: =RC[-46] -> 0 | BD64: =RC[-46] -> 0 | BE64: =RC[-46] -> 0 | BF64: =RC[-46] -> 680000 | BG64: =RC[-46] -> 235463 | BH64: =RC[-46] -> 0 | BI64: =RC[-46] -> 0 | BJ64: =RC[-46] -> 0 | BK64: =RC[-46] -> 5584876 | BL64: =RC[-46] -> 179400 | BM64: =RC[-46] -> 33638 | BN64: =RC[-46] -> 22425 | BO64: =RC[-46] -> 53494.13 | BP64: =RC[-46] -> 0 | BQ64: =RC[-46] -> 5295918.87 | BR64: =RC[-46] -> 0 | BS64: =RC[-46] -> 0 | BT64: =RC[-46] -> 0 | BU64: =RC[-46] -> 0 | BV64: =RC[-46] -> 0 | BW64: =RC[-46] -> 0 | BX64: =RC[-46] -> 0 | BY64: =RC[-46] -> 0 | BZ64: =RC[-46] -> 0 | CA64: =RC[-46] -> 0 | CB64: =RC[-46] -> 0 | CC64: =RC[-46] -> 4669413 | CD64: =RC[-46] -> 0 | CE64: =RC[-46] -> 0 | CF64: =RC[-46] -> 0 | CG64: =RC[-46] -> 0 | CH64: =RC[-46] -> 0 | CI64: =RC[-46] -> 0 | CJ64: =RC[-46] -> 0 | CK64: =RC[-46] -> 0 | CL64: =RC[-46] -> 1 | CM64: =RC[-46] -> 0 | CN64: =RC[-46] -> 0 | CO64: =RC[-46] -> 5295918.87 | CP64: =RC[-46] -> 0 | CQ64: =RC[-46] -> 0 | CR64: =RC[-46] -> 0 | CS64: =RC[-46] -> 0
A65: 45 | B65: 012595 | C65: Lê Văn Lương | D65: NV ULD | E65: 19028385620015 | F65: =RC[29]+RC[30]+RC[31]+RC[32]+RC[33]+RC[34]+RC[35]+RC[36]+RC[37] -> 4669413 | G65: =RC[17]+RC[18]++RC[19]+RC[20]+RC[21]+RC[38]+RC[39]+RC[41] -> 0 | H65: 0 | I65: 0 | J65: =RC[-2]+RC[-1] -> 0 | K65: 0 | L65: 680000 | M65: 235463 | N65: =RC[15]+RC[16]+RC[17]+RC[18]+RC[19]+RC[20] -> 0 | O65: 0 | P65: 0 | Q65: 5584876 | R65: 179400 | S65: 33638 | T65: 22425 | U65: 53494.13 | V65: 0 | W65: 5295918.87 | X65: 0 | Y65: 0 | Z65: 0 | AA65: 0 | AB65: 0 | AC65: 0 | AD65: 0 | AE65: 0 | AF65: 0 | AG65: 0 | AH65: 0 | AI65: 4669413 | AJ65: 0 | AK65: 0 | AL65: 0 | AM65: 0 | AN65: 0 | AO65: 0 | AP65: 0 | AQ65: 0 | AR65: =1 -> 1 | AS65: 0 | AT65: 0 | AU65: =RC[-30]-RC[-29]-RC[-28]-RC[-27]-RC[-26]-RC[-25] -> 5295918.87 | AV65: 0 | AW65: =RC[1]-RC[2] -> 0 | AX65: 0 | AY65: 0 | AZ65: =RC[-46] -> 4669413 | BA65: =RC[-46] -> 0 | BB65: =RC[-46] -> 0 | BC65: =RC[-46] -> 0 | BD65: =RC[-46] -> 0 | BE65: =RC[-46] -> 0 | BF65: =RC[-46] -> 680000 | BG65: =RC[-46] -> 235463 | BH65: =RC[-46] -> 0 | BI65: =RC[-46] -> 0 | BJ65: =RC[-46] -> 0 | BK65: =RC[-46] -> 5584876 | BL65: =RC[-46] -> 179400 | BM65: =RC[-46] -> 33638 | BN65: =RC[-46] -> 22425 | BO65: =RC[-46] -> 53494.13 | BP65: =RC[-46] -> 0 | BQ65: =RC[-46] -> 5295918.87 | BR65: =RC[-46] -> 0 | BS65: =RC[-46] -> 0 | BT65: =RC[-46] -> 0 | BU65: =RC[-46] -> 0 | BV65: =RC[-46] -> 0 | BW65: =RC[-46] -> 0 | BX65: =RC[-46] -> 0 | BY65: =RC[-46] -> 0 | BZ65: =RC[-46] -> 0 | CA65: =RC[-46] -> 0 | CB65: =RC[-46] -> 0 | CC65: =RC[-46] -> 4669413 | CD65: =RC[-46] -> 0 | CE65: =RC[-46] -> 0 | CF65: =RC[-46] -> 0 | CG65: =RC[-46] -> 0 | CH65: =RC[-46] -> 0 | CI65: =RC[-46] -> 0 | CJ65: =RC[-46] -> 0 | CK65: =RC[-46] -> 0 | CL65: =RC[-46] -> 1 | CM65: =RC[-46] -> 0 | CN65: =RC[-46] -> 0 | CO65: =RC[-46] -> 5295918.87 | CP65: =RC[-46] -> 0 | CQ65: =RC[-46] -> 0 | CR65: =RC[-46] -> 0 | CS65: =RC[-46] -> 0
A66: 46 | B66: 013102 | C66: Ngô Văn Sơn | D66: Nviên HDCX | E66: 19028834685011 | F66: =RC[29]+RC[30]+RC[31]+RC[32]+RC[33]+RC[34]+RC[35]+RC[36]+RC[37] -> 3677163 | G66: =RC[17]+RC[18]++RC[19]+RC[20]+RC[21]+RC[38]+RC[39]+RC[41] -> 0 | H66: 0 | I66: 0 | J66: =RC[-2]+RC[-1] -> 0 | K66: 0 | L66: 680000 | M66: 0 | N66: =RC[15]+RC[16]+RC[17]+RC[18]+RC[19]+RC[20] -> 0 | O66: 0 | P66: 0 | Q66: 4357163 | R66: 0 | S66: 0 | T66: 0 | U66: 43571.63 | V66: 0 | W66: 4313591.37 | X66: 0 | Y66: 0 | Z66: 0 | AA66: 0 | AB66: 0 | AC66: 0 | AD66: 0 | AE66: 0 | AF66: 0 | AG66: 0 | AH66: 0 | AI66: 3677163 | AJ66: 0 | AK66: 0 | AL66: 0 | AM66: 0 | AN66: 0 | AO66: 0 | AP66: 0 | AQ66: 0 | AR66: =1 -> 1 | AS66: 0 | AT66: 0 | AU66: =RC[-30]-RC[-29]-RC[-28]-RC[-27]-RC[-26]-RC[-25] -> 4313591.37 | AV66: 0 | AW66: =RC[1]-RC[2] -> 0 | AX66: 0 | AY66: 0 | AZ66: =RC[-46] -> 3677163 | BA66: =RC[-46] -> 0 | BB66: =RC[-46] -> 0 | BC66: =RC[-46] -> 0 | BD66: =RC[-46] -> 0 | BE66: =RC[-46] -> 0 | BF66: =RC[-46] -> 680000 | BG66: =RC[-46] -> 0 | BH66: =RC[-46] -> 0 | BI66: =RC[-46] -> 0 | BJ66: =RC[-46] -> 0 | BK66: =RC[-46] -> 4357163 | BL66: =RC[-46] -> 0 | BM66: =RC[-46] -> 0 | BN66: =RC[-46] -> 0 | BO66: =RC[-46] -> 43571.63 | BP66: =RC[-46] -> 0 | BQ66: =RC[-46] -> 4313591.37 | BR66: =RC[-46] -> 0 | BS66: =RC[-46] -> 0 | BT66: =RC[-46] -> 0 | BU66: =RC[-46] -> 0 | BV66: =RC[-46] -> 0 | BW66: =RC[-46] -> 0 | BX66: =RC[-46] -> 0 | BY66: =RC[-46] -> 0 | BZ66: =RC[-46] -> 0 | CA66: =RC[-46] -> 0 | CB66: =RC[-46] -> 0 | CC66: =RC[-46] -> 3677163 | CD66: =RC[-46] -> 0 | CE66: =RC[-46] -> 0 | CF66: =RC[-46] -> 0 | CG66: =RC[-46] -> 0 | CH66: =RC[-46] -> 0 | CI66: =RC[-46] -> 0 | CJ66: =RC[-46] -> 0 | CK66: =RC[-46] -> 0 | CL66: =RC[-46] -> 1 | CM66: =RC[-46] -> 0 | CN66: =RC[-46] -> 0 | CO66: =RC[-46] -> 4313591.37 | CP66: =RC[-46] -> 0 | CQ66: =RC[-46] -> 0 | CR66: =RC[-46] -> 0 | CS66: =RC[-46] -> 0
F67: =SUM(R[-46]C:R[-1]C) -> 262680749 | G67: =SUM(R[-46]C:R[-1]C) -> 581538 | H67: =SUM(R[-46]C:R[-1]C) -> 0 | I67: =SUM(R[-46]C:R[-1]C) -> 735000 | J67: =SUM(R[-46]C:R[-1]C) -> 735000 | K67: =SUM(R[-46]C:R[-1]C) -> 420000 | L67: =SUM(R[-46]C:R[-1]C) -> 29736923 | M67: =SUM(R[-46]C:R[-1]C) -> 9989660 | N67: =SUM(R[-46]C:R[-1]C) -> 2877406 | O67: =SUM(R[-46]C:R[-1]C) -> 0 | P67: =SUM(R[-46]C:R[-1]C) -> 0 | Q67: =SUM(R[-46]C:R[-1]C) -> 307021276 | R67: =SUM(R[-46]C:R[-1]C) -> 7611160 | S67: =SUM(R[-46]C:R[-1]C) -> 1427105 | T67: =SUM(R[-46]C:R[-1]C) -> 951395 | U67: =SUM(R[-46]C:R[-1]C) -> 2869521.4299999988 | V67: =SUM(R[-46]C:R[-1]C) -> 2903 | W67: =SUM(R[-46]C:R[-1]C) -> 294159191.57000005 | X67: =SUM(R[-46]C:R[-1]C) -> 0 | Y67: =SUM(R[-46]C:R[-1]C) -> 581538 | Z67: =SUM(R[-46]C:R[-1]C) -> 0 | AA67: =SUM(R[-46]C:R[-1]C) -> 0 | AB67: =SUM(R[-46]C:R[-1]C) -> 0 | AC67: =SUM(R[-46]C:R[-1]C) -> 0 | AD67: =SUM(R[-46]C:R[-1]C) -> 0 | AE67: =SUM(R[-46]C:R[-1]C) -> 0 | AF67: =SUM(R[-46]C:R[-1]C) -> 0 | AG67: =SUM(R[-46]C:R[-1]C) -> 0 | AH67: =SUM(R[-46]C:R[-1]C) -> 2877406 | AI67: =SUM(R[-46]C:R[-1]C) -> 260293512 | AJ67: =SUM(R[-46]C:R[-1]C) -> 2387237 | AK67: =SUM(R[-46]C:R[-1]C) -> 0 | AL67: =SUM(R[-46]C:R[-1]C) -> 0 | AM67: =SUM(R[-46]C:R[-1]C) -> 0 | AN67: =SUM(R[-46]C:R[-1]C) -> 0 | AO67: =SUM(R[-46]C:R[-1]C) -> 0 | AP67: =SUM(R[-46]C:R[-1]C) -> 0 | AQ67: =SUM(R[-46]C:R[-1]C) -> 0 | AR67: =SUM(R[-46]C:R[-1]C) -> 46 | AS67: =SUM(R[-46]C:R[-1]C) -> 0 | AT67: =SUM(R[-46]C:R[-1]C) -> 0 | AU67: =SUM(R[-46]C:R[-1]C) -> 294159191.57000005 | AV67: =SUM(R[-46]C:R[-1]C) -> 0 | AW67: =SUM(R[-46]C:R[-1]C) -> 959135.32999999984 | AX67: =SUM(R[-46]C:R[-1]C) -> 2877406 | AY67: =SUM(R[-46]C:R[-1]C) -> 1918270.6699999995
A68: Phòng Điều hành, tài liệu và hướng dẫn chất xếp (HGS) | F68: =SUM(R[-48]C[46]:R[-1]C[46]) -> 262680749 | G68: =SUM(R[-48]C[46]:R[-1]C[46]) -> 581538 | H68: =SUM(R[-48]C[46]:R[-1]C[46]) -> 0 | I68: =SUM(R[-48]C[46]:R[-1]C[46]) -> 735000 | J68: =SUM(R[-48]C[46]:R[-1]C[46]) -> 735000 | K68: =SUM(R[-48]C[46]:R[-1]C[46]) -> 420000 | L68: =SUM(R[-48]C[46]:R[-1]C[46]) -> 29736923 | M68: =SUM(R[-48]C[46]:R[-1]C[46]) -> 9989660 | N68: =SUM(R[-48]C[46]:R[-1]C[46]) -> 2877406 | O68: =SUM(R[-48]C[46]:R[-1]C[46]) -> 0 | P68: =SUM(R[-48]C[46]:R[-1]C[46]) -> 0 | Q68: =SUM(R[-48]C[46]:R[-1]C[46]) -> 307021276 | R68: =SUM(R[-48]C[46]:R[-1]C[46]) -> 7611160 | S68: =SUM(R[-48]C[46]:R[-1]C[46]) -> 1427105 | T68: =SUM(R[-48]C[46]:R[-1]C[46]) -> 951395 | U68: =SUM(R[-48]C[46]:R[-1]C[46]) -> 2869521.4299999988 | V68: =SUM(R[-48]C[46]:R[-1]C[46]) -> 2903 | W68: =SUM(R[-48]C[46]:R[-1]C[46]) -> 294159191.57000005 | X68: =SUM(R[-48]C[46]:R[-1]C[46]) -> 0 | Y68: =SUM(R[-48]C[46]:R[-1]C[46]) -> 581538 | Z68: =SUM(R[-48]C[46]:R[-1]C[46]) -> 0 | AA68: =SUM(R[-48]C[46]:R[-1]C[46]) -> 0 | AB68: =SUM(R[-48]C[46]:R[-1]C[46]) -> 0 | AC68: =SUM(R[-48]C[46]:R[-1]C[46]) -> 0 | AD68: =SUM(R[-48]C[46]:R[-1]C[46]) -> 0 | AE68: =SUM(R[-48]C[46]:R[-1]C[46]) -> 0 | AF68: =SUM(R[-48]C[46]:R[-1]C[46]) -> 0 | AG68: =SUM(R[-48]C[46]:R[-1]C[46]) -> 0 | AH68: =SUM(R[-48]C[46]:R[-1]C[46]) -> 2877406 | AI68: =SUM(R[-48]C[46]:R[-1]C[46]) -> 260293512 | AJ68: =SUM(R[-48]C[46]:R[-1]C[46]) -> 2387237 | AK68: =SUM(R[-48]C[46]:R[-1]C[46]) -> 0 | AL68: =SUM(R[-48]C[46]:R[-1]C[46]) -> 0 | AM68: =SUM(R[-48]C[46]:R[-1]C[46]) -> 0 | AN68: =SUM(R[-48]C[46]:R[-1]C[46]) -> 0 | AO68: =SUM(R[-48]C[46]:R[-1]C[46]) -> 0 | AP68: =SUM(R[-48]C[46]:R[-1]C[46]) -> 0 | AQ68: =SUM(R[-48]C[46]:R[-1]C[46]) -> 0 | AR68: =SUM(R[-48]C[46]:R[-1]C[46]) -> 46 | AS68: =SUM(R[-48]C[46]:R[-1]C[46]) -> 0 | AT68: =SUM(R[-48]C[46]:R[-1]C[46]) -> 0 | AU68: =SUM(R[-48]C[46]:R[-1]C[46]) -> 294159191.57000005 | AV68: =SUM(R[-48]C[46]:R[-1]C[46]) -> 0 | AW68: =SUM(R[-48]C[46]:R[-1]C[46]) -> 959135.32999999984 | AX68: =SUM(R[-48]C[46]:R[-1]C[46]) -> 2877406 | AY68: =SUM(R[-48]C[46]:R[-1]C[46]) -> 1918270.6699999995
A69: Phòng Kế hoạch - Kinh doanh (HGS) | F69: =R[13]C -> 82272138 | G69: =R[13]C -> 0 | H69: =R[13]C -> 0 | I69: =R[13]C -> 630000 | J69: =R[13]C -> 630000 | K69: =R[13]C -> 0 | L69: =R[13]C -> 6490909 | M69: =R[13]C -> 2935436 | N69: =R[13]C -> 0 | O69: =R[13]C -> 0 | P69: =R[13]C -> 0 | Q69: =R[13]C -> 92328483 | R69: =R[13]C -> 2236520 | S69: =R[13]C -> 419351 | T69: =R[13]C -> 279565 | U69: =R[13]C -> 816277.89999999991 | V69: =R[13]C -> 0 | W69: =R[13]C -> 88576769.099999994 | X69: =R[13]C -> 0 | Y69: =R[13]C -> 0 | Z69: =R[13]C -> 0 | AA69: =R[13]C -> 0 | AB69: =R[13]C -> 0 | AC69: =R[13]C -> 0 | AD69: =R[13]C -> 0 | AE69: =R[13]C -> 0 | AF69: =R[13]C -> 0 | AG69: =R[13]C -> 0 | AH69: =R[13]C -> 0 | AI69: =R[13]C -> 82272138 | AJ69: =R[13]C -> 0 | AK69: =R[13]C -> 0 | AL69: =R[13]C -> 0 | AM69: =R[13]C -> 0 | AN69: =R[13]C -> 0 | AO69: =R[13]C -> 0 | AP69: =R[13]C -> 0 | AQ69: =R[13]C -> 0 | AR69: =R[13]C -> 10 | AS69: =R[13]C -> 0 | AT69: =R[13]C -> 0 | AU69: =R[13]C -> 88576769.099999994 | AW69: =R[13]C -> 0 | AX69: =R[13]C -> 0 | AY69: =R[13]C -> 0
F70: =R[11]C -> 82272138 | G70: =R[11]C -> 0 | H70: =R[11]C -> 0 | I70: =R[11]C -> 630000 | J70: =R[11]C -> 630000 | K70: =R[11]C -> 0 | L70: =R[11]C -> 6490909 | M70: =R[11]C -> 2935436 | N70: =R[11]C -> 0 | O70: =R[11]C -> 0 | P70: =R[11]C -> 0 | Q70: =R[11]C -> 92328483 | R70: =R[11]C -> 2236520 | S70: =R[11]C -> 419351 | T70: =R[11]C -> 279565 | U70: =R[11]C -> 816277.89999999991 | V70: =R[11]C -> 0 | W70: =R[11]C -> 88576769.099999994 | X70: =R[11]C -> 0 | Y70: =R[11]C -> 0 | Z70: =R[11]C -> 0 | AA70: =R[11]C -> 0 | AB70: =R[11]C -> 0 | AC70: =R[11]C -> 0 | AD70: =R[11]C -> 0 | AE70: =R[11]C -> 0 | AF70: =R[11]C -> 0 | AG70: =R[11]C -> 0 | AH70: =R[11]C -> 0 | AI70: =R[11]C -> 82272138 | AJ70: =R[11]C -> 0 | AK70: =R[11]C -> 0 | AL70: =R[11]C -> 0 | AM70: =R[11]C -> 0 | AN70: =R[11]C -> 0 | AO70: =R[11]C -> 0 | AP70: =R[11]C -> 0 | AQ70: =R[11]C -> 0 | AR70: =R[11]C -> 10 | AS70: =R[11]C -> 0 | AT70: =R[11]C -> 0 | AU70: =R[11]C -> 88576769.099999994 | AW70: =R[11]C -> 0 | AX70: =R[11]C -> 0 | AY70: =R[11]C -> 0
A71: 1 | B71: 010563 | C71: Lưu Xuân Cường | D71: Phó Trưởng Phòng | E71: 10520052608017 | F71: =RC[29]+RC[30]+RC[31]+RC[32]+RC[33]+RC[34]+RC[35]+RC[36]+RC[37] -> 15146408 | G71: =RC[17]+RC[18]++RC[19]+RC[20]+RC[21]+RC[38]+RC[39]+RC[41] -> 0 | H71: 0 | I71: 315000 | J71: =RC[-2]+RC[-1] -> 315000 | K71: 0 | L71: 680000 | M71: 319988 | N71: =RC[15]+RC[16]+RC[17]+RC[18]+RC[19]+RC[20] -> 0 | O71: 0 | P71: 0 | Q71: 16461396 | R71: 243800 | S71: 45713 | T71: 30475 | U71: 115000 | V71: 0 | W71: 16026408 | X71: 0 | Y71: 0 | Z71: 0 | AA71: 0 | AB71: 0 | AC71: 0 | AD71: 0 | AE71: 0 | AF71: 0 | AG71: 0 | AH71: 0 | AI71: 15146408 | AJ71: 0 | AK71: 0 | AL71: 0 | AM71: 0 | AN71: 0 | AO71: 0 | AP71: 0 | AQ71: 0 | AR71: =1 -> 1 | AS71: 0 | AT71: 0 | AU71: =RC[-30]-RC[-29]-RC[-28]-RC[-27]-RC[-26]-RC[-25] -> 16026408 | AV71: 0 | AW71: =RC[1]-RC[2] -> 0 | AX71: 0 | AY71: 0 | AZ71: =RC[-46] -> 15146408 | BA71: =RC[-46] -> 0 | BB71: =RC[-46] -> 0 | BC71: =RC[-46] -> 315000 | BD71: =RC[-46] -> 315000 | BE71: =RC[-46] -> 0 | BF71: =RC[-46] -> 680000 | BG71: =RC[-46] -> 319988 | BH71: =RC[-46] -> 0 | BI71: =RC[-46] -> 0 | BJ71: =RC[-46] -> 0 | BK71: =RC[-46] -> 16461396 | BL71: =RC[-46] -> 243800 | BM71: =RC[-46] -> 45713 | BN71: =RC[-46] -> 30475 | BO71: =RC[-46] -> 115000 | BP71: =RC[-46] -> 0 | BQ71: =RC[-46] -> 16026408 | BR71: =RC[-46] -> 0 | BS71: =RC[-46] -> 0 | BT71: =RC[-46] -> 0 | BU71: =RC[-46] -> 0 | BV71: =RC[-46] -> 0 | BW71: =RC[-46] -> 0 | BX71: =RC[-46] -> 0 | BY71: =RC[-46] -> 0 | BZ71: =RC[-46] -> 0 | CA71: =RC[-46] -> 0 | CB71: =RC[-46] -> 0 | CC71: =RC[-46] -> 15146408 | CD71: =RC[-46] -> 0 | CE71: =RC[-46] -> 0 | CF71: =RC[-46] -> 0 | CG71: =RC[-46] -> 0 | CH71: =RC[-46] -> 0 | CI71: =RC[-46] -> 0 | CJ71: =RC[-46] -> 0 | CK71: =RC[-46] -> 0 | CL71: =RC[-46] -> 1 | CM71: =RC[-46] -> 0 | CN71: =RC[-46] -> 0 | CO71: =RC[-46] -> 16026408 | CP71: =RC[-46] -> 0 | CQ71: =RC[-46] -> 0 | CR71: =RC[-46] -> 0 | CS71: =RC[-46] -> 0
A72: 2 | B72: 010642 | C72: Lương Văn Thăng | D72: Phó Trưởng Phòng | E72: 19025655101016 | F72: =RC[29]+RC[30]+RC[31]+RC[32]+RC[33]+RC[34]+RC[35]+RC[36]+RC[37] -> 13628849 | G72: =RC[17]+RC[18]++RC[19]+RC[20]+RC[21]+RC[38]+RC[39]+RC[41] -> 0 | H72: 0 | I72: 315000 | J72: =RC[-2]+RC[-1] -> 315000 | K72: 0 | L72: 680000 | M72: 282555 | N72: =RC[15]+RC[16]+RC[17]+RC[18]+RC[19]+RC[20] -> 0 | O72: 0 | P72: 0 | Q72: 14906404 | R72: 215280 | S72: 40365 | T72: 26910 | U72: 115000 | V72: 0 | W72: 14508849 | X72: 0 | Y72: 0 | Z72: 0 | AA72: 0 | AB72: 0 | AC72: 0 | AD72: 0 | AE72: 0 | AF72: 0 | AG72: 0 | AH72: 0 | AI72: 13628849 | AJ72: 0 | AK72: 0 | AL72: 0 | AM72: 0 | AN72: 0 | AO72: 0 | AP72: 0 | AQ72: 0 | AR72: =1 -> 1 | AS72: 0 | AT72: 0 | AU72: =RC[-30]-RC[-29]-RC[-28]-RC[-27]-RC[-26]-RC[-25] -> 14508849 | AV72: 0 | AW72: =RC[1]-RC[2] -> 0 | AX72: 0 | AY72: 0 | AZ72: =RC[-46] -> 13628849 | BA72: =RC[-46] -> 0 | BB72: =RC[-46] -> 0 | BC72: =RC[-46] -> 315000 | BD72: =RC[-46] -> 315000 | BE72: =RC[-46] -> 0 | BF72: =RC[-46] -> 680000 | BG72: =RC[-46] -> 282555 | BH72: =RC[-46] -> 0 | BI72: =RC[-46] -> 0 | BJ72: =RC[-46] -> 0 | BK72: =RC[-46] -> 14906404 | BL72: =RC[-46] -> 215280 | BM72: =RC[-46] -> 40365 | BN72: =RC[-46] -> 26910 | BO72: =RC[-46] -> 115000 | BP72: =RC[-46] -> 0 | BQ72: =RC[-46] -> 14508849 | BR72: =RC[-46] -> 0 | BS72: =RC[-46] -> 0 | BT72: =RC[-46] -> 0 | BU72: =RC[-46] -> 0 | BV72: =RC[-46] -> 0 | BW72: =RC[-46] -> 0 | BX72: =RC[-46] -> 0 | BY72: =RC[-46] -> 0 | BZ72: =RC[-46] -> 0 | CA72: =RC[-46] -> 0 | CB72: =RC[-46] -> 0 | CC72: =RC[-46] -> 13628849 | CD72: =RC[-46] -> 0 | CE72: =RC[-46] -> 0 | CF72: =RC[-46] -> 0 | CG72: =RC[-46] -> 0 | CH72: =RC[-46] -> 0 | CI72: =RC[-46] -> 0 | CJ72: =RC[-46] -> 0 | CK72: =RC[-46] -> 0 | CL72: =RC[-46] -> 1 | CM72: =RC[-46] -> 0 | CN72: =RC[-46] -> 0 | CO72: =RC[-46] -> 14508849 | CP72: =RC[-46] -> 0 | CQ72: =RC[-46] -> 0 | CR72: =RC[-46] -> 0 | CS72: =RC[-46] -> 0
A73: 3 | B73: 010559 | C73: Nguyễn Tiến Hiệp | D73: NV Kế hoạch | E73: 10520025904011 | F73: =RC[29]+RC[30]+RC[31]+RC[32]+RC[33]+RC[34]+RC[35]+RC[36]+RC[37] -> 7587796 | G73: =RC[17]+RC[18]++RC[19]+RC[20]+RC[21]+RC[38]+RC[39]+RC[41] -> 0 | H73: 0 | I73: 0 | J73: =RC[-2]+RC[-1] -> 0 | K73: 0 | L73: 680000 | M73: 332063 | N73: =RC[15]+RC[16]+RC[17]+RC[18]+RC[19]+RC[20] -> 0 | O73: 0 | P73: 0 | Q73: 8599859 | R73: 253000 | S73: 47438 | T73: 31625 | U73: 82677.960000000006 | V73: 0 | W73: 8185118.04 | X73: 0 | Y73: 0 | Z73: 0 | AA73: 0 | AB73: 0 | AC73: 0 | AD73: 0 | AE73: 0 | AF73: 0 | AG73: 0 | AH73: 0 | AI73: 7587796 | AJ73: 0 | AK73: 0 | AL73: 0 | AM73: 0 | AN73: 0 | AO73: 0 | AP73: 0 | AQ73: 0 | AR73: =1 -> 1 | AS73: 0 | AT73: 0 | AU73: =RC[-30]-RC[-29]-RC[-28]-RC[-27]-RC[-26]-RC[-25] -> 8185118.04 | AV73: 0 | AW73: =RC[1]-RC[2] -> 0 | AX73: 0 | AY73: 0 | AZ73: =RC[-46] -> 7587796 | BA73: =RC[-46] -> 0 | BB73: =RC[-46] -> 0 | BC73: =RC[-46] -> 0 | BD73: =RC[-46] -> 0 | BE73: =RC[-46] -> 0 | BF73: =RC[-46] -> 680000 | BG73: =RC[-46] -> 332063 | BH73: =RC[-46] -> 0 | BI73: =RC[-46] -> 0 | BJ73: =RC[-46] -> 0 | BK73: =RC[-46] -> 8599859 | BL73: =RC[-46] -> 253000 | BM73: =RC[-46] -> 47438 | BN73: =RC[-46] -> 31625 | BO73: =RC[-46] -> 82677.960000000006 | BP73: =RC[-46] -> 0 | BQ73: =RC[-46] -> 8185118.04 | BR73: =RC[-46] -> 0 | BS73: =RC[-46] -> 0 | BT73: =RC[-46] -> 0 | BU73: =RC[-46] -> 0 | BV73: =RC[-46] -> 0 | BW73: =RC[-46] -> 0 | BX73: =RC[-46] -> 0 | BY73: =RC[-46] -> 0 | BZ73: =RC[-46] -> 0 | CA73: =RC[-46] -> 0 | CB73: =RC[-46] -> 0 | CC73: =RC[-46] -> 7587796 | CD73: =RC[-46] -> 0 | CE73: =RC[-46] -> 0 | CF73: =RC[-46] -> 0 | CG73: =RC[-46] -> 0 | CH73: =RC[-46] -> 0 | CI73: =RC[-46] -> 0 | CJ73: =RC[-46] -> 0 | CK73: =RC[-46] -> 0 | CL73: =RC[-46] -> 1 | CM73: =RC[-46] -> 0 | CN73: =RC[-46] -> 0 | CO73: =RC[-46] -> 8185118.04 | CP73: =RC[-46] -> 0 | CQ73: =RC[-46] -> 0 | CR73: =RC[-46] -> 0 | CS73: =RC[-46] -> 0
A74: 4 | B74: 010594 | C74: Lê Thị Thu Huyền | D74: NV Kế hoạch | E74: 10525139503019 | F74: =RC[29]+RC[30]+RC[31]+RC[32]+RC[33]+RC[34]+RC[35]+RC[36]+RC[37] -> 4964170 | G74: =RC[17]+RC[18]++RC[19]+RC[20]+RC[21]+RC[38]+RC[39]+RC[41] -> 0 | H74: 0 | I74: 0 | J74: =RC[-2]+RC[-1] -> 0 | K74: 0 | L74: 370909 | M74: 263235 | N74: =RC[15]+RC[16]+RC[17]+RC[18]+RC[19]+RC[20] -> 0 | O74: 0 | P74: 0 | Q74: 5598314 | R74: 200560 | S74: 37605 | T74: 25070 | U74: 53350.79 | V74: 0 | W74: 5281728.21 | X74: 0 | Y74: 0 | Z74: 0 | AA74: 0 | AB74: 0 | AC74: 0 | AD74: 0 | AE74: 0 | AF74: 0 | AG74: 0 | AH74: 0 | AI74: 4964170 | AJ74: 0 | AK74: 0 | AL74: 0 | AM74: 0 | AN74: 0 | AO74: 0 | AP74: 0 | AQ74: 0 | AR74: =1 -> 1 | AS74: 0 | AT74: 0 | AU74: =RC[-30]-RC[-29]-RC[-28]-RC[-27]-RC[-26]-RC[-25] -> 5281728.21 | AV74: 0 | AW74: =RC[1]-RC[2] -> 0 | AX74: 0 | AY74: 0 | AZ74: =RC[-46] -> 4964170 | BA74: =RC[-46] -> 0 | BB74: =RC[-46] -> 0 | BC74: =RC[-46] -> 0 | BD74: =RC[-46] -> 0 | BE74: =RC[-46] -> 0 | BF74: =RC[-46] -> 370909 | BG74: =RC[-46] -> 263235 | BH74: =RC[-46] -> 0 | BI74: =RC[-46] -> 0 | BJ74: =RC[-46] -> 0 | BK74: =RC[-46] -> 5598314 | BL74: =RC[-46] -> 200560 | BM74: =RC[-46] -> 37605 | BN74: =RC[-46] -> 25070 | BO74: =RC[-46] -> 53350.79 | BP74: =RC[-46] -> 0 | BQ74: =RC[-46] -> 5281728.21 | BR74: =RC[-46] -> 0 | BS74: =RC[-46] -> 0 | BT74: =RC[-46] -> 0 | BU74: =RC[-46] -> 0 | BV74: =RC[-46] -> 0 | BW74: =RC[-46] -> 0 | BX74: =RC[-46] -> 0 | BY74: =RC[-46] -> 0 | BZ74: =RC[-46] -> 0 | CA74: =RC[-46] -> 0 | CB74: =RC[-46] -> 0 | CC74: =RC[-46] -> 4964170 | CD74: =RC[-46] -> 0 | CE74: =RC[-46] -> 0 | CF74: =RC[-46] -> 0 | CG74: =RC[-46] -> 0 | CH74: =RC[-46] -> 0 | CI74: =RC[-46] -> 0 | CJ74: =RC[-46] -> 0 | CK74: =RC[-46] -> 0 | CL74: =RC[-46] -> 1 | CM74: =RC[-46] -> 0 | CN74: =RC[-46] -> 0 | CO74: =RC[-46] -> 5281728.21 | CP74: =RC[-46] -> 0 | CQ74: =RC[-46] -> 0 | CR74: =RC[-46] -> 0 | CS74: =RC[-46] -> 0
A75: 5 | B75: 011146 | C75: Trần Việt Phương | D75: NV Kế hoạch | E75: 19026465630019 | F75: =RC[29]+RC[30]+RC[31]+RC[32]+RC[33]+RC[34]+RC[35]+RC[36]+RC[37] -> 6829017 | G75: =RC[17]+RC[18]++RC[19]+RC[20]+RC[21]+RC[38]+RC[39]+RC[41] -> 0 | H75: 0 | I75: 0 | J75: =RC[-2]+RC[-1] -> 0 | K75: 0 | L75: 680000 | M75: 240293 | N75: =RC[15]+RC[16]+RC[17]+RC[18]+RC[19]+RC[20] -> 0 | O75: 0 | P75: 0 | Q75: 7749310 | R75: 183080 | S75: 34328 | T75: 22885 | U75: 75090.17 | V75: 0 | W75: 7433926.8300000001 | X75: 0 | Y75: 0 | Z75: 0 | AA75: 0 | AB75: 0 | AC75: 0 | AD75: 0 | AE75: 0 | AF75: 0 | AG75: 0 | AH75: 0 | AI75: 6829017 | AJ75: 0 | AK75: 0 | AL75: 0 | AM75: 0 | AN75: 0 | AO75: 0 | AP75: 0 | AQ75: 0 | AR75: =1 -> 1 | AS75: 0 | AT75: 0 | AU75: =RC[-30]-RC[-29]-RC[-28]-RC[-27]-RC[-26]-RC[-25] -> 7433926.8300000001 | AV75: 0 | AW75: =RC[1]-RC[2] -> 0 | AX75: 0 | AY75: 0 | AZ75: =RC[-46] -> 6829017 | BA75: =RC[-46] -> 0 | BB75: =RC[-46] -> 0 | BC75: =RC[-46] -> 0 | BD75: =RC[-46] -> 0 | BE75: =RC[-46] -> 0 | BF75: =RC[-46] -> 680000 | BG75: =RC[-46] -> 240293 | BH75: =RC[-46] -> 0 | BI75: =RC[-46] -> 0 | BJ75: =RC[-46] -> 0 | BK75: =RC[-46] -> 7749310 | BL75: =RC[-46] -> 183080 | BM75: =RC[-46] -> 34328 | BN75: =RC[-46] -> 22885 | BO75: =RC[-46] -> 75090.17 | BP75: =RC[-46] -> 0 | BQ75: =RC[-46] -> 7433926.8300000001 | BR75: =RC[-46] -> 0 | BS75: =RC[-46] -> 0 | BT75: =RC[-46] -> 0 | BU75: =RC[-46] -> 0 | BV75: =RC[-46] -> 0 | BW75: =RC[-46] -> 0 | BX75: =RC[-46] -> 0 | BY75: =RC[-46] -> 0 | BZ75: =RC[-46] -> 0 | CA75: =RC[-46] -> 0 | CB75: =RC[-46] -> 0 | CC75: =RC[-46] -> 6829017 | CD75: =RC[-46] -> 0 | CE75: =RC[-46] -> 0 | CF75: =RC[-46] -> 0 | CG75: =RC[-46] -> 0 | CH75: =RC[-46] -> 0 | CI75: =RC[-46] -> 0 | CJ75: =RC[-46] -> 0 | CK75: =RC[-46] -> 0 | CL75: =RC[-46] -> 1 | CM75: =RC[-46] -> 0 | CN75: =RC[-46] -> 0 | CO75: =RC[-46] -> 7433926.8300000001 | CP75: =RC[-46] -> 0 | CQ75: =RC[-46] -> 0 | CR75: =RC[-46] -> 0 | CS75: =RC[-46] -> 0
A76: 6 | B76: 010623 | C76: Bùi Đức Hưng | D76: NV Marketing | E76: 10523498957014 | F76: =RC[29]+RC[30]+RC[31]+RC[32]+RC[33]+RC[34]+RC[35]+RC[36]+RC[37] -> 7587796 | G76: =RC[17]+RC[18]++RC[19]+RC[20]+RC[21]+RC[38]+RC[39]+RC[41] -> 0 | H76: 0 | I76: 0 | J76: =RC[-2]+RC[-1] -> 0 | K76: 0 | L76: 680000 | M76: 286178 | N76: =RC[15]+RC[16]+RC[17]+RC[18]+RC[19]+RC[20] -> 0 | O76: 0 | P76: 0 | Q76: 8553974 | R76: 218040 | S76: 40883 | T76: 27255 | U76: 82677.960000000006 | V76: 0 | W76: 8185118.04 | X76: 0 | Y76: 0 | Z76: 0 | AA76: 0 | AB76: 0 | AC76: 0 | AD76: 0 | AE76: 0 | AF76: 0 | AG76: 0 | AH76: 0 | AI76: 7587796 | AJ76: 0 | AK76: 0 | AL76: 0 | AM76: 0 | AN76: 0 | AO76: 0 | AP76: 0 | AQ76: 0 | AR76: =1 -> 1 | AS76: 0 | AT76: 0 | AU76: =RC[-30]-RC[-29]-RC[-28]-RC[-27]-RC[-26]-RC[-25] -> 8185118.04 | AV76: 0 | AW76: =RC[1]-RC[2] -> 0 | AX76: 0 | AY76: 0 | AZ76: =RC[-46] -> 7587796 | BA76: =RC[-46] -> 0 | BB76: =RC[-46] -> 0 | BC76: =RC[-46] -> 0 | BD76: =RC[-46] -> 0 | BE76: =RC[-46] -> 0 | BF76: =RC[-46] -> 680000 | BG76: =RC[-46] -> 286178 | BH76: =RC[-46] -> 0 | BI76: =RC[-46] -> 0 | BJ76: =RC[-46] -> 0 | BK76: =RC[-46] -> 8553974 | BL76: =RC[-46] -> 218040 | BM76: =RC[-46] -> 40883 | BN76: =RC[-46] -> 27255 | BO76: =RC[-46] -> 82677.960000000006 | BP76: =RC[-46] -> 0 | BQ76: =RC[-46] -> 8185118.04 | BR76: =RC[-46] -> 0 | BS76: =RC[-46] -> 0 | BT76: =RC[-46] -> 0 | BU76: =RC[-46] -> 0 | BV76: =RC[-46] -> 0 | BW76: =RC[-46] -> 0 | BX76: =RC[-46] -> 0 | BY76: =RC[-46] -> 0 | BZ76: =RC[-46] -> 0 | CA76: =RC[-46] -> 0 | CB76: =RC[-46] -> 0 | CC76: =RC[-46] -> 7587796 | CD76: =RC[-46] -> 0 | CE76: =RC[-46] -> 0 | CF76: =RC[-46] -> 0 | CG76: =RC[-46] -> 0 | CH76: =RC[-46] -> 0 | CI76: =RC[-46] -> 0 | CJ76: =RC[-46] -> 0 | CK76: =RC[-46] -> 0 | CL76: =RC[-46] -> 1 | CM76: =RC[-46] -> 0 | CN76: =RC[-46] -> 0 | CO76: =RC[-46] -> 8185118.04 | CP76: =RC[-46] -> 0 | CQ76: =RC[-46] -> 0 | CR76: =RC[-46] -> 0 | CS76: =RC[-46] -> 0
A77: 7 | B77: 011129 | C77: Nguyễn Văn Hiệp | D77: NV Tài liệu và HDCX | E77: 19026970091017 | F77: =RC[29]+RC[30]+RC[31]+RC[32]+RC[33]+RC[34]+RC[35]+RC[36]+RC[37] -> 7587796 | G77: =RC[17]+RC[18]++RC[19]+RC[20]+RC[21]+RC[38]+RC[39]+RC[41] -> 0 | H77: 0 | I77: 0 | J77: =RC[-2]+RC[-1] -> 0 | K77: 0 | L77: 680000 | M77: 240293 | N77: =RC[15]+RC[16]+RC[17]+RC[18]+RC[19]+RC[20] -> 0 | O77: 0 | P77: 0 | Q77: 8508089 | R77: 183080 | S77: 34328 | T77: 22885 | U77: 82677.960000000006 | V77: 0 | W77: 8185118.04 | X77: 0 | Y77: 0 | Z77: 0 | AA77: 0 | AB77: 0 | AC77: 0 | AD77: 0 | AE77: 0 | AF77: 0 | AG77: 0 | AH77: 0 | AI77: 7587796 | AJ77: 0 | AK77: 0 | AL77: 0 | AM77: 0 | AN77: 0 | AO77: 0 | AP77: 0 | AQ77: 0 | AR77: =1 -> 1 | AS77: 0 | AT77: 0 | AU77: =RC[-30]-RC[-29]-RC[-28]-RC[-27]-RC[-26]-RC[-25] -> 8185118.04 | AV77: 0 | AW77: =RC[1]-RC[2] -> 0 | AX77: 0 | AY77: 0 | AZ77: =RC[-46] -> 7587796 | BA77: =RC[-46] -> 0 | BB77: =RC[-46] -> 0 | BC77: =RC[-46] -> 0 | BD77: =RC[-46] -> 0 | BE77: =RC[-46] -> 0 | BF77: =RC[-46] -> 680000 | BG77: =RC[-46] -> 240293 | BH77: =RC[-46] -> 0 | BI77: =RC[-46] -> 0 | BJ77: =RC[-46] -> 0 | BK77: =RC[-46] -> 8508089 | BL77: =RC[-46] -> 183080 | BM77: =RC[-46] -> 34328 | BN77: =RC[-46] -> 22885 | BO77: =RC[-46] -> 82677.960000000006 | BP77: =RC[-46] -> 0 | BQ77: =RC[-46] -> 8185118.04 | BR77: =RC[-46] -> 0 | BS77: =RC[-46] -> 0 | BT77: =RC[-46] -> 0 | BU77: =RC[-46] -> 0 | BV77: =RC[-46] -> 0 | BW77: =RC[-46] -> 0 | BX77: =RC[-46] -> 0 | BY77: =RC[-46] -> 0 | BZ77: =RC[-46] -> 0 | CA77: =RC[-46] -> 0 | CB77: =RC[-46] -> 0 | CC77: =RC[-46] -> 7587796 | CD77: =RC[-46] -> 0 | CE77: =RC[-46] -> 0 | CF77: =RC[-46] -> 0 | CG77: =RC[-46] -> 0 | CH77: =RC[-46] -> 0 | CI77: =RC[-46] -> 0 | CJ77: =RC[-46] -> 0 | CK77: =RC[-46] -> 0 | CL77: =RC[-46] -> 1 | CM77: =RC[-46] -> 0 | CN77: =RC[-46] -> 0 | CO77: =RC[-46] -> 8185118.04 | CP77: =RC[-46] -> 0 | CQ77: =RC[-46] -> 0 | CR77: =RC[-46] -> 0 | CS77: =RC[-46] -> 0
A78: 8 | B78: 010561 | C78: Vũ Quảng Ba | D78: NV Thủ kho | E78: 10520047964018 | F78: =RC[29]+RC[30]+RC[31]+RC[32]+RC[33]+RC[34]+RC[35]+RC[36]+RC[37] -> 6595546 | G78: =RC[17]+RC[18]++RC[19]+RC[20]+RC[21]+RC[38]+RC[39]+RC[41] -> 0 | H78: 0 | I78: 0 | J78: =RC[-2]+RC[-1] -> 0 | K78: 0 | L78: 680000 | M78: 373118 | N78: =RC[15]+RC[16]+RC[17]+RC[18]+RC[19]+RC[20] -> 0 | O78: 0 | P78: 0 | Q78: 7648664 | R78: 284280 | S78: 53303 | T78: 35535 | U78: 72755.460000000006 | V78: 0 | W78: 7202790.54 | X78: 0 | Y78: 0 | Z78: 0 | AA78: 0 | AB78: 0 | AC78: 0 | AD78: 0 | AE78: 0 | AF78: 0 | AG78: 0 | AH78: 0 | AI78: 6595546 | AJ78: 0 | AK78: 0 | AL78: 0 | AM78: 0 | AN78: 0 | AO78: 0 | AP78: 0 | AQ78: 0 | AR78: =1 -> 1 | AS78: 0 | AT78: 0 | AU78: =RC[-30]-RC[-29]-RC[-28]-RC[-27]-RC[-26]-RC[-25] -> 7202790.54 | AV78: 0 | AW78: =RC[1]-RC[2] -> 0 | AX78: 0 | AY78: 0 | AZ78: =RC[-46] -> 6595546 | BA78: =RC[-46] -> 0 | BB78: =RC[-46] -> 0 | BC78: =RC[-46] -> 0 | BD78: =RC[-46] -> 0 | BE78: =RC[-46] -> 0 | BF78: =RC[-46] -> 680000 | BG78: =RC[-46] -> 373118 | BH78: =RC[-46] -> 0 | BI78: =RC[-46] -> 0 | BJ78: =RC[-46] -> 0 | BK78: =RC[-46] -> 7648664 | BL78: =RC[-46] -> 284280 | BM78: =RC[-46] -> 53303 | BN78: =RC[-46] -> 35535 | BO78: =RC[-46] -> 72755.460000000006 | BP78: =RC[-46] -> 0 | BQ78: =RC[-46] -> 7202790.54 | BR78: =RC[-46] -> 0 | BS78: =RC[-46] -> 0 | BT78: =RC[-46] -> 0 | BU78: =RC[-46] -> 0 | BV78: =RC[-46] -> 0 | BW78: =RC[-46] -> 0 | BX78: =RC[-46] -> 0 | BY78: =RC[-46] -> 0 | BZ78: =RC[-46] -> 0 | CA78: =RC[-46] -> 0 | CB78: =RC[-46] -> 0 | CC78: =RC[-46] -> 6595546 | CD78: =RC[-46] -> 0 | CE78: =RC[-46] -> 0 | CF78: =RC[-46] -> 0 | CG78: =RC[-46] -> 0 | CH78: =RC[-46] -> 0 | CI78: =RC[-46] -> 0 | CJ78: =RC[-46] -> 0 | CK78: =RC[-46] -> 0 | CL78: =RC[-46] -> 1 | CM78: =RC[-46] -> 0 | CN78: =RC[-46] -> 0 | CO78: =RC[-46] -> 7202790.54 | CP78: =RC[-46] -> 0 | CQ78: =RC[-46] -> 0 | CR78: =RC[-46] -> 0 | CS78: =RC[-46] -> 0
A79: 9 | B79: 010784 | C79: Lê Thị Thạch | D79: Nv VS MB | E79: 10522162762014 | F79: =RC[29]+RC[30]+RC[31]+RC[32]+RC[33]+RC[34]+RC[35]+RC[36]+RC[37] -> 5107170 | G79: =RC[17]+RC[18]++RC[19]+RC[20]+RC[21]+RC[38]+RC[39]+RC[41] -> 0 | H79: 0 | I79: 0 | J79: =RC[-2]+RC[-1] -> 0 | K79: 0 | L79: 680000 | M79: 277725 | N79: =RC[15]+RC[16]+RC[17]+RC[18]+RC[19]+RC[20] -> 0 | O79: 0 | P79: 0 | Q79: 6064895 | R79: 211600 | S79: 39675 | T79: 26450 | U79: 57871.7 | V79: 0 | W79: 5729298.2999999998 | X79: 0 | Y79: 0 | Z79: 0 | AA79: 0 | AB79: 0 | AC79: 0 | AD79: 0 | AE79: 0 | AF79: 0 | AG79: 0 | AH79: 0 | AI79: 5107170 | AJ79: 0 | AK79: 0 | AL79: 0 | AM79: 0 | AN79: 0 | AO79: 0 | AP79: 0 | AQ79: 0 | AR79: =1 -> 1 | AS79: 0 | AT79: 0 | AU79: =RC[-30]-RC[-29]-RC[-28]-RC[-27]-RC[-26]-RC[-25] -> 5729298.2999999998 | AV79: 0 | AW79: =RC[1]-RC[2] -> 0 | AX79: 0 | AY79: 0 | AZ79: =RC[-46] -> 5107170 | BA79: =RC[-46] -> 0 | BB79: =RC[-46] -> 0 | BC79: =RC[-46] -> 0 | BD79: =RC[-46] -> 0 | BE79: =RC[-46] -> 0 | BF79: =RC[-46] -> 680000 | BG79: =RC[-46] -> 277725 | BH79: =RC[-46] -> 0 | BI79: =RC[-46] -> 0 | BJ79: =RC[-46] -> 0 | BK79: =RC[-46] -> 6064895 | BL79: =RC[-46] -> 211600 | BM79: =RC[-46] -> 39675 | BN79: =RC[-46] -> 26450 | BO79: =RC[-46] -> 57871.7 | BP79: =RC[-46] -> 0 | BQ79: =RC[-46] -> 5729298.2999999998 | BR79: =RC[-46] -> 0 | BS79: =RC[-46] -> 0 | BT79: =RC[-46] -> 0 | BU79: =RC[-46] -> 0 | BV79: =RC[-46] -> 0 | BW79: =RC[-46] -> 0 | BX79: =RC[-46] -> 0 | BY79: =RC[-46] -> 0 | BZ79: =RC[-46] -> 0 | CA79: =RC[-46] -> 0 | CB79: =RC[-46] -> 0 | CC79: =RC[-46] -> 5107170 | CD79: =RC[-46] -> 0 | CE79: =RC[-46] -> 0 | CF79: =RC[-46] -> 0 | CG79: =RC[-46] -> 0 | CH79: =RC[-46] -> 0 | CI79: =RC[-46] -> 0 | CJ79: =RC[-46] -> 0 | CK79: =RC[-46] -> 0 | CL79: =RC[-46] -> 1 | CM79: =RC[-46] -> 0 | CN79: =RC[-46] -> 0 | CO79: =RC[-46] -> 5729298.2999999998 | CP79: =RC[-46] -> 0 | CQ79: =RC[-46] -> 0 | CR79: =RC[-46] -> 0 | CS79: =RC[-46] -> 0
A80: 10 | B80: 010558 | C80: Vương Hoàng Linh | D80: Chuyên viên pháp lý | E80: 10524109595011 | F80: =RC[29]+RC[30]+RC[31]+RC[32]+RC[33]+RC[34]+RC[35]+RC[36]+RC[37] -> 7237590 | G80: =RC[17]+RC[18]++RC[19]+RC[20]+RC[21]+RC[38]+RC[39]+RC[41] -> 0 | H80: 0 | I80: 0 | J80: =RC[-2]+RC[-1] -> 0 | K80: 0 | L80: 680000 | M80: 319988 | N80: =RC[15]+RC[16]+RC[17]+RC[18]+RC[19]+RC[20] -> 0 | O80: 0 | P80: 0 | Q80: 8237578 | R80: 243800 | S80: 45713 | T80: 30475 | U80: 79175.899999999994 | V80: 0 | W80: 7838414.0999999996 | X80: 0 | Y80: 0 | Z80: 0 | AA80: 0 | AB80: 0 | AC80: 0 | AD80: 0 | AE80: 0 | AF80: 0 | AG80: 0 | AH80: 0 | AI80: 7237590 | AJ80: 0 | AK80: 0 | AL80: 0 | AM80: 0 | AN80: 0 | AO80: 0 | AP80: 0 | AQ80: 0 | AR80: =1 -> 1 | AS80: 0 | AT80: 0 | AU80: =RC[-30]-RC[-29]-RC[-28]-RC[-27]-RC[-26]-RC[-25] -> 7838414.0999999996 | AV80: 0 | AW80: =RC[1]-RC[2] -> 0 | AX80: 0 | AY80: 0 | AZ80: =RC[-46] -> 7237590 | BA80: =RC[-46] -> 0 | BB80: =RC[-46] -> 0 | BC80: =RC[-46] -> 0 | BD80: =RC[-46] -> 0 | BE80: =RC[-46] -> 0 | BF80: =RC[-46] -> 680000 | BG80: =RC[-46] -> 319988 | BH80: =RC[-46] -> 0 | BI80: =RC[-46] -> 0 | BJ80: =RC[-46] -> 0 | BK80: =RC[-46] -> 8237578 | BL80: =RC[-46] -> 243800 | BM80: =RC[-46] -> 45713 | BN80: =RC[-46] -> 30475 | BO80: =RC[-46] -> 79175.899999999994 | BP80: =RC[-46] -> 0 | BQ80: =RC[-46] -> 7838414.0999999996 | BR80: =RC[-46] -> 0 | BS80: =RC[-46] -> 0 | BT80: =RC[-46] -> 0 | BU80: =RC[-46] -> 0 | BV80: =RC[-46] -> 0 | BW80: =RC[-46] -> 0 | BX80: =RC[-46] -> 0 | BY80: =RC[-46] -> 0 | BZ80: =RC[-46] -> 0 | CA80: =RC[-46] -> 0 | CB80: =RC[-46] -> 0 | CC80: =RC[-46] -> 7237590 | CD80: =RC[-46] -> 0 | CE80: =RC[-46] -> 0 | CF80: =RC[-46] -> 0 | CG80: =RC[-46] -> 0 | CH80: =RC[-46] -> 0 | CI80: =RC[-46] -> 0 | CJ80: =RC[-46] -> 0 | CK80: =RC[-46] -> 0 | CL80: =RC[-46] -> 1 | CM80: =RC[-46] -> 0 | CN80: =RC[-46] -> 0 | CO80: =RC[-46] -> 7838414.0999999996 | CP80: =RC[-46] -> 0 | CQ80: =RC[-46] -> 0 | CR80: =RC[-46] -> 0 | CS80: =RC[-46] -> 0
F81: =SUM(R[-10]C:R[-1]C) -> 82272138 | G81: =SUM(R[-10]C:R[-1]C) -> 0 | H81: =SUM(R[-10]C:R[-1]C) -> 0 | I81: =SUM(R[-10]C:R[-1]C) -> 630000 | J81: =SUM(R[-10]C:R[-1]C) -> 630000 | K81: =SUM(R[-10]C:R[-1]C) -> 0 | L81: =SUM(R[-10]C:R[-1]C) -> 6490909 | M81: =SUM(R[-10]C:R[-1]C) -> 2935436 | N81: =SUM(R[-10]C:R[-1]C) -> 0 | O81: =SUM(R[-10]C:R[-1]C) -> 0 | P81: =SUM(R[-10]C:R[-1]C) -> 0 | Q81: =SUM(R[-10]C:R[-1]C) -> 92328483 | R81: =SUM(R[-10]C:R[-1]C) -> 2236520 | S81: =SUM(R[-10]C:R[-1]C) -> 419351 | T81: =SUM(R[-10]C:R[-1]C) -> 279565 | U81: =SUM(R[-10]C:R[-1]C) -> 816277.89999999991 | V81: =SUM(R[-10]C:R[-1]C) -> 0 | W81: =SUM(R[-10]C:R[-1]C) -> 88576769.099999994 | X81: =SUM(R[-10]C:R[-1]C) -> 0 | Y81: =SUM(R[-10]C:R[-1]C) -> 0 | Z81: =SUM(R[-10]C:R[-1]C) -> 0 | AA81: =SUM(R[-10]C:R[-1]C) -> 0 | AB81: =SUM(R[-10]C:R[-1]C) -> 0 | AC81: =SUM(R[-10]C:R[-1]C) -> 0 | AD81: =SUM(R[-10]C:R[-1]C) -> 0 | AE81: =SUM(R[-10]C:R[-1]C) -> 0 | AF81: =SUM(R[-10]C:R[-1]C) -> 0 | AG81: =SUM(R[-10]C:R[-1]C) -> 0 | AH81: =SUM(R[-10]C:R[-1]C) -> 0 | AI81: =SUM(R[-10]C:R[-1]C) -> 82272138 | AJ81: =SUM(R[-10]C:R[-1]C) -> 0 | AK81: =SUM(R[-10]C:R[-1]C) -> 0 | AL81: =SUM(R[-10]C:R[-1]C) -> 0 | AM81: =SUM(R[-10]C:R[-1]C) -> 0 | AN81: =SUM(R[-10]C:R[-1]C) -> 0 | AO81: =SUM(R[-10]C:R[-1]C) -> 0 | AP81: =SUM(R[-10]C:R[-1]C) -> 0 | AQ81: =SUM(R[-10]C:R[-1]C) -> 0 | AR81: =SUM(R[-10]C:R[-1]C) -> 10 | AS81: =SUM(R[-10]C:R[-1]C) -> 0 | AT81: =SUM(R[-10]C:R[-1]C) -> 0 | AU81: =SUM(R[-10]C:R[-1]C) -> 88576769.099999994 | AV81: =SUM(R[-10]C:R[-1]C) -> 0 | AW81: =SUM(R[-10]C:R[-1]C) -> 0 | AX81: =SUM(R[-10]C:R[-1]C) -> 0 | AY81: =SUM(R[-10]C:R[-1]C) -> 0
A82: Phòng Kế hoạch - Kinh doanh (HGS) | F82: =SUM(R[-12]C[46]:R[-1]C[46]) -> 82272138 | G82: =SUM(R[-12]C[46]:R[-1]C[46]) -> 0 | H82: =SUM(R[-12]C[46]:R[-1]C[46]) -> 0 | I82: =SUM(R[-12]C[46]:R[-1]C[46]) -> 630000 | J82: =SUM(R[-12]C[46]:R[-1]C[46]) -> 630000 | K82: =SUM(R[-12]C[46]:R[-1]C[46]) -> 0 | L82: =SUM(R[-12]C[46]:R[-1]C[46]) -> 6490909 | M82: =SUM(R[-12]C[46]:R[-1]C[46]) -> 2935436 | N82: =SUM(R[-12]C[46]:R[-1]C[46]) -> 0 | O82: =SUM(R[-12]C[46]:R[-1]C[46]) -> 0 | P82: =SUM(R[-12]C[46]:R[-1]C[46]) -> 0 | Q82: =SUM(R[-12]C[46]:R[-1]C[46]) -> 92328483 | R82: =SUM(R[-12]C[46]:R[-1]C[46]) -> 2236520 | S82: =SUM(R[-12]C[46]:R[-1]C[46]) -> 419351 | T82: =SUM(R[-12]C[46]:R[-1]C[46]) -> 279565 | U82: =SUM(R[-12]C[46]:R[-1]C[46]) -> 816277.89999999991 | V82: =SUM(R[-12]C[46]:R[-1]C[46]) -> 0 | W82: =SUM(R[-12]C[46]:R[-1]C[46]) -> 88576769.099999994 | X82: =SUM(R[-12]C[46]:R[-1]C[46]) -> 0 | Y82: =SUM(R[-12]C[46]:R[-1]C[46]) -> 0 | Z82: =SUM(R[-12]C[46]:R[-1]C[46]) -> 0 | AA82: =SUM(R[-12]C[46]:R[-1]C[46]) -> 0 | AB82: =SUM(R[-12]C[46]:R[-1]C[46]) -> 0 | AC82: =SUM(R[-12]C[46]:R[-1]C[46]) -> 0 | AD82: =SUM(R[-12]C[46]:R[-1]C[46]) -> 0 | AE82: =SUM(R[-12]C[46]:R[-1]C[46]) -> 0 | AF82: =SUM(R[-12]C[46]:R[-1]C[46]) -> 0 | AG82: =SUM(R[-12]C[46]:R[-1]C[46]) -> 0 | AH82: =SUM(R[-12]C[46]:R[-1]C[46]) -> 0 | AI82: =SUM(R[-12]C[46]:R[-1]C[46]) -> 82272138 | AJ82: =SUM(R[-12]C[46]:R[-1]C[46]) -> 0 | AK82: =SUM(R[-12]C[46]:R[-1]C[46]) -> 0 | AL82: =SUM(R[-12]C[46]:R[-1]C[46]) -> 0 | AM82: =SUM(R[-12]C[46]:R[-1]C[46]) -> 0 | AN82: =SUM(R[-12]C[46]:R[-1]C[46]) -> 0 | AO82: =SUM(R[-12]C[46]:R[-1]C[46]) -> 0 | AP82: =SUM(R[-12]C[46]:R[-1]C[46]) -> 0 | AQ82: =SUM(R[-12]C[46]:R[-1]C[46]) -> 0 | AR82: =SUM(R[-12]C[46]:R[-1]C[46]) -> 10 | AS82: =SUM(R[-12]C[46]:R[-1]C[46]) -> 0 | AT82: =SUM(R[-12]C[46]:R[-1]C[46]) -> 0 | AU82: =SUM(R[-12]C[46]:R[-1]C[46]) -> 88576769.099999994 | AV82: =SUM(R[-12]C[46]:R[-1]C[46]) -> 0 | AW82: =SUM(R[-12]C[46]:R[-1]C[46]) -> 0 | AX82: =SUM(R[-12]C[46]:R[-1]C[46]) -> 0 | AY82: =SUM(R[-12]C[46]:R[-1]C[46]) -> 0
A83: Phòng Phục vụ hành khách (HGS) | F83: =R[123]C -> 538733524 | G83: =R[123]C -> 3705693 | H83: =R[123]C -> 0 | I83: =R[123]C -> 735000 | J83: =R[123]C -> 735000 | K83: =R[123]C -> 1260000 | L83: =R[123]C -> 65332306 | M83: =R[123]C -> 21428304 | N83: =R[123]C -> 16907041 | O83: =R[123]C -> 0 | P83: =R[123]C -> 0 | Q83: =R[123]C -> 648101868 | R83: =R[123]C -> 16510320 | S83: =R[123]C -> 3095694 | T83: =R[123]C -> 2063790 | U83: =R[123]C -> 6142494.4999999991 | V83: =R[123]C -> 90893 | W83: =R[123]C -> 620198676.5000006 | X83: =R[123]C -> 0 | Y83: =R[123]C -> 3705693 | Z83: =R[123]C -> 0 | AA83: =R[123]C -> 0 | AB83: =R[123]C -> 0 | AC83: =R[123]C -> 0 | AD83: =R[123]C -> 0 | AE83: =R[123]C -> 0 | AF83: =R[123]C -> 0 | AG83: =R[123]C -> 0 | AH83: =R[123]C -> 16907041 | AI83: =R[123]C -> 513845554 | AJ83: =R[123]C -> 24887970 | AK83: =R[123]C -> 0 | AL83: =R[123]C -> 0 | AM83: =R[123]C -> 0 | AN83: =R[123]C -> 0 | AO83: =R[123]C -> 0 | AP83: =R[123]C -> 0 | AQ83: =R[123]C -> 0 | AR83: =R[123]C -> 110 | AS83: =R[123]C -> 0 | AT83: =R[123]C -> 0 | AU83: =R[123]C -> 620198676.5000006 | AW83: =R[123]C -> 5635680.3219999997 | AX83: =R[123]C -> 16907041 | AY83: =R[123]C -> 11271360.677999999
A84: Bộ phận nghiệp vụ PPVHK (HGS) | F84: =R[2]C -> 6420443 | G84: =R[2]C -> 0 | H84: =R[2]C -> 0 | I84: =R[2]C -> 0 | J84: =R[2]C -> 0 | K84: =R[2]C -> 0 | L84: =R[2]C -> 680000 | M84: =R[2]C -> 263235 | N84: =R[2]C -> 0 | O84: =R[2]C -> 0 | P84: =R[2]C -> 0 | Q84: =R[2]C -> 7363678 | R84: =R[2]C -> 200560 | S84: =R[2]C -> 37605 | T84: =R[2]C -> 25070 | U84: =R[2]C -> 71004.429999999993 | V84: =R[2]C -> 0 | W84: =R[2]C -> 7029438.5700000003 | X84: =R[2]C -> 0 | Y84: =R[2]C -> 0 | Z84: =R[2]C -> 0 | AA84: =R[2]C -> 0 | AB84: =R[2]C -> 0 | AC84: =R[2]C -> 0 | AD84: =R[2]C -> 0 | AE84: =R[2]C -> 0 | AF84: =R[2]C -> 0 | AG84: =R[2]C -> 0 | AH84: =R[2]C -> 0 | AI84: =R[2]C -> 6420443 | AJ84: =R[2]C -> 0 | AK84: =R[2]C -> 0 | AL84: =R[2]C -> 0 | AM84: =R[2]C -> 0 | AN84: =R[2]C -> 0 | AO84: =R[2]C -> 0 | AP84: =R[2]C -> 0 | AQ84: =R[2]C -> 0 | AR84: =R[2]C -> 1 | AS84: =R[2]C -> 0 | AT84: =R[2]C -> 0 | AU84: =R[2]C -> 7029438.5700000003 | AW84: =R[2]C -> 0 | AX84: =R[2]C -> 0 | AY84: =R[2]C -> 0
A85: 1 | B85: 010564 | C85: Nguyễn Thị Quỳnh Anh | D85: Nv Thống kê | E85: 10522162015014 | F85: =RC[29]+RC[30]+RC[31]+RC[32]+RC[33]+RC[34]+RC[35]+RC[36]+RC[37] -> 6420443 | G85: =RC[17]+RC[18]++RC[19]+RC[20]+RC[21]+RC[38]+RC[39]+RC[41] -> 0 | H85: 0 | I85: 0 | J85: =RC[-2]+RC[-1] -> 0 | K85: 0 | L85: 680000 | M85: 263235 | N85: =RC[15]+RC[16]+RC[17]+RC[18]+RC[19]+RC[20] -> 0 | O85: 0 | P85: 0 | Q85: 7363678 | R85: 200560 | S85: 37605 | T85: 25070 | U85: 71004.429999999993 | V85: 0 | W85: 7029438.5700000003 | X85: 0 | Y85: 0 | Z85: 0 | AA85: 0 | AB85: 0 | AC85: 0 | AD85: 0 | AE85: 0 | AF85: 0 | AG85: 0 | AH85: 0 | AI85: 6420443 | AJ85: 0 | AK85: 0 | AL85: 0 | AM85: 0 | AN85: 0 | AO85: 0 | AP85: 0 | AQ85: 0 | AR85: =1 -> 1 | AS85: 0 | AT85: 0 | AU85: =RC[-30]-RC[-29]-RC[-28]-RC[-27]-RC[-26]-RC[-25] -> 7029438.5700000003 | AV85: 0 | AW85: =RC[1]-RC[2] -> 0 | AX85: 0 | AY85: 0 | AZ85: =RC[-46] -> 6420443 | BA85: =RC[-46] -> 0 | BB85: =RC[-46] -> 0 | BC85: =RC[-46] -> 0 | BD85: =RC[-46] -> 0 | BE85: =RC[-46] -> 0 | BF85: =RC[-46] -> 680000 | BG85: =RC[-46] -> 263235 | BH85: =RC[-46] -> 0 | BI85: =RC[-46] -> 0 | BJ85: =RC[-46] -> 0 | BK85: =RC[-46] -> 7363678 | BL85: =RC[-46] -> 200560 | BM85: =RC[-46] -> 37605 | BN85: =RC[-46] -> 25070 | BO85: =RC[-46] -> 71004.429999999993 | BP85: =RC[-46] -> 0 | BQ85: =RC[-46] -> 7029438.5700000003 | BR85: =RC[-46] -> 0 | BS85: =RC[-46] -> 0 | BT85: =RC[-46] -> 0 | BU85: =RC[-46] -> 0 | BV85: =RC[-46] -> 0 | BW85: =RC[-46] -> 0 | BX85: =RC[-46] -> 0 | BY85: =RC[-46] -> 0 | BZ85: =RC[-46] -> 0 | CA85: =RC[-46] -> 0 | CB85: =RC[-46] -> 0 | CC85: =RC[-46] -> 6420443 | CD85: =RC[-46] -> 0 | CE85: =RC[-46] -> 0 | CF85: =RC[-46] -> 0 | CG85: =RC[-46] -> 0 | CH85: =RC[-46] -> 0 | CI85: =RC[-46] -> 0 | CJ85: =RC[-46] -> 0 | CK85: =RC[-46] -> 0 | CL85: =RC[-46] -> 1 | CM85: =RC[-46] -> 0 | CN85: =RC[-46] -> 0 | CO85: =RC[-46] -> 7029438.5700000003 | CP85: =RC[-46] -> 0 | CQ85: =RC[-46] -> 0 | CR85: =RC[-46] -> 0 | CS85: =RC[-46] -> 0
A86: Bộ phận nghiệp vụ PPVHK (HGS) | F86: =SUM(R[-1]C:R[-1]C) -> 6420443 | G86: =SUM(R[-1]C:R[-1]C) -> 0 | H86: =SUM(R[-1]C:R[-1]C) -> 0 | I86: =SUM(R[-1]C:R[-1]C) -> 0 | J86: =SUM(R[-1]C:R[-1]C) -> 0 | K86: =SUM(R[-1]C:R[-1]C) -> 0 | L86: =SUM(R[-1]C:R[-1]C) -> 680000 | M86: =SUM(R[-1]C:R[-1]C) -> 263235 | N86: =SUM(R[-1]C:R[-1]C) -> 0 | O86: =SUM(R[-1]C:R[-1]C) -> 0 | P86: =SUM(R[-1]C:R[-1]C) -> 0 | Q86: =SUM(R[-1]C:R[-1]C) -> 7363678 | R86: =SUM(R[-1]C:R[-1]C) -> 200560 | S86: =SUM(R[-1]C:R[-1]C) -> 37605 | T86: =SUM(R[-1]C:R[-1]C) -> 25070 | U86: =SUM(R[-1]C:R[-1]C) -> 71004.429999999993 | V86: =SUM(R[-1]C:R[-1]C) -> 0 | W86: =SUM(R[-1]C:R[-1]C) -> 7029438.5700000003 | X86: =SUM(R[-1]C:R[-1]C) -> 0 | Y86: =SUM(R[-1]C:R[-1]C) -> 0 | Z86: =SUM(R[-1]C:R[-1]C) -> 0 | AA86: =SUM(R[-1]C:R[-1]C) -> 0 | AB86: =SUM(R[-1]C:R[-1]C) -> 0 | AC86: =SUM(R[-1]C:R[-1]C) -> 0 | AD86: =SUM(R[-1]C:R[-1]C) -> 0 | AE86: =SUM(R[-1]C:R[-1]C) -> 0 | AF86: =SUM(R[-1]C:R[-1]C) -> 0 | AG86: =SUM(R[-1]C:R[-1]C) -> 0 | AH86: =SUM(R[-1]C:R[-1]C) -> 0 | AI86: =SUM(R[-1]C:R[-1]C) -> 6420443 | AJ86: =SUM(R[-1]C:R[-1]C) -> 0 | AK86: =SUM(R[-1]C:R[-1]C) -> 0 | AL86: =SUM(R[-1]C:R[-1]C) -> 0 | AM86: =SUM(R[-1]C:R[-1]C) -> 0 | AN86: =SUM(R[-1]C:R[-1]C) -> 0 | AO86: =SUM(R[-1]C:R[-1]C) -> 0 | AP86: =SUM(R[-1]C:R[-1]C) -> 0 | AQ86: =SUM(R[-1]C:R[-1]C) -> 0 | AR86: =SUM(R[-1]C:R[-1]C) -> 1 | AS86: =SUM(R[-1]C:R[-1]C) -> 0 | AT86: =SUM(R[-1]C:R[-1]C) -> 0 | AU86: =SUM(R[-1]C:R[-1]C) -> 7029438.5700000003 | AV86: =SUM(R[-1]C:R[-1]C) -> 0 | AW86: =SUM(R[-1]C:R[-1]C) -> 0 | AX86: =SUM(R[-1]C:R[-1]C) -> 0 | AY86: =SUM(R[-1]C:R[-1]C) -> 0
A87: Cán bộ Phòng Phục vụ Hành khách (HGS) | F87: =R[3]C -> 32744258 | G87: =R[3]C -> 0 | H87: =R[3]C -> 0 | I87: =R[3]C -> 735000 | J87: =R[3]C -> 735000 | K87: =R[3]C -> 0 | L87: =R[3]C -> 1360000 | M87: =R[3]C -> 765555 | N87: =R[3]C -> 0 | O87: =R[3]C -> 0 | P87: =R[3]C -> 0 | Q87: =R[3]C -> 35604813 | R87: =R[3]C -> 583280 | S87: =R[3]C -> 109365 | T87: =R[3]C -> 72910 | U87: =R[3]C -> 230000 | V87: =R[3]C -> 90893 | W87: =R[3]C -> 34518365 | X87: =R[3]C -> 0 | Y87: =R[3]C -> 0 | Z87: =R[3]C -> 0 | AA87: =R[3]C -> 0 | AB87: =R[3]C -> 0 | AC87: =R[3]C -> 0 | AD87: =R[3]C -> 0 | AE87: =R[3]C -> 0 | AF87: =R[3]C -> 0 | AG87: =R[3]C -> 0 | AH87: =R[3]C -> 0 | AI87: =R[3]C -> 32744258 | AJ87: =R[3]C -> 0 | AK87: =R[3]C -> 0 | AL87: =R[3]C -> 0 | AM87: =R[3]C -> 0 | AN87: =R[3]C -> 0 | AO87: =R[3]C -> 0 | AP87: =R[3]C -> 0 | AQ87: =R[3]C -> 0 | AR87: =R[3]C -> 2 | AS87: =R[3]C -> 0 | AT87: =R[3]C -> 0 | AU87: =R[3]C -> 34518365 | AW87: =R[3]C -> 0 | AX87: =R[3]C -> 0 | AY87: =R[3]C -> 0
A88: 1 | B88: 010641 | C88: Nguyễn Kim Oanh | D88: Trưởng phòng | E88: 10520003086013 | F88: =RC[29]+RC[30]+RC[31]+RC[32]+RC[33]+RC[34]+RC[35]+RC[36]+RC[37] -> 17597850 | G88: =RC[17]+RC[18]++RC[19]+RC[20]+RC[21]+RC[38]+RC[39]+RC[41] -> 0 | H88: 0 | I88: 420000 | J88: =RC[-2]+RC[-1] -> 420000 | K88: 0 | L88: 680000 | M88: 432285 | N88: =RC[15]+RC[16]+RC[17]+RC[18]+RC[19]+RC[20] -> 0 | O88: 0 | P88: 0 | Q88: 19130135 | R88: 329360 | S88: 61755 | T88: 41170 | U88: 115000 | V88: 90893 | W88: 18491957 | X88: 0 | Y88: 0 | Z88: 0 | AA88: 0 | AB88: 0 | AC88: 0 | AD88: 0 | AE88: 0 | AF88: 0 | AG88: 0 | AH88: 0 | AI88: 17597850 | AJ88: 0 | AK88: 0 | AL88: 0 | AM88: 0 | AN88: 0 | AO88: 0 | AP88: 0 | AQ88: 0 | AR88: =1 -> 1 | AS88: 0 | AT88: 0 | AU88: =RC[-30]-RC[-29]-RC[-28]-RC[-27]-RC[-26]-RC[-25] -> 18491957 | AV88: 0 | AW88: =RC[1]-RC[2] -> 0 | AX88: 0 | AY88: 0 | AZ88: =RC[-46] -> 17597850 | BA88: =RC[-46] -> 0 | BB88: =RC[-46] -> 0 | BC88: =RC[-46] -> 420000 | BD88: =RC[-46] -> 420000 | BE88: =RC[-46] -> 0 | BF88: =RC[-46] -> 680000 | BG88: =RC[-46] -> 432285 | BH88: =RC[-46] -> 0 | BI88: =RC[-46] -> 0 | BJ88: =RC[-46] -> 0 | BK88: =RC[-46] -> 19130135 | BL88: =RC[-46] -> 329360 | BM88: =RC[-46] -> 61755 | BN88: =RC[-46] -> 41170 | BO88: =RC[-46] -> 115000 | BP88: =RC[-46] -> 90893 | BQ88: =RC[-46] -> 18491957 | BR88: =RC[-46] -> 0 | BS88: =RC[-46] -> 0 | BT88: =RC[-46] -> 0 | BU88: =RC[-46] -> 0 | BV88: =RC[-46] -> 0 | BW88: =RC[-46] -> 0 | BX88: =RC[-46] -> 0 | BY88: =RC[-46] -> 0 | BZ88: =RC[-46] -> 0 | CA88: =RC[-46] -> 0 | CB88: =RC[-46] -> 0 | CC88: =RC[-46] -> 17597850 | CD88: =RC[-46] -> 0 | CE88: =RC[-46] -> 0 | CF88: =RC[-46] -> 0 | CG88: =RC[-46] -> 0 | CH88: =RC[-46] -> 0 | CI88: =RC[-46] -> 0 | CJ88: =RC[-46] -> 0 | CK88: =RC[-46] -> 0 | CL88: =RC[-46] -> 1 | CM88: =RC[-46] -> 0 | CN88: =RC[-46] -> 0 | CO88: =RC[-46] -> 18491957 | CP88: =RC[-46] -> 0 | CQ88: =RC[-46] -> 0 | CR88: =RC[-46] -> 0 | CS88: =RC[-46] -> 0
A89: 2 | B89: 010640 | C89: Trần Phương Dung | D89: Phó Trưởng Phòng | E89: 10520027367013 | F89: =RC[29]+RC[30]+RC[31]+RC[32]+RC[33]+RC[34]+RC[35]+RC[36]+RC[37] -> 15146408 | G89: =RC[17]+RC[18]++RC[19]+RC[20]+RC[21]+RC[38]+RC[39]+RC[41] -> 0 | H89: 0 | I89: 315000 | J89: =RC[-2]+RC[-1] -> 315000 | K89: 0 | L89: 680000 | M89: 333270 | N89: =RC[15]+RC[16]+RC[17]+RC[18]+RC[19]+RC[20] -> 0 | O89: 0 | P89: 0 | Q89: 16474678 | R89: 253920 | S89: 47610 | T89: 31740 | U89: 115000 | V89: 0 | W89: 16026408 | X89: 0 | Y89: 0 | Z89: 0 | AA89: 0 | AB89: 0 | AC89: 0 | AD89: 0 | AE89: 0 | AF89: 0 | AG89: 0 | AH89: 0 | AI89: 15146408 | AJ89: 0 | AK89: 0 | AL89: 0 | AM89: 0 | AN89: 0 | AO89: 0 | AP89: 0 | AQ89: 0 | AR89: =1 -> 1 | AS89: 0 | AT89: 0 | AU89: =RC[-30]-RC[-29]-RC[-28]-RC[-27]-RC[-26]-RC[-25] -> 16026408 | AV89: 0 | AW89: =RC[1]-RC[2] -> 0 | AX89: 0 | AY89: 0 | AZ89: =RC[-46] -> 15146408 | BA89: =RC[-46] -> 0 | BB89: =RC[-46] -> 0 | BC89: =RC[-46] -> 315000 | BD89: =RC[-46] -> 315000 | BE89: =RC[-46] -> 0 | BF89: =RC[-46] -> 680000 | BG89: =RC[-46] -> 333270 | BH89: =RC[-46] -> 0 | BI89: =RC[-46] -> 0 | BJ89: =RC[-46] -> 0 | BK89: =RC[-46] -> 16474678 | BL89: =RC[-46] -> 253920 | BM89: =RC[-46] -> 47610 | BN89: =RC[-46] -> 31740 | BO89: =RC[-46] -> 115000 | BP89: =RC[-46] -> 0 | BQ89: =RC[-46] -> 16026408 | BR89: =RC[-46] -> 0 | BS89: =RC[-46] -> 0 | BT89: =RC[-46] -> 0 | BU89: =RC[-46] -> 0 | BV89: =RC[-46] -> 0 | BW89: =RC[-46] -> 0 | BX89: =RC[-46] -> 0 | BY89: =RC[-46] -> 0 | BZ89: =RC[-46] -> 0 | CA89: =RC[-46] -> 0 | CB89: =RC[-46] -> 0 | CC89: =RC[-46] -> 15146408 | CD89: =RC[-46] -> 0 | CE89: =RC[-46] -> 0 | CF89: =RC[-46] -> 0 | CG89: =RC[-46] -> 0 | CH89: =RC[-46] -> 0 | CI89: =RC[-46] -> 0 | CJ89: =RC[-46] -> 0 | CK89: =RC[-46] -> 0 | CL89: =RC[-46] -> 1 | CM89: =RC[-46] -> 0 | CN89: =RC[-46] -> 0 | CO89: =RC[-46] -> 16026408 | CP89: =RC[-46] -> 0 | CQ89: =RC[-46] -> 0 | CR89: =RC[-46] -> 0 | CS89: =RC[-46] -> 0
A90: Cán bộ Phòng Phục vụ Hành khách (HGS) | F90: =SUM(R[-2]C:R[-1]C) -> 32744258 | G90: =SUM(R[-2]C:R[-1]C) -> 0 | H90: =SUM(R[-2]C:R[-1]C) -> 0 | I90: =SUM(R[-2]C:R[-1]C) -> 735000 | J90: =SUM(R[-2]C:R[-1]C) -> 735000 | K90: =SUM(R[-2]C:R[-1]C) -> 0 | L90: =SUM(R[-2]C:R[-1]C) -> 1360000 | M90: =SUM(R[-2]C:R[-1]C) -> 765555 | N90: =SUM(R[-2]C:R[-1]C) -> 0 | O90: =SUM(R[-2]C:R[-1]C) -> 0 | P90: =SUM(R[-2]C:R[-1]C) -> 0 | Q90: =SUM(R[-2]C:R[-1]C) -> 35604813 | R90: =SUM(R[-2]C:R[-1]C) -> 583280 | S90: =SUM(R[-2]C:R[-1]C) -> 109365 | T90: =SUM(R[-2]C:R[-1]C) -> 72910 | U90: =SUM(R[-2]C:R[-1]C) -> 230000 | V90: =SUM(R[-2]C:R[-1]C) -> 90893 | W90: =SUM(R[-2]C:R[-1]C) -> 34518365 | X90: =SUM(R[-2]C:R[-1]C) -> 0 | Y90: =SUM(R[-2]C:R[-1]C) -> 0 | Z90: =SUM(R[-2]C:R[-1]C) -> 0 | AA90: =SUM(R[-2]C:R[-1]C) -> 0 | AB90: =SUM(R[-2]C:R[-1]C) -> 0 | AC90: =SUM(R[-2]C:R[-1]C) -> 0 | AD90: =SUM(R[-2]C:R[-1]C) -> 0 | AE90: =SUM(R[-2]C:R[-1]C) -> 0 | AF90: =SUM(R[-2]C:R[-1]C) -> 0 | AG90: =SUM(R[-2]C:R[-1]C) -> 0 | AH90: =SUM(R[-2]C:R[-1]C) -> 0 | AI90: =SUM(R[-2]C:R[-1]C) -> 32744258 | AJ90: =SUM(R[-2]C:R[-1]C) -> 0 | AK90: =SUM(R[-2]C:R[-1]C) -> 0 | AL90: =SUM(R[-2]C:R[-1]C) -> 0 | AM90: =SUM(R[-2]C:R[-1]C) -> 0 | AN90: =SUM(R[-2]C:R[-1]C) -> 0 | AO90: =SUM(R[-2]C:R[-1]C) -> 0 | AP90: =SUM(R[-2]C:R[-1]C) -> 0 | AQ90: =SUM(R[-2]C:R[-1]C) -> 0 | AR90: =SUM(R[-2]C:R[-1]C) -> 2 | AS90: =SUM(R[-2]C:R[-1]C) -> 0 | AT90: =SUM(R[-2]C:R[-1]C) -> 0 | AU90: =SUM(R[-2]C:R[-1]C) -> 34518365 | AV90: =SUM(R[-2]C:R[-1]C) -> 0 | AW90: =SUM(R[-2]C:R[-1]C) -> 0 | AX90: =SUM(R[-2]C:R[-1]C) -> 0 | AY90: =SUM(R[-2]C:R[-1]C) -> 0
A91: Đội phục vụ hành khách đến (HGS) | F91: =R[31]C -> 134196010 | G91: =R[31]C -> 1510385 | H91: =R[31]C -> 0 | I91: =R[31]C -> 0 | J91: =R[31]C -> 0 | K91: =R[31]C -> 525000 | L91: =R[31]C -> 15875384 | M91: =R[31]C -> 6097876 | N91: =R[31]C -> 5299275 | O91: =R[31]C -> 0 | P91: =R[31]C -> 0 | Q91: =R[31]C -> 163503930 | R91: =R[31]C -> 4646000 | S91: =R[31]C -> 871126 | T91: =R[31]C -> 580750 | U91: =R[31]C -> 1574060.5399999998 | V91: =R[31]C -> 0 | W91: =R[31]C -> 155831993.46000004 | X91: =R[31]C -> 0 | Y91: =R[31]C -> 1510385 | Z91: =R[31]C -> 0 | AA91: =R[31]C -> 0 | AB91: =R[31]C -> 0 | AC91: =R[31]C -> 0 | AD91: =R[31]C -> 0 | AE91: =R[31]C -> 0 | AF91: =R[31]C -> 0 | AG91: =R[31]C -> 0 | AH91: =R[31]C -> 5299275 | AI91: =R[31]C -> 119668300 | AJ91: =R[31]C -> 14527710 | AK91: =R[31]C -> 0 | AL91: =R[31]C -> 0 | AM91: =R[31]C -> 0 | AN91: =R[31]C -> 0 | AO91: =R[31]C -> 0 | AP91: =R[31]C -> 0 | AQ91: =R[31]C -> 0 | AR91: =R[31]C -> 30 | AS91: =R[31]C -> 0 | AT91: =R[31]C -> 0 | AU91: =R[31]C -> 155831993.46000004 | AW91: =R[31]C -> 1766424.9970000004 | AX91: =R[31]C -> 5299275 | AY91: =R[31]C -> 3532850.0029999996
A92: 1 | B92: 010629 | C92: Nguyễn Thị Cúc | D92: Đội trưởng | E92: 10522162395011 | F92: =RC[29]+RC[30]+RC[31]+RC[32]+RC[33]+RC[34]+RC[35]+RC[36]+RC[37] -> 5544928 | G92: =RC[17]+RC[18]++RC[19]+RC[20]+RC[21]+RC[38]+RC[39]+RC[41] -> 0 | H92: 0 | I92: 0 | J92: =RC[-2]+RC[-1] -> 0 | K92: 315000 | L92: 0 | M92: 0 | N92: =RC[15]+RC[16]+RC[17]+RC[18]+RC[19]+RC[20] -> 0 | O92: 0 | P92: 0 | Q92: 5859928 | R92: 0 | S92: 0 | T92: 0 | U92: 58599.28 | V92: 0 | W92: 5801328.7199999997 | X92: 0 | Y92: 0 | Z92: 0 | AA92: 0 | AB92: 0 | AC92: 0 | AD92: 0 | AE92: 0 | AF92: 0 | AG92: 0 | AH92: 0 | AI92: 0 | AJ92: 5544928 | AK92: 0 | AL92: 0 | AM92: 0 | AN92: 0 | AO92: 0 | AP92: 0 | AQ92: 0 | AR92: =1 -> 1 | AS92: 0 | AT92: 0 | AU92: =RC[-30]-RC[-29]-RC[-28]-RC[-27]-RC[-26]-RC[-25] -> 5801328.7199999997 | AV92: 0 | AW92: =RC[1]-RC[2] -> 0 | AX92: 0 | AY92: 0 | AZ92: =RC[-46] -> 5544928 | BA92: =RC[-46] -> 0 | BB92: =RC[-46] -> 0 | BC92: =RC[-46] -> 0 | BD92: =RC[-46] -> 0 | BE92: =RC[-46] -> 315000 | BF92: =RC[-46] -> 0 | BG92: =RC[-46] -> 0 | BH92: =RC[-46] -> 0 | BI92: =RC[-46] -> 0 | BJ92: =RC[-46] -> 0 | BK92: =RC[-46] -> 5859928 | BL92: =RC[-46] -> 0 | BM92: =RC[-46] -> 0 | BN92: =RC[-46] -> 0 | BO92: =RC[-46] -> 58599.28 | BP92: =RC[-46] -> 0 | BQ92: =RC[-46] -> 5801328.7199999997 | BR92: =RC[-46] -> 0 | BS92: =RC[-46] -> 0 | BT92: =RC[-46] -> 0 | BU92: =RC[-46] -> 0 | BV92: =RC[-46] -> 0 | BW92: =RC[-46] -> 0 | BX92: =RC[-46] -> 0 | BY92: =RC[-46] -> 0 | BZ92: =RC[-46] -> 0 | CA92: =RC[-46] -> 0 | CB92: =RC[-46] -> 0 | CC92: =RC[-46] -> 0 | CD92: =RC[-46] -> 5544928 | CE92: =RC[-46] -> 0 | CF92: =RC[-46] -> 0 | CG92: =RC[-46] -> 0 | CH92: =RC[-46] -> 0 | CI92: =RC[-46] -> 0 | CJ92: =RC[-46] -> 0 | CK92: =RC[-46] -> 0 | CL92: =RC[-46] -> 1 | CM92: =RC[-46] -> 0 | CN92: =RC[-46] -> 0 | CO92: =RC[-46] -> 5801328.7199999997 | CP92: =RC[-46] -> 0 | CQ92: =RC[-46] -> 0 | CR92: =RC[-46] -> 0 | CS92: =RC[-46] -> 0
A93: 2 | B93: 010628 | C93: Nguyễn Thị Thu Hà | D93: Đội phó | E93: 10522162066018 | F93: =RC[29]+RC[30]+RC[31]+RC[32]+RC[33]+RC[34]+RC[35]+RC[36]+RC[37] -> 9543113 | G93: =RC[17]+RC[18]++RC[19]+RC[20]+RC[21]+RC[38]+RC[39]+RC[41] -> 0 | H93: 0 | I93: 0 | J93: =RC[-2]+RC[-1] -> 0 | K93: 210000 | L93: 680000 | M93: 333270 | N93: =RC[15]+RC[16]+RC[17]+RC[18]+RC[19]+RC[20] -> 0 | O93: 0 | P93: 0 | Q93: 10766383 | R93: 253920 | S93: 47610 | T93: 31740 | U93: 104331.13 | V93: 0 | W93: 10328781.869999999 | X93: 0 | Y93: 0 | Z93: 0 | AA93: 0 | AB93: 0 | AC93: 0 | AD93: 0 | AE93: 0 | AF93: 0 | AG93: 0 | AH93: 0 | AI93: 9543113 | AJ93: 0 | AK93: 0 | AL93: 0 | AM93: 0 | AN93: 0 | AO93: 0 | AP93: 0 | AQ93: 0 | AR93: =1 -> 1 | AS93: 0 | AT93: 0 | AU93: =RC[-30]-RC[-29]-RC[-28]-RC[-27]-RC[-26]-RC[-25] -> 10328781.869999999 | AV93: 0 | AW93: =RC[1]-RC[2] -> 0 | AX93: 0 | AY93: 0 | AZ93: =RC[-46] -> 9543113 | BA93: =RC[-46] -> 0 | BB93: =RC[-46] -> 0 | BC93: =RC[-46] -> 0 | BD93: =RC[-46] -> 0 | BE93: =RC[-46] -> 210000 | BF93: =RC[-46] -> 680000 | BG93: =RC[-46] -> 333270 | BH93: =RC[-46] -> 0 | BI93: =RC[-46] -> 0 | BJ93: =RC[-46] -> 0 | BK93: =RC[-46] -> 10766383 | BL93: =RC[-46] -> 253920 | BM93: =RC[-46] -> 47610 | BN93: =RC[-46] -> 31740 | BO93: =RC[-46] -> 104331.13 | BP93: =RC[-46] -> 0 | BQ93: =RC[-46] -> 10328781.869999999 | BR93: =RC[-46] -> 0 | BS93: =RC[-46] -> 0 | BT93: =RC[-46] -> 0 | BU93: =RC[-46] -> 0 | BV93: =RC[-46] -> 0 | BW93: =RC[-46] -> 0 | BX93: =RC[-46] -> 0 | BY93: =RC[-46] -> 0 | BZ93: =RC[-46] -> 0 | CA93: =RC[-46] -> 0 | CB93: =RC[-46] -> 0 | CC93: =RC[-46] -> 9543113 | CD93: =RC[-46] -> 0 | CE93: =RC[-46] -> 0 | CF93: =RC[-46] -> 0 | CG93: =RC[-46] -> 0 | CH93: =RC[-46] -> 0 | CI93: =RC[-46] -> 0 | CJ93: =RC[-46] -> 0 | CK93: =RC[-46] -> 0 | CL93: =RC[-46] -> 1 | CM93: =RC[-46] -> 0 | CN93: =RC[-46] -> 0 | CO93: =RC[-46] -> 10328781.869999999 | CP93: =RC[-46] -> 0 | CQ93: =RC[-46] -> 0 | CR93: =RC[-46] -> 0 | CS93: =RC[-46] -> 0
A94: 3 | B94: 012555 | C94: Đinh Thanh Ngân | D94: Nhân viên phục vụ hành khách hàng hóa | E94: 19028385482011 | F94: =RC[29]+RC[30]+RC[31]+RC[32]+RC[33]+RC[34]+RC[35]+RC[36]+RC[37] -> 4669413 | G94: =RC[17]+RC[18]++RC[19]+RC[20]+RC[21]+RC[38]+RC[39]+RC[41] -> 0 | H94: 0 | I94: 0 | J94: =RC[-2]+RC[-1] -> 0 | K94: 0 | L94: 680000 | M94: 241500 | N94: =RC[15]+RC[16]+RC[17]+RC[18]+RC[19]+RC[20] -> 242308 | O94: 0 | P94: 0 | Q94: 5833221 | R94: 184000 | S94: 34500 | T94: 23000 | U94: 55917.21 | V94: 0 | W94: 5535803.79 | X94: 0 | Y94: 0 | Z94: 0 | AA94: 0 | AB94: 0 | AC94: 0 | AD94: 0 | AE94: 0 | AF94: 0 | AG94: 0 | AH94: 242308 | AI94: 4669413 | AJ94: 0 | AK94: 0 | AL94: 0 | AM94: 0 | AN94: 0 | AO94: 0 | AP94: 0 | AQ94: 0 | AR94: =1 -> 1 | AS94: 0 | AT94: 0 | AU94: =RC[-30]-RC[-29]-RC[-28]-RC[-27]-RC[-26]-RC[-25] -> 5535803.79 | AV94: 0 | AW94: =RC[1]-RC[2] -> 80769.333000000013 | AX94: 242308 | AY94: 161538.66699999999 | AZ94: =RC[-46] -> 4669413 | BA94: =RC[-46] -> 0 | BB94: =RC[-46] -> 0 | BC94: =RC[-46] -> 0 | BD94: =RC[-46] -> 0 | BE94: =RC[-46] -> 0 | BF94: =RC[-46] -> 680000 | BG94: =RC[-46] -> 241500 | BH94: =RC[-46] -> 242308 | BI94: =RC[-46] -> 0 | BJ94: =RC[-46] -> 0 | BK94: =RC[-46] -> 5833221 | BL94: =RC[-46] -> 184000 | BM94: =RC[-46] -> 34500 | BN94: =RC[-46] -> 23000 | BO94: =RC[-46] -> 55917.21 | BP94: =RC[-46] -> 0 | BQ94: =RC[-46] -> 5535803.79 | BR94: =RC[-46] -> 0 | BS94: =RC[-46] -> 0 | BT94: =RC[-46] -> 0 | BU94: =RC[-46] -> 0 | BV94: =RC[-46] -> 0 | BW94: =RC[-46] -> 0 | BX94: =RC[-46] -> 0 | BY94: =RC[-46] -> 0 | BZ94: =RC[-46] -> 0 | CA94: =RC[-46] -> 0 | CB94: =RC[-46] -> 242308 | CC94: =RC[-46] -> 4669413 | CD94: =RC[-46] -> 0 | CE94: =RC[-46] -> 0 | CF94: =RC[-46] -> 0 | CG94: =RC[-46] -> 0 | CH94: =RC[-46] -> 0 | CI94: =RC[-46] -> 0 | CJ94: =RC[-46] -> 0 | CK94: =RC[-46] -> 0 | CL94: =RC[-46] -> 1 | CM94: =RC[-46] -> 0 | CN94: =RC[-46] -> 0 | CO94: =RC[-46] -> 5535803.79 | CP94: =RC[-46] -> 0 | CQ94: =RC[-46] -> 80769.333000000013 | CR94: =RC[-46] -> 242308 | CS94: =RC[-46] -> 161538.66699999999
A95: 4 | B95: 012561 | C95: Lê Thị Hồng Vân | D95: Nhân viên phục vụ hành khách hàng hóa | E95: 19028385486017 | F95: =RC[29]+RC[30]+RC[31]+RC[32]+RC[33]+RC[34]+RC[35]+RC[36]+RC[37] -> 4669413 | G95: =RC[17]+RC[18]++RC[19]+RC[20]+RC[21]+RC[38]+RC[39]+RC[41] -> 0 | H95: 0 | I95: 0 | J95: =RC[-2]+RC[-1] -> 0 | K95: 0 | L95: 680000 | M95: 241500 | N95: =RC[15]+RC[16]+RC[17]+RC[18]+RC[19]+RC[20] -> 242308 | O95: 0 | P95: 0 | Q95: 5833221 | R95: 184000 | S95: 34500 | T95: 23000 | U95: 55917.21 | V95: 0 | W95: 5535803.79 | X95: 0 | Y95: 0 | Z95: 0 | AA95: 0 | AB95: 0 | AC95: 0 | AD95: 0 | AE95: 0 | AF95: 0 | AG95: 0 | AH95: 242308 | AI95: 4669413 | AJ95: 0 | AK95: 0 | AL95: 0 | AM95: 0 | AN95: 0 | AO95: 0 | AP95: 0 | AQ95: 0 | AR95: =1 -> 1 | AS95: 0 | AT95: 0 | AU95: =RC[-30]-RC[-29]-RC[-28]-RC[-27]-RC[-26]-RC[-25] -> 5535803.79 | AV95: 0 | AW95: =RC[1]-RC[2] -> 80769.333000000013 | AX95: 242308 | AY95: 161538.66699999999 | AZ95: =RC[-46] -> 4669413 | BA95: =RC[-46] -> 0 | BB95: =RC[-46] -> 0 | BC95: =RC[-46] -> 0 | BD95: =RC[-46] -> 0 | BE95: =RC[-46] -> 0 | BF95: =RC[-46] -> 680000 | BG95: =RC[-46] -> 241500 | BH95: =RC[-46] -> 242308 | BI95: =RC[-46] -> 0 | BJ95: =RC[-46] -> 0 | BK95: =RC[-46] -> 5833221 | BL95: =RC[-46] -> 184000 | BM95: =RC[-46] -> 34500 | BN95: =RC[-46] -> 23000 | BO95: =RC[-46] -> 55917.21 | BP95: =RC[-46] -> 0 | BQ95: =RC[-46] -> 5535803.79 | BR95: =RC[-46] -> 0 | BS95: =RC[-46] -> 0 | BT95: =RC[-46] -> 0 | BU95: =RC[-46] -> 0 | BV95: =RC[-46] -> 0 | BW95: =RC[-46] -> 0 | BX95: =RC[-46] -> 0 | BY95: =RC[-46] -> 0 | BZ95: =RC[-46] -> 0 | CA95: =RC[-46] -> 0 | CB95: =RC[-46] -> 242308 | CC95: =RC[-46] -> 4669413 | CD95: =RC[-46] -> 0 | CE95: =RC[-46] -> 0 | CF95: =RC[-46] -> 0 | CG95: =RC[-46] -> 0 | CH95: =RC[-46] -> 0 | CI95: =RC[-46] -> 0 | CJ95: =RC[-46] -> 0 | CK95: =RC[-46] -> 0 | CL95: =RC[-46] -> 1 | CM95: =RC[-46] -> 0 | CN95: =RC[-46] -> 0 | CO95: =RC[-46] -> 5535803.79 | CP95: =RC[-46] -> 0 | CQ95: =RC[-46] -> 80769.333000000013 | CR95: =RC[-46] -> 242308 | CS95: =RC[-46] -> 161538.66699999999
A96: 5 | B96: 012564 | C96: Đặng Thị Thu Hà | D96: Nhân viên phục vụ hành khách hàng hóa | E96: 19028385539013 | F96: =RC[29]+RC[30]+RC[31]+RC[32]+RC[33]+RC[34]+RC[35]+RC[36]+RC[37] -> 4669413 | G96: =RC[17]+RC[18]++RC[19]+RC[20]+RC[21]+RC[38]+RC[39]+RC[41] -> 0 | H96: 0 | I96: 0 | J96: =RC[-2]+RC[-1] -> 0 | K96: 0 | L96: 680000 | M96: 241500 | N96: =RC[15]+RC[16]+RC[17]+RC[18]+RC[19]+RC[20] -> 242308 | O96: 0 | P96: 0 | Q96: 5833221 | R96: 184000 | S96: 34500 | T96: 23000 | U96: 55917.21 | V96: 0 | W96: 5535803.79 | X96: 0 | Y96: 0 | Z96: 0 | AA96: 0 | AB96: 0 | AC96: 0 | AD96: 0 | AE96: 0 | AF96: 0 | AG96: 0 | AH96: 242308 | AI96: 4669413 | AJ96: 0 | AK96: 0 | AL96: 0 | AM96: 0 | AN96: 0 | AO96: 0 | AP96: 0 | AQ96: 0 | AR96: =1 -> 1 | AS96: 0 | AT96: 0 | AU96: =RC[-30]-RC[-29]-RC[-28]-RC[-27]-RC[-26]-RC[-25] -> 5535803.79 | AV96: 0 | AW96: =RC[1]-RC[2] -> 80769.333000000013 | AX96: 242308 | AY96: 161538.66699999999 | AZ96: =RC[-46] -> 4669413 | BA96: =RC[-46] -> 0 | BB96: =RC[-46] -> 0 | BC96: =RC[-46] -> 0 | BD96: =RC[-46] -> 0 | BE96: =RC[-46] -> 0 | BF96: =RC[-46] -> 680000 | BG96: =RC[-46] -> 241500 | BH96: =RC[-46] -> 242308 | BI96: =RC[-46] -> 0 | BJ96: =RC[-46] -> 0 | BK96: =RC[-46] -> 5833221 | BL96: =RC[-46] -> 184000 | BM96: =RC[-46] -> 34500 | BN96: =RC[-46] -> 23000 | BO96: =RC[-46] -> 55917.21 | BP96: =RC[-46] -> 0 | BQ96: =RC[-46] -> 5535803.79 | BR96: =RC[-46] -> 0 | BS96: =RC[-46] -> 0 | BT96: =RC[-46] -> 0 | BU96: =RC[-46] -> 0 | BV96: =RC[-46] -> 0 | BW96: =RC[-46] -> 0 | BX96: =RC[-46] -> 0 | BY96: =RC[-46] -> 0 | BZ96: =RC[-46] -> 0 | CA96: =RC[-46] -> 0 | CB96: =RC[-46] -> 242308 | CC96: =RC[-46] -> 4669413 | CD96: =RC[-46] -> 0 | CE96: =RC[-46] -> 0 | CF96: =RC[-46] -> 0 | CG96: =RC[-46] -> 0 | CH96: =RC[-46] -> 0 | CI96: =RC[-46] -> 0 | CJ96: =RC[-46] -> 0 | CK96: =RC[-46] -> 0 | CL96: =RC[-46] -> 1 | CM96: =RC[-46] -> 0 | CN96: =RC[-46] -> 0 | CO96: =RC[-46] -> 5535803.79 | CP96: =RC[-46] -> 0 | CQ96: =RC[-46] -> 80769.333000000013 | CR96: =RC[-46] -> 242308 | CS96: =RC[-46] -> 161538.66699999999
A97: 6 | B97: 012569 | C97: Cấn Hà An | D97: Nhân viên phục vụ hành khách hàng hóa | E97: 19024063167018 | F97: =RC[29]+RC[30]+RC[31]+RC[32]+RC[33]+RC[34]+RC[35]+RC[36]+RC[37] -> 4669413 | G97: =RC[17]+RC[18]++RC[19]+RC[20]+RC[21]+RC[38]+RC[39]+RC[41] -> 0 | H97: 0 | I97: 0 | J97: =RC[-2]+RC[-1] -> 0 | K97: 0 | L97: 680000 | M97: 241500 | N97: =RC[15]+RC[16]+RC[17]+RC[18]+RC[19]+RC[20] -> 242308 | O97: 0 | P97: 0 | Q97: 5833221 | R97: 184000 | S97: 34500 | T97: 23000 | U97: 55917.21 | V97: 0 | W97: 5535803.79 | X97: 0 | Y97: 0 | Z97: 0 | AA97: 0 | AB97: 0 | AC97: 0 | AD97: 0 | AE97: 0 | AF97: 0 | AG97: 0 | AH97: 242308 | AI97: 4669413 | AJ97: 0 | AK97: 0 | AL97: 0 | AM97: 0 | AN97: 0 | AO97: 0 | AP97: 0 | AQ97: 0 | AR97: =1 -> 1 | AS97: 0 | AT97: 0 | AU97: =RC[-30]-RC[-29]-RC[-28]-RC[-27]-RC[-26]-RC[-25] -> 5535803.79 | AV97: 0 | AW97: =RC[1]-RC[2] -> 80769.333000000013 | AX97: 242308 | AY97: 161538.66699999999 | AZ97: =RC[-46] -> 4669413 | BA97: =RC[-46] -> 0 | BB97: =RC[-46] -> 0 | BC97: =RC[-46] -> 0 | BD97: =RC[-46] -> 0 | BE97: =RC[-46] -> 0 | BF97: =RC[-46] -> 680000 | BG97: =RC[-46] -> 241500 | BH97: =RC[-46] -> 242308 | BI97: =RC[-46] -> 0 | BJ97: =RC[-46] -> 0 | BK97: =RC[-46] -> 5833221 | BL97: =RC[-46] -> 184000 | BM97: =RC[-46] -> 34500 | BN97: =RC[-46] -> 23000 | BO97: =RC[-46] -> 55917.21 | BP97: =RC[-46] -> 0 | BQ97: =RC[-46] -> 5535803.79 | BR97: =RC[-46] -> 0 | BS97: =RC[-46] -> 0 | BT97: =RC[-46] -> 0 | BU97: =RC[-46] -> 0 | BV97: =RC[-46] -> 0 | BW97: =RC[-46] -> 0 | BX97: =RC[-46] -> 0 | BY97: =RC[-46] -> 0 | BZ97: =RC[-46] -> 0 | CA97: =RC[-46] -> 0 | CB97: =RC[-46] -> 242308 | CC97: =RC[-46] -> 4669413 | CD97: =RC[-46] -> 0 | CE97: =RC[-46] -> 0 | CF97: =RC[-46] -> 0 | CG97: =RC[-46] -> 0 | CH97: =RC[-46] -> 0 | CI97: =RC[-46] -> 0 | CJ97: =RC[-46] -> 0 | CK97: =RC[-46] -> 0 | CL97: =RC[-46] -> 1 | CM97: =RC[-46] -> 0 | CN97: =RC[-46] -> 0 | CO97: =RC[-46] -> 5535803.79 | CP97: =RC[-46] -> 0 | CQ97: =RC[-46] -> 80769.333000000013 | CR97: =RC[-46] -> 242308 | CS97: =RC[-46] -> 161538.66699999999
A98: 7 | B98: 012570 | C98: Nguyễn Hoàng Hải | D98: Nhân viên phục vụ hành khách hàng hóa | E98: 19028385535018 | F98: =RC[29]+RC[30]+RC[31]+RC[32]+RC[33]+RC[34]+RC[35]+RC[36]+RC[37] -> 4669413 | G98: =RC[17]+RC[18]++RC[19]+RC[20]+RC[21]+RC[38]+RC[39]+RC[41] -> 0 | H98: 0 | I98: 0 | J98: =RC[-2]+RC[-1] -> 0 | K98: 0 | L98: 680000 | M98: 241500 | N98: =RC[15]+RC[16]+RC[17]+RC[18]+RC[19]+RC[20] -> 242308 | O98: 0 | P98: 0 | Q98: 5833221 | R98: 184000 | S98: 34500 | T98: 23000 | U98: 55917.21 | V98: 0 | W98: 5535803.79 | X98: 0 | Y98: 0 | Z98: 0 | AA98: 0 | AB98: 0 | AC98: 0 | AD98: 0 | AE98: 0 | AF98: 0 | AG98: 0 | AH98: 242308 | AI98: 4669413 | AJ98: 0 | AK98: 0 | AL98: 0 | AM98: 0 | AN98: 0 | AO98: 0 | AP98: 0 | AQ98: 0 | AR98: =1 -> 1 | AS98: 0 | AT98: 0 | AU98: =RC[-30]-RC[-29]-RC[-28]-RC[-27]-RC[-26]-RC[-25] -> 5535803.79 | AV98: 0 | AW98: =RC[1]-RC[2] -> 80769.333000000013 | AX98: 242308 | AY98: 161538.66699999999 | AZ98: =RC[-46] -> 4669413 | BA98: =RC[-46] -> 0 | BB98: =RC[-46] -> 0 | BC98: =RC[-46] -> 0 | BD98: =RC[-46] -> 0 | BE98: =RC[-46] -> 0 | BF98: =RC[-46] -> 680000 | BG98: =RC[-46] -> 241500 | BH98: =RC[-46] -> 242308 | BI98: =RC[-46] -> 0 | BJ98: =RC[-46] -> 0 | BK98: =RC[-46] -> 5833221 | BL98: =RC[-46] -> 184000 | BM98: =RC[-46] -> 34500 | BN98: =RC[-46] -> 23000 | BO98: =RC[-46] -> 55917.21 | BP98: =RC[-46] -> 0 | BQ98: =RC[-46] -> 5535803.79 | BR98: =RC[-46] -> 0 | BS98: =RC[-46] -> 0 | BT98: =RC[-46] -> 0 | BU98: =RC[-46] -> 0 | BV98: =RC[-46] -> 0 | BW98: =RC[-46] -> 0 | BX98: =RC[-46] -> 0 | BY98: =RC[-46] -> 0 | BZ98: =RC[-46] -> 0 | CA98: =RC[-46] -> 0 | CB98: =RC[-46] -> 242308 | CC98: =RC[-46] -> 4669413 | CD98: =RC[-46] -> 0 | CE98: =RC[-46] -> 0 | CF98: =RC[-46] -> 0 | CG98: =RC[-46] -> 0 | CH98: =RC[-46] -> 0 | CI98: =RC[-46] -> 0 | CJ98: =RC[-46] -> 0 | CK98: =RC[-46] -> 0 | CL98: =RC[-46] -> 1 | CM98: =RC[-46] -> 0 | CN98: =RC[-46] -> 0 | CO98: =RC[-46] -> 5535803.79 | CP98: =RC[-46] -> 0 | CQ98: =RC[-46] -> 80769.333000000013 | CR98: =RC[-46] -> 242308 | CS98: =RC[-46] -> 161538.66699999999
A99: 8 | B99: 013382 | C99: Nguyễn Thị Bích Thảo | D99: Nhân viên phục vụ hành khách hàng hóa | E99: 19028960225018 | F99: =RC[29]+RC[30]+RC[31]+RC[32]+RC[33]+RC[34]+RC[35]+RC[36]+RC[37] -> 3268589 | G99: =RC[17]+RC[18]++RC[19]+RC[20]+RC[21]+RC[38]+RC[39]+RC[41] -> 0 | H99: 0 | I99: 0 | J99: =RC[-2]+RC[-1] -> 0 | K99: 0 | L99: 680000 | M99: 0 | N99: =RC[15]+RC[16]+RC[17]+RC[18]+RC[19]+RC[20] -> 0 | O99: 0 | P99: 0 | Q99: 3948589 | R99: 0 | S99: 0 | T99: 0 | U99: 39485.89 | V99: 0 | W99: 3909103.11 | X99: 0 | Y99: 0 | Z99: 0 | AA99: 0 | AB99: 0 | AC99: 0 | AD99: 0 | AE99: 0 | AF99: 0 | AG99: 0 | AH99: 0 | AI99: 3268589 | AJ99: 0 | AK99: 0 | AL99: 0 | AM99: 0 | AN99: 0 | AO99: 0 | AP99: 0 | AQ99: 0 | AR99: =1 -> 1 | AS99: 0 | AT99: 0 | AU99: =RC[-30]-RC[-29]-RC[-28]-RC[-27]-RC[-26]-RC[-25] -> 3909103.11 | AV99: 0 | AW99: =RC[1]-RC[2] -> 0 | AX99: 0 | AY99: 0 | AZ99: =RC[-46] -> 3268589 | BA99: =RC[-46] -> 0 | BB99: =RC[-46] -> 0 | BC99: =RC[-46] -> 0 | BD99: =RC[-46] -> 0 | BE99: =RC[-46] -> 0 | BF99: =RC[-46] -> 680000 | BG99: =RC[-46] -> 0 | BH99: =RC[-46] -> 0 | BI99: =RC[-46] -> 0 | BJ99: =RC[-46] -> 0 | BK99: =RC[-46] -> 3948589 | BL99: =RC[-46] -> 0 | BM99: =RC[-46] -> 0 | BN99: =RC[-46] -> 0 | BO99: =RC[-46] -> 39485.89 | BP99: =RC[-46] -> 0 | BQ99: =RC[-46] -> 3909103.11 | BR99: =RC[-46] -> 0 | BS99: =RC[-46] -> 0 | BT99: =RC[-46] -> 0 | BU99: =RC[-46] -> 0 | BV99: =RC[-46] -> 0 | BW99: =RC[-46] -> 0 | BX99: =RC[-46] -> 0 | BY99: =RC[-46] -> 0 | BZ99: =RC[-46] -> 0 | CA99: =RC[-46] -> 0 | CB99: =RC[-46] -> 0 | CC99: =RC[-46] -> 3268589 | CD99: =RC[-46] -> 0 | CE99: =RC[-46] -> 0 | CF99: =RC[-46] -> 0 | CG99: =RC[-46] -> 0 | CH99: =RC[-46] -> 0 | CI99: =RC[-46] -> 0 | CJ99: =RC[-46] -> 0 | CK99: =RC[-46] -> 0 | CL99: =RC[-46] -> 1 | CM99: =RC[-46] -> 0 | CN99: =RC[-46] -> 0 | CO99: =RC[-46] -> 3909103.11 | CP99: =RC[-46] -> 0 | CQ99: =RC[-46] -> 0 | CR99: =RC[-46] -> 0 | CS99: =RC[-46] -> 0
A100: 9 | B100: 010570 | C100: Phạm Anh Dũng | D100: NV PVHK | E100: 10522162011019 | F100: =RC[29]+RC[30]+RC[31]+RC[32]+RC[33]+RC[34]+RC[35]+RC[36]+RC[37] -> 5501152 | G100: =RC[17]+RC[18]++RC[19]+RC[20]+RC[21]+RC[38]+RC[39]+RC[41] -> 284712 | H100: 0 | I100: 0 | J100: =RC[-2]+RC[-1] -> 0 | K100: 0 | L100: 601538 | M100: 283763 | N100: =RC[15]+RC[16]+RC[17]+RC[18]+RC[19]+RC[20] -> 284712 | O100: 0 | P100: 0 | Q100: 6955877 | R100: 216200 | S100: 40538 | T100: 27025 | U100: 66721.14 | V100: 0 | W100: 6605392.8600000003 | X100: 0 | Y100: 284712 | Z100: 0 | AA100: 0 | AB100: 0 | AC100: 0 | AD100: 0 | AE100: 0 | AF100: 0 | AG100: 0 | AH100: 284712 | AI100: 5501152 | AJ100: 0 | AK100: 0 | AL100: 0 | AM100: 0 | AN100: 0 | AO100: 0 | AP100: 0 | AQ100: 0 | AR100: =1 -> 1 | AS100: 0 | AT100: 0 | AU100: =RC[-30]-RC[-29]-RC[-28]-RC[-27]-RC[-26]-RC[-25] -> 6605392.8600000003 | AV100: 0 | AW100: =RC[1]-RC[2] -> 94904 | AX100: 284712 | AY100: 189808 | AZ100: =RC[-46] -> 5501152 | BA100: =RC[-46] -> 284712 | BB100: =RC[-46] -> 0 | BC100: =RC[-46] -> 0 | BD100: =RC[-46] -> 0 | BE100: =RC[-46] -> 0 | BF100: =RC[-46] -> 601538 | BG100: =RC[-46] -> 283763 | BH100: =RC[-46] -> 284712 | BI100: =RC[-46] -> 0 | BJ100: =RC[-46] -> 0 | BK100: =RC[-46] -> 6955877 | BL100: =RC[-46] -> 216200 | BM100: =RC[-46] -> 40538 | BN100: =RC[-46] -> 27025 | BO100: =RC[-46] -> 66721.14 | BP100: =RC[-46] -> 0 | BQ100: =RC[-46] -> 6605392.8600000003 | BR100: =RC[-46] -> 0 | BS100: =RC[-46] -> 284712 | BT100: =RC[-46] -> 0 | BU100: =RC[-46] -> 0 | BV100: =RC[-46] -> 0 | BW100: =RC[-46] -> 0 | BX100: =RC[-46] -> 0 | BY100: =RC[-46] -> 0 | BZ100: =RC[-46] -> 0 | CA100: =RC[-46] -> 0 | CB100: =RC[-46] -> 284712 | CC100: =RC[-46] -> 5501152 | CD100: =RC[-46] -> 0 | CE100: =RC[-46] -> 0 | CF100: =RC[-46] -> 0 | CG100: =RC[-46] -> 0 | CH100: =RC[-46] -> 0 | CI100: =RC[-46] -> 0 | CJ100: =RC[-46] -> 0 | CK100: =RC[-46] -> 0 | CL100: =RC[-46] -> 1 | CM100: =RC[-46] -> 0 | CN100: =RC[-46] -> 0 | CO100: =RC[-46] -> 6605392.8600000003 | CP100: =RC[-46] -> 0 | CQ100: =RC[-46] -> 94904 | CR100: =RC[-46] -> 284712 | CS100: =RC[-46] -> 189808
A101: 10 | B101: 010583 | C101: Nguyễn Thanh Huy | D101: NV PVHK | E101: 10525139501016 | F101: =RC[29]+RC[30]+RC[31]+RC[32]+RC[33]+RC[34]+RC[35]+RC[36]+RC[37] -> 5544928 | G101: =RC[17]+RC[18]++RC[19]+RC[20]+RC[21]+RC[38]+RC[39]+RC[41] -> 0 | H101: 0 | I101: 0 | J101: =RC[-2]+RC[-1] -> 0 | K101: 0 | L101: 680000 | M101: 241500 | N101: =RC[15]+RC[16]+RC[17]+RC[18]+RC[19]+RC[20] -> 242308 | O101: 0 | P101: 0 | Q101: 6708736 | R101: 184000 | S101: 34500 | T101: 23000 | U101: 64672.36 | V101: 0 | W101: 6402563.6399999997 | X101: 0 | Y101: 0 | Z101: 0 | AA101: 0 | AB101: 0 | AC101: 0 | AD101: 0 | AE101: 0 | AF101: 0 | AG101: 0 | AH101: 242308 | AI101: 5544928 | AJ101: 0 | AK101: 0 | AL101: 0 | AM101: 0 | AN101: 0 | AO101: 0 | AP101: 0 | AQ101: 0 | AR101: =1 -> 1 | AS101: 0 | AT101: 0 | AU101: =RC[-30]-RC[-29]-RC[-28]-RC[-27]-RC[-26]-RC[-25] -> 6402563.6399999997 | AV101: 0 | AW101: =RC[1]-RC[2] -> 80769.333000000013 | AX101: 242308 | AY101: 161538.66699999999 | AZ101: =RC[-46] -> 5544928 | BA101: =RC[-46] -> 0 | BB101: =RC[-46] -> 0 | BC101: =RC[-46] -> 0 | BD101: =RC[-46] -> 0 | BE101: =RC[-46] -> 0 | BF101: =RC[-46] -> 680000 | BG101: =RC[-46] -> 241500 | BH101: =RC[-46] -> 242308 | BI101: =RC[-46] -> 0 | BJ101: =RC[-46] -> 0 | BK101: =RC[-46] -> 6708736 | BL101: =RC[-46] -> 184000 | BM101: =RC[-46] -> 34500 | BN101: =RC[-46] -> 23000 | BO101: =RC[-46] -> 64672.36 | BP101: =RC[-46] -> 0 | BQ101: =RC[-46] -> 6402563.6399999997 | BR101: =RC[-46] -> 0 | BS101: =RC[-46] -> 0 | BT101: =RC[-46] -> 0 | BU101: =RC[-46] -> 0 | BV101: =RC[-46] -> 0 | BW101: =RC[-46] -> 0 | BX101: =RC[-46] -> 0 | BY101: =RC[-46] -> 0 | BZ101: =RC[-46] -> 0 | CA101: =RC[-46] -> 0 | CB101: =RC[-46] -> 242308 | CC101: =RC[-46] -> 5544928 | CD101: =RC[-46] -> 0 | CE101: =RC[-46] -> 0 | CF101: =RC[-46] -> 0 | CG101: =RC[-46] -> 0 | CH101: =RC[-46] -> 0 | CI101: =RC[-46] -> 0 | CJ101: =RC[-46] -> 0 | CK101: =RC[-46] -> 0 | CL101: =RC[-46] -> 1 | CM101: =RC[-46] -> 0 | CN101: =RC[-46] -> 0 | CO101: =RC[-46] -> 6402563.6399999997 | CP101: =RC[-46] -> 0 | CQ101: =RC[-46] -> 80769.333000000013 | CR101: =RC[-46] -> 242308 | CS101: =RC[-46] -> 161538.66699999999
A102: 11 | B102: 010585 | C102: Nguyễn Thị Minh Thu | D102: NV PVHK | E102: 10525139512018 | F102: =RC[29]+RC[30]+RC[31]+RC[32]+RC[33]+RC[34]+RC[35]+RC[36]+RC[37] -> 5544928 | G102: =RC[17]+RC[18]++RC[19]+RC[20]+RC[21]+RC[38]+RC[39]+RC[41] -> 0 | H102: 0 | I102: 0 | J102: =RC[-2]+RC[-1] -> 0 | K102: 0 | L102: 680000 | M102: 241500 | N102: =RC[15]+RC[16]+RC[17]+RC[18]+RC[19]+RC[20] -> 242308 | O102: 0 | P102: 0 | Q102: 6708736 | R102: 184000 | S102: 34500 | T102: 23000 | U102: 64672.36 | V102: 0 | W102: 6402563.6399999997 | X102: 0 | Y102: 0 | Z102: 0 | AA102: 0 | AB102: 0 | AC102: 0 | AD102: 0 | AE102: 0 | AF102: 0 | AG102: 0 | AH102: 242308 | AI102: 5544928 | AJ102: 0 | AK102: 0 | AL102: 0 | AM102: 0 | AN102: 0 | AO102: 0 | AP102: 0 | AQ102: 0 | AR102: =1 -> 1 | AS102: 0 | AT102: 0 | AU102: =RC[-30]-RC[-29]-RC[-28]-RC[-27]-RC[-26]-RC[-25] -> 6402563.6399999997 | AV102: 0 | AW102: =RC[1]-RC[2] -> 80769.333000000013 | AX102: 242308 | AY102: 161538.66699999999 | AZ102: =RC[-46] -> 5544928 | BA102: =RC[-46] -> 0 | BB102: =RC[-46] -> 0 | BC102: =RC[-46] -> 0 | BD102: =RC[-46] -> 0 | BE102: =RC[-46] -> 0 | BF102: =RC[-46] -> 680000 | BG102: =RC[-46] -> 241500 | BH102: =RC[-46] -> 242308 | BI102: =RC[-46] -> 0 | BJ102: =RC[-46] -> 0 | BK102: =RC[-46] -> 6708736 | BL102: =RC[-46] -> 184000 | BM102: =RC[-46] -> 34500 | BN102: =RC[-46] -> 23000 | BO102: =RC[-46] -> 64672.36 | BP102: =RC[-46] -> 0 | BQ102: =RC[-46] -> 6402563.6399999997 | BR102: =RC[-46] -> 0 | BS102: =RC[-46] -> 0 | BT102: =RC[-46] -> 0 | BU102: =RC[-46] -> 0 | BV102: =RC[-46] -> 0 | BW102: =RC[-46] -> 0 | BX102: =RC[-46] -> 0 | BY102: =RC[-46] -> 0 | BZ102: =RC[-46] -> 0 | CA102: =RC[-46] -> 0 | CB102: =RC[-46] -> 242308 | CC102: =RC[-46] -> 5544928 | CD102: =RC[-46] -> 0 | CE102: =RC[-46] -> 0 | CF102: =RC[-46] -> 0 | CG102: =RC[-46] -> 0 | CH102: =RC[-46] -> 0 | CI102: =RC[-46] -> 0 | CJ102: =RC[-46] -> 0 | CK102: =RC[-46] -> 0 | CL102: =RC[-46] -> 1 | CM102: =RC[-46] -> 0 | CN102: =RC[-46] -> 0 | CO102: =RC[-46] -> 6402563.6399999997 | CP102: =RC[-46] -> 0 | CQ102: =RC[-46] -> 80769.333000000013 | CR102: =RC[-46] -> 242308 | CS102: =RC[-46] -> 161538.66699999999
A103: 12 | B103: 010586 | C103: Nguyễn Thu Hằng | D103: NV PVHK | E103: 10523365971014 | F103: =RC[29]+RC[30]+RC[31]+RC[32]+RC[33]+RC[34]+RC[35]+RC[36]+RC[37] -> 5544928 | G103: =RC[17]+RC[18]++RC[19]+RC[20]+RC[21]+RC[38]+RC[39]+RC[41] -> 0 | H103: 0 | I103: 0 | J103: =RC[-2]+RC[-1] -> 0 | K103: 0 | L103: 680000 | M103: 241500 | N103: =RC[15]+RC[16]+RC[17]+RC[18]+RC[19]+RC[20] -> 242308 | O103: 0 | P103: 0 | Q103: 6708736 | R103: 184000 | S103: 34500 | T103: 23000 | U103: 64672.36 | V103: 0 | W103: 6402563.6399999997 | X103: 0 | Y103: 0 | Z103: 0 | AA103: 0 | AB103: 0 | AC103: 0 | AD103: 0 | AE103: 0 | AF103: 0 | AG103: 0 | AH103: 242308 | AI103: 5544928 | AJ103: 0 | AK103: 0 | AL103: 0 | AM103: 0 | AN103: 0 | AO103: 0 | AP103: 0 | AQ103: 0 | AR103: =1 -> 1 | AS103: 0 | AT103: 0 | AU103: =RC[-30]-RC[-29]-RC[-28]-RC[-27]-RC[-26]-RC[-25] -> 6402563.6399999997 | AV103: 0 | AW103: =RC[1]-RC[2] -> 80769.333000000013 | AX103: 242308 | AY103: 161538.66699999999 | AZ103: =RC[-46] -> 5544928 | BA103: =RC[-46] -> 0 | BB103: =RC[-46] -> 0 | BC103: =RC[-46] -> 0 | BD103: =RC[-46] -> 0 | BE103: =RC[-46] -> 0 | BF103: =RC[-46] -> 680000 | BG103: =RC[-46] -> 241500 | BH103: =RC[-46] -> 242308 | BI103: =RC[-46] -> 0 | BJ103: =RC[-46] -> 0 | BK103: =RC[-46] -> 6708736 | BL103: =RC[-46] -> 184000 | BM103: =RC[-46] -> 34500 | BN103: =RC[-46] -> 23000 | BO103: =RC[-46] -> 64672.36 | BP103: =RC[-46] -> 0 | BQ103: =RC[-46] -> 6402563.6399999997 | BR103: =RC[-46] -> 0 | BS103: =RC[-46] -> 0 | BT103: =RC[-46] -> 0 | BU103: =RC[-46] -> 0 | BV103: =RC[-46] -> 0 | BW103: =RC[-46] -> 0 | BX103: =RC[-46] -> 0 | BY103: =RC[-46] -> 0 | BZ103: =RC[-46] -> 0 | CA103: =RC[-46] -> 0 | CB103: =RC[-46] -> 242308 | CC103: =RC[-46] -> 5544928 | CD103: =RC[-46] -> 0 | CE103: =RC[-46] -> 0 | CF103: =RC[-46] -> 0 | CG103: =RC[-46] -> 0 | CH103: =RC[-46] -> 0 | CI103: =RC[-46] -> 0 | CJ103: =RC[-46] -> 0 | CK103: =RC[-46] -> 0 | CL103: =RC[-46] -> 1 | CM103: =RC[-46] -> 0 | CN103: =RC[-46] -> 0 | CO103: =RC[-46] -> 6402563.6399999997 | CP103: =RC[-46] -> 0 | CQ103: =RC[-46] -> 80769.333000000013 | CR103: =RC[-46] -> 242308 | CS103: =RC[-46] -> 161538.66699999999
A104: 13 | B104: 010590 | C104: Phạm Thị Hồng Hà | D104: NV PVHK | E104: 10522722533016 | F104: =RC[29]+RC[30]+RC[31]+RC[32]+RC[33]+RC[34]+RC[35]+RC[36]+RC[37] -> 426084 | G104: =RC[17]+RC[18]++RC[19]+RC[20]+RC[21]+RC[38]+RC[39]+RC[41] -> 1130769 | H104: 0 | I104: 0 | J104: =RC[-2]+RC[-1] -> 0 | K104: 0 | L104: 52308 | M104: 241500 | N104: =RC[15]+RC[16]+RC[17]+RC[18]+RC[19]+RC[20] -> 0 | O104: 0 | P104: 0 | Q104: 1850661 | R104: 184000 | S104: 34500 | T104: 23000 | U104: 16091.61 | V104: 0 | W104: 1593069.39 | X104: 0 | Y104: 1130769 | Z104: 0 | AA104: 0 | AB104: 0 | AC104: 0 | AD104: 0 | AE104: 0 | AF104: 0 | AG104: 0 | AH104: 0 | AI104: 426084 | AJ104: 0 | AK104: 0 | AL104: 0 | AM104: 0 | AN104: 0 | AO104: 0 | AP104: 0 | AQ104: 0 | AR104: =1 -> 1 | AS104: 0 | AT104: 0 | AU104: =RC[-30]-RC[-29]-RC[-28]-RC[-27]-RC[-26]-RC[-25] -> 1593069.39 | AV104: 0 | AW104: =RC[1]-RC[2] -> 0 | AX104: 0 | AY104: 0 | AZ104: =RC[-46] -> 426084 | BA104: =RC[-46] -> 1130769 | BB104: =RC[-46] -> 0 | BC104: =RC[-46] -> 0 | BD104: =RC[-46] -> 0 | BE104: =RC[-46] -> 0 | BF104: =RC[-46] -> 52308 | BG104: =RC[-46] -> 241500 | BH104: =RC[-46] -> 0 | BI104: =RC[-46] -> 0 | BJ104: =RC[-46] -> 0 | BK104: =RC[-46] -> 1850661 | BL104: =RC[-46] -> 184000 | BM104: =RC[-46] -> 34500 | BN104: =RC[-46] -> 23000 | BO104: =RC[-46] -> 16091.61 | BP104: =RC[-46] -> 0 | BQ104: =RC[-46] -> 1593069.39 | BR104: =RC[-46] -> 0 | BS104: =RC[-46] -> 1130769 | BT104: =RC[-46] -> 0 | BU104: =RC[-46] -> 0 | BV104: =RC[-46] -> 0 | BW104: =RC[-46] -> 0 | BX104: =RC[-46] -> 0 | BY104: =RC[-46] -> 0 | BZ104: =RC[-46] -> 0 | CA104: =RC[-46] -> 0 | CB104: =RC[-46] -> 0 | CC104: =RC[-46] -> 426084 | CD104: =RC[-46] -> 0 | CE104: =RC[-46] -> 0 | CF104: =RC[-46] -> 0 | CG104: =RC[-46] -> 0 | CH104: =RC[-46] -> 0 | CI104: =RC[-46] -> 0 | CJ104: =RC[-46] -> 0 | CK104: =RC[-46] -> 0 | CL104: =RC[-46] -> 1 | CM104: =RC[-46] -> 0 | CN104: =RC[-46] -> 0 | CO104: =RC[-46] -> 1593069.39 | CP104: =RC[-46] -> 0 | CQ104: =RC[-46] -> 0 | CR104: =RC[-46] -> 0 | CS104: =RC[-46] -> 0
A105: 14 | B105: 010600 | C105: Nguyễn Thị Vân Anh | D105: NV PVHK | E105: 10525213783010 | F105: =RC[29]+RC[30]+RC[31]+RC[32]+RC[33]+RC[34]+RC[35]+RC[36]+RC[37] -> 4669413 | G105: =RC[17]+RC[18]++RC[19]+RC[20]+RC[21]+RC[38]+RC[39]+RC[41] -> 0 | H105: 0 | I105: 0 | J105: =RC[-2]+RC[-1] -> 0 | K105: 0 | L105: 680000 | M105: 241500 | N105: =RC[15]+RC[16]+RC[17]+RC[18]+RC[19]+RC[20] -> 242308 | O105: 0 | P105: 0 | Q105: 5833221 | R105: 184000 | S105: 34500 | T105: 23000 | U105: 55917.21 | V105: 0 | W105: 5535803.79 | X105: 0 | Y105: 0 | Z105: 0 | AA105: 0 | AB105: 0 | AC105: 0 | AD105: 0 | AE105: 0 | AF105: 0 | AG105: 0 | AH105: 242308 | AI105: 4669413 | AJ105: 0 | AK105: 0 | AL105: 0 | AM105: 0 | AN105: 0 | AO105: 0 | AP105: 0 | AQ105: 0 | AR105: =1 -> 1 | AS105: 0 | AT105: 0 | AU105: =RC[-30]-RC[-29]-RC[-28]-RC[-27]-RC[-26]-RC[-25] -> 5535803.79 | AV105: 0 | AW105: =RC[1]-RC[2] -> 80769.333000000013 | AX105: 242308 | AY105: 161538.66699999999 | AZ105: =RC[-46] -> 4669413 | BA105: =RC[-46] -> 0 | BB105: =RC[-46] -> 0 | BC105: =RC[-46] -> 0 | BD105: =RC[-46] -> 0 | BE105: =RC[-46] -> 0 | BF105: =RC[-46] -> 680000 | BG105: =RC[-46] -> 241500 | BH105: =RC[-46] -> 242308 | BI105: =RC[-46] -> 0 | BJ105: =RC[-46] -> 0 | BK105: =RC[-46] -> 5833221 | BL105: =RC[-46] -> 184000 | BM105: =RC[-46] -> 34500 | BN105: =RC[-46] -> 23000 | BO105: =RC[-46] -> 55917.21 | BP105: =RC[-46] -> 0 | BQ105: =RC[-46] -> 5535803.79 | BR105: =RC[-46] -> 0 | BS105: =RC[-46] -> 0 | BT105: =RC[-46] -> 0 | BU105: =RC[-46] -> 0 | BV105: =RC[-46] -> 0 | BW105: =RC[-46] -> 0 | BX105: =RC[-46] -> 0 | BY105: =RC[-46] -> 0 | BZ105: =RC[-46] -> 0 | CA105: =RC[-46] -> 0 | CB105: =RC[-46] -> 242308 | CC105: =RC[-46] -> 4669413 | CD105: =RC[-46] -> 0 | CE105: =RC[-46] -> 0 | CF105: =RC[-46] -> 0 | CG105: =RC[-46] -> 0 | CH105: =RC[-46] -> 0 | CI105: =RC[-46] -> 0 | CJ105: =RC[-46] -> 0 | CK105: =RC[-46] -> 0 | CL105: =RC[-46] -> 1 | CM105: =RC[-46] -> 0 | CN105: =RC[-46] -> 0 | CO105: =RC[-46] -> 5535803.79 | CP105: =RC[-46] -> 0 | CQ105: =RC[-46] -> 80769.333000000013 | CR105: =RC[-46] -> 242308 | CS105: =RC[-46] -> 161538.66699999999
A106: 15 | B106: 010601 | C106: Phan Thị Hạnh | D106: NV PVHK | E106: 10525213791013 | F106: =RC[29]+RC[30]+RC[31]+RC[32]+RC[33]+RC[34]+RC[35]+RC[36]+RC[37] -> 2156685 | G106: =RC[17]+RC[18]++RC[19]+RC[20]+RC[21]+RC[38]+RC[39]+RC[41] -> 0 | H106: 0 | I106: 0 | J106: =RC[-2]+RC[-1] -> 0 | K106: 0 | L106: 0 | M106: 0 | N106: =RC[15]+RC[16]+RC[17]+RC[18]+RC[19]+RC[20] -> 0 | O106: 0 | P106: 0 | Q106: 2156685 | R106: 0 | S106: 0 | T106: 0 | U106: 21566.85 | V106: 0 | W106: 2135118.15 | X106: 0 | Y106: 0 | Z106: 0 | AA106: 0 | AB106: 0 | AC106: 0 | AD106: 0 | AE106: 0 | AF106: 0 | AG106: 0 | AH106: 0 | AI106: 0 | AJ106: 2156685 | AK106: 0 | AL106: 0 | AM106: 0 | AN106: 0 | AO106: 0 | AP106: 0 | AQ106: 0 | AR106: =1 -> 1 | AS106: 0 | AT106: 0 | AU106: =RC[-30]-RC[-29]-RC[-28]-RC[-27]-RC[-26]-RC[-25] -> 2135118.15 | AV106: 0 | AW106: =RC[1]-RC[2] -> 0 | AX106: 0 | AY106: 0 | AZ106: =RC[-46] -> 2156685 | BA106: =RC[-46] -> 0 | BB106: =RC[-46] -> 0 | BC106: =RC[-46] -> 0 | BD106: =RC[-46] -> 0 | BE106: =RC[-46] -> 0 | BF106: =RC[-46] -> 0 | BG106: =RC[-46] -> 0 | BH106: =RC[-46] -> 0 | BI106: =RC[-46] -> 0 | BJ106: =RC[-46] -> 0 | BK106: =RC[-46] -> 2156685 | BL106: =RC[-46] -> 0 | BM106: =RC[-46] -> 0 | BN106: =RC[-46] -> 0 | BO106: =RC[-46] -> 21566.85 | BP106: =RC[-46] -> 0 | BQ106: =RC[-46] -> 2135118.15 | BR106: =RC[-46] -> 0 | BS106: =RC[-46] -> 0 | BT106: =RC[-46] -> 0 | BU106: =RC[-46] -> 0 | BV106: =RC[-46] -> 0 | BW106: =RC[-46] -> 0 | BX106: =RC[-46] -> 0 | BY106: =RC[-46] -> 0 | BZ106: =RC[-46] -> 0 | CA106: =RC[-46] -> 0 | CB106: =RC[-46] -> 0 | CC106: =RC[-46] -> 0 | CD106: =RC[-46] -> 2156685 | CE106: =RC[-46] -> 0 | CF106: =RC[-46] -> 0 | CG106: =RC[-46] -> 0 | CH106: =RC[-46] -> 0 | CI106: =RC[-46] -> 0 | CJ106: =RC[-46] -> 0 | CK106: =RC[-46] -> 0 | CL106: =RC[-46] -> 1 | CM106: =RC[-46] -> 0 | CN106: =RC[-46] -> 0 | CO106: =RC[-46] -> 2135118.15 | CP106: =RC[-46] -> 0 | CQ106: =RC[-46] -> 0 | CR106: =RC[-46] -> 0 | CS106: =RC[-46] -> 0
A107: 16 | B107: 010608 | C107: Nguyễn Thị Hương | D107: NV PVHK | E107: 10523498956018 | F107: =RC[29]+RC[30]+RC[31]+RC[32]+RC[33]+RC[34]+RC[35]+RC[36]+RC[37] -> 4961251 | G107: =RC[17]+RC[18]++RC[19]+RC[20]+RC[21]+RC[38]+RC[39]+RC[41] -> 0 | H107: 0 | I107: 0 | J107: =RC[-2]+RC[-1] -> 0 | K107: 0 | L107: 680000 | M107: 283763 | N107: =RC[15]+RC[16]+RC[17]+RC[18]+RC[19]+RC[20] -> 284712 | O107: 0 | P107: 0 | Q107: 6209726 | R107: 216200 | S107: 40538 | T107: 27025 | U107: 59259.63 | V107: 0 | W107: 5866703.3700000001 | X107: 0 | Y107: 0 | Z107: 0 | AA107: 0 | AB107: 0 | AC107: 0 | AD107: 0 | AE107: 0 | AF107: 0 | AG107: 0 | AH107: 284712 | AI107: 4961251 | AJ107: 0 | AK107: 0 | AL107: 0 | AM107: 0 | AN107: 0 | AO107: 0 | AP107: 0 | AQ107: 0 | AR107: =1 -> 1 | AS107: 0 | AT107: 0 | AU107: =RC[-30]-RC[-29]-RC[-28]-RC[-27]-RC[-26]-RC[-25] -> 5866703.3700000001 | AV107: 0 | AW107: =RC[1]-RC[2] -> 94904 | AX107: 284712 | AY107: 189808 | AZ107: =RC[-46] -> 4961251 | BA107: =RC[-46] -> 0 | BB107: =RC[-46] -> 0 | BC107: =RC[-46] -> 0 | BD107: =RC[-46] -> 0 | BE107: =RC[-46] -> 0 | BF107: =RC[-46] -> 680000 | BG107: =RC[-46] -> 283763 | BH107: =RC[-46] -> 284712 | BI107: =RC[-46] -> 0 | BJ107: =RC[-46] -> 0 | BK107: =RC[-46] -> 6209726 | BL107: =RC[-46] -> 216200 | BM107: =RC[-46] -> 40538 | BN107: =RC[-46] -> 27025 | BO107: =RC[-46] -> 59259.63 | BP107: =RC[-46] -> 0 | BQ107: =RC[-46] -> 5866703.3700000001 | BR107: =RC[-46] -> 0 | BS107: =RC[-46] -> 0 | BT107: =RC[-46] -> 0 | BU107: =RC[-46] -> 0 | BV107: =RC[-46] -> 0 | BW107: =RC[-46] -> 0 | BX107: =RC[-46] -> 0 | BY107: =RC[-46] -> 0 | BZ107: =RC[-46] -> 0 | CA107: =RC[-46] -> 0 | CB107: =RC[-46] -> 284712 | CC107: =RC[-46] -> 4961251 | CD107: =RC[-46] -> 0 | CE107: =RC[-46] -> 0 | CF107: =RC[-46] -> 0 | CG107: =RC[-46] -> 0 | CH107: =RC[-46] -> 0 | CI107: =RC[-46] -> 0 | CJ107: =RC[-46] -> 0 | CK107: =RC[-46] -> 0 | CL107: =RC[-46] -> 1 | CM107: =RC[-46] -> 0 | CN107: =RC[-46] -> 0 | CO107: =RC[-46] -> 5866703.3700000001 | CP107: =RC[-46] -> 0 | CQ107: =RC[-46] -> 94904 | CR107: =RC[-46] -> 284712 | CS107: =RC[-46] -> 189808
A108: 17 | B108: 010624 | C108: Nguyễn Huyền Trang | D108: NV PVHK | E108: 10523498907017 | F108: =RC[29]+RC[30]+RC[31]+RC[32]+RC[33]+RC[34]+RC[35]+RC[36]+RC[37] -> 3338630 | G108: =RC[17]+RC[18]++RC[19]+RC[20]+RC[21]+RC[38]+RC[39]+RC[41] -> 94904 | H108: 0 | I108: 0 | J108: =RC[-2]+RC[-1] -> 0 | K108: 0 | L108: 261538 | M108: 0 | N108: =RC[15]+RC[16]+RC[17]+RC[18]+RC[19]+RC[20] -> 0 | O108: 0 | P108: 0 | Q108: 3695072 | R108: 0 | S108: 0 | T108: 0 | U108: 36950.720000000001 | V108: 0 | W108: 3658121.28 | X108: 0 | Y108: 94904 | Z108: 0 | AA108: 0 | AB108: 0 | AC108: 0 | AD108: 0 | AE108: 0 | AF108: 0 | AG108: 0 | AH108: 0 | AI108: 3338630 | AJ108: 0 | AK108: 0 | AL108: 0 | AM108: 0 | AN108: 0 | AO108: 0 | AP108: 0 | AQ108: 0 | AR108: =1 -> 1 | AS108: 0 | AT108: 0 | AU108: =RC[-30]-RC[-29]-RC[-28]-RC[-27]-RC[-26]-RC[-25] -> 3658121.28 | AV108: 0 | AW108: =RC[1]-RC[2] -> 0 | AX108: 0 | AY108: 0 | AZ108: =RC[-46] -> 3338630 | BA108: =RC[-46] -> 94904 | BB108: =RC[-46] -> 0 | BC108: =RC[-46] -> 0 | BD108: =RC[-46] -> 0 | BE108: =RC[-46] -> 0 | BF108: =RC[-46] -> 261538 | BG108: =RC[-46] -> 0 | BH108: =RC[-46] -> 0 | BI108: =RC[-46] -> 0 | BJ108: =RC[-46] -> 0 | BK108: =RC[-46] -> 3695072 | BL108: =RC[-46] -> 0 | BM108: =RC[-46] -> 0 | BN108: =RC[-46] -> 0 | BO108: =RC[-46] -> 36950.720000000001 | BP108: =RC[-46] -> 0 | BQ108: =RC[-46] -> 3658121.28 | BR108: =RC[-46] -> 0 | BS108: =RC[-46] -> 94904 | BT108: =RC[-46] -> 0 | BU108: =RC[-46] -> 0 | BV108: =RC[-46] -> 0 | BW108: =RC[-46] -> 0 | BX108: =RC[-46] -> 0 | BY108: =RC[-46] -> 0 | BZ108: =RC[-46] -> 0 | CA108: =RC[-46] -> 0 | CB108: =RC[-46] -> 0 | CC108: =RC[-46] -> 3338630 | CD108: =RC[-46] -> 0 | CE108: =RC[-46] -> 0 | CF108: =RC[-46] -> 0 | CG108: =RC[-46] -> 0 | CH108: =RC[-46] -> 0 | CI108: =RC[-46] -> 0 | CJ108: =RC[-46] -> 0 | CK108: =RC[-46] -> 0 | CL108: =RC[-46] -> 1 | CM108: =RC[-46] -> 0 | CN108: =RC[-46] -> 0 | CO108: =RC[-46] -> 3658121.28 | CP108: =RC[-46] -> 0 | CQ108: =RC[-46] -> 0 | CR108: =RC[-46] -> 0 | CS108: =RC[-46] -> 0
A109: 18 | B109: 010625 | C109: Vương Thị Thanh Nhàn | D109: NV PVHK | E109: 13820400981015 | F109: =RC[29]+RC[30]+RC[31]+RC[32]+RC[33]+RC[34]+RC[35]+RC[36]+RC[37] -> 5865950 | G109: =RC[17]+RC[18]++RC[19]+RC[20]+RC[21]+RC[38]+RC[39]+RC[41] -> 0 | H109: 0 | I109: 0 | J109: =RC[-2]+RC[-1] -> 0 | K109: 0 | L109: 680000 | M109: 333270 | N109: =RC[15]+RC[16]+RC[17]+RC[18]+RC[19]+RC[20] -> 334385 | O109: 0 | P109: 0 | Q109: 7213605 | R109: 253920 | S109: 47610 | T109: 31740 | U109: 68803.350000000006 | V109: 0 | W109: 6811531.6500000004 | X109: 0 | Y109: 0 | Z109: 0 | AA109: 0 | AB109: 0 | AC109: 0 | AD109: 0 | AE109: 0 | AF109: 0 | AG109: 0 | AH109: 334385 | AI109: 5865950 | AJ109: 0 | AK109: 0 | AL109: 0 | AM109: 0 | AN109: 0 | AO109: 0 | AP109: 0 | AQ109: 0 | AR109: =1 -> 1 | AS109: 0 | AT109: 0 | AU109: =RC[-30]-RC[-29]-RC[-28]-RC[-27]-RC[-26]-RC[-25] -> 6811531.6500000004 | AV109: 0 | AW109: =RC[1]-RC[2] -> 111461.66699999999 | AX109: 334385 | AY109: 222923.33300000001 | AZ109: =RC[-46] -> 5865950 | BA109: =RC[-46] -> 0 | BB109: =RC[-46] -> 0 | BC109: =RC[-46] -> 0 | BD109: =RC[-46] -> 0 | BE109: =RC[-46] -> 0 | BF109: =RC[-46] -> 680000 | BG109: =RC[-46] -> 333270 | BH109: =RC[-46] -> 334385 | BI109: =RC[-46] -> 0 | BJ109: =RC[-46] -> 0 | BK109: =RC[-46] -> 7213605 | BL109: =RC[-46] -> 253920 | BM109: =RC[-46] -> 47610 | BN109: =RC[-46] -> 31740 | BO109: =RC[-46] -> 68803.350000000006 | BP109: =RC[-46] -> 0 | BQ109: =RC[-46] -> 6811531.6500000004 | BR109: =RC[-46] -> 0 | BS109: =RC[-46] -> 0 | BT109: =RC[-46] -> 0 | BU109: =RC[-46] -> 0 | BV109: =RC[-46] -> 0 | BW109: =RC[-46] -> 0 | BX109: =RC[-46] -> 0 | BY109: =RC[-46] -> 0 | BZ109: =RC[-46] -> 0 | CA109: =RC[-46] -> 0 | CB109: =RC[-46] -> 334385 | CC109: =RC[-46] -> 5865950 | CD109: =RC[-46] -> 0 | CE109: =RC[-46] -> 0 | CF109: =RC[-46] -> 0 | CG109: =RC[-46] -> 0 | CH109: =RC[-46] -> 0 | CI109: =RC[-46] -> 0 | CJ109: =RC[-46] -> 0 | CK109: =RC[-46] -> 0 | CL109: =RC[-46] -> 1 | CM109: =RC[-46] -> 0 | CN109: =RC[-46] -> 0 | CO109: =RC[-46] -> 6811531.6500000004 | CP109: =RC[-46] -> 0 | CQ109: =RC[-46] -> 111461.66699999999 | CR109: =RC[-46] -> 334385 | CS109: =RC[-46] -> 222923.33300000001
A110: 19 | B110: 010633 | C110: Quàng Thị Phúc | D110: NV PVHK | E110: 10522162856019 | F110: =RC[29]+RC[30]+RC[31]+RC[32]+RC[33]+RC[34]+RC[35]+RC[36]+RC[37] -> 5019619 | G110: =RC[17]+RC[18]++RC[19]+RC[20]+RC[21]+RC[38]+RC[39]+RC[41] -> 0 | H110: 0 | I110: 0 | J110: =RC[-2]+RC[-1] -> 0 | K110: 0 | L110: 680000 | M110: 458850 | N110: =RC[15]+RC[16]+RC[17]+RC[18]+RC[19]+RC[20] -> 460385 | O110: 0 | P110: 0 | Q110: 6618854 | R110: 349600 | S110: 65550 | T110: 43700 | U110: 61600.04 | V110: 0 | W110: 6098403.96 | X110: 0 | Y110: 0 | Z110: 0 | AA110: 0 | AB110: 0 | AC110: 0 | AD110: 0 | AE110: 0 | AF110: 0 | AG110: 0 | AH110: 460385 | AI110: 5019619 | AJ110: 0 | AK110: 0 | AL110: 0 | AM110: 0 | AN110: 0 | AO110: 0 | AP110: 0 | AQ110: 0 | AR110: =1 -> 1 | AS110: 0 | AT110: 0 | AU110: =RC[-30]-RC[-29]-RC[-28]-RC[-27]-RC[-26]-RC[-25] -> 6098403.96 | AV110: 0 | AW110: =RC[1]-RC[2] -> 153461.66700000002 | AX110: 460385 | AY110: 306923.33299999998 | AZ110: =RC[-46] -> 5019619 | BA110: =RC[-46] -> 0 | BB110: =RC[-46] -> 0 | BC110: =RC[-46] -> 0 | BD110: =RC[-46] -> 0 | BE110: =RC[-46] -> 0 | BF110: =RC[-46] -> 680000 | BG110: =RC[-46] -> 458850 | BH110: =RC[-46] -> 460385 | BI110: =RC[-46] -> 0 | BJ110: =RC[-46] -> 0 | BK110: =RC[-46] -> 6618854 | BL110: =RC[-46] -> 349600 | BM110: =RC[-46] -> 65550 | BN110: =RC[-46] -> 43700 | BO110: =RC[-46] -> 61600.04 | BP110: =RC[-46] -> 0 | BQ110: =RC[-46] -> 6098403.96 | BR110: =RC[-46] -> 0 | BS110: =RC[-46] -> 0 | BT110: =RC[-46] -> 0 | BU110: =RC[-46] -> 0 | BV110: =RC[-46] -> 0 | BW110: =RC[-46] -> 0 | BX110: =RC[-46] -> 0 | BY110: =RC[-46] -> 0 | BZ110: =RC[-46] -> 0 | CA110: =RC[-46] -> 0 | CB110: =RC[-46] -> 460385 | CC110: =RC[-46] -> 5019619 | CD110: =RC[-46] -> 0 | CE110: =RC[-46] -> 0 | CF110: =RC[-46] -> 0 | CG110: =RC[-46] -> 0 | CH110: =RC[-46] -> 0 | CI110: =RC[-46] -> 0 | CJ110: =RC[-46] -> 0 | CK110: =RC[-46] -> 0 | CL110: =RC[-46] -> 1 | CM110: =RC[-46] -> 0 | CN110: =RC[-46] -> 0 | CO110: =RC[-46] -> 6098403.96 | CP110: =RC[-46] -> 0 | CQ110: =RC[-46] -> 153461.66700000002 | CR110: =RC[-46] -> 460385 | CS110: =RC[-46] -> 306923.33299999998
A111: 20 | B111: 010634 | C111: Phạm Thị Thanh Hoa | D111: NV PVHK | E111: 10520107405013 | F111: =RC[29]+RC[30]+RC[31]+RC[32]+RC[33]+RC[34]+RC[35]+RC[36]+RC[37] -> 5865950 | G111: =RC[17]+RC[18]++RC[19]+RC[20]+RC[21]+RC[38]+RC[39]+RC[41] -> 0 | H111: 0 | I111: 0 | J111: =RC[-2]+RC[-1] -> 0 | K111: 0 | L111: 680000 | M111: 333270 | N111: =RC[15]+RC[16]+RC[17]+RC[18]+RC[19]+RC[20] -> 334385 | O111: 0 | P111: 0 | Q111: 7213605 | R111: 253920 | S111: 47610 | T111: 31740 | U111: 68803.350000000006 | V111: 0 | W111: 6811531.6500000004 | X111: 0 | Y111: 0 | Z111: 0 | AA111: 0 | AB111: 0 | AC111: 0 | AD111: 0 | AE111: 0 | AF111: 0 | AG111: 0 | AH111: 334385 | AI111: 5865950 | AJ111: 0 | AK111: 0 | AL111: 0 | AM111: 0 | AN111: 0 | AO111: 0 | AP111: 0 | AQ111: 0 | AR111: =1 -> 1 | AS111: 0 | AT111: 0 | AU111: =RC[-30]-RC[-29]-RC[-28]-RC[-27]-RC[-26]-RC[-25] -> 6811531.6500000004 | AV111: 0 | AW111: =RC[1]-RC[2] -> 111461.66699999999 | AX111: 334385 | AY111: 222923.33300000001 | AZ111: =RC[-46] -> 5865950 | BA111: =RC[-46] -> 0 | BB111: =RC[-46] -> 0 | BC111: =RC[-46] -> 0 | BD111: =RC[-46] -> 0 | BE111: =RC[-46] -> 0 | BF111: =RC[-46] -> 680000 | BG111: =RC[-46] -> 333270 | BH111: =RC[-46] -> 334385 | BI111: =RC[-46] -> 0 | BJ111: =RC[-46] -> 0 | BK111: =RC[-46] -> 7213605 | BL111: =RC[-46] -> 253920 | BM111: =RC[-46] -> 47610 | BN111: =RC[-46] -> 31740 | BO111: =RC[-46] -> 68803.350000000006 | BP111: =RC[-46] -> 0 | BQ111: =RC[-46] -> 6811531.6500000004 | BR111: =RC[-46] -> 0 | BS111: =RC[-46] -> 0 | BT111: =RC[-46] -> 0 | BU111: =RC[-46] -> 0 | BV111: =RC[-46] -> 0 | BW111: =RC[-46] -> 0 | BX111: =RC[-46] -> 0 | BY111: =RC[-46] -> 0 | BZ111: =RC[-46] -> 0 | CA111: =RC[-46] -> 0 | CB111: =RC[-46] -> 334385 | CC111: =RC[-46] -> 5865950 | CD111: =RC[-46] -> 0 | CE111: =RC[-46] -> 0 | CF111: =RC[-46] -> 0 | CG111: =RC[-46] -> 0 | CH111: =RC[-46] -> 0 | CI111: =RC[-46] -> 0 | CJ111: =RC[-46] -> 0 | CK111: =RC[-46] -> 0 | CL111: =RC[-46] -> 1 | CM111: =RC[-46] -> 0 | CN111: =RC[-46] -> 0 | CO111: =RC[-46] -> 6811531.6500000004 | CP111: =RC[-46] -> 0 | CQ111: =RC[-46] -> 111461.66699999999 | CR111: =RC[-46] -> 334385 | CS111: =RC[-46] -> 222923.33300000001
A112: 21 | B112: 010635 | C112: Đào Thị Mận | D112: NV PVHK | E112: 10522162757010 | F112: =RC[29]+RC[30]+RC[31]+RC[32]+RC[33]+RC[34]+RC[35]+RC[36]+RC[37] -> 4727781 | G112: =RC[17]+RC[18]++RC[19]+RC[20]+RC[21]+RC[38]+RC[39]+RC[41] -> 0 | H112: 0 | I112: 0 | J112: =RC[-2]+RC[-1] -> 0 | K112: 0 | L112: 680000 | M112: 458850 | N112: =RC[15]+RC[16]+RC[17]+RC[18]+RC[19]+RC[20] -> 460385 | O112: 0 | P112: 0 | Q112: 6327016 | R112: 349600 | S112: 65550 | T112: 43700 | U112: 58681.66 | V112: 0 | W112: 5809484.3399999999 | X112: 0 | Y112: 0 | Z112: 0 | AA112: 0 | AB112: 0 | AC112: 0 | AD112: 0 | AE112: 0 | AF112: 0 | AG112: 0 | AH112: 460385 | AI112: 4727781 | AJ112: 0 | AK112: 0 | AL112: 0 | AM112: 0 | AN112: 0 | AO112: 0 | AP112: 0 | AQ112: 0 | AR112: =1 -> 1 | AS112: 0 | AT112: 0 | AU112: =RC[-30]-RC[-29]-RC[-28]-RC[-27]-RC[-26]-RC[-25] -> 5809484.3399999999 | AV112: 0 | AW112: =RC[1]-RC[2] -> 153461.66700000002 | AX112: 460385 | AY112: 306923.33299999998 | AZ112: =RC[-46] -> 4727781 | BA112: =RC[-46] -> 0 | BB112: =RC[-46] -> 0 | BC112: =RC[-46] -> 0 | BD112: =RC[-46] -> 0 | BE112: =RC[-46] -> 0 | BF112: =RC[-46] -> 680000 | BG112: =RC[-46] -> 458850 | BH112: =RC[-46] -> 460385 | BI112: =RC[-46] -> 0 | BJ112: =RC[-46] -> 0 | BK112: =RC[-46] -> 6327016 | BL112: =RC[-46] -> 349600 | BM112: =RC[-46] -> 65550 | BN112: =RC[-46] -> 43700 | BO112: =RC[-46] -> 58681.66 | BP112: =RC[-46] -> 0 | BQ112: =RC[-46] -> 5809484.3399999999 | BR112: =RC[-46] -> 0 | BS112: =RC[-46] -> 0 | BT112: =RC[-46] -> 0 | BU112: =RC[-46] -> 0 | BV112: =RC[-46] -> 0 | BW112: =RC[-46] -> 0 | BX112: =RC[-46] -> 0 | BY112: =RC[-46] -> 0 | BZ112: =RC[-46] -> 0 | CA112: =RC[-46] -> 0 | CB112: =RC[-46] -> 460385 | CC112: =RC[-46] -> 4727781 | CD112: =RC[-46] -> 0 | CE112: =RC[-46] -> 0 | CF112: =RC[-46] -> 0 | CG112: =RC[-46] -> 0 | CH112: =RC[-46] -> 0 | CI112: =RC[-46] -> 0 | CJ112: =RC[-46] -> 0 | CK112: =RC[-46] -> 0 | CL112: =RC[-46] -> 1 | CM112: =RC[-46] -> 0 | CN112: =RC[-46] -> 0 | CO112: =RC[-46] -> 5809484.3399999999 | CP112: =RC[-46] -> 0 | CQ112: =RC[-46] -> 153461.66700000002 | CR112: =RC[-46] -> 460385 | CS112: =RC[-46] -> 306923.33299999998
A113: 22 | B113: 011104 | C113: Lê Thị Thanh Huyền | D113: NV PVHK | E113: 19026970107010 | F113: =RC[29]+RC[30]+RC[31]+RC[32]+RC[33]+RC[34]+RC[35]+RC[36]+RC[37] -> 4669413 | G113: =RC[17]+RC[18]++RC[19]+RC[20]+RC[21]+RC[38]+RC[39]+RC[41] -> 0 | H113: 0 | I113: 0 | J113: =RC[-2]+RC[-1] -> 0 | K113: 0 | L113: 680000 | M113: 241500 | N113: =RC[15]+RC[16]+RC[17]+RC[18]+RC[19]+RC[20] -> 242308 | O113: 0 | P113: 0 | Q113: 5833221 | R113: 184000 | S113: 34500 | T113: 23000 | U113: 55917.21 | V113: 0 | W113: 5535803.79 | X113: 0 | Y113: 0 | Z113: 0 | AA113: 0 | AB113: 0 | AC113: 0 | AD113: 0 | AE113: 0 | AF113: 0 | AG113: 0 | AH113: 242308 | AI113: 4669413 | AJ113: 0 | AK113: 0 | AL113: 0 | AM113: 0 | AN113: 0 | AO113: 0 | AP113: 0 | AQ113: 0 | AR113: =1 -> 1 | AS113: 0 | AT113: 0 | AU113: =RC[-30]-RC[-29]-RC[-28]-RC[-27]-RC[-26]-RC[-25] -> 5535803.79 | AV113: 0 | AW113: =RC[1]-RC[2] -> 80769.333000000013 | AX113: 242308 | AY113: 161538.66699999999 | AZ113: =RC[-46] -> 4669413 | BA113: =RC[-46] -> 0 | BB113: =RC[-46] -> 0 | BC113: =RC[-46] -> 0 | BD113: =RC[-46] -> 0 | BE113: =RC[-46] -> 0 | BF113: =RC[-46] -> 680000 | BG113: =RC[-46] -> 241500 | BH113: =RC[-46] -> 242308 | BI113: =RC[-46] -> 0 | BJ113: =RC[-46] -> 0 | BK113: =RC[-46] -> 5833221 | BL113: =RC[-46] -> 184000 | BM113: =RC[-46] -> 34500 | BN113: =RC[-46] -> 23000 | BO113: =RC[-46] -> 55917.21 | BP113: =RC[-46] -> 0 | BQ113: =RC[-46] -> 5535803.79 | BR113: =RC[-46] -> 0 | BS113: =RC[-46] -> 0 | BT113: =RC[-46] -> 0 | BU113: =RC[-46] -> 0 | BV113: =RC[-46] -> 0 | BW113: =RC[-46] -> 0 | BX113: =RC[-46] -> 0 | BY113: =RC[-46] -> 0 | BZ113: =RC[-46] -> 0 | CA113: =RC[-46] -> 0 | CB113: =RC[-46] -> 242308 | CC113: =RC[-46] -> 4669413 | CD113: =RC[-46] -> 0 | CE113: =RC[-46] -> 0 | CF113: =RC[-46] -> 0 | CG113: =RC[-46] -> 0 | CH113: =RC[-46] -> 0 | CI113: =RC[-46] -> 0 | CJ113: =RC[-46] -> 0 | CK113: =RC[-46] -> 0 | CL113: =RC[-46] -> 1 | CM113: =RC[-46] -> 0 | CN113: =RC[-46] -> 0 | CO113: =RC[-46] -> 5535803.79 | CP113: =RC[-46] -> 0 | CQ113: =RC[-46] -> 80769.333000000013 | CR113: =RC[-46] -> 242308 | CS113: =RC[-46] -> 161538.66699999999
A114: 23 | B114: 011105 | C114: Ngô Minh Thanh | D114: NV PVHK | E114: 19020895815014 | F114: =RC[29]+RC[30]+RC[31]+RC[32]+RC[33]+RC[34]+RC[35]+RC[36]+RC[37] -> 4669413 | G114: =RC[17]+RC[18]++RC[19]+RC[20]+RC[21]+RC[38]+RC[39]+RC[41] -> 0 | H114: 0 | I114: 0 | J114: =RC[-2]+RC[-1] -> 0 | K114: 0 | L114: 680000 | M114: 241500 | N114: =RC[15]+RC[16]+RC[17]+RC[18]+RC[19]+RC[20] -> 242308 | O114: 0 | P114: 0 | Q114: 5833221 | R114: 184000 | S114: 34500 | T114: 23000 | U114: 55917.21 | V114: 0 | W114: 5535803.79 | X114: 0 | Y114: 0 | Z114: 0 | AA114: 0 | AB114: 0 | AC114: 0 | AD114: 0 | AE114: 0 | AF114: 0 | AG114: 0 | AH114: 242308 | AI114: 4669413 | AJ114: 0 | AK114: 0 | AL114: 0 | AM114: 0 | AN114: 0 | AO114: 0 | AP114: 0 | AQ114: 0 | AR114: =1 -> 1 | AS114: 0 | AT114: 0 | AU114: =RC[-30]-RC[-29]-RC[-28]-RC[-27]-RC[-26]-RC[-25] -> 5535803.79 | AV114: 0 | AW114: =RC[1]-RC[2] -> 80769.333000000013 | AX114: 242308 | AY114: 161538.66699999999 | AZ114: =RC[-46] -> 4669413 | BA114: =RC[-46] -> 0 | BB114: =RC[-46] -> 0 | BC114: =RC[-46] -> 0 | BD114: =RC[-46] -> 0 | BE114: =RC[-46] -> 0 | BF114: =RC[-46] -> 680000 | BG114: =RC[-46] -> 241500 | BH114: =RC[-46] -> 242308 | BI114: =RC[-46] -> 0 | BJ114: =RC[-46] -> 0 | BK114: =RC[-46] -> 5833221 | BL114: =RC[-46] -> 184000 | BM114: =RC[-46] -> 34500 | BN114: =RC[-46] -> 23000 | BO114: =RC[-46] -> 55917.21 | BP114: =RC[-46] -> 0 | BQ114: =RC[-46] -> 5535803.79 | BR114: =RC[-46] -> 0 | BS114: =RC[-46] -> 0 | BT114: =RC[-46] -> 0 | BU114: =RC[-46] -> 0 | BV114: =RC[-46] -> 0 | BW114: =RC[-46] -> 0 | BX114: =RC[-46] -> 0 | BY114: =RC[-46] -> 0 | BZ114: =RC[-46] -> 0 | CA114: =RC[-46] -> 0 | CB114: =RC[-46] -> 242308 | CC114: =RC[-46] -> 4669413 | CD114: =RC[-46] -> 0 | CE114: =RC[-46] -> 0 | CF114: =RC[-46] -> 0 | CG114: =RC[-46] -> 0 | CH114: =RC[-46] -> 0 | CI114: =RC[-46] -> 0 | CJ114: =RC[-46] -> 0 | CK114: =RC[-46] -> 0 | CL114: =RC[-46] -> 1 | CM114: =RC[-46] -> 0 | CN114: =RC[-46] -> 0 | CO114: =RC[-46] -> 5535803.79 | CP114: =RC[-46] -> 0 | CQ114: =RC[-46] -> 80769.333000000013 | CR114: =RC[-46] -> 242308 | CS114: =RC[-46] -> 161538.66699999999
A115: 24 | B115: 011106 | C115: Lê Thị Trang Nhung | D115: NV PVHK | E115: 13724170180019 | F115: =RC[29]+RC[30]+RC[31]+RC[32]+RC[33]+RC[34]+RC[35]+RC[36]+RC[37] -> 4669413 | G115: =RC[17]+RC[18]++RC[19]+RC[20]+RC[21]+RC[38]+RC[39]+RC[41] -> 0 | H115: 0 | I115: 0 | J115: =RC[-2]+RC[-1] -> 0 | K115: 0 | L115: 680000 | M115: 241500 | N115: =RC[15]+RC[16]+RC[17]+RC[18]+RC[19]+RC[20] -> 0 | O115: 0 | P115: 0 | Q115: 5590913 | R115: 184000 | S115: 34500 | T115: 23000 | U115: 53494.13 | V115: 0 | W115: 5295918.87 | X115: 0 | Y115: 0 | Z115: 0 | AA115: 0 | AB115: 0 | AC115: 0 | AD115: 0 | AE115: 0 | AF115: 0 | AG115: 0 | AH115: 0 | AI115: 4669413 | AJ115: 0 | AK115: 0 | AL115: 0 | AM115: 0 | AN115: 0 | AO115: 0 | AP115: 0 | AQ115: 0 | AR115: =1 -> 1 | AS115: 0 | AT115: 0 | AU115: =RC[-30]-RC[-29]-RC[-28]-RC[-27]-RC[-26]-RC[-25] -> 5295918.87 | AV115: 0 | AW115: =RC[1]-RC[2] -> 0 | AX115: 0 | AY115: 0 | AZ115: =RC[-46] -> 4669413 | BA115: =RC[-46] -> 0 | BB115: =RC[-46] -> 0 | BC115: =RC[-46] -> 0 | BD115: =RC[-46] -> 0 | BE115: =RC[-46] -> 0 | BF115: =RC[-46] -> 680000 | BG115: =RC[-46] -> 241500 | BH115: =RC[-46] -> 0 | BI115: =RC[-46] -> 0 | BJ115: =RC[-46] -> 0 | BK115: =RC[-46] -> 5590913 | BL115: =RC[-46] -> 184000 | BM115: =RC[-46] -> 34500 | BN115: =RC[-46] -> 23000 | BO115: =RC[-46] -> 53494.13 | BP115: =RC[-46] -> 0 | BQ115: =RC[-46] -> 5295918.87 | BR115: =RC[-46] -> 0 | BS115: =RC[-46] -> 0 | BT115: =RC[-46] -> 0 | BU115: =RC[-46] -> 0 | BV115: =RC[-46] -> 0 | BW115: =RC[-46] -> 0 | BX115: =RC[-46] -> 0 | BY115: =RC[-46] -> 0 | BZ115: =RC[-46] -> 0 | CA115: =RC[-46] -> 0 | CB115: =RC[-46] -> 0 | CC115: =RC[-46] -> 4669413 | CD115: =RC[-46] -> 0 | CE115: =RC[-46] -> 0 | CF115: =RC[-46] -> 0 | CG115: =RC[-46] -> 0 | CH115: =RC[-46] -> 0 | CI115: =RC[-46] -> 0 | CJ115: =RC[-46] -> 0 | CK115: =RC[-46] -> 0 | CL115: =RC[-46] -> 1 | CM115: =RC[-46] -> 0 | CN115: =RC[-46] -> 0 | CO115: =RC[-46] -> 5295918.87 | CP115: =RC[-46] -> 0 | CQ115: =RC[-46] -> 0 | CR115: =RC[-46] -> 0 | CS115: =RC[-46] -> 0
A116: 25 | B116: 011107 | C116: Vũ Thị Thơm | D116: NV PVHK | E116: 19026970109013 | F116: =RC[29]+RC[30]+RC[31]+RC[32]+RC[33]+RC[34]+RC[35]+RC[36]+RC[37] -> 2334706 | G116: =RC[17]+RC[18]++RC[19]+RC[20]+RC[21]+RC[38]+RC[39]+RC[41] -> 0 | H116: 0 | I116: 0 | J116: =RC[-2]+RC[-1] -> 0 | K116: 0 | L116: 0 | M116: 0 | N116: =RC[15]+RC[16]+RC[17]+RC[18]+RC[19]+RC[20] -> 0 | O116: 0 | P116: 0 | Q116: 2334706 | R116: 0 | S116: 0 | T116: 0 | U116: 23347.06 | V116: 0 | W116: 2311358.94 | X116: 0 | Y116: 0 | Z116: 0 | AA116: 0 | AB116: 0 | AC116: 0 | AD116: 0 | AE116: 0 | AF116: 0 | AG116: 0 | AH116: 0 | AI116: 0 | AJ116: 2334706 | AK116: 0 | AL116: 0 | AM116: 0 | AN116: 0 | AO116: 0 | AP116: 0 | AQ116: 0 | AR116: =1 -> 1 | AS116: 0 | AT116: 0 | AU116: =RC[-30]-RC[-29]-RC[-28]-RC[-27]-RC[-26]-RC[-25] -> 2311358.94 | AV116: 0 | AW116: =RC[1]-RC[2] -> 0 | AX116: 0 | AY116: 0 | AZ116: =RC[-46] -> 2334706 | BA116: =RC[-46] -> 0 | BB116: =RC[-46] -> 0 | BC116: =RC[-46] -> 0 | BD116: =RC[-46] -> 0 | BE116: =RC[-46] -> 0 | BF116: =RC[-46] -> 0 | BG116: =RC[-46] -> 0 | BH116: =RC[-46] -> 0 | BI116: =RC[-46] -> 0 | BJ116: =RC[-46] -> 0 | BK116: =RC[-46] -> 2334706 | BL116: =RC[-46] -> 0 | BM116: =RC[-46] -> 0 | BN116: =RC[-46] -> 0 | BO116: =RC[-46] -> 23347.06 | BP116: =RC[-46] -> 0 | BQ116: =RC[-46] -> 2311358.94 | BR116: =RC[-46] -> 0 | BS116: =RC[-46] -> 0 | BT116: =RC[-46] -> 0 | BU116: =RC[-46] -> 0 | BV116: =RC[-46] -> 0 | BW116: =RC[-46] -> 0 | BX116: =RC[-46] -> 0 | BY116: =RC[-46] -> 0 | BZ116: =RC[-46] -> 0 | CA116: =RC[-46] -> 0 | CB116: =RC[-46] -> 0 | CC116: =RC[-46] -> 0 | CD116: =RC[-46] -> 2334706 | CE116: =RC[-46] -> 0 | CF116: =RC[-46] -> 0 | CG116: =RC[-46] -> 0 | CH116: =RC[-46] -> 0 | CI116: =RC[-46] -> 0 | CJ116: =RC[-46] -> 0 | CK116: =RC[-46] -> 0 | CL116: =RC[-46] -> 1 | CM116: =RC[-46] -> 0 | CN116: =RC[-46] -> 0 | CO116: =RC[-46] -> 2311358.94 | CP116: =RC[-46] -> 0 | CQ116: =RC[-46] -> 0 | CR116: =RC[-46] -> 0 | CS116: =RC[-46] -> 0
A117: 26 | B117: 011108 | C117: Phạm Thùy Dung | D117: NV PVHK | E117: 19026970110011 | F117: =RC[29]+RC[30]+RC[31]+RC[32]+RC[33]+RC[34]+RC[35]+RC[36]+RC[37] -> 2156685 | G117: =RC[17]+RC[18]++RC[19]+RC[20]+RC[21]+RC[38]+RC[39]+RC[41] -> 0 | H117: 0 | I117: 0 | J117: =RC[-2]+RC[-1] -> 0 | K117: 0 | L117: 0 | M117: 0 | N117: =RC[15]+RC[16]+RC[17]+RC[18]+RC[19]+RC[20] -> 0 | O117: 0 | P117: 0 | Q117: 2156685 | R117: 0 | S117: 0 | T117: 0 | U117: 21566.85 | V117: 0 | W117: 2135118.15 | X117: 0 | Y117: 0 | Z117: 0 | AA117: 0 | AB117: 0 | AC117: 0 | AD117: 0 | AE117: 0 | AF117: 0 | AG117: 0 | AH117: 0 | AI117: 0 | AJ117: 2156685 | AK117: 0 | AL117: 0 | AM117: 0 | AN117: 0 | AO117: 0 | AP117: 0 | AQ117: 0 | AR117: =1 -> 1 | AS117: 0 | AT117: 0 | AU117: =RC[-30]-RC[-29]-RC[-28]-RC[-27]-RC[-26]-RC[-25] -> 2135118.15 | AV117: 0 | AW117: =RC[1]-RC[2] -> 0 | AX117: 0 | AY117: 0 | AZ117: =RC[-46] -> 2156685 | BA117: =RC[-46] -> 0 | BB117: =RC[-46] -> 0 | BC117: =RC[-46] -> 0 | BD117: =RC[-46] -> 0 | BE117: =RC[-46] -> 0 | BF117: =RC[-46] -> 0 | BG117: =RC[-46] -> 0 | BH117: =RC[-46] -> 0 | BI117: =RC[-46] -> 0 | BJ117: =RC[-46] -> 0 | BK117: =RC[-46] -> 2156685 | BL117: =RC[-46] -> 0 | BM117: =RC[-46] -> 0 | BN117: =RC[-46] -> 0 | BO117: =RC[-46] -> 21566.85 | BP117: =RC[-46] -> 0 | BQ117: =RC[-46] -> 2135118.15 | BR117: =RC[-46] -> 0 | BS117: =RC[-46] -> 0 | BT117: =RC[-46] -> 0 | BU117: =RC[-46] -> 0 | BV117: =RC[-46] -> 0 | BW117: =RC[-46] -> 0 | BX117: =RC[-46] -> 0 | BY117: =RC[-46] -> 0 | BZ117: =RC[-46] -> 0 | CA117: =RC[-46] -> 0 | CB117: =RC[-46] -> 0 | CC117: =RC[-46] -> 0 | CD117: =RC[-46] -> 2156685 | CE117: =RC[-46] -> 0 | CF117: =RC[-46] -> 0 | CG117: =RC[-46] -> 0 | CH117: =RC[-46] -> 0 | CI117: =RC[-46] -> 0 | CJ117: =RC[-46] -> 0 | CK117: =RC[-46] -> 0 | CL117: =RC[-46] -> 1 | CM117: =RC[-46] -> 0 | CN117: =RC[-46] -> 0 | CO117: =RC[-46] -> 2135118.15 | CP117: =RC[-46] -> 0 | CQ117: =RC[-46] -> 0 | CR117: =RC[-46] -> 0 | CS117: =RC[-46] -> 0
A118: 27 | B118: 011109 | C118: Phạm Thành Việt | D118: NV PVHK | E118: 10523001015010 | F118: =RC[29]+RC[30]+RC[31]+RC[32]+RC[33]+RC[34]+RC[35]+RC[36]+RC[37] -> 4669413 | G118: =RC[17]+RC[18]++RC[19]+RC[20]+RC[21]+RC[38]+RC[39]+RC[41] -> 0 | H118: 0 | I118: 0 | J118: =RC[-2]+RC[-1] -> 0 | K118: 0 | L118: 680000 | M118: 241500 | N118: =RC[15]+RC[16]+RC[17]+RC[18]+RC[19]+RC[20] -> 242308 | O118: 0 | P118: 0 | Q118: 5833221 | R118: 184000 | S118: 34500 | T118: 23000 | U118: 55917.21 | V118: 0 | W118: 5535803.79 | X118: 0 | Y118: 0 | Z118: 0 | AA118: 0 | AB118: 0 | AC118: 0 | AD118: 0 | AE118: 0 | AF118: 0 | AG118: 0 | AH118: 242308 | AI118: 4669413 | AJ118: 0 | AK118: 0 | AL118: 0 | AM118: 0 | AN118: 0 | AO118: 0 | AP118: 0 | AQ118: 0 | AR118: =1 -> 1 | AS118: 0 | AT118: 0 | AU118: =RC[-30]-RC[-29]-RC[-28]-RC[-27]-RC[-26]-RC[-25] -> 5535803.79 | AV118: 0 | AW118: =RC[1]-RC[2] -> 80769.333000000013 | AX118: 242308 | AY118: 161538.66699999999 | AZ118: =RC[-46] -> 4669413 | BA118: =RC[-46] -> 0 | BB118: =RC[-46] -> 0 | BC118: =RC[-46] -> 0 | BD118: =RC[-46] -> 0 | BE118: =RC[-46] -> 0 | BF118: =RC[-46] -> 680000 | BG118: =RC[-46] -> 241500 | BH118: =RC[-46] -> 242308 | BI118: =RC[-46] -> 0 | BJ118: =RC[-46] -> 0 | BK118: =RC[-46] -> 5833221 | BL118: =RC[-46] -> 184000 | BM118: =RC[-46] -> 34500 | BN118: =RC[-46] -> 23000 | BO118: =RC[-46] -> 55917.21 | BP118: =RC[-46] -> 0 | BQ118: =RC[-46] -> 5535803.79 | BR118: =RC[-46] -> 0 | BS118: =RC[-46] -> 0 | BT118: =RC[-46] -> 0 | BU118: =RC[-46] -> 0 | BV118: =RC[-46] -> 0 | BW118: =RC[-46] -> 0 | BX118: =RC[-46] -> 0 | BY118: =RC[-46] -> 0 | BZ118: =RC[-46] -> 0 | CA118: =RC[-46] -> 0 | CB118: =RC[-46] -> 242308 | CC118: =RC[-46] -> 4669413 | CD118: =RC[-46] -> 0 | CE118: =RC[-46] -> 0 | CF118: =RC[-46] -> 0 | CG118: =RC[-46] -> 0 | CH118: =RC[-46] -> 0 | CI118: =RC[-46] -> 0 | CJ118: =RC[-46] -> 0 | CK118: =RC[-46] -> 0 | CL118: =RC[-46] -> 1 | CM118: =RC[-46] -> 0 | CN118: =RC[-46] -> 0 | CO118: =RC[-46] -> 5535803.79 | CP118: =RC[-46] -> 0 | CQ118: =RC[-46] -> 80769.333000000013 | CR118: =RC[-46] -> 242308 | CS118: =RC[-46] -> 161538.66699999999
A119: 28 | B119: 011766 | C119: Nguyễn Thị Vân | D119: NV PVHK | E119: 19020859610015 | F119: =RC[29]+RC[30]+RC[31]+RC[32]+RC[33]+RC[34]+RC[35]+RC[36]+RC[37] -> 2334706 | G119: =RC[17]+RC[18]++RC[19]+RC[20]+RC[21]+RC[38]+RC[39]+RC[41] -> 0 | H119: 0 | I119: 0 | J119: =RC[-2]+RC[-1] -> 0 | K119: 0 | L119: 0 | M119: 0 | N119: =RC[15]+RC[16]+RC[17]+RC[18]+RC[19]+RC[20] -> 0 | O119: 0 | P119: 0 | Q119: 2334706 | R119: 0 | S119: 0 | T119: 0 | U119: 23347.06 | V119: 0 | W119: 2311358.94 | X119: 0 | Y119: 0 | Z119: 0 | AA119: 0 | AB119: 0 | AC119: 0 | AD119: 0 | AE119: 0 | AF119: 0 | AG119: 0 | AH119: 0 | AI119: 0 | AJ119: 2334706 | AK119: 0 | AL119: 0 | AM119: 0 | AN119: 0 | AO119: 0 | AP119: 0 | AQ119: 0 | AR119: =1 -> 1 | AS119: 0 | AT119: 0 | AU119: =RC[-30]-RC[-29]-RC[-28]-RC[-27]-RC[-26]-RC[-25] -> 2311358.94 | AV119: 0 | AW119: =RC[1]-RC[2] -> 0 | AX119: 0 | AY119: 0 | AZ119: =RC[-46] -> 2334706 | BA119: =RC[-46] -> 0 | BB119: =RC[-46] -> 0 | BC119: =RC[-46] -> 0 | BD119: =RC[-46] -> 0 | BE119: =RC[-46] -> 0 | BF119: =RC[-46] -> 0 | BG119: =RC[-46] -> 0 | BH119: =RC[-46] -> 0 | BI119: =RC[-46] -> 0 | BJ119: =RC[-46] -> 0 | BK119: =RC[-46] -> 2334706 | BL119: =RC[-46] -> 0 | BM119: =RC[-46] -> 0 | BN119: =RC[-46] -> 0 | BO119: =RC[-46] -> 23347.06 | BP119: =RC[-46] -> 0 | BQ119: =RC[-46] -> 2311358.94 | BR119: =RC[-46] -> 0 | BS119: =RC[-46] -> 0 | BT119: =RC[-46] -> 0 | BU119: =RC[-46] -> 0 | BV119: =RC[-46] -> 0 | BW119: =RC[-46] -> 0 | BX119: =RC[-46] -> 0 | BY119: =RC[-46] -> 0 | BZ119: =RC[-46] -> 0 | CA119: =RC[-46] -> 0 | CB119: =RC[-46] -> 0 | CC119: =RC[-46] -> 0 | CD119: =RC[-46] -> 2334706 | CE119: =RC[-46] -> 0 | CF119: =RC[-46] -> 0 | CG119: =RC[-46] -> 0 | CH119: =RC[-46] -> 0 | CI119: =RC[-46] -> 0 | CJ119: =RC[-46] -> 0 | CK119: =RC[-46] -> 0 | CL119: =RC[-46] -> 1 | CM119: =RC[-46] -> 0 | CN119: =RC[-46] -> 0 | CO119: =RC[-46] -> 2311358.94 | CP119: =RC[-46] -> 0 | CQ119: =RC[-46] -> 0 | CR119: =RC[-46] -> 0 | CS119: =RC[-46] -> 0
A120: 29 | B120: 013096 | C120: Đinh Văn Long | D120: NV PVHK | E120: 19028834682012 | F120: =RC[29]+RC[30]+RC[31]+RC[32]+RC[33]+RC[34]+RC[35]+RC[36]+RC[37] -> 3268589 | G120: =RC[17]+RC[18]++RC[19]+RC[20]+RC[21]+RC[38]+RC[39]+RC[41] -> 0 | H120: 0 | I120: 0 | J120: =RC[-2]+RC[-1] -> 0 | K120: 0 | L120: 680000 | M120: 0 | N120: =RC[15]+RC[16]+RC[17]+RC[18]+RC[19]+RC[20] -> 0 | O120: 0 | P120: 0 | Q120: 3948589 | R120: 0 | S120: 0 | T120: 0 | U120: 39485.89 | V120: 0 | W120: 3909103.11 | X120: 0 | Y120: 0 | Z120: 0 | AA120: 0 | AB120: 0 | AC120: 0 | AD120: 0 | AE120: 0 | AF120: 0 | AG120: 0 | AH120: 0 | AI120: 3268589 | AJ120: 0 | AK120: 0 | AL120: 0 | AM120: 0 | AN120: 0 | AO120: 0 | AP120: 0 | AQ120: 0 | AR120: =1 -> 1 | AS120: 0 | AT120: 0 | AU120: =RC[-30]-RC[-29]-RC[-28]-RC[-27]-RC[-26]-RC[-25] -> 3909103.11 | AV120: 0 | AW120: =RC[1]-RC[2] -> 0 | AX120: 0 | AY120: 0 | AZ120: =RC[-46] -> 3268589 | BA120: =RC[-46] -> 0 | BB120: =RC[-46] -> 0 | BC120: =RC[-46] -> 0 | BD120: =RC[-46] -> 0 | BE120: =RC[-46] -> 0 | BF120: =RC[-46] -> 680000 | BG120: =RC[-46] -> 0 | BH120: =RC[-46] -> 0 | BI120: =RC[-46] -> 0 | BJ120: =RC[-46] -> 0 | BK120: =RC[-46] -> 3948589 | BL120: =RC[-46] -> 0 | BM120: =RC[-46] -> 0 | BN120: =RC[-46] -> 0 | BO120: =RC[-46] -> 39485.89 | BP120: =RC[-46] -> 0 | BQ120: =RC[-46] -> 3909103.11 | BR120: =RC[-46] -> 0 | BS120: =RC[-46] -> 0 | BT120: =RC[-46] -> 0 | BU120: =RC[-46] -> 0 | BV120: =RC[-46] -> 0 | BW120: =RC[-46] -> 0 | BX120: =RC[-46] -> 0 | BY120: =RC[-46] -> 0 | BZ120: =RC[-46] -> 0 | CA120: =RC[-46] -> 0 | CB120: =RC[-46] -> 0 | CC120: =RC[-46] -> 3268589 | CD120: =RC[-46] -> 0 | CE120: =RC[-46] -> 0 | CF120: =RC[-46] -> 0 | CG120: =RC[-46] -> 0 | CH120: =RC[-46] -> 0 | CI120: =RC[-46] -> 0 | CJ120: =RC[-46] -> 0 | CK120: =RC[-46] -> 0 | CL120: =RC[-46] -> 1 | CM120: =RC[-46] -> 0 | CN120: =RC[-46] -> 0 | CO120: =RC[-46] -> 3909103.11 | CP120: =RC[-46] -> 0 | CQ120: =RC[-46] -> 0 | CR120: =RC[-46] -> 0 | CS120: =RC[-46] -> 0
A121: 30 | B121: 010778 | C121: Nguyễn Thị Hồng Anh | D121: Nv VS MB | E121: 10523608693018 | F121: =RC[29]+RC[30]+RC[31]+RC[32]+RC[33]+RC[34]+RC[35]+RC[36]+RC[37] -> 4552678 | G121: =RC[17]+RC[18]++RC[19]+RC[20]+RC[21]+RC[38]+RC[39]+RC[41] -> 0 | H121: 0 | I121: 0 | J121: =RC[-2]+RC[-1] -> 0 | K121: 0 | L121: 680000 | M121: 231840 | N121: =RC[15]+RC[16]+RC[17]+RC[18]+RC[19]+RC[20] -> 232615 | O121: 0 | P121: 0 | Q121: 5697133 | R121: 176640 | S121: 33120 | T121: 22080 | U121: 54652.93 | V121: 0 | W121: 5410640.0700000003 | X121: 0 | Y121: 0 | Z121: 0 | AA121: 0 | AB121: 0 | AC121: 0 | AD121: 0 | AE121: 0 | AF121: 0 | AG121: 0 | AH121: 232615 | AI121: 4552678 | AJ121: 0 | AK121: 0 | AL121: 0 | AM121: 0 | AN121: 0 | AO121: 0 | AP121: 0 | AQ121: 0 | AR121: =1 -> 1 | AS121: 0 | AT121: 0 | AU121: =RC[-30]-RC[-29]-RC[-28]-RC[-27]-RC[-26]-RC[-25] -> 5410640.0700000003 | AV121: 0 | AW121: =RC[1]-RC[2] -> 77538.333000000013 | AX121: 232615 | AY121: 155076.66699999999 | AZ121: =RC[-46] -> 4552678 | BA121: =RC[-46] -> 0 | BB121: =RC[-46] -> 0 | BC121: =RC[-46] -> 0 | BD121: =RC[-46] -> 0 | BE121: =RC[-46] -> 0 | BF121: =RC[-46] -> 680000 | BG121: =RC[-46] -> 231840 | BH121: =RC[-46] -> 232615 | BI121: =RC[-46] -> 0 | BJ121: =RC[-46] -> 0 | BK121: =RC[-46] -> 5697133 | BL121: =RC[-46] -> 176640 | BM121: =RC[-46] -> 33120 | BN121: =RC[-46] -> 22080 | BO121: =RC[-46] -> 54652.93 | BP121: =RC[-46] -> 0 | BQ121: =RC[-46] -> 5410640.0700000003 | BR121: =RC[-46] -> 0 | BS121: =RC[-46] -> 0 | BT121: =RC[-46] -> 0 | BU121: =RC[-46] -> 0 | BV121: =RC[-46] -> 0 | BW121: =RC[-46] -> 0 | BX121: =RC[-46] -> 0 | BY121: =RC[-46] -> 0 | BZ121: =RC[-46] -> 0 | CA121: =RC[-46] -> 0 | CB121: =RC[-46] -> 232615 | CC121: =RC[-46] -> 4552678 | CD121: =RC[-46] -> 0 | CE121: =RC[-46] -> 0 | CF121: =RC[-46] -> 0 | CG121: =RC[-46] -> 0 | CH121: =RC[-46] -> 0 | CI121: =RC[-46] -> 0 | CJ121: =RC[-46] -> 0 | CK121: =RC[-46] -> 0 | CL121: =RC[-46] -> 1 | CM121: =RC[-46] -> 0 | CN121: =RC[-46] -> 0 | CO121: =RC[-46] -> 5410640.0700000003 | CP121: =RC[-46] -> 0 | CQ121: =RC[-46] -> 77538.333000000013 | CR121: =RC[-46] -> 232615 | CS121: =RC[-46] -> 155076.66699999999
A122: Đội phục vụ hành khách đến (HGS) | F122: =SUM(R[-30]C:R[-1]C) -> 134196010 | G122: =SUM(R[-30]C:R[-1]C) -> 1510385 | H122: =SUM(R[-30]C:R[-1]C) -> 0 | I122: =SUM(R[-30]C:R[-1]C) -> 0 | J122: =SUM(R[-30]C:R[-1]C) -> 0 | K122: =SUM(R[-30]C:R[-1]C) -> 525000 | L122: =SUM(R[-30]C:R[-1]C) -> 15875384 | M122: =SUM(R[-30]C:R[-1]C) -> 6097876 | N122: =SUM(R[-30]C:R[-1]C) -> 5299275 | O122: =SUM(R[-30]C:R[-1]C) -> 0 | P122: =SUM(R[-30]C:R[-1]C) -> 0 | Q122: =SUM(R[-30]C:R[-1]C) -> 163503930 | R122: =SUM(R[-30]C:R[-1]C) -> 4646000 | S122: =SUM(R[-30]C:R[-1]C) -> 871126 | T122: =SUM(R[-30]C:R[-1]C) -> 580750 | U122: =SUM(R[-30]C:R[-1]C) -> 1574060.5399999998 | V122: =SUM(R[-30]C:R[-1]C) -> 0 | W122: =SUM(R[-30]C:R[-1]C) -> 155831993.46000004 | X122: =SUM(R[-30]C:R[-1]C) -> 0 | Y122: =SUM(R[-30]C:R[-1]C) -> 1510385 | Z122: =SUM(R[-30]C:R[-1]C) -> 0 | AA122: =SUM(R[-30]C:R[-1]C) -> 0 | AB122: =SUM(R[-30]C:R[-1]C) -> 0 | AC122: =SUM(R[-30]C:R[-1]C) -> 0 | AD122: =SUM(R[-30]C:R[-1]C) -> 0 | AE122: =SUM(R[-30]C:R[-1]C) -> 0 | AF122: =SUM(R[-30]C:R[-1]C) -> 0 | AG122: =SUM(R[-30]C:R[-1]C) -> 0 | AH122: =SUM(R[-30]C:R[-1]C) -> 5299275 | AI122: =SUM(R[-30]C:R[-1]C) -> 119668300 | AJ122: =SUM(R[-30]C:R[-1]C) -> 14527710 | AK122: =SUM(R[-30]C:R[-1]C) -> 0 | AL122: =SUM(R[-30]C:R[-1]C) -> 0 | AM122: =SUM(R[-30]C:R[-1]C) -> 0 | AN122: =SUM(R[-30]C:R[-1]C) -> 0 | AO122: =SUM(R[-30]C:R[-1]C) -> 0 | AP122: =SUM(R[-30]C:R[-1]C) -> 0 | AQ122: =SUM(R[-30]C:R[-1]C) -> 0 | AR122: =SUM(R[-30]C:R[-1]C) -> 30 | AS122: =SUM(R[-30]C:R[-1]C) -> 0 | AT122: =SUM(R[-30]C:R[-1]C) -> 0 | AU122: =SUM(R[-30]C:R[-1]C) -> 155831993.46000004 | AV122: =SUM(R[-30]C:R[-1]C) -> 0 | AW122: =SUM(R[-30]C:R[-1]C) -> 1766424.9970000004 | AX122: =SUM(R[-30]C:R[-1]C) -> 5299275 | AY122: =SUM(R[-30]C:R[-1]C) -> 3532850.0029999996
A123: Đội phục vụ hành khách đi (HGS) | F123: =R[3]C -> 5749215 | G123: =R[3]C -> 0 | H123: =R[3]C -> 0 | I123: =R[3]C -> 0 | J123: =R[3]C -> 0 | K123: =R[3]C -> 0 | L123: =R[3]C -> 836923 | M123: =R[3]C -> 241500 | N123: =R[3]C -> 242308 | O123: =R[3]C -> 0 | P123: =R[3]C -> 0 | Q123: =R[3]C -> 7069946 | R123: =R[3]C -> 184000 | S123: =R[3]C -> 34500 | T123: =R[3]C -> 23000 | U123: =R[3]C -> 68284.459999999992 | V123: =R[3]C -> 0 | W123: =R[3]C -> 6760161.54 | X123: =R[3]C -> 0 | Y123: =R[3]C -> 0 | Z123: =R[3]C -> 0 | AA123: =R[3]C -> 0 | AB123: =R[3]C -> 0 | AC123: =R[3]C -> 0 | AD123: =R[3]C -> 0 | AE123: =R[3]C -> 0 | AF123: =R[3]C -> 0 | AG123: =R[3]C -> 0 | AH123: =R[3]C -> 242308 | AI123: =R[3]C -> 5749215 | AJ123: =R[3]C -> 0 | AK123: =R[3]C -> 0 | AL123: =R[3]C -> 0 | AM123: =R[3]C -> 0 | AN123: =R[3]C -> 0 | AO123: =R[3]C -> 0 | AP123: =R[3]C -> 0 | AQ123: =R[3]C -> 0 | AR123: =R[3]C -> 2 | AS123: =R[3]C -> 0 | AT123: =R[3]C -> 0 | AU123: =R[3]C -> 6760161.54 | AW123: =R[3]C -> 80769.333000000013 | AX123: =R[3]C -> 242308 | AY123: =R[3]C -> 161538.66699999999
A124: 1 | B124: 012554 | C124: Ngô Thị Tuyết Nhung | D124: Nhân viên phục vụ hành khách hàng hóa | E124: 19028385480019 | F124: =RC[29]+RC[30]+RC[31]+RC[32]+RC[33]+RC[34]+RC[35]+RC[36]+RC[37] -> 1079802 | G124: =RC[17]+RC[18]++RC[19]+RC[20]+RC[21]+RC[38]+RC[39]+RC[41] -> 0 | H124: 0 | I124: 0 | J124: =RC[-2]+RC[-1] -> 0 | K124: 0 | L124: 156923 | M124: 0 | N124: =RC[15]+RC[16]+RC[17]+RC[18]+RC[19]+RC[20] -> 0 | O124: 0 | P124: 0 | Q124: 1236725 | R124: 0 | S124: 0 | T124: 0 | U124: 12367.25 | V124: 0 | W124: 1224357.75 | X124: 0 | Y124: 0 | Z124: 0 | AA124: 0 | AB124: 0 | AC124: 0 | AD124: 0 | AE124: 0 | AF124: 0 | AG124: 0 | AH124: 0 | AI124: 1079802 | AJ124: 0 | AK124: 0 | AL124: 0 | AM124: 0 | AN124: 0 | AO124: 0 | AP124: 0 | AQ124: 0 | AR124: =1 -> 1 | AS124: 0 | AT124: 0 | AU124: =RC[-30]-RC[-29]-RC[-28]-RC[-27]-RC[-26]-RC[-25] -> 1224357.75 | AV124: 0 | AW124: =RC[1]-RC[2] -> 0 | AX124: 0 | AY124: 0 | AZ124: =RC[-46] -> 1079802 | BA124: =RC[-46] -> 0 | BB124: =RC[-46] -> 0 | BC124: =RC[-46] -> 0 | BD124: =RC[-46] -> 0 | BE124: =RC[-46] -> 0 | BF124: =RC[-46] -> 156923 | BG124: =RC[-46] -> 0 | BH124: =RC[-46] -> 0 | BI124: =RC[-46] -> 0 | BJ124: =RC[-46] -> 0 | BK124: =RC[-46] -> 1236725 | BL124: =RC[-46] -> 0 | BM124: =RC[-46] -> 0 | BN124: =RC[-46] -> 0 | BO124: =RC[-46] -> 12367.25 | BP124: =RC[-46] -> 0 | BQ124: =RC[-46] -> 1224357.75 | BR124: =RC[-46] -> 0 | BS124: =RC[-46] -> 0 | BT124: =RC[-46] -> 0 | BU124: =RC[-46] -> 0 | BV124: =RC[-46] -> 0 | BW124: =RC[-46] -> 0 | BX124: =RC[-46] -> 0 | BY124: =RC[-46] -> 0 | BZ124: =RC[-46] -> 0 | CA124: =RC[-46] -> 0 | CB124: =RC[-46] -> 0 | CC124: =RC[-46] -> 1079802 | CD124: =RC[-46] -> 0 | CE124: =RC[-46] -> 0 | CF124: =RC[-46] -> 0 | CG124: =RC[-46] -> 0 | CH124: =RC[-46] -> 0 | CI124: =RC[-46] -> 0 | CJ124: =RC[-46] -> 0 | CK124: =RC[-46] -> 0 | CL124: =RC[-46] -> 1 | CM124: =RC[-46] -> 0 | CN124: =RC[-46] -> 0 | CO124: =RC[-46] -> 1224357.75 | CP124: =RC[-46] -> 0 | CQ124: =RC[-46] -> 0 | CR124: =RC[-46] -> 0 | CS124: =RC[-46] -> 0
A125: 2 | B125: 011765 | C125: Hoàng Thị Hồng Nhung | D125: NV PVHK | E125: 19027522772018 | F125: =RC[29]+RC[30]+RC[31]+RC[32]+RC[33]+RC[34]+RC[35]+RC[36]+RC[37] -> 4669413 | G125: =RC[17]+RC[18]++RC[19]+RC[20]+RC[21]+RC[38]+RC[39]+RC[41] -> 0 | H125: 0 | I125: 0 | J125: =RC[-2]+RC[-1] -> 0 | K125: 0 | L125: 680000 | M125: 241500 | N125: =RC[15]+RC[16]+RC[17]+RC[18]+RC[19]+RC[20] -> 242308 | O125: 0 | P125: 0 | Q125: 5833221 | R125: 184000 | S125: 34500 | T125: 23000 | U125: 55917.21 | V125: 0 | W125: 5535803.79 | X125: 0 | Y125: 0 | Z125: 0 | AA125: 0 | AB125: 0 | AC125: 0 | AD125: 0 | AE125: 0 | AF125: 0 | AG125: 0 | AH125: 242308 | AI125: 4669413 | AJ125: 0 | AK125: 0 | AL125: 0 | AM125: 0 | AN125: 0 | AO125: 0 | AP125: 0 | AQ125: 0 | AR125: =1 -> 1 | AS125: 0 | AT125: 0 | AU125: =RC[-30]-RC[-29]-RC[-28]-RC[-27]-RC[-26]-RC[-25] -> 5535803.79 | AV125: 0 | AW125: =RC[1]-RC[2] -> 80769.333000000013 | AX125: 242308 | AY125: 161538.66699999999 | AZ125: =RC[-46] -> 4669413 | BA125: =RC[-46] -> 0 | BB125: =RC[-46] -> 0 | BC125: =RC[-46] -> 0 | BD125: =RC[-46] -> 0 | BE125: =RC[-46] -> 0 | BF125: =RC[-46] -> 680000 | BG125: =RC[-46] -> 241500 | BH125: =RC[-46] -> 242308 | BI125: =RC[-46] -> 0 | BJ125: =RC[-46] -> 0 | BK125: =RC[-46] -> 5833221 | BL125: =RC[-46] -> 184000 | BM125: =RC[-46] -> 34500 | BN125: =RC[-46] -> 23000 | BO125: =RC[-46] -> 55917.21 | BP125: =RC[-46] -> 0 | BQ125: =RC[-46] -> 5535803.79 | BR125: =RC[-46] -> 0 | BS125: =RC[-46] -> 0 | BT125: =RC[-46] -> 0 | BU125: =RC[-46] -> 0 | BV125: =RC[-46] -> 0 | BW125: =RC[-46] -> 0 | BX125: =RC[-46] -> 0 | BY125: =RC[-46] -> 0 | BZ125: =RC[-46] -> 0 | CA125: =RC[-46] -> 0 | CB125: =RC[-46] -> 242308 | CC125: =RC[-46] -> 4669413 | CD125: =RC[-46] -> 0 | CE125: =RC[-46] -> 0 | CF125: =RC[-46] -> 0 | CG125: =RC[-46] -> 0 | CH125: =RC[-46] -> 0 | CI125: =RC[-46] -> 0 | CJ125: =RC[-46] -> 0 | CK125: =RC[-46] -> 0 | CL125: =RC[-46] -> 1 | CM125: =RC[-46] -> 0 | CN125: =RC[-46] -> 0 | CO125: =RC[-46] -> 5535803.79 | CP125: =RC[-46] -> 0 | CQ125: =RC[-46] -> 80769.333000000013 | CR125: =RC[-46] -> 242308 | CS125: =RC[-46] -> 161538.66699999999
A126: Đội phục vụ hành khách đi (HGS) | F126: =SUM(R[-2]C:R[-1]C) -> 5749215 | G126: =SUM(R[-2]C:R[-1]C) -> 0 | H126: =SUM(R[-2]C:R[-1]C) -> 0 | I126: =SUM(R[-2]C:R[-1]C) -> 0 | J126: =SUM(R[-2]C:R[-1]C) -> 0 | K126: =SUM(R[-2]C:R[-1]C) -> 0 | L126: =SUM(R[-2]C:R[-1]C) -> 836923 | M126: =SUM(R[-2]C:R[-1]C) -> 241500 | N126: =SUM(R[-2]C:R[-1]C) -> 242308 | O126: =SUM(R[-2]C:R[-1]C) -> 0 | P126: =SUM(R[-2]C:R[-1]C) -> 0 | Q126: =SUM(R[-2]C:R[-1]C) -> 7069946 | R126: =SUM(R[-2]C:R[-1]C) -> 184000 | S126: =SUM(R[-2]C:R[-1]C) -> 34500 | T126: =SUM(R[-2]C:R[-1]C) -> 23000 | U126: =SUM(R[-2]C:R[-1]C) -> 68284.459999999992 | V126: =SUM(R[-2]C:R[-1]C) -> 0 | W126: =SUM(R[-2]C:R[-1]C) -> 6760161.54 | X126: =SUM(R[-2]C:R[-1]C) -> 0 | Y126: =SUM(R[-2]C:R[-1]C) -> 0 | Z126: =SUM(R[-2]C:R[-1]C) -> 0 | AA126: =SUM(R[-2]C:R[-1]C) -> 0 | AB126: =SUM(R[-2]C:R[-1]C) -> 0 | AC126: =SUM(R[-2]C:R[-1]C) -> 0 | AD126: =SUM(R[-2]C:R[-1]C) -> 0 | AE126: =SUM(R[-2]C:R[-1]C) -> 0 | AF126: =SUM(R[-2]C:R[-1]C) -> 0 | AG126: =SUM(R[-2]C:R[-1]C) -> 0 | AH126: =SUM(R[-2]C:R[-1]C) -> 242308 | AI126: =SUM(R[-2]C:R[-1]C) -> 5749215 | AJ126: =SUM(R[-2]C:R[-1]C) -> 0 | AK126: =SUM(R[-2]C:R[-1]C) -> 0 | AL126: =SUM(R[-2]C:R[-1]C) -> 0 | AM126: =SUM(R[-2]C:R[-1]C) -> 0 | AN126: =SUM(R[-2]C:R[-1]C) -> 0 | AO126: =SUM(R[-2]C:R[-1]C) -> 0 | AP126: =SUM(R[-2]C:R[-1]C) -> 0 | AQ126: =SUM(R[-2]C:R[-1]C) -> 0 | AR126: =SUM(R[-2]C:R[-1]C) -> 2 | AS126: =SUM(R[-2]C:R[-1]C) -> 0 | AT126: =SUM(R[-2]C:R[-1]C) -> 0 | AU126: =SUM(R[-2]C:R[-1]C) -> 6760161.54 | AV126: =SUM(R[-2]C:R[-1]C) -> 0 | AW126: =SUM(R[-2]C:R[-1]C) -> 80769.333000000013 | AX126: =SUM(R[-2]C:R[-1]C) -> 242308 | AY126: =SUM(R[-2]C:R[-1]C) -> 161538.66699999999
A127: Đội Phục Vụ Hành Khách Đi Nội Địa (HGS) | F127: =R[37]C -> 169009405 | G127: =R[37]C -> 0 | H127: =R[37]C -> 0 | I127: =R[37]C -> 0 | J127: =R[37]C -> 0 | K127: =R[37]C -> 525000 | L127: =R[37]C -> 22413846 | M127: =R[37]C -> 6159461 | N127: =R[37]C -> 5560969 | O127: =R[37]C -> 0 | P127: =R[37]C -> 0 | Q127: =R[37]C -> 203668681 | R127: =R[37]C -> 4876920 | S127: =R[37]C -> 914426 | T127: =R[37]C -> 609615 | U127: =R[37]C -> 1969243.6399999992 | V127: =R[37]C -> 0 | W127: =R[37]C -> 195298476.36000004 | X127: =R[37]C -> 0 | Y127: =R[37]C -> 0 | Z127: =R[37]C -> 0 | AA127: =R[37]C -> 0 | AB127: =R[37]C -> 0 | AC127: =R[37]C -> 0 | AD127: =R[37]C -> 0 | AE127: =R[37]C -> 0 | AF127: =R[37]C -> 0 | AG127: =R[37]C -> 0 | AH127: =R[37]C -> 5560969 | AI127: =R[37]C -> 164194073 | AJ127: =R[37]C -> 4815332 | AK127: =R[37]C -> 0 | AL127: =R[37]C -> 0 | AM127: =R[37]C -> 0 | AN127: =R[37]C -> 0 | AO127: =R[37]C -> 0 | AP127: =R[37]C -> 0 | AQ127: =R[37]C -> 0 | AR127: =R[37]C -> 36 | AS127: =R[37]C -> 0 | AT127: =R[37]C -> 0 | AU127: =R[37]C -> 195298476.36000004 | AW127: =R[37]C -> 1853656.3290000006 | AX127: =R[37]C -> 5560969 | AY127: =R[37]C -> 3707312.6709999992
A128: 1 | B128: 010631 | C128: Nguyễn Thị Phương Mai | D128: Đội trưởng | E128: 10520002785015 | F128: =RC[29]+RC[30]+RC[31]+RC[32]+RC[33]+RC[34]+RC[35]+RC[36]+RC[37] -> 11089856 | G128: =RC[17]+RC[18]++RC[19]+RC[20]+RC[21]+RC[38]+RC[39]+RC[41] -> 0 | H128: 0 | I128: 0 | J128: =RC[-2]+RC[-1] -> 0 | K128: 315000 | L128: 680000 | M128: 333270 | N128: =RC[15]+RC[16]+RC[17]+RC[18]+RC[19]+RC[20] -> 0 | O128: 0 | P128: 0 | Q128: 12418126 | R128: 253920 | S128: 47610 | T128: 31740 | U128: 115000 | V128: 0 | W128: 11969856 | X128: 0 | Y128: 0 | Z128: 0 | AA128: 0 | AB128: 0 | AC128: 0 | AD128: 0 | AE128: 0 | AF128: 0 | AG128: 0 | AH128: 0 | AI128: 11089856 | AJ128: 0 | AK128: 0 | AL128: 0 | AM128: 0 | AN128: 0 | AO128: 0 | AP128: 0 | AQ128: 0 | AR128: =1 -> 1 | AS128: 0 | AT128: 0 | AU128: =RC[-30]-RC[-29]-RC[-28]-RC[-27]-RC[-26]-RC[-25] -> 11969856 | AV128: 0 | AW128: =RC[1]-RC[2] -> 0 | AX128: 0 | AY128: 0 | AZ128: =RC[-46] -> 11089856 | BA128: =RC[-46] -> 0 | BB128: =RC[-46] -> 0 | BC128: =RC[-46] -> 0 | BD128: =RC[-46] -> 0 | BE128: =RC[-46] -> 315000 | BF128: =RC[-46] -> 680000 | BG128: =RC[-46] -> 333270 | BH128: =RC[-46] -> 0 | BI128: =RC[-46] -> 0 | BJ128: =RC[-46] -> 0 | BK128: =RC[-46] -> 12418126 | BL128: =RC[-46] -> 253920 | BM128: =RC[-46] -> 47610 | BN128: =RC[-46] -> 31740 | BO128: =RC[-46] -> 115000 | BP128: =RC[-46] -> 0 | BQ128: =RC[-46] -> 11969856 | BR128: =RC[-46] -> 0 | BS128: =RC[-46] -> 0 | BT128: =RC[-46] -> 0 | BU128: =RC[-46] -> 0 | BV128: =RC[-46] -> 0 | BW128: =RC[-46] -> 0 | BX128: =RC[-46] -> 0 | BY128: =RC[-46] -> 0 | BZ128: =RC[-46] -> 0 | CA128: =RC[-46] -> 0 | CB128: =RC[-46] -> 0 | CC128: =RC[-46] -> 11089856 | CD128: =RC[-46] -> 0 | CE128: =RC[-46] -> 0 | CF128: =RC[-46] -> 0 | CG128: =RC[-46] -> 0 | CH128: =RC[-46] -> 0 | CI128: =RC[-46] -> 0 | CJ128: =RC[-46] -> 0 | CK128: =RC[-46] -> 0 | CL128: =RC[-46] -> 1 | CM128: =RC[-46] -> 0 | CN128: =RC[-46] -> 0 | CO128: =RC[-46] -> 11969856 | CP128: =RC[-46] -> 0 | CQ128: =RC[-46] -> 0 | CR128: =RC[-46] -> 0 | CS128: =RC[-46] -> 0
A129: 2 | B129: 010630 | C129: Nguyễn Thị Thu Hương | D129: Đội phó | E129: 10522162047013 | F129: =RC[29]+RC[30]+RC[31]+RC[32]+RC[33]+RC[34]+RC[35]+RC[36]+RC[37] -> 9543113 | G129: =RC[17]+RC[18]++RC[19]+RC[20]+RC[21]+RC[38]+RC[39]+RC[41] -> 0 | H129: 0 | I129: 0 | J129: =RC[-2]+RC[-1] -> 0 | K129: 210000 | L129: 680000 | M129: 283763 | N129: =RC[15]+RC[16]+RC[17]+RC[18]+RC[19]+RC[20] -> 0 | O129: 0 | P129: 0 | Q129: 10716876 | R129: 216200 | S129: 40538 | T129: 27025 | U129: 104331.13 | V129: 0 | W129: 10328781.869999999 | X129: 0 | Y129: 0 | Z129: 0 | AA129: 0 | AB129: 0 | AC129: 0 | AD129: 0 | AE129: 0 | AF129: 0 | AG129: 0 | AH129: 0 | AI129: 9543113 | AJ129: 0 | AK129: 0 | AL129: 0 | AM129: 0 | AN129: 0 | AO129: 0 | AP129: 0 | AQ129: 0 | AR129: =1 -> 1 | AS129: 0 | AT129: 0 | AU129: =RC[-30]-RC[-29]-RC[-28]-RC[-27]-RC[-26]-RC[-25] -> 10328781.869999999 | AV129: 0 | AW129: =RC[1]-RC[2] -> 0 | AX129: 0 | AY129: 0 | AZ129: =RC[-46] -> 9543113 | BA129: =RC[-46] -> 0 | BB129: =RC[-46] -> 0 | BC129: =RC[-46] -> 0 | BD129: =RC[-46] -> 0 | BE129: =RC[-46] -> 210000 | BF129: =RC[-46] -> 680000 | BG129: =RC[-46] -> 283763 | BH129: =RC[-46] -> 0 | BI129: =RC[-46] -> 0 | BJ129: =RC[-46] -> 0 | BK129: =RC[-46] -> 10716876 | BL129: =RC[-46] -> 216200 | BM129: =RC[-46] -> 40538 | BN129: =RC[-46] -> 27025 | BO129: =RC[-46] -> 104331.13 | BP129: =RC[-46] -> 0 | BQ129: =RC[-46] -> 10328781.869999999 | BR129: =RC[-46] -> 0 | BS129: =RC[-46] -> 0 | BT129: =RC[-46] -> 0 | BU129: =RC[-46] -> 0 | BV129: =RC[-46] -> 0 | BW129: =RC[-46] -> 0 | BX129: =RC[-46] -> 0 | BY129: =RC[-46] -> 0 | BZ129: =RC[-46] -> 0 | CA129: =RC[-46] -> 0 | CB129: =RC[-46] -> 0 | CC129: =RC[-46] -> 9543113 | CD129: =RC[-46] -> 0 | CE129: =RC[-46] -> 0 | CF129: =RC[-46] -> 0 | CG129: =RC[-46] -> 0 | CH129: =RC[-46] -> 0 | CI129: =RC[-46] -> 0 | CJ129: =RC[-46] -> 0 | CK129: =RC[-46] -> 0 | CL129: =RC[-46] -> 1 | CM129: =RC[-46] -> 0 | CN129: =RC[-46] -> 0 | CO129: =RC[-46] -> 10328781.869999999 | CP129: =RC[-46] -> 0 | CQ129: =RC[-46] -> 0 | CR129: =RC[-46] -> 0 | CS129: =RC[-46] -> 0
A130: 3 | B130: 012549 | C130: Nguyễn Tuấn Linh | D130: Nhân viên phục vụ hành khách hàng hóa | E130: 19028385513014 | F130: =RC[29]+RC[30]+RC[31]+RC[32]+RC[33]+RC[34]+RC[35]+RC[36]+RC[37] -> 4669413 | G130: =RC[17]+RC[18]++RC[19]+RC[20]+RC[21]+RC[38]+RC[39]+RC[41] -> 0 | H130: 0 | I130: 0 | J130: =RC[-2]+RC[-1] -> 0 | K130: 0 | L130: 680000 | M130: 241500 | N130: =RC[15]+RC[16]+RC[17]+RC[18]+RC[19]+RC[20] -> 242308 | O130: 0 | P130: 0 | Q130: 5833221 | R130: 184000 | S130: 34500 | T130: 23000 | U130: 55917.21 | V130: 0 | W130: 5535803.79 | X130: 0 | Y130: 0 | Z130: 0 | AA130: 0 | AB130: 0 | AC130: 0 | AD130: 0 | AE130: 0 | AF130: 0 | AG130: 0 | AH130: 242308 | AI130: 4669413 | AJ130: 0 | AK130: 0 | AL130: 0 | AM130: 0 | AN130: 0 | AO130: 0 | AP130: 0 | AQ130: 0 | AR130: =1 -> 1 | AS130: 0 | AT130: 0 | AU130: =RC[-30]-RC[-29]-RC[-28]-RC[-27]-RC[-26]-RC[-25] -> 5535803.79 | AV130: 0 | AW130: =RC[1]-RC[2] -> 80769.333000000013 | AX130: 242308 | AY130: 161538.66699999999 | AZ130: =RC[-46] -> 4669413 | BA130: =RC[-46] -> 0 | BB130: =RC[-46] -> 0 | BC130: =RC[-46] -> 0 | BD130: =RC[-46] -> 0 | BE130: =RC[-46] -> 0 | BF130: =RC[-46] -> 680000 | BG130: =RC[-46] -> 241500 | BH130: =RC[-46] -> 242308 | BI130: =RC[-46] -> 0 | BJ130: =RC[-46] -> 0 | BK130: =RC[-46] -> 5833221 | BL130: =RC[-46] -> 184000 | BM130: =RC[-46] -> 34500 | BN130: =RC[-46] -> 23000 | BO130: =RC[-46] -> 55917.21 | BP130: =RC[-46] -> 0 | BQ130: =RC[-46] -> 5535803.79 | BR130: =RC[-46] -> 0 | BS130: =RC[-46] -> 0 | BT130: =RC[-46] -> 0 | BU130: =RC[-46] -> 0 | BV130: =RC[-46] -> 0 | BW130: =RC[-46] -> 0 | BX130: =RC[-46] -> 0 | BY130: =RC[-46] -> 0 | BZ130: =RC[-46] -> 0 | CA130: =RC[-46] -> 0 | CB130: =RC[-46] -> 242308 | CC130: =RC[-46] -> 4669413 | CD130: =RC[-46] -> 0 | CE130: =RC[-46] -> 0 | CF130: =RC[-46] -> 0 | CG130: =RC[-46] -> 0 | CH130: =RC[-46] -> 0 | CI130: =RC[-46] -> 0 | CJ130: =RC[-46] -> 0 | CK130: =RC[-46] -> 0 | CL130: =RC[-46] -> 1 | CM130: =RC[-46] -> 0 | CN130: =RC[-46] -> 0 | CO130: =RC[-46] -> 5535803.79 | CP130: =RC[-46] -> 0 | CQ130: =RC[-46] -> 80769.333000000013 | CR130: =RC[-46] -> 242308 | CS130: =RC[-46] -> 161538.66699999999
A131: 4 | B131: 012568 | C131: Nguyễn Thị Hồng Minh | D131: Nhân viên phục vụ hành khách hàng hóa | E131: 19028385493013 | F131: =RC[29]+RC[30]+RC[31]+RC[32]+RC[33]+RC[34]+RC[35]+RC[36]+RC[37] -> 4669413 | G131: =RC[17]+RC[18]++RC[19]+RC[20]+RC[21]+RC[38]+RC[39]+RC[41] -> 0 | H131: 0 | I131: 0 | J131: =RC[-2]+RC[-1] -> 0 | K131: 0 | L131: 680000 | M131: 241500 | N131: =RC[15]+RC[16]+RC[17]+RC[18]+RC[19]+RC[20] -> 242308 | O131: 0 | P131: 0 | Q131: 5833221 | R131: 184000 | S131: 34500 | T131: 23000 | U131: 55917.21 | V131: 0 | W131: 5535803.79 | X131: 0 | Y131: 0 | Z131: 0 | AA131: 0 | AB131: 0 | AC131: 0 | AD131: 0 | AE131: 0 | AF131: 0 | AG131: 0 | AH131: 242308 | AI131: 4669413 | AJ131: 0 | AK131: 0 | AL131: 0 | AM131: 0 | AN131: 0 | AO131: 0 | AP131: 0 | AQ131: 0 | AR131: =1 -> 1 | AS131: 0 | AT131: 0 | AU131: =RC[-30]-RC[-29]-RC[-28]-RC[-27]-RC[-26]-RC[-25] -> 5535803.79 | AV131: 0 | AW131: =RC[1]-RC[2] -> 80769.333000000013 | AX131: 242308 | AY131: 161538.66699999999 | AZ131: =RC[-46] -> 4669413 | BA131: =RC[-46] -> 0 | BB131: =RC[-46] -> 0 | BC131: =RC[-46] -> 0 | BD131: =RC[-46] -> 0 | BE131: =RC[-46] -> 0 | BF131: =RC[-46] -> 680000 | BG131: =RC[-46] -> 241500 | BH131: =RC[-46] -> 242308 | BI131: =RC[-46] -> 0 | BJ131: =RC[-46] -> 0 | BK131: =RC[-46] -> 5833221 | BL131: =RC[-46] -> 184000 | BM131: =RC[-46] -> 34500 | BN131: =RC[-46] -> 23000 | BO131: =RC[-46] -> 55917.21 | BP131: =RC[-46] -> 0 | BQ131: =RC[-46] -> 5535803.79 | BR131: =RC[-46] -> 0 | BS131: =RC[-46] -> 0 | BT131: =RC[-46] -> 0 | BU131: =RC[-46] -> 0 | BV131: =RC[-46] -> 0 | BW131: =RC[-46] -> 0 | BX131: =RC[-46] -> 0 | BY131: =RC[-46] -> 0 | BZ131: =RC[-46] -> 0 | CA131: =RC[-46] -> 0 | CB131: =RC[-46] -> 242308 | CC131: =RC[-46] -> 4669413 | CD131: =RC[-46] -> 0 | CE131: =RC[-46] -> 0 | CF131: =RC[-46] -> 0 | CG131: =RC[-46] -> 0 | CH131: =RC[-46] -> 0 | CI131: =RC[-46] -> 0 | CJ131: =RC[-46] -> 0 | CK131: =RC[-46] -> 0 | CL131: =RC[-46] -> 1 | CM131: =RC[-46] -> 0 | CN131: =RC[-46] -> 0 | CO131: =RC[-46] -> 5535803.79 | CP131: =RC[-46] -> 0 | CQ131: =RC[-46] -> 80769.333000000013 | CR131: =RC[-46] -> 242308 | CS131: =RC[-46] -> 161538.66699999999
A132: 5 | B132: 012571 | C132: Ngô Thị Diễm Quỳnh | D132: Nhân viên phục vụ hành khách hàng hóa | E132: 19028385545013 | F132: =RC[29]+RC[30]+RC[31]+RC[32]+RC[33]+RC[34]+RC[35]+RC[36]+RC[37] -> 4669413 | G132: =RC[17]+RC[18]++RC[19]+RC[20]+RC[21]+RC[38]+RC[39]+RC[41] -> 0 | H132: 0 | I132: 0 | J132: =RC[-2]+RC[-1] -> 0 | K132: 0 | L132: 680000 | M132: 241500 | N132: =RC[15]+RC[16]+RC[17]+RC[18]+RC[19]+RC[20] -> 242308 | O132: 0 | P132: 0 | Q132: 5833221 | R132: 184000 | S132: 34500 | T132: 23000 | U132: 55917.21 | V132: 0 | W132: 5535803.79 | X132: 0 | Y132: 0 | Z132: 0 | AA132: 0 | AB132: 0 | AC132: 0 | AD132: 0 | AE132: 0 | AF132: 0 | AG132: 0 | AH132: 242308 | AI132: 4669413 | AJ132: 0 | AK132: 0 | AL132: 0 | AM132: 0 | AN132: 0 | AO132: 0 | AP132: 0 | AQ132: 0 | AR132: =1 -> 1 | AS132: 0 | AT132: 0 | AU132: =RC[-30]-RC[-29]-RC[-28]-RC[-27]-RC[-26]-RC[-25] -> 5535803.79 | AV132: 0 | AW132: =RC[1]-RC[2] -> 80769.333000000013 | AX132: 242308 | AY132: 161538.66699999999 | AZ132: =RC[-46] -> 4669413 | BA132: =RC[-46] -> 0 | BB132: =RC[-46] -> 0 | BC132: =RC[-46] -> 0 | BD132: =RC[-46] -> 0 | BE132: =RC[-46] -> 0 | BF132: =RC[-46] -> 680000 | BG132: =RC[-46] -> 241500 | BH132: =RC[-46] -> 242308 | BI132: =RC[-46] -> 0 | BJ132: =RC[-46] -> 0 | BK132: =RC[-46] -> 5833221 | BL132: =RC[-46] -> 184000 | BM132: =RC[-46] -> 34500 | BN132: =RC[-46] -> 23000 | BO132: =RC[-46] -> 55917.21 | BP132: =RC[-46] -> 0 | BQ132: =RC[-46] -> 5535803.79 | BR132: =RC[-46] -> 0 | BS132: =RC[-46] -> 0 | BT132: =RC[-46] -> 0 | BU132: =RC[-46] -> 0 | BV132: =RC[-46] -> 0 | BW132: =RC[-46] -> 0 | BX132: =RC[-46] -> 0 | BY132: =RC[-46] -> 0 | BZ132: =RC[-46] -> 0 | CA132: =RC[-46] -> 0 | CB132: =RC[-46] -> 242308 | CC132: =RC[-46] -> 4669413 | CD132: =RC[-46] -> 0 | CE132: =RC[-46] -> 0 | CF132: =RC[-46] -> 0 | CG132: =RC[-46] -> 0 | CH132: =RC[-46] -> 0 | CI132: =RC[-46] -> 0 | CJ132: =RC[-46] -> 0 | CK132: =RC[-46] -> 0 | CL132: =RC[-46] -> 1 | CM132: =RC[-46] -> 0 | CN132: =RC[-46] -> 0 | CO132: =RC[-46] -> 5535803.79 | CP132: =RC[-46] -> 0 | CQ132: =RC[-46] -> 80769.333000000013 | CR132: =RC[-46] -> 242308 | CS132: =RC[-46] -> 161538.66699999999
A133: 6 | B133: 013370 | C133: Đinh Đức Điệp | D133: Nhân viên phục vụ hành khách hàng hóa | E133: 19027124776021 | F133: =RC[29]+RC[30]+RC[31]+RC[32]+RC[33]+RC[34]+RC[35]+RC[36]+RC[37] -> 3268589 | G133: =RC[17]+RC[18]++RC[19]+RC[20]+RC[21]+RC[38]+RC[39]+RC[41] -> 0 | H133: 0 | I133: 0 | J133: =RC[-2]+RC[-1] -> 0 | K133: 0 | L133: 680000 | M133: 0 | N133: =RC[15]+RC[16]+RC[17]+RC[18]+RC[19]+RC[20] -> 0 | O133: 0 | P133: 0 | Q133: 3948589 | R133: 0 | S133: 0 | T133: 0 | U133: 39485.89 | V133: 0 | W133: 3909103.11 | X133: 0 | Y133: 0 | Z133: 0 | AA133: 0 | AB133: 0 | AC133: 0 | AD133: 0 | AE133: 0 | AF133: 0 | AG133: 0 | AH133: 0 | AI133: 3268589 | AJ133: 0 | AK133: 0 | AL133: 0 | AM133: 0 | AN133: 0 | AO133: 0 | AP133: 0 | AQ133: 0 | AR133: =1 -> 1 | AS133: 0 | AT133: 0 | AU133: =RC[-30]-RC[-29]-RC[-28]-RC[-27]-RC[-26]-RC[-25] -> 3909103.11 | AV133: 0 | AW133: =RC[1]-RC[2] -> 0 | AX133: 0 | AY133: 0 | AZ133: =RC[-46] -> 3268589 | BA133: =RC[-46] -> 0 | BB133: =RC[-46] -> 0 | BC133: =RC[-46] -> 0 | BD133: =RC[-46] -> 0 | BE133: =RC[-46] -> 0 | BF133: =RC[-46] -> 680000 | BG133: =RC[-46] -> 0 | BH133: =RC[-46] -> 0 | BI133: =RC[-46] -> 0 | BJ133: =RC[-46] -> 0 | BK133: =RC[-46] -> 3948589 | BL133: =RC[-46] -> 0 | BM133: =RC[-46] -> 0 | BN133: =RC[-46] -> 0 | BO133: =RC[-46] -> 39485.89 | BP133: =RC[-46] -> 0 | BQ133: =RC[-46] -> 3909103.11 | BR133: =RC[-46] -> 0 | BS133: =RC[-46] -> 0 | BT133: =RC[-46] -> 0 | BU133: =RC[-46] -> 0 | BV133: =RC[-46] -> 0 | BW133: =RC[-46] -> 0 | BX133: =RC[-46] -> 0 | BY133: =RC[-46] -> 0 | BZ133: =RC[-46] -> 0 | CA133: =RC[-46] -> 0 | CB133: =RC[-46] -> 0 | CC133: =RC[-46] -> 3268589 | CD133: =RC[-46] -> 0 | CE133: =RC[-46] -> 0 | CF133: =RC[-46] -> 0 | CG133: =RC[-46] -> 0 | CH133: =RC[-46] -> 0 | CI133: =RC[-46] -> 0 | CJ133: =RC[-46] -> 0 | CK133: =RC[-46] -> 0 | CL133: =RC[-46] -> 1 | CM133: =RC[-46] -> 0 | CN133: =RC[-46] -> 0 | CO133: =RC[-46] -> 3909103.11 | CP133: =RC[-46] -> 0 | CQ133: =RC[-46] -> 0 | CR133: =RC[-46] -> 0 | CS133: =RC[-46] -> 0
A134: 7 | B134: 013372 | C134: Trần Thị Hoa Lý | D134: Nhân viên phục vụ hành khách hàng hóa | E134: 19028960245019 | F134: =RC[29]+RC[30]+RC[31]+RC[32]+RC[33]+RC[34]+RC[35]+RC[36]+RC[37] -> 3268589 | G134: =RC[17]+RC[18]++RC[19]+RC[20]+RC[21]+RC[38]+RC[39]+RC[41] -> 0 | H134: 0 | I134: 0 | J134: =RC[-2]+RC[-1] -> 0 | K134: 0 | L134: 680000 | M134: 0 | N134: =RC[15]+RC[16]+RC[17]+RC[18]+RC[19]+RC[20] -> 0 | O134: 0 | P134: 0 | Q134: 3948589 | R134: 0 | S134: 0 | T134: 0 | U134: 39485.89 | V134: 0 | W134: 3909103.11 | X134: 0 | Y134: 0 | Z134: 0 | AA134: 0 | AB134: 0 | AC134: 0 | AD134: 0 | AE134: 0 | AF134: 0 | AG134: 0 | AH134: 0 | AI134: 3268589 | AJ134: 0 | AK134: 0 | AL134: 0 | AM134: 0 | AN134: 0 | AO134: 0 | AP134: 0 | AQ134: 0 | AR134: =1 -> 1 | AS134: 0 | AT134: 0 | AU134: =RC[-30]-RC[-29]-RC[-28]-RC[-27]-RC[-26]-RC[-25] -> 3909103.11 | AV134: 0 | AW134: =RC[1]-RC[2] -> 0 | AX134: 0 | AY134: 0 | AZ134: =RC[-46] -> 3268589 | BA134: =RC[-46] -> 0 | BB134: =RC[-46] -> 0 | BC134: =RC[-46] -> 0 | BD134: =RC[-46] -> 0 | BE134: =RC[-46] -> 0 | BF134: =RC[-46] -> 680000 | BG134: =RC[-46] -> 0 | BH134: =RC[-46] -> 0 | BI134: =RC[-46] -> 0 | BJ134: =RC[-46] -> 0 | BK134: =RC[-46] -> 3948589 | BL134: =RC[-46] -> 0 | BM134: =RC[-46] -> 0 | BN134: =RC[-46] -> 0 | BO134: =RC[-46] -> 39485.89 | BP134: =RC[-46] -> 0 | BQ134: =RC[-46] -> 3909103.11 | BR134: =RC[-46] -> 0 | BS134: =RC[-46] -> 0 | BT134: =RC[-46] -> 0 | BU134: =RC[-46] -> 0 | BV134: =RC[-46] -> 0 | BW134: =RC[-46] -> 0 | BX134: =RC[-46] -> 0 | BY134: =RC[-46] -> 0 | BZ134: =RC[-46] -> 0 | CA134: =RC[-46] -> 0 | CB134: =RC[-46] -> 0 | CC134: =RC[-46] -> 3268589 | CD134: =RC[-46] -> 0 | CE134: =RC[-46] -> 0 | CF134: =RC[-46] -> 0 | CG134: =RC[-46] -> 0 | CH134: =RC[-46] -> 0 | CI134: =RC[-46] -> 0 | CJ134: =RC[-46] -> 0 | CK134: =RC[-46] -> 0 | CL134: =RC[-46] -> 1 | CM134: =RC[-46] -> 0 | CN134: =RC[-46] -> 0 | CO134: =RC[-46] -> 3909103.11 | CP134: =RC[-46] -> 0 | CQ134: =RC[-46] -> 0 | CR134: =RC[-46] -> 0 | CS134: =RC[-46] -> 0
A135: 8 | B135: 013376 | C135: Vũ Thùy Linh | D135: Nhân viên phục vụ hành khách hàng hóa | E135: 19028369955023 | F135: =RC[29]+RC[30]+RC[31]+RC[32]+RC[33]+RC[34]+RC[35]+RC[36]+RC[37] -> 3268589 | G135: =RC[17]+RC[18]++RC[19]+RC[20]+RC[21]+RC[38]+RC[39]+RC[41] -> 0 | H135: 0 | I135: 0 | J135: =RC[-2]+RC[-1] -> 0 | K135: 0 | L135: 680000 | M135: 0 | N135: =RC[15]+RC[16]+RC[17]+RC[18]+RC[19]+RC[20] -> 0 | O135: 0 | P135: 0 | Q135: 3948589 | R135: 0 | S135: 0 | T135: 0 | U135: 39485.89 | V135: 0 | W135: 3909103.11 | X135: 0 | Y135: 0 | Z135: 0 | AA135: 0 | AB135: 0 | AC135: 0 | AD135: 0 | AE135: 0 | AF135: 0 | AG135: 0 | AH135: 0 | AI135: 3268589 | AJ135: 0 | AK135: 0 | AL135: 0 | AM135: 0 | AN135: 0 | AO135: 0 | AP135: 0 | AQ135: 0 | AR135: =1 -> 1 | AS135: 0 | AT135: 0 | AU135: =RC[-30]-RC[-29]-RC[-28]-RC[-27]-RC[-26]-RC[-25] -> 3909103.11 | AV135: 0 | AW135: =RC[1]-RC[2] -> 0 | AX135: 0 | AY135: 0 | AZ135: =RC[-46] -> 3268589 | BA135: =RC[-46] -> 0 | BB135: =RC[-46] -> 0 | BC135: =RC[-46] -> 0 | BD135: =RC[-46] -> 0 | BE135: =RC[-46] -> 0 | BF135: =RC[-46] -> 680000 | BG135: =RC[-46] -> 0 | BH135: =RC[-46] -> 0 | BI135: =RC[-46] -> 0 | BJ135: =RC[-46] -> 0 | BK135: =RC[-46] -> 3948589 | BL135: =RC[-46] -> 0 | BM135: =RC[-46] -> 0 | BN135: =RC[-46] -> 0 | BO135: =RC[-46] -> 39485.89 | BP135: =RC[-46] -> 0 | BQ135: =RC[-46] -> 3909103.11 | BR135: =RC[-46] -> 0 | BS135: =RC[-46] -> 0 | BT135: =RC[-46] -> 0 | BU135: =RC[-46] -> 0 | BV135: =RC[-46] -> 0 | BW135: =RC[-46] -> 0 | BX135: =RC[-46] -> 0 | BY135: =RC[-46] -> 0 | BZ135: =RC[-46] -> 0 | CA135: =RC[-46] -> 0 | CB135: =RC[-46] -> 0 | CC135: =RC[-46] -> 3268589 | CD135: =RC[-46] -> 0 | CE135: =RC[-46] -> 0 | CF135: =RC[-46] -> 0 | CG135: =RC[-46] -> 0 | CH135: =RC[-46] -> 0 | CI135: =RC[-46] -> 0 | CJ135: =RC[-46] -> 0 | CK135: =RC[-46] -> 0 | CL135: =RC[-46] -> 1 | CM135: =RC[-46] -> 0 | CN135: =RC[-46] -> 0 | CO135: =RC[-46] -> 3909103.11 | CP135: =RC[-46] -> 0 | CQ135: =RC[-46] -> 0 | CR135: =RC[-46] -> 0 | CS135: =RC[-46] -> 0
A136: 9 | B136: 013377 | C136: Vũ Thị Bích Dung | D136: Nhân viên phục vụ hành khách hàng hóa | E136: 19028960285010 | F136: =RC[29]+RC[30]+RC[31]+RC[32]+RC[33]+RC[34]+RC[35]+RC[36]+RC[37] -> 3268589 | G136: =RC[17]+RC[18]++RC[19]+RC[20]+RC[21]+RC[38]+RC[39]+RC[41] -> 0 | H136: 0 | I136: 0 | J136: =RC[-2]+RC[-1] -> 0 | K136: 0 | L136: 680000 | M136: 0 | N136: =RC[15]+RC[16]+RC[17]+RC[18]+RC[19]+RC[20] -> 0 | O136: 0 | P136: 0 | Q136: 3948589 | R136: 0 | S136: 0 | T136: 0 | U136: 39485.89 | V136: 0 | W136: 3909103.11 | X136: 0 | Y136: 0 | Z136: 0 | AA136: 0 | AB136: 0 | AC136: 0 | AD136: 0 | AE136: 0 | AF136: 0 | AG136: 0 | AH136: 0 | AI136: 3268589 | AJ136: 0 | AK136: 0 | AL136: 0 | AM136: 0 | AN136: 0 | AO136: 0 | AP136: 0 | AQ136: 0 | AR136: =1 -> 1 | AS136: 0 | AT136: 0 | AU136: =RC[-30]-RC[-29]-RC[-28]-RC[-27]-RC[-26]-RC[-25] -> 3909103.11 | AV136: 0 | AW136: =RC[1]-RC[2] -> 0 | AX136: 0 | AY136: 0 | AZ136: =RC[-46] -> 3268589 | BA136: =RC[-46] -> 0 | BB136: =RC[-46] -> 0 | BC136: =RC[-46] -> 0 | BD136: =RC[-46] -> 0 | BE136: =RC[-46] -> 0 | BF136: =RC[-46] -> 680000 | BG136: =RC[-46] -> 0 | BH136: =RC[-46] -> 0 | BI136: =RC[-46] -> 0 | BJ136: =RC[-46] -> 0 | BK136: =RC[-46] -> 3948589 | BL136: =RC[-46] -> 0 | BM136: =RC[-46] -> 0 | BN136: =RC[-46] -> 0 | BO136: =RC[-46] -> 39485.89 | BP136: =RC[-46] -> 0 | BQ136: =RC[-46] -> 3909103.11 | BR136: =RC[-46] -> 0 | BS136: =RC[-46] -> 0 | BT136: =RC[-46] -> 0 | BU136: =RC[-46] -> 0 | BV136: =RC[-46] -> 0 | BW136: =RC[-46] -> 0 | BX136: =RC[-46] -> 0 | BY136: =RC[-46] -> 0 | BZ136: =RC[-46] -> 0 | CA136: =RC[-46] -> 0 | CB136: =RC[-46] -> 0 | CC136: =RC[-46] -> 3268589 | CD136: =RC[-46] -> 0 | CE136: =RC[-46] -> 0 | CF136: =RC[-46] -> 0 | CG136: =RC[-46] -> 0 | CH136: =RC[-46] -> 0 | CI136: =RC[-46] -> 0 | CJ136: =RC[-46] -> 0 | CK136: =RC[-46] -> 0 | CL136: =RC[-46] -> 1 | CM136: =RC[-46] -> 0 | CN136: =RC[-46] -> 0 | CO136: =RC[-46] -> 3909103.11 | CP136: =RC[-46] -> 0 | CQ136: =RC[-46] -> 0 | CR136: =RC[-46] -> 0 | CS136: =RC[-46] -> 0
A137: 10 | B137: 013378 | C137: Nguyễn Bảo Ngân | D137: Nhân viên phục vụ hành khách hàng hóa | E137: 19028960204010 | F137: =RC[29]+RC[30]+RC[31]+RC[32]+RC[33]+RC[34]+RC[35]+RC[36]+RC[37] -> 3268589 | G137: =RC[17]+RC[18]++RC[19]+RC[20]+RC[21]+RC[38]+RC[39]+RC[41] -> 0 | H137: 0 | I137: 0 | J137: =RC[-2]+RC[-1] -> 0 | K137: 0 | L137: 680000 | M137: 0 | N137: =RC[15]+RC[16]+RC[17]+RC[18]+RC[19]+RC[20] -> 0 | O137: 0 | P137: 0 | Q137: 3948589 | R137: 0 | S137: 0 | T137: 0 | U137: 39485.89 | V137: 0 | W137: 3909103.11 | X137: 0 | Y137: 0 | Z137: 0 | AA137: 0 | AB137: 0 | AC137: 0 | AD137: 0 | AE137: 0 | AF137: 0 | AG137: 0 | AH137: 0 | AI137: 3268589 | AJ137: 0 | AK137: 0 | AL137: 0 | AM137: 0 | AN137: 0 | AO137: 0 | AP137: 0 | AQ137: 0 | AR137: =1 -> 1 | AS137: 0 | AT137: 0 | AU137: =RC[-30]-RC[-29]-RC[-28]-RC[-27]-RC[-26]-RC[-25] -> 3909103.11 | AV137: 0 | AW137: =RC[1]-RC[2] -> 0 | AX137: 0 | AY137: 0 | AZ137: =RC[-46] -> 3268589 | BA137: =RC[-46] -> 0 | BB137: =RC[-46] -> 0 | BC137: =RC[-46] -> 0 | BD137: =RC[-46] -> 0 | BE137: =RC[-46] -> 0 | BF137: =RC[-46] -> 680000 | BG137: =RC[-46] -> 0 | BH137: =RC[-46] -> 0 | BI137: =RC[-46] -> 0 | BJ137: =RC[-46] -> 0 | BK137: =RC[-46] -> 3948589 | BL137: =RC[-46] -> 0 | BM137: =RC[-46] -> 0 | BN137: =RC[-46] -> 0 | BO137: =RC[-46] -> 39485.89 | BP137: =RC[-46] -> 0 | BQ137: =RC[-46] -> 3909103.11 | BR137: =RC[-46] -> 0 | BS137: =RC[-46] -> 0 | BT137: =RC[-46] -> 0 | BU137: =RC[-46] -> 0 | BV137: =RC[-46] -> 0 | BW137: =RC[-46] -> 0 | BX137: =RC[-46] -> 0 | BY137: =RC[-46] -> 0 | BZ137: =RC[-46] -> 0 | CA137: =RC[-46] -> 0 | CB137: =RC[-46] -> 0 | CC137: =RC[-46] -> 3268589 | CD137: =RC[-46] -> 0 | CE137: =RC[-46] -> 0 | CF137: =RC[-46] -> 0 | CG137: =RC[-46] -> 0 | CH137: =RC[-46] -> 0 | CI137: =RC[-46] -> 0 | CJ137: =RC[-46] -> 0 | CK137: =RC[-46] -> 0 | CL137: =RC[-46] -> 1 | CM137: =RC[-46] -> 0 | CN137: =RC[-46] -> 0 | CO137: =RC[-46] -> 3909103.11 | CP137: =RC[-46] -> 0 | CQ137: =RC[-46] -> 0 | CR137: =RC[-46] -> 0 | CS137: =RC[-46] -> 0
A138: 11 | B138: 013379 | C138: Nguyễn Thùy Linh | D138: Nhân viên phục vụ hành khách hàng hóa | E138: 19021868567013 | F138: =RC[29]+RC[30]+RC[31]+RC[32]+RC[33]+RC[34]+RC[35]+RC[36]+RC[37] -> 3268589 | G138: =RC[17]+RC[18]++RC[19]+RC[20]+RC[21]+RC[38]+RC[39]+RC[41] -> 0 | H138: 0 | I138: 0 | J138: =RC[-2]+RC[-1] -> 0 | K138: 0 | L138: 680000 | M138: 0 | N138: =RC[15]+RC[16]+RC[17]+RC[18]+RC[19]+RC[20] -> 0 | O138: 0 | P138: 0 | Q138: 3948589 | R138: 0 | S138: 0 | T138: 0 | U138: 39485.89 | V138: 0 | W138: 3909103.11 | X138: 0 | Y138: 0 | Z138: 0 | AA138: 0 | AB138: 0 | AC138: 0 | AD138: 0 | AE138: 0 | AF138: 0 | AG138: 0 | AH138: 0 | AI138: 3268589 | AJ138: 0 | AK138: 0 | AL138: 0 | AM138: 0 | AN138: 0 | AO138: 0 | AP138: 0 | AQ138: 0 | AR138: =1 -> 1 | AS138: 0 | AT138: 0 | AU138: =RC[-30]-RC[-29]-RC[-28]-RC[-27]-RC[-26]-RC[-25] -> 3909103.11 | AV138: 0 | AW138: =RC[1]-RC[2] -> 0 | AX138: 0 | AY138: 0 | AZ138: =RC[-46] -> 3268589 | BA138: =RC[-46] -> 0 | BB138: =RC[-46] -> 0 | BC138: =RC[-46] -> 0 | BD138: =RC[-46] -> 0 | BE138: =RC[-46] -> 0 | BF138: =RC[-46] -> 680000 | BG138: =RC[-46] -> 0 | BH138: =RC[-46] -> 0 | BI138: =RC[-46] -> 0 | BJ138: =RC[-46] -> 0 | BK138: =RC[-46] -> 3948589 | BL138: =RC[-46] -> 0 | BM138: =RC[-46] -> 0 | BN138: =RC[-46] -> 0 | BO138: =RC[-46] -> 39485.89 | BP138: =RC[-46] -> 0 | BQ138: =RC[-46] -> 3909103.11 | BR138: =RC[-46] -> 0 | BS138: =RC[-46] -> 0 | BT138: =RC[-46] -> 0 | BU138: =RC[-46] -> 0 | BV138: =RC[-46] -> 0 | BW138: =RC[-46] -> 0 | BX138: =RC[-46] -> 0 | BY138: =RC[-46] -> 0 | BZ138: =RC[-46] -> 0 | CA138: =RC[-46] -> 0 | CB138: =RC[-46] -> 0 | CC138: =RC[-46] -> 3268589 | CD138: =RC[-46] -> 0 | CE138: =RC[-46] -> 0 | CF138: =RC[-46] -> 0 | CG138: =RC[-46] -> 0 | CH138: =RC[-46] -> 0 | CI138: =RC[-46] -> 0 | CJ138: =RC[-46] -> 0 | CK138: =RC[-46] -> 0 | CL138: =RC[-46] -> 1 | CM138: =RC[-46] -> 0 | CN138: =RC[-46] -> 0 | CO138: =RC[-46] -> 3909103.11 | CP138: =RC[-46] -> 0 | CQ138: =RC[-46] -> 0 | CR138: =RC[-46] -> 0 | CS138: =RC[-46] -> 0
A139: 12 | B139: 013381 | C139: Phạm Thị Thanh Tú | D139: Nhân viên phục vụ hành khách hàng hóa | E139: 19028960155011 | F139: =RC[29]+RC[30]+RC[31]+RC[32]+RC[33]+RC[34]+RC[35]+RC[36]+RC[37] -> 3268589 | G139: =RC[17]+RC[18]++RC[19]+RC[20]+RC[21]+RC[38]+RC[39]+RC[41] -> 0 | H139: 0 | I139: 0 | J139: =RC[-2]+RC[-1] -> 0 | K139: 0 | L139: 680000 | M139: 0 | N139: =RC[15]+RC[16]+RC[17]+RC[18]+RC[19]+RC[20] -> 0 | O139: 0 | P139: 0 | Q139: 3948589 | R139: 0 | S139: 0 | T139: 0 | U139: 39485.89 | V139: 0 | W139: 3909103.11 | X139: 0 | Y139: 0 | Z139: 0 | AA139: 0 | AB139: 0 | AC139: 0 | AD139: 0 | AE139: 0 | AF139: 0 | AG139: 0 | AH139: 0 | AI139: 3268589 | AJ139: 0 | AK139: 0 | AL139: 0 | AM139: 0 | AN139: 0 | AO139: 0 | AP139: 0 | AQ139: 0 | AR139: =1 -> 1 | AS139: 0 | AT139: 0 | AU139: =RC[-30]-RC[-29]-RC[-28]-RC[-27]-RC[-26]-RC[-25] -> 3909103.11 | AV139: 0 | AW139: =RC[1]-RC[2] -> 0 | AX139: 0 | AY139: 0 | AZ139: =RC[-46] -> 3268589 | BA139: =RC[-46] -> 0 | BB139: =RC[-46] -> 0 | BC139: =RC[-46] -> 0 | BD139: =RC[-46] -> 0 | BE139: =RC[-46] -> 0 | BF139: =RC[-46] -> 680000 | BG139: =RC[-46] -> 0 | BH139: =RC[-46] -> 0 | BI139: =RC[-46] -> 0 | BJ139: =RC[-46] -> 0 | BK139: =RC[-46] -> 3948589 | BL139: =RC[-46] -> 0 | BM139: =RC[-46] -> 0 | BN139: =RC[-46] -> 0 | BO139: =RC[-46] -> 39485.89 | BP139: =RC[-46] -> 0 | BQ139: =RC[-46] -> 3909103.11 | BR139: =RC[-46] -> 0 | BS139: =RC[-46] -> 0 | BT139: =RC[-46] -> 0 | BU139: =RC[-46] -> 0 | BV139: =RC[-46] -> 0 | BW139: =RC[-46] -> 0 | BX139: =RC[-46] -> 0 | BY139: =RC[-46] -> 0 | BZ139: =RC[-46] -> 0 | CA139: =RC[-46] -> 0 | CB139: =RC[-46] -> 0 | CC139: =RC[-46] -> 3268589 | CD139: =RC[-46] -> 0 | CE139: =RC[-46] -> 0 | CF139: =RC[-46] -> 0 | CG139: =RC[-46] -> 0 | CH139: =RC[-46] -> 0 | CI139: =RC[-46] -> 0 | CJ139: =RC[-46] -> 0 | CK139: =RC[-46] -> 0 | CL139: =RC[-46] -> 1 | CM139: =RC[-46] -> 0 | CN139: =RC[-46] -> 0 | CO139: =RC[-46] -> 3909103.11 | CP139: =RC[-46] -> 0 | CQ139: =RC[-46] -> 0 | CR139: =RC[-46] -> 0 | CS139: =RC[-46] -> 0
A140: 13 | B140: 010569 | C140: Đàm Thu Hường | D140: NV PVHK | E140: 10522174672010 | F140: =RC[29]+RC[30]+RC[31]+RC[32]+RC[33]+RC[34]+RC[35]+RC[36]+RC[37] -> 6595546 | G140: =RC[17]+RC[18]++RC[19]+RC[20]+RC[21]+RC[38]+RC[39]+RC[41] -> 0 | H140: 0 | I140: 0 | J140: =RC[-2]+RC[-1] -> 0 | K140: 0 | L140: 680000 | M140: 458850 | N140: =RC[15]+RC[16]+RC[17]+RC[18]+RC[19]+RC[20] -> 460385 | O140: 0 | P140: 0 | Q140: 8194781 | R140: 349600 | S140: 65550 | T140: 43700 | U140: 77359.31 | V140: 0 | W140: 7658571.6900000004 | X140: 0 | Y140: 0 | Z140: 0 | AA140: 0 | AB140: 0 | AC140: 0 | AD140: 0 | AE140: 0 | AF140: 0 | AG140: 0 | AH140: 460385 | AI140: 6595546 | AJ140: 0 | AK140: 0 | AL140: 0 | AM140: 0 | AN140: 0 | AO140: 0 | AP140: 0 | AQ140: 0 | AR140: =1 -> 1 | AS140: 0 | AT140: 0 | AU140: =RC[-30]-RC[-29]-RC[-28]-RC[-27]-RC[-26]-RC[-25] -> 7658571.6900000004 | AV140: 0 | AW140: =RC[1]-RC[2] -> 153461.66700000002 | AX140: 460385 | AY140: 306923.33299999998 | AZ140: =RC[-46] -> 6595546 | BA140: =RC[-46] -> 0 | BB140: =RC[-46] -> 0 | BC140: =RC[-46] -> 0 | BD140: =RC[-46] -> 0 | BE140: =RC[-46] -> 0 | BF140: =RC[-46] -> 680000 | BG140: =RC[-46] -> 458850 | BH140: =RC[-46] -> 460385 | BI140: =RC[-46] -> 0 | BJ140: =RC[-46] -> 0 | BK140: =RC[-46] -> 8194781 | BL140: =RC[-46] -> 349600 | BM140: =RC[-46] -> 65550 | BN140: =RC[-46] -> 43700 | BO140: =RC[-46] -> 77359.31 | BP140: =RC[-46] -> 0 | BQ140: =RC[-46] -> 7658571.6900000004 | BR140: =RC[-46] -> 0 | BS140: =RC[-46] -> 0 | BT140: =RC[-46] -> 0 | BU140: =RC[-46] -> 0 | BV140: =RC[-46] -> 0 | BW140: =RC[-46] -> 0 | BX140: =RC[-46] -> 0 | BY140: =RC[-46] -> 0 | BZ140: =RC[-46] -> 0 | CA140: =RC[-46] -> 0 | CB140: =RC[-46] -> 460385 | CC140: =RC[-46] -> 6595546 | CD140: =RC[-46] -> 0 | CE140: =RC[-46] -> 0 | CF140: =RC[-46] -> 0 | CG140: =RC[-46] -> 0 | CH140: =RC[-46] -> 0 | CI140: =RC[-46] -> 0 | CJ140: =RC[-46] -> 0 | CK140: =RC[-46] -> 0 | CL140: =RC[-46] -> 1 | CM140: =RC[-46] -> 0 | CN140: =RC[-46] -> 0 | CO140: =RC[-46] -> 7658571.6900000004 | CP140: =RC[-46] -> 0 | CQ140: =RC[-46] -> 153461.66700000002 | CR140: =RC[-46] -> 460385 | CS140: =RC[-46] -> 306923.33299999998
A141: 14 | B141: 010571 | C141: Nguyễn Thị Thuỳ Dung | D141: NV PVHK | E141: 10522162036011 | F141: =RC[29]+RC[30]+RC[31]+RC[32]+RC[33]+RC[34]+RC[35]+RC[36]+RC[37] -> 6216156 | G141: =RC[17]+RC[18]++RC[19]+RC[20]+RC[21]+RC[38]+RC[39]+RC[41] -> 0 | H141: 0 | I141: 0 | J141: =RC[-2]+RC[-1] -> 0 | K141: 0 | L141: 680000 | M141: 283763 | N141: =RC[15]+RC[16]+RC[17]+RC[18]+RC[19]+RC[20] -> 284712 | O141: 0 | P141: 0 | Q141: 7464631 | R141: 216200 | S141: 40538 | T141: 27025 | U141: 71808.679999999993 | V141: 0 | W141: 7109059.3200000003 | X141: 0 | Y141: 0 | Z141: 0 | AA141: 0 | AB141: 0 | AC141: 0 | AD141: 0 | AE141: 0 | AF141: 0 | AG141: 0 | AH141: 284712 | AI141: 6216156 | AJ141: 0 | AK141: 0 | AL141: 0 | AM141: 0 | AN141: 0 | AO141: 0 | AP141: 0 | AQ141: 0 | AR141: =1 -> 1 | AS141: 0 | AT141: 0 | AU141: =RC[-30]-RC[-29]-RC[-28]-RC[-27]-RC[-26]-RC[-25] -> 7109059.3200000003 | AV141: 0 | AW141: =RC[1]-RC[2] -> 94904 | AX141: 284712 | AY141: 189808 | AZ141: =RC[-46] -> 6216156 | BA141: =RC[-46] -> 0 | BB141: =RC[-46] -> 0 | BC141: =RC[-46] -> 0 | BD141: =RC[-46] -> 0 | BE141: =RC[-46] -> 0 | BF141: =RC[-46] -> 680000 | BG141: =RC[-46] -> 283763 | BH141: =RC[-46] -> 284712 | BI141: =RC[-46] -> 0 | BJ141: =RC[-46] -> 0 | BK141: =RC[-46] -> 7464631 | BL141: =RC[-46] -> 216200 | BM141: =RC[-46] -> 40538 | BN141: =RC[-46] -> 27025 | BO141: =RC[-46] -> 71808.679999999993 | BP141: =RC[-46] -> 0 | BQ141: =RC[-46] -> 7109059.3200000003 | BR141: =RC[-46] -> 0 | BS141: =RC[-46] -> 0 | BT141: =RC[-46] -> 0 | BU141: =RC[-46] -> 0 | BV141: =RC[-46] -> 0 | BW141: =RC[-46] -> 0 | BX141: =RC[-46] -> 0 | BY141: =RC[-46] -> 0 | BZ141: =RC[-46] -> 0 | CA141: =RC[-46] -> 0 | CB141: =RC[-46] -> 284712 | CC141: =RC[-46] -> 6216156 | CD141: =RC[-46] -> 0 | CE141: =RC[-46] -> 0 | CF141: =RC[-46] -> 0 | CG141: =RC[-46] -> 0 | CH141: =RC[-46] -> 0 | CI141: =RC[-46] -> 0 | CJ141: =RC[-46] -> 0 | CK141: =RC[-46] -> 0 | CL141: =RC[-46] -> 1 | CM141: =RC[-46] -> 0 | CN141: =RC[-46] -> 0 | CO141: =RC[-46] -> 7109059.3200000003 | CP141: =RC[-46] -> 0 | CQ141: =RC[-46] -> 94904 | CR141: =RC[-46] -> 284712 | CS141: =RC[-46] -> 189808
A142: 15 | B142: 010578 | C142: Bùi Việt Quang | D142: NV PVHK | E142: 10525139510015 | F142: =RC[29]+RC[30]+RC[31]+RC[32]+RC[33]+RC[34]+RC[35]+RC[36]+RC[37] -> 5865950 | G142: =RC[17]+RC[18]++RC[19]+RC[20]+RC[21]+RC[38]+RC[39]+RC[41] -> 0 | H142: 0 | I142: 0 | J142: =RC[-2]+RC[-1] -> 0 | K142: 0 | L142: 680000 | M142: 241500 | N142: =RC[15]+RC[16]+RC[17]+RC[18]+RC[19]+RC[20] -> 242308 | O142: 0 | P142: 0 | Q142: 7029758 | R142: 184000 | S142: 34500 | T142: 23000 | U142: 67882.58 | V142: 0 | W142: 6720375.4199999999 | X142: 0 | Y142: 0 | Z142: 0 | AA142: 0 | AB142: 0 | AC142: 0 | AD142: 0 | AE142: 0 | AF142: 0 | AG142: 0 | AH142: 242308 | AI142: 5865950 | AJ142: 0 | AK142: 0 | AL142: 0 | AM142: 0 | AN142: 0 | AO142: 0 | AP142: 0 | AQ142: 0 | AR142: =1 -> 1 | AS142: 0 | AT142: 0 | AU142: =RC[-30]-RC[-29]-RC[-28]-RC[-27]-RC[-26]-RC[-25] -> 6720375.4199999999 | AV142: 0 | AW142: =RC[1]-RC[2] -> 80769.333000000013 | AX142: 242308 | AY142: 161538.66699999999 | AZ142: =RC[-46] -> 5865950 | BA142: =RC[-46] -> 0 | BB142: =RC[-46] -> 0 | BC142: =RC[-46] -> 0 | BD142: =RC[-46] -> 0 | BE142: =RC[-46] -> 0 | BF142: =RC[-46] -> 680000 | BG142: =RC[-46] -> 241500 | BH142: =RC[-46] -> 242308 | BI142: =RC[-46] -> 0 | BJ142: =RC[-46] -> 0 | BK142: =RC[-46] -> 7029758 | BL142: =RC[-46] -> 184000 | BM142: =RC[-46] -> 34500 | BN142: =RC[-46] -> 23000 | BO142: =RC[-46] -> 67882.58 | BP142: =RC[-46] -> 0 | BQ142: =RC[-46] -> 6720375.4199999999 | BR142: =RC[-46] -> 0 | BS142: =RC[-46] -> 0 | BT142: =RC[-46] -> 0 | BU142: =RC[-46] -> 0 | BV142: =RC[-46] -> 0 | BW142: =RC[-46] -> 0 | BX142: =RC[-46] -> 0 | BY142: =RC[-46] -> 0 | BZ142: =RC[-46] -> 0 | CA142: =RC[-46] -> 0 | CB142: =RC[-46] -> 242308 | CC142: =RC[-46] -> 5865950 | CD142: =RC[-46] -> 0 | CE142: =RC[-46] -> 0 | CF142: =RC[-46] -> 0 | CG142: =RC[-46] -> 0 | CH142: =RC[-46] -> 0 | CI142: =RC[-46] -> 0 | CJ142: =RC[-46] -> 0 | CK142: =RC[-46] -> 0 | CL142: =RC[-46] -> 1 | CM142: =RC[-46] -> 0 | CN142: =RC[-46] -> 0 | CO142: =RC[-46] -> 6720375.4199999999 | CP142: =RC[-46] -> 0 | CQ142: =RC[-46] -> 80769.333000000013 | CR142: =RC[-46] -> 242308 | CS142: =RC[-46] -> 161538.66699999999
A143: 16 | B143: 010589 | C143: Phạm Thị Ba | D143: NV PVHK | E143: 10524470156012 | F143: =RC[29]+RC[30]+RC[31]+RC[32]+RC[33]+RC[34]+RC[35]+RC[36]+RC[37] -> 5574112 | G143: =RC[17]+RC[18]++RC[19]+RC[20]+RC[21]+RC[38]+RC[39]+RC[41] -> 0 | H143: 0 | I143: 0 | J143: =RC[-2]+RC[-1] -> 0 | K143: 0 | L143: 680000 | M143: 283763 | N143: =RC[15]+RC[16]+RC[17]+RC[18]+RC[19]+RC[20] -> 284712 | O143: 0 | P143: 0 | Q143: 6822587 | R143: 216200 | S143: 40538 | T143: 27025 | U143: 65388.24 | V143: 0 | W143: 6473435.7599999998 | X143: 0 | Y143: 0 | Z143: 0 | AA143: 0 | AB143: 0 | AC143: 0 | AD143: 0 | AE143: 0 | AF143: 0 | AG143: 0 | AH143: 284712 | AI143: 5574112 | AJ143: 0 | AK143: 0 | AL143: 0 | AM143: 0 | AN143: 0 | AO143: 0 | AP143: 0 | AQ143: 0 | AR143: =1 -> 1 | AS143: 0 | AT143: 0 | AU143: =RC[-30]-RC[-29]-RC[-28]-RC[-27]-RC[-26]-RC[-25] -> 6473435.7599999998 | AV143: 0 | AW143: =RC[1]-RC[2] -> 94904 | AX143: 284712 | AY143: 189808 | AZ143: =RC[-46] -> 5574112 | BA143: =RC[-46] -> 0 | BB143: =RC[-46] -> 0 | BC143: =RC[-46] -> 0 | BD143: =RC[-46] -> 0 | BE143: =RC[-46] -> 0 | BF143: =RC[-46] -> 680000 | BG143: =RC[-46] -> 283763 | BH143: =RC[-46] -> 284712 | BI143: =RC[-46] -> 0 | BJ143: =RC[-46] -> 0 | BK143: =RC[-46] -> 6822587 | BL143: =RC[-46] -> 216200 | BM143: =RC[-46] -> 40538 | BN143: =RC[-46] -> 27025 | BO143: =RC[-46] -> 65388.24 | BP143: =RC[-46] -> 0 | BQ143: =RC[-46] -> 6473435.7599999998 | BR143: =RC[-46] -> 0 | BS143: =RC[-46] -> 0 | BT143: =RC[-46] -> 0 | BU143: =RC[-46] -> 0 | BV143: =RC[-46] -> 0 | BW143: =RC[-46] -> 0 | BX143: =RC[-46] -> 0 | BY143: =RC[-46] -> 0 | BZ143: =RC[-46] -> 0 | CA143: =RC[-46] -> 0 | CB143: =RC[-46] -> 284712 | CC143: =RC[-46] -> 5574112 | CD143: =RC[-46] -> 0 | CE143: =RC[-46] -> 0 | CF143: =RC[-46] -> 0 | CG143: =RC[-46] -> 0 | CH143: =RC[-46] -> 0 | CI143: =RC[-46] -> 0 | CJ143: =RC[-46] -> 0 | CK143: =RC[-46] -> 0 | CL143: =RC[-46] -> 1 | CM143: =RC[-46] -> 0 | CN143: =RC[-46] -> 0 | CO143: =RC[-46] -> 6473435.7599999998 | CP143: =RC[-46] -> 0 | CQ143: =RC[-46] -> 94904 | CR143: =RC[-46] -> 284712 | CS143: =RC[-46] -> 189808
A144: 17 | B144: 010591 | C144: Vũ Phương Thanh | D144: NV PVHK | E144: 10524470162012 | F144: =RC[29]+RC[30]+RC[31]+RC[32]+RC[33]+RC[34]+RC[35]+RC[36]+RC[37] -> 5019619 | G144: =RC[17]+RC[18]++RC[19]+RC[20]+RC[21]+RC[38]+RC[39]+RC[41] -> 0 | H144: 0 | I144: 0 | J144: =RC[-2]+RC[-1] -> 0 | K144: 0 | L144: 680000 | M144: 283763 | N144: =RC[15]+RC[16]+RC[17]+RC[18]+RC[19]+RC[20] -> 284712 | O144: 0 | P144: 0 | Q144: 6268094 | R144: 216200 | S144: 40538 | T144: 27025 | U144: 59843.31 | V144: 0 | W144: 5924487.6900000004 | X144: 0 | Y144: 0 | Z144: 0 | AA144: 0 | AB144: 0 | AC144: 0 | AD144: 0 | AE144: 0 | AF144: 0 | AG144: 0 | AH144: 284712 | AI144: 5019619 | AJ144: 0 | AK144: 0 | AL144: 0 | AM144: 0 | AN144: 0 | AO144: 0 | AP144: 0 | AQ144: 0 | AR144: =1 -> 1 | AS144: 0 | AT144: 0 | AU144: =RC[-30]-RC[-29]-RC[-28]-RC[-27]-RC[-26]-RC[-25] -> 5924487.6900000004 | AV144: 0 | AW144: =RC[1]-RC[2] -> 94904 | AX144: 284712 | AY144: 189808 | AZ144: =RC[-46] -> 5019619 | BA144: =RC[-46] -> 0 | BB144: =RC[-46] -> 0 | BC144: =RC[-46] -> 0 | BD144: =RC[-46] -> 0 | BE144: =RC[-46] -> 0 | BF144: =RC[-46] -> 680000 | BG144: =RC[-46] -> 283763 | BH144: =RC[-46] -> 284712 | BI144: =RC[-46] -> 0 | BJ144: =RC[-46] -> 0 | BK144: =RC[-46] -> 6268094 | BL144: =RC[-46] -> 216200 | BM144: =RC[-46] -> 40538 | BN144: =RC[-46] -> 27025 | BO144: =RC[-46] -> 59843.31 | BP144: =RC[-46] -> 0 | BQ144: =RC[-46] -> 5924487.6900000004 | BR144: =RC[-46] -> 0 | BS144: =RC[-46] -> 0 | BT144: =RC[-46] -> 0 | BU144: =RC[-46] -> 0 | BV144: =RC[-46] -> 0 | BW144: =RC[-46] -> 0 | BX144: =RC[-46] -> 0 | BY144: =RC[-46] -> 0 | BZ144: =RC[-46] -> 0 | CA144: =RC[-46] -> 0 | CB144: =RC[-46] -> 284712 | CC144: =RC[-46] -> 5019619 | CD144: =RC[-46] -> 0 | CE144: =RC[-46] -> 0 | CF144: =RC[-46] -> 0 | CG144: =RC[-46] -> 0 | CH144: =RC[-46] -> 0 | CI144: =RC[-46] -> 0 | CJ144: =RC[-46] -> 0 | CK144: =RC[-46] -> 0 | CL144: =RC[-46] -> 1 | CM144: =RC[-46] -> 0 | CN144: =RC[-46] -> 0 | CO144: =RC[-46] -> 5924487.6900000004 | CP144: =RC[-46] -> 0 | CQ144: =RC[-46] -> 94904 | CR144: =RC[-46] -> 284712 | CS144: =RC[-46] -> 189808
A145: 18 | B145: 010596 | C145: Phạm Thị Ánh Hồng | D145: NV PVHK | E145: 10525139497019 | F145: =RC[29]+RC[30]+RC[31]+RC[32]+RC[33]+RC[34]+RC[35]+RC[36]+RC[37] -> 5253090 | G145: =RC[17]+RC[18]++RC[19]+RC[20]+RC[21]+RC[38]+RC[39]+RC[41] -> 0 | H145: 0 | I145: 0 | J145: =RC[-2]+RC[-1] -> 0 | K145: 0 | L145: 680000 | M145: 241500 | N145: =RC[15]+RC[16]+RC[17]+RC[18]+RC[19]+RC[20] -> 242308 | O145: 0 | P145: 0 | Q145: 6416898 | R145: 184000 | S145: 34500 | T145: 23000 | U145: 61753.98 | V145: 0 | W145: 6113644.0199999996 | X145: 0 | Y145: 0 | Z145: 0 | AA145: 0 | AB145: 0 | AC145: 0 | AD145: 0 | AE145: 0 | AF145: 0 | AG145: 0 | AH145: 242308 | AI145: 5253090 | AJ145: 0 | AK145: 0 | AL145: 0 | AM145: 0 | AN145: 0 | AO145: 0 | AP145: 0 | AQ145: 0 | AR145: =1 -> 1 | AS145: 0 | AT145: 0 | AU145: =RC[-30]-RC[-29]-RC[-28]-RC[-27]-RC[-26]-RC[-25] -> 6113644.0199999996 | AV145: 0 | AW145: =RC[1]-RC[2] -> 80769.333000000013 | AX145: 242308 | AY145: 161538.66699999999 | AZ145: =RC[-46] -> 5253090 | BA145: =RC[-46] -> 0 | BB145: =RC[-46] -> 0 | BC145: =RC[-46] -> 0 | BD145: =RC[-46] -> 0 | BE145: =RC[-46] -> 0 | BF145: =RC[-46] -> 680000 | BG145: =RC[-46] -> 241500 | BH145: =RC[-46] -> 242308 | BI145: =RC[-46] -> 0 | BJ145: =RC[-46] -> 0 | BK145: =RC[-46] -> 6416898 | BL145: =RC[-46] -> 184000 | BM145: =RC[-46] -> 34500 | BN145: =RC[-46] -> 23000 | BO145: =RC[-46] -> 61753.98 | BP145: =RC[-46] -> 0 | BQ145: =RC[-46] -> 6113644.0199999996 | BR145: =RC[-46] -> 0 | BS145: =RC[-46] -> 0 | BT145: =RC[-46] -> 0 | BU145: =RC[-46] -> 0 | BV145: =RC[-46] -> 0 | BW145: =RC[-46] -> 0 | BX145: =RC[-46] -> 0 | BY145: =RC[-46] -> 0 | BZ145: =RC[-46] -> 0 | CA145: =RC[-46] -> 0 | CB145: =RC[-46] -> 242308 | CC145: =RC[-46] -> 5253090 | CD145: =RC[-46] -> 0 | CE145: =RC[-46] -> 0 | CF145: =RC[-46] -> 0 | CG145: =RC[-46] -> 0 | CH145: =RC[-46] -> 0 | CI145: =RC[-46] -> 0 | CJ145: =RC[-46] -> 0 | CK145: =RC[-46] -> 0 | CL145: =RC[-46] -> 1 | CM145: =RC[-46] -> 0 | CN145: =RC[-46] -> 0 | CO145: =RC[-46] -> 6113644.0199999996 | CP145: =RC[-46] -> 0 | CQ145: =RC[-46] -> 80769.333000000013 | CR145: =RC[-46] -> 242308 | CS145: =RC[-46] -> 161538.66699999999
A146: 19 | B146: 010597 | C146: Nguyễn Thị Thu Sang | D146: NV PVHK | E146: 10525213787016 | F146: =RC[29]+RC[30]+RC[31]+RC[32]+RC[33]+RC[34]+RC[35]+RC[36]+RC[37] -> 5253090 | G146: =RC[17]+RC[18]++RC[19]+RC[20]+RC[21]+RC[38]+RC[39]+RC[41] -> 0 | H146: 0 | I146: 0 | J146: =RC[-2]+RC[-1] -> 0 | K146: 0 | L146: 680000 | M146: 241500 | N146: =RC[15]+RC[16]+RC[17]+RC[18]+RC[19]+RC[20] -> 242308 | O146: 0 | P146: 0 | Q146: 6416898 | R146: 184000 | S146: 34500 | T146: 23000 | U146: 61753.98 | V146: 0 | W146: 6113644.0199999996 | X146: 0 | Y146: 0 | Z146: 0 | AA146: 0 | AB146: 0 | AC146: 0 | AD146: 0 | AE146: 0 | AF146: 0 | AG146: 0 | AH146: 242308 | AI146: 5253090 | AJ146: 0 | AK146: 0 | AL146: 0 | AM146: 0 | AN146: 0 | AO146: 0 | AP146: 0 | AQ146: 0 | AR146: =1 -> 1 | AS146: 0 | AT146: 0 | AU146: =RC[-30]-RC[-29]-RC[-28]-RC[-27]-RC[-26]-RC[-25] -> 6113644.0199999996 | AV146: 0 | AW146: =RC[1]-RC[2] -> 80769.333000000013 | AX146: 242308 | AY146: 161538.66699999999 | AZ146: =RC[-46] -> 5253090 | BA146: =RC[-46] -> 0 | BB146: =RC[-46] -> 0 | BC146: =RC[-46] -> 0 | BD146: =RC[-46] -> 0 | BE146: =RC[-46] -> 0 | BF146: =RC[-46] -> 680000 | BG146: =RC[-46] -> 241500 | BH146: =RC[-46] -> 242308 | BI146: =RC[-46] -> 0 | BJ146: =RC[-46] -> 0 | BK146: =RC[-46] -> 6416898 | BL146: =RC[-46] -> 184000 | BM146: =RC[-46] -> 34500 | BN146: =RC[-46] -> 23000 | BO146: =RC[-46] -> 61753.98 | BP146: =RC[-46] -> 0 | BQ146: =RC[-46] -> 6113644.0199999996 | BR146: =RC[-46] -> 0 | BS146: =RC[-46] -> 0 | BT146: =RC[-46] -> 0 | BU146: =RC[-46] -> 0 | BV146: =RC[-46] -> 0 | BW146: =RC[-46] -> 0 | BX146: =RC[-46] -> 0 | BY146: =RC[-46] -> 0 | BZ146: =RC[-46] -> 0 | CA146: =RC[-46] -> 0 | CB146: =RC[-46] -> 242308 | CC146: =RC[-46] -> 5253090 | CD146: =RC[-46] -> 0 | CE146: =RC[-46] -> 0 | CF146: =RC[-46] -> 0 | CG146: =RC[-46] -> 0 | CH146: =RC[-46] -> 0 | CI146: =RC[-46] -> 0 | CJ146: =RC[-46] -> 0 | CK146: =RC[-46] -> 0 | CL146: =RC[-46] -> 1 | CM146: =RC[-46] -> 0 | CN146: =RC[-46] -> 0 | CO146: =RC[-46] -> 6113644.0199999996 | CP146: =RC[-46] -> 0 | CQ146: =RC[-46] -> 80769.333000000013 | CR146: =RC[-46] -> 242308 | CS146: =RC[-46] -> 161538.66699999999
A147: 20 | B147: 010598 | C147: Nguyễn Ngọc Quân | D147: NV PVHK | E147: 10525213794012 | F147: =RC[29]+RC[30]+RC[31]+RC[32]+RC[33]+RC[34]+RC[35]+RC[36]+RC[37] -> 5865950 | G147: =RC[17]+RC[18]++RC[19]+RC[20]+RC[21]+RC[38]+RC[39]+RC[41] -> 0 | H147: 0 | I147: 0 | J147: =RC[-2]+RC[-1] -> 0 | K147: 0 | L147: 680000 | M147: 241500 | N147: =RC[15]+RC[16]+RC[17]+RC[18]+RC[19]+RC[20] -> 242308 | O147: 0 | P147: 0 | Q147: 7029758 | R147: 184000 | S147: 34500 | T147: 23000 | U147: 67882.58 | V147: 0 | W147: 6720375.4199999999 | X147: 0 | Y147: 0 | Z147: 0 | AA147: 0 | AB147: 0 | AC147: 0 | AD147: 0 | AE147: 0 | AF147: 0 | AG147: 0 | AH147: 242308 | AI147: 5865950 | AJ147: 0 | AK147: 0 | AL147: 0 | AM147: 0 | AN147: 0 | AO147: 0 | AP147: 0 | AQ147: 0 | AR147: =1 -> 1 | AS147: 0 | AT147: 0 | AU147: =RC[-30]-RC[-29]-RC[-28]-RC[-27]-RC[-26]-RC[-25] -> 6720375.4199999999 | AV147: 0 | AW147: =RC[1]-RC[2] -> 80769.333000000013 | AX147: 242308 | AY147: 161538.66699999999 | AZ147: =RC[-46] -> 5865950 | BA147: =RC[-46] -> 0 | BB147: =RC[-46] -> 0 | BC147: =RC[-46] -> 0 | BD147: =RC[-46] -> 0 | BE147: =RC[-46] -> 0 | BF147: =RC[-46] -> 680000 | BG147: =RC[-46] -> 241500 | BH147: =RC[-46] -> 242308 | BI147: =RC[-46] -> 0 | BJ147: =RC[-46] -> 0 | BK147: =RC[-46] -> 7029758 | BL147: =RC[-46] -> 184000 | BM147: =RC[-46] -> 34500 | BN147: =RC[-46] -> 23000 | BO147: =RC[-46] -> 67882.58 | BP147: =RC[-46] -> 0 | BQ147: =RC[-46] -> 6720375.4199999999 | BR147: =RC[-46] -> 0 | BS147: =RC[-46] -> 0 | BT147: =RC[-46] -> 0 | BU147: =RC[-46] -> 0 | BV147: =RC[-46] -> 0 | BW147: =RC[-46] -> 0 | BX147: =RC[-46] -> 0 | BY147: =RC[-46] -> 0 | BZ147: =RC[-46] -> 0 | CA147: =RC[-46] -> 0 | CB147: =RC[-46] -> 242308 | CC147: =RC[-46] -> 5865950 | CD147: =RC[-46] -> 0 | CE147: =RC[-46] -> 0 | CF147: =RC[-46] -> 0 | CG147: =RC[-46] -> 0 | CH147: =RC[-46] -> 0 | CI147: =RC[-46] -> 0 | CJ147: =RC[-46] -> 0 | CK147: =RC[-46] -> 0 | CL147: =RC[-46] -> 1 | CM147: =RC[-46] -> 0 | CN147: =RC[-46] -> 0 | CO147: =RC[-46] -> 6720375.4199999999 | CP147: =RC[-46] -> 0 | CQ147: =RC[-46] -> 80769.333000000013 | CR147: =RC[-46] -> 242308 | CS147: =RC[-46] -> 161538.66699999999
A148: 21 | B148: 010602 | C148: Nguyễn Thị Thu Trang | D148: NV PVHK | E148: 19020531052015 | F148: =RC[29]+RC[30]+RC[31]+RC[32]+RC[33]+RC[34]+RC[35]+RC[36]+RC[37] -> 5054640 | G148: =RC[17]+RC[18]++RC[19]+RC[20]+RC[21]+RC[38]+RC[39]+RC[41] -> 0 | H148: 0 | I148: 0 | J148: =RC[-2]+RC[-1] -> 0 | K148: 0 | L148: 653846 | M148: 241500 | N148: =RC[15]+RC[16]+RC[17]+RC[18]+RC[19]+RC[20] -> 242308 | O148: 0 | P148: 0 | Q148: 6192294 | R148: 184000 | S148: 34500 | T148: 23000 | U148: 59507.94 | V148: 0 | W148: 5891286.0599999996 | X148: 0 | Y148: 0 | Z148: 0 | AA148: 0 | AB148: 0 | AC148: 0 | AD148: 0 | AE148: 0 | AF148: 0 | AG148: 0 | AH148: 242308 | AI148: 5054640 | AJ148: 0 | AK148: 0 | AL148: 0 | AM148: 0 | AN148: 0 | AO148: 0 | AP148: 0 | AQ148: 0 | AR148: =1 -> 1 | AS148: 0 | AT148: 0 | AU148: =RC[-30]-RC[-29]-RC[-28]-RC[-27]-RC[-26]-RC[-25] -> 5891286.0599999996 | AV148: 0 | AW148: =RC[1]-RC[2] -> 80769.333000000013 | AX148: 242308 | AY148: 161538.66699999999 | AZ148: =RC[-46] -> 5054640 | BA148: =RC[-46] -> 0 | BB148: =RC[-46] -> 0 | BC148: =RC[-46] -> 0 | BD148: =RC[-46] -> 0 | BE148: =RC[-46] -> 0 | BF148: =RC[-46] -> 653846 | BG148: =RC[-46] -> 241500 | BH148: =RC[-46] -> 242308 | BI148: =RC[-46] -> 0 | BJ148: =RC[-46] -> 0 | BK148: =RC[-46] -> 6192294 | BL148: =RC[-46] -> 184000 | BM148: =RC[-46] -> 34500 | BN148: =RC[-46] -> 23000 | BO148: =RC[-46] -> 59507.94 | BP148: =RC[-46] -> 0 | BQ148: =RC[-46] -> 5891286.0599999996 | BR148: =RC[-46] -> 0 | BS148: =RC[-46] -> 0 | BT148: =RC[-46] -> 0 | BU148: =RC[-46] -> 0 | BV148: =RC[-46] -> 0 | BW148: =RC[-46] -> 0 | BX148: =RC[-46] -> 0 | BY148: =RC[-46] -> 0 | BZ148: =RC[-46] -> 0 | CA148: =RC[-46] -> 0 | CB148: =RC[-46] -> 242308 | CC148: =RC[-46] -> 5054640 | CD148: =RC[-46] -> 0 | CE148: =RC[-46] -> 0 | CF148: =RC[-46] -> 0 | CG148: =RC[-46] -> 0 | CH148: =RC[-46] -> 0 | CI148: =RC[-46] -> 0 | CJ148: =RC[-46] -> 0 | CK148: =RC[-46] -> 0 | CL148: =RC[-46] -> 1 | CM148: =RC[-46] -> 0 | CN148: =RC[-46] -> 0 | CO148: =RC[-46] -> 5891286.0599999996 | CP148: =RC[-46] -> 0 | CQ148: =RC[-46] -> 80769.333000000013 | CR148: =RC[-46] -> 242308 | CS148: =RC[-46] -> 161538.66699999999
A149: 22 | B149: 010603 | C149: Nguyễn Thị Vân Anh | D149: NV PVHK | E149: 10525213795019 | F149: =RC[29]+RC[30]+RC[31]+RC[32]+RC[33]+RC[34]+RC[35]+RC[36]+RC[37] -> 4669413 | G149: =RC[17]+RC[18]++RC[19]+RC[20]+RC[21]+RC[38]+RC[39]+RC[41] -> 0 | H149: 0 | I149: 0 | J149: =RC[-2]+RC[-1] -> 0 | K149: 0 | L149: 680000 | M149: 241500 | N149: =RC[15]+RC[16]+RC[17]+RC[18]+RC[19]+RC[20] -> 242308 | O149: 0 | P149: 0 | Q149: 5833221 | R149: 184000 | S149: 34500 | T149: 23000 | U149: 55917.21 | V149: 0 | W149: 5535803.79 | X149: 0 | Y149: 0 | Z149: 0 | AA149: 0 | AB149: 0 | AC149: 0 | AD149: 0 | AE149: 0 | AF149: 0 | AG149: 0 | AH149: 242308 | AI149: 4669413 | AJ149: 0 | AK149: 0 | AL149: 0 | AM149: 0 | AN149: 0 | AO149: 0 | AP149: 0 | AQ149: 0 | AR149: =1 -> 1 | AS149: 0 | AT149: 0 | AU149: =RC[-30]-RC[-29]-RC[-28]-RC[-27]-RC[-26]-RC[-25] -> 5535803.79 | AV149: 0 | AW149: =RC[1]-RC[2] -> 80769.333000000013 | AX149: 242308 | AY149: 161538.66699999999 | AZ149: =RC[-46] -> 4669413 | BA149: =RC[-46] -> 0 | BB149: =RC[-46] -> 0 | BC149: =RC[-46] -> 0 | BD149: =RC[-46] -> 0 | BE149: =RC[-46] -> 0 | BF149: =RC[-46] -> 680000 | BG149: =RC[-46] -> 241500 | BH149: =RC[-46] -> 242308 | BI149: =RC[-46] -> 0 | BJ149: =RC[-46] -> 0 | BK149: =RC[-46] -> 5833221 | BL149: =RC[-46] -> 184000 | BM149: =RC[-46] -> 34500 | BN149: =RC[-46] -> 23000 | BO149: =RC[-46] -> 55917.21 | BP149: =RC[-46] -> 0 | BQ149: =RC[-46] -> 5535803.79 | BR149: =RC[-46] -> 0 | BS149: =RC[-46] -> 0 | BT149: =RC[-46] -> 0 | BU149: =RC[-46] -> 0 | BV149: =RC[-46] -> 0 | BW149: =RC[-46] -> 0 | BX149: =RC[-46] -> 0 | BY149: =RC[-46] -> 0 | BZ149: =RC[-46] -> 0 | CA149: =RC[-46] -> 0 | CB149: =RC[-46] -> 242308 | CC149: =RC[-46] -> 4669413 | CD149: =RC[-46] -> 0 | CE149: =RC[-46] -> 0 | CF149: =RC[-46] -> 0 | CG149: =RC[-46] -> 0 | CH149: =RC[-46] -> 0 | CI149: =RC[-46] -> 0 | CJ149: =RC[-46] -> 0 | CK149: =RC[-46] -> 0 | CL149: =RC[-46] -> 1 | CM149: =RC[-46] -> 0 | CN149: =RC[-46] -> 0 | CO149: =RC[-46] -> 5535803.79 | CP149: =RC[-46] -> 0 | CQ149: =RC[-46] -> 80769.333000000013 | CR149: =RC[-46] -> 242308 | CS149: =RC[-46] -> 161538.66699999999
A150: 23 | B150: 010618 | C150: Nguyễn Thị Hằng | D150: NV PVHK | E150: 10523498963014 | F150: =RC[29]+RC[30]+RC[31]+RC[32]+RC[33]+RC[34]+RC[35]+RC[36]+RC[37] -> 5574112 | G150: =RC[17]+RC[18]++RC[19]+RC[20]+RC[21]+RC[38]+RC[39]+RC[41] -> 0 | H150: 0 | I150: 0 | J150: =RC[-2]+RC[-1] -> 0 | K150: 0 | L150: 680000 | M150: 283763 | N150: =RC[15]+RC[16]+RC[17]+RC[18]+RC[19]+RC[20] -> 284712 | O150: 0 | P150: 0 | Q150: 6822587 | R150: 216200 | S150: 40538 | T150: 27025 | U150: 65388.24 | V150: 0 | W150: 6473435.7599999998 | X150: 0 | Y150: 0 | Z150: 0 | AA150: 0 | AB150: 0 | AC150: 0 | AD150: 0 | AE150: 0 | AF150: 0 | AG150: 0 | AH150: 284712 | AI150: 5574112 | AJ150: 0 | AK150: 0 | AL150: 0 | AM150: 0 | AN150: 0 | AO150: 0 | AP150: 0 | AQ150: 0 | AR150: =1 -> 1 | AS150: 0 | AT150: 0 | AU150: =RC[-30]-RC[-29]-RC[-28]-RC[-27]-RC[-26]-RC[-25] -> 6473435.7599999998 | AV150: 0 | AW150: =RC[1]-RC[2] -> 94904 | AX150: 284712 | AY150: 189808 | AZ150: =RC[-46] -> 5574112 | BA150: =RC[-46] -> 0 | BB150: =RC[-46] -> 0 | BC150: =RC[-46] -> 0 | BD150: =RC[-46] -> 0 | BE150: =RC[-46] -> 0 | BF150: =RC[-46] -> 680000 | BG150: =RC[-46] -> 283763 | BH150: =RC[-46] -> 284712 | BI150: =RC[-46] -> 0 | BJ150: =RC[-46] -> 0 | BK150: =RC[-46] -> 6822587 | BL150: =RC[-46] -> 216200 | BM150: =RC[-46] -> 40538 | BN150: =RC[-46] -> 27025 | BO150: =RC[-46] -> 65388.24 | BP150: =RC[-46] -> 0 | BQ150: =RC[-46] -> 6473435.7599999998 | BR150: =RC[-46] -> 0 | BS150: =RC[-46] -> 0 | BT150: =RC[-46] -> 0 | BU150: =RC[-46] -> 0 | BV150: =RC[-46] -> 0 | BW150: =RC[-46] -> 0 | BX150: =RC[-46] -> 0 | BY150: =RC[-46] -> 0 | BZ150: =RC[-46] -> 0 | CA150: =RC[-46] -> 0 | CB150: =RC[-46] -> 284712 | CC150: =RC[-46] -> 5574112 | CD150: =RC[-46] -> 0 | CE150: =RC[-46] -> 0 | CF150: =RC[-46] -> 0 | CG150: =RC[-46] -> 0 | CH150: =RC[-46] -> 0 | CI150: =RC[-46] -> 0 | CJ150: =RC[-46] -> 0 | CK150: =RC[-46] -> 0 | CL150: =RC[-46] -> 1 | CM150: =RC[-46] -> 0 | CN150: =RC[-46] -> 0 | CO150: =RC[-46] -> 6473435.7599999998 | CP150: =RC[-46] -> 0 | CQ150: =RC[-46] -> 94904 | CR150: =RC[-46] -> 284712 | CS150: =RC[-46] -> 189808
A151: 24 | B151: 010619 | C151: Phạm Thị Thu Hương | D151: NV PVHK | E151: 10523640465019 | F151: =RC[29]+RC[30]+RC[31]+RC[32]+RC[33]+RC[34]+RC[35]+RC[36]+RC[37] -> 5865950 | G151: =RC[17]+RC[18]++RC[19]+RC[20]+RC[21]+RC[38]+RC[39]+RC[41] -> 0 | H151: 0 | I151: 0 | J151: =RC[-2]+RC[-1] -> 0 | K151: 0 | L151: 680000 | M151: 283763 | N151: =RC[15]+RC[16]+RC[17]+RC[18]+RC[19]+RC[20] -> 284712 | O151: 0 | P151: 0 | Q151: 7114425 | R151: 216200 | S151: 40538 | T151: 27025 | U151: 68306.62 | V151: 0 | W151: 6762355.3799999999 | X151: 0 | Y151: 0 | Z151: 0 | AA151: 0 | AB151: 0 | AC151: 0 | AD151: 0 | AE151: 0 | AF151: 0 | AG151: 0 | AH151: 284712 | AI151: 5865950 | AJ151: 0 | AK151: 0 | AL151: 0 | AM151: 0 | AN151: 0 | AO151: 0 | AP151: 0 | AQ151: 0 | AR151: =1 -> 1 | AS151: 0 | AT151: 0 | AU151: =RC[-30]-RC[-29]-RC[-28]-RC[-27]-RC[-26]-RC[-25] -> 6762355.3799999999 | AV151: 0 | AW151: =RC[1]-RC[2] -> 94904 | AX151: 284712 | AY151: 189808 | AZ151: =RC[-46] -> 5865950 | BA151: =RC[-46] -> 0 | BB151: =RC[-46] -> 0 | BC151: =RC[-46] -> 0 | BD151: =RC[-46] -> 0 | BE151: =RC[-46] -> 0 | BF151: =RC[-46] -> 680000 | BG151: =RC[-46] -> 283763 | BH151: =RC[-46] -> 284712 | BI151: =RC[-46] -> 0 | BJ151: =RC[-46] -> 0 | BK151: =RC[-46] -> 7114425 | BL151: =RC[-46] -> 216200 | BM151: =RC[-46] -> 40538 | BN151: =RC[-46] -> 27025 | BO151: =RC[-46] -> 68306.62 | BP151: =RC[-46] -> 0 | BQ151: =RC[-46] -> 6762355.3799999999 | BR151: =RC[-46] -> 0 | BS151: =RC[-46] -> 0 | BT151: =RC[-46] -> 0 | BU151: =RC[-46] -> 0 | BV151: =RC[-46] -> 0 | BW151: =RC[-46] -> 0 | BX151: =RC[-46] -> 0 | BY151: =RC[-46] -> 0 | BZ151: =RC[-46] -> 0 | CA151: =RC[-46] -> 0 | CB151: =RC[-46] -> 284712 | CC151: =RC[-46] -> 5865950 | CD151: =RC[-46] -> 0 | CE151: =RC[-46] -> 0 | CF151: =RC[-46] -> 0 | CG151: =RC[-46] -> 0 | CH151: =RC[-46] -> 0 | CI151: =RC[-46] -> 0 | CJ151: =RC[-46] -> 0 | CK151: =RC[-46] -> 0 | CL151: =RC[-46] -> 1 | CM151: =RC[-46] -> 0 | CN151: =RC[-46] -> 0 | CO151: =RC[-46] -> 6762355.3799999999 | CP151: =RC[-46] -> 0 | CQ151: =RC[-46] -> 94904 | CR151: =RC[-46] -> 284712 | CS151: =RC[-46] -> 189808
A152: 25 | B152: 010620 | C152: Trần Thị Thu | D152: NV PVHK | E152: 10523498901019 | F152: =RC[29]+RC[30]+RC[31]+RC[32]+RC[33]+RC[34]+RC[35]+RC[36]+RC[37] -> 2480626 | G152: =RC[17]+RC[18]++RC[19]+RC[20]+RC[21]+RC[38]+RC[39]+RC[41] -> 0 | H152: 0 | I152: 0 | J152: =RC[-2]+RC[-1] -> 0 | K152: 0 | L152: 0 | M152: 0 | N152: =RC[15]+RC[16]+RC[17]+RC[18]+RC[19]+RC[20] -> 0 | O152: 0 | P152: 0 | Q152: 2480626 | R152: 0 | S152: 0 | T152: 0 | U152: 24806.26 | V152: 0 | W152: 2455819.7400000002 | X152: 0 | Y152: 0 | Z152: 0 | AA152: 0 | AB152: 0 | AC152: 0 | AD152: 0 | AE152: 0 | AF152: 0 | AG152: 0 | AH152: 0 | AI152: 0 | AJ152: 2480626 | AK152: 0 | AL152: 0 | AM152: 0 | AN152: 0 | AO152: 0 | AP152: 0 | AQ152: 0 | AR152: =1 -> 1 | AS152: 0 | AT152: 0 | AU152: =RC[-30]-RC[-29]-RC[-28]-RC[-27]-RC[-26]-RC[-25] -> 2455819.7400000002 | AV152: 0 | AW152: =RC[1]-RC[2] -> 0 | AX152: 0 | AY152: 0 | AZ152: =RC[-46] -> 2480626 | BA152: =RC[-46] -> 0 | BB152: =RC[-46] -> 0 | BC152: =RC[-46] -> 0 | BD152: =RC[-46] -> 0 | BE152: =RC[-46] -> 0 | BF152: =RC[-46] -> 0 | BG152: =RC[-46] -> 0 | BH152: =RC[-46] -> 0 | BI152: =RC[-46] -> 0 | BJ152: =RC[-46] -> 0 | BK152: =RC[-46] -> 2480626 | BL152: =RC[-46] -> 0 | BM152: =RC[-46] -> 0 | BN152: =RC[-46] -> 0 | BO152: =RC[-46] -> 24806.26 | BP152: =RC[-46] -> 0 | BQ152: =RC[-46] -> 2455819.7400000002 | BR152: =RC[-46] -> 0 | BS152: =RC[-46] -> 0 | BT152: =RC[-46] -> 0 | BU152: =RC[-46] -> 0 | BV152: =RC[-46] -> 0 | BW152: =RC[-46] -> 0 | BX152: =RC[-46] -> 0 | BY152: =RC[-46] -> 0 | BZ152: =RC[-46] -> 0 | CA152: =RC[-46] -> 0 | CB152: =RC[-46] -> 0 | CC152: =RC[-46] -> 0 | CD152: =RC[-46] -> 2480626 | CE152: =RC[-46] -> 0 | CF152: =RC[-46] -> 0 | CG152: =RC[-46] -> 0 | CH152: =RC[-46] -> 0 | CI152: =RC[-46] -> 0 | CJ152: =RC[-46] -> 0 | CK152: =RC[-46] -> 0 | CL152: =RC[-46] -> 1 | CM152: =RC[-46] -> 0 | CN152: =RC[-46] -> 0 | CO152: =RC[-46] -> 2455819.7400000002 | CP152: =RC[-46] -> 0 | CQ152: =RC[-46] -> 0 | CR152: =RC[-46] -> 0 | CS152: =RC[-46] -> 0
A153: 26 | B153: 010621 | C153: Hoàng Anh Trang | D153: NV PVHK | E153: 10520209504016 | F153: =RC[29]+RC[30]+RC[31]+RC[32]+RC[33]+RC[34]+RC[35]+RC[36]+RC[37] -> 4961251 | G153: =RC[17]+RC[18]++RC[19]+RC[20]+RC[21]+RC[38]+RC[39]+RC[41] -> 0 | H153: 0 | I153: 0 | J153: =RC[-2]+RC[-1] -> 0 | K153: 0 | L153: 680000 | M153: 283763 | N153: =RC[15]+RC[16]+RC[17]+RC[18]+RC[19]+RC[20] -> 284712 | O153: 0 | P153: 0 | Q153: 6209726 | R153: 216200 | S153: 40538 | T153: 27025 | U153: 59259.63 | V153: 0 | W153: 5866703.3700000001 | X153: 0 | Y153: 0 | Z153: 0 | AA153: 0 | AB153: 0 | AC153: 0 | AD153: 0 | AE153: 0 | AF153: 0 | AG153: 0 | AH153: 284712 | AI153: 4961251 | AJ153: 0 | AK153: 0 | AL153: 0 | AM153: 0 | AN153: 0 | AO153: 0 | AP153: 0 | AQ153: 0 | AR153: =1 -> 1 | AS153: 0 | AT153: 0 | AU153: =RC[-30]-RC[-29]-RC[-28]-RC[-27]-RC[-26]-RC[-25] -> 5866703.3700000001 | AV153: 0 | AW153: =RC[1]-RC[2] -> 94904 | AX153: 284712 | AY153: 189808 | AZ153: =RC[-46] -> 4961251 | BA153: =RC[-46] -> 0 | BB153: =RC[-46] -> 0 | BC153: =RC[-46] -> 0 | BD153: =RC[-46] -> 0 | BE153: =RC[-46] -> 0 | BF153: =RC[-46] -> 680000 | BG153: =RC[-46] -> 283763 | BH153: =RC[-46] -> 284712 | BI153: =RC[-46] -> 0 | BJ153: =RC[-46] -> 0 | BK153: =RC[-46] -> 6209726 | BL153: =RC[-46] -> 216200 | BM153: =RC[-46] -> 40538 | BN153: =RC[-46] -> 27025 | BO153: =RC[-46] -> 59259.63 | BP153: =RC[-46] -> 0 | BQ153: =RC[-46] -> 5866703.3700000001 | BR153: =RC[-46] -> 0 | BS153: =RC[-46] -> 0 | BT153: =RC[-46] -> 0 | BU153: =RC[-46] -> 0 | BV153: =RC[-46] -> 0 | BW153: =RC[-46] -> 0 | BX153: =RC[-46] -> 0 | BY153: =RC[-46] -> 0 | BZ153: =RC[-46] -> 0 | CA153: =RC[-46] -> 0 | CB153: =RC[-46] -> 284712 | CC153: =RC[-46] -> 4961251 | CD153: =RC[-46] -> 0 | CE153: =RC[-46] -> 0 | CF153: =RC[-46] -> 0 | CG153: =RC[-46] -> 0 | CH153: =RC[-46] -> 0 | CI153: =RC[-46] -> 0 | CJ153: =RC[-46] -> 0 | CK153: =RC[-46] -> 0 | CL153: =RC[-46] -> 1 | CM153: =RC[-46] -> 0 | CN153: =RC[-46] -> 0 | CO153: =RC[-46] -> 5866703.3700000001 | CP153: =RC[-46] -> 0 | CQ153: =RC[-46] -> 94904 | CR153: =RC[-46] -> 284712 | CS153: =RC[-46] -> 189808
A154: 27 | B154: 011111 | C154: Phạm Kim Hoàn | D154: NV PVHK | E154: 19026970093011 | F154: =RC[29]+RC[30]+RC[31]+RC[32]+RC[33]+RC[34]+RC[35]+RC[36]+RC[37] -> 4669413 | G154: =RC[17]+RC[18]++RC[19]+RC[20]+RC[21]+RC[38]+RC[39]+RC[41] -> 0 | H154: 0 | I154: 0 | J154: =RC[-2]+RC[-1] -> 0 | K154: 0 | L154: 680000 | M154: 241500 | N154: =RC[15]+RC[16]+RC[17]+RC[18]+RC[19]+RC[20] -> 242308 | O154: 0 | P154: 0 | Q154: 5833221 | R154: 184000 | S154: 34500 | T154: 23000 | U154: 55917.21 | V154: 0 | W154: 5535803.79 | X154: 0 | Y154: 0 | Z154: 0 | AA154: 0 | AB154: 0 | AC154: 0 | AD154: 0 | AE154: 0 | AF154: 0 | AG154: 0 | AH154: 242308 | AI154: 4669413 | AJ154: 0 | AK154: 0 | AL154: 0 | AM154: 0 | AN154: 0 | AO154: 0 | AP154: 0 | AQ154: 0 | AR154: =1 -> 1 | AS154: 0 | AT154: 0 | AU154: =RC[-30]-RC[-29]-RC[-28]-RC[-27]-RC[-26]-RC[-25] -> 5535803.79 | AV154: 0 | AW154: =RC[1]-RC[2] -> 80769.333000000013 | AX154: 242308 | AY154: 161538.66699999999 | AZ154: =RC[-46] -> 4669413 | BA154: =RC[-46] -> 0 | BB154: =RC[-46] -> 0 | BC154: =RC[-46] -> 0 | BD154: =RC[-46] -> 0 | BE154: =RC[-46] -> 0 | BF154: =RC[-46] -> 680000 | BG154: =RC[-46] -> 241500 | BH154: =RC[-46] -> 242308 | BI154: =RC[-46] -> 0 | BJ154: =RC[-46] -> 0 | BK154: =RC[-46] -> 5833221 | BL154: =RC[-46] -> 184000 | BM154: =RC[-46] -> 34500 | BN154: =RC[-46] -> 23000 | BO154: =RC[-46] -> 55917.21 | BP154: =RC[-46] -> 0 | BQ154: =RC[-46] -> 5535803.79 | BR154: =RC[-46] -> 0 | BS154: =RC[-46] -> 0 | BT154: =RC[-46] -> 0 | BU154: =RC[-46] -> 0 | BV154: =RC[-46] -> 0 | BW154: =RC[-46] -> 0 | BX154: =RC[-46] -> 0 | BY154: =RC[-46] -> 0 | BZ154: =RC[-46] -> 0 | CA154: =RC[-46] -> 0 | CB154: =RC[-46] -> 242308 | CC154: =RC[-46] -> 4669413 | CD154: =RC[-46] -> 0 | CE154: =RC[-46] -> 0 | CF154: =RC[-46] -> 0 | CG154: =RC[-46] -> 0 | CH154: =RC[-46] -> 0 | CI154: =RC[-46] -> 0 | CJ154: =RC[-46] -> 0 | CK154: =RC[-46] -> 0 | CL154: =RC[-46] -> 1 | CM154: =RC[-46] -> 0 | CN154: =RC[-46] -> 0 | CO154: =RC[-46] -> 5535803.79 | CP154: =RC[-46] -> 0 | CQ154: =RC[-46] -> 80769.333000000013 | CR154: =RC[-46] -> 242308 | CS154: =RC[-46] -> 161538.66699999999
A155: 28 | B155: 011116 | C155: Đỗ Thanh Bình | D155: NV PVHK | E155: 19026970098011 | F155: =RC[29]+RC[30]+RC[31]+RC[32]+RC[33]+RC[34]+RC[35]+RC[36]+RC[37] -> 5253090 | G155: =RC[17]+RC[18]++RC[19]+RC[20]+RC[21]+RC[38]+RC[39]+RC[41] -> 0 | H155: 0 | I155: 0 | J155: =RC[-2]+RC[-1] -> 0 | K155: 0 | L155: 680000 | M155: 241500 | N155: =RC[15]+RC[16]+RC[17]+RC[18]+RC[19]+RC[20] -> 242308 | O155: 0 | P155: 0 | Q155: 6416898 | R155: 184000 | S155: 34500 | T155: 23000 | U155: 61753.98 | V155: 0 | W155: 6113644.0199999996 | X155: 0 | Y155: 0 | Z155: 0 | AA155: 0 | AB155: 0 | AC155: 0 | AD155: 0 | AE155: 0 | AF155: 0 | AG155: 0 | AH155: 242308 | AI155: 5253090 | AJ155: 0 | AK155: 0 | AL155: 0 | AM155: 0 | AN155: 0 | AO155: 0 | AP155: 0 | AQ155: 0 | AR155: =1 -> 1 | AS155: 0 | AT155: 0 | AU155: =RC[-30]-RC[-29]-RC[-28]-RC[-27]-RC[-26]-RC[-25] -> 6113644.0199999996 | AV155: 0 | AW155: =RC[1]-RC[2] -> 80769.333000000013 | AX155: 242308 | AY155: 161538.66699999999 | AZ155: =RC[-46] -> 5253090 | BA155: =RC[-46] -> 0 | BB155: =RC[-46] -> 0 | BC155: =RC[-46] -> 0 | BD155: =RC[-46] -> 0 | BE155: =RC[-46] -> 0 | BF155: =RC[-46] -> 680000 | BG155: =RC[-46] -> 241500 | BH155: =RC[-46] -> 242308 | BI155: =RC[-46] -> 0 | BJ155: =RC[-46] -> 0 | BK155: =RC[-46] -> 6416898 | BL155: =RC[-46] -> 184000 | BM155: =RC[-46] -> 34500 | BN155: =RC[-46] -> 23000 | BO155: =RC[-46] -> 61753.98 | BP155: =RC[-46] -> 0 | BQ155: =RC[-46] -> 6113644.0199999996 | BR155: =RC[-46] -> 0 | BS155: =RC[-46] -> 0 | BT155: =RC[-46] -> 0 | BU155: =RC[-46] -> 0 | BV155: =RC[-46] -> 0 | BW155: =RC[-46] -> 0 | BX155: =RC[-46] -> 0 | BY155: =RC[-46] -> 0 | BZ155: =RC[-46] -> 0 | CA155: =RC[-46] -> 0 | CB155: =RC[-46] -> 242308 | CC155: =RC[-46] -> 5253090 | CD155: =RC[-46] -> 0 | CE155: =RC[-46] -> 0 | CF155: =RC[-46] -> 0 | CG155: =RC[-46] -> 0 | CH155: =RC[-46] -> 0 | CI155: =RC[-46] -> 0 | CJ155: =RC[-46] -> 0 | CK155: =RC[-46] -> 0 | CL155: =RC[-46] -> 1 | CM155: =RC[-46] -> 0 | CN155: =RC[-46] -> 0 | CO155: =RC[-46] -> 6113644.0199999996 | CP155: =RC[-46] -> 0 | CQ155: =RC[-46] -> 80769.333000000013 | CR155: =RC[-46] -> 242308 | CS155: =RC[-46] -> 161538.66699999999
A156: 29 | B156: 011119 | C156: Nguyễn Hương Quỳnh | D156: NV PVHK | E156: 19026970101012 | F156: =RC[29]+RC[30]+RC[31]+RC[32]+RC[33]+RC[34]+RC[35]+RC[36]+RC[37] -> 5253090 | G156: =RC[17]+RC[18]++RC[19]+RC[20]+RC[21]+RC[38]+RC[39]+RC[41] -> 0 | H156: 0 | I156: 0 | J156: =RC[-2]+RC[-1] -> 0 | K156: 0 | L156: 680000 | M156: 241500 | N156: =RC[15]+RC[16]+RC[17]+RC[18]+RC[19]+RC[20] -> 242308 | O156: 0 | P156: 0 | Q156: 6416898 | R156: 184000 | S156: 34500 | T156: 23000 | U156: 61753.98 | V156: 0 | W156: 6113644.0199999996 | X156: 0 | Y156: 0 | Z156: 0 | AA156: 0 | AB156: 0 | AC156: 0 | AD156: 0 | AE156: 0 | AF156: 0 | AG156: 0 | AH156: 242308 | AI156: 5253090 | AJ156: 0 | AK156: 0 | AL156: 0 | AM156: 0 | AN156: 0 | AO156: 0 | AP156: 0 | AQ156: 0 | AR156: =1 -> 1 | AS156: 0 | AT156: 0 | AU156: =RC[-30]-RC[-29]-RC[-28]-RC[-27]-RC[-26]-RC[-25] -> 6113644.0199999996 | AV156: 0 | AW156: =RC[1]-RC[2] -> 80769.333000000013 | AX156: 242308 | AY156: 161538.66699999999 | AZ156: =RC[-46] -> 5253090 | BA156: =RC[-46] -> 0 | BB156: =RC[-46] -> 0 | BC156: =RC[-46] -> 0 | BD156: =RC[-46] -> 0 | BE156: =RC[-46] -> 0 | BF156: =RC[-46] -> 680000 | BG156: =RC[-46] -> 241500 | BH156: =RC[-46] -> 242308 | BI156: =RC[-46] -> 0 | BJ156: =RC[-46] -> 0 | BK156: =RC[-46] -> 6416898 | BL156: =RC[-46] -> 184000 | BM156: =RC[-46] -> 34500 | BN156: =RC[-46] -> 23000 | BO156: =RC[-46] -> 61753.98 | BP156: =RC[-46] -> 0 | BQ156: =RC[-46] -> 6113644.0199999996 | BR156: =RC[-46] -> 0 | BS156: =RC[-46] -> 0 | BT156: =RC[-46] -> 0 | BU156: =RC[-46] -> 0 | BV156: =RC[-46] -> 0 | BW156: =RC[-46] -> 0 | BX156: =RC[-46] -> 0 | BY156: =RC[-46] -> 0 | BZ156: =RC[-46] -> 0 | CA156: =RC[-46] -> 0 | CB156: =RC[-46] -> 242308 | CC156: =RC[-46] -> 5253090 | CD156: =RC[-46] -> 0 | CE156: =RC[-46] -> 0 | CF156: =RC[-46] -> 0 | CG156: =RC[-46] -> 0 | CH156: =RC[-46] -> 0 | CI156: =RC[-46] -> 0 | CJ156: =RC[-46] -> 0 | CK156: =RC[-46] -> 0 | CL156: =RC[-46] -> 1 | CM156: =RC[-46] -> 0 | CN156: =RC[-46] -> 0 | CO156: =RC[-46] -> 6113644.0199999996 | CP156: =RC[-46] -> 0 | CQ156: =RC[-46] -> 80769.333000000013 | CR156: =RC[-46] -> 242308 | CS156: =RC[-46] -> 161538.66699999999
A157: 30 | B157: 011123 | C157: Bùi Thị Bảo Ngọc | D157: NV PVHK | E157: 19026970104011 | F157: =RC[29]+RC[30]+RC[31]+RC[32]+RC[33]+RC[34]+RC[35]+RC[36]+RC[37] -> 4669413 | G157: =RC[17]+RC[18]++RC[19]+RC[20]+RC[21]+RC[38]+RC[39]+RC[41] -> 0 | H157: 0 | I157: 0 | J157: =RC[-2]+RC[-1] -> 0 | K157: 0 | L157: 680000 | M157: 241500 | N157: =RC[15]+RC[16]+RC[17]+RC[18]+RC[19]+RC[20] -> 242308 | O157: 0 | P157: 0 | Q157: 5833221 | R157: 184000 | S157: 34500 | T157: 23000 | U157: 55917.21 | V157: 0 | W157: 5535803.79 | X157: 0 | Y157: 0 | Z157: 0 | AA157: 0 | AB157: 0 | AC157: 0 | AD157: 0 | AE157: 0 | AF157: 0 | AG157: 0 | AH157: 242308 | AI157: 4669413 | AJ157: 0 | AK157: 0 | AL157: 0 | AM157: 0 | AN157: 0 | AO157: 0 | AP157: 0 | AQ157: 0 | AR157: =1 -> 1 | AS157: 0 | AT157: 0 | AU157: =RC[-30]-RC[-29]-RC[-28]-RC[-27]-RC[-26]-RC[-25] -> 5535803.79 | AV157: 0 | AW157: =RC[1]-RC[2] -> 80769.333000000013 | AX157: 242308 | AY157: 161538.66699999999 | AZ157: =RC[-46] -> 4669413 | BA157: =RC[-46] -> 0 | BB157: =RC[-46] -> 0 | BC157: =RC[-46] -> 0 | BD157: =RC[-46] -> 0 | BE157: =RC[-46] -> 0 | BF157: =RC[-46] -> 680000 | BG157: =RC[-46] -> 241500 | BH157: =RC[-46] -> 242308 | BI157: =RC[-46] -> 0 | BJ157: =RC[-46] -> 0 | BK157: =RC[-46] -> 5833221 | BL157: =RC[-46] -> 184000 | BM157: =RC[-46] -> 34500 | BN157: =RC[-46] -> 23000 | BO157: =RC[-46] -> 55917.21 | BP157: =RC[-46] -> 0 | BQ157: =RC[-46] -> 5535803.79 | BR157: =RC[-46] -> 0 | BS157: =RC[-46] -> 0 | BT157: =RC[-46] -> 0 | BU157: =RC[-46] -> 0 | BV157: =RC[-46] -> 0 | BW157: =RC[-46] -> 0 | BX157: =RC[-46] -> 0 | BY157: =RC[-46] -> 0 | BZ157: =RC[-46] -> 0 | CA157: =RC[-46] -> 0 | CB157: =RC[-46] -> 242308 | CC157: =RC[-46] -> 4669413 | CD157: =RC[-46] -> 0 | CE157: =RC[-46] -> 0 | CF157: =RC[-46] -> 0 | CG157: =RC[-46] -> 0 | CH157: =RC[-46] -> 0 | CI157: =RC[-46] -> 0 | CJ157: =RC[-46] -> 0 | CK157: =RC[-46] -> 0 | CL157: =RC[-46] -> 1 | CM157: =RC[-46] -> 0 | CN157: =RC[-46] -> 0 | CO157: =RC[-46] -> 5535803.79 | CP157: =RC[-46] -> 0 | CQ157: =RC[-46] -> 80769.333000000013 | CR157: =RC[-46] -> 242308 | CS157: =RC[-46] -> 161538.66699999999
A158: 31 | B158: 011764 | C158: Nguyễn Thu Huyền | D158: NV PVHK | E158: 19027522771011 | F158: =RC[29]+RC[30]+RC[31]+RC[32]+RC[33]+RC[34]+RC[35]+RC[36]+RC[37] -> 0 | G158: =RC[17]+RC[18]++RC[19]+RC[20]+RC[21]+RC[38]+RC[39]+RC[41] -> 0 | H158: 0 | I158: 0 | J158: =RC[-2]+RC[-1] -> 0 | K158: 0 | L158: 0 | M158: 0 | N158: =RC[15]+RC[16]+RC[17]+RC[18]+RC[19]+RC[20] -> 0 | O158: 0 | P158: 0 | Q158: 0 | R158: 184000 | S158: 34500 | T158: 23000 | U158: 0 | V158: 0 | W158: -241500 | X158: 0 | Y158: 0 | Z158: 0 | AA158: 0 | AB158: 0 | AC158: 0 | AD158: 0 | AE158: 0 | AF158: 0 | AG158: 0 | AH158: 0 | AI158: 0 | AJ158: 0 | AK158: 0 | AL158: 0 | AM158: 0 | AN158: 0 | AO158: 0 | AP158: 0 | AQ158: 0 | AR158: =1 -> 1 | AS158: 0 | AT158: 0 | AU158: =RC[-30]-RC[-29]-RC[-28]-RC[-27]-RC[-26]-RC[-25] -> -241500 | AV158: 0 | AW158: =RC[1]-RC[2] -> 0 | AX158: 0 | AY158: 0 | AZ158: =RC[-46] -> 0 | BA158: =RC[-46] -> 0 | BB158: =RC[-46] -> 0 | BC158: =RC[-46] -> 0 | BD158: =RC[-46] -> 0 | BE158: =RC[-46] -> 0 | BF158: =RC[-46] -> 0 | BG158: =RC[-46] -> 0 | BH158: =RC[-46] -> 0 | BI158: =RC[-46] -> 0 | BJ158: =RC[-46] -> 0 | BK158: =RC[-46] -> 0 | BL158: =RC[-46] -> 184000 | BM158: =RC[-46] -> 34500 | BN158: =RC[-46] -> 23000 | BO158: =RC[-46] -> 0 | BP158: =RC[-46] -> 0 | BQ158: =RC[-46] -> -241500 | BR158: =RC[-46] -> 0 | BS158: =RC[-46] -> 0 | BT158: =RC[-46] -> 0 | BU158: =RC[-46] -> 0 | BV158: =RC[-46] -> 0 | BW158: =RC[-46] -> 0 | BX158: =RC[-46] -> 0 | BY158: =RC[-46] -> 0 | BZ158: =RC[-46] -> 0 | CA158: =RC[-46] -> 0 | CB158: =RC[-46] -> 0 | CC158: =RC[-46] -> 0 | CD158: =RC[-46] -> 0 | CE158: =RC[-46] -> 0 | CF158: =RC[-46] -> 0 | CG158: =RC[-46] -> 0 | CH158: =RC[-46] -> 0 | CI158: =RC[-46] -> 0 | CJ158: =RC[-46] -> 0 | CK158: =RC[-46] -> 0 | CL158: =RC[-46] -> 1 | CM158: =RC[-46] -> 0 | CN158: =RC[-46] -> 0 | CO158: =RC[-46] -> -241500 | CP158: =RC[-46] -> 0 | CQ158: =RC[-46] -> 0 | CR158: =RC[-46] -> 0 | CS158: =RC[-46] -> 0
A159: 32 | B159: 012281 | C159: Nguyễn Minh Phương | D159: NV PVHK | E159: 19021264267771 | F159: =RC[29]+RC[30]+RC[31]+RC[32]+RC[33]+RC[34]+RC[35]+RC[36]+RC[37] -> 2334706 | G159: =RC[17]+RC[18]++RC[19]+RC[20]+RC[21]+RC[38]+RC[39]+RC[41] -> 0 | H159: 0 | I159: 0 | J159: =RC[-2]+RC[-1] -> 0 | K159: 0 | L159: 0 | M159: 0 | N159: =RC[15]+RC[16]+RC[17]+RC[18]+RC[19]+RC[20] -> 0 | O159: 0 | P159: 0 | Q159: 2334706 | R159: 0 | S159: 0 | T159: 0 | U159: 23347.06 | V159: 0 | W159: 2311358.94 | X159: 0 | Y159: 0 | Z159: 0 | AA159: 0 | AB159: 0 | AC159: 0 | AD159: 0 | AE159: 0 | AF159: 0 | AG159: 0 | AH159: 0 | AI159: 0 | AJ159: 2334706 | AK159: 0 | AL159: 0 | AM159: 0 | AN159: 0 | AO159: 0 | AP159: 0 | AQ159: 0 | AR159: =1 -> 1 | AS159: 0 | AT159: 0 | AU159: =RC[-30]-RC[-29]-RC[-28]-RC[-27]-RC[-26]-RC[-25] -> 2311358.94 | AV159: 0 | AW159: =RC[1]-RC[2] -> 0 | AX159: 0 | AY159: 0 | AZ159: =RC[-46] -> 2334706 | BA159: =RC[-46] -> 0 | BB159: =RC[-46] -> 0 | BC159: =RC[-46] -> 0 | BD159: =RC[-46] -> 0 | BE159: =RC[-46] -> 0 | BF159: =RC[-46] -> 0 | BG159: =RC[-46] -> 0 | BH159: =RC[-46] -> 0 | BI159: =RC[-46] -> 0 | BJ159: =RC[-46] -> 0 | BK159: =RC[-46] -> 2334706 | BL159: =RC[-46] -> 0 | BM159: =RC[-46] -> 0 | BN159: =RC[-46] -> 0 | BO159: =RC[-46] -> 23347.06 | BP159: =RC[-46] -> 0 | BQ159: =RC[-46] -> 2311358.94 | BR159: =RC[-46] -> 0 | BS159: =RC[-46] -> 0 | BT159: =RC[-46] -> 0 | BU159: =RC[-46] -> 0 | BV159: =RC[-46] -> 0 | BW159: =RC[-46] -> 0 | BX159: =RC[-46] -> 0 | BY159: =RC[-46] -> 0 | BZ159: =RC[-46] -> 0 | CA159: =RC[-46] -> 0 | CB159: =RC[-46] -> 0 | CC159: =RC[-46] -> 0 | CD159: =RC[-46] -> 2334706 | CE159: =RC[-46] -> 0 | CF159: =RC[-46] -> 0 | CG159: =RC[-46] -> 0 | CH159: =RC[-46] -> 0 | CI159: =RC[-46] -> 0 | CJ159: =RC[-46] -> 0 | CK159: =RC[-46] -> 0 | CL159: =RC[-46] -> 1 | CM159: =RC[-46] -> 0 | CN159: =RC[-46] -> 0 | CO159: =RC[-46] -> 2311358.94 | CP159: =RC[-46] -> 0 | CQ159: =RC[-46] -> 0 | CR159: =RC[-46] -> 0 | CS159: =RC[-46] -> 0
A160: 33 | B160: 013097 | C160: Nguyễn Thu Quỳnh | D160: NV PVHK | E160: 19028834686018 | F160: =RC[29]+RC[30]+RC[31]+RC[32]+RC[33]+RC[34]+RC[35]+RC[36]+RC[37] -> 3268589 | G160: =RC[17]+RC[18]++RC[19]+RC[20]+RC[21]+RC[38]+RC[39]+RC[41] -> 0 | H160: 0 | I160: 0 | J160: =RC[-2]+RC[-1] -> 0 | K160: 0 | L160: 680000 | M160: 0 | N160: =RC[15]+RC[16]+RC[17]+RC[18]+RC[19]+RC[20] -> 0 | O160: 0 | P160: 0 | Q160: 3948589 | R160: 0 | S160: 0 | T160: 0 | U160: 39485.89 | V160: 0 | W160: 3909103.11 | X160: 0 | Y160: 0 | Z160: 0 | AA160: 0 | AB160: 0 | AC160: 0 | AD160: 0 | AE160: 0 | AF160: 0 | AG160: 0 | AH160: 0 | AI160: 3268589 | AJ160: 0 | AK160: 0 | AL160: 0 | AM160: 0 | AN160: 0 | AO160: 0 | AP160: 0 | AQ160: 0 | AR160: =1 -> 1 | AS160: 0 | AT160: 0 | AU160: =RC[-30]-RC[-29]-RC[-28]-RC[-27]-RC[-26]-RC[-25] -> 3909103.11 | AV160: 0 | AW160: =RC[1]-RC[2] -> 0 | AX160: 0 | AY160: 0 | AZ160: =RC[-46] -> 3268589 | BA160: =RC[-46] -> 0 | BB160: =RC[-46] -> 0 | BC160: =RC[-46] -> 0 | BD160: =RC[-46] -> 0 | BE160: =RC[-46] -> 0 | BF160: =RC[-46] -> 680000 | BG160: =RC[-46] -> 0 | BH160: =RC[-46] -> 0 | BI160: =RC[-46] -> 0 | BJ160: =RC[-46] -> 0 | BK160: =RC[-46] -> 3948589 | BL160: =RC[-46] -> 0 | BM160: =RC[-46] -> 0 | BN160: =RC[-46] -> 0 | BO160: =RC[-46] -> 39485.89 | BP160: =RC[-46] -> 0 | BQ160: =RC[-46] -> 3909103.11 | BR160: =RC[-46] -> 0 | BS160: =RC[-46] -> 0 | BT160: =RC[-46] -> 0 | BU160: =RC[-46] -> 0 | BV160: =RC[-46] -> 0 | BW160: =RC[-46] -> 0 | BX160: =RC[-46] -> 0 | BY160: =RC[-46] -> 0 | BZ160: =RC[-46] -> 0 | CA160: =RC[-46] -> 0 | CB160: =RC[-46] -> 0 | CC160: =RC[-46] -> 3268589 | CD160: =RC[-46] -> 0 | CE160: =RC[-46] -> 0 | CF160: =RC[-46] -> 0 | CG160: =RC[-46] -> 0 | CH160: =RC[-46] -> 0 | CI160: =RC[-46] -> 0 | CJ160: =RC[-46] -> 0 | CK160: =RC[-46] -> 0 | CL160: =RC[-46] -> 1 | CM160: =RC[-46] -> 0 | CN160: =RC[-46] -> 0 | CO160: =RC[-46] -> 3909103.11 | CP160: =RC[-46] -> 0 | CQ160: =RC[-46] -> 0 | CR160: =RC[-46] -> 0 | CS160: =RC[-46] -> 0
A161: 34 | B161: 013101 | C161: Trần Thị Huệ | D161: NV PVHK | E161: 19028834680011 | F161: =RC[29]+RC[30]+RC[31]+RC[32]+RC[33]+RC[34]+RC[35]+RC[36]+RC[37] -> 3268589 | G161: =RC[17]+RC[18]++RC[19]+RC[20]+RC[21]+RC[38]+RC[39]+RC[41] -> 0 | H161: 0 | I161: 0 | J161: =RC[-2]+RC[-1] -> 0 | K161: 0 | L161: 680000 | M161: 0 | N161: =RC[15]+RC[16]+RC[17]+RC[18]+RC[19]+RC[20] -> 0 | O161: 0 | P161: 0 | Q161: 3948589 | R161: 0 | S161: 0 | T161: 0 | U161: 39485.89 | V161: 0 | W161: 3909103.11 | X161: 0 | Y161: 0 | Z161: 0 | AA161: 0 | AB161: 0 | AC161: 0 | AD161: 0 | AE161: 0 | AF161: 0 | AG161: 0 | AH161: 0 | AI161: 3268589 | AJ161: 0 | AK161: 0 | AL161: 0 | AM161: 0 | AN161: 0 | AO161: 0 | AP161: 0 | AQ161: 0 | AR161: =1 -> 1 | AS161: 0 | AT161: 0 | AU161: =RC[-30]-RC[-29]-RC[-28]-RC[-27]-RC[-26]-RC[-25] -> 3909103.11 | AV161: 0 | AW161: =RC[1]-RC[2] -> 0 | AX161: 0 | AY161: 0 | AZ161: =RC[-46] -> 3268589 | BA161: =RC[-46] -> 0 | BB161: =RC[-46] -> 0 | BC161: =RC[-46] -> 0 | BD161: =RC[-46] -> 0 | BE161: =RC[-46] -> 0 | BF161: =RC[-46] -> 680000 | BG161: =RC[-46] -> 0 | BH161: =RC[-46] -> 0 | BI161: =RC[-46] -> 0 | BJ161: =RC[-46] -> 0 | BK161: =RC[-46] -> 3948589 | BL161: =RC[-46] -> 0 | BM161: =RC[-46] -> 0 | BN161: =RC[-46] -> 0 | BO161: =RC[-46] -> 39485.89 | BP161: =RC[-46] -> 0 | BQ161: =RC[-46] -> 3909103.11 | BR161: =RC[-46] -> 0 | BS161: =RC[-46] -> 0 | BT161: =RC[-46] -> 0 | BU161: =RC[-46] -> 0 | BV161: =RC[-46] -> 0 | BW161: =RC[-46] -> 0 | BX161: =RC[-46] -> 0 | BY161: =RC[-46] -> 0 | BZ161: =RC[-46] -> 0 | CA161: =RC[-46] -> 0 | CB161: =RC[-46] -> 0 | CC161: =RC[-46] -> 3268589 | CD161: =RC[-46] -> 0 | CE161: =RC[-46] -> 0 | CF161: =RC[-46] -> 0 | CG161: =RC[-46] -> 0 | CH161: =RC[-46] -> 0 | CI161: =RC[-46] -> 0 | CJ161: =RC[-46] -> 0 | CK161: =RC[-46] -> 0 | CL161: =RC[-46] -> 1 | CM161: =RC[-46] -> 0 | CN161: =RC[-46] -> 0 | CO161: =RC[-46] -> 3909103.11 | CP161: =RC[-46] -> 0 | CQ161: =RC[-46] -> 0 | CR161: =RC[-46] -> 0 | CS161: =RC[-46] -> 0
A162: 35 | B162: 013532 | C162: Nguyễn Tuấn Cường | D162: NV PVHK | E162: 19028960219018 | F162: =RC[29]+RC[30]+RC[31]+RC[32]+RC[33]+RC[34]+RC[35]+RC[36]+RC[37] -> 3268589 | G162: =RC[17]+RC[18]++RC[19]+RC[20]+RC[21]+RC[38]+RC[39]+RC[41] -> 0 | H162: 0 | I162: 0 | J162: =RC[-2]+RC[-1] -> 0 | K162: 0 | L162: 680000 | M162: 0 | N162: =RC[15]+RC[16]+RC[17]+RC[18]+RC[19]+RC[20] -> 0 | O162: 0 | P162: 0 | Q162: 3948589 | R162: 0 | S162: 0 | T162: 0 | U162: 39485.89 | V162: 0 | W162: 3909103.11 | X162: 0 | Y162: 0 | Z162: 0 | AA162: 0 | AB162: 0 | AC162: 0 | AD162: 0 | AE162: 0 | AF162: 0 | AG162: 0 | AH162: 0 | AI162: 3268589 | AJ162: 0 | AK162: 0 | AL162: 0 | AM162: 0 | AN162: 0 | AO162: 0 | AP162: 0 | AQ162: 0 | AR162: =1 -> 1 | AS162: 0 | AT162: 0 | AU162: =RC[-30]-RC[-29]-RC[-28]-RC[-27]-RC[-26]-RC[-25] -> 3909103.11 | AV162: 0 | AW162: =RC[1]-RC[2] -> 0 | AX162: 0 | AY162: 0 | AZ162: =RC[-46] -> 3268589 | BA162: =RC[-46] -> 0 | BB162: =RC[-46] -> 0 | BC162: =RC[-46] -> 0 | BD162: =RC[-46] -> 0 | BE162: =RC[-46] -> 0 | BF162: =RC[-46] -> 680000 | BG162: =RC[-46] -> 0 | BH162: =RC[-46] -> 0 | BI162: =RC[-46] -> 0 | BJ162: =RC[-46] -> 0 | BK162: =RC[-46] -> 3948589 | BL162: =RC[-46] -> 0 | BM162: =RC[-46] -> 0 | BN162: =RC[-46] -> 0 | BO162: =RC[-46] -> 39485.89 | BP162: =RC[-46] -> 0 | BQ162: =RC[-46] -> 3909103.11 | BR162: =RC[-46] -> 0 | BS162: =RC[-46] -> 0 | BT162: =RC[-46] -> 0 | BU162: =RC[-46] -> 0 | BV162: =RC[-46] -> 0 | BW162: =RC[-46] -> 0 | BX162: =RC[-46] -> 0 | BY162: =RC[-46] -> 0 | BZ162: =RC[-46] -> 0 | CA162: =RC[-46] -> 0 | CB162: =RC[-46] -> 0 | CC162: =RC[-46] -> 3268589 | CD162: =RC[-46] -> 0 | CE162: =RC[-46] -> 0 | CF162: =RC[-46] -> 0 | CG162: =RC[-46] -> 0 | CH162: =RC[-46] -> 0 | CI162: =RC[-46] -> 0 | CJ162: =RC[-46] -> 0 | CK162: =RC[-46] -> 0 | CL162: =RC[-46] -> 1 | CM162: =RC[-46] -> 0 | CN162: =RC[-46] -> 0 | CO162: =RC[-46] -> 3909103.11 | CP162: =RC[-46] -> 0 | CQ162: =RC[-46] -> 0 | CR162: =RC[-46] -> 0 | CS162: =RC[-46] -> 0
A163: 36 | B163: 011357 | C163: Nguyễn Việt Dũng | D163: NV PVHKĐB | E163: 19027089335015 | F163: =RC[29]+RC[30]+RC[31]+RC[32]+RC[33]+RC[34]+RC[35]+RC[36]+RC[37] -> 5253090 | G163: =RC[17]+RC[18]++RC[19]+RC[20]+RC[21]+RC[38]+RC[39]+RC[41] -> 0 | H163: 0 | I163: 0 | J163: =RC[-2]+RC[-1] -> 0 | K163: 0 | L163: 680000 | M163: 241500 | N163: =RC[15]+RC[16]+RC[17]+RC[18]+RC[19]+RC[20] -> 242308 | O163: 0 | P163: 0 | Q163: 6416898 | R163: 184000 | S163: 34500 | T163: 23000 | U163: 61753.98 | V163: 0 | W163: 6113644.0199999996 | X163: 0 | Y163: 0 | Z163: 0 | AA163: 0 | AB163: 0 | AC163: 0 | AD163: 0 | AE163: 0 | AF163: 0 | AG163: 0 | AH163: 242308 | AI163: 5253090 | AJ163: 0 | AK163: 0 | AL163: 0 | AM163: 0 | AN163: 0 | AO163: 0 | AP163: 0 | AQ163: 0 | AR163: =1 -> 1 | AS163: 0 | AT163: 0 | AU163: =RC[-30]-RC[-29]-RC[-28]-RC[-27]-RC[-26]-RC[-25] -> 6113644.0199999996 | AV163: 0 | AW163: =RC[1]-RC[2] -> 80769.333000000013 | AX163: 242308 | AY163: 161538.66699999999 | AZ163: =RC[-46] -> 5253090 | BA163: =RC[-46] -> 0 | BB163: =RC[-46] -> 0 | BC163: =RC[-46] -> 0 | BD163: =RC[-46] -> 0 | BE163: =RC[-46] -> 0 | BF163: =RC[-46] -> 680000 | BG163: =RC[-46] -> 241500 | BH163: =RC[-46] -> 242308 | BI163: =RC[-46] -> 0 | BJ163: =RC[-46] -> 0 | BK163: =RC[-46] -> 6416898 | BL163: =RC[-46] -> 184000 | BM163: =RC[-46] -> 34500 | BN163: =RC[-46] -> 23000 | BO163: =RC[-46] -> 61753.98 | BP163: =RC[-46] -> 0 | BQ163: =RC[-46] -> 6113644.0199999996 | BR163: =RC[-46] -> 0 | BS163: =RC[-46] -> 0 | BT163: =RC[-46] -> 0 | BU163: =RC[-46] -> 0 | BV163: =RC[-46] -> 0 | BW163: =RC[-46] -> 0 | BX163: =RC[-46] -> 0 | BY163: =RC[-46] -> 0 | BZ163: =RC[-46] -> 0 | CA163: =RC[-46] -> 0 | CB163: =RC[-46] -> 242308 | CC163: =RC[-46] -> 5253090 | CD163: =RC[-46] -> 0 | CE163: =RC[-46] -> 0 | CF163: =RC[-46] -> 0 | CG163: =RC[-46] -> 0 | CH163: =RC[-46] -> 0 | CI163: =RC[-46] -> 0 | CJ163: =RC[-46] -> 0 | CK163: =RC[-46] -> 0 | CL163: =RC[-46] -> 1 | CM163: =RC[-46] -> 0 | CN163: =RC[-46] -> 0 | CO163: =RC[-46] -> 6113644.0199999996 | CP163: =RC[-46] -> 0 | CQ163: =RC[-46] -> 80769.333000000013 | CR163: =RC[-46] -> 242308 | CS163: =RC[-46] -> 161538.66699999999
A164: Đội Phục Vụ Hành Khách Đi Nội Địa (HGS) | F164: =SUM(R[-36]C:R[-1]C) -> 169009405 | G164: =SUM(R[-36]C:R[-1]C) -> 0 | H164: =SUM(R[-36]C:R[-1]C) -> 0 | I164: =SUM(R[-36]C:R[-1]C) -> 0 | J164: =SUM(R[-36]C:R[-1]C) -> 0 | K164: =SUM(R[-36]C:R[-1]C) -> 525000 | L164: =SUM(R[-36]C:R[-1]C) -> 22413846 | M164: =SUM(R[-36]C:R[-1]C) -> 6159461 | N164: =SUM(R[-36]C:R[-1]C) -> 5560969 | O164: =SUM(R[-36]C:R[-1]C) -> 0 | P164: =SUM(R[-36]C:R[-1]C) -> 0 | Q164: =SUM(R[-36]C:R[-1]C) -> 203668681 | R164: =SUM(R[-36]C:R[-1]C) -> 4876920 | S164: =SUM(R[-36]C:R[-1]C) -> 914426 | T164: =SUM(R[-36]C:R[-1]C) -> 609615 | U164: =SUM(R[-36]C:R[-1]C) -> 1969243.6399999992 | V164: =SUM(R[-36]C:R[-1]C) -> 0 | W164: =SUM(R[-36]C:R[-1]C) -> 195298476.36000004 | X164: =SUM(R[-36]C:R[-1]C) -> 0 | Y164: =SUM(R[-36]C:R[-1]C) -> 0 | Z164: =SUM(R[-36]C:R[-1]C) -> 0 | AA164: =SUM(R[-36]C:R[-1]C) -> 0 | AB164: =SUM(R[-36]C:R[-1]C) -> 0 | AC164: =SUM(R[-36]C:R[-1]C) -> 0 | AD164: =SUM(R[-36]C:R[-1]C) -> 0 | AE164: =SUM(R[-36]C:R[-1]C) -> 0 | AF164: =SUM(R[-36]C:R[-1]C) -> 0 | AG164: =SUM(R[-36]C:R[-1]C) -> 0 | AH164: =SUM(R[-36]C:R[-1]C) -> 5560969 | AI164: =SUM(R[-36]C:R[-1]C) -> 164194073 | AJ164: =SUM(R[-36]C:R[-1]C) -> 4815332 | AK164: =SUM(R[-36]C:R[-1]C) -> 0 | AL164: =SUM(R[-36]C:R[-1]C) -> 0 | AM164: =SUM(R[-36]C:R[-1]C) -> 0 | AN164: =SUM(R[-36]C:R[-1]C) -> 0 | AO164: =SUM(R[-36]C:R[-1]C) -> 0 | AP164: =SUM(R[-36]C:R[-1]C) -> 0 | AQ164: =SUM(R[-36]C:R[-1]C) -> 0 | AR164: =SUM(R[-36]C:R[-1]C) -> 36 | AS164: =SUM(R[-36]C:R[-1]C) -> 0 | AT164: =SUM(R[-36]C:R[-1]C) -> 0 | AU164: =SUM(R[-36]C:R[-1]C) -> 195298476.36000004 | AV164: =SUM(R[-36]C:R[-1]C) -> 0 | AW164: =SUM(R[-36]C:R[-1]C) -> 1853656.3290000006 | AX164: =SUM(R[-36]C:R[-1]C) -> 5560969 | AY164: =SUM(R[-36]C:R[-1]C) -> 3707312.6709999992
A165: Đội Phục Vụ Hành Khách Đi Quốc Tế (HGS) | F165: =R[40]C -> 190614193 | G165: =R[40]C -> 2195308 | H165: =R[40]C -> 0 | I165: =R[40]C -> 0 | J165: =R[40]C -> 0 | K165: =R[40]C -> 210000 | L165: =R[40]C -> 24166153 | M165: =R[40]C -> 7900677 | N165: =R[40]C -> 5804489 | O165: =R[40]C -> 0 | P165: =R[40]C -> 0 | Q165: =R[40]C -> 230890820 | R165: =R[40]C -> 6019560 | S165: =R[40]C -> 1128672 | T165: =R[40]C -> 752445 | U165: =R[40]C -> 2229901.4299999992 | V165: =R[40]C -> 0 | W165: =R[40]C -> 220760241.56999999 | X165: =R[40]C -> 0 | Y165: =R[40]C -> 2195308 | Z165: =R[40]C -> 0 | AA165: =R[40]C -> 0 | AB165: =R[40]C -> 0 | AC165: =R[40]C -> 0 | AD165: =R[40]C -> 0 | AE165: =R[40]C -> 0 | AF165: =R[40]C -> 0 | AG165: =R[40]C -> 0 | AH165: =R[40]C -> 5804489 | AI165: =R[40]C -> 185069265 | AJ165: =R[40]C -> 5544928 | AK165: =R[40]C -> 0 | AL165: =R[40]C -> 0 | AM165: =R[40]C -> 0 | AN165: =R[40]C -> 0 | AO165: =R[40]C -> 0 | AP165: =R[40]C -> 0 | AQ165: =R[40]C -> 0 | AR165: =R[40]C -> 39 | AS165: =R[40]C -> 0 | AT165: =R[40]C -> 0 | AU165: =R[40]C -> 220760241.56999999 | AW165: =R[40]C -> 1934829.6630000006 | AX165: =R[40]C -> 5804489 | AY165: =R[40]C -> 3869659.3369999989
A166: 1 | B166: 010632 | C166: Trần Thanh Hiếu | D166: Đội phó | E166: 10520178055013 | F166: =RC[29]+RC[30]+RC[31]+RC[32]+RC[33]+RC[34]+RC[35]+RC[36]+RC[37] -> 9543113 | G166: =RC[17]+RC[18]++RC[19]+RC[20]+RC[21]+RC[38]+RC[39]+RC[41] -> 0 | H166: 0 | I166: 0 | J166: =RC[-2]+RC[-1] -> 0 | K166: 210000 | L166: 680000 | M166: 333270 | N166: =RC[15]+RC[16]+RC[17]+RC[18]+RC[19]+RC[20] -> 0 | O166: 0 | P166: 0 | Q166: 10766383 | R166: 253920 | S166: 47610 | T166: 31740 | U166: 104331.13 | V166: 0 | W166: 10328781.869999999 | X166: 0 | Y166: 0 | Z166: 0 | AA166: 0 | AB166: 0 | AC166: 0 | AD166: 0 | AE166: 0 | AF166: 0 | AG166: 0 | AH166: 0 | AI166: 9543113 | AJ166: 0 | AK166: 0 | AL166: 0 | AM166: 0 | AN166: 0 | AO166: 0 | AP166: 0 | AQ166: 0 | AR166: =1 -> 1 | AS166: 0 | AT166: 0 | AU166: =RC[-30]-RC[-29]-RC[-28]-RC[-27]-RC[-26]-RC[-25] -> 10328781.869999999 | AV166: 0 | AW166: =RC[1]-RC[2] -> 0 | AX166: 0 | AY166: 0 | AZ166: =RC[-46] -> 9543113 | BA166: =RC[-46] -> 0 | BB166: =RC[-46] -> 0 | BC166: =RC[-46] -> 0 | BD166: =RC[-46] -> 0 | BE166: =RC[-46] -> 210000 | BF166: =RC[-46] -> 680000 | BG166: =RC[-46] -> 333270 | BH166: =RC[-46] -> 0 | BI166: =RC[-46] -> 0 | BJ166: =RC[-46] -> 0 | BK166: =RC[-46] -> 10766383 | BL166: =RC[-46] -> 253920 | BM166: =RC[-46] -> 47610 | BN166: =RC[-46] -> 31740 | BO166: =RC[-46] -> 104331.13 | BP166: =RC[-46] -> 0 | BQ166: =RC[-46] -> 10328781.869999999 | BR166: =RC[-46] -> 0 | BS166: =RC[-46] -> 0 | BT166: =RC[-46] -> 0 | BU166: =RC[-46] -> 0 | BV166: =RC[-46] -> 0 | BW166: =RC[-46] -> 0 | BX166: =RC[-46] -> 0 | BY166: =RC[-46] -> 0 | BZ166: =RC[-46] -> 0 | CA166: =RC[-46] -> 0 | CB166: =RC[-46] -> 0 | CC166: =RC[-46] -> 9543113 | CD166: =RC[-46] -> 0 | CE166: =RC[-46] -> 0 | CF166: =RC[-46] -> 0 | CG166: =RC[-46] -> 0 | CH166: =RC[-46] -> 0 | CI166: =RC[-46] -> 0 | CJ166: =RC[-46] -> 0 | CK166: =RC[-46] -> 0 | CL166: =RC[-46] -> 1 | CM166: =RC[-46] -> 0 | CN166: =RC[-46] -> 0 | CO166: =RC[-46] -> 10328781.869999999 | CP166: =RC[-46] -> 0 | CQ166: =RC[-46] -> 0 | CR166: =RC[-46] -> 0 | CS166: =RC[-46] -> 0
A167: 2 | B167: 012557 | C167: Nguyễn Thị Lan | D167: Nhân viên phục vụ hành khách hàng hóa | E167: 19026463331014 | F167: =RC[29]+RC[30]+RC[31]+RC[32]+RC[33]+RC[34]+RC[35]+RC[36]+RC[37] -> 4669413 | G167: =RC[17]+RC[18]++RC[19]+RC[20]+RC[21]+RC[38]+RC[39]+RC[41] -> 0 | H167: 0 | I167: 0 | J167: =RC[-2]+RC[-1] -> 0 | K167: 0 | L167: 680000 | M167: 241500 | N167: =RC[15]+RC[16]+RC[17]+RC[18]+RC[19]+RC[20] -> 242308 | O167: 0 | P167: 0 | Q167: 5833221 | R167: 184000 | S167: 34500 | T167: 23000 | U167: 55917.21 | V167: 0 | W167: 5535803.79 | X167: 0 | Y167: 0 | Z167: 0 | AA167: 0 | AB167: 0 | AC167: 0 | AD167: 0 | AE167: 0 | AF167: 0 | AG167: 0 | AH167: 242308 | AI167: 4669413 | AJ167: 0 | AK167: 0 | AL167: 0 | AM167: 0 | AN167: 0 | AO167: 0 | AP167: 0 | AQ167: 0 | AR167: =1 -> 1 | AS167: 0 | AT167: 0 | AU167: =RC[-30]-RC[-29]-RC[-28]-RC[-27]-RC[-26]-RC[-25] -> 5535803.79 | AV167: 0 | AW167: =RC[1]-RC[2] -> 80769.333000000013 | AX167: 242308 | AY167: 161538.66699999999 | AZ167: =RC[-46] -> 4669413 | BA167: =RC[-46] -> 0 | BB167: =RC[-46] -> 0 | BC167: =RC[-46] -> 0 | BD167: =RC[-46] -> 0 | BE167: =RC[-46] -> 0 | BF167: =RC[-46] -> 680000 | BG167: =RC[-46] -> 241500 | BH167: =RC[-46] -> 242308 | BI167: =RC[-46] -> 0 | BJ167: =RC[-46] -> 0 | BK167: =RC[-46] -> 5833221 | BL167: =RC[-46] -> 184000 | BM167: =RC[-46] -> 34500 | BN167: =RC[-46] -> 23000 | BO167: =RC[-46] -> 55917.21 | BP167: =RC[-46] -> 0 | BQ167: =RC[-46] -> 5535803.79 | BR167: =RC[-46] -> 0 | BS167: =RC[-46] -> 0 | BT167: =RC[-46] -> 0 | BU167: =RC[-46] -> 0 | BV167: =RC[-46] -> 0 | BW167: =RC[-46] -> 0 | BX167: =RC[-46] -> 0 | BY167: =RC[-46] -> 0 | BZ167: =RC[-46] -> 0 | CA167: =RC[-46] -> 0 | CB167: =RC[-46] -> 242308 | CC167: =RC[-46] -> 4669413 | CD167: =RC[-46] -> 0 | CE167: =RC[-46] -> 0 | CF167: =RC[-46] -> 0 | CG167: =RC[-46] -> 0 | CH167: =RC[-46] -> 0 | CI167: =RC[-46] -> 0 | CJ167: =RC[-46] -> 0 | CK167: =RC[-46] -> 0 | CL167: =RC[-46] -> 1 | CM167: =RC[-46] -> 0 | CN167: =RC[-46] -> 0 | CO167: =RC[-46] -> 5535803.79 | CP167: =RC[-46] -> 0 | CQ167: =RC[-46] -> 80769.333000000013 | CR167: =RC[-46] -> 242308 | CS167: =RC[-46] -> 161538.66699999999
A168: 3 | B168: 012558 | C168: Tạ Hồng Hạnh | D168: Nhân viên phục vụ hành khách hàng hóa | E168: 19020359029014 | F168: =RC[29]+RC[30]+RC[31]+RC[32]+RC[33]+RC[34]+RC[35]+RC[36]+RC[37] -> 4669413 | G168: =RC[17]+RC[18]++RC[19]+RC[20]+RC[21]+RC[38]+RC[39]+RC[41] -> 0 | H168: 0 | I168: 0 | J168: =RC[-2]+RC[-1] -> 0 | K168: 0 | L168: 680000 | M168: 241500 | N168: =RC[15]+RC[16]+RC[17]+RC[18]+RC[19]+RC[20] -> 0 | O168: 0 | P168: 0 | Q168: 5590913 | R168: 184000 | S168: 34500 | T168: 23000 | U168: 53494.13 | V168: 0 | W168: 5295918.87 | X168: 0 | Y168: 0 | Z168: 0 | AA168: 0 | AB168: 0 | AC168: 0 | AD168: 0 | AE168: 0 | AF168: 0 | AG168: 0 | AH168: 0 | AI168: 4669413 | AJ168: 0 | AK168: 0 | AL168: 0 | AM168: 0 | AN168: 0 | AO168: 0 | AP168: 0 | AQ168: 0 | AR168: =1 -> 1 | AS168: 0 | AT168: 0 | AU168: =RC[-30]-RC[-29]-RC[-28]-RC[-27]-RC[-26]-RC[-25] -> 5295918.87 | AV168: 0 | AW168: =RC[1]-RC[2] -> 0 | AX168: 0 | AY168: 0 | AZ168: =RC[-46] -> 4669413 | BA168: =RC[-46] -> 0 | BB168: =RC[-46] -> 0 | BC168: =RC[-46] -> 0 | BD168: =RC[-46] -> 0 | BE168: =RC[-46] -> 0 | BF168: =RC[-46] -> 680000 | BG168: =RC[-46] -> 241500 | BH168: =RC[-46] -> 0 | BI168: =RC[-46] -> 0 | BJ168: =RC[-46] -> 0 | BK168: =RC[-46] -> 5590913 | BL168: =RC[-46] -> 184000 | BM168: =RC[-46] -> 34500 | BN168: =RC[-46] -> 23000 | BO168: =RC[-46] -> 53494.13 | BP168: =RC[-46] -> 0 | BQ168: =RC[-46] -> 5295918.87 | BR168: =RC[-46] -> 0 | BS168: =RC[-46] -> 0 | BT168: =RC[-46] -> 0 | BU168: =RC[-46] -> 0 | BV168: =RC[-46] -> 0 | BW168: =RC[-46] -> 0 | BX168: =RC[-46] -> 0 | BY168: =RC[-46] -> 0 | BZ168: =RC[-46] -> 0 | CA168: =RC[-46] -> 0 | CB168: =RC[-46] -> 0 | CC168: =RC[-46] -> 4669413 | CD168: =RC[-46] -> 0 | CE168: =RC[-46] -> 0 | CF168: =RC[-46] -> 0 | CG168: =RC[-46] -> 0 | CH168: =RC[-46] -> 0 | CI168: =RC[-46] -> 0 | CJ168: =RC[-46] -> 0 | CK168: =RC[-46] -> 0 | CL168: =RC[-46] -> 1 | CM168: =RC[-46] -> 0 | CN168: =RC[-46] -> 0 | CO168: =RC[-46] -> 5295918.87 | CP168: =RC[-46] -> 0 | CQ168: =RC[-46] -> 0 | CR168: =RC[-46] -> 0 | CS168: =RC[-46] -> 0
A169: 4 | B169: 012559 | C169: Phạm Thị Mai Giang | D169: Nhân viên phục vụ hành khách hàng hóa | E169: 19028385476011 | F169: =RC[29]+RC[30]+RC[31]+RC[32]+RC[33]+RC[34]+RC[35]+RC[36]+RC[37] -> 3773469 | G169: =RC[17]+RC[18]++RC[19]+RC[20]+RC[21]+RC[38]+RC[39]+RC[41] -> 0 | H169: 0 | I169: 0 | J169: =RC[-2]+RC[-1] -> 0 | K169: 0 | L169: 549231 | M169: 241500 | N169: =RC[15]+RC[16]+RC[17]+RC[18]+RC[19]+RC[20] -> 0 | O169: 0 | P169: 0 | Q169: 4564200 | R169: 184000 | S169: 34500 | T169: 23000 | U169: 43227 | V169: 0 | W169: 4279473 | X169: 0 | Y169: 0 | Z169: 0 | AA169: 0 | AB169: 0 | AC169: 0 | AD169: 0 | AE169: 0 | AF169: 0 | AG169: 0 | AH169: 0 | AI169: 3773469 | AJ169: 0 | AK169: 0 | AL169: 0 | AM169: 0 | AN169: 0 | AO169: 0 | AP169: 0 | AQ169: 0 | AR169: =1 -> 1 | AS169: 0 | AT169: 0 | AU169: =RC[-30]-RC[-29]-RC[-28]-RC[-27]-RC[-26]-RC[-25] -> 4279473 | AV169: 0 | AW169: =RC[1]-RC[2] -> 0 | AX169: 0 | AY169: 0 | AZ169: =RC[-46] -> 3773469 | BA169: =RC[-46] -> 0 | BB169: =RC[-46] -> 0 | BC169: =RC[-46] -> 0 | BD169: =RC[-46] -> 0 | BE169: =RC[-46] -> 0 | BF169: =RC[-46] -> 549231 | BG169: =RC[-46] -> 241500 | BH169: =RC[-46] -> 0 | BI169: =RC[-46] -> 0 | BJ169: =RC[-46] -> 0 | BK169: =RC[-46] -> 4564200 | BL169: =RC[-46] -> 184000 | BM169: =RC[-46] -> 34500 | BN169: =RC[-46] -> 23000 | BO169: =RC[-46] -> 43227 | BP169: =RC[-46] -> 0 | BQ169: =RC[-46] -> 4279473 | BR169: =RC[-46] -> 0 | BS169: =RC[-46] -> 0 | BT169: =RC[-46] -> 0 | BU169: =RC[-46] -> 0 | BV169: =RC[-46] -> 0 | BW169: =RC[-46] -> 0 | BX169: =RC[-46] -> 0 | BY169: =RC[-46] -> 0 | BZ169: =RC[-46] -> 0 | CA169: =RC[-46] -> 0 | CB169: =RC[-46] -> 0 | CC169: =RC[-46] -> 3773469 | CD169: =RC[-46] -> 0 | CE169: =RC[-46] -> 0 | CF169: =RC[-46] -> 0 | CG169: =RC[-46] -> 0 | CH169: =RC[-46] -> 0 | CI169: =RC[-46] -> 0 | CJ169: =RC[-46] -> 0 | CK169: =RC[-46] -> 0 | CL169: =RC[-46] -> 1 | CM169: =RC[-46] -> 0 | CN169: =RC[-46] -> 0 | CO169: =RC[-46] -> 4279473 | CP169: =RC[-46] -> 0 | CQ169: =RC[-46] -> 0 | CR169: =RC[-46] -> 0 | CS169: =RC[-46] -> 0
A170: 5 | B170: 012562 | C170: Đỗ Thị Thu Trang | D170: Nhân viên phục vụ hành khách hàng hóa | E170: 19028385505011 | F170: =RC[29]+RC[30]+RC[31]+RC[32]+RC[33]+RC[34]+RC[35]+RC[36]+RC[37] -> 4669413 | G170: =RC[17]+RC[18]++RC[19]+RC[20]+RC[21]+RC[38]+RC[39]+RC[41] -> 0 | H170: 0 | I170: 0 | J170: =RC[-2]+RC[-1] -> 0 | K170: 0 | L170: 680000 | M170: 241500 | N170: =RC[15]+RC[16]+RC[17]+RC[18]+RC[19]+RC[20] -> 242308 | O170: 0 | P170: 0 | Q170: 5833221 | R170: 184000 | S170: 34500 | T170: 23000 | U170: 55917.21 | V170: 0 | W170: 5535803.79 | X170: 0 | Y170: 0 | Z170: 0 | AA170: 0 | AB170: 0 | AC170: 0 | AD170: 0 | AE170: 0 | AF170: 0 | AG170: 0 | AH170: 242308 | AI170: 4669413 | AJ170: 0 | AK170: 0 | AL170: 0 | AM170: 0 | AN170: 0 | AO170: 0 | AP170: 0 | AQ170: 0 | AR170: =1 -> 1 | AS170: 0 | AT170: 0 | AU170: =RC[-30]-RC[-29]-RC[-28]-RC[-27]-RC[-26]-RC[-25] -> 5535803.79 | AV170: 0 | AW170: =RC[1]-RC[2] -> 80769.333000000013 | AX170: 242308 | AY170: 161538.66699999999 | AZ170: =RC[-46] -> 4669413 | BA170: =RC[-46] -> 0 | BB170: =RC[-46] -> 0 | BC170: =RC[-46] -> 0 | BD170: =RC[-46] -> 0 | BE170: =RC[-46] -> 0 | BF170: =RC[-46] -> 680000 | BG170: =RC[-46] -> 241500 | BH170: =RC[-46] -> 242308 | BI170: =RC[-46] -> 0 | BJ170: =RC[-46] -> 0 | BK170: =RC[-46] -> 5833221 | BL170: =RC[-46] -> 184000 | BM170: =RC[-46] -> 34500 | BN170: =RC[-46] -> 23000 | BO170: =RC[-46] -> 55917.21 | BP170: =RC[-46] -> 0 | BQ170: =RC[-46] -> 5535803.79 | BR170: =RC[-46] -> 0 | BS170: =RC[-46] -> 0 | BT170: =RC[-46] -> 0 | BU170: =RC[-46] -> 0 | BV170: =RC[-46] -> 0 | BW170: =RC[-46] -> 0 | BX170: =RC[-46] -> 0 | BY170: =RC[-46] -> 0 | BZ170: =RC[-46] -> 0 | CA170: =RC[-46] -> 0 | CB170: =RC[-46] -> 242308 | CC170: =RC[-46] -> 4669413 | CD170: =RC[-46] -> 0 | CE170: =RC[-46] -> 0 | CF170: =RC[-46] -> 0 | CG170: =RC[-46] -> 0 | CH170: =RC[-46] -> 0 | CI170: =RC[-46] -> 0 | CJ170: =RC[-46] -> 0 | CK170: =RC[-46] -> 0 | CL170: =RC[-46] -> 1 | CM170: =RC[-46] -> 0 | CN170: =RC[-46] -> 0 | CO170: =RC[-46] -> 5535803.79 | CP170: =RC[-46] -> 0 | CQ170: =RC[-46] -> 80769.333000000013 | CR170: =RC[-46] -> 242308 | CS170: =RC[-46] -> 161538.66699999999
A171: 6 | B171: 012563 | C171: Trịnh Khánh Linh | D171: Nhân viên phục vụ hành khách hàng hóa | E171: 19028385508010 | F171: =RC[29]+RC[30]+RC[31]+RC[32]+RC[33]+RC[34]+RC[35]+RC[36]+RC[37] -> 4669413 | G171: =RC[17]+RC[18]++RC[19]+RC[20]+RC[21]+RC[38]+RC[39]+RC[41] -> 0 | H171: 0 | I171: 0 | J171: =RC[-2]+RC[-1] -> 0 | K171: 0 | L171: 680000 | M171: 241500 | N171: =RC[15]+RC[16]+RC[17]+RC[18]+RC[19]+RC[20] -> 242308 | O171: 0 | P171: 0 | Q171: 5833221 | R171: 184000 | S171: 34500 | T171: 23000 | U171: 55917.21 | V171: 0 | W171: 5535803.79 | X171: 0 | Y171: 0 | Z171: 0 | AA171: 0 | AB171: 0 | AC171: 0 | AD171: 0 | AE171: 0 | AF171: 0 | AG171: 0 | AH171: 242308 | AI171: 4669413 | AJ171: 0 | AK171: 0 | AL171: 0 | AM171: 0 | AN171: 0 | AO171: 0 | AP171: 0 | AQ171: 0 | AR171: =1 -> 1 | AS171: 0 | AT171: 0 | AU171: =RC[-30]-RC[-29]-RC[-28]-RC[-27]-RC[-26]-RC[-25] -> 5535803.79 | AV171: 0 | AW171: =RC[1]-RC[2] -> 80769.333000000013 | AX171: 242308 | AY171: 161538.66699999999 | AZ171: =RC[-46] -> 4669413 | BA171: =RC[-46] -> 0 | BB171: =RC[-46] -> 0 | BC171: =RC[-46] -> 0 | BD171: =RC[-46] -> 0 | BE171: =RC[-46] -> 0 | BF171: =RC[-46] -> 680000 | BG171: =RC[-46] -> 241500 | BH171: =RC[-46] -> 242308 | BI171: =RC[-46] -> 0 | BJ171: =RC[-46] -> 0 | BK171: =RC[-46] -> 5833221 | BL171: =RC[-46] -> 184000 | BM171: =RC[-46] -> 34500 | BN171: =RC[-46] -> 23000 | BO171: =RC[-46] -> 55917.21 | BP171: =RC[-46] -> 0 | BQ171: =RC[-46] -> 5535803.79 | BR171: =RC[-46] -> 0 | BS171: =RC[-46] -> 0 | BT171: =RC[-46] -> 0 | BU171: =RC[-46] -> 0 | BV171: =RC[-46] -> 0 | BW171: =RC[-46] -> 0 | BX171: =RC[-46] -> 0 | BY171: =RC[-46] -> 0 | BZ171: =RC[-46] -> 0 | CA171: =RC[-46] -> 0 | CB171: =RC[-46] -> 242308 | CC171: =RC[-46] -> 4669413 | CD171: =RC[-46] -> 0 | CE171: =RC[-46] -> 0 | CF171: =RC[-46] -> 0 | CG171: =RC[-46] -> 0 | CH171: =RC[-46] -> 0 | CI171: =RC[-46] -> 0 | CJ171: =RC[-46] -> 0 | CK171: =RC[-46] -> 0 | CL171: =RC[-46] -> 1 | CM171: =RC[-46] -> 0 | CN171: =RC[-46] -> 0 | CO171: =RC[-46] -> 5535803.79 | CP171: =RC[-46] -> 0 | CQ171: =RC[-46] -> 80769.333000000013 | CR171: =RC[-46] -> 242308 | CS171: =RC[-46] -> 161538.66699999999
A172: 7 | B172: 012567 | C172: Nguyễn Thị Hải Yến | D172: Nhân viên phục vụ hành khách hàng hóa | E172: 19028385520010 | F172: =RC[29]+RC[30]+RC[31]+RC[32]+RC[33]+RC[34]+RC[35]+RC[36]+RC[37] -> 4669413 | G172: =RC[17]+RC[18]++RC[19]+RC[20]+RC[21]+RC[38]+RC[39]+RC[41] -> 0 | H172: 0 | I172: 0 | J172: =RC[-2]+RC[-1] -> 0 | K172: 0 | L172: 680000 | M172: 241500 | N172: =RC[15]+RC[16]+RC[17]+RC[18]+RC[19]+RC[20] -> 242308 | O172: 0 | P172: 0 | Q172: 5833221 | R172: 184000 | S172: 34500 | T172: 23000 | U172: 55917.21 | V172: 0 | W172: 5535803.79 | X172: 0 | Y172: 0 | Z172: 0 | AA172: 0 | AB172: 0 | AC172: 0 | AD172: 0 | AE172: 0 | AF172: 0 | AG172: 0 | AH172: 242308 | AI172: 4669413 | AJ172: 0 | AK172: 0 | AL172: 0 | AM172: 0 | AN172: 0 | AO172: 0 | AP172: 0 | AQ172: 0 | AR172: =1 -> 1 | AS172: 0 | AT172: 0 | AU172: =RC[-30]-RC[-29]-RC[-28]-RC[-27]-RC[-26]-RC[-25] -> 5535803.79 | AV172: 0 | AW172: =RC[1]-RC[2] -> 80769.333000000013 | AX172: 242308 | AY172: 161538.66699999999 | AZ172: =RC[-46] -> 4669413 | BA172: =RC[-46] -> 0 | BB172: =RC[-46] -> 0 | BC172: =RC[-46] -> 0 | BD172: =RC[-46] -> 0 | BE172: =RC[-46] -> 0 | BF172: =RC[-46] -> 680000 | BG172: =RC[-46] -> 241500 | BH172: =RC[-46] -> 242308 | BI172: =RC[-46] -> 0 | BJ172: =RC[-46] -> 0 | BK172: =RC[-46] -> 5833221 | BL172: =RC[-46] -> 184000 | BM172: =RC[-46] -> 34500 | BN172: =RC[-46] -> 23000 | BO172: =RC[-46] -> 55917.21 | BP172: =RC[-46] -> 0 | BQ172: =RC[-46] -> 5535803.79 | BR172: =RC[-46] -> 0 | BS172: =RC[-46] -> 0 | BT172: =RC[-46] -> 0 | BU172: =RC[-46] -> 0 | BV172: =RC[-46] -> 0 | BW172: =RC[-46] -> 0 | BX172: =RC[-46] -> 0 | BY172: =RC[-46] -> 0 | BZ172: =RC[-46] -> 0 | CA172: =RC[-46] -> 0 | CB172: =RC[-46] -> 242308 | CC172: =RC[-46] -> 4669413 | CD172: =RC[-46] -> 0 | CE172: =RC[-46] -> 0 | CF172: =RC[-46] -> 0 | CG172: =RC[-46] -> 0 | CH172: =RC[-46] -> 0 | CI172: =RC[-46] -> 0 | CJ172: =RC[-46] -> 0 | CK172: =RC[-46] -> 0 | CL172: =RC[-46] -> 1 | CM172: =RC[-46] -> 0 | CN172: =RC[-46] -> 0 | CO172: =RC[-46] -> 5535803.79 | CP172: =RC[-46] -> 0 | CQ172: =RC[-46] -> 80769.333000000013 | CR172: =RC[-46] -> 242308 | CS172: =RC[-46] -> 161538.66699999999
A173: 8 | B173: 013361 | C173: Mai Thế Anh | D173: Nhân viên phục vụ hành khách hàng hóa | E173: 19028779459015 | F173: =RC[29]+RC[30]+RC[31]+RC[32]+RC[33]+RC[34]+RC[35]+RC[36]+RC[37] -> 3268589 | G173: =RC[17]+RC[18]++RC[19]+RC[20]+RC[21]+RC[38]+RC[39]+RC[41] -> 0 | H173: 0 | I173: 0 | J173: =RC[-2]+RC[-1] -> 0 | K173: 0 | L173: 680000 | M173: 0 | N173: =RC[15]+RC[16]+RC[17]+RC[18]+RC[19]+RC[20] -> 0 | O173: 0 | P173: 0 | Q173: 3948589 | R173: 0 | S173: 0 | T173: 0 | U173: 39485.89 | V173: 0 | W173: 3909103.11 | X173: 0 | Y173: 0 | Z173: 0 | AA173: 0 | AB173: 0 | AC173: 0 | AD173: 0 | AE173: 0 | AF173: 0 | AG173: 0 | AH173: 0 | AI173: 3268589 | AJ173: 0 | AK173: 0 | AL173: 0 | AM173: 0 | AN173: 0 | AO173: 0 | AP173: 0 | AQ173: 0 | AR173: =1 -> 1 | AS173: 0 | AT173: 0 | AU173: =RC[-30]-RC[-29]-RC[-28]-RC[-27]-RC[-26]-RC[-25] -> 3909103.11 | AV173: 0 | AW173: =RC[1]-RC[2] -> 0 | AX173: 0 | AY173: 0 | AZ173: =RC[-46] -> 3268589 | BA173: =RC[-46] -> 0 | BB173: =RC[-46] -> 0 | BC173: =RC[-46] -> 0 | BD173: =RC[-46] -> 0 | BE173: =RC[-46] -> 0 | BF173: =RC[-46] -> 680000 | BG173: =RC[-46] -> 0 | BH173: =RC[-46] -> 0 | BI173: =RC[-46] -> 0 | BJ173: =RC[-46] -> 0 | BK173: =RC[-46] -> 3948589 | BL173: =RC[-46] -> 0 | BM173: =RC[-46] -> 0 | BN173: =RC[-46] -> 0 | BO173: =RC[-46] -> 39485.89 | BP173: =RC[-46] -> 0 | BQ173: =RC[-46] -> 3909103.11 | BR173: =RC[-46] -> 0 | BS173: =RC[-46] -> 0 | BT173: =RC[-46] -> 0 | BU173: =RC[-46] -> 0 | BV173: =RC[-46] -> 0 | BW173: =RC[-46] -> 0 | BX173: =RC[-46] -> 0 | BY173: =RC[-46] -> 0 | BZ173: =RC[-46] -> 0 | CA173: =RC[-46] -> 0 | CB173: =RC[-46] -> 0 | CC173: =RC[-46] -> 3268589 | CD173: =RC[-46] -> 0 | CE173: =RC[-46] -> 0 | CF173: =RC[-46] -> 0 | CG173: =RC[-46] -> 0 | CH173: =RC[-46] -> 0 | CI173: =RC[-46] -> 0 | CJ173: =RC[-46] -> 0 | CK173: =RC[-46] -> 0 | CL173: =RC[-46] -> 1 | CM173: =RC[-46] -> 0 | CN173: =RC[-46] -> 0 | CO173: =RC[-46] -> 3909103.11 | CP173: =RC[-46] -> 0 | CQ173: =RC[-46] -> 0 | CR173: =RC[-46] -> 0 | CS173: =RC[-46] -> 0
A174: 9 | B174: 013371 | C174: Hà Triệu Phương Anh | D174: Nhân viên phục vụ hành khách hàng hóa | E174: 19028960158019 | F174: =RC[29]+RC[30]+RC[31]+RC[32]+RC[33]+RC[34]+RC[35]+RC[36]+RC[37] -> 3268589 | G174: =RC[17]+RC[18]++RC[19]+RC[20]+RC[21]+RC[38]+RC[39]+RC[41] -> 0 | H174: 0 | I174: 0 | J174: =RC[-2]+RC[-1] -> 0 | K174: 0 | L174: 680000 | M174: 0 | N174: =RC[15]+RC[16]+RC[17]+RC[18]+RC[19]+RC[20] -> 0 | O174: 0 | P174: 0 | Q174: 3948589 | R174: 0 | S174: 0 | T174: 0 | U174: 39485.89 | V174: 0 | W174: 3909103.11 | X174: 0 | Y174: 0 | Z174: 0 | AA174: 0 | AB174: 0 | AC174: 0 | AD174: 0 | AE174: 0 | AF174: 0 | AG174: 0 | AH174: 0 | AI174: 3268589 | AJ174: 0 | AK174: 0 | AL174: 0 | AM174: 0 | AN174: 0 | AO174: 0 | AP174: 0 | AQ174: 0 | AR174: =1 -> 1 | AS174: 0 | AT174: 0 | AU174: =RC[-30]-RC[-29]-RC[-28]-RC[-27]-RC[-26]-RC[-25] -> 3909103.11 | AV174: 0 | AW174: =RC[1]-RC[2] -> 0 | AX174: 0 | AY174: 0 | AZ174: =RC[-46] -> 3268589 | BA174: =RC[-46] -> 0 | BB174: =RC[-46] -> 0 | BC174: =RC[-46] -> 0 | BD174: =RC[-46] -> 0 | BE174: =RC[-46] -> 0 | BF174: =RC[-46] -> 680000 | BG174: =RC[-46] -> 0 | BH174: =RC[-46] -> 0 | BI174: =RC[-46] -> 0 | BJ174: =RC[-46] -> 0 | BK174: =RC[-46] -> 3948589 | BL174: =RC[-46] -> 0 | BM174: =RC[-46] -> 0 | BN174: =RC[-46] -> 0 | BO174: =RC[-46] -> 39485.89 | BP174: =RC[-46] -> 0 | BQ174: =RC[-46] -> 3909103.11 | BR174: =RC[-46] -> 0 | BS174: =RC[-46] -> 0 | BT174: =RC[-46] -> 0 | BU174: =RC[-46] -> 0 | BV174: =RC[-46] -> 0 | BW174: =RC[-46] -> 0 | BX174: =RC[-46] -> 0 | BY174: =RC[-46] -> 0 | BZ174: =RC[-46] -> 0 | CA174: =RC[-46] -> 0 | CB174: =RC[-46] -> 0 | CC174: =RC[-46] -> 3268589 | CD174: =RC[-46] -> 0 | CE174: =RC[-46] -> 0 | CF174: =RC[-46] -> 0 | CG174: =RC[-46] -> 0 | CH174: =RC[-46] -> 0 | CI174: =RC[-46] -> 0 | CJ174: =RC[-46] -> 0 | CK174: =RC[-46] -> 0 | CL174: =RC[-46] -> 1 | CM174: =RC[-46] -> 0 | CN174: =RC[-46] -> 0 | CO174: =RC[-46] -> 3909103.11 | CP174: =RC[-46] -> 0 | CQ174: =RC[-46] -> 0 | CR174: =RC[-46] -> 0 | CS174: =RC[-46] -> 0
A175: 10 | B175: 013373 | C175: Trần Thị Sơn | D175: Nhân viên phục vụ hành khách hàng hóa | E175: 19028960201011 | F175: =RC[29]+RC[30]+RC[31]+RC[32]+RC[33]+RC[34]+RC[35]+RC[36]+RC[37] -> 3268589 | G175: =RC[17]+RC[18]++RC[19]+RC[20]+RC[21]+RC[38]+RC[39]+RC[41] -> 0 | H175: 0 | I175: 0 | J175: =RC[-2]+RC[-1] -> 0 | K175: 0 | L175: 680000 | M175: 0 | N175: =RC[15]+RC[16]+RC[17]+RC[18]+RC[19]+RC[20] -> 0 | O175: 0 | P175: 0 | Q175: 3948589 | R175: 0 | S175: 0 | T175: 0 | U175: 39485.89 | V175: 0 | W175: 3909103.11 | X175: 0 | Y175: 0 | Z175: 0 | AA175: 0 | AB175: 0 | AC175: 0 | AD175: 0 | AE175: 0 | AF175: 0 | AG175: 0 | AH175: 0 | AI175: 3268589 | AJ175: 0 | AK175: 0 | AL175: 0 | AM175: 0 | AN175: 0 | AO175: 0 | AP175: 0 | AQ175: 0 | AR175: =1 -> 1 | AS175: 0 | AT175: 0 | AU175: =RC[-30]-RC[-29]-RC[-28]-RC[-27]-RC[-26]-RC[-25] -> 3909103.11 | AV175: 0 | AW175: =RC[1]-RC[2] -> 0 | AX175: 0 | AY175: 0 | AZ175: =RC[-46] -> 3268589 | BA175: =RC[-46] -> 0 | BB175: =RC[-46] -> 0 | BC175: =RC[-46] -> 0 | BD175: =RC[-46] -> 0 | BE175: =RC[-46] -> 0 | BF175: =RC[-46] -> 680000 | BG175: =RC[-46] -> 0 | BH175: =RC[-46] -> 0 | BI175: =RC[-46] -> 0 | BJ175: =RC[-46] -> 0 | BK175: =RC[-46] -> 3948589 | BL175: =RC[-46] -> 0 | BM175: =RC[-46] -> 0 | BN175: =RC[-46] -> 0 | BO175: =RC[-46] -> 39485.89 | BP175: =RC[-46] -> 0 | BQ175: =RC[-46] -> 3909103.11 | BR175: =RC[-46] -> 0 | BS175: =RC[-46] -> 0 | BT175: =RC[-46] -> 0 | BU175: =RC[-46] -> 0 | BV175: =RC[-46] -> 0 | BW175: =RC[-46] -> 0 | BX175: =RC[-46] -> 0 | BY175: =RC[-46] -> 0 | BZ175: =RC[-46] -> 0 | CA175: =RC[-46] -> 0 | CB175: =RC[-46] -> 0 | CC175: =RC[-46] -> 3268589 | CD175: =RC[-46] -> 0 | CE175: =RC[-46] -> 0 | CF175: =RC[-46] -> 0 | CG175: =RC[-46] -> 0 | CH175: =RC[-46] -> 0 | CI175: =RC[-46] -> 0 | CJ175: =RC[-46] -> 0 | CK175: =RC[-46] -> 0 | CL175: =RC[-46] -> 1 | CM175: =RC[-46] -> 0 | CN175: =RC[-46] -> 0 | CO175: =RC[-46] -> 3909103.11 | CP175: =RC[-46] -> 0 | CQ175: =RC[-46] -> 0 | CR175: =RC[-46] -> 0 | CS175: =RC[-46] -> 0
A176: 11 | B176: 013374 | C176: Trần Thị Ngọc Hoa | D176: Nhân viên phục vụ hành khách hàng hóa | E176: 19025879138020 | F176: =RC[29]+RC[30]+RC[31]+RC[32]+RC[33]+RC[34]+RC[35]+RC[36]+RC[37] -> 3268589 | G176: =RC[17]+RC[18]++RC[19]+RC[20]+RC[21]+RC[38]+RC[39]+RC[41] -> 0 | H176: 0 | I176: 0 | J176: =RC[-2]+RC[-1] -> 0 | K176: 0 | L176: 680000 | M176: 0 | N176: =RC[15]+RC[16]+RC[17]+RC[18]+RC[19]+RC[20] -> 0 | O176: 0 | P176: 0 | Q176: 3948589 | R176: 0 | S176: 0 | T176: 0 | U176: 39485.89 | V176: 0 | W176: 3909103.11 | X176: 0 | Y176: 0 | Z176: 0 | AA176: 0 | AB176: 0 | AC176: 0 | AD176: 0 | AE176: 0 | AF176: 0 | AG176: 0 | AH176: 0 | AI176: 3268589 | AJ176: 0 | AK176: 0 | AL176: 0 | AM176: 0 | AN176: 0 | AO176: 0 | AP176: 0 | AQ176: 0 | AR176: =1 -> 1 | AS176: 0 | AT176: 0 | AU176: =RC[-30]-RC[-29]-RC[-28]-RC[-27]-RC[-26]-RC[-25] -> 3909103.11 | AV176: 0 | AW176: =RC[1]-RC[2] -> 0 | AX176: 0 | AY176: 0 | AZ176: =RC[-46] -> 3268589 | BA176: =RC[-46] -> 0 | BB176: =RC[-46] -> 0 | BC176: =RC[-46] -> 0 | BD176: =RC[-46] -> 0 | BE176: =RC[-46] -> 0 | BF176: =RC[-46] -> 680000 | BG176: =RC[-46] -> 0 | BH176: =RC[-46] -> 0 | BI176: =RC[-46] -> 0 | BJ176: =RC[-46] -> 0 | BK176: =RC[-46] -> 3948589 | BL176: =RC[-46] -> 0 | BM176: =RC[-46] -> 0 | BN176: =RC[-46] -> 0 | BO176: =RC[-46] -> 39485.89 | BP176: =RC[-46] -> 0 | BQ176: =RC[-46] -> 3909103.11 | BR176: =RC[-46] -> 0 | BS176: =RC[-46] -> 0 | BT176: =RC[-46] -> 0 | BU176: =RC[-46] -> 0 | BV176: =RC[-46] -> 0 | BW176: =RC[-46] -> 0 | BX176: =RC[-46] -> 0 | BY176: =RC[-46] -> 0 | BZ176: =RC[-46] -> 0 | CA176: =RC[-46] -> 0 | CB176: =RC[-46] -> 0 | CC176: =RC[-46] -> 3268589 | CD176: =RC[-46] -> 0 | CE176: =RC[-46] -> 0 | CF176: =RC[-46] -> 0 | CG176: =RC[-46] -> 0 | CH176: =RC[-46] -> 0 | CI176: =RC[-46] -> 0 | CJ176: =RC[-46] -> 0 | CK176: =RC[-46] -> 0 | CL176: =RC[-46] -> 1 | CM176: =RC[-46] -> 0 | CN176: =RC[-46] -> 0 | CO176: =RC[-46] -> 3909103.11 | CP176: =RC[-46] -> 0 | CQ176: =RC[-46] -> 0 | CR176: =RC[-46] -> 0 | CS176: =RC[-46] -> 0
A177: 12 | B177: 013375 | C177: Nguyễn Thị Oanh | D177: Nhân viên phục vụ hành khách hàng hóa | E177: 19026811113026 | F177: =RC[29]+RC[30]+RC[31]+RC[32]+RC[33]+RC[34]+RC[35]+RC[36]+RC[37] -> 3268589 | G177: =RC[17]+RC[18]++RC[19]+RC[20]+RC[21]+RC[38]+RC[39]+RC[41] -> 0 | H177: 0 | I177: 0 | J177: =RC[-2]+RC[-1] -> 0 | K177: 0 | L177: 680000 | M177: 0 | N177: =RC[15]+RC[16]+RC[17]+RC[18]+RC[19]+RC[20] -> 0 | O177: 0 | P177: 0 | Q177: 3948589 | R177: 0 | S177: 0 | T177: 0 | U177: 39485.89 | V177: 0 | W177: 3909103.11 | X177: 0 | Y177: 0 | Z177: 0 | AA177: 0 | AB177: 0 | AC177: 0 | AD177: 0 | AE177: 0 | AF177: 0 | AG177: 0 | AH177: 0 | AI177: 3268589 | AJ177: 0 | AK177: 0 | AL177: 0 | AM177: 0 | AN177: 0 | AO177: 0 | AP177: 0 | AQ177: 0 | AR177: =1 -> 1 | AS177: 0 | AT177: 0 | AU177: =RC[-30]-RC[-29]-RC[-28]-RC[-27]-RC[-26]-RC[-25] -> 3909103.11 | AV177: 0 | AW177: =RC[1]-RC[2] -> 0 | AX177: 0 | AY177: 0 | AZ177: =RC[-46] -> 3268589 | BA177: =RC[-46] -> 0 | BB177: =RC[-46] -> 0 | BC177: =RC[-46] -> 0 | BD177: =RC[-46] -> 0 | BE177: =RC[-46] -> 0 | BF177: =RC[-46] -> 680000 | BG177: =RC[-46] -> 0 | BH177: =RC[-46] -> 0 | BI177: =RC[-46] -> 0 | BJ177: =RC[-46] -> 0 | BK177: =RC[-46] -> 3948589 | BL177: =RC[-46] -> 0 | BM177: =RC[-46] -> 0 | BN177: =RC[-46] -> 0 | BO177: =RC[-46] -> 39485.89 | BP177: =RC[-46] -> 0 | BQ177: =RC[-46] -> 3909103.11 | BR177: =RC[-46] -> 0 | BS177: =RC[-46] -> 0 | BT177: =RC[-46] -> 0 | BU177: =RC[-46] -> 0 | BV177: =RC[-46] -> 0 | BW177: =RC[-46] -> 0 | BX177: =RC[-46] -> 0 | BY177: =RC[-46] -> 0 | BZ177: =RC[-46] -> 0 | CA177: =RC[-46] -> 0 | CB177: =RC[-46] -> 0 | CC177: =RC[-46] -> 3268589 | CD177: =RC[-46] -> 0 | CE177: =RC[-46] -> 0 | CF177: =RC[-46] -> 0 | CG177: =RC[-46] -> 0 | CH177: =RC[-46] -> 0 | CI177: =RC[-46] -> 0 | CJ177: =RC[-46] -> 0 | CK177: =RC[-46] -> 0 | CL177: =RC[-46] -> 1 | CM177: =RC[-46] -> 0 | CN177: =RC[-46] -> 0 | CO177: =RC[-46] -> 3909103.11 | CP177: =RC[-46] -> 0 | CQ177: =RC[-46] -> 0 | CR177: =RC[-46] -> 0 | CS177: =RC[-46] -> 0
A178: 13 | B178: 013380 | C178: Nguyễn Thị Yến Hương | D178: Nhân viên phục vụ hành khách hàng hóa | E178: 19028960284014 | F178: =RC[29]+RC[30]+RC[31]+RC[32]+RC[33]+RC[34]+RC[35]+RC[36]+RC[37] -> 3268589 | G178: =RC[17]+RC[18]++RC[19]+RC[20]+RC[21]+RC[38]+RC[39]+RC[41] -> 0 | H178: 0 | I178: 0 | J178: =RC[-2]+RC[-1] -> 0 | K178: 0 | L178: 680000 | M178: 0 | N178: =RC[15]+RC[16]+RC[17]+RC[18]+RC[19]+RC[20] -> 0 | O178: 0 | P178: 0 | Q178: 3948589 | R178: 0 | S178: 0 | T178: 0 | U178: 39485.89 | V178: 0 | W178: 3909103.11 | X178: 0 | Y178: 0 | Z178: 0 | AA178: 0 | AB178: 0 | AC178: 0 | AD178: 0 | AE178: 0 | AF178: 0 | AG178: 0 | AH178: 0 | AI178: 3268589 | AJ178: 0 | AK178: 0 | AL178: 0 | AM178: 0 | AN178: 0 | AO178: 0 | AP178: 0 | AQ178: 0 | AR178: =1 -> 1 | AS178: 0 | AT178: 0 | AU178: =RC[-30]-RC[-29]-RC[-28]-RC[-27]-RC[-26]-RC[-25] -> 3909103.11 | AV178: 0 | AW178: =RC[1]-RC[2] -> 0 | AX178: 0 | AY178: 0 | AZ178: =RC[-46] -> 3268589 | BA178: =RC[-46] -> 0 | BB178: =RC[-46] -> 0 | BC178: =RC[-46] -> 0 | BD178: =RC[-46] -> 0 | BE178: =RC[-46] -> 0 | BF178: =RC[-46] -> 680000 | BG178: =RC[-46] -> 0 | BH178: =RC[-46] -> 0 | BI178: =RC[-46] -> 0 | BJ178: =RC[-46] -> 0 | BK178: =RC[-46] -> 3948589 | BL178: =RC[-46] -> 0 | BM178: =RC[-46] -> 0 | BN178: =RC[-46] -> 0 | BO178: =RC[-46] -> 39485.89 | BP178: =RC[-46] -> 0 | BQ178: =RC[-46] -> 3909103.11 | BR178: =RC[-46] -> 0 | BS178: =RC[-46] -> 0 | BT178: =RC[-46] -> 0 | BU178: =RC[-46] -> 0 | BV178: =RC[-46] -> 0 | BW178: =RC[-46] -> 0 | BX178: =RC[-46] -> 0 | BY178: =RC[-46] -> 0 | BZ178: =RC[-46] -> 0 | CA178: =RC[-46] -> 0 | CB178: =RC[-46] -> 0 | CC178: =RC[-46] -> 3268589 | CD178: =RC[-46] -> 0 | CE178: =RC[-46] -> 0 | CF178: =RC[-46] -> 0 | CG178: =RC[-46] -> 0 | CH178: =RC[-46] -> 0 | CI178: =RC[-46] -> 0 | CJ178: =RC[-46] -> 0 | CK178: =RC[-46] -> 0 | CL178: =RC[-46] -> 1 | CM178: =RC[-46] -> 0 | CN178: =RC[-46] -> 0 | CO178: =RC[-46] -> 3909103.11 | CP178: =RC[-46] -> 0 | CQ178: =RC[-46] -> 0 | CR178: =RC[-46] -> 0 | CS178: =RC[-46] -> 0
A179: 14 | B179: 013405 | C179: Nguyễn Thị Thúy Hằng | D179: Nhân viên phục vụ hành khách hàng hóa | E179: 19028178495022 | F179: =RC[29]+RC[30]+RC[31]+RC[32]+RC[33]+RC[34]+RC[35]+RC[36]+RC[37] -> 3268589 | G179: =RC[17]+RC[18]++RC[19]+RC[20]+RC[21]+RC[38]+RC[39]+RC[41] -> 0 | H179: 0 | I179: 0 | J179: =RC[-2]+RC[-1] -> 0 | K179: 0 | L179: 680000 | M179: 0 | N179: =RC[15]+RC[16]+RC[17]+RC[18]+RC[19]+RC[20] -> 0 | O179: 0 | P179: 0 | Q179: 3948589 | R179: 0 | S179: 0 | T179: 0 | U179: 39485.89 | V179: 0 | W179: 3909103.11 | X179: 0 | Y179: 0 | Z179: 0 | AA179: 0 | AB179: 0 | AC179: 0 | AD179: 0 | AE179: 0 | AF179: 0 | AG179: 0 | AH179: 0 | AI179: 3268589 | AJ179: 0 | AK179: 0 | AL179: 0 | AM179: 0 | AN179: 0 | AO179: 0 | AP179: 0 | AQ179: 0 | AR179: =1 -> 1 | AS179: 0 | AT179: 0 | AU179: =RC[-30]-RC[-29]-RC[-28]-RC[-27]-RC[-26]-RC[-25] -> 3909103.11 | AV179: 0 | AW179: =RC[1]-RC[2] -> 0 | AX179: 0 | AY179: 0 | AZ179: =RC[-46] -> 3268589 | BA179: =RC[-46] -> 0 | BB179: =RC[-46] -> 0 | BC179: =RC[-46] -> 0 | BD179: =RC[-46] -> 0 | BE179: =RC[-46] -> 0 | BF179: =RC[-46] -> 680000 | BG179: =RC[-46] -> 0 | BH179: =RC[-46] -> 0 | BI179: =RC[-46] -> 0 | BJ179: =RC[-46] -> 0 | BK179: =RC[-46] -> 3948589 | BL179: =RC[-46] -> 0 | BM179: =RC[-46] -> 0 | BN179: =RC[-46] -> 0 | BO179: =RC[-46] -> 39485.89 | BP179: =RC[-46] -> 0 | BQ179: =RC[-46] -> 3909103.11 | BR179: =RC[-46] -> 0 | BS179: =RC[-46] -> 0 | BT179: =RC[-46] -> 0 | BU179: =RC[-46] -> 0 | BV179: =RC[-46] -> 0 | BW179: =RC[-46] -> 0 | BX179: =RC[-46] -> 0 | BY179: =RC[-46] -> 0 | BZ179: =RC[-46] -> 0 | CA179: =RC[-46] -> 0 | CB179: =RC[-46] -> 0 | CC179: =RC[-46] -> 3268589 | CD179: =RC[-46] -> 0 | CE179: =RC[-46] -> 0 | CF179: =RC[-46] -> 0 | CG179: =RC[-46] -> 0 | CH179: =RC[-46] -> 0 | CI179: =RC[-46] -> 0 | CJ179: =RC[-46] -> 0 | CK179: =RC[-46] -> 0 | CL179: =RC[-46] -> 1 | CM179: =RC[-46] -> 0 | CN179: =RC[-46] -> 0 | CO179: =RC[-46] -> 3909103.11 | CP179: =RC[-46] -> 0 | CQ179: =RC[-46] -> 0 | CR179: =RC[-46] -> 0 | CS179: =RC[-46] -> 0
A180: 15 | B180: 010572 | C180: Võ Thị Hồng Minh | D180: NV PVHK | E180: 10522162218012 | F180: =RC[29]+RC[30]+RC[31]+RC[32]+RC[33]+RC[34]+RC[35]+RC[36]+RC[37] -> 6216156 | G180: =RC[17]+RC[18]++RC[19]+RC[20]+RC[21]+RC[38]+RC[39]+RC[41] -> 0 | H180: 0 | I180: 0 | J180: =RC[-2]+RC[-1] -> 0 | K180: 0 | L180: 680000 | M180: 283763 | N180: =RC[15]+RC[16]+RC[17]+RC[18]+RC[19]+RC[20] -> 284712 | O180: 0 | P180: 0 | Q180: 7464631 | R180: 216200 | S180: 40538 | T180: 27025 | U180: 71808.679999999993 | V180: 0 | W180: 7109059.3200000003 | X180: 0 | Y180: 0 | Z180: 0 | AA180: 0 | AB180: 0 | AC180: 0 | AD180: 0 | AE180: 0 | AF180: 0 | AG180: 0 | AH180: 284712 | AI180: 6216156 | AJ180: 0 | AK180: 0 | AL180: 0 | AM180: 0 | AN180: 0 | AO180: 0 | AP180: 0 | AQ180: 0 | AR180: =1 -> 1 | AS180: 0 | AT180: 0 | AU180: =RC[-30]-RC[-29]-RC[-28]-RC[-27]-RC[-26]-RC[-25] -> 7109059.3200000003 | AV180: 0 | AW180: =RC[1]-RC[2] -> 94904 | AX180: 284712 | AY180: 189808 | AZ180: =RC[-46] -> 6216156 | BA180: =RC[-46] -> 0 | BB180: =RC[-46] -> 0 | BC180: =RC[-46] -> 0 | BD180: =RC[-46] -> 0 | BE180: =RC[-46] -> 0 | BF180: =RC[-46] -> 680000 | BG180: =RC[-46] -> 283763 | BH180: =RC[-46] -> 284712 | BI180: =RC[-46] -> 0 | BJ180: =RC[-46] -> 0 | BK180: =RC[-46] -> 7464631 | BL180: =RC[-46] -> 216200 | BM180: =RC[-46] -> 40538 | BN180: =RC[-46] -> 27025 | BO180: =RC[-46] -> 71808.679999999993 | BP180: =RC[-46] -> 0 | BQ180: =RC[-46] -> 7109059.3200000003 | BR180: =RC[-46] -> 0 | BS180: =RC[-46] -> 0 | BT180: =RC[-46] -> 0 | BU180: =RC[-46] -> 0 | BV180: =RC[-46] -> 0 | BW180: =RC[-46] -> 0 | BX180: =RC[-46] -> 0 | BY180: =RC[-46] -> 0 | BZ180: =RC[-46] -> 0 | CA180: =RC[-46] -> 0 | CB180: =RC[-46] -> 284712 | CC180: =RC[-46] -> 6216156 | CD180: =RC[-46] -> 0 | CE180: =RC[-46] -> 0 | CF180: =RC[-46] -> 0 | CG180: =RC[-46] -> 0 | CH180: =RC[-46] -> 0 | CI180: =RC[-46] -> 0 | CJ180: =RC[-46] -> 0 | CK180: =RC[-46] -> 0 | CL180: =RC[-46] -> 1 | CM180: =RC[-46] -> 0 | CN180: =RC[-46] -> 0 | CO180: =RC[-46] -> 7109059.3200000003 | CP180: =RC[-46] -> 0 | CQ180: =RC[-46] -> 94904 | CR180: =RC[-46] -> 284712 | CS180: =RC[-46] -> 189808
A181: 16 | B181: 010574 | C181: Nguyễn Thị Hồng Duyên | D181: NV PVHK | E181: 10520235203016 | F181: =RC[29]+RC[30]+RC[31]+RC[32]+RC[33]+RC[34]+RC[35]+RC[36]+RC[37] -> 6216156 | G181: =RC[17]+RC[18]++RC[19]+RC[20]+RC[21]+RC[38]+RC[39]+RC[41] -> 0 | H181: 0 | I181: 0 | J181: =RC[-2]+RC[-1] -> 0 | K181: 0 | L181: 680000 | M181: 333270 | N181: =RC[15]+RC[16]+RC[17]+RC[18]+RC[19]+RC[20] -> 334385 | O181: 0 | P181: 0 | Q181: 7563811 | R181: 253920 | S181: 47610 | T181: 31740 | U181: 72305.41 | V181: 0 | W181: 7158235.5899999999 | X181: 0 | Y181: 0 | Z181: 0 | AA181: 0 | AB181: 0 | AC181: 0 | AD181: 0 | AE181: 0 | AF181: 0 | AG181: 0 | AH181: 334385 | AI181: 6216156 | AJ181: 0 | AK181: 0 | AL181: 0 | AM181: 0 | AN181: 0 | AO181: 0 | AP181: 0 | AQ181: 0 | AR181: =1 -> 1 | AS181: 0 | AT181: 0 | AU181: =RC[-30]-RC[-29]-RC[-28]-RC[-27]-RC[-26]-RC[-25] -> 7158235.5899999999 | AV181: 0 | AW181: =RC[1]-RC[2] -> 111461.66699999999 | AX181: 334385 | AY181: 222923.33300000001 | AZ181: =RC[-46] -> 6216156 | BA181: =RC[-46] -> 0 | BB181: =RC[-46] -> 0 | BC181: =RC[-46] -> 0 | BD181: =RC[-46] -> 0 | BE181: =RC[-46] -> 0 | BF181: =RC[-46] -> 680000 | BG181: =RC[-46] -> 333270 | BH181: =RC[-46] -> 334385 | BI181: =RC[-46] -> 0 | BJ181: =RC[-46] -> 0 | BK181: =RC[-46] -> 7563811 | BL181: =RC[-46] -> 253920 | BM181: =RC[-46] -> 47610 | BN181: =RC[-46] -> 31740 | BO181: =RC[-46] -> 72305.41 | BP181: =RC[-46] -> 0 | BQ181: =RC[-46] -> 7158235.5899999999 | BR181: =RC[-46] -> 0 | BS181: =RC[-46] -> 0 | BT181: =RC[-46] -> 0 | BU181: =RC[-46] -> 0 | BV181: =RC[-46] -> 0 | BW181: =RC[-46] -> 0 | BX181: =RC[-46] -> 0 | BY181: =RC[-46] -> 0 | BZ181: =RC[-46] -> 0 | CA181: =RC[-46] -> 0 | CB181: =RC[-46] -> 334385 | CC181: =RC[-46] -> 6216156 | CD181: =RC[-46] -> 0 | CE181: =RC[-46] -> 0 | CF181: =RC[-46] -> 0 | CG181: =RC[-46] -> 0 | CH181: =RC[-46] -> 0 | CI181: =RC[-46] -> 0 | CJ181: =RC[-46] -> 0 | CK181: =RC[-46] -> 0 | CL181: =RC[-46] -> 1 | CM181: =RC[-46] -> 0 | CN181: =RC[-46] -> 0 | CO181: =RC[-46] -> 7158235.5899999999 | CP181: =RC[-46] -> 0 | CQ181: =RC[-46] -> 111461.66699999999 | CR181: =RC[-46] -> 334385 | CS181: =RC[-46] -> 222923.33300000001
A182: 17 | B182: 010575 | C182: Phan Thị Thu Hường | D182: NV PVHK | E182: 10520104989014 | F182: =RC[29]+RC[30]+RC[31]+RC[32]+RC[33]+RC[34]+RC[35]+RC[36]+RC[37] -> 3586693 | G182: =RC[17]+RC[18]++RC[19]+RC[20]+RC[21]+RC[38]+RC[39]+RC[41] -> 1226077 | H182: 0 | I182: 0 | J182: =RC[-2]+RC[-1] -> 0 | K182: 0 | L182: 392308 | M182: 333270 | N182: =RC[15]+RC[16]+RC[17]+RC[18]+RC[19]+RC[20] -> 0 | O182: 0 | P182: 0 | Q182: 5538348 | R182: 253920 | S182: 47610 | T182: 31740 | U182: 52050.78 | V182: 0 | W182: 5153027.22 | X182: 0 | Y182: 1226077 | Z182: 0 | AA182: 0 | AB182: 0 | AC182: 0 | AD182: 0 | AE182: 0 | AF182: 0 | AG182: 0 | AH182: 0 | AI182: 3586693 | AJ182: 0 | AK182: 0 | AL182: 0 | AM182: 0 | AN182: 0 | AO182: 0 | AP182: 0 | AQ182: 0 | AR182: =1 -> 1 | AS182: 0 | AT182: 0 | AU182: =RC[-30]-RC[-29]-RC[-28]-RC[-27]-RC[-26]-RC[-25] -> 5153027.22 | AV182: 0 | AW182: =RC[1]-RC[2] -> 0 | AX182: 0 | AY182: 0 | AZ182: =RC[-46] -> 3586693 | BA182: =RC[-46] -> 1226077 | BB182: =RC[-46] -> 0 | BC182: =RC[-46] -> 0 | BD182: =RC[-46] -> 0 | BE182: =RC[-46] -> 0 | BF182: =RC[-46] -> 392308 | BG182: =RC[-46] -> 333270 | BH182: =RC[-46] -> 0 | BI182: =RC[-46] -> 0 | BJ182: =RC[-46] -> 0 | BK182: =RC[-46] -> 5538348 | BL182: =RC[-46] -> 253920 | BM182: =RC[-46] -> 47610 | BN182: =RC[-46] -> 31740 | BO182: =RC[-46] -> 52050.78 | BP182: =RC[-46] -> 0 | BQ182: =RC[-46] -> 5153027.22 | BR182: =RC[-46] -> 0 | BS182: =RC[-46] -> 1226077 | BT182: =RC[-46] -> 0 | BU182: =RC[-46] -> 0 | BV182: =RC[-46] -> 0 | BW182: =RC[-46] -> 0 | BX182: =RC[-46] -> 0 | BY182: =RC[-46] -> 0 | BZ182: =RC[-46] -> 0 | CA182: =RC[-46] -> 0 | CB182: =RC[-46] -> 0 | CC182: =RC[-46] -> 3586693 | CD182: =RC[-46] -> 0 | CE182: =RC[-46] -> 0 | CF182: =RC[-46] -> 0 | CG182: =RC[-46] -> 0 | CH182: =RC[-46] -> 0 | CI182: =RC[-46] -> 0 | CJ182: =RC[-46] -> 0 | CK182: =RC[-46] -> 0 | CL182: =RC[-46] -> 1 | CM182: =RC[-46] -> 0 | CN182: =RC[-46] -> 0 | CO182: =RC[-46] -> 5153027.22 | CP182: =RC[-46] -> 0 | CQ182: =RC[-46] -> 0 | CR182: =RC[-46] -> 0 | CS182: =RC[-46] -> 0
A183: 18 | B183: 010579 | C183: Tạ Thị Cẩm Vân | D183: NV PVHK | E183: 10525139513014 | F183: =RC[29]+RC[30]+RC[31]+RC[32]+RC[33]+RC[34]+RC[35]+RC[36]+RC[37] -> 5865950 | G183: =RC[17]+RC[18]++RC[19]+RC[20]+RC[21]+RC[38]+RC[39]+RC[41] -> 0 | H183: 0 | I183: 0 | J183: =RC[-2]+RC[-1] -> 0 | K183: 0 | L183: 680000 | M183: 241500 | N183: =RC[15]+RC[16]+RC[17]+RC[18]+RC[19]+RC[20] -> 242308 | O183: 0 | P183: 0 | Q183: 7029758 | R183: 184000 | S183: 34500 | T183: 23000 | U183: 67882.58 | V183: 0 | W183: 6720375.4199999999 | X183: 0 | Y183: 0 | Z183: 0 | AA183: 0 | AB183: 0 | AC183: 0 | AD183: 0 | AE183: 0 | AF183: 0 | AG183: 0 | AH183: 242308 | AI183: 5865950 | AJ183: 0 | AK183: 0 | AL183: 0 | AM183: 0 | AN183: 0 | AO183: 0 | AP183: 0 | AQ183: 0 | AR183: =1 -> 1 | AS183: 0 | AT183: 0 | AU183: =RC[-30]-RC[-29]-RC[-28]-RC[-27]-RC[-26]-RC[-25] -> 6720375.4199999999 | AV183: 0 | AW183: =RC[1]-RC[2] -> 80769.333000000013 | AX183: 242308 | AY183: 161538.66699999999 | AZ183: =RC[-46] -> 5865950 | BA183: =RC[-46] -> 0 | BB183: =RC[-46] -> 0 | BC183: =RC[-46] -> 0 | BD183: =RC[-46] -> 0 | BE183: =RC[-46] -> 0 | BF183: =RC[-46] -> 680000 | BG183: =RC[-46] -> 241500 | BH183: =RC[-46] -> 242308 | BI183: =RC[-46] -> 0 | BJ183: =RC[-46] -> 0 | BK183: =RC[-46] -> 7029758 | BL183: =RC[-46] -> 184000 | BM183: =RC[-46] -> 34500 | BN183: =RC[-46] -> 23000 | BO183: =RC[-46] -> 67882.58 | BP183: =RC[-46] -> 0 | BQ183: =RC[-46] -> 6720375.4199999999 | BR183: =RC[-46] -> 0 | BS183: =RC[-46] -> 0 | BT183: =RC[-46] -> 0 | BU183: =RC[-46] -> 0 | BV183: =RC[-46] -> 0 | BW183: =RC[-46] -> 0 | BX183: =RC[-46] -> 0 | BY183: =RC[-46] -> 0 | BZ183: =RC[-46] -> 0 | CA183: =RC[-46] -> 0 | CB183: =RC[-46] -> 242308 | CC183: =RC[-46] -> 5865950 | CD183: =RC[-46] -> 0 | CE183: =RC[-46] -> 0 | CF183: =RC[-46] -> 0 | CG183: =RC[-46] -> 0 | CH183: =RC[-46] -> 0 | CI183: =RC[-46] -> 0 | CJ183: =RC[-46] -> 0 | CK183: =RC[-46] -> 0 | CL183: =RC[-46] -> 1 | CM183: =RC[-46] -> 0 | CN183: =RC[-46] -> 0 | CO183: =RC[-46] -> 6720375.4199999999 | CP183: =RC[-46] -> 0 | CQ183: =RC[-46] -> 80769.333000000013 | CR183: =RC[-46] -> 242308 | CS183: =RC[-46] -> 161538.66699999999
A184: 19 | B184: 010581 | C184: Nguyễn Thị Hoài | D184: NV PVHK | E184: 10524103453019 | F184: =RC[29]+RC[30]+RC[31]+RC[32]+RC[33]+RC[34]+RC[35]+RC[36]+RC[37] -> 5544928 | G184: =RC[17]+RC[18]++RC[19]+RC[20]+RC[21]+RC[38]+RC[39]+RC[41] -> 0 | H184: 0 | I184: 0 | J184: =RC[-2]+RC[-1] -> 0 | K184: 0 | L184: 680000 | M184: 241500 | N184: =RC[15]+RC[16]+RC[17]+RC[18]+RC[19]+RC[20] -> 242308 | O184: 0 | P184: 0 | Q184: 6708736 | R184: 184000 | S184: 34500 | T184: 23000 | U184: 64672.36 | V184: 0 | W184: 6402563.6399999997 | X184: 0 | Y184: 0 | Z184: 0 | AA184: 0 | AB184: 0 | AC184: 0 | AD184: 0 | AE184: 0 | AF184: 0 | AG184: 0 | AH184: 242308 | AI184: 5544928 | AJ184: 0 | AK184: 0 | AL184: 0 | AM184: 0 | AN184: 0 | AO184: 0 | AP184: 0 | AQ184: 0 | AR184: =1 -> 1 | AS184: 0 | AT184: 0 | AU184: =RC[-30]-RC[-29]-RC[-28]-RC[-27]-RC[-26]-RC[-25] -> 6402563.6399999997 | AV184: 0 | AW184: =RC[1]-RC[2] -> 80769.333000000013 | AX184: 242308 | AY184: 161538.66699999999 | AZ184: =RC[-46] -> 5544928 | BA184: =RC[-46] -> 0 | BB184: =RC[-46] -> 0 | BC184: =RC[-46] -> 0 | BD184: =RC[-46] -> 0 | BE184: =RC[-46] -> 0 | BF184: =RC[-46] -> 680000 | BG184: =RC[-46] -> 241500 | BH184: =RC[-46] -> 242308 | BI184: =RC[-46] -> 0 | BJ184: =RC[-46] -> 0 | BK184: =RC[-46] -> 6708736 | BL184: =RC[-46] -> 184000 | BM184: =RC[-46] -> 34500 | BN184: =RC[-46] -> 23000 | BO184: =RC[-46] -> 64672.36 | BP184: =RC[-46] -> 0 | BQ184: =RC[-46] -> 6402563.6399999997 | BR184: =RC[-46] -> 0 | BS184: =RC[-46] -> 0 | BT184: =RC[-46] -> 0 | BU184: =RC[-46] -> 0 | BV184: =RC[-46] -> 0 | BW184: =RC[-46] -> 0 | BX184: =RC[-46] -> 0 | BY184: =RC[-46] -> 0 | BZ184: =RC[-46] -> 0 | CA184: =RC[-46] -> 0 | CB184: =RC[-46] -> 242308 | CC184: =RC[-46] -> 5544928 | CD184: =RC[-46] -> 0 | CE184: =RC[-46] -> 0 | CF184: =RC[-46] -> 0 | CG184: =RC[-46] -> 0 | CH184: =RC[-46] -> 0 | CI184: =RC[-46] -> 0 | CJ184: =RC[-46] -> 0 | CK184: =RC[-46] -> 0 | CL184: =RC[-46] -> 1 | CM184: =RC[-46] -> 0 | CN184: =RC[-46] -> 0 | CO184: =RC[-46] -> 6402563.6399999997 | CP184: =RC[-46] -> 0 | CQ184: =RC[-46] -> 80769.333000000013 | CR184: =RC[-46] -> 242308 | CS184: =RC[-46] -> 161538.66699999999
A185: 20 | B185: 010587 | C185: Nguyễn Thị Tú Oanh | D185: NV PVHK | E185: 10525139509017 | F185: =RC[29]+RC[30]+RC[31]+RC[32]+RC[33]+RC[34]+RC[35]+RC[36]+RC[37] -> 2772464 | G185: =RC[17]+RC[18]++RC[19]+RC[20]+RC[21]+RC[38]+RC[39]+RC[41] -> 0 | H185: 0 | I185: 0 | J185: =RC[-2]+RC[-1] -> 0 | K185: 0 | L185: 0 | M185: 0 | N185: =RC[15]+RC[16]+RC[17]+RC[18]+RC[19]+RC[20] -> 0 | O185: 0 | P185: 0 | Q185: 2772464 | R185: 0 | S185: 0 | T185: 0 | U185: 27724.639999999999 | V185: 0 | W185: 2744739.36 | X185: 0 | Y185: 0 | Z185: 0 | AA185: 0 | AB185: 0 | AC185: 0 | AD185: 0 | AE185: 0 | AF185: 0 | AG185: 0 | AH185: 0 | AI185: 0 | AJ185: 2772464 | AK185: 0 | AL185: 0 | AM185: 0 | AN185: 0 | AO185: 0 | AP185: 0 | AQ185: 0 | AR185: =1 -> 1 | AS185: 0 | AT185: 0 | AU185: =RC[-30]-RC[-29]-RC[-28]-RC[-27]-RC[-26]-RC[-25] -> 2744739.36 | AV185: 0 | AW185: =RC[1]-RC[2] -> 0 | AX185: 0 | AY185: 0 | AZ185: =RC[-46] -> 2772464 | BA185: =RC[-46] -> 0 | BB185: =RC[-46] -> 0 | BC185: =RC[-46] -> 0 | BD185: =RC[-46] -> 0 | BE185: =RC[-46] -> 0 | BF185: =RC[-46] -> 0 | BG185: =RC[-46] -> 0 | BH185: =RC[-46] -> 0 | BI185: =RC[-46] -> 0 | BJ185: =RC[-46] -> 0 | BK185: =RC[-46] -> 2772464 | BL185: =RC[-46] -> 0 | BM185: =RC[-46] -> 0 | BN185: =RC[-46] -> 0 | BO185: =RC[-46] -> 27724.639999999999 | BP185: =RC[-46] -> 0 | BQ185: =RC[-46] -> 2744739.36 | BR185: =RC[-46] -> 0 | BS185: =RC[-46] -> 0 | BT185: =RC[-46] -> 0 | BU185: =RC[-46] -> 0 | BV185: =RC[-46] -> 0 | BW185: =RC[-46] -> 0 | BX185: =RC[-46] -> 0 | BY185: =RC[-46] -> 0 | BZ185: =RC[-46] -> 0 | CA185: =RC[-46] -> 0 | CB185: =RC[-46] -> 0 | CC185: =RC[-46] -> 0 | CD185: =RC[-46] -> 2772464 | CE185: =RC[-46] -> 0 | CF185: =RC[-46] -> 0 | CG185: =RC[-46] -> 0 | CH185: =RC[-46] -> 0 | CI185: =RC[-46] -> 0 | CJ185: =RC[-46] -> 0 | CK185: =RC[-46] -> 0 | CL185: =RC[-46] -> 1 | CM185: =RC[-46] -> 0 | CN185: =RC[-46] -> 0 | CO185: =RC[-46] -> 2744739.36 | CP185: =RC[-46] -> 0 | CQ185: =RC[-46] -> 0 | CR185: =RC[-46] -> 0 | CS185: =RC[-46] -> 0
A186: 21 | B186: 010592 | C186: Trần Thị Thu Huyền | D186: NV PVHK | E186: 10520155212014 | F186: =RC[29]+RC[30]+RC[31]+RC[32]+RC[33]+RC[34]+RC[35]+RC[36]+RC[37] -> 4847434 | G186: =RC[17]+RC[18]++RC[19]+RC[20]+RC[21]+RC[38]+RC[39]+RC[41] -> 0 | H186: 0 | I186: 0 | J186: =RC[-2]+RC[-1] -> 0 | K186: 0 | L186: 627692 | M186: 241500 | N186: =RC[15]+RC[16]+RC[17]+RC[18]+RC[19]+RC[20] -> 0 | O186: 0 | P186: 0 | Q186: 5716626 | R186: 184000 | S186: 34500 | T186: 23000 | U186: 54751.26 | V186: 0 | W186: 5420374.7400000002 | X186: 0 | Y186: 0 | Z186: 0 | AA186: 0 | AB186: 0 | AC186: 0 | AD186: 0 | AE186: 0 | AF186: 0 | AG186: 0 | AH186: 0 | AI186: 4847434 | AJ186: 0 | AK186: 0 | AL186: 0 | AM186: 0 | AN186: 0 | AO186: 0 | AP186: 0 | AQ186: 0 | AR186: =1 -> 1 | AS186: 0 | AT186: 0 | AU186: =RC[-30]-RC[-29]-RC[-28]-RC[-27]-RC[-26]-RC[-25] -> 5420374.7400000002 | AV186: 0 | AW186: =RC[1]-RC[2] -> 0 | AX186: 0 | AY186: 0 | AZ186: =RC[-46] -> 4847434 | BA186: =RC[-46] -> 0 | BB186: =RC[-46] -> 0 | BC186: =RC[-46] -> 0 | BD186: =RC[-46] -> 0 | BE186: =RC[-46] -> 0 | BF186: =RC[-46] -> 627692 | BG186: =RC[-46] -> 241500 | BH186: =RC[-46] -> 0 | BI186: =RC[-46] -> 0 | BJ186: =RC[-46] -> 0 | BK186: =RC[-46] -> 5716626 | BL186: =RC[-46] -> 184000 | BM186: =RC[-46] -> 34500 | BN186: =RC[-46] -> 23000 | BO186: =RC[-46] -> 54751.26 | BP186: =RC[-46] -> 0 | BQ186: =RC[-46] -> 5420374.7400000002 | BR186: =RC[-46] -> 0 | BS186: =RC[-46] -> 0 | BT186: =RC[-46] -> 0 | BU186: =RC[-46] -> 0 | BV186: =RC[-46] -> 0 | BW186: =RC[-46] -> 0 | BX186: =RC[-46] -> 0 | BY186: =RC[-46] -> 0 | BZ186: =RC[-46] -> 0 | CA186: =RC[-46] -> 0 | CB186: =RC[-46] -> 0 | CC186: =RC[-46] -> 4847434 | CD186: =RC[-46] -> 0 | CE186: =RC[-46] -> 0 | CF186: =RC[-46] -> 0 | CG186: =RC[-46] -> 0 | CH186: =RC[-46] -> 0 | CI186: =RC[-46] -> 0 | CJ186: =RC[-46] -> 0 | CK186: =RC[-46] -> 0 | CL186: =RC[-46] -> 1 | CM186: =RC[-46] -> 0 | CN186: =RC[-46] -> 0 | CO186: =RC[-46] -> 5420374.7400000002 | CP186: =RC[-46] -> 0 | CQ186: =RC[-46] -> 0 | CR186: =RC[-46] -> 0 | CS186: =RC[-46] -> 0
A187: 22 | B187: 010604 | C187: Nguyễn Thị Hồng | D187: NV PVHK | E187: 10525139496012 | F187: =RC[29]+RC[30]+RC[31]+RC[32]+RC[33]+RC[34]+RC[35]+RC[36]+RC[37] -> 4648984 | G187: =RC[17]+RC[18]++RC[19]+RC[20]+RC[21]+RC[38]+RC[39]+RC[41] -> 0 | H187: 0 | I187: 0 | J187: =RC[-2]+RC[-1] -> 0 | K187: 0 | L187: 601538 | M187: 241500 | N187: =RC[15]+RC[16]+RC[17]+RC[18]+RC[19]+RC[20] -> 242308 | O187: 0 | P187: 0 | Q187: 5734330 | R187: 184000 | S187: 34500 | T187: 23000 | U187: 54928.3 | V187: 0 | W187: 5437901.7000000002 | X187: 0 | Y187: 0 | Z187: 0 | AA187: 0 | AB187: 0 | AC187: 0 | AD187: 0 | AE187: 0 | AF187: 0 | AG187: 0 | AH187: 242308 | AI187: 4648984 | AJ187: 0 | AK187: 0 | AL187: 0 | AM187: 0 | AN187: 0 | AO187: 0 | AP187: 0 | AQ187: 0 | AR187: =1 -> 1 | AS187: 0 | AT187: 0 | AU187: =RC[-30]-RC[-29]-RC[-28]-RC[-27]-RC[-26]-RC[-25] -> 5437901.7000000002 | AV187: 0 | AW187: =RC[1]-RC[2] -> 80769.333000000013 | AX187: 242308 | AY187: 161538.66699999999 | AZ187: =RC[-46] -> 4648984 | BA187: =RC[-46] -> 0 | BB187: =RC[-46] -> 0 | BC187: =RC[-46] -> 0 | BD187: =RC[-46] -> 0 | BE187: =RC[-46] -> 0 | BF187: =RC[-46] -> 601538 | BG187: =RC[-46] -> 241500 | BH187: =RC[-46] -> 242308 | BI187: =RC[-46] -> 0 | BJ187: =RC[-46] -> 0 | BK187: =RC[-46] -> 5734330 | BL187: =RC[-46] -> 184000 | BM187: =RC[-46] -> 34500 | BN187: =RC[-46] -> 23000 | BO187: =RC[-46] -> 54928.3 | BP187: =RC[-46] -> 0 | BQ187: =RC[-46] -> 5437901.7000000002 | BR187: =RC[-46] -> 0 | BS187: =RC[-46] -> 0 | BT187: =RC[-46] -> 0 | BU187: =RC[-46] -> 0 | BV187: =RC[-46] -> 0 | BW187: =RC[-46] -> 0 | BX187: =RC[-46] -> 0 | BY187: =RC[-46] -> 0 | BZ187: =RC[-46] -> 0 | CA187: =RC[-46] -> 0 | CB187: =RC[-46] -> 242308 | CC187: =RC[-46] -> 4648984 | CD187: =RC[-46] -> 0 | CE187: =RC[-46] -> 0 | CF187: =RC[-46] -> 0 | CG187: =RC[-46] -> 0 | CH187: =RC[-46] -> 0 | CI187: =RC[-46] -> 0 | CJ187: =RC[-46] -> 0 | CK187: =RC[-46] -> 0 | CL187: =RC[-46] -> 1 | CM187: =RC[-46] -> 0 | CN187: =RC[-46] -> 0 | CO187: =RC[-46] -> 5437901.7000000002 | CP187: =RC[-46] -> 0 | CQ187: =RC[-46] -> 80769.333000000013 | CR187: =RC[-46] -> 242308 | CS187: =RC[-46] -> 161538.66699999999
A188: 23 | B188: 010605 | C188: Nguyễn Thị Thuỳ Dương | D188: NV PVHK | E188: 10520192647012 | F188: =RC[29]+RC[30]+RC[31]+RC[32]+RC[33]+RC[34]+RC[35]+RC[36]+RC[37] -> 5737541 | G188: =RC[17]+RC[18]++RC[19]+RC[20]+RC[21]+RC[38]+RC[39]+RC[41] -> 0 | H188: 0 | I188: 0 | J188: =RC[-2]+RC[-1] -> 0 | K188: 0 | L188: 627692 | M188: 283763 | N188: =RC[15]+RC[16]+RC[17]+RC[18]+RC[19]+RC[20] -> 284712 | O188: 0 | P188: 0 | Q188: 6933708 | R188: 216200 | S188: 40538 | T188: 27025 | U188: 66499.45 | V188: 0 | W188: 6583445.5499999998 | X188: 0 | Y188: 0 | Z188: 0 | AA188: 0 | AB188: 0 | AC188: 0 | AD188: 0 | AE188: 0 | AF188: 0 | AG188: 0 | AH188: 284712 | AI188: 5737541 | AJ188: 0 | AK188: 0 | AL188: 0 | AM188: 0 | AN188: 0 | AO188: 0 | AP188: 0 | AQ188: 0 | AR188: =1 -> 1 | AS188: 0 | AT188: 0 | AU188: =RC[-30]-RC[-29]-RC[-28]-RC[-27]-RC[-26]-RC[-25] -> 6583445.5499999998 | AV188: 0 | AW188: =RC[1]-RC[2] -> 94904 | AX188: 284712 | AY188: 189808 | AZ188: =RC[-46] -> 5737541 | BA188: =RC[-46] -> 0 | BB188: =RC[-46] -> 0 | BC188: =RC[-46] -> 0 | BD188: =RC[-46] -> 0 | BE188: =RC[-46] -> 0 | BF188: =RC[-46] -> 627692 | BG188: =RC[-46] -> 283763 | BH188: =RC[-46] -> 284712 | BI188: =RC[-46] -> 0 | BJ188: =RC[-46] -> 0 | BK188: =RC[-46] -> 6933708 | BL188: =RC[-46] -> 216200 | BM188: =RC[-46] -> 40538 | BN188: =RC[-46] -> 27025 | BO188: =RC[-46] -> 66499.45 | BP188: =RC[-46] -> 0 | BQ188: =RC[-46] -> 6583445.5499999998 | BR188: =RC[-46] -> 0 | BS188: =RC[-46] -> 0 | BT188: =RC[-46] -> 0 | BU188: =RC[-46] -> 0 | BV188: =RC[-46] -> 0 | BW188: =RC[-46] -> 0 | BX188: =RC[-46] -> 0 | BY188: =RC[-46] -> 0 | BZ188: =RC[-46] -> 0 | CA188: =RC[-46] -> 0 | CB188: =RC[-46] -> 284712 | CC188: =RC[-46] -> 5737541 | CD188: =RC[-46] -> 0 | CE188: =RC[-46] -> 0 | CF188: =RC[-46] -> 0 | CG188: =RC[-46] -> 0 | CH188: =RC[-46] -> 0 | CI188: =RC[-46] -> 0 | CJ188: =RC[-46] -> 0 | CK188: =RC[-46] -> 0 | CL188: =RC[-46] -> 1 | CM188: =RC[-46] -> 0 | CN188: =RC[-46] -> 0 | CO188: =RC[-46] -> 6583445.5499999998 | CP188: =RC[-46] -> 0 | CQ188: =RC[-46] -> 94904 | CR188: =RC[-46] -> 284712 | CS188: =RC[-46] -> 189808
A189: 24 | B189: 010606 | C189: Lê Thị Thao | D189: NV PVHK | E189: 10520292194015 | F189: =RC[29]+RC[30]+RC[31]+RC[32]+RC[33]+RC[34]+RC[35]+RC[36]+RC[37] -> 5501152 | G189: =RC[17]+RC[18]++RC[19]+RC[20]+RC[21]+RC[38]+RC[39]+RC[41] -> 0 | H189: 0 | I189: 0 | J189: =RC[-2]+RC[-1] -> 0 | K189: 0 | L189: 601538 | M189: 283763 | N189: =RC[15]+RC[16]+RC[17]+RC[18]+RC[19]+RC[20] -> 284712 | O189: 0 | P189: 0 | Q189: 6671165 | R189: 216200 | S189: 40538 | T189: 27025 | U189: 63874.02 | V189: 0 | W189: 6323527.9800000004 | X189: 0 | Y189: 0 | Z189: 0 | AA189: 0 | AB189: 0 | AC189: 0 | AD189: 0 | AE189: 0 | AF189: 0 | AG189: 0 | AH189: 284712 | AI189: 5501152 | AJ189: 0 | AK189: 0 | AL189: 0 | AM189: 0 | AN189: 0 | AO189: 0 | AP189: 0 | AQ189: 0 | AR189: =1 -> 1 | AS189: 0 | AT189: 0 | AU189: =RC[-30]-RC[-29]-RC[-28]-RC[-27]-RC[-26]-RC[-25] -> 6323527.9800000004 | AV189: 0 | AW189: =RC[1]-RC[2] -> 94904 | AX189: 284712 | AY189: 189808 | AZ189: =RC[-46] -> 5501152 | BA189: =RC[-46] -> 0 | BB189: =RC[-46] -> 0 | BC189: =RC[-46] -> 0 | BD189: =RC[-46] -> 0 | BE189: =RC[-46] -> 0 | BF189: =RC[-46] -> 601538 | BG189: =RC[-46] -> 283763 | BH189: =RC[-46] -> 284712 | BI189: =RC[-46] -> 0 | BJ189: =RC[-46] -> 0 | BK189: =RC[-46] -> 6671165 | BL189: =RC[-46] -> 216200 | BM189: =RC[-46] -> 40538 | BN189: =RC[-46] -> 27025 | BO189: =RC[-46] -> 63874.02 | BP189: =RC[-46] -> 0 | BQ189: =RC[-46] -> 6323527.9800000004 | BR189: =RC[-46] -> 0 | BS189: =RC[-46] -> 0 | BT189: =RC[-46] -> 0 | BU189: =RC[-46] -> 0 | BV189: =RC[-46] -> 0 | BW189: =RC[-46] -> 0 | BX189: =RC[-46] -> 0 | BY189: =RC[-46] -> 0 | BZ189: =RC[-46] -> 0 | CA189: =RC[-46] -> 0 | CB189: =RC[-46] -> 284712 | CC189: =RC[-46] -> 5501152 | CD189: =RC[-46] -> 0 | CE189: =RC[-46] -> 0 | CF189: =RC[-46] -> 0 | CG189: =RC[-46] -> 0 | CH189: =RC[-46] -> 0 | CI189: =RC[-46] -> 0 | CJ189: =RC[-46] -> 0 | CK189: =RC[-46] -> 0 | CL189: =RC[-46] -> 1 | CM189: =RC[-46] -> 0 | CN189: =RC[-46] -> 0 | CO189: =RC[-46] -> 6323527.9800000004 | CP189: =RC[-46] -> 0 | CQ189: =RC[-46] -> 94904 | CR189: =RC[-46] -> 284712 | CS189: =RC[-46] -> 189808
A190: 25 | B190: 010611 | C190: Hoàng Thị Huyền Diệu | D190: NV PVHK | E190: 10522162383013 | F190: =RC[29]+RC[30]+RC[31]+RC[32]+RC[33]+RC[34]+RC[35]+RC[36]+RC[37] -> 6216156 | G190: =RC[17]+RC[18]++RC[19]+RC[20]+RC[21]+RC[38]+RC[39]+RC[41] -> 0 | H190: 0 | I190: 0 | J190: =RC[-2]+RC[-1] -> 0 | K190: 0 | L190: 680000 | M190: 283763 | N190: =RC[15]+RC[16]+RC[17]+RC[18]+RC[19]+RC[20] -> 284712 | O190: 0 | P190: 0 | Q190: 7464631 | R190: 216200 | S190: 40538 | T190: 27025 | U190: 71808.679999999993 | V190: 0 | W190: 7109059.3200000003 | X190: 0 | Y190: 0 | Z190: 0 | AA190: 0 | AB190: 0 | AC190: 0 | AD190: 0 | AE190: 0 | AF190: 0 | AG190: 0 | AH190: 284712 | AI190: 6216156 | AJ190: 0 | AK190: 0 | AL190: 0 | AM190: 0 | AN190: 0 | AO190: 0 | AP190: 0 | AQ190: 0 | AR190: =1 -> 1 | AS190: 0 | AT190: 0 | AU190: =RC[-30]-RC[-29]-RC[-28]-RC[-27]-RC[-26]-RC[-25] -> 7109059.3200000003 | AV190: 0 | AW190: =RC[1]-RC[2] -> 94904 | AX190: 284712 | AY190: 189808 | AZ190: =RC[-46] -> 6216156 | BA190: =RC[-46] -> 0 | BB190: =RC[-46] -> 0 | BC190: =RC[-46] -> 0 | BD190: =RC[-46] -> 0 | BE190: =RC[-46] -> 0 | BF190: =RC[-46] -> 680000 | BG190: =RC[-46] -> 283763 | BH190: =RC[-46] -> 284712 | BI190: =RC[-46] -> 0 | BJ190: =RC[-46] -> 0 | BK190: =RC[-46] -> 7464631 | BL190: =RC[-46] -> 216200 | BM190: =RC[-46] -> 40538 | BN190: =RC[-46] -> 27025 | BO190: =RC[-46] -> 71808.679999999993 | BP190: =RC[-46] -> 0 | BQ190: =RC[-46] -> 7109059.3200000003 | BR190: =RC[-46] -> 0 | BS190: =RC[-46] -> 0 | BT190: =RC[-46] -> 0 | BU190: =RC[-46] -> 0 | BV190: =RC[-46] -> 0 | BW190: =RC[-46] -> 0 | BX190: =RC[-46] -> 0 | BY190: =RC[-46] -> 0 | BZ190: =RC[-46] -> 0 | CA190: =RC[-46] -> 0 | CB190: =RC[-46] -> 284712 | CC190: =RC[-46] -> 6216156 | CD190: =RC[-46] -> 0 | CE190: =RC[-46] -> 0 | CF190: =RC[-46] -> 0 | CG190: =RC[-46] -> 0 | CH190: =RC[-46] -> 0 | CI190: =RC[-46] -> 0 | CJ190: =RC[-46] -> 0 | CK190: =RC[-46] -> 0 | CL190: =RC[-46] -> 1 | CM190: =RC[-46] -> 0 | CN190: =RC[-46] -> 0 | CO190: =RC[-46] -> 7109059.3200000003 | CP190: =RC[-46] -> 0 | CQ190: =RC[-46] -> 94904 | CR190: =RC[-46] -> 284712 | CS190: =RC[-46] -> 189808
A191: 26 | B191: 010612 | C191: Tạ Thị Phượng | D191: NV PVHK | E191: 10523498955011 | F191: =RC[29]+RC[30]+RC[31]+RC[32]+RC[33]+RC[34]+RC[35]+RC[36]+RC[37] -> 5865950 | G191: =RC[17]+RC[18]++RC[19]+RC[20]+RC[21]+RC[38]+RC[39]+RC[41] -> 0 | H191: 0 | I191: 0 | J191: =RC[-2]+RC[-1] -> 0 | K191: 0 | L191: 680000 | M191: 283763 | N191: =RC[15]+RC[16]+RC[17]+RC[18]+RC[19]+RC[20] -> 284712 | O191: 0 | P191: 0 | Q191: 7114425 | R191: 216200 | S191: 40538 | T191: 27025 | U191: 68306.62 | V191: 0 | W191: 6762355.3799999999 | X191: 0 | Y191: 0 | Z191: 0 | AA191: 0 | AB191: 0 | AC191: 0 | AD191: 0 | AE191: 0 | AF191: 0 | AG191: 0 | AH191: 284712 | AI191: 5865950 | AJ191: 0 | AK191: 0 | AL191: 0 | AM191: 0 | AN191: 0 | AO191: 0 | AP191: 0 | AQ191: 0 | AR191: =1 -> 1 | AS191: 0 | AT191: 0 | AU191: =RC[-30]-RC[-29]-RC[-28]-RC[-27]-RC[-26]-RC[-25] -> 6762355.3799999999 | AV191: 0 | AW191: =RC[1]-RC[2] -> 94904 | AX191: 284712 | AY191: 189808 | AZ191: =RC[-46] -> 5865950 | BA191: =RC[-46] -> 0 | BB191: =RC[-46] -> 0 | BC191: =RC[-46] -> 0 | BD191: =RC[-46] -> 0 | BE191: =RC[-46] -> 0 | BF191: =RC[-46] -> 680000 | BG191: =RC[-46] -> 283763 | BH191: =RC[-46] -> 284712 | BI191: =RC[-46] -> 0 | BJ191: =RC[-46] -> 0 | BK191: =RC[-46] -> 7114425 | BL191: =RC[-46] -> 216200 | BM191: =RC[-46] -> 40538 | BN191: =RC[-46] -> 27025 | BO191: =RC[-46] -> 68306.62 | BP191: =RC[-46] -> 0 | BQ191: =RC[-46] -> 6762355.3799999999 | BR191: =RC[-46] -> 0 | BS191: =RC[-46] -> 0 | BT191: =RC[-46] -> 0 | BU191: =RC[-46] -> 0 | BV191: =RC[-46] -> 0 | BW191: =RC[-46] -> 0 | BX191: =RC[-46] -> 0 | BY191: =RC[-46] -> 0 | BZ191: =RC[-46] -> 0 | CA191: =RC[-46] -> 0 | CB191: =RC[-46] -> 284712 | CC191: =RC[-46] -> 5865950 | CD191: =RC[-46] -> 0 | CE191: =RC[-46] -> 0 | CF191: =RC[-46] -> 0 | CG191: =RC[-46] -> 0 | CH191: =RC[-46] -> 0 | CI191: =RC[-46] -> 0 | CJ191: =RC[-46] -> 0 | CK191: =RC[-46] -> 0 | CL191: =RC[-46] -> 1 | CM191: =RC[-46] -> 0 | CN191: =RC[-46] -> 0 | CO191: =RC[-46] -> 6762355.3799999999 | CP191: =RC[-46] -> 0 | CQ191: =RC[-46] -> 94904 | CR191: =RC[-46] -> 284712 | CS191: =RC[-46] -> 189808
A192: 27 | B192: 010613 | C192: Nguyễn Thị Hường | D192: NV PVHK | E192: 10522162447011 | F192: =RC[29]+RC[30]+RC[31]+RC[32]+RC[33]+RC[34]+RC[35]+RC[36]+RC[37] -> 6216156 | G192: =RC[17]+RC[18]++RC[19]+RC[20]+RC[21]+RC[38]+RC[39]+RC[41] -> 0 | H192: 0 | I192: 0 | J192: =RC[-2]+RC[-1] -> 0 | K192: 0 | L192: 680000 | M192: 283763 | N192: =RC[15]+RC[16]+RC[17]+RC[18]+RC[19]+RC[20] -> 284712 | O192: 0 | P192: 0 | Q192: 7464631 | R192: 216200 | S192: 40538 | T192: 27025 | U192: 71808.679999999993 | V192: 0 | W192: 7109059.3200000003 | X192: 0 | Y192: 0 | Z192: 0 | AA192: 0 | AB192: 0 | AC192: 0 | AD192: 0 | AE192: 0 | AF192: 0 | AG192: 0 | AH192: 284712 | AI192: 6216156 | AJ192: 0 | AK192: 0 | AL192: 0 | AM192: 0 | AN192: 0 | AO192: 0 | AP192: 0 | AQ192: 0 | AR192: =1 -> 1 | AS192: 0 | AT192: 0 | AU192: =RC[-30]-RC[-29]-RC[-28]-RC[-27]-RC[-26]-RC[-25] -> 7109059.3200000003 | AV192: 0 | AW192: =RC[1]-RC[2] -> 94904 | AX192: 284712 | AY192: 189808 | AZ192: =RC[-46] -> 6216156 | BA192: =RC[-46] -> 0 | BB192: =RC[-46] -> 0 | BC192: =RC[-46] -> 0 | BD192: =RC[-46] -> 0 | BE192: =RC[-46] -> 0 | BF192: =RC[-46] -> 680000 | BG192: =RC[-46] -> 283763 | BH192: =RC[-46] -> 284712 | BI192: =RC[-46] -> 0 | BJ192: =RC[-46] -> 0 | BK192: =RC[-46] -> 7464631 | BL192: =RC[-46] -> 216200 | BM192: =RC[-46] -> 40538 | BN192: =RC[-46] -> 27025 | BO192: =RC[-46] -> 71808.679999999993 | BP192: =RC[-46] -> 0 | BQ192: =RC[-46] -> 7109059.3200000003 | BR192: =RC[-46] -> 0 | BS192: =RC[-46] -> 0 | BT192: =RC[-46] -> 0 | BU192: =RC[-46] -> 0 | BV192: =RC[-46] -> 0 | BW192: =RC[-46] -> 0 | BX192: =RC[-46] -> 0 | BY192: =RC[-46] -> 0 | BZ192: =RC[-46] -> 0 | CA192: =RC[-46] -> 0 | CB192: =RC[-46] -> 284712 | CC192: =RC[-46] -> 6216156 | CD192: =RC[-46] -> 0 | CE192: =RC[-46] -> 0 | CF192: =RC[-46] -> 0 | CG192: =RC[-46] -> 0 | CH192: =RC[-46] -> 0 | CI192: =RC[-46] -> 0 | CJ192: =RC[-46] -> 0 | CK192: =RC[-46] -> 0 | CL192: =RC[-46] -> 1 | CM192: =RC[-46] -> 0 | CN192: =RC[-46] -> 0 | CO192: =RC[-46] -> 7109059.3200000003 | CP192: =RC[-46] -> 0 | CQ192: =RC[-46] -> 94904 | CR192: =RC[-46] -> 284712 | CS192: =RC[-46] -> 189808
A193: 28 | B193: 010616 | C193: Đỗ Thanh Thuỷ | D193: NV PVHK | E193: 10522162026016 | F193: =RC[29]+RC[30]+RC[31]+RC[32]+RC[33]+RC[34]+RC[35]+RC[36]+RC[37] -> 6216156 | G193: =RC[17]+RC[18]++RC[19]+RC[20]+RC[21]+RC[38]+RC[39]+RC[41] -> 0 | H193: 0 | I193: 0 | J193: =RC[-2]+RC[-1] -> 0 | K193: 0 | L193: 680000 | M193: 283763 | N193: =RC[15]+RC[16]+RC[17]+RC[18]+RC[19]+RC[20] -> 284712 | O193: 0 | P193: 0 | Q193: 7464631 | R193: 216200 | S193: 40538 | T193: 27025 | U193: 71808.679999999993 | V193: 0 | W193: 7109059.3200000003 | X193: 0 | Y193: 0 | Z193: 0 | AA193: 0 | AB193: 0 | AC193: 0 | AD193: 0 | AE193: 0 | AF193: 0 | AG193: 0 | AH193: 284712 | AI193: 6216156 | AJ193: 0 | AK193: 0 | AL193: 0 | AM193: 0 | AN193: 0 | AO193: 0 | AP193: 0 | AQ193: 0 | AR193: =1 -> 1 | AS193: 0 | AT193: 0 | AU193: =RC[-30]-RC[-29]-RC[-28]-RC[-27]-RC[-26]-RC[-25] -> 7109059.3200000003 | AV193: 0 | AW193: =RC[1]-RC[2] -> 94904 | AX193: 284712 | AY193: 189808 | AZ193: =RC[-46] -> 6216156 | BA193: =RC[-46] -> 0 | BB193: =RC[-46] -> 0 | BC193: =RC[-46] -> 0 | BD193: =RC[-46] -> 0 | BE193: =RC[-46] -> 0 | BF193: =RC[-46] -> 680000 | BG193: =RC[-46] -> 283763 | BH193: =RC[-46] -> 284712 | BI193: =RC[-46] -> 0 | BJ193: =RC[-46] -> 0 | BK193: =RC[-46] -> 7464631 | BL193: =RC[-46] -> 216200 | BM193: =RC[-46] -> 40538 | BN193: =RC[-46] -> 27025 | BO193: =RC[-46] -> 71808.679999999993 | BP193: =RC[-46] -> 0 | BQ193: =RC[-46] -> 7109059.3200000003 | BR193: =RC[-46] -> 0 | BS193: =RC[-46] -> 0 | BT193: =RC[-46] -> 0 | BU193: =RC[-46] -> 0 | BV193: =RC[-46] -> 0 | BW193: =RC[-46] -> 0 | BX193: =RC[-46] -> 0 | BY193: =RC[-46] -> 0 | BZ193: =RC[-46] -> 0 | CA193: =RC[-46] -> 0 | CB193: =RC[-46] -> 284712 | CC193: =RC[-46] -> 6216156 | CD193: =RC[-46] -> 0 | CE193: =RC[-46] -> 0 | CF193: =RC[-46] -> 0 | CG193: =RC[-46] -> 0 | CH193: =RC[-46] -> 0 | CI193: =RC[-46] -> 0 | CJ193: =RC[-46] -> 0 | CK193: =RC[-46] -> 0 | CL193: =RC[-46] -> 1 | CM193: =RC[-46] -> 0 | CN193: =RC[-46] -> 0 | CO193: =RC[-46] -> 7109059.3200000003 | CP193: =RC[-46] -> 0 | CQ193: =RC[-46] -> 94904 | CR193: =RC[-46] -> 284712 | CS193: =RC[-46] -> 189808
A194: 29 | B194: 010617 | C194: Ngô Thị Hường | D194: NV PVHK | E194: 10522162211018 | F194: =RC[29]+RC[30]+RC[31]+RC[32]+RC[33]+RC[34]+RC[35]+RC[36]+RC[37] -> 6216156 | G194: =RC[17]+RC[18]++RC[19]+RC[20]+RC[21]+RC[38]+RC[39]+RC[41] -> 0 | H194: 0 | I194: 0 | J194: =RC[-2]+RC[-1] -> 0 | K194: 0 | L194: 680000 | M194: 283763 | N194: =RC[15]+RC[16]+RC[17]+RC[18]+RC[19]+RC[20] -> 284712 | O194: 0 | P194: 0 | Q194: 7464631 | R194: 216200 | S194: 40538 | T194: 27025 | U194: 71808.679999999993 | V194: 0 | W194: 7109059.3200000003 | X194: 0 | Y194: 0 | Z194: 0 | AA194: 0 | AB194: 0 | AC194: 0 | AD194: 0 | AE194: 0 | AF194: 0 | AG194: 0 | AH194: 284712 | AI194: 6216156 | AJ194: 0 | AK194: 0 | AL194: 0 | AM194: 0 | AN194: 0 | AO194: 0 | AP194: 0 | AQ194: 0 | AR194: =1 -> 1 | AS194: 0 | AT194: 0 | AU194: =RC[-30]-RC[-29]-RC[-28]-RC[-27]-RC[-26]-RC[-25] -> 7109059.3200000003 | AV194: 0 | AW194: =RC[1]-RC[2] -> 94904 | AX194: 284712 | AY194: 189808 | AZ194: =RC[-46] -> 6216156 | BA194: =RC[-46] -> 0 | BB194: =RC[-46] -> 0 | BC194: =RC[-46] -> 0 | BD194: =RC[-46] -> 0 | BE194: =RC[-46] -> 0 | BF194: =RC[-46] -> 680000 | BG194: =RC[-46] -> 283763 | BH194: =RC[-46] -> 284712 | BI194: =RC[-46] -> 0 | BJ194: =RC[-46] -> 0 | BK194: =RC[-46] -> 7464631 | BL194: =RC[-46] -> 216200 | BM194: =RC[-46] -> 40538 | BN194: =RC[-46] -> 27025 | BO194: =RC[-46] -> 71808.679999999993 | BP194: =RC[-46] -> 0 | BQ194: =RC[-46] -> 7109059.3200000003 | BR194: =RC[-46] -> 0 | BS194: =RC[-46] -> 0 | BT194: =RC[-46] -> 0 | BU194: =RC[-46] -> 0 | BV194: =RC[-46] -> 0 | BW194: =RC[-46] -> 0 | BX194: =RC[-46] -> 0 | BY194: =RC[-46] -> 0 | BZ194: =RC[-46] -> 0 | CA194: =RC[-46] -> 0 | CB194: =RC[-46] -> 284712 | CC194: =RC[-46] -> 6216156 | CD194: =RC[-46] -> 0 | CE194: =RC[-46] -> 0 | CF194: =RC[-46] -> 0 | CG194: =RC[-46] -> 0 | CH194: =RC[-46] -> 0 | CI194: =RC[-46] -> 0 | CJ194: =RC[-46] -> 0 | CK194: =RC[-46] -> 0 | CL194: =RC[-46] -> 1 | CM194: =RC[-46] -> 0 | CN194: =RC[-46] -> 0 | CO194: =RC[-46] -> 7109059.3200000003 | CP194: =RC[-46] -> 0 | CQ194: =RC[-46] -> 94904 | CR194: =RC[-46] -> 284712 | CS194: =RC[-46] -> 189808
A195: 30 | B195: 010627 | C195: Trần Thị Thu | D195: NV PVHK | E195: 10523498954015 | F195: =RC[29]+RC[30]+RC[31]+RC[32]+RC[33]+RC[34]+RC[35]+RC[36]+RC[37] -> 5865950 | G195: =RC[17]+RC[18]++RC[19]+RC[20]+RC[21]+RC[38]+RC[39]+RC[41] -> 0 | H195: 0 | I195: 0 | J195: =RC[-2]+RC[-1] -> 0 | K195: 0 | L195: 680000 | M195: 283763 | N195: =RC[15]+RC[16]+RC[17]+RC[18]+RC[19]+RC[20] -> 284712 | O195: 0 | P195: 0 | Q195: 7114425 | R195: 216200 | S195: 40538 | T195: 27025 | U195: 68306.62 | V195: 0 | W195: 6762355.3799999999 | X195: 0 | Y195: 0 | Z195: 0 | AA195: 0 | AB195: 0 | AC195: 0 | AD195: 0 | AE195: 0 | AF195: 0 | AG195: 0 | AH195: 284712 | AI195: 5865950 | AJ195: 0 | AK195: 0 | AL195: 0 | AM195: 0 | AN195: 0 | AO195: 0 | AP195: 0 | AQ195: 0 | AR195: =1 -> 1 | AS195: 0 | AT195: 0 | AU195: =RC[-30]-RC[-29]-RC[-28]-RC[-27]-RC[-26]-RC[-25] -> 6762355.3799999999 | AV195: 0 | AW195: =RC[1]-RC[2] -> 94904 | AX195: 284712 | AY195: 189808 | AZ195: =RC[-46] -> 5865950 | BA195: =RC[-46] -> 0 | BB195: =RC[-46] -> 0 | BC195: =RC[-46] -> 0 | BD195: =RC[-46] -> 0 | BE195: =RC[-46] -> 0 | BF195: =RC[-46] -> 680000 | BG195: =RC[-46] -> 283763 | BH195: =RC[-46] -> 284712 | BI195: =RC[-46] -> 0 | BJ195: =RC[-46] -> 0 | BK195: =RC[-46] -> 7114425 | BL195: =RC[-46] -> 216200 | BM195: =RC[-46] -> 40538 | BN195: =RC[-46] -> 27025 | BO195: =RC[-46] -> 68306.62 | BP195: =RC[-46] -> 0 | BQ195: =RC[-46] -> 6762355.3799999999 | BR195: =RC[-46] -> 0 | BS195: =RC[-46] -> 0 | BT195: =RC[-46] -> 0 | BU195: =RC[-46] -> 0 | BV195: =RC[-46] -> 0 | BW195: =RC[-46] -> 0 | BX195: =RC[-46] -> 0 | BY195: =RC[-46] -> 0 | BZ195: =RC[-46] -> 0 | CA195: =RC[-46] -> 0 | CB195: =RC[-46] -> 284712 | CC195: =RC[-46] -> 5865950 | CD195: =RC[-46] -> 0 | CE195: =RC[-46] -> 0 | CF195: =RC[-46] -> 0 | CG195: =RC[-46] -> 0 | CH195: =RC[-46] -> 0 | CI195: =RC[-46] -> 0 | CJ195: =RC[-46] -> 0 | CK195: =RC[-46] -> 0 | CL195: =RC[-46] -> 1 | CM195: =RC[-46] -> 0 | CN195: =RC[-46] -> 0 | CO195: =RC[-46] -> 6762355.3799999999 | CP195: =RC[-46] -> 0 | CQ195: =RC[-46] -> 94904 | CR195: =RC[-46] -> 284712 | CS195: =RC[-46] -> 189808
A196: 31 | B196: 011110 | C196: Đinh Thị Vân Anh | D196: NV PVHK | E196: 19026970092013 | F196: =RC[29]+RC[30]+RC[31]+RC[32]+RC[33]+RC[34]+RC[35]+RC[36]+RC[37] -> 5253090 | G196: =RC[17]+RC[18]++RC[19]+RC[20]+RC[21]+RC[38]+RC[39]+RC[41] -> 0 | H196: 0 | I196: 0 | J196: =RC[-2]+RC[-1] -> 0 | K196: 0 | L196: 680000 | M196: 241500 | N196: =RC[15]+RC[16]+RC[17]+RC[18]+RC[19]+RC[20] -> 242308 | O196: 0 | P196: 0 | Q196: 6416898 | R196: 184000 | S196: 34500 | T196: 23000 | U196: 61753.98 | V196: 0 | W196: 6113644.0199999996 | X196: 0 | Y196: 0 | Z196: 0 | AA196: 0 | AB196: 0 | AC196: 0 | AD196: 0 | AE196: 0 | AF196: 0 | AG196: 0 | AH196: 242308 | AI196: 5253090 | AJ196: 0 | AK196: 0 | AL196: 0 | AM196: 0 | AN196: 0 | AO196: 0 | AP196: 0 | AQ196: 0 | AR196: =1 -> 1 | AS196: 0 | AT196: 0 | AU196: =RC[-30]-RC[-29]-RC[-28]-RC[-27]-RC[-26]-RC[-25] -> 6113644.0199999996 | AV196: 0 | AW196: =RC[1]-RC[2] -> 80769.333000000013 | AX196: 242308 | AY196: 161538.66699999999 | AZ196: =RC[-46] -> 5253090 | BA196: =RC[-46] -> 0 | BB196: =RC[-46] -> 0 | BC196: =RC[-46] -> 0 | BD196: =RC[-46] -> 0 | BE196: =RC[-46] -> 0 | BF196: =RC[-46] -> 680000 | BG196: =RC[-46] -> 241500 | BH196: =RC[-46] -> 242308 | BI196: =RC[-46] -> 0 | BJ196: =RC[-46] -> 0 | BK196: =RC[-46] -> 6416898 | BL196: =RC[-46] -> 184000 | BM196: =RC[-46] -> 34500 | BN196: =RC[-46] -> 23000 | BO196: =RC[-46] -> 61753.98 | BP196: =RC[-46] -> 0 | BQ196: =RC[-46] -> 6113644.0199999996 | BR196: =RC[-46] -> 0 | BS196: =RC[-46] -> 0 | BT196: =RC[-46] -> 0 | BU196: =RC[-46] -> 0 | BV196: =RC[-46] -> 0 | BW196: =RC[-46] -> 0 | BX196: =RC[-46] -> 0 | BY196: =RC[-46] -> 0 | BZ196: =RC[-46] -> 0 | CA196: =RC[-46] -> 0 | CB196: =RC[-46] -> 242308 | CC196: =RC[-46] -> 5253090 | CD196: =RC[-46] -> 0 | CE196: =RC[-46] -> 0 | CF196: =RC[-46] -> 0 | CG196: =RC[-46] -> 0 | CH196: =RC[-46] -> 0 | CI196: =RC[-46] -> 0 | CJ196: =RC[-46] -> 0 | CK196: =RC[-46] -> 0 | CL196: =RC[-46] -> 1 | CM196: =RC[-46] -> 0 | CN196: =RC[-46] -> 0 | CO196: =RC[-46] -> 6113644.0199999996 | CP196: =RC[-46] -> 0 | CQ196: =RC[-46] -> 80769.333000000013 | CR196: =RC[-46] -> 242308 | CS196: =RC[-46] -> 161538.66699999999
A197: 32 | B197: 011112 | C197: Đào Xuân Tuân | D197: NV PVHK | E197: 19026970094016 | F197: =RC[29]+RC[30]+RC[31]+RC[32]+RC[33]+RC[34]+RC[35]+RC[36]+RC[37] -> 5544928 | G197: =RC[17]+RC[18]++RC[19]+RC[20]+RC[21]+RC[38]+RC[39]+RC[41] -> 0 | H197: 0 | I197: 0 | J197: =RC[-2]+RC[-1] -> 0 | K197: 0 | L197: 680000 | M197: 241500 | N197: =RC[15]+RC[16]+RC[17]+RC[18]+RC[19]+RC[20] -> 0 | O197: 0 | P197: 0 | Q197: 6466428 | R197: 184000 | S197: 34500 | T197: 23000 | U197: 62249.279999999999 | V197: 0 | W197: 6162678.7199999997 | X197: 0 | Y197: 0 | Z197: 0 | AA197: 0 | AB197: 0 | AC197: 0 | AD197: 0 | AE197: 0 | AF197: 0 | AG197: 0 | AH197: 0 | AI197: 5544928 | AJ197: 0 | AK197: 0 | AL197: 0 | AM197: 0 | AN197: 0 | AO197: 0 | AP197: 0 | AQ197: 0 | AR197: =1 -> 1 | AS197: 0 | AT197: 0 | AU197: =RC[-30]-RC[-29]-RC[-28]-RC[-27]-RC[-26]-RC[-25] -> 6162678.7199999997 | AV197: 0 | AW197: =RC[1]-RC[2] -> 0 | AX197: 0 | AY197: 0 | AZ197: =RC[-46] -> 5544928 | BA197: =RC[-46] -> 0 | BB197: =RC[-46] -> 0 | BC197: =RC[-46] -> 0 | BD197: =RC[-46] -> 0 | BE197: =RC[-46] -> 0 | BF197: =RC[-46] -> 680000 | BG197: =RC[-46] -> 241500 | BH197: =RC[-46] -> 0 | BI197: =RC[-46] -> 0 | BJ197: =RC[-46] -> 0 | BK197: =RC[-46] -> 6466428 | BL197: =RC[-46] -> 184000 | BM197: =RC[-46] -> 34500 | BN197: =RC[-46] -> 23000 | BO197: =RC[-46] -> 62249.279999999999 | BP197: =RC[-46] -> 0 | BQ197: =RC[-46] -> 6162678.7199999997 | BR197: =RC[-46] -> 0 | BS197: =RC[-46] -> 0 | BT197: =RC[-46] -> 0 | BU197: =RC[-46] -> 0 | BV197: =RC[-46] -> 0 | BW197: =RC[-46] -> 0 | BX197: =RC[-46] -> 0 | BY197: =RC[-46] -> 0 | BZ197: =RC[-46] -> 0 | CA197: =RC[-46] -> 0 | CB197: =RC[-46] -> 0 | CC197: =RC[-46] -> 5544928 | CD197: =RC[-46] -> 0 | CE197: =RC[-46] -> 0 | CF197: =RC[-46] -> 0 | CG197: =RC[-46] -> 0 | CH197: =RC[-46] -> 0 | CI197: =RC[-46] -> 0 | CJ197: =RC[-46] -> 0 | CK197: =RC[-46] -> 0 | CL197: =RC[-46] -> 1 | CM197: =RC[-46] -> 0 | CN197: =RC[-46] -> 0 | CO197: =RC[-46] -> 6162678.7199999997 | CP197: =RC[-46] -> 0 | CQ197: =RC[-46] -> 0 | CR197: =RC[-46] -> 0 | CS197: =RC[-46] -> 0
A198: 33 | B198: 011113 | C198: Trịnh Thị Hạnh | D198: NV PVHK | E198: 19026970097015 | F198: =RC[29]+RC[30]+RC[31]+RC[32]+RC[33]+RC[34]+RC[35]+RC[36]+RC[37] -> 2824995 | G198: =RC[17]+RC[18]++RC[19]+RC[20]+RC[21]+RC[38]+RC[39]+RC[41] -> 969231 | H198: 0 | I198: 0 | J198: =RC[-2]+RC[-1] -> 0 | K198: 0 | L198: 366154 | M198: 241500 | N198: =RC[15]+RC[16]+RC[17]+RC[18]+RC[19]+RC[20] -> 0 | O198: 0 | P198: 0 | Q198: 4401880 | R198: 184000 | S198: 34500 | T198: 23000 | U198: 41603.800000000003 | V198: 0 | W198: 4118776.2 | X198: 0 | Y198: 969231 | Z198: 0 | AA198: 0 | AB198: 0 | AC198: 0 | AD198: 0 | AE198: 0 | AF198: 0 | AG198: 0 | AH198: 0 | AI198: 2824995 | AJ198: 0 | AK198: 0 | AL198: 0 | AM198: 0 | AN198: 0 | AO198: 0 | AP198: 0 | AQ198: 0 | AR198: =1 -> 1 | AS198: 0 | AT198: 0 | AU198: =RC[-30]-RC[-29]-RC[-28]-RC[-27]-RC[-26]-RC[-25] -> 4118776.2 | AV198: 0 | AW198: =RC[1]-RC[2] -> 0 | AX198: 0 | AY198: 0 | AZ198: =RC[-46] -> 2824995 | BA198: =RC[-46] -> 969231 | BB198: =RC[-46] -> 0 | BC198: =RC[-46] -> 0 | BD198: =RC[-46] -> 0 | BE198: =RC[-46] -> 0 | BF198: =RC[-46] -> 366154 | BG198: =RC[-46] -> 241500 | BH198: =RC[-46] -> 0 | BI198: =RC[-46] -> 0 | BJ198: =RC[-46] -> 0 | BK198: =RC[-46] -> 4401880 | BL198: =RC[-46] -> 184000 | BM198: =RC[-46] -> 34500 | BN198: =RC[-46] -> 23000 | BO198: =RC[-46] -> 41603.800000000003 | BP198: =RC[-46] -> 0 | BQ198: =RC[-46] -> 4118776.2 | BR198: =RC[-46] -> 0 | BS198: =RC[-46] -> 969231 | BT198: =RC[-46] -> 0 | BU198: =RC[-46] -> 0 | BV198: =RC[-46] -> 0 | BW198: =RC[-46] -> 0 | BX198: =RC[-46] -> 0 | BY198: =RC[-46] -> 0 | BZ198: =RC[-46] -> 0 | CA198: =RC[-46] -> 0 | CB198: =RC[-46] -> 0 | CC198: =RC[-46] -> 2824995 | CD198: =RC[-46] -> 0 | CE198: =RC[-46] -> 0 | CF198: =RC[-46] -> 0 | CG198: =RC[-46] -> 0 | CH198: =RC[-46] -> 0 | CI198: =RC[-46] -> 0 | CJ198: =RC[-46] -> 0 | CK198: =RC[-46] -> 0 | CL198: =RC[-46] -> 1 | CM198: =RC[-46] -> 0 | CN198: =RC[-46] -> 0 | CO198: =RC[-46] -> 4118776.2 | CP198: =RC[-46] -> 0 | CQ198: =RC[-46] -> 0 | CR198: =RC[-46] -> 0 | CS198: =RC[-46] -> 0
A199: 34 | B199: 011114 | C199: Đoàn Thu Hoa | D199: NV PVHK | E199: 19020458929019 | F199: =RC[29]+RC[30]+RC[31]+RC[32]+RC[33]+RC[34]+RC[35]+RC[36]+RC[37] -> 5544928 | G199: =RC[17]+RC[18]++RC[19]+RC[20]+RC[21]+RC[38]+RC[39]+RC[41] -> 0 | H199: 0 | I199: 0 | J199: =RC[-2]+RC[-1] -> 0 | K199: 0 | L199: 680000 | M199: 241500 | N199: =RC[15]+RC[16]+RC[17]+RC[18]+RC[19]+RC[20] -> 242308 | O199: 0 | P199: 0 | Q199: 6708736 | R199: 184000 | S199: 34500 | T199: 23000 | U199: 64672.36 | V199: 0 | W199: 6402563.6399999997 | X199: 0 | Y199: 0 | Z199: 0 | AA199: 0 | AB199: 0 | AC199: 0 | AD199: 0 | AE199: 0 | AF199: 0 | AG199: 0 | AH199: 242308 | AI199: 5544928 | AJ199: 0 | AK199: 0 | AL199: 0 | AM199: 0 | AN199: 0 | AO199: 0 | AP199: 0 | AQ199: 0 | AR199: =1 -> 1 | AS199: 0 | AT199: 0 | AU199: =RC[-30]-RC[-29]-RC[-28]-RC[-27]-RC[-26]-RC[-25] -> 6402563.6399999997 | AV199: 0 | AW199: =RC[1]-RC[2] -> 80769.333000000013 | AX199: 242308 | AY199: 161538.66699999999 | AZ199: =RC[-46] -> 5544928 | BA199: =RC[-46] -> 0 | BB199: =RC[-46] -> 0 | BC199: =RC[-46] -> 0 | BD199: =RC[-46] -> 0 | BE199: =RC[-46] -> 0 | BF199: =RC[-46] -> 680000 | BG199: =RC[-46] -> 241500 | BH199: =RC[-46] -> 242308 | BI199: =RC[-46] -> 0 | BJ199: =RC[-46] -> 0 | BK199: =RC[-46] -> 6708736 | BL199: =RC[-46] -> 184000 | BM199: =RC[-46] -> 34500 | BN199: =RC[-46] -> 23000 | BO199: =RC[-46] -> 64672.36 | BP199: =RC[-46] -> 0 | BQ199: =RC[-46] -> 6402563.6399999997 | BR199: =RC[-46] -> 0 | BS199: =RC[-46] -> 0 | BT199: =RC[-46] -> 0 | BU199: =RC[-46] -> 0 | BV199: =RC[-46] -> 0 | BW199: =RC[-46] -> 0 | BX199: =RC[-46] -> 0 | BY199: =RC[-46] -> 0 | BZ199: =RC[-46] -> 0 | CA199: =RC[-46] -> 0 | CB199: =RC[-46] -> 242308 | CC199: =RC[-46] -> 5544928 | CD199: =RC[-46] -> 0 | CE199: =RC[-46] -> 0 | CF199: =RC[-46] -> 0 | CG199: =RC[-46] -> 0 | CH199: =RC[-46] -> 0 | CI199: =RC[-46] -> 0 | CJ199: =RC[-46] -> 0 | CK199: =RC[-46] -> 0 | CL199: =RC[-46] -> 1 | CM199: =RC[-46] -> 0 | CN199: =RC[-46] -> 0 | CO199: =RC[-46] -> 6402563.6399999997 | CP199: =RC[-46] -> 0 | CQ199: =RC[-46] -> 80769.333000000013 | CR199: =RC[-46] -> 242308 | CS199: =RC[-46] -> 161538.66699999999
A200: 35 | B200: 011115 | C200: Mai Thị Ngọc | D200: NV PVHK | E200: 19026970096019 | F200: =RC[29]+RC[30]+RC[31]+RC[32]+RC[33]+RC[34]+RC[35]+RC[36]+RC[37] -> 5253090 | G200: =RC[17]+RC[18]++RC[19]+RC[20]+RC[21]+RC[38]+RC[39]+RC[41] -> 0 | H200: 0 | I200: 0 | J200: =RC[-2]+RC[-1] -> 0 | K200: 0 | L200: 680000 | M200: 241500 | N200: =RC[15]+RC[16]+RC[17]+RC[18]+RC[19]+RC[20] -> 242308 | O200: 0 | P200: 0 | Q200: 6416898 | R200: 184000 | S200: 34500 | T200: 23000 | U200: 61753.98 | V200: 0 | W200: 6113644.0199999996 | X200: 0 | Y200: 0 | Z200: 0 | AA200: 0 | AB200: 0 | AC200: 0 | AD200: 0 | AE200: 0 | AF200: 0 | AG200: 0 | AH200: 242308 | AI200: 5253090 | AJ200: 0 | AK200: 0 | AL200: 0 | AM200: 0 | AN200: 0 | AO200: 0 | AP200: 0 | AQ200: 0 | AR200: =1 -> 1 | AS200: 0 | AT200: 0 | AU200: =RC[-30]-RC[-29]-RC[-28]-RC[-27]-RC[-26]-RC[-25] -> 6113644.0199999996 | AV200: 0 | AW200: =RC[1]-RC[2] -> 80769.333000000013 | AX200: 242308 | AY200: 161538.66699999999 | AZ200: =RC[-46] -> 5253090 | BA200: =RC[-46] -> 0 | BB200: =RC[-46] -> 0 | BC200: =RC[-46] -> 0 | BD200: =RC[-46] -> 0 | BE200: =RC[-46] -> 0 | BF200: =RC[-46] -> 680000 | BG200: =RC[-46] -> 241500 | BH200: =RC[-46] -> 242308 | BI200: =RC[-46] -> 0 | BJ200: =RC[-46] -> 0 | BK200: =RC[-46] -> 6416898 | BL200: =RC[-46] -> 184000 | BM200: =RC[-46] -> 34500 | BN200: =RC[-46] -> 23000 | BO200: =RC[-46] -> 61753.98 | BP200: =RC[-46] -> 0 | BQ200: =RC[-46] -> 6113644.0199999996 | BR200: =RC[-46] -> 0 | BS200: =RC[-46] -> 0 | BT200: =RC[-46] -> 0 | BU200: =RC[-46] -> 0 | BV200: =RC[-46] -> 0 | BW200: =RC[-46] -> 0 | BX200: =RC[-46] -> 0 | BY200: =RC[-46] -> 0 | BZ200: =RC[-46] -> 0 | CA200: =RC[-46] -> 0 | CB200: =RC[-46] -> 242308 | CC200: =RC[-46] -> 5253090 | CD200: =RC[-46] -> 0 | CE200: =RC[-46] -> 0 | CF200: =RC[-46] -> 0 | CG200: =RC[-46] -> 0 | CH200: =RC[-46] -> 0 | CI200: =RC[-46] -> 0 | CJ200: =RC[-46] -> 0 | CK200: =RC[-46] -> 0 | CL200: =RC[-46] -> 1 | CM200: =RC[-46] -> 0 | CN200: =RC[-46] -> 0 | CO200: =RC[-46] -> 6113644.0199999996 | CP200: =RC[-46] -> 0 | CQ200: =RC[-46] -> 80769.333000000013 | CR200: =RC[-46] -> 242308 | CS200: =RC[-46] -> 161538.66699999999
A201: 36 | B201: 011118 | C201: Lã Thị Thu Hương | D201: NV PVHK | E201: 19026970100016 | F201: =RC[29]+RC[30]+RC[31]+RC[32]+RC[33]+RC[34]+RC[35]+RC[36]+RC[37] -> 2772464 | G201: =RC[17]+RC[18]++RC[19]+RC[20]+RC[21]+RC[38]+RC[39]+RC[41] -> 0 | H201: 0 | I201: 0 | J201: =RC[-2]+RC[-1] -> 0 | K201: 0 | L201: 0 | M201: 0 | N201: =RC[15]+RC[16]+RC[17]+RC[18]+RC[19]+RC[20] -> 0 | O201: 0 | P201: 0 | Q201: 2772464 | R201: 0 | S201: 0 | T201: 0 | U201: 27724.639999999999 | V201: 0 | W201: 2744739.36 | X201: 0 | Y201: 0 | Z201: 0 | AA201: 0 | AB201: 0 | AC201: 0 | AD201: 0 | AE201: 0 | AF201: 0 | AG201: 0 | AH201: 0 | AI201: 0 | AJ201: 2772464 | AK201: 0 | AL201: 0 | AM201: 0 | AN201: 0 | AO201: 0 | AP201: 0 | AQ201: 0 | AR201: =1 -> 1 | AS201: 0 | AT201: 0 | AU201: =RC[-30]-RC[-29]-RC[-28]-RC[-27]-RC[-26]-RC[-25] -> 2744739.36 | AV201: 0 | AW201: =RC[1]-RC[2] -> 0 | AX201: 0 | AY201: 0 | AZ201: =RC[-46] -> 2772464 | BA201: =RC[-46] -> 0 | BB201: =RC[-46] -> 0 | BC201: =RC[-46] -> 0 | BD201: =RC[-46] -> 0 | BE201: =RC[-46] -> 0 | BF201: =RC[-46] -> 0 | BG201: =RC[-46] -> 0 | BH201: =RC[-46] -> 0 | BI201: =RC[-46] -> 0 | BJ201: =RC[-46] -> 0 | BK201: =RC[-46] -> 2772464 | BL201: =RC[-46] -> 0 | BM201: =RC[-46] -> 0 | BN201: =RC[-46] -> 0 | BO201: =RC[-46] -> 27724.639999999999 | BP201: =RC[-46] -> 0 | BQ201: =RC[-46] -> 2744739.36 | BR201: =RC[-46] -> 0 | BS201: =RC[-46] -> 0 | BT201: =RC[-46] -> 0 | BU201: =RC[-46] -> 0 | BV201: =RC[-46] -> 0 | BW201: =RC[-46] -> 0 | BX201: =RC[-46] -> 0 | BY201: =RC[-46] -> 0 | BZ201: =RC[-46] -> 0 | CA201: =RC[-46] -> 0 | CB201: =RC[-46] -> 0 | CC201: =RC[-46] -> 0 | CD201: =RC[-46] -> 2772464 | CE201: =RC[-46] -> 0 | CF201: =RC[-46] -> 0 | CG201: =RC[-46] -> 0 | CH201: =RC[-46] -> 0 | CI201: =RC[-46] -> 0 | CJ201: =RC[-46] -> 0 | CK201: =RC[-46] -> 0 | CL201: =RC[-46] -> 1 | CM201: =RC[-46] -> 0 | CN201: =RC[-46] -> 0 | CO201: =RC[-46] -> 2744739.36 | CP201: =RC[-46] -> 0 | CQ201: =RC[-46] -> 0 | CR201: =RC[-46] -> 0 | CS201: =RC[-46] -> 0
A202: 37 | B202: 011120 | C202: Đỗ Hương Trà | D202: NV PVHK | E202: 19026970102019 | F202: =RC[29]+RC[30]+RC[31]+RC[32]+RC[33]+RC[34]+RC[35]+RC[36]+RC[37] -> 5253090 | G202: =RC[17]+RC[18]++RC[19]+RC[20]+RC[21]+RC[38]+RC[39]+RC[41] -> 0 | H202: 0 | I202: 0 | J202: =RC[-2]+RC[-1] -> 0 | K202: 0 | L202: 680000 | M202: 241500 | N202: =RC[15]+RC[16]+RC[17]+RC[18]+RC[19]+RC[20] -> 242308 | O202: 0 | P202: 0 | Q202: 6416898 | R202: 184000 | S202: 34500 | T202: 23000 | U202: 61753.98 | V202: 0 | W202: 6113644.0199999996 | X202: 0 | Y202: 0 | Z202: 0 | AA202: 0 | AB202: 0 | AC202: 0 | AD202: 0 | AE202: 0 | AF202: 0 | AG202: 0 | AH202: 242308 | AI202: 5253090 | AJ202: 0 | AK202: 0 | AL202: 0 | AM202: 0 | AN202: 0 | AO202: 0 | AP202: 0 | AQ202: 0 | AR202: =1 -> 1 | AS202: 0 | AT202: 0 | AU202: =RC[-30]-RC[-29]-RC[-28]-RC[-27]-RC[-26]-RC[-25] -> 6113644.0199999996 | AV202: 0 | AW202: =RC[1]-RC[2] -> 80769.333000000013 | AX202: 242308 | AY202: 161538.66699999999 | AZ202: =RC[-46] -> 5253090 | BA202: =RC[-46] -> 0 | BB202: =RC[-46] -> 0 | BC202: =RC[-46] -> 0 | BD202: =RC[-46] -> 0 | BE202: =RC[-46] -> 0 | BF202: =RC[-46] -> 680000 | BG202: =RC[-46] -> 241500 | BH202: =RC[-46] -> 242308 | BI202: =RC[-46] -> 0 | BJ202: =RC[-46] -> 0 | BK202: =RC[-46] -> 6416898 | BL202: =RC[-46] -> 184000 | BM202: =RC[-46] -> 34500 | BN202: =RC[-46] -> 23000 | BO202: =RC[-46] -> 61753.98 | BP202: =RC[-46] -> 0 | BQ202: =RC[-46] -> 6113644.0199999996 | BR202: =RC[-46] -> 0 | BS202: =RC[-46] -> 0 | BT202: =RC[-46] -> 0 | BU202: =RC[-46] -> 0 | BV202: =RC[-46] -> 0 | BW202: =RC[-46] -> 0 | BX202: =RC[-46] -> 0 | BY202: =RC[-46] -> 0 | BZ202: =RC[-46] -> 0 | CA202: =RC[-46] -> 0 | CB202: =RC[-46] -> 242308 | CC202: =RC[-46] -> 5253090 | CD202: =RC[-46] -> 0 | CE202: =RC[-46] -> 0 | CF202: =RC[-46] -> 0 | CG202: =RC[-46] -> 0 | CH202: =RC[-46] -> 0 | CI202: =RC[-46] -> 0 | CJ202: =RC[-46] -> 0 | CK202: =RC[-46] -> 0 | CL202: =RC[-46] -> 1 | CM202: =RC[-46] -> 0 | CN202: =RC[-46] -> 0 | CO202: =RC[-46] -> 6113644.0199999996 | CP202: =RC[-46] -> 0 | CQ202: =RC[-46] -> 80769.333000000013 | CR202: =RC[-46] -> 242308 | CS202: =RC[-46] -> 161538.66699999999
A203: 38 | B203: 011121 | C203: Nguyễn Hiền Hạnh | D203: NV PVHK | E203: 13324573209019 | F203: =RC[29]+RC[30]+RC[31]+RC[32]+RC[33]+RC[34]+RC[35]+RC[36]+RC[37] -> 5544928 | G203: =RC[17]+RC[18]++RC[19]+RC[20]+RC[21]+RC[38]+RC[39]+RC[41] -> 0 | H203: 0 | I203: 0 | J203: =RC[-2]+RC[-1] -> 0 | K203: 0 | L203: 680000 | M203: 241500 | N203: =RC[15]+RC[16]+RC[17]+RC[18]+RC[19]+RC[20] -> 242308 | O203: 0 | P203: 0 | Q203: 6708736 | R203: 184000 | S203: 34500 | T203: 23000 | U203: 64672.36 | V203: 0 | W203: 6402563.6399999997 | X203: 0 | Y203: 0 | Z203: 0 | AA203: 0 | AB203: 0 | AC203: 0 | AD203: 0 | AE203: 0 | AF203: 0 | AG203: 0 | AH203: 242308 | AI203: 5544928 | AJ203: 0 | AK203: 0 | AL203: 0 | AM203: 0 | AN203: 0 | AO203: 0 | AP203: 0 | AQ203: 0 | AR203: =1 -> 1 | AS203: 0 | AT203: 0 | AU203: =RC[-30]-RC[-29]-RC[-28]-RC[-27]-RC[-26]-RC[-25] -> 6402563.6399999997 | AV203: 0 | AW203: =RC[1]-RC[2] -> 80769.333000000013 | AX203: 242308 | AY203: 161538.66699999999 | AZ203: =RC[-46] -> 5544928 | BA203: =RC[-46] -> 0 | BB203: =RC[-46] -> 0 | BC203: =RC[-46] -> 0 | BD203: =RC[-46] -> 0 | BE203: =RC[-46] -> 0 | BF203: =RC[-46] -> 680000 | BG203: =RC[-46] -> 241500 | BH203: =RC[-46] -> 242308 | BI203: =RC[-46] -> 0 | BJ203: =RC[-46] -> 0 | BK203: =RC[-46] -> 6708736 | BL203: =RC[-46] -> 184000 | BM203: =RC[-46] -> 34500 | BN203: =RC[-46] -> 23000 | BO203: =RC[-46] -> 64672.36 | BP203: =RC[-46] -> 0 | BQ203: =RC[-46] -> 6402563.6399999997 | BR203: =RC[-46] -> 0 | BS203: =RC[-46] -> 0 | BT203: =RC[-46] -> 0 | BU203: =RC[-46] -> 0 | BV203: =RC[-46] -> 0 | BW203: =RC[-46] -> 0 | BX203: =RC[-46] -> 0 | BY203: =RC[-46] -> 0 | BZ203: =RC[-46] -> 0 | CA203: =RC[-46] -> 0 | CB203: =RC[-46] -> 242308 | CC203: =RC[-46] -> 5544928 | CD203: =RC[-46] -> 0 | CE203: =RC[-46] -> 0 | CF203: =RC[-46] -> 0 | CG203: =RC[-46] -> 0 | CH203: =RC[-46] -> 0 | CI203: =RC[-46] -> 0 | CJ203: =RC[-46] -> 0 | CK203: =RC[-46] -> 0 | CL203: =RC[-46] -> 1 | CM203: =RC[-46] -> 0 | CN203: =RC[-46] -> 0 | CO203: =RC[-46] -> 6402563.6399999997 | CP203: =RC[-46] -> 0 | CQ203: =RC[-46] -> 80769.333000000013 | CR203: =RC[-46] -> 242308 | CS203: =RC[-46] -> 161538.66699999999
A204: 39 | B204: 011122 | C204: Nguyễn Thị Huyền | D204: NV PVHK | E204: 19026970103015 | F204: =RC[29]+RC[30]+RC[31]+RC[32]+RC[33]+RC[34]+RC[35]+RC[36]+RC[37] -> 5544928 | G204: =RC[17]+RC[18]++RC[19]+RC[20]+RC[21]+RC[38]+RC[39]+RC[41] -> 0 | H204: 0 | I204: 0 | J204: =RC[-2]+RC[-1] -> 0 | K204: 0 | L204: 680000 | M204: 241500 | N204: =RC[15]+RC[16]+RC[17]+RC[18]+RC[19]+RC[20] -> 0 | O204: 0 | P204: 0 | Q204: 6466428 | R204: 184000 | S204: 34500 | T204: 23000 | U204: 62249.279999999999 | V204: 0 | W204: 6162678.7199999997 | X204: 0 | Y204: 0 | Z204: 0 | AA204: 0 | AB204: 0 | AC204: 0 | AD204: 0 | AE204: 0 | AF204: 0 | AG204: 0 | AH204: 0 | AI204: 5544928 | AJ204: 0 | AK204: 0 | AL204: 0 | AM204: 0 | AN204: 0 | AO204: 0 | AP204: 0 | AQ204: 0 | AR204: =1 -> 1 | AS204: 0 | AT204: 0 | AU204: =RC[-30]-RC[-29]-RC[-28]-RC[-27]-RC[-26]-RC[-25] -> 6162678.7199999997 | AV204: 0 | AW204: =RC[1]-RC[2] -> 0 | AX204: 0 | AY204: 0 | AZ204: =RC[-46] -> 5544928 | BA204: =RC[-46] -> 0 | BB204: =RC[-46] -> 0 | BC204: =RC[-46] -> 0 | BD204: =RC[-46] -> 0 | BE204: =RC[-46] -> 0 | BF204: =RC[-46] -> 680000 | BG204: =RC[-46] -> 241500 | BH204: =RC[-46] -> 0 | BI204: =RC[-46] -> 0 | BJ204: =RC[-46] -> 0 | BK204: =RC[-46] -> 6466428 | BL204: =RC[-46] -> 184000 | BM204: =RC[-46] -> 34500 | BN204: =RC[-46] -> 23000 | BO204: =RC[-46] -> 62249.279999999999 | BP204: =RC[-46] -> 0 | BQ204: =RC[-46] -> 6162678.7199999997 | BR204: =RC[-46] -> 0 | BS204: =RC[-46] -> 0 | BT204: =RC[-46] -> 0 | BU204: =RC[-46] -> 0 | BV204: =RC[-46] -> 0 | BW204: =RC[-46] -> 0 | BX204: =RC[-46] -> 0 | BY204: =RC[-46] -> 0 | BZ204: =RC[-46] -> 0 | CA204: =RC[-46] -> 0 | CB204: =RC[-46] -> 0 | CC204: =RC[-46] -> 5544928 | CD204: =RC[-46] -> 0 | CE204: =RC[-46] -> 0 | CF204: =RC[-46] -> 0 | CG204: =RC[-46] -> 0 | CH204: =RC[-46] -> 0 | CI204: =RC[-46] -> 0 | CJ204: =RC[-46] -> 0 | CK204: =RC[-46] -> 0 | CL204: =RC[-46] -> 1 | CM204: =RC[-46] -> 0 | CN204: =RC[-46] -> 0 | CO204: =RC[-46] -> 6162678.7199999997 | CP204: =RC[-46] -> 0 | CQ204: =RC[-46] -> 0 | CR204: =RC[-46] -> 0 | CS204: =RC[-46] -> 0
A205: Đội Phục Vụ Hành Khách Đi Quốc Tế (HGS) | F205: =SUM(R[-39]C:R[-1]C) -> 190614193 | G205: =SUM(R[-39]C:R[-1]C) -> 2195308 | H205: =SUM(R[-39]C:R[-1]C) -> 0 | I205: =SUM(R[-39]C:R[-1]C) -> 0 | J205: =SUM(R[-39]C:R[-1]C) -> 0 | K205: =SUM(R[-39]C:R[-1]C) -> 210000 | L205: =SUM(R[-39]C:R[-1]C) -> 24166153 | M205: =SUM(R[-39]C:R[-1]C) -> 7900677 | N205: =SUM(R[-39]C:R[-1]C) -> 5804489 | O205: =SUM(R[-39]C:R[-1]C) -> 0 | P205: =SUM(R[-39]C:R[-1]C) -> 0 | Q205: =SUM(R[-39]C:R[-1]C) -> 230890820 | R205: =SUM(R[-39]C:R[-1]C) -> 6019560 | S205: =SUM(R[-39]C:R[-1]C) -> 1128672 | T205: =SUM(R[-39]C:R[-1]C) -> 752445 | U205: =SUM(R[-39]C:R[-1]C) -> 2229901.4299999992 | V205: =SUM(R[-39]C:R[-1]C) -> 0 | W205: =SUM(R[-39]C:R[-1]C) -> 220760241.56999999 | X205: =SUM(R[-39]C:R[-1]C) -> 0 | Y205: =SUM(R[-39]C:R[-1]C) -> 2195308 | Z205: =SUM(R[-39]C:R[-1]C) -> 0 | AA205: =SUM(R[-39]C:R[-1]C) -> 0 | AB205: =SUM(R[-39]C:R[-1]C) -> 0 | AC205: =SUM(R[-39]C:R[-1]C) -> 0 | AD205: =SUM(R[-39]C:R[-1]C) -> 0 | AE205: =SUM(R[-39]C:R[-1]C) -> 0 | AF205: =SUM(R[-39]C:R[-1]C) -> 0 | AG205: =SUM(R[-39]C:R[-1]C) -> 0 | AH205: =SUM(R[-39]C:R[-1]C) -> 5804489 | AI205: =SUM(R[-39]C:R[-1]C) -> 185069265 | AJ205: =SUM(R[-39]C:R[-1]C) -> 5544928 | AK205: =SUM(R[-39]C:R[-1]C) -> 0 | AL205: =SUM(R[-39]C:R[-1]C) -> 0 | AM205: =SUM(R[-39]C:R[-1]C) -> 0 | AN205: =SUM(R[-39]C:R[-1]C) -> 0 | AO205: =SUM(R[-39]C:R[-1]C) -> 0 | AP205: =SUM(R[-39]C:R[-1]C) -> 0 | AQ205: =SUM(R[-39]C:R[-1]C) -> 0 | AR205: =SUM(R[-39]C:R[-1]C) -> 39 | AS205: =SUM(R[-39]C:R[-1]C) -> 0 | AT205: =SUM(R[-39]C:R[-1]C) -> 0 | AU205: =SUM(R[-39]C:R[-1]C) -> 220760241.56999999 | AV205: =SUM(R[-39]C:R[-1]C) -> 0 | AW205: =SUM(R[-39]C:R[-1]C) -> 1934829.6630000006 | AX205: =SUM(R[-39]C:R[-1]C) -> 5804489 | AY205: =SUM(R[-39]C:R[-1]C) -> 3869659.3369999989
A206: Phòng Phục vụ hành khách (HGS) | F206: =SUM(R[-122]C[46]:R[-1]C[46]) -> 538733524 | G206: =SUM(R[-122]C[46]:R[-1]C[46]) -> 3705693 | H206: =SUM(R[-122]C[46]:R[-1]C[46]) -> 0 | I206: =SUM(R[-122]C[46]:R[-1]C[46]) -> 735000 | J206: =SUM(R[-122]C[46]:R[-1]C[46]) -> 735000 | K206: =SUM(R[-122]C[46]:R[-1]C[46]) -> 1260000 | L206: =SUM(R[-122]C[46]:R[-1]C[46]) -> 65332306 | M206: =SUM(R[-122]C[46]:R[-1]C[46]) -> 21428304 | N206: =SUM(R[-122]C[46]:R[-1]C[46]) -> 16907041 | O206: =SUM(R[-122]C[46]:R[-1]C[46]) -> 0 | P206: =SUM(R[-122]C[46]:R[-1]C[46]) -> 0 | Q206: =SUM(R[-122]C[46]:R[-1]C[46]) -> 648101868 | R206: =SUM(R[-122]C[46]:R[-1]C[46]) -> 16510320 | S206: =SUM(R[-122]C[46]:R[-1]C[46]) -> 3095694 | T206: =SUM(R[-122]C[46]:R[-1]C[46]) -> 2063790 | U206: =SUM(R[-122]C[46]:R[-1]C[46]) -> 6142494.4999999991 | V206: =SUM(R[-122]C[46]:R[-1]C[46]) -> 90893 | W206: =SUM(R[-122]C[46]:R[-1]C[46]) -> 620198676.5000006 | X206: =SUM(R[-122]C[46]:R[-1]C[46]) -> 0 | Y206: =SUM(R[-122]C[46]:R[-1]C[46]) -> 3705693 | Z206: =SUM(R[-122]C[46]:R[-1]C[46]) -> 0 | AA206: =SUM(R[-122]C[46]:R[-1]C[46]) -> 0 | AB206: =SUM(R[-122]C[46]:R[-1]C[46]) -> 0 | AC206: =SUM(R[-122]C[46]:R[-1]C[46]) -> 0 | AD206: =SUM(R[-122]C[46]:R[-1]C[46]) -> 0 | AE206: =SUM(R[-122]C[46]:R[-1]C[46]) -> 0 | AF206: =SUM(R[-122]C[46]:R[-1]C[46]) -> 0 | AG206: =SUM(R[-122]C[46]:R[-1]C[46]) -> 0 | AH206: =SUM(R[-122]C[46]:R[-1]C[46]) -> 16907041 | AI206: =SUM(R[-122]C[46]:R[-1]C[46]) -> 513845554 | AJ206: =SUM(R[-122]C[46]:R[-1]C[46]) -> 24887970 | AK206: =SUM(R[-122]C[46]:R[-1]C[46]) -> 0 | AL206: =SUM(R[-122]C[46]:R[-1]C[46]) -> 0 | AM206: =SUM(R[-122]C[46]:R[-1]C[46]) -> 0 | AN206: =SUM(R[-122]C[46]:R[-1]C[46]) -> 0 | AO206: =SUM(R[-122]C[46]:R[-1]C[46]) -> 0 | AP206: =SUM(R[-122]C[46]:R[-1]C[46]) -> 0 | AQ206: =SUM(R[-122]C[46]:R[-1]C[46]) -> 0 | AR206: =SUM(R[-122]C[46]:R[-1]C[46]) -> 110 | AS206: =SUM(R[-122]C[46]:R[-1]C[46]) -> 0 | AT206: =SUM(R[-122]C[46]:R[-1]C[46]) -> 0 | AU206: =SUM(R[-122]C[46]:R[-1]C[46]) -> 620198676.5000006 | AV206: =SUM(R[-122]C[46]:R[-1]C[46]) -> 0 | AW206: =SUM(R[-122]C[46]:R[-1]C[46]) -> 5635680.3219999997 | AX206: =SUM(R[-122]C[46]:R[-1]C[46]) -> 16907041 | AY206: =SUM(R[-122]C[46]:R[-1]C[46]) -> 11271360.677999999
A207: Phòng Phục vụ kỹ thuật sân đỗ (HGS) | F207: =R[204]C -> 947855815 | G207: =R[204]C -> 4757307 | H207: =R[204]C -> 0 | I207: =R[204]C -> 1050000 | J207: =R[204]C -> 1050000 | K207: =R[204]C -> 3675000 | L207: =R[204]C -> 124387693 | M207: =R[204]C -> 50217561 | N207: =R[204]C -> 34482817 | O207: =R[204]C -> 0 | P207: =R[204]C -> 0 | Q207: =R[204]C -> 1166426193 | R207: =R[204]C -> 38260960 | S207: =R[204]C -> 7173981 | T207: =R[204]C -> 4782620 | U207: =R[204]C -> 11024175.349999983 | V207: =R[204]C -> 2903 | W207: =R[204]C -> 1105181553.6500001 | X207: =R[204]C -> 0 | Y207: =R[204]C -> 4757307 | Z207: =R[204]C -> 0 | AA207: =R[204]C -> 0 | AB207: =R[204]C -> 0 | AC207: =R[204]C -> 0 | AD207: =R[204]C -> 0 | AE207: =R[204]C -> 0 | AF207: =R[204]C -> 0 | AG207: =R[204]C -> 0 | AH207: =R[204]C -> 34482817 | AI207: =R[204]C -> 941026798 | AJ207: =R[204]C -> 6829017 | AK207: =R[204]C -> 0 | AL207: =R[204]C -> 0 | AM207: =R[204]C -> 0 | AN207: =R[204]C -> 0 | AO207: =R[204]C -> 0 | AP207: =R[204]C -> 0 | AQ207: =R[204]C -> 0 | AR207: =R[204]C -> 189 | AS207: =R[204]C -> 0 | AT207: =R[204]C -> 0 | AU207: =R[204]C -> 1105181553.6500001 | AW207: =R[204]C -> 11494272.332000002 | AX207: =R[204]C -> 34482817 | AY207: =R[204]C -> 22988544.66799999
F208: =R[2]C -> 5544928 | G208: =R[2]C -> 0 | H208: =R[2]C -> 0 | I208: =R[2]C -> 0 | J208: =R[2]C -> 0 | K208: =R[2]C -> 0 | L208: =R[2]C -> 680000 | M208: =R[2]C -> 217350 | N208: =R[2]C -> 0 | O208: =R[2]C -> 0 | P208: =R[2]C -> 0 | Q208: =R[2]C -> 6442278 | R208: =R[2]C -> 165600 | S208: =R[2]C -> 31050 | T208: =R[2]C -> 20700 | U208: =R[2]C -> 62249.279999999999 | V208: =R[2]C -> 0 | W208: =R[2]C -> 6162678.7199999997 | X208: =R[2]C -> 0 | Y208: =R[2]C -> 0 | Z208: =R[2]C -> 0 | AA208: =R[2]C -> 0 | AB208: =R[2]C -> 0 | AC208: =R[2]C -> 0 | AD208: =R[2]C -> 0 | AE208: =R[2]C -> 0 | AF208: =R[2]C -> 0 | AG208: =R[2]C -> 0 | AH208: =R[2]C -> 0 | AI208: =R[2]C -> 5544928 | AJ208: =R[2]C -> 0 | AK208: =R[2]C -> 0 | AL208: =R[2]C -> 0 | AM208: =R[2]C -> 0 | AN208: =R[2]C -> 0 | AO208: =R[2]C -> 0 | AP208: =R[2]C -> 0 | AQ208: =R[2]C -> 0 | AR208: =R[2]C -> 1 | AS208: =R[2]C -> 0 | AT208: =R[2]C -> 0 | AU208: =R[2]C -> 6162678.7199999997 | AW208: =R[2]C -> 0 | AX208: =R[2]C -> 0 | AY208: =R[2]C -> 0
A209: 1 | B209: 010765 | C209: Nguyễn Thị Thuý | D209: Nv Thống kê | E209: 10524470160011 | F209: =RC[29]+RC[30]+RC[31]+RC[32]+RC[33]+RC[34]+RC[35]+RC[36]+RC[37] -> 5544928 | G209: =RC[17]+RC[18]++RC[19]+RC[20]+RC[21]+RC[38]+RC[39]+RC[41] -> 0 | H209: 0 | I209: 0 | J209: =RC[-2]+RC[-1] -> 0 | K209: 0 | L209: 680000 | M209: 217350 | N209: =RC[15]+RC[16]+RC[17]+RC[18]+RC[19]+RC[20] -> 0 | O209: 0 | P209: 0 | Q209: 6442278 | R209: 165600 | S209: 31050 | T209: 20700 | U209: 62249.279999999999 | V209: 0 | W209: 6162678.7199999997 | X209: 0 | Y209: 0 | Z209: 0 | AA209: 0 | AB209: 0 | AC209: 0 | AD209: 0 | AE209: 0 | AF209: 0 | AG209: 0 | AH209: 0 | AI209: 5544928 | AJ209: 0 | AK209: 0 | AL209: 0 | AM209: 0 | AN209: 0 | AO209: 0 | AP209: 0 | AQ209: 0 | AR209: =1 -> 1 | AS209: 0 | AT209: 0 | AU209: =RC[-30]-RC[-29]-RC[-28]-RC[-27]-RC[-26]-RC[-25] -> 6162678.7199999997 | AV209: 0 | AW209: =RC[1]-RC[2] -> 0 | AX209: 0 | AY209: 0 | AZ209: =RC[-46] -> 5544928 | BA209: =RC[-46] -> 0 | BB209: =RC[-46] -> 0 | BC209: =RC[-46] -> 0 | BD209: =RC[-46] -> 0 | BE209: =RC[-46] -> 0 | BF209: =RC[-46] -> 680000 | BG209: =RC[-46] -> 217350 | BH209: =RC[-46] -> 0 | BI209: =RC[-46] -> 0 | BJ209: =RC[-46] -> 0 | BK209: =RC[-46] -> 6442278 | BL209: =RC[-46] -> 165600 | BM209: =RC[-46] -> 31050 | BN209: =RC[-46] -> 20700 | BO209: =RC[-46] -> 62249.279999999999 | BP209: =RC[-46] -> 0 | BQ209: =RC[-46] -> 6162678.7199999997 | BR209: =RC[-46] -> 0 | BS209: =RC[-46] -> 0 | BT209: =RC[-46] -> 0 | BU209: =RC[-46] -> 0 | BV209: =RC[-46] -> 0 | BW209: =RC[-46] -> 0 | BX209: =RC[-46] -> 0 | BY209: =RC[-46] -> 0 | BZ209: =RC[-46] -> 0 | CA209: =RC[-46] -> 0 | CB209: =RC[-46] -> 0 | CC209: =RC[-46] -> 5544928 | CD209: =RC[-46] -> 0 | CE209: =RC[-46] -> 0 | CF209: =RC[-46] -> 0 | CG209: =RC[-46] -> 0 | CH209: =RC[-46] -> 0 | CI209: =RC[-46] -> 0 | CJ209: =RC[-46] -> 0 | CK209: =RC[-46] -> 0 | CL209: =RC[-46] -> 1 | CM209: =RC[-46] -> 0 | CN209: =RC[-46] -> 0 | CO209: =RC[-46] -> 6162678.7199999997 | CP209: =RC[-46] -> 0 | CQ209: =RC[-46] -> 0 | CR209: =RC[-46] -> 0 | CS209: =RC[-46] -> 0
F210: =SUM(R[-1]C:R[-1]C) -> 5544928 | G210: =SUM(R[-1]C:R[-1]C) -> 0 | H210: =SUM(R[-1]C:R[-1]C) -> 0 | I210: =SUM(R[-1]C:R[-1]C) -> 0 | J210: =SUM(R[-1]C:R[-1]C) -> 0 | K210: =SUM(R[-1]C:R[-1]C) -> 0 | L210: =SUM(R[-1]C:R[-1]C) -> 680000 | M210: =SUM(R[-1]C:R[-1]C) -> 217350 | N210: =SUM(R[-1]C:R[-1]C) -> 0 | O210: =SUM(R[-1]C:R[-1]C) -> 0 | P210: =SUM(R[-1]C:R[-1]C) -> 0 | Q210: =SUM(R[-1]C:R[-1]C) -> 6442278 | R210: =SUM(R[-1]C:R[-1]C) -> 165600 | S210: =SUM(R[-1]C:R[-1]C) -> 31050 | T210: =SUM(R[-1]C:R[-1]C) -> 20700 | U210: =SUM(R[-1]C:R[-1]C) -> 62249.279999999999 | V210: =SUM(R[-1]C:R[-1]C) -> 0 | W210: =SUM(R[-1]C:R[-1]C) -> 6162678.7199999997 | X210: =SUM(R[-1]C:R[-1]C) -> 0 | Y210: =SUM(R[-1]C:R[-1]C) -> 0 | Z210: =SUM(R[-1]C:R[-1]C) -> 0 | AA210: =SUM(R[-1]C:R[-1]C) -> 0 | AB210: =SUM(R[-1]C:R[-1]C) -> 0 | AC210: =SUM(R[-1]C:R[-1]C) -> 0 | AD210: =SUM(R[-1]C:R[-1]C) -> 0 | AE210: =SUM(R[-1]C:R[-1]C) -> 0 | AF210: =SUM(R[-1]C:R[-1]C) -> 0 | AG210: =SUM(R[-1]C:R[-1]C) -> 0 | AH210: =SUM(R[-1]C:R[-1]C) -> 0 | AI210: =SUM(R[-1]C:R[-1]C) -> 5544928 | AJ210: =SUM(R[-1]C:R[-1]C) -> 0 | AK210: =SUM(R[-1]C:R[-1]C) -> 0 | AL210: =SUM(R[-1]C:R[-1]C) -> 0 | AM210: =SUM(R[-1]C:R[-1]C) -> 0 | AN210: =SUM(R[-1]C:R[-1]C) -> 0 | AO210: =SUM(R[-1]C:R[-1]C) -> 0 | AP210: =SUM(R[-1]C:R[-1]C) -> 0 | AQ210: =SUM(R[-1]C:R[-1]C) -> 0 | AR210: =SUM(R[-1]C:R[-1]C) -> 1 | AS210: =SUM(R[-1]C:R[-1]C) -> 0 | AT210: =SUM(R[-1]C:R[-1]C) -> 0 | AU210: =SUM(R[-1]C:R[-1]C) -> 6162678.7199999997 | AV210: =SUM(R[-1]C:R[-1]C) -> 0 | AW210: =SUM(R[-1]C:R[-1]C) -> 0 | AX210: =SUM(R[-1]C:R[-1]C) -> 0 | AY210: =SUM(R[-1]C:R[-1]C) -> 0
A211: Bộ phận nghiệp vụ PKTSĐ (HGS) | F211: =R[2]C -> 5574112 | G211: =R[2]C -> 0 | H211: =R[2]C -> 0 | I211: =R[2]C -> 0 | J211: =R[2]C -> 0 | K211: =R[2]C -> 0 | L211: =R[2]C -> 680000 | M211: =R[2]C -> 241500 | N211: =R[2]C -> 0 | O211: =R[2]C -> 0 | P211: =R[2]C -> 0 | Q211: =R[2]C -> 6495612 | R211: =R[2]C -> 184000 | S211: =R[2]C -> 34500 | T211: =R[2]C -> 23000 | U211: =R[2]C -> 62541.120000000003 | V211: =R[2]C -> 0 | W211: =R[2]C -> 6191570.8799999999 | X211: =R[2]C -> 0 | Y211: =R[2]C -> 0 | Z211: =R[2]C -> 0 | AA211: =R[2]C -> 0 | AB211: =R[2]C -> 0 | AC211: =R[2]C -> 0 | AD211: =R[2]C -> 0 | AE211: =R[2]C -> 0 | AF211: =R[2]C -> 0 | AG211: =R[2]C -> 0 | AH211: =R[2]C -> 0 | AI211: =R[2]C -> 5574112 | AJ211: =R[2]C -> 0 | AK211: =R[2]C -> 0 | AL211: =R[2]C -> 0 | AM211: =R[2]C -> 0 | AN211: =R[2]C -> 0 | AO211: =R[2]C -> 0 | AP211: =R[2]C -> 0 | AQ211: =R[2]C -> 0 | AR211: =R[2]C -> 1 | AS211: =R[2]C -> 0 | AT211: =R[2]C -> 0 | AU211: =R[2]C -> 6191570.8799999999 | AW211: =R[2]C -> 0 | AX211: =R[2]C -> 0 | AY211: =R[2]C -> 0
A212: 1 | B212: 010599 | C212: Đào Thu Giang | D212: NV PVHK | E212: 10525213781018 | F212: =RC[29]+RC[30]+RC[31]+RC[32]+RC[33]+RC[34]+RC[35]+RC[36]+RC[37] -> 5574112 | G212: =RC[17]+RC[18]++RC[19]+RC[20]+RC[21]+RC[38]+RC[39]+RC[41] -> 0 | H212: 0 | I212: 0 | J212: =RC[-2]+RC[-1] -> 0 | K212: 0 | L212: 680000 | M212: 241500 | N212: =RC[15]+RC[16]+RC[17]+RC[18]+RC[19]+RC[20] -> 0 | O212: 0 | P212: 0 | Q212: 6495612 | R212: 184000 | S212: 34500 | T212: 23000 | U212: 62541.120000000003 | V212: 0 | W212: 6191570.8799999999 | X212: 0 | Y212: 0 | Z212: 0 | AA212: 0 | AB212: 0 | AC212: 0 | AD212: 0 | AE212: 0 | AF212: 0 | AG212: 0 | AH212: 0 | AI212: 5574112 | AJ212: 0 | AK212: 0 | AL212: 0 | AM212: 0 | AN212: 0 | AO212: 0 | AP212: 0 | AQ212: 0 | AR212: =1 -> 1 | AS212: 0 | AT212: 0 | AU212: =RC[-30]-RC[-29]-RC[-28]-RC[-27]-RC[-26]-RC[-25] -> 6191570.8799999999 | AV212: 0 | AW212: =RC[1]-RC[2] -> 0 | AX212: 0 | AY212: 0 | AZ212: =RC[-46] -> 5574112 | BA212: =RC[-46] -> 0 | BB212: =RC[-46] -> 0 | BC212: =RC[-46] -> 0 | BD212: =RC[-46] -> 0 | BE212: =RC[-46] -> 0 | BF212: =RC[-46] -> 680000 | BG212: =RC[-46] -> 241500 | BH212: =RC[-46] -> 0 | BI212: =RC[-46] -> 0 | BJ212: =RC[-46] -> 0 | BK212: =RC[-46] -> 6495612 | BL212: =RC[-46] -> 184000 | BM212: =RC[-46] -> 34500 | BN212: =RC[-46] -> 23000 | BO212: =RC[-46] -> 62541.120000000003 | BP212: =RC[-46] -> 0 | BQ212: =RC[-46] -> 6191570.8799999999 | BR212: =RC[-46] -> 0 | BS212: =RC[-46] -> 0 | BT212: =RC[-46] -> 0 | BU212: =RC[-46] -> 0 | BV212: =RC[-46] -> 0 | BW212: =RC[-46] -> 0 | BX212: =RC[-46] -> 0 | BY212: =RC[-46] -> 0 | BZ212: =RC[-46] -> 0 | CA212: =RC[-46] -> 0 | CB212: =RC[-46] -> 0 | CC212: =RC[-46] -> 5574112 | CD212: =RC[-46] -> 0 | CE212: =RC[-46] -> 0 | CF212: =RC[-46] -> 0 | CG212: =RC[-46] -> 0 | CH212: =RC[-46] -> 0 | CI212: =RC[-46] -> 0 | CJ212: =RC[-46] -> 0 | CK212: =RC[-46] -> 0 | CL212: =RC[-46] -> 1 | CM212: =RC[-46] -> 0 | CN212: =RC[-46] -> 0 | CO212: =RC[-46] -> 6191570.8799999999 | CP212: =RC[-46] -> 0 | CQ212: =RC[-46] -> 0 | CR212: =RC[-46] -> 0 | CS212: =RC[-46] -> 0
A213: Bộ phận nghiệp vụ PKTSĐ (HGS) | F213: =SUM(R[-1]C:R[-1]C) -> 5574112 | G213: =SUM(R[-1]C:R[-1]C) -> 0 | H213: =SUM(R[-1]C:R[-1]C) -> 0 | I213: =SUM(R[-1]C:R[-1]C) -> 0 | J213: =SUM(R[-1]C:R[-1]C) -> 0 | K213: =SUM(R[-1]C:R[-1]C) -> 0 | L213: =SUM(R[-1]C:R[-1]C) -> 680000 | M213: =SUM(R[-1]C:R[-1]C) -> 241500 | N213: =SUM(R[-1]C:R[-1]C) -> 0 | O213: =SUM(R[-1]C:R[-1]C) -> 0 | P213: =SUM(R[-1]C:R[-1]C) -> 0 | Q213: =SUM(R[-1]C:R[-1]C) -> 6495612 | R213: =SUM(R[-1]C:R[-1]C) -> 184000 | S213: =SUM(R[-1]C:R[-1]C) -> 34500 | T213: =SUM(R[-1]C:R[-1]C) -> 23000 | U213: =SUM(R[-1]C:R[-1]C) -> 62541.120000000003 | V213: =SUM(R[-1]C:R[-1]C) -> 0 | W213: =SUM(R[-1]C:R[-1]C) -> 6191570.8799999999 | X213: =SUM(R[-1]C:R[-1]C) -> 0 | Y213: =SUM(R[-1]C:R[-1]C) -> 0 | Z213: =SUM(R[-1]C:R[-1]C) -> 0 | AA213: =SUM(R[-1]C:R[-1]C) -> 0 | AB213: =SUM(R[-1]C:R[-1]C) -> 0 | AC213: =SUM(R[-1]C:R[-1]C) -> 0 | AD213: =SUM(R[-1]C:R[-1]C) -> 0 | AE213: =SUM(R[-1]C:R[-1]C) -> 0 | AF213: =SUM(R[-1]C:R[-1]C) -> 0 | AG213: =SUM(R[-1]C:R[-1]C) -> 0 | AH213: =SUM(R[-1]C:R[-1]C) -> 0 | AI213: =SUM(R[-1]C:R[-1]C) -> 5574112 | AJ213: =SUM(R[-1]C:R[-1]C) -> 0 | AK213: =SUM(R[-1]C:R[-1]C) -> 0 | AL213: =SUM(R[-1]C:R[-1]C) -> 0 | AM213: =SUM(R[-1]C:R[-1]C) -> 0 | AN213: =SUM(R[-1]C:R[-1]C) -> 0 | AO213: =SUM(R[-1]C:R[-1]C) -> 0 | AP213: =SUM(R[-1]C:R[-1]C) -> 0 | AQ213: =SUM(R[-1]C:R[-1]C) -> 0 | AR213: =SUM(R[-1]C:R[-1]C) -> 1 | AS213: =SUM(R[-1]C:R[-1]C) -> 0 | AT213: =SUM(R[-1]C:R[-1]C) -> 0 | AU213: =SUM(R[-1]C:R[-1]C) -> 6191570.8799999999 | AV213: =SUM(R[-1]C:R[-1]C) -> 0 | AW213: =SUM(R[-1]C:R[-1]C) -> 0 | AX213: =SUM(R[-1]C:R[-1]C) -> 0 | AY213: =SUM(R[-1]C:R[-1]C) -> 0
A214: Cán bộ Phòng Phục vụ Kỹ thuật sân đỗ (HGS) | F214: =R[4]C -> 44616241 | G214: =R[4]C -> 0 | H214: =R[4]C -> 0 | I214: =R[4]C -> 1050000 | J214: =R[4]C -> 1050000 | K214: =R[4]C -> 0 | L214: =R[4]C -> 2040000 | M214: =R[4]C -> 1205085 | N214: =R[4]C -> 0 | O214: =R[4]C -> 0 | P214: =R[4]C -> 0 | Q214: =R[4]C -> 48911326 | R214: =R[4]C -> 918160 | S214: =R[4]C -> 172155 | T214: =R[4]C -> 114770 | U214: =R[4]C -> 345000 | V214: =R[4]C -> 2903 | W214: =R[4]C -> 47358338 | X214: =R[4]C -> 0 | Y214: =R[4]C -> 0 | Z214: =R[4]C -> 0 | AA214: =R[4]C -> 0 | AB214: =R[4]C -> 0 | AC214: =R[4]C -> 0 | AD214: =R[4]C -> 0 | AE214: =R[4]C -> 0 | AF214: =R[4]C -> 0 | AG214: =R[4]C -> 0 | AH214: =R[4]C -> 0 | AI214: =R[4]C -> 44616241 | AJ214: =R[4]C -> 0 | AK214: =R[4]C -> 0 | AL214: =R[4]C -> 0 | AM214: =R[4]C -> 0 | AN214: =R[4]C -> 0 | AO214: =R[4]C -> 0 | AP214: =R[4]C -> 0 | AQ214: =R[4]C -> 0 | AR214: =R[4]C -> 3 | AS214: =R[4]C -> 0 | AT214: =R[4]C -> 0 | AU214: =R[4]C -> 47358338 | AW214: =R[4]C -> 0 | AX214: =R[4]C -> 0 | AY214: =R[4]C -> 0
A215: 1 | B215: 010787 | C215: Lê Đình Tuấn | D215: Trưởng phòng | E215: 10520089208019 | F215: =RC[29]+RC[30]+RC[31]+RC[32]+RC[33]+RC[34]+RC[35]+RC[36]+RC[37] -> 15838065 | G215: =RC[17]+RC[18]++RC[19]+RC[20]+RC[21]+RC[38]+RC[39]+RC[41] -> 0 | H215: 0 | I215: 420000 | J215: =RC[-2]+RC[-1] -> 420000 | K215: 0 | L215: 680000 | M215: 357420 | N215: =RC[15]+RC[16]+RC[17]+RC[18]+RC[19]+RC[20] -> 0 | O215: 0 | P215: 0 | Q215: 17295485 | R215: 272320 | S215: 51060 | T215: 34040 | U215: 115000 | V215: 2903 | W215: 16820162 | X215: 0 | Y215: 0 | Z215: 0 | AA215: 0 | AB215: 0 | AC215: 0 | AD215: 0 | AE215: 0 | AF215: 0 | AG215: 0 | AH215: 0 | AI215: 15838065 | AJ215: 0 | AK215: 0 | AL215: 0 | AM215: 0 | AN215: 0 | AO215: 0 | AP215: 0 | AQ215: 0 | AR215: =1 -> 1 | AS215: 0 | AT215: 0 | AU215: =RC[-30]-RC[-29]-RC[-28]-RC[-27]-RC[-26]-RC[-25] -> 16820162 | AV215: 0 | AW215: =RC[1]-RC[2] -> 0 | AX215: 0 | AY215: 0 | AZ215: =RC[-46] -> 15838065 | BA215: =RC[-46] -> 0 | BB215: =RC[-46] -> 0 | BC215: =RC[-46] -> 420000 | BD215: =RC[-46] -> 420000 | BE215: =RC[-46] -> 0 | BF215: =RC[-46] -> 680000 | BG215: =RC[-46] -> 357420 | BH215: =RC[-46] -> 0 | BI215: =RC[-46] -> 0 | BJ215: =RC[-46] -> 0 | BK215: =RC[-46] -> 17295485 | BL215: =RC[-46] -> 272320 | BM215: =RC[-46] -> 51060 | BN215: =RC[-46] -> 34040 | BO215: =RC[-46] -> 115000 | BP215: =RC[-46] -> 2903 | BQ215: =RC[-46] -> 16820162 | BR215: =RC[-46] -> 0 | BS215: =RC[-46] -> 0 | BT215: =RC[-46] -> 0 | BU215: =RC[-46] -> 0 | BV215: =RC[-46] -> 0 | BW215: =RC[-46] -> 0 | BX215: =RC[-46] -> 0 | BY215: =RC[-46] -> 0 | BZ215: =RC[-46] -> 0 | CA215: =RC[-46] -> 0 | CB215: =RC[-46] -> 0 | CC215: =RC[-46] -> 15838065 | CD215: =RC[-46] -> 0 | CE215: =RC[-46] -> 0 | CF215: =RC[-46] -> 0 | CG215: =RC[-46] -> 0 | CH215: =RC[-46] -> 0 | CI215: =RC[-46] -> 0 | CJ215: =RC[-46] -> 0 | CK215: =RC[-46] -> 0 | CL215: =RC[-46] -> 1 | CM215: =RC[-46] -> 0 | CN215: =RC[-46] -> 0 | CO215: =RC[-46] -> 16820162 | CP215: =RC[-46] -> 0 | CQ215: =RC[-46] -> 0 | CR215: =RC[-46] -> 0 | CS215: =RC[-46] -> 0
A216: 2 | B216: 010785 | C216: Nguyễn Duy Thái | D216: Phó Trưởng Phòng | E216: 10522162696011 | F216: =RC[29]+RC[30]+RC[31]+RC[32]+RC[33]+RC[34]+RC[35]+RC[36]+RC[37] -> 15146408 | G216: =RC[17]+RC[18]++RC[19]+RC[20]+RC[21]+RC[38]+RC[39]+RC[41] -> 0 | H216: 0 | I216: 315000 | J216: =RC[-2]+RC[-1] -> 315000 | K216: 0 | L216: 680000 | M216: 357420 | N216: =RC[15]+RC[16]+RC[17]+RC[18]+RC[19]+RC[20] -> 0 | O216: 0 | P216: 0 | Q216: 16498828 | R216: 272320 | S216: 51060 | T216: 34040 | U216: 115000 | V216: 0 | W216: 16026408 | X216: 0 | Y216: 0 | Z216: 0 | AA216: 0 | AB216: 0 | AC216: 0 | AD216: 0 | AE216: 0 | AF216: 0 | AG216: 0 | AH216: 0 | AI216: 15146408 | AJ216: 0 | AK216: 0 | AL216: 0 | AM216: 0 | AN216: 0 | AO216: 0 | AP216: 0 | AQ216: 0 | AR216: =1 -> 1 | AS216: 0 | AT216: 0 | AU216: =RC[-30]-RC[-29]-RC[-28]-RC[-27]-RC[-26]-RC[-25] -> 16026408 | AV216: 0 | AW216: =RC[1]-RC[2] -> 0 | AX216: 0 | AY216: 0 | AZ216: =RC[-46] -> 15146408 | BA216: =RC[-46] -> 0 | BB216: =RC[-46] -> 0 | BC216: =RC[-46] -> 315000 | BD216: =RC[-46] -> 315000 | BE216: =RC[-46] -> 0 | BF216: =RC[-46] -> 680000 | BG216: =RC[-46] -> 357420 | BH216: =RC[-46] -> 0 | BI216: =RC[-46] -> 0 | BJ216: =RC[-46] -> 0 | BK216: =RC[-46] -> 16498828 | BL216: =RC[-46] -> 272320 | BM216: =RC[-46] -> 51060 | BN216: =RC[-46] -> 34040 | BO216: =RC[-46] -> 115000 | BP216: =RC[-46] -> 0 | BQ216: =RC[-46] -> 16026408 | BR216: =RC[-46] -> 0 | BS216: =RC[-46] -> 0 | BT216: =RC[-46] -> 0 | BU216: =RC[-46] -> 0 | BV216: =RC[-46] -> 0 | BW216: =RC[-46] -> 0 | BX216: =RC[-46] -> 0 | BY216: =RC[-46] -> 0 | BZ216: =RC[-46] -> 0 | CA216: =RC[-46] -> 0 | CB216: =RC[-46] -> 0 | CC216: =RC[-46] -> 15146408 | CD216: =RC[-46] -> 0 | CE216: =RC[-46] -> 0 | CF216: =RC[-46] -> 0 | CG216: =RC[-46] -> 0 | CH216: =RC[-46] -> 0 | CI216: =RC[-46] -> 0 | CJ216: =RC[-46] -> 0 | CK216: =RC[-46] -> 0 | CL216: =RC[-46] -> 1 | CM216: =RC[-46] -> 0 | CN216: =RC[-46] -> 0 | CO216: =RC[-46] -> 16026408 | CP216: =RC[-46] -> 0 | CQ216: =RC[-46] -> 0 | CR216: =RC[-46] -> 0 | CS216: =RC[-46] -> 0
A217: 3 | B217: 010786 | C217: Nguyễn Hà Thanh | D217: Phó Trưởng Phòng | E217: 10522162943019 | F217: =RC[29]+RC[30]+RC[31]+RC[32]+RC[33]+RC[34]+RC[35]+RC[36]+RC[37] -> 13631768 | G217: =RC[17]+RC[18]++RC[19]+RC[20]+RC[21]+RC[38]+RC[39]+RC[41] -> 0 | H217: 0 | I217: 315000 | J217: =RC[-2]+RC[-1] -> 315000 | K217: 0 | L217: 680000 | M217: 490245 | N217: =RC[15]+RC[16]+RC[17]+RC[18]+RC[19]+RC[20] -> 0 | O217: 0 | P217: 0 | Q217: 15117013 | R217: 373520 | S217: 70035 | T217: 46690 | U217: 115000 | V217: 0 | W217: 14511768 | X217: 0 | Y217: 0 | Z217: 0 | AA217: 0 | AB217: 0 | AC217: 0 | AD217: 0 | AE217: 0 | AF217: 0 | AG217: 0 | AH217: 0 | AI217: 13631768 | AJ217: 0 | AK217: 0 | AL217: 0 | AM217: 0 | AN217: 0 | AO217: 0 | AP217: 0 | AQ217: 0 | AR217: =1 -> 1 | AS217: 0 | AT217: 0 | AU217: =RC[-30]-RC[-29]-RC[-28]-RC[-27]-RC[-26]-RC[-25] -> 14511768 | AV217: 0 | AW217: =RC[1]-RC[2] -> 0 | AX217: 0 | AY217: 0 | AZ217: =RC[-46] -> 13631768 | BA217: =RC[-46] -> 0 | BB217: =RC[-46] -> 0 | BC217: =RC[-46] -> 315000 | BD217: =RC[-46] -> 315000 | BE217: =RC[-46] -> 0 | BF217: =RC[-46] -> 680000 | BG217: =RC[-46] -> 490245 | BH217: =RC[-46] -> 0 | BI217: =RC[-46] -> 0 | BJ217: =RC[-46] -> 0 | BK217: =RC[-46] -> 15117013 | BL217: =RC[-46] -> 373520 | BM217: =RC[-46] -> 70035 | BN217: =RC[-46] -> 46690 | BO217: =RC[-46] -> 115000 | BP217: =RC[-46] -> 0 | BQ217: =RC[-46] -> 14511768 | BR217: =RC[-46] -> 0 | BS217: =RC[-46] -> 0 | BT217: =RC[-46] -> 0 | BU217: =RC[-46] -> 0 | BV217: =RC[-46] -> 0 | BW217: =RC[-46] -> 0 | BX217: =RC[-46] -> 0 | BY217: =RC[-46] -> 0 | BZ217: =RC[-46] -> 0 | CA217: =RC[-46] -> 0 | CB217: =RC[-46] -> 0 | CC217: =RC[-46] -> 13631768 | CD217: =RC[-46] -> 0 | CE217: =RC[-46] -> 0 | CF217: =RC[-46] -> 0 | CG217: =RC[-46] -> 0 | CH217: =RC[-46] -> 0 | CI217: =RC[-46] -> 0 | CJ217: =RC[-46] -> 0 | CK217: =RC[-46] -> 0 | CL217: =RC[-46] -> 1 | CM217: =RC[-46] -> 0 | CN217: =RC[-46] -> 0 | CO217: =RC[-46] -> 14511768 | CP217: =RC[-46] -> 0 | CQ217: =RC[-46] -> 0 | CR217: =RC[-46] -> 0 | CS217: =RC[-46] -> 0
A218: Cán bộ Phòng Phục vụ Kỹ thuật sân đỗ (HGS) | F218: =SUM(R[-3]C:R[-1]C) -> 44616241 | G218: =SUM(R[-3]C:R[-1]C) -> 0 | H218: =SUM(R[-3]C:R[-1]C) -> 0 | I218: =SUM(R[-3]C:R[-1]C) -> 1050000 | J218: =SUM(R[-3]C:R[-1]C) -> 1050000 | K218: =SUM(R[-3]C:R[-1]C) -> 0 | L218: =SUM(R[-3]C:R[-1]C) -> 2040000 | M218: =SUM(R[-3]C:R[-1]C) -> 1205085 | N218: =SUM(R[-3]C:R[-1]C) -> 0 | O218: =SUM(R[-3]C:R[-1]C) -> 0 | P218: =SUM(R[-3]C:R[-1]C) -> 0 | Q218: =SUM(R[-3]C:R[-1]C) -> 48911326 | R218: =SUM(R[-3]C:R[-1]C) -> 918160 | S218: =SUM(R[-3]C:R[-1]C) -> 172155 | T218: =SUM(R[-3]C:R[-1]C) -> 114770 | U218: =SUM(R[-3]C:R[-1]C) -> 345000 | V218: =SUM(R[-3]C:R[-1]C) -> 2903 | W218: =SUM(R[-3]C:R[-1]C) -> 47358338 | X218: =SUM(R[-3]C:R[-1]C) -> 0 | Y218: =SUM(R[-3]C:R[-1]C) -> 0 | Z218: =SUM(R[-3]C:R[-1]C) -> 0 | AA218: =SUM(R[-3]C:R[-1]C) -> 0 | AB218: =SUM(R[-3]C:R[-1]C) -> 0 | AC218: =SUM(R[-3]C:R[-1]C) -> 0 | AD218: =SUM(R[-3]C:R[-1]C) -> 0 | AE218: =SUM(R[-3]C:R[-1]C) -> 0 | AF218: =SUM(R[-3]C:R[-1]C) -> 0 | AG218: =SUM(R[-3]C:R[-1]C) -> 0 | AH218: =SUM(R[-3]C:R[-1]C) -> 0 | AI218: =SUM(R[-3]C:R[-1]C) -> 44616241 | AJ218: =SUM(R[-3]C:R[-1]C) -> 0 | AK218: =SUM(R[-3]C:R[-1]C) -> 0 | AL218: =SUM(R[-3]C:R[-1]C) -> 0 | AM218: =SUM(R[-3]C:R[-1]C) -> 0 | AN218: =SUM(R[-3]C:R[-1]C) -> 0 | AO218: =SUM(R[-3]C:R[-1]C) -> 0 | AP218: =SUM(R[-3]C:R[-1]C) -> 0 | AQ218: =SUM(R[-3]C:R[-1]C) -> 0 | AR218: =SUM(R[-3]C:R[-1]C) -> 3 | AS218: =SUM(R[-3]C:R[-1]C) -> 0 | AT218: =SUM(R[-3]C:R[-1]C) -> 0 | AU218: =SUM(R[-3]C:R[-1]C) -> 47358338 | AV218: =SUM(R[-3]C:R[-1]C) -> 0 | AW218: =SUM(R[-3]C:R[-1]C) -> 0 | AX218: =SUM(R[-3]C:R[-1]C) -> 0 | AY218: =SUM(R[-3]C:R[-1]C) -> 0
A219: Đội cầu, xe kéo đẩy (HGS) | F219: =R[20]C -> 127264854 | G219: =R[20]C -> 0 | H219: =R[20]C -> 0 | I219: =R[20]C -> 0 | J219: =R[20]C -> 0 | K219: =R[20]C -> 945000 | L219: =R[20]C -> 12920000 | M219: =R[20]C -> 8962067 | N219: =R[20]C -> 7980410 | O219: =R[20]C -> 0 | P219: =R[20]C -> 0 | Q219: =R[20]C -> 158072331 | R219: =R[20]C -> 6828240 | S219: =R[20]C -> 1280297 | T219: =R[20]C -> 853530 | U219: =R[20]C -> 1485254.0799999998 | V219: =R[20]C -> 0 | W219: =R[20]C -> 147625009.91999999 | X219: =R[20]C -> 0 | Y219: =R[20]C -> 0 | Z219: =R[20]C -> 0 | AA219: =R[20]C -> 0 | AB219: =R[20]C -> 0 | AC219: =R[20]C -> 0 | AD219: =R[20]C -> 0 | AE219: =R[20]C -> 0 | AF219: =R[20]C -> 0 | AG219: =R[20]C -> 0 | AH219: =R[20]C -> 7980410 | AI219: =R[20]C -> 127264854 | AJ219: =R[20]C -> 0 | AK219: =R[20]C -> 0 | AL219: =R[20]C -> 0 | AM219: =R[20]C -> 0 | AN219: =R[20]C -> 0 | AO219: =R[20]C -> 0 | AP219: =R[20]C -> 0 | AQ219: =R[20]C -> 0 | AR219: =R[20]C -> 19 | AS219: =R[20]C -> 0 | AT219: =R[20]C -> 0 | AU219: =R[20]C -> 147625009.91999999 | AW219: =R[20]C -> 2660136.6699999995 | AX219: =R[20]C -> 7980410 | AY219: =R[20]C -> 5320273.3299999991
A220: 1 | B220: 010753 | C220: Hoàng Việt Cường | D220: Đội trưởng | E220: 10520030753013 | F220: =RC[29]+RC[30]+RC[31]+RC[32]+RC[33]+RC[34]+RC[35]+RC[36]+RC[37] -> 11089856 | G220: =RC[17]+RC[18]++RC[19]+RC[20]+RC[21]+RC[38]+RC[39]+RC[41] -> 0 | H220: 0 | I220: 0 | J220: =RC[-2]+RC[-1] -> 0 | K220: 315000 | L220: 680000 | M220: 452813 | N220: =RC[15]+RC[16]+RC[17]+RC[18]+RC[19]+RC[20] -> 0 | O220: 0 | P220: 0 | Q220: 12537669 | R220: 345000 | S220: 64688 | T220: 43125 | U220: 115000 | V220: 0 | W220: 11969856 | X220: 0 | Y220: 0 | Z220: 0 | AA220: 0 | AB220: 0 | AC220: 0 | AD220: 0 | AE220: 0 | AF220: 0 | AG220: 0 | AH220: 0 | AI220: 11089856 | AJ220: 0 | AK220: 0 | AL220: 0 | AM220: 0 | AN220: 0 | AO220: 0 | AP220: 0 | AQ220: 0 | AR220: =1 -> 1 | AS220: 0 | AT220: 0 | AU220: =RC[-30]-RC[-29]-RC[-28]-RC[-27]-RC[-26]-RC[-25] -> 11969856 | AV220: 0 | AW220: =RC[1]-RC[2] -> 0 | AX220: 0 | AY220: 0 | AZ220: =RC[-46] -> 11089856 | BA220: =RC[-46] -> 0 | BB220: =RC[-46] -> 0 | BC220: =RC[-46] -> 0 | BD220: =RC[-46] -> 0 | BE220: =RC[-46] -> 315000 | BF220: =RC[-46] -> 680000 | BG220: =RC[-46] -> 452813 | BH220: =RC[-46] -> 0 | BI220: =RC[-46] -> 0 | BJ220: =RC[-46] -> 0 | BK220: =RC[-46] -> 12537669 | BL220: =RC[-46] -> 345000 | BM220: =RC[-46] -> 64688 | BN220: =RC[-46] -> 43125 | BO220: =RC[-46] -> 115000 | BP220: =RC[-46] -> 0 | BQ220: =RC[-46] -> 11969856 | BR220: =RC[-46] -> 0 | BS220: =RC[-46] -> 0 | BT220: =RC[-46] -> 0 | BU220: =RC[-46] -> 0 | BV220: =RC[-46] -> 0 | BW220: =RC[-46] -> 0 | BX220: =RC[-46] -> 0 | BY220: =RC[-46] -> 0 | BZ220: =RC[-46] -> 0 | CA220: =RC[-46] -> 0 | CB220: =RC[-46] -> 0 | CC220: =RC[-46] -> 11089856 | CD220: =RC[-46] -> 0 | CE220: =RC[-46] -> 0 | CF220: =RC[-46] -> 0 | CG220: =RC[-46] -> 0 | CH220: =RC[-46] -> 0 | CI220: =RC[-46] -> 0 | CJ220: =RC[-46] -> 0 | CK220: =RC[-46] -> 0 | CL220: =RC[-46] -> 1 | CM220: =RC[-46] -> 0 | CN220: =RC[-46] -> 0 | CO220: =RC[-46] -> 11969856 | CP220: =RC[-46] -> 0 | CQ220: =RC[-46] -> 0 | CR220: =RC[-46] -> 0 | CS220: =RC[-46] -> 0
A221: 2 | B221: 010704 | C221: Ngô Quốc Khánh | D221: Đội phó | E221: 10522162947014 | F221: =RC[29]+RC[30]+RC[31]+RC[32]+RC[33]+RC[34]+RC[35]+RC[36]+RC[37] -> 10021728 | G221: =RC[17]+RC[18]++RC[19]+RC[20]+RC[21]+RC[38]+RC[39]+RC[41] -> 0 | H221: 0 | I221: 0 | J221: =RC[-2]+RC[-1] -> 0 | K221: 210000 | L221: 680000 | M221: 555450 | N221: =RC[15]+RC[16]+RC[17]+RC[18]+RC[19]+RC[20] -> 0 | O221: 0 | P221: 0 | Q221: 11467178 | R221: 423200 | S221: 79350 | T221: 52900 | U221: 109117.28 | V221: 0 | W221: 10802610.720000001 | X221: 0 | Y221: 0 | Z221: 0 | AA221: 0 | AB221: 0 | AC221: 0 | AD221: 0 | AE221: 0 | AF221: 0 | AG221: 0 | AH221: 0 | AI221: 10021728 | AJ221: 0 | AK221: 0 | AL221: 0 | AM221: 0 | AN221: 0 | AO221: 0 | AP221: 0 | AQ221: 0 | AR221: =1 -> 1 | AS221: 0 | AT221: 0 | AU221: =RC[-30]-RC[-29]-RC[-28]-RC[-27]-RC[-26]-RC[-25] -> 10802610.720000001 | AV221: 0 | AW221: =RC[1]-RC[2] -> 0 | AX221: 0 | AY221: 0 | AZ221: =RC[-46] -> 10021728 | BA221: =RC[-46] -> 0 | BB221: =RC[-46] -> 0 | BC221: =RC[-46] -> 0 | BD221: =RC[-46] -> 0 | BE221: =RC[-46] -> 210000 | BF221: =RC[-46] -> 680000 | BG221: =RC[-46] -> 555450 | BH221: =RC[-46] -> 0 | BI221: =RC[-46] -> 0 | BJ221: =RC[-46] -> 0 | BK221: =RC[-46] -> 11467178 | BL221: =RC[-46] -> 423200 | BM221: =RC[-46] -> 79350 | BN221: =RC[-46] -> 52900 | BO221: =RC[-46] -> 109117.28 | BP221: =RC[-46] -> 0 | BQ221: =RC[-46] -> 10802610.720000001 | BR221: =RC[-46] -> 0 | BS221: =RC[-46] -> 0 | BT221: =RC[-46] -> 0 | BU221: =RC[-46] -> 0 | BV221: =RC[-46] -> 0 | BW221: =RC[-46] -> 0 | BX221: =RC[-46] -> 0 | BY221: =RC[-46] -> 0 | BZ221: =RC[-46] -> 0 | CA221: =RC[-46] -> 0 | CB221: =RC[-46] -> 0 | CC221: =RC[-46] -> 10021728 | CD221: =RC[-46] -> 0 | CE221: =RC[-46] -> 0 | CF221: =RC[-46] -> 0 | CG221: =RC[-46] -> 0 | CH221: =RC[-46] -> 0 | CI221: =RC[-46] -> 0 | CJ221: =RC[-46] -> 0 | CK221: =RC[-46] -> 0 | CL221: =RC[-46] -> 1 | CM221: =RC[-46] -> 0 | CN221: =RC[-46] -> 0 | CO221: =RC[-46] -> 10802610.720000001 | CP221: =RC[-46] -> 0 | CQ221: =RC[-46] -> 0 | CR221: =RC[-46] -> 0 | CS221: =RC[-46] -> 0
A222: 3 | B222: 010686 | C222: Đỗ Anh Tuấn | D222: NV Lái xe - VHTTB | E222: 10522162969018 | F222: =RC[29]+RC[30]+RC[31]+RC[32]+RC[33]+RC[34]+RC[35]+RC[36]+RC[37] -> 6245340 | G222: =RC[17]+RC[18]++RC[19]+RC[20]+RC[21]+RC[38]+RC[39]+RC[41] -> 0 | H222: 0 | I222: 0 | J222: =RC[-2]+RC[-1] -> 0 | K222: 0 | L222: 680000 | M222: 490245 | N222: =RC[15]+RC[16]+RC[17]+RC[18]+RC[19]+RC[20] -> 491885 | O222: 0 | P222: 0 | Q222: 7907470 | R222: 373520 | S222: 70035 | T222: 46690 | U222: 74172.25 | V222: 0 | W222: 7343052.75 | X222: 0 | Y222: 0 | Z222: 0 | AA222: 0 | AB222: 0 | AC222: 0 | AD222: 0 | AE222: 0 | AF222: 0 | AG222: 0 | AH222: 491885 | AI222: 6245340 | AJ222: 0 | AK222: 0 | AL222: 0 | AM222: 0 | AN222: 0 | AO222: 0 | AP222: 0 | AQ222: 0 | AR222: =1 -> 1 | AS222: 0 | AT222: 0 | AU222: =RC[-30]-RC[-29]-RC[-28]-RC[-27]-RC[-26]-RC[-25] -> 7343052.75 | AV222: 0 | AW222: =RC[1]-RC[2] -> 163961.66700000002 | AX222: 491885 | AY222: 327923.33299999998 | AZ222: =RC[-46] -> 6245340 | BA222: =RC[-46] -> 0 | BB222: =RC[-46] -> 0 | BC222: =RC[-46] -> 0 | BD222: =RC[-46] -> 0 | BE222: =RC[-46] -> 0 | BF222: =RC[-46] -> 680000 | BG222: =RC[-46] -> 490245 | BH222: =RC[-46] -> 491885 | BI222: =RC[-46] -> 0 | BJ222: =RC[-46] -> 0 | BK222: =RC[-46] -> 7907470 | BL222: =RC[-46] -> 373520 | BM222: =RC[-46] -> 70035 | BN222: =RC[-46] -> 46690 | BO222: =RC[-46] -> 74172.25 | BP222: =RC[-46] -> 0 | BQ222: =RC[-46] -> 7343052.75 | BR222: =RC[-46] -> 0 | BS222: =RC[-46] -> 0 | BT222: =RC[-46] -> 0 | BU222: =RC[-46] -> 0 | BV222: =RC[-46] -> 0 | BW222: =RC[-46] -> 0 | BX222: =RC[-46] -> 0 | BY222: =RC[-46] -> 0 | BZ222: =RC[-46] -> 0 | CA222: =RC[-46] -> 0 | CB222: =RC[-46] -> 491885 | CC222: =RC[-46] -> 6245340 | CD222: =RC[-46] -> 0 | CE222: =RC[-46] -> 0 | CF222: =RC[-46] -> 0 | CG222: =RC[-46] -> 0 | CH222: =RC[-46] -> 0 | CI222: =RC[-46] -> 0 | CJ222: =RC[-46] -> 0 | CK222: =RC[-46] -> 0 | CL222: =RC[-46] -> 1 | CM222: =RC[-46] -> 0 | CN222: =RC[-46] -> 0 | CO222: =RC[-46] -> 7343052.75 | CP222: =RC[-46] -> 0 | CQ222: =RC[-46] -> 163961.66700000002 | CR222: =RC[-46] -> 491885 | CS222: =RC[-46] -> 327923.33299999998
A223: 4 | B223: 010687 | C223: Lê Hồng Nam | D223: NV Lái xe - VHTTB | E223: 10520981787015 | F223: =RC[29]+RC[30]+RC[31]+RC[32]+RC[33]+RC[34]+RC[35]+RC[36]+RC[37] -> 6916568 | G223: =RC[17]+RC[18]++RC[19]+RC[20]+RC[21]+RC[38]+RC[39]+RC[41] -> 0 | H223: 0 | I223: 0 | J223: =RC[-2]+RC[-1] -> 0 | K223: 105000 | L223: 680000 | M223: 490245 | N223: =RC[15]+RC[16]+RC[17]+RC[18]+RC[19]+RC[20] -> 491885 | O223: 0 | P223: 0 | Q223: 8683698 | R223: 373520 | S223: 70035 | T223: 46690 | U223: 81934.53 | V223: 0 | W223: 8111518.4699999997 | X223: 0 | Y223: 0 | Z223: 0 | AA223: 0 | AB223: 0 | AC223: 0 | AD223: 0 | AE223: 0 | AF223: 0 | AG223: 0 | AH223: 491885 | AI223: 6916568 | AJ223: 0 | AK223: 0 | AL223: 0 | AM223: 0 | AN223: 0 | AO223: 0 | AP223: 0 | AQ223: 0 | AR223: =1 -> 1 | AS223: 0 | AT223: 0 | AU223: =RC[-30]-RC[-29]-RC[-28]-RC[-27]-RC[-26]-RC[-25] -> 8111518.4699999997 | AV223: 0 | AW223: =RC[1]-RC[2] -> 163961.66700000002 | AX223: 491885 | AY223: 327923.33299999998 | AZ223: =RC[-46] -> 6916568 | BA223: =RC[-46] -> 0 | BB223: =RC[-46] -> 0 | BC223: =RC[-46] -> 0 | BD223: =RC[-46] -> 0 | BE223: =RC[-46] -> 105000 | BF223: =RC[-46] -> 680000 | BG223: =RC[-46] -> 490245 | BH223: =RC[-46] -> 491885 | BI223: =RC[-46] -> 0 | BJ223: =RC[-46] -> 0 | BK223: =RC[-46] -> 8683698 | BL223: =RC[-46] -> 373520 | BM223: =RC[-46] -> 70035 | BN223: =RC[-46] -> 46690 | BO223: =RC[-46] -> 81934.53 | BP223: =RC[-46] -> 0 | BQ223: =RC[-46] -> 8111518.4699999997 | BR223: =RC[-46] -> 0 | BS223: =RC[-46] -> 0 | BT223: =RC[-46] -> 0 | BU223: =RC[-46] -> 0 | BV223: =RC[-46] -> 0 | BW223: =RC[-46] -> 0 | BX223: =RC[-46] -> 0 | BY223: =RC[-46] -> 0 | BZ223: =RC[-46] -> 0 | CA223: =RC[-46] -> 0 | CB223: =RC[-46] -> 491885 | CC223: =RC[-46] -> 6916568 | CD223: =RC[-46] -> 0 | CE223: =RC[-46] -> 0 | CF223: =RC[-46] -> 0 | CG223: =RC[-46] -> 0 | CH223: =RC[-46] -> 0 | CI223: =RC[-46] -> 0 | CJ223: =RC[-46] -> 0 | CK223: =RC[-46] -> 0 | CL223: =RC[-46] -> 1 | CM223: =RC[-46] -> 0 | CN223: =RC[-46] -> 0 | CO223: =RC[-46] -> 8111518.4699999997 | CP223: =RC[-46] -> 0 | CQ223: =RC[-46] -> 163961.66700000002 | CR223: =RC[-46] -> 491885 | CS223: =RC[-46] -> 327923.33299999998
A224: 5 | B224: 010688 | C224: Cao Thế Vinh | D224: NV Lái xe - VHTTB | E224: 10522162949017 | F224: =RC[29]+RC[30]+RC[31]+RC[32]+RC[33]+RC[34]+RC[35]+RC[36]+RC[37] -> 7208406 | G224: =RC[17]+RC[18]++RC[19]+RC[20]+RC[21]+RC[38]+RC[39]+RC[41] -> 0 | H224: 0 | I224: 0 | J224: =RC[-2]+RC[-1] -> 0 | K224: 210000 | L224: 680000 | M224: 490245 | N224: =RC[15]+RC[16]+RC[17]+RC[18]+RC[19]+RC[20] -> 491885 | O224: 0 | P224: 0 | Q224: 9080536 | R224: 373520 | S224: 70035 | T224: 46690 | U224: 85902.91 | V224: 0 | W224: 8504388.0899999999 | X224: 0 | Y224: 0 | Z224: 0 | AA224: 0 | AB224: 0 | AC224: 0 | AD224: 0 | AE224: 0 | AF224: 0 | AG224: 0 | AH224: 491885 | AI224: 7208406 | AJ224: 0 | AK224: 0 | AL224: 0 | AM224: 0 | AN224: 0 | AO224: 0 | AP224: 0 | AQ224: 0 | AR224: =1 -> 1 | AS224: 0 | AT224: 0 | AU224: =RC[-30]-RC[-29]-RC[-28]-RC[-27]-RC[-26]-RC[-25] -> 8504388.0899999999 | AV224: 0 | AW224: =RC[1]-RC[2] -> 163961.66700000002 | AX224: 491885 | AY224: 327923.33299999998 | AZ224: =RC[-46] -> 7208406 | BA224: =RC[-46] -> 0 | BB224: =RC[-46] -> 0 | BC224: =RC[-46] -> 0 | BD224: =RC[-46] -> 0 | BE224: =RC[-46] -> 210000 | BF224: =RC[-46] -> 680000 | BG224: =RC[-46] -> 490245 | BH224: =RC[-46] -> 491885 | BI224: =RC[-46] -> 0 | BJ224: =RC[-46] -> 0 | BK224: =RC[-46] -> 9080536 | BL224: =RC[-46] -> 373520 | BM224: =RC[-46] -> 70035 | BN224: =RC[-46] -> 46690 | BO224: =RC[-46] -> 85902.91 | BP224: =RC[-46] -> 0 | BQ224: =RC[-46] -> 8504388.0899999999 | BR224: =RC[-46] -> 0 | BS224: =RC[-46] -> 0 | BT224: =RC[-46] -> 0 | BU224: =RC[-46] -> 0 | BV224: =RC[-46] -> 0 | BW224: =RC[-46] -> 0 | BX224: =RC[-46] -> 0 | BY224: =RC[-46] -> 0 | BZ224: =RC[-46] -> 0 | CA224: =RC[-46] -> 0 | CB224: =RC[-46] -> 491885 | CC224: =RC[-46] -> 7208406 | CD224: =RC[-46] -> 0 | CE224: =RC[-46] -> 0 | CF224: =RC[-46] -> 0 | CG224: =RC[-46] -> 0 | CH224: =RC[-46] -> 0 | CI224: =RC[-46] -> 0 | CJ224: =RC[-46] -> 0 | CK224: =RC[-46] -> 0 | CL224: =RC[-46] -> 1 | CM224: =RC[-46] -> 0 | CN224: =RC[-46] -> 0 | CO224: =RC[-46] -> 8504388.0899999999 | CP224: =RC[-46] -> 0 | CQ224: =RC[-46] -> 163961.66700000002 | CR224: =RC[-46] -> 491885 | CS224: =RC[-46] -> 327923.33299999998
A225: 6 | B225: 010689 | C225: Đỗ Minh Hải | D225: NV Lái xe - VHTTB | E225: 10520037366015 | F225: =RC[29]+RC[30]+RC[31]+RC[32]+RC[33]+RC[34]+RC[35]+RC[36]+RC[37] -> 6916568 | G225: =RC[17]+RC[18]++RC[19]+RC[20]+RC[21]+RC[38]+RC[39]+RC[41] -> 0 | H225: 0 | I225: 0 | J225: =RC[-2]+RC[-1] -> 0 | K225: 105000 | L225: 680000 | M225: 490245 | N225: =RC[15]+RC[16]+RC[17]+RC[18]+RC[19]+RC[20] -> 491885 | O225: 0 | P225: 0 | Q225: 8683698 | R225: 373520 | S225: 70035 | T225: 46690 | U225: 81934.53 | V225: 0 | W225: 8111518.4699999997 | X225: 0 | Y225: 0 | Z225: 0 | AA225: 0 | AB225: 0 | AC225: 0 | AD225: 0 | AE225: 0 | AF225: 0 | AG225: 0 | AH225: 491885 | AI225: 6916568 | AJ225: 0 | AK225: 0 | AL225: 0 | AM225: 0 | AN225: 0 | AO225: 0 | AP225: 0 | AQ225: 0 | AR225: =1 -> 1 | AS225: 0 | AT225: 0 | AU225: =RC[-30]-RC[-29]-RC[-28]-RC[-27]-RC[-26]-RC[-25] -> 8111518.4699999997 | AV225: 0 | AW225: =RC[1]-RC[2] -> 163961.66700000002 | AX225: 491885 | AY225: 327923.33299999998 | AZ225: =RC[-46] -> 6916568 | BA225: =RC[-46] -> 0 | BB225: =RC[-46] -> 0 | BC225: =RC[-46] -> 0 | BD225: =RC[-46] -> 0 | BE225: =RC[-46] -> 105000 | BF225: =RC[-46] -> 680000 | BG225: =RC[-46] -> 490245 | BH225: =RC[-46] -> 491885 | BI225: =RC[-46] -> 0 | BJ225: =RC[-46] -> 0 | BK225: =RC[-46] -> 8683698 | BL225: =RC[-46] -> 373520 | BM225: =RC[-46] -> 70035 | BN225: =RC[-46] -> 46690 | BO225: =RC[-46] -> 81934.53 | BP225: =RC[-46] -> 0 | BQ225: =RC[-46] -> 8111518.4699999997 | BR225: =RC[-46] -> 0 | BS225: =RC[-46] -> 0 | BT225: =RC[-46] -> 0 | BU225: =RC[-46] -> 0 | BV225: =RC[-46] -> 0 | BW225: =RC[-46] -> 0 | BX225: =RC[-46] -> 0 | BY225: =RC[-46] -> 0 | BZ225: =RC[-46] -> 0 | CA225: =RC[-46] -> 0 | CB225: =RC[-46] -> 491885 | CC225: =RC[-46] -> 6916568 | CD225: =RC[-46] -> 0 | CE225: =RC[-46] -> 0 | CF225: =RC[-46] -> 0 | CG225: =RC[-46] -> 0 | CH225: =RC[-46] -> 0 | CI225: =RC[-46] -> 0 | CJ225: =RC[-46] -> 0 | CK225: =RC[-46] -> 0 | CL225: =RC[-46] -> 1 | CM225: =RC[-46] -> 0 | CN225: =RC[-46] -> 0 | CO225: =RC[-46] -> 8111518.4699999997 | CP225: =RC[-46] -> 0 | CQ225: =RC[-46] -> 163961.66700000002 | CR225: =RC[-46] -> 491885 | CS225: =RC[-46] -> 327923.33299999998
A226: 7 | B226: 010690 | C226: Phạm Đăng Khoa | D226: NV Lái xe - VHTTB | E226: 10520036699010 | F226: =RC[29]+RC[30]+RC[31]+RC[32]+RC[33]+RC[34]+RC[35]+RC[36]+RC[37] -> 6245340 | G226: =RC[17]+RC[18]++RC[19]+RC[20]+RC[21]+RC[38]+RC[39]+RC[41] -> 0 | H226: 0 | I226: 0 | J226: =RC[-2]+RC[-1] -> 0 | K226: 0 | L226: 680000 | M226: 490245 | N226: =RC[15]+RC[16]+RC[17]+RC[18]+RC[19]+RC[20] -> 491885 | O226: 0 | P226: 0 | Q226: 7907470 | R226: 373520 | S226: 70035 | T226: 46690 | U226: 74172.25 | V226: 0 | W226: 7343052.75 | X226: 0 | Y226: 0 | Z226: 0 | AA226: 0 | AB226: 0 | AC226: 0 | AD226: 0 | AE226: 0 | AF226: 0 | AG226: 0 | AH226: 491885 | AI226: 6245340 | AJ226: 0 | AK226: 0 | AL226: 0 | AM226: 0 | AN226: 0 | AO226: 0 | AP226: 0 | AQ226: 0 | AR226: =1 -> 1 | AS226: 0 | AT226: 0 | AU226: =RC[-30]-RC[-29]-RC[-28]-RC[-27]-RC[-26]-RC[-25] -> 7343052.75 | AV226: 0 | AW226: =RC[1]-RC[2] -> 163961.66700000002 | AX226: 491885 | AY226: 327923.33299999998 | AZ226: =RC[-46] -> 6245340 | BA226: =RC[-46] -> 0 | BB226: =RC[-46] -> 0 | BC226: =RC[-46] -> 0 | BD226: =RC[-46] -> 0 | BE226: =RC[-46] -> 0 | BF226: =RC[-46] -> 680000 | BG226: =RC[-46] -> 490245 | BH226: =RC[-46] -> 491885 | BI226: =RC[-46] -> 0 | BJ226: =RC[-46] -> 0 | BK226: =RC[-46] -> 7907470 | BL226: =RC[-46] -> 373520 | BM226: =RC[-46] -> 70035 | BN226: =RC[-46] -> 46690 | BO226: =RC[-46] -> 74172.25 | BP226: =RC[-46] -> 0 | BQ226: =RC[-46] -> 7343052.75 | BR226: =RC[-46] -> 0 | BS226: =RC[-46] -> 0 | BT226: =RC[-46] -> 0 | BU226: =RC[-46] -> 0 | BV226: =RC[-46] -> 0 | BW226: =RC[-46] -> 0 | BX226: =RC[-46] -> 0 | BY226: =RC[-46] -> 0 | BZ226: =RC[-46] -> 0 | CA226: =RC[-46] -> 0 | CB226: =RC[-46] -> 491885 | CC226: =RC[-46] -> 6245340 | CD226: =RC[-46] -> 0 | CE226: =RC[-46] -> 0 | CF226: =RC[-46] -> 0 | CG226: =RC[-46] -> 0 | CH226: =RC[-46] -> 0 | CI226: =RC[-46] -> 0 | CJ226: =RC[-46] -> 0 | CK226: =RC[-46] -> 0 | CL226: =RC[-46] -> 1 | CM226: =RC[-46] -> 0 | CN226: =RC[-46] -> 0 | CO226: =RC[-46] -> 7343052.75 | CP226: =RC[-46] -> 0 | CQ226: =RC[-46] -> 163961.66700000002 | CR226: =RC[-46] -> 491885 | CS226: =RC[-46] -> 327923.33299999998
A227: 8 | B227: 010691 | C227: Hoàng Văn Thanh | D227: NV Lái xe - VHTTB | E227: 10522162954010 | F227: =RC[29]+RC[30]+RC[31]+RC[32]+RC[33]+RC[34]+RC[35]+RC[36]+RC[37] -> 6624730 | G227: =RC[17]+RC[18]++RC[19]+RC[20]+RC[21]+RC[38]+RC[39]+RC[41] -> 0 | H227: 0 | I227: 0 | J227: =RC[-2]+RC[-1] -> 0 | K227: 0 | L227: 680000 | M227: 555450 | N227: =RC[15]+RC[16]+RC[17]+RC[18]+RC[19]+RC[20] -> 557308 | O227: 0 | P227: 0 | Q227: 8417488 | R227: 423200 | S227: 79350 | T227: 52900 | U227: 78620.38 | V227: 0 | W227: 7783417.6200000001 | X227: 0 | Y227: 0 | Z227: 0 | AA227: 0 | AB227: 0 | AC227: 0 | AD227: 0 | AE227: 0 | AF227: 0 | AG227: 0 | AH227: 557308 | AI227: 6624730 | AJ227: 0 | AK227: 0 | AL227: 0 | AM227: 0 | AN227: 0 | AO227: 0 | AP227: 0 | AQ227: 0 | AR227: =1 -> 1 | AS227: 0 | AT227: 0 | AU227: =RC[-30]-RC[-29]-RC[-28]-RC[-27]-RC[-26]-RC[-25] -> 7783417.6200000001 | AV227: 0 | AW227: =RC[1]-RC[2] -> 185769.33299999998 | AX227: 557308 | AY227: 371538.66700000002 | AZ227: =RC[-46] -> 6624730 | BA227: =RC[-46] -> 0 | BB227: =RC[-46] -> 0 | BC227: =RC[-46] -> 0 | BD227: =RC[-46] -> 0 | BE227: =RC[-46] -> 0 | BF227: =RC[-46] -> 680000 | BG227: =RC[-46] -> 555450 | BH227: =RC[-46] -> 557308 | BI227: =RC[-46] -> 0 | BJ227: =RC[-46] -> 0 | BK227: =RC[-46] -> 8417488 | BL227: =RC[-46] -> 423200 | BM227: =RC[-46] -> 79350 | BN227: =RC[-46] -> 52900 | BO227: =RC[-46] -> 78620.38 | BP227: =RC[-46] -> 0 | BQ227: =RC[-46] -> 7783417.6200000001 | BR227: =RC[-46] -> 0 | BS227: =RC[-46] -> 0 | BT227: =RC[-46] -> 0 | BU227: =RC[-46] -> 0 | BV227: =RC[-46] -> 0 | BW227: =RC[-46] -> 0 | BX227: =RC[-46] -> 0 | BY227: =RC[-46] -> 0 | BZ227: =RC[-46] -> 0 | CA227: =RC[-46] -> 0 | CB227: =RC[-46] -> 557308 | CC227: =RC[-46] -> 6624730 | CD227: =RC[-46] -> 0 | CE227: =RC[-46] -> 0 | CF227: =RC[-46] -> 0 | CG227: =RC[-46] -> 0 | CH227: =RC[-46] -> 0 | CI227: =RC[-46] -> 0 | CJ227: =RC[-46] -> 0 | CK227: =RC[-46] -> 0 | CL227: =RC[-46] -> 1 | CM227: =RC[-46] -> 0 | CN227: =RC[-46] -> 0 | CO227: =RC[-46] -> 7783417.6200000001 | CP227: =RC[-46] -> 0 | CQ227: =RC[-46] -> 185769.33299999998 | CR227: =RC[-46] -> 557308 | CS227: =RC[-46] -> 371538.66700000002
A228: 9 | B228: 010692 | C228: Đỗ Quang Tiến | D228: NV Lái xe - VHTTB | E228: 10520324211014 | F228: =RC[29]+RC[30]+RC[31]+RC[32]+RC[33]+RC[34]+RC[35]+RC[36]+RC[37] -> 6245340 | G228: =RC[17]+RC[18]++RC[19]+RC[20]+RC[21]+RC[38]+RC[39]+RC[41] -> 0 | H228: 0 | I228: 0 | J228: =RC[-2]+RC[-1] -> 0 | K228: 0 | L228: 680000 | M228: 490245 | N228: =RC[15]+RC[16]+RC[17]+RC[18]+RC[19]+RC[20] -> 491885 | O228: 0 | P228: 0 | Q228: 7907470 | R228: 373520 | S228: 70035 | T228: 46690 | U228: 74172.25 | V228: 0 | W228: 7343052.75 | X228: 0 | Y228: 0 | Z228: 0 | AA228: 0 | AB228: 0 | AC228: 0 | AD228: 0 | AE228: 0 | AF228: 0 | AG228: 0 | AH228: 491885 | AI228: 6245340 | AJ228: 0 | AK228: 0 | AL228: 0 | AM228: 0 | AN228: 0 | AO228: 0 | AP228: 0 | AQ228: 0 | AR228: =1 -> 1 | AS228: 0 | AT228: 0 | AU228: =RC[-30]-RC[-29]-RC[-28]-RC[-27]-RC[-26]-RC[-25] -> 7343052.75 | AV228: 0 | AW228: =RC[1]-RC[2] -> 163961.66700000002 | AX228: 491885 | AY228: 327923.33299999998 | AZ228: =RC[-46] -> 6245340 | BA228: =RC[-46] -> 0 | BB228: =RC[-46] -> 0 | BC228: =RC[-46] -> 0 | BD228: =RC[-46] -> 0 | BE228: =RC[-46] -> 0 | BF228: =RC[-46] -> 680000 | BG228: =RC[-46] -> 490245 | BH228: =RC[-46] -> 491885 | BI228: =RC[-46] -> 0 | BJ228: =RC[-46] -> 0 | BK228: =RC[-46] -> 7907470 | BL228: =RC[-46] -> 373520 | BM228: =RC[-46] -> 70035 | BN228: =RC[-46] -> 46690 | BO228: =RC[-46] -> 74172.25 | BP228: =RC[-46] -> 0 | BQ228: =RC[-46] -> 7343052.75 | BR228: =RC[-46] -> 0 | BS228: =RC[-46] -> 0 | BT228: =RC[-46] -> 0 | BU228: =RC[-46] -> 0 | BV228: =RC[-46] -> 0 | BW228: =RC[-46] -> 0 | BX228: =RC[-46] -> 0 | BY228: =RC[-46] -> 0 | BZ228: =RC[-46] -> 0 | CA228: =RC[-46] -> 0 | CB228: =RC[-46] -> 491885 | CC228: =RC[-46] -> 6245340 | CD228: =RC[-46] -> 0 | CE228: =RC[-46] -> 0 | CF228: =RC[-46] -> 0 | CG228: =RC[-46] -> 0 | CH228: =RC[-46] -> 0 | CI228: =RC[-46] -> 0 | CJ228: =RC[-46] -> 0 | CK228: =RC[-46] -> 0 | CL228: =RC[-46] -> 1 | CM228: =RC[-46] -> 0 | CN228: =RC[-46] -> 0 | CO228: =RC[-46] -> 7343052.75 | CP228: =RC[-46] -> 0 | CQ228: =RC[-46] -> 163961.66700000002 | CR228: =RC[-46] -> 491885 | CS228: =RC[-46] -> 327923.33299999998
A229: 10 | B229: 010693 | C229: Hoàng Sơn | D229: NV Lái xe - VHTTB | E229: 10522162931010 | F229: =RC[29]+RC[30]+RC[31]+RC[32]+RC[33]+RC[34]+RC[35]+RC[36]+RC[37] -> 5253090 | G229: =RC[17]+RC[18]++RC[19]+RC[20]+RC[21]+RC[38]+RC[39]+RC[41] -> 0 | H229: 0 | I229: 0 | J229: =RC[-2]+RC[-1] -> 0 | K229: 0 | L229: 680000 | M229: 382778 | N229: =RC[15]+RC[16]+RC[17]+RC[18]+RC[19]+RC[20] -> 384058 | O229: 0 | P229: 0 | Q229: 6699926 | R229: 291640 | S229: 54683 | T229: 36455 | U229: 63171.48 | V229: 0 | W229: 6253976.5199999996 | X229: 0 | Y229: 0 | Z229: 0 | AA229: 0 | AB229: 0 | AC229: 0 | AD229: 0 | AE229: 0 | AF229: 0 | AG229: 0 | AH229: 384058 | AI229: 5253090 | AJ229: 0 | AK229: 0 | AL229: 0 | AM229: 0 | AN229: 0 | AO229: 0 | AP229: 0 | AQ229: 0 | AR229: =1 -> 1 | AS229: 0 | AT229: 0 | AU229: =RC[-30]-RC[-29]-RC[-28]-RC[-27]-RC[-26]-RC[-25] -> 6253976.5199999996 | AV229: 0 | AW229: =RC[1]-RC[2] -> 128019.33300000001 | AX229: 384058 | AY229: 256038.66699999999 | AZ229: =RC[-46] -> 5253090 | BA229: =RC[-46] -> 0 | BB229: =RC[-46] -> 0 | BC229: =RC[-46] -> 0 | BD229: =RC[-46] -> 0 | BE229: =RC[-46] -> 0 | BF229: =RC[-46] -> 680000 | BG229: =RC[-46] -> 382778 | BH229: =RC[-46] -> 384058 | BI229: =RC[-46] -> 0 | BJ229: =RC[-46] -> 0 | BK229: =RC[-46] -> 6699926 | BL229: =RC[-46] -> 291640 | BM229: =RC[-46] -> 54683 | BN229: =RC[-46] -> 36455 | BO229: =RC[-46] -> 63171.48 | BP229: =RC[-46] -> 0 | BQ229: =RC[-46] -> 6253976.5199999996 | BR229: =RC[-46] -> 0 | BS229: =RC[-46] -> 0 | BT229: =RC[-46] -> 0 | BU229: =RC[-46] -> 0 | BV229: =RC[-46] -> 0 | BW229: =RC[-46] -> 0 | BX229: =RC[-46] -> 0 | BY229: =RC[-46] -> 0 | BZ229: =RC[-46] -> 0 | CA229: =RC[-46] -> 0 | CB229: =RC[-46] -> 384058 | CC229: =RC[-46] -> 5253090 | CD229: =RC[-46] -> 0 | CE229: =RC[-46] -> 0 | CF229: =RC[-46] -> 0 | CG229: =RC[-46] -> 0 | CH229: =RC[-46] -> 0 | CI229: =RC[-46] -> 0 | CJ229: =RC[-46] -> 0 | CK229: =RC[-46] -> 0 | CL229: =RC[-46] -> 1 | CM229: =RC[-46] -> 0 | CN229: =RC[-46] -> 0 | CO229: =RC[-46] -> 6253976.5199999996 | CP229: =RC[-46] -> 0 | CQ229: =RC[-46] -> 128019.33300000001 | CR229: =RC[-46] -> 384058 | CS229: =RC[-46] -> 256038.66699999999
A230: 11 | B230: 010694 | C230: Trần Văn Trà | D230: NV Lái xe - VHTTB | E230: 10522162896010 | F230: =RC[29]+RC[30]+RC[31]+RC[32]+RC[33]+RC[34]+RC[35]+RC[36]+RC[37] -> 5253090 | G230: =RC[17]+RC[18]++RC[19]+RC[20]+RC[21]+RC[38]+RC[39]+RC[41] -> 0 | H230: 0 | I230: 0 | J230: =RC[-2]+RC[-1] -> 0 | K230: 0 | L230: 680000 | M230: 382778 | N230: =RC[15]+RC[16]+RC[17]+RC[18]+RC[19]+RC[20] -> 384058 | O230: 0 | P230: 0 | Q230: 6699926 | R230: 291640 | S230: 54683 | T230: 36455 | U230: 63171.48 | V230: 0 | W230: 6253976.5199999996 | X230: 0 | Y230: 0 | Z230: 0 | AA230: 0 | AB230: 0 | AC230: 0 | AD230: 0 | AE230: 0 | AF230: 0 | AG230: 0 | AH230: 384058 | AI230: 5253090 | AJ230: 0 | AK230: 0 | AL230: 0 | AM230: 0 | AN230: 0 | AO230: 0 | AP230: 0 | AQ230: 0 | AR230: =1 -> 1 | AS230: 0 | AT230: 0 | AU230: =RC[-30]-RC[-29]-RC[-28]-RC[-27]-RC[-26]-RC[-25] -> 6253976.5199999996 | AV230: 0 | AW230: =RC[1]-RC[2] -> 128019.33300000001 | AX230: 384058 | AY230: 256038.66699999999 | AZ230: =RC[-46] -> 5253090 | BA230: =RC[-46] -> 0 | BB230: =RC[-46] -> 0 | BC230: =RC[-46] -> 0 | BD230: =RC[-46] -> 0 | BE230: =RC[-46] -> 0 | BF230: =RC[-46] -> 680000 | BG230: =RC[-46] -> 382778 | BH230: =RC[-46] -> 384058 | BI230: =RC[-46] -> 0 | BJ230: =RC[-46] -> 0 | BK230: =RC[-46] -> 6699926 | BL230: =RC[-46] -> 291640 | BM230: =RC[-46] -> 54683 | BN230: =RC[-46] -> 36455 | BO230: =RC[-46] -> 63171.48 | BP230: =RC[-46] -> 0 | BQ230: =RC[-46] -> 6253976.5199999996 | BR230: =RC[-46] -> 0 | BS230: =RC[-46] -> 0 | BT230: =RC[-46] -> 0 | BU230: =RC[-46] -> 0 | BV230: =RC[-46] -> 0 | BW230: =RC[-46] -> 0 | BX230: =RC[-46] -> 0 | BY230: =RC[-46] -> 0 | BZ230: =RC[-46] -> 0 | CA230: =RC[-46] -> 0 | CB230: =RC[-46] -> 384058 | CC230: =RC[-46] -> 5253090 | CD230: =RC[-46] -> 0 | CE230: =RC[-46] -> 0 | CF230: =RC[-46] -> 0 | CG230: =RC[-46] -> 0 | CH230: =RC[-46] -> 0 | CI230: =RC[-46] -> 0 | CJ230: =RC[-46] -> 0 | CK230: =RC[-46] -> 0 | CL230: =RC[-46] -> 1 | CM230: =RC[-46] -> 0 | CN230: =RC[-46] -> 0 | CO230: =RC[-46] -> 6253976.5199999996 | CP230: =RC[-46] -> 0 | CQ230: =RC[-46] -> 128019.33300000001 | CR230: =RC[-46] -> 384058 | CS230: =RC[-46] -> 256038.66699999999
A231: 12 | B231: 010696 | C231: Nguyễn Đình Thiện | D231: NV Lái xe - VHTTB | E231: 10520035677013 | F231: =RC[29]+RC[30]+RC[31]+RC[32]+RC[33]+RC[34]+RC[35]+RC[36]+RC[37] -> 6245340 | G231: =RC[17]+RC[18]++RC[19]+RC[20]+RC[21]+RC[38]+RC[39]+RC[41] -> 0 | H231: 0 | I231: 0 | J231: =RC[-2]+RC[-1] -> 0 | K231: 0 | L231: 680000 | M231: 490245 | N231: =RC[15]+RC[16]+RC[17]+RC[18]+RC[19]+RC[20] -> 491885 | O231: 0 | P231: 0 | Q231: 7907470 | R231: 373520 | S231: 70035 | T231: 46690 | U231: 74172.25 | V231: 0 | W231: 7343052.75 | X231: 0 | Y231: 0 | Z231: 0 | AA231: 0 | AB231: 0 | AC231: 0 | AD231: 0 | AE231: 0 | AF231: 0 | AG231: 0 | AH231: 491885 | AI231: 6245340 | AJ231: 0 | AK231: 0 | AL231: 0 | AM231: 0 | AN231: 0 | AO231: 0 | AP231: 0 | AQ231: 0 | AR231: =1 -> 1 | AS231: 0 | AT231: 0 | AU231: =RC[-30]-RC[-29]-RC[-28]-RC[-27]-RC[-26]-RC[-25] -> 7343052.75 | AV231: 0 | AW231: =RC[1]-RC[2] -> 163961.66700000002 | AX231: 491885 | AY231: 327923.33299999998 | AZ231: =RC[-46] -> 6245340 | BA231: =RC[-46] -> 0 | BB231: =RC[-46] -> 0 | BC231: =RC[-46] -> 0 | BD231: =RC[-46] -> 0 | BE231: =RC[-46] -> 0 | BF231: =RC[-46] -> 680000 | BG231: =RC[-46] -> 490245 | BH231: =RC[-46] -> 491885 | BI231: =RC[-46] -> 0 | BJ231: =RC[-46] -> 0 | BK231: =RC[-46] -> 7907470 | BL231: =RC[-46] -> 373520 | BM231: =RC[-46] -> 70035 | BN231: =RC[-46] -> 46690 | BO231: =RC[-46] -> 74172.25 | BP231: =RC[-46] -> 0 | BQ231: =RC[-46] -> 7343052.75 | BR231: =RC[-46] -> 0 | BS231: =RC[-46] -> 0 | BT231: =RC[-46] -> 0 | BU231: =RC[-46] -> 0 | BV231: =RC[-46] -> 0 | BW231: =RC[-46] -> 0 | BX231: =RC[-46] -> 0 | BY231: =RC[-46] -> 0 | BZ231: =RC[-46] -> 0 | CA231: =RC[-46] -> 0 | CB231: =RC[-46] -> 491885 | CC231: =RC[-46] -> 6245340 | CD231: =RC[-46] -> 0 | CE231: =RC[-46] -> 0 | CF231: =RC[-46] -> 0 | CG231: =RC[-46] -> 0 | CH231: =RC[-46] -> 0 | CI231: =RC[-46] -> 0 | CJ231: =RC[-46] -> 0 | CK231: =RC[-46] -> 0 | CL231: =RC[-46] -> 1 | CM231: =RC[-46] -> 0 | CN231: =RC[-46] -> 0 | CO231: =RC[-46] -> 7343052.75 | CP231: =RC[-46] -> 0 | CQ231: =RC[-46] -> 163961.66700000002 | CR231: =RC[-46] -> 491885 | CS231: =RC[-46] -> 327923.33299999998
A232: 13 | B232: 010697 | C232: Trần Hưng Nhân | D232: NV Lái xe - VHTTB | E232: 10520440823019 | F232: =RC[29]+RC[30]+RC[31]+RC[32]+RC[33]+RC[34]+RC[35]+RC[36]+RC[37] -> 6245340 | G232: =RC[17]+RC[18]++RC[19]+RC[20]+RC[21]+RC[38]+RC[39]+RC[41] -> 0 | H232: 0 | I232: 0 | J232: =RC[-2]+RC[-1] -> 0 | K232: 0 | L232: 680000 | M232: 490245 | N232: =RC[15]+RC[16]+RC[17]+RC[18]+RC[19]+RC[20] -> 491885 | O232: 0 | P232: 0 | Q232: 7907470 | R232: 373520 | S232: 70035 | T232: 46690 | U232: 74172.25 | V232: 0 | W232: 7343052.75 | X232: 0 | Y232: 0 | Z232: 0 | AA232: 0 | AB232: 0 | AC232: 0 | AD232: 0 | AE232: 0 | AF232: 0 | AG232: 0 | AH232: 491885 | AI232: 6245340 | AJ232: 0 | AK232: 0 | AL232: 0 | AM232: 0 | AN232: 0 | AO232: 0 | AP232: 0 | AQ232: 0 | AR232: =1 -> 1 | AS232: 0 | AT232: 0 | AU232: =RC[-30]-RC[-29]-RC[-28]-RC[-27]-RC[-26]-RC[-25] -> 7343052.75 | AV232: 0 | AW232: =RC[1]-RC[2] -> 163961.66700000002 | AX232: 491885 | AY232: 327923.33299999998 | AZ232: =RC[-46] -> 6245340 | BA232: =RC[-46] -> 0 | BB232: =RC[-46] -> 0 | BC232: =RC[-46] -> 0 | BD232: =RC[-46] -> 0 | BE232: =RC[-46] -> 0 | BF232: =RC[-46] -> 680000 | BG232: =RC[-46] -> 490245 | BH232: =RC[-46] -> 491885 | BI232: =RC[-46] -> 0 | BJ232: =RC[-46] -> 0 | BK232: =RC[-46] -> 7907470 | BL232: =RC[-46] -> 373520 | BM232: =RC[-46] -> 70035 | BN232: =RC[-46] -> 46690 | BO232: =RC[-46] -> 74172.25 | BP232: =RC[-46] -> 0 | BQ232: =RC[-46] -> 7343052.75 | BR232: =RC[-46] -> 0 | BS232: =RC[-46] -> 0 | BT232: =RC[-46] -> 0 | BU232: =RC[-46] -> 0 | BV232: =RC[-46] -> 0 | BW232: =RC[-46] -> 0 | BX232: =RC[-46] -> 0 | BY232: =RC[-46] -> 0 | BZ232: =RC[-46] -> 0 | CA232: =RC[-46] -> 0 | CB232: =RC[-46] -> 491885 | CC232: =RC[-46] -> 6245340 | CD232: =RC[-46] -> 0 | CE232: =RC[-46] -> 0 | CF232: =RC[-46] -> 0 | CG232: =RC[-46] -> 0 | CH232: =RC[-46] -> 0 | CI232: =RC[-46] -> 0 | CJ232: =RC[-46] -> 0 | CK232: =RC[-46] -> 0 | CL232: =RC[-46] -> 1 | CM232: =RC[-46] -> 0 | CN232: =RC[-46] -> 0 | CO232: =RC[-46] -> 7343052.75 | CP232: =RC[-46] -> 0 | CQ232: =RC[-46] -> 163961.66700000002 | CR232: =RC[-46] -> 491885 | CS232: =RC[-46] -> 327923.33299999998
A233: 14 | B233: 010698 | C233: Nguyễn Ngọc Toàn | D233: NV Lái xe - VHTTB | E233: 10520036969018 | F233: =RC[29]+RC[30]+RC[31]+RC[32]+RC[33]+RC[34]+RC[35]+RC[36]+RC[37] -> 6557607 | G233: =RC[17]+RC[18]++RC[19]+RC[20]+RC[21]+RC[38]+RC[39]+RC[41] -> 0 | H233: 0 | I233: 0 | J233: =RC[-2]+RC[-1] -> 0 | K233: 0 | L233: 680000 | M233: 490245 | N233: =RC[15]+RC[16]+RC[17]+RC[18]+RC[19]+RC[20] -> 491885 | O233: 0 | P233: 0 | Q233: 8219737 | R233: 373520 | S233: 70035 | T233: 46690 | U233: 77294.92 | V233: 0 | W233: 7652197.0800000001 | X233: 0 | Y233: 0 | Z233: 0 | AA233: 0 | AB233: 0 | AC233: 0 | AD233: 0 | AE233: 0 | AF233: 0 | AG233: 0 | AH233: 491885 | AI233: 6557607 | AJ233: 0 | AK233: 0 | AL233: 0 | AM233: 0 | AN233: 0 | AO233: 0 | AP233: 0 | AQ233: 0 | AR233: =1 -> 1 | AS233: 0 | AT233: 0 | AU233: =RC[-30]-RC[-29]-RC[-28]-RC[-27]-RC[-26]-RC[-25] -> 7652197.0800000001 | AV233: 0 | AW233: =RC[1]-RC[2] -> 163961.66700000002 | AX233: 491885 | AY233: 327923.33299999998 | AZ233: =RC[-46] -> 6557607 | BA233: =RC[-46] -> 0 | BB233: =RC[-46] -> 0 | BC233: =RC[-46] -> 0 | BD233: =RC[-46] -> 0 | BE233: =RC[-46] -> 0 | BF233: =RC[-46] -> 680000 | BG233: =RC[-46] -> 490245 | BH233: =RC[-46] -> 491885 | BI233: =RC[-46] -> 0 | BJ233: =RC[-46] -> 0 | BK233: =RC[-46] -> 8219737 | BL233: =RC[-46] -> 373520 | BM233: =RC[-46] -> 70035 | BN233: =RC[-46] -> 46690 | BO233: =RC[-46] -> 77294.92 | BP233: =RC[-46] -> 0 | BQ233: =RC[-46] -> 7652197.0800000001 | BR233: =RC[-46] -> 0 | BS233: =RC[-46] -> 0 | BT233: =RC[-46] -> 0 | BU233: =RC[-46] -> 0 | BV233: =RC[-46] -> 0 | BW233: =RC[-46] -> 0 | BX233: =RC[-46] -> 0 | BY233: =RC[-46] -> 0 | BZ233: =RC[-46] -> 0 | CA233: =RC[-46] -> 0 | CB233: =RC[-46] -> 491885 | CC233: =RC[-46] -> 6557607 | CD233: =RC[-46] -> 0 | CE233: =RC[-46] -> 0 | CF233: =RC[-46] -> 0 | CG233: =RC[-46] -> 0 | CH233: =RC[-46] -> 0 | CI233: =RC[-46] -> 0 | CJ233: =RC[-46] -> 0 | CK233: =RC[-46] -> 0 | CL233: =RC[-46] -> 1 | CM233: =RC[-46] -> 0 | CN233: =RC[-46] -> 0 | CO233: =RC[-46] -> 7652197.0800000001 | CP233: =RC[-46] -> 0 | CQ233: =RC[-46] -> 163961.66700000002 | CR233: =RC[-46] -> 491885 | CS233: =RC[-46] -> 327923.33299999998
A234: 15 | B234: 010700 | C234: Đặng Đức Mạnh | D234: NV Lái xe - VHTTB | E234: 10522162952018 | F234: =RC[29]+RC[30]+RC[31]+RC[32]+RC[33]+RC[34]+RC[35]+RC[36]+RC[37] -> 6557607 | G234: =RC[17]+RC[18]++RC[19]+RC[20]+RC[21]+RC[38]+RC[39]+RC[41] -> 0 | H234: 0 | I234: 0 | J234: =RC[-2]+RC[-1] -> 0 | K234: 0 | L234: 680000 | M234: 490245 | N234: =RC[15]+RC[16]+RC[17]+RC[18]+RC[19]+RC[20] -> 491885 | O234: 0 | P234: 0 | Q234: 8219737 | R234: 373520 | S234: 70035 | T234: 46690 | U234: 77294.92 | V234: 0 | W234: 7652197.0800000001 | X234: 0 | Y234: 0 | Z234: 0 | AA234: 0 | AB234: 0 | AC234: 0 | AD234: 0 | AE234: 0 | AF234: 0 | AG234: 0 | AH234: 491885 | AI234: 6557607 | AJ234: 0 | AK234: 0 | AL234: 0 | AM234: 0 | AN234: 0 | AO234: 0 | AP234: 0 | AQ234: 0 | AR234: =1 -> 1 | AS234: 0 | AT234: 0 | AU234: =RC[-30]-RC[-29]-RC[-28]-RC[-27]-RC[-26]-RC[-25] -> 7652197.0800000001 | AV234: 0 | AW234: =RC[1]-RC[2] -> 163961.66700000002 | AX234: 491885 | AY234: 327923.33299999998 | AZ234: =RC[-46] -> 6557607 | BA234: =RC[-46] -> 0 | BB234: =RC[-46] -> 0 | BC234: =RC[-46] -> 0 | BD234: =RC[-46] -> 0 | BE234: =RC[-46] -> 0 | BF234: =RC[-46] -> 680000 | BG234: =RC[-46] -> 490245 | BH234: =RC[-46] -> 491885 | BI234: =RC[-46] -> 0 | BJ234: =RC[-46] -> 0 | BK234: =RC[-46] -> 8219737 | BL234: =RC[-46] -> 373520 | BM234: =RC[-46] -> 70035 | BN234: =RC[-46] -> 46690 | BO234: =RC[-46] -> 77294.92 | BP234: =RC[-46] -> 0 | BQ234: =RC[-46] -> 7652197.0800000001 | BR234: =RC[-46] -> 0 | BS234: =RC[-46] -> 0 | BT234: =RC[-46] -> 0 | BU234: =RC[-46] -> 0 | BV234: =RC[-46] -> 0 | BW234: =RC[-46] -> 0 | BX234: =RC[-46] -> 0 | BY234: =RC[-46] -> 0 | BZ234: =RC[-46] -> 0 | CA234: =RC[-46] -> 0 | CB234: =RC[-46] -> 491885 | CC234: =RC[-46] -> 6557607 | CD234: =RC[-46] -> 0 | CE234: =RC[-46] -> 0 | CF234: =RC[-46] -> 0 | CG234: =RC[-46] -> 0 | CH234: =RC[-46] -> 0 | CI234: =RC[-46] -> 0 | CJ234: =RC[-46] -> 0 | CK234: =RC[-46] -> 0 | CL234: =RC[-46] -> 1 | CM234: =RC[-46] -> 0 | CN234: =RC[-46] -> 0 | CO234: =RC[-46] -> 7652197.0800000001 | CP234: =RC[-46] -> 0 | CQ234: =RC[-46] -> 163961.66700000002 | CR234: =RC[-46] -> 491885 | CS234: =RC[-46] -> 327923.33299999998
A235: 16 | B235: 010701 | C235: Đỗ Ngọc Lân | D235: NV Lái xe - VHTTB | E235: 10520512504010 | F235: =RC[29]+RC[30]+RC[31]+RC[32]+RC[33]+RC[34]+RC[35]+RC[36]+RC[37] -> 6245340 | G235: =RC[17]+RC[18]++RC[19]+RC[20]+RC[21]+RC[38]+RC[39]+RC[41] -> 0 | H235: 0 | I235: 0 | J235: =RC[-2]+RC[-1] -> 0 | K235: 0 | L235: 680000 | M235: 490245 | N235: =RC[15]+RC[16]+RC[17]+RC[18]+RC[19]+RC[20] -> 491885 | O235: 0 | P235: 0 | Q235: 7907470 | R235: 373520 | S235: 70035 | T235: 46690 | U235: 74172.25 | V235: 0 | W235: 7343052.75 | X235: 0 | Y235: 0 | Z235: 0 | AA235: 0 | AB235: 0 | AC235: 0 | AD235: 0 | AE235: 0 | AF235: 0 | AG235: 0 | AH235: 491885 | AI235: 6245340 | AJ235: 0 | AK235: 0 | AL235: 0 | AM235: 0 | AN235: 0 | AO235: 0 | AP235: 0 | AQ235: 0 | AR235: =1 -> 1 | AS235: 0 | AT235: 0 | AU235: =RC[-30]-RC[-29]-RC[-28]-RC[-27]-RC[-26]-RC[-25] -> 7343052.75 | AV235: 0 | AW235: =RC[1]-RC[2] -> 163961.66700000002 | AX235: 491885 | AY235: 327923.33299999998 | AZ235: =RC[-46] -> 6245340 | BA235: =RC[-46] -> 0 | BB235: =RC[-46] -> 0 | BC235: =RC[-46] -> 0 | BD235: =RC[-46] -> 0 | BE235: =RC[-46] -> 0 | BF235: =RC[-46] -> 680000 | BG235: =RC[-46] -> 490245 | BH235: =RC[-46] -> 491885 | BI235: =RC[-46] -> 0 | BJ235: =RC[-46] -> 0 | BK235: =RC[-46] -> 7907470 | BL235: =RC[-46] -> 373520 | BM235: =RC[-46] -> 70035 | BN235: =RC[-46] -> 46690 | BO235: =RC[-46] -> 74172.25 | BP235: =RC[-46] -> 0 | BQ235: =RC[-46] -> 7343052.75 | BR235: =RC[-46] -> 0 | BS235: =RC[-46] -> 0 | BT235: =RC[-46] -> 0 | BU235: =RC[-46] -> 0 | BV235: =RC[-46] -> 0 | BW235: =RC[-46] -> 0 | BX235: =RC[-46] -> 0 | BY235: =RC[-46] -> 0 | BZ235: =RC[-46] -> 0 | CA235: =RC[-46] -> 0 | CB235: =RC[-46] -> 491885 | CC235: =RC[-46] -> 6245340 | CD235: =RC[-46] -> 0 | CE235: =RC[-46] -> 0 | CF235: =RC[-46] -> 0 | CG235: =RC[-46] -> 0 | CH235: =RC[-46] -> 0 | CI235: =RC[-46] -> 0 | CJ235: =RC[-46] -> 0 | CK235: =RC[-46] -> 0 | CL235: =RC[-46] -> 1 | CM235: =RC[-46] -> 0 | CN235: =RC[-46] -> 0 | CO235: =RC[-46] -> 7343052.75 | CP235: =RC[-46] -> 0 | CQ235: =RC[-46] -> 163961.66700000002 | CR235: =RC[-46] -> 491885 | CS235: =RC[-46] -> 327923.33299999998
A236: 17 | B236: 010702 | C236: Nguyễn Tuấn Anh | D236: NV Lái xe - VHTTB | E236: 10522162956013 | F236: =RC[29]+RC[30]+RC[31]+RC[32]+RC[33]+RC[34]+RC[35]+RC[36]+RC[37] -> 6245340 | G236: =RC[17]+RC[18]++RC[19]+RC[20]+RC[21]+RC[38]+RC[39]+RC[41] -> 0 | H236: 0 | I236: 0 | J236: =RC[-2]+RC[-1] -> 0 | K236: 0 | L236: 680000 | M236: 490245 | N236: =RC[15]+RC[16]+RC[17]+RC[18]+RC[19]+RC[20] -> 491885 | O236: 0 | P236: 0 | Q236: 7907470 | R236: 373520 | S236: 70035 | T236: 46690 | U236: 74172.25 | V236: 0 | W236: 7343052.75 | X236: 0 | Y236: 0 | Z236: 0 | AA236: 0 | AB236: 0 | AC236: 0 | AD236: 0 | AE236: 0 | AF236: 0 | AG236: 0 | AH236: 491885 | AI236: 6245340 | AJ236: 0 | AK236: 0 | AL236: 0 | AM236: 0 | AN236: 0 | AO236: 0 | AP236: 0 | AQ236: 0 | AR236: =1 -> 1 | AS236: 0 | AT236: 0 | AU236: =RC[-30]-RC[-29]-RC[-28]-RC[-27]-RC[-26]-RC[-25] -> 7343052.75 | AV236: 0 | AW236: =RC[1]-RC[2] -> 163961.66700000002 | AX236: 491885 | AY236: 327923.33299999998 | AZ236: =RC[-46] -> 6245340 | BA236: =RC[-46] -> 0 | BB236: =RC[-46] -> 0 | BC236: =RC[-46] -> 0 | BD236: =RC[-46] -> 0 | BE236: =RC[-46] -> 0 | BF236: =RC[-46] -> 680000 | BG236: =RC[-46] -> 490245 | BH236: =RC[-46] -> 491885 | BI236: =RC[-46] -> 0 | BJ236: =RC[-46] -> 0 | BK236: =RC[-46] -> 7907470 | BL236: =RC[-46] -> 373520 | BM236: =RC[-46] -> 70035 | BN236: =RC[-46] -> 46690 | BO236: =RC[-46] -> 74172.25 | BP236: =RC[-46] -> 0 | BQ236: =RC[-46] -> 7343052.75 | BR236: =RC[-46] -> 0 | BS236: =RC[-46] -> 0 | BT236: =RC[-46] -> 0 | BU236: =RC[-46] -> 0 | BV236: =RC[-46] -> 0 | BW236: =RC[-46] -> 0 | BX236: =RC[-46] -> 0 | BY236: =RC[-46] -> 0 | BZ236: =RC[-46] -> 0 | CA236: =RC[-46] -> 0 | CB236: =RC[-46] -> 491885 | CC236: =RC[-46] -> 6245340 | CD236: =RC[-46] -> 0 | CE236: =RC[-46] -> 0 | CF236: =RC[-46] -> 0 | CG236: =RC[-46] -> 0 | CH236: =RC[-46] -> 0 | CI236: =RC[-46] -> 0 | CJ236: =RC[-46] -> 0 | CK236: =RC[-46] -> 0 | CL236: =RC[-46] -> 1 | CM236: =RC[-46] -> 0 | CN236: =RC[-46] -> 0 | CO236: =RC[-46] -> 7343052.75 | CP236: =RC[-46] -> 0 | CQ236: =RC[-46] -> 163961.66700000002 | CR236: =RC[-46] -> 491885 | CS236: =RC[-46] -> 327923.33299999998
A237: 18 | B237: 010703 | C237: Trần Văn Dậu | D237: NV Lái xe - VHTTB | E237: 10522162962013 | F237: =RC[29]+RC[30]+RC[31]+RC[32]+RC[33]+RC[34]+RC[35]+RC[36]+RC[37] -> 6245340 | G237: =RC[17]+RC[18]++RC[19]+RC[20]+RC[21]+RC[38]+RC[39]+RC[41] -> 0 | H237: 0 | I237: 0 | J237: =RC[-2]+RC[-1] -> 0 | K237: 0 | L237: 680000 | M237: 490245 | N237: =RC[15]+RC[16]+RC[17]+RC[18]+RC[19]+RC[20] -> 491885 | O237: 0 | P237: 0 | Q237: 7907470 | R237: 373520 | S237: 70035 | T237: 46690 | U237: 74172.25 | V237: 0 | W237: 7343052.75 | X237: 0 | Y237: 0 | Z237: 0 | AA237: 0 | AB237: 0 | AC237: 0 | AD237: 0 | AE237: 0 | AF237: 0 | AG237: 0 | AH237: 491885 | AI237: 6245340 | AJ237: 0 | AK237: 0 | AL237: 0 | AM237: 0 | AN237: 0 | AO237: 0 | AP237: 0 | AQ237: 0 | AR237: =1 -> 1 | AS237: 0 | AT237: 0 | AU237: =RC[-30]-RC[-29]-RC[-28]-RC[-27]-RC[-26]-RC[-25] -> 7343052.75 | AV237: 0 | AW237: =RC[1]-RC[2] -> 163961.66700000002 | AX237: 491885 | AY237: 327923.33299999998 | AZ237: =RC[-46] -> 6245340 | BA237: =RC[-46] -> 0 | BB237: =RC[-46] -> 0 | BC237: =RC[-46] -> 0 | BD237: =RC[-46] -> 0 | BE237: =RC[-46] -> 0 | BF237: =RC[-46] -> 680000 | BG237: =RC[-46] -> 490245 | BH237: =RC[-46] -> 491885 | BI237: =RC[-46] -> 0 | BJ237: =RC[-46] -> 0 | BK237: =RC[-46] -> 7907470 | BL237: =RC[-46] -> 373520 | BM237: =RC[-46] -> 70035 | BN237: =RC[-46] -> 46690 | BO237: =RC[-46] -> 74172.25 | BP237: =RC[-46] -> 0 | BQ237: =RC[-46] -> 7343052.75 | BR237: =RC[-46] -> 0 | BS237: =RC[-46] -> 0 | BT237: =RC[-46] -> 0 | BU237: =RC[-46] -> 0 | BV237: =RC[-46] -> 0 | BW237: =RC[-46] -> 0 | BX237: =RC[-46] -> 0 | BY237: =RC[-46] -> 0 | BZ237: =RC[-46] -> 0 | CA237: =RC[-46] -> 0 | CB237: =RC[-46] -> 491885 | CC237: =RC[-46] -> 6245340 | CD237: =RC[-46] -> 0 | CE237: =RC[-46] -> 0 | CF237: =RC[-46] -> 0 | CG237: =RC[-46] -> 0 | CH237: =RC[-46] -> 0 | CI237: =RC[-46] -> 0 | CJ237: =RC[-46] -> 0 | CK237: =RC[-46] -> 0 | CL237: =RC[-46] -> 1 | CM237: =RC[-46] -> 0 | CN237: =RC[-46] -> 0 | CO237: =RC[-46] -> 7343052.75 | CP237: =RC[-46] -> 0 | CQ237: =RC[-46] -> 163961.66700000002 | CR237: =RC[-46] -> 491885 | CS237: =RC[-46] -> 327923.33299999998
A238: 19 | B238: 011140 | C238: Nguyễn Chí Công | D238: NV Lái xe - VHTTB | E238: 19026970121013 | F238: =RC[29]+RC[30]+RC[31]+RC[32]+RC[33]+RC[34]+RC[35]+RC[36]+RC[37] -> 4902884 | G238: =RC[17]+RC[18]++RC[19]+RC[20]+RC[21]+RC[38]+RC[39]+RC[41] -> 0 | H238: 0 | I238: 0 | J238: =RC[-2]+RC[-1] -> 0 | K238: 0 | L238: 680000 | M238: 259613 | N238: =RC[15]+RC[16]+RC[17]+RC[18]+RC[19]+RC[20] -> 260481 | O238: 0 | P238: 0 | Q238: 6102978 | R238: 197800 | S238: 37088 | T238: 24725 | U238: 58433.65 | V238: 0 | W238: 5784931.3499999996 | X238: 0 | Y238: 0 | Z238: 0 | AA238: 0 | AB238: 0 | AC238: 0 | AD238: 0 | AE238: 0 | AF238: 0 | AG238: 0 | AH238: 260481 | AI238: 4902884 | AJ238: 0 | AK238: 0 | AL238: 0 | AM238: 0 | AN238: 0 | AO238: 0 | AP238: 0 | AQ238: 0 | AR238: =1 -> 1 | AS238: 0 | AT238: 0 | AU238: =RC[-30]-RC[-29]-RC[-28]-RC[-27]-RC[-26]-RC[-25] -> 5784931.3499999996 | AV238: 0 | AW238: =RC[1]-RC[2] -> 86827 | AX238: 260481 | AY238: 173654 | AZ238: =RC[-46] -> 4902884 | BA238: =RC[-46] -> 0 | BB238: =RC[-46] -> 0 | BC238: =RC[-46] -> 0 | BD238: =RC[-46] -> 0 | BE238: =RC[-46] -> 0 | BF238: =RC[-46] -> 680000 | BG238: =RC[-46] -> 259613 | BH238: =RC[-46] -> 260481 | BI238: =RC[-46] -> 0 | BJ238: =RC[-46] -> 0 | BK238: =RC[-46] -> 6102978 | BL238: =RC[-46] -> 197800 | BM238: =RC[-46] -> 37088 | BN238: =RC[-46] -> 24725 | BO238: =RC[-46] -> 58433.65 | BP238: =RC[-46] -> 0 | BQ238: =RC[-46] -> 5784931.3499999996 | BR238: =RC[-46] -> 0 | BS238: =RC[-46] -> 0 | BT238: =RC[-46] -> 0 | BU238: =RC[-46] -> 0 | BV238: =RC[-46] -> 0 | BW238: =RC[-46] -> 0 | BX238: =RC[-46] -> 0 | BY238: =RC[-46] -> 0 | BZ238: =RC[-46] -> 0 | CA238: =RC[-46] -> 0 | CB238: =RC[-46] -> 260481 | CC238: =RC[-46] -> 4902884 | CD238: =RC[-46] -> 0 | CE238: =RC[-46] -> 0 | CF238: =RC[-46] -> 0 | CG238: =RC[-46] -> 0 | CH238: =RC[-46] -> 0 | CI238: =RC[-46] -> 0 | CJ238: =RC[-46] -> 0 | CK238: =RC[-46] -> 0 | CL238: =RC[-46] -> 1 | CM238: =RC[-46] -> 0 | CN238: =RC[-46] -> 0 | CO238: =RC[-46] -> 5784931.3499999996 | CP238: =RC[-46] -> 0 | CQ238: =RC[-46] -> 86827 | CR238: =RC[-46] -> 260481 | CS238: =RC[-46] -> 173654
A239: Đội cầu, xe kéo đẩy (HGS) | F239: =SUM(R[-19]C:R[-1]C) -> 127264854 | G239: =SUM(R[-19]C:R[-1]C) -> 0 | H239: =SUM(R[-19]C:R[-1]C) -> 0 | I239: =SUM(R[-19]C:R[-1]C) -> 0 | J239: =SUM(R[-19]C:R[-1]C) -> 0 | K239: =SUM(R[-19]C:R[-1]C) -> 945000 | L239: =SUM(R[-19]C:R[-1]C) -> 12920000 | M239: =SUM(R[-19]C:R[-1]C) -> 8962067 | N239: =SUM(R[-19]C:R[-1]C) -> 7980410 | O239: =SUM(R[-19]C:R[-1]C) -> 0 | P239: =SUM(R[-19]C:R[-1]C) -> 0 | Q239: =SUM(R[-19]C:R[-1]C) -> 158072331 | R239: =SUM(R[-19]C:R[-1]C) -> 6828240 | S239: =SUM(R[-19]C:R[-1]C) -> 1280297 | T239: =SUM(R[-19]C:R[-1]C) -> 853530 | U239: =SUM(R[-19]C:R[-1]C) -> 1485254.0799999998 | V239: =SUM(R[-19]C:R[-1]C) -> 0 | W239: =SUM(R[-19]C:R[-1]C) -> 147625009.91999999 | X239: =SUM(R[-19]C:R[-1]C) -> 0 | Y239: =SUM(R[-19]C:R[-1]C) -> 0 | Z239: =SUM(R[-19]C:R[-1]C) -> 0 | AA239: =SUM(R[-19]C:R[-1]C) -> 0 | AB239: =SUM(R[-19]C:R[-1]C) -> 0 | AC239: =SUM(R[-19]C:R[-1]C) -> 0 | AD239: =SUM(R[-19]C:R[-1]C) -> 0 | AE239: =SUM(R[-19]C:R[-1]C) -> 0 | AF239: =SUM(R[-19]C:R[-1]C) -> 0 | AG239: =SUM(R[-19]C:R[-1]C) -> 0 | AH239: =SUM(R[-19]C:R[-1]C) -> 7980410 | AI239: =SUM(R[-19]C:R[-1]C) -> 127264854 | AJ239: =SUM(R[-19]C:R[-1]C) -> 0 | AK239: =SUM(R[-19]C:R[-1]C) -> 0 | AL239: =SUM(R[-19]C:R[-1]C) -> 0 | AM239: =SUM(R[-19]C:R[-1]C) -> 0 | AN239: =SUM(R[-19]C:R[-1]C) -> 0 | AO239: =SUM(R[-19]C:R[-1]C) -> 0 | AP239: =SUM(R[-19]C:R[-1]C) -> 0 | AQ239: =SUM(R[-19]C:R[-1]C) -> 0 | AR239: =SUM(R[-19]C:R[-1]C) -> 19 | AS239: =SUM(R[-19]C:R[-1]C) -> 0 | AT239: =SUM(R[-19]C:R[-1]C) -> 0 | AU239: =SUM(R[-19]C:R[-1]C) -> 147625009.91999999 | AV239: =SUM(R[-19]C:R[-1]C) -> 0 | AW239: =SUM(R[-19]C:R[-1]C) -> 2660136.6699999995 | AX239: =SUM(R[-19]C:R[-1]C) -> 7980410 | AY239: =SUM(R[-19]C:R[-1]C) -> 5320273.3299999991
A240: Đội phục vụ hành lý hàng hóa (HGS) | F240: =R[126]C -> 576765887 | G240: =R[126]C -> 3036923 | H240: =R[126]C -> 0 | I240: =R[126]C -> 0 | J240: =R[126]C -> 0 | K240: =R[126]C -> 1995000 | L240: =R[126]C -> 83875385 | M240: =R[126]C -> 29860312 | N240: =R[126]C -> 26009311 | O240: =R[126]C -> 0 | P240: =R[126]C -> 0 | Q240: =R[126]C -> 721542818 | R240: =R[126]C -> 22750680 | S240: =R[126]C -> 4265797 | T240: =R[126]C -> 2843835 | U240: =R[126]C -> 6916825.0599999987 | V240: =R[126]C -> 0 | W240: =R[126]C -> 684765680.94000006 | X240: =R[126]C -> 0 | Y240: =R[126]C -> 3036923 | Z240: =R[126]C -> 0 | AA240: =R[126]C -> 0 | AB240: =R[126]C -> 0 | AC240: =R[126]C -> 0 | AD240: =R[126]C -> 0 | AE240: =R[126]C -> 0 | AF240: =R[126]C -> 0 | AG240: =R[126]C -> 0 | AH240: =R[126]C -> 26009311 | AI240: =R[126]C -> 576765887 | AJ240: =R[126]C -> 0 | AK240: =R[126]C -> 0 | AL240: =R[126]C -> 0 | AM240: =R[126]C -> 0 | AN240: =R[126]C -> 0 | AO240: =R[126]C -> 0 | AP240: =R[126]C -> 0 | AQ240: =R[126]C -> 0 | AR240: =R[126]C -> 125 | AS240: =R[126]C -> 0 | AT240: =R[126]C -> 0 | AU240: =R[126]C -> 684765680.94000006 | AW240: =R[126]C -> 8669770.3289999962 | AX240: =R[126]C -> 26009311 | AY240: =R[126]C -> 17339540.670999993
A241: 1 | B241: 010685 | C241: Hà Minh Trí | D241: Đội trưởng | E241: 10520003643011 | F241: =RC[29]+RC[30]+RC[31]+RC[32]+RC[33]+RC[34]+RC[35]+RC[36]+RC[37] -> 9980870 | G241: =RC[17]+RC[18]++RC[19]+RC[20]+RC[21]+RC[38]+RC[39]+RC[41] -> 0 | H241: 0 | I241: 0 | J241: =RC[-2]+RC[-1] -> 0 | K241: 315000 | L241: 680000 | M241: 489038 | N241: =RC[15]+RC[16]+RC[17]+RC[18]+RC[19]+RC[20] -> 0 | O241: 0 | P241: 0 | Q241: 11464908 | R241: 372600 | S241: 69863 | T241: 46575 | U241: 109758.7 | V241: 0 | W241: 10866111.300000001 | X241: 0 | Y241: 0 | Z241: 0 | AA241: 0 | AB241: 0 | AC241: 0 | AD241: 0 | AE241: 0 | AF241: 0 | AG241: 0 | AH241: 0 | AI241: 9980870 | AJ241: 0 | AK241: 0 | AL241: 0 | AM241: 0 | AN241: 0 | AO241: 0 | AP241: 0 | AQ241: 0 | AR241: =1 -> 1 | AS241: 0 | AT241: 0 | AU241: =RC[-30]-RC[-29]-RC[-28]-RC[-27]-RC[-26]-RC[-25] -> 10866111.300000001 | AV241: 0 | AW241: =RC[1]-RC[2] -> 0 | AX241: 0 | AY241: 0 | AZ241: =RC[-46] -> 9980870 | BA241: =RC[-46] -> 0 | BB241: =RC[-46] -> 0 | BC241: =RC[-46] -> 0 | BD241: =RC[-46] -> 0 | BE241: =RC[-46] -> 315000 | BF241: =RC[-46] -> 680000 | BG241: =RC[-46] -> 489038 | BH241: =RC[-46] -> 0 | BI241: =RC[-46] -> 0 | BJ241: =RC[-46] -> 0 | BK241: =RC[-46] -> 11464908 | BL241: =RC[-46] -> 372600 | BM241: =RC[-46] -> 69863 | BN241: =RC[-46] -> 46575 | BO241: =RC[-46] -> 109758.7 | BP241: =RC[-46] -> 0 | BQ241: =RC[-46] -> 10866111.300000001 | BR241: =RC[-46] -> 0 | BS241: =RC[-46] -> 0 | BT241: =RC[-46] -> 0 | BU241: =RC[-46] -> 0 | BV241: =RC[-46] -> 0 | BW241: =RC[-46] -> 0 | BX241: =RC[-46] -> 0 | BY241: =RC[-46] -> 0 | BZ241: =RC[-46] -> 0 | CA241: =RC[-46] -> 0 | CB241: =RC[-46] -> 0 | CC241: =RC[-46] -> 9980870 | CD241: =RC[-46] -> 0 | CE241: =RC[-46] -> 0 | CF241: =RC[-46] -> 0 | CG241: =RC[-46] -> 0 | CH241: =RC[-46] -> 0 | CI241: =RC[-46] -> 0 | CJ241: =RC[-46] -> 0 | CK241: =RC[-46] -> 0 | CL241: =RC[-46] -> 1 | CM241: =RC[-46] -> 0 | CN241: =RC[-46] -> 0 | CO241: =RC[-46] -> 10866111.300000001 | CP241: =RC[-46] -> 0 | CQ241: =RC[-46] -> 0 | CR241: =RC[-46] -> 0 | CS241: =RC[-46] -> 0
A242: 2 | B242: 010709 | C242: Lê Hữu Thịnh | D242: Đội phó | E242: 10520003340017 | F242: =RC[29]+RC[30]+RC[31]+RC[32]+RC[33]+RC[34]+RC[35]+RC[36]+RC[37] -> 9067416 | G242: =RC[17]+RC[18]++RC[19]+RC[20]+RC[21]+RC[38]+RC[39]+RC[41] -> 0 | H242: 0 | I242: 0 | J242: =RC[-2]+RC[-1] -> 0 | K242: 210000 | L242: 680000 | M242: 452813 | N242: =RC[15]+RC[16]+RC[17]+RC[18]+RC[19]+RC[20] -> 0 | O242: 0 | P242: 0 | Q242: 10410229 | R242: 345000 | S242: 64688 | T242: 43125 | U242: 99574.16 | V242: 0 | W242: 9857841.8399999999 | X242: 0 | Y242: 0 | Z242: 0 | AA242: 0 | AB242: 0 | AC242: 0 | AD242: 0 | AE242: 0 | AF242: 0 | AG242: 0 | AH242: 0 | AI242: 9067416 | AJ242: 0 | AK242: 0 | AL242: 0 | AM242: 0 | AN242: 0 | AO242: 0 | AP242: 0 | AQ242: 0 | AR242: =1 -> 1 | AS242: 0 | AT242: 0 | AU242: =RC[-30]-RC[-29]-RC[-28]-RC[-27]-RC[-26]-RC[-25] -> 9857841.8399999999 | AV242: 0 | AW242: =RC[1]-RC[2] -> 0 | AX242: 0 | AY242: 0 | AZ242: =RC[-46] -> 9067416 | BA242: =RC[-46] -> 0 | BB242: =RC[-46] -> 0 | BC242: =RC[-46] -> 0 | BD242: =RC[-46] -> 0 | BE242: =RC[-46] -> 210000 | BF242: =RC[-46] -> 680000 | BG242: =RC[-46] -> 452813 | BH242: =RC[-46] -> 0 | BI242: =RC[-46] -> 0 | BJ242: =RC[-46] -> 0 | BK242: =RC[-46] -> 10410229 | BL242: =RC[-46] -> 345000 | BM242: =RC[-46] -> 64688 | BN242: =RC[-46] -> 43125 | BO242: =RC[-46] -> 99574.16 | BP242: =RC[-46] -> 0 | BQ242: =RC[-46] -> 9857841.8399999999 | BR242: =RC[-46] -> 0 | BS242: =RC[-46] -> 0 | BT242: =RC[-46] -> 0 | BU242: =RC[-46] -> 0 | BV242: =RC[-46] -> 0 | BW242: =RC[-46] -> 0 | BX242: =RC[-46] -> 0 | BY242: =RC[-46] -> 0 | BZ242: =RC[-46] -> 0 | CA242: =RC[-46] -> 0 | CB242: =RC[-46] -> 0 | CC242: =RC[-46] -> 9067416 | CD242: =RC[-46] -> 0 | CE242: =RC[-46] -> 0 | CF242: =RC[-46] -> 0 | CG242: =RC[-46] -> 0 | CH242: =RC[-46] -> 0 | CI242: =RC[-46] -> 0 | CJ242: =RC[-46] -> 0 | CK242: =RC[-46] -> 0 | CL242: =RC[-46] -> 1 | CM242: =RC[-46] -> 0 | CN242: =RC[-46] -> 0 | CO242: =RC[-46] -> 9857841.8399999999 | CP242: =RC[-46] -> 0 | CQ242: =RC[-46] -> 0 | CR242: =RC[-46] -> 0 | CS242: =RC[-46] -> 0
A243: 3 | B243: 010715 | C243: Trần Văn Lộc | D243: Đội phó | E243: 10522162660017 | F243: =RC[29]+RC[30]+RC[31]+RC[32]+RC[33]+RC[34]+RC[35]+RC[36]+RC[37] -> 9543113 | G243: =RC[17]+RC[18]++RC[19]+RC[20]+RC[21]+RC[38]+RC[39]+RC[41] -> 0 | H243: 0 | I243: 0 | J243: =RC[-2]+RC[-1] -> 0 | K243: 210000 | L243: 680000 | M243: 452813 | N243: =RC[15]+RC[16]+RC[17]+RC[18]+RC[19]+RC[20] -> 0 | O243: 0 | P243: 0 | Q243: 10885926 | R243: 345000 | S243: 64688 | T243: 43125 | U243: 104331.13 | V243: 0 | W243: 10328781.869999999 | X243: 0 | Y243: 0 | Z243: 0 | AA243: 0 | AB243: 0 | AC243: 0 | AD243: 0 | AE243: 0 | AF243: 0 | AG243: 0 | AH243: 0 | AI243: 9543113 | AJ243: 0 | AK243: 0 | AL243: 0 | AM243: 0 | AN243: 0 | AO243: 0 | AP243: 0 | AQ243: 0 | AR243: =1 -> 1 | AS243: 0 | AT243: 0 | AU243: =RC[-30]-RC[-29]-RC[-28]-RC[-27]-RC[-26]-RC[-25] -> 10328781.869999999 | AV243: 0 | AW243: =RC[1]-RC[2] -> 0 | AX243: 0 | AY243: 0 | AZ243: =RC[-46] -> 9543113 | BA243: =RC[-46] -> 0 | BB243: =RC[-46] -> 0 | BC243: =RC[-46] -> 0 | BD243: =RC[-46] -> 0 | BE243: =RC[-46] -> 210000 | BF243: =RC[-46] -> 680000 | BG243: =RC[-46] -> 452813 | BH243: =RC[-46] -> 0 | BI243: =RC[-46] -> 0 | BJ243: =RC[-46] -> 0 | BK243: =RC[-46] -> 10885926 | BL243: =RC[-46] -> 345000 | BM243: =RC[-46] -> 64688 | BN243: =RC[-46] -> 43125 | BO243: =RC[-46] -> 104331.13 | BP243: =RC[-46] -> 0 | BQ243: =RC[-46] -> 10328781.869999999 | BR243: =RC[-46] -> 0 | BS243: =RC[-46] -> 0 | BT243: =RC[-46] -> 0 | BU243: =RC[-46] -> 0 | BV243: =RC[-46] -> 0 | BW243: =RC[-46] -> 0 | BX243: =RC[-46] -> 0 | BY243: =RC[-46] -> 0 | BZ243: =RC[-46] -> 0 | CA243: =RC[-46] -> 0 | CB243: =RC[-46] -> 0 | CC243: =RC[-46] -> 9543113 | CD243: =RC[-46] -> 0 | CE243: =RC[-46] -> 0 | CF243: =RC[-46] -> 0 | CG243: =RC[-46] -> 0 | CH243: =RC[-46] -> 0 | CI243: =RC[-46] -> 0 | CJ243: =RC[-46] -> 0 | CK243: =RC[-46] -> 0 | CL243: =RC[-46] -> 1 | CM243: =RC[-46] -> 0 | CN243: =RC[-46] -> 0 | CO243: =RC[-46] -> 10328781.869999999 | CP243: =RC[-46] -> 0 | CQ243: =RC[-46] -> 0 | CR243: =RC[-46] -> 0 | CS243: =RC[-46] -> 0
A244: 4 | B244: 010734 | C244: Trần Duy Hải | D244: Đội phó | E244: 10522162673011 | F244: =RC[29]+RC[30]+RC[31]+RC[32]+RC[33]+RC[34]+RC[35]+RC[36]+RC[37] -> 9543113 | G244: =RC[17]+RC[18]++RC[19]+RC[20]+RC[21]+RC[38]+RC[39]+RC[41] -> 0 | H244: 0 | I244: 0 | J244: =RC[-2]+RC[-1] -> 0 | K244: 210000 | L244: 680000 | M244: 342930 | N244: =RC[15]+RC[16]+RC[17]+RC[18]+RC[19]+RC[20] -> 0 | O244: 0 | P244: 0 | Q244: 10776043 | R244: 261280 | S244: 48990 | T244: 32660 | U244: 104331.13 | V244: 0 | W244: 10328781.869999999 | X244: 0 | Y244: 0 | Z244: 0 | AA244: 0 | AB244: 0 | AC244: 0 | AD244: 0 | AE244: 0 | AF244: 0 | AG244: 0 | AH244: 0 | AI244: 9543113 | AJ244: 0 | AK244: 0 | AL244: 0 | AM244: 0 | AN244: 0 | AO244: 0 | AP244: 0 | AQ244: 0 | AR244: =1 -> 1 | AS244: 0 | AT244: 0 | AU244: =RC[-30]-RC[-29]-RC[-28]-RC[-27]-RC[-26]-RC[-25] -> 10328781.869999999 | AV244: 0 | AW244: =RC[1]-RC[2] -> 0 | AX244: 0 | AY244: 0 | AZ244: =RC[-46] -> 9543113 | BA244: =RC[-46] -> 0 | BB244: =RC[-46] -> 0 | BC244: =RC[-46] -> 0 | BD244: =RC[-46] -> 0 | BE244: =RC[-46] -> 210000 | BF244: =RC[-46] -> 680000 | BG244: =RC[-46] -> 342930 | BH244: =RC[-46] -> 0 | BI244: =RC[-46] -> 0 | BJ244: =RC[-46] -> 0 | BK244: =RC[-46] -> 10776043 | BL244: =RC[-46] -> 261280 | BM244: =RC[-46] -> 48990 | BN244: =RC[-46] -> 32660 | BO244: =RC[-46] -> 104331.13 | BP244: =RC[-46] -> 0 | BQ244: =RC[-46] -> 10328781.869999999 | BR244: =RC[-46] -> 0 | BS244: =RC[-46] -> 0 | BT244: =RC[-46] -> 0 | BU244: =RC[-46] -> 0 | BV244: =RC[-46] -> 0 | BW244: =RC[-46] -> 0 | BX244: =RC[-46] -> 0 | BY244: =RC[-46] -> 0 | BZ244: =RC[-46] -> 0 | CA244: =RC[-46] -> 0 | CB244: =RC[-46] -> 0 | CC244: =RC[-46] -> 9543113 | CD244: =RC[-46] -> 0 | CE244: =RC[-46] -> 0 | CF244: =RC[-46] -> 0 | CG244: =RC[-46] -> 0 | CH244: =RC[-46] -> 0 | CI244: =RC[-46] -> 0 | CJ244: =RC[-46] -> 0 | CK244: =RC[-46] -> 0 | CL244: =RC[-46] -> 1 | CM244: =RC[-46] -> 0 | CN244: =RC[-46] -> 0 | CO244: =RC[-46] -> 10328781.869999999 | CP244: =RC[-46] -> 0 | CQ244: =RC[-46] -> 0 | CR244: =RC[-46] -> 0 | CS244: =RC[-46] -> 0
A245: 5 | B245: 010646 | C245: Lê Ngọc Cường | D245: Nhân viên Bốc xếp | E245: 10522162940011 | F245: =RC[29]+RC[30]+RC[31]+RC[32]+RC[33]+RC[34]+RC[35]+RC[36]+RC[37] -> 4657739 | G245: =RC[17]+RC[18]++RC[19]+RC[20]+RC[21]+RC[38]+RC[39]+RC[41] -> 0 | H245: 0 | I245: 0 | J245: =RC[-2]+RC[-1] -> 0 | K245: 0 | L245: 680000 | M245: 298253 | N245: =RC[15]+RC[16]+RC[17]+RC[18]+RC[19]+RC[20] -> 299250 | O245: 0 | P245: 0 | Q245: 5935242 | R245: 227240 | S245: 42608 | T245: 28405 | U245: 56369.89 | V245: 0 | W245: 5580619.1100000003 | X245: 0 | Y245: 0 | Z245: 0 | AA245: 0 | AB245: 0 | AC245: 0 | AD245: 0 | AE245: 0 | AF245: 0 | AG245: 0 | AH245: 299250 | AI245: 4657739 | AJ245: 0 | AK245: 0 | AL245: 0 | AM245: 0 | AN245: 0 | AO245: 0 | AP245: 0 | AQ245: 0 | AR245: =1 -> 1 | AS245: 0 | AT245: 0 | AU245: =RC[-30]-RC[-29]-RC[-28]-RC[-27]-RC[-26]-RC[-25] -> 5580619.1100000003 | AV245: 0 | AW245: =RC[1]-RC[2] -> 99750 | AX245: 299250 | AY245: 199500 | AZ245: =RC[-46] -> 4657739 | BA245: =RC[-46] -> 0 | BB245: =RC[-46] -> 0 | BC245: =RC[-46] -> 0 | BD245: =RC[-46] -> 0 | BE245: =RC[-46] -> 0 | BF245: =RC[-46] -> 680000 | BG245: =RC[-46] -> 298253 | BH245: =RC[-46] -> 299250 | BI245: =RC[-46] -> 0 | BJ245: =RC[-46] -> 0 | BK245: =RC[-46] -> 5935242 | BL245: =RC[-46] -> 227240 | BM245: =RC[-46] -> 42608 | BN245: =RC[-46] -> 28405 | BO245: =RC[-46] -> 56369.89 | BP245: =RC[-46] -> 0 | BQ245: =RC[-46] -> 5580619.1100000003 | BR245: =RC[-46] -> 0 | BS245: =RC[-46] -> 0 | BT245: =RC[-46] -> 0 | BU245: =RC[-46] -> 0 | BV245: =RC[-46] -> 0 | BW245: =RC[-46] -> 0 | BX245: =RC[-46] -> 0 | BY245: =RC[-46] -> 0 | BZ245: =RC[-46] -> 0 | CA245: =RC[-46] -> 0 | CB245: =RC[-46] -> 299250 | CC245: =RC[-46] -> 4657739 | CD245: =RC[-46] -> 0 | CE245: =RC[-46] -> 0 | CF245: =RC[-46] -> 0 | CG245: =RC[-46] -> 0 | CH245: =RC[-46] -> 0 | CI245: =RC[-46] -> 0 | CJ245: =RC[-46] -> 0 | CK245: =RC[-46] -> 0 | CL245: =RC[-46] -> 1 | CM245: =RC[-46] -> 0 | CN245: =RC[-46] -> 0 | CO245: =RC[-46] -> 5580619.1100000003 | CP245: =RC[-46] -> 0 | CQ245: =RC[-46] -> 99750 | CR245: =RC[-46] -> 299250 | CS245: =RC[-46] -> 199500
A246: 6 | B246: 010647 | C246: Nguyễn Tiến Anh | D246: Nhân viên Bốc xếp | E246: 19025652321015 | F246: =RC[29]+RC[30]+RC[31]+RC[32]+RC[33]+RC[34]+RC[35]+RC[36]+RC[37] -> 4377575 | G246: =RC[17]+RC[18]++RC[19]+RC[20]+RC[21]+RC[38]+RC[39]+RC[41] -> 0 | H246: 0 | I246: 0 | J246: =RC[-2]+RC[-1] -> 0 | K246: 0 | L246: 680000 | M246: 235463 | N246: =RC[15]+RC[16]+RC[17]+RC[18]+RC[19]+RC[20] -> 236250 | O246: 0 | P246: 0 | Q246: 5529288 | R246: 179400 | S246: 33638 | T246: 22425 | U246: 52938.25 | V246: 0 | W246: 5240886.75 | X246: 0 | Y246: 0 | Z246: 0 | AA246: 0 | AB246: 0 | AC246: 0 | AD246: 0 | AE246: 0 | AF246: 0 | AG246: 0 | AH246: 236250 | AI246: 4377575 | AJ246: 0 | AK246: 0 | AL246: 0 | AM246: 0 | AN246: 0 | AO246: 0 | AP246: 0 | AQ246: 0 | AR246: =1 -> 1 | AS246: 0 | AT246: 0 | AU246: =RC[-30]-RC[-29]-RC[-28]-RC[-27]-RC[-26]-RC[-25] -> 5240886.75 | AV246: 0 | AW246: =RC[1]-RC[2] -> 78750 | AX246: 236250 | AY246: 157500 | AZ246: =RC[-46] -> 4377575 | BA246: =RC[-46] -> 0 | BB246: =RC[-46] -> 0 | BC246: =RC[-46] -> 0 | BD246: =RC[-46] -> 0 | BE246: =RC[-46] -> 0 | BF246: =RC[-46] -> 680000 | BG246: =RC[-46] -> 235463 | BH246: =RC[-46] -> 236250 | BI246: =RC[-46] -> 0 | BJ246: =RC[-46] -> 0 | BK246: =RC[-46] -> 5529288 | BL246: =RC[-46] -> 179400 | BM246: =RC[-46] -> 33638 | BN246: =RC[-46] -> 22425 | BO246: =RC[-46] -> 52938.25 | BP246: =RC[-46] -> 0 | BQ246: =RC[-46] -> 5240886.75 | BR246: =RC[-46] -> 0 | BS246: =RC[-46] -> 0 | BT246: =RC[-46] -> 0 | BU246: =RC[-46] -> 0 | BV246: =RC[-46] -> 0 | BW246: =RC[-46] -> 0 | BX246: =RC[-46] -> 0 | BY246: =RC[-46] -> 0 | BZ246: =RC[-46] -> 0 | CA246: =RC[-46] -> 0 | CB246: =RC[-46] -> 236250 | CC246: =RC[-46] -> 4377575 | CD246: =RC[-46] -> 0 | CE246: =RC[-46] -> 0 | CF246: =RC[-46] -> 0 | CG246: =RC[-46] -> 0 | CH246: =RC[-46] -> 0 | CI246: =RC[-46] -> 0 | CJ246: =RC[-46] -> 0 | CK246: =RC[-46] -> 0 | CL246: =RC[-46] -> 1 | CM246: =RC[-46] -> 0 | CN246: =RC[-46] -> 0 | CO246: =RC[-46] -> 5240886.75 | CP246: =RC[-46] -> 0 | CQ246: =RC[-46] -> 78750 | CR246: =RC[-46] -> 236250 | CS246: =RC[-46] -> 157500
A247: 7 | B247: 010648 | C247: Phạm Minh Thành | D247: Nhân viên Bốc xếp | E247: 11623063628017 | F247: =RC[29]+RC[30]+RC[31]+RC[32]+RC[33]+RC[34]+RC[35]+RC[36]+RC[37] -> 4640229 | G247: =RC[17]+RC[18]++RC[19]+RC[20]+RC[21]+RC[38]+RC[39]+RC[41] -> 0 | H247: 0 | I247: 0 | J247: =RC[-2]+RC[-1] -> 0 | K247: 0 | L247: 680000 | M247: 235463 | N247: =RC[15]+RC[16]+RC[17]+RC[18]+RC[19]+RC[20] -> 236250 | O247: 0 | P247: 0 | Q247: 5791942 | R247: 179400 | S247: 33638 | T247: 22425 | U247: 55564.79 | V247: 0 | W247: 5500914.21 | X247: 0 | Y247: 0 | Z247: 0 | AA247: 0 | AB247: 0 | AC247: 0 | AD247: 0 | AE247: 0 | AF247: 0 | AG247: 0 | AH247: 236250 | AI247: 4640229 | AJ247: 0 | AK247: 0 | AL247: 0 | AM247: 0 | AN247: 0 | AO247: 0 | AP247: 0 | AQ247: 0 | AR247: =1 -> 1 | AS247: 0 | AT247: 0 | AU247: =RC[-30]-RC[-29]-RC[-28]-RC[-27]-RC[-26]-RC[-25] -> 5500914.21 | AV247: 0 | AW247: =RC[1]-RC[2] -> 78750 | AX247: 236250 | AY247: 157500 | AZ247: =RC[-46] -> 4640229 | BA247: =RC[-46] -> 0 | BB247: =RC[-46] -> 0 | BC247: =RC[-46] -> 0 | BD247: =RC[-46] -> 0 | BE247: =RC[-46] -> 0 | BF247: =RC[-46] -> 680000 | BG247: =RC[-46] -> 235463 | BH247: =RC[-46] -> 236250 | BI247: =RC[-46] -> 0 | BJ247: =RC[-46] -> 0 | BK247: =RC[-46] -> 5791942 | BL247: =RC[-46] -> 179400 | BM247: =RC[-46] -> 33638 | BN247: =RC[-46] -> 22425 | BO247: =RC[-46] -> 55564.79 | BP247: =RC[-46] -> 0 | BQ247: =RC[-46] -> 5500914.21 | BR247: =RC[-46] -> 0 | BS247: =RC[-46] -> 0 | BT247: =RC[-46] -> 0 | BU247: =RC[-46] -> 0 | BV247: =RC[-46] -> 0 | BW247: =RC[-46] -> 0 | BX247: =RC[-46] -> 0 | BY247: =RC[-46] -> 0 | BZ247: =RC[-46] -> 0 | CA247: =RC[-46] -> 0 | CB247: =RC[-46] -> 236250 | CC247: =RC[-46] -> 4640229 | CD247: =RC[-46] -> 0 | CE247: =RC[-46] -> 0 | CF247: =RC[-46] -> 0 | CG247: =RC[-46] -> 0 | CH247: =RC[-46] -> 0 | CI247: =RC[-46] -> 0 | CJ247: =RC[-46] -> 0 | CK247: =RC[-46] -> 0 | CL247: =RC[-46] -> 1 | CM247: =RC[-46] -> 0 | CN247: =RC[-46] -> 0 | CO247: =RC[-46] -> 5500914.21 | CP247: =RC[-46] -> 0 | CQ247: =RC[-46] -> 78750 | CR247: =RC[-46] -> 236250 | CS247: =RC[-46] -> 157500
A248: 8 | B248: 010649 | C248: Vũ Minh Tú | D248: Nhân viên Bốc xếp | E248: 10524470154011 | F248: =RC[29]+RC[30]+RC[31]+RC[32]+RC[33]+RC[34]+RC[35]+RC[36]+RC[37] -> 4640229 | G248: =RC[17]+RC[18]++RC[19]+RC[20]+RC[21]+RC[38]+RC[39]+RC[41] -> 0 | H248: 0 | I248: 0 | J248: =RC[-2]+RC[-1] -> 0 | K248: 0 | L248: 680000 | M248: 235463 | N248: =RC[15]+RC[16]+RC[17]+RC[18]+RC[19]+RC[20] -> 236250 | O248: 0 | P248: 0 | Q248: 5791942 | R248: 179400 | S248: 33638 | T248: 22425 | U248: 55564.79 | V248: 0 | W248: 5500914.21 | X248: 0 | Y248: 0 | Z248: 0 | AA248: 0 | AB248: 0 | AC248: 0 | AD248: 0 | AE248: 0 | AF248: 0 | AG248: 0 | AH248: 236250 | AI248: 4640229 | AJ248: 0 | AK248: 0 | AL248: 0 | AM248: 0 | AN248: 0 | AO248: 0 | AP248: 0 | AQ248: 0 | AR248: =1 -> 1 | AS248: 0 | AT248: 0 | AU248: =RC[-30]-RC[-29]-RC[-28]-RC[-27]-RC[-26]-RC[-25] -> 5500914.21 | AV248: 0 | AW248: =RC[1]-RC[2] -> 78750 | AX248: 236250 | AY248: 157500 | AZ248: =RC[-46] -> 4640229 | BA248: =RC[-46] -> 0 | BB248: =RC[-46] -> 0 | BC248: =RC[-46] -> 0 | BD248: =RC[-46] -> 0 | BE248: =RC[-46] -> 0 | BF248: =RC[-46] -> 680000 | BG248: =RC[-46] -> 235463 | BH248: =RC[-46] -> 236250 | BI248: =RC[-46] -> 0 | BJ248: =RC[-46] -> 0 | BK248: =RC[-46] -> 5791942 | BL248: =RC[-46] -> 179400 | BM248: =RC[-46] -> 33638 | BN248: =RC[-46] -> 22425 | BO248: =RC[-46] -> 55564.79 | BP248: =RC[-46] -> 0 | BQ248: =RC[-46] -> 5500914.21 | BR248: =RC[-46] -> 0 | BS248: =RC[-46] -> 0 | BT248: =RC[-46] -> 0 | BU248: =RC[-46] -> 0 | BV248: =RC[-46] -> 0 | BW248: =RC[-46] -> 0 | BX248: =RC[-46] -> 0 | BY248: =RC[-46] -> 0 | BZ248: =RC[-46] -> 0 | CA248: =RC[-46] -> 0 | CB248: =RC[-46] -> 236250 | CC248: =RC[-46] -> 4640229 | CD248: =RC[-46] -> 0 | CE248: =RC[-46] -> 0 | CF248: =RC[-46] -> 0 | CG248: =RC[-46] -> 0 | CH248: =RC[-46] -> 0 | CI248: =RC[-46] -> 0 | CJ248: =RC[-46] -> 0 | CK248: =RC[-46] -> 0 | CL248: =RC[-46] -> 1 | CM248: =RC[-46] -> 0 | CN248: =RC[-46] -> 0 | CO248: =RC[-46] -> 5500914.21 | CP248: =RC[-46] -> 0 | CQ248: =RC[-46] -> 78750 | CR248: =RC[-46] -> 236250 | CS248: =RC[-46] -> 157500
A249: 9 | B249: 010650 | C249: Ngô Ngọc Hảo | D249: Nhân viên Bốc xếp | E249: 10524470150014 | F249: =RC[29]+RC[30]+RC[31]+RC[32]+RC[33]+RC[34]+RC[35]+RC[36]+RC[37] -> 4873700 | G249: =RC[17]+RC[18]++RC[19]+RC[20]+RC[21]+RC[38]+RC[39]+RC[41] -> 0 | H249: 0 | I249: 0 | J249: =RC[-2]+RC[-1] -> 0 | K249: 0 | L249: 680000 | M249: 235463 | N249: =RC[15]+RC[16]+RC[17]+RC[18]+RC[19]+RC[20] -> 236250 | O249: 0 | P249: 0 | Q249: 6025413 | R249: 179400 | S249: 33638 | T249: 22425 | U249: 57899.5 | V249: 0 | W249: 5732050.5 | X249: 0 | Y249: 0 | Z249: 0 | AA249: 0 | AB249: 0 | AC249: 0 | AD249: 0 | AE249: 0 | AF249: 0 | AG249: 0 | AH249: 236250 | AI249: 4873700 | AJ249: 0 | AK249: 0 | AL249: 0 | AM249: 0 | AN249: 0 | AO249: 0 | AP249: 0 | AQ249: 0 | AR249: =1 -> 1 | AS249: 0 | AT249: 0 | AU249: =RC[-30]-RC[-29]-RC[-28]-RC[-27]-RC[-26]-RC[-25] -> 5732050.5 | AV249: 0 | AW249: =RC[1]-RC[2] -> 78750 | AX249: 236250 | AY249: 157500 | AZ249: =RC[-46] -> 4873700 | BA249: =RC[-46] -> 0 | BB249: =RC[-46] -> 0 | BC249: =RC[-46] -> 0 | BD249: =RC[-46] -> 0 | BE249: =RC[-46] -> 0 | BF249: =RC[-46] -> 680000 | BG249: =RC[-46] -> 235463 | BH249: =RC[-46] -> 236250 | BI249: =RC[-46] -> 0 | BJ249: =RC[-46] -> 0 | BK249: =RC[-46] -> 6025413 | BL249: =RC[-46] -> 179400 | BM249: =RC[-46] -> 33638 | BN249: =RC[-46] -> 22425 | BO249: =RC[-46] -> 57899.5 | BP249: =RC[-46] -> 0 | BQ249: =RC[-46] -> 5732050.5 | BR249: =RC[-46] -> 0 | BS249: =RC[-46] -> 0 | BT249: =RC[-46] -> 0 | BU249: =RC[-46] -> 0 | BV249: =RC[-46] -> 0 | BW249: =RC[-46] -> 0 | BX249: =RC[-46] -> 0 | BY249: =RC[-46] -> 0 | BZ249: =RC[-46] -> 0 | CA249: =RC[-46] -> 0 | CB249: =RC[-46] -> 236250 | CC249: =RC[-46] -> 4873700 | CD249: =RC[-46] -> 0 | CE249: =RC[-46] -> 0 | CF249: =RC[-46] -> 0 | CG249: =RC[-46] -> 0 | CH249: =RC[-46] -> 0 | CI249: =RC[-46] -> 0 | CJ249: =RC[-46] -> 0 | CK249: =RC[-46] -> 0 | CL249: =RC[-46] -> 1 | CM249: =RC[-46] -> 0 | CN249: =RC[-46] -> 0 | CO249: =RC[-46] -> 5732050.5 | CP249: =RC[-46] -> 0 | CQ249: =RC[-46] -> 78750 | CR249: =RC[-46] -> 236250 | CS249: =RC[-46] -> 157500
A250: 10 | B250: 010651 | C250: Đỗ Văn Chính | D250: Nhân viên Bốc xếp | E250: 10525139402018 | F250: =RC[29]+RC[30]+RC[31]+RC[32]+RC[33]+RC[34]+RC[35]+RC[36]+RC[37] -> 4377575 | G250: =RC[17]+RC[18]++RC[19]+RC[20]+RC[21]+RC[38]+RC[39]+RC[41] -> 0 | H250: 0 | I250: 0 | J250: =RC[-2]+RC[-1] -> 0 | K250: 0 | L250: 680000 | M250: 235463 | N250: =RC[15]+RC[16]+RC[17]+RC[18]+RC[19]+RC[20] -> 236250 | O250: 0 | P250: 0 | Q250: 5529288 | R250: 179400 | S250: 33638 | T250: 22425 | U250: 52938.25 | V250: 0 | W250: 5240886.75 | X250: 0 | Y250: 0 | Z250: 0 | AA250: 0 | AB250: 0 | AC250: 0 | AD250: 0 | AE250: 0 | AF250: 0 | AG250: 0 | AH250: 236250 | AI250: 4377575 | AJ250: 0 | AK250: 0 | AL250: 0 | AM250: 0 | AN250: 0 | AO250: 0 | AP250: 0 | AQ250: 0 | AR250: =1 -> 1 | AS250: 0 | AT250: 0 | AU250: =RC[-30]-RC[-29]-RC[-28]-RC[-27]-RC[-26]-RC[-25] -> 5240886.75 | AV250: 0 | AW250: =RC[1]-RC[2] -> 78750 | AX250: 236250 | AY250: 157500 | AZ250: =RC[-46] -> 4377575 | BA250: =RC[-46] -> 0 | BB250: =RC[-46] -> 0 | BC250: =RC[-46] -> 0 | BD250: =RC[-46] -> 0 | BE250: =RC[-46] -> 0 | BF250: =RC[-46] -> 680000 | BG250: =RC[-46] -> 235463 | BH250: =RC[-46] -> 236250 | BI250: =RC[-46] -> 0 | BJ250: =RC[-46] -> 0 | BK250: =RC[-46] -> 5529288 | BL250: =RC[-46] -> 179400 | BM250: =RC[-46] -> 33638 | BN250: =RC[-46] -> 22425 | BO250: =RC[-46] -> 52938.25 | BP250: =RC[-46] -> 0 | BQ250: =RC[-46] -> 5240886.75 | BR250: =RC[-46] -> 0 | BS250: =RC[-46] -> 0 | BT250: =RC[-46] -> 0 | BU250: =RC[-46] -> 0 | BV250: =RC[-46] -> 0 | BW250: =RC[-46] -> 0 | BX250: =RC[-46] -> 0 | BY250: =RC[-46] -> 0 | BZ250: =RC[-46] -> 0 | CA250: =RC[-46] -> 0 | CB250: =RC[-46] -> 236250 | CC250: =RC[-46] -> 4377575 | CD250: =RC[-46] -> 0 | CE250: =RC[-46] -> 0 | CF250: =RC[-46] -> 0 | CG250: =RC[-46] -> 0 | CH250: =RC[-46] -> 0 | CI250: =RC[-46] -> 0 | CJ250: =RC[-46] -> 0 | CK250: =RC[-46] -> 0 | CL250: =RC[-46] -> 1 | CM250: =RC[-46] -> 0 | CN250: =RC[-46] -> 0 | CO250: =RC[-46] -> 5240886.75 | CP250: =RC[-46] -> 0 | CQ250: =RC[-46] -> 78750 | CR250: =RC[-46] -> 236250 | CS250: =RC[-46] -> 157500
A251: 11 | B251: 010652 | C251: Trương Văn Triệu | D251: Nhân viên Bốc xếp | E251: 10524577010010 | F251: =RC[29]+RC[30]+RC[31]+RC[32]+RC[33]+RC[34]+RC[35]+RC[36]+RC[37] -> 4377575 | G251: =RC[17]+RC[18]++RC[19]+RC[20]+RC[21]+RC[38]+RC[39]+RC[41] -> 0 | H251: 0 | I251: 0 | J251: =RC[-2]+RC[-1] -> 0 | K251: 0 | L251: 680000 | M251: 235463 | N251: =RC[15]+RC[16]+RC[17]+RC[18]+RC[19]+RC[20] -> 236250 | O251: 0 | P251: 0 | Q251: 5529288 | R251: 179400 | S251: 33638 | T251: 22425 | U251: 52938.25 | V251: 0 | W251: 5240886.75 | X251: 0 | Y251: 0 | Z251: 0 | AA251: 0 | AB251: 0 | AC251: 0 | AD251: 0 | AE251: 0 | AF251: 0 | AG251: 0 | AH251: 236250 | AI251: 4377575 | AJ251: 0 | AK251: 0 | AL251: 0 | AM251: 0 | AN251: 0 | AO251: 0 | AP251: 0 | AQ251: 0 | AR251: =1 -> 1 | AS251: 0 | AT251: 0 | AU251: =RC[-30]-RC[-29]-RC[-28]-RC[-27]-RC[-26]-RC[-25] -> 5240886.75 | AV251: 0 | AW251: =RC[1]-RC[2] -> 78750 | AX251: 236250 | AY251: 157500 | AZ251: =RC[-46] -> 4377575 | BA251: =RC[-46] -> 0 | BB251: =RC[-46] -> 0 | BC251: =RC[-46] -> 0 | BD251: =RC[-46] -> 0 | BE251: =RC[-46] -> 0 | BF251: =RC[-46] -> 680000 | BG251: =RC[-46] -> 235463 | BH251: =RC[-46] -> 236250 | BI251: =RC[-46] -> 0 | BJ251: =RC[-46] -> 0 | BK251: =RC[-46] -> 5529288 | BL251: =RC[-46] -> 179400 | BM251: =RC[-46] -> 33638 | BN251: =RC[-46] -> 22425 | BO251: =RC[-46] -> 52938.25 | BP251: =RC[-46] -> 0 | BQ251: =RC[-46] -> 5240886.75 | BR251: =RC[-46] -> 0 | BS251: =RC[-46] -> 0 | BT251: =RC[-46] -> 0 | BU251: =RC[-46] -> 0 | BV251: =RC[-46] -> 0 | BW251: =RC[-46] -> 0 | BX251: =RC[-46] -> 0 | BY251: =RC[-46] -> 0 | BZ251: =RC[-46] -> 0 | CA251: =RC[-46] -> 0 | CB251: =RC[-46] -> 236250 | CC251: =RC[-46] -> 4377575 | CD251: =RC[-46] -> 0 | CE251: =RC[-46] -> 0 | CF251: =RC[-46] -> 0 | CG251: =RC[-46] -> 0 | CH251: =RC[-46] -> 0 | CI251: =RC[-46] -> 0 | CJ251: =RC[-46] -> 0 | CK251: =RC[-46] -> 0 | CL251: =RC[-46] -> 1 | CM251: =RC[-46] -> 0 | CN251: =RC[-46] -> 0 | CO251: =RC[-46] -> 5240886.75 | CP251: =RC[-46] -> 0 | CQ251: =RC[-46] -> 78750 | CR251: =RC[-46] -> 236250 | CS251: =RC[-46] -> 157500
A252: 12 | B252: 010653 | C252: Nguyễn Ngọc Nam | D252: Nhân viên Bốc xếp | E252: 19024178103013 | F252: =RC[29]+RC[30]+RC[31]+RC[32]+RC[33]+RC[34]+RC[35]+RC[36]+RC[37] -> 4596453 | G252: =RC[17]+RC[18]++RC[19]+RC[20]+RC[21]+RC[38]+RC[39]+RC[41] -> 0 | H252: 0 | I252: 0 | J252: =RC[-2]+RC[-1] -> 0 | K252: 0 | L252: 680000 | M252: 235463 | N252: =RC[15]+RC[16]+RC[17]+RC[18]+RC[19]+RC[20] -> 236250 | O252: 0 | P252: 0 | Q252: 5748166 | R252: 179400 | S252: 33638 | T252: 22425 | U252: 55127.03 | V252: 0 | W252: 5457575.9699999997 | X252: 0 | Y252: 0 | Z252: 0 | AA252: 0 | AB252: 0 | AC252: 0 | AD252: 0 | AE252: 0 | AF252: 0 | AG252: 0 | AH252: 236250 | AI252: 4596453 | AJ252: 0 | AK252: 0 | AL252: 0 | AM252: 0 | AN252: 0 | AO252: 0 | AP252: 0 | AQ252: 0 | AR252: =1 -> 1 | AS252: 0 | AT252: 0 | AU252: =RC[-30]-RC[-29]-RC[-28]-RC[-27]-RC[-26]-RC[-25] -> 5457575.9699999997 | AV252: 0 | AW252: =RC[1]-RC[2] -> 78750 | AX252: 236250 | AY252: 157500 | AZ252: =RC[-46] -> 4596453 | BA252: =RC[-46] -> 0 | BB252: =RC[-46] -> 0 | BC252: =RC[-46] -> 0 | BD252: =RC[-46] -> 0 | BE252: =RC[-46] -> 0 | BF252: =RC[-46] -> 680000 | BG252: =RC[-46] -> 235463 | BH252: =RC[-46] -> 236250 | BI252: =RC[-46] -> 0 | BJ252: =RC[-46] -> 0 | BK252: =RC[-46] -> 5748166 | BL252: =RC[-46] -> 179400 | BM252: =RC[-46] -> 33638 | BN252: =RC[-46] -> 22425 | BO252: =RC[-46] -> 55127.03 | BP252: =RC[-46] -> 0 | BQ252: =RC[-46] -> 5457575.9699999997 | BR252: =RC[-46] -> 0 | BS252: =RC[-46] -> 0 | BT252: =RC[-46] -> 0 | BU252: =RC[-46] -> 0 | BV252: =RC[-46] -> 0 | BW252: =RC[-46] -> 0 | BX252: =RC[-46] -> 0 | BY252: =RC[-46] -> 0 | BZ252: =RC[-46] -> 0 | CA252: =RC[-46] -> 0 | CB252: =RC[-46] -> 236250 | CC252: =RC[-46] -> 4596453 | CD252: =RC[-46] -> 0 | CE252: =RC[-46] -> 0 | CF252: =RC[-46] -> 0 | CG252: =RC[-46] -> 0 | CH252: =RC[-46] -> 0 | CI252: =RC[-46] -> 0 | CJ252: =RC[-46] -> 0 | CK252: =RC[-46] -> 0 | CL252: =RC[-46] -> 1 | CM252: =RC[-46] -> 0 | CN252: =RC[-46] -> 0 | CO252: =RC[-46] -> 5457575.9699999997 | CP252: =RC[-46] -> 0 | CQ252: =RC[-46] -> 78750 | CR252: =RC[-46] -> 236250 | CS252: =RC[-46] -> 157500
A253: 13 | B253: 010655 | C253: Nguyễn Chiến Thắng | D253: Nhân viên Bốc xếp | E253: 19025652324014 | F253: =RC[29]+RC[30]+RC[31]+RC[32]+RC[33]+RC[34]+RC[35]+RC[36]+RC[37] -> 3537080 | G253: =RC[17]+RC[18]++RC[19]+RC[20]+RC[21]+RC[38]+RC[39]+RC[41] -> 0 | H253: 0 | I253: 0 | J253: =RC[-2]+RC[-1] -> 0 | K253: 0 | L253: 549231 | M253: 235463 | N253: =RC[15]+RC[16]+RC[17]+RC[18]+RC[19]+RC[20] -> 0 | O253: 0 | P253: 0 | Q253: 4321774 | R253: 179400 | S253: 33638 | T253: 22425 | U253: 40863.11 | V253: 0 | W253: 4045447.89 | X253: 0 | Y253: 0 | Z253: 0 | AA253: 0 | AB253: 0 | AC253: 0 | AD253: 0 | AE253: 0 | AF253: 0 | AG253: 0 | AH253: 0 | AI253: 3537080 | AJ253: 0 | AK253: 0 | AL253: 0 | AM253: 0 | AN253: 0 | AO253: 0 | AP253: 0 | AQ253: 0 | AR253: =1 -> 1 | AS253: 0 | AT253: 0 | AU253: =RC[-30]-RC[-29]-RC[-28]-RC[-27]-RC[-26]-RC[-25] -> 4045447.89 | AV253: 0 | AW253: =RC[1]-RC[2] -> 0 | AX253: 0 | AY253: 0 | AZ253: =RC[-46] -> 3537080 | BA253: =RC[-46] -> 0 | BB253: =RC[-46] -> 0 | BC253: =RC[-46] -> 0 | BD253: =RC[-46] -> 0 | BE253: =RC[-46] -> 0 | BF253: =RC[-46] -> 549231 | BG253: =RC[-46] -> 235463 | BH253: =RC[-46] -> 0 | BI253: =RC[-46] -> 0 | BJ253: =RC[-46] -> 0 | BK253: =RC[-46] -> 4321774 | BL253: =RC[-46] -> 179400 | BM253: =RC[-46] -> 33638 | BN253: =RC[-46] -> 22425 | BO253: =RC[-46] -> 40863.11 | BP253: =RC[-46] -> 0 | BQ253: =RC[-46] -> 4045447.89 | BR253: =RC[-46] -> 0 | BS253: =RC[-46] -> 0 | BT253: =RC[-46] -> 0 | BU253: =RC[-46] -> 0 | BV253: =RC[-46] -> 0 | BW253: =RC[-46] -> 0 | BX253: =RC[-46] -> 0 | BY253: =RC[-46] -> 0 | BZ253: =RC[-46] -> 0 | CA253: =RC[-46] -> 0 | CB253: =RC[-46] -> 0 | CC253: =RC[-46] -> 3537080 | CD253: =RC[-46] -> 0 | CE253: =RC[-46] -> 0 | CF253: =RC[-46] -> 0 | CG253: =RC[-46] -> 0 | CH253: =RC[-46] -> 0 | CI253: =RC[-46] -> 0 | CJ253: =RC[-46] -> 0 | CK253: =RC[-46] -> 0 | CL253: =RC[-46] -> 1 | CM253: =RC[-46] -> 0 | CN253: =RC[-46] -> 0 | CO253: =RC[-46] -> 4045447.89 | CP253: =RC[-46] -> 0 | CQ253: =RC[-46] -> 0 | CR253: =RC[-46] -> 0 | CS253: =RC[-46] -> 0
A254: 14 | B254: 010656 | C254: Bùi Việt Bắc | D254: Nhân viên Bốc xếp | E254: 10525139458013 | F254: =RC[29]+RC[30]+RC[31]+RC[32]+RC[33]+RC[34]+RC[35]+RC[36]+RC[37] -> 4640229 | G254: =RC[17]+RC[18]++RC[19]+RC[20]+RC[21]+RC[38]+RC[39]+RC[41] -> 0 | H254: 0 | I254: 0 | J254: =RC[-2]+RC[-1] -> 0 | K254: 0 | L254: 680000 | M254: 235463 | N254: =RC[15]+RC[16]+RC[17]+RC[18]+RC[19]+RC[20] -> 236250 | O254: 0 | P254: 0 | Q254: 5791942 | R254: 179400 | S254: 33638 | T254: 22425 | U254: 55564.79 | V254: 0 | W254: 5500914.21 | X254: 0 | Y254: 0 | Z254: 0 | AA254: 0 | AB254: 0 | AC254: 0 | AD254: 0 | AE254: 0 | AF254: 0 | AG254: 0 | AH254: 236250 | AI254: 4640229 | AJ254: 0 | AK254: 0 | AL254: 0 | AM254: 0 | AN254: 0 | AO254: 0 | AP254: 0 | AQ254: 0 | AR254: =1 -> 1 | AS254: 0 | AT254: 0 | AU254: =RC[-30]-RC[-29]-RC[-28]-RC[-27]-RC[-26]-RC[-25] -> 5500914.21 | AV254: 0 | AW254: =RC[1]-RC[2] -> 78750 | AX254: 236250 | AY254: 157500 | AZ254: =RC[-46] -> 4640229 | BA254: =RC[-46] -> 0 | BB254: =RC[-46] -> 0 | BC254: =RC[-46] -> 0 | BD254: =RC[-46] -> 0 | BE254: =RC[-46] -> 0 | BF254: =RC[-46] -> 680000 | BG254: =RC[-46] -> 235463 | BH254: =RC[-46] -> 236250 | BI254: =RC[-46] -> 0 | BJ254: =RC[-46] -> 0 | BK254: =RC[-46] -> 5791942 | BL254: =RC[-46] -> 179400 | BM254: =RC[-46] -> 33638 | BN254: =RC[-46] -> 22425 | BO254: =RC[-46] -> 55564.79 | BP254: =RC[-46] -> 0 | BQ254: =RC[-46] -> 5500914.21 | BR254: =RC[-46] -> 0 | BS254: =RC[-46] -> 0 | BT254: =RC[-46] -> 0 | BU254: =RC[-46] -> 0 | BV254: =RC[-46] -> 0 | BW254: =RC[-46] -> 0 | BX254: =RC[-46] -> 0 | BY254: =RC[-46] -> 0 | BZ254: =RC[-46] -> 0 | CA254: =RC[-46] -> 0 | CB254: =RC[-46] -> 236250 | CC254: =RC[-46] -> 4640229 | CD254: =RC[-46] -> 0 | CE254: =RC[-46] -> 0 | CF254: =RC[-46] -> 0 | CG254: =RC[-46] -> 0 | CH254: =RC[-46] -> 0 | CI254: =RC[-46] -> 0 | CJ254: =RC[-46] -> 0 | CK254: =RC[-46] -> 0 | CL254: =RC[-46] -> 1 | CM254: =RC[-46] -> 0 | CN254: =RC[-46] -> 0 | CO254: =RC[-46] -> 5500914.21 | CP254: =RC[-46] -> 0 | CQ254: =RC[-46] -> 78750 | CR254: =RC[-46] -> 236250 | CS254: =RC[-46] -> 157500
A255: 15 | B255: 010658 | C255: Nguyễn Phương Tuấn | D255: Nhân viên Bốc xếp | E255: 10525139448018 | F255: =RC[29]+RC[30]+RC[31]+RC[32]+RC[33]+RC[34]+RC[35]+RC[36]+RC[37] -> 3239405 | G255: =RC[17]+RC[18]++RC[19]+RC[20]+RC[21]+RC[38]+RC[39]+RC[41] -> 0 | H255: 0 | I255: 0 | J255: =RC[-2]+RC[-1] -> 0 | K255: 0 | L255: 680000 | M255: 235463 | N255: =RC[15]+RC[16]+RC[17]+RC[18]+RC[19]+RC[20] -> 236250 | O255: 0 | P255: 0 | Q255: 4391118 | R255: 179400 | S255: 33638 | T255: 22425 | U255: 41556.550000000003 | V255: 0 | W255: 4114098.45 | X255: 0 | Y255: 0 | Z255: 0 | AA255: 0 | AB255: 0 | AC255: 0 | AD255: 0 | AE255: 0 | AF255: 0 | AG255: 0 | AH255: 236250 | AI255: 3239405 | AJ255: 0 | AK255: 0 | AL255: 0 | AM255: 0 | AN255: 0 | AO255: 0 | AP255: 0 | AQ255: 0 | AR255: =1 -> 1 | AS255: 0 | AT255: 0 | AU255: =RC[-30]-RC[-29]-RC[-28]-RC[-27]-RC[-26]-RC[-25] -> 4114098.45 | AV255: 0 | AW255: =RC[1]-RC[2] -> 78750 | AX255: 236250 | AY255: 157500 | AZ255: =RC[-46] -> 3239405 | BA255: =RC[-46] -> 0 | BB255: =RC[-46] -> 0 | BC255: =RC[-46] -> 0 | BD255: =RC[-46] -> 0 | BE255: =RC[-46] -> 0 | BF255: =RC[-46] -> 680000 | BG255: =RC[-46] -> 235463 | BH255: =RC[-46] -> 236250 | BI255: =RC[-46] -> 0 | BJ255: =RC[-46] -> 0 | BK255: =RC[-46] -> 4391118 | BL255: =RC[-46] -> 179400 | BM255: =RC[-46] -> 33638 | BN255: =RC[-46] -> 22425 | BO255: =RC[-46] -> 41556.550000000003 | BP255: =RC[-46] -> 0 | BQ255: =RC[-46] -> 4114098.45 | BR255: =RC[-46] -> 0 | BS255: =RC[-46] -> 0 | BT255: =RC[-46] -> 0 | BU255: =RC[-46] -> 0 | BV255: =RC[-46] -> 0 | BW255: =RC[-46] -> 0 | BX255: =RC[-46] -> 0 | BY255: =RC[-46] -> 0 | BZ255: =RC[-46] -> 0 | CA255: =RC[-46] -> 0 | CB255: =RC[-46] -> 236250 | CC255: =RC[-46] -> 3239405 | CD255: =RC[-46] -> 0 | CE255: =RC[-46] -> 0 | CF255: =RC[-46] -> 0 | CG255: =RC[-46] -> 0 | CH255: =RC[-46] -> 0 | CI255: =RC[-46] -> 0 | CJ255: =RC[-46] -> 0 | CK255: =RC[-46] -> 0 | CL255: =RC[-46] -> 1 | CM255: =RC[-46] -> 0 | CN255: =RC[-46] -> 0 | CO255: =RC[-46] -> 4114098.45 | CP255: =RC[-46] -> 0 | CQ255: =RC[-46] -> 78750 | CR255: =RC[-46] -> 236250 | CS255: =RC[-46] -> 157500
A256: 16 | B256: 010659 | C256: Ngô Ngọc Tiến | D256: Nhân viên Bốc xếp | E256: 10525139450012 | F256: =RC[29]+RC[30]+RC[31]+RC[32]+RC[33]+RC[34]+RC[35]+RC[36]+RC[37] -> 4377575 | G256: =RC[17]+RC[18]++RC[19]+RC[20]+RC[21]+RC[38]+RC[39]+RC[41] -> 0 | H256: 0 | I256: 0 | J256: =RC[-2]+RC[-1] -> 0 | K256: 0 | L256: 680000 | M256: 235463 | N256: =RC[15]+RC[16]+RC[17]+RC[18]+RC[19]+RC[20] -> 236250 | O256: 0 | P256: 0 | Q256: 5529288 | R256: 179400 | S256: 33638 | T256: 22425 | U256: 52938.25 | V256: 0 | W256: 5240886.75 | X256: 0 | Y256: 0 | Z256: 0 | AA256: 0 | AB256: 0 | AC256: 0 | AD256: 0 | AE256: 0 | AF256: 0 | AG256: 0 | AH256: 236250 | AI256: 4377575 | AJ256: 0 | AK256: 0 | AL256: 0 | AM256: 0 | AN256: 0 | AO256: 0 | AP256: 0 | AQ256: 0 | AR256: =1 -> 1 | AS256: 0 | AT256: 0 | AU256: =RC[-30]-RC[-29]-RC[-28]-RC[-27]-RC[-26]-RC[-25] -> 5240886.75 | AV256: 0 | AW256: =RC[1]-RC[2] -> 78750 | AX256: 236250 | AY256: 157500 | AZ256: =RC[-46] -> 4377575 | BA256: =RC[-46] -> 0 | BB256: =RC[-46] -> 0 | BC256: =RC[-46] -> 0 | BD256: =RC[-46] -> 0 | BE256: =RC[-46] -> 0 | BF256: =RC[-46] -> 680000 | BG256: =RC[-46] -> 235463 | BH256: =RC[-46] -> 236250 | BI256: =RC[-46] -> 0 | BJ256: =RC[-46] -> 0 | BK256: =RC[-46] -> 5529288 | BL256: =RC[-46] -> 179400 | BM256: =RC[-46] -> 33638 | BN256: =RC[-46] -> 22425 | BO256: =RC[-46] -> 52938.25 | BP256: =RC[-46] -> 0 | BQ256: =RC[-46] -> 5240886.75 | BR256: =RC[-46] -> 0 | BS256: =RC[-46] -> 0 | BT256: =RC[-46] -> 0 | BU256: =RC[-46] -> 0 | BV256: =RC[-46] -> 0 | BW256: =RC[-46] -> 0 | BX256: =RC[-46] -> 0 | BY256: =RC[-46] -> 0 | BZ256: =RC[-46] -> 0 | CA256: =RC[-46] -> 0 | CB256: =RC[-46] -> 236250 | CC256: =RC[-46] -> 4377575 | CD256: =RC[-46] -> 0 | CE256: =RC[-46] -> 0 | CF256: =RC[-46] -> 0 | CG256: =RC[-46] -> 0 | CH256: =RC[-46] -> 0 | CI256: =RC[-46] -> 0 | CJ256: =RC[-46] -> 0 | CK256: =RC[-46] -> 0 | CL256: =RC[-46] -> 1 | CM256: =RC[-46] -> 0 | CN256: =RC[-46] -> 0 | CO256: =RC[-46] -> 5240886.75 | CP256: =RC[-46] -> 0 | CQ256: =RC[-46] -> 78750 | CR256: =RC[-46] -> 236250 | CS256: =RC[-46] -> 157500
A257: 17 | B257: 010662 | C257: Trần Văn Tĩnh | D257: Nhân viên Bốc xếp | E257: 10525139460018 | F257: =RC[29]+RC[30]+RC[31]+RC[32]+RC[33]+RC[34]+RC[35]+RC[36]+RC[37] -> 4640229 | G257: =RC[17]+RC[18]++RC[19]+RC[20]+RC[21]+RC[38]+RC[39]+RC[41] -> 0 | H257: 0 | I257: 0 | J257: =RC[-2]+RC[-1] -> 0 | K257: 0 | L257: 680000 | M257: 235463 | N257: =RC[15]+RC[16]+RC[17]+RC[18]+RC[19]+RC[20] -> 236250 | O257: 0 | P257: 0 | Q257: 5791942 | R257: 179400 | S257: 33638 | T257: 22425 | U257: 55564.79 | V257: 0 | W257: 5500914.21 | X257: 0 | Y257: 0 | Z257: 0 | AA257: 0 | AB257: 0 | AC257: 0 | AD257: 0 | AE257: 0 | AF257: 0 | AG257: 0 | AH257: 236250 | AI257: 4640229 | AJ257: 0 | AK257: 0 | AL257: 0 | AM257: 0 | AN257: 0 | AO257: 0 | AP257: 0 | AQ257: 0 | AR257: =1 -> 1 | AS257: 0 | AT257: 0 | AU257: =RC[-30]-RC[-29]-RC[-28]-RC[-27]-RC[-26]-RC[-25] -> 5500914.21 | AV257: 0 | AW257: =RC[1]-RC[2] -> 78750 | AX257: 236250 | AY257: 157500 | AZ257: =RC[-46] -> 4640229 | BA257: =RC[-46] -> 0 | BB257: =RC[-46] -> 0 | BC257: =RC[-46] -> 0 | BD257: =RC[-46] -> 0 | BE257: =RC[-46] -> 0 | BF257: =RC[-46] -> 680000 | BG257: =RC[-46] -> 235463 | BH257: =RC[-46] -> 236250 | BI257: =RC[-46] -> 0 | BJ257: =RC[-46] -> 0 | BK257: =RC[-46] -> 5791942 | BL257: =RC[-46] -> 179400 | BM257: =RC[-46] -> 33638 | BN257: =RC[-46] -> 22425 | BO257: =RC[-46] -> 55564.79 | BP257: =RC[-46] -> 0 | BQ257: =RC[-46] -> 5500914.21 | BR257: =RC[-46] -> 0 | BS257: =RC[-46] -> 0 | BT257: =RC[-46] -> 0 | BU257: =RC[-46] -> 0 | BV257: =RC[-46] -> 0 | BW257: =RC[-46] -> 0 | BX257: =RC[-46] -> 0 | BY257: =RC[-46] -> 0 | BZ257: =RC[-46] -> 0 | CA257: =RC[-46] -> 0 | CB257: =RC[-46] -> 236250 | CC257: =RC[-46] -> 4640229 | CD257: =RC[-46] -> 0 | CE257: =RC[-46] -> 0 | CF257: =RC[-46] -> 0 | CG257: =RC[-46] -> 0 | CH257: =RC[-46] -> 0 | CI257: =RC[-46] -> 0 | CJ257: =RC[-46] -> 0 | CK257: =RC[-46] -> 0 | CL257: =RC[-46] -> 1 | CM257: =RC[-46] -> 0 | CN257: =RC[-46] -> 0 | CO257: =RC[-46] -> 5500914.21 | CP257: =RC[-46] -> 0 | CQ257: =RC[-46] -> 78750 | CR257: =RC[-46] -> 236250 | CS257: =RC[-46] -> 157500
A258: 18 | B258: 010663 | C258: Khổng Vũ Hùng | D258: Nhân viên Bốc xếp | E258: 10525139462010 | F258: =RC[29]+RC[30]+RC[31]+RC[32]+RC[33]+RC[34]+RC[35]+RC[36]+RC[37] -> 4596453 | G258: =RC[17]+RC[18]++RC[19]+RC[20]+RC[21]+RC[38]+RC[39]+RC[41] -> 0 | H258: 0 | I258: 0 | J258: =RC[-2]+RC[-1] -> 0 | K258: 0 | L258: 680000 | M258: 235463 | N258: =RC[15]+RC[16]+RC[17]+RC[18]+RC[19]+RC[20] -> 236250 | O258: 0 | P258: 0 | Q258: 5748166 | R258: 179400 | S258: 33638 | T258: 22425 | U258: 55127.03 | V258: 0 | W258: 5457575.9699999997 | X258: 0 | Y258: 0 | Z258: 0 | AA258: 0 | AB258: 0 | AC258: 0 | AD258: 0 | AE258: 0 | AF258: 0 | AG258: 0 | AH258: 236250 | AI258: 4596453 | AJ258: 0 | AK258: 0 | AL258: 0 | AM258: 0 | AN258: 0 | AO258: 0 | AP258: 0 | AQ258: 0 | AR258: =1 -> 1 | AS258: 0 | AT258: 0 | AU258: =RC[-30]-RC[-29]-RC[-28]-RC[-27]-RC[-26]-RC[-25] -> 5457575.9699999997 | AV258: 0 | AW258: =RC[1]-RC[2] -> 78750 | AX258: 236250 | AY258: 157500 | AZ258: =RC[-46] -> 4596453 | BA258: =RC[-46] -> 0 | BB258: =RC[-46] -> 0 | BC258: =RC[-46] -> 0 | BD258: =RC[-46] -> 0 | BE258: =RC[-46] -> 0 | BF258: =RC[-46] -> 680000 | BG258: =RC[-46] -> 235463 | BH258: =RC[-46] -> 236250 | BI258: =RC[-46] -> 0 | BJ258: =RC[-46] -> 0 | BK258: =RC[-46] -> 5748166 | BL258: =RC[-46] -> 179400 | BM258: =RC[-46] -> 33638 | BN258: =RC[-46] -> 22425 | BO258: =RC[-46] -> 55127.03 | BP258: =RC[-46] -> 0 | BQ258: =RC[-46] -> 5457575.9699999997 | BR258: =RC[-46] -> 0 | BS258: =RC[-46] -> 0 | BT258: =RC[-46] -> 0 | BU258: =RC[-46] -> 0 | BV258: =RC[-46] -> 0 | BW258: =RC[-46] -> 0 | BX258: =RC[-46] -> 0 | BY258: =RC[-46] -> 0 | BZ258: =RC[-46] -> 0 | CA258: =RC[-46] -> 0 | CB258: =RC[-46] -> 236250 | CC258: =RC[-46] -> 4596453 | CD258: =RC[-46] -> 0 | CE258: =RC[-46] -> 0 | CF258: =RC[-46] -> 0 | CG258: =RC[-46] -> 0 | CH258: =RC[-46] -> 0 | CI258: =RC[-46] -> 0 | CJ258: =RC[-46] -> 0 | CK258: =RC[-46] -> 0 | CL258: =RC[-46] -> 1 | CM258: =RC[-46] -> 0 | CN258: =RC[-46] -> 0 | CO258: =RC[-46] -> 5457575.9699999997 | CP258: =RC[-46] -> 0 | CQ258: =RC[-46] -> 78750 | CR258: =RC[-46] -> 236250 | CS258: =RC[-46] -> 157500
A259: 19 | B259: 010664 | C259: Phan Bá Tráng | D259: Nhân viên Bốc xếp | E259: 10525139464013 | F259: =RC[29]+RC[30]+RC[31]+RC[32]+RC[33]+RC[34]+RC[35]+RC[36]+RC[37] -> 4377575 | G259: =RC[17]+RC[18]++RC[19]+RC[20]+RC[21]+RC[38]+RC[39]+RC[41] -> 0 | H259: 0 | I259: 0 | J259: =RC[-2]+RC[-1] -> 0 | K259: 0 | L259: 680000 | M259: 235463 | N259: =RC[15]+RC[16]+RC[17]+RC[18]+RC[19]+RC[20] -> 236250 | O259: 0 | P259: 0 | Q259: 5529288 | R259: 179400 | S259: 33638 | T259: 22425 | U259: 52938.25 | V259: 0 | W259: 5240886.75 | X259: 0 | Y259: 0 | Z259: 0 | AA259: 0 | AB259: 0 | AC259: 0 | AD259: 0 | AE259: 0 | AF259: 0 | AG259: 0 | AH259: 236250 | AI259: 4377575 | AJ259: 0 | AK259: 0 | AL259: 0 | AM259: 0 | AN259: 0 | AO259: 0 | AP259: 0 | AQ259: 0 | AR259: =1 -> 1 | AS259: 0 | AT259: 0 | AU259: =RC[-30]-RC[-29]-RC[-28]-RC[-27]-RC[-26]-RC[-25] -> 5240886.75 | AV259: 0 | AW259: =RC[1]-RC[2] -> 78750 | AX259: 236250 | AY259: 157500 | AZ259: =RC[-46] -> 4377575 | BA259: =RC[-46] -> 0 | BB259: =RC[-46] -> 0 | BC259: =RC[-46] -> 0 | BD259: =RC[-46] -> 0 | BE259: =RC[-46] -> 0 | BF259: =RC[-46] -> 680000 | BG259: =RC[-46] -> 235463 | BH259: =RC[-46] -> 236250 | BI259: =RC[-46] -> 0 | BJ259: =RC[-46] -> 0 | BK259: =RC[-46] -> 5529288 | BL259: =RC[-46] -> 179400 | BM259: =RC[-46] -> 33638 | BN259: =RC[-46] -> 22425 | BO259: =RC[-46] -> 52938.25 | BP259: =RC[-46] -> 0 | BQ259: =RC[-46] -> 5240886.75 | BR259: =RC[-46] -> 0 | BS259: =RC[-46] -> 0 | BT259: =RC[-46] -> 0 | BU259: =RC[-46] -> 0 | BV259: =RC[-46] -> 0 | BW259: =RC[-46] -> 0 | BX259: =RC[-46] -> 0 | BY259: =RC[-46] -> 0 | BZ259: =RC[-46] -> 0 | CA259: =RC[-46] -> 0 | CB259: =RC[-46] -> 236250 | CC259: =RC[-46] -> 4377575 | CD259: =RC[-46] -> 0 | CE259: =RC[-46] -> 0 | CF259: =RC[-46] -> 0 | CG259: =RC[-46] -> 0 | CH259: =RC[-46] -> 0 | CI259: =RC[-46] -> 0 | CJ259: =RC[-46] -> 0 | CK259: =RC[-46] -> 0 | CL259: =RC[-46] -> 1 | CM259: =RC[-46] -> 0 | CN259: =RC[-46] -> 0 | CO259: =RC[-46] -> 5240886.75 | CP259: =RC[-46] -> 0 | CQ259: =RC[-46] -> 78750 | CR259: =RC[-46] -> 236250 | CS259: =RC[-46] -> 157500
A260: 20 | B260: 010665 | C260: Trần Hồng Sơn | D260: Nhân viên Bốc xếp | E260: 10525139467012 | F260: =RC[29]+RC[30]+RC[31]+RC[32]+RC[33]+RC[34]+RC[35]+RC[36]+RC[37] -> 4640229 | G260: =RC[17]+RC[18]++RC[19]+RC[20]+RC[21]+RC[38]+RC[39]+RC[41] -> 0 | H260: 0 | I260: 0 | J260: =RC[-2]+RC[-1] -> 0 | K260: 0 | L260: 680000 | M260: 235463 | N260: =RC[15]+RC[16]+RC[17]+RC[18]+RC[19]+RC[20] -> 236250 | O260: 0 | P260: 0 | Q260: 5791942 | R260: 179400 | S260: 33638 | T260: 22425 | U260: 55564.79 | V260: 0 | W260: 5500914.21 | X260: 0 | Y260: 0 | Z260: 0 | AA260: 0 | AB260: 0 | AC260: 0 | AD260: 0 | AE260: 0 | AF260: 0 | AG260: 0 | AH260: 236250 | AI260: 4640229 | AJ260: 0 | AK260: 0 | AL260: 0 | AM260: 0 | AN260: 0 | AO260: 0 | AP260: 0 | AQ260: 0 | AR260: =1 -> 1 | AS260: 0 | AT260: 0 | AU260: =RC[-30]-RC[-29]-RC[-28]-RC[-27]-RC[-26]-RC[-25] -> 5500914.21 | AV260: 0 | AW260: =RC[1]-RC[2] -> 78750 | AX260: 236250 | AY260: 157500 | AZ260: =RC[-46] -> 4640229 | BA260: =RC[-46] -> 0 | BB260: =RC[-46] -> 0 | BC260: =RC[-46] -> 0 | BD260: =RC[-46] -> 0 | BE260: =RC[-46] -> 0 | BF260: =RC[-46] -> 680000 | BG260: =RC[-46] -> 235463 | BH260: =RC[-46] -> 236250 | BI260: =RC[-46] -> 0 | BJ260: =RC[-46] -> 0 | BK260: =RC[-46] -> 5791942 | BL260: =RC[-46] -> 179400 | BM260: =RC[-46] -> 33638 | BN260: =RC[-46] -> 22425 | BO260: =RC[-46] -> 55564.79 | BP260: =RC[-46] -> 0 | BQ260: =RC[-46] -> 5500914.21 | BR260: =RC[-46] -> 0 | BS260: =RC[-46] -> 0 | BT260: =RC[-46] -> 0 | BU260: =RC[-46] -> 0 | BV260: =RC[-46] -> 0 | BW260: =RC[-46] -> 0 | BX260: =RC[-46] -> 0 | BY260: =RC[-46] -> 0 | BZ260: =RC[-46] -> 0 | CA260: =RC[-46] -> 0 | CB260: =RC[-46] -> 236250 | CC260: =RC[-46] -> 4640229 | CD260: =RC[-46] -> 0 | CE260: =RC[-46] -> 0 | CF260: =RC[-46] -> 0 | CG260: =RC[-46] -> 0 | CH260: =RC[-46] -> 0 | CI260: =RC[-46] -> 0 | CJ260: =RC[-46] -> 0 | CK260: =RC[-46] -> 0 | CL260: =RC[-46] -> 1 | CM260: =RC[-46] -> 0 | CN260: =RC[-46] -> 0 | CO260: =RC[-46] -> 5500914.21 | CP260: =RC[-46] -> 0 | CQ260: =RC[-46] -> 78750 | CR260: =RC[-46] -> 236250 | CS260: =RC[-46] -> 157500
A261: 21 | B261: 010666 | C261: Phạm Quang Trung | D261: Nhân viên Bốc xếp | E261: 10525139471011 | F261: =RC[29]+RC[30]+RC[31]+RC[32]+RC[33]+RC[34]+RC[35]+RC[36]+RC[37] -> 3983593 | G261: =RC[17]+RC[18]++RC[19]+RC[20]+RC[21]+RC[38]+RC[39]+RC[41] -> 0 | H261: 0 | I261: 0 | J261: =RC[-2]+RC[-1] -> 0 | K261: 0 | L261: 680000 | M261: 235463 | N261: =RC[15]+RC[16]+RC[17]+RC[18]+RC[19]+RC[20] -> 236250 | O261: 0 | P261: 0 | Q261: 5135306 | R261: 179400 | S261: 33638 | T261: 22425 | U261: 48998.43 | V261: 0 | W261: 4850844.57 | X261: 0 | Y261: 0 | Z261: 0 | AA261: 0 | AB261: 0 | AC261: 0 | AD261: 0 | AE261: 0 | AF261: 0 | AG261: 0 | AH261: 236250 | AI261: 3983593 | AJ261: 0 | AK261: 0 | AL261: 0 | AM261: 0 | AN261: 0 | AO261: 0 | AP261: 0 | AQ261: 0 | AR261: =1 -> 1 | AS261: 0 | AT261: 0 | AU261: =RC[-30]-RC[-29]-RC[-28]-RC[-27]-RC[-26]-RC[-25] -> 4850844.57 | AV261: 0 | AW261: =RC[1]-RC[2] -> 78750 | AX261: 236250 | AY261: 157500 | AZ261: =RC[-46] -> 3983593 | BA261: =RC[-46] -> 0 | BB261: =RC[-46] -> 0 | BC261: =RC[-46] -> 0 | BD261: =RC[-46] -> 0 | BE261: =RC[-46] -> 0 | BF261: =RC[-46] -> 680000 | BG261: =RC[-46] -> 235463 | BH261: =RC[-46] -> 236250 | BI261: =RC[-46] -> 0 | BJ261: =RC[-46] -> 0 | BK261: =RC[-46] -> 5135306 | BL261: =RC[-46] -> 179400 | BM261: =RC[-46] -> 33638 | BN261: =RC[-46] -> 22425 | BO261: =RC[-46] -> 48998.43 | BP261: =RC[-46] -> 0 | BQ261: =RC[-46] -> 4850844.57 | BR261: =RC[-46] -> 0 | BS261: =RC[-46] -> 0 | BT261: =RC[-46] -> 0 | BU261: =RC[-46] -> 0 | BV261: =RC[-46] -> 0 | BW261: =RC[-46] -> 0 | BX261: =RC[-46] -> 0 | BY261: =RC[-46] -> 0 | BZ261: =RC[-46] -> 0 | CA261: =RC[-46] -> 0 | CB261: =RC[-46] -> 236250 | CC261: =RC[-46] -> 3983593 | CD261: =RC[-46] -> 0 | CE261: =RC[-46] -> 0 | CF261: =RC[-46] -> 0 | CG261: =RC[-46] -> 0 | CH261: =RC[-46] -> 0 | CI261: =RC[-46] -> 0 | CJ261: =RC[-46] -> 0 | CK261: =RC[-46] -> 0 | CL261: =RC[-46] -> 1 | CM261: =RC[-46] -> 0 | CN261: =RC[-46] -> 0 | CO261: =RC[-46] -> 4850844.57 | CP261: =RC[-46] -> 0 | CQ261: =RC[-46] -> 78750 | CR261: =RC[-46] -> 236250 | CS261: =RC[-46] -> 157500
A262: 22 | B262: 010667 | C262: Nguyễn Phi Trường | D262: Nhân viên Bốc xếp | E262: 10522186950016 | F262: =RC[29]+RC[30]+RC[31]+RC[32]+RC[33]+RC[34]+RC[35]+RC[36]+RC[37] -> 4041961 | G262: =RC[17]+RC[18]++RC[19]+RC[20]+RC[21]+RC[38]+RC[39]+RC[41] -> 0 | H262: 0 | I262: 0 | J262: =RC[-2]+RC[-1] -> 0 | K262: 0 | L262: 627692 | M262: 235463 | N262: =RC[15]+RC[16]+RC[17]+RC[18]+RC[19]+RC[20] -> 236250 | O262: 0 | P262: 0 | Q262: 5141366 | R262: 179400 | S262: 33638 | T262: 22425 | U262: 49059.03 | V262: 0 | W262: 4856843.97 | X262: 0 | Y262: 0 | Z262: 0 | AA262: 0 | AB262: 0 | AC262: 0 | AD262: 0 | AE262: 0 | AF262: 0 | AG262: 0 | AH262: 236250 | AI262: 4041961 | AJ262: 0 | AK262: 0 | AL262: 0 | AM262: 0 | AN262: 0 | AO262: 0 | AP262: 0 | AQ262: 0 | AR262: =1 -> 1 | AS262: 0 | AT262: 0 | AU262: =RC[-30]-RC[-29]-RC[-28]-RC[-27]-RC[-26]-RC[-25] -> 4856843.97 | AV262: 0 | AW262: =RC[1]-RC[2] -> 78750 | AX262: 236250 | AY262: 157500 | AZ262: =RC[-46] -> 4041961 | BA262: =RC[-46] -> 0 | BB262: =RC[-46] -> 0 | BC262: =RC[-46] -> 0 | BD262: =RC[-46] -> 0 | BE262: =RC[-46] -> 0 | BF262: =RC[-46] -> 627692 | BG262: =RC[-46] -> 235463 | BH262: =RC[-46] -> 236250 | BI262: =RC[-46] -> 0 | BJ262: =RC[-46] -> 0 | BK262: =RC[-46] -> 5141366 | BL262: =RC[-46] -> 179400 | BM262: =RC[-46] -> 33638 | BN262: =RC[-46] -> 22425 | BO262: =RC[-46] -> 49059.03 | BP262: =RC[-46] -> 0 | BQ262: =RC[-46] -> 4856843.97 | BR262: =RC[-46] -> 0 | BS262: =RC[-46] -> 0 | BT262: =RC[-46] -> 0 | BU262: =RC[-46] -> 0 | BV262: =RC[-46] -> 0 | BW262: =RC[-46] -> 0 | BX262: =RC[-46] -> 0 | BY262: =RC[-46] -> 0 | BZ262: =RC[-46] -> 0 | CA262: =RC[-46] -> 0 | CB262: =RC[-46] -> 236250 | CC262: =RC[-46] -> 4041961 | CD262: =RC[-46] -> 0 | CE262: =RC[-46] -> 0 | CF262: =RC[-46] -> 0 | CG262: =RC[-46] -> 0 | CH262: =RC[-46] -> 0 | CI262: =RC[-46] -> 0 | CJ262: =RC[-46] -> 0 | CK262: =RC[-46] -> 0 | CL262: =RC[-46] -> 1 | CM262: =RC[-46] -> 0 | CN262: =RC[-46] -> 0 | CO262: =RC[-46] -> 4856843.97 | CP262: =RC[-46] -> 0 | CQ262: =RC[-46] -> 78750 | CR262: =RC[-46] -> 236250 | CS262: =RC[-46] -> 157500
A263: 23 | B263: 010668 | C263: Đới Minh Khoa | D263: Nhân viên Bốc xếp | E263: 10525139453011 | F263: =RC[29]+RC[30]+RC[31]+RC[32]+RC[33]+RC[34]+RC[35]+RC[36]+RC[37] -> 4686923 | G263: =RC[17]+RC[18]++RC[19]+RC[20]+RC[21]+RC[38]+RC[39]+RC[41] -> 0 | H263: 0 | I263: 0 | J263: =RC[-2]+RC[-1] -> 0 | K263: 105000 | L263: 680000 | M263: 235463 | N263: =RC[15]+RC[16]+RC[17]+RC[18]+RC[19]+RC[20] -> 236250 | O263: 0 | P263: 0 | Q263: 5943636 | R263: 179400 | S263: 33638 | T263: 22425 | U263: 57081.73 | V263: 0 | W263: 5651091.2699999996 | X263: 0 | Y263: 0 | Z263: 0 | AA263: 0 | AB263: 0 | AC263: 0 | AD263: 0 | AE263: 0 | AF263: 0 | AG263: 0 | AH263: 236250 | AI263: 4686923 | AJ263: 0 | AK263: 0 | AL263: 0 | AM263: 0 | AN263: 0 | AO263: 0 | AP263: 0 | AQ263: 0 | AR263: =1 -> 1 | AS263: 0 | AT263: 0 | AU263: =RC[-30]-RC[-29]-RC[-28]-RC[-27]-RC[-26]-RC[-25] -> 5651091.2699999996 | AV263: 0 | AW263: =RC[1]-RC[2] -> 78750 | AX263: 236250 | AY263: 157500 | AZ263: =RC[-46] -> 4686923 | BA263: =RC[-46] -> 0 | BB263: =RC[-46] -> 0 | BC263: =RC[-46] -> 0 | BD263: =RC[-46] -> 0 | BE263: =RC[-46] -> 105000 | BF263: =RC[-46] -> 680000 | BG263: =RC[-46] -> 235463 | BH263: =RC[-46] -> 236250 | BI263: =RC[-46] -> 0 | BJ263: =RC[-46] -> 0 | BK263: =RC[-46] -> 5943636 | BL263: =RC[-46] -> 179400 | BM263: =RC[-46] -> 33638 | BN263: =RC[-46] -> 22425 | BO263: =RC[-46] -> 57081.73 | BP263: =RC[-46] -> 0 | BQ263: =RC[-46] -> 5651091.2699999996 | BR263: =RC[-46] -> 0 | BS263: =RC[-46] -> 0 | BT263: =RC[-46] -> 0 | BU263: =RC[-46] -> 0 | BV263: =RC[-46] -> 0 | BW263: =RC[-46] -> 0 | BX263: =RC[-46] -> 0 | BY263: =RC[-46] -> 0 | BZ263: =RC[-46] -> 0 | CA263: =RC[-46] -> 0 | CB263: =RC[-46] -> 236250 | CC263: =RC[-46] -> 4686923 | CD263: =RC[-46] -> 0 | CE263: =RC[-46] -> 0 | CF263: =RC[-46] -> 0 | CG263: =RC[-46] -> 0 | CH263: =RC[-46] -> 0 | CI263: =RC[-46] -> 0 | CJ263: =RC[-46] -> 0 | CK263: =RC[-46] -> 0 | CL263: =RC[-46] -> 1 | CM263: =RC[-46] -> 0 | CN263: =RC[-46] -> 0 | CO263: =RC[-46] -> 5651091.2699999996 | CP263: =RC[-46] -> 0 | CQ263: =RC[-46] -> 78750 | CR263: =RC[-46] -> 236250 | CS263: =RC[-46] -> 157500
A264: 24 | B264: 010669 | C264: Nguyễn Xuân Tân | D264: Nhân viên Bốc xếp | E264: 19025652320019 | F264: =RC[29]+RC[30]+RC[31]+RC[32]+RC[33]+RC[34]+RC[35]+RC[36]+RC[37] -> 4377575 | G264: =RC[17]+RC[18]++RC[19]+RC[20]+RC[21]+RC[38]+RC[39]+RC[41] -> 0 | H264: 0 | I264: 0 | J264: =RC[-2]+RC[-1] -> 0 | K264: 0 | L264: 680000 | M264: 235463 | N264: =RC[15]+RC[16]+RC[17]+RC[18]+RC[19]+RC[20] -> 236250 | O264: 0 | P264: 0 | Q264: 5529288 | R264: 179400 | S264: 33638 | T264: 22425 | U264: 52938.25 | V264: 0 | W264: 5240886.75 | X264: 0 | Y264: 0 | Z264: 0 | AA264: 0 | AB264: 0 | AC264: 0 | AD264: 0 | AE264: 0 | AF264: 0 | AG264: 0 | AH264: 236250 | AI264: 4377575 | AJ264: 0 | AK264: 0 | AL264: 0 | AM264: 0 | AN264: 0 | AO264: 0 | AP264: 0 | AQ264: 0 | AR264: =1 -> 1 | AS264: 0 | AT264: 0 | AU264: =RC[-30]-RC[-29]-RC[-28]-RC[-27]-RC[-26]-RC[-25] -> 5240886.75 | AV264: 0 | AW264: =RC[1]-RC[2] -> 78750 | AX264: 236250 | AY264: 157500 | AZ264: =RC[-46] -> 4377575 | BA264: =RC[-46] -> 0 | BB264: =RC[-46] -> 0 | BC264: =RC[-46] -> 0 | BD264: =RC[-46] -> 0 | BE264: =RC[-46] -> 0 | BF264: =RC[-46] -> 680000 | BG264: =RC[-46] -> 235463 | BH264: =RC[-46] -> 236250 | BI264: =RC[-46] -> 0 | BJ264: =RC[-46] -> 0 | BK264: =RC[-46] -> 5529288 | BL264: =RC[-46] -> 179400 | BM264: =RC[-46] -> 33638 | BN264: =RC[-46] -> 22425 | BO264: =RC[-46] -> 52938.25 | BP264: =RC[-46] -> 0 | BQ264: =RC[-46] -> 5240886.75 | BR264: =RC[-46] -> 0 | BS264: =RC[-46] -> 0 | BT264: =RC[-46] -> 0 | BU264: =RC[-46] -> 0 | BV264: =RC[-46] -> 0 | BW264: =RC[-46] -> 0 | BX264: =RC[-46] -> 0 | BY264: =RC[-46] -> 0 | BZ264: =RC[-46] -> 0 | CA264: =RC[-46] -> 0 | CB264: =RC[-46] -> 236250 | CC264: =RC[-46] -> 4377575 | CD264: =RC[-46] -> 0 | CE264: =RC[-46] -> 0 | CF264: =RC[-46] -> 0 | CG264: =RC[-46] -> 0 | CH264: =RC[-46] -> 0 | CI264: =RC[-46] -> 0 | CJ264: =RC[-46] -> 0 | CK264: =RC[-46] -> 0 | CL264: =RC[-46] -> 1 | CM264: =RC[-46] -> 0 | CN264: =RC[-46] -> 0 | CO264: =RC[-46] -> 5240886.75 | CP264: =RC[-46] -> 0 | CQ264: =RC[-46] -> 78750 | CR264: =RC[-46] -> 236250 | CS264: =RC[-46] -> 157500
A265: 25 | B265: 010670 | C265: Nguyễn Văn Toàn | D265: Nhân viên Bốc xếp | E265: 10522162915015 | F265: =RC[29]+RC[30]+RC[31]+RC[32]+RC[33]+RC[34]+RC[35]+RC[36]+RC[37] -> 5807582 | G265: =RC[17]+RC[18]++RC[19]+RC[20]+RC[21]+RC[38]+RC[39]+RC[41] -> 0 | H265: 0 | I265: 0 | J265: =RC[-2]+RC[-1] -> 0 | K265: 210000 | L265: 680000 | M265: 274103 | N265: =RC[15]+RC[16]+RC[17]+RC[18]+RC[19]+RC[20] -> 275019 | O265: 0 | P265: 0 | Q265: 7246704 | R265: 208840 | S265: 39158 | T265: 26105 | U265: 69726.009999999995 | V265: 0 | W265: 6902874.9900000002 | X265: 0 | Y265: 0 | Z265: 0 | AA265: 0 | AB265: 0 | AC265: 0 | AD265: 0 | AE265: 0 | AF265: 0 | AG265: 0 | AH265: 275019 | AI265: 5807582 | AJ265: 0 | AK265: 0 | AL265: 0 | AM265: 0 | AN265: 0 | AO265: 0 | AP265: 0 | AQ265: 0 | AR265: =1 -> 1 | AS265: 0 | AT265: 0 | AU265: =RC[-30]-RC[-29]-RC[-28]-RC[-27]-RC[-26]-RC[-25] -> 6902874.9900000002 | AV265: 0 | AW265: =RC[1]-RC[2] -> 91673 | AX265: 275019 | AY265: 183346 | AZ265: =RC[-46] -> 5807582 | BA265: =RC[-46] -> 0 | BB265: =RC[-46] -> 0 | BC265: =RC[-46] -> 0 | BD265: =RC[-46] -> 0 | BE265: =RC[-46] -> 210000 | BF265: =RC[-46] -> 680000 | BG265: =RC[-46] -> 274103 | BH265: =RC[-46] -> 275019 | BI265: =RC[-46] -> 0 | BJ265: =RC[-46] -> 0 | BK265: =RC[-46] -> 7246704 | BL265: =RC[-46] -> 208840 | BM265: =RC[-46] -> 39158 | BN265: =RC[-46] -> 26105 | BO265: =RC[-46] -> 69726.009999999995 | BP265: =RC[-46] -> 0 | BQ265: =RC[-46] -> 6902874.9900000002 | BR265: =RC[-46] -> 0 | BS265: =RC[-46] -> 0 | BT265: =RC[-46] -> 0 | BU265: =RC[-46] -> 0 | BV265: =RC[-46] -> 0 | BW265: =RC[-46] -> 0 | BX265: =RC[-46] -> 0 | BY265: =RC[-46] -> 0 | BZ265: =RC[-46] -> 0 | CA265: =RC[-46] -> 0 | CB265: =RC[-46] -> 275019 | CC265: =RC[-46] -> 5807582 | CD265: =RC[-46] -> 0 | CE265: =RC[-46] -> 0 | CF265: =RC[-46] -> 0 | CG265: =RC[-46] -> 0 | CH265: =RC[-46] -> 0 | CI265: =RC[-46] -> 0 | CJ265: =RC[-46] -> 0 | CK265: =RC[-46] -> 0 | CL265: =RC[-46] -> 1 | CM265: =RC[-46] -> 0 | CN265: =RC[-46] -> 0 | CO265: =RC[-46] -> 6902874.9900000002 | CP265: =RC[-46] -> 0 | CQ265: =RC[-46] -> 91673 | CR265: =RC[-46] -> 275019 | CS265: =RC[-46] -> 183346
A266: 26 | B266: 010671 | C266: Lê Đức Duy | D266: Nhân viên Bốc xếp | E266: 10522089555013 | F266: =RC[29]+RC[30]+RC[31]+RC[32]+RC[33]+RC[34]+RC[35]+RC[36]+RC[37] -> 4686923 | G266: =RC[17]+RC[18]++RC[19]+RC[20]+RC[21]+RC[38]+RC[39]+RC[41] -> 0 | H266: 0 | I266: 0 | J266: =RC[-2]+RC[-1] -> 0 | K266: 0 | L266: 680000 | M266: 274103 | N266: =RC[15]+RC[16]+RC[17]+RC[18]+RC[19]+RC[20] -> 275019 | O266: 0 | P266: 0 | Q266: 5916045 | R266: 208840 | S266: 39158 | T266: 26105 | U266: 56419.42 | V266: 0 | W266: 5585522.5800000001 | X266: 0 | Y266: 0 | Z266: 0 | AA266: 0 | AB266: 0 | AC266: 0 | AD266: 0 | AE266: 0 | AF266: 0 | AG266: 0 | AH266: 275019 | AI266: 4686923 | AJ266: 0 | AK266: 0 | AL266: 0 | AM266: 0 | AN266: 0 | AO266: 0 | AP266: 0 | AQ266: 0 | AR266: =1 -> 1 | AS266: 0 | AT266: 0 | AU266: =RC[-30]-RC[-29]-RC[-28]-RC[-27]-RC[-26]-RC[-25] -> 5585522.5800000001 | AV266: 0 | AW266: =RC[1]-RC[2] -> 91673 | AX266: 275019 | AY266: 183346 | AZ266: =RC[-46] -> 4686923 | BA266: =RC[-46] -> 0 | BB266: =RC[-46] -> 0 | BC266: =RC[-46] -> 0 | BD266: =RC[-46] -> 0 | BE266: =RC[-46] -> 0 | BF266: =RC[-46] -> 680000 | BG266: =RC[-46] -> 274103 | BH266: =RC[-46] -> 275019 | BI266: =RC[-46] -> 0 | BJ266: =RC[-46] -> 0 | BK266: =RC[-46] -> 5916045 | BL266: =RC[-46] -> 208840 | BM266: =RC[-46] -> 39158 | BN266: =RC[-46] -> 26105 | BO266: =RC[-46] -> 56419.42 | BP266: =RC[-46] -> 0 | BQ266: =RC[-46] -> 5585522.5800000001 | BR266: =RC[-46] -> 0 | BS266: =RC[-46] -> 0 | BT266: =RC[-46] -> 0 | BU266: =RC[-46] -> 0 | BV266: =RC[-46] -> 0 | BW266: =RC[-46] -> 0 | BX266: =RC[-46] -> 0 | BY266: =RC[-46] -> 0 | BZ266: =RC[-46] -> 0 | CA266: =RC[-46] -> 0 | CB266: =RC[-46] -> 275019 | CC266: =RC[-46] -> 4686923 | CD266: =RC[-46] -> 0 | CE266: =RC[-46] -> 0 | CF266: =RC[-46] -> 0 | CG266: =RC[-46] -> 0 | CH266: =RC[-46] -> 0 | CI266: =RC[-46] -> 0 | CJ266: =RC[-46] -> 0 | CK266: =RC[-46] -> 0 | CL266: =RC[-46] -> 1 | CM266: =RC[-46] -> 0 | CN266: =RC[-46] -> 0 | CO266: =RC[-46] -> 5585522.5800000001 | CP266: =RC[-46] -> 0 | CQ266: =RC[-46] -> 91673 | CR266: =RC[-46] -> 275019 | CS266: =RC[-46] -> 183346
A267: 27 | B267: 010672 | C267: Triệu Tuấn Anh | D267: Nhân viên Bốc xếp | E267: 10522162888018 | F267: =RC[29]+RC[30]+RC[31]+RC[32]+RC[33]+RC[34]+RC[35]+RC[36]+RC[37] -> 4902884 | G267: =RC[17]+RC[18]++RC[19]+RC[20]+RC[21]+RC[38]+RC[39]+RC[41] -> 0 | H267: 0 | I267: 0 | J267: =RC[-2]+RC[-1] -> 0 | K267: 0 | L267: 680000 | M267: 298253 | N267: =RC[15]+RC[16]+RC[17]+RC[18]+RC[19]+RC[20] -> 299250 | O267: 0 | P267: 0 | Q267: 6180387 | R267: 227240 | S267: 42608 | T267: 28405 | U267: 58821.34 | V267: 0 | W267: 5823312.6600000001 | X267: 0 | Y267: 0 | Z267: 0 | AA267: 0 | AB267: 0 | AC267: 0 | AD267: 0 | AE267: 0 | AF267: 0 | AG267: 0 | AH267: 299250 | AI267: 4902884 | AJ267: 0 | AK267: 0 | AL267: 0 | AM267: 0 | AN267: 0 | AO267: 0 | AP267: 0 | AQ267: 0 | AR267: =1 -> 1 | AS267: 0 | AT267: 0 | AU267: =RC[-30]-RC[-29]-RC[-28]-RC[-27]-RC[-26]-RC[-25] -> 5823312.6600000001 | AV267: 0 | AW267: =RC[1]-RC[2] -> 99750 | AX267: 299250 | AY267: 199500 | AZ267: =RC[-46] -> 4902884 | BA267: =RC[-46] -> 0 | BB267: =RC[-46] -> 0 | BC267: =RC[-46] -> 0 | BD267: =RC[-46] -> 0 | BE267: =RC[-46] -> 0 | BF267: =RC[-46] -> 680000 | BG267: =RC[-46] -> 298253 | BH267: =RC[-46] -> 299250 | BI267: =RC[-46] -> 0 | BJ267: =RC[-46] -> 0 | BK267: =RC[-46] -> 6180387 | BL267: =RC[-46] -> 227240 | BM267: =RC[-46] -> 42608 | BN267: =RC[-46] -> 28405 | BO267: =RC[-46] -> 58821.34 | BP267: =RC[-46] -> 0 | BQ267: =RC[-46] -> 5823312.6600000001 | BR267: =RC[-46] -> 0 | BS267: =RC[-46] -> 0 | BT267: =RC[-46] -> 0 | BU267: =RC[-46] -> 0 | BV267: =RC[-46] -> 0 | BW267: =RC[-46] -> 0 | BX267: =RC[-46] -> 0 | BY267: =RC[-46] -> 0 | BZ267: =RC[-46] -> 0 | CA267: =RC[-46] -> 0 | CB267: =RC[-46] -> 299250 | CC267: =RC[-46] -> 4902884 | CD267: =RC[-46] -> 0 | CE267: =RC[-46] -> 0 | CF267: =RC[-46] -> 0 | CG267: =RC[-46] -> 0 | CH267: =RC[-46] -> 0 | CI267: =RC[-46] -> 0 | CJ267: =RC[-46] -> 0 | CK267: =RC[-46] -> 0 | CL267: =RC[-46] -> 1 | CM267: =RC[-46] -> 0 | CN267: =RC[-46] -> 0 | CO267: =RC[-46] -> 5823312.6600000001 | CP267: =RC[-46] -> 0 | CQ267: =RC[-46] -> 99750 | CR267: =RC[-46] -> 299250 | CS267: =RC[-46] -> 199500
A268: 28 | B268: 010673 | C268: Đặng Xuân Sơn | D268: Nhân viên Bốc xếp | E268: 10522162937019 | F268: =RC[29]+RC[30]+RC[31]+RC[32]+RC[33]+RC[34]+RC[35]+RC[36]+RC[37] -> 4640229 | G268: =RC[17]+RC[18]++RC[19]+RC[20]+RC[21]+RC[38]+RC[39]+RC[41] -> 0 | H268: 0 | I268: 0 | J268: =RC[-2]+RC[-1] -> 0 | K268: 0 | L268: 680000 | M268: 274103 | N268: =RC[15]+RC[16]+RC[17]+RC[18]+RC[19]+RC[20] -> 275019 | O268: 0 | P268: 0 | Q268: 5869351 | R268: 208840 | S268: 39158 | T268: 26105 | U268: 55952.480000000003 | V268: 0 | W268: 5539295.5199999996 | X268: 0 | Y268: 0 | Z268: 0 | AA268: 0 | AB268: 0 | AC268: 0 | AD268: 0 | AE268: 0 | AF268: 0 | AG268: 0 | AH268: 275019 | AI268: 4640229 | AJ268: 0 | AK268: 0 | AL268: 0 | AM268: 0 | AN268: 0 | AO268: 0 | AP268: 0 | AQ268: 0 | AR268: =1 -> 1 | AS268: 0 | AT268: 0 | AU268: =RC[-30]-RC[-29]-RC[-28]-RC[-27]-RC[-26]-RC[-25] -> 5539295.5199999996 | AV268: 0 | AW268: =RC[1]-RC[2] -> 91673 | AX268: 275019 | AY268: 183346 | AZ268: =RC[-46] -> 4640229 | BA268: =RC[-46] -> 0 | BB268: =RC[-46] -> 0 | BC268: =RC[-46] -> 0 | BD268: =RC[-46] -> 0 | BE268: =RC[-46] -> 0 | BF268: =RC[-46] -> 680000 | BG268: =RC[-46] -> 274103 | BH268: =RC[-46] -> 275019 | BI268: =RC[-46] -> 0 | BJ268: =RC[-46] -> 0 | BK268: =RC[-46] -> 5869351 | BL268: =RC[-46] -> 208840 | BM268: =RC[-46] -> 39158 | BN268: =RC[-46] -> 26105 | BO268: =RC[-46] -> 55952.480000000003 | BP268: =RC[-46] -> 0 | BQ268: =RC[-46] -> 5539295.5199999996 | BR268: =RC[-46] -> 0 | BS268: =RC[-46] -> 0 | BT268: =RC[-46] -> 0 | BU268: =RC[-46] -> 0 | BV268: =RC[-46] -> 0 | BW268: =RC[-46] -> 0 | BX268: =RC[-46] -> 0 | BY268: =RC[-46] -> 0 | BZ268: =RC[-46] -> 0 | CA268: =RC[-46] -> 0 | CB268: =RC[-46] -> 275019 | CC268: =RC[-46] -> 4640229 | CD268: =RC[-46] -> 0 | CE268: =RC[-46] -> 0 | CF268: =RC[-46] -> 0 | CG268: =RC[-46] -> 0 | CH268: =RC[-46] -> 0 | CI268: =RC[-46] -> 0 | CJ268: =RC[-46] -> 0 | CK268: =RC[-46] -> 0 | CL268: =RC[-46] -> 1 | CM268: =RC[-46] -> 0 | CN268: =RC[-46] -> 0 | CO268: =RC[-46] -> 5539295.5199999996 | CP268: =RC[-46] -> 0 | CQ268: =RC[-46] -> 91673 | CR268: =RC[-46] -> 275019 | CS268: =RC[-46] -> 183346
A269: 29 | B269: 010674 | C269: Nguyễn Văn Tuế | D269: Nhân viên Bốc xếp | E269: 10523498981012 | F269: =RC[29]+RC[30]+RC[31]+RC[32]+RC[33]+RC[34]+RC[35]+RC[36]+RC[37] -> 4932067 | G269: =RC[17]+RC[18]++RC[19]+RC[20]+RC[21]+RC[38]+RC[39]+RC[41] -> 0 | H269: 0 | I269: 0 | J269: =RC[-2]+RC[-1] -> 0 | K269: 105000 | L269: 680000 | M269: 235463 | N269: =RC[15]+RC[16]+RC[17]+RC[18]+RC[19]+RC[20] -> 236250 | O269: 0 | P269: 0 | Q269: 6188780 | R269: 179400 | S269: 33638 | T269: 22425 | U269: 59533.17 | V269: 0 | W269: 5893783.8300000001 | X269: 0 | Y269: 0 | Z269: 0 | AA269: 0 | AB269: 0 | AC269: 0 | AD269: 0 | AE269: 0 | AF269: 0 | AG269: 0 | AH269: 236250 | AI269: 4932067 | AJ269: 0 | AK269: 0 | AL269: 0 | AM269: 0 | AN269: 0 | AO269: 0 | AP269: 0 | AQ269: 0 | AR269: =1 -> 1 | AS269: 0 | AT269: 0 | AU269: =RC[-30]-RC[-29]-RC[-28]-RC[-27]-RC[-26]-RC[-25] -> 5893783.8300000001 | AV269: 0 | AW269: =RC[1]-RC[2] -> 78750 | AX269: 236250 | AY269: 157500 | AZ269: =RC[-46] -> 4932067 | BA269: =RC[-46] -> 0 | BB269: =RC[-46] -> 0 | BC269: =RC[-46] -> 0 | BD269: =RC[-46] -> 0 | BE269: =RC[-46] -> 105000 | BF269: =RC[-46] -> 680000 | BG269: =RC[-46] -> 235463 | BH269: =RC[-46] -> 236250 | BI269: =RC[-46] -> 0 | BJ269: =RC[-46] -> 0 | BK269: =RC[-46] -> 6188780 | BL269: =RC[-46] -> 179400 | BM269: =RC[-46] -> 33638 | BN269: =RC[-46] -> 22425 | BO269: =RC[-46] -> 59533.17 | BP269: =RC[-46] -> 0 | BQ269: =RC[-46] -> 5893783.8300000001 | BR269: =RC[-46] -> 0 | BS269: =RC[-46] -> 0 | BT269: =RC[-46] -> 0 | BU269: =RC[-46] -> 0 | BV269: =RC[-46] -> 0 | BW269: =RC[-46] -> 0 | BX269: =RC[-46] -> 0 | BY269: =RC[-46] -> 0 | BZ269: =RC[-46] -> 0 | CA269: =RC[-46] -> 0 | CB269: =RC[-46] -> 236250 | CC269: =RC[-46] -> 4932067 | CD269: =RC[-46] -> 0 | CE269: =RC[-46] -> 0 | CF269: =RC[-46] -> 0 | CG269: =RC[-46] -> 0 | CH269: =RC[-46] -> 0 | CI269: =RC[-46] -> 0 | CJ269: =RC[-46] -> 0 | CK269: =RC[-46] -> 0 | CL269: =RC[-46] -> 1 | CM269: =RC[-46] -> 0 | CN269: =RC[-46] -> 0 | CO269: =RC[-46] -> 5893783.8300000001 | CP269: =RC[-46] -> 0 | CQ269: =RC[-46] -> 78750 | CR269: =RC[-46] -> 236250 | CS269: =RC[-46] -> 157500
A270: 30 | B270: 010675 | C270: Phạm Văn Bảy | D270: Nhân viên Bốc xếp | E270: 10523215468012 | F270: =RC[29]+RC[30]+RC[31]+RC[32]+RC[33]+RC[34]+RC[35]+RC[36]+RC[37] -> 4284186 | G270: =RC[17]+RC[18]++RC[19]+RC[20]+RC[21]+RC[38]+RC[39]+RC[41] -> 157500 | H270: 0 | I270: 0 | J270: =RC[-2]+RC[-1] -> 0 | K270: 0 | L270: 627692 | M270: 235463 | N270: =RC[15]+RC[16]+RC[17]+RC[18]+RC[19]+RC[20] -> 236250 | O270: 0 | P270: 0 | Q270: 5541091 | R270: 179400 | S270: 33638 | T270: 22425 | U270: 53056.28 | V270: 0 | W270: 5252571.72 | X270: 0 | Y270: 157500 | Z270: 0 | AA270: 0 | AB270: 0 | AC270: 0 | AD270: 0 | AE270: 0 | AF270: 0 | AG270: 0 | AH270: 236250 | AI270: 4284186 | AJ270: 0 | AK270: 0 | AL270: 0 | AM270: 0 | AN270: 0 | AO270: 0 | AP270: 0 | AQ270: 0 | AR270: =1 -> 1 | AS270: 0 | AT270: 0 | AU270: =RC[-30]-RC[-29]-RC[-28]-RC[-27]-RC[-26]-RC[-25] -> 5252571.72 | AV270: 0 | AW270: =RC[1]-RC[2] -> 78750 | AX270: 236250 | AY270: 157500 | AZ270: =RC[-46] -> 4284186 | BA270: =RC[-46] -> 157500 | BB270: =RC[-46] -> 0 | BC270: =RC[-46] -> 0 | BD270: =RC[-46] -> 0 | BE270: =RC[-46] -> 0 | BF270: =RC[-46] -> 627692 | BG270: =RC[-46] -> 235463 | BH270: =RC[-46] -> 236250 | BI270: =RC[-46] -> 0 | BJ270: =RC[-46] -> 0 | BK270: =RC[-46] -> 5541091 | BL270: =RC[-46] -> 179400 | BM270: =RC[-46] -> 33638 | BN270: =RC[-46] -> 22425 | BO270: =RC[-46] -> 53056.28 | BP270: =RC[-46] -> 0 | BQ270: =RC[-46] -> 5252571.72 | BR270: =RC[-46] -> 0 | BS270: =RC[-46] -> 157500 | BT270: =RC[-46] -> 0 | BU270: =RC[-46] -> 0 | BV270: =RC[-46] -> 0 | BW270: =RC[-46] -> 0 | BX270: =RC[-46] -> 0 | BY270: =RC[-46] -> 0 | BZ270: =RC[-46] -> 0 | CA270: =RC[-46] -> 0 | CB270: =RC[-46] -> 236250 | CC270: =RC[-46] -> 4284186 | CD270: =RC[-46] -> 0 | CE270: =RC[-46] -> 0 | CF270: =RC[-46] -> 0 | CG270: =RC[-46] -> 0 | CH270: =RC[-46] -> 0 | CI270: =RC[-46] -> 0 | CJ270: =RC[-46] -> 0 | CK270: =RC[-46] -> 0 | CL270: =RC[-46] -> 1 | CM270: =RC[-46] -> 0 | CN270: =RC[-46] -> 0 | CO270: =RC[-46] -> 5252571.72 | CP270: =RC[-46] -> 0 | CQ270: =RC[-46] -> 78750 | CR270: =RC[-46] -> 236250 | CS270: =RC[-46] -> 157500
A271: 31 | B271: 010676 | C271: Vương Khắc Hoà | D271: Nhân viên Bốc xếp | E271: 10522162941016 | F271: =RC[29]+RC[30]+RC[31]+RC[32]+RC[33]+RC[34]+RC[35]+RC[36]+RC[37] -> 4657739 | G271: =RC[17]+RC[18]++RC[19]+RC[20]+RC[21]+RC[38]+RC[39]+RC[41] -> 0 | H271: 0 | I271: 0 | J271: =RC[-2]+RC[-1] -> 0 | K271: 0 | L271: 680000 | M271: 298253 | N271: =RC[15]+RC[16]+RC[17]+RC[18]+RC[19]+RC[20] -> 299250 | O271: 0 | P271: 0 | Q271: 5935242 | R271: 227240 | S271: 42608 | T271: 28405 | U271: 56369.89 | V271: 0 | W271: 5580619.1100000003 | X271: 0 | Y271: 0 | Z271: 0 | AA271: 0 | AB271: 0 | AC271: 0 | AD271: 0 | AE271: 0 | AF271: 0 | AG271: 0 | AH271: 299250 | AI271: 4657739 | AJ271: 0 | AK271: 0 | AL271: 0 | AM271: 0 | AN271: 0 | AO271: 0 | AP271: 0 | AQ271: 0 | AR271: =1 -> 1 | AS271: 0 | AT271: 0 | AU271: =RC[-30]-RC[-29]-RC[-28]-RC[-27]-RC[-26]-RC[-25] -> 5580619.1100000003 | AV271: 0 | AW271: =RC[1]-RC[2] -> 99750 | AX271: 299250 | AY271: 199500 | AZ271: =RC[-46] -> 4657739 | BA271: =RC[-46] -> 0 | BB271: =RC[-46] -> 0 | BC271: =RC[-46] -> 0 | BD271: =RC[-46] -> 0 | BE271: =RC[-46] -> 0 | BF271: =RC[-46] -> 680000 | BG271: =RC[-46] -> 298253 | BH271: =RC[-46] -> 299250 | BI271: =RC[-46] -> 0 | BJ271: =RC[-46] -> 0 | BK271: =RC[-46] -> 5935242 | BL271: =RC[-46] -> 227240 | BM271: =RC[-46] -> 42608 | BN271: =RC[-46] -> 28405 | BO271: =RC[-46] -> 56369.89 | BP271: =RC[-46] -> 0 | BQ271: =RC[-46] -> 5580619.1100000003 | BR271: =RC[-46] -> 0 | BS271: =RC[-46] -> 0 | BT271: =RC[-46] -> 0 | BU271: =RC[-46] -> 0 | BV271: =RC[-46] -> 0 | BW271: =RC[-46] -> 0 | BX271: =RC[-46] -> 0 | BY271: =RC[-46] -> 0 | BZ271: =RC[-46] -> 0 | CA271: =RC[-46] -> 0 | CB271: =RC[-46] -> 299250 | CC271: =RC[-46] -> 4657739 | CD271: =RC[-46] -> 0 | CE271: =RC[-46] -> 0 | CF271: =RC[-46] -> 0 | CG271: =RC[-46] -> 0 | CH271: =RC[-46] -> 0 | CI271: =RC[-46] -> 0 | CJ271: =RC[-46] -> 0 | CK271: =RC[-46] -> 0 | CL271: =RC[-46] -> 1 | CM271: =RC[-46] -> 0 | CN271: =RC[-46] -> 0 | CO271: =RC[-46] -> 5580619.1100000003 | CP271: =RC[-46] -> 0 | CQ271: =RC[-46] -> 99750 | CR271: =RC[-46] -> 299250 | CS271: =RC[-46] -> 199500
A272: 32 | B272: 010677 | C272: Vũ Văn Thành | D272: Nhân viên Bốc xếp | E272: 10523498949011 | F272: =RC[29]+RC[30]+RC[31]+RC[32]+RC[33]+RC[34]+RC[35]+RC[36]+RC[37] -> 3496223 | G272: =RC[17]+RC[18]++RC[19]+RC[20]+RC[21]+RC[38]+RC[39]+RC[41] -> 472500 | H272: 0 | I272: 0 | J272: =RC[-2]+RC[-1] -> 0 | K272: 0 | L272: 523077 | M272: 235463 | N272: =RC[15]+RC[16]+RC[17]+RC[18]+RC[19]+RC[20] -> 236250 | O272: 0 | P272: 0 | Q272: 4963513 | R272: 179400 | S272: 33638 | T272: 22425 | U272: 47280.5 | V272: 0 | W272: 4680769.5 | X272: 0 | Y272: 472500 | Z272: 0 | AA272: 0 | AB272: 0 | AC272: 0 | AD272: 0 | AE272: 0 | AF272: 0 | AG272: 0 | AH272: 236250 | AI272: 3496223 | AJ272: 0 | AK272: 0 | AL272: 0 | AM272: 0 | AN272: 0 | AO272: 0 | AP272: 0 | AQ272: 0 | AR272: =1 -> 1 | AS272: 0 | AT272: 0 | AU272: =RC[-30]-RC[-29]-RC[-28]-RC[-27]-RC[-26]-RC[-25] -> 4680769.5 | AV272: 0 | AW272: =RC[1]-RC[2] -> 78750 | AX272: 236250 | AY272: 157500 | AZ272: =RC[-46] -> 3496223 | BA272: =RC[-46] -> 472500 | BB272: =RC[-46] -> 0 | BC272: =RC[-46] -> 0 | BD272: =RC[-46] -> 0 | BE272: =RC[-46] -> 0 | BF272: =RC[-46] -> 523077 | BG272: =RC[-46] -> 235463 | BH272: =RC[-46] -> 236250 | BI272: =RC[-46] -> 0 | BJ272: =RC[-46] -> 0 | BK272: =RC[-46] -> 4963513 | BL272: =RC[-46] -> 179400 | BM272: =RC[-46] -> 33638 | BN272: =RC[-46] -> 22425 | BO272: =RC[-46] -> 47280.5 | BP272: =RC[-46] -> 0 | BQ272: =RC[-46] -> 4680769.5 | BR272: =RC[-46] -> 0 | BS272: =RC[-46] -> 472500 | BT272: =RC[-46] -> 0 | BU272: =RC[-46] -> 0 | BV272: =RC[-46] -> 0 | BW272: =RC[-46] -> 0 | BX272: =RC[-46] -> 0 | BY272: =RC[-46] -> 0 | BZ272: =RC[-46] -> 0 | CA272: =RC[-46] -> 0 | CB272: =RC[-46] -> 236250 | CC272: =RC[-46] -> 3496223 | CD272: =RC[-46] -> 0 | CE272: =RC[-46] -> 0 | CF272: =RC[-46] -> 0 | CG272: =RC[-46] -> 0 | CH272: =RC[-46] -> 0 | CI272: =RC[-46] -> 0 | CJ272: =RC[-46] -> 0 | CK272: =RC[-46] -> 0 | CL272: =RC[-46] -> 1 | CM272: =RC[-46] -> 0 | CN272: =RC[-46] -> 0 | CO272: =RC[-46] -> 4680769.5 | CP272: =RC[-46] -> 0 | CQ272: =RC[-46] -> 78750 | CR272: =RC[-46] -> 236250 | CS272: =RC[-46] -> 157500
A273: 33 | B273: 010678 | C273: Phạm Thanh Quang | D273: Nhân viên Bốc xếp | E273: 10523498951016 | F273: =RC[29]+RC[30]+RC[31]+RC[32]+RC[33]+RC[34]+RC[35]+RC[36]+RC[37] -> 4377575 | G273: =RC[17]+RC[18]++RC[19]+RC[20]+RC[21]+RC[38]+RC[39]+RC[41] -> 0 | H273: 0 | I273: 0 | J273: =RC[-2]+RC[-1] -> 0 | K273: 0 | L273: 680000 | M273: 235463 | N273: =RC[15]+RC[16]+RC[17]+RC[18]+RC[19]+RC[20] -> 236250 | O273: 0 | P273: 0 | Q273: 5529288 | R273: 179400 | S273: 33638 | T273: 22425 | U273: 52938.25 | V273: 0 | W273: 5240886.75 | X273: 0 | Y273: 0 | Z273: 0 | AA273: 0 | AB273: 0 | AC273: 0 | AD273: 0 | AE273: 0 | AF273: 0 | AG273: 0 | AH273: 236250 | AI273: 4377575 | AJ273: 0 | AK273: 0 | AL273: 0 | AM273: 0 | AN273: 0 | AO273: 0 | AP273: 0 | AQ273: 0 | AR273: =1 -> 1 | AS273: 0 | AT273: 0 | AU273: =RC[-30]-RC[-29]-RC[-28]-RC[-27]-RC[-26]-RC[-25] -> 5240886.75 | AV273: 0 | AW273: =RC[1]-RC[2] -> 78750 | AX273: 236250 | AY273: 157500 | AZ273: =RC[-46] -> 4377575 | BA273: =RC[-46] -> 0 | BB273: =RC[-46] -> 0 | BC273: =RC[-46] -> 0 | BD273: =RC[-46] -> 0 | BE273: =RC[-46] -> 0 | BF273: =RC[-46] -> 680000 | BG273: =RC[-46] -> 235463 | BH273: =RC[-46] -> 236250 | BI273: =RC[-46] -> 0 | BJ273: =RC[-46] -> 0 | BK273: =RC[-46] -> 5529288 | BL273: =RC[-46] -> 179400 | BM273: =RC[-46] -> 33638 | BN273: =RC[-46] -> 22425 | BO273: =RC[-46] -> 52938.25 | BP273: =RC[-46] -> 0 | BQ273: =RC[-46] -> 5240886.75 | BR273: =RC[-46] -> 0 | BS273: =RC[-46] -> 0 | BT273: =RC[-46] -> 0 | BU273: =RC[-46] -> 0 | BV273: =RC[-46] -> 0 | BW273: =RC[-46] -> 0 | BX273: =RC[-46] -> 0 | BY273: =RC[-46] -> 0 | BZ273: =RC[-46] -> 0 | CA273: =RC[-46] -> 0 | CB273: =RC[-46] -> 236250 | CC273: =RC[-46] -> 4377575 | CD273: =RC[-46] -> 0 | CE273: =RC[-46] -> 0 | CF273: =RC[-46] -> 0 | CG273: =RC[-46] -> 0 | CH273: =RC[-46] -> 0 | CI273: =RC[-46] -> 0 | CJ273: =RC[-46] -> 0 | CK273: =RC[-46] -> 0 | CL273: =RC[-46] -> 1 | CM273: =RC[-46] -> 0 | CN273: =RC[-46] -> 0 | CO273: =RC[-46] -> 5240886.75 | CP273: =RC[-46] -> 0 | CQ273: =RC[-46] -> 78750 | CR273: =RC[-46] -> 236250 | CS273: =RC[-46] -> 157500
A274: 34 | B274: 010679 | C274: Lã Văn Thảo | D274: Nhân viên Bốc xếp | E274: 10523498950011 | F274: =RC[29]+RC[30]+RC[31]+RC[32]+RC[33]+RC[34]+RC[35]+RC[36]+RC[37] -> 4640229 | G274: =RC[17]+RC[18]++RC[19]+RC[20]+RC[21]+RC[38]+RC[39]+RC[41] -> 0 | H274: 0 | I274: 0 | J274: =RC[-2]+RC[-1] -> 0 | K274: 0 | L274: 680000 | M274: 235463 | N274: =RC[15]+RC[16]+RC[17]+RC[18]+RC[19]+RC[20] -> 236250 | O274: 0 | P274: 0 | Q274: 5791942 | R274: 179400 | S274: 33638 | T274: 22425 | U274: 55564.79 | V274: 0 | W274: 5500914.21 | X274: 0 | Y274: 0 | Z274: 0 | AA274: 0 | AB274: 0 | AC274: 0 | AD274: 0 | AE274: 0 | AF274: 0 | AG274: 0 | AH274: 236250 | AI274: 4640229 | AJ274: 0 | AK274: 0 | AL274: 0 | AM274: 0 | AN274: 0 | AO274: 0 | AP274: 0 | AQ274: 0 | AR274: =1 -> 1 | AS274: 0 | AT274: 0 | AU274: =RC[-30]-RC[-29]-RC[-28]-RC[-27]-RC[-26]-RC[-25] -> 5500914.21 | AV274: 0 | AW274: =RC[1]-RC[2] -> 78750 | AX274: 236250 | AY274: 157500 | AZ274: =RC[-46] -> 4640229 | BA274: =RC[-46] -> 0 | BB274: =RC[-46] -> 0 | BC274: =RC[-46] -> 0 | BD274: =RC[-46] -> 0 | BE274: =RC[-46] -> 0 | BF274: =RC[-46] -> 680000 | BG274: =RC[-46] -> 235463 | BH274: =RC[-46] -> 236250 | BI274: =RC[-46] -> 0 | BJ274: =RC[-46] -> 0 | BK274: =RC[-46] -> 5791942 | BL274: =RC[-46] -> 179400 | BM274: =RC[-46] -> 33638 | BN274: =RC[-46] -> 22425 | BO274: =RC[-46] -> 55564.79 | BP274: =RC[-46] -> 0 | BQ274: =RC[-46] -> 5500914.21 | BR274: =RC[-46] -> 0 | BS274: =RC[-46] -> 0 | BT274: =RC[-46] -> 0 | BU274: =RC[-46] -> 0 | BV274: =RC[-46] -> 0 | BW274: =RC[-46] -> 0 | BX274: =RC[-46] -> 0 | BY274: =RC[-46] -> 0 | BZ274: =RC[-46] -> 0 | CA274: =RC[-46] -> 0 | CB274: =RC[-46] -> 236250 | CC274: =RC[-46] -> 4640229 | CD274: =RC[-46] -> 0 | CE274: =RC[-46] -> 0 | CF274: =RC[-46] -> 0 | CG274: =RC[-46] -> 0 | CH274: =RC[-46] -> 0 | CI274: =RC[-46] -> 0 | CJ274: =RC[-46] -> 0 | CK274: =RC[-46] -> 0 | CL274: =RC[-46] -> 1 | CM274: =RC[-46] -> 0 | CN274: =RC[-46] -> 0 | CO274: =RC[-46] -> 5500914.21 | CP274: =RC[-46] -> 0 | CQ274: =RC[-46] -> 78750 | CR274: =RC[-46] -> 236250 | CS274: =RC[-46] -> 157500
A275: 35 | B275: 010680 | C275: Nguyễn Thanh Bình | D275: Nhân viên Bốc xếp | E275: 10522162869013 | F275: =RC[29]+RC[30]+RC[31]+RC[32]+RC[33]+RC[34]+RC[35]+RC[36]+RC[37] -> 4240411 | G275: =RC[17]+RC[18]++RC[19]+RC[20]+RC[21]+RC[38]+RC[39]+RC[41] -> 642115 | H275: 0 | I275: 0 | J275: =RC[-2]+RC[-1] -> 0 | K275: 105000 | L275: 523077 | M275: 319988 | N275: =RC[15]+RC[16]+RC[17]+RC[18]+RC[19]+RC[20] -> 321058 | O275: 0 | P275: 0 | Q275: 6151649 | R275: 243800 | S275: 45713 | T275: 30475 | U275: 58316.61 | V275: 0 | W275: 5773344.3899999997 | X275: 0 | Y275: 642115 | Z275: 0 | AA275: 0 | AB275: 0 | AC275: 0 | AD275: 0 | AE275: 0 | AF275: 0 | AG275: 0 | AH275: 321058 | AI275: 4240411 | AJ275: 0 | AK275: 0 | AL275: 0 | AM275: 0 | AN275: 0 | AO275: 0 | AP275: 0 | AQ275: 0 | AR275: =1 -> 1 | AS275: 0 | AT275: 0 | AU275: =RC[-30]-RC[-29]-RC[-28]-RC[-27]-RC[-26]-RC[-25] -> 5773344.3899999997 | AV275: 0 | AW275: =RC[1]-RC[2] -> 107019.33300000001 | AX275: 321058 | AY275: 214038.66699999999 | AZ275: =RC[-46] -> 4240411 | BA275: =RC[-46] -> 642115 | BB275: =RC[-46] -> 0 | BC275: =RC[-46] -> 0 | BD275: =RC[-46] -> 0 | BE275: =RC[-46] -> 105000 | BF275: =RC[-46] -> 523077 | BG275: =RC[-46] -> 319988 | BH275: =RC[-46] -> 321058 | BI275: =RC[-46] -> 0 | BJ275: =RC[-46] -> 0 | BK275: =RC[-46] -> 6151649 | BL275: =RC[-46] -> 243800 | BM275: =RC[-46] -> 45713 | BN275: =RC[-46] -> 30475 | BO275: =RC[-46] -> 58316.61 | BP275: =RC[-46] -> 0 | BQ275: =RC[-46] -> 5773344.3899999997 | BR275: =RC[-46] -> 0 | BS275: =RC[-46] -> 642115 | BT275: =RC[-46] -> 0 | BU275: =RC[-46] -> 0 | BV275: =RC[-46] -> 0 | BW275: =RC[-46] -> 0 | BX275: =RC[-46] -> 0 | BY275: =RC[-46] -> 0 | BZ275: =RC[-46] -> 0 | CA275: =RC[-46] -> 0 | CB275: =RC[-46] -> 321058 | CC275: =RC[-46] -> 4240411 | CD275: =RC[-46] -> 0 | CE275: =RC[-46] -> 0 | CF275: =RC[-46] -> 0 | CG275: =RC[-46] -> 0 | CH275: =RC[-46] -> 0 | CI275: =RC[-46] -> 0 | CJ275: =RC[-46] -> 0 | CK275: =RC[-46] -> 0 | CL275: =RC[-46] -> 1 | CM275: =RC[-46] -> 0 | CN275: =RC[-46] -> 0 | CO275: =RC[-46] -> 5773344.3899999997 | CP275: =RC[-46] -> 0 | CQ275: =RC[-46] -> 107019.33300000001 | CR275: =RC[-46] -> 321058 | CS275: =RC[-46] -> 214038.66699999999
A276: 36 | B276: 011086 | C276: Nguyễn Quốc Dũng | D276: Nhân viên Bốc xếp | E276: 10823818666017 | F276: =RC[29]+RC[30]+RC[31]+RC[32]+RC[33]+RC[34]+RC[35]+RC[36]+RC[37] -> 4596453 | G276: =RC[17]+RC[18]++RC[19]+RC[20]+RC[21]+RC[38]+RC[39]+RC[41] -> 0 | H276: 0 | I276: 0 | J276: =RC[-2]+RC[-1] -> 0 | K276: 0 | L276: 680000 | M276: 235463 | N276: =RC[15]+RC[16]+RC[17]+RC[18]+RC[19]+RC[20] -> 236250 | O276: 0 | P276: 0 | Q276: 5748166 | R276: 179400 | S276: 33638 | T276: 22425 | U276: 55127.03 | V276: 0 | W276: 5457575.9699999997 | X276: 0 | Y276: 0 | Z276: 0 | AA276: 0 | AB276: 0 | AC276: 0 | AD276: 0 | AE276: 0 | AF276: 0 | AG276: 0 | AH276: 236250 | AI276: 4596453 | AJ276: 0 | AK276: 0 | AL276: 0 | AM276: 0 | AN276: 0 | AO276: 0 | AP276: 0 | AQ276: 0 | AR276: =1 -> 1 | AS276: 0 | AT276: 0 | AU276: =RC[-30]-RC[-29]-RC[-28]-RC[-27]-RC[-26]-RC[-25] -> 5457575.9699999997 | AV276: 0 | AW276: =RC[1]-RC[2] -> 78750 | AX276: 236250 | AY276: 157500 | AZ276: =RC[-46] -> 4596453 | BA276: =RC[-46] -> 0 | BB276: =RC[-46] -> 0 | BC276: =RC[-46] -> 0 | BD276: =RC[-46] -> 0 | BE276: =RC[-46] -> 0 | BF276: =RC[-46] -> 680000 | BG276: =RC[-46] -> 235463 | BH276: =RC[-46] -> 236250 | BI276: =RC[-46] -> 0 | BJ276: =RC[-46] -> 0 | BK276: =RC[-46] -> 5748166 | BL276: =RC[-46] -> 179400 | BM276: =RC[-46] -> 33638 | BN276: =RC[-46] -> 22425 | BO276: =RC[-46] -> 55127.03 | BP276: =RC[-46] -> 0 | BQ276: =RC[-46] -> 5457575.9699999997 | BR276: =RC[-46] -> 0 | BS276: =RC[-46] -> 0 | BT276: =RC[-46] -> 0 | BU276: =RC[-46] -> 0 | BV276: =RC[-46] -> 0 | BW276: =RC[-46] -> 0 | BX276: =RC[-46] -> 0 | BY276: =RC[-46] -> 0 | BZ276: =RC[-46] -> 0 | CA276: =RC[-46] -> 0 | CB276: =RC[-46] -> 236250 | CC276: =RC[-46] -> 4596453 | CD276: =RC[-46] -> 0 | CE276: =RC[-46] -> 0 | CF276: =RC[-46] -> 0 | CG276: =RC[-46] -> 0 | CH276: =RC[-46] -> 0 | CI276: =RC[-46] -> 0 | CJ276: =RC[-46] -> 0 | CK276: =RC[-46] -> 0 | CL276: =RC[-46] -> 1 | CM276: =RC[-46] -> 0 | CN276: =RC[-46] -> 0 | CO276: =RC[-46] -> 5457575.9699999997 | CP276: =RC[-46] -> 0 | CQ276: =RC[-46] -> 78750 | CR276: =RC[-46] -> 236250 | CS276: =RC[-46] -> 157500
A277: 37 | B277: 011087 | C277: Phan Thế Hòa | D277: Nhân viên Bốc xếp | E277: 19026970127011 | F277: =RC[29]+RC[30]+RC[31]+RC[32]+RC[33]+RC[34]+RC[35]+RC[36]+RC[37] -> 4377575 | G277: =RC[17]+RC[18]++RC[19]+RC[20]+RC[21]+RC[38]+RC[39]+RC[41] -> 0 | H277: 0 | I277: 0 | J277: =RC[-2]+RC[-1] -> 0 | K277: 0 | L277: 680000 | M277: 235463 | N277: =RC[15]+RC[16]+RC[17]+RC[18]+RC[19]+RC[20] -> 236250 | O277: 0 | P277: 0 | Q277: 5529288 | R277: 179400 | S277: 33638 | T277: 22425 | U277: 52938.25 | V277: 0 | W277: 5240886.75 | X277: 0 | Y277: 0 | Z277: 0 | AA277: 0 | AB277: 0 | AC277: 0 | AD277: 0 | AE277: 0 | AF277: 0 | AG277: 0 | AH277: 236250 | AI277: 4377575 | AJ277: 0 | AK277: 0 | AL277: 0 | AM277: 0 | AN277: 0 | AO277: 0 | AP277: 0 | AQ277: 0 | AR277: =1 -> 1 | AS277: 0 | AT277: 0 | AU277: =RC[-30]-RC[-29]-RC[-28]-RC[-27]-RC[-26]-RC[-25] -> 5240886.75 | AV277: 0 | AW277: =RC[1]-RC[2] -> 78750 | AX277: 236250 | AY277: 157500 | AZ277: =RC[-46] -> 4377575 | BA277: =RC[-46] -> 0 | BB277: =RC[-46] -> 0 | BC277: =RC[-46] -> 0 | BD277: =RC[-46] -> 0 | BE277: =RC[-46] -> 0 | BF277: =RC[-46] -> 680000 | BG277: =RC[-46] -> 235463 | BH277: =RC[-46] -> 236250 | BI277: =RC[-46] -> 0 | BJ277: =RC[-46] -> 0 | BK277: =RC[-46] -> 5529288 | BL277: =RC[-46] -> 179400 | BM277: =RC[-46] -> 33638 | BN277: =RC[-46] -> 22425 | BO277: =RC[-46] -> 52938.25 | BP277: =RC[-46] -> 0 | BQ277: =RC[-46] -> 5240886.75 | BR277: =RC[-46] -> 0 | BS277: =RC[-46] -> 0 | BT277: =RC[-46] -> 0 | BU277: =RC[-46] -> 0 | BV277: =RC[-46] -> 0 | BW277: =RC[-46] -> 0 | BX277: =RC[-46] -> 0 | BY277: =RC[-46] -> 0 | BZ277: =RC[-46] -> 0 | CA277: =RC[-46] -> 0 | CB277: =RC[-46] -> 236250 | CC277: =RC[-46] -> 4377575 | CD277: =RC[-46] -> 0 | CE277: =RC[-46] -> 0 | CF277: =RC[-46] -> 0 | CG277: =RC[-46] -> 0 | CH277: =RC[-46] -> 0 | CI277: =RC[-46] -> 0 | CJ277: =RC[-46] -> 0 | CK277: =RC[-46] -> 0 | CL277: =RC[-46] -> 1 | CM277: =RC[-46] -> 0 | CN277: =RC[-46] -> 0 | CO277: =RC[-46] -> 5240886.75 | CP277: =RC[-46] -> 0 | CQ277: =RC[-46] -> 78750 | CR277: =RC[-46] -> 236250 | CS277: =RC[-46] -> 157500
A278: 38 | B278: 011091 | C278: Nguyễn Như Cương | D278: Nhân viên Bốc xếp | E278: 19026970130012 | F278: =RC[29]+RC[30]+RC[31]+RC[32]+RC[33]+RC[34]+RC[35]+RC[36]+RC[37] -> 4158696 | G278: =RC[17]+RC[18]++RC[19]+RC[20]+RC[21]+RC[38]+RC[39]+RC[41] -> 0 | H278: 0 | I278: 0 | J278: =RC[-2]+RC[-1] -> 0 | K278: 0 | L278: 680000 | M278: 235463 | N278: =RC[15]+RC[16]+RC[17]+RC[18]+RC[19]+RC[20] -> 236250 | O278: 0 | P278: 0 | Q278: 5310409 | R278: 179400 | S278: 33638 | T278: 22425 | U278: 50749.46 | V278: 0 | W278: 5024196.54 | X278: 0 | Y278: 0 | Z278: 0 | AA278: 0 | AB278: 0 | AC278: 0 | AD278: 0 | AE278: 0 | AF278: 0 | AG278: 0 | AH278: 236250 | AI278: 4158696 | AJ278: 0 | AK278: 0 | AL278: 0 | AM278: 0 | AN278: 0 | AO278: 0 | AP278: 0 | AQ278: 0 | AR278: =1 -> 1 | AS278: 0 | AT278: 0 | AU278: =RC[-30]-RC[-29]-RC[-28]-RC[-27]-RC[-26]-RC[-25] -> 5024196.54 | AV278: 0 | AW278: =RC[1]-RC[2] -> 78750 | AX278: 236250 | AY278: 157500 | AZ278: =RC[-46] -> 4158696 | BA278: =RC[-46] -> 0 | BB278: =RC[-46] -> 0 | BC278: =RC[-46] -> 0 | BD278: =RC[-46] -> 0 | BE278: =RC[-46] -> 0 | BF278: =RC[-46] -> 680000 | BG278: =RC[-46] -> 235463 | BH278: =RC[-46] -> 236250 | BI278: =RC[-46] -> 0 | BJ278: =RC[-46] -> 0 | BK278: =RC[-46] -> 5310409 | BL278: =RC[-46] -> 179400 | BM278: =RC[-46] -> 33638 | BN278: =RC[-46] -> 22425 | BO278: =RC[-46] -> 50749.46 | BP278: =RC[-46] -> 0 | BQ278: =RC[-46] -> 5024196.54 | BR278: =RC[-46] -> 0 | BS278: =RC[-46] -> 0 | BT278: =RC[-46] -> 0 | BU278: =RC[-46] -> 0 | BV278: =RC[-46] -> 0 | BW278: =RC[-46] -> 0 | BX278: =RC[-46] -> 0 | BY278: =RC[-46] -> 0 | BZ278: =RC[-46] -> 0 | CA278: =RC[-46] -> 0 | CB278: =RC[-46] -> 236250 | CC278: =RC[-46] -> 4158696 | CD278: =RC[-46] -> 0 | CE278: =RC[-46] -> 0 | CF278: =RC[-46] -> 0 | CG278: =RC[-46] -> 0 | CH278: =RC[-46] -> 0 | CI278: =RC[-46] -> 0 | CJ278: =RC[-46] -> 0 | CK278: =RC[-46] -> 0 | CL278: =RC[-46] -> 1 | CM278: =RC[-46] -> 0 | CN278: =RC[-46] -> 0 | CO278: =RC[-46] -> 5024196.54 | CP278: =RC[-46] -> 0 | CQ278: =RC[-46] -> 78750 | CR278: =RC[-46] -> 236250 | CS278: =RC[-46] -> 157500
A279: 39 | B279: 011092 | C279: Nguyễn Thành Long | D279: Nhân viên Bốc xếp | E279: 10521950496019 | F279: =RC[29]+RC[30]+RC[31]+RC[32]+RC[33]+RC[34]+RC[35]+RC[36]+RC[37] -> 4377575 | G279: =RC[17]+RC[18]++RC[19]+RC[20]+RC[21]+RC[38]+RC[39]+RC[41] -> 0 | H279: 0 | I279: 0 | J279: =RC[-2]+RC[-1] -> 0 | K279: 0 | L279: 680000 | M279: 235463 | N279: =RC[15]+RC[16]+RC[17]+RC[18]+RC[19]+RC[20] -> 236250 | O279: 0 | P279: 0 | Q279: 5529288 | R279: 179400 | S279: 33638 | T279: 22425 | U279: 52938.25 | V279: 0 | W279: 5240886.75 | X279: 0 | Y279: 0 | Z279: 0 | AA279: 0 | AB279: 0 | AC279: 0 | AD279: 0 | AE279: 0 | AF279: 0 | AG279: 0 | AH279: 236250 | AI279: 4377575 | AJ279: 0 | AK279: 0 | AL279: 0 | AM279: 0 | AN279: 0 | AO279: 0 | AP279: 0 | AQ279: 0 | AR279: =1 -> 1 | AS279: 0 | AT279: 0 | AU279: =RC[-30]-RC[-29]-RC[-28]-RC[-27]-RC[-26]-RC[-25] -> 5240886.75 | AV279: 0 | AW279: =RC[1]-RC[2] -> 78750 | AX279: 236250 | AY279: 157500 | AZ279: =RC[-46] -> 4377575 | BA279: =RC[-46] -> 0 | BB279: =RC[-46] -> 0 | BC279: =RC[-46] -> 0 | BD279: =RC[-46] -> 0 | BE279: =RC[-46] -> 0 | BF279: =RC[-46] -> 680000 | BG279: =RC[-46] -> 235463 | BH279: =RC[-46] -> 236250 | BI279: =RC[-46] -> 0 | BJ279: =RC[-46] -> 0 | BK279: =RC[-46] -> 5529288 | BL279: =RC[-46] -> 179400 | BM279: =RC[-46] -> 33638 | BN279: =RC[-46] -> 22425 | BO279: =RC[-46] -> 52938.25 | BP279: =RC[-46] -> 0 | BQ279: =RC[-46] -> 5240886.75 | BR279: =RC[-46] -> 0 | BS279: =RC[-46] -> 0 | BT279: =RC[-46] -> 0 | BU279: =RC[-46] -> 0 | BV279: =RC[-46] -> 0 | BW279: =RC[-46] -> 0 | BX279: =RC[-46] -> 0 | BY279: =RC[-46] -> 0 | BZ279: =RC[-46] -> 0 | CA279: =RC[-46] -> 0 | CB279: =RC[-46] -> 236250 | CC279: =RC[-46] -> 4377575 | CD279: =RC[-46] -> 0 | CE279: =RC[-46] -> 0 | CF279: =RC[-46] -> 0 | CG279: =RC[-46] -> 0 | CH279: =RC[-46] -> 0 | CI279: =RC[-46] -> 0 | CJ279: =RC[-46] -> 0 | CK279: =RC[-46] -> 0 | CL279: =RC[-46] -> 1 | CM279: =RC[-46] -> 0 | CN279: =RC[-46] -> 0 | CO279: =RC[-46] -> 5240886.75 | CP279: =RC[-46] -> 0 | CQ279: =RC[-46] -> 78750 | CR279: =RC[-46] -> 236250 | CS279: =RC[-46] -> 157500
A280: 40 | B280: 011093 | C280: Đỗ Chí Thanh | D280: Nhân viên Bốc xếp | E280: 19020229093012 | F280: =RC[29]+RC[30]+RC[31]+RC[32]+RC[33]+RC[34]+RC[35]+RC[36]+RC[37] -> 4596453 | G280: =RC[17]+RC[18]++RC[19]+RC[20]+RC[21]+RC[38]+RC[39]+RC[41] -> 0 | H280: 0 | I280: 0 | J280: =RC[-2]+RC[-1] -> 0 | K280: 0 | L280: 680000 | M280: 235463 | N280: =RC[15]+RC[16]+RC[17]+RC[18]+RC[19]+RC[20] -> 236250 | O280: 0 | P280: 0 | Q280: 5748166 | R280: 179400 | S280: 33638 | T280: 22425 | U280: 55127.03 | V280: 0 | W280: 5457575.9699999997 | X280: 0 | Y280: 0 | Z280: 0 | AA280: 0 | AB280: 0 | AC280: 0 | AD280: 0 | AE280: 0 | AF280: 0 | AG280: 0 | AH280: 236250 | AI280: 4596453 | AJ280: 0 | AK280: 0 | AL280: 0 | AM280: 0 | AN280: 0 | AO280: 0 | AP280: 0 | AQ280: 0 | AR280: =1 -> 1 | AS280: 0 | AT280: 0 | AU280: =RC[-30]-RC[-29]-RC[-28]-RC[-27]-RC[-26]-RC[-25] -> 5457575.9699999997 | AV280: 0 | AW280: =RC[1]-RC[2] -> 78750 | AX280: 236250 | AY280: 157500 | AZ280: =RC[-46] -> 4596453 | BA280: =RC[-46] -> 0 | BB280: =RC[-46] -> 0 | BC280: =RC[-46] -> 0 | BD280: =RC[-46] -> 0 | BE280: =RC[-46] -> 0 | BF280: =RC[-46] -> 680000 | BG280: =RC[-46] -> 235463 | BH280: =RC[-46] -> 236250 | BI280: =RC[-46] -> 0 | BJ280: =RC[-46] -> 0 | BK280: =RC[-46] -> 5748166 | BL280: =RC[-46] -> 179400 | BM280: =RC[-46] -> 33638 | BN280: =RC[-46] -> 22425 | BO280: =RC[-46] -> 55127.03 | BP280: =RC[-46] -> 0 | BQ280: =RC[-46] -> 5457575.9699999997 | BR280: =RC[-46] -> 0 | BS280: =RC[-46] -> 0 | BT280: =RC[-46] -> 0 | BU280: =RC[-46] -> 0 | BV280: =RC[-46] -> 0 | BW280: =RC[-46] -> 0 | BX280: =RC[-46] -> 0 | BY280: =RC[-46] -> 0 | BZ280: =RC[-46] -> 0 | CA280: =RC[-46] -> 0 | CB280: =RC[-46] -> 236250 | CC280: =RC[-46] -> 4596453 | CD280: =RC[-46] -> 0 | CE280: =RC[-46] -> 0 | CF280: =RC[-46] -> 0 | CG280: =RC[-46] -> 0 | CH280: =RC[-46] -> 0 | CI280: =RC[-46] -> 0 | CJ280: =RC[-46] -> 0 | CK280: =RC[-46] -> 0 | CL280: =RC[-46] -> 1 | CM280: =RC[-46] -> 0 | CN280: =RC[-46] -> 0 | CO280: =RC[-46] -> 5457575.9699999997 | CP280: =RC[-46] -> 0 | CQ280: =RC[-46] -> 78750 | CR280: =RC[-46] -> 236250 | CS280: =RC[-46] -> 157500
A281: 41 | B281: 011094 | C281: Nguyễn Xuân Đỏ | D281: Nhân viên Bốc xếp | E281: 19026970133011 | F281: =RC[29]+RC[30]+RC[31]+RC[32]+RC[33]+RC[34]+RC[35]+RC[36]+RC[37] -> 3367814 | G281: =RC[17]+RC[18]++RC[19]+RC[20]+RC[21]+RC[38]+RC[39]+RC[41] -> 472500 | H281: 0 | I281: 0 | J281: =RC[-2]+RC[-1] -> 0 | K281: 0 | L281: 523077 | M281: 235463 | N281: =RC[15]+RC[16]+RC[17]+RC[18]+RC[19]+RC[20] -> 236250 | O281: 0 | P281: 0 | Q281: 4835104 | R281: 179400 | S281: 33638 | T281: 22425 | U281: 45996.41 | V281: 0 | W281: 4553644.59 | X281: 0 | Y281: 472500 | Z281: 0 | AA281: 0 | AB281: 0 | AC281: 0 | AD281: 0 | AE281: 0 | AF281: 0 | AG281: 0 | AH281: 236250 | AI281: 3367814 | AJ281: 0 | AK281: 0 | AL281: 0 | AM281: 0 | AN281: 0 | AO281: 0 | AP281: 0 | AQ281: 0 | AR281: =1 -> 1 | AS281: 0 | AT281: 0 | AU281: =RC[-30]-RC[-29]-RC[-28]-RC[-27]-RC[-26]-RC[-25] -> 4553644.59 | AV281: 0 | AW281: =RC[1]-RC[2] -> 78750 | AX281: 236250 | AY281: 157500 | AZ281: =RC[-46] -> 3367814 | BA281: =RC[-46] -> 472500 | BB281: =RC[-46] -> 0 | BC281: =RC[-46] -> 0 | BD281: =RC[-46] -> 0 | BE281: =RC[-46] -> 0 | BF281: =RC[-46] -> 523077 | BG281: =RC[-46] -> 235463 | BH281: =RC[-46] -> 236250 | BI281: =RC[-46] -> 0 | BJ281: =RC[-46] -> 0 | BK281: =RC[-46] -> 4835104 | BL281: =RC[-46] -> 179400 | BM281: =RC[-46] -> 33638 | BN281: =RC[-46] -> 22425 | BO281: =RC[-46] -> 45996.41 | BP281: =RC[-46] -> 0 | BQ281: =RC[-46] -> 4553644.59 | BR281: =RC[-46] -> 0 | BS281: =RC[-46] -> 472500 | BT281: =RC[-46] -> 0 | BU281: =RC[-46] -> 0 | BV281: =RC[-46] -> 0 | BW281: =RC[-46] -> 0 | BX281: =RC[-46] -> 0 | BY281: =RC[-46] -> 0 | BZ281: =RC[-46] -> 0 | CA281: =RC[-46] -> 0 | CB281: =RC[-46] -> 236250 | CC281: =RC[-46] -> 3367814 | CD281: =RC[-46] -> 0 | CE281: =RC[-46] -> 0 | CF281: =RC[-46] -> 0 | CG281: =RC[-46] -> 0 | CH281: =RC[-46] -> 0 | CI281: =RC[-46] -> 0 | CJ281: =RC[-46] -> 0 | CK281: =RC[-46] -> 0 | CL281: =RC[-46] -> 1 | CM281: =RC[-46] -> 0 | CN281: =RC[-46] -> 0 | CO281: =RC[-46] -> 4553644.59 | CP281: =RC[-46] -> 0 | CQ281: =RC[-46] -> 78750 | CR281: =RC[-46] -> 236250 | CS281: =RC[-46] -> 157500
A282: 42 | B282: 011095 | C282: Đỗ Văn Phụng | D282: Nhân viên Bốc xếp | E282: 19026970134018 | F282: =RC[29]+RC[30]+RC[31]+RC[32]+RC[33]+RC[34]+RC[35]+RC[36]+RC[37] -> 3367814 | G282: =RC[17]+RC[18]++RC[19]+RC[20]+RC[21]+RC[38]+RC[39]+RC[41] -> 472500 | H282: 0 | I282: 0 | J282: =RC[-2]+RC[-1] -> 0 | K282: 0 | L282: 523077 | M282: 235463 | N282: =RC[15]+RC[16]+RC[17]+RC[18]+RC[19]+RC[20] -> 236250 | O282: 0 | P282: 0 | Q282: 4835104 | R282: 179400 | S282: 33638 | T282: 22425 | U282: 45996.41 | V282: 0 | W282: 4553644.59 | X282: 0 | Y282: 472500 | Z282: 0 | AA282: 0 | AB282: 0 | AC282: 0 | AD282: 0 | AE282: 0 | AF282: 0 | AG282: 0 | AH282: 236250 | AI282: 3367814 | AJ282: 0 | AK282: 0 | AL282: 0 | AM282: 0 | AN282: 0 | AO282: 0 | AP282: 0 | AQ282: 0 | AR282: =1 -> 1 | AS282: 0 | AT282: 0 | AU282: =RC[-30]-RC[-29]-RC[-28]-RC[-27]-RC[-26]-RC[-25] -> 4553644.59 | AV282: 0 | AW282: =RC[1]-RC[2] -> 78750 | AX282: 236250 | AY282: 157500 | AZ282: =RC[-46] -> 3367814 | BA282: =RC[-46] -> 472500 | BB282: =RC[-46] -> 0 | BC282: =RC[-46] -> 0 | BD282: =RC[-46] -> 0 | BE282: =RC[-46] -> 0 | BF282: =RC[-46] -> 523077 | BG282: =RC[-46] -> 235463 | BH282: =RC[-46] -> 236250 | BI282: =RC[-46] -> 0 | BJ282: =RC[-46] -> 0 | BK282: =RC[-46] -> 4835104 | BL282: =RC[-46] -> 179400 | BM282: =RC[-46] -> 33638 | BN282: =RC[-46] -> 22425 | BO282: =RC[-46] -> 45996.41 | BP282: =RC[-46] -> 0 | BQ282: =RC[-46] -> 4553644.59 | BR282: =RC[-46] -> 0 | BS282: =RC[-46] -> 472500 | BT282: =RC[-46] -> 0 | BU282: =RC[-46] -> 0 | BV282: =RC[-46] -> 0 | BW282: =RC[-46] -> 0 | BX282: =RC[-46] -> 0 | BY282: =RC[-46] -> 0 | BZ282: =RC[-46] -> 0 | CA282: =RC[-46] -> 0 | CB282: =RC[-46] -> 236250 | CC282: =RC[-46] -> 3367814 | CD282: =RC[-46] -> 0 | CE282: =RC[-46] -> 0 | CF282: =RC[-46] -> 0 | CG282: =RC[-46] -> 0 | CH282: =RC[-46] -> 0 | CI282: =RC[-46] -> 0 | CJ282: =RC[-46] -> 0 | CK282: =RC[-46] -> 0 | CL282: =RC[-46] -> 1 | CM282: =RC[-46] -> 0 | CN282: =RC[-46] -> 0 | CO282: =RC[-46] -> 4553644.59 | CP282: =RC[-46] -> 0 | CQ282: =RC[-46] -> 78750 | CR282: =RC[-46] -> 236250 | CS282: =RC[-46] -> 157500
A283: 43 | B283: 011097 | C283: Trần Đình Thăng | D283: Nhân viên Bốc xếp | E283: 19026970136010 | F283: =RC[29]+RC[30]+RC[31]+RC[32]+RC[33]+RC[34]+RC[35]+RC[36]+RC[37] -> 4596453 | G283: =RC[17]+RC[18]++RC[19]+RC[20]+RC[21]+RC[38]+RC[39]+RC[41] -> 0 | H283: 0 | I283: 0 | J283: =RC[-2]+RC[-1] -> 0 | K283: 0 | L283: 680000 | M283: 235463 | N283: =RC[15]+RC[16]+RC[17]+RC[18]+RC[19]+RC[20] -> 236250 | O283: 0 | P283: 0 | Q283: 5748166 | R283: 179400 | S283: 33638 | T283: 22425 | U283: 55127.03 | V283: 0 | W283: 5457575.9699999997 | X283: 0 | Y283: 0 | Z283: 0 | AA283: 0 | AB283: 0 | AC283: 0 | AD283: 0 | AE283: 0 | AF283: 0 | AG283: 0 | AH283: 236250 | AI283: 4596453 | AJ283: 0 | AK283: 0 | AL283: 0 | AM283: 0 | AN283: 0 | AO283: 0 | AP283: 0 | AQ283: 0 | AR283: =1 -> 1 | AS283: 0 | AT283: 0 | AU283: =RC[-30]-RC[-29]-RC[-28]-RC[-27]-RC[-26]-RC[-25] -> 5457575.9699999997 | AV283: 0 | AW283: =RC[1]-RC[2] -> 78750 | AX283: 236250 | AY283: 157500 | AZ283: =RC[-46] -> 4596453 | BA283: =RC[-46] -> 0 | BB283: =RC[-46] -> 0 | BC283: =RC[-46] -> 0 | BD283: =RC[-46] -> 0 | BE283: =RC[-46] -> 0 | BF283: =RC[-46] -> 680000 | BG283: =RC[-46] -> 235463 | BH283: =RC[-46] -> 236250 | BI283: =RC[-46] -> 0 | BJ283: =RC[-46] -> 0 | BK283: =RC[-46] -> 5748166 | BL283: =RC[-46] -> 179400 | BM283: =RC[-46] -> 33638 | BN283: =RC[-46] -> 22425 | BO283: =RC[-46] -> 55127.03 | BP283: =RC[-46] -> 0 | BQ283: =RC[-46] -> 5457575.9699999997 | BR283: =RC[-46] -> 0 | BS283: =RC[-46] -> 0 | BT283: =RC[-46] -> 0 | BU283: =RC[-46] -> 0 | BV283: =RC[-46] -> 0 | BW283: =RC[-46] -> 0 | BX283: =RC[-46] -> 0 | BY283: =RC[-46] -> 0 | BZ283: =RC[-46] -> 0 | CA283: =RC[-46] -> 0 | CB283: =RC[-46] -> 236250 | CC283: =RC[-46] -> 4596453 | CD283: =RC[-46] -> 0 | CE283: =RC[-46] -> 0 | CF283: =RC[-46] -> 0 | CG283: =RC[-46] -> 0 | CH283: =RC[-46] -> 0 | CI283: =RC[-46] -> 0 | CJ283: =RC[-46] -> 0 | CK283: =RC[-46] -> 0 | CL283: =RC[-46] -> 1 | CM283: =RC[-46] -> 0 | CN283: =RC[-46] -> 0 | CO283: =RC[-46] -> 5457575.9699999997 | CP283: =RC[-46] -> 0 | CQ283: =RC[-46] -> 78750 | CR283: =RC[-46] -> 236250 | CS283: =RC[-46] -> 157500
A284: 44 | B284: 011098 | C284: Lương Bá Huỳnh | D284: Nhân viên Bốc xếp | E284: 19026970137017 | F284: =RC[29]+RC[30]+RC[31]+RC[32]+RC[33]+RC[34]+RC[35]+RC[36]+RC[37] -> 4158696 | G284: =RC[17]+RC[18]++RC[19]+RC[20]+RC[21]+RC[38]+RC[39]+RC[41] -> 0 | H284: 0 | I284: 0 | J284: =RC[-2]+RC[-1] -> 0 | K284: 0 | L284: 680000 | M284: 235463 | N284: =RC[15]+RC[16]+RC[17]+RC[18]+RC[19]+RC[20] -> 236250 | O284: 0 | P284: 0 | Q284: 5310409 | R284: 179400 | S284: 33638 | T284: 22425 | U284: 50749.46 | V284: 0 | W284: 5024196.54 | X284: 0 | Y284: 0 | Z284: 0 | AA284: 0 | AB284: 0 | AC284: 0 | AD284: 0 | AE284: 0 | AF284: 0 | AG284: 0 | AH284: 236250 | AI284: 4158696 | AJ284: 0 | AK284: 0 | AL284: 0 | AM284: 0 | AN284: 0 | AO284: 0 | AP284: 0 | AQ284: 0 | AR284: =1 -> 1 | AS284: 0 | AT284: 0 | AU284: =RC[-30]-RC[-29]-RC[-28]-RC[-27]-RC[-26]-RC[-25] -> 5024196.54 | AV284: 0 | AW284: =RC[1]-RC[2] -> 78750 | AX284: 236250 | AY284: 157500 | AZ284: =RC[-46] -> 4158696 | BA284: =RC[-46] -> 0 | BB284: =RC[-46] -> 0 | BC284: =RC[-46] -> 0 | BD284: =RC[-46] -> 0 | BE284: =RC[-46] -> 0 | BF284: =RC[-46] -> 680000 | BG284: =RC[-46] -> 235463 | BH284: =RC[-46] -> 236250 | BI284: =RC[-46] -> 0 | BJ284: =RC[-46] -> 0 | BK284: =RC[-46] -> 5310409 | BL284: =RC[-46] -> 179400 | BM284: =RC[-46] -> 33638 | BN284: =RC[-46] -> 22425 | BO284: =RC[-46] -> 50749.46 | BP284: =RC[-46] -> 0 | BQ284: =RC[-46] -> 5024196.54 | BR284: =RC[-46] -> 0 | BS284: =RC[-46] -> 0 | BT284: =RC[-46] -> 0 | BU284: =RC[-46] -> 0 | BV284: =RC[-46] -> 0 | BW284: =RC[-46] -> 0 | BX284: =RC[-46] -> 0 | BY284: =RC[-46] -> 0 | BZ284: =RC[-46] -> 0 | CA284: =RC[-46] -> 0 | CB284: =RC[-46] -> 236250 | CC284: =RC[-46] -> 4158696 | CD284: =RC[-46] -> 0 | CE284: =RC[-46] -> 0 | CF284: =RC[-46] -> 0 | CG284: =RC[-46] -> 0 | CH284: =RC[-46] -> 0 | CI284: =RC[-46] -> 0 | CJ284: =RC[-46] -> 0 | CK284: =RC[-46] -> 0 | CL284: =RC[-46] -> 1 | CM284: =RC[-46] -> 0 | CN284: =RC[-46] -> 0 | CO284: =RC[-46] -> 5024196.54 | CP284: =RC[-46] -> 0 | CQ284: =RC[-46] -> 78750 | CR284: =RC[-46] -> 236250 | CS284: =RC[-46] -> 157500
A285: 45 | B285: 012572 | C285: Trần Quốc Việt | D285: Nhân viên Bốc xếp | E285: 19028385614015 | F285: =RC[29]+RC[30]+RC[31]+RC[32]+RC[33]+RC[34]+RC[35]+RC[36]+RC[37] -> 3939817 | G285: =RC[17]+RC[18]++RC[19]+RC[20]+RC[21]+RC[38]+RC[39]+RC[41] -> 0 | H285: 0 | I285: 0 | J285: =RC[-2]+RC[-1] -> 0 | K285: 0 | L285: 680000 | M285: 235463 | N285: =RC[15]+RC[16]+RC[17]+RC[18]+RC[19]+RC[20] -> 236250 | O285: 0 | P285: 0 | Q285: 5091530 | R285: 179400 | S285: 33638 | T285: 22425 | U285: 48560.67 | V285: 0 | W285: 4807506.33 | X285: 0 | Y285: 0 | Z285: 0 | AA285: 0 | AB285: 0 | AC285: 0 | AD285: 0 | AE285: 0 | AF285: 0 | AG285: 0 | AH285: 236250 | AI285: 3939817 | AJ285: 0 | AK285: 0 | AL285: 0 | AM285: 0 | AN285: 0 | AO285: 0 | AP285: 0 | AQ285: 0 | AR285: =1 -> 1 | AS285: 0 | AT285: 0 | AU285: =RC[-30]-RC[-29]-RC[-28]-RC[-27]-RC[-26]-RC[-25] -> 4807506.33 | AV285: 0 | AW285: =RC[1]-RC[2] -> 78750 | AX285: 236250 | AY285: 157500 | AZ285: =RC[-46] -> 3939817 | BA285: =RC[-46] -> 0 | BB285: =RC[-46] -> 0 | BC285: =RC[-46] -> 0 | BD285: =RC[-46] -> 0 | BE285: =RC[-46] -> 0 | BF285: =RC[-46] -> 680000 | BG285: =RC[-46] -> 235463 | BH285: =RC[-46] -> 236250 | BI285: =RC[-46] -> 0 | BJ285: =RC[-46] -> 0 | BK285: =RC[-46] -> 5091530 | BL285: =RC[-46] -> 179400 | BM285: =RC[-46] -> 33638 | BN285: =RC[-46] -> 22425 | BO285: =RC[-46] -> 48560.67 | BP285: =RC[-46] -> 0 | BQ285: =RC[-46] -> 4807506.33 | BR285: =RC[-46] -> 0 | BS285: =RC[-46] -> 0 | BT285: =RC[-46] -> 0 | BU285: =RC[-46] -> 0 | BV285: =RC[-46] -> 0 | BW285: =RC[-46] -> 0 | BX285: =RC[-46] -> 0 | BY285: =RC[-46] -> 0 | BZ285: =RC[-46] -> 0 | CA285: =RC[-46] -> 0 | CB285: =RC[-46] -> 236250 | CC285: =RC[-46] -> 3939817 | CD285: =RC[-46] -> 0 | CE285: =RC[-46] -> 0 | CF285: =RC[-46] -> 0 | CG285: =RC[-46] -> 0 | CH285: =RC[-46] -> 0 | CI285: =RC[-46] -> 0 | CJ285: =RC[-46] -> 0 | CK285: =RC[-46] -> 0 | CL285: =RC[-46] -> 1 | CM285: =RC[-46] -> 0 | CN285: =RC[-46] -> 0 | CO285: =RC[-46] -> 4807506.33 | CP285: =RC[-46] -> 0 | CQ285: =RC[-46] -> 78750 | CR285: =RC[-46] -> 236250 | CS285: =RC[-46] -> 157500
A286: 46 | B286: 012573 | C286: Trần Thế Khánh | D286: Nhân viên Bốc xếp | E286: 10523002508010 | F286: =RC[29]+RC[30]+RC[31]+RC[32]+RC[33]+RC[34]+RC[35]+RC[36]+RC[37] -> 3744286 | G286: =RC[17]+RC[18]++RC[19]+RC[20]+RC[21]+RC[38]+RC[39]+RC[41] -> 0 | H286: 0 | I286: 0 | J286: =RC[-2]+RC[-1] -> 0 | K286: 0 | L286: 680000 | M286: 235463 | N286: =RC[15]+RC[16]+RC[17]+RC[18]+RC[19]+RC[20] -> 236250 | O286: 0 | P286: 0 | Q286: 4895999 | R286: 179400 | S286: 33638 | T286: 22425 | U286: 46605.36 | V286: 0 | W286: 4613930.6399999997 | X286: 0 | Y286: 0 | Z286: 0 | AA286: 0 | AB286: 0 | AC286: 0 | AD286: 0 | AE286: 0 | AF286: 0 | AG286: 0 | AH286: 236250 | AI286: 3744286 | AJ286: 0 | AK286: 0 | AL286: 0 | AM286: 0 | AN286: 0 | AO286: 0 | AP286: 0 | AQ286: 0 | AR286: =1 -> 1 | AS286: 0 | AT286: 0 | AU286: =RC[-30]-RC[-29]-RC[-28]-RC[-27]-RC[-26]-RC[-25] -> 4613930.6399999997 | AV286: 0 | AW286: =RC[1]-RC[2] -> 78750 | AX286: 236250 | AY286: 157500 | AZ286: =RC[-46] -> 3744286 | BA286: =RC[-46] -> 0 | BB286: =RC[-46] -> 0 | BC286: =RC[-46] -> 0 | BD286: =RC[-46] -> 0 | BE286: =RC[-46] -> 0 | BF286: =RC[-46] -> 680000 | BG286: =RC[-46] -> 235463 | BH286: =RC[-46] -> 236250 | BI286: =RC[-46] -> 0 | BJ286: =RC[-46] -> 0 | BK286: =RC[-46] -> 4895999 | BL286: =RC[-46] -> 179400 | BM286: =RC[-46] -> 33638 | BN286: =RC[-46] -> 22425 | BO286: =RC[-46] -> 46605.36 | BP286: =RC[-46] -> 0 | BQ286: =RC[-46] -> 4613930.6399999997 | BR286: =RC[-46] -> 0 | BS286: =RC[-46] -> 0 | BT286: =RC[-46] -> 0 | BU286: =RC[-46] -> 0 | BV286: =RC[-46] -> 0 | BW286: =RC[-46] -> 0 | BX286: =RC[-46] -> 0 | BY286: =RC[-46] -> 0 | BZ286: =RC[-46] -> 0 | CA286: =RC[-46] -> 0 | CB286: =RC[-46] -> 236250 | CC286: =RC[-46] -> 3744286 | CD286: =RC[-46] -> 0 | CE286: =RC[-46] -> 0 | CF286: =RC[-46] -> 0 | CG286: =RC[-46] -> 0 | CH286: =RC[-46] -> 0 | CI286: =RC[-46] -> 0 | CJ286: =RC[-46] -> 0 | CK286: =RC[-46] -> 0 | CL286: =RC[-46] -> 1 | CM286: =RC[-46] -> 0 | CN286: =RC[-46] -> 0 | CO286: =RC[-46] -> 4613930.6399999997 | CP286: =RC[-46] -> 0 | CQ286: =RC[-46] -> 78750 | CR286: =RC[-46] -> 236250 | CS286: =RC[-46] -> 157500
A287: 47 | B287: 012574 | C287: Lê Văn Hùng | D287: Nhân viên Bốc xếp | E287: 19028385597013 | F287: =RC[29]+RC[30]+RC[31]+RC[32]+RC[33]+RC[34]+RC[35]+RC[36]+RC[37] -> 3939817 | G287: =RC[17]+RC[18]++RC[19]+RC[20]+RC[21]+RC[38]+RC[39]+RC[41] -> 0 | H287: 0 | I287: 0 | J287: =RC[-2]+RC[-1] -> 0 | K287: 0 | L287: 680000 | M287: 235463 | N287: =RC[15]+RC[16]+RC[17]+RC[18]+RC[19]+RC[20] -> 236250 | O287: 0 | P287: 0 | Q287: 5091530 | R287: 179400 | S287: 33638 | T287: 22425 | U287: 48560.67 | V287: 0 | W287: 4807506.33 | X287: 0 | Y287: 0 | Z287: 0 | AA287: 0 | AB287: 0 | AC287: 0 | AD287: 0 | AE287: 0 | AF287: 0 | AG287: 0 | AH287: 236250 | AI287: 3939817 | AJ287: 0 | AK287: 0 | AL287: 0 | AM287: 0 | AN287: 0 | AO287: 0 | AP287: 0 | AQ287: 0 | AR287: =1 -> 1 | AS287: 0 | AT287: 0 | AU287: =RC[-30]-RC[-29]-RC[-28]-RC[-27]-RC[-26]-RC[-25] -> 4807506.33 | AV287: 0 | AW287: =RC[1]-RC[2] -> 78750 | AX287: 236250 | AY287: 157500 | AZ287: =RC[-46] -> 3939817 | BA287: =RC[-46] -> 0 | BB287: =RC[-46] -> 0 | BC287: =RC[-46] -> 0 | BD287: =RC[-46] -> 0 | BE287: =RC[-46] -> 0 | BF287: =RC[-46] -> 680000 | BG287: =RC[-46] -> 235463 | BH287: =RC[-46] -> 236250 | BI287: =RC[-46] -> 0 | BJ287: =RC[-46] -> 0 | BK287: =RC[-46] -> 5091530 | BL287: =RC[-46] -> 179400 | BM287: =RC[-46] -> 33638 | BN287: =RC[-46] -> 22425 | BO287: =RC[-46] -> 48560.67 | BP287: =RC[-46] -> 0 | BQ287: =RC[-46] -> 4807506.33 | BR287: =RC[-46] -> 0 | BS287: =RC[-46] -> 0 | BT287: =RC[-46] -> 0 | BU287: =RC[-46] -> 0 | BV287: =RC[-46] -> 0 | BW287: =RC[-46] -> 0 | BX287: =RC[-46] -> 0 | BY287: =RC[-46] -> 0 | BZ287: =RC[-46] -> 0 | CA287: =RC[-46] -> 0 | CB287: =RC[-46] -> 236250 | CC287: =RC[-46] -> 3939817 | CD287: =RC[-46] -> 0 | CE287: =RC[-46] -> 0 | CF287: =RC[-46] -> 0 | CG287: =RC[-46] -> 0 | CH287: =RC[-46] -> 0 | CI287: =RC[-46] -> 0 | CJ287: =RC[-46] -> 0 | CK287: =RC[-46] -> 0 | CL287: =RC[-46] -> 1 | CM287: =RC[-46] -> 0 | CN287: =RC[-46] -> 0 | CO287: =RC[-46] -> 4807506.33 | CP287: =RC[-46] -> 0 | CQ287: =RC[-46] -> 78750 | CR287: =RC[-46] -> 236250 | CS287: =RC[-46] -> 157500
A288: 48 | B288: 012575 | C288: Nguyễn Văn Thắng | D288: Nhân viên Bốc xếp | E288: 19021952031013 | F288: =RC[29]+RC[30]+RC[31]+RC[32]+RC[33]+RC[34]+RC[35]+RC[36]+RC[37] -> 2915465 | G288: =RC[17]+RC[18]++RC[19]+RC[20]+RC[21]+RC[38]+RC[39]+RC[41] -> 0 | H288: 0 | I288: 0 | J288: =RC[-2]+RC[-1] -> 0 | K288: 0 | L288: 680000 | M288: 235463 | N288: =RC[15]+RC[16]+RC[17]+RC[18]+RC[19]+RC[20] -> 236250 | O288: 0 | P288: 0 | Q288: 4067178 | R288: 179400 | S288: 33638 | T288: 22425 | U288: 38317.15 | V288: 0 | W288: 3793397.85 | X288: 0 | Y288: 0 | Z288: 0 | AA288: 0 | AB288: 0 | AC288: 0 | AD288: 0 | AE288: 0 | AF288: 0 | AG288: 0 | AH288: 236250 | AI288: 2915465 | AJ288: 0 | AK288: 0 | AL288: 0 | AM288: 0 | AN288: 0 | AO288: 0 | AP288: 0 | AQ288: 0 | AR288: =1 -> 1 | AS288: 0 | AT288: 0 | AU288: =RC[-30]-RC[-29]-RC[-28]-RC[-27]-RC[-26]-RC[-25] -> 3793397.85 | AV288: 0 | AW288: =RC[1]-RC[2] -> 78750 | AX288: 236250 | AY288: 157500 | AZ288: =RC[-46] -> 2915465 | BA288: =RC[-46] -> 0 | BB288: =RC[-46] -> 0 | BC288: =RC[-46] -> 0 | BD288: =RC[-46] -> 0 | BE288: =RC[-46] -> 0 | BF288: =RC[-46] -> 680000 | BG288: =RC[-46] -> 235463 | BH288: =RC[-46] -> 236250 | BI288: =RC[-46] -> 0 | BJ288: =RC[-46] -> 0 | BK288: =RC[-46] -> 4067178 | BL288: =RC[-46] -> 179400 | BM288: =RC[-46] -> 33638 | BN288: =RC[-46] -> 22425 | BO288: =RC[-46] -> 38317.15 | BP288: =RC[-46] -> 0 | BQ288: =RC[-46] -> 3793397.85 | BR288: =RC[-46] -> 0 | BS288: =RC[-46] -> 0 | BT288: =RC[-46] -> 0 | BU288: =RC[-46] -> 0 | BV288: =RC[-46] -> 0 | BW288: =RC[-46] -> 0 | BX288: =RC[-46] -> 0 | BY288: =RC[-46] -> 0 | BZ288: =RC[-46] -> 0 | CA288: =RC[-46] -> 0 | CB288: =RC[-46] -> 236250 | CC288: =RC[-46] -> 2915465 | CD288: =RC[-46] -> 0 | CE288: =RC[-46] -> 0 | CF288: =RC[-46] -> 0 | CG288: =RC[-46] -> 0 | CH288: =RC[-46] -> 0 | CI288: =RC[-46] -> 0 | CJ288: =RC[-46] -> 0 | CK288: =RC[-46] -> 0 | CL288: =RC[-46] -> 1 | CM288: =RC[-46] -> 0 | CN288: =RC[-46] -> 0 | CO288: =RC[-46] -> 3793397.85 | CP288: =RC[-46] -> 0 | CQ288: =RC[-46] -> 78750 | CR288: =RC[-46] -> 236250 | CS288: =RC[-46] -> 157500
A289: 49 | B289: 012576 | C289: Nguyễn Tùng Giang | D289: Nhân viên Bốc xếp | E289: 19028385574013 | F289: =RC[29]+RC[30]+RC[31]+RC[32]+RC[33]+RC[34]+RC[35]+RC[36]+RC[37] -> 3939817 | G289: =RC[17]+RC[18]++RC[19]+RC[20]+RC[21]+RC[38]+RC[39]+RC[41] -> 0 | H289: 0 | I289: 0 | J289: =RC[-2]+RC[-1] -> 0 | K289: 0 | L289: 680000 | M289: 235463 | N289: =RC[15]+RC[16]+RC[17]+RC[18]+RC[19]+RC[20] -> 0 | O289: 0 | P289: 0 | Q289: 4855280 | R289: 179400 | S289: 33638 | T289: 22425 | U289: 46198.17 | V289: 0 | W289: 4573618.83 | X289: 0 | Y289: 0 | Z289: 0 | AA289: 0 | AB289: 0 | AC289: 0 | AD289: 0 | AE289: 0 | AF289: 0 | AG289: 0 | AH289: 0 | AI289: 3939817 | AJ289: 0 | AK289: 0 | AL289: 0 | AM289: 0 | AN289: 0 | AO289: 0 | AP289: 0 | AQ289: 0 | AR289: =1 -> 1 | AS289: 0 | AT289: 0 | AU289: =RC[-30]-RC[-29]-RC[-28]-RC[-27]-RC[-26]-RC[-25] -> 4573618.83 | AV289: 0 | AW289: =RC[1]-RC[2] -> 0 | AX289: 0 | AY289: 0 | AZ289: =RC[-46] -> 3939817 | BA289: =RC[-46] -> 0 | BB289: =RC[-46] -> 0 | BC289: =RC[-46] -> 0 | BD289: =RC[-46] -> 0 | BE289: =RC[-46] -> 0 | BF289: =RC[-46] -> 680000 | BG289: =RC[-46] -> 235463 | BH289: =RC[-46] -> 0 | BI289: =RC[-46] -> 0 | BJ289: =RC[-46] -> 0 | BK289: =RC[-46] -> 4855280 | BL289: =RC[-46] -> 179400 | BM289: =RC[-46] -> 33638 | BN289: =RC[-46] -> 22425 | BO289: =RC[-46] -> 46198.17 | BP289: =RC[-46] -> 0 | BQ289: =RC[-46] -> 4573618.83 | BR289: =RC[-46] -> 0 | BS289: =RC[-46] -> 0 | BT289: =RC[-46] -> 0 | BU289: =RC[-46] -> 0 | BV289: =RC[-46] -> 0 | BW289: =RC[-46] -> 0 | BX289: =RC[-46] -> 0 | BY289: =RC[-46] -> 0 | BZ289: =RC[-46] -> 0 | CA289: =RC[-46] -> 0 | CB289: =RC[-46] -> 0 | CC289: =RC[-46] -> 3939817 | CD289: =RC[-46] -> 0 | CE289: =RC[-46] -> 0 | CF289: =RC[-46] -> 0 | CG289: =RC[-46] -> 0 | CH289: =RC[-46] -> 0 | CI289: =RC[-46] -> 0 | CJ289: =RC[-46] -> 0 | CK289: =RC[-46] -> 0 | CL289: =RC[-46] -> 1 | CM289: =RC[-46] -> 0 | CN289: =RC[-46] -> 0 | CO289: =RC[-46] -> 4573618.83 | CP289: =RC[-46] -> 0 | CQ289: =RC[-46] -> 0 | CR289: =RC[-46] -> 0 | CS289: =RC[-46] -> 0
A290: 50 | B290: 012577 | C290: Lê Ngọc Hùng | D290: Nhân viên Bốc xếp | E290: 19022281111013 | F290: =RC[29]+RC[30]+RC[31]+RC[32]+RC[33]+RC[34]+RC[35]+RC[36]+RC[37] -> 3939817 | G290: =RC[17]+RC[18]++RC[19]+RC[20]+RC[21]+RC[38]+RC[39]+RC[41] -> 0 | H290: 0 | I290: 0 | J290: =RC[-2]+RC[-1] -> 0 | K290: 0 | L290: 680000 | M290: 235463 | N290: =RC[15]+RC[16]+RC[17]+RC[18]+RC[19]+RC[20] -> 236250 | O290: 0 | P290: 0 | Q290: 5091530 | R290: 179400 | S290: 33638 | T290: 22425 | U290: 48560.67 | V290: 0 | W290: 4807506.33 | X290: 0 | Y290: 0 | Z290: 0 | AA290: 0 | AB290: 0 | AC290: 0 | AD290: 0 | AE290: 0 | AF290: 0 | AG290: 0 | AH290: 236250 | AI290: 3939817 | AJ290: 0 | AK290: 0 | AL290: 0 | AM290: 0 | AN290: 0 | AO290: 0 | AP290: 0 | AQ290: 0 | AR290: =1 -> 1 | AS290: 0 | AT290: 0 | AU290: =RC[-30]-RC[-29]-RC[-28]-RC[-27]-RC[-26]-RC[-25] -> 4807506.33 | AV290: 0 | AW290: =RC[1]-RC[2] -> 78750 | AX290: 236250 | AY290: 157500 | AZ290: =RC[-46] -> 3939817 | BA290: =RC[-46] -> 0 | BB290: =RC[-46] -> 0 | BC290: =RC[-46] -> 0 | BD290: =RC[-46] -> 0 | BE290: =RC[-46] -> 0 | BF290: =RC[-46] -> 680000 | BG290: =RC[-46] -> 235463 | BH290: =RC[-46] -> 236250 | BI290: =RC[-46] -> 0 | BJ290: =RC[-46] -> 0 | BK290: =RC[-46] -> 5091530 | BL290: =RC[-46] -> 179400 | BM290: =RC[-46] -> 33638 | BN290: =RC[-46] -> 22425 | BO290: =RC[-46] -> 48560.67 | BP290: =RC[-46] -> 0 | BQ290: =RC[-46] -> 4807506.33 | BR290: =RC[-46] -> 0 | BS290: =RC[-46] -> 0 | BT290: =RC[-46] -> 0 | BU290: =RC[-46] -> 0 | BV290: =RC[-46] -> 0 | BW290: =RC[-46] -> 0 | BX290: =RC[-46] -> 0 | BY290: =RC[-46] -> 0 | BZ290: =RC[-46] -> 0 | CA290: =RC[-46] -> 0 | CB290: =RC[-46] -> 236250 | CC290: =RC[-46] -> 3939817 | CD290: =RC[-46] -> 0 | CE290: =RC[-46] -> 0 | CF290: =RC[-46] -> 0 | CG290: =RC[-46] -> 0 | CH290: =RC[-46] -> 0 | CI290: =RC[-46] -> 0 | CJ290: =RC[-46] -> 0 | CK290: =RC[-46] -> 0 | CL290: =RC[-46] -> 1 | CM290: =RC[-46] -> 0 | CN290: =RC[-46] -> 0 | CO290: =RC[-46] -> 4807506.33 | CP290: =RC[-46] -> 0 | CQ290: =RC[-46] -> 78750 | CR290: =RC[-46] -> 236250 | CS290: =RC[-46] -> 157500
A291: 51 | B291: 012578 | C291: Bùi Bảo Long | D291: Nhân viên Bốc xếp | E291: 14022643677012 | F291: =RC[29]+RC[30]+RC[31]+RC[32]+RC[33]+RC[34]+RC[35]+RC[36]+RC[37] -> 3939817 | G291: =RC[17]+RC[18]++RC[19]+RC[20]+RC[21]+RC[38]+RC[39]+RC[41] -> 0 | H291: 0 | I291: 0 | J291: =RC[-2]+RC[-1] -> 0 | K291: 0 | L291: 680000 | M291: 235463 | N291: =RC[15]+RC[16]+RC[17]+RC[18]+RC[19]+RC[20] -> 0 | O291: 0 | P291: 0 | Q291: 4855280 | R291: 179400 | S291: 33638 | T291: 22425 | U291: 46198.17 | V291: 0 | W291: 4573618.83 | X291: 0 | Y291: 0 | Z291: 0 | AA291: 0 | AB291: 0 | AC291: 0 | AD291: 0 | AE291: 0 | AF291: 0 | AG291: 0 | AH291: 0 | AI291: 3939817 | AJ291: 0 | AK291: 0 | AL291: 0 | AM291: 0 | AN291: 0 | AO291: 0 | AP291: 0 | AQ291: 0 | AR291: =1 -> 1 | AS291: 0 | AT291: 0 | AU291: =RC[-30]-RC[-29]-RC[-28]-RC[-27]-RC[-26]-RC[-25] -> 4573618.83 | AV291: 0 | AW291: =RC[1]-RC[2] -> 0 | AX291: 0 | AY291: 0 | AZ291: =RC[-46] -> 3939817 | BA291: =RC[-46] -> 0 | BB291: =RC[-46] -> 0 | BC291: =RC[-46] -> 0 | BD291: =RC[-46] -> 0 | BE291: =RC[-46] -> 0 | BF291: =RC[-46] -> 680000 | BG291: =RC[-46] -> 235463 | BH291: =RC[-46] -> 0 | BI291: =RC[-46] -> 0 | BJ291: =RC[-46] -> 0 | BK291: =RC[-46] -> 4855280 | BL291: =RC[-46] -> 179400 | BM291: =RC[-46] -> 33638 | BN291: =RC[-46] -> 22425 | BO291: =RC[-46] -> 46198.17 | BP291: =RC[-46] -> 0 | BQ291: =RC[-46] -> 4573618.83 | BR291: =RC[-46] -> 0 | BS291: =RC[-46] -> 0 | BT291: =RC[-46] -> 0 | BU291: =RC[-46] -> 0 | BV291: =RC[-46] -> 0 | BW291: =RC[-46] -> 0 | BX291: =RC[-46] -> 0 | BY291: =RC[-46] -> 0 | BZ291: =RC[-46] -> 0 | CA291: =RC[-46] -> 0 | CB291: =RC[-46] -> 0 | CC291: =RC[-46] -> 3939817 | CD291: =RC[-46] -> 0 | CE291: =RC[-46] -> 0 | CF291: =RC[-46] -> 0 | CG291: =RC[-46] -> 0 | CH291: =RC[-46] -> 0 | CI291: =RC[-46] -> 0 | CJ291: =RC[-46] -> 0 | CK291: =RC[-46] -> 0 | CL291: =RC[-46] -> 1 | CM291: =RC[-46] -> 0 | CN291: =RC[-46] -> 0 | CO291: =RC[-46] -> 4573618.83 | CP291: =RC[-46] -> 0 | CQ291: =RC[-46] -> 0 | CR291: =RC[-46] -> 0 | CS291: =RC[-46] -> 0
A292: 52 | B292: 012579 | C292: Nguyễn Ngọc Công | D292: Nhân viên Bốc xếp | E292: 19028385607019 | F292: =RC[29]+RC[30]+RC[31]+RC[32]+RC[33]+RC[34]+RC[35]+RC[36]+RC[37] -> 3939817 | G292: =RC[17]+RC[18]++RC[19]+RC[20]+RC[21]+RC[38]+RC[39]+RC[41] -> 0 | H292: 0 | I292: 0 | J292: =RC[-2]+RC[-1] -> 0 | K292: 0 | L292: 680000 | M292: 235463 | N292: =RC[15]+RC[16]+RC[17]+RC[18]+RC[19]+RC[20] -> 236250 | O292: 0 | P292: 0 | Q292: 5091530 | R292: 179400 | S292: 33638 | T292: 22425 | U292: 48560.67 | V292: 0 | W292: 4807506.33 | X292: 0 | Y292: 0 | Z292: 0 | AA292: 0 | AB292: 0 | AC292: 0 | AD292: 0 | AE292: 0 | AF292: 0 | AG292: 0 | AH292: 236250 | AI292: 3939817 | AJ292: 0 | AK292: 0 | AL292: 0 | AM292: 0 | AN292: 0 | AO292: 0 | AP292: 0 | AQ292: 0 | AR292: =1 -> 1 | AS292: 0 | AT292: 0 | AU292: =RC[-30]-RC[-29]-RC[-28]-RC[-27]-RC[-26]-RC[-25] -> 4807506.33 | AV292: 0 | AW292: =RC[1]-RC[2] -> 78750 | AX292: 236250 | AY292: 157500 | AZ292: =RC[-46] -> 3939817 | BA292: =RC[-46] -> 0 | BB292: =RC[-46] -> 0 | BC292: =RC[-46] -> 0 | BD292: =RC[-46] -> 0 | BE292: =RC[-46] -> 0 | BF292: =RC[-46] -> 680000 | BG292: =RC[-46] -> 235463 | BH292: =RC[-46] -> 236250 | BI292: =RC[-46] -> 0 | BJ292: =RC[-46] -> 0 | BK292: =RC[-46] -> 5091530 | BL292: =RC[-46] -> 179400 | BM292: =RC[-46] -> 33638 | BN292: =RC[-46] -> 22425 | BO292: =RC[-46] -> 48560.67 | BP292: =RC[-46] -> 0 | BQ292: =RC[-46] -> 4807506.33 | BR292: =RC[-46] -> 0 | BS292: =RC[-46] -> 0 | BT292: =RC[-46] -> 0 | BU292: =RC[-46] -> 0 | BV292: =RC[-46] -> 0 | BW292: =RC[-46] -> 0 | BX292: =RC[-46] -> 0 | BY292: =RC[-46] -> 0 | BZ292: =RC[-46] -> 0 | CA292: =RC[-46] -> 0 | CB292: =RC[-46] -> 236250 | CC292: =RC[-46] -> 3939817 | CD292: =RC[-46] -> 0 | CE292: =RC[-46] -> 0 | CF292: =RC[-46] -> 0 | CG292: =RC[-46] -> 0 | CH292: =RC[-46] -> 0 | CI292: =RC[-46] -> 0 | CJ292: =RC[-46] -> 0 | CK292: =RC[-46] -> 0 | CL292: =RC[-46] -> 1 | CM292: =RC[-46] -> 0 | CN292: =RC[-46] -> 0 | CO292: =RC[-46] -> 4807506.33 | CP292: =RC[-46] -> 0 | CQ292: =RC[-46] -> 78750 | CR292: =RC[-46] -> 236250 | CS292: =RC[-46] -> 157500
A293: 53 | B293: 012580 | C293: Đào Công Duẩn | D293: Nhân viên Bốc xếp | E293: 19028385612012 | F293: =RC[29]+RC[30]+RC[31]+RC[32]+RC[33]+RC[34]+RC[35]+RC[36]+RC[37] -> 2915465 | G293: =RC[17]+RC[18]++RC[19]+RC[20]+RC[21]+RC[38]+RC[39]+RC[41] -> 0 | H293: 0 | I293: 0 | J293: =RC[-2]+RC[-1] -> 0 | K293: 0 | L293: 680000 | M293: 235463 | N293: =RC[15]+RC[16]+RC[17]+RC[18]+RC[19]+RC[20] -> 236250 | O293: 0 | P293: 0 | Q293: 4067178 | R293: 179400 | S293: 33638 | T293: 22425 | U293: 38317.15 | V293: 0 | W293: 3793397.85 | X293: 0 | Y293: 0 | Z293: 0 | AA293: 0 | AB293: 0 | AC293: 0 | AD293: 0 | AE293: 0 | AF293: 0 | AG293: 0 | AH293: 236250 | AI293: 2915465 | AJ293: 0 | AK293: 0 | AL293: 0 | AM293: 0 | AN293: 0 | AO293: 0 | AP293: 0 | AQ293: 0 | AR293: =1 -> 1 | AS293: 0 | AT293: 0 | AU293: =RC[-30]-RC[-29]-RC[-28]-RC[-27]-RC[-26]-RC[-25] -> 3793397.85 | AV293: 0 | AW293: =RC[1]-RC[2] -> 78750 | AX293: 236250 | AY293: 157500 | AZ293: =RC[-46] -> 2915465 | BA293: =RC[-46] -> 0 | BB293: =RC[-46] -> 0 | BC293: =RC[-46] -> 0 | BD293: =RC[-46] -> 0 | BE293: =RC[-46] -> 0 | BF293: =RC[-46] -> 680000 | BG293: =RC[-46] -> 235463 | BH293: =RC[-46] -> 236250 | BI293: =RC[-46] -> 0 | BJ293: =RC[-46] -> 0 | BK293: =RC[-46] -> 4067178 | BL293: =RC[-46] -> 179400 | BM293: =RC[-46] -> 33638 | BN293: =RC[-46] -> 22425 | BO293: =RC[-46] -> 38317.15 | BP293: =RC[-46] -> 0 | BQ293: =RC[-46] -> 3793397.85 | BR293: =RC[-46] -> 0 | BS293: =RC[-46] -> 0 | BT293: =RC[-46] -> 0 | BU293: =RC[-46] -> 0 | BV293: =RC[-46] -> 0 | BW293: =RC[-46] -> 0 | BX293: =RC[-46] -> 0 | BY293: =RC[-46] -> 0 | BZ293: =RC[-46] -> 0 | CA293: =RC[-46] -> 0 | CB293: =RC[-46] -> 236250 | CC293: =RC[-46] -> 2915465 | CD293: =RC[-46] -> 0 | CE293: =RC[-46] -> 0 | CF293: =RC[-46] -> 0 | CG293: =RC[-46] -> 0 | CH293: =RC[-46] -> 0 | CI293: =RC[-46] -> 0 | CJ293: =RC[-46] -> 0 | CK293: =RC[-46] -> 0 | CL293: =RC[-46] -> 1 | CM293: =RC[-46] -> 0 | CN293: =RC[-46] -> 0 | CO293: =RC[-46] -> 3793397.85 | CP293: =RC[-46] -> 0 | CQ293: =RC[-46] -> 78750 | CR293: =RC[-46] -> 236250 | CS293: =RC[-46] -> 157500
A294: 54 | B294: 012581 | C294: Nguyễn Gia Thắng | D294: Nhân viên Bốc xếp | E294: 19028385591015 | F294: =RC[29]+RC[30]+RC[31]+RC[32]+RC[33]+RC[34]+RC[35]+RC[36]+RC[37] -> 3939817 | G294: =RC[17]+RC[18]++RC[19]+RC[20]+RC[21]+RC[38]+RC[39]+RC[41] -> 0 | H294: 0 | I294: 0 | J294: =RC[-2]+RC[-1] -> 0 | K294: 0 | L294: 680000 | M294: 235463 | N294: =RC[15]+RC[16]+RC[17]+RC[18]+RC[19]+RC[20] -> 236250 | O294: 0 | P294: 0 | Q294: 5091530 | R294: 179400 | S294: 33638 | T294: 22425 | U294: 48560.67 | V294: 0 | W294: 4807506.33 | X294: 0 | Y294: 0 | Z294: 0 | AA294: 0 | AB294: 0 | AC294: 0 | AD294: 0 | AE294: 0 | AF294: 0 | AG294: 0 | AH294: 236250 | AI294: 3939817 | AJ294: 0 | AK294: 0 | AL294: 0 | AM294: 0 | AN294: 0 | AO294: 0 | AP294: 0 | AQ294: 0 | AR294: =1 -> 1 | AS294: 0 | AT294: 0 | AU294: =RC[-30]-RC[-29]-RC[-28]-RC[-27]-RC[-26]-RC[-25] -> 4807506.33 | AV294: 0 | AW294: =RC[1]-RC[2] -> 78750 | AX294: 236250 | AY294: 157500 | AZ294: =RC[-46] -> 3939817 | BA294: =RC[-46] -> 0 | BB294: =RC[-46] -> 0 | BC294: =RC[-46] -> 0 | BD294: =RC[-46] -> 0 | BE294: =RC[-46] -> 0 | BF294: =RC[-46] -> 680000 | BG294: =RC[-46] -> 235463 | BH294: =RC[-46] -> 236250 | BI294: =RC[-46] -> 0 | BJ294: =RC[-46] -> 0 | BK294: =RC[-46] -> 5091530 | BL294: =RC[-46] -> 179400 | BM294: =RC[-46] -> 33638 | BN294: =RC[-46] -> 22425 | BO294: =RC[-46] -> 48560.67 | BP294: =RC[-46] -> 0 | BQ294: =RC[-46] -> 4807506.33 | BR294: =RC[-46] -> 0 | BS294: =RC[-46] -> 0 | BT294: =RC[-46] -> 0 | BU294: =RC[-46] -> 0 | BV294: =RC[-46] -> 0 | BW294: =RC[-46] -> 0 | BX294: =RC[-46] -> 0 | BY294: =RC[-46] -> 0 | BZ294: =RC[-46] -> 0 | CA294: =RC[-46] -> 0 | CB294: =RC[-46] -> 236250 | CC294: =RC[-46] -> 3939817 | CD294: =RC[-46] -> 0 | CE294: =RC[-46] -> 0 | CF294: =RC[-46] -> 0 | CG294: =RC[-46] -> 0 | CH294: =RC[-46] -> 0 | CI294: =RC[-46] -> 0 | CJ294: =RC[-46] -> 0 | CK294: =RC[-46] -> 0 | CL294: =RC[-46] -> 1 | CM294: =RC[-46] -> 0 | CN294: =RC[-46] -> 0 | CO294: =RC[-46] -> 4807506.33 | CP294: =RC[-46] -> 0 | CQ294: =RC[-46] -> 78750 | CR294: =RC[-46] -> 236250 | CS294: =RC[-46] -> 157500
A295: 55 | B295: 012583 | C295: Nguyễn Huy Đáp | D295: Nhân viên Bốc xếp | E295: 19028385582016 | F295: =RC[29]+RC[30]+RC[31]+RC[32]+RC[33]+RC[34]+RC[35]+RC[36]+RC[37] -> 3939817 | G295: =RC[17]+RC[18]++RC[19]+RC[20]+RC[21]+RC[38]+RC[39]+RC[41] -> 0 | H295: 0 | I295: 0 | J295: =RC[-2]+RC[-1] -> 0 | K295: 0 | L295: 680000 | M295: 235463 | N295: =RC[15]+RC[16]+RC[17]+RC[18]+RC[19]+RC[20] -> 236250 | O295: 0 | P295: 0 | Q295: 5091530 | R295: 179400 | S295: 33638 | T295: 22425 | U295: 48560.67 | V295: 0 | W295: 4807506.33 | X295: 0 | Y295: 0 | Z295: 0 | AA295: 0 | AB295: 0 | AC295: 0 | AD295: 0 | AE295: 0 | AF295: 0 | AG295: 0 | AH295: 236250 | AI295: 3939817 | AJ295: 0 | AK295: 0 | AL295: 0 | AM295: 0 | AN295: 0 | AO295: 0 | AP295: 0 | AQ295: 0 | AR295: =1 -> 1 | AS295: 0 | AT295: 0 | AU295: =RC[-30]-RC[-29]-RC[-28]-RC[-27]-RC[-26]-RC[-25] -> 4807506.33 | AV295: 0 | AW295: =RC[1]-RC[2] -> 78750 | AX295: 236250 | AY295: 157500 | AZ295: =RC[-46] -> 3939817 | BA295: =RC[-46] -> 0 | BB295: =RC[-46] -> 0 | BC295: =RC[-46] -> 0 | BD295: =RC[-46] -> 0 | BE295: =RC[-46] -> 0 | BF295: =RC[-46] -> 680000 | BG295: =RC[-46] -> 235463 | BH295: =RC[-46] -> 236250 | BI295: =RC[-46] -> 0 | BJ295: =RC[-46] -> 0 | BK295: =RC[-46] -> 5091530 | BL295: =RC[-46] -> 179400 | BM295: =RC[-46] -> 33638 | BN295: =RC[-46] -> 22425 | BO295: =RC[-46] -> 48560.67 | BP295: =RC[-46] -> 0 | BQ295: =RC[-46] -> 4807506.33 | BR295: =RC[-46] -> 0 | BS295: =RC[-46] -> 0 | BT295: =RC[-46] -> 0 | BU295: =RC[-46] -> 0 | BV295: =RC[-46] -> 0 | BW295: =RC[-46] -> 0 | BX295: =RC[-46] -> 0 | BY295: =RC[-46] -> 0 | BZ295: =RC[-46] -> 0 | CA295: =RC[-46] -> 0 | CB295: =RC[-46] -> 236250 | CC295: =RC[-46] -> 3939817 | CD295: =RC[-46] -> 0 | CE295: =RC[-46] -> 0 | CF295: =RC[-46] -> 0 | CG295: =RC[-46] -> 0 | CH295: =RC[-46] -> 0 | CI295: =RC[-46] -> 0 | CJ295: =RC[-46] -> 0 | CK295: =RC[-46] -> 0 | CL295: =RC[-46] -> 1 | CM295: =RC[-46] -> 0 | CN295: =RC[-46] -> 0 | CO295: =RC[-46] -> 4807506.33 | CP295: =RC[-46] -> 0 | CQ295: =RC[-46] -> 78750 | CR295: =RC[-46] -> 236250 | CS295: =RC[-46] -> 157500
A296: 56 | B296: 012584 | C296: Lê Văn Thịnh | D296: Nhân viên Bốc xếp | E296: 19028385557011 | F296: =RC[29]+RC[30]+RC[31]+RC[32]+RC[33]+RC[34]+RC[35]+RC[36]+RC[37] -> 3939817 | G296: =RC[17]+RC[18]++RC[19]+RC[20]+RC[21]+RC[38]+RC[39]+RC[41] -> 0 | H296: 0 | I296: 0 | J296: =RC[-2]+RC[-1] -> 0 | K296: 0 | L296: 680000 | M296: 235463 | N296: =RC[15]+RC[16]+RC[17]+RC[18]+RC[19]+RC[20] -> 236250 | O296: 0 | P296: 0 | Q296: 5091530 | R296: 179400 | S296: 33638 | T296: 22425 | U296: 48560.67 | V296: 0 | W296: 4807506.33 | X296: 0 | Y296: 0 | Z296: 0 | AA296: 0 | AB296: 0 | AC296: 0 | AD296: 0 | AE296: 0 | AF296: 0 | AG296: 0 | AH296: 236250 | AI296: 3939817 | AJ296: 0 | AK296: 0 | AL296: 0 | AM296: 0 | AN296: 0 | AO296: 0 | AP296: 0 | AQ296: 0 | AR296: =1 -> 1 | AS296: 0 | AT296: 0 | AU296: =RC[-30]-RC[-29]-RC[-28]-RC[-27]-RC[-26]-RC[-25] -> 4807506.33 | AV296: 0 | AW296: =RC[1]-RC[2] -> 78750 | AX296: 236250 | AY296: 157500 | AZ296: =RC[-46] -> 3939817 | BA296: =RC[-46] -> 0 | BB296: =RC[-46] -> 0 | BC296: =RC[-46] -> 0 | BD296: =RC[-46] -> 0 | BE296: =RC[-46] -> 0 | BF296: =RC[-46] -> 680000 | BG296: =RC[-46] -> 235463 | BH296: =RC[-46] -> 236250 | BI296: =RC[-46] -> 0 | BJ296: =RC[-46] -> 0 | BK296: =RC[-46] -> 5091530 | BL296: =RC[-46] -> 179400 | BM296: =RC[-46] -> 33638 | BN296: =RC[-46] -> 22425 | BO296: =RC[-46] -> 48560.67 | BP296: =RC[-46] -> 0 | BQ296: =RC[-46] -> 4807506.33 | BR296: =RC[-46] -> 0 | BS296: =RC[-46] -> 0 | BT296: =RC[-46] -> 0 | BU296: =RC[-46] -> 0 | BV296: =RC[-46] -> 0 | BW296: =RC[-46] -> 0 | BX296: =RC[-46] -> 0 | BY296: =RC[-46] -> 0 | BZ296: =RC[-46] -> 0 | CA296: =RC[-46] -> 0 | CB296: =RC[-46] -> 236250 | CC296: =RC[-46] -> 3939817 | CD296: =RC[-46] -> 0 | CE296: =RC[-46] -> 0 | CF296: =RC[-46] -> 0 | CG296: =RC[-46] -> 0 | CH296: =RC[-46] -> 0 | CI296: =RC[-46] -> 0 | CJ296: =RC[-46] -> 0 | CK296: =RC[-46] -> 0 | CL296: =RC[-46] -> 1 | CM296: =RC[-46] -> 0 | CN296: =RC[-46] -> 0 | CO296: =RC[-46] -> 4807506.33 | CP296: =RC[-46] -> 0 | CQ296: =RC[-46] -> 78750 | CR296: =RC[-46] -> 236250 | CS296: =RC[-46] -> 157500
A297: 57 | B297: 012585 | C297: Nguyễn Tuấn Anh | D297: Nhân viên Bốc xếp | E297: 19028385584019 | F297: =RC[29]+RC[30]+RC[31]+RC[32]+RC[33]+RC[34]+RC[35]+RC[36]+RC[37] -> 4138267 | G297: =RC[17]+RC[18]++RC[19]+RC[20]+RC[21]+RC[38]+RC[39]+RC[41] -> 0 | H297: 0 | I297: 0 | J297: =RC[-2]+RC[-1] -> 0 | K297: 0 | L297: 680000 | M297: 235463 | N297: =RC[15]+RC[16]+RC[17]+RC[18]+RC[19]+RC[20] -> 236250 | O297: 0 | P297: 0 | Q297: 5289980 | R297: 179400 | S297: 33638 | T297: 22425 | U297: 50545.17 | V297: 0 | W297: 5003971.83 | X297: 0 | Y297: 0 | Z297: 0 | AA297: 0 | AB297: 0 | AC297: 0 | AD297: 0 | AE297: 0 | AF297: 0 | AG297: 0 | AH297: 236250 | AI297: 4138267 | AJ297: 0 | AK297: 0 | AL297: 0 | AM297: 0 | AN297: 0 | AO297: 0 | AP297: 0 | AQ297: 0 | AR297: =1 -> 1 | AS297: 0 | AT297: 0 | AU297: =RC[-30]-RC[-29]-RC[-28]-RC[-27]-RC[-26]-RC[-25] -> 5003971.83 | AV297: 0 | AW297: =RC[1]-RC[2] -> 78750 | AX297: 236250 | AY297: 157500 | AZ297: =RC[-46] -> 4138267 | BA297: =RC[-46] -> 0 | BB297: =RC[-46] -> 0 | BC297: =RC[-46] -> 0 | BD297: =RC[-46] -> 0 | BE297: =RC[-46] -> 0 | BF297: =RC[-46] -> 680000 | BG297: =RC[-46] -> 235463 | BH297: =RC[-46] -> 236250 | BI297: =RC[-46] -> 0 | BJ297: =RC[-46] -> 0 | BK297: =RC[-46] -> 5289980 | BL297: =RC[-46] -> 179400 | BM297: =RC[-46] -> 33638 | BN297: =RC[-46] -> 22425 | BO297: =RC[-46] -> 50545.17 | BP297: =RC[-46] -> 0 | BQ297: =RC[-46] -> 5003971.83 | BR297: =RC[-46] -> 0 | BS297: =RC[-46] -> 0 | BT297: =RC[-46] -> 0 | BU297: =RC[-46] -> 0 | BV297: =RC[-46] -> 0 | BW297: =RC[-46] -> 0 | BX297: =RC[-46] -> 0 | BY297: =RC[-46] -> 0 | BZ297: =RC[-46] -> 0 | CA297: =RC[-46] -> 0 | CB297: =RC[-46] -> 236250 | CC297: =RC[-46] -> 4138267 | CD297: =RC[-46] -> 0 | CE297: =RC[-46] -> 0 | CF297: =RC[-46] -> 0 | CG297: =RC[-46] -> 0 | CH297: =RC[-46] -> 0 | CI297: =RC[-46] -> 0 | CJ297: =RC[-46] -> 0 | CK297: =RC[-46] -> 0 | CL297: =RC[-46] -> 1 | CM297: =RC[-46] -> 0 | CN297: =RC[-46] -> 0 | CO297: =RC[-46] -> 5003971.83 | CP297: =RC[-46] -> 0 | CQ297: =RC[-46] -> 78750 | CR297: =RC[-46] -> 236250 | CS297: =RC[-46] -> 157500
A298: 58 | B298: 012586 | C298: Phạm Văn Trường | D298: Nhân viên Bốc xếp | E298: 19028385587018 | F298: =RC[29]+RC[30]+RC[31]+RC[32]+RC[33]+RC[34]+RC[35]+RC[36]+RC[37] -> 4138267 | G298: =RC[17]+RC[18]++RC[19]+RC[20]+RC[21]+RC[38]+RC[39]+RC[41] -> 0 | H298: 0 | I298: 0 | J298: =RC[-2]+RC[-1] -> 0 | K298: 0 | L298: 680000 | M298: 235463 | N298: =RC[15]+RC[16]+RC[17]+RC[18]+RC[19]+RC[20] -> 0 | O298: 0 | P298: 0 | Q298: 5053730 | R298: 179400 | S298: 33638 | T298: 22425 | U298: 48182.67 | V298: 0 | W298: 4770084.33 | X298: 0 | Y298: 0 | Z298: 0 | AA298: 0 | AB298: 0 | AC298: 0 | AD298: 0 | AE298: 0 | AF298: 0 | AG298: 0 | AH298: 0 | AI298: 4138267 | AJ298: 0 | AK298: 0 | AL298: 0 | AM298: 0 | AN298: 0 | AO298: 0 | AP298: 0 | AQ298: 0 | AR298: =1 -> 1 | AS298: 0 | AT298: 0 | AU298: =RC[-30]-RC[-29]-RC[-28]-RC[-27]-RC[-26]-RC[-25] -> 4770084.33 | AV298: 0 | AW298: =RC[1]-RC[2] -> 0 | AX298: 0 | AY298: 0 | AZ298: =RC[-46] -> 4138267 | BA298: =RC[-46] -> 0 | BB298: =RC[-46] -> 0 | BC298: =RC[-46] -> 0 | BD298: =RC[-46] -> 0 | BE298: =RC[-46] -> 0 | BF298: =RC[-46] -> 680000 | BG298: =RC[-46] -> 235463 | BH298: =RC[-46] -> 0 | BI298: =RC[-46] -> 0 | BJ298: =RC[-46] -> 0 | BK298: =RC[-46] -> 5053730 | BL298: =RC[-46] -> 179400 | BM298: =RC[-46] -> 33638 | BN298: =RC[-46] -> 22425 | BO298: =RC[-46] -> 48182.67 | BP298: =RC[-46] -> 0 | BQ298: =RC[-46] -> 4770084.33 | BR298: =RC[-46] -> 0 | BS298: =RC[-46] -> 0 | BT298: =RC[-46] -> 0 | BU298: =RC[-46] -> 0 | BV298: =RC[-46] -> 0 | BW298: =RC[-46] -> 0 | BX298: =RC[-46] -> 0 | BY298: =RC[-46] -> 0 | BZ298: =RC[-46] -> 0 | CA298: =RC[-46] -> 0 | CB298: =RC[-46] -> 0 | CC298: =RC[-46] -> 4138267 | CD298: =RC[-46] -> 0 | CE298: =RC[-46] -> 0 | CF298: =RC[-46] -> 0 | CG298: =RC[-46] -> 0 | CH298: =RC[-46] -> 0 | CI298: =RC[-46] -> 0 | CJ298: =RC[-46] -> 0 | CK298: =RC[-46] -> 0 | CL298: =RC[-46] -> 1 | CM298: =RC[-46] -> 0 | CN298: =RC[-46] -> 0 | CO298: =RC[-46] -> 4770084.33 | CP298: =RC[-46] -> 0 | CQ298: =RC[-46] -> 0 | CR298: =RC[-46] -> 0 | CS298: =RC[-46] -> 0
A299: 59 | B299: 012587 | C299: Nguyễn Minh Dũng | D299: Nhân viên Bốc xếp | E299: 19028385600014 | F299: =RC[29]+RC[30]+RC[31]+RC[32]+RC[33]+RC[34]+RC[35]+RC[36]+RC[37] -> 3939817 | G299: =RC[17]+RC[18]++RC[19]+RC[20]+RC[21]+RC[38]+RC[39]+RC[41] -> 0 | H299: 0 | I299: 0 | J299: =RC[-2]+RC[-1] -> 0 | K299: 0 | L299: 680000 | M299: 235463 | N299: =RC[15]+RC[16]+RC[17]+RC[18]+RC[19]+RC[20] -> 236250 | O299: 0 | P299: 0 | Q299: 5091530 | R299: 179400 | S299: 33638 | T299: 22425 | U299: 48560.67 | V299: 0 | W299: 4807506.33 | X299: 0 | Y299: 0 | Z299: 0 | AA299: 0 | AB299: 0 | AC299: 0 | AD299: 0 | AE299: 0 | AF299: 0 | AG299: 0 | AH299: 236250 | AI299: 3939817 | AJ299: 0 | AK299: 0 | AL299: 0 | AM299: 0 | AN299: 0 | AO299: 0 | AP299: 0 | AQ299: 0 | AR299: =1 -> 1 | AS299: 0 | AT299: 0 | AU299: =RC[-30]-RC[-29]-RC[-28]-RC[-27]-RC[-26]-RC[-25] -> 4807506.33 | AV299: 0 | AW299: =RC[1]-RC[2] -> 78750 | AX299: 236250 | AY299: 157500 | AZ299: =RC[-46] -> 3939817 | BA299: =RC[-46] -> 0 | BB299: =RC[-46] -> 0 | BC299: =RC[-46] -> 0 | BD299: =RC[-46] -> 0 | BE299: =RC[-46] -> 0 | BF299: =RC[-46] -> 680000 | BG299: =RC[-46] -> 235463 | BH299: =RC[-46] -> 236250 | BI299: =RC[-46] -> 0 | BJ299: =RC[-46] -> 0 | BK299: =RC[-46] -> 5091530 | BL299: =RC[-46] -> 179400 | BM299: =RC[-46] -> 33638 | BN299: =RC[-46] -> 22425 | BO299: =RC[-46] -> 48560.67 | BP299: =RC[-46] -> 0 | BQ299: =RC[-46] -> 4807506.33 | BR299: =RC[-46] -> 0 | BS299: =RC[-46] -> 0 | BT299: =RC[-46] -> 0 | BU299: =RC[-46] -> 0 | BV299: =RC[-46] -> 0 | BW299: =RC[-46] -> 0 | BX299: =RC[-46] -> 0 | BY299: =RC[-46] -> 0 | BZ299: =RC[-46] -> 0 | CA299: =RC[-46] -> 0 | CB299: =RC[-46] -> 236250 | CC299: =RC[-46] -> 3939817 | CD299: =RC[-46] -> 0 | CE299: =RC[-46] -> 0 | CF299: =RC[-46] -> 0 | CG299: =RC[-46] -> 0 | CH299: =RC[-46] -> 0 | CI299: =RC[-46] -> 0 | CJ299: =RC[-46] -> 0 | CK299: =RC[-46] -> 0 | CL299: =RC[-46] -> 1 | CM299: =RC[-46] -> 0 | CN299: =RC[-46] -> 0 | CO299: =RC[-46] -> 4807506.33 | CP299: =RC[-46] -> 0 | CQ299: =RC[-46] -> 78750 | CR299: =RC[-46] -> 236250 | CS299: =RC[-46] -> 157500
A300: 60 | B300: 012588 | C300: Đào Huy Phong | D300: Nhân viên Bốc xếp | E300: 19028385553016 | F300: =RC[29]+RC[30]+RC[31]+RC[32]+RC[33]+RC[34]+RC[35]+RC[36]+RC[37] -> 3939817 | G300: =RC[17]+RC[18]++RC[19]+RC[20]+RC[21]+RC[38]+RC[39]+RC[41] -> 0 | H300: 0 | I300: 0 | J300: =RC[-2]+RC[-1] -> 0 | K300: 0 | L300: 680000 | M300: 235463 | N300: =RC[15]+RC[16]+RC[17]+RC[18]+RC[19]+RC[20] -> 236250 | O300: 0 | P300: 0 | Q300: 5091530 | R300: 179400 | S300: 33638 | T300: 22425 | U300: 48560.67 | V300: 0 | W300: 4807506.33 | X300: 0 | Y300: 0 | Z300: 0 | AA300: 0 | AB300: 0 | AC300: 0 | AD300: 0 | AE300: 0 | AF300: 0 | AG300: 0 | AH300: 236250 | AI300: 3939817 | AJ300: 0 | AK300: 0 | AL300: 0 | AM300: 0 | AN300: 0 | AO300: 0 | AP300: 0 | AQ300: 0 | AR300: =1 -> 1 | AS300: 0 | AT300: 0 | AU300: =RC[-30]-RC[-29]-RC[-28]-RC[-27]-RC[-26]-RC[-25] -> 4807506.33 | AV300: 0 | AW300: =RC[1]-RC[2] -> 78750 | AX300: 236250 | AY300: 157500 | AZ300: =RC[-46] -> 3939817 | BA300: =RC[-46] -> 0 | BB300: =RC[-46] -> 0 | BC300: =RC[-46] -> 0 | BD300: =RC[-46] -> 0 | BE300: =RC[-46] -> 0 | BF300: =RC[-46] -> 680000 | BG300: =RC[-46] -> 235463 | BH300: =RC[-46] -> 236250 | BI300: =RC[-46] -> 0 | BJ300: =RC[-46] -> 0 | BK300: =RC[-46] -> 5091530 | BL300: =RC[-46] -> 179400 | BM300: =RC[-46] -> 33638 | BN300: =RC[-46] -> 22425 | BO300: =RC[-46] -> 48560.67 | BP300: =RC[-46] -> 0 | BQ300: =RC[-46] -> 4807506.33 | BR300: =RC[-46] -> 0 | BS300: =RC[-46] -> 0 | BT300: =RC[-46] -> 0 | BU300: =RC[-46] -> 0 | BV300: =RC[-46] -> 0 | BW300: =RC[-46] -> 0 | BX300: =RC[-46] -> 0 | BY300: =RC[-46] -> 0 | BZ300: =RC[-46] -> 0 | CA300: =RC[-46] -> 0 | CB300: =RC[-46] -> 236250 | CC300: =RC[-46] -> 3939817 | CD300: =RC[-46] -> 0 | CE300: =RC[-46] -> 0 | CF300: =RC[-46] -> 0 | CG300: =RC[-46] -> 0 | CH300: =RC[-46] -> 0 | CI300: =RC[-46] -> 0 | CJ300: =RC[-46] -> 0 | CK300: =RC[-46] -> 0 | CL300: =RC[-46] -> 1 | CM300: =RC[-46] -> 0 | CN300: =RC[-46] -> 0 | CO300: =RC[-46] -> 4807506.33 | CP300: =RC[-46] -> 0 | CQ300: =RC[-46] -> 78750 | CR300: =RC[-46] -> 236250 | CS300: =RC[-46] -> 157500
A301: 61 | B301: 012589 | C301: Lê Văn Thiện | D301: Nhân viên Bốc xếp | E301: 19025508778019 | F301: =RC[29]+RC[30]+RC[31]+RC[32]+RC[33]+RC[34]+RC[35]+RC[36]+RC[37] -> 3939817 | G301: =RC[17]+RC[18]++RC[19]+RC[20]+RC[21]+RC[38]+RC[39]+RC[41] -> 0 | H301: 0 | I301: 0 | J301: =RC[-2]+RC[-1] -> 0 | K301: 0 | L301: 680000 | M301: 235463 | N301: =RC[15]+RC[16]+RC[17]+RC[18]+RC[19]+RC[20] -> 0 | O301: 0 | P301: 0 | Q301: 4855280 | R301: 179400 | S301: 33638 | T301: 22425 | U301: 46198.17 | V301: 0 | W301: 4573618.83 | X301: 0 | Y301: 0 | Z301: 0 | AA301: 0 | AB301: 0 | AC301: 0 | AD301: 0 | AE301: 0 | AF301: 0 | AG301: 0 | AH301: 0 | AI301: 3939817 | AJ301: 0 | AK301: 0 | AL301: 0 | AM301: 0 | AN301: 0 | AO301: 0 | AP301: 0 | AQ301: 0 | AR301: =1 -> 1 | AS301: 0 | AT301: 0 | AU301: =RC[-30]-RC[-29]-RC[-28]-RC[-27]-RC[-26]-RC[-25] -> 4573618.83 | AV301: 0 | AW301: =RC[1]-RC[2] -> 0 | AX301: 0 | AY301: 0 | AZ301: =RC[-46] -> 3939817 | BA301: =RC[-46] -> 0 | BB301: =RC[-46] -> 0 | BC301: =RC[-46] -> 0 | BD301: =RC[-46] -> 0 | BE301: =RC[-46] -> 0 | BF301: =RC[-46] -> 680000 | BG301: =RC[-46] -> 235463 | BH301: =RC[-46] -> 0 | BI301: =RC[-46] -> 0 | BJ301: =RC[-46] -> 0 | BK301: =RC[-46] -> 4855280 | BL301: =RC[-46] -> 179400 | BM301: =RC[-46] -> 33638 | BN301: =RC[-46] -> 22425 | BO301: =RC[-46] -> 46198.17 | BP301: =RC[-46] -> 0 | BQ301: =RC[-46] -> 4573618.83 | BR301: =RC[-46] -> 0 | BS301: =RC[-46] -> 0 | BT301: =RC[-46] -> 0 | BU301: =RC[-46] -> 0 | BV301: =RC[-46] -> 0 | BW301: =RC[-46] -> 0 | BX301: =RC[-46] -> 0 | BY301: =RC[-46] -> 0 | BZ301: =RC[-46] -> 0 | CA301: =RC[-46] -> 0 | CB301: =RC[-46] -> 0 | CC301: =RC[-46] -> 3939817 | CD301: =RC[-46] -> 0 | CE301: =RC[-46] -> 0 | CF301: =RC[-46] -> 0 | CG301: =RC[-46] -> 0 | CH301: =RC[-46] -> 0 | CI301: =RC[-46] -> 0 | CJ301: =RC[-46] -> 0 | CK301: =RC[-46] -> 0 | CL301: =RC[-46] -> 1 | CM301: =RC[-46] -> 0 | CN301: =RC[-46] -> 0 | CO301: =RC[-46] -> 4573618.83 | CP301: =RC[-46] -> 0 | CQ301: =RC[-46] -> 0 | CR301: =RC[-46] -> 0 | CS301: =RC[-46] -> 0
A302: 62 | B302: 012591 | C302: Nguyễn Xuân Quý | D302: Nhân viên Bốc xếp | E302: 19028385566010 | F302: =RC[29]+RC[30]+RC[31]+RC[32]+RC[33]+RC[34]+RC[35]+RC[36]+RC[37] -> 3939817 | G302: =RC[17]+RC[18]++RC[19]+RC[20]+RC[21]+RC[38]+RC[39]+RC[41] -> 0 | H302: 0 | I302: 0 | J302: =RC[-2]+RC[-1] -> 0 | K302: 0 | L302: 680000 | M302: 235463 | N302: =RC[15]+RC[16]+RC[17]+RC[18]+RC[19]+RC[20] -> 236250 | O302: 0 | P302: 0 | Q302: 5091530 | R302: 179400 | S302: 33638 | T302: 22425 | U302: 48560.67 | V302: 0 | W302: 4807506.33 | X302: 0 | Y302: 0 | Z302: 0 | AA302: 0 | AB302: 0 | AC302: 0 | AD302: 0 | AE302: 0 | AF302: 0 | AG302: 0 | AH302: 236250 | AI302: 3939817 | AJ302: 0 | AK302: 0 | AL302: 0 | AM302: 0 | AN302: 0 | AO302: 0 | AP302: 0 | AQ302: 0 | AR302: =1 -> 1 | AS302: 0 | AT302: 0 | AU302: =RC[-30]-RC[-29]-RC[-28]-RC[-27]-RC[-26]-RC[-25] -> 4807506.33 | AV302: 0 | AW302: =RC[1]-RC[2] -> 78750 | AX302: 236250 | AY302: 157500 | AZ302: =RC[-46] -> 3939817 | BA302: =RC[-46] -> 0 | BB302: =RC[-46] -> 0 | BC302: =RC[-46] -> 0 | BD302: =RC[-46] -> 0 | BE302: =RC[-46] -> 0 | BF302: =RC[-46] -> 680000 | BG302: =RC[-46] -> 235463 | BH302: =RC[-46] -> 236250 | BI302: =RC[-46] -> 0 | BJ302: =RC[-46] -> 0 | BK302: =RC[-46] -> 5091530 | BL302: =RC[-46] -> 179400 | BM302: =RC[-46] -> 33638 | BN302: =RC[-46] -> 22425 | BO302: =RC[-46] -> 48560.67 | BP302: =RC[-46] -> 0 | BQ302: =RC[-46] -> 4807506.33 | BR302: =RC[-46] -> 0 | BS302: =RC[-46] -> 0 | BT302: =RC[-46] -> 0 | BU302: =RC[-46] -> 0 | BV302: =RC[-46] -> 0 | BW302: =RC[-46] -> 0 | BX302: =RC[-46] -> 0 | BY302: =RC[-46] -> 0 | BZ302: =RC[-46] -> 0 | CA302: =RC[-46] -> 0 | CB302: =RC[-46] -> 236250 | CC302: =RC[-46] -> 3939817 | CD302: =RC[-46] -> 0 | CE302: =RC[-46] -> 0 | CF302: =RC[-46] -> 0 | CG302: =RC[-46] -> 0 | CH302: =RC[-46] -> 0 | CI302: =RC[-46] -> 0 | CJ302: =RC[-46] -> 0 | CK302: =RC[-46] -> 0 | CL302: =RC[-46] -> 1 | CM302: =RC[-46] -> 0 | CN302: =RC[-46] -> 0 | CO302: =RC[-46] -> 4807506.33 | CP302: =RC[-46] -> 0 | CQ302: =RC[-46] -> 78750 | CR302: =RC[-46] -> 236250 | CS302: =RC[-46] -> 157500
A303: 63 | B303: 012592 | C303: Lê Minh Huy | D303: Nhân viên Bốc xếp | E303: 19028385570018 | F303: =RC[29]+RC[30]+RC[31]+RC[32]+RC[33]+RC[34]+RC[35]+RC[36]+RC[37] -> 3350304 | G303: =RC[17]+RC[18]++RC[19]+RC[20]+RC[21]+RC[38]+RC[39]+RC[41] -> 0 | H303: 0 | I303: 0 | J303: =RC[-2]+RC[-1] -> 0 | K303: 0 | L303: 680000 | M303: 235463 | N303: =RC[15]+RC[16]+RC[17]+RC[18]+RC[19]+RC[20] -> 236250 | O303: 0 | P303: 0 | Q303: 4502017 | R303: 179400 | S303: 33638 | T303: 22425 | U303: 42665.54 | V303: 0 | W303: 4223888.46 | X303: 0 | Y303: 0 | Z303: 0 | AA303: 0 | AB303: 0 | AC303: 0 | AD303: 0 | AE303: 0 | AF303: 0 | AG303: 0 | AH303: 236250 | AI303: 3350304 | AJ303: 0 | AK303: 0 | AL303: 0 | AM303: 0 | AN303: 0 | AO303: 0 | AP303: 0 | AQ303: 0 | AR303: =1 -> 1 | AS303: 0 | AT303: 0 | AU303: =RC[-30]-RC[-29]-RC[-28]-RC[-27]-RC[-26]-RC[-25] -> 4223888.46 | AV303: 0 | AW303: =RC[1]-RC[2] -> 78750 | AX303: 236250 | AY303: 157500 | AZ303: =RC[-46] -> 3350304 | BA303: =RC[-46] -> 0 | BB303: =RC[-46] -> 0 | BC303: =RC[-46] -> 0 | BD303: =RC[-46] -> 0 | BE303: =RC[-46] -> 0 | BF303: =RC[-46] -> 680000 | BG303: =RC[-46] -> 235463 | BH303: =RC[-46] -> 236250 | BI303: =RC[-46] -> 0 | BJ303: =RC[-46] -> 0 | BK303: =RC[-46] -> 4502017 | BL303: =RC[-46] -> 179400 | BM303: =RC[-46] -> 33638 | BN303: =RC[-46] -> 22425 | BO303: =RC[-46] -> 42665.54 | BP303: =RC[-46] -> 0 | BQ303: =RC[-46] -> 4223888.46 | BR303: =RC[-46] -> 0 | BS303: =RC[-46] -> 0 | BT303: =RC[-46] -> 0 | BU303: =RC[-46] -> 0 | BV303: =RC[-46] -> 0 | BW303: =RC[-46] -> 0 | BX303: =RC[-46] -> 0 | BY303: =RC[-46] -> 0 | BZ303: =RC[-46] -> 0 | CA303: =RC[-46] -> 0 | CB303: =RC[-46] -> 236250 | CC303: =RC[-46] -> 3350304 | CD303: =RC[-46] -> 0 | CE303: =RC[-46] -> 0 | CF303: =RC[-46] -> 0 | CG303: =RC[-46] -> 0 | CH303: =RC[-46] -> 0 | CI303: =RC[-46] -> 0 | CJ303: =RC[-46] -> 0 | CK303: =RC[-46] -> 0 | CL303: =RC[-46] -> 1 | CM303: =RC[-46] -> 0 | CN303: =RC[-46] -> 0 | CO303: =RC[-46] -> 4223888.46 | CP303: =RC[-46] -> 0 | CQ303: =RC[-46] -> 78750 | CR303: =RC[-46] -> 236250 | CS303: =RC[-46] -> 157500
A304: 64 | B304: 013424 | C304: Bùi Tuấn Anh | D304: Nhân viên Bốc xếp | E304: 19028960235013 | F304: =RC[29]+RC[30]+RC[31]+RC[32]+RC[33]+RC[34]+RC[35]+RC[36]+RC[37] -> 3064302 | G304: =RC[17]+RC[18]++RC[19]+RC[20]+RC[21]+RC[38]+RC[39]+RC[41] -> 0 | H304: 0 | I304: 0 | J304: =RC[-2]+RC[-1] -> 0 | K304: 0 | L304: 680000 | M304: 0 | N304: =RC[15]+RC[16]+RC[17]+RC[18]+RC[19]+RC[20] -> 0 | O304: 0 | P304: 0 | Q304: 3744302 | R304: 0 | S304: 0 | T304: 0 | U304: 37443.019999999997 | V304: 0 | W304: 3706858.98 | X304: 0 | Y304: 0 | Z304: 0 | AA304: 0 | AB304: 0 | AC304: 0 | AD304: 0 | AE304: 0 | AF304: 0 | AG304: 0 | AH304: 0 | AI304: 3064302 | AJ304: 0 | AK304: 0 | AL304: 0 | AM304: 0 | AN304: 0 | AO304: 0 | AP304: 0 | AQ304: 0 | AR304: =1 -> 1 | AS304: 0 | AT304: 0 | AU304: =RC[-30]-RC[-29]-RC[-28]-RC[-27]-RC[-26]-RC[-25] -> 3706858.98 | AV304: 0 | AW304: =RC[1]-RC[2] -> 0 | AX304: 0 | AY304: 0 | AZ304: =RC[-46] -> 3064302 | BA304: =RC[-46] -> 0 | BB304: =RC[-46] -> 0 | BC304: =RC[-46] -> 0 | BD304: =RC[-46] -> 0 | BE304: =RC[-46] -> 0 | BF304: =RC[-46] -> 680000 | BG304: =RC[-46] -> 0 | BH304: =RC[-46] -> 0 | BI304: =RC[-46] -> 0 | BJ304: =RC[-46] -> 0 | BK304: =RC[-46] -> 3744302 | BL304: =RC[-46] -> 0 | BM304: =RC[-46] -> 0 | BN304: =RC[-46] -> 0 | BO304: =RC[-46] -> 37443.019999999997 | BP304: =RC[-46] -> 0 | BQ304: =RC[-46] -> 3706858.98 | BR304: =RC[-46] -> 0 | BS304: =RC[-46] -> 0 | BT304: =RC[-46] -> 0 | BU304: =RC[-46] -> 0 | BV304: =RC[-46] -> 0 | BW304: =RC[-46] -> 0 | BX304: =RC[-46] -> 0 | BY304: =RC[-46] -> 0 | BZ304: =RC[-46] -> 0 | CA304: =RC[-46] -> 0 | CB304: =RC[-46] -> 0 | CC304: =RC[-46] -> 3064302 | CD304: =RC[-46] -> 0 | CE304: =RC[-46] -> 0 | CF304: =RC[-46] -> 0 | CG304: =RC[-46] -> 0 | CH304: =RC[-46] -> 0 | CI304: =RC[-46] -> 0 | CJ304: =RC[-46] -> 0 | CK304: =RC[-46] -> 0 | CL304: =RC[-46] -> 1 | CM304: =RC[-46] -> 0 | CN304: =RC[-46] -> 0 | CO304: =RC[-46] -> 3706858.98 | CP304: =RC[-46] -> 0 | CQ304: =RC[-46] -> 0 | CR304: =RC[-46] -> 0 | CS304: =RC[-46] -> 0
A305: 65 | B305: 013425 | C305: Nguyễn Duy Trinh | D305: Nhân viên Bốc xếp | E305: 19020203734011 | F305: =RC[29]+RC[30]+RC[31]+RC[32]+RC[33]+RC[34]+RC[35]+RC[36]+RC[37] -> 3064302 | G305: =RC[17]+RC[18]++RC[19]+RC[20]+RC[21]+RC[38]+RC[39]+RC[41] -> 0 | H305: 0 | I305: 0 | J305: =RC[-2]+RC[-1] -> 0 | K305: 0 | L305: 680000 | M305: 0 | N305: =RC[15]+RC[16]+RC[17]+RC[18]+RC[19]+RC[20] -> 0 | O305: 0 | P305: 0 | Q305: 3744302 | R305: 0 | S305: 0 | T305: 0 | U305: 37443.019999999997 | V305: 0 | W305: 3706858.98 | X305: 0 | Y305: 0 | Z305: 0 | AA305: 0 | AB305: 0 | AC305: 0 | AD305: 0 | AE305: 0 | AF305: 0 | AG305: 0 | AH305: 0 | AI305: 3064302 | AJ305: 0 | AK305: 0 | AL305: 0 | AM305: 0 | AN305: 0 | AO305: 0 | AP305: 0 | AQ305: 0 | AR305: =1 -> 1 | AS305: 0 | AT305: 0 | AU305: =RC[-30]-RC[-29]-RC[-28]-RC[-27]-RC[-26]-RC[-25] -> 3706858.98 | AV305: 0 | AW305: =RC[1]-RC[2] -> 0 | AX305: 0 | AY305: 0 | AZ305: =RC[-46] -> 3064302 | BA305: =RC[-46] -> 0 | BB305: =RC[-46] -> 0 | BC305: =RC[-46] -> 0 | BD305: =RC[-46] -> 0 | BE305: =RC[-46] -> 0 | BF305: =RC[-46] -> 680000 | BG305: =RC[-46] -> 0 | BH305: =RC[-46] -> 0 | BI305: =RC[-46] -> 0 | BJ305: =RC[-46] -> 0 | BK305: =RC[-46] -> 3744302 | BL305: =RC[-46] -> 0 | BM305: =RC[-46] -> 0 | BN305: =RC[-46] -> 0 | BO305: =RC[-46] -> 37443.019999999997 | BP305: =RC[-46] -> 0 | BQ305: =RC[-46] -> 3706858.98 | BR305: =RC[-46] -> 0 | BS305: =RC[-46] -> 0 | BT305: =RC[-46] -> 0 | BU305: =RC[-46] -> 0 | BV305: =RC[-46] -> 0 | BW305: =RC[-46] -> 0 | BX305: =RC[-46] -> 0 | BY305: =RC[-46] -> 0 | BZ305: =RC[-46] -> 0 | CA305: =RC[-46] -> 0 | CB305: =RC[-46] -> 0 | CC305: =RC[-46] -> 3064302 | CD305: =RC[-46] -> 0 | CE305: =RC[-46] -> 0 | CF305: =RC[-46] -> 0 | CG305: =RC[-46] -> 0 | CH305: =RC[-46] -> 0 | CI305: =RC[-46] -> 0 | CJ305: =RC[-46] -> 0 | CK305: =RC[-46] -> 0 | CL305: =RC[-46] -> 1 | CM305: =RC[-46] -> 0 | CN305: =RC[-46] -> 0 | CO305: =RC[-46] -> 3706858.98 | CP305: =RC[-46] -> 0 | CQ305: =RC[-46] -> 0 | CR305: =RC[-46] -> 0 | CS305: =RC[-46] -> 0
A306: 66 | B306: 013436 | C306: Lê Văn Thư | D306: Nhân viên Bốc xếp | E306: 19028960271011 | F306: =RC[29]+RC[30]+RC[31]+RC[32]+RC[33]+RC[34]+RC[35]+RC[36]+RC[37] -> 3064302 | G306: =RC[17]+RC[18]++RC[19]+RC[20]+RC[21]+RC[38]+RC[39]+RC[41] -> 0 | H306: 0 | I306: 0 | J306: =RC[-2]+RC[-1] -> 0 | K306: 0 | L306: 680000 | M306: 0 | N306: =RC[15]+RC[16]+RC[17]+RC[18]+RC[19]+RC[20] -> 0 | O306: 0 | P306: 0 | Q306: 3744302 | R306: 0 | S306: 0 | T306: 0 | U306: 37443.019999999997 | V306: 0 | W306: 3706858.98 | X306: 0 | Y306: 0 | Z306: 0 | AA306: 0 | AB306: 0 | AC306: 0 | AD306: 0 | AE306: 0 | AF306: 0 | AG306: 0 | AH306: 0 | AI306: 3064302 | AJ306: 0 | AK306: 0 | AL306: 0 | AM306: 0 | AN306: 0 | AO306: 0 | AP306: 0 | AQ306: 0 | AR306: =1 -> 1 | AS306: 0 | AT306: 0 | AU306: =RC[-30]-RC[-29]-RC[-28]-RC[-27]-RC[-26]-RC[-25] -> 3706858.98 | AV306: 0 | AW306: =RC[1]-RC[2] -> 0 | AX306: 0 | AY306: 0 | AZ306: =RC[-46] -> 3064302 | BA306: =RC[-46] -> 0 | BB306: =RC[-46] -> 0 | BC306: =RC[-46] -> 0 | BD306: =RC[-46] -> 0 | BE306: =RC[-46] -> 0 | BF306: =RC[-46] -> 680000 | BG306: =RC[-46] -> 0 | BH306: =RC[-46] -> 0 | BI306: =RC[-46] -> 0 | BJ306: =RC[-46] -> 0 | BK306: =RC[-46] -> 3744302 | BL306: =RC[-46] -> 0 | BM306: =RC[-46] -> 0 | BN306: =RC[-46] -> 0 | BO306: =RC[-46] -> 37443.019999999997 | BP306: =RC[-46] -> 0 | BQ306: =RC[-46] -> 3706858.98 | BR306: =RC[-46] -> 0 | BS306: =RC[-46] -> 0 | BT306: =RC[-46] -> 0 | BU306: =RC[-46] -> 0 | BV306: =RC[-46] -> 0 | BW306: =RC[-46] -> 0 | BX306: =RC[-46] -> 0 | BY306: =RC[-46] -> 0 | BZ306: =RC[-46] -> 0 | CA306: =RC[-46] -> 0 | CB306: =RC[-46] -> 0 | CC306: =RC[-46] -> 3064302 | CD306: =RC[-46] -> 0 | CE306: =RC[-46] -> 0 | CF306: =RC[-46] -> 0 | CG306: =RC[-46] -> 0 | CH306: =RC[-46] -> 0 | CI306: =RC[-46] -> 0 | CJ306: =RC[-46] -> 0 | CK306: =RC[-46] -> 0 | CL306: =RC[-46] -> 1 | CM306: =RC[-46] -> 0 | CN306: =RC[-46] -> 0 | CO306: =RC[-46] -> 3706858.98 | CP306: =RC[-46] -> 0 | CQ306: =RC[-46] -> 0 | CR306: =RC[-46] -> 0 | CS306: =RC[-46] -> 0
A307: 67 | B307: 013437 | C307: Phạm Ngọc Huấn | D307: Nhân viên Bốc xếp | E307: 19028960192012 | F307: =RC[29]+RC[30]+RC[31]+RC[32]+RC[33]+RC[34]+RC[35]+RC[36]+RC[37] -> 3064302 | G307: =RC[17]+RC[18]++RC[19]+RC[20]+RC[21]+RC[38]+RC[39]+RC[41] -> 0 | H307: 0 | I307: 0 | J307: =RC[-2]+RC[-1] -> 0 | K307: 0 | L307: 680000 | M307: 0 | N307: =RC[15]+RC[16]+RC[17]+RC[18]+RC[19]+RC[20] -> 0 | O307: 0 | P307: 0 | Q307: 3744302 | R307: 0 | S307: 0 | T307: 0 | U307: 37443.019999999997 | V307: 0 | W307: 3706858.98 | X307: 0 | Y307: 0 | Z307: 0 | AA307: 0 | AB307: 0 | AC307: 0 | AD307: 0 | AE307: 0 | AF307: 0 | AG307: 0 | AH307: 0 | AI307: 3064302 | AJ307: 0 | AK307: 0 | AL307: 0 | AM307: 0 | AN307: 0 | AO307: 0 | AP307: 0 | AQ307: 0 | AR307: =1 -> 1 | AS307: 0 | AT307: 0 | AU307: =RC[-30]-RC[-29]-RC[-28]-RC[-27]-RC[-26]-RC[-25] -> 3706858.98 | AV307: 0 | AW307: =RC[1]-RC[2] -> 0 | AX307: 0 | AY307: 0 | AZ307: =RC[-46] -> 3064302 | BA307: =RC[-46] -> 0 | BB307: =RC[-46] -> 0 | BC307: =RC[-46] -> 0 | BD307: =RC[-46] -> 0 | BE307: =RC[-46] -> 0 | BF307: =RC[-46] -> 680000 | BG307: =RC[-46] -> 0 | BH307: =RC[-46] -> 0 | BI307: =RC[-46] -> 0 | BJ307: =RC[-46] -> 0 | BK307: =RC[-46] -> 3744302 | BL307: =RC[-46] -> 0 | BM307: =RC[-46] -> 0 | BN307: =RC[-46] -> 0 | BO307: =RC[-46] -> 37443.019999999997 | BP307: =RC[-46] -> 0 | BQ307: =RC[-46] -> 3706858.98 | BR307: =RC[-46] -> 0 | BS307: =RC[-46] -> 0 | BT307: =RC[-46] -> 0 | BU307: =RC[-46] -> 0 | BV307: =RC[-46] -> 0 | BW307: =RC[-46] -> 0 | BX307: =RC[-46] -> 0 | BY307: =RC[-46] -> 0 | BZ307: =RC[-46] -> 0 | CA307: =RC[-46] -> 0 | CB307: =RC[-46] -> 0 | CC307: =RC[-46] -> 3064302 | CD307: =RC[-46] -> 0 | CE307: =RC[-46] -> 0 | CF307: =RC[-46] -> 0 | CG307: =RC[-46] -> 0 | CH307: =RC[-46] -> 0 | CI307: =RC[-46] -> 0 | CJ307: =RC[-46] -> 0 | CK307: =RC[-46] -> 0 | CL307: =RC[-46] -> 1 | CM307: =RC[-46] -> 0 | CN307: =RC[-46] -> 0 | CO307: =RC[-46] -> 3706858.98 | CP307: =RC[-46] -> 0 | CQ307: =RC[-46] -> 0 | CR307: =RC[-46] -> 0 | CS307: =RC[-46] -> 0
A308: 68 | B308: 013446 | C308: Dương Công Tú | D308: Nhân viên Bốc xếp | E308: 19028960173018 | F308: =RC[29]+RC[30]+RC[31]+RC[32]+RC[33]+RC[34]+RC[35]+RC[36]+RC[37] -> 3064302 | G308: =RC[17]+RC[18]++RC[19]+RC[20]+RC[21]+RC[38]+RC[39]+RC[41] -> 0 | H308: 0 | I308: 0 | J308: =RC[-2]+RC[-1] -> 0 | K308: 0 | L308: 680000 | M308: 0 | N308: =RC[15]+RC[16]+RC[17]+RC[18]+RC[19]+RC[20] -> 0 | O308: 0 | P308: 0 | Q308: 3744302 | R308: 0 | S308: 0 | T308: 0 | U308: 37443.019999999997 | V308: 0 | W308: 3706858.98 | X308: 0 | Y308: 0 | Z308: 0 | AA308: 0 | AB308: 0 | AC308: 0 | AD308: 0 | AE308: 0 | AF308: 0 | AG308: 0 | AH308: 0 | AI308: 3064302 | AJ308: 0 | AK308: 0 | AL308: 0 | AM308: 0 | AN308: 0 | AO308: 0 | AP308: 0 | AQ308: 0 | AR308: =1 -> 1 | AS308: 0 | AT308: 0 | AU308: =RC[-30]-RC[-29]-RC[-28]-RC[-27]-RC[-26]-RC[-25] -> 3706858.98 | AV308: 0 | AW308: =RC[1]-RC[2] -> 0 | AX308: 0 | AY308: 0 | AZ308: =RC[-46] -> 3064302 | BA308: =RC[-46] -> 0 | BB308: =RC[-46] -> 0 | BC308: =RC[-46] -> 0 | BD308: =RC[-46] -> 0 | BE308: =RC[-46] -> 0 | BF308: =RC[-46] -> 680000 | BG308: =RC[-46] -> 0 | BH308: =RC[-46] -> 0 | BI308: =RC[-46] -> 0 | BJ308: =RC[-46] -> 0 | BK308: =RC[-46] -> 3744302 | BL308: =RC[-46] -> 0 | BM308: =RC[-46] -> 0 | BN308: =RC[-46] -> 0 | BO308: =RC[-46] -> 37443.019999999997 | BP308: =RC[-46] -> 0 | BQ308: =RC[-46] -> 3706858.98 | BR308: =RC[-46] -> 0 | BS308: =RC[-46] -> 0 | BT308: =RC[-46] -> 0 | BU308: =RC[-46] -> 0 | BV308: =RC[-46] -> 0 | BW308: =RC[-46] -> 0 | BX308: =RC[-46] -> 0 | BY308: =RC[-46] -> 0 | BZ308: =RC[-46] -> 0 | CA308: =RC[-46] -> 0 | CB308: =RC[-46] -> 0 | CC308: =RC[-46] -> 3064302 | CD308: =RC[-46] -> 0 | CE308: =RC[-46] -> 0 | CF308: =RC[-46] -> 0 | CG308: =RC[-46] -> 0 | CH308: =RC[-46] -> 0 | CI308: =RC[-46] -> 0 | CJ308: =RC[-46] -> 0 | CK308: =RC[-46] -> 0 | CL308: =RC[-46] -> 1 | CM308: =RC[-46] -> 0 | CN308: =RC[-46] -> 0 | CO308: =RC[-46] -> 3706858.98 | CP308: =RC[-46] -> 0 | CQ308: =RC[-46] -> 0 | CR308: =RC[-46] -> 0 | CS308: =RC[-46] -> 0
A309: 69 | B309: 013448 | C309: Nguyễn Hùng Anh | D309: Nhân viên Bốc xếp | E309: 19028960229013 | F309: =RC[29]+RC[30]+RC[31]+RC[32]+RC[33]+RC[34]+RC[35]+RC[36]+RC[37] -> 3064302 | G309: =RC[17]+RC[18]++RC[19]+RC[20]+RC[21]+RC[38]+RC[39]+RC[41] -> 0 | H309: 0 | I309: 0 | J309: =RC[-2]+RC[-1] -> 0 | K309: 0 | L309: 680000 | M309: 0 | N309: =RC[15]+RC[16]+RC[17]+RC[18]+RC[19]+RC[20] -> 0 | O309: 0 | P309: 0 | Q309: 3744302 | R309: 0 | S309: 0 | T309: 0 | U309: 37443.019999999997 | V309: 0 | W309: 3706858.98 | X309: 0 | Y309: 0 | Z309: 0 | AA309: 0 | AB309: 0 | AC309: 0 | AD309: 0 | AE309: 0 | AF309: 0 | AG309: 0 | AH309: 0 | AI309: 3064302 | AJ309: 0 | AK309: 0 | AL309: 0 | AM309: 0 | AN309: 0 | AO309: 0 | AP309: 0 | AQ309: 0 | AR309: =1 -> 1 | AS309: 0 | AT309: 0 | AU309: =RC[-30]-RC[-29]-RC[-28]-RC[-27]-RC[-26]-RC[-25] -> 3706858.98 | AV309: 0 | AW309: =RC[1]-RC[2] -> 0 | AX309: 0 | AY309: 0 | AZ309: =RC[-46] -> 3064302 | BA309: =RC[-46] -> 0 | BB309: =RC[-46] -> 0 | BC309: =RC[-46] -> 0 | BD309: =RC[-46] -> 0 | BE309: =RC[-46] -> 0 | BF309: =RC[-46] -> 680000 | BG309: =RC[-46] -> 0 | BH309: =RC[-46] -> 0 | BI309: =RC[-46] -> 0 | BJ309: =RC[-46] -> 0 | BK309: =RC[-46] -> 3744302 | BL309: =RC[-46] -> 0 | BM309: =RC[-46] -> 0 | BN309: =RC[-46] -> 0 | BO309: =RC[-46] -> 37443.019999999997 | BP309: =RC[-46] -> 0 | BQ309: =RC[-46] -> 3706858.98 | BR309: =RC[-46] -> 0 | BS309: =RC[-46] -> 0 | BT309: =RC[-46] -> 0 | BU309: =RC[-46] -> 0 | BV309: =RC[-46] -> 0 | BW309: =RC[-46] -> 0 | BX309: =RC[-46] -> 0 | BY309: =RC[-46] -> 0 | BZ309: =RC[-46] -> 0 | CA309: =RC[-46] -> 0 | CB309: =RC[-46] -> 0 | CC309: =RC[-46] -> 3064302 | CD309: =RC[-46] -> 0 | CE309: =RC[-46] -> 0 | CF309: =RC[-46] -> 0 | CG309: =RC[-46] -> 0 | CH309: =RC[-46] -> 0 | CI309: =RC[-46] -> 0 | CJ309: =RC[-46] -> 0 | CK309: =RC[-46] -> 0 | CL309: =RC[-46] -> 1 | CM309: =RC[-46] -> 0 | CN309: =RC[-46] -> 0 | CO309: =RC[-46] -> 3706858.98 | CP309: =RC[-46] -> 0 | CQ309: =RC[-46] -> 0 | CR309: =RC[-46] -> 0 | CS309: =RC[-46] -> 0
A310: 70 | B310: 013450 | C310: Phạm Văn Mạnh | D310: Nhân viên Bốc xếp | E310: 19027722431029 | F310: =RC[29]+RC[30]+RC[31]+RC[32]+RC[33]+RC[34]+RC[35]+RC[36]+RC[37] -> 3064302 | G310: =RC[17]+RC[18]++RC[19]+RC[20]+RC[21]+RC[38]+RC[39]+RC[41] -> 0 | H310: 0 | I310: 0 | J310: =RC[-2]+RC[-1] -> 0 | K310: 0 | L310: 680000 | M310: 0 | N310: =RC[15]+RC[16]+RC[17]+RC[18]+RC[19]+RC[20] -> 0 | O310: 0 | P310: 0 | Q310: 3744302 | R310: 0 | S310: 0 | T310: 0 | U310: 37443.019999999997 | V310: 0 | W310: 3706858.98 | X310: 0 | Y310: 0 | Z310: 0 | AA310: 0 | AB310: 0 | AC310: 0 | AD310: 0 | AE310: 0 | AF310: 0 | AG310: 0 | AH310: 0 | AI310: 3064302 | AJ310: 0 | AK310: 0 | AL310: 0 | AM310: 0 | AN310: 0 | AO310: 0 | AP310: 0 | AQ310: 0 | AR310: =1 -> 1 | AS310: 0 | AT310: 0 | AU310: =RC[-30]-RC[-29]-RC[-28]-RC[-27]-RC[-26]-RC[-25] -> 3706858.98 | AV310: 0 | AW310: =RC[1]-RC[2] -> 0 | AX310: 0 | AY310: 0 | AZ310: =RC[-46] -> 3064302 | BA310: =RC[-46] -> 0 | BB310: =RC[-46] -> 0 | BC310: =RC[-46] -> 0 | BD310: =RC[-46] -> 0 | BE310: =RC[-46] -> 0 | BF310: =RC[-46] -> 680000 | BG310: =RC[-46] -> 0 | BH310: =RC[-46] -> 0 | BI310: =RC[-46] -> 0 | BJ310: =RC[-46] -> 0 | BK310: =RC[-46] -> 3744302 | BL310: =RC[-46] -> 0 | BM310: =RC[-46] -> 0 | BN310: =RC[-46] -> 0 | BO310: =RC[-46] -> 37443.019999999997 | BP310: =RC[-46] -> 0 | BQ310: =RC[-46] -> 3706858.98 | BR310: =RC[-46] -> 0 | BS310: =RC[-46] -> 0 | BT310: =RC[-46] -> 0 | BU310: =RC[-46] -> 0 | BV310: =RC[-46] -> 0 | BW310: =RC[-46] -> 0 | BX310: =RC[-46] -> 0 | BY310: =RC[-46] -> 0 | BZ310: =RC[-46] -> 0 | CA310: =RC[-46] -> 0 | CB310: =RC[-46] -> 0 | CC310: =RC[-46] -> 3064302 | CD310: =RC[-46] -> 0 | CE310: =RC[-46] -> 0 | CF310: =RC[-46] -> 0 | CG310: =RC[-46] -> 0 | CH310: =RC[-46] -> 0 | CI310: =RC[-46] -> 0 | CJ310: =RC[-46] -> 0 | CK310: =RC[-46] -> 0 | CL310: =RC[-46] -> 1 | CM310: =RC[-46] -> 0 | CN310: =RC[-46] -> 0 | CO310: =RC[-46] -> 3706858.98 | CP310: =RC[-46] -> 0 | CQ310: =RC[-46] -> 0 | CR310: =RC[-46] -> 0 | CS310: =RC[-46] -> 0
A311: 71 | B311: 013451 | C311: Vũ Minh Tiến | D311: Nhân viên Bốc xếp | E311: 19028960266016 | F311: =RC[29]+RC[30]+RC[31]+RC[32]+RC[33]+RC[34]+RC[35]+RC[36]+RC[37] -> 3064302 | G311: =RC[17]+RC[18]++RC[19]+RC[20]+RC[21]+RC[38]+RC[39]+RC[41] -> 0 | H311: 0 | I311: 0 | J311: =RC[-2]+RC[-1] -> 0 | K311: 0 | L311: 680000 | M311: 0 | N311: =RC[15]+RC[16]+RC[17]+RC[18]+RC[19]+RC[20] -> 0 | O311: 0 | P311: 0 | Q311: 3744302 | R311: 0 | S311: 0 | T311: 0 | U311: 37443.019999999997 | V311: 0 | W311: 3706858.98 | X311: 0 | Y311: 0 | Z311: 0 | AA311: 0 | AB311: 0 | AC311: 0 | AD311: 0 | AE311: 0 | AF311: 0 | AG311: 0 | AH311: 0 | AI311: 3064302 | AJ311: 0 | AK311: 0 | AL311: 0 | AM311: 0 | AN311: 0 | AO311: 0 | AP311: 0 | AQ311: 0 | AR311: =1 -> 1 | AS311: 0 | AT311: 0 | AU311: =RC[-30]-RC[-29]-RC[-28]-RC[-27]-RC[-26]-RC[-25] -> 3706858.98 | AV311: 0 | AW311: =RC[1]-RC[2] -> 0 | AX311: 0 | AY311: 0 | AZ311: =RC[-46] -> 3064302 | BA311: =RC[-46] -> 0 | BB311: =RC[-46] -> 0 | BC311: =RC[-46] -> 0 | BD311: =RC[-46] -> 0 | BE311: =RC[-46] -> 0 | BF311: =RC[-46] -> 680000 | BG311: =RC[-46] -> 0 | BH311: =RC[-46] -> 0 | BI311: =RC[-46] -> 0 | BJ311: =RC[-46] -> 0 | BK311: =RC[-46] -> 3744302 | BL311: =RC[-46] -> 0 | BM311: =RC[-46] -> 0 | BN311: =RC[-46] -> 0 | BO311: =RC[-46] -> 37443.019999999997 | BP311: =RC[-46] -> 0 | BQ311: =RC[-46] -> 3706858.98 | BR311: =RC[-46] -> 0 | BS311: =RC[-46] -> 0 | BT311: =RC[-46] -> 0 | BU311: =RC[-46] -> 0 | BV311: =RC[-46] -> 0 | BW311: =RC[-46] -> 0 | BX311: =RC[-46] -> 0 | BY311: =RC[-46] -> 0 | BZ311: =RC[-46] -> 0 | CA311: =RC[-46] -> 0 | CB311: =RC[-46] -> 0 | CC311: =RC[-46] -> 3064302 | CD311: =RC[-46] -> 0 | CE311: =RC[-46] -> 0 | CF311: =RC[-46] -> 0 | CG311: =RC[-46] -> 0 | CH311: =RC[-46] -> 0 | CI311: =RC[-46] -> 0 | CJ311: =RC[-46] -> 0 | CK311: =RC[-46] -> 0 | CL311: =RC[-46] -> 1 | CM311: =RC[-46] -> 0 | CN311: =RC[-46] -> 0 | CO311: =RC[-46] -> 3706858.98 | CP311: =RC[-46] -> 0 | CQ311: =RC[-46] -> 0 | CR311: =RC[-46] -> 0 | CS311: =RC[-46] -> 0
A312: 72 | B312: 013453 | C312: Nguyễn Văn Khiêm | D312: Nhân viên Bốc xếp | E312: 19027527604016 | F312: =RC[29]+RC[30]+RC[31]+RC[32]+RC[33]+RC[34]+RC[35]+RC[36]+RC[37] -> 3064302 | G312: =RC[17]+RC[18]++RC[19]+RC[20]+RC[21]+RC[38]+RC[39]+RC[41] -> 0 | H312: 0 | I312: 0 | J312: =RC[-2]+RC[-1] -> 0 | K312: 0 | L312: 680000 | M312: 0 | N312: =RC[15]+RC[16]+RC[17]+RC[18]+RC[19]+RC[20] -> 0 | O312: 0 | P312: 0 | Q312: 3744302 | R312: 0 | S312: 0 | T312: 0 | U312: 37443.019999999997 | V312: 0 | W312: 3706858.98 | X312: 0 | Y312: 0 | Z312: 0 | AA312: 0 | AB312: 0 | AC312: 0 | AD312: 0 | AE312: 0 | AF312: 0 | AG312: 0 | AH312: 0 | AI312: 3064302 | AJ312: 0 | AK312: 0 | AL312: 0 | AM312: 0 | AN312: 0 | AO312: 0 | AP312: 0 | AQ312: 0 | AR312: =1 -> 1 | AS312: 0 | AT312: 0 | AU312: =RC[-30]-RC[-29]-RC[-28]-RC[-27]-RC[-26]-RC[-25] -> 3706858.98 | AV312: 0 | AW312: =RC[1]-RC[2] -> 0 | AX312: 0 | AY312: 0 | AZ312: =RC[-46] -> 3064302 | BA312: =RC[-46] -> 0 | BB312: =RC[-46] -> 0 | BC312: =RC[-46] -> 0 | BD312: =RC[-46] -> 0 | BE312: =RC[-46] -> 0 | BF312: =RC[-46] -> 680000 | BG312: =RC[-46] -> 0 | BH312: =RC[-46] -> 0 | BI312: =RC[-46] -> 0 | BJ312: =RC[-46] -> 0 | BK312: =RC[-46] -> 3744302 | BL312: =RC[-46] -> 0 | BM312: =RC[-46] -> 0 | BN312: =RC[-46] -> 0 | BO312: =RC[-46] -> 37443.019999999997 | BP312: =RC[-46] -> 0 | BQ312: =RC[-46] -> 3706858.98 | BR312: =RC[-46] -> 0 | BS312: =RC[-46] -> 0 | BT312: =RC[-46] -> 0 | BU312: =RC[-46] -> 0 | BV312: =RC[-46] -> 0 | BW312: =RC[-46] -> 0 | BX312: =RC[-46] -> 0 | BY312: =RC[-46] -> 0 | BZ312: =RC[-46] -> 0 | CA312: =RC[-46] -> 0 | CB312: =RC[-46] -> 0 | CC312: =RC[-46] -> 3064302 | CD312: =RC[-46] -> 0 | CE312: =RC[-46] -> 0 | CF312: =RC[-46] -> 0 | CG312: =RC[-46] -> 0 | CH312: =RC[-46] -> 0 | CI312: =RC[-46] -> 0 | CJ312: =RC[-46] -> 0 | CK312: =RC[-46] -> 0 | CL312: =RC[-46] -> 1 | CM312: =RC[-46] -> 0 | CN312: =RC[-46] -> 0 | CO312: =RC[-46] -> 3706858.98 | CP312: =RC[-46] -> 0 | CQ312: =RC[-46] -> 0 | CR312: =RC[-46] -> 0 | CS312: =RC[-46] -> 0
A313: 73 | B313: 013454 | C313: Nguyễn Xuân Hải | D313: Nhân viên Bốc xếp | E313: 19028960290014 | F313: =RC[29]+RC[30]+RC[31]+RC[32]+RC[33]+RC[34]+RC[35]+RC[36]+RC[37] -> 3064302 | G313: =RC[17]+RC[18]++RC[19]+RC[20]+RC[21]+RC[38]+RC[39]+RC[41] -> 0 | H313: 0 | I313: 0 | J313: =RC[-2]+RC[-1] -> 0 | K313: 0 | L313: 680000 | M313: 0 | N313: =RC[15]+RC[16]+RC[17]+RC[18]+RC[19]+RC[20] -> 0 | O313: 0 | P313: 0 | Q313: 3744302 | R313: 0 | S313: 0 | T313: 0 | U313: 37443.019999999997 | V313: 0 | W313: 3706858.98 | X313: 0 | Y313: 0 | Z313: 0 | AA313: 0 | AB313: 0 | AC313: 0 | AD313: 0 | AE313: 0 | AF313: 0 | AG313: 0 | AH313: 0 | AI313: 3064302 | AJ313: 0 | AK313: 0 | AL313: 0 | AM313: 0 | AN313: 0 | AO313: 0 | AP313: 0 | AQ313: 0 | AR313: =1 -> 1 | AS313: 0 | AT313: 0 | AU313: =RC[-30]-RC[-29]-RC[-28]-RC[-27]-RC[-26]-RC[-25] -> 3706858.98 | AV313: 0 | AW313: =RC[1]-RC[2] -> 0 | AX313: 0 | AY313: 0 | AZ313: =RC[-46] -> 3064302 | BA313: =RC[-46] -> 0 | BB313: =RC[-46] -> 0 | BC313: =RC[-46] -> 0 | BD313: =RC[-46] -> 0 | BE313: =RC[-46] -> 0 | BF313: =RC[-46] -> 680000 | BG313: =RC[-46] -> 0 | BH313: =RC[-46] -> 0 | BI313: =RC[-46] -> 0 | BJ313: =RC[-46] -> 0 | BK313: =RC[-46] -> 3744302 | BL313: =RC[-46] -> 0 | BM313: =RC[-46] -> 0 | BN313: =RC[-46] -> 0 | BO313: =RC[-46] -> 37443.019999999997 | BP313: =RC[-46] -> 0 | BQ313: =RC[-46] -> 3706858.98 | BR313: =RC[-46] -> 0 | BS313: =RC[-46] -> 0 | BT313: =RC[-46] -> 0 | BU313: =RC[-46] -> 0 | BV313: =RC[-46] -> 0 | BW313: =RC[-46] -> 0 | BX313: =RC[-46] -> 0 | BY313: =RC[-46] -> 0 | BZ313: =RC[-46] -> 0 | CA313: =RC[-46] -> 0 | CB313: =RC[-46] -> 0 | CC313: =RC[-46] -> 3064302 | CD313: =RC[-46] -> 0 | CE313: =RC[-46] -> 0 | CF313: =RC[-46] -> 0 | CG313: =RC[-46] -> 0 | CH313: =RC[-46] -> 0 | CI313: =RC[-46] -> 0 | CJ313: =RC[-46] -> 0 | CK313: =RC[-46] -> 0 | CL313: =RC[-46] -> 1 | CM313: =RC[-46] -> 0 | CN313: =RC[-46] -> 0 | CO313: =RC[-46] -> 3706858.98 | CP313: =RC[-46] -> 0 | CQ313: =RC[-46] -> 0 | CR313: =RC[-46] -> 0 | CS313: =RC[-46] -> 0
A314: 74 | B314: 013455 | C314: Nguyễn Như Tuấn | D314: Nhân viên Bốc xếp | E314: 19028960241013 | F314: =RC[29]+RC[30]+RC[31]+RC[32]+RC[33]+RC[34]+RC[35]+RC[36]+RC[37] -> 3064302 | G314: =RC[17]+RC[18]++RC[19]+RC[20]+RC[21]+RC[38]+RC[39]+RC[41] -> 0 | H314: 0 | I314: 0 | J314: =RC[-2]+RC[-1] -> 0 | K314: 0 | L314: 680000 | M314: 0 | N314: =RC[15]+RC[16]+RC[17]+RC[18]+RC[19]+RC[20] -> 0 | O314: 0 | P314: 0 | Q314: 3744302 | R314: 0 | S314: 0 | T314: 0 | U314: 37443.019999999997 | V314: 0 | W314: 3706858.98 | X314: 0 | Y314: 0 | Z314: 0 | AA314: 0 | AB314: 0 | AC314: 0 | AD314: 0 | AE314: 0 | AF314: 0 | AG314: 0 | AH314: 0 | AI314: 3064302 | AJ314: 0 | AK314: 0 | AL314: 0 | AM314: 0 | AN314: 0 | AO314: 0 | AP314: 0 | AQ314: 0 | AR314: =1 -> 1 | AS314: 0 | AT314: 0 | AU314: =RC[-30]-RC[-29]-RC[-28]-RC[-27]-RC[-26]-RC[-25] -> 3706858.98 | AV314: 0 | AW314: =RC[1]-RC[2] -> 0 | AX314: 0 | AY314: 0 | AZ314: =RC[-46] -> 3064302 | BA314: =RC[-46] -> 0 | BB314: =RC[-46] -> 0 | BC314: =RC[-46] -> 0 | BD314: =RC[-46] -> 0 | BE314: =RC[-46] -> 0 | BF314: =RC[-46] -> 680000 | BG314: =RC[-46] -> 0 | BH314: =RC[-46] -> 0 | BI314: =RC[-46] -> 0 | BJ314: =RC[-46] -> 0 | BK314: =RC[-46] -> 3744302 | BL314: =RC[-46] -> 0 | BM314: =RC[-46] -> 0 | BN314: =RC[-46] -> 0 | BO314: =RC[-46] -> 37443.019999999997 | BP314: =RC[-46] -> 0 | BQ314: =RC[-46] -> 3706858.98 | BR314: =RC[-46] -> 0 | BS314: =RC[-46] -> 0 | BT314: =RC[-46] -> 0 | BU314: =RC[-46] -> 0 | BV314: =RC[-46] -> 0 | BW314: =RC[-46] -> 0 | BX314: =RC[-46] -> 0 | BY314: =RC[-46] -> 0 | BZ314: =RC[-46] -> 0 | CA314: =RC[-46] -> 0 | CB314: =RC[-46] -> 0 | CC314: =RC[-46] -> 3064302 | CD314: =RC[-46] -> 0 | CE314: =RC[-46] -> 0 | CF314: =RC[-46] -> 0 | CG314: =RC[-46] -> 0 | CH314: =RC[-46] -> 0 | CI314: =RC[-46] -> 0 | CJ314: =RC[-46] -> 0 | CK314: =RC[-46] -> 0 | CL314: =RC[-46] -> 1 | CM314: =RC[-46] -> 0 | CN314: =RC[-46] -> 0 | CO314: =RC[-46] -> 3706858.98 | CP314: =RC[-46] -> 0 | CQ314: =RC[-46] -> 0 | CR314: =RC[-46] -> 0 | CS314: =RC[-46] -> 0
A315: 75 | B315: 013457 | C315: Trần Thanh Tuấn | D315: Nhân viên Bốc xếp | E315: 10521547311017 | F315: =RC[29]+RC[30]+RC[31]+RC[32]+RC[33]+RC[34]+RC[35]+RC[36]+RC[37] -> 3064302 | G315: =RC[17]+RC[18]++RC[19]+RC[20]+RC[21]+RC[38]+RC[39]+RC[41] -> 0 | H315: 0 | I315: 0 | J315: =RC[-2]+RC[-1] -> 0 | K315: 0 | L315: 680000 | M315: 0 | N315: =RC[15]+RC[16]+RC[17]+RC[18]+RC[19]+RC[20] -> 0 | O315: 0 | P315: 0 | Q315: 3744302 | R315: 0 | S315: 0 | T315: 0 | U315: 37443.019999999997 | V315: 0 | W315: 3706858.98 | X315: 0 | Y315: 0 | Z315: 0 | AA315: 0 | AB315: 0 | AC315: 0 | AD315: 0 | AE315: 0 | AF315: 0 | AG315: 0 | AH315: 0 | AI315: 3064302 | AJ315: 0 | AK315: 0 | AL315: 0 | AM315: 0 | AN315: 0 | AO315: 0 | AP315: 0 | AQ315: 0 | AR315: =1 -> 1 | AS315: 0 | AT315: 0 | AU315: =RC[-30]-RC[-29]-RC[-28]-RC[-27]-RC[-26]-RC[-25] -> 3706858.98 | AV315: 0 | AW315: =RC[1]-RC[2] -> 0 | AX315: 0 | AY315: 0 | AZ315: =RC[-46] -> 3064302 | BA315: =RC[-46] -> 0 | BB315: =RC[-46] -> 0 | BC315: =RC[-46] -> 0 | BD315: =RC[-46] -> 0 | BE315: =RC[-46] -> 0 | BF315: =RC[-46] -> 680000 | BG315: =RC[-46] -> 0 | BH315: =RC[-46] -> 0 | BI315: =RC[-46] -> 0 | BJ315: =RC[-46] -> 0 | BK315: =RC[-46] -> 3744302 | BL315: =RC[-46] -> 0 | BM315: =RC[-46] -> 0 | BN315: =RC[-46] -> 0 | BO315: =RC[-46] -> 37443.019999999997 | BP315: =RC[-46] -> 0 | BQ315: =RC[-46] -> 3706858.98 | BR315: =RC[-46] -> 0 | BS315: =RC[-46] -> 0 | BT315: =RC[-46] -> 0 | BU315: =RC[-46] -> 0 | BV315: =RC[-46] -> 0 | BW315: =RC[-46] -> 0 | BX315: =RC[-46] -> 0 | BY315: =RC[-46] -> 0 | BZ315: =RC[-46] -> 0 | CA315: =RC[-46] -> 0 | CB315: =RC[-46] -> 0 | CC315: =RC[-46] -> 3064302 | CD315: =RC[-46] -> 0 | CE315: =RC[-46] -> 0 | CF315: =RC[-46] -> 0 | CG315: =RC[-46] -> 0 | CH315: =RC[-46] -> 0 | CI315: =RC[-46] -> 0 | CJ315: =RC[-46] -> 0 | CK315: =RC[-46] -> 0 | CL315: =RC[-46] -> 1 | CM315: =RC[-46] -> 0 | CN315: =RC[-46] -> 0 | CO315: =RC[-46] -> 3706858.98 | CP315: =RC[-46] -> 0 | CQ315: =RC[-46] -> 0 | CR315: =RC[-46] -> 0 | CS315: =RC[-46] -> 0
A316: 76 | B316: 013458 | C316: Nguyễn Việt Hải | D316: Nhân viên Bốc xếp | E316: 19028960261014 | F316: =RC[29]+RC[30]+RC[31]+RC[32]+RC[33]+RC[34]+RC[35]+RC[36]+RC[37] -> 3064302 | G316: =RC[17]+RC[18]++RC[19]+RC[20]+RC[21]+RC[38]+RC[39]+RC[41] -> 0 | H316: 0 | I316: 0 | J316: =RC[-2]+RC[-1] -> 0 | K316: 0 | L316: 680000 | M316: 0 | N316: =RC[15]+RC[16]+RC[17]+RC[18]+RC[19]+RC[20] -> 0 | O316: 0 | P316: 0 | Q316: 3744302 | R316: 0 | S316: 0 | T316: 0 | U316: 37443.019999999997 | V316: 0 | W316: 3706858.98 | X316: 0 | Y316: 0 | Z316: 0 | AA316: 0 | AB316: 0 | AC316: 0 | AD316: 0 | AE316: 0 | AF316: 0 | AG316: 0 | AH316: 0 | AI316: 3064302 | AJ316: 0 | AK316: 0 | AL316: 0 | AM316: 0 | AN316: 0 | AO316: 0 | AP316: 0 | AQ316: 0 | AR316: =1 -> 1 | AS316: 0 | AT316: 0 | AU316: =RC[-30]-RC[-29]-RC[-28]-RC[-27]-RC[-26]-RC[-25] -> 3706858.98 | AV316: 0 | AW316: =RC[1]-RC[2] -> 0 | AX316: 0 | AY316: 0 | AZ316: =RC[-46] -> 3064302 | BA316: =RC[-46] -> 0 | BB316: =RC[-46] -> 0 | BC316: =RC[-46] -> 0 | BD316: =RC[-46] -> 0 | BE316: =RC[-46] -> 0 | BF316: =RC[-46] -> 680000 | BG316: =RC[-46] -> 0 | BH316: =RC[-46] -> 0 | BI316: =RC[-46] -> 0 | BJ316: =RC[-46] -> 0 | BK316: =RC[-46] -> 3744302 | BL316: =RC[-46] -> 0 | BM316: =RC[-46] -> 0 | BN316: =RC[-46] -> 0 | BO316: =RC[-46] -> 37443.019999999997 | BP316: =RC[-46] -> 0 | BQ316: =RC[-46] -> 3706858.98 | BR316: =RC[-46] -> 0 | BS316: =RC[-46] -> 0 | BT316: =RC[-46] -> 0 | BU316: =RC[-46] -> 0 | BV316: =RC[-46] -> 0 | BW316: =RC[-46] -> 0 | BX316: =RC[-46] -> 0 | BY316: =RC[-46] -> 0 | BZ316: =RC[-46] -> 0 | CA316: =RC[-46] -> 0 | CB316: =RC[-46] -> 0 | CC316: =RC[-46] -> 3064302 | CD316: =RC[-46] -> 0 | CE316: =RC[-46] -> 0 | CF316: =RC[-46] -> 0 | CG316: =RC[-46] -> 0 | CH316: =RC[-46] -> 0 | CI316: =RC[-46] -> 0 | CJ316: =RC[-46] -> 0 | CK316: =RC[-46] -> 0 | CL316: =RC[-46] -> 1 | CM316: =RC[-46] -> 0 | CN316: =RC[-46] -> 0 | CO316: =RC[-46] -> 3706858.98 | CP316: =RC[-46] -> 0 | CQ316: =RC[-46] -> 0 | CR316: =RC[-46] -> 0 | CS316: =RC[-46] -> 0
A317: 77 | B317: 013461 | C317: Cao Văn Mạnh | D317: Nhân viên Bốc xếp | E317: 19028960231018 | F317: =RC[29]+RC[30]+RC[31]+RC[32]+RC[33]+RC[34]+RC[35]+RC[36]+RC[37] -> 3064302 | G317: =RC[17]+RC[18]++RC[19]+RC[20]+RC[21]+RC[38]+RC[39]+RC[41] -> 0 | H317: 0 | I317: 0 | J317: =RC[-2]+RC[-1] -> 0 | K317: 0 | L317: 680000 | M317: 0 | N317: =RC[15]+RC[16]+RC[17]+RC[18]+RC[19]+RC[20] -> 0 | O317: 0 | P317: 0 | Q317: 3744302 | R317: 0 | S317: 0 | T317: 0 | U317: 37443.019999999997 | V317: 0 | W317: 3706858.98 | X317: 0 | Y317: 0 | Z317: 0 | AA317: 0 | AB317: 0 | AC317: 0 | AD317: 0 | AE317: 0 | AF317: 0 | AG317: 0 | AH317: 0 | AI317: 3064302 | AJ317: 0 | AK317: 0 | AL317: 0 | AM317: 0 | AN317: 0 | AO317: 0 | AP317: 0 | AQ317: 0 | AR317: =1 -> 1 | AS317: 0 | AT317: 0 | AU317: =RC[-30]-RC[-29]-RC[-28]-RC[-27]-RC[-26]-RC[-25] -> 3706858.98 | AV317: 0 | AW317: =RC[1]-RC[2] -> 0 | AX317: 0 | AY317: 0 | AZ317: =RC[-46] -> 3064302 | BA317: =RC[-46] -> 0 | BB317: =RC[-46] -> 0 | BC317: =RC[-46] -> 0 | BD317: =RC[-46] -> 0 | BE317: =RC[-46] -> 0 | BF317: =RC[-46] -> 680000 | BG317: =RC[-46] -> 0 | BH317: =RC[-46] -> 0 | BI317: =RC[-46] -> 0 | BJ317: =RC[-46] -> 0 | BK317: =RC[-46] -> 3744302 | BL317: =RC[-46] -> 0 | BM317: =RC[-46] -> 0 | BN317: =RC[-46] -> 0 | BO317: =RC[-46] -> 37443.019999999997 | BP317: =RC[-46] -> 0 | BQ317: =RC[-46] -> 3706858.98 | BR317: =RC[-46] -> 0 | BS317: =RC[-46] -> 0 | BT317: =RC[-46] -> 0 | BU317: =RC[-46] -> 0 | BV317: =RC[-46] -> 0 | BW317: =RC[-46] -> 0 | BX317: =RC[-46] -> 0 | BY317: =RC[-46] -> 0 | BZ317: =RC[-46] -> 0 | CA317: =RC[-46] -> 0 | CB317: =RC[-46] -> 0 | CC317: =RC[-46] -> 3064302 | CD317: =RC[-46] -> 0 | CE317: =RC[-46] -> 0 | CF317: =RC[-46] -> 0 | CG317: =RC[-46] -> 0 | CH317: =RC[-46] -> 0 | CI317: =RC[-46] -> 0 | CJ317: =RC[-46] -> 0 | CK317: =RC[-46] -> 0 | CL317: =RC[-46] -> 1 | CM317: =RC[-46] -> 0 | CN317: =RC[-46] -> 0 | CO317: =RC[-46] -> 3706858.98 | CP317: =RC[-46] -> 0 | CQ317: =RC[-46] -> 0 | CR317: =RC[-46] -> 0 | CS317: =RC[-46] -> 0
A318: 78 | B318: 013464 | C318: Phạm Văn Dũng | D318: Nhân viên Bốc xếp | E318: 19028960254018 | F318: =RC[29]+RC[30]+RC[31]+RC[32]+RC[33]+RC[34]+RC[35]+RC[36]+RC[37] -> 3064302 | G318: =RC[17]+RC[18]++RC[19]+RC[20]+RC[21]+RC[38]+RC[39]+RC[41] -> 0 | H318: 0 | I318: 0 | J318: =RC[-2]+RC[-1] -> 0 | K318: 0 | L318: 680000 | M318: 0 | N318: =RC[15]+RC[16]+RC[17]+RC[18]+RC[19]+RC[20] -> 0 | O318: 0 | P318: 0 | Q318: 3744302 | R318: 0 | S318: 0 | T318: 0 | U318: 37443.019999999997 | V318: 0 | W318: 3706858.98 | X318: 0 | Y318: 0 | Z318: 0 | AA318: 0 | AB318: 0 | AC318: 0 | AD318: 0 | AE318: 0 | AF318: 0 | AG318: 0 | AH318: 0 | AI318: 3064302 | AJ318: 0 | AK318: 0 | AL318: 0 | AM318: 0 | AN318: 0 | AO318: 0 | AP318: 0 | AQ318: 0 | AR318: =1 -> 1 | AS318: 0 | AT318: 0 | AU318: =RC[-30]-RC[-29]-RC[-28]-RC[-27]-RC[-26]-RC[-25] -> 3706858.98 | AV318: 0 | AW318: =RC[1]-RC[2] -> 0 | AX318: 0 | AY318: 0 | AZ318: =RC[-46] -> 3064302 | BA318: =RC[-46] -> 0 | BB318: =RC[-46] -> 0 | BC318: =RC[-46] -> 0 | BD318: =RC[-46] -> 0 | BE318: =RC[-46] -> 0 | BF318: =RC[-46] -> 680000 | BG318: =RC[-46] -> 0 | BH318: =RC[-46] -> 0 | BI318: =RC[-46] -> 0 | BJ318: =RC[-46] -> 0 | BK318: =RC[-46] -> 3744302 | BL318: =RC[-46] -> 0 | BM318: =RC[-46] -> 0 | BN318: =RC[-46] -> 0 | BO318: =RC[-46] -> 37443.019999999997 | BP318: =RC[-46] -> 0 | BQ318: =RC[-46] -> 3706858.98 | BR318: =RC[-46] -> 0 | BS318: =RC[-46] -> 0 | BT318: =RC[-46] -> 0 | BU318: =RC[-46] -> 0 | BV318: =RC[-46] -> 0 | BW318: =RC[-46] -> 0 | BX318: =RC[-46] -> 0 | BY318: =RC[-46] -> 0 | BZ318: =RC[-46] -> 0 | CA318: =RC[-46] -> 0 | CB318: =RC[-46] -> 0 | CC318: =RC[-46] -> 3064302 | CD318: =RC[-46] -> 0 | CE318: =RC[-46] -> 0 | CF318: =RC[-46] -> 0 | CG318: =RC[-46] -> 0 | CH318: =RC[-46] -> 0 | CI318: =RC[-46] -> 0 | CJ318: =RC[-46] -> 0 | CK318: =RC[-46] -> 0 | CL318: =RC[-46] -> 1 | CM318: =RC[-46] -> 0 | CN318: =RC[-46] -> 0 | CO318: =RC[-46] -> 3706858.98 | CP318: =RC[-46] -> 0 | CQ318: =RC[-46] -> 0 | CR318: =RC[-46] -> 0 | CS318: =RC[-46] -> 0
A319: 79 | B319: 013465 | C319: Vũ Văn Tuyền | D319: Nhân viên Bốc xếp | E319: 19028960218011 | F319: =RC[29]+RC[30]+RC[31]+RC[32]+RC[33]+RC[34]+RC[35]+RC[36]+RC[37] -> 3064302 | G319: =RC[17]+RC[18]++RC[19]+RC[20]+RC[21]+RC[38]+RC[39]+RC[41] -> 0 | H319: 0 | I319: 0 | J319: =RC[-2]+RC[-1] -> 0 | K319: 0 | L319: 680000 | M319: 0 | N319: =RC[15]+RC[16]+RC[17]+RC[18]+RC[19]+RC[20] -> 0 | O319: 0 | P319: 0 | Q319: 3744302 | R319: 0 | S319: 0 | T319: 0 | U319: 37443.019999999997 | V319: 0 | W319: 3706858.98 | X319: 0 | Y319: 0 | Z319: 0 | AA319: 0 | AB319: 0 | AC319: 0 | AD319: 0 | AE319: 0 | AF319: 0 | AG319: 0 | AH319: 0 | AI319: 3064302 | AJ319: 0 | AK319: 0 | AL319: 0 | AM319: 0 | AN319: 0 | AO319: 0 | AP319: 0 | AQ319: 0 | AR319: =1 -> 1 | AS319: 0 | AT319: 0 | AU319: =RC[-30]-RC[-29]-RC[-28]-RC[-27]-RC[-26]-RC[-25] -> 3706858.98 | AV319: 0 | AW319: =RC[1]-RC[2] -> 0 | AX319: 0 | AY319: 0 | AZ319: =RC[-46] -> 3064302 | BA319: =RC[-46] -> 0 | BB319: =RC[-46] -> 0 | BC319: =RC[-46] -> 0 | BD319: =RC[-46] -> 0 | BE319: =RC[-46] -> 0 | BF319: =RC[-46] -> 680000 | BG319: =RC[-46] -> 0 | BH319: =RC[-46] -> 0 | BI319: =RC[-46] -> 0 | BJ319: =RC[-46] -> 0 | BK319: =RC[-46] -> 3744302 | BL319: =RC[-46] -> 0 | BM319: =RC[-46] -> 0 | BN319: =RC[-46] -> 0 | BO319: =RC[-46] -> 37443.019999999997 | BP319: =RC[-46] -> 0 | BQ319: =RC[-46] -> 3706858.98 | BR319: =RC[-46] -> 0 | BS319: =RC[-46] -> 0 | BT319: =RC[-46] -> 0 | BU319: =RC[-46] -> 0 | BV319: =RC[-46] -> 0 | BW319: =RC[-46] -> 0 | BX319: =RC[-46] -> 0 | BY319: =RC[-46] -> 0 | BZ319: =RC[-46] -> 0 | CA319: =RC[-46] -> 0 | CB319: =RC[-46] -> 0 | CC319: =RC[-46] -> 3064302 | CD319: =RC[-46] -> 0 | CE319: =RC[-46] -> 0 | CF319: =RC[-46] -> 0 | CG319: =RC[-46] -> 0 | CH319: =RC[-46] -> 0 | CI319: =RC[-46] -> 0 | CJ319: =RC[-46] -> 0 | CK319: =RC[-46] -> 0 | CL319: =RC[-46] -> 1 | CM319: =RC[-46] -> 0 | CN319: =RC[-46] -> 0 | CO319: =RC[-46] -> 3706858.98 | CP319: =RC[-46] -> 0 | CQ319: =RC[-46] -> 0 | CR319: =RC[-46] -> 0 | CS319: =RC[-46] -> 0
A320: 80 | B320: 013466 | C320: Nguyễn Viết Phi | D320: Nhân viên Bốc xếp | E320: 19028609457026 | F320: =RC[29]+RC[30]+RC[31]+RC[32]+RC[33]+RC[34]+RC[35]+RC[36]+RC[37] -> 3064302 | G320: =RC[17]+RC[18]++RC[19]+RC[20]+RC[21]+RC[38]+RC[39]+RC[41] -> 0 | H320: 0 | I320: 0 | J320: =RC[-2]+RC[-1] -> 0 | K320: 0 | L320: 680000 | M320: 0 | N320: =RC[15]+RC[16]+RC[17]+RC[18]+RC[19]+RC[20] -> 0 | O320: 0 | P320: 0 | Q320: 3744302 | R320: 0 | S320: 0 | T320: 0 | U320: 37443.019999999997 | V320: 0 | W320: 3706858.98 | X320: 0 | Y320: 0 | Z320: 0 | AA320: 0 | AB320: 0 | AC320: 0 | AD320: 0 | AE320: 0 | AF320: 0 | AG320: 0 | AH320: 0 | AI320: 3064302 | AJ320: 0 | AK320: 0 | AL320: 0 | AM320: 0 | AN320: 0 | AO320: 0 | AP320: 0 | AQ320: 0 | AR320: =1 -> 1 | AS320: 0 | AT320: 0 | AU320: =RC[-30]-RC[-29]-RC[-28]-RC[-27]-RC[-26]-RC[-25] -> 3706858.98 | AV320: 0 | AW320: =RC[1]-RC[2] -> 0 | AX320: 0 | AY320: 0 | AZ320: =RC[-46] -> 3064302 | BA320: =RC[-46] -> 0 | BB320: =RC[-46] -> 0 | BC320: =RC[-46] -> 0 | BD320: =RC[-46] -> 0 | BE320: =RC[-46] -> 0 | BF320: =RC[-46] -> 680000 | BG320: =RC[-46] -> 0 | BH320: =RC[-46] -> 0 | BI320: =RC[-46] -> 0 | BJ320: =RC[-46] -> 0 | BK320: =RC[-46] -> 3744302 | BL320: =RC[-46] -> 0 | BM320: =RC[-46] -> 0 | BN320: =RC[-46] -> 0 | BO320: =RC[-46] -> 37443.019999999997 | BP320: =RC[-46] -> 0 | BQ320: =RC[-46] -> 3706858.98 | BR320: =RC[-46] -> 0 | BS320: =RC[-46] -> 0 | BT320: =RC[-46] -> 0 | BU320: =RC[-46] -> 0 | BV320: =RC[-46] -> 0 | BW320: =RC[-46] -> 0 | BX320: =RC[-46] -> 0 | BY320: =RC[-46] -> 0 | BZ320: =RC[-46] -> 0 | CA320: =RC[-46] -> 0 | CB320: =RC[-46] -> 0 | CC320: =RC[-46] -> 3064302 | CD320: =RC[-46] -> 0 | CE320: =RC[-46] -> 0 | CF320: =RC[-46] -> 0 | CG320: =RC[-46] -> 0 | CH320: =RC[-46] -> 0 | CI320: =RC[-46] -> 0 | CJ320: =RC[-46] -> 0 | CK320: =RC[-46] -> 0 | CL320: =RC[-46] -> 1 | CM320: =RC[-46] -> 0 | CN320: =RC[-46] -> 0 | CO320: =RC[-46] -> 3706858.98 | CP320: =RC[-46] -> 0 | CQ320: =RC[-46] -> 0 | CR320: =RC[-46] -> 0 | CS320: =RC[-46] -> 0
A321: 81 | B321: 013467 | C321: Tăng Văn Hải | D321: Nhân viên Bốc xếp | E321: 19028960196018 | F321: =RC[29]+RC[30]+RC[31]+RC[32]+RC[33]+RC[34]+RC[35]+RC[36]+RC[37] -> 3064302 | G321: =RC[17]+RC[18]++RC[19]+RC[20]+RC[21]+RC[38]+RC[39]+RC[41] -> 0 | H321: 0 | I321: 0 | J321: =RC[-2]+RC[-1] -> 0 | K321: 0 | L321: 680000 | M321: 0 | N321: =RC[15]+RC[16]+RC[17]+RC[18]+RC[19]+RC[20] -> 0 | O321: 0 | P321: 0 | Q321: 3744302 | R321: 0 | S321: 0 | T321: 0 | U321: 37443.019999999997 | V321: 0 | W321: 3706858.98 | X321: 0 | Y321: 0 | Z321: 0 | AA321: 0 | AB321: 0 | AC321: 0 | AD321: 0 | AE321: 0 | AF321: 0 | AG321: 0 | AH321: 0 | AI321: 3064302 | AJ321: 0 | AK321: 0 | AL321: 0 | AM321: 0 | AN321: 0 | AO321: 0 | AP321: 0 | AQ321: 0 | AR321: =1 -> 1 | AS321: 0 | AT321: 0 | AU321: =RC[-30]-RC[-29]-RC[-28]-RC[-27]-RC[-26]-RC[-25] -> 3706858.98 | AV321: 0 | AW321: =RC[1]-RC[2] -> 0 | AX321: 0 | AY321: 0 | AZ321: =RC[-46] -> 3064302 | BA321: =RC[-46] -> 0 | BB321: =RC[-46] -> 0 | BC321: =RC[-46] -> 0 | BD321: =RC[-46] -> 0 | BE321: =RC[-46] -> 0 | BF321: =RC[-46] -> 680000 | BG321: =RC[-46] -> 0 | BH321: =RC[-46] -> 0 | BI321: =RC[-46] -> 0 | BJ321: =RC[-46] -> 0 | BK321: =RC[-46] -> 3744302 | BL321: =RC[-46] -> 0 | BM321: =RC[-46] -> 0 | BN321: =RC[-46] -> 0 | BO321: =RC[-46] -> 37443.019999999997 | BP321: =RC[-46] -> 0 | BQ321: =RC[-46] -> 3706858.98 | BR321: =RC[-46] -> 0 | BS321: =RC[-46] -> 0 | BT321: =RC[-46] -> 0 | BU321: =RC[-46] -> 0 | BV321: =RC[-46] -> 0 | BW321: =RC[-46] -> 0 | BX321: =RC[-46] -> 0 | BY321: =RC[-46] -> 0 | BZ321: =RC[-46] -> 0 | CA321: =RC[-46] -> 0 | CB321: =RC[-46] -> 0 | CC321: =RC[-46] -> 3064302 | CD321: =RC[-46] -> 0 | CE321: =RC[-46] -> 0 | CF321: =RC[-46] -> 0 | CG321: =RC[-46] -> 0 | CH321: =RC[-46] -> 0 | CI321: =RC[-46] -> 0 | CJ321: =RC[-46] -> 0 | CK321: =RC[-46] -> 0 | CL321: =RC[-46] -> 1 | CM321: =RC[-46] -> 0 | CN321: =RC[-46] -> 0 | CO321: =RC[-46] -> 3706858.98 | CP321: =RC[-46] -> 0 | CQ321: =RC[-46] -> 0 | CR321: =RC[-46] -> 0 | CS321: =RC[-46] -> 0
A322: 82 | B322: 013468 | C322: Lê Trọng Tài | D322: Nhân viên Bốc xếp | E322: 19028960213011 | F322: =RC[29]+RC[30]+RC[31]+RC[32]+RC[33]+RC[34]+RC[35]+RC[36]+RC[37] -> 3064302 | G322: =RC[17]+RC[18]++RC[19]+RC[20]+RC[21]+RC[38]+RC[39]+RC[41] -> 0 | H322: 0 | I322: 0 | J322: =RC[-2]+RC[-1] -> 0 | K322: 0 | L322: 680000 | M322: 0 | N322: =RC[15]+RC[16]+RC[17]+RC[18]+RC[19]+RC[20] -> 0 | O322: 0 | P322: 0 | Q322: 3744302 | R322: 0 | S322: 0 | T322: 0 | U322: 37443.019999999997 | V322: 0 | W322: 3706858.98 | X322: 0 | Y322: 0 | Z322: 0 | AA322: 0 | AB322: 0 | AC322: 0 | AD322: 0 | AE322: 0 | AF322: 0 | AG322: 0 | AH322: 0 | AI322: 3064302 | AJ322: 0 | AK322: 0 | AL322: 0 | AM322: 0 | AN322: 0 | AO322: 0 | AP322: 0 | AQ322: 0 | AR322: =1 -> 1 | AS322: 0 | AT322: 0 | AU322: =RC[-30]-RC[-29]-RC[-28]-RC[-27]-RC[-26]-RC[-25] -> 3706858.98 | AV322: 0 | AW322: =RC[1]-RC[2] -> 0 | AX322: 0 | AY322: 0 | AZ322: =RC[-46] -> 3064302 | BA322: =RC[-46] -> 0 | BB322: =RC[-46] -> 0 | BC322: =RC[-46] -> 0 | BD322: =RC[-46] -> 0 | BE322: =RC[-46] -> 0 | BF322: =RC[-46] -> 680000 | BG322: =RC[-46] -> 0 | BH322: =RC[-46] -> 0 | BI322: =RC[-46] -> 0 | BJ322: =RC[-46] -> 0 | BK322: =RC[-46] -> 3744302 | BL322: =RC[-46] -> 0 | BM322: =RC[-46] -> 0 | BN322: =RC[-46] -> 0 | BO322: =RC[-46] -> 37443.019999999997 | BP322: =RC[-46] -> 0 | BQ322: =RC[-46] -> 3706858.98 | BR322: =RC[-46] -> 0 | BS322: =RC[-46] -> 0 | BT322: =RC[-46] -> 0 | BU322: =RC[-46] -> 0 | BV322: =RC[-46] -> 0 | BW322: =RC[-46] -> 0 | BX322: =RC[-46] -> 0 | BY322: =RC[-46] -> 0 | BZ322: =RC[-46] -> 0 | CA322: =RC[-46] -> 0 | CB322: =RC[-46] -> 0 | CC322: =RC[-46] -> 3064302 | CD322: =RC[-46] -> 0 | CE322: =RC[-46] -> 0 | CF322: =RC[-46] -> 0 | CG322: =RC[-46] -> 0 | CH322: =RC[-46] -> 0 | CI322: =RC[-46] -> 0 | CJ322: =RC[-46] -> 0 | CK322: =RC[-46] -> 0 | CL322: =RC[-46] -> 1 | CM322: =RC[-46] -> 0 | CN322: =RC[-46] -> 0 | CO322: =RC[-46] -> 3706858.98 | CP322: =RC[-46] -> 0 | CQ322: =RC[-46] -> 0 | CR322: =RC[-46] -> 0 | CS322: =RC[-46] -> 0
A323: 83 | B323: 010681 | C323: Trần Văn Minh | D323: NV Lái xe - VHTTB | E323: 10522162833019 | F323: =RC[29]+RC[30]+RC[31]+RC[32]+RC[33]+RC[34]+RC[35]+RC[36]+RC[37] -> 5895134 | G323: =RC[17]+RC[18]++RC[19]+RC[20]+RC[21]+RC[38]+RC[39]+RC[41] -> 0 | H323: 0 | I323: 0 | J323: =RC[-2]+RC[-1] -> 0 | K323: 0 | L323: 680000 | M323: 489038 | N323: =RC[15]+RC[16]+RC[17]+RC[18]+RC[19]+RC[20] -> 490673 | O323: 0 | P323: 0 | Q323: 7554845 | R323: 372600 | S323: 69863 | T323: 46575 | U323: 70658.070000000007 | V323: 0 | W323: 6995148.9299999997 | X323: 0 | Y323: 0 | Z323: 0 | AA323: 0 | AB323: 0 | AC323: 0 | AD323: 0 | AE323: 0 | AF323: 0 | AG323: 0 | AH323: 490673 | AI323: 5895134 | AJ323: 0 | AK323: 0 | AL323: 0 | AM323: 0 | AN323: 0 | AO323: 0 | AP323: 0 | AQ323: 0 | AR323: =1 -> 1 | AS323: 0 | AT323: 0 | AU323: =RC[-30]-RC[-29]-RC[-28]-RC[-27]-RC[-26]-RC[-25] -> 6995148.9299999997 | AV323: 0 | AW323: =RC[1]-RC[2] -> 163557.66700000002 | AX323: 490673 | AY323: 327115.33299999998 | AZ323: =RC[-46] -> 5895134 | BA323: =RC[-46] -> 0 | BB323: =RC[-46] -> 0 | BC323: =RC[-46] -> 0 | BD323: =RC[-46] -> 0 | BE323: =RC[-46] -> 0 | BF323: =RC[-46] -> 680000 | BG323: =RC[-46] -> 489038 | BH323: =RC[-46] -> 490673 | BI323: =RC[-46] -> 0 | BJ323: =RC[-46] -> 0 | BK323: =RC[-46] -> 7554845 | BL323: =RC[-46] -> 372600 | BM323: =RC[-46] -> 69863 | BN323: =RC[-46] -> 46575 | BO323: =RC[-46] -> 70658.070000000007 | BP323: =RC[-46] -> 0 | BQ323: =RC[-46] -> 6995148.9299999997 | BR323: =RC[-46] -> 0 | BS323: =RC[-46] -> 0 | BT323: =RC[-46] -> 0 | BU323: =RC[-46] -> 0 | BV323: =RC[-46] -> 0 | BW323: =RC[-46] -> 0 | BX323: =RC[-46] -> 0 | BY323: =RC[-46] -> 0 | BZ323: =RC[-46] -> 0 | CA323: =RC[-46] -> 0 | CB323: =RC[-46] -> 490673 | CC323: =RC[-46] -> 5895134 | CD323: =RC[-46] -> 0 | CE323: =RC[-46] -> 0 | CF323: =RC[-46] -> 0 | CG323: =RC[-46] -> 0 | CH323: =RC[-46] -> 0 | CI323: =RC[-46] -> 0 | CJ323: =RC[-46] -> 0 | CK323: =RC[-46] -> 0 | CL323: =RC[-46] -> 1 | CM323: =RC[-46] -> 0 | CN323: =RC[-46] -> 0 | CO323: =RC[-46] -> 6995148.9299999997 | CP323: =RC[-46] -> 0 | CQ323: =RC[-46] -> 163557.66700000002 | CR323: =RC[-46] -> 490673 | CS323: =RC[-46] -> 327115.33299999998
A324: 84 | B324: 010682 | C324: Nguyễn Gia Chiến | D324: NV Lái xe - VHTTB | E324: 10522201381015 | F324: =RC[29]+RC[30]+RC[31]+RC[32]+RC[33]+RC[34]+RC[35]+RC[36]+RC[37] -> 6186972 | G324: =RC[17]+RC[18]++RC[19]+RC[20]+RC[21]+RC[38]+RC[39]+RC[41] -> 0 | H324: 0 | I324: 0 | J324: =RC[-2]+RC[-1] -> 0 | K324: 0 | L324: 680000 | M324: 489038 | N324: =RC[15]+RC[16]+RC[17]+RC[18]+RC[19]+RC[20] -> 0 | O324: 0 | P324: 0 | Q324: 7356010 | R324: 372600 | S324: 69863 | T324: 46575 | U324: 68669.72 | V324: 0 | W324: 6798302.2800000003 | X324: 0 | Y324: 0 | Z324: 0 | AA324: 0 | AB324: 0 | AC324: 0 | AD324: 0 | AE324: 0 | AF324: 0 | AG324: 0 | AH324: 0 | AI324: 6186972 | AJ324: 0 | AK324: 0 | AL324: 0 | AM324: 0 | AN324: 0 | AO324: 0 | AP324: 0 | AQ324: 0 | AR324: =1 -> 1 | AS324: 0 | AT324: 0 | AU324: =RC[-30]-RC[-29]-RC[-28]-RC[-27]-RC[-26]-RC[-25] -> 6798302.2800000003 | AV324: 0 | AW324: =RC[1]-RC[2] -> 0 | AX324: 0 | AY324: 0 | AZ324: =RC[-46] -> 6186972 | BA324: =RC[-46] -> 0 | BB324: =RC[-46] -> 0 | BC324: =RC[-46] -> 0 | BD324: =RC[-46] -> 0 | BE324: =RC[-46] -> 0 | BF324: =RC[-46] -> 680000 | BG324: =RC[-46] -> 489038 | BH324: =RC[-46] -> 0 | BI324: =RC[-46] -> 0 | BJ324: =RC[-46] -> 0 | BK324: =RC[-46] -> 7356010 | BL324: =RC[-46] -> 372600 | BM324: =RC[-46] -> 69863 | BN324: =RC[-46] -> 46575 | BO324: =RC[-46] -> 68669.72 | BP324: =RC[-46] -> 0 | BQ324: =RC[-46] -> 6798302.2800000003 | BR324: =RC[-46] -> 0 | BS324: =RC[-46] -> 0 | BT324: =RC[-46] -> 0 | BU324: =RC[-46] -> 0 | BV324: =RC[-46] -> 0 | BW324: =RC[-46] -> 0 | BX324: =RC[-46] -> 0 | BY324: =RC[-46] -> 0 | BZ324: =RC[-46] -> 0 | CA324: =RC[-46] -> 0 | CB324: =RC[-46] -> 0 | CC324: =RC[-46] -> 6186972 | CD324: =RC[-46] -> 0 | CE324: =RC[-46] -> 0 | CF324: =RC[-46] -> 0 | CG324: =RC[-46] -> 0 | CH324: =RC[-46] -> 0 | CI324: =RC[-46] -> 0 | CJ324: =RC[-46] -> 0 | CK324: =RC[-46] -> 0 | CL324: =RC[-46] -> 1 | CM324: =RC[-46] -> 0 | CN324: =RC[-46] -> 0 | CO324: =RC[-46] -> 6798302.2800000003 | CP324: =RC[-46] -> 0 | CQ324: =RC[-46] -> 0 | CR324: =RC[-46] -> 0 | CS324: =RC[-46] -> 0
A325: 85 | B325: 010683 | C325: Nguyễn Trung Sơn | D325: NV Lái xe - VHTTB | E325: 10522162724015 | F325: =RC[29]+RC[30]+RC[31]+RC[32]+RC[33]+RC[34]+RC[35]+RC[36]+RC[37] -> 5895134 | G325: =RC[17]+RC[18]++RC[19]+RC[20]+RC[21]+RC[38]+RC[39]+RC[41] -> 0 | H325: 0 | I325: 0 | J325: =RC[-2]+RC[-1] -> 0 | K325: 0 | L325: 680000 | M325: 355005 | N325: =RC[15]+RC[16]+RC[17]+RC[18]+RC[19]+RC[20] -> 356192 | O325: 0 | P325: 0 | Q325: 7286331 | R325: 270480 | S325: 50715 | T325: 33810 | U325: 69313.259999999995 | V325: 0 | W325: 6862012.7400000002 | X325: 0 | Y325: 0 | Z325: 0 | AA325: 0 | AB325: 0 | AC325: 0 | AD325: 0 | AE325: 0 | AF325: 0 | AG325: 0 | AH325: 356192 | AI325: 5895134 | AJ325: 0 | AK325: 0 | AL325: 0 | AM325: 0 | AN325: 0 | AO325: 0 | AP325: 0 | AQ325: 0 | AR325: =1 -> 1 | AS325: 0 | AT325: 0 | AU325: =RC[-30]-RC[-29]-RC[-28]-RC[-27]-RC[-26]-RC[-25] -> 6862012.7400000002 | AV325: 0 | AW325: =RC[1]-RC[2] -> 118730.66699999999 | AX325: 356192 | AY325: 237461.33300000001 | AZ325: =RC[-46] -> 5895134 | BA325: =RC[-46] -> 0 | BB325: =RC[-46] -> 0 | BC325: =RC[-46] -> 0 | BD325: =RC[-46] -> 0 | BE325: =RC[-46] -> 0 | BF325: =RC[-46] -> 680000 | BG325: =RC[-46] -> 355005 | BH325: =RC[-46] -> 356192 | BI325: =RC[-46] -> 0 | BJ325: =RC[-46] -> 0 | BK325: =RC[-46] -> 7286331 | BL325: =RC[-46] -> 270480 | BM325: =RC[-46] -> 50715 | BN325: =RC[-46] -> 33810 | BO325: =RC[-46] -> 69313.259999999995 | BP325: =RC[-46] -> 0 | BQ325: =RC[-46] -> 6862012.7400000002 | BR325: =RC[-46] -> 0 | BS325: =RC[-46] -> 0 | BT325: =RC[-46] -> 0 | BU325: =RC[-46] -> 0 | BV325: =RC[-46] -> 0 | BW325: =RC[-46] -> 0 | BX325: =RC[-46] -> 0 | BY325: =RC[-46] -> 0 | BZ325: =RC[-46] -> 0 | CA325: =RC[-46] -> 0 | CB325: =RC[-46] -> 356192 | CC325: =RC[-46] -> 5895134 | CD325: =RC[-46] -> 0 | CE325: =RC[-46] -> 0 | CF325: =RC[-46] -> 0 | CG325: =RC[-46] -> 0 | CH325: =RC[-46] -> 0 | CI325: =RC[-46] -> 0 | CJ325: =RC[-46] -> 0 | CK325: =RC[-46] -> 0 | CL325: =RC[-46] -> 1 | CM325: =RC[-46] -> 0 | CN325: =RC[-46] -> 0 | CO325: =RC[-46] -> 6862012.7400000002 | CP325: =RC[-46] -> 0 | CQ325: =RC[-46] -> 118730.66699999999 | CR325: =RC[-46] -> 356192 | CS325: =RC[-46] -> 237461.33300000001
A326: 86 | B326: 010684 | C326: Lê Quang Hợp | D326: NV Lái xe - VHTTB | E326: 10520053143018 | F326: =RC[29]+RC[30]+RC[31]+RC[32]+RC[33]+RC[34]+RC[35]+RC[36]+RC[37] -> 5895134 | G326: =RC[17]+RC[18]++RC[19]+RC[20]+RC[21]+RC[38]+RC[39]+RC[41] -> 0 | H326: 0 | I326: 0 | J326: =RC[-2]+RC[-1] -> 0 | K326: 0 | L326: 680000 | M326: 415380 | N326: =RC[15]+RC[16]+RC[17]+RC[18]+RC[19]+RC[20] -> 416769 | O326: 0 | P326: 0 | Q326: 7407283 | R326: 316480 | S326: 59340 | T326: 39560 | U326: 69919.03 | V326: 0 | W326: 6921983.9699999997 | X326: 0 | Y326: 0 | Z326: 0 | AA326: 0 | AB326: 0 | AC326: 0 | AD326: 0 | AE326: 0 | AF326: 0 | AG326: 0 | AH326: 416769 | AI326: 5895134 | AJ326: 0 | AK326: 0 | AL326: 0 | AM326: 0 | AN326: 0 | AO326: 0 | AP326: 0 | AQ326: 0 | AR326: =1 -> 1 | AS326: 0 | AT326: 0 | AU326: =RC[-30]-RC[-29]-RC[-28]-RC[-27]-RC[-26]-RC[-25] -> 6921983.9699999997 | AV326: 0 | AW326: =RC[1]-RC[2] -> 138923 | AX326: 416769 | AY326: 277846 | AZ326: =RC[-46] -> 5895134 | BA326: =RC[-46] -> 0 | BB326: =RC[-46] -> 0 | BC326: =RC[-46] -> 0 | BD326: =RC[-46] -> 0 | BE326: =RC[-46] -> 0 | BF326: =RC[-46] -> 680000 | BG326: =RC[-46] -> 415380 | BH326: =RC[-46] -> 416769 | BI326: =RC[-46] -> 0 | BJ326: =RC[-46] -> 0 | BK326: =RC[-46] -> 7407283 | BL326: =RC[-46] -> 316480 | BM326: =RC[-46] -> 59340 | BN326: =RC[-46] -> 39560 | BO326: =RC[-46] -> 69919.03 | BP326: =RC[-46] -> 0 | BQ326: =RC[-46] -> 6921983.9699999997 | BR326: =RC[-46] -> 0 | BS326: =RC[-46] -> 0 | BT326: =RC[-46] -> 0 | BU326: =RC[-46] -> 0 | BV326: =RC[-46] -> 0 | BW326: =RC[-46] -> 0 | BX326: =RC[-46] -> 0 | BY326: =RC[-46] -> 0 | BZ326: =RC[-46] -> 0 | CA326: =RC[-46] -> 0 | CB326: =RC[-46] -> 416769 | CC326: =RC[-46] -> 5895134 | CD326: =RC[-46] -> 0 | CE326: =RC[-46] -> 0 | CF326: =RC[-46] -> 0 | CG326: =RC[-46] -> 0 | CH326: =RC[-46] -> 0 | CI326: =RC[-46] -> 0 | CJ326: =RC[-46] -> 0 | CK326: =RC[-46] -> 0 | CL326: =RC[-46] -> 1 | CM326: =RC[-46] -> 0 | CN326: =RC[-46] -> 0 | CO326: =RC[-46] -> 6921983.9699999997 | CP326: =RC[-46] -> 0 | CQ326: =RC[-46] -> 138923 | CR326: =RC[-46] -> 416769 | CS326: =RC[-46] -> 277846
A327: 87 | B327: 010705 | C327: Nguyễn Hữu Nam | D327: NV Lái xe - VHTTB | E327: 10522162653010 | F327: =RC[29]+RC[30]+RC[31]+RC[32]+RC[33]+RC[34]+RC[35]+RC[36]+RC[37] -> 5895134 | G327: =RC[17]+RC[18]++RC[19]+RC[20]+RC[21]+RC[38]+RC[39]+RC[41] -> 0 | H327: 0 | I327: 0 | J327: =RC[-2]+RC[-1] -> 0 | K327: 0 | L327: 680000 | M327: 342930 | N327: =RC[15]+RC[16]+RC[17]+RC[18]+RC[19]+RC[20] -> 344077 | O327: 0 | P327: 0 | Q327: 7262141 | R327: 261280 | S327: 48990 | T327: 32660 | U327: 69192.11 | V327: 0 | W327: 6850018.8899999997 | X327: 0 | Y327: 0 | Z327: 0 | AA327: 0 | AB327: 0 | AC327: 0 | AD327: 0 | AE327: 0 | AF327: 0 | AG327: 0 | AH327: 344077 | AI327: 5895134 | AJ327: 0 | AK327: 0 | AL327: 0 | AM327: 0 | AN327: 0 | AO327: 0 | AP327: 0 | AQ327: 0 | AR327: =1 -> 1 | AS327: 0 | AT327: 0 | AU327: =RC[-30]-RC[-29]-RC[-28]-RC[-27]-RC[-26]-RC[-25] -> 6850018.8899999997 | AV327: 0 | AW327: =RC[1]-RC[2] -> 114692.33300000001 | AX327: 344077 | AY327: 229384.66699999999 | AZ327: =RC[-46] -> 5895134 | BA327: =RC[-46] -> 0 | BB327: =RC[-46] -> 0 | BC327: =RC[-46] -> 0 | BD327: =RC[-46] -> 0 | BE327: =RC[-46] -> 0 | BF327: =RC[-46] -> 680000 | BG327: =RC[-46] -> 342930 | BH327: =RC[-46] -> 344077 | BI327: =RC[-46] -> 0 | BJ327: =RC[-46] -> 0 | BK327: =RC[-46] -> 7262141 | BL327: =RC[-46] -> 261280 | BM327: =RC[-46] -> 48990 | BN327: =RC[-46] -> 32660 | BO327: =RC[-46] -> 69192.11 | BP327: =RC[-46] -> 0 | BQ327: =RC[-46] -> 6850018.8899999997 | BR327: =RC[-46] -> 0 | BS327: =RC[-46] -> 0 | BT327: =RC[-46] -> 0 | BU327: =RC[-46] -> 0 | BV327: =RC[-46] -> 0 | BW327: =RC[-46] -> 0 | BX327: =RC[-46] -> 0 | BY327: =RC[-46] -> 0 | BZ327: =RC[-46] -> 0 | CA327: =RC[-46] -> 0 | CB327: =RC[-46] -> 344077 | CC327: =RC[-46] -> 5895134 | CD327: =RC[-46] -> 0 | CE327: =RC[-46] -> 0 | CF327: =RC[-46] -> 0 | CG327: =RC[-46] -> 0 | CH327: =RC[-46] -> 0 | CI327: =RC[-46] -> 0 | CJ327: =RC[-46] -> 0 | CK327: =RC[-46] -> 0 | CL327: =RC[-46] -> 1 | CM327: =RC[-46] -> 0 | CN327: =RC[-46] -> 0 | CO327: =RC[-46] -> 6850018.8899999997 | CP327: =RC[-46] -> 0 | CQ327: =RC[-46] -> 114692.33300000001 | CR327: =RC[-46] -> 344077 | CS327: =RC[-46] -> 229384.66699999999
A328: 88 | B328: 010706 | C328: Đặng Đình Phương | D328: NV Lái xe - VHTTB | E328: 10522162710014 | F328: =RC[29]+RC[30]+RC[31]+RC[32]+RC[33]+RC[34]+RC[35]+RC[36]+RC[37] -> 6864037 | G328: =RC[17]+RC[18]++RC[19]+RC[20]+RC[21]+RC[38]+RC[39]+RC[41] -> 0 | H328: 0 | I328: 0 | J328: =RC[-2]+RC[-1] -> 0 | K328: 105000 | L328: 680000 | M328: 342930 | N328: =RC[15]+RC[16]+RC[17]+RC[18]+RC[19]+RC[20] -> 344077 | O328: 0 | P328: 0 | Q328: 8336044 | R328: 261280 | S328: 48990 | T328: 32660 | U328: 79931.14 | V328: 0 | W328: 7913182.8600000003 | X328: 0 | Y328: 0 | Z328: 0 | AA328: 0 | AB328: 0 | AC328: 0 | AD328: 0 | AE328: 0 | AF328: 0 | AG328: 0 | AH328: 344077 | AI328: 6864037 | AJ328: 0 | AK328: 0 | AL328: 0 | AM328: 0 | AN328: 0 | AO328: 0 | AP328: 0 | AQ328: 0 | AR328: =1 -> 1 | AS328: 0 | AT328: 0 | AU328: =RC[-30]-RC[-29]-RC[-28]-RC[-27]-RC[-26]-RC[-25] -> 7913182.8600000003 | AV328: 0 | AW328: =RC[1]-RC[2] -> 114692.33300000001 | AX328: 344077 | AY328: 229384.66699999999 | AZ328: =RC[-46] -> 6864037 | BA328: =RC[-46] -> 0 | BB328: =RC[-46] -> 0 | BC328: =RC[-46] -> 0 | BD328: =RC[-46] -> 0 | BE328: =RC[-46] -> 105000 | BF328: =RC[-46] -> 680000 | BG328: =RC[-46] -> 342930 | BH328: =RC[-46] -> 344077 | BI328: =RC[-46] -> 0 | BJ328: =RC[-46] -> 0 | BK328: =RC[-46] -> 8336044 | BL328: =RC[-46] -> 261280 | BM328: =RC[-46] -> 48990 | BN328: =RC[-46] -> 32660 | BO328: =RC[-46] -> 79931.14 | BP328: =RC[-46] -> 0 | BQ328: =RC[-46] -> 7913182.8600000003 | BR328: =RC[-46] -> 0 | BS328: =RC[-46] -> 0 | BT328: =RC[-46] -> 0 | BU328: =RC[-46] -> 0 | BV328: =RC[-46] -> 0 | BW328: =RC[-46] -> 0 | BX328: =RC[-46] -> 0 | BY328: =RC[-46] -> 0 | BZ328: =RC[-46] -> 0 | CA328: =RC[-46] -> 0 | CB328: =RC[-46] -> 344077 | CC328: =RC[-46] -> 6864037 | CD328: =RC[-46] -> 0 | CE328: =RC[-46] -> 0 | CF328: =RC[-46] -> 0 | CG328: =RC[-46] -> 0 | CH328: =RC[-46] -> 0 | CI328: =RC[-46] -> 0 | CJ328: =RC[-46] -> 0 | CK328: =RC[-46] -> 0 | CL328: =RC[-46] -> 1 | CM328: =RC[-46] -> 0 | CN328: =RC[-46] -> 0 | CO328: =RC[-46] -> 7913182.8600000003 | CP328: =RC[-46] -> 0 | CQ328: =RC[-46] -> 114692.33300000001 | CR328: =RC[-46] -> 344077 | CS328: =RC[-46] -> 229384.66699999999
A329: 89 | B329: 010707 | C329: Phù Trung Ninh | D329: NV Lái xe - VHTTB | E329: 10522162705010 | F329: =RC[29]+RC[30]+RC[31]+RC[32]+RC[33]+RC[34]+RC[35]+RC[36]+RC[37] -> 6537178 | G329: =RC[17]+RC[18]++RC[19]+RC[20]+RC[21]+RC[38]+RC[39]+RC[41] -> 0 | H329: 0 | I329: 0 | J329: =RC[-2]+RC[-1] -> 0 | K329: 105000 | L329: 680000 | M329: 342930 | N329: =RC[15]+RC[16]+RC[17]+RC[18]+RC[19]+RC[20] -> 344077 | O329: 0 | P329: 0 | Q329: 8009185 | R329: 261280 | S329: 48990 | T329: 32660 | U329: 76662.55 | V329: 0 | W329: 7589592.4500000002 | X329: 0 | Y329: 0 | Z329: 0 | AA329: 0 | AB329: 0 | AC329: 0 | AD329: 0 | AE329: 0 | AF329: 0 | AG329: 0 | AH329: 344077 | AI329: 6537178 | AJ329: 0 | AK329: 0 | AL329: 0 | AM329: 0 | AN329: 0 | AO329: 0 | AP329: 0 | AQ329: 0 | AR329: =1 -> 1 | AS329: 0 | AT329: 0 | AU329: =RC[-30]-RC[-29]-RC[-28]-RC[-27]-RC[-26]-RC[-25] -> 7589592.4500000002 | AV329: 0 | AW329: =RC[1]-RC[2] -> 114692.33300000001 | AX329: 344077 | AY329: 229384.66699999999 | AZ329: =RC[-46] -> 6537178 | BA329: =RC[-46] -> 0 | BB329: =RC[-46] -> 0 | BC329: =RC[-46] -> 0 | BD329: =RC[-46] -> 0 | BE329: =RC[-46] -> 105000 | BF329: =RC[-46] -> 680000 | BG329: =RC[-46] -> 342930 | BH329: =RC[-46] -> 344077 | BI329: =RC[-46] -> 0 | BJ329: =RC[-46] -> 0 | BK329: =RC[-46] -> 8009185 | BL329: =RC[-46] -> 261280 | BM329: =RC[-46] -> 48990 | BN329: =RC[-46] -> 32660 | BO329: =RC[-46] -> 76662.55 | BP329: =RC[-46] -> 0 | BQ329: =RC[-46] -> 7589592.4500000002 | BR329: =RC[-46] -> 0 | BS329: =RC[-46] -> 0 | BT329: =RC[-46] -> 0 | BU329: =RC[-46] -> 0 | BV329: =RC[-46] -> 0 | BW329: =RC[-46] -> 0 | BX329: =RC[-46] -> 0 | BY329: =RC[-46] -> 0 | BZ329: =RC[-46] -> 0 | CA329: =RC[-46] -> 0 | CB329: =RC[-46] -> 344077 | CC329: =RC[-46] -> 6537178 | CD329: =RC[-46] -> 0 | CE329: =RC[-46] -> 0 | CF329: =RC[-46] -> 0 | CG329: =RC[-46] -> 0 | CH329: =RC[-46] -> 0 | CI329: =RC[-46] -> 0 | CJ329: =RC[-46] -> 0 | CK329: =RC[-46] -> 0 | CL329: =RC[-46] -> 1 | CM329: =RC[-46] -> 0 | CN329: =RC[-46] -> 0 | CO329: =RC[-46] -> 7589592.4500000002 | CP329: =RC[-46] -> 0 | CQ329: =RC[-46] -> 114692.33300000001 | CR329: =RC[-46] -> 344077 | CS329: =RC[-46] -> 229384.66699999999
A330: 90 | B330: 010708 | C330: Phạm Đình Thuần | D330: NV Lái xe - VHTTB | E330: 10520003333010 | F330: =RC[29]+RC[30]+RC[31]+RC[32]+RC[33]+RC[34]+RC[35]+RC[36]+RC[37] -> 6245340 | G330: =RC[17]+RC[18]++RC[19]+RC[20]+RC[21]+RC[38]+RC[39]+RC[41] -> 0 | H330: 0 | I330: 0 | J330: =RC[-2]+RC[-1] -> 0 | K330: 0 | L330: 680000 | M330: 452813 | N330: =RC[15]+RC[16]+RC[17]+RC[18]+RC[19]+RC[20] -> 454327 | O330: 0 | P330: 0 | Q330: 7832480 | R330: 345000 | S330: 64688 | T330: 43125 | U330: 73796.67 | V330: 0 | W330: 7305870.3300000001 | X330: 0 | Y330: 0 | Z330: 0 | AA330: 0 | AB330: 0 | AC330: 0 | AD330: 0 | AE330: 0 | AF330: 0 | AG330: 0 | AH330: 454327 | AI330: 6245340 | AJ330: 0 | AK330: 0 | AL330: 0 | AM330: 0 | AN330: 0 | AO330: 0 | AP330: 0 | AQ330: 0 | AR330: =1 -> 1 | AS330: 0 | AT330: 0 | AU330: =RC[-30]-RC[-29]-RC[-28]-RC[-27]-RC[-26]-RC[-25] -> 7305870.3300000001 | AV330: 0 | AW330: =RC[1]-RC[2] -> 151442.33299999998 | AX330: 454327 | AY330: 302884.66700000002 | AZ330: =RC[-46] -> 6245340 | BA330: =RC[-46] -> 0 | BB330: =RC[-46] -> 0 | BC330: =RC[-46] -> 0 | BD330: =RC[-46] -> 0 | BE330: =RC[-46] -> 0 | BF330: =RC[-46] -> 680000 | BG330: =RC[-46] -> 452813 | BH330: =RC[-46] -> 454327 | BI330: =RC[-46] -> 0 | BJ330: =RC[-46] -> 0 | BK330: =RC[-46] -> 7832480 | BL330: =RC[-46] -> 345000 | BM330: =RC[-46] -> 64688 | BN330: =RC[-46] -> 43125 | BO330: =RC[-46] -> 73796.67 | BP330: =RC[-46] -> 0 | BQ330: =RC[-46] -> 7305870.3300000001 | BR330: =RC[-46] -> 0 | BS330: =RC[-46] -> 0 | BT330: =RC[-46] -> 0 | BU330: =RC[-46] -> 0 | BV330: =RC[-46] -> 0 | BW330: =RC[-46] -> 0 | BX330: =RC[-46] -> 0 | BY330: =RC[-46] -> 0 | BZ330: =RC[-46] -> 0 | CA330: =RC[-46] -> 0 | CB330: =RC[-46] -> 454327 | CC330: =RC[-46] -> 6245340 | CD330: =RC[-46] -> 0 | CE330: =RC[-46] -> 0 | CF330: =RC[-46] -> 0 | CG330: =RC[-46] -> 0 | CH330: =RC[-46] -> 0 | CI330: =RC[-46] -> 0 | CJ330: =RC[-46] -> 0 | CK330: =RC[-46] -> 0 | CL330: =RC[-46] -> 1 | CM330: =RC[-46] -> 0 | CN330: =RC[-46] -> 0 | CO330: =RC[-46] -> 7305870.3300000001 | CP330: =RC[-46] -> 0 | CQ330: =RC[-46] -> 151442.33299999998 | CR330: =RC[-46] -> 454327 | CS330: =RC[-46] -> 302884.66700000002
A331: 91 | B331: 010710 | C331: Nguyễn Anh Dũng | D331: NV Lái xe - VHTTB | E331: 10522162701015 | F331: =RC[29]+RC[30]+RC[31]+RC[32]+RC[33]+RC[34]+RC[35]+RC[36]+RC[37] -> 6829017 | G331: =RC[17]+RC[18]++RC[19]+RC[20]+RC[21]+RC[38]+RC[39]+RC[41] -> 0 | H331: 0 | I331: 0 | J331: =RC[-2]+RC[-1] -> 0 | K331: 210000 | L331: 680000 | M331: 342930 | N331: =RC[15]+RC[16]+RC[17]+RC[18]+RC[19]+RC[20] -> 344077 | O331: 0 | P331: 0 | Q331: 8406024 | R331: 261280 | S331: 48990 | T331: 32660 | U331: 80630.94 | V331: 0 | W331: 7982463.0599999996 | X331: 0 | Y331: 0 | Z331: 0 | AA331: 0 | AB331: 0 | AC331: 0 | AD331: 0 | AE331: 0 | AF331: 0 | AG331: 0 | AH331: 344077 | AI331: 6829017 | AJ331: 0 | AK331: 0 | AL331: 0 | AM331: 0 | AN331: 0 | AO331: 0 | AP331: 0 | AQ331: 0 | AR331: =1 -> 1 | AS331: 0 | AT331: 0 | AU331: =RC[-30]-RC[-29]-RC[-28]-RC[-27]-RC[-26]-RC[-25] -> 7982463.0599999996 | AV331: 0 | AW331: =RC[1]-RC[2] -> 114692.33300000001 | AX331: 344077 | AY331: 229384.66699999999 | AZ331: =RC[-46] -> 6829017 | BA331: =RC[-46] -> 0 | BB331: =RC[-46] -> 0 | BC331: =RC[-46] -> 0 | BD331: =RC[-46] -> 0 | BE331: =RC[-46] -> 210000 | BF331: =RC[-46] -> 680000 | BG331: =RC[-46] -> 342930 | BH331: =RC[-46] -> 344077 | BI331: =RC[-46] -> 0 | BJ331: =RC[-46] -> 0 | BK331: =RC[-46] -> 8406024 | BL331: =RC[-46] -> 261280 | BM331: =RC[-46] -> 48990 | BN331: =RC[-46] -> 32660 | BO331: =RC[-46] -> 80630.94 | BP331: =RC[-46] -> 0 | BQ331: =RC[-46] -> 7982463.0599999996 | BR331: =RC[-46] -> 0 | BS331: =RC[-46] -> 0 | BT331: =RC[-46] -> 0 | BU331: =RC[-46] -> 0 | BV331: =RC[-46] -> 0 | BW331: =RC[-46] -> 0 | BX331: =RC[-46] -> 0 | BY331: =RC[-46] -> 0 | BZ331: =RC[-46] -> 0 | CA331: =RC[-46] -> 0 | CB331: =RC[-46] -> 344077 | CC331: =RC[-46] -> 6829017 | CD331: =RC[-46] -> 0 | CE331: =RC[-46] -> 0 | CF331: =RC[-46] -> 0 | CG331: =RC[-46] -> 0 | CH331: =RC[-46] -> 0 | CI331: =RC[-46] -> 0 | CJ331: =RC[-46] -> 0 | CK331: =RC[-46] -> 0 | CL331: =RC[-46] -> 1 | CM331: =RC[-46] -> 0 | CN331: =RC[-46] -> 0 | CO331: =RC[-46] -> 7982463.0599999996 | CP331: =RC[-46] -> 0 | CQ331: =RC[-46] -> 114692.33300000001 | CR331: =RC[-46] -> 344077 | CS331: =RC[-46] -> 229384.66699999999
A332: 92 | B332: 010711 | C332: Nguyễn Ngọc Hà | D332: NV Lái xe - VHTTB | E332: 10522162639018 | F332: =RC[29]+RC[30]+RC[31]+RC[32]+RC[33]+RC[34]+RC[35]+RC[36]+RC[37] -> 6189891 | G332: =RC[17]+RC[18]++RC[19]+RC[20]+RC[21]+RC[38]+RC[39]+RC[41] -> 0 | H332: 0 | I332: 0 | J332: =RC[-2]+RC[-1] -> 0 | K332: 0 | L332: 680000 | M332: 342930 | N332: =RC[15]+RC[16]+RC[17]+RC[18]+RC[19]+RC[20] -> 344077 | O332: 0 | P332: 0 | Q332: 7556898 | R332: 261280 | S332: 48990 | T332: 32660 | U332: 72139.679999999993 | V332: 0 | W332: 7141828.3200000003 | X332: 0 | Y332: 0 | Z332: 0 | AA332: 0 | AB332: 0 | AC332: 0 | AD332: 0 | AE332: 0 | AF332: 0 | AG332: 0 | AH332: 344077 | AI332: 6189891 | AJ332: 0 | AK332: 0 | AL332: 0 | AM332: 0 | AN332: 0 | AO332: 0 | AP332: 0 | AQ332: 0 | AR332: =1 -> 1 | AS332: 0 | AT332: 0 | AU332: =RC[-30]-RC[-29]-RC[-28]-RC[-27]-RC[-26]-RC[-25] -> 7141828.3200000003 | AV332: 0 | AW332: =RC[1]-RC[2] -> 114692.33300000001 | AX332: 344077 | AY332: 229384.66699999999 | AZ332: =RC[-46] -> 6189891 | BA332: =RC[-46] -> 0 | BB332: =RC[-46] -> 0 | BC332: =RC[-46] -> 0 | BD332: =RC[-46] -> 0 | BE332: =RC[-46] -> 0 | BF332: =RC[-46] -> 680000 | BG332: =RC[-46] -> 342930 | BH332: =RC[-46] -> 344077 | BI332: =RC[-46] -> 0 | BJ332: =RC[-46] -> 0 | BK332: =RC[-46] -> 7556898 | BL332: =RC[-46] -> 261280 | BM332: =RC[-46] -> 48990 | BN332: =RC[-46] -> 32660 | BO332: =RC[-46] -> 72139.679999999993 | BP332: =RC[-46] -> 0 | BQ332: =RC[-46] -> 7141828.3200000003 | BR332: =RC[-46] -> 0 | BS332: =RC[-46] -> 0 | BT332: =RC[-46] -> 0 | BU332: =RC[-46] -> 0 | BV332: =RC[-46] -> 0 | BW332: =RC[-46] -> 0 | BX332: =RC[-46] -> 0 | BY332: =RC[-46] -> 0 | BZ332: =RC[-46] -> 0 | CA332: =RC[-46] -> 0 | CB332: =RC[-46] -> 344077 | CC332: =RC[-46] -> 6189891 | CD332: =RC[-46] -> 0 | CE332: =RC[-46] -> 0 | CF332: =RC[-46] -> 0 | CG332: =RC[-46] -> 0 | CH332: =RC[-46] -> 0 | CI332: =RC[-46] -> 0 | CJ332: =RC[-46] -> 0 | CK332: =RC[-46] -> 0 | CL332: =RC[-46] -> 1 | CM332: =RC[-46] -> 0 | CN332: =RC[-46] -> 0 | CO332: =RC[-46] -> 7141828.3200000003 | CP332: =RC[-46] -> 0 | CQ332: =RC[-46] -> 114692.33300000001 | CR332: =RC[-46] -> 344077 | CS332: =RC[-46] -> 229384.66699999999
A333: 93 | B333: 010712 | C333: Phạm Đức Long | D333: NV Lái xe - VHTTB | E333: 10522162741017 | F333: =RC[29]+RC[30]+RC[31]+RC[32]+RC[33]+RC[34]+RC[35]+RC[36]+RC[37] -> 5895134 | G333: =RC[17]+RC[18]++RC[19]+RC[20]+RC[21]+RC[38]+RC[39]+RC[41] -> 0 | H333: 0 | I333: 0 | J333: =RC[-2]+RC[-1] -> 0 | K333: 0 | L333: 680000 | M333: 342930 | N333: =RC[15]+RC[16]+RC[17]+RC[18]+RC[19]+RC[20] -> 344077 | O333: 0 | P333: 0 | Q333: 7262141 | R333: 261280 | S333: 48990 | T333: 32660 | U333: 69192.11 | V333: 0 | W333: 6850018.8899999997 | X333: 0 | Y333: 0 | Z333: 0 | AA333: 0 | AB333: 0 | AC333: 0 | AD333: 0 | AE333: 0 | AF333: 0 | AG333: 0 | AH333: 344077 | AI333: 5895134 | AJ333: 0 | AK333: 0 | AL333: 0 | AM333: 0 | AN333: 0 | AO333: 0 | AP333: 0 | AQ333: 0 | AR333: =1 -> 1 | AS333: 0 | AT333: 0 | AU333: =RC[-30]-RC[-29]-RC[-28]-RC[-27]-RC[-26]-RC[-25] -> 6850018.8899999997 | AV333: 0 | AW333: =RC[1]-RC[2] -> 114692.33300000001 | AX333: 344077 | AY333: 229384.66699999999 | AZ333: =RC[-46] -> 5895134 | BA333: =RC[-46] -> 0 | BB333: =RC[-46] -> 0 | BC333: =RC[-46] -> 0 | BD333: =RC[-46] -> 0 | BE333: =RC[-46] -> 0 | BF333: =RC[-46] -> 680000 | BG333: =RC[-46] -> 342930 | BH333: =RC[-46] -> 344077 | BI333: =RC[-46] -> 0 | BJ333: =RC[-46] -> 0 | BK333: =RC[-46] -> 7262141 | BL333: =RC[-46] -> 261280 | BM333: =RC[-46] -> 48990 | BN333: =RC[-46] -> 32660 | BO333: =RC[-46] -> 69192.11 | BP333: =RC[-46] -> 0 | BQ333: =RC[-46] -> 6850018.8899999997 | BR333: =RC[-46] -> 0 | BS333: =RC[-46] -> 0 | BT333: =RC[-46] -> 0 | BU333: =RC[-46] -> 0 | BV333: =RC[-46] -> 0 | BW333: =RC[-46] -> 0 | BX333: =RC[-46] -> 0 | BY333: =RC[-46] -> 0 | BZ333: =RC[-46] -> 0 | CA333: =RC[-46] -> 0 | CB333: =RC[-46] -> 344077 | CC333: =RC[-46] -> 5895134 | CD333: =RC[-46] -> 0 | CE333: =RC[-46] -> 0 | CF333: =RC[-46] -> 0 | CG333: =RC[-46] -> 0 | CH333: =RC[-46] -> 0 | CI333: =RC[-46] -> 0 | CJ333: =RC[-46] -> 0 | CK333: =RC[-46] -> 0 | CL333: =RC[-46] -> 1 | CM333: =RC[-46] -> 0 | CN333: =RC[-46] -> 0 | CO333: =RC[-46] -> 6850018.8899999997 | CP333: =RC[-46] -> 0 | CQ333: =RC[-46] -> 114692.33300000001 | CR333: =RC[-46] -> 344077 | CS333: =RC[-46] -> 229384.66699999999
A334: 94 | B334: 010713 | C334: Trịnh Văn Mạnh | D334: NV Lái xe - VHTTB | E334: 10522162648017 | F334: =RC[29]+RC[30]+RC[31]+RC[32]+RC[33]+RC[34]+RC[35]+RC[36]+RC[37] -> 6245340 | G334: =RC[17]+RC[18]++RC[19]+RC[20]+RC[21]+RC[38]+RC[39]+RC[41] -> 0 | H334: 0 | I334: 0 | J334: =RC[-2]+RC[-1] -> 0 | K334: 0 | L334: 680000 | M334: 342930 | N334: =RC[15]+RC[16]+RC[17]+RC[18]+RC[19]+RC[20] -> 344077 | O334: 0 | P334: 0 | Q334: 7612347 | R334: 261280 | S334: 48990 | T334: 32660 | U334: 72694.17 | V334: 0 | W334: 7196722.8300000001 | X334: 0 | Y334: 0 | Z334: 0 | AA334: 0 | AB334: 0 | AC334: 0 | AD334: 0 | AE334: 0 | AF334: 0 | AG334: 0 | AH334: 344077 | AI334: 6245340 | AJ334: 0 | AK334: 0 | AL334: 0 | AM334: 0 | AN334: 0 | AO334: 0 | AP334: 0 | AQ334: 0 | AR334: =1 -> 1 | AS334: 0 | AT334: 0 | AU334: =RC[-30]-RC[-29]-RC[-28]-RC[-27]-RC[-26]-RC[-25] -> 7196722.8300000001 | AV334: 0 | AW334: =RC[1]-RC[2] -> 114692.33300000001 | AX334: 344077 | AY334: 229384.66699999999 | AZ334: =RC[-46] -> 6245340 | BA334: =RC[-46] -> 0 | BB334: =RC[-46] -> 0 | BC334: =RC[-46] -> 0 | BD334: =RC[-46] -> 0 | BE334: =RC[-46] -> 0 | BF334: =RC[-46] -> 680000 | BG334: =RC[-46] -> 342930 | BH334: =RC[-46] -> 344077 | BI334: =RC[-46] -> 0 | BJ334: =RC[-46] -> 0 | BK334: =RC[-46] -> 7612347 | BL334: =RC[-46] -> 261280 | BM334: =RC[-46] -> 48990 | BN334: =RC[-46] -> 32660 | BO334: =RC[-46] -> 72694.17 | BP334: =RC[-46] -> 0 | BQ334: =RC[-46] -> 7196722.8300000001 | BR334: =RC[-46] -> 0 | BS334: =RC[-46] -> 0 | BT334: =RC[-46] -> 0 | BU334: =RC[-46] -> 0 | BV334: =RC[-46] -> 0 | BW334: =RC[-46] -> 0 | BX334: =RC[-46] -> 0 | BY334: =RC[-46] -> 0 | BZ334: =RC[-46] -> 0 | CA334: =RC[-46] -> 0 | CB334: =RC[-46] -> 344077 | CC334: =RC[-46] -> 6245340 | CD334: =RC[-46] -> 0 | CE334: =RC[-46] -> 0 | CF334: =RC[-46] -> 0 | CG334: =RC[-46] -> 0 | CH334: =RC[-46] -> 0 | CI334: =RC[-46] -> 0 | CJ334: =RC[-46] -> 0 | CK334: =RC[-46] -> 0 | CL334: =RC[-46] -> 1 | CM334: =RC[-46] -> 0 | CN334: =RC[-46] -> 0 | CO334: =RC[-46] -> 7196722.8300000001 | CP334: =RC[-46] -> 0 | CQ334: =RC[-46] -> 114692.33300000001 | CR334: =RC[-46] -> 344077 | CS334: =RC[-46] -> 229384.66699999999
A335: 95 | B335: 010714 | C335: Phạm Văn Hải | D335: NV Lái xe - VHTTB | E335: 10522162623014 | F335: =RC[29]+RC[30]+RC[31]+RC[32]+RC[33]+RC[34]+RC[35]+RC[36]+RC[37] -> 6537178 | G335: =RC[17]+RC[18]++RC[19]+RC[20]+RC[21]+RC[38]+RC[39]+RC[41] -> 0 | H335: 0 | I335: 0 | J335: =RC[-2]+RC[-1] -> 0 | K335: 105000 | L335: 680000 | M335: 452813 | N335: =RC[15]+RC[16]+RC[17]+RC[18]+RC[19]+RC[20] -> 454327 | O335: 0 | P335: 0 | Q335: 8229318 | R335: 345000 | S335: 64688 | T335: 43125 | U335: 77765.05 | V335: 0 | W335: 7698739.9500000002 | X335: 0 | Y335: 0 | Z335: 0 | AA335: 0 | AB335: 0 | AC335: 0 | AD335: 0 | AE335: 0 | AF335: 0 | AG335: 0 | AH335: 454327 | AI335: 6537178 | AJ335: 0 | AK335: 0 | AL335: 0 | AM335: 0 | AN335: 0 | AO335: 0 | AP335: 0 | AQ335: 0 | AR335: =1 -> 1 | AS335: 0 | AT335: 0 | AU335: =RC[-30]-RC[-29]-RC[-28]-RC[-27]-RC[-26]-RC[-25] -> 7698739.9500000002 | AV335: 0 | AW335: =RC[1]-RC[2] -> 151442.33299999998 | AX335: 454327 | AY335: 302884.66700000002 | AZ335: =RC[-46] -> 6537178 | BA335: =RC[-46] -> 0 | BB335: =RC[-46] -> 0 | BC335: =RC[-46] -> 0 | BD335: =RC[-46] -> 0 | BE335: =RC[-46] -> 105000 | BF335: =RC[-46] -> 680000 | BG335: =RC[-46] -> 452813 | BH335: =RC[-46] -> 454327 | BI335: =RC[-46] -> 0 | BJ335: =RC[-46] -> 0 | BK335: =RC[-46] -> 8229318 | BL335: =RC[-46] -> 345000 | BM335: =RC[-46] -> 64688 | BN335: =RC[-46] -> 43125 | BO335: =RC[-46] -> 77765.05 | BP335: =RC[-46] -> 0 | BQ335: =RC[-46] -> 7698739.9500000002 | BR335: =RC[-46] -> 0 | BS335: =RC[-46] -> 0 | BT335: =RC[-46] -> 0 | BU335: =RC[-46] -> 0 | BV335: =RC[-46] -> 0 | BW335: =RC[-46] -> 0 | BX335: =RC[-46] -> 0 | BY335: =RC[-46] -> 0 | BZ335: =RC[-46] -> 0 | CA335: =RC[-46] -> 0 | CB335: =RC[-46] -> 454327 | CC335: =RC[-46] -> 6537178 | CD335: =RC[-46] -> 0 | CE335: =RC[-46] -> 0 | CF335: =RC[-46] -> 0 | CG335: =RC[-46] -> 0 | CH335: =RC[-46] -> 0 | CI335: =RC[-46] -> 0 | CJ335: =RC[-46] -> 0 | CK335: =RC[-46] -> 0 | CL335: =RC[-46] -> 1 | CM335: =RC[-46] -> 0 | CN335: =RC[-46] -> 0 | CO335: =RC[-46] -> 7698739.9500000002 | CP335: =RC[-46] -> 0 | CQ335: =RC[-46] -> 151442.33299999998 | CR335: =RC[-46] -> 454327 | CS335: =RC[-46] -> 302884.66700000002
A336: 96 | B336: 010716 | C336: Bùi Văn Thành | D336: NV Lái xe - VHTTB | E336: 10522162737011 | F336: =RC[29]+RC[30]+RC[31]+RC[32]+RC[33]+RC[34]+RC[35]+RC[36]+RC[37] -> 5574112 | G336: =RC[17]+RC[18]++RC[19]+RC[20]+RC[21]+RC[38]+RC[39]+RC[41] -> 0 | H336: 0 | I336: 0 | J336: =RC[-2]+RC[-1] -> 0 | K336: 0 | L336: 680000 | M336: 342930 | N336: =RC[15]+RC[16]+RC[17]+RC[18]+RC[19]+RC[20] -> 344077 | O336: 0 | P336: 0 | Q336: 6941119 | R336: 261280 | S336: 48990 | T336: 32660 | U336: 65981.89 | V336: 0 | W336: 6532207.1100000003 | X336: 0 | Y336: 0 | Z336: 0 | AA336: 0 | AB336: 0 | AC336: 0 | AD336: 0 | AE336: 0 | AF336: 0 | AG336: 0 | AH336: 344077 | AI336: 5574112 | AJ336: 0 | AK336: 0 | AL336: 0 | AM336: 0 | AN336: 0 | AO336: 0 | AP336: 0 | AQ336: 0 | AR336: =1 -> 1 | AS336: 0 | AT336: 0 | AU336: =RC[-30]-RC[-29]-RC[-28]-RC[-27]-RC[-26]-RC[-25] -> 6532207.1100000003 | AV336: 0 | AW336: =RC[1]-RC[2] -> 114692.33300000001 | AX336: 344077 | AY336: 229384.66699999999 | AZ336: =RC[-46] -> 5574112 | BA336: =RC[-46] -> 0 | BB336: =RC[-46] -> 0 | BC336: =RC[-46] -> 0 | BD336: =RC[-46] -> 0 | BE336: =RC[-46] -> 0 | BF336: =RC[-46] -> 680000 | BG336: =RC[-46] -> 342930 | BH336: =RC[-46] -> 344077 | BI336: =RC[-46] -> 0 | BJ336: =RC[-46] -> 0 | BK336: =RC[-46] -> 6941119 | BL336: =RC[-46] -> 261280 | BM336: =RC[-46] -> 48990 | BN336: =RC[-46] -> 32660 | BO336: =RC[-46] -> 65981.89 | BP336: =RC[-46] -> 0 | BQ336: =RC[-46] -> 6532207.1100000003 | BR336: =RC[-46] -> 0 | BS336: =RC[-46] -> 0 | BT336: =RC[-46] -> 0 | BU336: =RC[-46] -> 0 | BV336: =RC[-46] -> 0 | BW336: =RC[-46] -> 0 | BX336: =RC[-46] -> 0 | BY336: =RC[-46] -> 0 | BZ336: =RC[-46] -> 0 | CA336: =RC[-46] -> 0 | CB336: =RC[-46] -> 344077 | CC336: =RC[-46] -> 5574112 | CD336: =RC[-46] -> 0 | CE336: =RC[-46] -> 0 | CF336: =RC[-46] -> 0 | CG336: =RC[-46] -> 0 | CH336: =RC[-46] -> 0 | CI336: =RC[-46] -> 0 | CJ336: =RC[-46] -> 0 | CK336: =RC[-46] -> 0 | CL336: =RC[-46] -> 1 | CM336: =RC[-46] -> 0 | CN336: =RC[-46] -> 0 | CO336: =RC[-46] -> 6532207.1100000003 | CP336: =RC[-46] -> 0 | CQ336: =RC[-46] -> 114692.33300000001 | CR336: =RC[-46] -> 344077 | CS336: =RC[-46] -> 229384.66699999999
A337: 97 | B337: 010717 | C337: Bùi Chí Công | D337: NV Lái xe - VHTTB | E337: 10522162630010 | F337: =RC[29]+RC[30]+RC[31]+RC[32]+RC[33]+RC[34]+RC[35]+RC[36]+RC[37] -> 5574112 | G337: =RC[17]+RC[18]++RC[19]+RC[20]+RC[21]+RC[38]+RC[39]+RC[41] -> 0 | H337: 0 | I337: 0 | J337: =RC[-2]+RC[-1] -> 0 | K337: 0 | L337: 680000 | M337: 342930 | N337: =RC[15]+RC[16]+RC[17]+RC[18]+RC[19]+RC[20] -> 344077 | O337: 0 | P337: 0 | Q337: 6941119 | R337: 261280 | S337: 48990 | T337: 32660 | U337: 65981.89 | V337: 0 | W337: 6532207.1100000003 | X337: 0 | Y337: 0 | Z337: 0 | AA337: 0 | AB337: 0 | AC337: 0 | AD337: 0 | AE337: 0 | AF337: 0 | AG337: 0 | AH337: 344077 | AI337: 5574112 | AJ337: 0 | AK337: 0 | AL337: 0 | AM337: 0 | AN337: 0 | AO337: 0 | AP337: 0 | AQ337: 0 | AR337: =1 -> 1 | AS337: 0 | AT337: 0 | AU337: =RC[-30]-RC[-29]-RC[-28]-RC[-27]-RC[-26]-RC[-25] -> 6532207.1100000003 | AV337: 0 | AW337: =RC[1]-RC[2] -> 114692.33300000001 | AX337: 344077 | AY337: 229384.66699999999 | AZ337: =RC[-46] -> 5574112 | BA337: =RC[-46] -> 0 | BB337: =RC[-46] -> 0 | BC337: =RC[-46] -> 0 | BD337: =RC[-46] -> 0 | BE337: =RC[-46] -> 0 | BF337: =RC[-46] -> 680000 | BG337: =RC[-46] -> 342930 | BH337: =RC[-46] -> 344077 | BI337: =RC[-46] -> 0 | BJ337: =RC[-46] -> 0 | BK337: =RC[-46] -> 6941119 | BL337: =RC[-46] -> 261280 | BM337: =RC[-46] -> 48990 | BN337: =RC[-46] -> 32660 | BO337: =RC[-46] -> 65981.89 | BP337: =RC[-46] -> 0 | BQ337: =RC[-46] -> 6532207.1100000003 | BR337: =RC[-46] -> 0 | BS337: =RC[-46] -> 0 | BT337: =RC[-46] -> 0 | BU337: =RC[-46] -> 0 | BV337: =RC[-46] -> 0 | BW337: =RC[-46] -> 0 | BX337: =RC[-46] -> 0 | BY337: =RC[-46] -> 0 | BZ337: =RC[-46] -> 0 | CA337: =RC[-46] -> 0 | CB337: =RC[-46] -> 344077 | CC337: =RC[-46] -> 5574112 | CD337: =RC[-46] -> 0 | CE337: =RC[-46] -> 0 | CF337: =RC[-46] -> 0 | CG337: =RC[-46] -> 0 | CH337: =RC[-46] -> 0 | CI337: =RC[-46] -> 0 | CJ337: =RC[-46] -> 0 | CK337: =RC[-46] -> 0 | CL337: =RC[-46] -> 1 | CM337: =RC[-46] -> 0 | CN337: =RC[-46] -> 0 | CO337: =RC[-46] -> 6532207.1100000003 | CP337: =RC[-46] -> 0 | CQ337: =RC[-46] -> 114692.33300000001 | CR337: =RC[-46] -> 344077 | CS337: =RC[-46] -> 229384.66699999999
A338: 98 | B338: 010718 | C338: Nguyễn Văn Định | D338: NV Lái xe - VHTTB | E338: 10520321899015 | F338: =RC[29]+RC[30]+RC[31]+RC[32]+RC[33]+RC[34]+RC[35]+RC[36]+RC[37] -> 5854277 | G338: =RC[17]+RC[18]++RC[19]+RC[20]+RC[21]+RC[38]+RC[39]+RC[41] -> 0 | H338: 0 | I338: 0 | J338: =RC[-2]+RC[-1] -> 0 | K338: 0 | L338: 680000 | M338: 342930 | N338: =RC[15]+RC[16]+RC[17]+RC[18]+RC[19]+RC[20] -> 344077 | O338: 0 | P338: 0 | Q338: 7221284 | R338: 261280 | S338: 48990 | T338: 32660 | U338: 68783.539999999994 | V338: 0 | W338: 6809570.46 | X338: 0 | Y338: 0 | Z338: 0 | AA338: 0 | AB338: 0 | AC338: 0 | AD338: 0 | AE338: 0 | AF338: 0 | AG338: 0 | AH338: 344077 | AI338: 5854277 | AJ338: 0 | AK338: 0 | AL338: 0 | AM338: 0 | AN338: 0 | AO338: 0 | AP338: 0 | AQ338: 0 | AR338: =1 -> 1 | AS338: 0 | AT338: 0 | AU338: =RC[-30]-RC[-29]-RC[-28]-RC[-27]-RC[-26]-RC[-25] -> 6809570.46 | AV338: 0 | AW338: =RC[1]-RC[2] -> 114692.33300000001 | AX338: 344077 | AY338: 229384.66699999999 | AZ338: =RC[-46] -> 5854277 | BA338: =RC[-46] -> 0 | BB338: =RC[-46] -> 0 | BC338: =RC[-46] -> 0 | BD338: =RC[-46] -> 0 | BE338: =RC[-46] -> 0 | BF338: =RC[-46] -> 680000 | BG338: =RC[-46] -> 342930 | BH338: =RC[-46] -> 344077 | BI338: =RC[-46] -> 0 | BJ338: =RC[-46] -> 0 | BK338: =RC[-46] -> 7221284 | BL338: =RC[-46] -> 261280 | BM338: =RC[-46] -> 48990 | BN338: =RC[-46] -> 32660 | BO338: =RC[-46] -> 68783.539999999994 | BP338: =RC[-46] -> 0 | BQ338: =RC[-46] -> 6809570.46 | BR338: =RC[-46] -> 0 | BS338: =RC[-46] -> 0 | BT338: =RC[-46] -> 0 | BU338: =RC[-46] -> 0 | BV338: =RC[-46] -> 0 | BW338: =RC[-46] -> 0 | BX338: =RC[-46] -> 0 | BY338: =RC[-46] -> 0 | BZ338: =RC[-46] -> 0 | CA338: =RC[-46] -> 0 | CB338: =RC[-46] -> 344077 | CC338: =RC[-46] -> 5854277 | CD338: =RC[-46] -> 0 | CE338: =RC[-46] -> 0 | CF338: =RC[-46] -> 0 | CG338: =RC[-46] -> 0 | CH338: =RC[-46] -> 0 | CI338: =RC[-46] -> 0 | CJ338: =RC[-46] -> 0 | CK338: =RC[-46] -> 0 | CL338: =RC[-46] -> 1 | CM338: =RC[-46] -> 0 | CN338: =RC[-46] -> 0 | CO338: =RC[-46] -> 6809570.46 | CP338: =RC[-46] -> 0 | CQ338: =RC[-46] -> 114692.33300000001 | CR338: =RC[-46] -> 344077 | CS338: =RC[-46] -> 229384.66699999999
A339: 99 | B339: 010719 | C339: Nguyễn Hải Anh | D339: NV Lái xe - VHTTB | E339: 10320272242014 | F339: =RC[29]+RC[30]+RC[31]+RC[32]+RC[33]+RC[34]+RC[35]+RC[36]+RC[37] -> 5574112 | G339: =RC[17]+RC[18]++RC[19]+RC[20]+RC[21]+RC[38]+RC[39]+RC[41] -> 0 | H339: 0 | I339: 0 | J339: =RC[-2]+RC[-1] -> 0 | K339: 0 | L339: 680000 | M339: 342930 | N339: =RC[15]+RC[16]+RC[17]+RC[18]+RC[19]+RC[20] -> 344077 | O339: 0 | P339: 0 | Q339: 6941119 | R339: 261280 | S339: 48990 | T339: 32660 | U339: 65981.89 | V339: 0 | W339: 6532207.1100000003 | X339: 0 | Y339: 0 | Z339: 0 | AA339: 0 | AB339: 0 | AC339: 0 | AD339: 0 | AE339: 0 | AF339: 0 | AG339: 0 | AH339: 344077 | AI339: 5574112 | AJ339: 0 | AK339: 0 | AL339: 0 | AM339: 0 | AN339: 0 | AO339: 0 | AP339: 0 | AQ339: 0 | AR339: =1 -> 1 | AS339: 0 | AT339: 0 | AU339: =RC[-30]-RC[-29]-RC[-28]-RC[-27]-RC[-26]-RC[-25] -> 6532207.1100000003 | AV339: 0 | AW339: =RC[1]-RC[2] -> 114692.33300000001 | AX339: 344077 | AY339: 229384.66699999999 | AZ339: =RC[-46] -> 5574112 | BA339: =RC[-46] -> 0 | BB339: =RC[-46] -> 0 | BC339: =RC[-46] -> 0 | BD339: =RC[-46] -> 0 | BE339: =RC[-46] -> 0 | BF339: =RC[-46] -> 680000 | BG339: =RC[-46] -> 342930 | BH339: =RC[-46] -> 344077 | BI339: =RC[-46] -> 0 | BJ339: =RC[-46] -> 0 | BK339: =RC[-46] -> 6941119 | BL339: =RC[-46] -> 261280 | BM339: =RC[-46] -> 48990 | BN339: =RC[-46] -> 32660 | BO339: =RC[-46] -> 65981.89 | BP339: =RC[-46] -> 0 | BQ339: =RC[-46] -> 6532207.1100000003 | BR339: =RC[-46] -> 0 | BS339: =RC[-46] -> 0 | BT339: =RC[-46] -> 0 | BU339: =RC[-46] -> 0 | BV339: =RC[-46] -> 0 | BW339: =RC[-46] -> 0 | BX339: =RC[-46] -> 0 | BY339: =RC[-46] -> 0 | BZ339: =RC[-46] -> 0 | CA339: =RC[-46] -> 0 | CB339: =RC[-46] -> 344077 | CC339: =RC[-46] -> 5574112 | CD339: =RC[-46] -> 0 | CE339: =RC[-46] -> 0 | CF339: =RC[-46] -> 0 | CG339: =RC[-46] -> 0 | CH339: =RC[-46] -> 0 | CI339: =RC[-46] -> 0 | CJ339: =RC[-46] -> 0 | CK339: =RC[-46] -> 0 | CL339: =RC[-46] -> 1 | CM339: =RC[-46] -> 0 | CN339: =RC[-46] -> 0 | CO339: =RC[-46] -> 6532207.1100000003 | CP339: =RC[-46] -> 0 | CQ339: =RC[-46] -> 114692.33300000001 | CR339: =RC[-46] -> 344077 | CS339: =RC[-46] -> 229384.66699999999
A340: 100 | B340: 010720 | C340: Bùi Kiên Trung | D340: NV Lái xe - VHTTB | E340: 10522156672011 | F340: =RC[29]+RC[30]+RC[31]+RC[32]+RC[33]+RC[34]+RC[35]+RC[36]+RC[37] -> 5574112 | G340: =RC[17]+RC[18]++RC[19]+RC[20]+RC[21]+RC[38]+RC[39]+RC[41] -> 0 | H340: 0 | I340: 0 | J340: =RC[-2]+RC[-1] -> 0 | K340: 0 | L340: 680000 | M340: 342930 | N340: =RC[15]+RC[16]+RC[17]+RC[18]+RC[19]+RC[20] -> 344077 | O340: 0 | P340: 0 | Q340: 6941119 | R340: 261280 | S340: 48990 | T340: 32660 | U340: 65981.89 | V340: 0 | W340: 6532207.1100000003 | X340: 0 | Y340: 0 | Z340: 0 | AA340: 0 | AB340: 0 | AC340: 0 | AD340: 0 | AE340: 0 | AF340: 0 | AG340: 0 | AH340: 344077 | AI340: 5574112 | AJ340: 0 | AK340: 0 | AL340: 0 | AM340: 0 | AN340: 0 | AO340: 0 | AP340: 0 | AQ340: 0 | AR340: =1 -> 1 | AS340: 0 | AT340: 0 | AU340: =RC[-30]-RC[-29]-RC[-28]-RC[-27]-RC[-26]-RC[-25] -> 6532207.1100000003 | AV340: 0 | AW340: =RC[1]-RC[2] -> 114692.33300000001 | AX340: 344077 | AY340: 229384.66699999999 | AZ340: =RC[-46] -> 5574112 | BA340: =RC[-46] -> 0 | BB340: =RC[-46] -> 0 | BC340: =RC[-46] -> 0 | BD340: =RC[-46] -> 0 | BE340: =RC[-46] -> 0 | BF340: =RC[-46] -> 680000 | BG340: =RC[-46] -> 342930 | BH340: =RC[-46] -> 344077 | BI340: =RC[-46] -> 0 | BJ340: =RC[-46] -> 0 | BK340: =RC[-46] -> 6941119 | BL340: =RC[-46] -> 261280 | BM340: =RC[-46] -> 48990 | BN340: =RC[-46] -> 32660 | BO340: =RC[-46] -> 65981.89 | BP340: =RC[-46] -> 0 | BQ340: =RC[-46] -> 6532207.1100000003 | BR340: =RC[-46] -> 0 | BS340: =RC[-46] -> 0 | BT340: =RC[-46] -> 0 | BU340: =RC[-46] -> 0 | BV340: =RC[-46] -> 0 | BW340: =RC[-46] -> 0 | BX340: =RC[-46] -> 0 | BY340: =RC[-46] -> 0 | BZ340: =RC[-46] -> 0 | CA340: =RC[-46] -> 0 | CB340: =RC[-46] -> 344077 | CC340: =RC[-46] -> 5574112 | CD340: =RC[-46] -> 0 | CE340: =RC[-46] -> 0 | CF340: =RC[-46] -> 0 | CG340: =RC[-46] -> 0 | CH340: =RC[-46] -> 0 | CI340: =RC[-46] -> 0 | CJ340: =RC[-46] -> 0 | CK340: =RC[-46] -> 0 | CL340: =RC[-46] -> 1 | CM340: =RC[-46] -> 0 | CN340: =RC[-46] -> 0 | CO340: =RC[-46] -> 6532207.1100000003 | CP340: =RC[-46] -> 0 | CQ340: =RC[-46] -> 114692.33300000001 | CR340: =RC[-46] -> 344077 | CS340: =RC[-46] -> 229384.66699999999
A341: 101 | B341: 010721 | C341: Vũ Quốc Cường | D341: NV Lái xe - VHTTB | E341: 10522162892015 | F341: =RC[29]+RC[30]+RC[31]+RC[32]+RC[33]+RC[34]+RC[35]+RC[36]+RC[37] -> 5194722 | G341: =RC[17]+RC[18]++RC[19]+RC[20]+RC[21]+RC[38]+RC[39]+RC[41] -> 0 | H341: 0 | I341: 0 | J341: =RC[-2]+RC[-1] -> 0 | K341: 0 | L341: 680000 | M341: 298253 | N341: =RC[15]+RC[16]+RC[17]+RC[18]+RC[19]+RC[20] -> 299250 | O341: 0 | P341: 0 | Q341: 6472225 | R341: 227240 | S341: 42608 | T341: 28405 | U341: 61739.72 | V341: 0 | W341: 6112232.2800000003 | X341: 0 | Y341: 0 | Z341: 0 | AA341: 0 | AB341: 0 | AC341: 0 | AD341: 0 | AE341: 0 | AF341: 0 | AG341: 0 | AH341: 299250 | AI341: 5194722 | AJ341: 0 | AK341: 0 | AL341: 0 | AM341: 0 | AN341: 0 | AO341: 0 | AP341: 0 | AQ341: 0 | AR341: =1 -> 1 | AS341: 0 | AT341: 0 | AU341: =RC[-30]-RC[-29]-RC[-28]-RC[-27]-RC[-26]-RC[-25] -> 6112232.2800000003 | AV341: 0 | AW341: =RC[1]-RC[2] -> 99750 | AX341: 299250 | AY341: 199500 | AZ341: =RC[-46] -> 5194722 | BA341: =RC[-46] -> 0 | BB341: =RC[-46] -> 0 | BC341: =RC[-46] -> 0 | BD341: =RC[-46] -> 0 | BE341: =RC[-46] -> 0 | BF341: =RC[-46] -> 680000 | BG341: =RC[-46] -> 298253 | BH341: =RC[-46] -> 299250 | BI341: =RC[-46] -> 0 | BJ341: =RC[-46] -> 0 | BK341: =RC[-46] -> 6472225 | BL341: =RC[-46] -> 227240 | BM341: =RC[-46] -> 42608 | BN341: =RC[-46] -> 28405 | BO341: =RC[-46] -> 61739.72 | BP341: =RC[-46] -> 0 | BQ341: =RC[-46] -> 6112232.2800000003 | BR341: =RC[-46] -> 0 | BS341: =RC[-46] -> 0 | BT341: =RC[-46] -> 0 | BU341: =RC[-46] -> 0 | BV341: =RC[-46] -> 0 | BW341: =RC[-46] -> 0 | BX341: =RC[-46] -> 0 | BY341: =RC[-46] -> 0 | BZ341: =RC[-46] -> 0 | CA341: =RC[-46] -> 0 | CB341: =RC[-46] -> 299250 | CC341: =RC[-46] -> 5194722 | CD341: =RC[-46] -> 0 | CE341: =RC[-46] -> 0 | CF341: =RC[-46] -> 0 | CG341: =RC[-46] -> 0 | CH341: =RC[-46] -> 0 | CI341: =RC[-46] -> 0 | CJ341: =RC[-46] -> 0 | CK341: =RC[-46] -> 0 | CL341: =RC[-46] -> 1 | CM341: =RC[-46] -> 0 | CN341: =RC[-46] -> 0 | CO341: =RC[-46] -> 6112232.2800000003 | CP341: =RC[-46] -> 0 | CQ341: =RC[-46] -> 99750 | CR341: =RC[-46] -> 299250 | CS341: =RC[-46] -> 199500
A342: 102 | B342: 010722 | C342: Vũ Văn Dương | D342: NV Lái xe - VHTTB | E342: 10522162900018 | F342: =RC[29]+RC[30]+RC[31]+RC[32]+RC[33]+RC[34]+RC[35]+RC[36]+RC[37] -> 5253090 | G342: =RC[17]+RC[18]++RC[19]+RC[20]+RC[21]+RC[38]+RC[39]+RC[41] -> 0 | H342: 0 | I342: 0 | J342: =RC[-2]+RC[-1] -> 0 | K342: 0 | L342: 680000 | M342: 298253 | N342: =RC[15]+RC[16]+RC[17]+RC[18]+RC[19]+RC[20] -> 0 | O342: 0 | P342: 0 | Q342: 6231343 | R342: 227240 | S342: 42608 | T342: 28405 | U342: 59330.9 | V342: 0 | W342: 5873759.0999999996 | X342: 0 | Y342: 0 | Z342: 0 | AA342: 0 | AB342: 0 | AC342: 0 | AD342: 0 | AE342: 0 | AF342: 0 | AG342: 0 | AH342: 0 | AI342: 5253090 | AJ342: 0 | AK342: 0 | AL342: 0 | AM342: 0 | AN342: 0 | AO342: 0 | AP342: 0 | AQ342: 0 | AR342: =1 -> 1 | AS342: 0 | AT342: 0 | AU342: =RC[-30]-RC[-29]-RC[-28]-RC[-27]-RC[-26]-RC[-25] -> 5873759.0999999996 | AV342: 0 | AW342: =RC[1]-RC[2] -> 0 | AX342: 0 | AY342: 0 | AZ342: =RC[-46] -> 5253090 | BA342: =RC[-46] -> 0 | BB342: =RC[-46] -> 0 | BC342: =RC[-46] -> 0 | BD342: =RC[-46] -> 0 | BE342: =RC[-46] -> 0 | BF342: =RC[-46] -> 680000 | BG342: =RC[-46] -> 298253 | BH342: =RC[-46] -> 0 | BI342: =RC[-46] -> 0 | BJ342: =RC[-46] -> 0 | BK342: =RC[-46] -> 6231343 | BL342: =RC[-46] -> 227240 | BM342: =RC[-46] -> 42608 | BN342: =RC[-46] -> 28405 | BO342: =RC[-46] -> 59330.9 | BP342: =RC[-46] -> 0 | BQ342: =RC[-46] -> 5873759.0999999996 | BR342: =RC[-46] -> 0 | BS342: =RC[-46] -> 0 | BT342: =RC[-46] -> 0 | BU342: =RC[-46] -> 0 | BV342: =RC[-46] -> 0 | BW342: =RC[-46] -> 0 | BX342: =RC[-46] -> 0 | BY342: =RC[-46] -> 0 | BZ342: =RC[-46] -> 0 | CA342: =RC[-46] -> 0 | CB342: =RC[-46] -> 0 | CC342: =RC[-46] -> 5253090 | CD342: =RC[-46] -> 0 | CE342: =RC[-46] -> 0 | CF342: =RC[-46] -> 0 | CG342: =RC[-46] -> 0 | CH342: =RC[-46] -> 0 | CI342: =RC[-46] -> 0 | CJ342: =RC[-46] -> 0 | CK342: =RC[-46] -> 0 | CL342: =RC[-46] -> 1 | CM342: =RC[-46] -> 0 | CN342: =RC[-46] -> 0 | CO342: =RC[-46] -> 5873759.0999999996 | CP342: =RC[-46] -> 0 | CQ342: =RC[-46] -> 0 | CR342: =RC[-46] -> 0 | CS342: =RC[-46] -> 0
A343: 103 | B343: 010723 | C343: Vũ Văn Thái | D343: NV Lái xe - VHTTB | E343: 10520767892014 | F343: =RC[29]+RC[30]+RC[31]+RC[32]+RC[33]+RC[34]+RC[35]+RC[36]+RC[37] -> 5854277 | G343: =RC[17]+RC[18]++RC[19]+RC[20]+RC[21]+RC[38]+RC[39]+RC[41] -> 0 | H343: 0 | I343: 0 | J343: =RC[-2]+RC[-1] -> 0 | K343: 0 | L343: 680000 | M343: 396060 | N343: =RC[15]+RC[16]+RC[17]+RC[18]+RC[19]+RC[20] -> 397385 | O343: 0 | P343: 0 | Q343: 7327722 | R343: 301760 | S343: 56580 | T343: 37720 | U343: 69316.62 | V343: 0 | W343: 6862345.3799999999 | X343: 0 | Y343: 0 | Z343: 0 | AA343: 0 | AB343: 0 | AC343: 0 | AD343: 0 | AE343: 0 | AF343: 0 | AG343: 0 | AH343: 397385 | AI343: 5854277 | AJ343: 0 | AK343: 0 | AL343: 0 | AM343: 0 | AN343: 0 | AO343: 0 | AP343: 0 | AQ343: 0 | AR343: =1 -> 1 | AS343: 0 | AT343: 0 | AU343: =RC[-30]-RC[-29]-RC[-28]-RC[-27]-RC[-26]-RC[-25] -> 6862345.3799999999 | AV343: 0 | AW343: =RC[1]-RC[2] -> 132461.66700000002 | AX343: 397385 | AY343: 264923.33299999998 | AZ343: =RC[-46] -> 5854277 | BA343: =RC[-46] -> 0 | BB343: =RC[-46] -> 0 | BC343: =RC[-46] -> 0 | BD343: =RC[-46] -> 0 | BE343: =RC[-46] -> 0 | BF343: =RC[-46] -> 680000 | BG343: =RC[-46] -> 396060 | BH343: =RC[-46] -> 397385 | BI343: =RC[-46] -> 0 | BJ343: =RC[-46] -> 0 | BK343: =RC[-46] -> 7327722 | BL343: =RC[-46] -> 301760 | BM343: =RC[-46] -> 56580 | BN343: =RC[-46] -> 37720 | BO343: =RC[-46] -> 69316.62 | BP343: =RC[-46] -> 0 | BQ343: =RC[-46] -> 6862345.3799999999 | BR343: =RC[-46] -> 0 | BS343: =RC[-46] -> 0 | BT343: =RC[-46] -> 0 | BU343: =RC[-46] -> 0 | BV343: =RC[-46] -> 0 | BW343: =RC[-46] -> 0 | BX343: =RC[-46] -> 0 | BY343: =RC[-46] -> 0 | BZ343: =RC[-46] -> 0 | CA343: =RC[-46] -> 0 | CB343: =RC[-46] -> 397385 | CC343: =RC[-46] -> 5854277 | CD343: =RC[-46] -> 0 | CE343: =RC[-46] -> 0 | CF343: =RC[-46] -> 0 | CG343: =RC[-46] -> 0 | CH343: =RC[-46] -> 0 | CI343: =RC[-46] -> 0 | CJ343: =RC[-46] -> 0 | CK343: =RC[-46] -> 0 | CL343: =RC[-46] -> 1 | CM343: =RC[-46] -> 0 | CN343: =RC[-46] -> 0 | CO343: =RC[-46] -> 6862345.3799999999 | CP343: =RC[-46] -> 0 | CQ343: =RC[-46] -> 132461.66700000002 | CR343: =RC[-46] -> 397385 | CS343: =RC[-46] -> 264923.33299999998
A344: 104 | B344: 010725 | C344: Phạm Quang Sơn | D344: NV Lái xe - VHTTB | E344: 10522162913012 | F344: =RC[29]+RC[30]+RC[31]+RC[32]+RC[33]+RC[34]+RC[35]+RC[36]+RC[37] -> 5194722 | G344: =RC[17]+RC[18]++RC[19]+RC[20]+RC[21]+RC[38]+RC[39]+RC[41] -> 0 | H344: 0 | I344: 0 | J344: =RC[-2]+RC[-1] -> 0 | K344: 0 | L344: 680000 | M344: 298253 | N344: =RC[15]+RC[16]+RC[17]+RC[18]+RC[19]+RC[20] -> 299250 | O344: 0 | P344: 0 | Q344: 6472225 | R344: 227240 | S344: 42608 | T344: 28405 | U344: 61739.72 | V344: 0 | W344: 6112232.2800000003 | X344: 0 | Y344: 0 | Z344: 0 | AA344: 0 | AB344: 0 | AC344: 0 | AD344: 0 | AE344: 0 | AF344: 0 | AG344: 0 | AH344: 299250 | AI344: 5194722 | AJ344: 0 | AK344: 0 | AL344: 0 | AM344: 0 | AN344: 0 | AO344: 0 | AP344: 0 | AQ344: 0 | AR344: =1 -> 1 | AS344: 0 | AT344: 0 | AU344: =RC[-30]-RC[-29]-RC[-28]-RC[-27]-RC[-26]-RC[-25] -> 6112232.2800000003 | AV344: 0 | AW344: =RC[1]-RC[2] -> 99750 | AX344: 299250 | AY344: 199500 | AZ344: =RC[-46] -> 5194722 | BA344: =RC[-46] -> 0 | BB344: =RC[-46] -> 0 | BC344: =RC[-46] -> 0 | BD344: =RC[-46] -> 0 | BE344: =RC[-46] -> 0 | BF344: =RC[-46] -> 680000 | BG344: =RC[-46] -> 298253 | BH344: =RC[-46] -> 299250 | BI344: =RC[-46] -> 0 | BJ344: =RC[-46] -> 0 | BK344: =RC[-46] -> 6472225 | BL344: =RC[-46] -> 227240 | BM344: =RC[-46] -> 42608 | BN344: =RC[-46] -> 28405 | BO344: =RC[-46] -> 61739.72 | BP344: =RC[-46] -> 0 | BQ344: =RC[-46] -> 6112232.2800000003 | BR344: =RC[-46] -> 0 | BS344: =RC[-46] -> 0 | BT344: =RC[-46] -> 0 | BU344: =RC[-46] -> 0 | BV344: =RC[-46] -> 0 | BW344: =RC[-46] -> 0 | BX344: =RC[-46] -> 0 | BY344: =RC[-46] -> 0 | BZ344: =RC[-46] -> 0 | CA344: =RC[-46] -> 0 | CB344: =RC[-46] -> 299250 | CC344: =RC[-46] -> 5194722 | CD344: =RC[-46] -> 0 | CE344: =RC[-46] -> 0 | CF344: =RC[-46] -> 0 | CG344: =RC[-46] -> 0 | CH344: =RC[-46] -> 0 | CI344: =RC[-46] -> 0 | CJ344: =RC[-46] -> 0 | CK344: =RC[-46] -> 0 | CL344: =RC[-46] -> 1 | CM344: =RC[-46] -> 0 | CN344: =RC[-46] -> 0 | CO344: =RC[-46] -> 6112232.2800000003 | CP344: =RC[-46] -> 0 | CQ344: =RC[-46] -> 99750 | CR344: =RC[-46] -> 299250 | CS344: =RC[-46] -> 199500
A345: 105 | B345: 010726 | C345: Vũ Mạnh Hùng | D345: NV Lái xe - VHTTB | E345: 10523498946012 | F345: =RC[29]+RC[30]+RC[31]+RC[32]+RC[33]+RC[34]+RC[35]+RC[36]+RC[37] -> 4990435 | G345: =RC[17]+RC[18]++RC[19]+RC[20]+RC[21]+RC[38]+RC[39]+RC[41] -> 0 | H345: 0 | I345: 0 | J345: =RC[-2]+RC[-1] -> 0 | K345: 0 | L345: 680000 | M345: 298253 | N345: =RC[15]+RC[16]+RC[17]+RC[18]+RC[19]+RC[20] -> 299250 | O345: 0 | P345: 0 | Q345: 6267938 | R345: 227240 | S345: 42608 | T345: 28405 | U345: 59696.85 | V345: 0 | W345: 5909988.1500000004 | X345: 0 | Y345: 0 | Z345: 0 | AA345: 0 | AB345: 0 | AC345: 0 | AD345: 0 | AE345: 0 | AF345: 0 | AG345: 0 | AH345: 299250 | AI345: 4990435 | AJ345: 0 | AK345: 0 | AL345: 0 | AM345: 0 | AN345: 0 | AO345: 0 | AP345: 0 | AQ345: 0 | AR345: =1 -> 1 | AS345: 0 | AT345: 0 | AU345: =RC[-30]-RC[-29]-RC[-28]-RC[-27]-RC[-26]-RC[-25] -> 5909988.1500000004 | AV345: 0 | AW345: =RC[1]-RC[2] -> 99750 | AX345: 299250 | AY345: 199500 | AZ345: =RC[-46] -> 4990435 | BA345: =RC[-46] -> 0 | BB345: =RC[-46] -> 0 | BC345: =RC[-46] -> 0 | BD345: =RC[-46] -> 0 | BE345: =RC[-46] -> 0 | BF345: =RC[-46] -> 680000 | BG345: =RC[-46] -> 298253 | BH345: =RC[-46] -> 299250 | BI345: =RC[-46] -> 0 | BJ345: =RC[-46] -> 0 | BK345: =RC[-46] -> 6267938 | BL345: =RC[-46] -> 227240 | BM345: =RC[-46] -> 42608 | BN345: =RC[-46] -> 28405 | BO345: =RC[-46] -> 59696.85 | BP345: =RC[-46] -> 0 | BQ345: =RC[-46] -> 5909988.1500000004 | BR345: =RC[-46] -> 0 | BS345: =RC[-46] -> 0 | BT345: =RC[-46] -> 0 | BU345: =RC[-46] -> 0 | BV345: =RC[-46] -> 0 | BW345: =RC[-46] -> 0 | BX345: =RC[-46] -> 0 | BY345: =RC[-46] -> 0 | BZ345: =RC[-46] -> 0 | CA345: =RC[-46] -> 0 | CB345: =RC[-46] -> 299250 | CC345: =RC[-46] -> 4990435 | CD345: =RC[-46] -> 0 | CE345: =RC[-46] -> 0 | CF345: =RC[-46] -> 0 | CG345: =RC[-46] -> 0 | CH345: =RC[-46] -> 0 | CI345: =RC[-46] -> 0 | CJ345: =RC[-46] -> 0 | CK345: =RC[-46] -> 0 | CL345: =RC[-46] -> 1 | CM345: =RC[-46] -> 0 | CN345: =RC[-46] -> 0 | CO345: =RC[-46] -> 5909988.1500000004 | CP345: =RC[-46] -> 0 | CQ345: =RC[-46] -> 99750 | CR345: =RC[-46] -> 299250 | CS345: =RC[-46] -> 199500
A346: 106 | B346: 010727 | C346: Trần Mạnh Hùng | D346: NV Lái xe - VHTTB | E346: 10520633859010 | F346: =RC[29]+RC[30]+RC[31]+RC[32]+RC[33]+RC[34]+RC[35]+RC[36]+RC[37] -> 4882455 | G346: =RC[17]+RC[18]++RC[19]+RC[20]+RC[21]+RC[38]+RC[39]+RC[41] -> 0 | H346: 0 | I346: 0 | J346: =RC[-2]+RC[-1] -> 0 | K346: 0 | L346: 680000 | M346: 298253 | N346: =RC[15]+RC[16]+RC[17]+RC[18]+RC[19]+RC[20] -> 299250 | O346: 0 | P346: 0 | Q346: 6159958 | R346: 227240 | S346: 42608 | T346: 28405 | U346: 58617.05 | V346: 0 | W346: 5803087.9500000002 | X346: 0 | Y346: 0 | Z346: 0 | AA346: 0 | AB346: 0 | AC346: 0 | AD346: 0 | AE346: 0 | AF346: 0 | AG346: 0 | AH346: 299250 | AI346: 4882455 | AJ346: 0 | AK346: 0 | AL346: 0 | AM346: 0 | AN346: 0 | AO346: 0 | AP346: 0 | AQ346: 0 | AR346: =1 -> 1 | AS346: 0 | AT346: 0 | AU346: =RC[-30]-RC[-29]-RC[-28]-RC[-27]-RC[-26]-RC[-25] -> 5803087.9500000002 | AV346: 0 | AW346: =RC[1]-RC[2] -> 99750 | AX346: 299250 | AY346: 199500 | AZ346: =RC[-46] -> 4882455 | BA346: =RC[-46] -> 0 | BB346: =RC[-46] -> 0 | BC346: =RC[-46] -> 0 | BD346: =RC[-46] -> 0 | BE346: =RC[-46] -> 0 | BF346: =RC[-46] -> 680000 | BG346: =RC[-46] -> 298253 | BH346: =RC[-46] -> 299250 | BI346: =RC[-46] -> 0 | BJ346: =RC[-46] -> 0 | BK346: =RC[-46] -> 6159958 | BL346: =RC[-46] -> 227240 | BM346: =RC[-46] -> 42608 | BN346: =RC[-46] -> 28405 | BO346: =RC[-46] -> 58617.05 | BP346: =RC[-46] -> 0 | BQ346: =RC[-46] -> 5803087.9500000002 | BR346: =RC[-46] -> 0 | BS346: =RC[-46] -> 0 | BT346: =RC[-46] -> 0 | BU346: =RC[-46] -> 0 | BV346: =RC[-46] -> 0 | BW346: =RC[-46] -> 0 | BX346: =RC[-46] -> 0 | BY346: =RC[-46] -> 0 | BZ346: =RC[-46] -> 0 | CA346: =RC[-46] -> 0 | CB346: =RC[-46] -> 299250 | CC346: =RC[-46] -> 4882455 | CD346: =RC[-46] -> 0 | CE346: =RC[-46] -> 0 | CF346: =RC[-46] -> 0 | CG346: =RC[-46] -> 0 | CH346: =RC[-46] -> 0 | CI346: =RC[-46] -> 0 | CJ346: =RC[-46] -> 0 | CK346: =RC[-46] -> 0 | CL346: =RC[-46] -> 1 | CM346: =RC[-46] -> 0 | CN346: =RC[-46] -> 0 | CO346: =RC[-46] -> 5803087.9500000002 | CP346: =RC[-46] -> 0 | CQ346: =RC[-46] -> 99750 | CR346: =RC[-46] -> 299250 | CS346: =RC[-46] -> 199500
A347: 107 | B347: 010728 | C347: Nguyễn Mạnh Hùng | D347: NV Lái xe - VHTTB | E347: 10522162904013 | F347: =RC[29]+RC[30]+RC[31]+RC[32]+RC[33]+RC[34]+RC[35]+RC[36]+RC[37] -> 5253090 | G347: =RC[17]+RC[18]++RC[19]+RC[20]+RC[21]+RC[38]+RC[39]+RC[41] -> 0 | H347: 0 | I347: 0 | J347: =RC[-2]+RC[-1] -> 0 | K347: 0 | L347: 680000 | M347: 298253 | N347: =RC[15]+RC[16]+RC[17]+RC[18]+RC[19]+RC[20] -> 299250 | O347: 0 | P347: 0 | Q347: 6530593 | R347: 227240 | S347: 42608 | T347: 28405 | U347: 62323.4 | V347: 0 | W347: 6170016.5999999996 | X347: 0 | Y347: 0 | Z347: 0 | AA347: 0 | AB347: 0 | AC347: 0 | AD347: 0 | AE347: 0 | AF347: 0 | AG347: 0 | AH347: 299250 | AI347: 5253090 | AJ347: 0 | AK347: 0 | AL347: 0 | AM347: 0 | AN347: 0 | AO347: 0 | AP347: 0 | AQ347: 0 | AR347: =1 -> 1 | AS347: 0 | AT347: 0 | AU347: =RC[-30]-RC[-29]-RC[-28]-RC[-27]-RC[-26]-RC[-25] -> 6170016.5999999996 | AV347: 0 | AW347: =RC[1]-RC[2] -> 99750 | AX347: 299250 | AY347: 199500 | AZ347: =RC[-46] -> 5253090 | BA347: =RC[-46] -> 0 | BB347: =RC[-46] -> 0 | BC347: =RC[-46] -> 0 | BD347: =RC[-46] -> 0 | BE347: =RC[-46] -> 0 | BF347: =RC[-46] -> 680000 | BG347: =RC[-46] -> 298253 | BH347: =RC[-46] -> 299250 | BI347: =RC[-46] -> 0 | BJ347: =RC[-46] -> 0 | BK347: =RC[-46] -> 6530593 | BL347: =RC[-46] -> 227240 | BM347: =RC[-46] -> 42608 | BN347: =RC[-46] -> 28405 | BO347: =RC[-46] -> 62323.4 | BP347: =RC[-46] -> 0 | BQ347: =RC[-46] -> 6170016.5999999996 | BR347: =RC[-46] -> 0 | BS347: =RC[-46] -> 0 | BT347: =RC[-46] -> 0 | BU347: =RC[-46] -> 0 | BV347: =RC[-46] -> 0 | BW347: =RC[-46] -> 0 | BX347: =RC[-46] -> 0 | BY347: =RC[-46] -> 0 | BZ347: =RC[-46] -> 0 | CA347: =RC[-46] -> 0 | CB347: =RC[-46] -> 299250 | CC347: =RC[-46] -> 5253090 | CD347: =RC[-46] -> 0 | CE347: =RC[-46] -> 0 | CF347: =RC[-46] -> 0 | CG347: =RC[-46] -> 0 | CH347: =RC[-46] -> 0 | CI347: =RC[-46] -> 0 | CJ347: =RC[-46] -> 0 | CK347: =RC[-46] -> 0 | CL347: =RC[-46] -> 1 | CM347: =RC[-46] -> 0 | CN347: =RC[-46] -> 0 | CO347: =RC[-46] -> 6170016.5999999996 | CP347: =RC[-46] -> 0 | CQ347: =RC[-46] -> 99750 | CR347: =RC[-46] -> 299250 | CS347: =RC[-46] -> 199500
A348: 108 | B348: 010729 | C348: Nguyễn Thanh Quyết | D348: NV Lái xe - VHTTB | E348: 10523640518015 | F348: =RC[29]+RC[30]+RC[31]+RC[32]+RC[33]+RC[34]+RC[35]+RC[36]+RC[37] -> 5253090 | G348: =RC[17]+RC[18]++RC[19]+RC[20]+RC[21]+RC[38]+RC[39]+RC[41] -> 0 | H348: 0 | I348: 0 | J348: =RC[-2]+RC[-1] -> 0 | K348: 0 | L348: 680000 | M348: 298253 | N348: =RC[15]+RC[16]+RC[17]+RC[18]+RC[19]+RC[20] -> 299250 | O348: 0 | P348: 0 | Q348: 6530593 | R348: 227240 | S348: 42608 | T348: 28405 | U348: 62323.4 | V348: 0 | W348: 6170016.5999999996 | X348: 0 | Y348: 0 | Z348: 0 | AA348: 0 | AB348: 0 | AC348: 0 | AD348: 0 | AE348: 0 | AF348: 0 | AG348: 0 | AH348: 299250 | AI348: 5253090 | AJ348: 0 | AK348: 0 | AL348: 0 | AM348: 0 | AN348: 0 | AO348: 0 | AP348: 0 | AQ348: 0 | AR348: =1 -> 1 | AS348: 0 | AT348: 0 | AU348: =RC[-30]-RC[-29]-RC[-28]-RC[-27]-RC[-26]-RC[-25] -> 6170016.5999999996 | AV348: 0 | AW348: =RC[1]-RC[2] -> 99750 | AX348: 299250 | AY348: 199500 | AZ348: =RC[-46] -> 5253090 | BA348: =RC[-46] -> 0 | BB348: =RC[-46] -> 0 | BC348: =RC[-46] -> 0 | BD348: =RC[-46] -> 0 | BE348: =RC[-46] -> 0 | BF348: =RC[-46] -> 680000 | BG348: =RC[-46] -> 298253 | BH348: =RC[-46] -> 299250 | BI348: =RC[-46] -> 0 | BJ348: =RC[-46] -> 0 | BK348: =RC[-46] -> 6530593 | BL348: =RC[-46] -> 227240 | BM348: =RC[-46] -> 42608 | BN348: =RC[-46] -> 28405 | BO348: =RC[-46] -> 62323.4 | BP348: =RC[-46] -> 0 | BQ348: =RC[-46] -> 6170016.5999999996 | BR348: =RC[-46] -> 0 | BS348: =RC[-46] -> 0 | BT348: =RC[-46] -> 0 | BU348: =RC[-46] -> 0 | BV348: =RC[-46] -> 0 | BW348: =RC[-46] -> 0 | BX348: =RC[-46] -> 0 | BY348: =RC[-46] -> 0 | BZ348: =RC[-46] -> 0 | CA348: =RC[-46] -> 0 | CB348: =RC[-46] -> 299250 | CC348: =RC[-46] -> 5253090 | CD348: =RC[-46] -> 0 | CE348: =RC[-46] -> 0 | CF348: =RC[-46] -> 0 | CG348: =RC[-46] -> 0 | CH348: =RC[-46] -> 0 | CI348: =RC[-46] -> 0 | CJ348: =RC[-46] -> 0 | CK348: =RC[-46] -> 0 | CL348: =RC[-46] -> 1 | CM348: =RC[-46] -> 0 | CN348: =RC[-46] -> 0 | CO348: =RC[-46] -> 6170016.5999999996 | CP348: =RC[-46] -> 0 | CQ348: =RC[-46] -> 99750 | CR348: =RC[-46] -> 299250 | CS348: =RC[-46] -> 199500
A349: 109 | B349: 010730 | C349: Nguyễn Thanh Bình | D349: NV Lái xe - VHTTB | E349: 10520003287019 | F349: =RC[29]+RC[30]+RC[31]+RC[32]+RC[33]+RC[34]+RC[35]+RC[36]+RC[37] -> 6245340 | G349: =RC[17]+RC[18]++RC[19]+RC[20]+RC[21]+RC[38]+RC[39]+RC[41] -> 0 | H349: 0 | I349: 0 | J349: =RC[-2]+RC[-1] -> 0 | K349: 0 | L349: 680000 | M349: 342930 | N349: =RC[15]+RC[16]+RC[17]+RC[18]+RC[19]+RC[20] -> 344077 | O349: 0 | P349: 0 | Q349: 7612347 | R349: 261280 | S349: 48990 | T349: 32660 | U349: 72694.17 | V349: 0 | W349: 7196722.8300000001 | X349: 0 | Y349: 0 | Z349: 0 | AA349: 0 | AB349: 0 | AC349: 0 | AD349: 0 | AE349: 0 | AF349: 0 | AG349: 0 | AH349: 344077 | AI349: 6245340 | AJ349: 0 | AK349: 0 | AL349: 0 | AM349: 0 | AN349: 0 | AO349: 0 | AP349: 0 | AQ349: 0 | AR349: =1 -> 1 | AS349: 0 | AT349: 0 | AU349: =RC[-30]-RC[-29]-RC[-28]-RC[-27]-RC[-26]-RC[-25] -> 7196722.8300000001 | AV349: 0 | AW349: =RC[1]-RC[2] -> 114692.33300000001 | AX349: 344077 | AY349: 229384.66699999999 | AZ349: =RC[-46] -> 6245340 | BA349: =RC[-46] -> 0 | BB349: =RC[-46] -> 0 | BC349: =RC[-46] -> 0 | BD349: =RC[-46] -> 0 | BE349: =RC[-46] -> 0 | BF349: =RC[-46] -> 680000 | BG349: =RC[-46] -> 342930 | BH349: =RC[-46] -> 344077 | BI349: =RC[-46] -> 0 | BJ349: =RC[-46] -> 0 | BK349: =RC[-46] -> 7612347 | BL349: =RC[-46] -> 261280 | BM349: =RC[-46] -> 48990 | BN349: =RC[-46] -> 32660 | BO349: =RC[-46] -> 72694.17 | BP349: =RC[-46] -> 0 | BQ349: =RC[-46] -> 7196722.8300000001 | BR349: =RC[-46] -> 0 | BS349: =RC[-46] -> 0 | BT349: =RC[-46] -> 0 | BU349: =RC[-46] -> 0 | BV349: =RC[-46] -> 0 | BW349: =RC[-46] -> 0 | BX349: =RC[-46] -> 0 | BY349: =RC[-46] -> 0 | BZ349: =RC[-46] -> 0 | CA349: =RC[-46] -> 0 | CB349: =RC[-46] -> 344077 | CC349: =RC[-46] -> 6245340 | CD349: =RC[-46] -> 0 | CE349: =RC[-46] -> 0 | CF349: =RC[-46] -> 0 | CG349: =RC[-46] -> 0 | CH349: =RC[-46] -> 0 | CI349: =RC[-46] -> 0 | CJ349: =RC[-46] -> 0 | CK349: =RC[-46] -> 0 | CL349: =RC[-46] -> 1 | CM349: =RC[-46] -> 0 | CN349: =RC[-46] -> 0 | CO349: =RC[-46] -> 7196722.8300000001 | CP349: =RC[-46] -> 0 | CQ349: =RC[-46] -> 114692.33300000001 | CR349: =RC[-46] -> 344077 | CS349: =RC[-46] -> 229384.66699999999
A350: 110 | B350: 010731 | C350: Vũ Tiến Lịch | D350: NV Lái xe - VHTTB | E350: 10523640500019 | F350: =RC[29]+RC[30]+RC[31]+RC[32]+RC[33]+RC[34]+RC[35]+RC[36]+RC[37] -> 5253090 | G350: =RC[17]+RC[18]++RC[19]+RC[20]+RC[21]+RC[38]+RC[39]+RC[41] -> 0 | H350: 0 | I350: 0 | J350: =RC[-2]+RC[-1] -> 0 | K350: 0 | L350: 680000 | M350: 298253 | N350: =RC[15]+RC[16]+RC[17]+RC[18]+RC[19]+RC[20] -> 299250 | O350: 0 | P350: 0 | Q350: 6530593 | R350: 227240 | S350: 42608 | T350: 28405 | U350: 62323.4 | V350: 0 | W350: 6170016.5999999996 | X350: 0 | Y350: 0 | Z350: 0 | AA350: 0 | AB350: 0 | AC350: 0 | AD350: 0 | AE350: 0 | AF350: 0 | AG350: 0 | AH350: 299250 | AI350: 5253090 | AJ350: 0 | AK350: 0 | AL350: 0 | AM350: 0 | AN350: 0 | AO350: 0 | AP350: 0 | AQ350: 0 | AR350: =1 -> 1 | AS350: 0 | AT350: 0 | AU350: =RC[-30]-RC[-29]-RC[-28]-RC[-27]-RC[-26]-RC[-25] -> 6170016.5999999996 | AV350: 0 | AW350: =RC[1]-RC[2] -> 99750 | AX350: 299250 | AY350: 199500 | AZ350: =RC[-46] -> 5253090 | BA350: =RC[-46] -> 0 | BB350: =RC[-46] -> 0 | BC350: =RC[-46] -> 0 | BD350: =RC[-46] -> 0 | BE350: =RC[-46] -> 0 | BF350: =RC[-46] -> 680000 | BG350: =RC[-46] -> 298253 | BH350: =RC[-46] -> 299250 | BI350: =RC[-46] -> 0 | BJ350: =RC[-46] -> 0 | BK350: =RC[-46] -> 6530593 | BL350: =RC[-46] -> 227240 | BM350: =RC[-46] -> 42608 | BN350: =RC[-46] -> 28405 | BO350: =RC[-46] -> 62323.4 | BP350: =RC[-46] -> 0 | BQ350: =RC[-46] -> 6170016.5999999996 | BR350: =RC[-46] -> 0 | BS350: =RC[-46] -> 0 | BT350: =RC[-46] -> 0 | BU350: =RC[-46] -> 0 | BV350: =RC[-46] -> 0 | BW350: =RC[-46] -> 0 | BX350: =RC[-46] -> 0 | BY350: =RC[-46] -> 0 | BZ350: =RC[-46] -> 0 | CA350: =RC[-46] -> 0 | CB350: =RC[-46] -> 299250 | CC350: =RC[-46] -> 5253090 | CD350: =RC[-46] -> 0 | CE350: =RC[-46] -> 0 | CF350: =RC[-46] -> 0 | CG350: =RC[-46] -> 0 | CH350: =RC[-46] -> 0 | CI350: =RC[-46] -> 0 | CJ350: =RC[-46] -> 0 | CK350: =RC[-46] -> 0 | CL350: =RC[-46] -> 1 | CM350: =RC[-46] -> 0 | CN350: =RC[-46] -> 0 | CO350: =RC[-46] -> 6170016.5999999996 | CP350: =RC[-46] -> 0 | CQ350: =RC[-46] -> 99750 | CR350: =RC[-46] -> 299250 | CS350: =RC[-46] -> 199500
A351: 111 | B351: 010732 | C351: Nguyễn Xuân Hợi | D351: NV Lái xe - VHTTB | E351: 10520153811018 | F351: =RC[29]+RC[30]+RC[31]+RC[32]+RC[33]+RC[34]+RC[35]+RC[36]+RC[37] -> 5194722 | G351: =RC[17]+RC[18]++RC[19]+RC[20]+RC[21]+RC[38]+RC[39]+RC[41] -> 0 | H351: 0 | I351: 0 | J351: =RC[-2]+RC[-1] -> 0 | K351: 0 | L351: 680000 | M351: 298253 | N351: =RC[15]+RC[16]+RC[17]+RC[18]+RC[19]+RC[20] -> 299250 | O351: 0 | P351: 0 | Q351: 6472225 | R351: 227240 | S351: 42608 | T351: 28405 | U351: 61739.72 | V351: 0 | W351: 6112232.2800000003 | X351: 0 | Y351: 0 | Z351: 0 | AA351: 0 | AB351: 0 | AC351: 0 | AD351: 0 | AE351: 0 | AF351: 0 | AG351: 0 | AH351: 299250 | AI351: 5194722 | AJ351: 0 | AK351: 0 | AL351: 0 | AM351: 0 | AN351: 0 | AO351: 0 | AP351: 0 | AQ351: 0 | AR351: =1 -> 1 | AS351: 0 | AT351: 0 | AU351: =RC[-30]-RC[-29]-RC[-28]-RC[-27]-RC[-26]-RC[-25] -> 6112232.2800000003 | AV351: 0 | AW351: =RC[1]-RC[2] -> 99750 | AX351: 299250 | AY351: 199500 | AZ351: =RC[-46] -> 5194722 | BA351: =RC[-46] -> 0 | BB351: =RC[-46] -> 0 | BC351: =RC[-46] -> 0 | BD351: =RC[-46] -> 0 | BE351: =RC[-46] -> 0 | BF351: =RC[-46] -> 680000 | BG351: =RC[-46] -> 298253 | BH351: =RC[-46] -> 299250 | BI351: =RC[-46] -> 0 | BJ351: =RC[-46] -> 0 | BK351: =RC[-46] -> 6472225 | BL351: =RC[-46] -> 227240 | BM351: =RC[-46] -> 42608 | BN351: =RC[-46] -> 28405 | BO351: =RC[-46] -> 61739.72 | BP351: =RC[-46] -> 0 | BQ351: =RC[-46] -> 6112232.2800000003 | BR351: =RC[-46] -> 0 | BS351: =RC[-46] -> 0 | BT351: =RC[-46] -> 0 | BU351: =RC[-46] -> 0 | BV351: =RC[-46] -> 0 | BW351: =RC[-46] -> 0 | BX351: =RC[-46] -> 0 | BY351: =RC[-46] -> 0 | BZ351: =RC[-46] -> 0 | CA351: =RC[-46] -> 0 | CB351: =RC[-46] -> 299250 | CC351: =RC[-46] -> 5194722 | CD351: =RC[-46] -> 0 | CE351: =RC[-46] -> 0 | CF351: =RC[-46] -> 0 | CG351: =RC[-46] -> 0 | CH351: =RC[-46] -> 0 | CI351: =RC[-46] -> 0 | CJ351: =RC[-46] -> 0 | CK351: =RC[-46] -> 0 | CL351: =RC[-46] -> 1 | CM351: =RC[-46] -> 0 | CN351: =RC[-46] -> 0 | CO351: =RC[-46] -> 6112232.2800000003 | CP351: =RC[-46] -> 0 | CQ351: =RC[-46] -> 99750 | CR351: =RC[-46] -> 299250 | CS351: =RC[-46] -> 199500
A352: 112 | B352: 010733 | C352: Nguyễn Văn Sơn | D352: NV Lái xe - VHTTB | E352: 10523499015012 | F352: =RC[29]+RC[30]+RC[31]+RC[32]+RC[33]+RC[34]+RC[35]+RC[36]+RC[37] -> 5194722 | G352: =RC[17]+RC[18]++RC[19]+RC[20]+RC[21]+RC[38]+RC[39]+RC[41] -> 0 | H352: 0 | I352: 0 | J352: =RC[-2]+RC[-1] -> 0 | K352: 0 | L352: 680000 | M352: 298253 | N352: =RC[15]+RC[16]+RC[17]+RC[18]+RC[19]+RC[20] -> 299250 | O352: 0 | P352: 0 | Q352: 6472225 | R352: 227240 | S352: 42608 | T352: 28405 | U352: 61739.72 | V352: 0 | W352: 6112232.2800000003 | X352: 0 | Y352: 0 | Z352: 0 | AA352: 0 | AB352: 0 | AC352: 0 | AD352: 0 | AE352: 0 | AF352: 0 | AG352: 0 | AH352: 299250 | AI352: 5194722 | AJ352: 0 | AK352: 0 | AL352: 0 | AM352: 0 | AN352: 0 | AO352: 0 | AP352: 0 | AQ352: 0 | AR352: =1 -> 1 | AS352: 0 | AT352: 0 | AU352: =RC[-30]-RC[-29]-RC[-28]-RC[-27]-RC[-26]-RC[-25] -> 6112232.2800000003 | AV352: 0 | AW352: =RC[1]-RC[2] -> 99750 | AX352: 299250 | AY352: 199500 | AZ352: =RC[-46] -> 5194722 | BA352: =RC[-46] -> 0 | BB352: =RC[-46] -> 0 | BC352: =RC[-46] -> 0 | BD352: =RC[-46] -> 0 | BE352: =RC[-46] -> 0 | BF352: =RC[-46] -> 680000 | BG352: =RC[-46] -> 298253 | BH352: =RC[-46] -> 299250 | BI352: =RC[-46] -> 0 | BJ352: =RC[-46] -> 0 | BK352: =RC[-46] -> 6472225 | BL352: =RC[-46] -> 227240 | BM352: =RC[-46] -> 42608 | BN352: =RC[-46] -> 28405 | BO352: =RC[-46] -> 61739.72 | BP352: =RC[-46] -> 0 | BQ352: =RC[-46] -> 6112232.2800000003 | BR352: =RC[-46] -> 0 | BS352: =RC[-46] -> 0 | BT352: =RC[-46] -> 0 | BU352: =RC[-46] -> 0 | BV352: =RC[-46] -> 0 | BW352: =RC[-46] -> 0 | BX352: =RC[-46] -> 0 | BY352: =RC[-46] -> 0 | BZ352: =RC[-46] -> 0 | CA352: =RC[-46] -> 0 | CB352: =RC[-46] -> 299250 | CC352: =RC[-46] -> 5194722 | CD352: =RC[-46] -> 0 | CE352: =RC[-46] -> 0 | CF352: =RC[-46] -> 0 | CG352: =RC[-46] -> 0 | CH352: =RC[-46] -> 0 | CI352: =RC[-46] -> 0 | CJ352: =RC[-46] -> 0 | CK352: =RC[-46] -> 0 | CL352: =RC[-46] -> 1 | CM352: =RC[-46] -> 0 | CN352: =RC[-46] -> 0 | CO352: =RC[-46] -> 6112232.2800000003 | CP352: =RC[-46] -> 0 | CQ352: =RC[-46] -> 99750 | CR352: =RC[-46] -> 299250 | CS352: =RC[-46] -> 199500
A353: 113 | B353: 011132 | C353: Nguyễn Hữu Chức | D353: NV Lái xe - VHTTB | E353: 19026970114017 | F353: =RC[29]+RC[30]+RC[31]+RC[32]+RC[33]+RC[34]+RC[35]+RC[36]+RC[37] -> 4902884 | G353: =RC[17]+RC[18]++RC[19]+RC[20]+RC[21]+RC[38]+RC[39]+RC[41] -> 0 | H353: 0 | I353: 0 | J353: =RC[-2]+RC[-1] -> 0 | K353: 0 | L353: 680000 | M353: 259613 | N353: =RC[15]+RC[16]+RC[17]+RC[18]+RC[19]+RC[20] -> 260481 | O353: 0 | P353: 0 | Q353: 6102978 | R353: 197800 | S353: 37088 | T353: 24725 | U353: 58433.65 | V353: 0 | W353: 5784931.3499999996 | X353: 0 | Y353: 0 | Z353: 0 | AA353: 0 | AB353: 0 | AC353: 0 | AD353: 0 | AE353: 0 | AF353: 0 | AG353: 0 | AH353: 260481 | AI353: 4902884 | AJ353: 0 | AK353: 0 | AL353: 0 | AM353: 0 | AN353: 0 | AO353: 0 | AP353: 0 | AQ353: 0 | AR353: =1 -> 1 | AS353: 0 | AT353: 0 | AU353: =RC[-30]-RC[-29]-RC[-28]-RC[-27]-RC[-26]-RC[-25] -> 5784931.3499999996 | AV353: 0 | AW353: =RC[1]-RC[2] -> 86827 | AX353: 260481 | AY353: 173654 | AZ353: =RC[-46] -> 4902884 | BA353: =RC[-46] -> 0 | BB353: =RC[-46] -> 0 | BC353: =RC[-46] -> 0 | BD353: =RC[-46] -> 0 | BE353: =RC[-46] -> 0 | BF353: =RC[-46] -> 680000 | BG353: =RC[-46] -> 259613 | BH353: =RC[-46] -> 260481 | BI353: =RC[-46] -> 0 | BJ353: =RC[-46] -> 0 | BK353: =RC[-46] -> 6102978 | BL353: =RC[-46] -> 197800 | BM353: =RC[-46] -> 37088 | BN353: =RC[-46] -> 24725 | BO353: =RC[-46] -> 58433.65 | BP353: =RC[-46] -> 0 | BQ353: =RC[-46] -> 5784931.3499999996 | BR353: =RC[-46] -> 0 | BS353: =RC[-46] -> 0 | BT353: =RC[-46] -> 0 | BU353: =RC[-46] -> 0 | BV353: =RC[-46] -> 0 | BW353: =RC[-46] -> 0 | BX353: =RC[-46] -> 0 | BY353: =RC[-46] -> 0 | BZ353: =RC[-46] -> 0 | CA353: =RC[-46] -> 0 | CB353: =RC[-46] -> 260481 | CC353: =RC[-46] -> 4902884 | CD353: =RC[-46] -> 0 | CE353: =RC[-46] -> 0 | CF353: =RC[-46] -> 0 | CG353: =RC[-46] -> 0 | CH353: =RC[-46] -> 0 | CI353: =RC[-46] -> 0 | CJ353: =RC[-46] -> 0 | CK353: =RC[-46] -> 0 | CL353: =RC[-46] -> 1 | CM353: =RC[-46] -> 0 | CN353: =RC[-46] -> 0 | CO353: =RC[-46] -> 5784931.3499999996 | CP353: =RC[-46] -> 0 | CQ353: =RC[-46] -> 86827 | CR353: =RC[-46] -> 260481 | CS353: =RC[-46] -> 173654
A354: 114 | B354: 011133 | C354: Phù Định | D354: NV Lái xe - VHTTB | E354: 11521309936010 | F354: =RC[29]+RC[30]+RC[31]+RC[32]+RC[33]+RC[34]+RC[35]+RC[36]+RC[37] -> 5148028 | G354: =RC[17]+RC[18]++RC[19]+RC[20]+RC[21]+RC[38]+RC[39]+RC[41] -> 0 | H354: 0 | I354: 0 | J354: =RC[-2]+RC[-1] -> 0 | K354: 0 | L354: 680000 | M354: 259613 | N354: =RC[15]+RC[16]+RC[17]+RC[18]+RC[19]+RC[20] -> 260481 | O354: 0 | P354: 0 | Q354: 6348122 | R354: 197800 | S354: 37088 | T354: 24725 | U354: 60885.09 | V354: 0 | W354: 6027623.9100000001 | X354: 0 | Y354: 0 | Z354: 0 | AA354: 0 | AB354: 0 | AC354: 0 | AD354: 0 | AE354: 0 | AF354: 0 | AG354: 0 | AH354: 260481 | AI354: 5148028 | AJ354: 0 | AK354: 0 | AL354: 0 | AM354: 0 | AN354: 0 | AO354: 0 | AP354: 0 | AQ354: 0 | AR354: =1 -> 1 | AS354: 0 | AT354: 0 | AU354: =RC[-30]-RC[-29]-RC[-28]-RC[-27]-RC[-26]-RC[-25] -> 6027623.9100000001 | AV354: 0 | AW354: =RC[1]-RC[2] -> 86827 | AX354: 260481 | AY354: 173654 | AZ354: =RC[-46] -> 5148028 | BA354: =RC[-46] -> 0 | BB354: =RC[-46] -> 0 | BC354: =RC[-46] -> 0 | BD354: =RC[-46] -> 0 | BE354: =RC[-46] -> 0 | BF354: =RC[-46] -> 680000 | BG354: =RC[-46] -> 259613 | BH354: =RC[-46] -> 260481 | BI354: =RC[-46] -> 0 | BJ354: =RC[-46] -> 0 | BK354: =RC[-46] -> 6348122 | BL354: =RC[-46] -> 197800 | BM354: =RC[-46] -> 37088 | BN354: =RC[-46] -> 24725 | BO354: =RC[-46] -> 60885.09 | BP354: =RC[-46] -> 0 | BQ354: =RC[-46] -> 6027623.9100000001 | BR354: =RC[-46] -> 0 | BS354: =RC[-46] -> 0 | BT354: =RC[-46] -> 0 | BU354: =RC[-46] -> 0 | BV354: =RC[-46] -> 0 | BW354: =RC[-46] -> 0 | BX354: =RC[-46] -> 0 | BY354: =RC[-46] -> 0 | BZ354: =RC[-46] -> 0 | CA354: =RC[-46] -> 0 | CB354: =RC[-46] -> 260481 | CC354: =RC[-46] -> 5148028 | CD354: =RC[-46] -> 0 | CE354: =RC[-46] -> 0 | CF354: =RC[-46] -> 0 | CG354: =RC[-46] -> 0 | CH354: =RC[-46] -> 0 | CI354: =RC[-46] -> 0 | CJ354: =RC[-46] -> 0 | CK354: =RC[-46] -> 0 | CL354: =RC[-46] -> 1 | CM354: =RC[-46] -> 0 | CN354: =RC[-46] -> 0 | CO354: =RC[-46] -> 6027623.9100000001 | CP354: =RC[-46] -> 0 | CQ354: =RC[-46] -> 86827 | CR354: =RC[-46] -> 260481 | CS354: =RC[-46] -> 173654
A355: 115 | B355: 011134 | C355: Hồ Ngọc Hà | D355: NV Lái xe - VHTTB | E355: 19026970115013 | F355: =RC[29]+RC[30]+RC[31]+RC[32]+RC[33]+RC[34]+RC[35]+RC[36]+RC[37] -> 4147022 | G355: =RC[17]+RC[18]++RC[19]+RC[20]+RC[21]+RC[38]+RC[39]+RC[41] -> 347308 | H355: 0 | I355: 0 | J355: =RC[-2]+RC[-1] -> 0 | K355: 0 | L355: 575385 | M355: 259613 | N355: =RC[15]+RC[16]+RC[17]+RC[18]+RC[19]+RC[20] -> 260481 | O355: 0 | P355: 0 | Q355: 5589809 | R355: 197800 | S355: 37088 | T355: 24725 | U355: 53301.96 | V355: 0 | W355: 5276894.04 | X355: 0 | Y355: 347308 | Z355: 0 | AA355: 0 | AB355: 0 | AC355: 0 | AD355: 0 | AE355: 0 | AF355: 0 | AG355: 0 | AH355: 260481 | AI355: 4147022 | AJ355: 0 | AK355: 0 | AL355: 0 | AM355: 0 | AN355: 0 | AO355: 0 | AP355: 0 | AQ355: 0 | AR355: =1 -> 1 | AS355: 0 | AT355: 0 | AU355: =RC[-30]-RC[-29]-RC[-28]-RC[-27]-RC[-26]-RC[-25] -> 5276894.04 | AV355: 0 | AW355: =RC[1]-RC[2] -> 86827 | AX355: 260481 | AY355: 173654 | AZ355: =RC[-46] -> 4147022 | BA355: =RC[-46] -> 347308 | BB355: =RC[-46] -> 0 | BC355: =RC[-46] -> 0 | BD355: =RC[-46] -> 0 | BE355: =RC[-46] -> 0 | BF355: =RC[-46] -> 575385 | BG355: =RC[-46] -> 259613 | BH355: =RC[-46] -> 260481 | BI355: =RC[-46] -> 0 | BJ355: =RC[-46] -> 0 | BK355: =RC[-46] -> 5589809 | BL355: =RC[-46] -> 197800 | BM355: =RC[-46] -> 37088 | BN355: =RC[-46] -> 24725 | BO355: =RC[-46] -> 53301.96 | BP355: =RC[-46] -> 0 | BQ355: =RC[-46] -> 5276894.04 | BR355: =RC[-46] -> 0 | BS355: =RC[-46] -> 347308 | BT355: =RC[-46] -> 0 | BU355: =RC[-46] -> 0 | BV355: =RC[-46] -> 0 | BW355: =RC[-46] -> 0 | BX355: =RC[-46] -> 0 | BY355: =RC[-46] -> 0 | BZ355: =RC[-46] -> 0 | CA355: =RC[-46] -> 0 | CB355: =RC[-46] -> 260481 | CC355: =RC[-46] -> 4147022 | CD355: =RC[-46] -> 0 | CE355: =RC[-46] -> 0 | CF355: =RC[-46] -> 0 | CG355: =RC[-46] -> 0 | CH355: =RC[-46] -> 0 | CI355: =RC[-46] -> 0 | CJ355: =RC[-46] -> 0 | CK355: =RC[-46] -> 0 | CL355: =RC[-46] -> 1 | CM355: =RC[-46] -> 0 | CN355: =RC[-46] -> 0 | CO355: =RC[-46] -> 5276894.04 | CP355: =RC[-46] -> 0 | CQ355: =RC[-46] -> 86827 | CR355: =RC[-46] -> 260481 | CS355: =RC[-46] -> 173654
A356: 116 | B356: 011135 | C356: Nguyễn Đắc Thanh | D356: NV Lái xe - VHTTB | E356: 19026970116011 | F356: =RC[29]+RC[30]+RC[31]+RC[32]+RC[33]+RC[34]+RC[35]+RC[36]+RC[37] -> 4902884 | G356: =RC[17]+RC[18]++RC[19]+RC[20]+RC[21]+RC[38]+RC[39]+RC[41] -> 0 | H356: 0 | I356: 0 | J356: =RC[-2]+RC[-1] -> 0 | K356: 0 | L356: 680000 | M356: 259613 | N356: =RC[15]+RC[16]+RC[17]+RC[18]+RC[19]+RC[20] -> 260481 | O356: 0 | P356: 0 | Q356: 6102978 | R356: 197800 | S356: 37088 | T356: 24725 | U356: 58433.65 | V356: 0 | W356: 5784931.3499999996 | X356: 0 | Y356: 0 | Z356: 0 | AA356: 0 | AB356: 0 | AC356: 0 | AD356: 0 | AE356: 0 | AF356: 0 | AG356: 0 | AH356: 260481 | AI356: 4902884 | AJ356: 0 | AK356: 0 | AL356: 0 | AM356: 0 | AN356: 0 | AO356: 0 | AP356: 0 | AQ356: 0 | AR356: =1 -> 1 | AS356: 0 | AT356: 0 | AU356: =RC[-30]-RC[-29]-RC[-28]-RC[-27]-RC[-26]-RC[-25] -> 5784931.3499999996 | AV356: 0 | AW356: =RC[1]-RC[2] -> 86827 | AX356: 260481 | AY356: 173654 | AZ356: =RC[-46] -> 4902884 | BA356: =RC[-46] -> 0 | BB356: =RC[-46] -> 0 | BC356: =RC[-46] -> 0 | BD356: =RC[-46] -> 0 | BE356: =RC[-46] -> 0 | BF356: =RC[-46] -> 680000 | BG356: =RC[-46] -> 259613 | BH356: =RC[-46] -> 260481 | BI356: =RC[-46] -> 0 | BJ356: =RC[-46] -> 0 | BK356: =RC[-46] -> 6102978 | BL356: =RC[-46] -> 197800 | BM356: =RC[-46] -> 37088 | BN356: =RC[-46] -> 24725 | BO356: =RC[-46] -> 58433.65 | BP356: =RC[-46] -> 0 | BQ356: =RC[-46] -> 5784931.3499999996 | BR356: =RC[-46] -> 0 | BS356: =RC[-46] -> 0 | BT356: =RC[-46] -> 0 | BU356: =RC[-46] -> 0 | BV356: =RC[-46] -> 0 | BW356: =RC[-46] -> 0 | BX356: =RC[-46] -> 0 | BY356: =RC[-46] -> 0 | BZ356: =RC[-46] -> 0 | CA356: =RC[-46] -> 0 | CB356: =RC[-46] -> 260481 | CC356: =RC[-46] -> 4902884 | CD356: =RC[-46] -> 0 | CE356: =RC[-46] -> 0 | CF356: =RC[-46] -> 0 | CG356: =RC[-46] -> 0 | CH356: =RC[-46] -> 0 | CI356: =RC[-46] -> 0 | CJ356: =RC[-46] -> 0 | CK356: =RC[-46] -> 0 | CL356: =RC[-46] -> 1 | CM356: =RC[-46] -> 0 | CN356: =RC[-46] -> 0 | CO356: =RC[-46] -> 5784931.3499999996 | CP356: =RC[-46] -> 0 | CQ356: =RC[-46] -> 86827 | CR356: =RC[-46] -> 260481 | CS356: =RC[-46] -> 173654
A357: 117 | B357: 011136 | C357: Nguyễn Huy Dũng | D357: NV Lái xe - VHTTB | E357: 19026970117016 | F357: =RC[29]+RC[30]+RC[31]+RC[32]+RC[33]+RC[34]+RC[35]+RC[36]+RC[37] -> 4657739 | G357: =RC[17]+RC[18]++RC[19]+RC[20]+RC[21]+RC[38]+RC[39]+RC[41] -> 0 | H357: 0 | I357: 0 | J357: =RC[-2]+RC[-1] -> 0 | K357: 0 | L357: 680000 | M357: 259613 | N357: =RC[15]+RC[16]+RC[17]+RC[18]+RC[19]+RC[20] -> 260481 | O357: 0 | P357: 0 | Q357: 5857833 | R357: 197800 | S357: 37088 | T357: 24725 | U357: 55982.2 | V357: 0 | W357: 5542237.7999999998 | X357: 0 | Y357: 0 | Z357: 0 | AA357: 0 | AB357: 0 | AC357: 0 | AD357: 0 | AE357: 0 | AF357: 0 | AG357: 0 | AH357: 260481 | AI357: 4657739 | AJ357: 0 | AK357: 0 | AL357: 0 | AM357: 0 | AN357: 0 | AO357: 0 | AP357: 0 | AQ357: 0 | AR357: =1 -> 1 | AS357: 0 | AT357: 0 | AU357: =RC[-30]-RC[-29]-RC[-28]-RC[-27]-RC[-26]-RC[-25] -> 5542237.7999999998 | AV357: 0 | AW357: =RC[1]-RC[2] -> 86827 | AX357: 260481 | AY357: 173654 | AZ357: =RC[-46] -> 4657739 | BA357: =RC[-46] -> 0 | BB357: =RC[-46] -> 0 | BC357: =RC[-46] -> 0 | BD357: =RC[-46] -> 0 | BE357: =RC[-46] -> 0 | BF357: =RC[-46] -> 680000 | BG357: =RC[-46] -> 259613 | BH357: =RC[-46] -> 260481 | BI357: =RC[-46] -> 0 | BJ357: =RC[-46] -> 0 | BK357: =RC[-46] -> 5857833 | BL357: =RC[-46] -> 197800 | BM357: =RC[-46] -> 37088 | BN357: =RC[-46] -> 24725 | BO357: =RC[-46] -> 55982.2 | BP357: =RC[-46] -> 0 | BQ357: =RC[-46] -> 5542237.7999999998 | BR357: =RC[-46] -> 0 | BS357: =RC[-46] -> 0 | BT357: =RC[-46] -> 0 | BU357: =RC[-46] -> 0 | BV357: =RC[-46] -> 0 | BW357: =RC[-46] -> 0 | BX357: =RC[-46] -> 0 | BY357: =RC[-46] -> 0 | BZ357: =RC[-46] -> 0 | CA357: =RC[-46] -> 0 | CB357: =RC[-46] -> 260481 | CC357: =RC[-46] -> 4657739 | CD357: =RC[-46] -> 0 | CE357: =RC[-46] -> 0 | CF357: =RC[-46] -> 0 | CG357: =RC[-46] -> 0 | CH357: =RC[-46] -> 0 | CI357: =RC[-46] -> 0 | CJ357: =RC[-46] -> 0 | CK357: =RC[-46] -> 0 | CL357: =RC[-46] -> 1 | CM357: =RC[-46] -> 0 | CN357: =RC[-46] -> 0 | CO357: =RC[-46] -> 5542237.7999999998 | CP357: =RC[-46] -> 0 | CQ357: =RC[-46] -> 86827 | CR357: =RC[-46] -> 260481 | CS357: =RC[-46] -> 173654
A358: 118 | B358: 011137 | C358: Nguyễn Văn Phong | D358: NV Lái xe - VHTTB | E358: 19027009697019 | F358: =RC[29]+RC[30]+RC[31]+RC[32]+RC[33]+RC[34]+RC[35]+RC[36]+RC[37] -> 4167451 | G358: =RC[17]+RC[18]++RC[19]+RC[20]+RC[21]+RC[38]+RC[39]+RC[41] -> 0 | H358: 0 | I358: 0 | J358: =RC[-2]+RC[-1] -> 0 | K358: 0 | L358: 680000 | M358: 259613 | N358: =RC[15]+RC[16]+RC[17]+RC[18]+RC[19]+RC[20] -> 260481 | O358: 0 | P358: 0 | Q358: 5367545 | R358: 197800 | S358: 37088 | T358: 24725 | U358: 51079.32 | V358: 0 | W358: 5056852.68 | X358: 0 | Y358: 0 | Z358: 0 | AA358: 0 | AB358: 0 | AC358: 0 | AD358: 0 | AE358: 0 | AF358: 0 | AG358: 0 | AH358: 260481 | AI358: 4167451 | AJ358: 0 | AK358: 0 | AL358: 0 | AM358: 0 | AN358: 0 | AO358: 0 | AP358: 0 | AQ358: 0 | AR358: =1 -> 1 | AS358: 0 | AT358: 0 | AU358: =RC[-30]-RC[-29]-RC[-28]-RC[-27]-RC[-26]-RC[-25] -> 5056852.68 | AV358: 0 | AW358: =RC[1]-RC[2] -> 86827 | AX358: 260481 | AY358: 173654 | AZ358: =RC[-46] -> 4167451 | BA358: =RC[-46] -> 0 | BB358: =RC[-46] -> 0 | BC358: =RC[-46] -> 0 | BD358: =RC[-46] -> 0 | BE358: =RC[-46] -> 0 | BF358: =RC[-46] -> 680000 | BG358: =RC[-46] -> 259613 | BH358: =RC[-46] -> 260481 | BI358: =RC[-46] -> 0 | BJ358: =RC[-46] -> 0 | BK358: =RC[-46] -> 5367545 | BL358: =RC[-46] -> 197800 | BM358: =RC[-46] -> 37088 | BN358: =RC[-46] -> 24725 | BO358: =RC[-46] -> 51079.32 | BP358: =RC[-46] -> 0 | BQ358: =RC[-46] -> 5056852.68 | BR358: =RC[-46] -> 0 | BS358: =RC[-46] -> 0 | BT358: =RC[-46] -> 0 | BU358: =RC[-46] -> 0 | BV358: =RC[-46] -> 0 | BW358: =RC[-46] -> 0 | BX358: =RC[-46] -> 0 | BY358: =RC[-46] -> 0 | BZ358: =RC[-46] -> 0 | CA358: =RC[-46] -> 0 | CB358: =RC[-46] -> 260481 | CC358: =RC[-46] -> 4167451 | CD358: =RC[-46] -> 0 | CE358: =RC[-46] -> 0 | CF358: =RC[-46] -> 0 | CG358: =RC[-46] -> 0 | CH358: =RC[-46] -> 0 | CI358: =RC[-46] -> 0 | CJ358: =RC[-46] -> 0 | CK358: =RC[-46] -> 0 | CL358: =RC[-46] -> 1 | CM358: =RC[-46] -> 0 | CN358: =RC[-46] -> 0 | CO358: =RC[-46] -> 5056852.68 | CP358: =RC[-46] -> 0 | CQ358: =RC[-46] -> 86827 | CR358: =RC[-46] -> 260481 | CS358: =RC[-46] -> 173654
A359: 119 | B359: 011138 | C359: Phạm Việt Tùng | D359: NV Lái xe - VHTTB | E359: 19026970119019 | F359: =RC[29]+RC[30]+RC[31]+RC[32]+RC[33]+RC[34]+RC[35]+RC[36]+RC[37] -> 4902884 | G359: =RC[17]+RC[18]++RC[19]+RC[20]+RC[21]+RC[38]+RC[39]+RC[41] -> 0 | H359: 0 | I359: 0 | J359: =RC[-2]+RC[-1] -> 0 | K359: 0 | L359: 680000 | M359: 259613 | N359: =RC[15]+RC[16]+RC[17]+RC[18]+RC[19]+RC[20] -> 260481 | O359: 0 | P359: 0 | Q359: 6102978 | R359: 197800 | S359: 37088 | T359: 24725 | U359: 58433.65 | V359: 0 | W359: 5784931.3499999996 | X359: 0 | Y359: 0 | Z359: 0 | AA359: 0 | AB359: 0 | AC359: 0 | AD359: 0 | AE359: 0 | AF359: 0 | AG359: 0 | AH359: 260481 | AI359: 4902884 | AJ359: 0 | AK359: 0 | AL359: 0 | AM359: 0 | AN359: 0 | AO359: 0 | AP359: 0 | AQ359: 0 | AR359: =1 -> 1 | AS359: 0 | AT359: 0 | AU359: =RC[-30]-RC[-29]-RC[-28]-RC[-27]-RC[-26]-RC[-25] -> 5784931.3499999996 | AV359: 0 | AW359: =RC[1]-RC[2] -> 86827 | AX359: 260481 | AY359: 173654 | AZ359: =RC[-46] -> 4902884 | BA359: =RC[-46] -> 0 | BB359: =RC[-46] -> 0 | BC359: =RC[-46] -> 0 | BD359: =RC[-46] -> 0 | BE359: =RC[-46] -> 0 | BF359: =RC[-46] -> 680000 | BG359: =RC[-46] -> 259613 | BH359: =RC[-46] -> 260481 | BI359: =RC[-46] -> 0 | BJ359: =RC[-46] -> 0 | BK359: =RC[-46] -> 6102978 | BL359: =RC[-46] -> 197800 | BM359: =RC[-46] -> 37088 | BN359: =RC[-46] -> 24725 | BO359: =RC[-46] -> 58433.65 | BP359: =RC[-46] -> 0 | BQ359: =RC[-46] -> 5784931.3499999996 | BR359: =RC[-46] -> 0 | BS359: =RC[-46] -> 0 | BT359: =RC[-46] -> 0 | BU359: =RC[-46] -> 0 | BV359: =RC[-46] -> 0 | BW359: =RC[-46] -> 0 | BX359: =RC[-46] -> 0 | BY359: =RC[-46] -> 0 | BZ359: =RC[-46] -> 0 | CA359: =RC[-46] -> 0 | CB359: =RC[-46] -> 260481 | CC359: =RC[-46] -> 4902884 | CD359: =RC[-46] -> 0 | CE359: =RC[-46] -> 0 | CF359: =RC[-46] -> 0 | CG359: =RC[-46] -> 0 | CH359: =RC[-46] -> 0 | CI359: =RC[-46] -> 0 | CJ359: =RC[-46] -> 0 | CK359: =RC[-46] -> 0 | CL359: =RC[-46] -> 1 | CM359: =RC[-46] -> 0 | CN359: =RC[-46] -> 0 | CO359: =RC[-46] -> 5784931.3499999996 | CP359: =RC[-46] -> 0 | CQ359: =RC[-46] -> 86827 | CR359: =RC[-46] -> 260481 | CS359: =RC[-46] -> 173654
A360: 120 | B360: 011139 | C360: Phùng Viết Dũng | D360: NV Lái xe - VHTTB | E360: 19026970120017 | F360: =RC[29]+RC[30]+RC[31]+RC[32]+RC[33]+RC[34]+RC[35]+RC[36]+RC[37] -> 4902884 | G360: =RC[17]+RC[18]++RC[19]+RC[20]+RC[21]+RC[38]+RC[39]+RC[41] -> 0 | H360: 0 | I360: 0 | J360: =RC[-2]+RC[-1] -> 0 | K360: 0 | L360: 680000 | M360: 259613 | N360: =RC[15]+RC[16]+RC[17]+RC[18]+RC[19]+RC[20] -> 260481 | O360: 0 | P360: 0 | Q360: 6102978 | R360: 197800 | S360: 37088 | T360: 24725 | U360: 58433.65 | V360: 0 | W360: 5784931.3499999996 | X360: 0 | Y360: 0 | Z360: 0 | AA360: 0 | AB360: 0 | AC360: 0 | AD360: 0 | AE360: 0 | AF360: 0 | AG360: 0 | AH360: 260481 | AI360: 4902884 | AJ360: 0 | AK360: 0 | AL360: 0 | AM360: 0 | AN360: 0 | AO360: 0 | AP360: 0 | AQ360: 0 | AR360: =1 -> 1 | AS360: 0 | AT360: 0 | AU360: =RC[-30]-RC[-29]-RC[-28]-RC[-27]-RC[-26]-RC[-25] -> 5784931.3499999996 | AV360: 0 | AW360: =RC[1]-RC[2] -> 86827 | AX360: 260481 | AY360: 173654 | AZ360: =RC[-46] -> 4902884 | BA360: =RC[-46] -> 0 | BB360: =RC[-46] -> 0 | BC360: =RC[-46] -> 0 | BD360: =RC[-46] -> 0 | BE360: =RC[-46] -> 0 | BF360: =RC[-46] -> 680000 | BG360: =RC[-46] -> 259613 | BH360: =RC[-46] -> 260481 | BI360: =RC[-46] -> 0 | BJ360: =RC[-46] -> 0 | BK360: =RC[-46] -> 6102978 | BL360: =RC[-46] -> 197800 | BM360: =RC[-46] -> 37088 | BN360: =RC[-46] -> 24725 | BO360: =RC[-46] -> 58433.65 | BP360: =RC[-46] -> 0 | BQ360: =RC[-46] -> 5784931.3499999996 | BR360: =RC[-46] -> 0 | BS360: =RC[-46] -> 0 | BT360: =RC[-46] -> 0 | BU360: =RC[-46] -> 0 | BV360: =RC[-46] -> 0 | BW360: =RC[-46] -> 0 | BX360: =RC[-46] -> 0 | BY360: =RC[-46] -> 0 | BZ360: =RC[-46] -> 0 | CA360: =RC[-46] -> 0 | CB360: =RC[-46] -> 260481 | CC360: =RC[-46] -> 4902884 | CD360: =RC[-46] -> 0 | CE360: =RC[-46] -> 0 | CF360: =RC[-46] -> 0 | CG360: =RC[-46] -> 0 | CH360: =RC[-46] -> 0 | CI360: =RC[-46] -> 0 | CJ360: =RC[-46] -> 0 | CK360: =RC[-46] -> 0 | CL360: =RC[-46] -> 1 | CM360: =RC[-46] -> 0 | CN360: =RC[-46] -> 0 | CO360: =RC[-46] -> 5784931.3499999996 | CP360: =RC[-46] -> 0 | CQ360: =RC[-46] -> 86827 | CR360: =RC[-46] -> 260481 | CS360: =RC[-46] -> 173654
A361: 121 | B361: 011141 | C361: Lê Trọng Lệ | D361: NV Lái xe - VHTTB | E361: 19026970122011 | F361: =RC[29]+RC[30]+RC[31]+RC[32]+RC[33]+RC[34]+RC[35]+RC[36]+RC[37] -> 3198548 | G361: =RC[17]+RC[18]++RC[19]+RC[20]+RC[21]+RC[38]+RC[39]+RC[41] -> 472500 | H361: 0 | I361: 0 | J361: =RC[-2]+RC[-1] -> 0 | K361: 0 | L361: 523077 | M361: 235463 | N361: =RC[15]+RC[16]+RC[17]+RC[18]+RC[19]+RC[20] -> 0 | O361: 0 | P361: 0 | Q361: 4429588 | R361: 179400 | S361: 33638 | T361: 22425 | U361: 41941.25 | V361: 0 | W361: 4152183.75 | X361: 0 | Y361: 472500 | Z361: 0 | AA361: 0 | AB361: 0 | AC361: 0 | AD361: 0 | AE361: 0 | AF361: 0 | AG361: 0 | AH361: 0 | AI361: 3198548 | AJ361: 0 | AK361: 0 | AL361: 0 | AM361: 0 | AN361: 0 | AO361: 0 | AP361: 0 | AQ361: 0 | AR361: =1 -> 1 | AS361: 0 | AT361: 0 | AU361: =RC[-30]-RC[-29]-RC[-28]-RC[-27]-RC[-26]-RC[-25] -> 4152183.75 | AV361: 0 | AW361: =RC[1]-RC[2] -> 0 | AX361: 0 | AY361: 0 | AZ361: =RC[-46] -> 3198548 | BA361: =RC[-46] -> 472500 | BB361: =RC[-46] -> 0 | BC361: =RC[-46] -> 0 | BD361: =RC[-46] -> 0 | BE361: =RC[-46] -> 0 | BF361: =RC[-46] -> 523077 | BG361: =RC[-46] -> 235463 | BH361: =RC[-46] -> 0 | BI361: =RC[-46] -> 0 | BJ361: =RC[-46] -> 0 | BK361: =RC[-46] -> 4429588 | BL361: =RC[-46] -> 179400 | BM361: =RC[-46] -> 33638 | BN361: =RC[-46] -> 22425 | BO361: =RC[-46] -> 41941.25 | BP361: =RC[-46] -> 0 | BQ361: =RC[-46] -> 4152183.75 | BR361: =RC[-46] -> 0 | BS361: =RC[-46] -> 472500 | BT361: =RC[-46] -> 0 | BU361: =RC[-46] -> 0 | BV361: =RC[-46] -> 0 | BW361: =RC[-46] -> 0 | BX361: =RC[-46] -> 0 | BY361: =RC[-46] -> 0 | BZ361: =RC[-46] -> 0 | CA361: =RC[-46] -> 0 | CB361: =RC[-46] -> 0 | CC361: =RC[-46] -> 3198548 | CD361: =RC[-46] -> 0 | CE361: =RC[-46] -> 0 | CF361: =RC[-46] -> 0 | CG361: =RC[-46] -> 0 | CH361: =RC[-46] -> 0 | CI361: =RC[-46] -> 0 | CJ361: =RC[-46] -> 0 | CK361: =RC[-46] -> 0 | CL361: =RC[-46] -> 1 | CM361: =RC[-46] -> 0 | CN361: =RC[-46] -> 0 | CO361: =RC[-46] -> 4152183.75 | CP361: =RC[-46] -> 0 | CQ361: =RC[-46] -> 0 | CR361: =RC[-46] -> 0 | CS361: =RC[-46] -> 0
A362: 122 | B362: 011142 | C362: Trần Văn Chính | D362: NV Lái xe - VHTTB | E362: 19026970123016 | F362: =RC[29]+RC[30]+RC[31]+RC[32]+RC[33]+RC[34]+RC[35]+RC[36]+RC[37] -> 4657739 | G362: =RC[17]+RC[18]++RC[19]+RC[20]+RC[21]+RC[38]+RC[39]+RC[41] -> 0 | H362: 0 | I362: 0 | J362: =RC[-2]+RC[-1] -> 0 | K362: 0 | L362: 680000 | M362: 259613 | N362: =RC[15]+RC[16]+RC[17]+RC[18]+RC[19]+RC[20] -> 260481 | O362: 0 | P362: 0 | Q362: 5857833 | R362: 197800 | S362: 37088 | T362: 24725 | U362: 55982.2 | V362: 0 | W362: 5542237.7999999998 | X362: 0 | Y362: 0 | Z362: 0 | AA362: 0 | AB362: 0 | AC362: 0 | AD362: 0 | AE362: 0 | AF362: 0 | AG362: 0 | AH362: 260481 | AI362: 4657739 | AJ362: 0 | AK362: 0 | AL362: 0 | AM362: 0 | AN362: 0 | AO362: 0 | AP362: 0 | AQ362: 0 | AR362: =1 -> 1 | AS362: 0 | AT362: 0 | AU362: =RC[-30]-RC[-29]-RC[-28]-RC[-27]-RC[-26]-RC[-25] -> 5542237.7999999998 | AV362: 0 | AW362: =RC[1]-RC[2] -> 86827 | AX362: 260481 | AY362: 173654 | AZ362: =RC[-46] -> 4657739 | BA362: =RC[-46] -> 0 | BB362: =RC[-46] -> 0 | BC362: =RC[-46] -> 0 | BD362: =RC[-46] -> 0 | BE362: =RC[-46] -> 0 | BF362: =RC[-46] -> 680000 | BG362: =RC[-46] -> 259613 | BH362: =RC[-46] -> 260481 | BI362: =RC[-46] -> 0 | BJ362: =RC[-46] -> 0 | BK362: =RC[-46] -> 5857833 | BL362: =RC[-46] -> 197800 | BM362: =RC[-46] -> 37088 | BN362: =RC[-46] -> 24725 | BO362: =RC[-46] -> 55982.2 | BP362: =RC[-46] -> 0 | BQ362: =RC[-46] -> 5542237.7999999998 | BR362: =RC[-46] -> 0 | BS362: =RC[-46] -> 0 | BT362: =RC[-46] -> 0 | BU362: =RC[-46] -> 0 | BV362: =RC[-46] -> 0 | BW362: =RC[-46] -> 0 | BX362: =RC[-46] -> 0 | BY362: =RC[-46] -> 0 | BZ362: =RC[-46] -> 0 | CA362: =RC[-46] -> 0 | CB362: =RC[-46] -> 260481 | CC362: =RC[-46] -> 4657739 | CD362: =RC[-46] -> 0 | CE362: =RC[-46] -> 0 | CF362: =RC[-46] -> 0 | CG362: =RC[-46] -> 0 | CH362: =RC[-46] -> 0 | CI362: =RC[-46] -> 0 | CJ362: =RC[-46] -> 0 | CK362: =RC[-46] -> 0 | CL362: =RC[-46] -> 1 | CM362: =RC[-46] -> 0 | CN362: =RC[-46] -> 0 | CO362: =RC[-46] -> 5542237.7999999998 | CP362: =RC[-46] -> 0 | CQ362: =RC[-46] -> 86827 | CR362: =RC[-46] -> 260481 | CS362: =RC[-46] -> 173654
A363: 123 | B363: 011143 | C363: Phù Xuân Tiền | D363: NV Lái xe - VHTTB | E363: 10522594122016 | F363: =RC[29]+RC[30]+RC[31]+RC[32]+RC[33]+RC[34]+RC[35]+RC[36]+RC[37] -> 5148028 | G363: =RC[17]+RC[18]++RC[19]+RC[20]+RC[21]+RC[38]+RC[39]+RC[41] -> 0 | H363: 0 | I363: 0 | J363: =RC[-2]+RC[-1] -> 0 | K363: 0 | L363: 680000 | M363: 259613 | N363: =RC[15]+RC[16]+RC[17]+RC[18]+RC[19]+RC[20] -> 260481 | O363: 0 | P363: 0 | Q363: 6348122 | R363: 197800 | S363: 37088 | T363: 24725 | U363: 60885.09 | V363: 0 | W363: 6027623.9100000001 | X363: 0 | Y363: 0 | Z363: 0 | AA363: 0 | AB363: 0 | AC363: 0 | AD363: 0 | AE363: 0 | AF363: 0 | AG363: 0 | AH363: 260481 | AI363: 5148028 | AJ363: 0 | AK363: 0 | AL363: 0 | AM363: 0 | AN363: 0 | AO363: 0 | AP363: 0 | AQ363: 0 | AR363: =1 -> 1 | AS363: 0 | AT363: 0 | AU363: =RC[-30]-RC[-29]-RC[-28]-RC[-27]-RC[-26]-RC[-25] -> 6027623.9100000001 | AV363: 0 | AW363: =RC[1]-RC[2] -> 86827 | AX363: 260481 | AY363: 173654 | AZ363: =RC[-46] -> 5148028 | BA363: =RC[-46] -> 0 | BB363: =RC[-46] -> 0 | BC363: =RC[-46] -> 0 | BD363: =RC[-46] -> 0 | BE363: =RC[-46] -> 0 | BF363: =RC[-46] -> 680000 | BG363: =RC[-46] -> 259613 | BH363: =RC[-46] -> 260481 | BI363: =RC[-46] -> 0 | BJ363: =RC[-46] -> 0 | BK363: =RC[-46] -> 6348122 | BL363: =RC[-46] -> 197800 | BM363: =RC[-46] -> 37088 | BN363: =RC[-46] -> 24725 | BO363: =RC[-46] -> 60885.09 | BP363: =RC[-46] -> 0 | BQ363: =RC[-46] -> 6027623.9100000001 | BR363: =RC[-46] -> 0 | BS363: =RC[-46] -> 0 | BT363: =RC[-46] -> 0 | BU363: =RC[-46] -> 0 | BV363: =RC[-46] -> 0 | BW363: =RC[-46] -> 0 | BX363: =RC[-46] -> 0 | BY363: =RC[-46] -> 0 | BZ363: =RC[-46] -> 0 | CA363: =RC[-46] -> 0 | CB363: =RC[-46] -> 260481 | CC363: =RC[-46] -> 5148028 | CD363: =RC[-46] -> 0 | CE363: =RC[-46] -> 0 | CF363: =RC[-46] -> 0 | CG363: =RC[-46] -> 0 | CH363: =RC[-46] -> 0 | CI363: =RC[-46] -> 0 | CJ363: =RC[-46] -> 0 | CK363: =RC[-46] -> 0 | CL363: =RC[-46] -> 1 | CM363: =RC[-46] -> 0 | CN363: =RC[-46] -> 0 | CO363: =RC[-46] -> 6027623.9100000001 | CP363: =RC[-46] -> 0 | CQ363: =RC[-46] -> 86827 | CR363: =RC[-46] -> 260481 | CS363: =RC[-46] -> 173654
A364: 124 | B364: 011144 | C364: Đinh Văn Bền | D364: NV Lái xe - VHTTB | E364: 19026970124012 | F364: =RC[29]+RC[30]+RC[31]+RC[32]+RC[33]+RC[34]+RC[35]+RC[36]+RC[37] -> 4657739 | G364: =RC[17]+RC[18]++RC[19]+RC[20]+RC[21]+RC[38]+RC[39]+RC[41] -> 0 | H364: 0 | I364: 0 | J364: =RC[-2]+RC[-1] -> 0 | K364: 0 | L364: 680000 | M364: 259613 | N364: =RC[15]+RC[16]+RC[17]+RC[18]+RC[19]+RC[20] -> 260481 | O364: 0 | P364: 0 | Q364: 5857833 | R364: 197800 | S364: 37088 | T364: 24725 | U364: 55982.2 | V364: 0 | W364: 5542237.7999999998 | X364: 0 | Y364: 0 | Z364: 0 | AA364: 0 | AB364: 0 | AC364: 0 | AD364: 0 | AE364: 0 | AF364: 0 | AG364: 0 | AH364: 260481 | AI364: 4657739 | AJ364: 0 | AK364: 0 | AL364: 0 | AM364: 0 | AN364: 0 | AO364: 0 | AP364: 0 | AQ364: 0 | AR364: =1 -> 1 | AS364: 0 | AT364: 0 | AU364: =RC[-30]-RC[-29]-RC[-28]-RC[-27]-RC[-26]-RC[-25] -> 5542237.7999999998 | AV364: 0 | AW364: =RC[1]-RC[2] -> 86827 | AX364: 260481 | AY364: 173654 | AZ364: =RC[-46] -> 4657739 | BA364: =RC[-46] -> 0 | BB364: =RC[-46] -> 0 | BC364: =RC[-46] -> 0 | BD364: =RC[-46] -> 0 | BE364: =RC[-46] -> 0 | BF364: =RC[-46] -> 680000 | BG364: =RC[-46] -> 259613 | BH364: =RC[-46] -> 260481 | BI364: =RC[-46] -> 0 | BJ364: =RC[-46] -> 0 | BK364: =RC[-46] -> 5857833 | BL364: =RC[-46] -> 197800 | BM364: =RC[-46] -> 37088 | BN364: =RC[-46] -> 24725 | BO364: =RC[-46] -> 55982.2 | BP364: =RC[-46] -> 0 | BQ364: =RC[-46] -> 5542237.7999999998 | BR364: =RC[-46] -> 0 | BS364: =RC[-46] -> 0 | BT364: =RC[-46] -> 0 | BU364: =RC[-46] -> 0 | BV364: =RC[-46] -> 0 | BW364: =RC[-46] -> 0 | BX364: =RC[-46] -> 0 | BY364: =RC[-46] -> 0 | BZ364: =RC[-46] -> 0 | CA364: =RC[-46] -> 0 | CB364: =RC[-46] -> 260481 | CC364: =RC[-46] -> 4657739 | CD364: =RC[-46] -> 0 | CE364: =RC[-46] -> 0 | CF364: =RC[-46] -> 0 | CG364: =RC[-46] -> 0 | CH364: =RC[-46] -> 0 | CI364: =RC[-46] -> 0 | CJ364: =RC[-46] -> 0 | CK364: =RC[-46] -> 0 | CL364: =RC[-46] -> 1 | CM364: =RC[-46] -> 0 | CN364: =RC[-46] -> 0 | CO364: =RC[-46] -> 5542237.7999999998 | CP364: =RC[-46] -> 0 | CQ364: =RC[-46] -> 86827 | CR364: =RC[-46] -> 260481 | CS364: =RC[-46] -> 173654
A365: 125 | B365: 011145 | C365: Nguyễn Tiến Ngọc | D365: NV Lái xe - VHTTB | E365: 19026970126015 | F365: =RC[29]+RC[30]+RC[31]+RC[32]+RC[33]+RC[34]+RC[35]+RC[36]+RC[37] -> 3627550 | G365: =RC[17]+RC[18]++RC[19]+RC[20]+RC[21]+RC[38]+RC[39]+RC[41] -> 0 | H365: 0 | I365: 0 | J365: =RC[-2]+RC[-1] -> 0 | K365: 0 | L365: 680000 | M365: 259613 | N365: =RC[15]+RC[16]+RC[17]+RC[18]+RC[19]+RC[20] -> 260481 | O365: 0 | P365: 0 | Q365: 4827644 | R365: 197800 | S365: 37088 | T365: 24725 | U365: 45680.31 | V365: 0 | W365: 4522350.6900000004 | X365: 0 | Y365: 0 | Z365: 0 | AA365: 0 | AB365: 0 | AC365: 0 | AD365: 0 | AE365: 0 | AF365: 0 | AG365: 0 | AH365: 260481 | AI365: 3627550 | AJ365: 0 | AK365: 0 | AL365: 0 | AM365: 0 | AN365: 0 | AO365: 0 | AP365: 0 | AQ365: 0 | AR365: =1 -> 1 | AS365: 0 | AT365: 0 | AU365: =RC[-30]-RC[-29]-RC[-28]-RC[-27]-RC[-26]-RC[-25] -> 4522350.6900000004 | AV365: 0 | AW365: =RC[1]-RC[2] -> 86827 | AX365: 260481 | AY365: 173654 | AZ365: =RC[-46] -> 3627550 | BA365: =RC[-46] -> 0 | BB365: =RC[-46] -> 0 | BC365: =RC[-46] -> 0 | BD365: =RC[-46] -> 0 | BE365: =RC[-46] -> 0 | BF365: =RC[-46] -> 680000 | BG365: =RC[-46] -> 259613 | BH365: =RC[-46] -> 260481 | BI365: =RC[-46] -> 0 | BJ365: =RC[-46] -> 0 | BK365: =RC[-46] -> 4827644 | BL365: =RC[-46] -> 197800 | BM365: =RC[-46] -> 37088 | BN365: =RC[-46] -> 24725 | BO365: =RC[-46] -> 45680.31 | BP365: =RC[-46] -> 0 | BQ365: =RC[-46] -> 4522350.6900000004 | BR365: =RC[-46] -> 0 | BS365: =RC[-46] -> 0 | BT365: =RC[-46] -> 0 | BU365: =RC[-46] -> 0 | BV365: =RC[-46] -> 0 | BW365: =RC[-46] -> 0 | BX365: =RC[-46] -> 0 | BY365: =RC[-46] -> 0 | BZ365: =RC[-46] -> 0 | CA365: =RC[-46] -> 0 | CB365: =RC[-46] -> 260481 | CC365: =RC[-46] -> 3627550 | CD365: =RC[-46] -> 0 | CE365: =RC[-46] -> 0 | CF365: =RC[-46] -> 0 | CG365: =RC[-46] -> 0 | CH365: =RC[-46] -> 0 | CI365: =RC[-46] -> 0 | CJ365: =RC[-46] -> 0 | CK365: =RC[-46] -> 0 | CL365: =RC[-46] -> 1 | CM365: =RC[-46] -> 0 | CN365: =RC[-46] -> 0 | CO365: =RC[-46] -> 4522350.6900000004 | CP365: =RC[-46] -> 0 | CQ365: =RC[-46] -> 86827 | CR365: =RC[-46] -> 260481 | CS365: =RC[-46] -> 173654
A366: Đội phục vụ hành lý hàng hóa (HGS) | F366: =SUM(R[-125]C:R[-1]C) -> 576765887 | G366: =SUM(R[-125]C:R[-1]C) -> 3036923 | H366: =SUM(R[-125]C:R[-1]C) -> 0 | I366: =SUM(R[-125]C:R[-1]C) -> 0 | J366: =SUM(R[-125]C:R[-1]C) -> 0 | K366: =SUM(R[-125]C:R[-1]C) -> 1995000 | L366: =SUM(R[-125]C:R[-1]C) -> 83875385 | M366: =SUM(R[-125]C:R[-1]C) -> 29860312 | N366: =SUM(R[-125]C:R[-1]C) -> 26009311 | O366: =SUM(R[-125]C:R[-1]C) -> 0 | P366: =SUM(R[-125]C:R[-1]C) -> 0 | Q366: =SUM(R[-125]C:R[-1]C) -> 721542818 | R366: =SUM(R[-125]C:R[-1]C) -> 22750680 | S366: =SUM(R[-125]C:R[-1]C) -> 4265797 | T366: =SUM(R[-125]C:R[-1]C) -> 2843835 | U366: =SUM(R[-125]C:R[-1]C) -> 6916825.0599999987 | V366: =SUM(R[-125]C:R[-1]C) -> 0 | W366: =SUM(R[-125]C:R[-1]C) -> 684765680.94000006 | X366: =SUM(R[-125]C:R[-1]C) -> 0 | Y366: =SUM(R[-125]C:R[-1]C) -> 3036923 | Z366: =SUM(R[-125]C:R[-1]C) -> 0 | AA366: =SUM(R[-125]C:R[-1]C) -> 0 | AB366: =SUM(R[-125]C:R[-1]C) -> 0 | AC366: =SUM(R[-125]C:R[-1]C) -> 0 | AD366: =SUM(R[-125]C:R[-1]C) -> 0 | AE366: =SUM(R[-125]C:R[-1]C) -> 0 | AF366: =SUM(R[-125]C:R[-1]C) -> 0 | AG366: =SUM(R[-125]C:R[-1]C) -> 0 | AH366: =SUM(R[-125]C:R[-1]C) -> 26009311 | AI366: =SUM(R[-125]C:R[-1]C) -> 576765887 | AJ366: =SUM(R[-125]C:R[-1]C) -> 0 | AK366: =SUM(R[-125]C:R[-1]C) -> 0 | AL366: =SUM(R[-125]C:R[-1]C) -> 0 | AM366: =SUM(R[-125]C:R[-1]C) -> 0 | AN366: =SUM(R[-125]C:R[-1]C) -> 0 | AO366: =SUM(R[-125]C:R[-1]C) -> 0 | AP366: =SUM(R[-125]C:R[-1]C) -> 0 | AQ366: =SUM(R[-125]C:R[-1]C) -> 0 | AR366: =SUM(R[-125]C:R[-1]C) -> 125 | AS366: =SUM(R[-125]C:R[-1]C) -> 0 | AT366: =SUM(R[-125]C:R[-1]C) -> 0 | AU366: =SUM(R[-125]C:R[-1]C) -> 684765680.94000006 | AV366: =SUM(R[-125]C:R[-1]C) -> 0 | AW366: =SUM(R[-125]C:R[-1]C) -> 8669770.3289999962 | AX366: =SUM(R[-125]C:R[-1]C) -> 26009311 | AY366: =SUM(R[-125]C:R[-1]C) -> 17339540.670999993
A367: Đội phục vụ tàu bay (HGS) | F367: =R[37]C -> 160715359 | G367: =R[37]C -> 1720384 | H367: =R[37]C -> 0 | I367: =R[37]C -> 0 | J367: =R[37]C -> 0 | K367: =R[37]C -> 735000 | L367: =R[37]C -> 21472308 | M367: =R[37]C -> 8528576 | N367: =R[37]C -> 493096 | O367: =R[37]C -> 0 | P367: =R[37]C -> 0 | Q367: =R[37]C -> 193664723 | R367: =R[37]C -> 6497960 | S367: =R[37]C -> 1218371 | T367: =R[37]C -> 812245 | U367: =R[37]C -> 1851361.47 | V367: =R[37]C -> 0 | W367: =R[37]C -> 183284785.53 | X367: =R[37]C -> 0 | Y367: =R[37]C -> 1720384 | Z367: =R[37]C -> 0 | AA367: =R[37]C -> 0 | AB367: =R[37]C -> 0 | AC367: =R[37]C -> 0 | AD367: =R[37]C -> 0 | AE367: =R[37]C -> 0 | AF367: =R[37]C -> 0 | AG367: =R[37]C -> 0 | AH367: =R[37]C -> 493096 | AI367: =R[37]C -> 153886342 | AJ367: =R[37]C -> 6829017 | AK367: =R[37]C -> 0 | AL367: =R[37]C -> 0 | AM367: =R[37]C -> 0 | AN367: =R[37]C -> 0 | AO367: =R[37]C -> 0 | AP367: =R[37]C -> 0 | AQ367: =R[37]C -> 0 | AR367: =R[37]C -> 36 | AS367: =R[37]C -> 0 | AT367: =R[37]C -> 0 | AU367: =R[37]C -> 183284785.53 | AW367: =R[37]C -> 164365.33299999998 | AX367: =R[37]C -> 493096 | AY367: =R[37]C -> 328730.66700000002
A368: 1 | B368: 010758 | C368: Trương Thị Minh Phượng | D368: Đội phó | E368: 10522161446011 | F368: =RC[29]+RC[30]+RC[31]+RC[32]+RC[33]+RC[34]+RC[35]+RC[36]+RC[37] -> 7500245 | G368: =RC[17]+RC[18]++RC[19]+RC[20]+RC[21]+RC[38]+RC[39]+RC[41] -> 0 | H368: 0 | I368: 0 | J368: =RC[-2]+RC[-1] -> 0 | K368: 210000 | L368: 680000 | M368: 332063 | N368: =RC[15]+RC[16]+RC[17]+RC[18]+RC[19]+RC[20] -> 0 | O368: 0 | P368: 0 | Q368: 8722308 | R368: 253000 | S368: 47438 | T368: 31625 | U368: 83902.45 | V368: 0 | W368: 8306342.5499999998 | X368: 0 | Y368: 0 | Z368: 0 | AA368: 0 | AB368: 0 | AC368: 0 | AD368: 0 | AE368: 0 | AF368: 0 | AG368: 0 | AH368: 0 | AI368: 7500245 | AJ368: 0 | AK368: 0 | AL368: 0 | AM368: 0 | AN368: 0 | AO368: 0 | AP368: 0 | AQ368: 0 | AR368: =1 -> 1 | AS368: 0 | AT368: 0 | AU368: =RC[-30]-RC[-29]-RC[-28]-RC[-27]-RC[-26]-RC[-25] -> 8306342.5499999998 | AV368: 0 | AW368: =RC[1]-RC[2] -> 0 | AX368: 0 | AY368: 0 | AZ368: =RC[-46] -> 7500245 | BA368: =RC[-46] -> 0 | BB368: =RC[-46] -> 0 | BC368: =RC[-46] -> 0 | BD368: =RC[-46] -> 0 | BE368: =RC[-46] -> 210000 | BF368: =RC[-46] -> 680000 | BG368: =RC[-46] -> 332063 | BH368: =RC[-46] -> 0 | BI368: =RC[-46] -> 0 | BJ368: =RC[-46] -> 0 | BK368: =RC[-46] -> 8722308 | BL368: =RC[-46] -> 253000 | BM368: =RC[-46] -> 47438 | BN368: =RC[-46] -> 31625 | BO368: =RC[-46] -> 83902.45 | BP368: =RC[-46] -> 0 | BQ368: =RC[-46] -> 8306342.5499999998 | BR368: =RC[-46] -> 0 | BS368: =RC[-46] -> 0 | BT368: =RC[-46] -> 0 | BU368: =RC[-46] -> 0 | BV368: =RC[-46] -> 0 | BW368: =RC[-46] -> 0 | BX368: =RC[-46] -> 0 | BY368: =RC[-46] -> 0 | BZ368: =RC[-46] -> 0 | CA368: =RC[-46] -> 0 | CB368: =RC[-46] -> 0 | CC368: =RC[-46] -> 7500245 | CD368: =RC[-46] -> 0 | CE368: =RC[-46] -> 0 | CF368: =RC[-46] -> 0 | CG368: =RC[-46] -> 0 | CH368: =RC[-46] -> 0 | CI368: =RC[-46] -> 0 | CJ368: =RC[-46] -> 0 | CK368: =RC[-46] -> 0 | CL368: =RC[-46] -> 1 | CM368: =RC[-46] -> 0 | CN368: =RC[-46] -> 0 | CO368: =RC[-46] -> 8306342.5499999998 | CP368: =RC[-46] -> 0 | CQ368: =RC[-46] -> 0 | CR368: =RC[-46] -> 0 | CS368: =RC[-46] -> 0
A369: 2 | B369: 010644 | C369: Nguyễn Văn Bình | D369: KTV mặt đất | E369: 10522162944015 | F369: =RC[29]+RC[30]+RC[31]+RC[32]+RC[33]+RC[34]+RC[35]+RC[36]+RC[37] -> 7500245 | G369: =RC[17]+RC[18]++RC[19]+RC[20]+RC[21]+RC[38]+RC[39]+RC[41] -> 0 | H369: 0 | I369: 0 | J369: =RC[-2]+RC[-1] -> 0 | K369: 210000 | L369: 680000 | M369: 377948 | N369: =RC[15]+RC[16]+RC[17]+RC[18]+RC[19]+RC[20] -> 0 | O369: 0 | P369: 0 | Q369: 8768193 | R369: 287960 | S369: 53993 | T369: 35995 | U369: 83902.45 | V369: 0 | W369: 8306342.5499999998 | X369: 0 | Y369: 0 | Z369: 0 | AA369: 0 | AB369: 0 | AC369: 0 | AD369: 0 | AE369: 0 | AF369: 0 | AG369: 0 | AH369: 0 | AI369: 7500245 | AJ369: 0 | AK369: 0 | AL369: 0 | AM369: 0 | AN369: 0 | AO369: 0 | AP369: 0 | AQ369: 0 | AR369: =1 -> 1 | AS369: 0 | AT369: 0 | AU369: =RC[-30]-RC[-29]-RC[-28]-RC[-27]-RC[-26]-RC[-25] -> 8306342.5499999998 | AV369: 0 | AW369: =RC[1]-RC[2] -> 0 | AX369: 0 | AY369: 0 | AZ369: =RC[-46] -> 7500245 | BA369: =RC[-46] -> 0 | BB369: =RC[-46] -> 0 | BC369: =RC[-46] -> 0 | BD369: =RC[-46] -> 0 | BE369: =RC[-46] -> 210000 | BF369: =RC[-46] -> 680000 | BG369: =RC[-46] -> 377948 | BH369: =RC[-46] -> 0 | BI369: =RC[-46] -> 0 | BJ369: =RC[-46] -> 0 | BK369: =RC[-46] -> 8768193 | BL369: =RC[-46] -> 287960 | BM369: =RC[-46] -> 53993 | BN369: =RC[-46] -> 35995 | BO369: =RC[-46] -> 83902.45 | BP369: =RC[-46] -> 0 | BQ369: =RC[-46] -> 8306342.5499999998 | BR369: =RC[-46] -> 0 | BS369: =RC[-46] -> 0 | BT369: =RC[-46] -> 0 | BU369: =RC[-46] -> 0 | BV369: =RC[-46] -> 0 | BW369: =RC[-46] -> 0 | BX369: =RC[-46] -> 0 | BY369: =RC[-46] -> 0 | BZ369: =RC[-46] -> 0 | CA369: =RC[-46] -> 0 | CB369: =RC[-46] -> 0 | CC369: =RC[-46] -> 7500245 | CD369: =RC[-46] -> 0 | CE369: =RC[-46] -> 0 | CF369: =RC[-46] -> 0 | CG369: =RC[-46] -> 0 | CH369: =RC[-46] -> 0 | CI369: =RC[-46] -> 0 | CJ369: =RC[-46] -> 0 | CK369: =RC[-46] -> 0 | CL369: =RC[-46] -> 1 | CM369: =RC[-46] -> 0 | CN369: =RC[-46] -> 0 | CO369: =RC[-46] -> 8306342.5499999998 | CP369: =RC[-46] -> 0 | CQ369: =RC[-46] -> 0 | CR369: =RC[-46] -> 0 | CS369: =RC[-46] -> 0
A370: 3 | B370: 010645 | C370: Thân Hoài Nam | D370: KTV mặt đất | E370: 10520029783014 | F370: =RC[29]+RC[30]+RC[31]+RC[32]+RC[33]+RC[34]+RC[35]+RC[36]+RC[37] -> 8755149 | G370: =RC[17]+RC[18]++RC[19]+RC[20]+RC[21]+RC[38]+RC[39]+RC[41] -> 0 | H370: 0 | I370: 0 | J370: =RC[-2]+RC[-1] -> 0 | K370: 315000 | L370: 680000 | M370: 423833 | N370: =RC[15]+RC[16]+RC[17]+RC[18]+RC[19]+RC[20] -> 0 | O370: 0 | P370: 0 | Q370: 10173982 | R370: 322920 | S370: 60548 | T370: 40365 | U370: 97501.49 | V370: 0 | W370: 9652647.5099999998 | X370: 0 | Y370: 0 | Z370: 0 | AA370: 0 | AB370: 0 | AC370: 0 | AD370: 0 | AE370: 0 | AF370: 0 | AG370: 0 | AH370: 0 | AI370: 8755149 | AJ370: 0 | AK370: 0 | AL370: 0 | AM370: 0 | AN370: 0 | AO370: 0 | AP370: 0 | AQ370: 0 | AR370: =1 -> 1 | AS370: 0 | AT370: 0 | AU370: =RC[-30]-RC[-29]-RC[-28]-RC[-27]-RC[-26]-RC[-25] -> 9652647.5099999998 | AV370: 0 | AW370: =RC[1]-RC[2] -> 0 | AX370: 0 | AY370: 0 | AZ370: =RC[-46] -> 8755149 | BA370: =RC[-46] -> 0 | BB370: =RC[-46] -> 0 | BC370: =RC[-46] -> 0 | BD370: =RC[-46] -> 0 | BE370: =RC[-46] -> 315000 | BF370: =RC[-46] -> 680000 | BG370: =RC[-46] -> 423833 | BH370: =RC[-46] -> 0 | BI370: =RC[-46] -> 0 | BJ370: =RC[-46] -> 0 | BK370: =RC[-46] -> 10173982 | BL370: =RC[-46] -> 322920 | BM370: =RC[-46] -> 60548 | BN370: =RC[-46] -> 40365 | BO370: =RC[-46] -> 97501.49 | BP370: =RC[-46] -> 0 | BQ370: =RC[-46] -> 9652647.5099999998 | BR370: =RC[-46] -> 0 | BS370: =RC[-46] -> 0 | BT370: =RC[-46] -> 0 | BU370: =RC[-46] -> 0 | BV370: =RC[-46] -> 0 | BW370: =RC[-46] -> 0 | BX370: =RC[-46] -> 0 | BY370: =RC[-46] -> 0 | BZ370: =RC[-46] -> 0 | CA370: =RC[-46] -> 0 | CB370: =RC[-46] -> 0 | CC370: =RC[-46] -> 8755149 | CD370: =RC[-46] -> 0 | CE370: =RC[-46] -> 0 | CF370: =RC[-46] -> 0 | CG370: =RC[-46] -> 0 | CH370: =RC[-46] -> 0 | CI370: =RC[-46] -> 0 | CJ370: =RC[-46] -> 0 | CK370: =RC[-46] -> 0 | CL370: =RC[-46] -> 1 | CM370: =RC[-46] -> 0 | CN370: =RC[-46] -> 0 | CO370: =RC[-46] -> 9652647.5099999998 | CP370: =RC[-46] -> 0 | CQ370: =RC[-46] -> 0 | CR370: =RC[-46] -> 0 | CS370: =RC[-46] -> 0
A371: 4 | B371: 013531 | C371: Võ Thị Vân | D371: Nhân viên vệ sinh khu bay | E371: 19028960288011 | F371: =RC[29]+RC[30]+RC[31]+RC[32]+RC[33]+RC[34]+RC[35]+RC[36]+RC[37] -> 3005935 | G371: =RC[17]+RC[18]++RC[19]+RC[20]+RC[21]+RC[38]+RC[39]+RC[41] -> 0 | H371: 0 | I371: 0 | J371: =RC[-2]+RC[-1] -> 0 | K371: 0 | L371: 680000 | M371: 0 | N371: =RC[15]+RC[16]+RC[17]+RC[18]+RC[19]+RC[20] -> 0 | O371: 0 | P371: 0 | Q371: 3685935 | R371: 0 | S371: 0 | T371: 0 | U371: 36859.35 | V371: 0 | W371: 3649075.65 | X371: 0 | Y371: 0 | Z371: 0 | AA371: 0 | AB371: 0 | AC371: 0 | AD371: 0 | AE371: 0 | AF371: 0 | AG371: 0 | AH371: 0 | AI371: 3005935 | AJ371: 0 | AK371: 0 | AL371: 0 | AM371: 0 | AN371: 0 | AO371: 0 | AP371: 0 | AQ371: 0 | AR371: =1 -> 1 | AS371: 0 | AT371: 0 | AU371: =RC[-30]-RC[-29]-RC[-28]-RC[-27]-RC[-26]-RC[-25] -> 3649075.65 | AV371: 0 | AW371: =RC[1]-RC[2] -> 0 | AX371: 0 | AY371: 0 | AZ371: =RC[-46] -> 3005935 | BA371: =RC[-46] -> 0 | BB371: =RC[-46] -> 0 | BC371: =RC[-46] -> 0 | BD371: =RC[-46] -> 0 | BE371: =RC[-46] -> 0 | BF371: =RC[-46] -> 680000 | BG371: =RC[-46] -> 0 | BH371: =RC[-46] -> 0 | BI371: =RC[-46] -> 0 | BJ371: =RC[-46] -> 0 | BK371: =RC[-46] -> 3685935 | BL371: =RC[-46] -> 0 | BM371: =RC[-46] -> 0 | BN371: =RC[-46] -> 0 | BO371: =RC[-46] -> 36859.35 | BP371: =RC[-46] -> 0 | BQ371: =RC[-46] -> 3649075.65 | BR371: =RC[-46] -> 0 | BS371: =RC[-46] -> 0 | BT371: =RC[-46] -> 0 | BU371: =RC[-46] -> 0 | BV371: =RC[-46] -> 0 | BW371: =RC[-46] -> 0 | BX371: =RC[-46] -> 0 | BY371: =RC[-46] -> 0 | BZ371: =RC[-46] -> 0 | CA371: =RC[-46] -> 0 | CB371: =RC[-46] -> 0 | CC371: =RC[-46] -> 3005935 | CD371: =RC[-46] -> 0 | CE371: =RC[-46] -> 0 | CF371: =RC[-46] -> 0 | CG371: =RC[-46] -> 0 | CH371: =RC[-46] -> 0 | CI371: =RC[-46] -> 0 | CJ371: =RC[-46] -> 0 | CK371: =RC[-46] -> 0 | CL371: =RC[-46] -> 1 | CM371: =RC[-46] -> 0 | CN371: =RC[-46] -> 0 | CO371: =RC[-46] -> 3649075.65 | CP371: =RC[-46] -> 0 | CQ371: =RC[-46] -> 0 | CR371: =RC[-46] -> 0 | CS371: =RC[-46] -> 0
A372: 5 | B372: 012508 | C372: Nguyễn Hồng Nhung | D372: Nv vệ sinh | E372: 19028242764016 | F372: =RC[29]+RC[30]+RC[31]+RC[32]+RC[33]+RC[34]+RC[35]+RC[36]+RC[37] -> 1780214 | G372: =RC[17]+RC[18]++RC[19]+RC[20]+RC[21]+RC[38]+RC[39]+RC[41] -> 0 | H372: 0 | I372: 0 | J372: =RC[-2]+RC[-1] -> 0 | K372: 0 | L372: 156923 | M372: 193200 | N372: =RC[15]+RC[16]+RC[17]+RC[18]+RC[19]+RC[20] -> 0 | O372: 0 | P372: 0 | Q372: 2130337 | R372: 147200 | S372: 27600 | T372: 18400 | U372: 19371.37 | V372: 0 | W372: 1917765.63 | X372: 0 | Y372: 0 | Z372: 0 | AA372: 0 | AB372: 0 | AC372: 0 | AD372: 0 | AE372: 0 | AF372: 0 | AG372: 0 | AH372: 0 | AI372: 1780214 | AJ372: 0 | AK372: 0 | AL372: 0 | AM372: 0 | AN372: 0 | AO372: 0 | AP372: 0 | AQ372: 0 | AR372: =1 -> 1 | AS372: 0 | AT372: 0 | AU372: =RC[-30]-RC[-29]-RC[-28]-RC[-27]-RC[-26]-RC[-25] -> 1917765.63 | AV372: 0 | AW372: =RC[1]-RC[2] -> 0 | AX372: 0 | AY372: 0 | AZ372: =RC[-46] -> 1780214 | BA372: =RC[-46] -> 0 | BB372: =RC[-46] -> 0 | BC372: =RC[-46] -> 0 | BD372: =RC[-46] -> 0 | BE372: =RC[-46] -> 0 | BF372: =RC[-46] -> 156923 | BG372: =RC[-46] -> 193200 | BH372: =RC[-46] -> 0 | BI372: =RC[-46] -> 0 | BJ372: =RC[-46] -> 0 | BK372: =RC[-46] -> 2130337 | BL372: =RC[-46] -> 147200 | BM372: =RC[-46] -> 27600 | BN372: =RC[-46] -> 18400 | BO372: =RC[-46] -> 19371.37 | BP372: =RC[-46] -> 0 | BQ372: =RC[-46] -> 1917765.63 | BR372: =RC[-46] -> 0 | BS372: =RC[-46] -> 0 | BT372: =RC[-46] -> 0 | BU372: =RC[-46] -> 0 | BV372: =RC[-46] -> 0 | BW372: =RC[-46] -> 0 | BX372: =RC[-46] -> 0 | BY372: =RC[-46] -> 0 | BZ372: =RC[-46] -> 0 | CA372: =RC[-46] -> 0 | CB372: =RC[-46] -> 0 | CC372: =RC[-46] -> 1780214 | CD372: =RC[-46] -> 0 | CE372: =RC[-46] -> 0 | CF372: =RC[-46] -> 0 | CG372: =RC[-46] -> 0 | CH372: =RC[-46] -> 0 | CI372: =RC[-46] -> 0 | CJ372: =RC[-46] -> 0 | CK372: =RC[-46] -> 0 | CL372: =RC[-46] -> 1 | CM372: =RC[-46] -> 0 | CN372: =RC[-46] -> 0 | CO372: =RC[-46] -> 1917765.63 | CP372: =RC[-46] -> 0 | CQ372: =RC[-46] -> 0 | CR372: =RC[-46] -> 0 | CS372: =RC[-46] -> 0
A373: 6 | B373: 012596 | C373: Phan Thị Hải Yến | D373: Nv vệ sinh | E373: 10524239067015 | F373: =RC[29]+RC[30]+RC[31]+RC[32]+RC[33]+RC[34]+RC[35]+RC[36]+RC[37] -> 4044879 | G373: =RC[17]+RC[18]++RC[19]+RC[20]+RC[21]+RC[38]+RC[39]+RC[41] -> 0 | H373: 0 | I373: 0 | J373: =RC[-2]+RC[-1] -> 0 | K373: 0 | L373: 680000 | M373: 193200 | N373: =RC[15]+RC[16]+RC[17]+RC[18]+RC[19]+RC[20] -> 0 | O373: 0 | P373: 0 | Q373: 4918079 | R373: 147200 | S373: 27600 | T373: 18400 | U373: 47248.79 | V373: 0 | W373: 4677630.21 | X373: 0 | Y373: 0 | Z373: 0 | AA373: 0 | AB373: 0 | AC373: 0 | AD373: 0 | AE373: 0 | AF373: 0 | AG373: 0 | AH373: 0 | AI373: 4044879 | AJ373: 0 | AK373: 0 | AL373: 0 | AM373: 0 | AN373: 0 | AO373: 0 | AP373: 0 | AQ373: 0 | AR373: =1 -> 1 | AS373: 0 | AT373: 0 | AU373: =RC[-30]-RC[-29]-RC[-28]-RC[-27]-RC[-26]-RC[-25] -> 4677630.21 | AV373: 0 | AW373: =RC[1]-RC[2] -> 0 | AX373: 0 | AY373: 0 | AZ373: =RC[-46] -> 4044879 | BA373: =RC[-46] -> 0 | BB373: =RC[-46] -> 0 | BC373: =RC[-46] -> 0 | BD373: =RC[-46] -> 0 | BE373: =RC[-46] -> 0 | BF373: =RC[-46] -> 680000 | BG373: =RC[-46] -> 193200 | BH373: =RC[-46] -> 0 | BI373: =RC[-46] -> 0 | BJ373: =RC[-46] -> 0 | BK373: =RC[-46] -> 4918079 | BL373: =RC[-46] -> 147200 | BM373: =RC[-46] -> 27600 | BN373: =RC[-46] -> 18400 | BO373: =RC[-46] -> 47248.79 | BP373: =RC[-46] -> 0 | BQ373: =RC[-46] -> 4677630.21 | BR373: =RC[-46] -> 0 | BS373: =RC[-46] -> 0 | BT373: =RC[-46] -> 0 | BU373: =RC[-46] -> 0 | BV373: =RC[-46] -> 0 | BW373: =RC[-46] -> 0 | BX373: =RC[-46] -> 0 | BY373: =RC[-46] -> 0 | BZ373: =RC[-46] -> 0 | CA373: =RC[-46] -> 0 | CB373: =RC[-46] -> 0 | CC373: =RC[-46] -> 4044879 | CD373: =RC[-46] -> 0 | CE373: =RC[-46] -> 0 | CF373: =RC[-46] -> 0 | CG373: =RC[-46] -> 0 | CH373: =RC[-46] -> 0 | CI373: =RC[-46] -> 0 | CJ373: =RC[-46] -> 0 | CK373: =RC[-46] -> 0 | CL373: =RC[-46] -> 1 | CM373: =RC[-46] -> 0 | CN373: =RC[-46] -> 0 | CO373: =RC[-46] -> 4677630.21 | CP373: =RC[-46] -> 0 | CQ373: =RC[-46] -> 0 | CR373: =RC[-46] -> 0 | CS373: =RC[-46] -> 0
A374: 7 | B374: 012597 | C374: Doãn Thị Thanh Hà | D374: Nv vệ sinh | E374: 10823281572010 | F374: =RC[29]+RC[30]+RC[31]+RC[32]+RC[33]+RC[34]+RC[35]+RC[36]+RC[37] -> 3969001 | G374: =RC[17]+RC[18]++RC[19]+RC[20]+RC[21]+RC[38]+RC[39]+RC[41] -> 0 | H374: 0 | I374: 0 | J374: =RC[-2]+RC[-1] -> 0 | K374: 0 | L374: 680000 | M374: 193200 | N374: =RC[15]+RC[16]+RC[17]+RC[18]+RC[19]+RC[20] -> 0 | O374: 0 | P374: 0 | Q374: 4842201 | R374: 147200 | S374: 27600 | T374: 18400 | U374: 46490.01 | V374: 0 | W374: 4602510.99 | X374: 0 | Y374: 0 | Z374: 0 | AA374: 0 | AB374: 0 | AC374: 0 | AD374: 0 | AE374: 0 | AF374: 0 | AG374: 0 | AH374: 0 | AI374: 3969001 | AJ374: 0 | AK374: 0 | AL374: 0 | AM374: 0 | AN374: 0 | AO374: 0 | AP374: 0 | AQ374: 0 | AR374: =1 -> 1 | AS374: 0 | AT374: 0 | AU374: =RC[-30]-RC[-29]-RC[-28]-RC[-27]-RC[-26]-RC[-25] -> 4602510.99 | AV374: 0 | AW374: =RC[1]-RC[2] -> 0 | AX374: 0 | AY374: 0 | AZ374: =RC[-46] -> 3969001 | BA374: =RC[-46] -> 0 | BB374: =RC[-46] -> 0 | BC374: =RC[-46] -> 0 | BD374: =RC[-46] -> 0 | BE374: =RC[-46] -> 0 | BF374: =RC[-46] -> 680000 | BG374: =RC[-46] -> 193200 | BH374: =RC[-46] -> 0 | BI374: =RC[-46] -> 0 | BJ374: =RC[-46] -> 0 | BK374: =RC[-46] -> 4842201 | BL374: =RC[-46] -> 147200 | BM374: =RC[-46] -> 27600 | BN374: =RC[-46] -> 18400 | BO374: =RC[-46] -> 46490.01 | BP374: =RC[-46] -> 0 | BQ374: =RC[-46] -> 4602510.99 | BR374: =RC[-46] -> 0 | BS374: =RC[-46] -> 0 | BT374: =RC[-46] -> 0 | BU374: =RC[-46] -> 0 | BV374: =RC[-46] -> 0 | BW374: =RC[-46] -> 0 | BX374: =RC[-46] -> 0 | BY374: =RC[-46] -> 0 | BZ374: =RC[-46] -> 0 | CA374: =RC[-46] -> 0 | CB374: =RC[-46] -> 0 | CC374: =RC[-46] -> 3969001 | CD374: =RC[-46] -> 0 | CE374: =RC[-46] -> 0 | CF374: =RC[-46] -> 0 | CG374: =RC[-46] -> 0 | CH374: =RC[-46] -> 0 | CI374: =RC[-46] -> 0 | CJ374: =RC[-46] -> 0 | CK374: =RC[-46] -> 0 | CL374: =RC[-46] -> 1 | CM374: =RC[-46] -> 0 | CN374: =RC[-46] -> 0 | CO374: =RC[-46] -> 4602510.99 | CP374: =RC[-46] -> 0 | CQ374: =RC[-46] -> 0 | CR374: =RC[-46] -> 0 | CS374: =RC[-46] -> 0
A375: 8 | B375: 013098 | C375: Đặng Thị Thúy Hằng | D375: Nv vệ sinh | E375: 19028834689017 | F375: =RC[29]+RC[30]+RC[31]+RC[32]+RC[33]+RC[34]+RC[35]+RC[36]+RC[37] -> 3852266 | G375: =RC[17]+RC[18]++RC[19]+RC[20]+RC[21]+RC[38]+RC[39]+RC[41] -> 0 | H375: 0 | I375: 0 | J375: =RC[-2]+RC[-1] -> 0 | K375: 0 | L375: 680000 | M375: 193200 | N375: =RC[15]+RC[16]+RC[17]+RC[18]+RC[19]+RC[20] -> 0 | O375: 0 | P375: 0 | Q375: 4725466 | R375: 147200 | S375: 27600 | T375: 18400 | U375: 45322.66 | V375: 0 | W375: 4486943.34 | X375: 0 | Y375: 0 | Z375: 0 | AA375: 0 | AB375: 0 | AC375: 0 | AD375: 0 | AE375: 0 | AF375: 0 | AG375: 0 | AH375: 0 | AI375: 3852266 | AJ375: 0 | AK375: 0 | AL375: 0 | AM375: 0 | AN375: 0 | AO375: 0 | AP375: 0 | AQ375: 0 | AR375: =1 -> 1 | AS375: 0 | AT375: 0 | AU375: =RC[-30]-RC[-29]-RC[-28]-RC[-27]-RC[-26]-RC[-25] -> 4486943.34 | AV375: 0 | AW375: =RC[1]-RC[2] -> 0 | AX375: 0 | AY375: 0 | AZ375: =RC[-46] -> 3852266 | BA375: =RC[-46] -> 0 | BB375: =RC[-46] -> 0 | BC375: =RC[-46] -> 0 | BD375: =RC[-46] -> 0 | BE375: =RC[-46] -> 0 | BF375: =RC[-46] -> 680000 | BG375: =RC[-46] -> 193200 | BH375: =RC[-46] -> 0 | BI375: =RC[-46] -> 0 | BJ375: =RC[-46] -> 0 | BK375: =RC[-46] -> 4725466 | BL375: =RC[-46] -> 147200 | BM375: =RC[-46] -> 27600 | BN375: =RC[-46] -> 18400 | BO375: =RC[-46] -> 45322.66 | BP375: =RC[-46] -> 0 | BQ375: =RC[-46] -> 4486943.34 | BR375: =RC[-46] -> 0 | BS375: =RC[-46] -> 0 | BT375: =RC[-46] -> 0 | BU375: =RC[-46] -> 0 | BV375: =RC[-46] -> 0 | BW375: =RC[-46] -> 0 | BX375: =RC[-46] -> 0 | BY375: =RC[-46] -> 0 | BZ375: =RC[-46] -> 0 | CA375: =RC[-46] -> 0 | CB375: =RC[-46] -> 0 | CC375: =RC[-46] -> 3852266 | CD375: =RC[-46] -> 0 | CE375: =RC[-46] -> 0 | CF375: =RC[-46] -> 0 | CG375: =RC[-46] -> 0 | CH375: =RC[-46] -> 0 | CI375: =RC[-46] -> 0 | CJ375: =RC[-46] -> 0 | CK375: =RC[-46] -> 0 | CL375: =RC[-46] -> 1 | CM375: =RC[-46] -> 0 | CN375: =RC[-46] -> 0 | CO375: =RC[-46] -> 4486943.34 | CP375: =RC[-46] -> 0 | CQ375: =RC[-46] -> 0 | CR375: =RC[-46] -> 0 | CS375: =RC[-46] -> 0
A376: 9 | B376: 013100 | C376: Nguyễn Thị Mến | D376: Nv vệ sinh | E376: 19028834691011 | F376: =RC[29]+RC[30]+RC[31]+RC[32]+RC[33]+RC[34]+RC[35]+RC[36]+RC[37] -> 3852266 | G376: =RC[17]+RC[18]++RC[19]+RC[20]+RC[21]+RC[38]+RC[39]+RC[41] -> 0 | H376: 0 | I376: 0 | J376: =RC[-2]+RC[-1] -> 0 | K376: 0 | L376: 680000 | M376: 193200 | N376: =RC[15]+RC[16]+RC[17]+RC[18]+RC[19]+RC[20] -> 0 | O376: 0 | P376: 0 | Q376: 4725466 | R376: 147200 | S376: 27600 | T376: 18400 | U376: 45322.66 | V376: 0 | W376: 4486943.34 | X376: 0 | Y376: 0 | Z376: 0 | AA376: 0 | AB376: 0 | AC376: 0 | AD376: 0 | AE376: 0 | AF376: 0 | AG376: 0 | AH376: 0 | AI376: 3852266 | AJ376: 0 | AK376: 0 | AL376: 0 | AM376: 0 | AN376: 0 | AO376: 0 | AP376: 0 | AQ376: 0 | AR376: =1 -> 1 | AS376: 0 | AT376: 0 | AU376: =RC[-30]-RC[-29]-RC[-28]-RC[-27]-RC[-26]-RC[-25] -> 4486943.34 | AV376: 0 | AW376: =RC[1]-RC[2] -> 0 | AX376: 0 | AY376: 0 | AZ376: =RC[-46] -> 3852266 | BA376: =RC[-46] -> 0 | BB376: =RC[-46] -> 0 | BC376: =RC[-46] -> 0 | BD376: =RC[-46] -> 0 | BE376: =RC[-46] -> 0 | BF376: =RC[-46] -> 680000 | BG376: =RC[-46] -> 193200 | BH376: =RC[-46] -> 0 | BI376: =RC[-46] -> 0 | BJ376: =RC[-46] -> 0 | BK376: =RC[-46] -> 4725466 | BL376: =RC[-46] -> 147200 | BM376: =RC[-46] -> 27600 | BN376: =RC[-46] -> 18400 | BO376: =RC[-46] -> 45322.66 | BP376: =RC[-46] -> 0 | BQ376: =RC[-46] -> 4486943.34 | BR376: =RC[-46] -> 0 | BS376: =RC[-46] -> 0 | BT376: =RC[-46] -> 0 | BU376: =RC[-46] -> 0 | BV376: =RC[-46] -> 0 | BW376: =RC[-46] -> 0 | BX376: =RC[-46] -> 0 | BY376: =RC[-46] -> 0 | BZ376: =RC[-46] -> 0 | CA376: =RC[-46] -> 0 | CB376: =RC[-46] -> 0 | CC376: =RC[-46] -> 3852266 | CD376: =RC[-46] -> 0 | CE376: =RC[-46] -> 0 | CF376: =RC[-46] -> 0 | CG376: =RC[-46] -> 0 | CH376: =RC[-46] -> 0 | CI376: =RC[-46] -> 0 | CJ376: =RC[-46] -> 0 | CK376: =RC[-46] -> 0 | CL376: =RC[-46] -> 1 | CM376: =RC[-46] -> 0 | CN376: =RC[-46] -> 0 | CO376: =RC[-46] -> 4486943.34 | CP376: =RC[-46] -> 0 | CQ376: =RC[-46] -> 0 | CR376: =RC[-46] -> 0 | CS376: =RC[-46] -> 0
A377: 10 | B377: 010754 | C377: Đào Hồng Phúc | D377: Nv VS MB | E377: 10522162862019 | F377: =RC[29]+RC[30]+RC[31]+RC[32]+RC[33]+RC[34]+RC[35]+RC[36]+RC[37] -> 4815332 | G377: =RC[17]+RC[18]++RC[19]+RC[20]+RC[21]+RC[38]+RC[39]+RC[41] -> 0 | H377: 0 | I377: 0 | J377: =RC[-2]+RC[-1] -> 0 | K377: 0 | L377: 680000 | M377: 277725 | N377: =RC[15]+RC[16]+RC[17]+RC[18]+RC[19]+RC[20] -> 0 | O377: 0 | P377: 0 | Q377: 5773057 | R377: 211600 | S377: 39675 | T377: 26450 | U377: 54953.32 | V377: 0 | W377: 5440378.6799999997 | X377: 0 | Y377: 0 | Z377: 0 | AA377: 0 | AB377: 0 | AC377: 0 | AD377: 0 | AE377: 0 | AF377: 0 | AG377: 0 | AH377: 0 | AI377: 4815332 | AJ377: 0 | AK377: 0 | AL377: 0 | AM377: 0 | AN377: 0 | AO377: 0 | AP377: 0 | AQ377: 0 | AR377: =1 -> 1 | AS377: 0 | AT377: 0 | AU377: =RC[-30]-RC[-29]-RC[-28]-RC[-27]-RC[-26]-RC[-25] -> 5440378.6799999997 | AV377: 0 | AW377: =RC[1]-RC[2] -> 0 | AX377: 0 | AY377: 0 | AZ377: =RC[-46] -> 4815332 | BA377: =RC[-46] -> 0 | BB377: =RC[-46] -> 0 | BC377: =RC[-46] -> 0 | BD377: =RC[-46] -> 0 | BE377: =RC[-46] -> 0 | BF377: =RC[-46] -> 680000 | BG377: =RC[-46] -> 277725 | BH377: =RC[-46] -> 0 | BI377: =RC[-46] -> 0 | BJ377: =RC[-46] -> 0 | BK377: =RC[-46] -> 5773057 | BL377: =RC[-46] -> 211600 | BM377: =RC[-46] -> 39675 | BN377: =RC[-46] -> 26450 | BO377: =RC[-46] -> 54953.32 | BP377: =RC[-46] -> 0 | BQ377: =RC[-46] -> 5440378.6799999997 | BR377: =RC[-46] -> 0 | BS377: =RC[-46] -> 0 | BT377: =RC[-46] -> 0 | BU377: =RC[-46] -> 0 | BV377: =RC[-46] -> 0 | BW377: =RC[-46] -> 0 | BX377: =RC[-46] -> 0 | BY377: =RC[-46] -> 0 | BZ377: =RC[-46] -> 0 | CA377: =RC[-46] -> 0 | CB377: =RC[-46] -> 0 | CC377: =RC[-46] -> 4815332 | CD377: =RC[-46] -> 0 | CE377: =RC[-46] -> 0 | CF377: =RC[-46] -> 0 | CG377: =RC[-46] -> 0 | CH377: =RC[-46] -> 0 | CI377: =RC[-46] -> 0 | CJ377: =RC[-46] -> 0 | CK377: =RC[-46] -> 0 | CL377: =RC[-46] -> 1 | CM377: =RC[-46] -> 0 | CN377: =RC[-46] -> 0 | CO377: =RC[-46] -> 5440378.6799999997 | CP377: =RC[-46] -> 0 | CQ377: =RC[-46] -> 0 | CR377: =RC[-46] -> 0 | CS377: =RC[-46] -> 0
A378: 11 | B378: 010755 | C378: Quàng Thị Hạnh | D378: Nv VS MB | E378: 19027888158010 | F378: =RC[29]+RC[30]+RC[31]+RC[32]+RC[33]+RC[34]+RC[35]+RC[36]+RC[37] -> 5107170 | G378: =RC[17]+RC[18]++RC[19]+RC[20]+RC[21]+RC[38]+RC[39]+RC[41] -> 0 | H378: 0 | I378: 0 | J378: =RC[-2]+RC[-1] -> 0 | K378: 0 | L378: 680000 | M378: 398475 | N378: =RC[15]+RC[16]+RC[17]+RC[18]+RC[19]+RC[20] -> 0 | O378: 0 | P378: 0 | Q378: 6185645 | R378: 303600 | S378: 56925 | T378: 37950 | U378: 57871.7 | V378: 0 | W378: 5729298.2999999998 | X378: 0 | Y378: 0 | Z378: 0 | AA378: 0 | AB378: 0 | AC378: 0 | AD378: 0 | AE378: 0 | AF378: 0 | AG378: 0 | AH378: 0 | AI378: 5107170 | AJ378: 0 | AK378: 0 | AL378: 0 | AM378: 0 | AN378: 0 | AO378: 0 | AP378: 0 | AQ378: 0 | AR378: =1 -> 1 | AS378: 0 | AT378: 0 | AU378: =RC[-30]-RC[-29]-RC[-28]-RC[-27]-RC[-26]-RC[-25] -> 5729298.2999999998 | AV378: 0 | AW378: =RC[1]-RC[2] -> 0 | AX378: 0 | AY378: 0 | AZ378: =RC[-46] -> 5107170 | BA378: =RC[-46] -> 0 | BB378: =RC[-46] -> 0 | BC378: =RC[-46] -> 0 | BD378: =RC[-46] -> 0 | BE378: =RC[-46] -> 0 | BF378: =RC[-46] -> 680000 | BG378: =RC[-46] -> 398475 | BH378: =RC[-46] -> 0 | BI378: =RC[-46] -> 0 | BJ378: =RC[-46] -> 0 | BK378: =RC[-46] -> 6185645 | BL378: =RC[-46] -> 303600 | BM378: =RC[-46] -> 56925 | BN378: =RC[-46] -> 37950 | BO378: =RC[-46] -> 57871.7 | BP378: =RC[-46] -> 0 | BQ378: =RC[-46] -> 5729298.2999999998 | BR378: =RC[-46] -> 0 | BS378: =RC[-46] -> 0 | BT378: =RC[-46] -> 0 | BU378: =RC[-46] -> 0 | BV378: =RC[-46] -> 0 | BW378: =RC[-46] -> 0 | BX378: =RC[-46] -> 0 | BY378: =RC[-46] -> 0 | BZ378: =RC[-46] -> 0 | CA378: =RC[-46] -> 0 | CB378: =RC[-46] -> 0 | CC378: =RC[-46] -> 5107170 | CD378: =RC[-46] -> 0 | CE378: =RC[-46] -> 0 | CF378: =RC[-46] -> 0 | CG378: =RC[-46] -> 0 | CH378: =RC[-46] -> 0 | CI378: =RC[-46] -> 0 | CJ378: =RC[-46] -> 0 | CK378: =RC[-46] -> 0 | CL378: =RC[-46] -> 1 | CM378: =RC[-46] -> 0 | CN378: =RC[-46] -> 0 | CO378: =RC[-46] -> 5729298.2999999998 | CP378: =RC[-46] -> 0 | CQ378: =RC[-46] -> 0 | CR378: =RC[-46] -> 0 | CS378: =RC[-46] -> 0
A379: 12 | B379: 010756 | C379: Nguyễn Thị Bình Minh | D379: Nv VS MB | E379: 10520653609010 | F379: =RC[29]+RC[30]+RC[31]+RC[32]+RC[33]+RC[34]+RC[35]+RC[36]+RC[37] -> 5107170 | G379: =RC[17]+RC[18]++RC[19]+RC[20]+RC[21]+RC[38]+RC[39]+RC[41] -> 0 | H379: 0 | I379: 0 | J379: =RC[-2]+RC[-1] -> 0 | K379: 0 | L379: 680000 | M379: 398475 | N379: =RC[15]+RC[16]+RC[17]+RC[18]+RC[19]+RC[20] -> 0 | O379: 0 | P379: 0 | Q379: 6185645 | R379: 303600 | S379: 56925 | T379: 37950 | U379: 57871.7 | V379: 0 | W379: 5729298.2999999998 | X379: 0 | Y379: 0 | Z379: 0 | AA379: 0 | AB379: 0 | AC379: 0 | AD379: 0 | AE379: 0 | AF379: 0 | AG379: 0 | AH379: 0 | AI379: 5107170 | AJ379: 0 | AK379: 0 | AL379: 0 | AM379: 0 | AN379: 0 | AO379: 0 | AP379: 0 | AQ379: 0 | AR379: =1 -> 1 | AS379: 0 | AT379: 0 | AU379: =RC[-30]-RC[-29]-RC[-28]-RC[-27]-RC[-26]-RC[-25] -> 5729298.2999999998 | AV379: 0 | AW379: =RC[1]-RC[2] -> 0 | AX379: 0 | AY379: 0 | AZ379: =RC[-46] -> 5107170 | BA379: =RC[-46] -> 0 | BB379: =RC[-46] -> 0 | BC379: =RC[-46] -> 0 | BD379: =RC[-46] -> 0 | BE379: =RC[-46] -> 0 | BF379: =RC[-46] -> 680000 | BG379: =RC[-46] -> 398475 | BH379: =RC[-46] -> 0 | BI379: =RC[-46] -> 0 | BJ379: =RC[-46] -> 0 | BK379: =RC[-46] -> 6185645 | BL379: =RC[-46] -> 303600 | BM379: =RC[-46] -> 56925 | BN379: =RC[-46] -> 37950 | BO379: =RC[-46] -> 57871.7 | BP379: =RC[-46] -> 0 | BQ379: =RC[-46] -> 5729298.2999999998 | BR379: =RC[-46] -> 0 | BS379: =RC[-46] -> 0 | BT379: =RC[-46] -> 0 | BU379: =RC[-46] -> 0 | BV379: =RC[-46] -> 0 | BW379: =RC[-46] -> 0 | BX379: =RC[-46] -> 0 | BY379: =RC[-46] -> 0 | BZ379: =RC[-46] -> 0 | CA379: =RC[-46] -> 0 | CB379: =RC[-46] -> 0 | CC379: =RC[-46] -> 5107170 | CD379: =RC[-46] -> 0 | CE379: =RC[-46] -> 0 | CF379: =RC[-46] -> 0 | CG379: =RC[-46] -> 0 | CH379: =RC[-46] -> 0 | CI379: =RC[-46] -> 0 | CJ379: =RC[-46] -> 0 | CK379: =RC[-46] -> 0 | CL379: =RC[-46] -> 1 | CM379: =RC[-46] -> 0 | CN379: =RC[-46] -> 0 | CO379: =RC[-46] -> 5729298.2999999998 | CP379: =RC[-46] -> 0 | CQ379: =RC[-46] -> 0 | CR379: =RC[-46] -> 0 | CS379: =RC[-46] -> 0
A380: 13 | B380: 010757 | C380: Nguyễn Văn Quý | D380: Nv VS MB | E380: 10520082208013 | F380: =RC[29]+RC[30]+RC[31]+RC[32]+RC[33]+RC[34]+RC[35]+RC[36]+RC[37] -> 4902884 | G380: =RC[17]+RC[18]++RC[19]+RC[20]+RC[21]+RC[38]+RC[39]+RC[41] -> 0 | H380: 0 | I380: 0 | J380: =RC[-2]+RC[-1] -> 0 | K380: 0 | L380: 680000 | M380: 298253 | N380: =RC[15]+RC[16]+RC[17]+RC[18]+RC[19]+RC[20] -> 299250 | O380: 0 | P380: 0 | Q380: 6180387 | R380: 227240 | S380: 42608 | T380: 28405 | U380: 58821.34 | V380: 0 | W380: 5823312.6600000001 | X380: 0 | Y380: 0 | Z380: 0 | AA380: 0 | AB380: 0 | AC380: 0 | AD380: 0 | AE380: 0 | AF380: 0 | AG380: 0 | AH380: 299250 | AI380: 4902884 | AJ380: 0 | AK380: 0 | AL380: 0 | AM380: 0 | AN380: 0 | AO380: 0 | AP380: 0 | AQ380: 0 | AR380: =1 -> 1 | AS380: 0 | AT380: 0 | AU380: =RC[-30]-RC[-29]-RC[-28]-RC[-27]-RC[-26]-RC[-25] -> 5823312.6600000001 | AV380: 0 | AW380: =RC[1]-RC[2] -> 99750 | AX380: 299250 | AY380: 199500 | AZ380: =RC[-46] -> 4902884 | BA380: =RC[-46] -> 0 | BB380: =RC[-46] -> 0 | BC380: =RC[-46] -> 0 | BD380: =RC[-46] -> 0 | BE380: =RC[-46] -> 0 | BF380: =RC[-46] -> 680000 | BG380: =RC[-46] -> 298253 | BH380: =RC[-46] -> 299250 | BI380: =RC[-46] -> 0 | BJ380: =RC[-46] -> 0 | BK380: =RC[-46] -> 6180387 | BL380: =RC[-46] -> 227240 | BM380: =RC[-46] -> 42608 | BN380: =RC[-46] -> 28405 | BO380: =RC[-46] -> 58821.34 | BP380: =RC[-46] -> 0 | BQ380: =RC[-46] -> 5823312.6600000001 | BR380: =RC[-46] -> 0 | BS380: =RC[-46] -> 0 | BT380: =RC[-46] -> 0 | BU380: =RC[-46] -> 0 | BV380: =RC[-46] -> 0 | BW380: =RC[-46] -> 0 | BX380: =RC[-46] -> 0 | BY380: =RC[-46] -> 0 | BZ380: =RC[-46] -> 0 | CA380: =RC[-46] -> 0 | CB380: =RC[-46] -> 299250 | CC380: =RC[-46] -> 4902884 | CD380: =RC[-46] -> 0 | CE380: =RC[-46] -> 0 | CF380: =RC[-46] -> 0 | CG380: =RC[-46] -> 0 | CH380: =RC[-46] -> 0 | CI380: =RC[-46] -> 0 | CJ380: =RC[-46] -> 0 | CK380: =RC[-46] -> 0 | CL380: =RC[-46] -> 1 | CM380: =RC[-46] -> 0 | CN380: =RC[-46] -> 0 | CO380: =RC[-46] -> 5823312.6600000001 | CP380: =RC[-46] -> 0 | CQ380: =RC[-46] -> 99750 | CR380: =RC[-46] -> 299250 | CS380: =RC[-46] -> 199500
A381: 14 | B381: 010759 | C381: Nguyễn Anh Đức | D381: Nv VS MB | E381: 10522162865018 | F381: =RC[29]+RC[30]+RC[31]+RC[32]+RC[33]+RC[34]+RC[35]+RC[36]+RC[37] -> 4815332 | G381: =RC[17]+RC[18]++RC[19]+RC[20]+RC[21]+RC[38]+RC[39]+RC[41] -> 0 | H381: 0 | I381: 0 | J381: =RC[-2]+RC[-1] -> 0 | K381: 0 | L381: 680000 | M381: 277725 | N381: =RC[15]+RC[16]+RC[17]+RC[18]+RC[19]+RC[20] -> 0 | O381: 0 | P381: 0 | Q381: 5773057 | R381: 211600 | S381: 39675 | T381: 26450 | U381: 54953.32 | V381: 0 | W381: 5440378.6799999997 | X381: 0 | Y381: 0 | Z381: 0 | AA381: 0 | AB381: 0 | AC381: 0 | AD381: 0 | AE381: 0 | AF381: 0 | AG381: 0 | AH381: 0 | AI381: 4815332 | AJ381: 0 | AK381: 0 | AL381: 0 | AM381: 0 | AN381: 0 | AO381: 0 | AP381: 0 | AQ381: 0 | AR381: =1 -> 1 | AS381: 0 | AT381: 0 | AU381: =RC[-30]-RC[-29]-RC[-28]-RC[-27]-RC[-26]-RC[-25] -> 5440378.6799999997 | AV381: 0 | AW381: =RC[1]-RC[2] -> 0 | AX381: 0 | AY381: 0 | AZ381: =RC[-46] -> 4815332 | BA381: =RC[-46] -> 0 | BB381: =RC[-46] -> 0 | BC381: =RC[-46] -> 0 | BD381: =RC[-46] -> 0 | BE381: =RC[-46] -> 0 | BF381: =RC[-46] -> 680000 | BG381: =RC[-46] -> 277725 | BH381: =RC[-46] -> 0 | BI381: =RC[-46] -> 0 | BJ381: =RC[-46] -> 0 | BK381: =RC[-46] -> 5773057 | BL381: =RC[-46] -> 211600 | BM381: =RC[-46] -> 39675 | BN381: =RC[-46] -> 26450 | BO381: =RC[-46] -> 54953.32 | BP381: =RC[-46] -> 0 | BQ381: =RC[-46] -> 5440378.6799999997 | BR381: =RC[-46] -> 0 | BS381: =RC[-46] -> 0 | BT381: =RC[-46] -> 0 | BU381: =RC[-46] -> 0 | BV381: =RC[-46] -> 0 | BW381: =RC[-46] -> 0 | BX381: =RC[-46] -> 0 | BY381: =RC[-46] -> 0 | BZ381: =RC[-46] -> 0 | CA381: =RC[-46] -> 0 | CB381: =RC[-46] -> 0 | CC381: =RC[-46] -> 4815332 | CD381: =RC[-46] -> 0 | CE381: =RC[-46] -> 0 | CF381: =RC[-46] -> 0 | CG381: =RC[-46] -> 0 | CH381: =RC[-46] -> 0 | CI381: =RC[-46] -> 0 | CJ381: =RC[-46] -> 0 | CK381: =RC[-46] -> 0 | CL381: =RC[-46] -> 1 | CM381: =RC[-46] -> 0 | CN381: =RC[-46] -> 0 | CO381: =RC[-46] -> 5440378.6799999997 | CP381: =RC[-46] -> 0 | CQ381: =RC[-46] -> 0 | CR381: =RC[-46] -> 0 | CS381: =RC[-46] -> 0
A382: 15 | B382: 010760 | C382: Trần Thị Ngọc Lan | D382: Nv VS MB | E382: 10522162843014 | F382: =RC[29]+RC[30]+RC[31]+RC[32]+RC[33]+RC[34]+RC[35]+RC[36]+RC[37] -> 2407666 | G382: =RC[17]+RC[18]++RC[19]+RC[20]+RC[21]+RC[38]+RC[39]+RC[41] -> 0 | H382: 0 | I382: 0 | J382: =RC[-2]+RC[-1] -> 0 | K382: 0 | L382: 0 | M382: 0 | N382: =RC[15]+RC[16]+RC[17]+RC[18]+RC[19]+RC[20] -> 0 | O382: 0 | P382: 0 | Q382: 2407666 | R382: 0 | S382: 0 | T382: 0 | U382: 24076.66 | V382: 0 | W382: 2383589.34 | X382: 0 | Y382: 0 | Z382: 0 | AA382: 0 | AB382: 0 | AC382: 0 | AD382: 0 | AE382: 0 | AF382: 0 | AG382: 0 | AH382: 0 | AI382: 0 | AJ382: 2407666 | AK382: 0 | AL382: 0 | AM382: 0 | AN382: 0 | AO382: 0 | AP382: 0 | AQ382: 0 | AR382: =1 -> 1 | AS382: 0 | AT382: 0 | AU382: =RC[-30]-RC[-29]-RC[-28]-RC[-27]-RC[-26]-RC[-25] -> 2383589.34 | AV382: 0 | AW382: =RC[1]-RC[2] -> 0 | AX382: 0 | AY382: 0 | AZ382: =RC[-46] -> 2407666 | BA382: =RC[-46] -> 0 | BB382: =RC[-46] -> 0 | BC382: =RC[-46] -> 0 | BD382: =RC[-46] -> 0 | BE382: =RC[-46] -> 0 | BF382: =RC[-46] -> 0 | BG382: =RC[-46] -> 0 | BH382: =RC[-46] -> 0 | BI382: =RC[-46] -> 0 | BJ382: =RC[-46] -> 0 | BK382: =RC[-46] -> 2407666 | BL382: =RC[-46] -> 0 | BM382: =RC[-46] -> 0 | BN382: =RC[-46] -> 0 | BO382: =RC[-46] -> 24076.66 | BP382: =RC[-46] -> 0 | BQ382: =RC[-46] -> 2383589.34 | BR382: =RC[-46] -> 0 | BS382: =RC[-46] -> 0 | BT382: =RC[-46] -> 0 | BU382: =RC[-46] -> 0 | BV382: =RC[-46] -> 0 | BW382: =RC[-46] -> 0 | BX382: =RC[-46] -> 0 | BY382: =RC[-46] -> 0 | BZ382: =RC[-46] -> 0 | CA382: =RC[-46] -> 0 | CB382: =RC[-46] -> 0 | CC382: =RC[-46] -> 0 | CD382: =RC[-46] -> 2407666 | CE382: =RC[-46] -> 0 | CF382: =RC[-46] -> 0 | CG382: =RC[-46] -> 0 | CH382: =RC[-46] -> 0 | CI382: =RC[-46] -> 0 | CJ382: =RC[-46] -> 0 | CK382: =RC[-46] -> 0 | CL382: =RC[-46] -> 1 | CM382: =RC[-46] -> 0 | CN382: =RC[-46] -> 0 | CO382: =RC[-46] -> 2383589.34 | CP382: =RC[-46] -> 0 | CQ382: =RC[-46] -> 0 | CR382: =RC[-46] -> 0 | CS382: =RC[-46] -> 0
A383: 16 | B383: 010761 | C383: Nguyễn Thị Anh Thơ | D383: Nv VS MB | E383: 10521622097018 | F383: =RC[29]+RC[30]+RC[31]+RC[32]+RC[33]+RC[34]+RC[35]+RC[36]+RC[37] -> 4815332 | G383: =RC[17]+RC[18]++RC[19]+RC[20]+RC[21]+RC[38]+RC[39]+RC[41] -> 0 | H383: 0 | I383: 0 | J383: =RC[-2]+RC[-1] -> 0 | K383: 0 | L383: 680000 | M383: 277725 | N383: =RC[15]+RC[16]+RC[17]+RC[18]+RC[19]+RC[20] -> 0 | O383: 0 | P383: 0 | Q383: 5773057 | R383: 211600 | S383: 39675 | T383: 26450 | U383: 54953.32 | V383: 0 | W383: 5440378.6799999997 | X383: 0 | Y383: 0 | Z383: 0 | AA383: 0 | AB383: 0 | AC383: 0 | AD383: 0 | AE383: 0 | AF383: 0 | AG383: 0 | AH383: 0 | AI383: 4815332 | AJ383: 0 | AK383: 0 | AL383: 0 | AM383: 0 | AN383: 0 | AO383: 0 | AP383: 0 | AQ383: 0 | AR383: =1 -> 1 | AS383: 0 | AT383: 0 | AU383: =RC[-30]-RC[-29]-RC[-28]-RC[-27]-RC[-26]-RC[-25] -> 5440378.6799999997 | AV383: 0 | AW383: =RC[1]-RC[2] -> 0 | AX383: 0 | AY383: 0 | AZ383: =RC[-46] -> 4815332 | BA383: =RC[-46] -> 0 | BB383: =RC[-46] -> 0 | BC383: =RC[-46] -> 0 | BD383: =RC[-46] -> 0 | BE383: =RC[-46] -> 0 | BF383: =RC[-46] -> 680000 | BG383: =RC[-46] -> 277725 | BH383: =RC[-46] -> 0 | BI383: =RC[-46] -> 0 | BJ383: =RC[-46] -> 0 | BK383: =RC[-46] -> 5773057 | BL383: =RC[-46] -> 211600 | BM383: =RC[-46] -> 39675 | BN383: =RC[-46] -> 26450 | BO383: =RC[-46] -> 54953.32 | BP383: =RC[-46] -> 0 | BQ383: =RC[-46] -> 5440378.6799999997 | BR383: =RC[-46] -> 0 | BS383: =RC[-46] -> 0 | BT383: =RC[-46] -> 0 | BU383: =RC[-46] -> 0 | BV383: =RC[-46] -> 0 | BW383: =RC[-46] -> 0 | BX383: =RC[-46] -> 0 | BY383: =RC[-46] -> 0 | BZ383: =RC[-46] -> 0 | CA383: =RC[-46] -> 0 | CB383: =RC[-46] -> 0 | CC383: =RC[-46] -> 4815332 | CD383: =RC[-46] -> 0 | CE383: =RC[-46] -> 0 | CF383: =RC[-46] -> 0 | CG383: =RC[-46] -> 0 | CH383: =RC[-46] -> 0 | CI383: =RC[-46] -> 0 | CJ383: =RC[-46] -> 0 | CK383: =RC[-46] -> 0 | CL383: =RC[-46] -> 1 | CM383: =RC[-46] -> 0 | CN383: =RC[-46] -> 0 | CO383: =RC[-46] -> 5440378.6799999997 | CP383: =RC[-46] -> 0 | CQ383: =RC[-46] -> 0 | CR383: =RC[-46] -> 0 | CS383: =RC[-46] -> 0
A384: 17 | B384: 010762 | C384: Nguyễn Thị Kim Thu | D384: Nv VS MB | E384: 10520054750015 | F384: =RC[29]+RC[30]+RC[31]+RC[32]+RC[33]+RC[34]+RC[35]+RC[36]+RC[37] -> 2749117 | G384: =RC[17]+RC[18]++RC[19]+RC[20]+RC[21]+RC[38]+RC[39]+RC[41] -> 1332692 | H384: 0 | I384: 0 | J384: =RC[-2]+RC[-1] -> 0 | K384: 0 | L384: 366154 | M384: 332063 | N384: =RC[15]+RC[16]+RC[17]+RC[18]+RC[19]+RC[20] -> 0 | O384: 0 | P384: 0 | Q384: 4780026 | R384: 253000 | S384: 47438 | T384: 31625 | U384: 44479.63 | V384: 0 | W384: 4403483.37 | X384: 0 | Y384: 1332692 | Z384: 0 | AA384: 0 | AB384: 0 | AC384: 0 | AD384: 0 | AE384: 0 | AF384: 0 | AG384: 0 | AH384: 0 | AI384: 2749117 | AJ384: 0 | AK384: 0 | AL384: 0 | AM384: 0 | AN384: 0 | AO384: 0 | AP384: 0 | AQ384: 0 | AR384: =1 -> 1 | AS384: 0 | AT384: 0 | AU384: =RC[-30]-RC[-29]-RC[-28]-RC[-27]-RC[-26]-RC[-25] -> 4403483.37 | AV384: 0 | AW384: =RC[1]-RC[2] -> 0 | AX384: 0 | AY384: 0 | AZ384: =RC[-46] -> 2749117 | BA384: =RC[-46] -> 1332692 | BB384: =RC[-46] -> 0 | BC384: =RC[-46] -> 0 | BD384: =RC[-46] -> 0 | BE384: =RC[-46] -> 0 | BF384: =RC[-46] -> 366154 | BG384: =RC[-46] -> 332063 | BH384: =RC[-46] -> 0 | BI384: =RC[-46] -> 0 | BJ384: =RC[-46] -> 0 | BK384: =RC[-46] -> 4780026 | BL384: =RC[-46] -> 253000 | BM384: =RC[-46] -> 47438 | BN384: =RC[-46] -> 31625 | BO384: =RC[-46] -> 44479.63 | BP384: =RC[-46] -> 0 | BQ384: =RC[-46] -> 4403483.37 | BR384: =RC[-46] -> 0 | BS384: =RC[-46] -> 1332692 | BT384: =RC[-46] -> 0 | BU384: =RC[-46] -> 0 | BV384: =RC[-46] -> 0 | BW384: =RC[-46] -> 0 | BX384: =RC[-46] -> 0 | BY384: =RC[-46] -> 0 | BZ384: =RC[-46] -> 0 | CA384: =RC[-46] -> 0 | CB384: =RC[-46] -> 0 | CC384: =RC[-46] -> 2749117 | CD384: =RC[-46] -> 0 | CE384: =RC[-46] -> 0 | CF384: =RC[-46] -> 0 | CG384: =RC[-46] -> 0 | CH384: =RC[-46] -> 0 | CI384: =RC[-46] -> 0 | CJ384: =RC[-46] -> 0 | CK384: =RC[-46] -> 0 | CL384: =RC[-46] -> 1 | CM384: =RC[-46] -> 0 | CN384: =RC[-46] -> 0 | CO384: =RC[-46] -> 4403483.37 | CP384: =RC[-46] -> 0 | CQ384: =RC[-46] -> 0 | CR384: =RC[-46] -> 0 | CS384: =RC[-46] -> 0
A385: 18 | B385: 010763 | C385: Nguyễn Thị Ngà | D385: Nv VS MB | E385: 10521802139010 | F385: =RC[29]+RC[30]+RC[31]+RC[32]+RC[33]+RC[34]+RC[35]+RC[36]+RC[37] -> 5107170 | G385: =RC[17]+RC[18]++RC[19]+RC[20]+RC[21]+RC[38]+RC[39]+RC[41] -> 0 | H385: 0 | I385: 0 | J385: =RC[-2]+RC[-1] -> 0 | K385: 0 | L385: 680000 | M385: 332063 | N385: =RC[15]+RC[16]+RC[17]+RC[18]+RC[19]+RC[20] -> 0 | O385: 0 | P385: 0 | Q385: 6119233 | R385: 253000 | S385: 47438 | T385: 31625 | U385: 57871.7 | V385: 0 | W385: 5729298.2999999998 | X385: 0 | Y385: 0 | Z385: 0 | AA385: 0 | AB385: 0 | AC385: 0 | AD385: 0 | AE385: 0 | AF385: 0 | AG385: 0 | AH385: 0 | AI385: 5107170 | AJ385: 0 | AK385: 0 | AL385: 0 | AM385: 0 | AN385: 0 | AO385: 0 | AP385: 0 | AQ385: 0 | AR385: =1 -> 1 | AS385: 0 | AT385: 0 | AU385: =RC[-30]-RC[-29]-RC[-28]-RC[-27]-RC[-26]-RC[-25] -> 5729298.2999999998 | AV385: 0 | AW385: =RC[1]-RC[2] -> 0 | AX385: 0 | AY385: 0 | AZ385: =RC[-46] -> 5107170 | BA385: =RC[-46] -> 0 | BB385: =RC[-46] -> 0 | BC385: =RC[-46] -> 0 | BD385: =RC[-46] -> 0 | BE385: =RC[-46] -> 0 | BF385: =RC[-46] -> 680000 | BG385: =RC[-46] -> 332063 | BH385: =RC[-46] -> 0 | BI385: =RC[-46] -> 0 | BJ385: =RC[-46] -> 0 | BK385: =RC[-46] -> 6119233 | BL385: =RC[-46] -> 253000 | BM385: =RC[-46] -> 47438 | BN385: =RC[-46] -> 31625 | BO385: =RC[-46] -> 57871.7 | BP385: =RC[-46] -> 0 | BQ385: =RC[-46] -> 5729298.2999999998 | BR385: =RC[-46] -> 0 | BS385: =RC[-46] -> 0 | BT385: =RC[-46] -> 0 | BU385: =RC[-46] -> 0 | BV385: =RC[-46] -> 0 | BW385: =RC[-46] -> 0 | BX385: =RC[-46] -> 0 | BY385: =RC[-46] -> 0 | BZ385: =RC[-46] -> 0 | CA385: =RC[-46] -> 0 | CB385: =RC[-46] -> 0 | CC385: =RC[-46] -> 5107170 | CD385: =RC[-46] -> 0 | CE385: =RC[-46] -> 0 | CF385: =RC[-46] -> 0 | CG385: =RC[-46] -> 0 | CH385: =RC[-46] -> 0 | CI385: =RC[-46] -> 0 | CJ385: =RC[-46] -> 0 | CK385: =RC[-46] -> 0 | CL385: =RC[-46] -> 1 | CM385: =RC[-46] -> 0 | CN385: =RC[-46] -> 0 | CO385: =RC[-46] -> 5729298.2999999998 | CP385: =RC[-46] -> 0 | CQ385: =RC[-46] -> 0 | CR385: =RC[-46] -> 0 | CS385: =RC[-46] -> 0
A386: 19 | B386: 010764 | C386: Nguyễn Thị Kim Anh | D386: Nv VS MB | E386: 10522162747015 | F386: =RC[29]+RC[30]+RC[31]+RC[32]+RC[33]+RC[34]+RC[35]+RC[36]+RC[37] -> 4815332 | G386: =RC[17]+RC[18]++RC[19]+RC[20]+RC[21]+RC[38]+RC[39]+RC[41] -> 0 | H386: 0 | I386: 0 | J386: =RC[-2]+RC[-1] -> 0 | K386: 0 | L386: 680000 | M386: 277725 | N386: =RC[15]+RC[16]+RC[17]+RC[18]+RC[19]+RC[20] -> 0 | O386: 0 | P386: 0 | Q386: 5773057 | R386: 211600 | S386: 39675 | T386: 26450 | U386: 54953.32 | V386: 0 | W386: 5440378.6799999997 | X386: 0 | Y386: 0 | Z386: 0 | AA386: 0 | AB386: 0 | AC386: 0 | AD386: 0 | AE386: 0 | AF386: 0 | AG386: 0 | AH386: 0 | AI386: 4815332 | AJ386: 0 | AK386: 0 | AL386: 0 | AM386: 0 | AN386: 0 | AO386: 0 | AP386: 0 | AQ386: 0 | AR386: =1 -> 1 | AS386: 0 | AT386: 0 | AU386: =RC[-30]-RC[-29]-RC[-28]-RC[-27]-RC[-26]-RC[-25] -> 5440378.6799999997 | AV386: 0 | AW386: =RC[1]-RC[2] -> 0 | AX386: 0 | AY386: 0 | AZ386: =RC[-46] -> 4815332 | BA386: =RC[-46] -> 0 | BB386: =RC[-46] -> 0 | BC386: =RC[-46] -> 0 | BD386: =RC[-46] -> 0 | BE386: =RC[-46] -> 0 | BF386: =RC[-46] -> 680000 | BG386: =RC[-46] -> 277725 | BH386: =RC[-46] -> 0 | BI386: =RC[-46] -> 0 | BJ386: =RC[-46] -> 0 | BK386: =RC[-46] -> 5773057 | BL386: =RC[-46] -> 211600 | BM386: =RC[-46] -> 39675 | BN386: =RC[-46] -> 26450 | BO386: =RC[-46] -> 54953.32 | BP386: =RC[-46] -> 0 | BQ386: =RC[-46] -> 5440378.6799999997 | BR386: =RC[-46] -> 0 | BS386: =RC[-46] -> 0 | BT386: =RC[-46] -> 0 | BU386: =RC[-46] -> 0 | BV386: =RC[-46] -> 0 | BW386: =RC[-46] -> 0 | BX386: =RC[-46] -> 0 | BY386: =RC[-46] -> 0 | BZ386: =RC[-46] -> 0 | CA386: =RC[-46] -> 0 | CB386: =RC[-46] -> 0 | CC386: =RC[-46] -> 4815332 | CD386: =RC[-46] -> 0 | CE386: =RC[-46] -> 0 | CF386: =RC[-46] -> 0 | CG386: =RC[-46] -> 0 | CH386: =RC[-46] -> 0 | CI386: =RC[-46] -> 0 | CJ386: =RC[-46] -> 0 | CK386: =RC[-46] -> 0 | CL386: =RC[-46] -> 1 | CM386: =RC[-46] -> 0 | CN386: =RC[-46] -> 0 | CO386: =RC[-46] -> 5440378.6799999997 | CP386: =RC[-46] -> 0 | CQ386: =RC[-46] -> 0 | CR386: =RC[-46] -> 0 | CS386: =RC[-46] -> 0
A387: 20 | B387: 010766 | C387: Nguyễn Thị Mai | D387: Nv VS MB | E387: 19025652310013 | F387: =RC[29]+RC[30]+RC[31]+RC[32]+RC[33]+RC[34]+RC[35]+RC[36]+RC[37] -> 4290023 | G387: =RC[17]+RC[18]++RC[19]+RC[20]+RC[21]+RC[38]+RC[39]+RC[41] -> 0 | H387: 0 | I387: 0 | J387: =RC[-2]+RC[-1] -> 0 | K387: 0 | L387: 680000 | M387: 193200 | N387: =RC[15]+RC[16]+RC[17]+RC[18]+RC[19]+RC[20] -> 0 | O387: 0 | P387: 0 | Q387: 5163223 | R387: 147200 | S387: 27600 | T387: 18400 | U387: 49700.23 | V387: 0 | W387: 4920322.7699999996 | X387: 0 | Y387: 0 | Z387: 0 | AA387: 0 | AB387: 0 | AC387: 0 | AD387: 0 | AE387: 0 | AF387: 0 | AG387: 0 | AH387: 0 | AI387: 4290023 | AJ387: 0 | AK387: 0 | AL387: 0 | AM387: 0 | AN387: 0 | AO387: 0 | AP387: 0 | AQ387: 0 | AR387: =1 -> 1 | AS387: 0 | AT387: 0 | AU387: =RC[-30]-RC[-29]-RC[-28]-RC[-27]-RC[-26]-RC[-25] -> 4920322.7699999996 | AV387: 0 | AW387: =RC[1]-RC[2] -> 0 | AX387: 0 | AY387: 0 | AZ387: =RC[-46] -> 4290023 | BA387: =RC[-46] -> 0 | BB387: =RC[-46] -> 0 | BC387: =RC[-46] -> 0 | BD387: =RC[-46] -> 0 | BE387: =RC[-46] -> 0 | BF387: =RC[-46] -> 680000 | BG387: =RC[-46] -> 193200 | BH387: =RC[-46] -> 0 | BI387: =RC[-46] -> 0 | BJ387: =RC[-46] -> 0 | BK387: =RC[-46] -> 5163223 | BL387: =RC[-46] -> 147200 | BM387: =RC[-46] -> 27600 | BN387: =RC[-46] -> 18400 | BO387: =RC[-46] -> 49700.23 | BP387: =RC[-46] -> 0 | BQ387: =RC[-46] -> 4920322.7699999996 | BR387: =RC[-46] -> 0 | BS387: =RC[-46] -> 0 | BT387: =RC[-46] -> 0 | BU387: =RC[-46] -> 0 | BV387: =RC[-46] -> 0 | BW387: =RC[-46] -> 0 | BX387: =RC[-46] -> 0 | BY387: =RC[-46] -> 0 | BZ387: =RC[-46] -> 0 | CA387: =RC[-46] -> 0 | CB387: =RC[-46] -> 0 | CC387: =RC[-46] -> 4290023 | CD387: =RC[-46] -> 0 | CE387: =RC[-46] -> 0 | CF387: =RC[-46] -> 0 | CG387: =RC[-46] -> 0 | CH387: =RC[-46] -> 0 | CI387: =RC[-46] -> 0 | CJ387: =RC[-46] -> 0 | CK387: =RC[-46] -> 0 | CL387: =RC[-46] -> 1 | CM387: =RC[-46] -> 0 | CN387: =RC[-46] -> 0 | CO387: =RC[-46] -> 4920322.7699999996 | CP387: =RC[-46] -> 0 | CQ387: =RC[-46] -> 0 | CR387: =RC[-46] -> 0 | CS387: =RC[-46] -> 0
A388: 21 | B388: 010767 | C388: Nguyễn Thị Huệ | D388: Nv VS MB | E388: 10525139526019 | F388: =RC[29]+RC[30]+RC[31]+RC[32]+RC[33]+RC[34]+RC[35]+RC[36]+RC[37] -> 4290023 | G388: =RC[17]+RC[18]++RC[19]+RC[20]+RC[21]+RC[38]+RC[39]+RC[41] -> 0 | H388: 0 | I388: 0 | J388: =RC[-2]+RC[-1] -> 0 | K388: 0 | L388: 680000 | M388: 231840 | N388: =RC[15]+RC[16]+RC[17]+RC[18]+RC[19]+RC[20] -> 0 | O388: 0 | P388: 0 | Q388: 5201863 | R388: 176640 | S388: 33120 | T388: 22080 | U388: 49700.23 | V388: 0 | W388: 4920322.7699999996 | X388: 0 | Y388: 0 | Z388: 0 | AA388: 0 | AB388: 0 | AC388: 0 | AD388: 0 | AE388: 0 | AF388: 0 | AG388: 0 | AH388: 0 | AI388: 4290023 | AJ388: 0 | AK388: 0 | AL388: 0 | AM388: 0 | AN388: 0 | AO388: 0 | AP388: 0 | AQ388: 0 | AR388: =1 -> 1 | AS388: 0 | AT388: 0 | AU388: =RC[-30]-RC[-29]-RC[-28]-RC[-27]-RC[-26]-RC[-25] -> 4920322.7699999996 | AV388: 0 | AW388: =RC[1]-RC[2] -> 0 | AX388: 0 | AY388: 0 | AZ388: =RC[-46] -> 4290023 | BA388: =RC[-46] -> 0 | BB388: =RC[-46] -> 0 | BC388: =RC[-46] -> 0 | BD388: =RC[-46] -> 0 | BE388: =RC[-46] -> 0 | BF388: =RC[-46] -> 680000 | BG388: =RC[-46] -> 231840 | BH388: =RC[-46] -> 0 | BI388: =RC[-46] -> 0 | BJ388: =RC[-46] -> 0 | BK388: =RC[-46] -> 5201863 | BL388: =RC[-46] -> 176640 | BM388: =RC[-46] -> 33120 | BN388: =RC[-46] -> 22080 | BO388: =RC[-46] -> 49700.23 | BP388: =RC[-46] -> 0 | BQ388: =RC[-46] -> 4920322.7699999996 | BR388: =RC[-46] -> 0 | BS388: =RC[-46] -> 0 | BT388: =RC[-46] -> 0 | BU388: =RC[-46] -> 0 | BV388: =RC[-46] -> 0 | BW388: =RC[-46] -> 0 | BX388: =RC[-46] -> 0 | BY388: =RC[-46] -> 0 | BZ388: =RC[-46] -> 0 | CA388: =RC[-46] -> 0 | CB388: =RC[-46] -> 0 | CC388: =RC[-46] -> 4290023 | CD388: =RC[-46] -> 0 | CE388: =RC[-46] -> 0 | CF388: =RC[-46] -> 0 | CG388: =RC[-46] -> 0 | CH388: =RC[-46] -> 0 | CI388: =RC[-46] -> 0 | CJ388: =RC[-46] -> 0 | CK388: =RC[-46] -> 0 | CL388: =RC[-46] -> 1 | CM388: =RC[-46] -> 0 | CN388: =RC[-46] -> 0 | CO388: =RC[-46] -> 4920322.7699999996 | CP388: =RC[-46] -> 0 | CQ388: =RC[-46] -> 0 | CR388: =RC[-46] -> 0 | CS388: =RC[-46] -> 0
A389: 22 | B389: 010768 | C389: Trần Duyên Hải | D389: Nv VS MB | E389: 19024815240011 | F389: =RC[29]+RC[30]+RC[31]+RC[32]+RC[33]+RC[34]+RC[35]+RC[36]+RC[37] -> 4290023 | G389: =RC[17]+RC[18]++RC[19]+RC[20]+RC[21]+RC[38]+RC[39]+RC[41] -> 0 | H389: 0 | I389: 0 | J389: =RC[-2]+RC[-1] -> 0 | K389: 0 | L389: 680000 | M389: 193200 | N389: =RC[15]+RC[16]+RC[17]+RC[18]+RC[19]+RC[20] -> 0 | O389: 0 | P389: 0 | Q389: 5163223 | R389: 147200 | S389: 27600 | T389: 18400 | U389: 49700.23 | V389: 0 | W389: 4920322.7699999996 | X389: 0 | Y389: 0 | Z389: 0 | AA389: 0 | AB389: 0 | AC389: 0 | AD389: 0 | AE389: 0 | AF389: 0 | AG389: 0 | AH389: 0 | AI389: 4290023 | AJ389: 0 | AK389: 0 | AL389: 0 | AM389: 0 | AN389: 0 | AO389: 0 | AP389: 0 | AQ389: 0 | AR389: =1 -> 1 | AS389: 0 | AT389: 0 | AU389: =RC[-30]-RC[-29]-RC[-28]-RC[-27]-RC[-26]-RC[-25] -> 4920322.7699999996 | AV389: 0 | AW389: =RC[1]-RC[2] -> 0 | AX389: 0 | AY389: 0 | AZ389: =RC[-46] -> 4290023 | BA389: =RC[-46] -> 0 | BB389: =RC[-46] -> 0 | BC389: =RC[-46] -> 0 | BD389: =RC[-46] -> 0 | BE389: =RC[-46] -> 0 | BF389: =RC[-46] -> 680000 | BG389: =RC[-46] -> 193200 | BH389: =RC[-46] -> 0 | BI389: =RC[-46] -> 0 | BJ389: =RC[-46] -> 0 | BK389: =RC[-46] -> 5163223 | BL389: =RC[-46] -> 147200 | BM389: =RC[-46] -> 27600 | BN389: =RC[-46] -> 18400 | BO389: =RC[-46] -> 49700.23 | BP389: =RC[-46] -> 0 | BQ389: =RC[-46] -> 4920322.7699999996 | BR389: =RC[-46] -> 0 | BS389: =RC[-46] -> 0 | BT389: =RC[-46] -> 0 | BU389: =RC[-46] -> 0 | BV389: =RC[-46] -> 0 | BW389: =RC[-46] -> 0 | BX389: =RC[-46] -> 0 | BY389: =RC[-46] -> 0 | BZ389: =RC[-46] -> 0 | CA389: =RC[-46] -> 0 | CB389: =RC[-46] -> 0 | CC389: =RC[-46] -> 4290023 | CD389: =RC[-46] -> 0 | CE389: =RC[-46] -> 0 | CF389: =RC[-46] -> 0 | CG389: =RC[-46] -> 0 | CH389: =RC[-46] -> 0 | CI389: =RC[-46] -> 0 | CJ389: =RC[-46] -> 0 | CK389: =RC[-46] -> 0 | CL389: =RC[-46] -> 1 | CM389: =RC[-46] -> 0 | CN389: =RC[-46] -> 0 | CO389: =RC[-46] -> 4920322.7699999996 | CP389: =RC[-46] -> 0 | CQ389: =RC[-46] -> 0 | CR389: =RC[-46] -> 0 | CS389: =RC[-46] -> 0
A390: 23 | B390: 010769 | C390: Nguyễn Thị Hải Yến | D390: Nv VS MB | E390: 19025652313012 | F390: =RC[29]+RC[30]+RC[31]+RC[32]+RC[33]+RC[34]+RC[35]+RC[36]+RC[37] -> 4290023 | G390: =RC[17]+RC[18]++RC[19]+RC[20]+RC[21]+RC[38]+RC[39]+RC[41] -> 0 | H390: 0 | I390: 0 | J390: =RC[-2]+RC[-1] -> 0 | K390: 0 | L390: 680000 | M390: 193200 | N390: =RC[15]+RC[16]+RC[17]+RC[18]+RC[19]+RC[20] -> 0 | O390: 0 | P390: 0 | Q390: 5163223 | R390: 147200 | S390: 27600 | T390: 18400 | U390: 49700.23 | V390: 0 | W390: 4920322.7699999996 | X390: 0 | Y390: 0 | Z390: 0 | AA390: 0 | AB390: 0 | AC390: 0 | AD390: 0 | AE390: 0 | AF390: 0 | AG390: 0 | AH390: 0 | AI390: 4290023 | AJ390: 0 | AK390: 0 | AL390: 0 | AM390: 0 | AN390: 0 | AO390: 0 | AP390: 0 | AQ390: 0 | AR390: =1 -> 1 | AS390: 0 | AT390: 0 | AU390: =RC[-30]-RC[-29]-RC[-28]-RC[-27]-RC[-26]-RC[-25] -> 4920322.7699999996 | AV390: 0 | AW390: =RC[1]-RC[2] -> 0 | AX390: 0 | AY390: 0 | AZ390: =RC[-46] -> 4290023 | BA390: =RC[-46] -> 0 | BB390: =RC[-46] -> 0 | BC390: =RC[-46] -> 0 | BD390: =RC[-46] -> 0 | BE390: =RC[-46] -> 0 | BF390: =RC[-46] -> 680000 | BG390: =RC[-46] -> 193200 | BH390: =RC[-46] -> 0 | BI390: =RC[-46] -> 0 | BJ390: =RC[-46] -> 0 | BK390: =RC[-46] -> 5163223 | BL390: =RC[-46] -> 147200 | BM390: =RC[-46] -> 27600 | BN390: =RC[-46] -> 18400 | BO390: =RC[-46] -> 49700.23 | BP390: =RC[-46] -> 0 | BQ390: =RC[-46] -> 4920322.7699999996 | BR390: =RC[-46] -> 0 | BS390: =RC[-46] -> 0 | BT390: =RC[-46] -> 0 | BU390: =RC[-46] -> 0 | BV390: =RC[-46] -> 0 | BW390: =RC[-46] -> 0 | BX390: =RC[-46] -> 0 | BY390: =RC[-46] -> 0 | BZ390: =RC[-46] -> 0 | CA390: =RC[-46] -> 0 | CB390: =RC[-46] -> 0 | CC390: =RC[-46] -> 4290023 | CD390: =RC[-46] -> 0 | CE390: =RC[-46] -> 0 | CF390: =RC[-46] -> 0 | CG390: =RC[-46] -> 0 | CH390: =RC[-46] -> 0 | CI390: =RC[-46] -> 0 | CJ390: =RC[-46] -> 0 | CK390: =RC[-46] -> 0 | CL390: =RC[-46] -> 1 | CM390: =RC[-46] -> 0 | CN390: =RC[-46] -> 0 | CO390: =RC[-46] -> 4920322.7699999996 | CP390: =RC[-46] -> 0 | CQ390: =RC[-46] -> 0 | CR390: =RC[-46] -> 0 | CS390: =RC[-46] -> 0
A391: 24 | B391: 010770 | C391: Trần Trọng Anh Chí | D391: Nv VS MB | E391: 19025652318014 | F391: =RC[29]+RC[30]+RC[31]+RC[32]+RC[33]+RC[34]+RC[35]+RC[36]+RC[37] -> 4290023 | G391: =RC[17]+RC[18]++RC[19]+RC[20]+RC[21]+RC[38]+RC[39]+RC[41] -> 0 | H391: 0 | I391: 0 | J391: =RC[-2]+RC[-1] -> 0 | K391: 0 | L391: 680000 | M391: 193200 | N391: =RC[15]+RC[16]+RC[17]+RC[18]+RC[19]+RC[20] -> 193846 | O391: 0 | P391: 0 | Q391: 5357069 | R391: 147200 | S391: 27600 | T391: 18400 | U391: 51638.69 | V391: 0 | W391: 5112230.3099999996 | X391: 0 | Y391: 0 | Z391: 0 | AA391: 0 | AB391: 0 | AC391: 0 | AD391: 0 | AE391: 0 | AF391: 0 | AG391: 0 | AH391: 193846 | AI391: 4290023 | AJ391: 0 | AK391: 0 | AL391: 0 | AM391: 0 | AN391: 0 | AO391: 0 | AP391: 0 | AQ391: 0 | AR391: =1 -> 1 | AS391: 0 | AT391: 0 | AU391: =RC[-30]-RC[-29]-RC[-28]-RC[-27]-RC[-26]-RC[-25] -> 5112230.3099999996 | AV391: 0 | AW391: =RC[1]-RC[2] -> 64615.332999999999 | AX391: 193846 | AY391: 129230.667 | AZ391: =RC[-46] -> 4290023 | BA391: =RC[-46] -> 0 | BB391: =RC[-46] -> 0 | BC391: =RC[-46] -> 0 | BD391: =RC[-46] -> 0 | BE391: =RC[-46] -> 0 | BF391: =RC[-46] -> 680000 | BG391: =RC[-46] -> 193200 | BH391: =RC[-46] -> 193846 | BI391: =RC[-46] -> 0 | BJ391: =RC[-46] -> 0 | BK391: =RC[-46] -> 5357069 | BL391: =RC[-46] -> 147200 | BM391: =RC[-46] -> 27600 | BN391: =RC[-46] -> 18400 | BO391: =RC[-46] -> 51638.69 | BP391: =RC[-46] -> 0 | BQ391: =RC[-46] -> 5112230.3099999996 | BR391: =RC[-46] -> 0 | BS391: =RC[-46] -> 0 | BT391: =RC[-46] -> 0 | BU391: =RC[-46] -> 0 | BV391: =RC[-46] -> 0 | BW391: =RC[-46] -> 0 | BX391: =RC[-46] -> 0 | BY391: =RC[-46] -> 0 | BZ391: =RC[-46] -> 0 | CA391: =RC[-46] -> 0 | CB391: =RC[-46] -> 193846 | CC391: =RC[-46] -> 4290023 | CD391: =RC[-46] -> 0 | CE391: =RC[-46] -> 0 | CF391: =RC[-46] -> 0 | CG391: =RC[-46] -> 0 | CH391: =RC[-46] -> 0 | CI391: =RC[-46] -> 0 | CJ391: =RC[-46] -> 0 | CK391: =RC[-46] -> 0 | CL391: =RC[-46] -> 1 | CM391: =RC[-46] -> 0 | CN391: =RC[-46] -> 0 | CO391: =RC[-46] -> 5112230.3099999996 | CP391: =RC[-46] -> 0 | CQ391: =RC[-46] -> 64615.332999999999 | CR391: =RC[-46] -> 193846 | CS391: =RC[-46] -> 129230.667
A392: 25 | B392: 010771 | C392: Trần Thị Thu Thuỷ | D392: Nv VS MB | E392: 19025652315015 | F392: =RC[29]+RC[30]+RC[31]+RC[32]+RC[33]+RC[34]+RC[35]+RC[36]+RC[37] -> 2145012 | G392: =RC[17]+RC[18]++RC[19]+RC[20]+RC[21]+RC[38]+RC[39]+RC[41] -> 0 | H392: 0 | I392: 0 | J392: =RC[-2]+RC[-1] -> 0 | K392: 0 | L392: 0 | M392: 0 | N392: =RC[15]+RC[16]+RC[17]+RC[18]+RC[19]+RC[20] -> 0 | O392: 0 | P392: 0 | Q392: 2145012 | R392: 0 | S392: 0 | T392: 0 | U392: 21450.12 | V392: 0 | W392: 2123561.88 | X392: 0 | Y392: 0 | Z392: 0 | AA392: 0 | AB392: 0 | AC392: 0 | AD392: 0 | AE392: 0 | AF392: 0 | AG392: 0 | AH392: 0 | AI392: 0 | AJ392: 2145012 | AK392: 0 | AL392: 0 | AM392: 0 | AN392: 0 | AO392: 0 | AP392: 0 | AQ392: 0 | AR392: =1 -> 1 | AS392: 0 | AT392: 0 | AU392: =RC[-30]-RC[-29]-RC[-28]-RC[-27]-RC[-26]-RC[-25] -> 2123561.88 | AV392: 0 | AW392: =RC[1]-RC[2] -> 0 | AX392: 0 | AY392: 0 | AZ392: =RC[-46] -> 2145012 | BA392: =RC[-46] -> 0 | BB392: =RC[-46] -> 0 | BC392: =RC[-46] -> 0 | BD392: =RC[-46] -> 0 | BE392: =RC[-46] -> 0 | BF392: =RC[-46] -> 0 | BG392: =RC[-46] -> 0 | BH392: =RC[-46] -> 0 | BI392: =RC[-46] -> 0 | BJ392: =RC[-46] -> 0 | BK392: =RC[-46] -> 2145012 | BL392: =RC[-46] -> 0 | BM392: =RC[-46] -> 0 | BN392: =RC[-46] -> 0 | BO392: =RC[-46] -> 21450.12 | BP392: =RC[-46] -> 0 | BQ392: =RC[-46] -> 2123561.88 | BR392: =RC[-46] -> 0 | BS392: =RC[-46] -> 0 | BT392: =RC[-46] -> 0 | BU392: =RC[-46] -> 0 | BV392: =RC[-46] -> 0 | BW392: =RC[-46] -> 0 | BX392: =RC[-46] -> 0 | BY392: =RC[-46] -> 0 | BZ392: =RC[-46] -> 0 | CA392: =RC[-46] -> 0 | CB392: =RC[-46] -> 0 | CC392: =RC[-46] -> 0 | CD392: =RC[-46] -> 2145012 | CE392: =RC[-46] -> 0 | CF392: =RC[-46] -> 0 | CG392: =RC[-46] -> 0 | CH392: =RC[-46] -> 0 | CI392: =RC[-46] -> 0 | CJ392: =RC[-46] -> 0 | CK392: =RC[-46] -> 0 | CL392: =RC[-46] -> 1 | CM392: =RC[-46] -> 0 | CN392: =RC[-46] -> 0 | CO392: =RC[-46] -> 2123561.88 | CP392: =RC[-46] -> 0 | CQ392: =RC[-46] -> 0 | CR392: =RC[-46] -> 0 | CS392: =RC[-46] -> 0
A393: 26 | B393: 010772 | C393: Đậu Thị Hồng Nguyệt | D393: Nv VS MB | E393: 10520912391010 | F393: =RC[29]+RC[30]+RC[31]+RC[32]+RC[33]+RC[34]+RC[35]+RC[36]+RC[37] -> 4552678 | G393: =RC[17]+RC[18]++RC[19]+RC[20]+RC[21]+RC[38]+RC[39]+RC[41] -> 0 | H393: 0 | I393: 0 | J393: =RC[-2]+RC[-1] -> 0 | K393: 0 | L393: 680000 | M393: 231840 | N393: =RC[15]+RC[16]+RC[17]+RC[18]+RC[19]+RC[20] -> 0 | O393: 0 | P393: 0 | Q393: 5464518 | R393: 176640 | S393: 33120 | T393: 22080 | U393: 52326.78 | V393: 0 | W393: 5180351.22 | X393: 0 | Y393: 0 | Z393: 0 | AA393: 0 | AB393: 0 | AC393: 0 | AD393: 0 | AE393: 0 | AF393: 0 | AG393: 0 | AH393: 0 | AI393: 4552678 | AJ393: 0 | AK393: 0 | AL393: 0 | AM393: 0 | AN393: 0 | AO393: 0 | AP393: 0 | AQ393: 0 | AR393: =1 -> 1 | AS393: 0 | AT393: 0 | AU393: =RC[-30]-RC[-29]-RC[-28]-RC[-27]-RC[-26]-RC[-25] -> 5180351.22 | AV393: 0 | AW393: =RC[1]-RC[2] -> 0 | AX393: 0 | AY393: 0 | AZ393: =RC[-46] -> 4552678 | BA393: =RC[-46] -> 0 | BB393: =RC[-46] -> 0 | BC393: =RC[-46] -> 0 | BD393: =RC[-46] -> 0 | BE393: =RC[-46] -> 0 | BF393: =RC[-46] -> 680000 | BG393: =RC[-46] -> 231840 | BH393: =RC[-46] -> 0 | BI393: =RC[-46] -> 0 | BJ393: =RC[-46] -> 0 | BK393: =RC[-46] -> 5464518 | BL393: =RC[-46] -> 176640 | BM393: =RC[-46] -> 33120 | BN393: =RC[-46] -> 22080 | BO393: =RC[-46] -> 52326.78 | BP393: =RC[-46] -> 0 | BQ393: =RC[-46] -> 5180351.22 | BR393: =RC[-46] -> 0 | BS393: =RC[-46] -> 0 | BT393: =RC[-46] -> 0 | BU393: =RC[-46] -> 0 | BV393: =RC[-46] -> 0 | BW393: =RC[-46] -> 0 | BX393: =RC[-46] -> 0 | BY393: =RC[-46] -> 0 | BZ393: =RC[-46] -> 0 | CA393: =RC[-46] -> 0 | CB393: =RC[-46] -> 0 | CC393: =RC[-46] -> 4552678 | CD393: =RC[-46] -> 0 | CE393: =RC[-46] -> 0 | CF393: =RC[-46] -> 0 | CG393: =RC[-46] -> 0 | CH393: =RC[-46] -> 0 | CI393: =RC[-46] -> 0 | CJ393: =RC[-46] -> 0 | CK393: =RC[-46] -> 0 | CL393: =RC[-46] -> 1 | CM393: =RC[-46] -> 0 | CN393: =RC[-46] -> 0 | CO393: =RC[-46] -> 5180351.22 | CP393: =RC[-46] -> 0 | CQ393: =RC[-46] -> 0 | CR393: =RC[-46] -> 0 | CS393: =RC[-46] -> 0
A394: 27 | B394: 010773 | C394: Nguyễn Thị Mến | D394: Nv VS MB | E394: 10520052686018 | F394: =RC[29]+RC[30]+RC[31]+RC[32]+RC[33]+RC[34]+RC[35]+RC[36]+RC[37] -> 4815332 | G394: =RC[17]+RC[18]++RC[19]+RC[20]+RC[21]+RC[38]+RC[39]+RC[41] -> 0 | H394: 0 | I394: 0 | J394: =RC[-2]+RC[-1] -> 0 | K394: 0 | L394: 680000 | M394: 277725 | N394: =RC[15]+RC[16]+RC[17]+RC[18]+RC[19]+RC[20] -> 0 | O394: 0 | P394: 0 | Q394: 5773057 | R394: 211600 | S394: 39675 | T394: 26450 | U394: 54953.32 | V394: 0 | W394: 5440378.6799999997 | X394: 0 | Y394: 0 | Z394: 0 | AA394: 0 | AB394: 0 | AC394: 0 | AD394: 0 | AE394: 0 | AF394: 0 | AG394: 0 | AH394: 0 | AI394: 4815332 | AJ394: 0 | AK394: 0 | AL394: 0 | AM394: 0 | AN394: 0 | AO394: 0 | AP394: 0 | AQ394: 0 | AR394: =1 -> 1 | AS394: 0 | AT394: 0 | AU394: =RC[-30]-RC[-29]-RC[-28]-RC[-27]-RC[-26]-RC[-25] -> 5440378.6799999997 | AV394: 0 | AW394: =RC[1]-RC[2] -> 0 | AX394: 0 | AY394: 0 | AZ394: =RC[-46] -> 4815332 | BA394: =RC[-46] -> 0 | BB394: =RC[-46] -> 0 | BC394: =RC[-46] -> 0 | BD394: =RC[-46] -> 0 | BE394: =RC[-46] -> 0 | BF394: =RC[-46] -> 680000 | BG394: =RC[-46] -> 277725 | BH394: =RC[-46] -> 0 | BI394: =RC[-46] -> 0 | BJ394: =RC[-46] -> 0 | BK394: =RC[-46] -> 5773057 | BL394: =RC[-46] -> 211600 | BM394: =RC[-46] -> 39675 | BN394: =RC[-46] -> 26450 | BO394: =RC[-46] -> 54953.32 | BP394: =RC[-46] -> 0 | BQ394: =RC[-46] -> 5440378.6799999997 | BR394: =RC[-46] -> 0 | BS394: =RC[-46] -> 0 | BT394: =RC[-46] -> 0 | BU394: =RC[-46] -> 0 | BV394: =RC[-46] -> 0 | BW394: =RC[-46] -> 0 | BX394: =RC[-46] -> 0 | BY394: =RC[-46] -> 0 | BZ394: =RC[-46] -> 0 | CA394: =RC[-46] -> 0 | CB394: =RC[-46] -> 0 | CC394: =RC[-46] -> 4815332 | CD394: =RC[-46] -> 0 | CE394: =RC[-46] -> 0 | CF394: =RC[-46] -> 0 | CG394: =RC[-46] -> 0 | CH394: =RC[-46] -> 0 | CI394: =RC[-46] -> 0 | CJ394: =RC[-46] -> 0 | CK394: =RC[-46] -> 0 | CL394: =RC[-46] -> 1 | CM394: =RC[-46] -> 0 | CN394: =RC[-46] -> 0 | CO394: =RC[-46] -> 5440378.6799999997 | CP394: =RC[-46] -> 0 | CQ394: =RC[-46] -> 0 | CR394: =RC[-46] -> 0 | CS394: =RC[-46] -> 0
A395: 28 | B395: 010774 | C395: Lò Thị Phượng | D395: Nv VS MB | E395: 10523608618016 | F395: =RC[29]+RC[30]+RC[31]+RC[32]+RC[33]+RC[34]+RC[35]+RC[36]+RC[37] -> 3677163 | G395: =RC[17]+RC[18]++RC[19]+RC[20]+RC[21]+RC[38]+RC[39]+RC[41] -> 387692 | H395: 0 | I395: 0 | J395: =RC[-2]+RC[-1] -> 0 | K395: 0 | L395: 549231 | M395: 231840 | N395: =RC[15]+RC[16]+RC[17]+RC[18]+RC[19]+RC[20] -> 0 | O395: 0 | P395: 0 | Q395: 4845926 | R395: 176640 | S395: 33120 | T395: 22080 | U395: 46140.86 | V395: 0 | W395: 4567945.1399999997 | X395: 0 | Y395: 387692 | Z395: 0 | AA395: 0 | AB395: 0 | AC395: 0 | AD395: 0 | AE395: 0 | AF395: 0 | AG395: 0 | AH395: 0 | AI395: 3677163 | AJ395: 0 | AK395: 0 | AL395: 0 | AM395: 0 | AN395: 0 | AO395: 0 | AP395: 0 | AQ395: 0 | AR395: =1 -> 1 | AS395: 0 | AT395: 0 | AU395: =RC[-30]-RC[-29]-RC[-28]-RC[-27]-RC[-26]-RC[-25] -> 4567945.1399999997 | AV395: 0 | AW395: =RC[1]-RC[2] -> 0 | AX395: 0 | AY395: 0 | AZ395: =RC[-46] -> 3677163 | BA395: =RC[-46] -> 387692 | BB395: =RC[-46] -> 0 | BC395: =RC[-46] -> 0 | BD395: =RC[-46] -> 0 | BE395: =RC[-46] -> 0 | BF395: =RC[-46] -> 549231 | BG395: =RC[-46] -> 231840 | BH395: =RC[-46] -> 0 | BI395: =RC[-46] -> 0 | BJ395: =RC[-46] -> 0 | BK395: =RC[-46] -> 4845926 | BL395: =RC[-46] -> 176640 | BM395: =RC[-46] -> 33120 | BN395: =RC[-46] -> 22080 | BO395: =RC[-46] -> 46140.86 | BP395: =RC[-46] -> 0 | BQ395: =RC[-46] -> 4567945.1399999997 | BR395: =RC[-46] -> 0 | BS395: =RC[-46] -> 387692 | BT395: =RC[-46] -> 0 | BU395: =RC[-46] -> 0 | BV395: =RC[-46] -> 0 | BW395: =RC[-46] -> 0 | BX395: =RC[-46] -> 0 | BY395: =RC[-46] -> 0 | BZ395: =RC[-46] -> 0 | CA395: =RC[-46] -> 0 | CB395: =RC[-46] -> 0 | CC395: =RC[-46] -> 3677163 | CD395: =RC[-46] -> 0 | CE395: =RC[-46] -> 0 | CF395: =RC[-46] -> 0 | CG395: =RC[-46] -> 0 | CH395: =RC[-46] -> 0 | CI395: =RC[-46] -> 0 | CJ395: =RC[-46] -> 0 | CK395: =RC[-46] -> 0 | CL395: =RC[-46] -> 1 | CM395: =RC[-46] -> 0 | CN395: =RC[-46] -> 0 | CO395: =RC[-46] -> 4567945.1399999997 | CP395: =RC[-46] -> 0 | CQ395: =RC[-46] -> 0 | CR395: =RC[-46] -> 0 | CS395: =RC[-46] -> 0
A396: 29 | B396: 010775 | C396: Đặng Thị Thu Hường | D396: Nv VS MB | E396: 10522161456017 | F396: =RC[29]+RC[30]+RC[31]+RC[32]+RC[33]+RC[34]+RC[35]+RC[36]+RC[37] -> 5107170 | G396: =RC[17]+RC[18]++RC[19]+RC[20]+RC[21]+RC[38]+RC[39]+RC[41] -> 0 | H396: 0 | I396: 0 | J396: =RC[-2]+RC[-1] -> 0 | K396: 0 | L396: 680000 | M396: 398475 | N396: =RC[15]+RC[16]+RC[17]+RC[18]+RC[19]+RC[20] -> 0 | O396: 0 | P396: 0 | Q396: 6185645 | R396: 303600 | S396: 56925 | T396: 37950 | U396: 57871.7 | V396: 0 | W396: 5729298.2999999998 | X396: 0 | Y396: 0 | Z396: 0 | AA396: 0 | AB396: 0 | AC396: 0 | AD396: 0 | AE396: 0 | AF396: 0 | AG396: 0 | AH396: 0 | AI396: 5107170 | AJ396: 0 | AK396: 0 | AL396: 0 | AM396: 0 | AN396: 0 | AO396: 0 | AP396: 0 | AQ396: 0 | AR396: =1 -> 1 | AS396: 0 | AT396: 0 | AU396: =RC[-30]-RC[-29]-RC[-28]-RC[-27]-RC[-26]-RC[-25] -> 5729298.2999999998 | AV396: 0 | AW396: =RC[1]-RC[2] -> 0 | AX396: 0 | AY396: 0 | AZ396: =RC[-46] -> 5107170 | BA396: =RC[-46] -> 0 | BB396: =RC[-46] -> 0 | BC396: =RC[-46] -> 0 | BD396: =RC[-46] -> 0 | BE396: =RC[-46] -> 0 | BF396: =RC[-46] -> 680000 | BG396: =RC[-46] -> 398475 | BH396: =RC[-46] -> 0 | BI396: =RC[-46] -> 0 | BJ396: =RC[-46] -> 0 | BK396: =RC[-46] -> 6185645 | BL396: =RC[-46] -> 303600 | BM396: =RC[-46] -> 56925 | BN396: =RC[-46] -> 37950 | BO396: =RC[-46] -> 57871.7 | BP396: =RC[-46] -> 0 | BQ396: =RC[-46] -> 5729298.2999999998 | BR396: =RC[-46] -> 0 | BS396: =RC[-46] -> 0 | BT396: =RC[-46] -> 0 | BU396: =RC[-46] -> 0 | BV396: =RC[-46] -> 0 | BW396: =RC[-46] -> 0 | BX396: =RC[-46] -> 0 | BY396: =RC[-46] -> 0 | BZ396: =RC[-46] -> 0 | CA396: =RC[-46] -> 0 | CB396: =RC[-46] -> 0 | CC396: =RC[-46] -> 5107170 | CD396: =RC[-46] -> 0 | CE396: =RC[-46] -> 0 | CF396: =RC[-46] -> 0 | CG396: =RC[-46] -> 0 | CH396: =RC[-46] -> 0 | CI396: =RC[-46] -> 0 | CJ396: =RC[-46] -> 0 | CK396: =RC[-46] -> 0 | CL396: =RC[-46] -> 1 | CM396: =RC[-46] -> 0 | CN396: =RC[-46] -> 0 | CO396: =RC[-46] -> 5729298.2999999998 | CP396: =RC[-46] -> 0 | CQ396: =RC[-46] -> 0 | CR396: =RC[-46] -> 0 | CS396: =RC[-46] -> 0
A397: 30 | B397: 010776 | C397: Nguyễn Thị Thu | D397: Nv VS MB | E397: 10521482614017 | F397: =RC[29]+RC[30]+RC[31]+RC[32]+RC[33]+RC[34]+RC[35]+RC[36]+RC[37] -> 2276339 | G397: =RC[17]+RC[18]++RC[19]+RC[20]+RC[21]+RC[38]+RC[39]+RC[41] -> 0 | H397: 0 | I397: 0 | J397: =RC[-2]+RC[-1] -> 0 | K397: 0 | L397: 0 | M397: 0 | N397: =RC[15]+RC[16]+RC[17]+RC[18]+RC[19]+RC[20] -> 0 | O397: 0 | P397: 0 | Q397: 2276339 | R397: 0 | S397: 0 | T397: 0 | U397: 22763.39 | V397: 0 | W397: 2253575.61 | X397: 0 | Y397: 0 | Z397: 0 | AA397: 0 | AB397: 0 | AC397: 0 | AD397: 0 | AE397: 0 | AF397: 0 | AG397: 0 | AH397: 0 | AI397: 0 | AJ397: 2276339 | AK397: 0 | AL397: 0 | AM397: 0 | AN397: 0 | AO397: 0 | AP397: 0 | AQ397: 0 | AR397: =1 -> 1 | AS397: 0 | AT397: 0 | AU397: =RC[-30]-RC[-29]-RC[-28]-RC[-27]-RC[-26]-RC[-25] -> 2253575.61 | AV397: 0 | AW397: =RC[1]-RC[2] -> 0 | AX397: 0 | AY397: 0 | AZ397: =RC[-46] -> 2276339 | BA397: =RC[-46] -> 0 | BB397: =RC[-46] -> 0 | BC397: =RC[-46] -> 0 | BD397: =RC[-46] -> 0 | BE397: =RC[-46] -> 0 | BF397: =RC[-46] -> 0 | BG397: =RC[-46] -> 0 | BH397: =RC[-46] -> 0 | BI397: =RC[-46] -> 0 | BJ397: =RC[-46] -> 0 | BK397: =RC[-46] -> 2276339 | BL397: =RC[-46] -> 0 | BM397: =RC[-46] -> 0 | BN397: =RC[-46] -> 0 | BO397: =RC[-46] -> 22763.39 | BP397: =RC[-46] -> 0 | BQ397: =RC[-46] -> 2253575.61 | BR397: =RC[-46] -> 0 | BS397: =RC[-46] -> 0 | BT397: =RC[-46] -> 0 | BU397: =RC[-46] -> 0 | BV397: =RC[-46] -> 0 | BW397: =RC[-46] -> 0 | BX397: =RC[-46] -> 0 | BY397: =RC[-46] -> 0 | BZ397: =RC[-46] -> 0 | CA397: =RC[-46] -> 0 | CB397: =RC[-46] -> 0 | CC397: =RC[-46] -> 0 | CD397: =RC[-46] -> 2276339 | CE397: =RC[-46] -> 0 | CF397: =RC[-46] -> 0 | CG397: =RC[-46] -> 0 | CH397: =RC[-46] -> 0 | CI397: =RC[-46] -> 0 | CJ397: =RC[-46] -> 0 | CK397: =RC[-46] -> 0 | CL397: =RC[-46] -> 1 | CM397: =RC[-46] -> 0 | CN397: =RC[-46] -> 0 | CO397: =RC[-46] -> 2253575.61 | CP397: =RC[-46] -> 0 | CQ397: =RC[-46] -> 0 | CR397: =RC[-46] -> 0 | CS397: =RC[-46] -> 0
A398: 31 | B398: 010777 | C398: Nguyễn Thị Lý | D398: Nv VS MB | E398: 10523608658018 | F398: =RC[29]+RC[30]+RC[31]+RC[32]+RC[33]+RC[34]+RC[35]+RC[36]+RC[37] -> 4552678 | G398: =RC[17]+RC[18]++RC[19]+RC[20]+RC[21]+RC[38]+RC[39]+RC[41] -> 0 | H398: 0 | I398: 0 | J398: =RC[-2]+RC[-1] -> 0 | K398: 0 | L398: 680000 | M398: 231840 | N398: =RC[15]+RC[16]+RC[17]+RC[18]+RC[19]+RC[20] -> 0 | O398: 0 | P398: 0 | Q398: 5464518 | R398: 176640 | S398: 33120 | T398: 22080 | U398: 52326.78 | V398: 0 | W398: 5180351.22 | X398: 0 | Y398: 0 | Z398: 0 | AA398: 0 | AB398: 0 | AC398: 0 | AD398: 0 | AE398: 0 | AF398: 0 | AG398: 0 | AH398: 0 | AI398: 4552678 | AJ398: 0 | AK398: 0 | AL398: 0 | AM398: 0 | AN398: 0 | AO398: 0 | AP398: 0 | AQ398: 0 | AR398: =1 -> 1 | AS398: 0 | AT398: 0 | AU398: =RC[-30]-RC[-29]-RC[-28]-RC[-27]-RC[-26]-RC[-25] -> 5180351.22 | AV398: 0 | AW398: =RC[1]-RC[2] -> 0 | AX398: 0 | AY398: 0 | AZ398: =RC[-46] -> 4552678 | BA398: =RC[-46] -> 0 | BB398: =RC[-46] -> 0 | BC398: =RC[-46] -> 0 | BD398: =RC[-46] -> 0 | BE398: =RC[-46] -> 0 | BF398: =RC[-46] -> 680000 | BG398: =RC[-46] -> 231840 | BH398: =RC[-46] -> 0 | BI398: =RC[-46] -> 0 | BJ398: =RC[-46] -> 0 | BK398: =RC[-46] -> 5464518 | BL398: =RC[-46] -> 176640 | BM398: =RC[-46] -> 33120 | BN398: =RC[-46] -> 22080 | BO398: =RC[-46] -> 52326.78 | BP398: =RC[-46] -> 0 | BQ398: =RC[-46] -> 5180351.22 | BR398: =RC[-46] -> 0 | BS398: =RC[-46] -> 0 | BT398: =RC[-46] -> 0 | BU398: =RC[-46] -> 0 | BV398: =RC[-46] -> 0 | BW398: =RC[-46] -> 0 | BX398: =RC[-46] -> 0 | BY398: =RC[-46] -> 0 | BZ398: =RC[-46] -> 0 | CA398: =RC[-46] -> 0 | CB398: =RC[-46] -> 0 | CC398: =RC[-46] -> 4552678 | CD398: =RC[-46] -> 0 | CE398: =RC[-46] -> 0 | CF398: =RC[-46] -> 0 | CG398: =RC[-46] -> 0 | CH398: =RC[-46] -> 0 | CI398: =RC[-46] -> 0 | CJ398: =RC[-46] -> 0 | CK398: =RC[-46] -> 0 | CL398: =RC[-46] -> 1 | CM398: =RC[-46] -> 0 | CN398: =RC[-46] -> 0 | CO398: =RC[-46] -> 5180351.22 | CP398: =RC[-46] -> 0 | CQ398: =RC[-46] -> 0 | CR398: =RC[-46] -> 0 | CS398: =RC[-46] -> 0
A399: 32 | B399: 010780 | C399: Hoàng Hải Yến | D399: Nv VS MB | E399: 10523608711016 | F399: =RC[29]+RC[30]+RC[31]+RC[32]+RC[33]+RC[34]+RC[35]+RC[36]+RC[37] -> 4552678 | G399: =RC[17]+RC[18]++RC[19]+RC[20]+RC[21]+RC[38]+RC[39]+RC[41] -> 0 | H399: 0 | I399: 0 | J399: =RC[-2]+RC[-1] -> 0 | K399: 0 | L399: 680000 | M399: 231840 | N399: =RC[15]+RC[16]+RC[17]+RC[18]+RC[19]+RC[20] -> 0 | O399: 0 | P399: 0 | Q399: 5464518 | R399: 176640 | S399: 33120 | T399: 22080 | U399: 52326.78 | V399: 0 | W399: 5180351.22 | X399: 0 | Y399: 0 | Z399: 0 | AA399: 0 | AB399: 0 | AC399: 0 | AD399: 0 | AE399: 0 | AF399: 0 | AG399: 0 | AH399: 0 | AI399: 4552678 | AJ399: 0 | AK399: 0 | AL399: 0 | AM399: 0 | AN399: 0 | AO399: 0 | AP399: 0 | AQ399: 0 | AR399: =1 -> 1 | AS399: 0 | AT399: 0 | AU399: =RC[-30]-RC[-29]-RC[-28]-RC[-27]-RC[-26]-RC[-25] -> 5180351.22 | AV399: 0 | AW399: =RC[1]-RC[2] -> 0 | AX399: 0 | AY399: 0 | AZ399: =RC[-46] -> 4552678 | BA399: =RC[-46] -> 0 | BB399: =RC[-46] -> 0 | BC399: =RC[-46] -> 0 | BD399: =RC[-46] -> 0 | BE399: =RC[-46] -> 0 | BF399: =RC[-46] -> 680000 | BG399: =RC[-46] -> 231840 | BH399: =RC[-46] -> 0 | BI399: =RC[-46] -> 0 | BJ399: =RC[-46] -> 0 | BK399: =RC[-46] -> 5464518 | BL399: =RC[-46] -> 176640 | BM399: =RC[-46] -> 33120 | BN399: =RC[-46] -> 22080 | BO399: =RC[-46] -> 52326.78 | BP399: =RC[-46] -> 0 | BQ399: =RC[-46] -> 5180351.22 | BR399: =RC[-46] -> 0 | BS399: =RC[-46] -> 0 | BT399: =RC[-46] -> 0 | BU399: =RC[-46] -> 0 | BV399: =RC[-46] -> 0 | BW399: =RC[-46] -> 0 | BX399: =RC[-46] -> 0 | BY399: =RC[-46] -> 0 | BZ399: =RC[-46] -> 0 | CA399: =RC[-46] -> 0 | CB399: =RC[-46] -> 0 | CC399: =RC[-46] -> 4552678 | CD399: =RC[-46] -> 0 | CE399: =RC[-46] -> 0 | CF399: =RC[-46] -> 0 | CG399: =RC[-46] -> 0 | CH399: =RC[-46] -> 0 | CI399: =RC[-46] -> 0 | CJ399: =RC[-46] -> 0 | CK399: =RC[-46] -> 0 | CL399: =RC[-46] -> 1 | CM399: =RC[-46] -> 0 | CN399: =RC[-46] -> 0 | CO399: =RC[-46] -> 5180351.22 | CP399: =RC[-46] -> 0 | CQ399: =RC[-46] -> 0 | CR399: =RC[-46] -> 0 | CS399: =RC[-46] -> 0
A400: 33 | B400: 010781 | C400: Lê Phương Huyền | D400: Nv VS MB | E400: 10523608674013 | F400: =RC[29]+RC[30]+RC[31]+RC[32]+RC[33]+RC[34]+RC[35]+RC[36]+RC[37] -> 4780312 | G400: =RC[17]+RC[18]++RC[19]+RC[20]+RC[21]+RC[38]+RC[39]+RC[41] -> 0 | H400: 0 | I400: 0 | J400: =RC[-2]+RC[-1] -> 0 | K400: 0 | L400: 680000 | M400: 231840 | N400: =RC[15]+RC[16]+RC[17]+RC[18]+RC[19]+RC[20] -> 0 | O400: 0 | P400: 0 | Q400: 5692152 | R400: 176640 | S400: 33120 | T400: 22080 | U400: 54603.12 | V400: 0 | W400: 5405708.8799999999 | X400: 0 | Y400: 0 | Z400: 0 | AA400: 0 | AB400: 0 | AC400: 0 | AD400: 0 | AE400: 0 | AF400: 0 | AG400: 0 | AH400: 0 | AI400: 4780312 | AJ400: 0 | AK400: 0 | AL400: 0 | AM400: 0 | AN400: 0 | AO400: 0 | AP400: 0 | AQ400: 0 | AR400: =1 -> 1 | AS400: 0 | AT400: 0 | AU400: =RC[-30]-RC[-29]-RC[-28]-RC[-27]-RC[-26]-RC[-25] -> 5405708.8799999999 | AV400: 0 | AW400: =RC[1]-RC[2] -> 0 | AX400: 0 | AY400: 0 | AZ400: =RC[-46] -> 4780312 | BA400: =RC[-46] -> 0 | BB400: =RC[-46] -> 0 | BC400: =RC[-46] -> 0 | BD400: =RC[-46] -> 0 | BE400: =RC[-46] -> 0 | BF400: =RC[-46] -> 680000 | BG400: =RC[-46] -> 231840 | BH400: =RC[-46] -> 0 | BI400: =RC[-46] -> 0 | BJ400: =RC[-46] -> 0 | BK400: =RC[-46] -> 5692152 | BL400: =RC[-46] -> 176640 | BM400: =RC[-46] -> 33120 | BN400: =RC[-46] -> 22080 | BO400: =RC[-46] -> 54603.12 | BP400: =RC[-46] -> 0 | BQ400: =RC[-46] -> 5405708.8799999999 | BR400: =RC[-46] -> 0 | BS400: =RC[-46] -> 0 | BT400: =RC[-46] -> 0 | BU400: =RC[-46] -> 0 | BV400: =RC[-46] -> 0 | BW400: =RC[-46] -> 0 | BX400: =RC[-46] -> 0 | BY400: =RC[-46] -> 0 | BZ400: =RC[-46] -> 0 | CA400: =RC[-46] -> 0 | CB400: =RC[-46] -> 0 | CC400: =RC[-46] -> 4780312 | CD400: =RC[-46] -> 0 | CE400: =RC[-46] -> 0 | CF400: =RC[-46] -> 0 | CG400: =RC[-46] -> 0 | CH400: =RC[-46] -> 0 | CI400: =RC[-46] -> 0 | CJ400: =RC[-46] -> 0 | CK400: =RC[-46] -> 0 | CL400: =RC[-46] -> 1 | CM400: =RC[-46] -> 0 | CN400: =RC[-46] -> 0 | CO400: =RC[-46] -> 5405708.8799999999 | CP400: =RC[-46] -> 0 | CQ400: =RC[-46] -> 0 | CR400: =RC[-46] -> 0 | CS400: =RC[-46] -> 0
A401: 34 | B401: 010782 | C401: Phạm Thị Lan Phương | D401: Nv VS MB | E401: 19020205572017 | F401: =RC[29]+RC[30]+RC[31]+RC[32]+RC[33]+RC[34]+RC[35]+RC[36]+RC[37] -> 4505984 | G401: =RC[17]+RC[18]++RC[19]+RC[20]+RC[21]+RC[38]+RC[39]+RC[41] -> 0 | H401: 0 | I401: 0 | J401: =RC[-2]+RC[-1] -> 0 | K401: 0 | L401: 680000 | M401: 193200 | N401: =RC[15]+RC[16]+RC[17]+RC[18]+RC[19]+RC[20] -> 0 | O401: 0 | P401: 0 | Q401: 5379184 | R401: 147200 | S401: 27600 | T401: 18400 | U401: 51859.839999999997 | V401: 0 | W401: 5134124.16 | X401: 0 | Y401: 0 | Z401: 0 | AA401: 0 | AB401: 0 | AC401: 0 | AD401: 0 | AE401: 0 | AF401: 0 | AG401: 0 | AH401: 0 | AI401: 4505984 | AJ401: 0 | AK401: 0 | AL401: 0 | AM401: 0 | AN401: 0 | AO401: 0 | AP401: 0 | AQ401: 0 | AR401: =1 -> 1 | AS401: 0 | AT401: 0 | AU401: =RC[-30]-RC[-29]-RC[-28]-RC[-27]-RC[-26]-RC[-25] -> 5134124.16 | AV401: 0 | AW401: =RC[1]-RC[2] -> 0 | AX401: 0 | AY401: 0 | AZ401: =RC[-46] -> 4505984 | BA401: =RC[-46] -> 0 | BB401: =RC[-46] -> 0 | BC401: =RC[-46] -> 0 | BD401: =RC[-46] -> 0 | BE401: =RC[-46] -> 0 | BF401: =RC[-46] -> 680000 | BG401: =RC[-46] -> 193200 | BH401: =RC[-46] -> 0 | BI401: =RC[-46] -> 0 | BJ401: =RC[-46] -> 0 | BK401: =RC[-46] -> 5379184 | BL401: =RC[-46] -> 147200 | BM401: =RC[-46] -> 27600 | BN401: =RC[-46] -> 18400 | BO401: =RC[-46] -> 51859.839999999997 | BP401: =RC[-46] -> 0 | BQ401: =RC[-46] -> 5134124.16 | BR401: =RC[-46] -> 0 | BS401: =RC[-46] -> 0 | BT401: =RC[-46] -> 0 | BU401: =RC[-46] -> 0 | BV401: =RC[-46] -> 0 | BW401: =RC[-46] -> 0 | BX401: =RC[-46] -> 0 | BY401: =RC[-46] -> 0 | BZ401: =RC[-46] -> 0 | CA401: =RC[-46] -> 0 | CB401: =RC[-46] -> 0 | CC401: =RC[-46] -> 4505984 | CD401: =RC[-46] -> 0 | CE401: =RC[-46] -> 0 | CF401: =RC[-46] -> 0 | CG401: =RC[-46] -> 0 | CH401: =RC[-46] -> 0 | CI401: =RC[-46] -> 0 | CJ401: =RC[-46] -> 0 | CK401: =RC[-46] -> 0 | CL401: =RC[-46] -> 1 | CM401: =RC[-46] -> 0 | CN401: =RC[-46] -> 0 | CO401: =RC[-46] -> 5134124.16 | CP401: =RC[-46] -> 0 | CQ401: =RC[-46] -> 0 | CR401: =RC[-46] -> 0 | CS401: =RC[-46] -> 0
A402: 35 | B402: 010783 | C402: Phạm Thị Thuý Ngà | D402: Nv VS MB | E402: 10520052575011 | F402: =RC[29]+RC[30]+RC[31]+RC[32]+RC[33]+RC[34]+RC[35]+RC[36]+RC[37] -> 5107170 | G402: =RC[17]+RC[18]++RC[19]+RC[20]+RC[21]+RC[38]+RC[39]+RC[41] -> 0 | H402: 0 | I402: 0 | J402: =RC[-2]+RC[-1] -> 0 | K402: 0 | L402: 680000 | M402: 332063 | N402: =RC[15]+RC[16]+RC[17]+RC[18]+RC[19]+RC[20] -> 0 | O402: 0 | P402: 0 | Q402: 6119233 | R402: 253000 | S402: 47438 | T402: 31625 | U402: 57871.7 | V402: 0 | W402: 5729298.2999999998 | X402: 0 | Y402: 0 | Z402: 0 | AA402: 0 | AB402: 0 | AC402: 0 | AD402: 0 | AE402: 0 | AF402: 0 | AG402: 0 | AH402: 0 | AI402: 5107170 | AJ402: 0 | AK402: 0 | AL402: 0 | AM402: 0 | AN402: 0 | AO402: 0 | AP402: 0 | AQ402: 0 | AR402: =1 -> 1 | AS402: 0 | AT402: 0 | AU402: =RC[-30]-RC[-29]-RC[-28]-RC[-27]-RC[-26]-RC[-25] -> 5729298.2999999998 | AV402: 0 | AW402: =RC[1]-RC[2] -> 0 | AX402: 0 | AY402: 0 | AZ402: =RC[-46] -> 5107170 | BA402: =RC[-46] -> 0 | BB402: =RC[-46] -> 0 | BC402: =RC[-46] -> 0 | BD402: =RC[-46] -> 0 | BE402: =RC[-46] -> 0 | BF402: =RC[-46] -> 680000 | BG402: =RC[-46] -> 332063 | BH402: =RC[-46] -> 0 | BI402: =RC[-46] -> 0 | BJ402: =RC[-46] -> 0 | BK402: =RC[-46] -> 6119233 | BL402: =RC[-46] -> 253000 | BM402: =RC[-46] -> 47438 | BN402: =RC[-46] -> 31625 | BO402: =RC[-46] -> 57871.7 | BP402: =RC[-46] -> 0 | BQ402: =RC[-46] -> 5729298.2999999998 | BR402: =RC[-46] -> 0 | BS402: =RC[-46] -> 0 | BT402: =RC[-46] -> 0 | BU402: =RC[-46] -> 0 | BV402: =RC[-46] -> 0 | BW402: =RC[-46] -> 0 | BX402: =RC[-46] -> 0 | BY402: =RC[-46] -> 0 | BZ402: =RC[-46] -> 0 | CA402: =RC[-46] -> 0 | CB402: =RC[-46] -> 0 | CC402: =RC[-46] -> 5107170 | CD402: =RC[-46] -> 0 | CE402: =RC[-46] -> 0 | CF402: =RC[-46] -> 0 | CG402: =RC[-46] -> 0 | CH402: =RC[-46] -> 0 | CI402: =RC[-46] -> 0 | CJ402: =RC[-46] -> 0 | CK402: =RC[-46] -> 0 | CL402: =RC[-46] -> 1 | CM402: =RC[-46] -> 0 | CN402: =RC[-46] -> 0 | CO402: =RC[-46] -> 5729298.2999999998 | CP402: =RC[-46] -> 0 | CQ402: =RC[-46] -> 0 | CR402: =RC[-46] -> 0 | CS402: =RC[-46] -> 0
A403: 36 | B403: 011769 | C403: Ngô Thị Hường | D403: Nv VS MB | E403: 19026925247014 | F403: =RC[29]+RC[30]+RC[31]+RC[32]+RC[33]+RC[34]+RC[35]+RC[36]+RC[37] -> 4290023 | G403: =RC[17]+RC[18]++RC[19]+RC[20]+RC[21]+RC[38]+RC[39]+RC[41] -> 0 | H403: 0 | I403: 0 | J403: =RC[-2]+RC[-1] -> 0 | K403: 0 | L403: 680000 | M403: 193200 | N403: =RC[15]+RC[16]+RC[17]+RC[18]+RC[19]+RC[20] -> 0 | O403: 0 | P403: 0 | Q403: 5163223 | R403: 147200 | S403: 27600 | T403: 18400 | U403: 49700.23 | V403: 0 | W403: 4920322.7699999996 | X403: 0 | Y403: 0 | Z403: 0 | AA403: 0 | AB403: 0 | AC403: 0 | AD403: 0 | AE403: 0 | AF403: 0 | AG403: 0 | AH403: 0 | AI403: 4290023 | AJ403: 0 | AK403: 0 | AL403: 0 | AM403: 0 | AN403: 0 | AO403: 0 | AP403: 0 | AQ403: 0 | AR403: =1 -> 1 | AS403: 0 | AT403: 0 | AU403: =RC[-30]-RC[-29]-RC[-28]-RC[-27]-RC[-26]-RC[-25] -> 4920322.7699999996 | AV403: 0 | AW403: =RC[1]-RC[2] -> 0 | AX403: 0 | AY403: 0 | AZ403: =RC[-46] -> 4290023 | BA403: =RC[-46] -> 0 | BB403: =RC[-46] -> 0 | BC403: =RC[-46] -> 0 | BD403: =RC[-46] -> 0 | BE403: =RC[-46] -> 0 | BF403: =RC[-46] -> 680000 | BG403: =RC[-46] -> 193200 | BH403: =RC[-46] -> 0 | BI403: =RC[-46] -> 0 | BJ403: =RC[-46] -> 0 | BK403: =RC[-46] -> 5163223 | BL403: =RC[-46] -> 147200 | BM403: =RC[-46] -> 27600 | BN403: =RC[-46] -> 18400 | BO403: =RC[-46] -> 49700.23 | BP403: =RC[-46] -> 0 | BQ403: =RC[-46] -> 4920322.7699999996 | BR403: =RC[-46] -> 0 | BS403: =RC[-46] -> 0 | BT403: =RC[-46] -> 0 | BU403: =RC[-46] -> 0 | BV403: =RC[-46] -> 0 | BW403: =RC[-46] -> 0 | BX403: =RC[-46] -> 0 | BY403: =RC[-46] -> 0 | BZ403: =RC[-46] -> 0 | CA403: =RC[-46] -> 0 | CB403: =RC[-46] -> 0 | CC403: =RC[-46] -> 4290023 | CD403: =RC[-46] -> 0 | CE403: =RC[-46] -> 0 | CF403: =RC[-46] -> 0 | CG403: =RC[-46] -> 0 | CH403: =RC[-46] -> 0 | CI403: =RC[-46] -> 0 | CJ403: =RC[-46] -> 0 | CK403: =RC[-46] -> 0 | CL403: =RC[-46] -> 1 | CM403: =RC[-46] -> 0 | CN403: =RC[-46] -> 0 | CO403: =RC[-46] -> 4920322.7699999996 | CP403: =RC[-46] -> 0 | CQ403: =RC[-46] -> 0 | CR403: =RC[-46] -> 0 | CS403: =RC[-46] -> 0
A404: Đội phục vụ tàu bay (HGS) | F404: =SUM(R[-36]C:R[-1]C) -> 160715359 | G404: =SUM(R[-36]C:R[-1]C) -> 1720384 | H404: =SUM(R[-36]C:R[-1]C) -> 0 | I404: =SUM(R[-36]C:R[-1]C) -> 0 | J404: =SUM(R[-36]C:R[-1]C) -> 0 | K404: =SUM(R[-36]C:R[-1]C) -> 735000 | L404: =SUM(R[-36]C:R[-1]C) -> 21472308 | M404: =SUM(R[-36]C:R[-1]C) -> 8528576 | N404: =SUM(R[-36]C:R[-1]C) -> 493096 | O404: =SUM(R[-36]C:R[-1]C) -> 0 | P404: =SUM(R[-36]C:R[-1]C) -> 0 | Q404: =SUM(R[-36]C:R[-1]C) -> 193664723 | R404: =SUM(R[-36]C:R[-1]C) -> 6497960 | S404: =SUM(R[-36]C:R[-1]C) -> 1218371 | T404: =SUM(R[-36]C:R[-1]C) -> 812245 | U404: =SUM(R[-36]C:R[-1]C) -> 1851361.47 | V404: =SUM(R[-36]C:R[-1]C) -> 0 | W404: =SUM(R[-36]C:R[-1]C) -> 183284785.53 | X404: =SUM(R[-36]C:R[-1]C) -> 0 | Y404: =SUM(R[-36]C:R[-1]C) -> 1720384 | Z404: =SUM(R[-36]C:R[-1]C) -> 0 | AA404: =SUM(R[-36]C:R[-1]C) -> 0 | AB404: =SUM(R[-36]C:R[-1]C) -> 0 | AC404: =SUM(R[-36]C:R[-1]C) -> 0 | AD404: =SUM(R[-36]C:R[-1]C) -> 0 | AE404: =SUM(R[-36]C:R[-1]C) -> 0 | AF404: =SUM(R[-36]C:R[-1]C) -> 0 | AG404: =SUM(R[-36]C:R[-1]C) -> 0 | AH404: =SUM(R[-36]C:R[-1]C) -> 493096 | AI404: =SUM(R[-36]C:R[-1]C) -> 153886342 | AJ404: =SUM(R[-36]C:R[-1]C) -> 6829017 | AK404: =SUM(R[-36]C:R[-1]C) -> 0 | AL404: =SUM(R[-36]C:R[-1]C) -> 0 | AM404: =SUM(R[-36]C:R[-1]C) -> 0 | AN404: =SUM(R[-36]C:R[-1]C) -> 0 | AO404: =SUM(R[-36]C:R[-1]C) -> 0 | AP404: =SUM(R[-36]C:R[-1]C) -> 0 | AQ404: =SUM(R[-36]C:R[-1]C) -> 0 | AR404: =SUM(R[-36]C:R[-1]C) -> 36 | AS404: =SUM(R[-36]C:R[-1]C) -> 0 | AT404: =SUM(R[-36]C:R[-1]C) -> 0 | AU404: =SUM(R[-36]C:R[-1]C) -> 183284785.53 | AV404: =SUM(R[-36]C:R[-1]C) -> 0 | AW404: =SUM(R[-36]C:R[-1]C) -> 164365.33299999998 | AX404: =SUM(R[-36]C:R[-1]C) -> 493096 | AY404: =SUM(R[-36]C:R[-1]C) -> 328730.66700000002
A405: Đội sửa chữa, bảo dưỡng trang thiết bị (HGS) | F405: =R[5]C -> 27374434 | G405: =R[5]C -> 0 | H405: =R[5]C -> 0 | I405: =R[5]C -> 0 | J405: =R[5]C -> 0 | K405: =R[5]C -> 0 | L405: =R[5]C -> 2720000 | M405: =R[5]C -> 1202671 | N405: =R[5]C -> 0 | O405: =R[5]C -> 0 | P405: =R[5]C -> 0 | Q405: =R[5]C -> 31297105 | R405: =R[5]C -> 916320 | S405: =R[5]C -> 171811 | T405: =R[5]C -> 114540 | U405: =R[5]C -> 300944.33999999997 | V405: =R[5]C -> 0 | W405: =R[5]C -> 29793489.66 | X405: =R[5]C -> 0 | Y405: =R[5]C -> 0 | Z405: =R[5]C -> 0 | AA405: =R[5]C -> 0 | AB405: =R[5]C -> 0 | AC405: =R[5]C -> 0 | AD405: =R[5]C -> 0 | AE405: =R[5]C -> 0 | AF405: =R[5]C -> 0 | AG405: =R[5]C -> 0 | AH405: =R[5]C -> 0 | AI405: =R[5]C -> 27374434 | AJ405: =R[5]C -> 0 | AK405: =R[5]C -> 0 | AL405: =R[5]C -> 0 | AM405: =R[5]C -> 0 | AN405: =R[5]C -> 0 | AO405: =R[5]C -> 0 | AP405: =R[5]C -> 0 | AQ405: =R[5]C -> 0 | AR405: =R[5]C -> 4 | AS405: =R[5]C -> 0 | AT405: =R[5]C -> 0 | AU405: =R[5]C -> 29793489.66 | AW405: =R[5]C -> 0 | AX405: =R[5]C -> 0 | AY405: =R[5]C -> 0
A406: 1 | B406: 011082 | C406: Hoàng Trung Dũng | D406: CV Kỹ thuật | E406: 19026970112014 | F406: =RC[29]+RC[30]+RC[31]+RC[32]+RC[33]+RC[34]+RC[35]+RC[36]+RC[37] -> 7587796 | G406: =RC[17]+RC[18]++RC[19]+RC[20]+RC[21]+RC[38]+RC[39]+RC[41] -> 0 | H406: 0 | I406: 0 | J406: =RC[-2]+RC[-1] -> 0 | K406: 0 | L406: 680000 | M406: 282555 | N406: =RC[15]+RC[16]+RC[17]+RC[18]+RC[19]+RC[20] -> 0 | O406: 0 | P406: 0 | Q406: 8550351 | R406: 215280 | S406: 40365 | T406: 26910 | U406: 82677.960000000006 | V406: 0 | W406: 8185118.04 | X406: 0 | Y406: 0 | Z406: 0 | AA406: 0 | AB406: 0 | AC406: 0 | AD406: 0 | AE406: 0 | AF406: 0 | AG406: 0 | AH406: 0 | AI406: 7587796 | AJ406: 0 | AK406: 0 | AL406: 0 | AM406: 0 | AN406: 0 | AO406: 0 | AP406: 0 | AQ406: 0 | AR406: =1 -> 1 | AS406: 0 | AT406: 0 | AU406: =RC[-30]-RC[-29]-RC[-28]-RC[-27]-RC[-26]-RC[-25] -> 8185118.04 | AV406: 0 | AW406: =RC[1]-RC[2] -> 0 | AX406: 0 | AY406: 0 | AZ406: =RC[-46] -> 7587796 | BA406: =RC[-46] -> 0 | BB406: =RC[-46] -> 0 | BC406: =RC[-46] -> 0 | BD406: =RC[-46] -> 0 | BE406: =RC[-46] -> 0 | BF406: =RC[-46] -> 680000 | BG406: =RC[-46] -> 282555 | BH406: =RC[-46] -> 0 | BI406: =RC[-46] -> 0 | BJ406: =RC[-46] -> 0 | BK406: =RC[-46] -> 8550351 | BL406: =RC[-46] -> 215280 | BM406: =RC[-46] -> 40365 | BN406: =RC[-46] -> 26910 | BO406: =RC[-46] -> 82677.960000000006 | BP406: =RC[-46] -> 0 | BQ406: =RC[-46] -> 8185118.04 | BR406: =RC[-46] -> 0 | BS406: =RC[-46] -> 0 | BT406: =RC[-46] -> 0 | BU406: =RC[-46] -> 0 | BV406: =RC[-46] -> 0 | BW406: =RC[-46] -> 0 | BX406: =RC[-46] -> 0 | BY406: =RC[-46] -> 0 | BZ406: =RC[-46] -> 0 | CA406: =RC[-46] -> 0 | CB406: =RC[-46] -> 0 | CC406: =RC[-46] -> 7587796 | CD406: =RC[-46] -> 0 | CE406: =RC[-46] -> 0 | CF406: =RC[-46] -> 0 | CG406: =RC[-46] -> 0 | CH406: =RC[-46] -> 0 | CI406: =RC[-46] -> 0 | CJ406: =RC[-46] -> 0 | CK406: =RC[-46] -> 0 | CL406: =RC[-46] -> 1 | CM406: =RC[-46] -> 0 | CN406: =RC[-46] -> 0 | CO406: =RC[-46] -> 8185118.04 | CP406: =RC[-46] -> 0 | CQ406: =RC[-46] -> 0 | CR406: =RC[-46] -> 0 | CS406: =RC[-46] -> 0
A407: 2 | B407: 011083 | C407: Bùi Văn Nam | D407: CV Kỹ thuật | E407: 19026970113010 | F407: =RC[29]+RC[30]+RC[31]+RC[32]+RC[33]+RC[34]+RC[35]+RC[36]+RC[37] -> 7967186 | G407: =RC[17]+RC[18]++RC[19]+RC[20]+RC[21]+RC[38]+RC[39]+RC[41] -> 0 | H407: 0 | I407: 0 | J407: =RC[-2]+RC[-1] -> 0 | K407: 0 | L407: 680000 | M407: 282555 | N407: =RC[15]+RC[16]+RC[17]+RC[18]+RC[19]+RC[20] -> 0 | O407: 0 | P407: 0 | Q407: 8929741 | R407: 215280 | S407: 40365 | T407: 26910 | U407: 86471.86 | V407: 0 | W407: 8560714.1400000006 | X407: 0 | Y407: 0 | Z407: 0 | AA407: 0 | AB407: 0 | AC407: 0 | AD407: 0 | AE407: 0 | AF407: 0 | AG407: 0 | AH407: 0 | AI407: 7967186 | AJ407: 0 | AK407: 0 | AL407: 0 | AM407: 0 | AN407: 0 | AO407: 0 | AP407: 0 | AQ407: 0 | AR407: =1 -> 1 | AS407: 0 | AT407: 0 | AU407: =RC[-30]-RC[-29]-RC[-28]-RC[-27]-RC[-26]-RC[-25] -> 8560714.1400000006 | AV407: 0 | AW407: =RC[1]-RC[2] -> 0 | AX407: 0 | AY407: 0 | AZ407: =RC[-46] -> 7967186 | BA407: =RC[-46] -> 0 | BB407: =RC[-46] -> 0 | BC407: =RC[-46] -> 0 | BD407: =RC[-46] -> 0 | BE407: =RC[-46] -> 0 | BF407: =RC[-46] -> 680000 | BG407: =RC[-46] -> 282555 | BH407: =RC[-46] -> 0 | BI407: =RC[-46] -> 0 | BJ407: =RC[-46] -> 0 | BK407: =RC[-46] -> 8929741 | BL407: =RC[-46] -> 215280 | BM407: =RC[-46] -> 40365 | BN407: =RC[-46] -> 26910 | BO407: =RC[-46] -> 86471.86 | BP407: =RC[-46] -> 0 | BQ407: =RC[-46] -> 8560714.1400000006 | BR407: =RC[-46] -> 0 | BS407: =RC[-46] -> 0 | BT407: =RC[-46] -> 0 | BU407: =RC[-46] -> 0 | BV407: =RC[-46] -> 0 | BW407: =RC[-46] -> 0 | BX407: =RC[-46] -> 0 | BY407: =RC[-46] -> 0 | BZ407: =RC[-46] -> 0 | CA407: =RC[-46] -> 0 | CB407: =RC[-46] -> 0 | CC407: =RC[-46] -> 7967186 | CD407: =RC[-46] -> 0 | CE407: =RC[-46] -> 0 | CF407: =RC[-46] -> 0 | CG407: =RC[-46] -> 0 | CH407: =RC[-46] -> 0 | CI407: =RC[-46] -> 0 | CJ407: =RC[-46] -> 0 | CK407: =RC[-46] -> 0 | CL407: =RC[-46] -> 1 | CM407: =RC[-46] -> 0 | CN407: =RC[-46] -> 0 | CO407: =RC[-46] -> 8560714.1400000006 | CP407: =RC[-46] -> 0 | CQ407: =RC[-46] -> 0 | CR407: =RC[-46] -> 0 | CS407: =RC[-46] -> 0
A408: 3 | B408: 010643 | C408: Nguyễn Văn Thành | D408: KTV mặt đất | E408: 10523640469014 | F408: =RC[29]+RC[30]+RC[31]+RC[32]+RC[33]+RC[34]+RC[35]+RC[36]+RC[37] -> 6420443 | G408: =RC[17]+RC[18]++RC[19]+RC[20]+RC[21]+RC[38]+RC[39]+RC[41] -> 0 | H408: 0 | I408: 0 | J408: =RC[-2]+RC[-1] -> 0 | K408: 0 | L408: 680000 | M408: 377948 | N408: =RC[15]+RC[16]+RC[17]+RC[18]+RC[19]+RC[20] -> 0 | O408: 0 | P408: 0 | Q408: 7478391 | R408: 287960 | S408: 53993 | T408: 35995 | U408: 71004.429999999993 | V408: 0 | W408: 7029438.5700000003 | X408: 0 | Y408: 0 | Z408: 0 | AA408: 0 | AB408: 0 | AC408: 0 | AD408: 0 | AE408: 0 | AF408: 0 | AG408: 0 | AH408: 0 | AI408: 6420443 | AJ408: 0 | AK408: 0 | AL408: 0 | AM408: 0 | AN408: 0 | AO408: 0 | AP408: 0 | AQ408: 0 | AR408: =1 -> 1 | AS408: 0 | AT408: 0 | AU408: =RC[-30]-RC[-29]-RC[-28]-RC[-27]-RC[-26]-RC[-25] -> 7029438.5700000003 | AV408: 0 | AW408: =RC[1]-RC[2] -> 0 | AX408: 0 | AY408: 0 | AZ408: =RC[-46] -> 6420443 | BA408: =RC[-46] -> 0 | BB408: =RC[-46] -> 0 | BC408: =RC[-46] -> 0 | BD408: =RC[-46] -> 0 | BE408: =RC[-46] -> 0 | BF408: =RC[-46] -> 680000 | BG408: =RC[-46] -> 377948 | BH408: =RC[-46] -> 0 | BI408: =RC[-46] -> 0 | BJ408: =RC[-46] -> 0 | BK408: =RC[-46] -> 7478391 | BL408: =RC[-46] -> 287960 | BM408: =RC[-46] -> 53993 | BN408: =RC[-46] -> 35995 | BO408: =RC[-46] -> 71004.429999999993 | BP408: =RC[-46] -> 0 | BQ408: =RC[-46] -> 7029438.5700000003 | BR408: =RC[-46] -> 0 | BS408: =RC[-46] -> 0 | BT408: =RC[-46] -> 0 | BU408: =RC[-46] -> 0 | BV408: =RC[-46] -> 0 | BW408: =RC[-46] -> 0 | BX408: =RC[-46] -> 0 | BY408: =RC[-46] -> 0 | BZ408: =RC[-46] -> 0 | CA408: =RC[-46] -> 0 | CB408: =RC[-46] -> 0 | CC408: =RC[-46] -> 6420443 | CD408: =RC[-46] -> 0 | CE408: =RC[-46] -> 0 | CF408: =RC[-46] -> 0 | CG408: =RC[-46] -> 0 | CH408: =RC[-46] -> 0 | CI408: =RC[-46] -> 0 | CJ408: =RC[-46] -> 0 | CK408: =RC[-46] -> 0 | CL408: =RC[-46] -> 1 | CM408: =RC[-46] -> 0 | CN408: =RC[-46] -> 0 | CO408: =RC[-46] -> 7029438.5700000003 | CP408: =RC[-46] -> 0 | CQ408: =RC[-46] -> 0 | CR408: =RC[-46] -> 0 | CS408: =RC[-46] -> 0
A409: 4 | B409: 013049 | C409: Nguyễn Đức Anh | D409: Nhân viên kỹ thuật | E409: 19028834678015 | F409: =RC[29]+RC[30]+RC[31]+RC[32]+RC[33]+RC[34]+RC[35]+RC[36]+RC[37] -> 5399009 | G409: =RC[17]+RC[18]++RC[19]+RC[20]+RC[21]+RC[38]+RC[39]+RC[41] -> 0 | H409: 0 | I409: 0 | J409: =RC[-2]+RC[-1] -> 0 | K409: 0 | L409: 680000 | M409: 259613 | N409: =RC[15]+RC[16]+RC[17]+RC[18]+RC[19]+RC[20] -> 0 | O409: 0 | P409: 0 | Q409: 6338622 | R409: 197800 | S409: 37088 | T409: 24725 | U409: 60790.09 | V409: 0 | W409: 6018218.9100000001 | X409: 0 | Y409: 0 | Z409: 0 | AA409: 0 | AB409: 0 | AC409: 0 | AD409: 0 | AE409: 0 | AF409: 0 | AG409: 0 | AH409: 0 | AI409: 5399009 | AJ409: 0 | AK409: 0 | AL409: 0 | AM409: 0 | AN409: 0 | AO409: 0 | AP409: 0 | AQ409: 0 | AR409: =1 -> 1 | AS409: 0 | AT409: 0 | AU409: =RC[-30]-RC[-29]-RC[-28]-RC[-27]-RC[-26]-RC[-25] -> 6018218.9100000001 | AV409: 0 | AW409: =RC[1]-RC[2] -> 0 | AX409: 0 | AY409: 0 | AZ409: =RC[-46] -> 5399009 | BA409: =RC[-46] -> 0 | BB409: =RC[-46] -> 0 | BC409: =RC[-46] -> 0 | BD409: =RC[-46] -> 0 | BE409: =RC[-46] -> 0 | BF409: =RC[-46] -> 680000 | BG409: =RC[-46] -> 259613 | BH409: =RC[-46] -> 0 | BI409: =RC[-46] -> 0 | BJ409: =RC[-46] -> 0 | BK409: =RC[-46] -> 6338622 | BL409: =RC[-46] -> 197800 | BM409: =RC[-46] -> 37088 | BN409: =RC[-46] -> 24725 | BO409: =RC[-46] -> 60790.09 | BP409: =RC[-46] -> 0 | BQ409: =RC[-46] -> 6018218.9100000001 | BR409: =RC[-46] -> 0 | BS409: =RC[-46] -> 0 | BT409: =RC[-46] -> 0 | BU409: =RC[-46] -> 0 | BV409: =RC[-46] -> 0 | BW409: =RC[-46] -> 0 | BX409: =RC[-46] -> 0 | BY409: =RC[-46] -> 0 | BZ409: =RC[-46] -> 0 | CA409: =RC[-46] -> 0 | CB409: =RC[-46] -> 0 | CC409: =RC[-46] -> 5399009 | CD409: =RC[-46] -> 0 | CE409: =RC[-46] -> 0 | CF409: =RC[-46] -> 0 | CG409: =RC[-46] -> 0 | CH409: =RC[-46] -> 0 | CI409: =RC[-46] -> 0 | CJ409: =RC[-46] -> 0 | CK409: =RC[-46] -> 0 | CL409: =RC[-46] -> 1 | CM409: =RC[-46] -> 0 | CN409: =RC[-46] -> 0 | CO409: =RC[-46] -> 6018218.9100000001 | CP409: =RC[-46] -> 0 | CQ409: =RC[-46] -> 0 | CR409: =RC[-46] -> 0 | CS409: =RC[-46] -> 0
A410: Đội sửa chữa, bảo dưỡng trang thiết bị (HGS) | F410: =SUM(R[-4]C:R[-1]C) -> 27374434 | G410: =SUM(R[-4]C:R[-1]C) -> 0 | H410: =SUM(R[-4]C:R[-1]C) -> 0 | I410: =SUM(R[-4]C:R[-1]C) -> 0 | J410: =SUM(R[-4]C:R[-1]C) -> 0 | K410: =SUM(R[-4]C:R[-1]C) -> 0 | L410: =SUM(R[-4]C:R[-1]C) -> 2720000 | M410: =SUM(R[-4]C:R[-1]C) -> 1202671 | N410: =SUM(R[-4]C:R[-1]C) -> 0 | O410: =SUM(R[-4]C:R[-1]C) -> 0 | P410: =SUM(R[-4]C:R[-1]C) -> 0 | Q410: =SUM(R[-4]C:R[-1]C) -> 31297105 | R410: =SUM(R[-4]C:R[-1]C) -> 916320 | S410: =SUM(R[-4]C:R[-1]C) -> 171811 | T410: =SUM(R[-4]C:R[-1]C) -> 114540 | U410: =SUM(R[-4]C:R[-1]C) -> 300944.33999999997 | V410: =SUM(R[-4]C:R[-1]C) -> 0 | W410: =SUM(R[-4]C:R[-1]C) -> 29793489.66 | X410: =SUM(R[-4]C:R[-1]C) -> 0 | Y410: =SUM(R[-4]C:R[-1]C) -> 0 | Z410: =SUM(R[-4]C:R[-1]C) -> 0 | AA410: =SUM(R[-4]C:R[-1]C) -> 0 | AB410: =SUM(R[-4]C:R[-1]C) -> 0 | AC410: =SUM(R[-4]C:R[-1]C) -> 0 | AD410: =SUM(R[-4]C:R[-1]C) -> 0 | AE410: =SUM(R[-4]C:R[-1]C) -> 0 | AF410: =SUM(R[-4]C:R[-1]C) -> 0 | AG410: =SUM(R[-4]C:R[-1]C) -> 0 | AH410: =SUM(R[-4]C:R[-1]C) -> 0 | AI410: =SUM(R[-4]C:R[-1]C) -> 27374434 | AJ410: =SUM(R[-4]C:R[-1]C) -> 0 | AK410: =SUM(R[-4]C:R[-1]C) -> 0 | AL410: =SUM(R[-4]C:R[-1]C) -> 0 | AM410: =SUM(R[-4]C:R[-1]C) -> 0 | AN410: =SUM(R[-4]C:R[-1]C) -> 0 | AO410: =SUM(R[-4]C:R[-1]C) -> 0 | AP410: =SUM(R[-4]C:R[-1]C) -> 0 | AQ410: =SUM(R[-4]C:R[-1]C) -> 0 | AR410: =SUM(R[-4]C:R[-1]C) -> 4 | AS410: =SUM(R[-4]C:R[-1]C) -> 0 | AT410: =SUM(R[-4]C:R[-1]C) -> 0 | AU410: =SUM(R[-4]C:R[-1]C) -> 29793489.66 | AV410: =SUM(R[-4]C:R[-1]C) -> 0 | AW410: =SUM(R[-4]C:R[-1]C) -> 0 | AX410: =SUM(R[-4]C:R[-1]C) -> 0 | AY410: =SUM(R[-4]C:R[-1]C) -> 0
A411: Phòng Phục vụ kỹ thuật sân đỗ (HGS) | F411: =SUM(R[-203]C[46]:R[-1]C[46]) -> 947855815 | G411: =SUM(R[-203]C[46]:R[-1]C[46]) -> 4757307 | H411: =SUM(R[-203]C[46]:R[-1]C[46]) -> 0 | I411: =SUM(R[-203]C[46]:R[-1]C[46]) -> 1050000 | J411: =SUM(R[-203]C[46]:R[-1]C[46]) -> 1050000 | K411: =SUM(R[-203]C[46]:R[-1]C[46]) -> 3675000 | L411: =SUM(R[-203]C[46]:R[-1]C[46]) -> 124387693 | M411: =SUM(R[-203]C[46]:R[-1]C[46]) -> 50217561 | N411: =SUM(R[-203]C[46]:R[-1]C[46]) -> 34482817 | O411: =SUM(R[-203]C[46]:R[-1]C[46]) -> 0 | P411: =SUM(R[-203]C[46]:R[-1]C[46]) -> 0 | Q411: =SUM(R[-203]C[46]:R[-1]C[46]) -> 1166426193 | R411: =SUM(R[-203]C[46]:R[-1]C[46]) -> 38260960 | S411: =SUM(R[-203]C[46]:R[-1]C[46]) -> 7173981 | T411: =SUM(R[-203]C[46]:R[-1]C[46]) -> 4782620 | U411: =SUM(R[-203]C[46]:R[-1]C[46]) -> 11024175.349999983 | V411: =SUM(R[-203]C[46]:R[-1]C[46]) -> 2903 | W411: =SUM(R[-203]C[46]:R[-1]C[46]) -> 1105181553.6500001 | X411: =SUM(R[-203]C[46]:R[-1]C[46]) -> 0 | Y411: =SUM(R[-203]C[46]:R[-1]C[46]) -> 4757307 | Z411: =SUM(R[-203]C[46]:R[-1]C[46]) -> 0 | AA411: =SUM(R[-203]C[46]:R[-1]C[46]) -> 0 | AB411: =SUM(R[-203]C[46]:R[-1]C[46]) -> 0 | AC411: =SUM(R[-203]C[46]:R[-1]C[46]) -> 0 | AD411: =SUM(R[-203]C[46]:R[-1]C[46]) -> 0 | AE411: =SUM(R[-203]C[46]:R[-1]C[46]) -> 0 | AF411: =SUM(R[-203]C[46]:R[-1]C[46]) -> 0 | AG411: =SUM(R[-203]C[46]:R[-1]C[46]) -> 0 | AH411: =SUM(R[-203]C[46]:R[-1]C[46]) -> 34482817 | AI411: =SUM(R[-203]C[46]:R[-1]C[46]) -> 941026798 | AJ411: =SUM(R[-203]C[46]:R[-1]C[46]) -> 6829017 | AK411: =SUM(R[-203]C[46]:R[-1]C[46]) -> 0 | AL411: =SUM(R[-203]C[46]:R[-1]C[46]) -> 0 | AM411: =SUM(R[-203]C[46]:R[-1]C[46]) -> 0 | AN411: =SUM(R[-203]C[46]:R[-1]C[46]) -> 0 | AO411: =SUM(R[-203]C[46]:R[-1]C[46]) -> 0 | AP411: =SUM(R[-203]C[46]:R[-1]C[46]) -> 0 | AQ411: =SUM(R[-203]C[46]:R[-1]C[46]) -> 0 | AR411: =SUM(R[-203]C[46]:R[-1]C[46]) -> 189 | AS411: =SUM(R[-203]C[46]:R[-1]C[46]) -> 0 | AT411: =SUM(R[-203]C[46]:R[-1]C[46]) -> 0 | AU411: =SUM(R[-203]C[46]:R[-1]C[46]) -> 1105181553.6500001 | AV411: =SUM(R[-203]C[46]:R[-1]C[46]) -> 0 | AW411: =SUM(R[-203]C[46]:R[-1]C[46]) -> 11494272.332000002 | AX411: =SUM(R[-203]C[46]:R[-1]C[46]) -> 34482817 | AY411: =SUM(R[-203]C[46]:R[-1]C[46]) -> 22988544.66799999
A412: Phòng Tài chính - Kế toán (HGS) | F412: =R[13]C -> 81898586 | G412: =R[13]C -> 0 | H412: =R[13]C -> 0 | I412: =R[13]C -> 420000 | J412: =R[13]C -> 420000 | K412: =R[13]C -> 0 | L412: =R[13]C -> 6274545 | M412: =R[13]C -> 2896794 | N412: =R[13]C -> 0 | O412: =R[13]C -> 0 | P412: =R[13]C -> 0 | Q412: =R[13]C -> 91489925 | R412: =R[13]C -> 2207080 | S412: =R[13]C -> 413829 | T412: =R[13]C -> 275885 | U412: =R[13]C -> 813952.80999999994 | V412: =R[13]C -> 291785 | W412: =R[13]C -> 87487393.189999998 | X412: =R[13]C -> 0 | Y412: =R[13]C -> 0 | Z412: =R[13]C -> 0 | AA412: =R[13]C -> 0 | AB412: =R[13]C -> 0 | AC412: =R[13]C -> 0 | AD412: =R[13]C -> 0 | AE412: =R[13]C -> 0 | AF412: =R[13]C -> 0 | AG412: =R[13]C -> 0 | AH412: =R[13]C -> 0 | AI412: =R[13]C -> 81898586 | AJ412: =R[13]C -> 0 | AK412: =R[13]C -> 0 | AL412: =R[13]C -> 0 | AM412: =R[13]C -> 0 | AN412: =R[13]C -> 0 | AO412: =R[13]C -> 0 | AP412: =R[13]C -> 0 | AQ412: =R[13]C -> 0 | AR412: =R[13]C -> 10 | AS412: =R[13]C -> 0 | AT412: =R[13]C -> 0 | AU412: =R[13]C -> 87487393.189999998 | AW412: =R[13]C -> 0 | AX412: =R[13]C -> 0 | AY412: =R[13]C -> 0
F413: =R[11]C -> 81898586 | G413: =R[11]C -> 0 | H413: =R[11]C -> 0 | I413: =R[11]C -> 420000 | J413: =R[11]C -> 420000 | K413: =R[11]C -> 0 | L413: =R[11]C -> 6274545 | M413: =R[11]C -> 2896794 | N413: =R[11]C -> 0 | O413: =R[11]C -> 0 | P413: =R[11]C -> 0 | Q413: =R[11]C -> 91489925 | R413: =R[11]C -> 2207080 | S413: =R[11]C -> 413829 | T413: =R[11]C -> 275885 | U413: =R[11]C -> 813952.80999999994 | V413: =R[11]C -> 291785 | W413: =R[11]C -> 87487393.189999998 | X413: =R[11]C -> 0 | Y413: =R[11]C -> 0 | Z413: =R[11]C -> 0 | AA413: =R[11]C -> 0 | AB413: =R[11]C -> 0 | AC413: =R[11]C -> 0 | AD413: =R[11]C -> 0 | AE413: =R[11]C -> 0 | AF413: =R[11]C -> 0 | AG413: =R[11]C -> 0 | AH413: =R[11]C -> 0 | AI413: =R[11]C -> 81898586 | AJ413: =R[11]C -> 0 | AK413: =R[11]C -> 0 | AL413: =R[11]C -> 0 | AM413: =R[11]C -> 0 | AN413: =R[11]C -> 0 | AO413: =R[11]C -> 0 | AP413: =R[11]C -> 0 | AQ413: =R[11]C -> 0 | AR413: =R[11]C -> 10 | AS413: =R[11]C -> 0 | AT413: =R[11]C -> 0 | AU413: =R[11]C -> 87487393.189999998 | AW413: =R[11]C -> 0 | AX413: =R[11]C -> 0 | AY413: =R[11]C -> 0
A414: 1 | B414: 010796 | C414: Trần Thị Thúy Oanh | D414: Trưởng phòng | E414: 10510102100014 | F414: =RC[29]+RC[30]+RC[31]+RC[32]+RC[33]+RC[34]+RC[35]+RC[36]+RC[37] -> 17597850 | G414: =RC[17]+RC[18]++RC[19]+RC[20]+RC[21]+RC[38]+RC[39]+RC[41] -> 0 | H414: 0 | I414: 420000 | J414: =RC[-2]+RC[-1] -> 420000 | K414: 0 | L414: 680000 | M414: 507150 | N414: =RC[15]+RC[16]+RC[17]+RC[18]+RC[19]+RC[20] -> 0 | O414: 0 | P414: 0 | Q414: 19205000 | R414: 386400 | S414: 72450 | T414: 48300 | U414: 115000 | V414: 291785 | W414: 18291065 | X414: 0 | Y414: 0 | Z414: 0 | AA414: 0 | AB414: 0 | AC414: 0 | AD414: 0 | AE414: 0 | AF414: 0 | AG414: 0 | AH414: 0 | AI414: 17597850 | AJ414: 0 | AK414: 0 | AL414: 0 | AM414: 0 | AN414: 0 | AO414: 0 | AP414: 0 | AQ414: 0 | AR414: =1 -> 1 | AS414: 0 | AT414: 0 | AU414: =RC[-30]-RC[-29]-RC[-28]-RC[-27]-RC[-26]-RC[-25] -> 18291065 | AV414: 0 | AW414: =RC[1]-RC[2] -> 0 | AX414: 0 | AY414: 0 | AZ414: =RC[-46] -> 17597850 | BA414: =RC[-46] -> 0 | BB414: =RC[-46] -> 0 | BC414: =RC[-46] -> 420000 | BD414: =RC[-46] -> 420000 | BE414: =RC[-46] -> 0 | BF414: =RC[-46] -> 680000 | BG414: =RC[-46] -> 507150 | BH414: =RC[-46] -> 0 | BI414: =RC[-46] -> 0 | BJ414: =RC[-46] -> 0 | BK414: =RC[-46] -> 19205000 | BL414: =RC[-46] -> 386400 | BM414: =RC[-46] -> 72450 | BN414: =RC[-46] -> 48300 | BO414: =RC[-46] -> 115000 | BP414: =RC[-46] -> 291785 | BQ414: =RC[-46] -> 18291065 | BR414: =RC[-46] -> 0 | BS414: =RC[-46] -> 0 | BT414: =RC[-46] -> 0 | BU414: =RC[-46] -> 0 | BV414: =RC[-46] -> 0 | BW414: =RC[-46] -> 0 | BX414: =RC[-46] -> 0 | BY414: =RC[-46] -> 0 | BZ414: =RC[-46] -> 0 | CA414: =RC[-46] -> 0 | CB414: =RC[-46] -> 0 | CC414: =RC[-46] -> 17597850 | CD414: =RC[-46] -> 0 | CE414: =RC[-46] -> 0 | CF414: =RC[-46] -> 0 | CG414: =RC[-46] -> 0 | CH414: =RC[-46] -> 0 | CI414: =RC[-46] -> 0 | CJ414: =RC[-46] -> 0 | CK414: =RC[-46] -> 0 | CL414: =RC[-46] -> 1 | CM414: =RC[-46] -> 0 | CN414: =RC[-46] -> 0 | CO414: =RC[-46] -> 18291065 | CP414: =RC[-46] -> 0 | CQ414: =RC[-46] -> 0 | CR414: =RC[-46] -> 0 | CS414: =RC[-46] -> 0
A415: 2 | B415: 010595 | C415: Lê Thị Mai | D415: Nhân viên kế toán | E415: 10524470158015 | F415: =RC[29]+RC[30]+RC[31]+RC[32]+RC[33]+RC[34]+RC[35]+RC[36]+RC[37] -> 5544928 | G415: =RC[17]+RC[18]++RC[19]+RC[20]+RC[21]+RC[38]+RC[39]+RC[41] -> 0 | H415: 0 | I415: 0 | J415: =RC[-2]+RC[-1] -> 0 | K415: 0 | L415: 680000 | M415: 263235 | N415: =RC[15]+RC[16]+RC[17]+RC[18]+RC[19]+RC[20] -> 0 | O415: 0 | P415: 0 | Q415: 6488163 | R415: 200560 | S415: 37605 | T415: 25070 | U415: 62249.279999999999 | V415: 0 | W415: 6162678.7199999997 | X415: 0 | Y415: 0 | Z415: 0 | AA415: 0 | AB415: 0 | AC415: 0 | AD415: 0 | AE415: 0 | AF415: 0 | AG415: 0 | AH415: 0 | AI415: 5544928 | AJ415: 0 | AK415: 0 | AL415: 0 | AM415: 0 | AN415: 0 | AO415: 0 | AP415: 0 | AQ415: 0 | AR415: =1 -> 1 | AS415: 0 | AT415: 0 | AU415: =RC[-30]-RC[-29]-RC[-28]-RC[-27]-RC[-26]-RC[-25] -> 6162678.7199999997 | AV415: 0 | AW415: =RC[1]-RC[2] -> 0 | AX415: 0 | AY415: 0 | AZ415: =RC[-46] -> 5544928 | BA415: =RC[-46] -> 0 | BB415: =RC[-46] -> 0 | BC415: =RC[-46] -> 0 | BD415: =RC[-46] -> 0 | BE415: =RC[-46] -> 0 | BF415: =RC[-46] -> 680000 | BG415: =RC[-46] -> 263235 | BH415: =RC[-46] -> 0 | BI415: =RC[-46] -> 0 | BJ415: =RC[-46] -> 0 | BK415: =RC[-46] -> 6488163 | BL415: =RC[-46] -> 200560 | BM415: =RC[-46] -> 37605 | BN415: =RC[-46] -> 25070 | BO415: =RC[-46] -> 62249.279999999999 | BP415: =RC[-46] -> 0 | BQ415: =RC[-46] -> 6162678.7199999997 | BR415: =RC[-46] -> 0 | BS415: =RC[-46] -> 0 | BT415: =RC[-46] -> 0 | BU415: =RC[-46] -> 0 | BV415: =RC[-46] -> 0 | BW415: =RC[-46] -> 0 | BX415: =RC[-46] -> 0 | BY415: =RC[-46] -> 0 | BZ415: =RC[-46] -> 0 | CA415: =RC[-46] -> 0 | CB415: =RC[-46] -> 0 | CC415: =RC[-46] -> 5544928 | CD415: =RC[-46] -> 0 | CE415: =RC[-46] -> 0 | CF415: =RC[-46] -> 0 | CG415: =RC[-46] -> 0 | CH415: =RC[-46] -> 0 | CI415: =RC[-46] -> 0 | CJ415: =RC[-46] -> 0 | CK415: =RC[-46] -> 0 | CL415: =RC[-46] -> 1 | CM415: =RC[-46] -> 0 | CN415: =RC[-46] -> 0 | CO415: =RC[-46] -> 6162678.7199999997 | CP415: =RC[-46] -> 0 | CQ415: =RC[-46] -> 0 | CR415: =RC[-46] -> 0 | CS415: =RC[-46] -> 0
A416: 3 | B416: 010793 | C416: Lê Thị Thuý | D416: Nhân viên kế toán | E416: 10523640486016 | F416: =RC[29]+RC[30]+RC[31]+RC[32]+RC[33]+RC[34]+RC[35]+RC[36]+RC[37] -> 7587796 | G416: =RC[17]+RC[18]++RC[19]+RC[20]+RC[21]+RC[38]+RC[39]+RC[41] -> 0 | H416: 0 | I416: 0 | J416: =RC[-2]+RC[-1] -> 0 | K416: 0 | L416: 680000 | M416: 263235 | N416: =RC[15]+RC[16]+RC[17]+RC[18]+RC[19]+RC[20] -> 0 | O416: 0 | P416: 0 | Q416: 8531031 | R416: 200560 | S416: 37605 | T416: 25070 | U416: 82677.960000000006 | V416: 0 | W416: 8185118.04 | X416: 0 | Y416: 0 | Z416: 0 | AA416: 0 | AB416: 0 | AC416: 0 | AD416: 0 | AE416: 0 | AF416: 0 | AG416: 0 | AH416: 0 | AI416: 7587796 | AJ416: 0 | AK416: 0 | AL416: 0 | AM416: 0 | AN416: 0 | AO416: 0 | AP416: 0 | AQ416: 0 | AR416: =1 -> 1 | AS416: 0 | AT416: 0 | AU416: =RC[-30]-RC[-29]-RC[-28]-RC[-27]-RC[-26]-RC[-25] -> 8185118.04 | AV416: 0 | AW416: =RC[1]-RC[2] -> 0 | AX416: 0 | AY416: 0 | AZ416: =RC[-46] -> 7587796 | BA416: =RC[-46] -> 0 | BB416: =RC[-46] -> 0 | BC416: =RC[-46] -> 0 | BD416: =RC[-46] -> 0 | BE416: =RC[-46] -> 0 | BF416: =RC[-46] -> 680000 | BG416: =RC[-46] -> 263235 | BH416: =RC[-46] -> 0 | BI416: =RC[-46] -> 0 | BJ416: =RC[-46] -> 0 | BK416: =RC[-46] -> 8531031 | BL416: =RC[-46] -> 200560 | BM416: =RC[-46] -> 37605 | BN416: =RC[-46] -> 25070 | BO416: =RC[-46] -> 82677.960000000006 | BP416: =RC[-46] -> 0 | BQ416: =RC[-46] -> 8185118.04 | BR416: =RC[-46] -> 0 | BS416: =RC[-46] -> 0 | BT416: =RC[-46] -> 0 | BU416: =RC[-46] -> 0 | BV416: =RC[-46] -> 0 | BW416: =RC[-46] -> 0 | BX416: =RC[-46] -> 0 | BY416: =RC[-46] -> 0 | BZ416: =RC[-46] -> 0 | CA416: =RC[-46] -> 0 | CB416: =RC[-46] -> 0 | CC416: =RC[-46] -> 7587796 | CD416: =RC[-46] -> 0 | CE416: =RC[-46] -> 0 | CF416: =RC[-46] -> 0 | CG416: =RC[-46] -> 0 | CH416: =RC[-46] -> 0 | CI416: =RC[-46] -> 0 | CJ416: =RC[-46] -> 0 | CK416: =RC[-46] -> 0 | CL416: =RC[-46] -> 1 | CM416: =RC[-46] -> 0 | CN416: =RC[-46] -> 0 | CO416: =RC[-46] -> 8185118.04 | CP416: =RC[-46] -> 0 | CQ416: =RC[-46] -> 0 | CR416: =RC[-46] -> 0 | CS416: =RC[-46] -> 0
A417: 4 | B417: 012660 | C417: Bùi Thị Thu | D417: Nhân viên kế toán | E417: 19027307720015 | F417: =RC[29]+RC[30]+RC[31]+RC[32]+RC[33]+RC[34]+RC[35]+RC[36]+RC[37] -> 6420443 | G417: =RC[17]+RC[18]++RC[19]+RC[20]+RC[21]+RC[38]+RC[39]+RC[41] -> 0 | H417: 0 | I417: 0 | J417: =RC[-2]+RC[-1] -> 0 | K417: 0 | L417: 680000 | M417: 282555 | N417: =RC[15]+RC[16]+RC[17]+RC[18]+RC[19]+RC[20] -> 0 | O417: 0 | P417: 0 | Q417: 7382998 | R417: 215280 | S417: 40365 | T417: 26910 | U417: 71004.429999999993 | V417: 0 | W417: 7029438.5700000003 | X417: 0 | Y417: 0 | Z417: 0 | AA417: 0 | AB417: 0 | AC417: 0 | AD417: 0 | AE417: 0 | AF417: 0 | AG417: 0 | AH417: 0 | AI417: 6420443 | AJ417: 0 | AK417: 0 | AL417: 0 | AM417: 0 | AN417: 0 | AO417: 0 | AP417: 0 | AQ417: 0 | AR417: =1 -> 1 | AS417: 0 | AT417: 0 | AU417: =RC[-30]-RC[-29]-RC[-28]-RC[-27]-RC[-26]-RC[-25] -> 7029438.5700000003 | AV417: 0 | AW417: =RC[1]-RC[2] -> 0 | AX417: 0 | AY417: 0 | AZ417: =RC[-46] -> 6420443 | BA417: =RC[-46] -> 0 | BB417: =RC[-46] -> 0 | BC417: =RC[-46] -> 0 | BD417: =RC[-46] -> 0 | BE417: =RC[-46] -> 0 | BF417: =RC[-46] -> 680000 | BG417: =RC[-46] -> 282555 | BH417: =RC[-46] -> 0 | BI417: =RC[-46] -> 0 | BJ417: =RC[-46] -> 0 | BK417: =RC[-46] -> 7382998 | BL417: =RC[-46] -> 215280 | BM417: =RC[-46] -> 40365 | BN417: =RC[-46] -> 26910 | BO417: =RC[-46] -> 71004.429999999993 | BP417: =RC[-46] -> 0 | BQ417: =RC[-46] -> 7029438.5700000003 | BR417: =RC[-46] -> 0 | BS417: =RC[-46] -> 0 | BT417: =RC[-46] -> 0 | BU417: =RC[-46] -> 0 | BV417: =RC[-46] -> 0 | BW417: =RC[-46] -> 0 | BX417: =RC[-46] -> 0 | BY417: =RC[-46] -> 0 | BZ417: =RC[-46] -> 0 | CA417: =RC[-46] -> 0 | CB417: =RC[-46] -> 0 | CC417: =RC[-46] -> 6420443 | CD417: =RC[-46] -> 0 | CE417: =RC[-46] -> 0 | CF417: =RC[-46] -> 0 | CG417: =RC[-46] -> 0 | CH417: =RC[-46] -> 0 | CI417: =RC[-46] -> 0 | CJ417: =RC[-46] -> 0 | CK417: =RC[-46] -> 0 | CL417: =RC[-46] -> 1 | CM417: =RC[-46] -> 0 | CN417: =RC[-46] -> 0 | CO417: =RC[-46] -> 7029438.5700000003 | CP417: =RC[-46] -> 0 | CQ417: =RC[-46] -> 0 | CR417: =RC[-46] -> 0 | CS417: =RC[-46] -> 0
A418: 5 | B418: 010794 | C418: Nguyễn Thị Kim Huệ | D418: NV Thủ Quỹ | E418: 10520052695017 | F418: =RC[29]+RC[30]+RC[31]+RC[32]+RC[33]+RC[34]+RC[35]+RC[36]+RC[37] -> 6216156 | G418: =RC[17]+RC[18]++RC[19]+RC[20]+RC[21]+RC[38]+RC[39]+RC[41] -> 0 | H418: 0 | I418: 0 | J418: =RC[-2]+RC[-1] -> 0 | K418: 0 | L418: 680000 | M418: 263235 | N418: =RC[15]+RC[16]+RC[17]+RC[18]+RC[19]+RC[20] -> 0 | O418: 0 | P418: 0 | Q418: 7159391 | R418: 200560 | S418: 37605 | T418: 25070 | U418: 68961.56 | V418: 0 | W418: 6827194.4400000004 | X418: 0 | Y418: 0 | Z418: 0 | AA418: 0 | AB418: 0 | AC418: 0 | AD418: 0 | AE418: 0 | AF418: 0 | AG418: 0 | AH418: 0 | AI418: 6216156 | AJ418: 0 | AK418: 0 | AL418: 0 | AM418: 0 | AN418: 0 | AO418: 0 | AP418: 0 | AQ418: 0 | AR418: =1 -> 1 | AS418: 0 | AT418: 0 | AU418: =RC[-30]-RC[-29]-RC[-28]-RC[-27]-RC[-26]-RC[-25] -> 6827194.4400000004 | AV418: 0 | AW418: =RC[1]-RC[2] -> 0 | AX418: 0 | AY418: 0 | AZ418: =RC[-46] -> 6216156 | BA418: =RC[-46] -> 0 | BB418: =RC[-46] -> 0 | BC418: =RC[-46] -> 0 | BD418: =RC[-46] -> 0 | BE418: =RC[-46] -> 0 | BF418: =RC[-46] -> 680000 | BG418: =RC[-46] -> 263235 | BH418: =RC[-46] -> 0 | BI418: =RC[-46] -> 0 | BJ418: =RC[-46] -> 0 | BK418: =RC[-46] -> 7159391 | BL418: =RC[-46] -> 200560 | BM418: =RC[-46] -> 37605 | BN418: =RC[-46] -> 25070 | BO418: =RC[-46] -> 68961.56 | BP418: =RC[-46] -> 0 | BQ418: =RC[-46] -> 6827194.4400000004 | BR418: =RC[-46] -> 0 | BS418: =RC[-46] -> 0 | BT418: =RC[-46] -> 0 | BU418: =RC[-46] -> 0 | BV418: =RC[-46] -> 0 | BW418: =RC[-46] -> 0 | BX418: =RC[-46] -> 0 | BY418: =RC[-46] -> 0 | BZ418: =RC[-46] -> 0 | CA418: =RC[-46] -> 0 | CB418: =RC[-46] -> 0 | CC418: =RC[-46] -> 6216156 | CD418: =RC[-46] -> 0 | CE418: =RC[-46] -> 0 | CF418: =RC[-46] -> 0 | CG418: =RC[-46] -> 0 | CH418: =RC[-46] -> 0 | CI418: =RC[-46] -> 0 | CJ418: =RC[-46] -> 0 | CK418: =RC[-46] -> 0 | CL418: =RC[-46] -> 1 | CM418: =RC[-46] -> 0 | CN418: =RC[-46] -> 0 | CO418: =RC[-46] -> 6827194.4400000004 | CP418: =RC[-46] -> 0 | CQ418: =RC[-46] -> 0 | CR418: =RC[-46] -> 0 | CS418: =RC[-46] -> 0
A419: 6 | B419: 010788 | C419: Phạm Thị Thu Hiền | D419: Chuyên viên TCKT | E419: 10522161952014 | F419: =RC[29]+RC[30]+RC[31]+RC[32]+RC[33]+RC[34]+RC[35]+RC[36]+RC[37] -> 8521679 | G419: =RC[17]+RC[18]++RC[19]+RC[20]+RC[21]+RC[38]+RC[39]+RC[41] -> 0 | H419: 0 | I419: 0 | J419: =RC[-2]+RC[-1] -> 0 | K419: 0 | L419: 680000 | M419: 319988 | N419: =RC[15]+RC[16]+RC[17]+RC[18]+RC[19]+RC[20] -> 0 | O419: 0 | P419: 0 | Q419: 9521667 | R419: 243800 | S419: 45713 | T419: 30475 | U419: 92016.79 | V419: 0 | W419: 9109662.2100000009 | X419: 0 | Y419: 0 | Z419: 0 | AA419: 0 | AB419: 0 | AC419: 0 | AD419: 0 | AE419: 0 | AF419: 0 | AG419: 0 | AH419: 0 | AI419: 8521679 | AJ419: 0 | AK419: 0 | AL419: 0 | AM419: 0 | AN419: 0 | AO419: 0 | AP419: 0 | AQ419: 0 | AR419: =1 -> 1 | AS419: 0 | AT419: 0 | AU419: =RC[-30]-RC[-29]-RC[-28]-RC[-27]-RC[-26]-RC[-25] -> 9109662.2100000009 | AV419: 0 | AW419: =RC[1]-RC[2] -> 0 | AX419: 0 | AY419: 0 | AZ419: =RC[-46] -> 8521679 | BA419: =RC[-46] -> 0 | BB419: =RC[-46] -> 0 | BC419: =RC[-46] -> 0 | BD419: =RC[-46] -> 0 | BE419: =RC[-46] -> 0 | BF419: =RC[-46] -> 680000 | BG419: =RC[-46] -> 319988 | BH419: =RC[-46] -> 0 | BI419: =RC[-46] -> 0 | BJ419: =RC[-46] -> 0 | BK419: =RC[-46] -> 9521667 | BL419: =RC[-46] -> 243800 | BM419: =RC[-46] -> 45713 | BN419: =RC[-46] -> 30475 | BO419: =RC[-46] -> 92016.79 | BP419: =RC[-46] -> 0 | BQ419: =RC[-46] -> 9109662.2100000009 | BR419: =RC[-46] -> 0 | BS419: =RC[-46] -> 0 | BT419: =RC[-46] -> 0 | BU419: =RC[-46] -> 0 | BV419: =RC[-46] -> 0 | BW419: =RC[-46] -> 0 | BX419: =RC[-46] -> 0 | BY419: =RC[-46] -> 0 | BZ419: =RC[-46] -> 0 | CA419: =RC[-46] -> 0 | CB419: =RC[-46] -> 0 | CC419: =RC[-46] -> 8521679 | CD419: =RC[-46] -> 0 | CE419: =RC[-46] -> 0 | CF419: =RC[-46] -> 0 | CG419: =RC[-46] -> 0 | CH419: =RC[-46] -> 0 | CI419: =RC[-46] -> 0 | CJ419: =RC[-46] -> 0 | CK419: =RC[-46] -> 0 | CL419: =RC[-46] -> 1 | CM419: =RC[-46] -> 0 | CN419: =RC[-46] -> 0 | CO419: =RC[-46] -> 9109662.2100000009 | CP419: =RC[-46] -> 0 | CQ419: =RC[-46] -> 0 | CR419: =RC[-46] -> 0 | CS419: =RC[-46] -> 0
A420: 7 | B420: 010789 | C420: Hoàng Thị Trang Nhung | D420: Chuyên viên TCKT | E420: 10522161961013 | F420: =RC[29]+RC[30]+RC[31]+RC[32]+RC[33]+RC[34]+RC[35]+RC[36]+RC[37] -> 5232661 | G420: =RC[17]+RC[18]++RC[19]+RC[20]+RC[21]+RC[38]+RC[39]+RC[41] -> 0 | H420: 0 | I420: 0 | J420: =RC[-2]+RC[-1] -> 0 | K420: 0 | L420: 154545 | M420: 0 | N420: =RC[15]+RC[16]+RC[17]+RC[18]+RC[19]+RC[20] -> 0 | O420: 0 | P420: 0 | Q420: 5387206 | R420: 0 | S420: 0 | T420: 0 | U420: 53872.06 | V420: 0 | W420: 5333333.9400000004 | X420: 0 | Y420: 0 | Z420: 0 | AA420: 0 | AB420: 0 | AC420: 0 | AD420: 0 | AE420: 0 | AF420: 0 | AG420: 0 | AH420: 0 | AI420: 5232661 | AJ420: 0 | AK420: 0 | AL420: 0 | AM420: 0 | AN420: 0 | AO420: 0 | AP420: 0 | AQ420: 0 | AR420: =1 -> 1 | AS420: 0 | AT420: 0 | AU420: =RC[-30]-RC[-29]-RC[-28]-RC[-27]-RC[-26]-RC[-25] -> 5333333.9400000004 | AV420: 0 | AW420: =RC[1]-RC[2] -> 0 | AX420: 0 | AY420: 0 | AZ420: =RC[-46] -> 5232661 | BA420: =RC[-46] -> 0 | BB420: =RC[-46] -> 0 | BC420: =RC[-46] -> 0 | BD420: =RC[-46] -> 0 | BE420: =RC[-46] -> 0 | BF420: =RC[-46] -> 154545 | BG420: =RC[-46] -> 0 | BH420: =RC[-46] -> 0 | BI420: =RC[-46] -> 0 | BJ420: =RC[-46] -> 0 | BK420: =RC[-46] -> 5387206 | BL420: =RC[-46] -> 0 | BM420: =RC[-46] -> 0 | BN420: =RC[-46] -> 0 | BO420: =RC[-46] -> 53872.06 | BP420: =RC[-46] -> 0 | BQ420: =RC[-46] -> 5333333.9400000004 | BR420: =RC[-46] -> 0 | BS420: =RC[-46] -> 0 | BT420: =RC[-46] -> 0 | BU420: =RC[-46] -> 0 | BV420: =RC[-46] -> 0 | BW420: =RC[-46] -> 0 | BX420: =RC[-46] -> 0 | BY420: =RC[-46] -> 0 | BZ420: =RC[-46] -> 0 | CA420: =RC[-46] -> 0 | CB420: =RC[-46] -> 0 | CC420: =RC[-46] -> 5232661 | CD420: =RC[-46] -> 0 | CE420: =RC[-46] -> 0 | CF420: =RC[-46] -> 0 | CG420: =RC[-46] -> 0 | CH420: =RC[-46] -> 0 | CI420: =RC[-46] -> 0 | CJ420: =RC[-46] -> 0 | CK420: =RC[-46] -> 0 | CL420: =RC[-46] -> 1 | CM420: =RC[-46] -> 0 | CN420: =RC[-46] -> 0 | CO420: =RC[-46] -> 5333333.9400000004 | CP420: =RC[-46] -> 0 | CQ420: =RC[-46] -> 0 | CR420: =RC[-46] -> 0 | CS420: =RC[-46] -> 0
A421: 8 | B421: 010790 | C421: Đào Thị Chín | D421: Chuyên viên TCKT | E421: 10520107419014 | F421: =RC[29]+RC[30]+RC[31]+RC[32]+RC[33]+RC[34]+RC[35]+RC[36]+RC[37] -> 8521679 | G421: =RC[17]+RC[18]++RC[19]+RC[20]+RC[21]+RC[38]+RC[39]+RC[41] -> 0 | H421: 0 | I421: 0 | J421: =RC[-2]+RC[-1] -> 0 | K421: 0 | L421: 680000 | M421: 319988 | N421: =RC[15]+RC[16]+RC[17]+RC[18]+RC[19]+RC[20] -> 0 | O421: 0 | P421: 0 | Q421: 9521667 | R421: 243800 | S421: 45713 | T421: 30475 | U421: 92016.79 | V421: 0 | W421: 9109662.2100000009 | X421: 0 | Y421: 0 | Z421: 0 | AA421: 0 | AB421: 0 | AC421: 0 | AD421: 0 | AE421: 0 | AF421: 0 | AG421: 0 | AH421: 0 | AI421: 8521679 | AJ421: 0 | AK421: 0 | AL421: 0 | AM421: 0 | AN421: 0 | AO421: 0 | AP421: 0 | AQ421: 0 | AR421: =1 -> 1 | AS421: 0 | AT421: 0 | AU421: =RC[-30]-RC[-29]-RC[-28]-RC[-27]-RC[-26]-RC[-25] -> 9109662.2100000009 | AV421: 0 | AW421: =RC[1]-RC[2] -> 0 | AX421: 0 | AY421: 0 | AZ421: =RC[-46] -> 8521679 | BA421: =RC[-46] -> 0 | BB421: =RC[-46] -> 0 | BC421: =RC[-46] -> 0 | BD421: =RC[-46] -> 0 | BE421: =RC[-46] -> 0 | BF421: =RC[-46] -> 680000 | BG421: =RC[-46] -> 319988 | BH421: =RC[-46] -> 0 | BI421: =RC[-46] -> 0 | BJ421: =RC[-46] -> 0 | BK421: =RC[-46] -> 9521667 | BL421: =RC[-46] -> 243800 | BM421: =RC[-46] -> 45713 | BN421: =RC[-46] -> 30475 | BO421: =RC[-46] -> 92016.79 | BP421: =RC[-46] -> 0 | BQ421: =RC[-46] -> 9109662.2100000009 | BR421: =RC[-46] -> 0 | BS421: =RC[-46] -> 0 | BT421: =RC[-46] -> 0 | BU421: =RC[-46] -> 0 | BV421: =RC[-46] -> 0 | BW421: =RC[-46] -> 0 | BX421: =RC[-46] -> 0 | BY421: =RC[-46] -> 0 | BZ421: =RC[-46] -> 0 | CA421: =RC[-46] -> 0 | CB421: =RC[-46] -> 0 | CC421: =RC[-46] -> 8521679 | CD421: =RC[-46] -> 0 | CE421: =RC[-46] -> 0 | CF421: =RC[-46] -> 0 | CG421: =RC[-46] -> 0 | CH421: =RC[-46] -> 0 | CI421: =RC[-46] -> 0 | CJ421: =RC[-46] -> 0 | CK421: =RC[-46] -> 0 | CL421: =RC[-46] -> 1 | CM421: =RC[-46] -> 0 | CN421: =RC[-46] -> 0 | CO421: =RC[-46] -> 9109662.2100000009 | CP421: =RC[-46] -> 0 | CQ421: =RC[-46] -> 0 | CR421: =RC[-46] -> 0 | CS421: =RC[-46] -> 0
A422: 9 | B422: 010791 | C422: Trần Thu Trang | D422: Chuyên viên TCKT | E422: 10520473286019 | F422: =RC[29]+RC[30]+RC[31]+RC[32]+RC[33]+RC[34]+RC[35]+RC[36]+RC[37] -> 7208406 | G422: =RC[17]+RC[18]++RC[19]+RC[20]+RC[21]+RC[38]+RC[39]+RC[41] -> 0 | H422: 0 | I422: 0 | J422: =RC[-2]+RC[-1] -> 0 | K422: 0 | L422: 680000 | M422: 357420 | N422: =RC[15]+RC[16]+RC[17]+RC[18]+RC[19]+RC[20] -> 0 | O422: 0 | P422: 0 | Q422: 8245826 | R422: 272320 | S422: 51060 | T422: 34040 | U422: 78884.06 | V422: 0 | W422: 7809521.9400000004 | X422: 0 | Y422: 0 | Z422: 0 | AA422: 0 | AB422: 0 | AC422: 0 | AD422: 0 | AE422: 0 | AF422: 0 | AG422: 0 | AH422: 0 | AI422: 7208406 | AJ422: 0 | AK422: 0 | AL422: 0 | AM422: 0 | AN422: 0 | AO422: 0 | AP422: 0 | AQ422: 0 | AR422: =1 -> 1 | AS422: 0 | AT422: 0 | AU422: =RC[-30]-RC[-29]-RC[-28]-RC[-27]-RC[-26]-RC[-25] -> 7809521.9400000004 | AV422: 0 | AW422: =RC[1]-RC[2] -> 0 | AX422: 0 | AY422: 0 | AZ422: =RC[-46] -> 7208406 | BA422: =RC[-46] -> 0 | BB422: =RC[-46] -> 0 | BC422: =RC[-46] -> 0 | BD422: =RC[-46] -> 0 | BE422: =RC[-46] -> 0 | BF422: =RC[-46] -> 680000 | BG422: =RC[-46] -> 357420 | BH422: =RC[-46] -> 0 | BI422: =RC[-46] -> 0 | BJ422: =RC[-46] -> 0 | BK422: =RC[-46] -> 8245826 | BL422: =RC[-46] -> 272320 | BM422: =RC[-46] -> 51060 | BN422: =RC[-46] -> 34040 | BO422: =RC[-46] -> 78884.06 | BP422: =RC[-46] -> 0 | BQ422: =RC[-46] -> 7809521.9400000004 | BR422: =RC[-46] -> 0 | BS422: =RC[-46] -> 0 | BT422: =RC[-46] -> 0 | BU422: =RC[-46] -> 0 | BV422: =RC[-46] -> 0 | BW422: =RC[-46] -> 0 | BX422: =RC[-46] -> 0 | BY422: =RC[-46] -> 0 | BZ422: =RC[-46] -> 0 | CA422: =RC[-46] -> 0 | CB422: =RC[-46] -> 0 | CC422: =RC[-46] -> 7208406 | CD422: =RC[-46] -> 0 | CE422: =RC[-46] -> 0 | CF422: =RC[-46] -> 0 | CG422: =RC[-46] -> 0 | CH422: =RC[-46] -> 0 | CI422: =RC[-46] -> 0 | CJ422: =RC[-46] -> 0 | CK422: =RC[-46] -> 0 | CL422: =RC[-46] -> 1 | CM422: =RC[-46] -> 0 | CN422: =RC[-46] -> 0 | CO422: =RC[-46] -> 7809521.9400000004 | CP422: =RC[-46] -> 0 | CQ422: =RC[-46] -> 0 | CR422: =RC[-46] -> 0 | CS422: =RC[-46] -> 0
A423: 10 | B423: 011147 | C423: Vũ Chí Kiên | D423: Chuyên viên TCKT | E423: 10522175759012 | F423: =RC[29]+RC[30]+RC[31]+RC[32]+RC[33]+RC[34]+RC[35]+RC[36]+RC[37] -> 9046988 | G423: =RC[17]+RC[18]++RC[19]+RC[20]+RC[21]+RC[38]+RC[39]+RC[41] -> 0 | H423: 0 | I423: 0 | J423: =RC[-2]+RC[-1] -> 0 | K423: 0 | L423: 680000 | M423: 319988 | N423: =RC[15]+RC[16]+RC[17]+RC[18]+RC[19]+RC[20] -> 0 | O423: 0 | P423: 0 | Q423: 10046976 | R423: 243800 | S423: 45713 | T423: 30475 | U423: 97269.88 | V423: 0 | W423: 9629718.1199999992 | X423: 0 | Y423: 0 | Z423: 0 | AA423: 0 | AB423: 0 | AC423: 0 | AD423: 0 | AE423: 0 | AF423: 0 | AG423: 0 | AH423: 0 | AI423: 9046988 | AJ423: 0 | AK423: 0 | AL423: 0 | AM423: 0 | AN423: 0 | AO423: 0 | AP423: 0 | AQ423: 0 | AR423: =1 -> 1 | AS423: 0 | AT423: 0 | AU423: =RC[-30]-RC[-29]-RC[-28]-RC[-27]-RC[-26]-RC[-25] -> 9629718.1199999992 | AV423: 0 | AW423: =RC[1]-RC[2] -> 0 | AX423: 0 | AY423: 0 | AZ423: =RC[-46] -> 9046988 | BA423: =RC[-46] -> 0 | BB423: =RC[-46] -> 0 | BC423: =RC[-46] -> 0 | BD423: =RC[-46] -> 0 | BE423: =RC[-46] -> 0 | BF423: =RC[-46] -> 680000 | BG423: =RC[-46] -> 319988 | BH423: =RC[-46] -> 0 | BI423: =RC[-46] -> 0 | BJ423: =RC[-46] -> 0 | BK423: =RC[-46] -> 10046976 | BL423: =RC[-46] -> 243800 | BM423: =RC[-46] -> 45713 | BN423: =RC[-46] -> 30475 | BO423: =RC[-46] -> 97269.88 | BP423: =RC[-46] -> 0 | BQ423: =RC[-46] -> 9629718.1199999992 | BR423: =RC[-46] -> 0 | BS423: =RC[-46] -> 0 | BT423: =RC[-46] -> 0 | BU423: =RC[-46] -> 0 | BV423: =RC[-46] -> 0 | BW423: =RC[-46] -> 0 | BX423: =RC[-46] -> 0 | BY423: =RC[-46] -> 0 | BZ423: =RC[-46] -> 0 | CA423: =RC[-46] -> 0 | CB423: =RC[-46] -> 0 | CC423: =RC[-46] -> 9046988 | CD423: =RC[-46] -> 0 | CE423: =RC[-46] -> 0 | CF423: =RC[-46] -> 0 | CG423: =RC[-46] -> 0 | CH423: =RC[-46] -> 0 | CI423: =RC[-46] -> 0 | CJ423: =RC[-46] -> 0 | CK423: =RC[-46] -> 0 | CL423: =RC[-46] -> 1 | CM423: =RC[-46] -> 0 | CN423: =RC[-46] -> 0 | CO423: =RC[-46] -> 9629718.1199999992 | CP423: =RC[-46] -> 0 | CQ423: =RC[-46] -> 0 | CR423: =RC[-46] -> 0 | CS423: =RC[-46] -> 0
F424: =SUM(R[-10]C:R[-1]C) -> 81898586 | G424: =SUM(R[-10]C:R[-1]C) -> 0 | H424: =SUM(R[-10]C:R[-1]C) -> 0 | I424: =SUM(R[-10]C:R[-1]C) -> 420000 | J424: =SUM(R[-10]C:R[-1]C) -> 420000 | K424: =SUM(R[-10]C:R[-1]C) -> 0 | L424: =SUM(R[-10]C:R[-1]C) -> 6274545 | M424: =SUM(R[-10]C:R[-1]C) -> 2896794 | N424: =SUM(R[-10]C:R[-1]C) -> 0 | O424: =SUM(R[-10]C:R[-1]C) -> 0 | P424: =SUM(R[-10]C:R[-1]C) -> 0 | Q424: =SUM(R[-10]C:R[-1]C) -> 91489925 | R424: =SUM(R[-10]C:R[-1]C) -> 2207080 | S424: =SUM(R[-10]C:R[-1]C) -> 413829 | T424: =SUM(R[-10]C:R[-1]C) -> 275885 | U424: =SUM(R[-10]C:R[-1]C) -> 813952.80999999994 | V424: =SUM(R[-10]C:R[-1]C) -> 291785 | W424: =SUM(R[-10]C:R[-1]C) -> 87487393.189999998 | X424: =SUM(R[-10]C:R[-1]C) -> 0 | Y424: =SUM(R[-10]C:R[-1]C) -> 0 | Z424: =SUM(R[-10]C:R[-1]C) -> 0 | AA424: =SUM(R[-10]C:R[-1]C) -> 0 | AB424: =SUM(R[-10]C:R[-1]C) -> 0 | AC424: =SUM(R[-10]C:R[-1]C) -> 0 | AD424: =SUM(R[-10]C:R[-1]C) -> 0 | AE424: =SUM(R[-10]C:R[-1]C) -> 0 | AF424: =SUM(R[-10]C:R[-1]C) -> 0 | AG424: =SUM(R[-10]C:R[-1]C) -> 0 | AH424: =SUM(R[-10]C:R[-1]C) -> 0 | AI424: =SUM(R[-10]C:R[-1]C) -> 81898586 | AJ424: =SUM(R[-10]C:R[-1]C) -> 0 | AK424: =SUM(R[-10]C:R[-1]C) -> 0 | AL424: =SUM(R[-10]C:R[-1]C) -> 0 | AM424: =SUM(R[-10]C:R[-1]C) -> 0 | AN424: =SUM(R[-10]C:R[-1]C) -> 0 | AO424: =SUM(R[-10]C:R[-1]C) -> 0 | AP424: =SUM(R[-10]C:R[-1]C) -> 0 | AQ424: =SUM(R[-10]C:R[-1]C) -> 0 | AR424: =SUM(R[-10]C:R[-1]C) -> 10 | AS424: =SUM(R[-10]C:R[-1]C) -> 0 | AT424: =SUM(R[-10]C:R[-1]C) -> 0 | AU424: =SUM(R[-10]C:R[-1]C) -> 87487393.189999998 | AV424: =SUM(R[-10]C:R[-1]C) -> 0 | AW424: =SUM(R[-10]C:R[-1]C) -> 0 | AX424: =SUM(R[-10]C:R[-1]C) -> 0 | AY424: =SUM(R[-10]C:R[-1]C) -> 0
A425: Phòng Tài chính - Kế toán (HGS) | F425: =SUM(R[-12]C[46]:R[-1]C[46]) -> 81898586 | G425: =SUM(R[-12]C[46]:R[-1]C[46]) -> 0 | H425: =SUM(R[-12]C[46]:R[-1]C[46]) -> 0 | I425: =SUM(R[-12]C[46]:R[-1]C[46]) -> 420000 | J425: =SUM(R[-12]C[46]:R[-1]C[46]) -> 420000 | K425: =SUM(R[-12]C[46]:R[-1]C[46]) -> 0 | L425: =SUM(R[-12]C[46]:R[-1]C[46]) -> 6274545 | M425: =SUM(R[-12]C[46]:R[-1]C[46]) -> 2896794 | N425: =SUM(R[-12]C[46]:R[-1]C[46]) -> 0 | O425: =SUM(R[-12]C[46]:R[-1]C[46]) -> 0 | P425: =SUM(R[-12]C[46]:R[-1]C[46]) -> 0 | Q425: =SUM(R[-12]C[46]:R[-1]C[46]) -> 91489925 | R425: =SUM(R[-12]C[46]:R[-1]C[46]) -> 2207080 | S425: =SUM(R[-12]C[46]:R[-1]C[46]) -> 413829 | T425: =SUM(R[-12]C[46]:R[-1]C[46]) -> 275885 | U425: =SUM(R[-12]C[46]:R[-1]C[46]) -> 813952.80999999994 | V425: =SUM(R[-12]C[46]:R[-1]C[46]) -> 291785 | W425: =SUM(R[-12]C[46]:R[-1]C[46]) -> 87487393.189999998 | X425: =SUM(R[-12]C[46]:R[-1]C[46]) -> 0 | Y425: =SUM(R[-12]C[46]:R[-1]C[46]) -> 0 | Z425: =SUM(R[-12]C[46]:R[-1]C[46]) -> 0 | AA425: =SUM(R[-12]C[46]:R[-1]C[46]) -> 0 | AB425: =SUM(R[-12]C[46]:R[-1]C[46]) -> 0 | AC425: =SUM(R[-12]C[46]:R[-1]C[46]) -> 0 | AD425: =SUM(R[-12]C[46]:R[-1]C[46]) -> 0 | AE425: =SUM(R[-12]C[46]:R[-1]C[46]) -> 0 | AF425: =SUM(R[-12]C[46]:R[-1]C[46]) -> 0 | AG425: =SUM(R[-12]C[46]:R[-1]C[46]) -> 0 | AH425: =SUM(R[-12]C[46]:R[-1]C[46]) -> 0 | AI425: =SUM(R[-12]C[46]:R[-1]C[46]) -> 81898586 | AJ425: =SUM(R[-12]C[46]:R[-1]C[46]) -> 0 | AK425: =SUM(R[-12]C[46]:R[-1]C[46]) -> 0 | AL425: =SUM(R[-12]C[46]:R[-1]C[46]) -> 0 | AM425: =SUM(R[-12]C[46]:R[-1]C[46]) -> 0 | AN425: =SUM(R[-12]C[46]:R[-1]C[46]) -> 0 | AO425: =SUM(R[-12]C[46]:R[-1]C[46]) -> 0 | AP425: =SUM(R[-12]C[46]:R[-1]C[46]) -> 0 | AQ425: =SUM(R[-12]C[46]:R[-1]C[46]) -> 0 | AR425: =SUM(R[-12]C[46]:R[-1]C[46]) -> 10 | AS425: =SUM(R[-12]C[46]:R[-1]C[46]) -> 0 | AT425: =SUM(R[-12]C[46]:R[-1]C[46]) -> 0 | AU425: =SUM(R[-12]C[46]:R[-1]C[46]) -> 87487393.189999998 | AV425: =SUM(R[-12]C[46]:R[-1]C[46]) -> 0 | AW425: =SUM(R[-12]C[46]:R[-1]C[46]) -> 0 | AX425: =SUM(R[-12]C[46]:R[-1]C[46]) -> 0 | AY425: =SUM(R[-12]C[46]:R[-1]C[46]) -> 0
A426: Phòng Tổ chức - Hành chính (HGS) | F426: =R[17]C -> 91517577 | G426: =R[17]C -> 0 | H426: =R[17]C -> 0 | I426: =R[17]C -> 315000 | J426: =R[17]C -> 315000 | K426: =R[17]C -> 0 | L426: =R[17]C -> 8840000 | M426: =R[17]C -> 4257648 | N426: =R[17]C -> 0 | O426: =R[17]C -> 0 | P426: =R[17]C -> 0 | Q426: =R[17]C -> 104930225 | R426: =R[17]C -> 3243920 | S426: =R[17]C -> 608238 | T426: =R[17]C -> 405490 | U426: =R[17]C -> 1006725.77 | V426: =R[17]C -> 0 | W426: =R[17]C -> 99665851.230000019 | X426: =R[17]C -> 0 | Y426: =R[17]C -> 0 | Z426: =R[17]C -> 0 | AA426: =R[17]C -> 0 | AB426: =R[17]C -> 0 | AC426: =R[17]C -> 0 | AD426: =R[17]C -> 0 | AE426: =R[17]C -> 0 | AF426: =R[17]C -> 0 | AG426: =R[17]C -> 0 | AH426: =R[17]C -> 0 | AI426: =R[17]C -> 83944373 | AJ426: =R[17]C -> 7573204 | AK426: =R[17]C -> 0 | AL426: =R[17]C -> 0 | AM426: =R[17]C -> 0 | AN426: =R[17]C -> 0 | AO426: =R[17]C -> 0 | AP426: =R[17]C -> 0 | AQ426: =R[17]C -> 0 | AR426: =R[17]C -> 14 | AS426: =R[17]C -> 0 | AT426: =R[17]C -> 0 | AU426: =R[17]C -> 99665851.230000019 | AW426: =R[17]C -> 0 | AX426: =R[17]C -> 0 | AY426: =R[17]C -> 0
F427: =R[15]C -> 91517577 | G427: =R[15]C -> 0 | H427: =R[15]C -> 0 | I427: =R[15]C -> 315000 | J427: =R[15]C -> 315000 | K427: =R[15]C -> 0 | L427: =R[15]C -> 8840000 | M427: =R[15]C -> 4257648 | N427: =R[15]C -> 0 | O427: =R[15]C -> 0 | P427: =R[15]C -> 0 | Q427: =R[15]C -> 104930225 | R427: =R[15]C -> 3243920 | S427: =R[15]C -> 608238 | T427: =R[15]C -> 405490 | U427: =R[15]C -> 1006725.77 | V427: =R[15]C -> 0 | W427: =R[15]C -> 99665851.230000019 | X427: =R[15]C -> 0 | Y427: =R[15]C -> 0 | Z427: =R[15]C -> 0 | AA427: =R[15]C -> 0 | AB427: =R[15]C -> 0 | AC427: =R[15]C -> 0 | AD427: =R[15]C -> 0 | AE427: =R[15]C -> 0 | AF427: =R[15]C -> 0 | AG427: =R[15]C -> 0 | AH427: =R[15]C -> 0 | AI427: =R[15]C -> 83944373 | AJ427: =R[15]C -> 7573204 | AK427: =R[15]C -> 0 | AL427: =R[15]C -> 0 | AM427: =R[15]C -> 0 | AN427: =R[15]C -> 0 | AO427: =R[15]C -> 0 | AP427: =R[15]C -> 0 | AQ427: =R[15]C -> 0 | AR427: =R[15]C -> 14 | AS427: =R[15]C -> 0 | AT427: =R[15]C -> 0 | AU427: =R[15]C -> 99665851.230000019 | AW427: =R[15]C -> 0 | AX427: =R[15]C -> 0 | AY427: =R[15]C -> 0
A428: 1 | B428: 010556 | C428: Nguyễn Thị Thuỳ Linh | D428: Phó Trưởng Phòng | E428: 10522148006010 | F428: =RC[29]+RC[30]+RC[31]+RC[32]+RC[33]+RC[34]+RC[35]+RC[36]+RC[37] -> 7573204 | G428: =RC[17]+RC[18]++RC[19]+RC[20]+RC[21]+RC[38]+RC[39]+RC[41] -> 0 | H428: 0 | I428: 315000 | J428: =RC[-2]+RC[-1] -> 315000 | K428: 0 | L428: 0 | M428: 0 | N428: =RC[15]+RC[16]+RC[17]+RC[18]+RC[19]+RC[20] -> 0 | O428: 0 | P428: 0 | Q428: 7888204 | R428: 0 | S428: 0 | T428: 0 | U428: 78882.039999999994 | V428: 0 | W428: 7809321.96 | X428: 0 | Y428: 0 | Z428: 0 | AA428: 0 | AB428: 0 | AC428: 0 | AD428: 0 | AE428: 0 | AF428: 0 | AG428: 0 | AH428: 0 | AI428: 0 | AJ428: 7573204 | AK428: 0 | AL428: 0 | AM428: 0 | AN428: 0 | AO428: 0 | AP428: 0 | AQ428: 0 | AR428: =1 -> 1 | AS428: 0 | AT428: 0 | AU428: =RC[-30]-RC[-29]-RC[-28]-RC[-27]-RC[-26]-RC[-25] -> 7809321.96 | AV428: 0 | AW428: =RC[1]-RC[2] -> 0 | AX428: 0 | AY428: 0 | AZ428: =RC[-46] -> 7573204 | BA428: =RC[-46] -> 0 | BB428: =RC[-46] -> 0 | BC428: =RC[-46] -> 315000 | BD428: =RC[-46] -> 315000 | BE428: =RC[-46] -> 0 | BF428: =RC[-46] -> 0 | BG428: =RC[-46] -> 0 | BH428: =RC[-46] -> 0 | BI428: =RC[-46] -> 0 | BJ428: =RC[-46] -> 0 | BK428: =RC[-46] -> 7888204 | BL428: =RC[-46] -> 0 | BM428: =RC[-46] -> 0 | BN428: =RC[-46] -> 0 | BO428: =RC[-46] -> 78882.039999999994 | BP428: =RC[-46] -> 0 | BQ428: =RC[-46] -> 7809321.96 | BR428: =RC[-46] -> 0 | BS428: =RC[-46] -> 0 | BT428: =RC[-46] -> 0 | BU428: =RC[-46] -> 0 | BV428: =RC[-46] -> 0 | BW428: =RC[-46] -> 0 | BX428: =RC[-46] -> 0 | BY428: =RC[-46] -> 0 | BZ428: =RC[-46] -> 0 | CA428: =RC[-46] -> 0 | CB428: =RC[-46] -> 0 | CC428: =RC[-46] -> 0 | CD428: =RC[-46] -> 7573204 | CE428: =RC[-46] -> 0 | CF428: =RC[-46] -> 0 | CG428: =RC[-46] -> 0 | CH428: =RC[-46] -> 0 | CI428: =RC[-46] -> 0 | CJ428: =RC[-46] -> 0 | CK428: =RC[-46] -> 0 | CL428: =RC[-46] -> 1 | CM428: =RC[-46] -> 0 | CN428: =RC[-46] -> 0 | CO428: =RC[-46] -> 7809321.96 | CP428: =RC[-46] -> 0 | CQ428: =RC[-46] -> 0 | CR428: =RC[-46] -> 0 | CS428: =RC[-46] -> 0
A429: 2 | B429: 010797 | C429: Nguyễn Hữu Hạ | D429: CV Đảng Đoàn - Thi đua | E429: 10520107390016 | F429: =RC[29]+RC[30]+RC[31]+RC[32]+RC[33]+RC[34]+RC[35]+RC[36]+RC[37] -> 8113105 | G429: =RC[17]+RC[18]++RC[19]+RC[20]+RC[21]+RC[38]+RC[39]+RC[41] -> 0 | H429: 0 | I429: 0 | J429: =RC[-2]+RC[-1] -> 0 | K429: 0 | L429: 680000 | M429: 469718 | N429: =RC[15]+RC[16]+RC[17]+RC[18]+RC[19]+RC[20] -> 0 | O429: 0 | P429: 0 | Q429: 9262823 | R429: 357880 | S429: 67103 | T429: 44735 | U429: 87931.05 | V429: 0 | W429: 8705173.9499999993 | X429: 0 | Y429: 0 | Z429: 0 | AA429: 0 | AB429: 0 | AC429: 0 | AD429: 0 | AE429: 0 | AF429: 0 | AG429: 0 | AH429: 0 | AI429: 8113105 | AJ429: 0 | AK429: 0 | AL429: 0 | AM429: 0 | AN429: 0 | AO429: 0 | AP429: 0 | AQ429: 0 | AR429: =1 -> 1 | AS429: 0 | AT429: 0 | AU429: =RC[-30]-RC[-29]-RC[-28]-RC[-27]-RC[-26]-RC[-25] -> 8705173.9499999993 | AV429: 0 | AW429: =RC[1]-RC[2] -> 0 | AX429: 0 | AY429: 0 | AZ429: =RC[-46] -> 8113105 | BA429: =RC[-46] -> 0 | BB429: =RC[-46] -> 0 | BC429: =RC[-46] -> 0 | BD429: =RC[-46] -> 0 | BE429: =RC[-46] -> 0 | BF429: =RC[-46] -> 680000 | BG429: =RC[-46] -> 469718 | BH429: =RC[-46] -> 0 | BI429: =RC[-46] -> 0 | BJ429: =RC[-46] -> 0 | BK429: =RC[-46] -> 9262823 | BL429: =RC[-46] -> 357880 | BM429: =RC[-46] -> 67103 | BN429: =RC[-46] -> 44735 | BO429: =RC[-46] -> 87931.05 | BP429: =RC[-46] -> 0 | BQ429: =RC[-46] -> 8705173.9499999993 | BR429: =RC[-46] -> 0 | BS429: =RC[-46] -> 0 | BT429: =RC[-46] -> 0 | BU429: =RC[-46] -> 0 | BV429: =RC[-46] -> 0 | BW429: =RC[-46] -> 0 | BX429: =RC[-46] -> 0 | BY429: =RC[-46] -> 0 | BZ429: =RC[-46] -> 0 | CA429: =RC[-46] -> 0 | CB429: =RC[-46] -> 0 | CC429: =RC[-46] -> 8113105 | CD429: =RC[-46] -> 0 | CE429: =RC[-46] -> 0 | CF429: =RC[-46] -> 0 | CG429: =RC[-46] -> 0 | CH429: =RC[-46] -> 0 | CI429: =RC[-46] -> 0 | CJ429: =RC[-46] -> 0 | CK429: =RC[-46] -> 0 | CL429: =RC[-46] -> 1 | CM429: =RC[-46] -> 0 | CN429: =RC[-46] -> 0 | CO429: =RC[-46] -> 8705173.9499999993 | CP429: =RC[-46] -> 0 | CQ429: =RC[-46] -> 0 | CR429: =RC[-46] -> 0 | CS429: =RC[-46] -> 0
A430: 3 | B430: 010803 | C430: Hà Duyên Lâm | D430: Lái xe CT | E430: 10520047944017 | F430: =RC[29]+RC[30]+RC[31]+RC[32]+RC[33]+RC[34]+RC[35]+RC[36]+RC[37] -> 6420443 | G430: =RC[17]+RC[18]++RC[19]+RC[20]+RC[21]+RC[38]+RC[39]+RC[41] -> 0 | H430: 0 | I430: 0 | J430: =RC[-2]+RC[-1] -> 0 | K430: 0 | L430: 680000 | M430: 434700 | N430: =RC[15]+RC[16]+RC[17]+RC[18]+RC[19]+RC[20] -> 0 | O430: 0 | P430: 0 | Q430: 7535143 | R430: 331200 | S430: 62100 | T430: 41400 | U430: 71004.429999999993 | V430: 0 | W430: 7029438.5700000003 | X430: 0 | Y430: 0 | Z430: 0 | AA430: 0 | AB430: 0 | AC430: 0 | AD430: 0 | AE430: 0 | AF430: 0 | AG430: 0 | AH430: 0 | AI430: 6420443 | AJ430: 0 | AK430: 0 | AL430: 0 | AM430: 0 | AN430: 0 | AO430: 0 | AP430: 0 | AQ430: 0 | AR430: =1 -> 1 | AS430: 0 | AT430: 0 | AU430: =RC[-30]-RC[-29]-RC[-28]-RC[-27]-RC[-26]-RC[-25] -> 7029438.5700000003 | AV430: 0 | AW430: =RC[1]-RC[2] -> 0 | AX430: 0 | AY430: 0 | AZ430: =RC[-46] -> 6420443 | BA430: =RC[-46] -> 0 | BB430: =RC[-46] -> 0 | BC430: =RC[-46] -> 0 | BD430: =RC[-46] -> 0 | BE430: =RC[-46] -> 0 | BF430: =RC[-46] -> 680000 | BG430: =RC[-46] -> 434700 | BH430: =RC[-46] -> 0 | BI430: =RC[-46] -> 0 | BJ430: =RC[-46] -> 0 | BK430: =RC[-46] -> 7535143 | BL430: =RC[-46] -> 331200 | BM430: =RC[-46] -> 62100 | BN430: =RC[-46] -> 41400 | BO430: =RC[-46] -> 71004.429999999993 | BP430: =RC[-46] -> 0 | BQ430: =RC[-46] -> 7029438.5700000003 | BR430: =RC[-46] -> 0 | BS430: =RC[-46] -> 0 | BT430: =RC[-46] -> 0 | BU430: =RC[-46] -> 0 | BV430: =RC[-46] -> 0 | BW430: =RC[-46] -> 0 | BX430: =RC[-46] -> 0 | BY430: =RC[-46] -> 0 | BZ430: =RC[-46] -> 0 | CA430: =RC[-46] -> 0 | CB430: =RC[-46] -> 0 | CC430: =RC[-46] -> 6420443 | CD430: =RC[-46] -> 0 | CE430: =RC[-46] -> 0 | CF430: =RC[-46] -> 0 | CG430: =RC[-46] -> 0 | CH430: =RC[-46] -> 0 | CI430: =RC[-46] -> 0 | CJ430: =RC[-46] -> 0 | CK430: =RC[-46] -> 0 | CL430: =RC[-46] -> 1 | CM430: =RC[-46] -> 0 | CN430: =RC[-46] -> 0 | CO430: =RC[-46] -> 7029438.5700000003 | CP430: =RC[-46] -> 0 | CQ430: =RC[-46] -> 0 | CR430: =RC[-46] -> 0 | CS430: =RC[-46] -> 0
A431: 4 | B431: 010800 | C431: Hoàng Thuỳ Lan | D431: NV đào tạo huấn luyện | E431: 10522162005019 | F431: =RC[29]+RC[30]+RC[31]+RC[32]+RC[33]+RC[34]+RC[35]+RC[36]+RC[37] -> 6216156 | G431: =RC[17]+RC[18]++RC[19]+RC[20]+RC[21]+RC[38]+RC[39]+RC[41] -> 0 | H431: 0 | I431: 0 | J431: =RC[-2]+RC[-1] -> 0 | K431: 0 | L431: 680000 | M431: 355005 | N431: =RC[15]+RC[16]+RC[17]+RC[18]+RC[19]+RC[20] -> 0 | O431: 0 | P431: 0 | Q431: 7251161 | R431: 270480 | S431: 50715 | T431: 33810 | U431: 68961.56 | V431: 0 | W431: 6827194.4400000004 | X431: 0 | Y431: 0 | Z431: 0 | AA431: 0 | AB431: 0 | AC431: 0 | AD431: 0 | AE431: 0 | AF431: 0 | AG431: 0 | AH431: 0 | AI431: 6216156 | AJ431: 0 | AK431: 0 | AL431: 0 | AM431: 0 | AN431: 0 | AO431: 0 | AP431: 0 | AQ431: 0 | AR431: =1 -> 1 | AS431: 0 | AT431: 0 | AU431: =RC[-30]-RC[-29]-RC[-28]-RC[-27]-RC[-26]-RC[-25] -> 6827194.4400000004 | AV431: 0 | AW431: =RC[1]-RC[2] -> 0 | AX431: 0 | AY431: 0 | AZ431: =RC[-46] -> 6216156 | BA431: =RC[-46] -> 0 | BB431: =RC[-46] -> 0 | BC431: =RC[-46] -> 0 | BD431: =RC[-46] -> 0 | BE431: =RC[-46] -> 0 | BF431: =RC[-46] -> 680000 | BG431: =RC[-46] -> 355005 | BH431: =RC[-46] -> 0 | BI431: =RC[-46] -> 0 | BJ431: =RC[-46] -> 0 | BK431: =RC[-46] -> 7251161 | BL431: =RC[-46] -> 270480 | BM431: =RC[-46] -> 50715 | BN431: =RC[-46] -> 33810 | BO431: =RC[-46] -> 68961.56 | BP431: =RC[-46] -> 0 | BQ431: =RC[-46] -> 6827194.4400000004 | BR431: =RC[-46] -> 0 | BS431: =RC[-46] -> 0 | BT431: =RC[-46] -> 0 | BU431: =RC[-46] -> 0 | BV431: =RC[-46] -> 0 | BW431: =RC[-46] -> 0 | BX431: =RC[-46] -> 0 | BY431: =RC[-46] -> 0 | BZ431: =RC[-46] -> 0 | CA431: =RC[-46] -> 0 | CB431: =RC[-46] -> 0 | CC431: =RC[-46] -> 6216156 | CD431: =RC[-46] -> 0 | CE431: =RC[-46] -> 0 | CF431: =RC[-46] -> 0 | CG431: =RC[-46] -> 0 | CH431: =RC[-46] -> 0 | CI431: =RC[-46] -> 0 | CJ431: =RC[-46] -> 0 | CK431: =RC[-46] -> 0 | CL431: =RC[-46] -> 1 | CM431: =RC[-46] -> 0 | CN431: =RC[-46] -> 0 | CO431: =RC[-46] -> 6827194.4400000004 | CP431: =RC[-46] -> 0 | CQ431: =RC[-46] -> 0 | CR431: =RC[-46] -> 0 | CS431: =RC[-46] -> 0
A432: 5 | B432: 010801 | C432: Diệu Linh | D432: NV đào tạo huấn luyện | E432: 10522162985013 | F432: =RC[29]+RC[30]+RC[31]+RC[32]+RC[33]+RC[34]+RC[35]+RC[36]+RC[37] -> 7570286 | G432: =RC[17]+RC[18]++RC[19]+RC[20]+RC[21]+RC[38]+RC[39]+RC[41] -> 0 | H432: 0 | I432: 0 | J432: =RC[-2]+RC[-1] -> 0 | K432: 0 | L432: 680000 | M432: 400890 | N432: =RC[15]+RC[16]+RC[17]+RC[18]+RC[19]+RC[20] -> 0 | O432: 0 | P432: 0 | Q432: 8651176 | R432: 305440 | S432: 57270 | T432: 38180 | U432: 82502.86 | V432: 0 | W432: 8167783.1399999997 | X432: 0 | Y432: 0 | Z432: 0 | AA432: 0 | AB432: 0 | AC432: 0 | AD432: 0 | AE432: 0 | AF432: 0 | AG432: 0 | AH432: 0 | AI432: 7570286 | AJ432: 0 | AK432: 0 | AL432: 0 | AM432: 0 | AN432: 0 | AO432: 0 | AP432: 0 | AQ432: 0 | AR432: =1 -> 1 | AS432: 0 | AT432: 0 | AU432: =RC[-30]-RC[-29]-RC[-28]-RC[-27]-RC[-26]-RC[-25] -> 8167783.1399999997 | AV432: 0 | AW432: =RC[1]-RC[2] -> 0 | AX432: 0 | AY432: 0 | AZ432: =RC[-46] -> 7570286 | BA432: =RC[-46] -> 0 | BB432: =RC[-46] -> 0 | BC432: =RC[-46] -> 0 | BD432: =RC[-46] -> 0 | BE432: =RC[-46] -> 0 | BF432: =RC[-46] -> 680000 | BG432: =RC[-46] -> 400890 | BH432: =RC[-46] -> 0 | BI432: =RC[-46] -> 0 | BJ432: =RC[-46] -> 0 | BK432: =RC[-46] -> 8651176 | BL432: =RC[-46] -> 305440 | BM432: =RC[-46] -> 57270 | BN432: =RC[-46] -> 38180 | BO432: =RC[-46] -> 82502.86 | BP432: =RC[-46] -> 0 | BQ432: =RC[-46] -> 8167783.1399999997 | BR432: =RC[-46] -> 0 | BS432: =RC[-46] -> 0 | BT432: =RC[-46] -> 0 | BU432: =RC[-46] -> 0 | BV432: =RC[-46] -> 0 | BW432: =RC[-46] -> 0 | BX432: =RC[-46] -> 0 | BY432: =RC[-46] -> 0 | BZ432: =RC[-46] -> 0 | CA432: =RC[-46] -> 0 | CB432: =RC[-46] -> 0 | CC432: =RC[-46] -> 7570286 | CD432: =RC[-46] -> 0 | CE432: =RC[-46] -> 0 | CF432: =RC[-46] -> 0 | CG432: =RC[-46] -> 0 | CH432: =RC[-46] -> 0 | CI432: =RC[-46] -> 0 | CJ432: =RC[-46] -> 0 | CK432: =RC[-46] -> 0 | CL432: =RC[-46] -> 1 | CM432: =RC[-46] -> 0 | CN432: =RC[-46] -> 0 | CO432: =RC[-46] -> 8167783.1399999997 | CP432: =RC[-46] -> 0 | CQ432: =RC[-46] -> 0 | CR432: =RC[-46] -> 0 | CS432: =RC[-46] -> 0
A433: 6 | B433: 010802 | C433: Hà Phương Thảo | D433: NV hành chính | E433: 10523640479011 | F433: =RC[29]+RC[30]+RC[31]+RC[32]+RC[33]+RC[34]+RC[35]+RC[36]+RC[37] -> 5865950 | G433: =RC[17]+RC[18]++RC[19]+RC[20]+RC[21]+RC[38]+RC[39]+RC[41] -> 0 | H433: 0 | I433: 0 | J433: =RC[-2]+RC[-1] -> 0 | K433: 0 | L433: 680000 | M433: 263235 | N433: =RC[15]+RC[16]+RC[17]+RC[18]+RC[19]+RC[20] -> 0 | O433: 0 | P433: 0 | Q433: 6809185 | R433: 200560 | S433: 37605 | T433: 25070 | U433: 65459.5 | V433: 0 | W433: 6480490.5 | X433: 0 | Y433: 0 | Z433: 0 | AA433: 0 | AB433: 0 | AC433: 0 | AD433: 0 | AE433: 0 | AF433: 0 | AG433: 0 | AH433: 0 | AI433: 5865950 | AJ433: 0 | AK433: 0 | AL433: 0 | AM433: 0 | AN433: 0 | AO433: 0 | AP433: 0 | AQ433: 0 | AR433: =1 -> 1 | AS433: 0 | AT433: 0 | AU433: =RC[-30]-RC[-29]-RC[-28]-RC[-27]-RC[-26]-RC[-25] -> 6480490.5 | AV433: 0 | AW433: =RC[1]-RC[2] -> 0 | AX433: 0 | AY433: 0 | AZ433: =RC[-46] -> 5865950 | BA433: =RC[-46] -> 0 | BB433: =RC[-46] -> 0 | BC433: =RC[-46] -> 0 | BD433: =RC[-46] -> 0 | BE433: =RC[-46] -> 0 | BF433: =RC[-46] -> 680000 | BG433: =RC[-46] -> 263235 | BH433: =RC[-46] -> 0 | BI433: =RC[-46] -> 0 | BJ433: =RC[-46] -> 0 | BK433: =RC[-46] -> 6809185 | BL433: =RC[-46] -> 200560 | BM433: =RC[-46] -> 37605 | BN433: =RC[-46] -> 25070 | BO433: =RC[-46] -> 65459.5 | BP433: =RC[-46] -> 0 | BQ433: =RC[-46] -> 6480490.5 | BR433: =RC[-46] -> 0 | BS433: =RC[-46] -> 0 | BT433: =RC[-46] -> 0 | BU433: =RC[-46] -> 0 | BV433: =RC[-46] -> 0 | BW433: =RC[-46] -> 0 | BX433: =RC[-46] -> 0 | BY433: =RC[-46] -> 0 | BZ433: =RC[-46] -> 0 | CA433: =RC[-46] -> 0 | CB433: =RC[-46] -> 0 | CC433: =RC[-46] -> 5865950 | CD433: =RC[-46] -> 0 | CE433: =RC[-46] -> 0 | CF433: =RC[-46] -> 0 | CG433: =RC[-46] -> 0 | CH433: =RC[-46] -> 0 | CI433: =RC[-46] -> 0 | CJ433: =RC[-46] -> 0 | CK433: =RC[-46] -> 0 | CL433: =RC[-46] -> 1 | CM433: =RC[-46] -> 0 | CN433: =RC[-46] -> 0 | CO433: =RC[-46] -> 6480490.5 | CP433: =RC[-46] -> 0 | CQ433: =RC[-46] -> 0 | CR433: =RC[-46] -> 0 | CS433: =RC[-46] -> 0
A434: 7 | B434: 010805 | C434: Trịnh Thị Thu Hằng | D434: NV Hành chính - VT | E434: 10520173139014 | F434: =RC[29]+RC[30]+RC[31]+RC[32]+RC[33]+RC[34]+RC[35]+RC[36]+RC[37] -> 5253090 | G434: =RC[17]+RC[18]++RC[19]+RC[20]+RC[21]+RC[38]+RC[39]+RC[41] -> 0 | H434: 0 | I434: 0 | J434: =RC[-2]+RC[-1] -> 0 | K434: 0 | L434: 680000 | M434: 228218 | N434: =RC[15]+RC[16]+RC[17]+RC[18]+RC[19]+RC[20] -> 0 | O434: 0 | P434: 0 | Q434: 6161308 | R434: 173880 | S434: 32603 | T434: 21735 | U434: 59330.9 | V434: 0 | W434: 5873759.0999999996 | X434: 0 | Y434: 0 | Z434: 0 | AA434: 0 | AB434: 0 | AC434: 0 | AD434: 0 | AE434: 0 | AF434: 0 | AG434: 0 | AH434: 0 | AI434: 5253090 | AJ434: 0 | AK434: 0 | AL434: 0 | AM434: 0 | AN434: 0 | AO434: 0 | AP434: 0 | AQ434: 0 | AR434: =1 -> 1 | AS434: 0 | AT434: 0 | AU434: =RC[-30]-RC[-29]-RC[-28]-RC[-27]-RC[-26]-RC[-25] -> 5873759.0999999996 | AV434: 0 | AW434: =RC[1]-RC[2] -> 0 | AX434: 0 | AY434: 0 | AZ434: =RC[-46] -> 5253090 | BA434: =RC[-46] -> 0 | BB434: =RC[-46] -> 0 | BC434: =RC[-46] -> 0 | BD434: =RC[-46] -> 0 | BE434: =RC[-46] -> 0 | BF434: =RC[-46] -> 680000 | BG434: =RC[-46] -> 228218 | BH434: =RC[-46] -> 0 | BI434: =RC[-46] -> 0 | BJ434: =RC[-46] -> 0 | BK434: =RC[-46] -> 6161308 | BL434: =RC[-46] -> 173880 | BM434: =RC[-46] -> 32603 | BN434: =RC[-46] -> 21735 | BO434: =RC[-46] -> 59330.9 | BP434: =RC[-46] -> 0 | BQ434: =RC[-46] -> 5873759.0999999996 | BR434: =RC[-46] -> 0 | BS434: =RC[-46] -> 0 | BT434: =RC[-46] -> 0 | BU434: =RC[-46] -> 0 | BV434: =RC[-46] -> 0 | BW434: =RC[-46] -> 0 | BX434: =RC[-46] -> 0 | BY434: =RC[-46] -> 0 | BZ434: =RC[-46] -> 0 | CA434: =RC[-46] -> 0 | CB434: =RC[-46] -> 0 | CC434: =RC[-46] -> 5253090 | CD434: =RC[-46] -> 0 | CE434: =RC[-46] -> 0 | CF434: =RC[-46] -> 0 | CG434: =RC[-46] -> 0 | CH434: =RC[-46] -> 0 | CI434: =RC[-46] -> 0 | CJ434: =RC[-46] -> 0 | CK434: =RC[-46] -> 0 | CL434: =RC[-46] -> 1 | CM434: =RC[-46] -> 0 | CN434: =RC[-46] -> 0 | CO434: =RC[-46] -> 5873759.0999999996 | CP434: =RC[-46] -> 0 | CQ434: =RC[-46] -> 0 | CR434: =RC[-46] -> 0 | CS434: =RC[-46] -> 0
A435: 8 | B435: 010566 | C435: Nguyễn Thị Ngọc | D435: NV Kế hoạch - Quản lý chất lượng | E435: 10522162194016 | F435: =RC[29]+RC[30]+RC[31]+RC[32]+RC[33]+RC[34]+RC[35]+RC[36]+RC[37] -> 6420443 | G435: =RC[17]+RC[18]++RC[19]+RC[20]+RC[21]+RC[38]+RC[39]+RC[41] -> 0 | H435: 0 | I435: 0 | J435: =RC[-2]+RC[-1] -> 0 | K435: 0 | L435: 680000 | M435: 286178 | N435: =RC[15]+RC[16]+RC[17]+RC[18]+RC[19]+RC[20] -> 0 | O435: 0 | P435: 0 | Q435: 7386621 | R435: 218040 | S435: 40883 | T435: 27255 | U435: 71004.429999999993 | V435: 0 | W435: 7029438.5700000003 | X435: 0 | Y435: 0 | Z435: 0 | AA435: 0 | AB435: 0 | AC435: 0 | AD435: 0 | AE435: 0 | AF435: 0 | AG435: 0 | AH435: 0 | AI435: 6420443 | AJ435: 0 | AK435: 0 | AL435: 0 | AM435: 0 | AN435: 0 | AO435: 0 | AP435: 0 | AQ435: 0 | AR435: =1 -> 1 | AS435: 0 | AT435: 0 | AU435: =RC[-30]-RC[-29]-RC[-28]-RC[-27]-RC[-26]-RC[-25] -> 7029438.5700000003 | AV435: 0 | AW435: =RC[1]-RC[2] -> 0 | AX435: 0 | AY435: 0 | AZ435: =RC[-46] -> 6420443 | BA435: =RC[-46] -> 0 | BB435: =RC[-46] -> 0 | BC435: =RC[-46] -> 0 | BD435: =RC[-46] -> 0 | BE435: =RC[-46] -> 0 | BF435: =RC[-46] -> 680000 | BG435: =RC[-46] -> 286178 | BH435: =RC[-46] -> 0 | BI435: =RC[-46] -> 0 | BJ435: =RC[-46] -> 0 | BK435: =RC[-46] -> 7386621 | BL435: =RC[-46] -> 218040 | BM435: =RC[-46] -> 40883 | BN435: =RC[-46] -> 27255 | BO435: =RC[-46] -> 71004.429999999993 | BP435: =RC[-46] -> 0 | BQ435: =RC[-46] -> 7029438.5700000003 | BR435: =RC[-46] -> 0 | BS435: =RC[-46] -> 0 | BT435: =RC[-46] -> 0 | BU435: =RC[-46] -> 0 | BV435: =RC[-46] -> 0 | BW435: =RC[-46] -> 0 | BX435: =RC[-46] -> 0 | BY435: =RC[-46] -> 0 | BZ435: =RC[-46] -> 0 | CA435: =RC[-46] -> 0 | CB435: =RC[-46] -> 0 | CC435: =RC[-46] -> 6420443 | CD435: =RC[-46] -> 0 | CE435: =RC[-46] -> 0 | CF435: =RC[-46] -> 0 | CG435: =RC[-46] -> 0 | CH435: =RC[-46] -> 0 | CI435: =RC[-46] -> 0 | CJ435: =RC[-46] -> 0 | CK435: =RC[-46] -> 0 | CL435: =RC[-46] -> 1 | CM435: =RC[-46] -> 0 | CN435: =RC[-46] -> 0 | CO435: =RC[-46] -> 7029438.5700000003 | CP435: =RC[-46] -> 0 | CQ435: =RC[-46] -> 0 | CR435: =RC[-46] -> 0 | CS435: =RC[-46] -> 0
A436: 9 | B436: 010804 | C436: Vũ Thị Hoà | D436: NV Lao động tiền lương | E436: 10520875472013 | F436: =RC[29]+RC[30]+RC[31]+RC[32]+RC[33]+RC[34]+RC[35]+RC[36]+RC[37] -> 7587796 | G436: =RC[17]+RC[18]++RC[19]+RC[20]+RC[21]+RC[38]+RC[39]+RC[41] -> 0 | H436: 0 | I436: 0 | J436: =RC[-2]+RC[-1] -> 0 | K436: 0 | L436: 680000 | M436: 263235 | N436: =RC[15]+RC[16]+RC[17]+RC[18]+RC[19]+RC[20] -> 0 | O436: 0 | P436: 0 | Q436: 8531031 | R436: 200560 | S436: 37605 | T436: 25070 | U436: 82677.960000000006 | V436: 0 | W436: 8185118.04 | X436: 0 | Y436: 0 | Z436: 0 | AA436: 0 | AB436: 0 | AC436: 0 | AD436: 0 | AE436: 0 | AF436: 0 | AG436: 0 | AH436: 0 | AI436: 7587796 | AJ436: 0 | AK436: 0 | AL436: 0 | AM436: 0 | AN436: 0 | AO436: 0 | AP436: 0 | AQ436: 0 | AR436: =1 -> 1 | AS436: 0 | AT436: 0 | AU436: =RC[-30]-RC[-29]-RC[-28]-RC[-27]-RC[-26]-RC[-25] -> 8185118.04 | AV436: 0 | AW436: =RC[1]-RC[2] -> 0 | AX436: 0 | AY436: 0 | AZ436: =RC[-46] -> 7587796 | BA436: =RC[-46] -> 0 | BB436: =RC[-46] -> 0 | BC436: =RC[-46] -> 0 | BD436: =RC[-46] -> 0 | BE436: =RC[-46] -> 0 | BF436: =RC[-46] -> 680000 | BG436: =RC[-46] -> 263235 | BH436: =RC[-46] -> 0 | BI436: =RC[-46] -> 0 | BJ436: =RC[-46] -> 0 | BK436: =RC[-46] -> 8531031 | BL436: =RC[-46] -> 200560 | BM436: =RC[-46] -> 37605 | BN436: =RC[-46] -> 25070 | BO436: =RC[-46] -> 82677.960000000006 | BP436: =RC[-46] -> 0 | BQ436: =RC[-46] -> 8185118.04 | BR436: =RC[-46] -> 0 | BS436: =RC[-46] -> 0 | BT436: =RC[-46] -> 0 | BU436: =RC[-46] -> 0 | BV436: =RC[-46] -> 0 | BW436: =RC[-46] -> 0 | BX436: =RC[-46] -> 0 | BY436: =RC[-46] -> 0 | BZ436: =RC[-46] -> 0 | CA436: =RC[-46] -> 0 | CB436: =RC[-46] -> 0 | CC436: =RC[-46] -> 7587796 | CD436: =RC[-46] -> 0 | CE436: =RC[-46] -> 0 | CF436: =RC[-46] -> 0 | CG436: =RC[-46] -> 0 | CH436: =RC[-46] -> 0 | CI436: =RC[-46] -> 0 | CJ436: =RC[-46] -> 0 | CK436: =RC[-46] -> 0 | CL436: =RC[-46] -> 1 | CM436: =RC[-46] -> 0 | CN436: =RC[-46] -> 0 | CO436: =RC[-46] -> 8185118.04 | CP436: =RC[-46] -> 0 | CQ436: =RC[-46] -> 0 | CR436: =RC[-46] -> 0 | CS436: =RC[-46] -> 0
A437: 10 | B437: 011117 | C437: Nguyễn Hương Giang | D437: NV PVHK | E437: 19026970099018 | F437: =RC[29]+RC[30]+RC[31]+RC[32]+RC[33]+RC[34]+RC[35]+RC[36]+RC[37] -> 4669413 | G437: =RC[17]+RC[18]++RC[19]+RC[20]+RC[21]+RC[38]+RC[39]+RC[41] -> 0 | H437: 0 | I437: 0 | J437: =RC[-2]+RC[-1] -> 0 | K437: 0 | L437: 680000 | M437: 241500 | N437: =RC[15]+RC[16]+RC[17]+RC[18]+RC[19]+RC[20] -> 0 | O437: 0 | P437: 0 | Q437: 5590913 | R437: 184000 | S437: 34500 | T437: 23000 | U437: 53494.13 | V437: 0 | W437: 5295918.87 | X437: 0 | Y437: 0 | Z437: 0 | AA437: 0 | AB437: 0 | AC437: 0 | AD437: 0 | AE437: 0 | AF437: 0 | AG437: 0 | AH437: 0 | AI437: 4669413 | AJ437: 0 | AK437: 0 | AL437: 0 | AM437: 0 | AN437: 0 | AO437: 0 | AP437: 0 | AQ437: 0 | AR437: =1 -> 1 | AS437: 0 | AT437: 0 | AU437: =RC[-30]-RC[-29]-RC[-28]-RC[-27]-RC[-26]-RC[-25] -> 5295918.87 | AV437: 0 | AW437: =RC[1]-RC[2] -> 0 | AX437: 0 | AY437: 0 | AZ437: =RC[-46] -> 4669413 | BA437: =RC[-46] -> 0 | BB437: =RC[-46] -> 0 | BC437: =RC[-46] -> 0 | BD437: =RC[-46] -> 0 | BE437: =RC[-46] -> 0 | BF437: =RC[-46] -> 680000 | BG437: =RC[-46] -> 241500 | BH437: =RC[-46] -> 0 | BI437: =RC[-46] -> 0 | BJ437: =RC[-46] -> 0 | BK437: =RC[-46] -> 5590913 | BL437: =RC[-46] -> 184000 | BM437: =RC[-46] -> 34500 | BN437: =RC[-46] -> 23000 | BO437: =RC[-46] -> 53494.13 | BP437: =RC[-46] -> 0 | BQ437: =RC[-46] -> 5295918.87 | BR437: =RC[-46] -> 0 | BS437: =RC[-46] -> 0 | BT437: =RC[-46] -> 0 | BU437: =RC[-46] -> 0 | BV437: =RC[-46] -> 0 | BW437: =RC[-46] -> 0 | BX437: =RC[-46] -> 0 | BY437: =RC[-46] -> 0 | BZ437: =RC[-46] -> 0 | CA437: =RC[-46] -> 0 | CB437: =RC[-46] -> 0 | CC437: =RC[-46] -> 4669413 | CD437: =RC[-46] -> 0 | CE437: =RC[-46] -> 0 | CF437: =RC[-46] -> 0 | CG437: =RC[-46] -> 0 | CH437: =RC[-46] -> 0 | CI437: =RC[-46] -> 0 | CJ437: =RC[-46] -> 0 | CK437: =RC[-46] -> 0 | CL437: =RC[-46] -> 1 | CM437: =RC[-46] -> 0 | CN437: =RC[-46] -> 0 | CO437: =RC[-46] -> 5295918.87 | CP437: =RC[-46] -> 0 | CQ437: =RC[-46] -> 0 | CR437: =RC[-46] -> 0 | CS437: =RC[-46] -> 0
A438: 11 | B438: 010735 | C438: Nguyễn Thị Phương Lan | D438: NV Thống kê - Tổng hợp | E438: 10520052581011 | F438: =RC[29]+RC[30]+RC[31]+RC[32]+RC[33]+RC[34]+RC[35]+RC[36]+RC[37] -> 6420443 | G438: =RC[17]+RC[18]++RC[19]+RC[20]+RC[21]+RC[38]+RC[39]+RC[41] -> 0 | H438: 0 | I438: 0 | J438: =RC[-2]+RC[-1] -> 0 | K438: 0 | L438: 680000 | M438: 286178 | N438: =RC[15]+RC[16]+RC[17]+RC[18]+RC[19]+RC[20] -> 0 | O438: 0 | P438: 0 | Q438: 7386621 | R438: 218040 | S438: 40883 | T438: 27255 | U438: 71004.429999999993 | V438: 0 | W438: 7029438.5700000003 | X438: 0 | Y438: 0 | Z438: 0 | AA438: 0 | AB438: 0 | AC438: 0 | AD438: 0 | AE438: 0 | AF438: 0 | AG438: 0 | AH438: 0 | AI438: 6420443 | AJ438: 0 | AK438: 0 | AL438: 0 | AM438: 0 | AN438: 0 | AO438: 0 | AP438: 0 | AQ438: 0 | AR438: =1 -> 1 | AS438: 0 | AT438: 0 | AU438: =RC[-30]-RC[-29]-RC[-28]-RC[-27]-RC[-26]-RC[-25] -> 7029438.5700000003 | AV438: 0 | AW438: =RC[1]-RC[2] -> 0 | AX438: 0 | AY438: 0 | AZ438: =RC[-46] -> 6420443 | BA438: =RC[-46] -> 0 | BB438: =RC[-46] -> 0 | BC438: =RC[-46] -> 0 | BD438: =RC[-46] -> 0 | BE438: =RC[-46] -> 0 | BF438: =RC[-46] -> 680000 | BG438: =RC[-46] -> 286178 | BH438: =RC[-46] -> 0 | BI438: =RC[-46] -> 0 | BJ438: =RC[-46] -> 0 | BK438: =RC[-46] -> 7386621 | BL438: =RC[-46] -> 218040 | BM438: =RC[-46] -> 40883 | BN438: =RC[-46] -> 27255 | BO438: =RC[-46] -> 71004.429999999993 | BP438: =RC[-46] -> 0 | BQ438: =RC[-46] -> 7029438.5700000003 | BR438: =RC[-46] -> 0 | BS438: =RC[-46] -> 0 | BT438: =RC[-46] -> 0 | BU438: =RC[-46] -> 0 | BV438: =RC[-46] -> 0 | BW438: =RC[-46] -> 0 | BX438: =RC[-46] -> 0 | BY438: =RC[-46] -> 0 | BZ438: =RC[-46] -> 0 | CA438: =RC[-46] -> 0 | CB438: =RC[-46] -> 0 | CC438: =RC[-46] -> 6420443 | CD438: =RC[-46] -> 0 | CE438: =RC[-46] -> 0 | CF438: =RC[-46] -> 0 | CG438: =RC[-46] -> 0 | CH438: =RC[-46] -> 0 | CI438: =RC[-46] -> 0 | CJ438: =RC[-46] -> 0 | CK438: =RC[-46] -> 0 | CL438: =RC[-46] -> 1 | CM438: =RC[-46] -> 0 | CN438: =RC[-46] -> 0 | CO438: =RC[-46] -> 7029438.5700000003 | CP438: =RC[-46] -> 0 | CQ438: =RC[-46] -> 0 | CR438: =RC[-46] -> 0 | CS438: =RC[-46] -> 0
A439: 12 | B439: 010562 | C439: Phạm Thị Thịnh | D439: NV Thủ kho | E439: 10522161892011 | F439: =RC[29]+RC[30]+RC[31]+RC[32]+RC[33]+RC[34]+RC[35]+RC[36]+RC[37] -> 5865950 | G439: =RC[17]+RC[18]++RC[19]+RC[20]+RC[21]+RC[38]+RC[39]+RC[41] -> 0 | H439: 0 | I439: 0 | J439: =RC[-2]+RC[-1] -> 0 | K439: 0 | L439: 680000 | M439: 274103 | N439: =RC[15]+RC[16]+RC[17]+RC[18]+RC[19]+RC[20] -> 0 | O439: 0 | P439: 0 | Q439: 6820053 | R439: 208840 | S439: 39158 | T439: 26105 | U439: 65459.5 | V439: 0 | W439: 6480490.5 | X439: 0 | Y439: 0 | Z439: 0 | AA439: 0 | AB439: 0 | AC439: 0 | AD439: 0 | AE439: 0 | AF439: 0 | AG439: 0 | AH439: 0 | AI439: 5865950 | AJ439: 0 | AK439: 0 | AL439: 0 | AM439: 0 | AN439: 0 | AO439: 0 | AP439: 0 | AQ439: 0 | AR439: =1 -> 1 | AS439: 0 | AT439: 0 | AU439: =RC[-30]-RC[-29]-RC[-28]-RC[-27]-RC[-26]-RC[-25] -> 6480490.5 | AV439: 0 | AW439: =RC[1]-RC[2] -> 0 | AX439: 0 | AY439: 0 | AZ439: =RC[-46] -> 5865950 | BA439: =RC[-46] -> 0 | BB439: =RC[-46] -> 0 | BC439: =RC[-46] -> 0 | BD439: =RC[-46] -> 0 | BE439: =RC[-46] -> 0 | BF439: =RC[-46] -> 680000 | BG439: =RC[-46] -> 274103 | BH439: =RC[-46] -> 0 | BI439: =RC[-46] -> 0 | BJ439: =RC[-46] -> 0 | BK439: =RC[-46] -> 6820053 | BL439: =RC[-46] -> 208840 | BM439: =RC[-46] -> 39158 | BN439: =RC[-46] -> 26105 | BO439: =RC[-46] -> 65459.5 | BP439: =RC[-46] -> 0 | BQ439: =RC[-46] -> 6480490.5 | BR439: =RC[-46] -> 0 | BS439: =RC[-46] -> 0 | BT439: =RC[-46] -> 0 | BU439: =RC[-46] -> 0 | BV439: =RC[-46] -> 0 | BW439: =RC[-46] -> 0 | BX439: =RC[-46] -> 0 | BY439: =RC[-46] -> 0 | BZ439: =RC[-46] -> 0 | CA439: =RC[-46] -> 0 | CB439: =RC[-46] -> 0 | CC439: =RC[-46] -> 5865950 | CD439: =RC[-46] -> 0 | CE439: =RC[-46] -> 0 | CF439: =RC[-46] -> 0 | CG439: =RC[-46] -> 0 | CH439: =RC[-46] -> 0 | CI439: =RC[-46] -> 0 | CJ439: =RC[-46] -> 0 | CK439: =RC[-46] -> 0 | CL439: =RC[-46] -> 1 | CM439: =RC[-46] -> 0 | CN439: =RC[-46] -> 0 | CO439: =RC[-46] -> 6480490.5 | CP439: =RC[-46] -> 0 | CQ439: =RC[-46] -> 0 | CR439: =RC[-46] -> 0 | CS439: =RC[-46] -> 0
A440: 13 | B440: 010637 | C440: Trần Đình Cát | D440: NV trông giữ hành lý | E440: 10520052613010 | F440: =RC[29]+RC[30]+RC[31]+RC[32]+RC[33]+RC[34]+RC[35]+RC[36]+RC[37] -> 5019619 | G440: =RC[17]+RC[18]++RC[19]+RC[20]+RC[21]+RC[38]+RC[39]+RC[41] -> 0 | H440: 0 | I440: 0 | J440: =RC[-2]+RC[-1] -> 0 | K440: 0 | L440: 680000 | M440: 434700 | N440: =RC[15]+RC[16]+RC[17]+RC[18]+RC[19]+RC[20] -> 0 | O440: 0 | P440: 0 | Q440: 6134319 | R440: 331200 | S440: 62100 | T440: 41400 | U440: 56996.19 | V440: 0 | W440: 5642622.8099999996 | X440: 0 | Y440: 0 | Z440: 0 | AA440: 0 | AB440: 0 | AC440: 0 | AD440: 0 | AE440: 0 | AF440: 0 | AG440: 0 | AH440: 0 | AI440: 5019619 | AJ440: 0 | AK440: 0 | AL440: 0 | AM440: 0 | AN440: 0 | AO440: 0 | AP440: 0 | AQ440: 0 | AR440: =1 -> 1 | AS440: 0 | AT440: 0 | AU440: =RC[-30]-RC[-29]-RC[-28]-RC[-27]-RC[-26]-RC[-25] -> 5642622.8099999996 | AV440: 0 | AW440: =RC[1]-RC[2] -> 0 | AX440: 0 | AY440: 0 | AZ440: =RC[-46] -> 5019619 | BA440: =RC[-46] -> 0 | BB440: =RC[-46] -> 0 | BC440: =RC[-46] -> 0 | BD440: =RC[-46] -> 0 | BE440: =RC[-46] -> 0 | BF440: =RC[-46] -> 680000 | BG440: =RC[-46] -> 434700 | BH440: =RC[-46] -> 0 | BI440: =RC[-46] -> 0 | BJ440: =RC[-46] -> 0 | BK440: =RC[-46] -> 6134319 | BL440: =RC[-46] -> 331200 | BM440: =RC[-46] -> 62100 | BN440: =RC[-46] -> 41400 | BO440: =RC[-46] -> 56996.19 | BP440: =RC[-46] -> 0 | BQ440: =RC[-46] -> 5642622.8099999996 | BR440: =RC[-46] -> 0 | BS440: =RC[-46] -> 0 | BT440: =RC[-46] -> 0 | BU440: =RC[-46] -> 0 | BV440: =RC[-46] -> 0 | BW440: =RC[-46] -> 0 | BX440: =RC[-46] -> 0 | BY440: =RC[-46] -> 0 | BZ440: =RC[-46] -> 0 | CA440: =RC[-46] -> 0 | CB440: =RC[-46] -> 0 | CC440: =RC[-46] -> 5019619 | CD440: =RC[-46] -> 0 | CE440: =RC[-46] -> 0 | CF440: =RC[-46] -> 0 | CG440: =RC[-46] -> 0 | CH440: =RC[-46] -> 0 | CI440: =RC[-46] -> 0 | CJ440: =RC[-46] -> 0 | CK440: =RC[-46] -> 0 | CL440: =RC[-46] -> 1 | CM440: =RC[-46] -> 0 | CN440: =RC[-46] -> 0 | CO440: =RC[-46] -> 5642622.8099999996 | CP440: =RC[-46] -> 0 | CQ440: =RC[-46] -> 0 | CR440: =RC[-46] -> 0 | CS440: =RC[-46] -> 0
A441: 14 | B441: 010799 | C441: Phương Lan | D441: Chuyên viên lao động tiền lương | E441: 10522162728010 | F441: =RC[29]+RC[30]+RC[31]+RC[32]+RC[33]+RC[34]+RC[35]+RC[36]+RC[37] -> 8521679 | G441: =RC[17]+RC[18]++RC[19]+RC[20]+RC[21]+RC[38]+RC[39]+RC[41] -> 0 | H441: 0 | I441: 0 | J441: =RC[-2]+RC[-1] -> 0 | K441: 0 | L441: 680000 | M441: 319988 | N441: =RC[15]+RC[16]+RC[17]+RC[18]+RC[19]+RC[20] -> 0 | O441: 0 | P441: 0 | Q441: 9521667 | R441: 243800 | S441: 45713 | T441: 30475 | U441: 92016.79 | V441: 0 | W441: 9109662.2100000009 | X441: 0 | Y441: 0 | Z441: 0 | AA441: 0 | AB441: 0 | AC441: 0 | AD441: 0 | AE441: 0 | AF441: 0 | AG441: 0 | AH441: 0 | AI441: 8521679 | AJ441: 0 | AK441: 0 | AL441: 0 | AM441: 0 | AN441: 0 | AO441: 0 | AP441: 0 | AQ441: 0 | AR441: =1 -> 1 | AS441: 0 | AT441: 0 | AU441: =RC[-30]-RC[-29]-RC[-28]-RC[-27]-RC[-26]-RC[-25] -> 9109662.2100000009 | AV441: 0 | AW441: =RC[1]-RC[2] -> 0 | AX441: 0 | AY441: 0 | AZ441: =RC[-46] -> 8521679 | BA441: =RC[-46] -> 0 | BB441: =RC[-46] -> 0 | BC441: =RC[-46] -> 0 | BD441: =RC[-46] -> 0 | BE441: =RC[-46] -> 0 | BF441: =RC[-46] -> 680000 | BG441: =RC[-46] -> 319988 | BH441: =RC[-46] -> 0 | BI441: =RC[-46] -> 0 | BJ441: =RC[-46] -> 0 | BK441: =RC[-46] -> 9521667 | BL441: =RC[-46] -> 243800 | BM441: =RC[-46] -> 45713 | BN441: =RC[-46] -> 30475 | BO441: =RC[-46] -> 92016.79 | BP441: =RC[-46] -> 0 | BQ441: =RC[-46] -> 9109662.2100000009 | BR441: =RC[-46] -> 0 | BS441: =RC[-46] -> 0 | BT441: =RC[-46] -> 0 | BU441: =RC[-46] -> 0 | BV441: =RC[-46] -> 0 | BW441: =RC[-46] -> 0 | BX441: =RC[-46] -> 0 | BY441: =RC[-46] -> 0 | BZ441: =RC[-46] -> 0 | CA441: =RC[-46] -> 0 | CB441: =RC[-46] -> 0 | CC441: =RC[-46] -> 8521679 | CD441: =RC[-46] -> 0 | CE441: =RC[-46] -> 0 | CF441: =RC[-46] -> 0 | CG441: =RC[-46] -> 0 | CH441: =RC[-46] -> 0 | CI441: =RC[-46] -> 0 | CJ441: =RC[-46] -> 0 | CK441: =RC[-46] -> 0 | CL441: =RC[-46] -> 1 | CM441: =RC[-46] -> 0 | CN441: =RC[-46] -> 0 | CO441: =RC[-46] -> 9109662.2100000009 | CP441: =RC[-46] -> 0 | CQ441: =RC[-46] -> 0 | CR441: =RC[-46] -> 0 | CS441: =RC[-46] -> 0
F442: =SUM(R[-14]C:R[-1]C) -> 91517577 | G442: =SUM(R[-14]C:R[-1]C) -> 0 | H442: =SUM(R[-14]C:R[-1]C) -> 0 | I442: =SUM(R[-14]C:R[-1]C) -> 315000 | J442: =SUM(R[-14]C:R[-1]C) -> 315000 | K442: =SUM(R[-14]C:R[-1]C) -> 0 | L442: =SUM(R[-14]C:R[-1]C) -> 8840000 | M442: =SUM(R[-14]C:R[-1]C) -> 4257648 | N442: =SUM(R[-14]C:R[-1]C) -> 0 | O442: =SUM(R[-14]C:R[-1]C) -> 0 | P442: =SUM(R[-14]C:R[-1]C) -> 0 | Q442: =SUM(R[-14]C:R[-1]C) -> 104930225 | R442: =SUM(R[-14]C:R[-1]C) -> 3243920 | S442: =SUM(R[-14]C:R[-1]C) -> 608238 | T442: =SUM(R[-14]C:R[-1]C) -> 405490 | U442: =SUM(R[-14]C:R[-1]C) -> 1006725.77 | V442: =SUM(R[-14]C:R[-1]C) -> 0 | W442: =SUM(R[-14]C:R[-1]C) -> 99665851.230000019 | X442: =SUM(R[-14]C:R[-1]C) -> 0 | Y442: =SUM(R[-14]C:R[-1]C) -> 0 | Z442: =SUM(R[-14]C:R[-1]C) -> 0 | AA442: =SUM(R[-14]C:R[-1]C) -> 0 | AB442: =SUM(R[-14]C:R[-1]C) -> 0 | AC442: =SUM(R[-14]C:R[-1]C) -> 0 | AD442: =SUM(R[-14]C:R[-1]C) -> 0 | AE442: =SUM(R[-14]C:R[-1]C) -> 0 | AF442: =SUM(R[-14]C:R[-1]C) -> 0 | AG442: =SUM(R[-14]C:R[-1]C) -> 0 | AH442: =SUM(R[-14]C:R[-1]C) -> 0 | AI442: =SUM(R[-14]C:R[-1]C) -> 83944373 | AJ442: =SUM(R[-14]C:R[-1]C) -> 7573204 | AK442: =SUM(R[-14]C:R[-1]C) -> 0 | AL442: =SUM(R[-14]C:R[-1]C) -> 0 | AM442: =SUM(R[-14]C:R[-1]C) -> 0 | AN442: =SUM(R[-14]C:R[-1]C) -> 0 | AO442: =SUM(R[-14]C:R[-1]C) -> 0 | AP442: =SUM(R[-14]C:R[-1]C) -> 0 | AQ442: =SUM(R[-14]C:R[-1]C) -> 0 | AR442: =SUM(R[-14]C:R[-1]C) -> 14 | AS442: =SUM(R[-14]C:R[-1]C) -> 0 | AT442: =SUM(R[-14]C:R[-1]C) -> 0 | AU442: =SUM(R[-14]C:R[-1]C) -> 99665851.230000019 | AV442: =SUM(R[-14]C:R[-1]C) -> 0 | AW442: =SUM(R[-14]C:R[-1]C) -> 0 | AX442: =SUM(R[-14]C:R[-1]C) -> 0 | AY442: =SUM(R[-14]C:R[-1]C) -> 0
A443: Phòng Tổ chức - Hành chính (HGS) | F443: =SUM(R[-16]C[46]:R[-1]C[46]) -> 91517577 | G443: =SUM(R[-16]C[46]:R[-1]C[46]) -> 0 | H443: =SUM(R[-16]C[46]:R[-1]C[46]) -> 0 | I443: =SUM(R[-16]C[46]:R[-1]C[46]) -> 315000 | J443: =SUM(R[-16]C[46]:R[-1]C[46]) -> 315000 | K443: =SUM(R[-16]C[46]:R[-1]C[46]) -> 0 | L443: =SUM(R[-16]C[46]:R[-1]C[46]) -> 8840000 | M443: =SUM(R[-16]C[46]:R[-1]C[46]) -> 4257648 | N443: =SUM(R[-16]C[46]:R[-1]C[46]) -> 0 | O443: =SUM(R[-16]C[46]:R[-1]C[46]) -> 0 | P443: =SUM(R[-16]C[46]:R[-1]C[46]) -> 0 | Q443: =SUM(R[-16]C[46]:R[-1]C[46]) -> 104930225 | R443: =SUM(R[-16]C[46]:R[-1]C[46]) -> 3243920 | S443: =SUM(R[-16]C[46]:R[-1]C[46]) -> 608238 | T443: =SUM(R[-16]C[46]:R[-1]C[46]) -> 405490 | U443: =SUM(R[-16]C[46]:R[-1]C[46]) -> 1006725.77 | V443: =SUM(R[-16]C[46]:R[-1]C[46]) -> 0 | W443: =SUM(R[-16]C[46]:R[-1]C[46]) -> 99665851.230000019 | X443: =SUM(R[-16]C[46]:R[-1]C[46]) -> 0 | Y443: =SUM(R[-16]C[46]:R[-1]C[46]) -> 0 | Z443: =SUM(R[-16]C[46]:R[-1]C[46]) -> 0 | AA443: =SUM(R[-16]C[46]:R[-1]C[46]) -> 0 | AB443: =SUM(R[-16]C[46]:R[-1]C[46]) -> 0 | AC443: =SUM(R[-16]C[46]:R[-1]C[46]) -> 0 | AD443: =SUM(R[-16]C[46]:R[-1]C[46]) -> 0 | AE443: =SUM(R[-16]C[46]:R[-1]C[46]) -> 0 | AF443: =SUM(R[-16]C[46]:R[-1]C[46]) -> 0 | AG443: =SUM(R[-16]C[46]:R[-1]C[46]) -> 0 | AH443: =SUM(R[-16]C[46]:R[-1]C[46]) -> 0 | AI443: =SUM(R[-16]C[46]:R[-1]C[46]) -> 83944373 | AJ443: =SUM(R[-16]C[46]:R[-1]C[46]) -> 7573204 | AK443: =SUM(R[-16]C[46]:R[-1]C[46]) -> 0 | AL443: =SUM(R[-16]C[46]:R[-1]C[46]) -> 0 | AM443: =SUM(R[-16]C[46]:R[-1]C[46]) -> 0 | AN443: =SUM(R[-16]C[46]:R[-1]C[46]) -> 0 | AO443: =SUM(R[-16]C[46]:R[-1]C[46]) -> 0 | AP443: =SUM(R[-16]C[46]:R[-1]C[46]) -> 0 | AQ443: =SUM(R[-16]C[46]:R[-1]C[46]) -> 0 | AR443: =SUM(R[-16]C[46]:R[-1]C[46]) -> 14 | AS443: =SUM(R[-16]C[46]:R[-1]C[46]) -> 0 | AT443: =SUM(R[-16]C[46]:R[-1]C[46]) -> 0 | AU443: =SUM(R[-16]C[46]:R[-1]C[46]) -> 99665851.230000019 | AV443: =SUM(R[-16]C[46]:R[-1]C[46]) -> 0 | AW443: =SUM(R[-16]C[46]:R[-1]C[46]) -> 0 | AX443: =SUM(R[-16]C[46]:R[-1]C[46]) -> 0 | AY443: =SUM(R[-16]C[46]:R[-1]C[46]) -> 0
A444: Công ty Phục vụ mặt đất Hà Nội (HGS) | B444: =RC[42] -> 384 | C444: TỔNG CỘNG: | F444: =SUM(R[-434]C[46]:R[-1]C[46]) -> 2111479374 | G444: =SUM(R[-434]C[46]:R[-1]C[46]) -> 9044538 | H444: =SUM(R[-434]C[46]:R[-1]C[46]) -> 3255000 | I444: =SUM(R[-434]C[46]:R[-1]C[46]) -> 3885000 | J444: =SUM(R[-434]C[46]:R[-1]C[46]) -> 7140000 | K444: =SUM(R[-434]C[46]:R[-1]C[46]) -> 5355000 | L444: =SUM(R[-434]C[46]:R[-1]C[46]) -> 244462376 | M444: =SUM(R[-434]C[46]:R[-1]C[46]) -> 94410884 | N444: =SUM(R[-434]C[46]:R[-1]C[46]) -> 54267264 | O444: =SUM(R[-434]C[46]:R[-1]C[46]) -> 0 | P444: =SUM(R[-434]C[46]:R[-1]C[46]) -> 0 | Q444: =SUM(R[-434]C[46]:R[-1]C[46]) -> 2526159436 | R444: =SUM(R[-434]C[46]:R[-1]C[46]) -> 72116040 | S444: =SUM(R[-434]C[46]:R[-1]C[46]) -> 13521839 | T444: =SUM(R[-434]C[46]:R[-1]C[46]) -> 9014505 | U444: =SUM(R[-434]C[46]:R[-1]C[46]) -> 23248147.759999968 | V444: =SUM(R[-434]C[46]:R[-1]C[46]) -> 1810629 | W444: =SUM(R[-434]C[46]:R[-1]C[46]) -> 2406448275.2399979 | X444: =SUM(R[-434]C[46]:R[-1]C[46]) -> 0 | Y444: =SUM(R[-434]C[46]:R[-1]C[46]) -> 9044538 | Z444: =SUM(R[-434]C[46]:R[-1]C[46]) -> 0 | AA444: =SUM(R[-434]C[46]:R[-1]C[46]) -> 0 | AB444: =SUM(R[-434]C[46]:R[-1]C[46]) -> 0 | AC444: =SUM(R[-434]C[46]:R[-1]C[46]) -> 0 | AD444: =SUM(R[-434]C[46]:R[-1]C[46]) -> 0 | AE444: =SUM(R[-434]C[46]:R[-1]C[46]) -> 0 | AF444: =SUM(R[-434]C[46]:R[-1]C[46]) -> 0 | AG444: =SUM(R[-434]C[46]:R[-1]C[46]) -> 0 | AH444: =SUM(R[-434]C[46]:R[-1]C[46]) -> 54267264 | AI444: =SUM(R[-434]C[46]:R[-1]C[46]) -> 2069801946 | AJ444: =SUM(R[-434]C[46]:R[-1]C[46]) -> 41677428 | AK444: =SUM(R[-434]C[46]:R[-1]C[46]) -> 0 | AL444: =SUM(R[-434]C[46]:R[-1]C[46]) -> 0 | AM444: =SUM(R[-434]C[46]:R[-1]C[46]) -> 0 | AN444: =SUM(R[-434]C[46]:R[-1]C[46]) -> 0 | AO444: =SUM(R[-434]C[46]:R[-1]C[46]) -> 0 | AP444: =SUM(R[-434]C[46]:R[-1]C[46]) -> 0 | AQ444: =SUM(R[-434]C[46]:R[-1]C[46]) -> 0 | AR444: =SUM(R[-434]C[46]:R[-1]C[46]) -> 384 | AS444: =SUM(R[-434]C[46]:R[-1]C[46]) -> 0 | AT444: =SUM(R[-434]C[46]:R[-1]C[46]) -> 0 | AU444: =SUM(R[-434]C[46]:R[-1]C[46]) -> 2406448275.2399979 | AV444: =SUM(R[-434]C[46]:R[-1]C[46]) -> 0 | AW444: =SUM(R[-434]C[46]:R[-1]C[46]) -> 18089087.984000001 | AX444: =SUM(R[-434]C[46]:R[-1]C[46]) -> 54267264 | AY444: =SUM(R[-434]C[46]:R[-1]C[46]) -> 36178176.015999995
C446: NGƯỜI LẬP BẢNG | H446: THỦ TRƯỞNG ĐƠN VỊ | J446: THỦ TRƯỞNG ĐƠN VỊ | O446: BAN TCCB-LĐTL | R446: =+R[-2]C/8*26 -> 234377130 | S446: =+R[-2]C/1.5*4.5 -> 40565517 | T446: =+R[-2]C*2 -> 18029010 | U446: BAN TCKT | W446: =+R[-2]C+'[Bang tien khoan T3.xls]ExcelTemplate'!R26C23 -> 2415714675.2399979
R447: =(82.35+6.05)*1150000*0.26 -> 26431599.999999996 | S447: =(6.05+82.35)*1150000*4.5/100 -> 4574699.9999999991 | T447: =(82.35+6.05)*2*1150000/100 -> 2033199.9999999998 | V447: =+R[-1]C[-4]+RC[-4]+R[-1]C[-3]+RC[-3]+R[-1]C[-2]+RC[-2] -> 326011157
C448: =+R[-2]C[15]*100/26 -> 901450500 | F448: =0.6*4+0.7 -> 3.0999999999999996 | Q448: Thơm TLK | R448: 2.0499999999999998
F449: =2.18*1150000*10.5/100 -> 263235 | Q449: Hạnh HK | R449: 2
Q450: Dung HK | R450: 2
R451: 234284440 | S451: 40549312 | T451: 18021880
R452: =+R[-1]C-R[-6]C -> -92690 | S452: =+R[-1]C-R[-6]C -> -16205 | T452: =+R[-1]C-R[-6]C -> -7130