Sheet: ExcelTemplate
A1: BỘ GIAO THÔNG VẬN TẢI | L1: 2015/05 | V1: Ngày in báo cáo: | W1: Ngày in báo cáo : ___/___/_____ | AU1: Ngày in báo cáo : ___/___/_____
A2: TỔNG CÔNG TY CẢNG HÀNG KHÔNG VIỆT NAM | W2: Trang in báo cáo : ___/___ | AU2: Trang in báo cáo : ___/___
A3: ="BẢNG TIỀN LƯƠNG THÁNG "&RIGHT(R[-2]C[11],2)&" NĂM "&LEFT(R[-2]C[11],4) -> BẢNG TIỀN LƯƠNG THÁNG 05 NĂM 2015
A4: ĐƠN VỊ: | C4: =R[5]C[-2] -> Công ty Phục vụ mặt đất Hà Nội (HGS)
A6: STT | B6: Mã NV | C6: Họ và tên | E6: Số TK | F6: Lương chức danh | G6: Lương cơ bản | H6: Các khoản phụ cấp | L6: Ăn giữa ca | M6: Bổ sung lương | N6: Tiền thêm giờ | O6: Tiền làm đêm | P6: Các khoản trừ vào lương | Q6: Tổng | R6: Các khoản phải nộp | W6: Thực lĩnh | AU6: Thực lĩnh | AW6: Tăng ca không chịu thuế | AX6: Tổng tiền tăng ca | AY6: Tăng ca chịu thuế
D7: Chức vụ | H7: PCCV | I7: PCCV o BH | J7: PCCV | K7: PCTN | R7: BHXH | S7: BHYT | T7: BHTN | U7: ĐPCĐ | V7: TTN tạm tính | X7: Đi đường | Y7: Nghỉ phép trong chế độ | Z7: H6 | AA7: Nghỉ TNLD | AB7: Nghỉ việc riêng hưởng nguyên lương (ma chay, cưới hỏi …) | AC7: Làm thêm CN b.đêm | AD7: Làm thêm CN b.ngày | AE7: Làm thêm LT b.đêm | AF7: Làm thêm LT b.ngày | AG7: Làm thêm NT b.đêm | AH7: Làm thêm NT b.ngày | AI7: X | AJ7: TS | AK7: ST | AL7: CT | AM7: H1 | AN7: H2 | AO7: H3 | AP7: H4 | AQ7: H5 | AV7: DC
A8: 1 | B8: 2 | C8: 3 | E8: 4 | F8: 22 | G8: 23 | H8: 24 | K8: 25 | L8: 26 | M8: 27 | N8: 28 | O8: 29 | Q8: 30 | R8: 31 | S8: 32 | T8: 33 | U8: 34 | V8: 35 | W8: 36 | AC8: 79 | AD8: 80 | AE8: 81 | AF8: 82 | AG8: 83 | AH8: 84 | AU8: 36
A9: Công ty Phục vụ mặt đất Hà Nội (HGS)
A10: Phòng Điều hành, tài liệu và hướng dẫn chất xếp (HGS) | B10: CÔng ty Phục vụ mặt đất Hà Nội (HGS) | F10: =R[22]C -> 6840000 | G10: =R[22]C -> 0 | H10: =R[22]C -> 0 | I10: =R[22]C -> 0 | J10: =R[22]C -> 0 | K10: =R[22]C -> 0 | L10: =R[22]C -> 0 | M10: =R[22]C -> 0 | N10: =R[22]C -> 0 | O10: =R[22]C -> 0 | P10: =R[22]C -> 0 | Q10: =R[22]C -> 6840000 | R10: =R[22]C -> 0 | S10: =R[22]C -> 0 | T10: =R[22]C -> 0 | U10: =R[22]C -> 68400 | V10: =R[22]C -> 0 | W10: =R[22]C -> 6771600 | X10: =R[22]C -> 0 | Y10: =R[22]C -> 0 | Z10: =R[22]C -> 0 | AA10: =R[22]C -> 0 | AB10: =R[22]C -> 0 | AC10: =R[22]C -> 0 | AD10: =R[22]C -> 0 | AE10: =R[22]C -> 0 | AF10: =R[22]C -> 0 | AG10: =R[22]C -> 0 | AH10: =R[22]C -> 0 | AI10: =R[22]C -> 6840000 | AJ10: =R[22]C -> 0 | AK10: =R[22]C -> 0 | AL10: =R[22]C -> 0 | AM10: =R[22]C -> 0 | AN10: =R[22]C -> 0 | AO10: =R[22]C -> 0 | AP10: =R[22]C -> 0 | AQ10: =R[22]C -> 0 | AR10: =R[22]C -> 19 | AS10: =R[22]C -> 0 | AT10: =R[22]C -> 0 | AU10: =R[22]C -> 6771600 | AW10: =R[22]C -> 0 | AX10: =R[22]C -> 0 | AY10: =R[22]C -> 0
F11: =R[20]C -> 6840000 | G11: =R[20]C -> 0 | H11: =R[20]C -> 0 | I11: =R[20]C -> 0 | J11: =R[20]C -> 0 | K11: =R[20]C -> 0 | L11: =R[20]C -> 0 | M11: =R[20]C -> 0 | N11: =R[20]C -> 0 | O11: =R[20]C -> 0 | P11: =R[20]C -> 0 | Q11: =R[20]C -> 6840000 | R11: =R[20]C -> 0 | S11: =R[20]C -> 0 | T11: =R[20]C -> 0 | U11: =R[20]C -> 68400 | V11: =R[20]C -> 0 | W11: =R[20]C -> 6771600 | X11: =R[20]C -> 0 | Y11: =R[20]C -> 0 | Z11: =R[20]C -> 0 | AA11: =R[20]C -> 0 | AB11: =R[20]C -> 0 | AC11: =R[20]C -> 0 | AD11: =R[20]C -> 0 | AE11: =R[20]C -> 0 | AF11: =R[20]C -> 0 | AG11: =R[20]C -> 0 | AH11: =R[20]C -> 0 | AI11: =R[20]C -> 6840000 | AJ11: =R[20]C -> 0 | AK11: =R[20]C -> 0 | AL11: =R[20]C -> 0 | AM11: =R[20]C -> 0 | AN11: =R[20]C -> 0 | AO11: =R[20]C -> 0 | AP11: =R[20]C -> 0 | AQ11: =R[20]C -> 0 | AR11: =R[20]C -> 19 | AS11: =R[20]C -> 0 | AT11: =R[20]C -> 0 | AU11: =R[20]C -> 6771600 | AW11: =R[20]C -> 0 | AX11: =R[20]C -> 0 | AY11: =R[20]C -> 0
A12: 1 | B12: 013715 | C12: Vũ Anh Đức | D12: Nhân viên Bốc xếp | F12: =RC[29]+RC[30]+RC[31]+RC[32]+RC[33]+RC[34]+RC[35]+RC[36]+RC[37] -> 360000 | G12: =RC[17]+RC[18]++RC[19]+RC[20]+RC[21]+RC[38]+RC[39]+RC[41] -> 0 | H12: 0 | I12: 0 | J12: =RC[-2]+RC[-1] -> 0 | K12: 0 | L12: 0 | M12: 0 | N12: =RC[15]+RC[16]+RC[17]+RC[18]+RC[19]+RC[20] -> 0 | O12: 0 | P12: 0 | Q12: 360000 | R12: 0 | S12: 0 | T12: 0 | U12: 3600 | V12: 0 | W12: 356400 | X12: 0 | Y12: 0 | Z12: 0 | AA12: 0 | AB12: 0 | AC12: 0 | AD12: 0 | AE12: 0 | AF12: 0 | AG12: 0 | AH12: 0 | AI12: 360000 | AJ12: 0 | AK12: 0 | AL12: 0 | AM12: 0 | AN12: 0 | AO12: 0 | AP12: 0 | AQ12: 0 | AR12: =1 -> 1 | AS12: 0 | AT12: 0 | AU12: =RC[-30]-RC[-29]-RC[-28]-RC[-27]-RC[-26]-RC[-25] -> 356400 | AV12: 0 | AW12: =RC[1]-RC[2] -> 0 | AX12: 0 | AY12: 0 | AZ12: =RC[-46] -> 360000 | BA12: =RC[-46] -> 0 | BB12: =RC[-46] -> 0 | BC12: =RC[-46] -> 0 | BD12: =RC[-46] -> 0 | BE12: =RC[-46] -> 0 | BF12: =RC[-46] -> 0 | BG12: =RC[-46] -> 0 | BH12: =RC[-46] -> 0 | BI12: =RC[-46] -> 0 | BJ12: =RC[-46] -> 0 | BK12: =RC[-46] -> 360000 | BL12: =RC[-46] -> 0 | BM12: =RC[-46] -> 0 | BN12: =RC[-46] -> 0 | BO12: =RC[-46] -> 3600 | BP12: =RC[-46] -> 0 | BQ12: =RC[-46] -> 356400 | BR12: =RC[-46] -> 0 | BS12: =RC[-46] -> 0 | BT12: =RC[-46] -> 0 | BU12: =RC[-46] -> 0 | BV12: =RC[-46] -> 0 | BW12: =RC[-46] -> 0 | BX12: =RC[-46] -> 0 | BY12: =RC[-46] -> 0 | BZ12: =RC[-46] -> 0 | CA12: =RC[-46] -> 0 | CB12: =RC[-46] -> 0 | CC12: =RC[-46] -> 360000 | CD12: =RC[-46] -> 0 | CE12: =RC[-46] -> 0 | CF12: =RC[-46] -> 0 | CG12: =RC[-46] -> 0 | CH12: =RC[-46] -> 0 | CI12: =RC[-46] -> 0 | CJ12: =RC[-46] -> 0 | CK12: =RC[-46] -> 0 | CL12: =RC[-46] -> 1 | CM12: =RC[-46] -> 0 | CN12: =RC[-46] -> 0 | CO12: =RC[-46] -> 356400 | CP12: =RC[-46] -> 0 | CQ12: =RC[-46] -> 0 | CR12: =RC[-46] -> 0 | CS12: =RC[-46] -> 0
A13: 2 | B13: 013716 | C13: Ngô Văn Minh | D13: Nhân viên Bốc xếp | F13: =RC[29]+RC[30]+RC[31]+RC[32]+RC[33]+RC[34]+RC[35]+RC[36]+RC[37] -> 360000 | G13: =RC[17]+RC[18]++RC[19]+RC[20]+RC[21]+RC[38]+RC[39]+RC[41] -> 0 | H13: 0 | I13: 0 | J13: =RC[-2]+RC[-1] -> 0 | K13: 0 | L13: 0 | M13: 0 | N13: =RC[15]+RC[16]+RC[17]+RC[18]+RC[19]+RC[20] -> 0 | O13: 0 | P13: 0 | Q13: 360000 | R13: 0 | S13: 0 | T13: 0 | U13: 3600 | V13: 0 | W13: 356400 | X13: 0 | Y13: 0 | Z13: 0 | AA13: 0 | AB13: 0 | AC13: 0 | AD13: 0 | AE13: 0 | AF13: 0 | AG13: 0 | AH13: 0 | AI13: 360000 | AJ13: 0 | AK13: 0 | AL13: 0 | AM13: 0 | AN13: 0 | AO13: 0 | AP13: 0 | AQ13: 0 | AR13: =1 -> 1 | AS13: 0 | AT13: 0 | AU13: =RC[-30]-RC[-29]-RC[-28]-RC[-27]-RC[-26]-RC[-25] -> 356400 | AV13: 0 | AW13: =RC[1]-RC[2] -> 0 | AX13: 0 | AY13: 0 | AZ13: =RC[-46] -> 360000 | BA13: =RC[-46] -> 0 | BB13: =RC[-46] -> 0 | BC13: =RC[-46] -> 0 | BD13: =RC[-46] -> 0 | BE13: =RC[-46] -> 0 | BF13: =RC[-46] -> 0 | BG13: =RC[-46] -> 0 | BH13: =RC[-46] -> 0 | BI13: =RC[-46] -> 0 | BJ13: =RC[-46] -> 0 | BK13: =RC[-46] -> 360000 | BL13: =RC[-46] -> 0 | BM13: =RC[-46] -> 0 | BN13: =RC[-46] -> 0 | BO13: =RC[-46] -> 3600 | BP13: =RC[-46] -> 0 | BQ13: =RC[-46] -> 356400 | BR13: =RC[-46] -> 0 | BS13: =RC[-46] -> 0 | BT13: =RC[-46] -> 0 | BU13: =RC[-46] -> 0 | BV13: =RC[-46] -> 0 | BW13: =RC[-46] -> 0 | BX13: =RC[-46] -> 0 | BY13: =RC[-46] -> 0 | BZ13: =RC[-46] -> 0 | CA13: =RC[-46] -> 0 | CB13: =RC[-46] -> 0 | CC13: =RC[-46] -> 360000 | CD13: =RC[-46] -> 0 | CE13: =RC[-46] -> 0 | CF13: =RC[-46] -> 0 | CG13: =RC[-46] -> 0 | CH13: =RC[-46] -> 0 | CI13: =RC[-46] -> 0 | CJ13: =RC[-46] -> 0 | CK13: =RC[-46] -> 0 | CL13: =RC[-46] -> 1 | CM13: =RC[-46] -> 0 | CN13: =RC[-46] -> 0 | CO13: =RC[-46] -> 356400 | CP13: =RC[-46] -> 0 | CQ13: =RC[-46] -> 0 | CR13: =RC[-46] -> 0 | CS13: =RC[-46] -> 0
A14: 3 | B14: 013717 | C14: Nguyễn Xuân Thành | D14: Nhân viên Bốc xếp | F14: =RC[29]+RC[30]+RC[31]+RC[32]+RC[33]+RC[34]+RC[35]+RC[36]+RC[37] -> 360000 | G14: =RC[17]+RC[18]++RC[19]+RC[20]+RC[21]+RC[38]+RC[39]+RC[41] -> 0 | H14: 0 | I14: 0 | J14: =RC[-2]+RC[-1] -> 0 | K14: 0 | L14: 0 | M14: 0 | N14: =RC[15]+RC[16]+RC[17]+RC[18]+RC[19]+RC[20] -> 0 | O14: 0 | P14: 0 | Q14: 360000 | R14: 0 | S14: 0 | T14: 0 | U14: 3600 | V14: 0 | W14: 356400 | X14: 0 | Y14: 0 | Z14: 0 | AA14: 0 | AB14: 0 | AC14: 0 | AD14: 0 | AE14: 0 | AF14: 0 | AG14: 0 | AH14: 0 | AI14: 360000 | AJ14: 0 | AK14: 0 | AL14: 0 | AM14: 0 | AN14: 0 | AO14: 0 | AP14: 0 | AQ14: 0 | AR14: =1 -> 1 | AS14: 0 | AT14: 0 | AU14: =RC[-30]-RC[-29]-RC[-28]-RC[-27]-RC[-26]-RC[-25] -> 356400 | AV14: 0 | AW14: =RC[1]-RC[2] -> 0 | AX14: 0 | AY14: 0 | AZ14: =RC[-46] -> 360000 | BA14: =RC[-46] -> 0 | BB14: =RC[-46] -> 0 | BC14: =RC[-46] -> 0 | BD14: =RC[-46] -> 0 | BE14: =RC[-46] -> 0 | BF14: =RC[-46] -> 0 | BG14: =RC[-46] -> 0 | BH14: =RC[-46] -> 0 | BI14: =RC[-46] -> 0 | BJ14: =RC[-46] -> 0 | BK14: =RC[-46] -> 360000 | BL14: =RC[-46] -> 0 | BM14: =RC[-46] -> 0 | BN14: =RC[-46] -> 0 | BO14: =RC[-46] -> 3600 | BP14: =RC[-46] -> 0 | BQ14: =RC[-46] -> 356400 | BR14: =RC[-46] -> 0 | BS14: =RC[-46] -> 0 | BT14: =RC[-46] -> 0 | BU14: =RC[-46] -> 0 | BV14: =RC[-46] -> 0 | BW14: =RC[-46] -> 0 | BX14: =RC[-46] -> 0 | BY14: =RC[-46] -> 0 | BZ14: =RC[-46] -> 0 | CA14: =RC[-46] -> 0 | CB14: =RC[-46] -> 0 | CC14: =RC[-46] -> 360000 | CD14: =RC[-46] -> 0 | CE14: =RC[-46] -> 0 | CF14: =RC[-46] -> 0 | CG14: =RC[-46] -> 0 | CH14: =RC[-46] -> 0 | CI14: =RC[-46] -> 0 | CJ14: =RC[-46] -> 0 | CK14: =RC[-46] -> 0 | CL14: =RC[-46] -> 1 | CM14: =RC[-46] -> 0 | CN14: =RC[-46] -> 0 | CO14: =RC[-46] -> 356400 | CP14: =RC[-46] -> 0 | CQ14: =RC[-46] -> 0 | CR14: =RC[-46] -> 0 | CS14: =RC[-46] -> 0
A15: 4 | B15: 013718 | C15: Nguyễn Khánh Duy | D15: Nhân viên Bốc xếp | F15: =RC[29]+RC[30]+RC[31]+RC[32]+RC[33]+RC[34]+RC[35]+RC[36]+RC[37] -> 360000 | G15: =RC[17]+RC[18]++RC[19]+RC[20]+RC[21]+RC[38]+RC[39]+RC[41] -> 0 | H15: 0 | I15: 0 | J15: =RC[-2]+RC[-1] -> 0 | K15: 0 | L15: 0 | M15: 0 | N15: =RC[15]+RC[16]+RC[17]+RC[18]+RC[19]+RC[20] -> 0 | O15: 0 | P15: 0 | Q15: 360000 | R15: 0 | S15: 0 | T15: 0 | U15: 3600 | V15: 0 | W15: 356400 | X15: 0 | Y15: 0 | Z15: 0 | AA15: 0 | AB15: 0 | AC15: 0 | AD15: 0 | AE15: 0 | AF15: 0 | AG15: 0 | AH15: 0 | AI15: 360000 | AJ15: 0 | AK15: 0 | AL15: 0 | AM15: 0 | AN15: 0 | AO15: 0 | AP15: 0 | AQ15: 0 | AR15: =1 -> 1 | AS15: 0 | AT15: 0 | AU15: =RC[-30]-RC[-29]-RC[-28]-RC[-27]-RC[-26]-RC[-25] -> 356400 | AV15: 0 | AW15: =RC[1]-RC[2] -> 0 | AX15: 0 | AY15: 0 | AZ15: =RC[-46] -> 360000 | BA15: =RC[-46] -> 0 | BB15: =RC[-46] -> 0 | BC15: =RC[-46] -> 0 | BD15: =RC[-46] -> 0 | BE15: =RC[-46] -> 0 | BF15: =RC[-46] -> 0 | BG15: =RC[-46] -> 0 | BH15: =RC[-46] -> 0 | BI15: =RC[-46] -> 0 | BJ15: =RC[-46] -> 0 | BK15: =RC[-46] -> 360000 | BL15: =RC[-46] -> 0 | BM15: =RC[-46] -> 0 | BN15: =RC[-46] -> 0 | BO15: =RC[-46] -> 3600 | BP15: =RC[-46] -> 0 | BQ15: =RC[-46] -> 356400 | BR15: =RC[-46] -> 0 | BS15: =RC[-46] -> 0 | BT15: =RC[-46] -> 0 | BU15: =RC[-46] -> 0 | BV15: =RC[-46] -> 0 | BW15: =RC[-46] -> 0 | BX15: =RC[-46] -> 0 | BY15: =RC[-46] -> 0 | BZ15: =RC[-46] -> 0 | CA15: =RC[-46] -> 0 | CB15: =RC[-46] -> 0 | CC15: =RC[-46] -> 360000 | CD15: =RC[-46] -> 0 | CE15: =RC[-46] -> 0 | CF15: =RC[-46] -> 0 | CG15: =RC[-46] -> 0 | CH15: =RC[-46] -> 0 | CI15: =RC[-46] -> 0 | CJ15: =RC[-46] -> 0 | CK15: =RC[-46] -> 0 | CL15: =RC[-46] -> 1 | CM15: =RC[-46] -> 0 | CN15: =RC[-46] -> 0 | CO15: =RC[-46] -> 356400 | CP15: =RC[-46] -> 0 | CQ15: =RC[-46] -> 0 | CR15: =RC[-46] -> 0 | CS15: =RC[-46] -> 0
A16: 5 | B16: 013719 | C16: Nguyễn Quang Huy | D16: Nhân viên Bốc xếp | F16: =RC[29]+RC[30]+RC[31]+RC[32]+RC[33]+RC[34]+RC[35]+RC[36]+RC[37] -> 360000 | G16: =RC[17]+RC[18]++RC[19]+RC[20]+RC[21]+RC[38]+RC[39]+RC[41] -> 0 | H16: 0 | I16: 0 | J16: =RC[-2]+RC[-1] -> 0 | K16: 0 | L16: 0 | M16: 0 | N16: =RC[15]+RC[16]+RC[17]+RC[18]+RC[19]+RC[20] -> 0 | O16: 0 | P16: 0 | Q16: 360000 | R16: 0 | S16: 0 | T16: 0 | U16: 3600 | V16: 0 | W16: 356400 | X16: 0 | Y16: 0 | Z16: 0 | AA16: 0 | AB16: 0 | AC16: 0 | AD16: 0 | AE16: 0 | AF16: 0 | AG16: 0 | AH16: 0 | AI16: 360000 | AJ16: 0 | AK16: 0 | AL16: 0 | AM16: 0 | AN16: 0 | AO16: 0 | AP16: 0 | AQ16: 0 | AR16: =1 -> 1 | AS16: 0 | AT16: 0 | AU16: =RC[-30]-RC[-29]-RC[-28]-RC[-27]-RC[-26]-RC[-25] -> 356400 | AV16: 0 | AW16: =RC[1]-RC[2] -> 0 | AX16: 0 | AY16: 0 | AZ16: =RC[-46] -> 360000 | BA16: =RC[-46] -> 0 | BB16: =RC[-46] -> 0 | BC16: =RC[-46] -> 0 | BD16: =RC[-46] -> 0 | BE16: =RC[-46] -> 0 | BF16: =RC[-46] -> 0 | BG16: =RC[-46] -> 0 | BH16: =RC[-46] -> 0 | BI16: =RC[-46] -> 0 | BJ16: =RC[-46] -> 0 | BK16: =RC[-46] -> 360000 | BL16: =RC[-46] -> 0 | BM16: =RC[-46] -> 0 | BN16: =RC[-46] -> 0 | BO16: =RC[-46] -> 3600 | BP16: =RC[-46] -> 0 | BQ16: =RC[-46] -> 356400 | BR16: =RC[-46] -> 0 | BS16: =RC[-46] -> 0 | BT16: =RC[-46] -> 0 | BU16: =RC[-46] -> 0 | BV16: =RC[-46] -> 0 | BW16: =RC[-46] -> 0 | BX16: =RC[-46] -> 0 | BY16: =RC[-46] -> 0 | BZ16: =RC[-46] -> 0 | CA16: =RC[-46] -> 0 | CB16: =RC[-46] -> 0 | CC16: =RC[-46] -> 360000 | CD16: =RC[-46] -> 0 | CE16: =RC[-46] -> 0 | CF16: =RC[-46] -> 0 | CG16: =RC[-46] -> 0 | CH16: =RC[-46] -> 0 | CI16: =RC[-46] -> 0 | CJ16: =RC[-46] -> 0 | CK16: =RC[-46] -> 0 | CL16: =RC[-46] -> 1 | CM16: =RC[-46] -> 0 | CN16: =RC[-46] -> 0 | CO16: =RC[-46] -> 356400 | CP16: =RC[-46] -> 0 | CQ16: =RC[-46] -> 0 | CR16: =RC[-46] -> 0 | CS16: =RC[-46] -> 0
A17: 6 | B17: 013720 | C17: Đinh Văn Minh | D17: Nhân viên Bốc xếp | F17: =RC[29]+RC[30]+RC[31]+RC[32]+RC[33]+RC[34]+RC[35]+RC[36]+RC[37] -> 360000 | G17: =RC[17]+RC[18]++RC[19]+RC[20]+RC[21]+RC[38]+RC[39]+RC[41] -> 0 | H17: 0 | I17: 0 | J17: =RC[-2]+RC[-1] -> 0 | K17: 0 | L17: 0 | M17: 0 | N17: =RC[15]+RC[16]+RC[17]+RC[18]+RC[19]+RC[20] -> 0 | O17: 0 | P17: 0 | Q17: 360000 | R17: 0 | S17: 0 | T17: 0 | U17: 3600 | V17: 0 | W17: 356400 | X17: 0 | Y17: 0 | Z17: 0 | AA17: 0 | AB17: 0 | AC17: 0 | AD17: 0 | AE17: 0 | AF17: 0 | AG17: 0 | AH17: 0 | AI17: 360000 | AJ17: 0 | AK17: 0 | AL17: 0 | AM17: 0 | AN17: 0 | AO17: 0 | AP17: 0 | AQ17: 0 | AR17: =1 -> 1 | AS17: 0 | AT17: 0 | AU17: =RC[-30]-RC[-29]-RC[-28]-RC[-27]-RC[-26]-RC[-25] -> 356400 | AV17: 0 | AW17: =RC[1]-RC[2] -> 0 | AX17: 0 | AY17: 0 | AZ17: =RC[-46] -> 360000 | BA17: =RC[-46] -> 0 | BB17: =RC[-46] -> 0 | BC17: =RC[-46] -> 0 | BD17: =RC[-46] -> 0 | BE17: =RC[-46] -> 0 | BF17: =RC[-46] -> 0 | BG17: =RC[-46] -> 0 | BH17: =RC[-46] -> 0 | BI17: =RC[-46] -> 0 | BJ17: =RC[-46] -> 0 | BK17: =RC[-46] -> 360000 | BL17: =RC[-46] -> 0 | BM17: =RC[-46] -> 0 | BN17: =RC[-46] -> 0 | BO17: =RC[-46] -> 3600 | BP17: =RC[-46] -> 0 | BQ17: =RC[-46] -> 356400 | BR17: =RC[-46] -> 0 | BS17: =RC[-46] -> 0 | BT17: =RC[-46] -> 0 | BU17: =RC[-46] -> 0 | BV17: =RC[-46] -> 0 | BW17: =RC[-46] -> 0 | BX17: =RC[-46] -> 0 | BY17: =RC[-46] -> 0 | BZ17: =RC[-46] -> 0 | CA17: =RC[-46] -> 0 | CB17: =RC[-46] -> 0 | CC17: =RC[-46] -> 360000 | CD17: =RC[-46] -> 0 | CE17: =RC[-46] -> 0 | CF17: =RC[-46] -> 0 | CG17: =RC[-46] -> 0 | CH17: =RC[-46] -> 0 | CI17: =RC[-46] -> 0 | CJ17: =RC[-46] -> 0 | CK17: =RC[-46] -> 0 | CL17: =RC[-46] -> 1 | CM17: =RC[-46] -> 0 | CN17: =RC[-46] -> 0 | CO17: =RC[-46] -> 356400 | CP17: =RC[-46] -> 0 | CQ17: =RC[-46] -> 0 | CR17: =RC[-46] -> 0 | CS17: =RC[-46] -> 0
A18: 7 | B18: 013721 | C18: Nguyễn Đình Quân | D18: Nhân viên Bốc xếp | F18: =RC[29]+RC[30]+RC[31]+RC[32]+RC[33]+RC[34]+RC[35]+RC[36]+RC[37] -> 360000 | G18: =RC[17]+RC[18]++RC[19]+RC[20]+RC[21]+RC[38]+RC[39]+RC[41] -> 0 | H18: 0 | I18: 0 | J18: =RC[-2]+RC[-1] -> 0 | K18: 0 | L18: 0 | M18: 0 | N18: =RC[15]+RC[16]+RC[17]+RC[18]+RC[19]+RC[20] -> 0 | O18: 0 | P18: 0 | Q18: 360000 | R18: 0 | S18: 0 | T18: 0 | U18: 3600 | V18: 0 | W18: 356400 | X18: 0 | Y18: 0 | Z18: 0 | AA18: 0 | AB18: 0 | AC18: 0 | AD18: 0 | AE18: 0 | AF18: 0 | AG18: 0 | AH18: 0 | AI18: 360000 | AJ18: 0 | AK18: 0 | AL18: 0 | AM18: 0 | AN18: 0 | AO18: 0 | AP18: 0 | AQ18: 0 | AR18: =1 -> 1 | AS18: 0 | AT18: 0 | AU18: =RC[-30]-RC[-29]-RC[-28]-RC[-27]-RC[-26]-RC[-25] -> 356400 | AV18: 0 | AW18: =RC[1]-RC[2] -> 0 | AX18: 0 | AY18: 0 | AZ18: =RC[-46] -> 360000 | BA18: =RC[-46] -> 0 | BB18: =RC[-46] -> 0 | BC18: =RC[-46] -> 0 | BD18: =RC[-46] -> 0 | BE18: =RC[-46] -> 0 | BF18: =RC[-46] -> 0 | BG18: =RC[-46] -> 0 | BH18: =RC[-46] -> 0 | BI18: =RC[-46] -> 0 | BJ18: =RC[-46] -> 0 | BK18: =RC[-46] -> 360000 | BL18: =RC[-46] -> 0 | BM18: =RC[-46] -> 0 | BN18: =RC[-46] -> 0 | BO18: =RC[-46] -> 3600 | BP18: =RC[-46] -> 0 | BQ18: =RC[-46] -> 356400 | BR18: =RC[-46] -> 0 | BS18: =RC[-46] -> 0 | BT18: =RC[-46] -> 0 | BU18: =RC[-46] -> 0 | BV18: =RC[-46] -> 0 | BW18: =RC[-46] -> 0 | BX18: =RC[-46] -> 0 | BY18: =RC[-46] -> 0 | BZ18: =RC[-46] -> 0 | CA18: =RC[-46] -> 0 | CB18: =RC[-46] -> 0 | CC18: =RC[-46] -> 360000 | CD18: =RC[-46] -> 0 | CE18: =RC[-46] -> 0 | CF18: =RC[-46] -> 0 | CG18: =RC[-46] -> 0 | CH18: =RC[-46] -> 0 | CI18: =RC[-46] -> 0 | CJ18: =RC[-46] -> 0 | CK18: =RC[-46] -> 0 | CL18: =RC[-46] -> 1 | CM18: =RC[-46] -> 0 | CN18: =RC[-46] -> 0 | CO18: =RC[-46] -> 356400 | CP18: =RC[-46] -> 0 | CQ18: =RC[-46] -> 0 | CR18: =RC[-46] -> 0 | CS18: =RC[-46] -> 0
A19: 8 | B19: 013722 | C19: Hoàng Anh Tuấn | D19: Nhân viên Bốc xếp | F19: =RC[29]+RC[30]+RC[31]+RC[32]+RC[33]+RC[34]+RC[35]+RC[36]+RC[37] -> 360000 | G19: =RC[17]+RC[18]++RC[19]+RC[20]+RC[21]+RC[38]+RC[39]+RC[41] -> 0 | H19: 0 | I19: 0 | J19: =RC[-2]+RC[-1] -> 0 | K19: 0 | L19: 0 | M19: 0 | N19: =RC[15]+RC[16]+RC[17]+RC[18]+RC[19]+RC[20] -> 0 | O19: 0 | P19: 0 | Q19: 360000 | R19: 0 | S19: 0 | T19: 0 | U19: 3600 | V19: 0 | W19: 356400 | X19: 0 | Y19: 0 | Z19: 0 | AA19: 0 | AB19: 0 | AC19: 0 | AD19: 0 | AE19: 0 | AF19: 0 | AG19: 0 | AH19: 0 | AI19: 360000 | AJ19: 0 | AK19: 0 | AL19: 0 | AM19: 0 | AN19: 0 | AO19: 0 | AP19: 0 | AQ19: 0 | AR19: =1 -> 1 | AS19: 0 | AT19: 0 | AU19: =RC[-30]-RC[-29]-RC[-28]-RC[-27]-RC[-26]-RC[-25] -> 356400 | AV19: 0 | AW19: =RC[1]-RC[2] -> 0 | AX19: 0 | AY19: 0 | AZ19: =RC[-46] -> 360000 | BA19: =RC[-46] -> 0 | BB19: =RC[-46] -> 0 | BC19: =RC[-46] -> 0 | BD19: =RC[-46] -> 0 | BE19: =RC[-46] -> 0 | BF19: =RC[-46] -> 0 | BG19: =RC[-46] -> 0 | BH19: =RC[-46] -> 0 | BI19: =RC[-46] -> 0 | BJ19: =RC[-46] -> 0 | BK19: =RC[-46] -> 360000 | BL19: =RC[-46] -> 0 | BM19: =RC[-46] -> 0 | BN19: =RC[-46] -> 0 | BO19: =RC[-46] -> 3600 | BP19: =RC[-46] -> 0 | BQ19: =RC[-46] -> 356400 | BR19: =RC[-46] -> 0 | BS19: =RC[-46] -> 0 | BT19: =RC[-46] -> 0 | BU19: =RC[-46] -> 0 | BV19: =RC[-46] -> 0 | BW19: =RC[-46] -> 0 | BX19: =RC[-46] -> 0 | BY19: =RC[-46] -> 0 | BZ19: =RC[-46] -> 0 | CA19: =RC[-46] -> 0 | CB19: =RC[-46] -> 0 | CC19: =RC[-46] -> 360000 | CD19: =RC[-46] -> 0 | CE19: =RC[-46] -> 0 | CF19: =RC[-46] -> 0 | CG19: =RC[-46] -> 0 | CH19: =RC[-46] -> 0 | CI19: =RC[-46] -> 0 | CJ19: =RC[-46] -> 0 | CK19: =RC[-46] -> 0 | CL19: =RC[-46] -> 1 | CM19: =RC[-46] -> 0 | CN19: =RC[-46] -> 0 | CO19: =RC[-46] -> 356400 | CP19: =RC[-46] -> 0 | CQ19: =RC[-46] -> 0 | CR19: =RC[-46] -> 0 | CS19: =RC[-46] -> 0
A20: 9 | B20: 013723 | C20: Phạm Tiến Công | D20: Nhân viên Bốc xếp | F20: =RC[29]+RC[30]+RC[31]+RC[32]+RC[33]+RC[34]+RC[35]+RC[36]+RC[37] -> 360000 | G20: =RC[17]+RC[18]++RC[19]+RC[20]+RC[21]+RC[38]+RC[39]+RC[41] -> 0 | H20: 0 | I20: 0 | J20: =RC[-2]+RC[-1] -> 0 | K20: 0 | L20: 0 | M20: 0 | N20: =RC[15]+RC[16]+RC[17]+RC[18]+RC[19]+RC[20] -> 0 | O20: 0 | P20: 0 | Q20: 360000 | R20: 0 | S20: 0 | T20: 0 | U20: 3600 | V20: 0 | W20: 356400 | X20: 0 | Y20: 0 | Z20: 0 | AA20: 0 | AB20: 0 | AC20: 0 | AD20: 0 | AE20: 0 | AF20: 0 | AG20: 0 | AH20: 0 | AI20: 360000 | AJ20: 0 | AK20: 0 | AL20: 0 | AM20: 0 | AN20: 0 | AO20: 0 | AP20: 0 | AQ20: 0 | AR20: =1 -> 1 | AS20: 0 | AT20: 0 | AU20: =RC[-30]-RC[-29]-RC[-28]-RC[-27]-RC[-26]-RC[-25] -> 356400 | AV20: 0 | AW20: =RC[1]-RC[2] -> 0 | AX20: 0 | AY20: 0 | AZ20: =RC[-46] -> 360000 | BA20: =RC[-46] -> 0 | BB20: =RC[-46] -> 0 | BC20: =RC[-46] -> 0 | BD20: =RC[-46] -> 0 | BE20: =RC[-46] -> 0 | BF20: =RC[-46] -> 0 | BG20: =RC[-46] -> 0 | BH20: =RC[-46] -> 0 | BI20: =RC[-46] -> 0 | BJ20: =RC[-46] -> 0 | BK20: =RC[-46] -> 360000 | BL20: =RC[-46] -> 0 | BM20: =RC[-46] -> 0 | BN20: =RC[-46] -> 0 | BO20: =RC[-46] -> 3600 | BP20: =RC[-46] -> 0 | BQ20: =RC[-46] -> 356400 | BR20: =RC[-46] -> 0 | BS20: =RC[-46] -> 0 | BT20: =RC[-46] -> 0 | BU20: =RC[-46] -> 0 | BV20: =RC[-46] -> 0 | BW20: =RC[-46] -> 0 | BX20: =RC[-46] -> 0 | BY20: =RC[-46] -> 0 | BZ20: =RC[-46] -> 0 | CA20: =RC[-46] -> 0 | CB20: =RC[-46] -> 0 | CC20: =RC[-46] -> 360000 | CD20: =RC[-46] -> 0 | CE20: =RC[-46] -> 0 | CF20: =RC[-46] -> 0 | CG20: =RC[-46] -> 0 | CH20: =RC[-46] -> 0 | CI20: =RC[-46] -> 0 | CJ20: =RC[-46] -> 0 | CK20: =RC[-46] -> 0 | CL20: =RC[-46] -> 1 | CM20: =RC[-46] -> 0 | CN20: =RC[-46] -> 0 | CO20: =RC[-46] -> 356400 | CP20: =RC[-46] -> 0 | CQ20: =RC[-46] -> 0 | CR20: =RC[-46] -> 0 | CS20: =RC[-46] -> 0
A21: 10 | B21: 013724 | C21: Nguyễn Văn Hưng | D21: Nhân viên Bốc xếp | F21: =RC[29]+RC[30]+RC[31]+RC[32]+RC[33]+RC[34]+RC[35]+RC[36]+RC[37] -> 360000 | G21: =RC[17]+RC[18]++RC[19]+RC[20]+RC[21]+RC[38]+RC[39]+RC[41] -> 0 | H21: 0 | I21: 0 | J21: =RC[-2]+RC[-1] -> 0 | K21: 0 | L21: 0 | M21: 0 | N21: =RC[15]+RC[16]+RC[17]+RC[18]+RC[19]+RC[20] -> 0 | O21: 0 | P21: 0 | Q21: 360000 | R21: 0 | S21: 0 | T21: 0 | U21: 3600 | V21: 0 | W21: 356400 | X21: 0 | Y21: 0 | Z21: 0 | AA21: 0 | AB21: 0 | AC21: 0 | AD21: 0 | AE21: 0 | AF21: 0 | AG21: 0 | AH21: 0 | AI21: 360000 | AJ21: 0 | AK21: 0 | AL21: 0 | AM21: 0 | AN21: 0 | AO21: 0 | AP21: 0 | AQ21: 0 | AR21: =1 -> 1 | AS21: 0 | AT21: 0 | AU21: =RC[-30]-RC[-29]-RC[-28]-RC[-27]-RC[-26]-RC[-25] -> 356400 | AV21: 0 | AW21: =RC[1]-RC[2] -> 0 | AX21: 0 | AY21: 0 | AZ21: =RC[-46] -> 360000 | BA21: =RC[-46] -> 0 | BB21: =RC[-46] -> 0 | BC21: =RC[-46] -> 0 | BD21: =RC[-46] -> 0 | BE21: =RC[-46] -> 0 | BF21: =RC[-46] -> 0 | BG21: =RC[-46] -> 0 | BH21: =RC[-46] -> 0 | BI21: =RC[-46] -> 0 | BJ21: =RC[-46] -> 0 | BK21: =RC[-46] -> 360000 | BL21: =RC[-46] -> 0 | BM21: =RC[-46] -> 0 | BN21: =RC[-46] -> 0 | BO21: =RC[-46] -> 3600 | BP21: =RC[-46] -> 0 | BQ21: =RC[-46] -> 356400 | BR21: =RC[-46] -> 0 | BS21: =RC[-46] -> 0 | BT21: =RC[-46] -> 0 | BU21: =RC[-46] -> 0 | BV21: =RC[-46] -> 0 | BW21: =RC[-46] -> 0 | BX21: =RC[-46] -> 0 | BY21: =RC[-46] -> 0 | BZ21: =RC[-46] -> 0 | CA21: =RC[-46] -> 0 | CB21: =RC[-46] -> 0 | CC21: =RC[-46] -> 360000 | CD21: =RC[-46] -> 0 | CE21: =RC[-46] -> 0 | CF21: =RC[-46] -> 0 | CG21: =RC[-46] -> 0 | CH21: =RC[-46] -> 0 | CI21: =RC[-46] -> 0 | CJ21: =RC[-46] -> 0 | CK21: =RC[-46] -> 0 | CL21: =RC[-46] -> 1 | CM21: =RC[-46] -> 0 | CN21: =RC[-46] -> 0 | CO21: =RC[-46] -> 356400 | CP21: =RC[-46] -> 0 | CQ21: =RC[-46] -> 0 | CR21: =RC[-46] -> 0 | CS21: =RC[-46] -> 0
A22: 11 | B22: 013725 | C22: Nguyễn Ngọc Phú | D22: Nhân viên Bốc xếp | F22: =RC[29]+RC[30]+RC[31]+RC[32]+RC[33]+RC[34]+RC[35]+RC[36]+RC[37] -> 360000 | G22: =RC[17]+RC[18]++RC[19]+RC[20]+RC[21]+RC[38]+RC[39]+RC[41] -> 0 | H22: 0 | I22: 0 | J22: =RC[-2]+RC[-1] -> 0 | K22: 0 | L22: 0 | M22: 0 | N22: =RC[15]+RC[16]+RC[17]+RC[18]+RC[19]+RC[20] -> 0 | O22: 0 | P22: 0 | Q22: 360000 | R22: 0 | S22: 0 | T22: 0 | U22: 3600 | V22: 0 | W22: 356400 | X22: 0 | Y22: 0 | Z22: 0 | AA22: 0 | AB22: 0 | AC22: 0 | AD22: 0 | AE22: 0 | AF22: 0 | AG22: 0 | AH22: 0 | AI22: 360000 | AJ22: 0 | AK22: 0 | AL22: 0 | AM22: 0 | AN22: 0 | AO22: 0 | AP22: 0 | AQ22: 0 | AR22: =1 -> 1 | AS22: 0 | AT22: 0 | AU22: =RC[-30]-RC[-29]-RC[-28]-RC[-27]-RC[-26]-RC[-25] -> 356400 | AV22: 0 | AW22: =RC[1]-RC[2] -> 0 | AX22: 0 | AY22: 0 | AZ22: =RC[-46] -> 360000 | BA22: =RC[-46] -> 0 | BB22: =RC[-46] -> 0 | BC22: =RC[-46] -> 0 | BD22: =RC[-46] -> 0 | BE22: =RC[-46] -> 0 | BF22: =RC[-46] -> 0 | BG22: =RC[-46] -> 0 | BH22: =RC[-46] -> 0 | BI22: =RC[-46] -> 0 | BJ22: =RC[-46] -> 0 | BK22: =RC[-46] -> 360000 | BL22: =RC[-46] -> 0 | BM22: =RC[-46] -> 0 | BN22: =RC[-46] -> 0 | BO22: =RC[-46] -> 3600 | BP22: =RC[-46] -> 0 | BQ22: =RC[-46] -> 356400 | BR22: =RC[-46] -> 0 | BS22: =RC[-46] -> 0 | BT22: =RC[-46] -> 0 | BU22: =RC[-46] -> 0 | BV22: =RC[-46] -> 0 | BW22: =RC[-46] -> 0 | BX22: =RC[-46] -> 0 | BY22: =RC[-46] -> 0 | BZ22: =RC[-46] -> 0 | CA22: =RC[-46] -> 0 | CB22: =RC[-46] -> 0 | CC22: =RC[-46] -> 360000 | CD22: =RC[-46] -> 0 | CE22: =RC[-46] -> 0 | CF22: =RC[-46] -> 0 | CG22: =RC[-46] -> 0 | CH22: =RC[-46] -> 0 | CI22: =RC[-46] -> 0 | CJ22: =RC[-46] -> 0 | CK22: =RC[-46] -> 0 | CL22: =RC[-46] -> 1 | CM22: =RC[-46] -> 0 | CN22: =RC[-46] -> 0 | CO22: =RC[-46] -> 356400 | CP22: =RC[-46] -> 0 | CQ22: =RC[-46] -> 0 | CR22: =RC[-46] -> 0 | CS22: =RC[-46] -> 0
A23: 12 | B23: 013726 | C23: Lưu Xuân Thắng | D23: Nhân viên Bốc xếp | F23: =RC[29]+RC[30]+RC[31]+RC[32]+RC[33]+RC[34]+RC[35]+RC[36]+RC[37] -> 360000 | G23: =RC[17]+RC[18]++RC[19]+RC[20]+RC[21]+RC[38]+RC[39]+RC[41] -> 0 | H23: 0 | I23: 0 | J23: =RC[-2]+RC[-1] -> 0 | K23: 0 | L23: 0 | M23: 0 | N23: =RC[15]+RC[16]+RC[17]+RC[18]+RC[19]+RC[20] -> 0 | O23: 0 | P23: 0 | Q23: 360000 | R23: 0 | S23: 0 | T23: 0 | U23: 3600 | V23: 0 | W23: 356400 | X23: 0 | Y23: 0 | Z23: 0 | AA23: 0 | AB23: 0 | AC23: 0 | AD23: 0 | AE23: 0 | AF23: 0 | AG23: 0 | AH23: 0 | AI23: 360000 | AJ23: 0 | AK23: 0 | AL23: 0 | AM23: 0 | AN23: 0 | AO23: 0 | AP23: 0 | AQ23: 0 | AR23: =1 -> 1 | AS23: 0 | AT23: 0 | AU23: =RC[-30]-RC[-29]-RC[-28]-RC[-27]-RC[-26]-RC[-25] -> 356400 | AV23: 0 | AW23: =RC[1]-RC[2] -> 0 | AX23: 0 | AY23: 0 | AZ23: =RC[-46] -> 360000 | BA23: =RC[-46] -> 0 | BB23: =RC[-46] -> 0 | BC23: =RC[-46] -> 0 | BD23: =RC[-46] -> 0 | BE23: =RC[-46] -> 0 | BF23: =RC[-46] -> 0 | BG23: =RC[-46] -> 0 | BH23: =RC[-46] -> 0 | BI23: =RC[-46] -> 0 | BJ23: =RC[-46] -> 0 | BK23: =RC[-46] -> 360000 | BL23: =RC[-46] -> 0 | BM23: =RC[-46] -> 0 | BN23: =RC[-46] -> 0 | BO23: =RC[-46] -> 3600 | BP23: =RC[-46] -> 0 | BQ23: =RC[-46] -> 356400 | BR23: =RC[-46] -> 0 | BS23: =RC[-46] -> 0 | BT23: =RC[-46] -> 0 | BU23: =RC[-46] -> 0 | BV23: =RC[-46] -> 0 | BW23: =RC[-46] -> 0 | BX23: =RC[-46] -> 0 | BY23: =RC[-46] -> 0 | BZ23: =RC[-46] -> 0 | CA23: =RC[-46] -> 0 | CB23: =RC[-46] -> 0 | CC23: =RC[-46] -> 360000 | CD23: =RC[-46] -> 0 | CE23: =RC[-46] -> 0 | CF23: =RC[-46] -> 0 | CG23: =RC[-46] -> 0 | CH23: =RC[-46] -> 0 | CI23: =RC[-46] -> 0 | CJ23: =RC[-46] -> 0 | CK23: =RC[-46] -> 0 | CL23: =RC[-46] -> 1 | CM23: =RC[-46] -> 0 | CN23: =RC[-46] -> 0 | CO23: =RC[-46] -> 356400 | CP23: =RC[-46] -> 0 | CQ23: =RC[-46] -> 0 | CR23: =RC[-46] -> 0 | CS23: =RC[-46] -> 0
A24: 13 | B24: 013727 | C24: Trần Quang Huy | D24: Nhân viên Bốc xếp | F24: =RC[29]+RC[30]+RC[31]+RC[32]+RC[33]+RC[34]+RC[35]+RC[36]+RC[37] -> 360000 | G24: =RC[17]+RC[18]++RC[19]+RC[20]+RC[21]+RC[38]+RC[39]+RC[41] -> 0 | H24: 0 | I24: 0 | J24: =RC[-2]+RC[-1] -> 0 | K24: 0 | L24: 0 | M24: 0 | N24: =RC[15]+RC[16]+RC[17]+RC[18]+RC[19]+RC[20] -> 0 | O24: 0 | P24: 0 | Q24: 360000 | R24: 0 | S24: 0 | T24: 0 | U24: 3600 | V24: 0 | W24: 356400 | X24: 0 | Y24: 0 | Z24: 0 | AA24: 0 | AB24: 0 | AC24: 0 | AD24: 0 | AE24: 0 | AF24: 0 | AG24: 0 | AH24: 0 | AI24: 360000 | AJ24: 0 | AK24: 0 | AL24: 0 | AM24: 0 | AN24: 0 | AO24: 0 | AP24: 0 | AQ24: 0 | AR24: =1 -> 1 | AS24: 0 | AT24: 0 | AU24: =RC[-30]-RC[-29]-RC[-28]-RC[-27]-RC[-26]-RC[-25] -> 356400 | AV24: 0 | AW24: =RC[1]-RC[2] -> 0 | AX24: 0 | AY24: 0 | AZ24: =RC[-46] -> 360000 | BA24: =RC[-46] -> 0 | BB24: =RC[-46] -> 0 | BC24: =RC[-46] -> 0 | BD24: =RC[-46] -> 0 | BE24: =RC[-46] -> 0 | BF24: =RC[-46] -> 0 | BG24: =RC[-46] -> 0 | BH24: =RC[-46] -> 0 | BI24: =RC[-46] -> 0 | BJ24: =RC[-46] -> 0 | BK24: =RC[-46] -> 360000 | BL24: =RC[-46] -> 0 | BM24: =RC[-46] -> 0 | BN24: =RC[-46] -> 0 | BO24: =RC[-46] -> 3600 | BP24: =RC[-46] -> 0 | BQ24: =RC[-46] -> 356400 | BR24: =RC[-46] -> 0 | BS24: =RC[-46] -> 0 | BT24: =RC[-46] -> 0 | BU24: =RC[-46] -> 0 | BV24: =RC[-46] -> 0 | BW24: =RC[-46] -> 0 | BX24: =RC[-46] -> 0 | BY24: =RC[-46] -> 0 | BZ24: =RC[-46] -> 0 | CA24: =RC[-46] -> 0 | CB24: =RC[-46] -> 0 | CC24: =RC[-46] -> 360000 | CD24: =RC[-46] -> 0 | CE24: =RC[-46] -> 0 | CF24: =RC[-46] -> 0 | CG24: =RC[-46] -> 0 | CH24: =RC[-46] -> 0 | CI24: =RC[-46] -> 0 | CJ24: =RC[-46] -> 0 | CK24: =RC[-46] -> 0 | CL24: =RC[-46] -> 1 | CM24: =RC[-46] -> 0 | CN24: =RC[-46] -> 0 | CO24: =RC[-46] -> 356400 | CP24: =RC[-46] -> 0 | CQ24: =RC[-46] -> 0 | CR24: =RC[-46] -> 0 | CS24: =RC[-46] -> 0
A25: 14 | B25: 013729 | C25: Ngô Đức Thuận | D25: Nhân viên Bốc xếp | F25: =RC[29]+RC[30]+RC[31]+RC[32]+RC[33]+RC[34]+RC[35]+RC[36]+RC[37] -> 360000 | G25: =RC[17]+RC[18]++RC[19]+RC[20]+RC[21]+RC[38]+RC[39]+RC[41] -> 0 | H25: 0 | I25: 0 | J25: =RC[-2]+RC[-1] -> 0 | K25: 0 | L25: 0 | M25: 0 | N25: =RC[15]+RC[16]+RC[17]+RC[18]+RC[19]+RC[20] -> 0 | O25: 0 | P25: 0 | Q25: 360000 | R25: 0 | S25: 0 | T25: 0 | U25: 3600 | V25: 0 | W25: 356400 | X25: 0 | Y25: 0 | Z25: 0 | AA25: 0 | AB25: 0 | AC25: 0 | AD25: 0 | AE25: 0 | AF25: 0 | AG25: 0 | AH25: 0 | AI25: 360000 | AJ25: 0 | AK25: 0 | AL25: 0 | AM25: 0 | AN25: 0 | AO25: 0 | AP25: 0 | AQ25: 0 | AR25: =1 -> 1 | AS25: 0 | AT25: 0 | AU25: =RC[-30]-RC[-29]-RC[-28]-RC[-27]-RC[-26]-RC[-25] -> 356400 | AV25: 0 | AW25: =RC[1]-RC[2] -> 0 | AX25: 0 | AY25: 0 | AZ25: =RC[-46] -> 360000 | BA25: =RC[-46] -> 0 | BB25: =RC[-46] -> 0 | BC25: =RC[-46] -> 0 | BD25: =RC[-46] -> 0 | BE25: =RC[-46] -> 0 | BF25: =RC[-46] -> 0 | BG25: =RC[-46] -> 0 | BH25: =RC[-46] -> 0 | BI25: =RC[-46] -> 0 | BJ25: =RC[-46] -> 0 | BK25: =RC[-46] -> 360000 | BL25: =RC[-46] -> 0 | BM25: =RC[-46] -> 0 | BN25: =RC[-46] -> 0 | BO25: =RC[-46] -> 3600 | BP25: =RC[-46] -> 0 | BQ25: =RC[-46] -> 356400 | BR25: =RC[-46] -> 0 | BS25: =RC[-46] -> 0 | BT25: =RC[-46] -> 0 | BU25: =RC[-46] -> 0 | BV25: =RC[-46] -> 0 | BW25: =RC[-46] -> 0 | BX25: =RC[-46] -> 0 | BY25: =RC[-46] -> 0 | BZ25: =RC[-46] -> 0 | CA25: =RC[-46] -> 0 | CB25: =RC[-46] -> 0 | CC25: =RC[-46] -> 360000 | CD25: =RC[-46] -> 0 | CE25: =RC[-46] -> 0 | CF25: =RC[-46] -> 0 | CG25: =RC[-46] -> 0 | CH25: =RC[-46] -> 0 | CI25: =RC[-46] -> 0 | CJ25: =RC[-46] -> 0 | CK25: =RC[-46] -> 0 | CL25: =RC[-46] -> 1 | CM25: =RC[-46] -> 0 | CN25: =RC[-46] -> 0 | CO25: =RC[-46] -> 356400 | CP25: =RC[-46] -> 0 | CQ25: =RC[-46] -> 0 | CR25: =RC[-46] -> 0 | CS25: =RC[-46] -> 0
A26: 15 | B26: 013754 | C26: Đinh Kiều Trang | D26: Nhân viên phục vụ hành khách hàng hóa | F26: =RC[29]+RC[30]+RC[31]+RC[32]+RC[33]+RC[34]+RC[35]+RC[36]+RC[37] -> 360000 | G26: =RC[17]+RC[18]++RC[19]+RC[20]+RC[21]+RC[38]+RC[39]+RC[41] -> 0 | H26: 0 | I26: 0 | J26: =RC[-2]+RC[-1] -> 0 | K26: 0 | L26: 0 | M26: 0 | N26: =RC[15]+RC[16]+RC[17]+RC[18]+RC[19]+RC[20] -> 0 | O26: 0 | P26: 0 | Q26: 360000 | R26: 0 | S26: 0 | T26: 0 | U26: 3600 | V26: 0 | W26: 356400 | X26: 0 | Y26: 0 | Z26: 0 | AA26: 0 | AB26: 0 | AC26: 0 | AD26: 0 | AE26: 0 | AF26: 0 | AG26: 0 | AH26: 0 | AI26: 360000 | AJ26: 0 | AK26: 0 | AL26: 0 | AM26: 0 | AN26: 0 | AO26: 0 | AP26: 0 | AQ26: 0 | AR26: =1 -> 1 | AS26: 0 | AT26: 0 | AU26: =RC[-30]-RC[-29]-RC[-28]-RC[-27]-RC[-26]-RC[-25] -> 356400 | AV26: 0 | AW26: =RC[1]-RC[2] -> 0 | AX26: 0 | AY26: 0 | AZ26: =RC[-46] -> 360000 | BA26: =RC[-46] -> 0 | BB26: =RC[-46] -> 0 | BC26: =RC[-46] -> 0 | BD26: =RC[-46] -> 0 | BE26: =RC[-46] -> 0 | BF26: =RC[-46] -> 0 | BG26: =RC[-46] -> 0 | BH26: =RC[-46] -> 0 | BI26: =RC[-46] -> 0 | BJ26: =RC[-46] -> 0 | BK26: =RC[-46] -> 360000 | BL26: =RC[-46] -> 0 | BM26: =RC[-46] -> 0 | BN26: =RC[-46] -> 0 | BO26: =RC[-46] -> 3600 | BP26: =RC[-46] -> 0 | BQ26: =RC[-46] -> 356400 | BR26: =RC[-46] -> 0 | BS26: =RC[-46] -> 0 | BT26: =RC[-46] -> 0 | BU26: =RC[-46] -> 0 | BV26: =RC[-46] -> 0 | BW26: =RC[-46] -> 0 | BX26: =RC[-46] -> 0 | BY26: =RC[-46] -> 0 | BZ26: =RC[-46] -> 0 | CA26: =RC[-46] -> 0 | CB26: =RC[-46] -> 0 | CC26: =RC[-46] -> 360000 | CD26: =RC[-46] -> 0 | CE26: =RC[-46] -> 0 | CF26: =RC[-46] -> 0 | CG26: =RC[-46] -> 0 | CH26: =RC[-46] -> 0 | CI26: =RC[-46] -> 0 | CJ26: =RC[-46] -> 0 | CK26: =RC[-46] -> 0 | CL26: =RC[-46] -> 1 | CM26: =RC[-46] -> 0 | CN26: =RC[-46] -> 0 | CO26: =RC[-46] -> 356400 | CP26: =RC[-46] -> 0 | CQ26: =RC[-46] -> 0 | CR26: =RC[-46] -> 0 | CS26: =RC[-46] -> 0
A27: 16 | B27: 013755 | C27: Phạm Thị Diễm Hương | D27: Nhân viên phục vụ hành khách hàng hóa | F27: =RC[29]+RC[30]+RC[31]+RC[32]+RC[33]+RC[34]+RC[35]+RC[36]+RC[37] -> 360000 | G27: =RC[17]+RC[18]++RC[19]+RC[20]+RC[21]+RC[38]+RC[39]+RC[41] -> 0 | H27: 0 | I27: 0 | J27: =RC[-2]+RC[-1] -> 0 | K27: 0 | L27: 0 | M27: 0 | N27: =RC[15]+RC[16]+RC[17]+RC[18]+RC[19]+RC[20] -> 0 | O27: 0 | P27: 0 | Q27: 360000 | R27: 0 | S27: 0 | T27: 0 | U27: 3600 | V27: 0 | W27: 356400 | X27: 0 | Y27: 0 | Z27: 0 | AA27: 0 | AB27: 0 | AC27: 0 | AD27: 0 | AE27: 0 | AF27: 0 | AG27: 0 | AH27: 0 | AI27: 360000 | AJ27: 0 | AK27: 0 | AL27: 0 | AM27: 0 | AN27: 0 | AO27: 0 | AP27: 0 | AQ27: 0 | AR27: =1 -> 1 | AS27: 0 | AT27: 0 | AU27: =RC[-30]-RC[-29]-RC[-28]-RC[-27]-RC[-26]-RC[-25] -> 356400 | AV27: 0 | AW27: =RC[1]-RC[2] -> 0 | AX27: 0 | AY27: 0 | AZ27: =RC[-46] -> 360000 | BA27: =RC[-46] -> 0 | BB27: =RC[-46] -> 0 | BC27: =RC[-46] -> 0 | BD27: =RC[-46] -> 0 | BE27: =RC[-46] -> 0 | BF27: =RC[-46] -> 0 | BG27: =RC[-46] -> 0 | BH27: =RC[-46] -> 0 | BI27: =RC[-46] -> 0 | BJ27: =RC[-46] -> 0 | BK27: =RC[-46] -> 360000 | BL27: =RC[-46] -> 0 | BM27: =RC[-46] -> 0 | BN27: =RC[-46] -> 0 | BO27: =RC[-46] -> 3600 | BP27: =RC[-46] -> 0 | BQ27: =RC[-46] -> 356400 | BR27: =RC[-46] -> 0 | BS27: =RC[-46] -> 0 | BT27: =RC[-46] -> 0 | BU27: =RC[-46] -> 0 | BV27: =RC[-46] -> 0 | BW27: =RC[-46] -> 0 | BX27: =RC[-46] -> 0 | BY27: =RC[-46] -> 0 | BZ27: =RC[-46] -> 0 | CA27: =RC[-46] -> 0 | CB27: =RC[-46] -> 0 | CC27: =RC[-46] -> 360000 | CD27: =RC[-46] -> 0 | CE27: =RC[-46] -> 0 | CF27: =RC[-46] -> 0 | CG27: =RC[-46] -> 0 | CH27: =RC[-46] -> 0 | CI27: =RC[-46] -> 0 | CJ27: =RC[-46] -> 0 | CK27: =RC[-46] -> 0 | CL27: =RC[-46] -> 1 | CM27: =RC[-46] -> 0 | CN27: =RC[-46] -> 0 | CO27: =RC[-46] -> 356400 | CP27: =RC[-46] -> 0 | CQ27: =RC[-46] -> 0 | CR27: =RC[-46] -> 0 | CS27: =RC[-46] -> 0
A28: 17 | B28: 013756 | C28: Nguyễn Thị Diệu Hoa | D28: Nhân viên phục vụ hành khách hàng hóa | F28: =RC[29]+RC[30]+RC[31]+RC[32]+RC[33]+RC[34]+RC[35]+RC[36]+RC[37] -> 360000 | G28: =RC[17]+RC[18]++RC[19]+RC[20]+RC[21]+RC[38]+RC[39]+RC[41] -> 0 | H28: 0 | I28: 0 | J28: =RC[-2]+RC[-1] -> 0 | K28: 0 | L28: 0 | M28: 0 | N28: =RC[15]+RC[16]+RC[17]+RC[18]+RC[19]+RC[20] -> 0 | O28: 0 | P28: 0 | Q28: 360000 | R28: 0 | S28: 0 | T28: 0 | U28: 3600 | V28: 0 | W28: 356400 | X28: 0 | Y28: 0 | Z28: 0 | AA28: 0 | AB28: 0 | AC28: 0 | AD28: 0 | AE28: 0 | AF28: 0 | AG28: 0 | AH28: 0 | AI28: 360000 | AJ28: 0 | AK28: 0 | AL28: 0 | AM28: 0 | AN28: 0 | AO28: 0 | AP28: 0 | AQ28: 0 | AR28: =1 -> 1 | AS28: 0 | AT28: 0 | AU28: =RC[-30]-RC[-29]-RC[-28]-RC[-27]-RC[-26]-RC[-25] -> 356400 | AV28: 0 | AW28: =RC[1]-RC[2] -> 0 | AX28: 0 | AY28: 0 | AZ28: =RC[-46] -> 360000 | BA28: =RC[-46] -> 0 | BB28: =RC[-46] -> 0 | BC28: =RC[-46] -> 0 | BD28: =RC[-46] -> 0 | BE28: =RC[-46] -> 0 | BF28: =RC[-46] -> 0 | BG28: =RC[-46] -> 0 | BH28: =RC[-46] -> 0 | BI28: =RC[-46] -> 0 | BJ28: =RC[-46] -> 0 | BK28: =RC[-46] -> 360000 | BL28: =RC[-46] -> 0 | BM28: =RC[-46] -> 0 | BN28: =RC[-46] -> 0 | BO28: =RC[-46] -> 3600 | BP28: =RC[-46] -> 0 | BQ28: =RC[-46] -> 356400 | BR28: =RC[-46] -> 0 | BS28: =RC[-46] -> 0 | BT28: =RC[-46] -> 0 | BU28: =RC[-46] -> 0 | BV28: =RC[-46] -> 0 | BW28: =RC[-46] -> 0 | BX28: =RC[-46] -> 0 | BY28: =RC[-46] -> 0 | BZ28: =RC[-46] -> 0 | CA28: =RC[-46] -> 0 | CB28: =RC[-46] -> 0 | CC28: =RC[-46] -> 360000 | CD28: =RC[-46] -> 0 | CE28: =RC[-46] -> 0 | CF28: =RC[-46] -> 0 | CG28: =RC[-46] -> 0 | CH28: =RC[-46] -> 0 | CI28: =RC[-46] -> 0 | CJ28: =RC[-46] -> 0 | CK28: =RC[-46] -> 0 | CL28: =RC[-46] -> 1 | CM28: =RC[-46] -> 0 | CN28: =RC[-46] -> 0 | CO28: =RC[-46] -> 356400 | CP28: =RC[-46] -> 0 | CQ28: =RC[-46] -> 0 | CR28: =RC[-46] -> 0 | CS28: =RC[-46] -> 0
A29: 18 | B29: 013757 | C29: Trần Thanh Trang | D29: Nhân viên phục vụ hành khách hàng hóa | F29: =RC[29]+RC[30]+RC[31]+RC[32]+RC[33]+RC[34]+RC[35]+RC[36]+RC[37] -> 360000 | G29: =RC[17]+RC[18]++RC[19]+RC[20]+RC[21]+RC[38]+RC[39]+RC[41] -> 0 | H29: 0 | I29: 0 | J29: =RC[-2]+RC[-1] -> 0 | K29: 0 | L29: 0 | M29: 0 | N29: =RC[15]+RC[16]+RC[17]+RC[18]+RC[19]+RC[20] -> 0 | O29: 0 | P29: 0 | Q29: 360000 | R29: 0 | S29: 0 | T29: 0 | U29: 3600 | V29: 0 | W29: 356400 | X29: 0 | Y29: 0 | Z29: 0 | AA29: 0 | AB29: 0 | AC29: 0 | AD29: 0 | AE29: 0 | AF29: 0 | AG29: 0 | AH29: 0 | AI29: 360000 | AJ29: 0 | AK29: 0 | AL29: 0 | AM29: 0 | AN29: 0 | AO29: 0 | AP29: 0 | AQ29: 0 | AR29: =1 -> 1 | AS29: 0 | AT29: 0 | AU29: =RC[-30]-RC[-29]-RC[-28]-RC[-27]-RC[-26]-RC[-25] -> 356400 | AV29: 0 | AW29: =RC[1]-RC[2] -> 0 | AX29: 0 | AY29: 0 | AZ29: =RC[-46] -> 360000 | BA29: =RC[-46] -> 0 | BB29: =RC[-46] -> 0 | BC29: =RC[-46] -> 0 | BD29: =RC[-46] -> 0 | BE29: =RC[-46] -> 0 | BF29: =RC[-46] -> 0 | BG29: =RC[-46] -> 0 | BH29: =RC[-46] -> 0 | BI29: =RC[-46] -> 0 | BJ29: =RC[-46] -> 0 | BK29: =RC[-46] -> 360000 | BL29: =RC[-46] -> 0 | BM29: =RC[-46] -> 0 | BN29: =RC[-46] -> 0 | BO29: =RC[-46] -> 3600 | BP29: =RC[-46] -> 0 | BQ29: =RC[-46] -> 356400 | BR29: =RC[-46] -> 0 | BS29: =RC[-46] -> 0 | BT29: =RC[-46] -> 0 | BU29: =RC[-46] -> 0 | BV29: =RC[-46] -> 0 | BW29: =RC[-46] -> 0 | BX29: =RC[-46] -> 0 | BY29: =RC[-46] -> 0 | BZ29: =RC[-46] -> 0 | CA29: =RC[-46] -> 0 | CB29: =RC[-46] -> 0 | CC29: =RC[-46] -> 360000 | CD29: =RC[-46] -> 0 | CE29: =RC[-46] -> 0 | CF29: =RC[-46] -> 0 | CG29: =RC[-46] -> 0 | CH29: =RC[-46] -> 0 | CI29: =RC[-46] -> 0 | CJ29: =RC[-46] -> 0 | CK29: =RC[-46] -> 0 | CL29: =RC[-46] -> 1 | CM29: =RC[-46] -> 0 | CN29: =RC[-46] -> 0 | CO29: =RC[-46] -> 356400 | CP29: =RC[-46] -> 0 | CQ29: =RC[-46] -> 0 | CR29: =RC[-46] -> 0 | CS29: =RC[-46] -> 0
A30: 19 | B30: 013768 | C30: Mạc Thị Thùy Dương | D30: Nhân viên phục vụ hành khách hàng hóa | F30: =RC[29]+RC[30]+RC[31]+RC[32]+RC[33]+RC[34]+RC[35]+RC[36]+RC[37] -> 360000 | G30: =RC[17]+RC[18]++RC[19]+RC[20]+RC[21]+RC[38]+RC[39]+RC[41] -> 0 | H30: 0 | I30: 0 | J30: =RC[-2]+RC[-1] -> 0 | K30: 0 | L30: 0 | M30: 0 | N30: =RC[15]+RC[16]+RC[17]+RC[18]+RC[19]+RC[20] -> 0 | O30: 0 | P30: 0 | Q30: 360000 | R30: 0 | S30: 0 | T30: 0 | U30: 3600 | V30: 0 | W30: 356400 | X30: 0 | Y30: 0 | Z30: 0 | AA30: 0 | AB30: 0 | AC30: 0 | AD30: 0 | AE30: 0 | AF30: 0 | AG30: 0 | AH30: 0 | AI30: 360000 | AJ30: 0 | AK30: 0 | AL30: 0 | AM30: 0 | AN30: 0 | AO30: 0 | AP30: 0 | AQ30: 0 | AR30: =1 -> 1 | AS30: 0 | AT30: 0 | AU30: =RC[-30]-RC[-29]-RC[-28]-RC[-27]-RC[-26]-RC[-25] -> 356400 | AV30: 0 | AW30: =RC[1]-RC[2] -> 0 | AX30: 0 | AY30: 0 | AZ30: =RC[-46] -> 360000 | BA30: =RC[-46] -> 0 | BB30: =RC[-46] -> 0 | BC30: =RC[-46] -> 0 | BD30: =RC[-46] -> 0 | BE30: =RC[-46] -> 0 | BF30: =RC[-46] -> 0 | BG30: =RC[-46] -> 0 | BH30: =RC[-46] -> 0 | BI30: =RC[-46] -> 0 | BJ30: =RC[-46] -> 0 | BK30: =RC[-46] -> 360000 | BL30: =RC[-46] -> 0 | BM30: =RC[-46] -> 0 | BN30: =RC[-46] -> 0 | BO30: =RC[-46] -> 3600 | BP30: =RC[-46] -> 0 | BQ30: =RC[-46] -> 356400 | BR30: =RC[-46] -> 0 | BS30: =RC[-46] -> 0 | BT30: =RC[-46] -> 0 | BU30: =RC[-46] -> 0 | BV30: =RC[-46] -> 0 | BW30: =RC[-46] -> 0 | BX30: =RC[-46] -> 0 | BY30: =RC[-46] -> 0 | BZ30: =RC[-46] -> 0 | CA30: =RC[-46] -> 0 | CB30: =RC[-46] -> 0 | CC30: =RC[-46] -> 360000 | CD30: =RC[-46] -> 0 | CE30: =RC[-46] -> 0 | CF30: =RC[-46] -> 0 | CG30: =RC[-46] -> 0 | CH30: =RC[-46] -> 0 | CI30: =RC[-46] -> 0 | CJ30: =RC[-46] -> 0 | CK30: =RC[-46] -> 0 | CL30: =RC[-46] -> 1 | CM30: =RC[-46] -> 0 | CN30: =RC[-46] -> 0 | CO30: =RC[-46] -> 356400 | CP30: =RC[-46] -> 0 | CQ30: =RC[-46] -> 0 | CR30: =RC[-46] -> 0 | CS30: =RC[-46] -> 0
F31: =SUM(R[-19]C:R[-1]C) -> 6840000 | G31: =SUM(R[-19]C:R[-1]C) -> 0 | H31: =SUM(R[-19]C:R[-1]C) -> 0 | I31: =SUM(R[-19]C:R[-1]C) -> 0 | J31: =SUM(R[-19]C:R[-1]C) -> 0 | K31: =SUM(R[-19]C:R[-1]C) -> 0 | L31: =SUM(R[-19]C:R[-1]C) -> 0 | M31: =SUM(R[-19]C:R[-1]C) -> 0 | N31: =SUM(R[-19]C:R[-1]C) -> 0 | O31: =SUM(R[-19]C:R[-1]C) -> 0 | P31: =SUM(R[-19]C:R[-1]C) -> 0 | Q31: =SUM(R[-19]C:R[-1]C) -> 6840000 | R31: =SUM(R[-19]C:R[-1]C) -> 0 | S31: =SUM(R[-19]C:R[-1]C) -> 0 | T31: =SUM(R[-19]C:R[-1]C) -> 0 | U31: =SUM(R[-19]C:R[-1]C) -> 68400 | V31: =SUM(R[-19]C:R[-1]C) -> 0 | W31: =SUM(R[-19]C:R[-1]C) -> 6771600 | X31: =SUM(R[-19]C:R[-1]C) -> 0 | Y31: =SUM(R[-19]C:R[-1]C) -> 0 | Z31: =SUM(R[-19]C:R[-1]C) -> 0 | AA31: =SUM(R[-19]C:R[-1]C) -> 0 | AB31: =SUM(R[-19]C:R[-1]C) -> 0 | AC31: =SUM(R[-19]C:R[-1]C) -> 0 | AD31: =SUM(R[-19]C:R[-1]C) -> 0 | AE31: =SUM(R[-19]C:R[-1]C) -> 0 | AF31: =SUM(R[-19]C:R[-1]C) -> 0 | AG31: =SUM(R[-19]C:R[-1]C) -> 0 | AH31: =SUM(R[-19]C:R[-1]C) -> 0 | AI31: =SUM(R[-19]C:R[-1]C) -> 6840000 | AJ31: =SUM(R[-19]C:R[-1]C) -> 0 | AK31: =SUM(R[-19]C:R[-1]C) -> 0 | AL31: =SUM(R[-19]C:R[-1]C) -> 0 | AM31: =SUM(R[-19]C:R[-1]C) -> 0 | AN31: =SUM(R[-19]C:R[-1]C) -> 0 | AO31: =SUM(R[-19]C:R[-1]C) -> 0 | AP31: =SUM(R[-19]C:R[-1]C) -> 0 | AQ31: =SUM(R[-19]C:R[-1]C) -> 0 | AR31: =SUM(R[-19]C:R[-1]C) -> 19 | AS31: =SUM(R[-19]C:R[-1]C) -> 0 | AT31: =SUM(R[-19]C:R[-1]C) -> 0 | AU31: =SUM(R[-19]C:R[-1]C) -> 6771600 | AV31: =SUM(R[-19]C:R[-1]C) -> 0 | AW31: =SUM(R[-19]C:R[-1]C) -> 0 | AX31: =SUM(R[-19]C:R[-1]C) -> 0 | AY31: =SUM(R[-19]C:R[-1]C) -> 0
F32: =SUM(R[-21]C[46]:R[-1]C[46]) -> 6840000 | G32: =SUM(R[-21]C[46]:R[-1]C[46]) -> 0 | H32: =SUM(R[-21]C[46]:R[-1]C[46]) -> 0 | I32: =SUM(R[-21]C[46]:R[-1]C[46]) -> 0 | J32: =SUM(R[-21]C[46]:R[-1]C[46]) -> 0 | K32: =SUM(R[-21]C[46]:R[-1]C[46]) -> 0 | L32: =SUM(R[-21]C[46]:R[-1]C[46]) -> 0 | M32: =SUM(R[-21]C[46]:R[-1]C[46]) -> 0 | N32: =SUM(R[-21]C[46]:R[-1]C[46]) -> 0 | O32: =SUM(R[-21]C[46]:R[-1]C[46]) -> 0 | P32: =SUM(R[-21]C[46]:R[-1]C[46]) -> 0 | Q32: =SUM(R[-21]C[46]:R[-1]C[46]) -> 6840000 | R32: =SUM(R[-21]C[46]:R[-1]C[46]) -> 0 | S32: =SUM(R[-21]C[46]:R[-1]C[46]) -> 0 | T32: =SUM(R[-21]C[46]:R[-1]C[46]) -> 0 | U32: =SUM(R[-21]C[46]:R[-1]C[46]) -> 68400 | V32: =SUM(R[-21]C[46]:R[-1]C[46]) -> 0 | W32: =SUM(R[-21]C[46]:R[-1]C[46]) -> 6771600 | X32: =SUM(R[-21]C[46]:R[-1]C[46]) -> 0 | Y32: =SUM(R[-21]C[46]:R[-1]C[46]) -> 0 | Z32: =SUM(R[-21]C[46]:R[-1]C[46]) -> 0 | AA32: =SUM(R[-21]C[46]:R[-1]C[46]) -> 0 | AB32: =SUM(R[-21]C[46]:R[-1]C[46]) -> 0 | AC32: =SUM(R[-21]C[46]:R[-1]C[46]) -> 0 | AD32: =SUM(R[-21]C[46]:R[-1]C[46]) -> 0 | AE32: =SUM(R[-21]C[46]:R[-1]C[46]) -> 0 | AF32: =SUM(R[-21]C[46]:R[-1]C[46]) -> 0 | AG32: =SUM(R[-21]C[46]:R[-1]C[46]) -> 0 | AH32: =SUM(R[-21]C[46]:R[-1]C[46]) -> 0 | AI32: =SUM(R[-21]C[46]:R[-1]C[46]) -> 6840000 | AJ32: =SUM(R[-21]C[46]:R[-1]C[46]) -> 0 | AK32: =SUM(R[-21]C[46]:R[-1]C[46]) -> 0 | AL32: =SUM(R[-21]C[46]:R[-1]C[46]) -> 0 | AM32: =SUM(R[-21]C[46]:R[-1]C[46]) -> 0 | AN32: =SUM(R[-21]C[46]:R[-1]C[46]) -> 0 | AO32: =SUM(R[-21]C[46]:R[-1]C[46]) -> 0 | AP32: =SUM(R[-21]C[46]:R[-1]C[46]) -> 0 | AQ32: =SUM(R[-21]C[46]:R[-1]C[46]) -> 0 | AR32: =SUM(R[-21]C[46]:R[-1]C[46]) -> 19 | AS32: =SUM(R[-21]C[46]:R[-1]C[46]) -> 0 | AT32: =SUM(R[-21]C[46]:R[-1]C[46]) -> 0 | AU32: =SUM(R[-21]C[46]:R[-1]C[46]) -> 6771600 | AV32: =SUM(R[-21]C[46]:R[-1]C[46]) -> 0 | AW32: =SUM(R[-21]C[46]:R[-1]C[46]) -> 0 | AX32: =SUM(R[-21]C[46]:R[-1]C[46]) -> 0 | AY32: =SUM(R[-21]C[46]:R[-1]C[46]) -> 0
A33: Phòng Điều hành, tài liệu và hướng dẫn chất xếp (HGS) | F33: =R[15]C -> 4320000 | G33: =R[15]C -> 0 | H33: =R[15]C -> 0 | I33: =R[15]C -> 0 | J33: =R[15]C -> 0 | K33: =R[15]C -> 0 | L33: =R[15]C -> 0 | M33: =R[15]C -> 0 | N33: =R[15]C -> 0 | O33: =R[15]C -> 0 | P33: =R[15]C -> 0 | Q33: =R[15]C -> 4320000 | R33: =R[15]C -> 0 | S33: =R[15]C -> 0 | T33: =R[15]C -> 0 | U33: =R[15]C -> 43200 | V33: =R[15]C -> 0 | W33: =R[15]C -> 4276800 | X33: =R[15]C -> 0 | Y33: =R[15]C -> 0 | Z33: =R[15]C -> 0 | AA33: =R[15]C -> 0 | AB33: =R[15]C -> 0 | AC33: =R[15]C -> 0 | AD33: =R[15]C -> 0 | AE33: =R[15]C -> 0 | AF33: =R[15]C -> 0 | AG33: =R[15]C -> 0 | AH33: =R[15]C -> 0 | AI33: =R[15]C -> 4320000 | AJ33: =R[15]C -> 0 | AK33: =R[15]C -> 0 | AL33: =R[15]C -> 0 | AM33: =R[15]C -> 0 | AN33: =R[15]C -> 0 | AO33: =R[15]C -> 0 | AP33: =R[15]C -> 0 | AQ33: =R[15]C -> 0 | AR33: =R[15]C -> 12 | AS33: =R[15]C -> 0 | AT33: =R[15]C -> 0 | AU33: =R[15]C -> 4276800 | AW33: =R[15]C -> 0 | AX33: =R[15]C -> 0 | AY33: =R[15]C -> 0
F34: =R[13]C -> 4320000 | G34: =R[13]C -> 0 | H34: =R[13]C -> 0 | I34: =R[13]C -> 0 | J34: =R[13]C -> 0 | K34: =R[13]C -> 0 | L34: =R[13]C -> 0 | M34: =R[13]C -> 0 | N34: =R[13]C -> 0 | O34: =R[13]C -> 0 | P34: =R[13]C -> 0 | Q34: =R[13]C -> 4320000 | R34: =R[13]C -> 0 | S34: =R[13]C -> 0 | T34: =R[13]C -> 0 | U34: =R[13]C -> 43200 | V34: =R[13]C -> 0 | W34: =R[13]C -> 4276800 | X34: =R[13]C -> 0 | Y34: =R[13]C -> 0 | Z34: =R[13]C -> 0 | AA34: =R[13]C -> 0 | AB34: =R[13]C -> 0 | AC34: =R[13]C -> 0 | AD34: =R[13]C -> 0 | AE34: =R[13]C -> 0 | AF34: =R[13]C -> 0 | AG34: =R[13]C -> 0 | AH34: =R[13]C -> 0 | AI34: =R[13]C -> 4320000 | AJ34: =R[13]C -> 0 | AK34: =R[13]C -> 0 | AL34: =R[13]C -> 0 | AM34: =R[13]C -> 0 | AN34: =R[13]C -> 0 | AO34: =R[13]C -> 0 | AP34: =R[13]C -> 0 | AQ34: =R[13]C -> 0 | AR34: =R[13]C -> 12 | AS34: =R[13]C -> 0 | AT34: =R[13]C -> 0 | AU34: =R[13]C -> 4276800 | AW34: =R[13]C -> 0 | AX34: =R[13]C -> 0 | AY34: =R[13]C -> 0
A35: 1 | B35: 013777 | C35: Nguyễn Đức Huy | D35: Nhân viên phục vụ hành khách hàng hóa | F35: =RC[29]+RC[30]+RC[31]+RC[32]+RC[33]+RC[34]+RC[35]+RC[36]+RC[37] -> 360000 | G35: =RC[17]+RC[18]++RC[19]+RC[20]+RC[21]+RC[38]+RC[39]+RC[41] -> 0 | H35: 0 | I35: 0 | J35: =RC[-2]+RC[-1] -> 0 | K35: 0 | L35: 0 | M35: 0 | N35: =RC[15]+RC[16]+RC[17]+RC[18]+RC[19]+RC[20] -> 0 | O35: 0 | P35: 0 | Q35: 360000 | R35: 0 | S35: 0 | T35: 0 | U35: 3600 | V35: 0 | W35: 356400 | X35: 0 | Y35: 0 | Z35: 0 | AA35: 0 | AB35: 0 | AC35: 0 | AD35: 0 | AE35: 0 | AF35: 0 | AG35: 0 | AH35: 0 | AI35: 360000 | AJ35: 0 | AK35: 0 | AL35: 0 | AM35: 0 | AN35: 0 | AO35: 0 | AP35: 0 | AQ35: 0 | AR35: =1 -> 1 | AS35: 0 | AT35: 0 | AU35: =RC[-30]-RC[-29]-RC[-28]-RC[-27]-RC[-26]-RC[-25] -> 356400 | AV35: 0 | AW35: =RC[1]-RC[2] -> 0 | AX35: 0 | AY35: 0 | AZ35: =RC[-46] -> 360000 | BA35: =RC[-46] -> 0 | BB35: =RC[-46] -> 0 | BC35: =RC[-46] -> 0 | BD35: =RC[-46] -> 0 | BE35: =RC[-46] -> 0 | BF35: =RC[-46] -> 0 | BG35: =RC[-46] -> 0 | BH35: =RC[-46] -> 0 | BI35: =RC[-46] -> 0 | BJ35: =RC[-46] -> 0 | BK35: =RC[-46] -> 360000 | BL35: =RC[-46] -> 0 | BM35: =RC[-46] -> 0 | BN35: =RC[-46] -> 0 | BO35: =RC[-46] -> 3600 | BP35: =RC[-46] -> 0 | BQ35: =RC[-46] -> 356400 | BR35: =RC[-46] -> 0 | BS35: =RC[-46] -> 0 | BT35: =RC[-46] -> 0 | BU35: =RC[-46] -> 0 | BV35: =RC[-46] -> 0 | BW35: =RC[-46] -> 0 | BX35: =RC[-46] -> 0 | BY35: =RC[-46] -> 0 | BZ35: =RC[-46] -> 0 | CA35: =RC[-46] -> 0 | CB35: =RC[-46] -> 0 | CC35: =RC[-46] -> 360000 | CD35: =RC[-46] -> 0 | CE35: =RC[-46] -> 0 | CF35: =RC[-46] -> 0 | CG35: =RC[-46] -> 0 | CH35: =RC[-46] -> 0 | CI35: =RC[-46] -> 0 | CJ35: =RC[-46] -> 0 | CK35: =RC[-46] -> 0 | CL35: =RC[-46] -> 1 | CM35: =RC[-46] -> 0 | CN35: =RC[-46] -> 0 | CO35: =RC[-46] -> 356400 | CP35: =RC[-46] -> 0 | CQ35: =RC[-46] -> 0 | CR35: =RC[-46] -> 0 | CS35: =RC[-46] -> 0
A36: 2 | B36: 013783 | C36: Trần Đăng Khoa | D36: Nhân viên cân bằng trọng tải nhóm 1 | F36: =RC[29]+RC[30]+RC[31]+RC[32]+RC[33]+RC[34]+RC[35]+RC[36]+RC[37] -> 360000 | G36: =RC[17]+RC[18]++RC[19]+RC[20]+RC[21]+RC[38]+RC[39]+RC[41] -> 0 | H36: 0 | I36: 0 | J36: =RC[-2]+RC[-1] -> 0 | K36: 0 | L36: 0 | M36: 0 | N36: =RC[15]+RC[16]+RC[17]+RC[18]+RC[19]+RC[20] -> 0 | O36: 0 | P36: 0 | Q36: 360000 | R36: 0 | S36: 0 | T36: 0 | U36: 3600 | V36: 0 | W36: 356400 | X36: 0 | Y36: 0 | Z36: 0 | AA36: 0 | AB36: 0 | AC36: 0 | AD36: 0 | AE36: 0 | AF36: 0 | AG36: 0 | AH36: 0 | AI36: 360000 | AJ36: 0 | AK36: 0 | AL36: 0 | AM36: 0 | AN36: 0 | AO36: 0 | AP36: 0 | AQ36: 0 | AR36: =1 -> 1 | AS36: 0 | AT36: 0 | AU36: =RC[-30]-RC[-29]-RC[-28]-RC[-27]-RC[-26]-RC[-25] -> 356400 | AV36: 0 | AW36: =RC[1]-RC[2] -> 0 | AX36: 0 | AY36: 0 | AZ36: =RC[-46] -> 360000 | BA36: =RC[-46] -> 0 | BB36: =RC[-46] -> 0 | BC36: =RC[-46] -> 0 | BD36: =RC[-46] -> 0 | BE36: =RC[-46] -> 0 | BF36: =RC[-46] -> 0 | BG36: =RC[-46] -> 0 | BH36: =RC[-46] -> 0 | BI36: =RC[-46] -> 0 | BJ36: =RC[-46] -> 0 | BK36: =RC[-46] -> 360000 | BL36: =RC[-46] -> 0 | BM36: =RC[-46] -> 0 | BN36: =RC[-46] -> 0 | BO36: =RC[-46] -> 3600 | BP36: =RC[-46] -> 0 | BQ36: =RC[-46] -> 356400 | BR36: =RC[-46] -> 0 | BS36: =RC[-46] -> 0 | BT36: =RC[-46] -> 0 | BU36: =RC[-46] -> 0 | BV36: =RC[-46] -> 0 | BW36: =RC[-46] -> 0 | BX36: =RC[-46] -> 0 | BY36: =RC[-46] -> 0 | BZ36: =RC[-46] -> 0 | CA36: =RC[-46] -> 0 | CB36: =RC[-46] -> 0 | CC36: =RC[-46] -> 360000 | CD36: =RC[-46] -> 0 | CE36: =RC[-46] -> 0 | CF36: =RC[-46] -> 0 | CG36: =RC[-46] -> 0 | CH36: =RC[-46] -> 0 | CI36: =RC[-46] -> 0 | CJ36: =RC[-46] -> 0 | CK36: =RC[-46] -> 0 | CL36: =RC[-46] -> 1 | CM36: =RC[-46] -> 0 | CN36: =RC[-46] -> 0 | CO36: =RC[-46] -> 356400 | CP36: =RC[-46] -> 0 | CQ36: =RC[-46] -> 0 | CR36: =RC[-46] -> 0 | CS36: =RC[-46] -> 0
A37: 3 | B37: 013785 | C37: Nguyễn Thị Nam Phương | D37: Nhân viên cân bằng trọng tải nhóm 1 | F37: =RC[29]+RC[30]+RC[31]+RC[32]+RC[33]+RC[34]+RC[35]+RC[36]+RC[37] -> 360000 | G37: =RC[17]+RC[18]++RC[19]+RC[20]+RC[21]+RC[38]+RC[39]+RC[41] -> 0 | H37: 0 | I37: 0 | J37: =RC[-2]+RC[-1] -> 0 | K37: 0 | L37: 0 | M37: 0 | N37: =RC[15]+RC[16]+RC[17]+RC[18]+RC[19]+RC[20] -> 0 | O37: 0 | P37: 0 | Q37: 360000 | R37: 0 | S37: 0 | T37: 0 | U37: 3600 | V37: 0 | W37: 356400 | X37: 0 | Y37: 0 | Z37: 0 | AA37: 0 | AB37: 0 | AC37: 0 | AD37: 0 | AE37: 0 | AF37: 0 | AG37: 0 | AH37: 0 | AI37: 360000 | AJ37: 0 | AK37: 0 | AL37: 0 | AM37: 0 | AN37: 0 | AO37: 0 | AP37: 0 | AQ37: 0 | AR37: =1 -> 1 | AS37: 0 | AT37: 0 | AU37: =RC[-30]-RC[-29]-RC[-28]-RC[-27]-RC[-26]-RC[-25] -> 356400 | AV37: 0 | AW37: =RC[1]-RC[2] -> 0 | AX37: 0 | AY37: 0 | AZ37: =RC[-46] -> 360000 | BA37: =RC[-46] -> 0 | BB37: =RC[-46] -> 0 | BC37: =RC[-46] -> 0 | BD37: =RC[-46] -> 0 | BE37: =RC[-46] -> 0 | BF37: =RC[-46] -> 0 | BG37: =RC[-46] -> 0 | BH37: =RC[-46] -> 0 | BI37: =RC[-46] -> 0 | BJ37: =RC[-46] -> 0 | BK37: =RC[-46] -> 360000 | BL37: =RC[-46] -> 0 | BM37: =RC[-46] -> 0 | BN37: =RC[-46] -> 0 | BO37: =RC[-46] -> 3600 | BP37: =RC[-46] -> 0 | BQ37: =RC[-46] -> 356400 | BR37: =RC[-46] -> 0 | BS37: =RC[-46] -> 0 | BT37: =RC[-46] -> 0 | BU37: =RC[-46] -> 0 | BV37: =RC[-46] -> 0 | BW37: =RC[-46] -> 0 | BX37: =RC[-46] -> 0 | BY37: =RC[-46] -> 0 | BZ37: =RC[-46] -> 0 | CA37: =RC[-46] -> 0 | CB37: =RC[-46] -> 0 | CC37: =RC[-46] -> 360000 | CD37: =RC[-46] -> 0 | CE37: =RC[-46] -> 0 | CF37: =RC[-46] -> 0 | CG37: =RC[-46] -> 0 | CH37: =RC[-46] -> 0 | CI37: =RC[-46] -> 0 | CJ37: =RC[-46] -> 0 | CK37: =RC[-46] -> 0 | CL37: =RC[-46] -> 1 | CM37: =RC[-46] -> 0 | CN37: =RC[-46] -> 0 | CO37: =RC[-46] -> 356400 | CP37: =RC[-46] -> 0 | CQ37: =RC[-46] -> 0 | CR37: =RC[-46] -> 0 | CS37: =RC[-46] -> 0
A38: 4 | B38: 013786 | C38: Đinh Đức Nam | D38: Nhân viên cân bằng trọng tải nhóm 1 | F38: =RC[29]+RC[30]+RC[31]+RC[32]+RC[33]+RC[34]+RC[35]+RC[36]+RC[37] -> 360000 | G38: =RC[17]+RC[18]++RC[19]+RC[20]+RC[21]+RC[38]+RC[39]+RC[41] -> 0 | H38: 0 | I38: 0 | J38: =RC[-2]+RC[-1] -> 0 | K38: 0 | L38: 0 | M38: 0 | N38: =RC[15]+RC[16]+RC[17]+RC[18]+RC[19]+RC[20] -> 0 | O38: 0 | P38: 0 | Q38: 360000 | R38: 0 | S38: 0 | T38: 0 | U38: 3600 | V38: 0 | W38: 356400 | X38: 0 | Y38: 0 | Z38: 0 | AA38: 0 | AB38: 0 | AC38: 0 | AD38: 0 | AE38: 0 | AF38: 0 | AG38: 0 | AH38: 0 | AI38: 360000 | AJ38: 0 | AK38: 0 | AL38: 0 | AM38: 0 | AN38: 0 | AO38: 0 | AP38: 0 | AQ38: 0 | AR38: =1 -> 1 | AS38: 0 | AT38: 0 | AU38: =RC[-30]-RC[-29]-RC[-28]-RC[-27]-RC[-26]-RC[-25] -> 356400 | AV38: 0 | AW38: =RC[1]-RC[2] -> 0 | AX38: 0 | AY38: 0 | AZ38: =RC[-46] -> 360000 | BA38: =RC[-46] -> 0 | BB38: =RC[-46] -> 0 | BC38: =RC[-46] -> 0 | BD38: =RC[-46] -> 0 | BE38: =RC[-46] -> 0 | BF38: =RC[-46] -> 0 | BG38: =RC[-46] -> 0 | BH38: =RC[-46] -> 0 | BI38: =RC[-46] -> 0 | BJ38: =RC[-46] -> 0 | BK38: =RC[-46] -> 360000 | BL38: =RC[-46] -> 0 | BM38: =RC[-46] -> 0 | BN38: =RC[-46] -> 0 | BO38: =RC[-46] -> 3600 | BP38: =RC[-46] -> 0 | BQ38: =RC[-46] -> 356400 | BR38: =RC[-46] -> 0 | BS38: =RC[-46] -> 0 | BT38: =RC[-46] -> 0 | BU38: =RC[-46] -> 0 | BV38: =RC[-46] -> 0 | BW38: =RC[-46] -> 0 | BX38: =RC[-46] -> 0 | BY38: =RC[-46] -> 0 | BZ38: =RC[-46] -> 0 | CA38: =RC[-46] -> 0 | CB38: =RC[-46] -> 0 | CC38: =RC[-46] -> 360000 | CD38: =RC[-46] -> 0 | CE38: =RC[-46] -> 0 | CF38: =RC[-46] -> 0 | CG38: =RC[-46] -> 0 | CH38: =RC[-46] -> 0 | CI38: =RC[-46] -> 0 | CJ38: =RC[-46] -> 0 | CK38: =RC[-46] -> 0 | CL38: =RC[-46] -> 1 | CM38: =RC[-46] -> 0 | CN38: =RC[-46] -> 0 | CO38: =RC[-46] -> 356400 | CP38: =RC[-46] -> 0 | CQ38: =RC[-46] -> 0 | CR38: =RC[-46] -> 0 | CS38: =RC[-46] -> 0
A39: 5 | B39: 013787 | C39: Nguyễn Thái Sơn | D39: Nhân viên cân bằng trọng tải nhóm 1 | F39: =RC[29]+RC[30]+RC[31]+RC[32]+RC[33]+RC[34]+RC[35]+RC[36]+RC[37] -> 360000 | G39: =RC[17]+RC[18]++RC[19]+RC[20]+RC[21]+RC[38]+RC[39]+RC[41] -> 0 | H39: 0 | I39: 0 | J39: =RC[-2]+RC[-1] -> 0 | K39: 0 | L39: 0 | M39: 0 | N39: =RC[15]+RC[16]+RC[17]+RC[18]+RC[19]+RC[20] -> 0 | O39: 0 | P39: 0 | Q39: 360000 | R39: 0 | S39: 0 | T39: 0 | U39: 3600 | V39: 0 | W39: 356400 | X39: 0 | Y39: 0 | Z39: 0 | AA39: 0 | AB39: 0 | AC39: 0 | AD39: 0 | AE39: 0 | AF39: 0 | AG39: 0 | AH39: 0 | AI39: 360000 | AJ39: 0 | AK39: 0 | AL39: 0 | AM39: 0 | AN39: 0 | AO39: 0 | AP39: 0 | AQ39: 0 | AR39: =1 -> 1 | AS39: 0 | AT39: 0 | AU39: =RC[-30]-RC[-29]-RC[-28]-RC[-27]-RC[-26]-RC[-25] -> 356400 | AV39: 0 | AW39: =RC[1]-RC[2] -> 0 | AX39: 0 | AY39: 0 | AZ39: =RC[-46] -> 360000 | BA39: =RC[-46] -> 0 | BB39: =RC[-46] -> 0 | BC39: =RC[-46] -> 0 | BD39: =RC[-46] -> 0 | BE39: =RC[-46] -> 0 | BF39: =RC[-46] -> 0 | BG39: =RC[-46] -> 0 | BH39: =RC[-46] -> 0 | BI39: =RC[-46] -> 0 | BJ39: =RC[-46] -> 0 | BK39: =RC[-46] -> 360000 | BL39: =RC[-46] -> 0 | BM39: =RC[-46] -> 0 | BN39: =RC[-46] -> 0 | BO39: =RC[-46] -> 3600 | BP39: =RC[-46] -> 0 | BQ39: =RC[-46] -> 356400 | BR39: =RC[-46] -> 0 | BS39: =RC[-46] -> 0 | BT39: =RC[-46] -> 0 | BU39: =RC[-46] -> 0 | BV39: =RC[-46] -> 0 | BW39: =RC[-46] -> 0 | BX39: =RC[-46] -> 0 | BY39: =RC[-46] -> 0 | BZ39: =RC[-46] -> 0 | CA39: =RC[-46] -> 0 | CB39: =RC[-46] -> 0 | CC39: =RC[-46] -> 360000 | CD39: =RC[-46] -> 0 | CE39: =RC[-46] -> 0 | CF39: =RC[-46] -> 0 | CG39: =RC[-46] -> 0 | CH39: =RC[-46] -> 0 | CI39: =RC[-46] -> 0 | CJ39: =RC[-46] -> 0 | CK39: =RC[-46] -> 0 | CL39: =RC[-46] -> 1 | CM39: =RC[-46] -> 0 | CN39: =RC[-46] -> 0 | CO39: =RC[-46] -> 356400 | CP39: =RC[-46] -> 0 | CQ39: =RC[-46] -> 0 | CR39: =RC[-46] -> 0 | CS39: =RC[-46] -> 0
A40: 6 | B40: 013788 | C40: Nguyễn Thành Luân | D40: Nhân viên cân bằng trọng tải nhóm 1 | F40: =RC[29]+RC[30]+RC[31]+RC[32]+RC[33]+RC[34]+RC[35]+RC[36]+RC[37] -> 360000 | G40: =RC[17]+RC[18]++RC[19]+RC[20]+RC[21]+RC[38]+RC[39]+RC[41] -> 0 | H40: 0 | I40: 0 | J40: =RC[-2]+RC[-1] -> 0 | K40: 0 | L40: 0 | M40: 0 | N40: =RC[15]+RC[16]+RC[17]+RC[18]+RC[19]+RC[20] -> 0 | O40: 0 | P40: 0 | Q40: 360000 | R40: 0 | S40: 0 | T40: 0 | U40: 3600 | V40: 0 | W40: 356400 | X40: 0 | Y40: 0 | Z40: 0 | AA40: 0 | AB40: 0 | AC40: 0 | AD40: 0 | AE40: 0 | AF40: 0 | AG40: 0 | AH40: 0 | AI40: 360000 | AJ40: 0 | AK40: 0 | AL40: 0 | AM40: 0 | AN40: 0 | AO40: 0 | AP40: 0 | AQ40: 0 | AR40: =1 -> 1 | AS40: 0 | AT40: 0 | AU40: =RC[-30]-RC[-29]-RC[-28]-RC[-27]-RC[-26]-RC[-25] -> 356400 | AV40: 0 | AW40: =RC[1]-RC[2] -> 0 | AX40: 0 | AY40: 0 | AZ40: =RC[-46] -> 360000 | BA40: =RC[-46] -> 0 | BB40: =RC[-46] -> 0 | BC40: =RC[-46] -> 0 | BD40: =RC[-46] -> 0 | BE40: =RC[-46] -> 0 | BF40: =RC[-46] -> 0 | BG40: =RC[-46] -> 0 | BH40: =RC[-46] -> 0 | BI40: =RC[-46] -> 0 | BJ40: =RC[-46] -> 0 | BK40: =RC[-46] -> 360000 | BL40: =RC[-46] -> 0 | BM40: =RC[-46] -> 0 | BN40: =RC[-46] -> 0 | BO40: =RC[-46] -> 3600 | BP40: =RC[-46] -> 0 | BQ40: =RC[-46] -> 356400 | BR40: =RC[-46] -> 0 | BS40: =RC[-46] -> 0 | BT40: =RC[-46] -> 0 | BU40: =RC[-46] -> 0 | BV40: =RC[-46] -> 0 | BW40: =RC[-46] -> 0 | BX40: =RC[-46] -> 0 | BY40: =RC[-46] -> 0 | BZ40: =RC[-46] -> 0 | CA40: =RC[-46] -> 0 | CB40: =RC[-46] -> 0 | CC40: =RC[-46] -> 360000 | CD40: =RC[-46] -> 0 | CE40: =RC[-46] -> 0 | CF40: =RC[-46] -> 0 | CG40: =RC[-46] -> 0 | CH40: =RC[-46] -> 0 | CI40: =RC[-46] -> 0 | CJ40: =RC[-46] -> 0 | CK40: =RC[-46] -> 0 | CL40: =RC[-46] -> 1 | CM40: =RC[-46] -> 0 | CN40: =RC[-46] -> 0 | CO40: =RC[-46] -> 356400 | CP40: =RC[-46] -> 0 | CQ40: =RC[-46] -> 0 | CR40: =RC[-46] -> 0 | CS40: =RC[-46] -> 0
A41: 7 | B41: 013789 | C41: Nguyễn Mạnh Cường | D41: Nhân viên cân bằng trọng tải nhóm 1 | F41: =RC[29]+RC[30]+RC[31]+RC[32]+RC[33]+RC[34]+RC[35]+RC[36]+RC[37] -> 360000 | G41: =RC[17]+RC[18]++RC[19]+RC[20]+RC[21]+RC[38]+RC[39]+RC[41] -> 0 | H41: 0 | I41: 0 | J41: =RC[-2]+RC[-1] -> 0 | K41: 0 | L41: 0 | M41: 0 | N41: =RC[15]+RC[16]+RC[17]+RC[18]+RC[19]+RC[20] -> 0 | O41: 0 | P41: 0 | Q41: 360000 | R41: 0 | S41: 0 | T41: 0 | U41: 3600 | V41: 0 | W41: 356400 | X41: 0 | Y41: 0 | Z41: 0 | AA41: 0 | AB41: 0 | AC41: 0 | AD41: 0 | AE41: 0 | AF41: 0 | AG41: 0 | AH41: 0 | AI41: 360000 | AJ41: 0 | AK41: 0 | AL41: 0 | AM41: 0 | AN41: 0 | AO41: 0 | AP41: 0 | AQ41: 0 | AR41: =1 -> 1 | AS41: 0 | AT41: 0 | AU41: =RC[-30]-RC[-29]-RC[-28]-RC[-27]-RC[-26]-RC[-25] -> 356400 | AV41: 0 | AW41: =RC[1]-RC[2] -> 0 | AX41: 0 | AY41: 0 | AZ41: =RC[-46] -> 360000 | BA41: =RC[-46] -> 0 | BB41: =RC[-46] -> 0 | BC41: =RC[-46] -> 0 | BD41: =RC[-46] -> 0 | BE41: =RC[-46] -> 0 | BF41: =RC[-46] -> 0 | BG41: =RC[-46] -> 0 | BH41: =RC[-46] -> 0 | BI41: =RC[-46] -> 0 | BJ41: =RC[-46] -> 0 | BK41: =RC[-46] -> 360000 | BL41: =RC[-46] -> 0 | BM41: =RC[-46] -> 0 | BN41: =RC[-46] -> 0 | BO41: =RC[-46] -> 3600 | BP41: =RC[-46] -> 0 | BQ41: =RC[-46] -> 356400 | BR41: =RC[-46] -> 0 | BS41: =RC[-46] -> 0 | BT41: =RC[-46] -> 0 | BU41: =RC[-46] -> 0 | BV41: =RC[-46] -> 0 | BW41: =RC[-46] -> 0 | BX41: =RC[-46] -> 0 | BY41: =RC[-46] -> 0 | BZ41: =RC[-46] -> 0 | CA41: =RC[-46] -> 0 | CB41: =RC[-46] -> 0 | CC41: =RC[-46] -> 360000 | CD41: =RC[-46] -> 0 | CE41: =RC[-46] -> 0 | CF41: =RC[-46] -> 0 | CG41: =RC[-46] -> 0 | CH41: =RC[-46] -> 0 | CI41: =RC[-46] -> 0 | CJ41: =RC[-46] -> 0 | CK41: =RC[-46] -> 0 | CL41: =RC[-46] -> 1 | CM41: =RC[-46] -> 0 | CN41: =RC[-46] -> 0 | CO41: =RC[-46] -> 356400 | CP41: =RC[-46] -> 0 | CQ41: =RC[-46] -> 0 | CR41: =RC[-46] -> 0 | CS41: =RC[-46] -> 0
A42: 8 | B42: 013790 | C42: Trần Đức Hạnh | D42: Nhân viên cân bằng trọng tải nhóm 1 | F42: =RC[29]+RC[30]+RC[31]+RC[32]+RC[33]+RC[34]+RC[35]+RC[36]+RC[37] -> 360000 | G42: =RC[17]+RC[18]++RC[19]+RC[20]+RC[21]+RC[38]+RC[39]+RC[41] -> 0 | H42: 0 | I42: 0 | J42: =RC[-2]+RC[-1] -> 0 | K42: 0 | L42: 0 | M42: 0 | N42: =RC[15]+RC[16]+RC[17]+RC[18]+RC[19]+RC[20] -> 0 | O42: 0 | P42: 0 | Q42: 360000 | R42: 0 | S42: 0 | T42: 0 | U42: 3600 | V42: 0 | W42: 356400 | X42: 0 | Y42: 0 | Z42: 0 | AA42: 0 | AB42: 0 | AC42: 0 | AD42: 0 | AE42: 0 | AF42: 0 | AG42: 0 | AH42: 0 | AI42: 360000 | AJ42: 0 | AK42: 0 | AL42: 0 | AM42: 0 | AN42: 0 | AO42: 0 | AP42: 0 | AQ42: 0 | AR42: =1 -> 1 | AS42: 0 | AT42: 0 | AU42: =RC[-30]-RC[-29]-RC[-28]-RC[-27]-RC[-26]-RC[-25] -> 356400 | AV42: 0 | AW42: =RC[1]-RC[2] -> 0 | AX42: 0 | AY42: 0 | AZ42: =RC[-46] -> 360000 | BA42: =RC[-46] -> 0 | BB42: =RC[-46] -> 0 | BC42: =RC[-46] -> 0 | BD42: =RC[-46] -> 0 | BE42: =RC[-46] -> 0 | BF42: =RC[-46] -> 0 | BG42: =RC[-46] -> 0 | BH42: =RC[-46] -> 0 | BI42: =RC[-46] -> 0 | BJ42: =RC[-46] -> 0 | BK42: =RC[-46] -> 360000 | BL42: =RC[-46] -> 0 | BM42: =RC[-46] -> 0 | BN42: =RC[-46] -> 0 | BO42: =RC[-46] -> 3600 | BP42: =RC[-46] -> 0 | BQ42: =RC[-46] -> 356400 | BR42: =RC[-46] -> 0 | BS42: =RC[-46] -> 0 | BT42: =RC[-46] -> 0 | BU42: =RC[-46] -> 0 | BV42: =RC[-46] -> 0 | BW42: =RC[-46] -> 0 | BX42: =RC[-46] -> 0 | BY42: =RC[-46] -> 0 | BZ42: =RC[-46] -> 0 | CA42: =RC[-46] -> 0 | CB42: =RC[-46] -> 0 | CC42: =RC[-46] -> 360000 | CD42: =RC[-46] -> 0 | CE42: =RC[-46] -> 0 | CF42: =RC[-46] -> 0 | CG42: =RC[-46] -> 0 | CH42: =RC[-46] -> 0 | CI42: =RC[-46] -> 0 | CJ42: =RC[-46] -> 0 | CK42: =RC[-46] -> 0 | CL42: =RC[-46] -> 1 | CM42: =RC[-46] -> 0 | CN42: =RC[-46] -> 0 | CO42: =RC[-46] -> 356400 | CP42: =RC[-46] -> 0 | CQ42: =RC[-46] -> 0 | CR42: =RC[-46] -> 0 | CS42: =RC[-46] -> 0
A43: 9 | B43: 013791 | C43: Nguyễn Danh Huy | D43: Nhân viên cân bằng trọng tải nhóm 1 | F43: =RC[29]+RC[30]+RC[31]+RC[32]+RC[33]+RC[34]+RC[35]+RC[36]+RC[37] -> 360000 | G43: =RC[17]+RC[18]++RC[19]+RC[20]+RC[21]+RC[38]+RC[39]+RC[41] -> 0 | H43: 0 | I43: 0 | J43: =RC[-2]+RC[-1] -> 0 | K43: 0 | L43: 0 | M43: 0 | N43: =RC[15]+RC[16]+RC[17]+RC[18]+RC[19]+RC[20] -> 0 | O43: 0 | P43: 0 | Q43: 360000 | R43: 0 | S43: 0 | T43: 0 | U43: 3600 | V43: 0 | W43: 356400 | X43: 0 | Y43: 0 | Z43: 0 | AA43: 0 | AB43: 0 | AC43: 0 | AD43: 0 | AE43: 0 | AF43: 0 | AG43: 0 | AH43: 0 | AI43: 360000 | AJ43: 0 | AK43: 0 | AL43: 0 | AM43: 0 | AN43: 0 | AO43: 0 | AP43: 0 | AQ43: 0 | AR43: =1 -> 1 | AS43: 0 | AT43: 0 | AU43: =RC[-30]-RC[-29]-RC[-28]-RC[-27]-RC[-26]-RC[-25] -> 356400 | AV43: 0 | AW43: =RC[1]-RC[2] -> 0 | AX43: 0 | AY43: 0 | AZ43: =RC[-46] -> 360000 | BA43: =RC[-46] -> 0 | BB43: =RC[-46] -> 0 | BC43: =RC[-46] -> 0 | BD43: =RC[-46] -> 0 | BE43: =RC[-46] -> 0 | BF43: =RC[-46] -> 0 | BG43: =RC[-46] -> 0 | BH43: =RC[-46] -> 0 | BI43: =RC[-46] -> 0 | BJ43: =RC[-46] -> 0 | BK43: =RC[-46] -> 360000 | BL43: =RC[-46] -> 0 | BM43: =RC[-46] -> 0 | BN43: =RC[-46] -> 0 | BO43: =RC[-46] -> 3600 | BP43: =RC[-46] -> 0 | BQ43: =RC[-46] -> 356400 | BR43: =RC[-46] -> 0 | BS43: =RC[-46] -> 0 | BT43: =RC[-46] -> 0 | BU43: =RC[-46] -> 0 | BV43: =RC[-46] -> 0 | BW43: =RC[-46] -> 0 | BX43: =RC[-46] -> 0 | BY43: =RC[-46] -> 0 | BZ43: =RC[-46] -> 0 | CA43: =RC[-46] -> 0 | CB43: =RC[-46] -> 0 | CC43: =RC[-46] -> 360000 | CD43: =RC[-46] -> 0 | CE43: =RC[-46] -> 0 | CF43: =RC[-46] -> 0 | CG43: =RC[-46] -> 0 | CH43: =RC[-46] -> 0 | CI43: =RC[-46] -> 0 | CJ43: =RC[-46] -> 0 | CK43: =RC[-46] -> 0 | CL43: =RC[-46] -> 1 | CM43: =RC[-46] -> 0 | CN43: =RC[-46] -> 0 | CO43: =RC[-46] -> 356400 | CP43: =RC[-46] -> 0 | CQ43: =RC[-46] -> 0 | CR43: =RC[-46] -> 0 | CS43: =RC[-46] -> 0
A44: 10 | B44: 013792 | C44: Lê Xuân Điệp | D44: Nhân viên cân bằng trọng tải nhóm 1 | F44: =RC[29]+RC[30]+RC[31]+RC[32]+RC[33]+RC[34]+RC[35]+RC[36]+RC[37] -> 360000 | G44: =RC[17]+RC[18]++RC[19]+RC[20]+RC[21]+RC[38]+RC[39]+RC[41] -> 0 | H44: 0 | I44: 0 | J44: =RC[-2]+RC[-1] -> 0 | K44: 0 | L44: 0 | M44: 0 | N44: =RC[15]+RC[16]+RC[17]+RC[18]+RC[19]+RC[20] -> 0 | O44: 0 | P44: 0 | Q44: 360000 | R44: 0 | S44: 0 | T44: 0 | U44: 3600 | V44: 0 | W44: 356400 | X44: 0 | Y44: 0 | Z44: 0 | AA44: 0 | AB44: 0 | AC44: 0 | AD44: 0 | AE44: 0 | AF44: 0 | AG44: 0 | AH44: 0 | AI44: 360000 | AJ44: 0 | AK44: 0 | AL44: 0 | AM44: 0 | AN44: 0 | AO44: 0 | AP44: 0 | AQ44: 0 | AR44: =1 -> 1 | AS44: 0 | AT44: 0 | AU44: =RC[-30]-RC[-29]-RC[-28]-RC[-27]-RC[-26]-RC[-25] -> 356400 | AV44: 0 | AW44: =RC[1]-RC[2] -> 0 | AX44: 0 | AY44: 0 | AZ44: =RC[-46] -> 360000 | BA44: =RC[-46] -> 0 | BB44: =RC[-46] -> 0 | BC44: =RC[-46] -> 0 | BD44: =RC[-46] -> 0 | BE44: =RC[-46] -> 0 | BF44: =RC[-46] -> 0 | BG44: =RC[-46] -> 0 | BH44: =RC[-46] -> 0 | BI44: =RC[-46] -> 0 | BJ44: =RC[-46] -> 0 | BK44: =RC[-46] -> 360000 | BL44: =RC[-46] -> 0 | BM44: =RC[-46] -> 0 | BN44: =RC[-46] -> 0 | BO44: =RC[-46] -> 3600 | BP44: =RC[-46] -> 0 | BQ44: =RC[-46] -> 356400 | BR44: =RC[-46] -> 0 | BS44: =RC[-46] -> 0 | BT44: =RC[-46] -> 0 | BU44: =RC[-46] -> 0 | BV44: =RC[-46] -> 0 | BW44: =RC[-46] -> 0 | BX44: =RC[-46] -> 0 | BY44: =RC[-46] -> 0 | BZ44: =RC[-46] -> 0 | CA44: =RC[-46] -> 0 | CB44: =RC[-46] -> 0 | CC44: =RC[-46] -> 360000 | CD44: =RC[-46] -> 0 | CE44: =RC[-46] -> 0 | CF44: =RC[-46] -> 0 | CG44: =RC[-46] -> 0 | CH44: =RC[-46] -> 0 | CI44: =RC[-46] -> 0 | CJ44: =RC[-46] -> 0 | CK44: =RC[-46] -> 0 | CL44: =RC[-46] -> 1 | CM44: =RC[-46] -> 0 | CN44: =RC[-46] -> 0 | CO44: =RC[-46] -> 356400 | CP44: =RC[-46] -> 0 | CQ44: =RC[-46] -> 0 | CR44: =RC[-46] -> 0 | CS44: =RC[-46] -> 0
A45: 11 | B45: 013793 | C45: Trần Hoàng Kiên | D45: Nhân viên cân bằng trọng tải nhóm 1 | F45: =RC[29]+RC[30]+RC[31]+RC[32]+RC[33]+RC[34]+RC[35]+RC[36]+RC[37] -> 360000 | G45: =RC[17]+RC[18]++RC[19]+RC[20]+RC[21]+RC[38]+RC[39]+RC[41] -> 0 | H45: 0 | I45: 0 | J45: =RC[-2]+RC[-1] -> 0 | K45: 0 | L45: 0 | M45: 0 | N45: =RC[15]+RC[16]+RC[17]+RC[18]+RC[19]+RC[20] -> 0 | O45: 0 | P45: 0 | Q45: 360000 | R45: 0 | S45: 0 | T45: 0 | U45: 3600 | V45: 0 | W45: 356400 | X45: 0 | Y45: 0 | Z45: 0 | AA45: 0 | AB45: 0 | AC45: 0 | AD45: 0 | AE45: 0 | AF45: 0 | AG45: 0 | AH45: 0 | AI45: 360000 | AJ45: 0 | AK45: 0 | AL45: 0 | AM45: 0 | AN45: 0 | AO45: 0 | AP45: 0 | AQ45: 0 | AR45: =1 -> 1 | AS45: 0 | AT45: 0 | AU45: =RC[-30]-RC[-29]-RC[-28]-RC[-27]-RC[-26]-RC[-25] -> 356400 | AV45: 0 | AW45: =RC[1]-RC[2] -> 0 | AX45: 0 | AY45: 0 | AZ45: =RC[-46] -> 360000 | BA45: =RC[-46] -> 0 | BB45: =RC[-46] -> 0 | BC45: =RC[-46] -> 0 | BD45: =RC[-46] -> 0 | BE45: =RC[-46] -> 0 | BF45: =RC[-46] -> 0 | BG45: =RC[-46] -> 0 | BH45: =RC[-46] -> 0 | BI45: =RC[-46] -> 0 | BJ45: =RC[-46] -> 0 | BK45: =RC[-46] -> 360000 | BL45: =RC[-46] -> 0 | BM45: =RC[-46] -> 0 | BN45: =RC[-46] -> 0 | BO45: =RC[-46] -> 3600 | BP45: =RC[-46] -> 0 | BQ45: =RC[-46] -> 356400 | BR45: =RC[-46] -> 0 | BS45: =RC[-46] -> 0 | BT45: =RC[-46] -> 0 | BU45: =RC[-46] -> 0 | BV45: =RC[-46] -> 0 | BW45: =RC[-46] -> 0 | BX45: =RC[-46] -> 0 | BY45: =RC[-46] -> 0 | BZ45: =RC[-46] -> 0 | CA45: =RC[-46] -> 0 | CB45: =RC[-46] -> 0 | CC45: =RC[-46] -> 360000 | CD45: =RC[-46] -> 0 | CE45: =RC[-46] -> 0 | CF45: =RC[-46] -> 0 | CG45: =RC[-46] -> 0 | CH45: =RC[-46] -> 0 | CI45: =RC[-46] -> 0 | CJ45: =RC[-46] -> 0 | CK45: =RC[-46] -> 0 | CL45: =RC[-46] -> 1 | CM45: =RC[-46] -> 0 | CN45: =RC[-46] -> 0 | CO45: =RC[-46] -> 356400 | CP45: =RC[-46] -> 0 | CQ45: =RC[-46] -> 0 | CR45: =RC[-46] -> 0 | CS45: =RC[-46] -> 0
A46: 12 | B46: 013794 | C46: Đặng Lê Minh | D46: Nhân viên cân bằng trọng tải nhóm 1 | F46: =RC[29]+RC[30]+RC[31]+RC[32]+RC[33]+RC[34]+RC[35]+RC[36]+RC[37] -> 360000 | G46: =RC[17]+RC[18]++RC[19]+RC[20]+RC[21]+RC[38]+RC[39]+RC[41] -> 0 | H46: 0 | I46: 0 | J46: =RC[-2]+RC[-1] -> 0 | K46: 0 | L46: 0 | M46: 0 | N46: =RC[15]+RC[16]+RC[17]+RC[18]+RC[19]+RC[20] -> 0 | O46: 0 | P46: 0 | Q46: 360000 | R46: 0 | S46: 0 | T46: 0 | U46: 3600 | V46: 0 | W46: 356400 | X46: 0 | Y46: 0 | Z46: 0 | AA46: 0 | AB46: 0 | AC46: 0 | AD46: 0 | AE46: 0 | AF46: 0 | AG46: 0 | AH46: 0 | AI46: 360000 | AJ46: 0 | AK46: 0 | AL46: 0 | AM46: 0 | AN46: 0 | AO46: 0 | AP46: 0 | AQ46: 0 | AR46: =1 -> 1 | AS46: 0 | AT46: 0 | AU46: =RC[-30]-RC[-29]-RC[-28]-RC[-27]-RC[-26]-RC[-25] -> 356400 | AV46: 0 | AW46: =RC[1]-RC[2] -> 0 | AX46: 0 | AY46: 0 | AZ46: =RC[-46] -> 360000 | BA46: =RC[-46] -> 0 | BB46: =RC[-46] -> 0 | BC46: =RC[-46] -> 0 | BD46: =RC[-46] -> 0 | BE46: =RC[-46] -> 0 | BF46: =RC[-46] -> 0 | BG46: =RC[-46] -> 0 | BH46: =RC[-46] -> 0 | BI46: =RC[-46] -> 0 | BJ46: =RC[-46] -> 0 | BK46: =RC[-46] -> 360000 | BL46: =RC[-46] -> 0 | BM46: =RC[-46] -> 0 | BN46: =RC[-46] -> 0 | BO46: =RC[-46] -> 3600 | BP46: =RC[-46] -> 0 | BQ46: =RC[-46] -> 356400 | BR46: =RC[-46] -> 0 | BS46: =RC[-46] -> 0 | BT46: =RC[-46] -> 0 | BU46: =RC[-46] -> 0 | BV46: =RC[-46] -> 0 | BW46: =RC[-46] -> 0 | BX46: =RC[-46] -> 0 | BY46: =RC[-46] -> 0 | BZ46: =RC[-46] -> 0 | CA46: =RC[-46] -> 0 | CB46: =RC[-46] -> 0 | CC46: =RC[-46] -> 360000 | CD46: =RC[-46] -> 0 | CE46: =RC[-46] -> 0 | CF46: =RC[-46] -> 0 | CG46: =RC[-46] -> 0 | CH46: =RC[-46] -> 0 | CI46: =RC[-46] -> 0 | CJ46: =RC[-46] -> 0 | CK46: =RC[-46] -> 0 | CL46: =RC[-46] -> 1 | CM46: =RC[-46] -> 0 | CN46: =RC[-46] -> 0 | CO46: =RC[-46] -> 356400 | CP46: =RC[-46] -> 0 | CQ46: =RC[-46] -> 0 | CR46: =RC[-46] -> 0 | CS46: =RC[-46] -> 0
F47: =SUM(R[-12]C:R[-1]C) -> 4320000 | G47: =SUM(R[-12]C:R[-1]C) -> 0 | H47: =SUM(R[-12]C:R[-1]C) -> 0 | I47: =SUM(R[-12]C:R[-1]C) -> 0 | J47: =SUM(R[-12]C:R[-1]C) -> 0 | K47: =SUM(R[-12]C:R[-1]C) -> 0 | L47: =SUM(R[-12]C:R[-1]C) -> 0 | M47: =SUM(R[-12]C:R[-1]C) -> 0 | N47: =SUM(R[-12]C:R[-1]C) -> 0 | O47: =SUM(R[-12]C:R[-1]C) -> 0 | P47: =SUM(R[-12]C:R[-1]C) -> 0 | Q47: =SUM(R[-12]C:R[-1]C) -> 4320000 | R47: =SUM(R[-12]C:R[-1]C) -> 0 | S47: =SUM(R[-12]C:R[-1]C) -> 0 | T47: =SUM(R[-12]C:R[-1]C) -> 0 | U47: =SUM(R[-12]C:R[-1]C) -> 43200 | V47: =SUM(R[-12]C:R[-1]C) -> 0 | W47: =SUM(R[-12]C:R[-1]C) -> 4276800 | X47: =SUM(R[-12]C:R[-1]C) -> 0 | Y47: =SUM(R[-12]C:R[-1]C) -> 0 | Z47: =SUM(R[-12]C:R[-1]C) -> 0 | AA47: =SUM(R[-12]C:R[-1]C) -> 0 | AB47: =SUM(R[-12]C:R[-1]C) -> 0 | AC47: =SUM(R[-12]C:R[-1]C) -> 0 | AD47: =SUM(R[-12]C:R[-1]C) -> 0 | AE47: =SUM(R[-12]C:R[-1]C) -> 0 | AF47: =SUM(R[-12]C:R[-1]C) -> 0 | AG47: =SUM(R[-12]C:R[-1]C) -> 0 | AH47: =SUM(R[-12]C:R[-1]C) -> 0 | AI47: =SUM(R[-12]C:R[-1]C) -> 4320000 | AJ47: =SUM(R[-12]C:R[-1]C) -> 0 | AK47: =SUM(R[-12]C:R[-1]C) -> 0 | AL47: =SUM(R[-12]C:R[-1]C) -> 0 | AM47: =SUM(R[-12]C:R[-1]C) -> 0 | AN47: =SUM(R[-12]C:R[-1]C) -> 0 | AO47: =SUM(R[-12]C:R[-1]C) -> 0 | AP47: =SUM(R[-12]C:R[-1]C) -> 0 | AQ47: =SUM(R[-12]C:R[-1]C) -> 0 | AR47: =SUM(R[-12]C:R[-1]C) -> 12 | AS47: =SUM(R[-12]C:R[-1]C) -> 0 | AT47: =SUM(R[-12]C:R[-1]C) -> 0 | AU47: =SUM(R[-12]C:R[-1]C) -> 4276800 | AV47: =SUM(R[-12]C:R[-1]C) -> 0 | AW47: =SUM(R[-12]C:R[-1]C) -> 0 | AX47: =SUM(R[-12]C:R[-1]C) -> 0 | AY47: =SUM(R[-12]C:R[-1]C) -> 0
A48: Phòng Điều hành, tài liệu và hướng dẫn chất xếp (HGS) | F48: =SUM(R[-14]C[46]:R[-1]C[46]) -> 4320000 | G48: =SUM(R[-14]C[46]:R[-1]C[46]) -> 0 | H48: =SUM(R[-14]C[46]:R[-1]C[46]) -> 0 | I48: =SUM(R[-14]C[46]:R[-1]C[46]) -> 0 | J48: =SUM(R[-14]C[46]:R[-1]C[46]) -> 0 | K48: =SUM(R[-14]C[46]:R[-1]C[46]) -> 0 | L48: =SUM(R[-14]C[46]:R[-1]C[46]) -> 0 | M48: =SUM(R[-14]C[46]:R[-1]C[46]) -> 0 | N48: =SUM(R[-14]C[46]:R[-1]C[46]) -> 0 | O48: =SUM(R[-14]C[46]:R[-1]C[46]) -> 0 | P48: =SUM(R[-14]C[46]:R[-1]C[46]) -> 0 | Q48: =SUM(R[-14]C[46]:R[-1]C[46]) -> 4320000 | R48: =SUM(R[-14]C[46]:R[-1]C[46]) -> 0 | S48: =SUM(R[-14]C[46]:R[-1]C[46]) -> 0 | T48: =SUM(R[-14]C[46]:R[-1]C[46]) -> 0 | U48: =SUM(R[-14]C[46]:R[-1]C[46]) -> 43200 | V48: =SUM(R[-14]C[46]:R[-1]C[46]) -> 0 | W48: =SUM(R[-14]C[46]:R[-1]C[46]) -> 4276800 | X48: =SUM(R[-14]C[46]:R[-1]C[46]) -> 0 | Y48: =SUM(R[-14]C[46]:R[-1]C[46]) -> 0 | Z48: =SUM(R[-14]C[46]:R[-1]C[46]) -> 0 | AA48: =SUM(R[-14]C[46]:R[-1]C[46]) -> 0 | AB48: =SUM(R[-14]C[46]:R[-1]C[46]) -> 0 | AC48: =SUM(R[-14]C[46]:R[-1]C[46]) -> 0 | AD48: =SUM(R[-14]C[46]:R[-1]C[46]) -> 0 | AE48: =SUM(R[-14]C[46]:R[-1]C[46]) -> 0 | AF48: =SUM(R[-14]C[46]:R[-1]C[46]) -> 0 | AG48: =SUM(R[-14]C[46]:R[-1]C[46]) -> 0 | AH48: =SUM(R[-14]C[46]:R[-1]C[46]) -> 0 | AI48: =SUM(R[-14]C[46]:R[-1]C[46]) -> 4320000 | AJ48: =SUM(R[-14]C[46]:R[-1]C[46]) -> 0 | AK48: =SUM(R[-14]C[46]:R[-1]C[46]) -> 0 | AL48: =SUM(R[-14]C[46]:R[-1]C[46]) -> 0 | AM48: =SUM(R[-14]C[46]:R[-1]C[46]) -> 0 | AN48: =SUM(R[-14]C[46]:R[-1]C[46]) -> 0 | AO48: =SUM(R[-14]C[46]:R[-1]C[46]) -> 0 | AP48: =SUM(R[-14]C[46]:R[-1]C[46]) -> 0 | AQ48: =SUM(R[-14]C[46]:R[-1]C[46]) -> 0 | AR48: =SUM(R[-14]C[46]:R[-1]C[46]) -> 12 | AS48: =SUM(R[-14]C[46]:R[-1]C[46]) -> 0 | AT48: =SUM(R[-14]C[46]:R[-1]C[46]) -> 0 | AU48: =SUM(R[-14]C[46]:R[-1]C[46]) -> 4276800 | AV48: =SUM(R[-14]C[46]:R[-1]C[46]) -> 0 | AW48: =SUM(R[-14]C[46]:R[-1]C[46]) -> 0 | AX48: =SUM(R[-14]C[46]:R[-1]C[46]) -> 0 | AY48: =SUM(R[-14]C[46]:R[-1]C[46]) -> 0
A49: Phòng Phục vụ hành khách (HGS) | F49: =R[28]C -> 9000000 | G49: =R[28]C -> 0 | H49: =R[28]C -> 0 | I49: =R[28]C -> 0 | J49: =R[28]C -> 0 | K49: =R[28]C -> 0 | L49: =R[28]C -> 0 | M49: =R[28]C -> 0 | N49: =R[28]C -> 0 | O49: =R[28]C -> 0 | P49: =R[28]C -> 0 | Q49: =R[28]C -> 9000000 | R49: =R[28]C -> 0 | S49: =R[28]C -> 0 | T49: =R[28]C -> 0 | U49: =R[28]C -> 90000 | V49: =R[28]C -> 0 | W49: =R[28]C -> 8910000 | X49: =R[28]C -> 0 | Y49: =R[28]C -> 0 | Z49: =R[28]C -> 0 | AA49: =R[28]C -> 0 | AB49: =R[28]C -> 0 | AC49: =R[28]C -> 0 | AD49: =R[28]C -> 0 | AE49: =R[28]C -> 0 | AF49: =R[28]C -> 0 | AG49: =R[28]C -> 0 | AH49: =R[28]C -> 0 | AI49: =R[28]C -> 9000000 | AJ49: =R[28]C -> 0 | AK49: =R[28]C -> 0 | AL49: =R[28]C -> 0 | AM49: =R[28]C -> 0 | AN49: =R[28]C -> 0 | AO49: =R[28]C -> 0 | AP49: =R[28]C -> 0 | AQ49: =R[28]C -> 0 | AR49: =R[28]C -> 25 | AS49: =R[28]C -> 0 | AT49: =R[28]C -> 0 | AU49: =R[28]C -> 8910000 | AW49: =R[28]C -> 0 | AX49: =R[28]C -> 0 | AY49: =R[28]C -> 0
F50: =R[26]C -> 9000000 | G50: =R[26]C -> 0 | H50: =R[26]C -> 0 | I50: =R[26]C -> 0 | J50: =R[26]C -> 0 | K50: =R[26]C -> 0 | L50: =R[26]C -> 0 | M50: =R[26]C -> 0 | N50: =R[26]C -> 0 | O50: =R[26]C -> 0 | P50: =R[26]C -> 0 | Q50: =R[26]C -> 9000000 | R50: =R[26]C -> 0 | S50: =R[26]C -> 0 | T50: =R[26]C -> 0 | U50: =R[26]C -> 90000 | V50: =R[26]C -> 0 | W50: =R[26]C -> 8910000 | X50: =R[26]C -> 0 | Y50: =R[26]C -> 0 | Z50: =R[26]C -> 0 | AA50: =R[26]C -> 0 | AB50: =R[26]C -> 0 | AC50: =R[26]C -> 0 | AD50: =R[26]C -> 0 | AE50: =R[26]C -> 0 | AF50: =R[26]C -> 0 | AG50: =R[26]C -> 0 | AH50: =R[26]C -> 0 | AI50: =R[26]C -> 9000000 | AJ50: =R[26]C -> 0 | AK50: =R[26]C -> 0 | AL50: =R[26]C -> 0 | AM50: =R[26]C -> 0 | AN50: =R[26]C -> 0 | AO50: =R[26]C -> 0 | AP50: =R[26]C -> 0 | AQ50: =R[26]C -> 0 | AR50: =R[26]C -> 25 | AS50: =R[26]C -> 0 | AT50: =R[26]C -> 0 | AU50: =R[26]C -> 8910000 | AW50: =R[26]C -> 0 | AX50: =R[26]C -> 0 | AY50: =R[26]C -> 0
A51: 1 | B51: 013753 | C51: Phan Thanh Hà | D51: Nhân viên phục vụ hành khách hàng hóa | F51: =RC[29]+RC[30]+RC[31]+RC[32]+RC[33]+RC[34]+RC[35]+RC[36]+RC[37] -> 360000 | G51: =RC[17]+RC[18]++RC[19]+RC[20]+RC[21]+RC[38]+RC[39]+RC[41] -> 0 | H51: 0 | I51: 0 | J51: =RC[-2]+RC[-1] -> 0 | K51: 0 | L51: 0 | M51: 0 | N51: =RC[15]+RC[16]+RC[17]+RC[18]+RC[19]+RC[20] -> 0 | O51: 0 | P51: 0 | Q51: 360000 | R51: 0 | S51: 0 | T51: 0 | U51: 3600 | V51: 0 | W51: 356400 | X51: 0 | Y51: 0 | Z51: 0 | AA51: 0 | AB51: 0 | AC51: 0 | AD51: 0 | AE51: 0 | AF51: 0 | AG51: 0 | AH51: 0 | AI51: 360000 | AJ51: 0 | AK51: 0 | AL51: 0 | AM51: 0 | AN51: 0 | AO51: 0 | AP51: 0 | AQ51: 0 | AR51: =1 -> 1 | AS51: 0 | AT51: 0 | AU51: =RC[-30]-RC[-29]-RC[-28]-RC[-27]-RC[-26]-RC[-25] -> 356400 | AV51: 0 | AW51: =RC[1]-RC[2] -> 0 | AX51: 0 | AY51: 0 | AZ51: =RC[-46] -> 360000 | BA51: =RC[-46] -> 0 | BB51: =RC[-46] -> 0 | BC51: =RC[-46] -> 0 | BD51: =RC[-46] -> 0 | BE51: =RC[-46] -> 0 | BF51: =RC[-46] -> 0 | BG51: =RC[-46] -> 0 | BH51: =RC[-46] -> 0 | BI51: =RC[-46] -> 0 | BJ51: =RC[-46] -> 0 | BK51: =RC[-46] -> 360000 | BL51: =RC[-46] -> 0 | BM51: =RC[-46] -> 0 | BN51: =RC[-46] -> 0 | BO51: =RC[-46] -> 3600 | BP51: =RC[-46] -> 0 | BQ51: =RC[-46] -> 356400 | BR51: =RC[-46] -> 0 | BS51: =RC[-46] -> 0 | BT51: =RC[-46] -> 0 | BU51: =RC[-46] -> 0 | BV51: =RC[-46] -> 0 | BW51: =RC[-46] -> 0 | BX51: =RC[-46] -> 0 | BY51: =RC[-46] -> 0 | BZ51: =RC[-46] -> 0 | CA51: =RC[-46] -> 0 | CB51: =RC[-46] -> 0 | CC51: =RC[-46] -> 360000 | CD51: =RC[-46] -> 0 | CE51: =RC[-46] -> 0 | CF51: =RC[-46] -> 0 | CG51: =RC[-46] -> 0 | CH51: =RC[-46] -> 0 | CI51: =RC[-46] -> 0 | CJ51: =RC[-46] -> 0 | CK51: =RC[-46] -> 0 | CL51: =RC[-46] -> 1 | CM51: =RC[-46] -> 0 | CN51: =RC[-46] -> 0 | CO51: =RC[-46] -> 356400 | CP51: =RC[-46] -> 0 | CQ51: =RC[-46] -> 0 | CR51: =RC[-46] -> 0 | CS51: =RC[-46] -> 0
A52: 2 | B52: 013758 | C52: Trần Vân Anh | D52: Nhân viên phục vụ hành khách hàng hóa | F52: =RC[29]+RC[30]+RC[31]+RC[32]+RC[33]+RC[34]+RC[35]+RC[36]+RC[37] -> 360000 | G52: =RC[17]+RC[18]++RC[19]+RC[20]+RC[21]+RC[38]+RC[39]+RC[41] -> 0 | H52: 0 | I52: 0 | J52: =RC[-2]+RC[-1] -> 0 | K52: 0 | L52: 0 | M52: 0 | N52: =RC[15]+RC[16]+RC[17]+RC[18]+RC[19]+RC[20] -> 0 | O52: 0 | P52: 0 | Q52: 360000 | R52: 0 | S52: 0 | T52: 0 | U52: 3600 | V52: 0 | W52: 356400 | X52: 0 | Y52: 0 | Z52: 0 | AA52: 0 | AB52: 0 | AC52: 0 | AD52: 0 | AE52: 0 | AF52: 0 | AG52: 0 | AH52: 0 | AI52: 360000 | AJ52: 0 | AK52: 0 | AL52: 0 | AM52: 0 | AN52: 0 | AO52: 0 | AP52: 0 | AQ52: 0 | AR52: =1 -> 1 | AS52: 0 | AT52: 0 | AU52: =RC[-30]-RC[-29]-RC[-28]-RC[-27]-RC[-26]-RC[-25] -> 356400 | AV52: 0 | AW52: =RC[1]-RC[2] -> 0 | AX52: 0 | AY52: 0 | AZ52: =RC[-46] -> 360000 | BA52: =RC[-46] -> 0 | BB52: =RC[-46] -> 0 | BC52: =RC[-46] -> 0 | BD52: =RC[-46] -> 0 | BE52: =RC[-46] -> 0 | BF52: =RC[-46] -> 0 | BG52: =RC[-46] -> 0 | BH52: =RC[-46] -> 0 | BI52: =RC[-46] -> 0 | BJ52: =RC[-46] -> 0 | BK52: =RC[-46] -> 360000 | BL52: =RC[-46] -> 0 | BM52: =RC[-46] -> 0 | BN52: =RC[-46] -> 0 | BO52: =RC[-46] -> 3600 | BP52: =RC[-46] -> 0 | BQ52: =RC[-46] -> 356400 | BR52: =RC[-46] -> 0 | BS52: =RC[-46] -> 0 | BT52: =RC[-46] -> 0 | BU52: =RC[-46] -> 0 | BV52: =RC[-46] -> 0 | BW52: =RC[-46] -> 0 | BX52: =RC[-46] -> 0 | BY52: =RC[-46] -> 0 | BZ52: =RC[-46] -> 0 | CA52: =RC[-46] -> 0 | CB52: =RC[-46] -> 0 | CC52: =RC[-46] -> 360000 | CD52: =RC[-46] -> 0 | CE52: =RC[-46] -> 0 | CF52: =RC[-46] -> 0 | CG52: =RC[-46] -> 0 | CH52: =RC[-46] -> 0 | CI52: =RC[-46] -> 0 | CJ52: =RC[-46] -> 0 | CK52: =RC[-46] -> 0 | CL52: =RC[-46] -> 1 | CM52: =RC[-46] -> 0 | CN52: =RC[-46] -> 0 | CO52: =RC[-46] -> 356400 | CP52: =RC[-46] -> 0 | CQ52: =RC[-46] -> 0 | CR52: =RC[-46] -> 0 | CS52: =RC[-46] -> 0
A53: 3 | B53: 013759 | C53: Nguyễn Thị Thanh Loan | D53: Nhân viên phục vụ hành khách hàng hóa | F53: =RC[29]+RC[30]+RC[31]+RC[32]+RC[33]+RC[34]+RC[35]+RC[36]+RC[37] -> 360000 | G53: =RC[17]+RC[18]++RC[19]+RC[20]+RC[21]+RC[38]+RC[39]+RC[41] -> 0 | H53: 0 | I53: 0 | J53: =RC[-2]+RC[-1] -> 0 | K53: 0 | L53: 0 | M53: 0 | N53: =RC[15]+RC[16]+RC[17]+RC[18]+RC[19]+RC[20] -> 0 | O53: 0 | P53: 0 | Q53: 360000 | R53: 0 | S53: 0 | T53: 0 | U53: 3600 | V53: 0 | W53: 356400 | X53: 0 | Y53: 0 | Z53: 0 | AA53: 0 | AB53: 0 | AC53: 0 | AD53: 0 | AE53: 0 | AF53: 0 | AG53: 0 | AH53: 0 | AI53: 360000 | AJ53: 0 | AK53: 0 | AL53: 0 | AM53: 0 | AN53: 0 | AO53: 0 | AP53: 0 | AQ53: 0 | AR53: =1 -> 1 | AS53: 0 | AT53: 0 | AU53: =RC[-30]-RC[-29]-RC[-28]-RC[-27]-RC[-26]-RC[-25] -> 356400 | AV53: 0 | AW53: =RC[1]-RC[2] -> 0 | AX53: 0 | AY53: 0 | AZ53: =RC[-46] -> 360000 | BA53: =RC[-46] -> 0 | BB53: =RC[-46] -> 0 | BC53: =RC[-46] -> 0 | BD53: =RC[-46] -> 0 | BE53: =RC[-46] -> 0 | BF53: =RC[-46] -> 0 | BG53: =RC[-46] -> 0 | BH53: =RC[-46] -> 0 | BI53: =RC[-46] -> 0 | BJ53: =RC[-46] -> 0 | BK53: =RC[-46] -> 360000 | BL53: =RC[-46] -> 0 | BM53: =RC[-46] -> 0 | BN53: =RC[-46] -> 0 | BO53: =RC[-46] -> 3600 | BP53: =RC[-46] -> 0 | BQ53: =RC[-46] -> 356400 | BR53: =RC[-46] -> 0 | BS53: =RC[-46] -> 0 | BT53: =RC[-46] -> 0 | BU53: =RC[-46] -> 0 | BV53: =RC[-46] -> 0 | BW53: =RC[-46] -> 0 | BX53: =RC[-46] -> 0 | BY53: =RC[-46] -> 0 | BZ53: =RC[-46] -> 0 | CA53: =RC[-46] -> 0 | CB53: =RC[-46] -> 0 | CC53: =RC[-46] -> 360000 | CD53: =RC[-46] -> 0 | CE53: =RC[-46] -> 0 | CF53: =RC[-46] -> 0 | CG53: =RC[-46] -> 0 | CH53: =RC[-46] -> 0 | CI53: =RC[-46] -> 0 | CJ53: =RC[-46] -> 0 | CK53: =RC[-46] -> 0 | CL53: =RC[-46] -> 1 | CM53: =RC[-46] -> 0 | CN53: =RC[-46] -> 0 | CO53: =RC[-46] -> 356400 | CP53: =RC[-46] -> 0 | CQ53: =RC[-46] -> 0 | CR53: =RC[-46] -> 0 | CS53: =RC[-46] -> 0
A54: 4 | B54: 013760 | C54: Trần Thùy Trang | D54: Nhân viên phục vụ hành khách hàng hóa | F54: =RC[29]+RC[30]+RC[31]+RC[32]+RC[33]+RC[34]+RC[35]+RC[36]+RC[37] -> 360000 | G54: =RC[17]+RC[18]++RC[19]+RC[20]+RC[21]+RC[38]+RC[39]+RC[41] -> 0 | H54: 0 | I54: 0 | J54: =RC[-2]+RC[-1] -> 0 | K54: 0 | L54: 0 | M54: 0 | N54: =RC[15]+RC[16]+RC[17]+RC[18]+RC[19]+RC[20] -> 0 | O54: 0 | P54: 0 | Q54: 360000 | R54: 0 | S54: 0 | T54: 0 | U54: 3600 | V54: 0 | W54: 356400 | X54: 0 | Y54: 0 | Z54: 0 | AA54: 0 | AB54: 0 | AC54: 0 | AD54: 0 | AE54: 0 | AF54: 0 | AG54: 0 | AH54: 0 | AI54: 360000 | AJ54: 0 | AK54: 0 | AL54: 0 | AM54: 0 | AN54: 0 | AO54: 0 | AP54: 0 | AQ54: 0 | AR54: =1 -> 1 | AS54: 0 | AT54: 0 | AU54: =RC[-30]-RC[-29]-RC[-28]-RC[-27]-RC[-26]-RC[-25] -> 356400 | AV54: 0 | AW54: =RC[1]-RC[2] -> 0 | AX54: 0 | AY54: 0 | AZ54: =RC[-46] -> 360000 | BA54: =RC[-46] -> 0 | BB54: =RC[-46] -> 0 | BC54: =RC[-46] -> 0 | BD54: =RC[-46] -> 0 | BE54: =RC[-46] -> 0 | BF54: =RC[-46] -> 0 | BG54: =RC[-46] -> 0 | BH54: =RC[-46] -> 0 | BI54: =RC[-46] -> 0 | BJ54: =RC[-46] -> 0 | BK54: =RC[-46] -> 360000 | BL54: =RC[-46] -> 0 | BM54: =RC[-46] -> 0 | BN54: =RC[-46] -> 0 | BO54: =RC[-46] -> 3600 | BP54: =RC[-46] -> 0 | BQ54: =RC[-46] -> 356400 | BR54: =RC[-46] -> 0 | BS54: =RC[-46] -> 0 | BT54: =RC[-46] -> 0 | BU54: =RC[-46] -> 0 | BV54: =RC[-46] -> 0 | BW54: =RC[-46] -> 0 | BX54: =RC[-46] -> 0 | BY54: =RC[-46] -> 0 | BZ54: =RC[-46] -> 0 | CA54: =RC[-46] -> 0 | CB54: =RC[-46] -> 0 | CC54: =RC[-46] -> 360000 | CD54: =RC[-46] -> 0 | CE54: =RC[-46] -> 0 | CF54: =RC[-46] -> 0 | CG54: =RC[-46] -> 0 | CH54: =RC[-46] -> 0 | CI54: =RC[-46] -> 0 | CJ54: =RC[-46] -> 0 | CK54: =RC[-46] -> 0 | CL54: =RC[-46] -> 1 | CM54: =RC[-46] -> 0 | CN54: =RC[-46] -> 0 | CO54: =RC[-46] -> 356400 | CP54: =RC[-46] -> 0 | CQ54: =RC[-46] -> 0 | CR54: =RC[-46] -> 0 | CS54: =RC[-46] -> 0
A55: 5 | B55: 013762 | C55: Bùi Thị Út | D55: Nhân viên phục vụ hành khách hàng hóa | F55: =RC[29]+RC[30]+RC[31]+RC[32]+RC[33]+RC[34]+RC[35]+RC[36]+RC[37] -> 360000 | G55: =RC[17]+RC[18]++RC[19]+RC[20]+RC[21]+RC[38]+RC[39]+RC[41] -> 0 | H55: 0 | I55: 0 | J55: =RC[-2]+RC[-1] -> 0 | K55: 0 | L55: 0 | M55: 0 | N55: =RC[15]+RC[16]+RC[17]+RC[18]+RC[19]+RC[20] -> 0 | O55: 0 | P55: 0 | Q55: 360000 | R55: 0 | S55: 0 | T55: 0 | U55: 3600 | V55: 0 | W55: 356400 | X55: 0 | Y55: 0 | Z55: 0 | AA55: 0 | AB55: 0 | AC55: 0 | AD55: 0 | AE55: 0 | AF55: 0 | AG55: 0 | AH55: 0 | AI55: 360000 | AJ55: 0 | AK55: 0 | AL55: 0 | AM55: 0 | AN55: 0 | AO55: 0 | AP55: 0 | AQ55: 0 | AR55: =1 -> 1 | AS55: 0 | AT55: 0 | AU55: =RC[-30]-RC[-29]-RC[-28]-RC[-27]-RC[-26]-RC[-25] -> 356400 | AV55: 0 | AW55: =RC[1]-RC[2] -> 0 | AX55: 0 | AY55: 0 | AZ55: =RC[-46] -> 360000 | BA55: =RC[-46] -> 0 | BB55: =RC[-46] -> 0 | BC55: =RC[-46] -> 0 | BD55: =RC[-46] -> 0 | BE55: =RC[-46] -> 0 | BF55: =RC[-46] -> 0 | BG55: =RC[-46] -> 0 | BH55: =RC[-46] -> 0 | BI55: =RC[-46] -> 0 | BJ55: =RC[-46] -> 0 | BK55: =RC[-46] -> 360000 | BL55: =RC[-46] -> 0 | BM55: =RC[-46] -> 0 | BN55: =RC[-46] -> 0 | BO55: =RC[-46] -> 3600 | BP55: =RC[-46] -> 0 | BQ55: =RC[-46] -> 356400 | BR55: =RC[-46] -> 0 | BS55: =RC[-46] -> 0 | BT55: =RC[-46] -> 0 | BU55: =RC[-46] -> 0 | BV55: =RC[-46] -> 0 | BW55: =RC[-46] -> 0 | BX55: =RC[-46] -> 0 | BY55: =RC[-46] -> 0 | BZ55: =RC[-46] -> 0 | CA55: =RC[-46] -> 0 | CB55: =RC[-46] -> 0 | CC55: =RC[-46] -> 360000 | CD55: =RC[-46] -> 0 | CE55: =RC[-46] -> 0 | CF55: =RC[-46] -> 0 | CG55: =RC[-46] -> 0 | CH55: =RC[-46] -> 0 | CI55: =RC[-46] -> 0 | CJ55: =RC[-46] -> 0 | CK55: =RC[-46] -> 0 | CL55: =RC[-46] -> 1 | CM55: =RC[-46] -> 0 | CN55: =RC[-46] -> 0 | CO55: =RC[-46] -> 356400 | CP55: =RC[-46] -> 0 | CQ55: =RC[-46] -> 0 | CR55: =RC[-46] -> 0 | CS55: =RC[-46] -> 0
A56: 6 | B56: 013763 | C56: Lê Mai Anh | D56: Nhân viên phục vụ hành khách hàng hóa | F56: =RC[29]+RC[30]+RC[31]+RC[32]+RC[33]+RC[34]+RC[35]+RC[36]+RC[37] -> 360000 | G56: =RC[17]+RC[18]++RC[19]+RC[20]+RC[21]+RC[38]+RC[39]+RC[41] -> 0 | H56: 0 | I56: 0 | J56: =RC[-2]+RC[-1] -> 0 | K56: 0 | L56: 0 | M56: 0 | N56: =RC[15]+RC[16]+RC[17]+RC[18]+RC[19]+RC[20] -> 0 | O56: 0 | P56: 0 | Q56: 360000 | R56: 0 | S56: 0 | T56: 0 | U56: 3600 | V56: 0 | W56: 356400 | X56: 0 | Y56: 0 | Z56: 0 | AA56: 0 | AB56: 0 | AC56: 0 | AD56: 0 | AE56: 0 | AF56: 0 | AG56: 0 | AH56: 0 | AI56: 360000 | AJ56: 0 | AK56: 0 | AL56: 0 | AM56: 0 | AN56: 0 | AO56: 0 | AP56: 0 | AQ56: 0 | AR56: =1 -> 1 | AS56: 0 | AT56: 0 | AU56: =RC[-30]-RC[-29]-RC[-28]-RC[-27]-RC[-26]-RC[-25] -> 356400 | AV56: 0 | AW56: =RC[1]-RC[2] -> 0 | AX56: 0 | AY56: 0 | AZ56: =RC[-46] -> 360000 | BA56: =RC[-46] -> 0 | BB56: =RC[-46] -> 0 | BC56: =RC[-46] -> 0 | BD56: =RC[-46] -> 0 | BE56: =RC[-46] -> 0 | BF56: =RC[-46] -> 0 | BG56: =RC[-46] -> 0 | BH56: =RC[-46] -> 0 | BI56: =RC[-46] -> 0 | BJ56: =RC[-46] -> 0 | BK56: =RC[-46] -> 360000 | BL56: =RC[-46] -> 0 | BM56: =RC[-46] -> 0 | BN56: =RC[-46] -> 0 | BO56: =RC[-46] -> 3600 | BP56: =RC[-46] -> 0 | BQ56: =RC[-46] -> 356400 | BR56: =RC[-46] -> 0 | BS56: =RC[-46] -> 0 | BT56: =RC[-46] -> 0 | BU56: =RC[-46] -> 0 | BV56: =RC[-46] -> 0 | BW56: =RC[-46] -> 0 | BX56: =RC[-46] -> 0 | BY56: =RC[-46] -> 0 | BZ56: =RC[-46] -> 0 | CA56: =RC[-46] -> 0 | CB56: =RC[-46] -> 0 | CC56: =RC[-46] -> 360000 | CD56: =RC[-46] -> 0 | CE56: =RC[-46] -> 0 | CF56: =RC[-46] -> 0 | CG56: =RC[-46] -> 0 | CH56: =RC[-46] -> 0 | CI56: =RC[-46] -> 0 | CJ56: =RC[-46] -> 0 | CK56: =RC[-46] -> 0 | CL56: =RC[-46] -> 1 | CM56: =RC[-46] -> 0 | CN56: =RC[-46] -> 0 | CO56: =RC[-46] -> 356400 | CP56: =RC[-46] -> 0 | CQ56: =RC[-46] -> 0 | CR56: =RC[-46] -> 0 | CS56: =RC[-46] -> 0
A57: 7 | B57: 013764 | C57: Đỗ Thị Ngọc Hà | D57: Nhân viên phục vụ hành khách hàng hóa | F57: =RC[29]+RC[30]+RC[31]+RC[32]+RC[33]+RC[34]+RC[35]+RC[36]+RC[37] -> 360000 | G57: =RC[17]+RC[18]++RC[19]+RC[20]+RC[21]+RC[38]+RC[39]+RC[41] -> 0 | H57: 0 | I57: 0 | J57: =RC[-2]+RC[-1] -> 0 | K57: 0 | L57: 0 | M57: 0 | N57: =RC[15]+RC[16]+RC[17]+RC[18]+RC[19]+RC[20] -> 0 | O57: 0 | P57: 0 | Q57: 360000 | R57: 0 | S57: 0 | T57: 0 | U57: 3600 | V57: 0 | W57: 356400 | X57: 0 | Y57: 0 | Z57: 0 | AA57: 0 | AB57: 0 | AC57: 0 | AD57: 0 | AE57: 0 | AF57: 0 | AG57: 0 | AH57: 0 | AI57: 360000 | AJ57: 0 | AK57: 0 | AL57: 0 | AM57: 0 | AN57: 0 | AO57: 0 | AP57: 0 | AQ57: 0 | AR57: =1 -> 1 | AS57: 0 | AT57: 0 | AU57: =RC[-30]-RC[-29]-RC[-28]-RC[-27]-RC[-26]-RC[-25] -> 356400 | AV57: 0 | AW57: =RC[1]-RC[2] -> 0 | AX57: 0 | AY57: 0 | AZ57: =RC[-46] -> 360000 | BA57: =RC[-46] -> 0 | BB57: =RC[-46] -> 0 | BC57: =RC[-46] -> 0 | BD57: =RC[-46] -> 0 | BE57: =RC[-46] -> 0 | BF57: =RC[-46] -> 0 | BG57: =RC[-46] -> 0 | BH57: =RC[-46] -> 0 | BI57: =RC[-46] -> 0 | BJ57: =RC[-46] -> 0 | BK57: =RC[-46] -> 360000 | BL57: =RC[-46] -> 0 | BM57: =RC[-46] -> 0 | BN57: =RC[-46] -> 0 | BO57: =RC[-46] -> 3600 | BP57: =RC[-46] -> 0 | BQ57: =RC[-46] -> 356400 | BR57: =RC[-46] -> 0 | BS57: =RC[-46] -> 0 | BT57: =RC[-46] -> 0 | BU57: =RC[-46] -> 0 | BV57: =RC[-46] -> 0 | BW57: =RC[-46] -> 0 | BX57: =RC[-46] -> 0 | BY57: =RC[-46] -> 0 | BZ57: =RC[-46] -> 0 | CA57: =RC[-46] -> 0 | CB57: =RC[-46] -> 0 | CC57: =RC[-46] -> 360000 | CD57: =RC[-46] -> 0 | CE57: =RC[-46] -> 0 | CF57: =RC[-46] -> 0 | CG57: =RC[-46] -> 0 | CH57: =RC[-46] -> 0 | CI57: =RC[-46] -> 0 | CJ57: =RC[-46] -> 0 | CK57: =RC[-46] -> 0 | CL57: =RC[-46] -> 1 | CM57: =RC[-46] -> 0 | CN57: =RC[-46] -> 0 | CO57: =RC[-46] -> 356400 | CP57: =RC[-46] -> 0 | CQ57: =RC[-46] -> 0 | CR57: =RC[-46] -> 0 | CS57: =RC[-46] -> 0
A58: 8 | B58: 013765 | C58: Phạm Tú Châu | D58: Nhân viên phục vụ hành khách hàng hóa | F58: =RC[29]+RC[30]+RC[31]+RC[32]+RC[33]+RC[34]+RC[35]+RC[36]+RC[37] -> 360000 | G58: =RC[17]+RC[18]++RC[19]+RC[20]+RC[21]+RC[38]+RC[39]+RC[41] -> 0 | H58: 0 | I58: 0 | J58: =RC[-2]+RC[-1] -> 0 | K58: 0 | L58: 0 | M58: 0 | N58: =RC[15]+RC[16]+RC[17]+RC[18]+RC[19]+RC[20] -> 0 | O58: 0 | P58: 0 | Q58: 360000 | R58: 0 | S58: 0 | T58: 0 | U58: 3600 | V58: 0 | W58: 356400 | X58: 0 | Y58: 0 | Z58: 0 | AA58: 0 | AB58: 0 | AC58: 0 | AD58: 0 | AE58: 0 | AF58: 0 | AG58: 0 | AH58: 0 | AI58: 360000 | AJ58: 0 | AK58: 0 | AL58: 0 | AM58: 0 | AN58: 0 | AO58: 0 | AP58: 0 | AQ58: 0 | AR58: =1 -> 1 | AS58: 0 | AT58: 0 | AU58: =RC[-30]-RC[-29]-RC[-28]-RC[-27]-RC[-26]-RC[-25] -> 356400 | AV58: 0 | AW58: =RC[1]-RC[2] -> 0 | AX58: 0 | AY58: 0 | AZ58: =RC[-46] -> 360000 | BA58: =RC[-46] -> 0 | BB58: =RC[-46] -> 0 | BC58: =RC[-46] -> 0 | BD58: =RC[-46] -> 0 | BE58: =RC[-46] -> 0 | BF58: =RC[-46] -> 0 | BG58: =RC[-46] -> 0 | BH58: =RC[-46] -> 0 | BI58: =RC[-46] -> 0 | BJ58: =RC[-46] -> 0 | BK58: =RC[-46] -> 360000 | BL58: =RC[-46] -> 0 | BM58: =RC[-46] -> 0 | BN58: =RC[-46] -> 0 | BO58: =RC[-46] -> 3600 | BP58: =RC[-46] -> 0 | BQ58: =RC[-46] -> 356400 | BR58: =RC[-46] -> 0 | BS58: =RC[-46] -> 0 | BT58: =RC[-46] -> 0 | BU58: =RC[-46] -> 0 | BV58: =RC[-46] -> 0 | BW58: =RC[-46] -> 0 | BX58: =RC[-46] -> 0 | BY58: =RC[-46] -> 0 | BZ58: =RC[-46] -> 0 | CA58: =RC[-46] -> 0 | CB58: =RC[-46] -> 0 | CC58: =RC[-46] -> 360000 | CD58: =RC[-46] -> 0 | CE58: =RC[-46] -> 0 | CF58: =RC[-46] -> 0 | CG58: =RC[-46] -> 0 | CH58: =RC[-46] -> 0 | CI58: =RC[-46] -> 0 | CJ58: =RC[-46] -> 0 | CK58: =RC[-46] -> 0 | CL58: =RC[-46] -> 1 | CM58: =RC[-46] -> 0 | CN58: =RC[-46] -> 0 | CO58: =RC[-46] -> 356400 | CP58: =RC[-46] -> 0 | CQ58: =RC[-46] -> 0 | CR58: =RC[-46] -> 0 | CS58: =RC[-46] -> 0
A59: 9 | B59: 013766 | C59: Nguyễn Thị Phương Dung | D59: Nhân viên phục vụ hành khách hàng hóa | F59: =RC[29]+RC[30]+RC[31]+RC[32]+RC[33]+RC[34]+RC[35]+RC[36]+RC[37] -> 360000 | G59: =RC[17]+RC[18]++RC[19]+RC[20]+RC[21]+RC[38]+RC[39]+RC[41] -> 0 | H59: 0 | I59: 0 | J59: =RC[-2]+RC[-1] -> 0 | K59: 0 | L59: 0 | M59: 0 | N59: =RC[15]+RC[16]+RC[17]+RC[18]+RC[19]+RC[20] -> 0 | O59: 0 | P59: 0 | Q59: 360000 | R59: 0 | S59: 0 | T59: 0 | U59: 3600 | V59: 0 | W59: 356400 | X59: 0 | Y59: 0 | Z59: 0 | AA59: 0 | AB59: 0 | AC59: 0 | AD59: 0 | AE59: 0 | AF59: 0 | AG59: 0 | AH59: 0 | AI59: 360000 | AJ59: 0 | AK59: 0 | AL59: 0 | AM59: 0 | AN59: 0 | AO59: 0 | AP59: 0 | AQ59: 0 | AR59: =1 -> 1 | AS59: 0 | AT59: 0 | AU59: =RC[-30]-RC[-29]-RC[-28]-RC[-27]-RC[-26]-RC[-25] -> 356400 | AV59: 0 | AW59: =RC[1]-RC[2] -> 0 | AX59: 0 | AY59: 0 | AZ59: =RC[-46] -> 360000 | BA59: =RC[-46] -> 0 | BB59: =RC[-46] -> 0 | BC59: =RC[-46] -> 0 | BD59: =RC[-46] -> 0 | BE59: =RC[-46] -> 0 | BF59: =RC[-46] -> 0 | BG59: =RC[-46] -> 0 | BH59: =RC[-46] -> 0 | BI59: =RC[-46] -> 0 | BJ59: =RC[-46] -> 0 | BK59: =RC[-46] -> 360000 | BL59: =RC[-46] -> 0 | BM59: =RC[-46] -> 0 | BN59: =RC[-46] -> 0 | BO59: =RC[-46] -> 3600 | BP59: =RC[-46] -> 0 | BQ59: =RC[-46] -> 356400 | BR59: =RC[-46] -> 0 | BS59: =RC[-46] -> 0 | BT59: =RC[-46] -> 0 | BU59: =RC[-46] -> 0 | BV59: =RC[-46] -> 0 | BW59: =RC[-46] -> 0 | BX59: =RC[-46] -> 0 | BY59: =RC[-46] -> 0 | BZ59: =RC[-46] -> 0 | CA59: =RC[-46] -> 0 | CB59: =RC[-46] -> 0 | CC59: =RC[-46] -> 360000 | CD59: =RC[-46] -> 0 | CE59: =RC[-46] -> 0 | CF59: =RC[-46] -> 0 | CG59: =RC[-46] -> 0 | CH59: =RC[-46] -> 0 | CI59: =RC[-46] -> 0 | CJ59: =RC[-46] -> 0 | CK59: =RC[-46] -> 0 | CL59: =RC[-46] -> 1 | CM59: =RC[-46] -> 0 | CN59: =RC[-46] -> 0 | CO59: =RC[-46] -> 356400 | CP59: =RC[-46] -> 0 | CQ59: =RC[-46] -> 0 | CR59: =RC[-46] -> 0 | CS59: =RC[-46] -> 0
A60: 10 | B60: 013767 | C60: Trần Thị Phương Anh | D60: Nhân viên phục vụ hành khách hàng hóa | F60: =RC[29]+RC[30]+RC[31]+RC[32]+RC[33]+RC[34]+RC[35]+RC[36]+RC[37] -> 360000 | G60: =RC[17]+RC[18]++RC[19]+RC[20]+RC[21]+RC[38]+RC[39]+RC[41] -> 0 | H60: 0 | I60: 0 | J60: =RC[-2]+RC[-1] -> 0 | K60: 0 | L60: 0 | M60: 0 | N60: =RC[15]+RC[16]+RC[17]+RC[18]+RC[19]+RC[20] -> 0 | O60: 0 | P60: 0 | Q60: 360000 | R60: 0 | S60: 0 | T60: 0 | U60: 3600 | V60: 0 | W60: 356400 | X60: 0 | Y60: 0 | Z60: 0 | AA60: 0 | AB60: 0 | AC60: 0 | AD60: 0 | AE60: 0 | AF60: 0 | AG60: 0 | AH60: 0 | AI60: 360000 | AJ60: 0 | AK60: 0 | AL60: 0 | AM60: 0 | AN60: 0 | AO60: 0 | AP60: 0 | AQ60: 0 | AR60: =1 -> 1 | AS60: 0 | AT60: 0 | AU60: =RC[-30]-RC[-29]-RC[-28]-RC[-27]-RC[-26]-RC[-25] -> 356400 | AV60: 0 | AW60: =RC[1]-RC[2] -> 0 | AX60: 0 | AY60: 0 | AZ60: =RC[-46] -> 360000 | BA60: =RC[-46] -> 0 | BB60: =RC[-46] -> 0 | BC60: =RC[-46] -> 0 | BD60: =RC[-46] -> 0 | BE60: =RC[-46] -> 0 | BF60: =RC[-46] -> 0 | BG60: =RC[-46] -> 0 | BH60: =RC[-46] -> 0 | BI60: =RC[-46] -> 0 | BJ60: =RC[-46] -> 0 | BK60: =RC[-46] -> 360000 | BL60: =RC[-46] -> 0 | BM60: =RC[-46] -> 0 | BN60: =RC[-46] -> 0 | BO60: =RC[-46] -> 3600 | BP60: =RC[-46] -> 0 | BQ60: =RC[-46] -> 356400 | BR60: =RC[-46] -> 0 | BS60: =RC[-46] -> 0 | BT60: =RC[-46] -> 0 | BU60: =RC[-46] -> 0 | BV60: =RC[-46] -> 0 | BW60: =RC[-46] -> 0 | BX60: =RC[-46] -> 0 | BY60: =RC[-46] -> 0 | BZ60: =RC[-46] -> 0 | CA60: =RC[-46] -> 0 | CB60: =RC[-46] -> 0 | CC60: =RC[-46] -> 360000 | CD60: =RC[-46] -> 0 | CE60: =RC[-46] -> 0 | CF60: =RC[-46] -> 0 | CG60: =RC[-46] -> 0 | CH60: =RC[-46] -> 0 | CI60: =RC[-46] -> 0 | CJ60: =RC[-46] -> 0 | CK60: =RC[-46] -> 0 | CL60: =RC[-46] -> 1 | CM60: =RC[-46] -> 0 | CN60: =RC[-46] -> 0 | CO60: =RC[-46] -> 356400 | CP60: =RC[-46] -> 0 | CQ60: =RC[-46] -> 0 | CR60: =RC[-46] -> 0 | CS60: =RC[-46] -> 0
A61: 11 | B61: 013769 | C61: Nguyễn Thị Hồng Thu | D61: Nhân viên phục vụ hành khách hàng hóa | F61: =RC[29]+RC[30]+RC[31]+RC[32]+RC[33]+RC[34]+RC[35]+RC[36]+RC[37] -> 360000 | G61: =RC[17]+RC[18]++RC[19]+RC[20]+RC[21]+RC[38]+RC[39]+RC[41] -> 0 | H61: 0 | I61: 0 | J61: =RC[-2]+RC[-1] -> 0 | K61: 0 | L61: 0 | M61: 0 | N61: =RC[15]+RC[16]+RC[17]+RC[18]+RC[19]+RC[20] -> 0 | O61: 0 | P61: 0 | Q61: 360000 | R61: 0 | S61: 0 | T61: 0 | U61: 3600 | V61: 0 | W61: 356400 | X61: 0 | Y61: 0 | Z61: 0 | AA61: 0 | AB61: 0 | AC61: 0 | AD61: 0 | AE61: 0 | AF61: 0 | AG61: 0 | AH61: 0 | AI61: 360000 | AJ61: 0 | AK61: 0 | AL61: 0 | AM61: 0 | AN61: 0 | AO61: 0 | AP61: 0 | AQ61: 0 | AR61: =1 -> 1 | AS61: 0 | AT61: 0 | AU61: =RC[-30]-RC[-29]-RC[-28]-RC[-27]-RC[-26]-RC[-25] -> 356400 | AV61: 0 | AW61: =RC[1]-RC[2] -> 0 | AX61: 0 | AY61: 0 | AZ61: =RC[-46] -> 360000 | BA61: =RC[-46] -> 0 | BB61: =RC[-46] -> 0 | BC61: =RC[-46] -> 0 | BD61: =RC[-46] -> 0 | BE61: =RC[-46] -> 0 | BF61: =RC[-46] -> 0 | BG61: =RC[-46] -> 0 | BH61: =RC[-46] -> 0 | BI61: =RC[-46] -> 0 | BJ61: =RC[-46] -> 0 | BK61: =RC[-46] -> 360000 | BL61: =RC[-46] -> 0 | BM61: =RC[-46] -> 0 | BN61: =RC[-46] -> 0 | BO61: =RC[-46] -> 3600 | BP61: =RC[-46] -> 0 | BQ61: =RC[-46] -> 356400 | BR61: =RC[-46] -> 0 | BS61: =RC[-46] -> 0 | BT61: =RC[-46] -> 0 | BU61: =RC[-46] -> 0 | BV61: =RC[-46] -> 0 | BW61: =RC[-46] -> 0 | BX61: =RC[-46] -> 0 | BY61: =RC[-46] -> 0 | BZ61: =RC[-46] -> 0 | CA61: =RC[-46] -> 0 | CB61: =RC[-46] -> 0 | CC61: =RC[-46] -> 360000 | CD61: =RC[-46] -> 0 | CE61: =RC[-46] -> 0 | CF61: =RC[-46] -> 0 | CG61: =RC[-46] -> 0 | CH61: =RC[-46] -> 0 | CI61: =RC[-46] -> 0 | CJ61: =RC[-46] -> 0 | CK61: =RC[-46] -> 0 | CL61: =RC[-46] -> 1 | CM61: =RC[-46] -> 0 | CN61: =RC[-46] -> 0 | CO61: =RC[-46] -> 356400 | CP61: =RC[-46] -> 0 | CQ61: =RC[-46] -> 0 | CR61: =RC[-46] -> 0 | CS61: =RC[-46] -> 0
A62: 12 | B62: 013770 | C62: Nguyễn Thị Thanh Phương | D62: Nhân viên phục vụ hành khách hàng hóa | F62: =RC[29]+RC[30]+RC[31]+RC[32]+RC[33]+RC[34]+RC[35]+RC[36]+RC[37] -> 360000 | G62: =RC[17]+RC[18]++RC[19]+RC[20]+RC[21]+RC[38]+RC[39]+RC[41] -> 0 | H62: 0 | I62: 0 | J62: =RC[-2]+RC[-1] -> 0 | K62: 0 | L62: 0 | M62: 0 | N62: =RC[15]+RC[16]+RC[17]+RC[18]+RC[19]+RC[20] -> 0 | O62: 0 | P62: 0 | Q62: 360000 | R62: 0 | S62: 0 | T62: 0 | U62: 3600 | V62: 0 | W62: 356400 | X62: 0 | Y62: 0 | Z62: 0 | AA62: 0 | AB62: 0 | AC62: 0 | AD62: 0 | AE62: 0 | AF62: 0 | AG62: 0 | AH62: 0 | AI62: 360000 | AJ62: 0 | AK62: 0 | AL62: 0 | AM62: 0 | AN62: 0 | AO62: 0 | AP62: 0 | AQ62: 0 | AR62: =1 -> 1 | AS62: 0 | AT62: 0 | AU62: =RC[-30]-RC[-29]-RC[-28]-RC[-27]-RC[-26]-RC[-25] -> 356400 | AV62: 0 | AW62: =RC[1]-RC[2] -> 0 | AX62: 0 | AY62: 0 | AZ62: =RC[-46] -> 360000 | BA62: =RC[-46] -> 0 | BB62: =RC[-46] -> 0 | BC62: =RC[-46] -> 0 | BD62: =RC[-46] -> 0 | BE62: =RC[-46] -> 0 | BF62: =RC[-46] -> 0 | BG62: =RC[-46] -> 0 | BH62: =RC[-46] -> 0 | BI62: =RC[-46] -> 0 | BJ62: =RC[-46] -> 0 | BK62: =RC[-46] -> 360000 | BL62: =RC[-46] -> 0 | BM62: =RC[-46] -> 0 | BN62: =RC[-46] -> 0 | BO62: =RC[-46] -> 3600 | BP62: =RC[-46] -> 0 | BQ62: =RC[-46] -> 356400 | BR62: =RC[-46] -> 0 | BS62: =RC[-46] -> 0 | BT62: =RC[-46] -> 0 | BU62: =RC[-46] -> 0 | BV62: =RC[-46] -> 0 | BW62: =RC[-46] -> 0 | BX62: =RC[-46] -> 0 | BY62: =RC[-46] -> 0 | BZ62: =RC[-46] -> 0 | CA62: =RC[-46] -> 0 | CB62: =RC[-46] -> 0 | CC62: =RC[-46] -> 360000 | CD62: =RC[-46] -> 0 | CE62: =RC[-46] -> 0 | CF62: =RC[-46] -> 0 | CG62: =RC[-46] -> 0 | CH62: =RC[-46] -> 0 | CI62: =RC[-46] -> 0 | CJ62: =RC[-46] -> 0 | CK62: =RC[-46] -> 0 | CL62: =RC[-46] -> 1 | CM62: =RC[-46] -> 0 | CN62: =RC[-46] -> 0 | CO62: =RC[-46] -> 356400 | CP62: =RC[-46] -> 0 | CQ62: =RC[-46] -> 0 | CR62: =RC[-46] -> 0 | CS62: =RC[-46] -> 0
A63: 13 | B63: 013771 | C63: Nguyễn Thị Thoa | D63: Nhân viên phục vụ hành khách hàng hóa | F63: =RC[29]+RC[30]+RC[31]+RC[32]+RC[33]+RC[34]+RC[35]+RC[36]+RC[37] -> 360000 | G63: =RC[17]+RC[18]++RC[19]+RC[20]+RC[21]+RC[38]+RC[39]+RC[41] -> 0 | H63: 0 | I63: 0 | J63: =RC[-2]+RC[-1] -> 0 | K63: 0 | L63: 0 | M63: 0 | N63: =RC[15]+RC[16]+RC[17]+RC[18]+RC[19]+RC[20] -> 0 | O63: 0 | P63: 0 | Q63: 360000 | R63: 0 | S63: 0 | T63: 0 | U63: 3600 | V63: 0 | W63: 356400 | X63: 0 | Y63: 0 | Z63: 0 | AA63: 0 | AB63: 0 | AC63: 0 | AD63: 0 | AE63: 0 | AF63: 0 | AG63: 0 | AH63: 0 | AI63: 360000 | AJ63: 0 | AK63: 0 | AL63: 0 | AM63: 0 | AN63: 0 | AO63: 0 | AP63: 0 | AQ63: 0 | AR63: =1 -> 1 | AS63: 0 | AT63: 0 | AU63: =RC[-30]-RC[-29]-RC[-28]-RC[-27]-RC[-26]-RC[-25] -> 356400 | AV63: 0 | AW63: =RC[1]-RC[2] -> 0 | AX63: 0 | AY63: 0 | AZ63: =RC[-46] -> 360000 | BA63: =RC[-46] -> 0 | BB63: =RC[-46] -> 0 | BC63: =RC[-46] -> 0 | BD63: =RC[-46] -> 0 | BE63: =RC[-46] -> 0 | BF63: =RC[-46] -> 0 | BG63: =RC[-46] -> 0 | BH63: =RC[-46] -> 0 | BI63: =RC[-46] -> 0 | BJ63: =RC[-46] -> 0 | BK63: =RC[-46] -> 360000 | BL63: =RC[-46] -> 0 | BM63: =RC[-46] -> 0 | BN63: =RC[-46] -> 0 | BO63: =RC[-46] -> 3600 | BP63: =RC[-46] -> 0 | BQ63: =RC[-46] -> 356400 | BR63: =RC[-46] -> 0 | BS63: =RC[-46] -> 0 | BT63: =RC[-46] -> 0 | BU63: =RC[-46] -> 0 | BV63: =RC[-46] -> 0 | BW63: =RC[-46] -> 0 | BX63: =RC[-46] -> 0 | BY63: =RC[-46] -> 0 | BZ63: =RC[-46] -> 0 | CA63: =RC[-46] -> 0 | CB63: =RC[-46] -> 0 | CC63: =RC[-46] -> 360000 | CD63: =RC[-46] -> 0 | CE63: =RC[-46] -> 0 | CF63: =RC[-46] -> 0 | CG63: =RC[-46] -> 0 | CH63: =RC[-46] -> 0 | CI63: =RC[-46] -> 0 | CJ63: =RC[-46] -> 0 | CK63: =RC[-46] -> 0 | CL63: =RC[-46] -> 1 | CM63: =RC[-46] -> 0 | CN63: =RC[-46] -> 0 | CO63: =RC[-46] -> 356400 | CP63: =RC[-46] -> 0 | CQ63: =RC[-46] -> 0 | CR63: =RC[-46] -> 0 | CS63: =RC[-46] -> 0
A64: 14 | B64: 013772 | C64: Nguyễn Thị Thu Thủy | D64: Nhân viên phục vụ hành khách hàng hóa | F64: =RC[29]+RC[30]+RC[31]+RC[32]+RC[33]+RC[34]+RC[35]+RC[36]+RC[37] -> 360000 | G64: =RC[17]+RC[18]++RC[19]+RC[20]+RC[21]+RC[38]+RC[39]+RC[41] -> 0 | H64: 0 | I64: 0 | J64: =RC[-2]+RC[-1] -> 0 | K64: 0 | L64: 0 | M64: 0 | N64: =RC[15]+RC[16]+RC[17]+RC[18]+RC[19]+RC[20] -> 0 | O64: 0 | P64: 0 | Q64: 360000 | R64: 0 | S64: 0 | T64: 0 | U64: 3600 | V64: 0 | W64: 356400 | X64: 0 | Y64: 0 | Z64: 0 | AA64: 0 | AB64: 0 | AC64: 0 | AD64: 0 | AE64: 0 | AF64: 0 | AG64: 0 | AH64: 0 | AI64: 360000 | AJ64: 0 | AK64: 0 | AL64: 0 | AM64: 0 | AN64: 0 | AO64: 0 | AP64: 0 | AQ64: 0 | AR64: =1 -> 1 | AS64: 0 | AT64: 0 | AU64: =RC[-30]-RC[-29]-RC[-28]-RC[-27]-RC[-26]-RC[-25] -> 356400 | AV64: 0 | AW64: =RC[1]-RC[2] -> 0 | AX64: 0 | AY64: 0 | AZ64: =RC[-46] -> 360000 | BA64: =RC[-46] -> 0 | BB64: =RC[-46] -> 0 | BC64: =RC[-46] -> 0 | BD64: =RC[-46] -> 0 | BE64: =RC[-46] -> 0 | BF64: =RC[-46] -> 0 | BG64: =RC[-46] -> 0 | BH64: =RC[-46] -> 0 | BI64: =RC[-46] -> 0 | BJ64: =RC[-46] -> 0 | BK64: =RC[-46] -> 360000 | BL64: =RC[-46] -> 0 | BM64: =RC[-46] -> 0 | BN64: =RC[-46] -> 0 | BO64: =RC[-46] -> 3600 | BP64: =RC[-46] -> 0 | BQ64: =RC[-46] -> 356400 | BR64: =RC[-46] -> 0 | BS64: =RC[-46] -> 0 | BT64: =RC[-46] -> 0 | BU64: =RC[-46] -> 0 | BV64: =RC[-46] -> 0 | BW64: =RC[-46] -> 0 | BX64: =RC[-46] -> 0 | BY64: =RC[-46] -> 0 | BZ64: =RC[-46] -> 0 | CA64: =RC[-46] -> 0 | CB64: =RC[-46] -> 0 | CC64: =RC[-46] -> 360000 | CD64: =RC[-46] -> 0 | CE64: =RC[-46] -> 0 | CF64: =RC[-46] -> 0 | CG64: =RC[-46] -> 0 | CH64: =RC[-46] -> 0 | CI64: =RC[-46] -> 0 | CJ64: =RC[-46] -> 0 | CK64: =RC[-46] -> 0 | CL64: =RC[-46] -> 1 | CM64: =RC[-46] -> 0 | CN64: =RC[-46] -> 0 | CO64: =RC[-46] -> 356400 | CP64: =RC[-46] -> 0 | CQ64: =RC[-46] -> 0 | CR64: =RC[-46] -> 0 | CS64: =RC[-46] -> 0
A65: 15 | B65: 013773 | C65: Nguyễn Thị Trang | D65: Nhân viên phục vụ hành khách hàng hóa | F65: =RC[29]+RC[30]+RC[31]+RC[32]+RC[33]+RC[34]+RC[35]+RC[36]+RC[37] -> 360000 | G65: =RC[17]+RC[18]++RC[19]+RC[20]+RC[21]+RC[38]+RC[39]+RC[41] -> 0 | H65: 0 | I65: 0 | J65: =RC[-2]+RC[-1] -> 0 | K65: 0 | L65: 0 | M65: 0 | N65: =RC[15]+RC[16]+RC[17]+RC[18]+RC[19]+RC[20] -> 0 | O65: 0 | P65: 0 | Q65: 360000 | R65: 0 | S65: 0 | T65: 0 | U65: 3600 | V65: 0 | W65: 356400 | X65: 0 | Y65: 0 | Z65: 0 | AA65: 0 | AB65: 0 | AC65: 0 | AD65: 0 | AE65: 0 | AF65: 0 | AG65: 0 | AH65: 0 | AI65: 360000 | AJ65: 0 | AK65: 0 | AL65: 0 | AM65: 0 | AN65: 0 | AO65: 0 | AP65: 0 | AQ65: 0 | AR65: =1 -> 1 | AS65: 0 | AT65: 0 | AU65: =RC[-30]-RC[-29]-RC[-28]-RC[-27]-RC[-26]-RC[-25] -> 356400 | AV65: 0 | AW65: =RC[1]-RC[2] -> 0 | AX65: 0 | AY65: 0 | AZ65: =RC[-46] -> 360000 | BA65: =RC[-46] -> 0 | BB65: =RC[-46] -> 0 | BC65: =RC[-46] -> 0 | BD65: =RC[-46] -> 0 | BE65: =RC[-46] -> 0 | BF65: =RC[-46] -> 0 | BG65: =RC[-46] -> 0 | BH65: =RC[-46] -> 0 | BI65: =RC[-46] -> 0 | BJ65: =RC[-46] -> 0 | BK65: =RC[-46] -> 360000 | BL65: =RC[-46] -> 0 | BM65: =RC[-46] -> 0 | BN65: =RC[-46] -> 0 | BO65: =RC[-46] -> 3600 | BP65: =RC[-46] -> 0 | BQ65: =RC[-46] -> 356400 | BR65: =RC[-46] -> 0 | BS65: =RC[-46] -> 0 | BT65: =RC[-46] -> 0 | BU65: =RC[-46] -> 0 | BV65: =RC[-46] -> 0 | BW65: =RC[-46] -> 0 | BX65: =RC[-46] -> 0 | BY65: =RC[-46] -> 0 | BZ65: =RC[-46] -> 0 | CA65: =RC[-46] -> 0 | CB65: =RC[-46] -> 0 | CC65: =RC[-46] -> 360000 | CD65: =RC[-46] -> 0 | CE65: =RC[-46] -> 0 | CF65: =RC[-46] -> 0 | CG65: =RC[-46] -> 0 | CH65: =RC[-46] -> 0 | CI65: =RC[-46] -> 0 | CJ65: =RC[-46] -> 0 | CK65: =RC[-46] -> 0 | CL65: =RC[-46] -> 1 | CM65: =RC[-46] -> 0 | CN65: =RC[-46] -> 0 | CO65: =RC[-46] -> 356400 | CP65: =RC[-46] -> 0 | CQ65: =RC[-46] -> 0 | CR65: =RC[-46] -> 0 | CS65: =RC[-46] -> 0
A66: 16 | B66: 013774 | C66: Hoàng Thị Kiều Trang | D66: Nhân viên phục vụ hành khách hàng hóa | F66: =RC[29]+RC[30]+RC[31]+RC[32]+RC[33]+RC[34]+RC[35]+RC[36]+RC[37] -> 360000 | G66: =RC[17]+RC[18]++RC[19]+RC[20]+RC[21]+RC[38]+RC[39]+RC[41] -> 0 | H66: 0 | I66: 0 | J66: =RC[-2]+RC[-1] -> 0 | K66: 0 | L66: 0 | M66: 0 | N66: =RC[15]+RC[16]+RC[17]+RC[18]+RC[19]+RC[20] -> 0 | O66: 0 | P66: 0 | Q66: 360000 | R66: 0 | S66: 0 | T66: 0 | U66: 3600 | V66: 0 | W66: 356400 | X66: 0 | Y66: 0 | Z66: 0 | AA66: 0 | AB66: 0 | AC66: 0 | AD66: 0 | AE66: 0 | AF66: 0 | AG66: 0 | AH66: 0 | AI66: 360000 | AJ66: 0 | AK66: 0 | AL66: 0 | AM66: 0 | AN66: 0 | AO66: 0 | AP66: 0 | AQ66: 0 | AR66: =1 -> 1 | AS66: 0 | AT66: 0 | AU66: =RC[-30]-RC[-29]-RC[-28]-RC[-27]-RC[-26]-RC[-25] -> 356400 | AV66: 0 | AW66: =RC[1]-RC[2] -> 0 | AX66: 0 | AY66: 0 | AZ66: =RC[-46] -> 360000 | BA66: =RC[-46] -> 0 | BB66: =RC[-46] -> 0 | BC66: =RC[-46] -> 0 | BD66: =RC[-46] -> 0 | BE66: =RC[-46] -> 0 | BF66: =RC[-46] -> 0 | BG66: =RC[-46] -> 0 | BH66: =RC[-46] -> 0 | BI66: =RC[-46] -> 0 | BJ66: =RC[-46] -> 0 | BK66: =RC[-46] -> 360000 | BL66: =RC[-46] -> 0 | BM66: =RC[-46] -> 0 | BN66: =RC[-46] -> 0 | BO66: =RC[-46] -> 3600 | BP66: =RC[-46] -> 0 | BQ66: =RC[-46] -> 356400 | BR66: =RC[-46] -> 0 | BS66: =RC[-46] -> 0 | BT66: =RC[-46] -> 0 | BU66: =RC[-46] -> 0 | BV66: =RC[-46] -> 0 | BW66: =RC[-46] -> 0 | BX66: =RC[-46] -> 0 | BY66: =RC[-46] -> 0 | BZ66: =RC[-46] -> 0 | CA66: =RC[-46] -> 0 | CB66: =RC[-46] -> 0 | CC66: =RC[-46] -> 360000 | CD66: =RC[-46] -> 0 | CE66: =RC[-46] -> 0 | CF66: =RC[-46] -> 0 | CG66: =RC[-46] -> 0 | CH66: =RC[-46] -> 0 | CI66: =RC[-46] -> 0 | CJ66: =RC[-46] -> 0 | CK66: =RC[-46] -> 0 | CL66: =RC[-46] -> 1 | CM66: =RC[-46] -> 0 | CN66: =RC[-46] -> 0 | CO66: =RC[-46] -> 356400 | CP66: =RC[-46] -> 0 | CQ66: =RC[-46] -> 0 | CR66: =RC[-46] -> 0 | CS66: =RC[-46] -> 0
A67: 17 | B67: 013775 | C67: Ngô Thị Thơm | D67: Nhân viên phục vụ hành khách hàng hóa | F67: =RC[29]+RC[30]+RC[31]+RC[32]+RC[33]+RC[34]+RC[35]+RC[36]+RC[37] -> 360000 | G67: =RC[17]+RC[18]++RC[19]+RC[20]+RC[21]+RC[38]+RC[39]+RC[41] -> 0 | H67: 0 | I67: 0 | J67: =RC[-2]+RC[-1] -> 0 | K67: 0 | L67: 0 | M67: 0 | N67: =RC[15]+RC[16]+RC[17]+RC[18]+RC[19]+RC[20] -> 0 | O67: 0 | P67: 0 | Q67: 360000 | R67: 0 | S67: 0 | T67: 0 | U67: 3600 | V67: 0 | W67: 356400 | X67: 0 | Y67: 0 | Z67: 0 | AA67: 0 | AB67: 0 | AC67: 0 | AD67: 0 | AE67: 0 | AF67: 0 | AG67: 0 | AH67: 0 | AI67: 360000 | AJ67: 0 | AK67: 0 | AL67: 0 | AM67: 0 | AN67: 0 | AO67: 0 | AP67: 0 | AQ67: 0 | AR67: =1 -> 1 | AS67: 0 | AT67: 0 | AU67: =RC[-30]-RC[-29]-RC[-28]-RC[-27]-RC[-26]-RC[-25] -> 356400 | AV67: 0 | AW67: =RC[1]-RC[2] -> 0 | AX67: 0 | AY67: 0 | AZ67: =RC[-46] -> 360000 | BA67: =RC[-46] -> 0 | BB67: =RC[-46] -> 0 | BC67: =RC[-46] -> 0 | BD67: =RC[-46] -> 0 | BE67: =RC[-46] -> 0 | BF67: =RC[-46] -> 0 | BG67: =RC[-46] -> 0 | BH67: =RC[-46] -> 0 | BI67: =RC[-46] -> 0 | BJ67: =RC[-46] -> 0 | BK67: =RC[-46] -> 360000 | BL67: =RC[-46] -> 0 | BM67: =RC[-46] -> 0 | BN67: =RC[-46] -> 0 | BO67: =RC[-46] -> 3600 | BP67: =RC[-46] -> 0 | BQ67: =RC[-46] -> 356400 | BR67: =RC[-46] -> 0 | BS67: =RC[-46] -> 0 | BT67: =RC[-46] -> 0 | BU67: =RC[-46] -> 0 | BV67: =RC[-46] -> 0 | BW67: =RC[-46] -> 0 | BX67: =RC[-46] -> 0 | BY67: =RC[-46] -> 0 | BZ67: =RC[-46] -> 0 | CA67: =RC[-46] -> 0 | CB67: =RC[-46] -> 0 | CC67: =RC[-46] -> 360000 | CD67: =RC[-46] -> 0 | CE67: =RC[-46] -> 0 | CF67: =RC[-46] -> 0 | CG67: =RC[-46] -> 0 | CH67: =RC[-46] -> 0 | CI67: =RC[-46] -> 0 | CJ67: =RC[-46] -> 0 | CK67: =RC[-46] -> 0 | CL67: =RC[-46] -> 1 | CM67: =RC[-46] -> 0 | CN67: =RC[-46] -> 0 | CO67: =RC[-46] -> 356400 | CP67: =RC[-46] -> 0 | CQ67: =RC[-46] -> 0 | CR67: =RC[-46] -> 0 | CS67: =RC[-46] -> 0
A68: 18 | B68: 013776 | C68: Đặng Thị Thùy Dương | D68: Nhân viên phục vụ hành khách hàng hóa | F68: =RC[29]+RC[30]+RC[31]+RC[32]+RC[33]+RC[34]+RC[35]+RC[36]+RC[37] -> 360000 | G68: =RC[17]+RC[18]++RC[19]+RC[20]+RC[21]+RC[38]+RC[39]+RC[41] -> 0 | H68: 0 | I68: 0 | J68: =RC[-2]+RC[-1] -> 0 | K68: 0 | L68: 0 | M68: 0 | N68: =RC[15]+RC[16]+RC[17]+RC[18]+RC[19]+RC[20] -> 0 | O68: 0 | P68: 0 | Q68: 360000 | R68: 0 | S68: 0 | T68: 0 | U68: 3600 | V68: 0 | W68: 356400 | X68: 0 | Y68: 0 | Z68: 0 | AA68: 0 | AB68: 0 | AC68: 0 | AD68: 0 | AE68: 0 | AF68: 0 | AG68: 0 | AH68: 0 | AI68: 360000 | AJ68: 0 | AK68: 0 | AL68: 0 | AM68: 0 | AN68: 0 | AO68: 0 | AP68: 0 | AQ68: 0 | AR68: =1 -> 1 | AS68: 0 | AT68: 0 | AU68: =RC[-30]-RC[-29]-RC[-28]-RC[-27]-RC[-26]-RC[-25] -> 356400 | AV68: 0 | AW68: =RC[1]-RC[2] -> 0 | AX68: 0 | AY68: 0 | AZ68: =RC[-46] -> 360000 | BA68: =RC[-46] -> 0 | BB68: =RC[-46] -> 0 | BC68: =RC[-46] -> 0 | BD68: =RC[-46] -> 0 | BE68: =RC[-46] -> 0 | BF68: =RC[-46] -> 0 | BG68: =RC[-46] -> 0 | BH68: =RC[-46] -> 0 | BI68: =RC[-46] -> 0 | BJ68: =RC[-46] -> 0 | BK68: =RC[-46] -> 360000 | BL68: =RC[-46] -> 0 | BM68: =RC[-46] -> 0 | BN68: =RC[-46] -> 0 | BO68: =RC[-46] -> 3600 | BP68: =RC[-46] -> 0 | BQ68: =RC[-46] -> 356400 | BR68: =RC[-46] -> 0 | BS68: =RC[-46] -> 0 | BT68: =RC[-46] -> 0 | BU68: =RC[-46] -> 0 | BV68: =RC[-46] -> 0 | BW68: =RC[-46] -> 0 | BX68: =RC[-46] -> 0 | BY68: =RC[-46] -> 0 | BZ68: =RC[-46] -> 0 | CA68: =RC[-46] -> 0 | CB68: =RC[-46] -> 0 | CC68: =RC[-46] -> 360000 | CD68: =RC[-46] -> 0 | CE68: =RC[-46] -> 0 | CF68: =RC[-46] -> 0 | CG68: =RC[-46] -> 0 | CH68: =RC[-46] -> 0 | CI68: =RC[-46] -> 0 | CJ68: =RC[-46] -> 0 | CK68: =RC[-46] -> 0 | CL68: =RC[-46] -> 1 | CM68: =RC[-46] -> 0 | CN68: =RC[-46] -> 0 | CO68: =RC[-46] -> 356400 | CP68: =RC[-46] -> 0 | CQ68: =RC[-46] -> 0 | CR68: =RC[-46] -> 0 | CS68: =RC[-46] -> 0
A69: 19 | B69: 013778 | C69: Nguyễn Phương Cương | D69: Nhân viên phục vụ hành khách hàng hóa | F69: =RC[29]+RC[30]+RC[31]+RC[32]+RC[33]+RC[34]+RC[35]+RC[36]+RC[37] -> 360000 | G69: =RC[17]+RC[18]++RC[19]+RC[20]+RC[21]+RC[38]+RC[39]+RC[41] -> 0 | H69: 0 | I69: 0 | J69: =RC[-2]+RC[-1] -> 0 | K69: 0 | L69: 0 | M69: 0 | N69: =RC[15]+RC[16]+RC[17]+RC[18]+RC[19]+RC[20] -> 0 | O69: 0 | P69: 0 | Q69: 360000 | R69: 0 | S69: 0 | T69: 0 | U69: 3600 | V69: 0 | W69: 356400 | X69: 0 | Y69: 0 | Z69: 0 | AA69: 0 | AB69: 0 | AC69: 0 | AD69: 0 | AE69: 0 | AF69: 0 | AG69: 0 | AH69: 0 | AI69: 360000 | AJ69: 0 | AK69: 0 | AL69: 0 | AM69: 0 | AN69: 0 | AO69: 0 | AP69: 0 | AQ69: 0 | AR69: =1 -> 1 | AS69: 0 | AT69: 0 | AU69: =RC[-30]-RC[-29]-RC[-28]-RC[-27]-RC[-26]-RC[-25] -> 356400 | AV69: 0 | AW69: =RC[1]-RC[2] -> 0 | AX69: 0 | AY69: 0 | AZ69: =RC[-46] -> 360000 | BA69: =RC[-46] -> 0 | BB69: =RC[-46] -> 0 | BC69: =RC[-46] -> 0 | BD69: =RC[-46] -> 0 | BE69: =RC[-46] -> 0 | BF69: =RC[-46] -> 0 | BG69: =RC[-46] -> 0 | BH69: =RC[-46] -> 0 | BI69: =RC[-46] -> 0 | BJ69: =RC[-46] -> 0 | BK69: =RC[-46] -> 360000 | BL69: =RC[-46] -> 0 | BM69: =RC[-46] -> 0 | BN69: =RC[-46] -> 0 | BO69: =RC[-46] -> 3600 | BP69: =RC[-46] -> 0 | BQ69: =RC[-46] -> 356400 | BR69: =RC[-46] -> 0 | BS69: =RC[-46] -> 0 | BT69: =RC[-46] -> 0 | BU69: =RC[-46] -> 0 | BV69: =RC[-46] -> 0 | BW69: =RC[-46] -> 0 | BX69: =RC[-46] -> 0 | BY69: =RC[-46] -> 0 | BZ69: =RC[-46] -> 0 | CA69: =RC[-46] -> 0 | CB69: =RC[-46] -> 0 | CC69: =RC[-46] -> 360000 | CD69: =RC[-46] -> 0 | CE69: =RC[-46] -> 0 | CF69: =RC[-46] -> 0 | CG69: =RC[-46] -> 0 | CH69: =RC[-46] -> 0 | CI69: =RC[-46] -> 0 | CJ69: =RC[-46] -> 0 | CK69: =RC[-46] -> 0 | CL69: =RC[-46] -> 1 | CM69: =RC[-46] -> 0 | CN69: =RC[-46] -> 0 | CO69: =RC[-46] -> 356400 | CP69: =RC[-46] -> 0 | CQ69: =RC[-46] -> 0 | CR69: =RC[-46] -> 0 | CS69: =RC[-46] -> 0
A70: 20 | B70: 013779 | C70: Lê Hoàng Gia | D70: Nhân viên phục vụ hành khách hàng hóa | F70: =RC[29]+RC[30]+RC[31]+RC[32]+RC[33]+RC[34]+RC[35]+RC[36]+RC[37] -> 360000 | G70: =RC[17]+RC[18]++RC[19]+RC[20]+RC[21]+RC[38]+RC[39]+RC[41] -> 0 | H70: 0 | I70: 0 | J70: =RC[-2]+RC[-1] -> 0 | K70: 0 | L70: 0 | M70: 0 | N70: =RC[15]+RC[16]+RC[17]+RC[18]+RC[19]+RC[20] -> 0 | O70: 0 | P70: 0 | Q70: 360000 | R70: 0 | S70: 0 | T70: 0 | U70: 3600 | V70: 0 | W70: 356400 | X70: 0 | Y70: 0 | Z70: 0 | AA70: 0 | AB70: 0 | AC70: 0 | AD70: 0 | AE70: 0 | AF70: 0 | AG70: 0 | AH70: 0 | AI70: 360000 | AJ70: 0 | AK70: 0 | AL70: 0 | AM70: 0 | AN70: 0 | AO70: 0 | AP70: 0 | AQ70: 0 | AR70: =1 -> 1 | AS70: 0 | AT70: 0 | AU70: =RC[-30]-RC[-29]-RC[-28]-RC[-27]-RC[-26]-RC[-25] -> 356400 | AV70: 0 | AW70: =RC[1]-RC[2] -> 0 | AX70: 0 | AY70: 0 | AZ70: =RC[-46] -> 360000 | BA70: =RC[-46] -> 0 | BB70: =RC[-46] -> 0 | BC70: =RC[-46] -> 0 | BD70: =RC[-46] -> 0 | BE70: =RC[-46] -> 0 | BF70: =RC[-46] -> 0 | BG70: =RC[-46] -> 0 | BH70: =RC[-46] -> 0 | BI70: =RC[-46] -> 0 | BJ70: =RC[-46] -> 0 | BK70: =RC[-46] -> 360000 | BL70: =RC[-46] -> 0 | BM70: =RC[-46] -> 0 | BN70: =RC[-46] -> 0 | BO70: =RC[-46] -> 3600 | BP70: =RC[-46] -> 0 | BQ70: =RC[-46] -> 356400 | BR70: =RC[-46] -> 0 | BS70: =RC[-46] -> 0 | BT70: =RC[-46] -> 0 | BU70: =RC[-46] -> 0 | BV70: =RC[-46] -> 0 | BW70: =RC[-46] -> 0 | BX70: =RC[-46] -> 0 | BY70: =RC[-46] -> 0 | BZ70: =RC[-46] -> 0 | CA70: =RC[-46] -> 0 | CB70: =RC[-46] -> 0 | CC70: =RC[-46] -> 360000 | CD70: =RC[-46] -> 0 | CE70: =RC[-46] -> 0 | CF70: =RC[-46] -> 0 | CG70: =RC[-46] -> 0 | CH70: =RC[-46] -> 0 | CI70: =RC[-46] -> 0 | CJ70: =RC[-46] -> 0 | CK70: =RC[-46] -> 0 | CL70: =RC[-46] -> 1 | CM70: =RC[-46] -> 0 | CN70: =RC[-46] -> 0 | CO70: =RC[-46] -> 356400 | CP70: =RC[-46] -> 0 | CQ70: =RC[-46] -> 0 | CR70: =RC[-46] -> 0 | CS70: =RC[-46] -> 0
A71: 21 | B71: 013780 | C71: Nguyễn Quang Hà Sơn | D71: Nhân viên phục vụ hành khách hàng hóa | F71: =RC[29]+RC[30]+RC[31]+RC[32]+RC[33]+RC[34]+RC[35]+RC[36]+RC[37] -> 360000 | G71: =RC[17]+RC[18]++RC[19]+RC[20]+RC[21]+RC[38]+RC[39]+RC[41] -> 0 | H71: 0 | I71: 0 | J71: =RC[-2]+RC[-1] -> 0 | K71: 0 | L71: 0 | M71: 0 | N71: =RC[15]+RC[16]+RC[17]+RC[18]+RC[19]+RC[20] -> 0 | O71: 0 | P71: 0 | Q71: 360000 | R71: 0 | S71: 0 | T71: 0 | U71: 3600 | V71: 0 | W71: 356400 | X71: 0 | Y71: 0 | Z71: 0 | AA71: 0 | AB71: 0 | AC71: 0 | AD71: 0 | AE71: 0 | AF71: 0 | AG71: 0 | AH71: 0 | AI71: 360000 | AJ71: 0 | AK71: 0 | AL71: 0 | AM71: 0 | AN71: 0 | AO71: 0 | AP71: 0 | AQ71: 0 | AR71: =1 -> 1 | AS71: 0 | AT71: 0 | AU71: =RC[-30]-RC[-29]-RC[-28]-RC[-27]-RC[-26]-RC[-25] -> 356400 | AV71: 0 | AW71: =RC[1]-RC[2] -> 0 | AX71: 0 | AY71: 0 | AZ71: =RC[-46] -> 360000 | BA71: =RC[-46] -> 0 | BB71: =RC[-46] -> 0 | BC71: =RC[-46] -> 0 | BD71: =RC[-46] -> 0 | BE71: =RC[-46] -> 0 | BF71: =RC[-46] -> 0 | BG71: =RC[-46] -> 0 | BH71: =RC[-46] -> 0 | BI71: =RC[-46] -> 0 | BJ71: =RC[-46] -> 0 | BK71: =RC[-46] -> 360000 | BL71: =RC[-46] -> 0 | BM71: =RC[-46] -> 0 | BN71: =RC[-46] -> 0 | BO71: =RC[-46] -> 3600 | BP71: =RC[-46] -> 0 | BQ71: =RC[-46] -> 356400 | BR71: =RC[-46] -> 0 | BS71: =RC[-46] -> 0 | BT71: =RC[-46] -> 0 | BU71: =RC[-46] -> 0 | BV71: =RC[-46] -> 0 | BW71: =RC[-46] -> 0 | BX71: =RC[-46] -> 0 | BY71: =RC[-46] -> 0 | BZ71: =RC[-46] -> 0 | CA71: =RC[-46] -> 0 | CB71: =RC[-46] -> 0 | CC71: =RC[-46] -> 360000 | CD71: =RC[-46] -> 0 | CE71: =RC[-46] -> 0 | CF71: =RC[-46] -> 0 | CG71: =RC[-46] -> 0 | CH71: =RC[-46] -> 0 | CI71: =RC[-46] -> 0 | CJ71: =RC[-46] -> 0 | CK71: =RC[-46] -> 0 | CL71: =RC[-46] -> 1 | CM71: =RC[-46] -> 0 | CN71: =RC[-46] -> 0 | CO71: =RC[-46] -> 356400 | CP71: =RC[-46] -> 0 | CQ71: =RC[-46] -> 0 | CR71: =RC[-46] -> 0 | CS71: =RC[-46] -> 0
A72: 22 | B72: 013781 | C72: Bùi Anh Tuấn | D72: Nhân viên phục vụ hành khách hàng hóa | F72: =RC[29]+RC[30]+RC[31]+RC[32]+RC[33]+RC[34]+RC[35]+RC[36]+RC[37] -> 360000 | G72: =RC[17]+RC[18]++RC[19]+RC[20]+RC[21]+RC[38]+RC[39]+RC[41] -> 0 | H72: 0 | I72: 0 | J72: =RC[-2]+RC[-1] -> 0 | K72: 0 | L72: 0 | M72: 0 | N72: =RC[15]+RC[16]+RC[17]+RC[18]+RC[19]+RC[20] -> 0 | O72: 0 | P72: 0 | Q72: 360000 | R72: 0 | S72: 0 | T72: 0 | U72: 3600 | V72: 0 | W72: 356400 | X72: 0 | Y72: 0 | Z72: 0 | AA72: 0 | AB72: 0 | AC72: 0 | AD72: 0 | AE72: 0 | AF72: 0 | AG72: 0 | AH72: 0 | AI72: 360000 | AJ72: 0 | AK72: 0 | AL72: 0 | AM72: 0 | AN72: 0 | AO72: 0 | AP72: 0 | AQ72: 0 | AR72: =1 -> 1 | AS72: 0 | AT72: 0 | AU72: =RC[-30]-RC[-29]-RC[-28]-RC[-27]-RC[-26]-RC[-25] -> 356400 | AV72: 0 | AW72: =RC[1]-RC[2] -> 0 | AX72: 0 | AY72: 0 | AZ72: =RC[-46] -> 360000 | BA72: =RC[-46] -> 0 | BB72: =RC[-46] -> 0 | BC72: =RC[-46] -> 0 | BD72: =RC[-46] -> 0 | BE72: =RC[-46] -> 0 | BF72: =RC[-46] -> 0 | BG72: =RC[-46] -> 0 | BH72: =RC[-46] -> 0 | BI72: =RC[-46] -> 0 | BJ72: =RC[-46] -> 0 | BK72: =RC[-46] -> 360000 | BL72: =RC[-46] -> 0 | BM72: =RC[-46] -> 0 | BN72: =RC[-46] -> 0 | BO72: =RC[-46] -> 3600 | BP72: =RC[-46] -> 0 | BQ72: =RC[-46] -> 356400 | BR72: =RC[-46] -> 0 | BS72: =RC[-46] -> 0 | BT72: =RC[-46] -> 0 | BU72: =RC[-46] -> 0 | BV72: =RC[-46] -> 0 | BW72: =RC[-46] -> 0 | BX72: =RC[-46] -> 0 | BY72: =RC[-46] -> 0 | BZ72: =RC[-46] -> 0 | CA72: =RC[-46] -> 0 | CB72: =RC[-46] -> 0 | CC72: =RC[-46] -> 360000 | CD72: =RC[-46] -> 0 | CE72: =RC[-46] -> 0 | CF72: =RC[-46] -> 0 | CG72: =RC[-46] -> 0 | CH72: =RC[-46] -> 0 | CI72: =RC[-46] -> 0 | CJ72: =RC[-46] -> 0 | CK72: =RC[-46] -> 0 | CL72: =RC[-46] -> 1 | CM72: =RC[-46] -> 0 | CN72: =RC[-46] -> 0 | CO72: =RC[-46] -> 356400 | CP72: =RC[-46] -> 0 | CQ72: =RC[-46] -> 0 | CR72: =RC[-46] -> 0 | CS72: =RC[-46] -> 0
A73: 23 | B73: 013782 | C73: Hoàng Thanh Tùng | D73: Nhân viên phục vụ hành khách hàng hóa | F73: =RC[29]+RC[30]+RC[31]+RC[32]+RC[33]+RC[34]+RC[35]+RC[36]+RC[37] -> 360000 | G73: =RC[17]+RC[18]++RC[19]+RC[20]+RC[21]+RC[38]+RC[39]+RC[41] -> 0 | H73: 0 | I73: 0 | J73: =RC[-2]+RC[-1] -> 0 | K73: 0 | L73: 0 | M73: 0 | N73: =RC[15]+RC[16]+RC[17]+RC[18]+RC[19]+RC[20] -> 0 | O73: 0 | P73: 0 | Q73: 360000 | R73: 0 | S73: 0 | T73: 0 | U73: 3600 | V73: 0 | W73: 356400 | X73: 0 | Y73: 0 | Z73: 0 | AA73: 0 | AB73: 0 | AC73: 0 | AD73: 0 | AE73: 0 | AF73: 0 | AG73: 0 | AH73: 0 | AI73: 360000 | AJ73: 0 | AK73: 0 | AL73: 0 | AM73: 0 | AN73: 0 | AO73: 0 | AP73: 0 | AQ73: 0 | AR73: =1 -> 1 | AS73: 0 | AT73: 0 | AU73: =RC[-30]-RC[-29]-RC[-28]-RC[-27]-RC[-26]-RC[-25] -> 356400 | AV73: 0 | AW73: =RC[1]-RC[2] -> 0 | AX73: 0 | AY73: 0 | AZ73: =RC[-46] -> 360000 | BA73: =RC[-46] -> 0 | BB73: =RC[-46] -> 0 | BC73: =RC[-46] -> 0 | BD73: =RC[-46] -> 0 | BE73: =RC[-46] -> 0 | BF73: =RC[-46] -> 0 | BG73: =RC[-46] -> 0 | BH73: =RC[-46] -> 0 | BI73: =RC[-46] -> 0 | BJ73: =RC[-46] -> 0 | BK73: =RC[-46] -> 360000 | BL73: =RC[-46] -> 0 | BM73: =RC[-46] -> 0 | BN73: =RC[-46] -> 0 | BO73: =RC[-46] -> 3600 | BP73: =RC[-46] -> 0 | BQ73: =RC[-46] -> 356400 | BR73: =RC[-46] -> 0 | BS73: =RC[-46] -> 0 | BT73: =RC[-46] -> 0 | BU73: =RC[-46] -> 0 | BV73: =RC[-46] -> 0 | BW73: =RC[-46] -> 0 | BX73: =RC[-46] -> 0 | BY73: =RC[-46] -> 0 | BZ73: =RC[-46] -> 0 | CA73: =RC[-46] -> 0 | CB73: =RC[-46] -> 0 | CC73: =RC[-46] -> 360000 | CD73: =RC[-46] -> 0 | CE73: =RC[-46] -> 0 | CF73: =RC[-46] -> 0 | CG73: =RC[-46] -> 0 | CH73: =RC[-46] -> 0 | CI73: =RC[-46] -> 0 | CJ73: =RC[-46] -> 0 | CK73: =RC[-46] -> 0 | CL73: =RC[-46] -> 1 | CM73: =RC[-46] -> 0 | CN73: =RC[-46] -> 0 | CO73: =RC[-46] -> 356400 | CP73: =RC[-46] -> 0 | CQ73: =RC[-46] -> 0 | CR73: =RC[-46] -> 0 | CS73: =RC[-46] -> 0
A74: 24 | B74: 013784 | C74: Đoàn Duy Anh | D74: Nhân viên phục vụ hành khách hàng hóa | F74: =RC[29]+RC[30]+RC[31]+RC[32]+RC[33]+RC[34]+RC[35]+RC[36]+RC[37] -> 360000 | G74: =RC[17]+RC[18]++RC[19]+RC[20]+RC[21]+RC[38]+RC[39]+RC[41] -> 0 | H74: 0 | I74: 0 | J74: =RC[-2]+RC[-1] -> 0 | K74: 0 | L74: 0 | M74: 0 | N74: =RC[15]+RC[16]+RC[17]+RC[18]+RC[19]+RC[20] -> 0 | O74: 0 | P74: 0 | Q74: 360000 | R74: 0 | S74: 0 | T74: 0 | U74: 3600 | V74: 0 | W74: 356400 | X74: 0 | Y74: 0 | Z74: 0 | AA74: 0 | AB74: 0 | AC74: 0 | AD74: 0 | AE74: 0 | AF74: 0 | AG74: 0 | AH74: 0 | AI74: 360000 | AJ74: 0 | AK74: 0 | AL74: 0 | AM74: 0 | AN74: 0 | AO74: 0 | AP74: 0 | AQ74: 0 | AR74: =1 -> 1 | AS74: 0 | AT74: 0 | AU74: =RC[-30]-RC[-29]-RC[-28]-RC[-27]-RC[-26]-RC[-25] -> 356400 | AV74: 0 | AW74: =RC[1]-RC[2] -> 0 | AX74: 0 | AY74: 0 | AZ74: =RC[-46] -> 360000 | BA74: =RC[-46] -> 0 | BB74: =RC[-46] -> 0 | BC74: =RC[-46] -> 0 | BD74: =RC[-46] -> 0 | BE74: =RC[-46] -> 0 | BF74: =RC[-46] -> 0 | BG74: =RC[-46] -> 0 | BH74: =RC[-46] -> 0 | BI74: =RC[-46] -> 0 | BJ74: =RC[-46] -> 0 | BK74: =RC[-46] -> 360000 | BL74: =RC[-46] -> 0 | BM74: =RC[-46] -> 0 | BN74: =RC[-46] -> 0 | BO74: =RC[-46] -> 3600 | BP74: =RC[-46] -> 0 | BQ74: =RC[-46] -> 356400 | BR74: =RC[-46] -> 0 | BS74: =RC[-46] -> 0 | BT74: =RC[-46] -> 0 | BU74: =RC[-46] -> 0 | BV74: =RC[-46] -> 0 | BW74: =RC[-46] -> 0 | BX74: =RC[-46] -> 0 | BY74: =RC[-46] -> 0 | BZ74: =RC[-46] -> 0 | CA74: =RC[-46] -> 0 | CB74: =RC[-46] -> 0 | CC74: =RC[-46] -> 360000 | CD74: =RC[-46] -> 0 | CE74: =RC[-46] -> 0 | CF74: =RC[-46] -> 0 | CG74: =RC[-46] -> 0 | CH74: =RC[-46] -> 0 | CI74: =RC[-46] -> 0 | CJ74: =RC[-46] -> 0 | CK74: =RC[-46] -> 0 | CL74: =RC[-46] -> 1 | CM74: =RC[-46] -> 0 | CN74: =RC[-46] -> 0 | CO74: =RC[-46] -> 356400 | CP74: =RC[-46] -> 0 | CQ74: =RC[-46] -> 0 | CR74: =RC[-46] -> 0 | CS74: =RC[-46] -> 0
A75: 25 | B75: 013795 | C75: Đặng Thị Huệ | D75: Nhân viên cân bằng trọng tải nhóm 1 | F75: =RC[29]+RC[30]+RC[31]+RC[32]+RC[33]+RC[34]+RC[35]+RC[36]+RC[37] -> 360000 | G75: =RC[17]+RC[18]++RC[19]+RC[20]+RC[21]+RC[38]+RC[39]+RC[41] -> 0 | H75: 0 | I75: 0 | J75: =RC[-2]+RC[-1] -> 0 | K75: 0 | L75: 0 | M75: 0 | N75: =RC[15]+RC[16]+RC[17]+RC[18]+RC[19]+RC[20] -> 0 | O75: 0 | P75: 0 | Q75: 360000 | R75: 0 | S75: 0 | T75: 0 | U75: 3600 | V75: 0 | W75: 356400 | X75: 0 | Y75: 0 | Z75: 0 | AA75: 0 | AB75: 0 | AC75: 0 | AD75: 0 | AE75: 0 | AF75: 0 | AG75: 0 | AH75: 0 | AI75: 360000 | AJ75: 0 | AK75: 0 | AL75: 0 | AM75: 0 | AN75: 0 | AO75: 0 | AP75: 0 | AQ75: 0 | AR75: =1 -> 1 | AS75: 0 | AT75: 0 | AU75: =RC[-30]-RC[-29]-RC[-28]-RC[-27]-RC[-26]-RC[-25] -> 356400 | AV75: 0 | AW75: =RC[1]-RC[2] -> 0 | AX75: 0 | AY75: 0 | AZ75: =RC[-46] -> 360000 | BA75: =RC[-46] -> 0 | BB75: =RC[-46] -> 0 | BC75: =RC[-46] -> 0 | BD75: =RC[-46] -> 0 | BE75: =RC[-46] -> 0 | BF75: =RC[-46] -> 0 | BG75: =RC[-46] -> 0 | BH75: =RC[-46] -> 0 | BI75: =RC[-46] -> 0 | BJ75: =RC[-46] -> 0 | BK75: =RC[-46] -> 360000 | BL75: =RC[-46] -> 0 | BM75: =RC[-46] -> 0 | BN75: =RC[-46] -> 0 | BO75: =RC[-46] -> 3600 | BP75: =RC[-46] -> 0 | BQ75: =RC[-46] -> 356400 | BR75: =RC[-46] -> 0 | BS75: =RC[-46] -> 0 | BT75: =RC[-46] -> 0 | BU75: =RC[-46] -> 0 | BV75: =RC[-46] -> 0 | BW75: =RC[-46] -> 0 | BX75: =RC[-46] -> 0 | BY75: =RC[-46] -> 0 | BZ75: =RC[-46] -> 0 | CA75: =RC[-46] -> 0 | CB75: =RC[-46] -> 0 | CC75: =RC[-46] -> 360000 | CD75: =RC[-46] -> 0 | CE75: =RC[-46] -> 0 | CF75: =RC[-46] -> 0 | CG75: =RC[-46] -> 0 | CH75: =RC[-46] -> 0 | CI75: =RC[-46] -> 0 | CJ75: =RC[-46] -> 0 | CK75: =RC[-46] -> 0 | CL75: =RC[-46] -> 1 | CM75: =RC[-46] -> 0 | CN75: =RC[-46] -> 0 | CO75: =RC[-46] -> 356400 | CP75: =RC[-46] -> 0 | CQ75: =RC[-46] -> 0 | CR75: =RC[-46] -> 0 | CS75: =RC[-46] -> 0
F76: =SUM(R[-25]C:R[-1]C) -> 9000000 | G76: =SUM(R[-25]C:R[-1]C) -> 0 | H76: =SUM(R[-25]C:R[-1]C) -> 0 | I76: =SUM(R[-25]C:R[-1]C) -> 0 | J76: =SUM(R[-25]C:R[-1]C) -> 0 | K76: =SUM(R[-25]C:R[-1]C) -> 0 | L76: =SUM(R[-25]C:R[-1]C) -> 0 | M76: =SUM(R[-25]C:R[-1]C) -> 0 | N76: =SUM(R[-25]C:R[-1]C) -> 0 | O76: =SUM(R[-25]C:R[-1]C) -> 0 | P76: =SUM(R[-25]C:R[-1]C) -> 0 | Q76: =SUM(R[-25]C:R[-1]C) -> 9000000 | R76: =SUM(R[-25]C:R[-1]C) -> 0 | S76: =SUM(R[-25]C:R[-1]C) -> 0 | T76: =SUM(R[-25]C:R[-1]C) -> 0 | U76: =SUM(R[-25]C:R[-1]C) -> 90000 | V76: =SUM(R[-25]C:R[-1]C) -> 0 | W76: =SUM(R[-25]C:R[-1]C) -> 8910000 | X76: =SUM(R[-25]C:R[-1]C) -> 0 | Y76: =SUM(R[-25]C:R[-1]C) -> 0 | Z76: =SUM(R[-25]C:R[-1]C) -> 0 | AA76: =SUM(R[-25]C:R[-1]C) -> 0 | AB76: =SUM(R[-25]C:R[-1]C) -> 0 | AC76: =SUM(R[-25]C:R[-1]C) -> 0 | AD76: =SUM(R[-25]C:R[-1]C) -> 0 | AE76: =SUM(R[-25]C:R[-1]C) -> 0 | AF76: =SUM(R[-25]C:R[-1]C) -> 0 | AG76: =SUM(R[-25]C:R[-1]C) -> 0 | AH76: =SUM(R[-25]C:R[-1]C) -> 0 | AI76: =SUM(R[-25]C:R[-1]C) -> 9000000 | AJ76: =SUM(R[-25]C:R[-1]C) -> 0 | AK76: =SUM(R[-25]C:R[-1]C) -> 0 | AL76: =SUM(R[-25]C:R[-1]C) -> 0 | AM76: =SUM(R[-25]C:R[-1]C) -> 0 | AN76: =SUM(R[-25]C:R[-1]C) -> 0 | AO76: =SUM(R[-25]C:R[-1]C) -> 0 | AP76: =SUM(R[-25]C:R[-1]C) -> 0 | AQ76: =SUM(R[-25]C:R[-1]C) -> 0 | AR76: =SUM(R[-25]C:R[-1]C) -> 25 | AS76: =SUM(R[-25]C:R[-1]C) -> 0 | AT76: =SUM(R[-25]C:R[-1]C) -> 0 | AU76: =SUM(R[-25]C:R[-1]C) -> 8910000 | AV76: =SUM(R[-25]C:R[-1]C) -> 0 | AW76: =SUM(R[-25]C:R[-1]C) -> 0 | AX76: =SUM(R[-25]C:R[-1]C) -> 0 | AY76: =SUM(R[-25]C:R[-1]C) -> 0
A77: Phòng Phục vụ hành khách (HGS) | F77: =SUM(R[-27]C[46]:R[-1]C[46]) -> 9000000 | G77: =SUM(R[-27]C[46]:R[-1]C[46]) -> 0 | H77: =SUM(R[-27]C[46]:R[-1]C[46]) -> 0 | I77: =SUM(R[-27]C[46]:R[-1]C[46]) -> 0 | J77: =SUM(R[-27]C[46]:R[-1]C[46]) -> 0 | K77: =SUM(R[-27]C[46]:R[-1]C[46]) -> 0 | L77: =SUM(R[-27]C[46]:R[-1]C[46]) -> 0 | M77: =SUM(R[-27]C[46]:R[-1]C[46]) -> 0 | N77: =SUM(R[-27]C[46]:R[-1]C[46]) -> 0 | O77: =SUM(R[-27]C[46]:R[-1]C[46]) -> 0 | P77: =SUM(R[-27]C[46]:R[-1]C[46]) -> 0 | Q77: =SUM(R[-27]C[46]:R[-1]C[46]) -> 9000000 | R77: =SUM(R[-27]C[46]:R[-1]C[46]) -> 0 | S77: =SUM(R[-27]C[46]:R[-1]C[46]) -> 0 | T77: =SUM(R[-27]C[46]:R[-1]C[46]) -> 0 | U77: =SUM(R[-27]C[46]:R[-1]C[46]) -> 90000 | V77: =SUM(R[-27]C[46]:R[-1]C[46]) -> 0 | W77: =SUM(R[-27]C[46]:R[-1]C[46]) -> 8910000 | X77: =SUM(R[-27]C[46]:R[-1]C[46]) -> 0 | Y77: =SUM(R[-27]C[46]:R[-1]C[46]) -> 0 | Z77: =SUM(R[-27]C[46]:R[-1]C[46]) -> 0 | AA77: =SUM(R[-27]C[46]:R[-1]C[46]) -> 0 | AB77: =SUM(R[-27]C[46]:R[-1]C[46]) -> 0 | AC77: =SUM(R[-27]C[46]:R[-1]C[46]) -> 0 | AD77: =SUM(R[-27]C[46]:R[-1]C[46]) -> 0 | AE77: =SUM(R[-27]C[46]:R[-1]C[46]) -> 0 | AF77: =SUM(R[-27]C[46]:R[-1]C[46]) -> 0 | AG77: =SUM(R[-27]C[46]:R[-1]C[46]) -> 0 | AH77: =SUM(R[-27]C[46]:R[-1]C[46]) -> 0 | AI77: =SUM(R[-27]C[46]:R[-1]C[46]) -> 9000000 | AJ77: =SUM(R[-27]C[46]:R[-1]C[46]) -> 0 | AK77: =SUM(R[-27]C[46]:R[-1]C[46]) -> 0 | AL77: =SUM(R[-27]C[46]:R[-1]C[46]) -> 0 | AM77: =SUM(R[-27]C[46]:R[-1]C[46]) -> 0 | AN77: =SUM(R[-27]C[46]:R[-1]C[46]) -> 0 | AO77: =SUM(R[-27]C[46]:R[-1]C[46]) -> 0 | AP77: =SUM(R[-27]C[46]:R[-1]C[46]) -> 0 | AQ77: =SUM(R[-27]C[46]:R[-1]C[46]) -> 0 | AR77: =SUM(R[-27]C[46]:R[-1]C[46]) -> 25 | AS77: =SUM(R[-27]C[46]:R[-1]C[46]) -> 0 | AT77: =SUM(R[-27]C[46]:R[-1]C[46]) -> 0 | AU77: =SUM(R[-27]C[46]:R[-1]C[46]) -> 8910000 | AV77: =SUM(R[-27]C[46]:R[-1]C[46]) -> 0 | AW77: =SUM(R[-27]C[46]:R[-1]C[46]) -> 0 | AX77: =SUM(R[-27]C[46]:R[-1]C[46]) -> 0 | AY77: =SUM(R[-27]C[46]:R[-1]C[46]) -> 0
A78: Phòng Phục vụ kỹ thuật sân đỗ (HGS) | F78: =R[28]C -> 8280000 | G78: =R[28]C -> 0 | H78: =R[28]C -> 0 | I78: =R[28]C -> 0 | J78: =R[28]C -> 0 | K78: =R[28]C -> 0 | L78: =R[28]C -> 0 | M78: =R[28]C -> 0 | N78: =R[28]C -> 0 | O78: =R[28]C -> 0 | P78: =R[28]C -> 0 | Q78: =R[28]C -> 8280000 | R78: =R[28]C -> 0 | S78: =R[28]C -> 0 | T78: =R[28]C -> 0 | U78: =R[28]C -> 82800 | V78: =R[28]C -> 0 | W78: =R[28]C -> 8197200 | X78: =R[28]C -> 0 | Y78: =R[28]C -> 0 | Z78: =R[28]C -> 0 | AA78: =R[28]C -> 0 | AB78: =R[28]C -> 0 | AC78: =R[28]C -> 0 | AD78: =R[28]C -> 0 | AE78: =R[28]C -> 0 | AF78: =R[28]C -> 0 | AG78: =R[28]C -> 0 | AH78: =R[28]C -> 0 | AI78: =R[28]C -> 8280000 | AJ78: =R[28]C -> 0 | AK78: =R[28]C -> 0 | AL78: =R[28]C -> 0 | AM78: =R[28]C -> 0 | AN78: =R[28]C -> 0 | AO78: =R[28]C -> 0 | AP78: =R[28]C -> 0 | AQ78: =R[28]C -> 0 | AR78: =R[28]C -> 23 | AS78: =R[28]C -> 0 | AT78: =R[28]C -> 0 | AU78: =R[28]C -> 8197200 | AW78: =R[28]C -> 0 | AX78: =R[28]C -> 0 | AY78: =R[28]C -> 0
A79: Đội phục vụ hành lý hàng hóa (HGS) | F79: =R[18]C -> 6120000 | G79: =R[18]C -> 0 | H79: =R[18]C -> 0 | I79: =R[18]C -> 0 | J79: =R[18]C -> 0 | K79: =R[18]C -> 0 | L79: =R[18]C -> 0 | M79: =R[18]C -> 0 | N79: =R[18]C -> 0 | O79: =R[18]C -> 0 | P79: =R[18]C -> 0 | Q79: =R[18]C -> 6120000 | R79: =R[18]C -> 0 | S79: =R[18]C -> 0 | T79: =R[18]C -> 0 | U79: =R[18]C -> 61200 | V79: =R[18]C -> 0 | W79: =R[18]C -> 6058800 | X79: =R[18]C -> 0 | Y79: =R[18]C -> 0 | Z79: =R[18]C -> 0 | AA79: =R[18]C -> 0 | AB79: =R[18]C -> 0 | AC79: =R[18]C -> 0 | AD79: =R[18]C -> 0 | AE79: =R[18]C -> 0 | AF79: =R[18]C -> 0 | AG79: =R[18]C -> 0 | AH79: =R[18]C -> 0 | AI79: =R[18]C -> 6120000 | AJ79: =R[18]C -> 0 | AK79: =R[18]C -> 0 | AL79: =R[18]C -> 0 | AM79: =R[18]C -> 0 | AN79: =R[18]C -> 0 | AO79: =R[18]C -> 0 | AP79: =R[18]C -> 0 | AQ79: =R[18]C -> 0 | AR79: =R[18]C -> 17 | AS79: =R[18]C -> 0 | AT79: =R[18]C -> 0 | AU79: =R[18]C -> 6058800 | AW79: =R[18]C -> 0 | AX79: =R[18]C -> 0 | AY79: =R[18]C -> 0
A80: 1 | B80: 013714 | C80: Nguyễn Công Cử | D80: Nhân viên Bốc xếp | F80: =RC[29]+RC[30]+RC[31]+RC[32]+RC[33]+RC[34]+RC[35]+RC[36]+RC[37] -> 360000 | G80: =RC[17]+RC[18]++RC[19]+RC[20]+RC[21]+RC[38]+RC[39]+RC[41] -> 0 | H80: 0 | I80: 0 | J80: =RC[-2]+RC[-1] -> 0 | K80: 0 | L80: 0 | M80: 0 | N80: =RC[15]+RC[16]+RC[17]+RC[18]+RC[19]+RC[20] -> 0 | O80: 0 | P80: 0 | Q80: 360000 | R80: 0 | S80: 0 | T80: 0 | U80: 3600 | V80: 0 | W80: 356400 | X80: 0 | Y80: 0 | Z80: 0 | AA80: 0 | AB80: 0 | AC80: 0 | AD80: 0 | AE80: 0 | AF80: 0 | AG80: 0 | AH80: 0 | AI80: 360000 | AJ80: 0 | AK80: 0 | AL80: 0 | AM80: 0 | AN80: 0 | AO80: 0 | AP80: 0 | AQ80: 0 | AR80: =1 -> 1 | AS80: 0 | AT80: 0 | AU80: =RC[-30]-RC[-29]-RC[-28]-RC[-27]-RC[-26]-RC[-25] -> 356400 | AV80: 0 | AW80: =RC[1]-RC[2] -> 0 | AX80: 0 | AY80: 0 | AZ80: =RC[-46] -> 360000 | BA80: =RC[-46] -> 0 | BB80: =RC[-46] -> 0 | BC80: =RC[-46] -> 0 | BD80: =RC[-46] -> 0 | BE80: =RC[-46] -> 0 | BF80: =RC[-46] -> 0 | BG80: =RC[-46] -> 0 | BH80: =RC[-46] -> 0 | BI80: =RC[-46] -> 0 | BJ80: =RC[-46] -> 0 | BK80: =RC[-46] -> 360000 | BL80: =RC[-46] -> 0 | BM80: =RC[-46] -> 0 | BN80: =RC[-46] -> 0 | BO80: =RC[-46] -> 3600 | BP80: =RC[-46] -> 0 | BQ80: =RC[-46] -> 356400 | BR80: =RC[-46] -> 0 | BS80: =RC[-46] -> 0 | BT80: =RC[-46] -> 0 | BU80: =RC[-46] -> 0 | BV80: =RC[-46] -> 0 | BW80: =RC[-46] -> 0 | BX80: =RC[-46] -> 0 | BY80: =RC[-46] -> 0 | BZ80: =RC[-46] -> 0 | CA80: =RC[-46] -> 0 | CB80: =RC[-46] -> 0 | CC80: =RC[-46] -> 360000 | CD80: =RC[-46] -> 0 | CE80: =RC[-46] -> 0 | CF80: =RC[-46] -> 0 | CG80: =RC[-46] -> 0 | CH80: =RC[-46] -> 0 | CI80: =RC[-46] -> 0 | CJ80: =RC[-46] -> 0 | CK80: =RC[-46] -> 0 | CL80: =RC[-46] -> 1 | CM80: =RC[-46] -> 0 | CN80: =RC[-46] -> 0 | CO80: =RC[-46] -> 356400 | CP80: =RC[-46] -> 0 | CQ80: =RC[-46] -> 0 | CR80: =RC[-46] -> 0 | CS80: =RC[-46] -> 0
A81: 2 | B81: 013730 | C81: Nguyễn Văn Trung | D81: Nhân viên Bốc xếp | F81: =RC[29]+RC[30]+RC[31]+RC[32]+RC[33]+RC[34]+RC[35]+RC[36]+RC[37] -> 360000 | G81: =RC[17]+RC[18]++RC[19]+RC[20]+RC[21]+RC[38]+RC[39]+RC[41] -> 0 | H81: 0 | I81: 0 | J81: =RC[-2]+RC[-1] -> 0 | K81: 0 | L81: 0 | M81: 0 | N81: =RC[15]+RC[16]+RC[17]+RC[18]+RC[19]+RC[20] -> 0 | O81: 0 | P81: 0 | Q81: 360000 | R81: 0 | S81: 0 | T81: 0 | U81: 3600 | V81: 0 | W81: 356400 | X81: 0 | Y81: 0 | Z81: 0 | AA81: 0 | AB81: 0 | AC81: 0 | AD81: 0 | AE81: 0 | AF81: 0 | AG81: 0 | AH81: 0 | AI81: 360000 | AJ81: 0 | AK81: 0 | AL81: 0 | AM81: 0 | AN81: 0 | AO81: 0 | AP81: 0 | AQ81: 0 | AR81: =1 -> 1 | AS81: 0 | AT81: 0 | AU81: =RC[-30]-RC[-29]-RC[-28]-RC[-27]-RC[-26]-RC[-25] -> 356400 | AV81: 0 | AW81: =RC[1]-RC[2] -> 0 | AX81: 0 | AY81: 0 | AZ81: =RC[-46] -> 360000 | BA81: =RC[-46] -> 0 | BB81: =RC[-46] -> 0 | BC81: =RC[-46] -> 0 | BD81: =RC[-46] -> 0 | BE81: =RC[-46] -> 0 | BF81: =RC[-46] -> 0 | BG81: =RC[-46] -> 0 | BH81: =RC[-46] -> 0 | BI81: =RC[-46] -> 0 | BJ81: =RC[-46] -> 0 | BK81: =RC[-46] -> 360000 | BL81: =RC[-46] -> 0 | BM81: =RC[-46] -> 0 | BN81: =RC[-46] -> 0 | BO81: =RC[-46] -> 3600 | BP81: =RC[-46] -> 0 | BQ81: =RC[-46] -> 356400 | BR81: =RC[-46] -> 0 | BS81: =RC[-46] -> 0 | BT81: =RC[-46] -> 0 | BU81: =RC[-46] -> 0 | BV81: =RC[-46] -> 0 | BW81: =RC[-46] -> 0 | BX81: =RC[-46] -> 0 | BY81: =RC[-46] -> 0 | BZ81: =RC[-46] -> 0 | CA81: =RC[-46] -> 0 | CB81: =RC[-46] -> 0 | CC81: =RC[-46] -> 360000 | CD81: =RC[-46] -> 0 | CE81: =RC[-46] -> 0 | CF81: =RC[-46] -> 0 | CG81: =RC[-46] -> 0 | CH81: =RC[-46] -> 0 | CI81: =RC[-46] -> 0 | CJ81: =RC[-46] -> 0 | CK81: =RC[-46] -> 0 | CL81: =RC[-46] -> 1 | CM81: =RC[-46] -> 0 | CN81: =RC[-46] -> 0 | CO81: =RC[-46] -> 356400 | CP81: =RC[-46] -> 0 | CQ81: =RC[-46] -> 0 | CR81: =RC[-46] -> 0 | CS81: =RC[-46] -> 0
A82: 3 | B82: 013731 | C82: Tạ Anh Tuấn | D82: Nhân viên Bốc xếp | F82: =RC[29]+RC[30]+RC[31]+RC[32]+RC[33]+RC[34]+RC[35]+RC[36]+RC[37] -> 360000 | G82: =RC[17]+RC[18]++RC[19]+RC[20]+RC[21]+RC[38]+RC[39]+RC[41] -> 0 | H82: 0 | I82: 0 | J82: =RC[-2]+RC[-1] -> 0 | K82: 0 | L82: 0 | M82: 0 | N82: =RC[15]+RC[16]+RC[17]+RC[18]+RC[19]+RC[20] -> 0 | O82: 0 | P82: 0 | Q82: 360000 | R82: 0 | S82: 0 | T82: 0 | U82: 3600 | V82: 0 | W82: 356400 | X82: 0 | Y82: 0 | Z82: 0 | AA82: 0 | AB82: 0 | AC82: 0 | AD82: 0 | AE82: 0 | AF82: 0 | AG82: 0 | AH82: 0 | AI82: 360000 | AJ82: 0 | AK82: 0 | AL82: 0 | AM82: 0 | AN82: 0 | AO82: 0 | AP82: 0 | AQ82: 0 | AR82: =1 -> 1 | AS82: 0 | AT82: 0 | AU82: =RC[-30]-RC[-29]-RC[-28]-RC[-27]-RC[-26]-RC[-25] -> 356400 | AV82: 0 | AW82: =RC[1]-RC[2] -> 0 | AX82: 0 | AY82: 0 | AZ82: =RC[-46] -> 360000 | BA82: =RC[-46] -> 0 | BB82: =RC[-46] -> 0 | BC82: =RC[-46] -> 0 | BD82: =RC[-46] -> 0 | BE82: =RC[-46] -> 0 | BF82: =RC[-46] -> 0 | BG82: =RC[-46] -> 0 | BH82: =RC[-46] -> 0 | BI82: =RC[-46] -> 0 | BJ82: =RC[-46] -> 0 | BK82: =RC[-46] -> 360000 | BL82: =RC[-46] -> 0 | BM82: =RC[-46] -> 0 | BN82: =RC[-46] -> 0 | BO82: =RC[-46] -> 3600 | BP82: =RC[-46] -> 0 | BQ82: =RC[-46] -> 356400 | BR82: =RC[-46] -> 0 | BS82: =RC[-46] -> 0 | BT82: =RC[-46] -> 0 | BU82: =RC[-46] -> 0 | BV82: =RC[-46] -> 0 | BW82: =RC[-46] -> 0 | BX82: =RC[-46] -> 0 | BY82: =RC[-46] -> 0 | BZ82: =RC[-46] -> 0 | CA82: =RC[-46] -> 0 | CB82: =RC[-46] -> 0 | CC82: =RC[-46] -> 360000 | CD82: =RC[-46] -> 0 | CE82: =RC[-46] -> 0 | CF82: =RC[-46] -> 0 | CG82: =RC[-46] -> 0 | CH82: =RC[-46] -> 0 | CI82: =RC[-46] -> 0 | CJ82: =RC[-46] -> 0 | CK82: =RC[-46] -> 0 | CL82: =RC[-46] -> 1 | CM82: =RC[-46] -> 0 | CN82: =RC[-46] -> 0 | CO82: =RC[-46] -> 356400 | CP82: =RC[-46] -> 0 | CQ82: =RC[-46] -> 0 | CR82: =RC[-46] -> 0 | CS82: =RC[-46] -> 0
A83: 4 | B83: 013732 | C83: Nguyễn Sơn Tùng | D83: Nhân viên Bốc xếp | F83: =RC[29]+RC[30]+RC[31]+RC[32]+RC[33]+RC[34]+RC[35]+RC[36]+RC[37] -> 360000 | G83: =RC[17]+RC[18]++RC[19]+RC[20]+RC[21]+RC[38]+RC[39]+RC[41] -> 0 | H83: 0 | I83: 0 | J83: =RC[-2]+RC[-1] -> 0 | K83: 0 | L83: 0 | M83: 0 | N83: =RC[15]+RC[16]+RC[17]+RC[18]+RC[19]+RC[20] -> 0 | O83: 0 | P83: 0 | Q83: 360000 | R83: 0 | S83: 0 | T83: 0 | U83: 3600 | V83: 0 | W83: 356400 | X83: 0 | Y83: 0 | Z83: 0 | AA83: 0 | AB83: 0 | AC83: 0 | AD83: 0 | AE83: 0 | AF83: 0 | AG83: 0 | AH83: 0 | AI83: 360000 | AJ83: 0 | AK83: 0 | AL83: 0 | AM83: 0 | AN83: 0 | AO83: 0 | AP83: 0 | AQ83: 0 | AR83: =1 -> 1 | AS83: 0 | AT83: 0 | AU83: =RC[-30]-RC[-29]-RC[-28]-RC[-27]-RC[-26]-RC[-25] -> 356400 | AV83: 0 | AW83: =RC[1]-RC[2] -> 0 | AX83: 0 | AY83: 0 | AZ83: =RC[-46] -> 360000 | BA83: =RC[-46] -> 0 | BB83: =RC[-46] -> 0 | BC83: =RC[-46] -> 0 | BD83: =RC[-46] -> 0 | BE83: =RC[-46] -> 0 | BF83: =RC[-46] -> 0 | BG83: =RC[-46] -> 0 | BH83: =RC[-46] -> 0 | BI83: =RC[-46] -> 0 | BJ83: =RC[-46] -> 0 | BK83: =RC[-46] -> 360000 | BL83: =RC[-46] -> 0 | BM83: =RC[-46] -> 0 | BN83: =RC[-46] -> 0 | BO83: =RC[-46] -> 3600 | BP83: =RC[-46] -> 0 | BQ83: =RC[-46] -> 356400 | BR83: =RC[-46] -> 0 | BS83: =RC[-46] -> 0 | BT83: =RC[-46] -> 0 | BU83: =RC[-46] -> 0 | BV83: =RC[-46] -> 0 | BW83: =RC[-46] -> 0 | BX83: =RC[-46] -> 0 | BY83: =RC[-46] -> 0 | BZ83: =RC[-46] -> 0 | CA83: =RC[-46] -> 0 | CB83: =RC[-46] -> 0 | CC83: =RC[-46] -> 360000 | CD83: =RC[-46] -> 0 | CE83: =RC[-46] -> 0 | CF83: =RC[-46] -> 0 | CG83: =RC[-46] -> 0 | CH83: =RC[-46] -> 0 | CI83: =RC[-46] -> 0 | CJ83: =RC[-46] -> 0 | CK83: =RC[-46] -> 0 | CL83: =RC[-46] -> 1 | CM83: =RC[-46] -> 0 | CN83: =RC[-46] -> 0 | CO83: =RC[-46] -> 356400 | CP83: =RC[-46] -> 0 | CQ83: =RC[-46] -> 0 | CR83: =RC[-46] -> 0 | CS83: =RC[-46] -> 0
A84: 5 | B84: 013733 | C84: Nguyễn Mạnh Hân Hoan | D84: Nhân viên Bốc xếp | F84: =RC[29]+RC[30]+RC[31]+RC[32]+RC[33]+RC[34]+RC[35]+RC[36]+RC[37] -> 360000 | G84: =RC[17]+RC[18]++RC[19]+RC[20]+RC[21]+RC[38]+RC[39]+RC[41] -> 0 | H84: 0 | I84: 0 | J84: =RC[-2]+RC[-1] -> 0 | K84: 0 | L84: 0 | M84: 0 | N84: =RC[15]+RC[16]+RC[17]+RC[18]+RC[19]+RC[20] -> 0 | O84: 0 | P84: 0 | Q84: 360000 | R84: 0 | S84: 0 | T84: 0 | U84: 3600 | V84: 0 | W84: 356400 | X84: 0 | Y84: 0 | Z84: 0 | AA84: 0 | AB84: 0 | AC84: 0 | AD84: 0 | AE84: 0 | AF84: 0 | AG84: 0 | AH84: 0 | AI84: 360000 | AJ84: 0 | AK84: 0 | AL84: 0 | AM84: 0 | AN84: 0 | AO84: 0 | AP84: 0 | AQ84: 0 | AR84: =1 -> 1 | AS84: 0 | AT84: 0 | AU84: =RC[-30]-RC[-29]-RC[-28]-RC[-27]-RC[-26]-RC[-25] -> 356400 | AV84: 0 | AW84: =RC[1]-RC[2] -> 0 | AX84: 0 | AY84: 0 | AZ84: =RC[-46] -> 360000 | BA84: =RC[-46] -> 0 | BB84: =RC[-46] -> 0 | BC84: =RC[-46] -> 0 | BD84: =RC[-46] -> 0 | BE84: =RC[-46] -> 0 | BF84: =RC[-46] -> 0 | BG84: =RC[-46] -> 0 | BH84: =RC[-46] -> 0 | BI84: =RC[-46] -> 0 | BJ84: =RC[-46] -> 0 | BK84: =RC[-46] -> 360000 | BL84: =RC[-46] -> 0 | BM84: =RC[-46] -> 0 | BN84: =RC[-46] -> 0 | BO84: =RC[-46] -> 3600 | BP84: =RC[-46] -> 0 | BQ84: =RC[-46] -> 356400 | BR84: =RC[-46] -> 0 | BS84: =RC[-46] -> 0 | BT84: =RC[-46] -> 0 | BU84: =RC[-46] -> 0 | BV84: =RC[-46] -> 0 | BW84: =RC[-46] -> 0 | BX84: =RC[-46] -> 0 | BY84: =RC[-46] -> 0 | BZ84: =RC[-46] -> 0 | CA84: =RC[-46] -> 0 | CB84: =RC[-46] -> 0 | CC84: =RC[-46] -> 360000 | CD84: =RC[-46] -> 0 | CE84: =RC[-46] -> 0 | CF84: =RC[-46] -> 0 | CG84: =RC[-46] -> 0 | CH84: =RC[-46] -> 0 | CI84: =RC[-46] -> 0 | CJ84: =RC[-46] -> 0 | CK84: =RC[-46] -> 0 | CL84: =RC[-46] -> 1 | CM84: =RC[-46] -> 0 | CN84: =RC[-46] -> 0 | CO84: =RC[-46] -> 356400 | CP84: =RC[-46] -> 0 | CQ84: =RC[-46] -> 0 | CR84: =RC[-46] -> 0 | CS84: =RC[-46] -> 0
A85: 6 | B85: 013734 | C85: Nguyễn Hữu Lâm | D85: Nhân viên Bốc xếp | F85: =RC[29]+RC[30]+RC[31]+RC[32]+RC[33]+RC[34]+RC[35]+RC[36]+RC[37] -> 360000 | G85: =RC[17]+RC[18]++RC[19]+RC[20]+RC[21]+RC[38]+RC[39]+RC[41] -> 0 | H85: 0 | I85: 0 | J85: =RC[-2]+RC[-1] -> 0 | K85: 0 | L85: 0 | M85: 0 | N85: =RC[15]+RC[16]+RC[17]+RC[18]+RC[19]+RC[20] -> 0 | O85: 0 | P85: 0 | Q85: 360000 | R85: 0 | S85: 0 | T85: 0 | U85: 3600 | V85: 0 | W85: 356400 | X85: 0 | Y85: 0 | Z85: 0 | AA85: 0 | AB85: 0 | AC85: 0 | AD85: 0 | AE85: 0 | AF85: 0 | AG85: 0 | AH85: 0 | AI85: 360000 | AJ85: 0 | AK85: 0 | AL85: 0 | AM85: 0 | AN85: 0 | AO85: 0 | AP85: 0 | AQ85: 0 | AR85: =1 -> 1 | AS85: 0 | AT85: 0 | AU85: =RC[-30]-RC[-29]-RC[-28]-RC[-27]-RC[-26]-RC[-25] -> 356400 | AV85: 0 | AW85: =RC[1]-RC[2] -> 0 | AX85: 0 | AY85: 0 | AZ85: =RC[-46] -> 360000 | BA85: =RC[-46] -> 0 | BB85: =RC[-46] -> 0 | BC85: =RC[-46] -> 0 | BD85: =RC[-46] -> 0 | BE85: =RC[-46] -> 0 | BF85: =RC[-46] -> 0 | BG85: =RC[-46] -> 0 | BH85: =RC[-46] -> 0 | BI85: =RC[-46] -> 0 | BJ85: =RC[-46] -> 0 | BK85: =RC[-46] -> 360000 | BL85: =RC[-46] -> 0 | BM85: =RC[-46] -> 0 | BN85: =RC[-46] -> 0 | BO85: =RC[-46] -> 3600 | BP85: =RC[-46] -> 0 | BQ85: =RC[-46] -> 356400 | BR85: =RC[-46] -> 0 | BS85: =RC[-46] -> 0 | BT85: =RC[-46] -> 0 | BU85: =RC[-46] -> 0 | BV85: =RC[-46] -> 0 | BW85: =RC[-46] -> 0 | BX85: =RC[-46] -> 0 | BY85: =RC[-46] -> 0 | BZ85: =RC[-46] -> 0 | CA85: =RC[-46] -> 0 | CB85: =RC[-46] -> 0 | CC85: =RC[-46] -> 360000 | CD85: =RC[-46] -> 0 | CE85: =RC[-46] -> 0 | CF85: =RC[-46] -> 0 | CG85: =RC[-46] -> 0 | CH85: =RC[-46] -> 0 | CI85: =RC[-46] -> 0 | CJ85: =RC[-46] -> 0 | CK85: =RC[-46] -> 0 | CL85: =RC[-46] -> 1 | CM85: =RC[-46] -> 0 | CN85: =RC[-46] -> 0 | CO85: =RC[-46] -> 356400 | CP85: =RC[-46] -> 0 | CQ85: =RC[-46] -> 0 | CR85: =RC[-46] -> 0 | CS85: =RC[-46] -> 0
A86: 7 | B86: 013735 | C86: Trần Xuân Phương | D86: Nhân viên Bốc xếp | F86: =RC[29]+RC[30]+RC[31]+RC[32]+RC[33]+RC[34]+RC[35]+RC[36]+RC[37] -> 360000 | G86: =RC[17]+RC[18]++RC[19]+RC[20]+RC[21]+RC[38]+RC[39]+RC[41] -> 0 | H86: 0 | I86: 0 | J86: =RC[-2]+RC[-1] -> 0 | K86: 0 | L86: 0 | M86: 0 | N86: =RC[15]+RC[16]+RC[17]+RC[18]+RC[19]+RC[20] -> 0 | O86: 0 | P86: 0 | Q86: 360000 | R86: 0 | S86: 0 | T86: 0 | U86: 3600 | V86: 0 | W86: 356400 | X86: 0 | Y86: 0 | Z86: 0 | AA86: 0 | AB86: 0 | AC86: 0 | AD86: 0 | AE86: 0 | AF86: 0 | AG86: 0 | AH86: 0 | AI86: 360000 | AJ86: 0 | AK86: 0 | AL86: 0 | AM86: 0 | AN86: 0 | AO86: 0 | AP86: 0 | AQ86: 0 | AR86: =1 -> 1 | AS86: 0 | AT86: 0 | AU86: =RC[-30]-RC[-29]-RC[-28]-RC[-27]-RC[-26]-RC[-25] -> 356400 | AV86: 0 | AW86: =RC[1]-RC[2] -> 0 | AX86: 0 | AY86: 0 | AZ86: =RC[-46] -> 360000 | BA86: =RC[-46] -> 0 | BB86: =RC[-46] -> 0 | BC86: =RC[-46] -> 0 | BD86: =RC[-46] -> 0 | BE86: =RC[-46] -> 0 | BF86: =RC[-46] -> 0 | BG86: =RC[-46] -> 0 | BH86: =RC[-46] -> 0 | BI86: =RC[-46] -> 0 | BJ86: =RC[-46] -> 0 | BK86: =RC[-46] -> 360000 | BL86: =RC[-46] -> 0 | BM86: =RC[-46] -> 0 | BN86: =RC[-46] -> 0 | BO86: =RC[-46] -> 3600 | BP86: =RC[-46] -> 0 | BQ86: =RC[-46] -> 356400 | BR86: =RC[-46] -> 0 | BS86: =RC[-46] -> 0 | BT86: =RC[-46] -> 0 | BU86: =RC[-46] -> 0 | BV86: =RC[-46] -> 0 | BW86: =RC[-46] -> 0 | BX86: =RC[-46] -> 0 | BY86: =RC[-46] -> 0 | BZ86: =RC[-46] -> 0 | CA86: =RC[-46] -> 0 | CB86: =RC[-46] -> 0 | CC86: =RC[-46] -> 360000 | CD86: =RC[-46] -> 0 | CE86: =RC[-46] -> 0 | CF86: =RC[-46] -> 0 | CG86: =RC[-46] -> 0 | CH86: =RC[-46] -> 0 | CI86: =RC[-46] -> 0 | CJ86: =RC[-46] -> 0 | CK86: =RC[-46] -> 0 | CL86: =RC[-46] -> 1 | CM86: =RC[-46] -> 0 | CN86: =RC[-46] -> 0 | CO86: =RC[-46] -> 356400 | CP86: =RC[-46] -> 0 | CQ86: =RC[-46] -> 0 | CR86: =RC[-46] -> 0 | CS86: =RC[-46] -> 0
A87: 8 | B87: 013736 | C87: Nguyễn Mạnh Tưởng | D87: Nhân viên Bốc xếp | F87: =RC[29]+RC[30]+RC[31]+RC[32]+RC[33]+RC[34]+RC[35]+RC[36]+RC[37] -> 360000 | G87: =RC[17]+RC[18]++RC[19]+RC[20]+RC[21]+RC[38]+RC[39]+RC[41] -> 0 | H87: 0 | I87: 0 | J87: =RC[-2]+RC[-1] -> 0 | K87: 0 | L87: 0 | M87: 0 | N87: =RC[15]+RC[16]+RC[17]+RC[18]+RC[19]+RC[20] -> 0 | O87: 0 | P87: 0 | Q87: 360000 | R87: 0 | S87: 0 | T87: 0 | U87: 3600 | V87: 0 | W87: 356400 | X87: 0 | Y87: 0 | Z87: 0 | AA87: 0 | AB87: 0 | AC87: 0 | AD87: 0 | AE87: 0 | AF87: 0 | AG87: 0 | AH87: 0 | AI87: 360000 | AJ87: 0 | AK87: 0 | AL87: 0 | AM87: 0 | AN87: 0 | AO87: 0 | AP87: 0 | AQ87: 0 | AR87: =1 -> 1 | AS87: 0 | AT87: 0 | AU87: =RC[-30]-RC[-29]-RC[-28]-RC[-27]-RC[-26]-RC[-25] -> 356400 | AV87: 0 | AW87: =RC[1]-RC[2] -> 0 | AX87: 0 | AY87: 0 | AZ87: =RC[-46] -> 360000 | BA87: =RC[-46] -> 0 | BB87: =RC[-46] -> 0 | BC87: =RC[-46] -> 0 | BD87: =RC[-46] -> 0 | BE87: =RC[-46] -> 0 | BF87: =RC[-46] -> 0 | BG87: =RC[-46] -> 0 | BH87: =RC[-46] -> 0 | BI87: =RC[-46] -> 0 | BJ87: =RC[-46] -> 0 | BK87: =RC[-46] -> 360000 | BL87: =RC[-46] -> 0 | BM87: =RC[-46] -> 0 | BN87: =RC[-46] -> 0 | BO87: =RC[-46] -> 3600 | BP87: =RC[-46] -> 0 | BQ87: =RC[-46] -> 356400 | BR87: =RC[-46] -> 0 | BS87: =RC[-46] -> 0 | BT87: =RC[-46] -> 0 | BU87: =RC[-46] -> 0 | BV87: =RC[-46] -> 0 | BW87: =RC[-46] -> 0 | BX87: =RC[-46] -> 0 | BY87: =RC[-46] -> 0 | BZ87: =RC[-46] -> 0 | CA87: =RC[-46] -> 0 | CB87: =RC[-46] -> 0 | CC87: =RC[-46] -> 360000 | CD87: =RC[-46] -> 0 | CE87: =RC[-46] -> 0 | CF87: =RC[-46] -> 0 | CG87: =RC[-46] -> 0 | CH87: =RC[-46] -> 0 | CI87: =RC[-46] -> 0 | CJ87: =RC[-46] -> 0 | CK87: =RC[-46] -> 0 | CL87: =RC[-46] -> 1 | CM87: =RC[-46] -> 0 | CN87: =RC[-46] -> 0 | CO87: =RC[-46] -> 356400 | CP87: =RC[-46] -> 0 | CQ87: =RC[-46] -> 0 | CR87: =RC[-46] -> 0 | CS87: =RC[-46] -> 0
A88: 9 | B88: 013737 | C88: Nguyễn Minh Hiếu | D88: Nhân viên Bốc xếp | F88: =RC[29]+RC[30]+RC[31]+RC[32]+RC[33]+RC[34]+RC[35]+RC[36]+RC[37] -> 360000 | G88: =RC[17]+RC[18]++RC[19]+RC[20]+RC[21]+RC[38]+RC[39]+RC[41] -> 0 | H88: 0 | I88: 0 | J88: =RC[-2]+RC[-1] -> 0 | K88: 0 | L88: 0 | M88: 0 | N88: =RC[15]+RC[16]+RC[17]+RC[18]+RC[19]+RC[20] -> 0 | O88: 0 | P88: 0 | Q88: 360000 | R88: 0 | S88: 0 | T88: 0 | U88: 3600 | V88: 0 | W88: 356400 | X88: 0 | Y88: 0 | Z88: 0 | AA88: 0 | AB88: 0 | AC88: 0 | AD88: 0 | AE88: 0 | AF88: 0 | AG88: 0 | AH88: 0 | AI88: 360000 | AJ88: 0 | AK88: 0 | AL88: 0 | AM88: 0 | AN88: 0 | AO88: 0 | AP88: 0 | AQ88: 0 | AR88: =1 -> 1 | AS88: 0 | AT88: 0 | AU88: =RC[-30]-RC[-29]-RC[-28]-RC[-27]-RC[-26]-RC[-25] -> 356400 | AV88: 0 | AW88: =RC[1]-RC[2] -> 0 | AX88: 0 | AY88: 0 | AZ88: =RC[-46] -> 360000 | BA88: =RC[-46] -> 0 | BB88: =RC[-46] -> 0 | BC88: =RC[-46] -> 0 | BD88: =RC[-46] -> 0 | BE88: =RC[-46] -> 0 | BF88: =RC[-46] -> 0 | BG88: =RC[-46] -> 0 | BH88: =RC[-46] -> 0 | BI88: =RC[-46] -> 0 | BJ88: =RC[-46] -> 0 | BK88: =RC[-46] -> 360000 | BL88: =RC[-46] -> 0 | BM88: =RC[-46] -> 0 | BN88: =RC[-46] -> 0 | BO88: =RC[-46] -> 3600 | BP88: =RC[-46] -> 0 | BQ88: =RC[-46] -> 356400 | BR88: =RC[-46] -> 0 | BS88: =RC[-46] -> 0 | BT88: =RC[-46] -> 0 | BU88: =RC[-46] -> 0 | BV88: =RC[-46] -> 0 | BW88: =RC[-46] -> 0 | BX88: =RC[-46] -> 0 | BY88: =RC[-46] -> 0 | BZ88: =RC[-46] -> 0 | CA88: =RC[-46] -> 0 | CB88: =RC[-46] -> 0 | CC88: =RC[-46] -> 360000 | CD88: =RC[-46] -> 0 | CE88: =RC[-46] -> 0 | CF88: =RC[-46] -> 0 | CG88: =RC[-46] -> 0 | CH88: =RC[-46] -> 0 | CI88: =RC[-46] -> 0 | CJ88: =RC[-46] -> 0 | CK88: =RC[-46] -> 0 | CL88: =RC[-46] -> 1 | CM88: =RC[-46] -> 0 | CN88: =RC[-46] -> 0 | CO88: =RC[-46] -> 356400 | CP88: =RC[-46] -> 0 | CQ88: =RC[-46] -> 0 | CR88: =RC[-46] -> 0 | CS88: =RC[-46] -> 0
A89: 10 | B89: 013738 | C89: Lê Văn Hợi | D89: Nhân viên Bốc xếp | F89: =RC[29]+RC[30]+RC[31]+RC[32]+RC[33]+RC[34]+RC[35]+RC[36]+RC[37] -> 360000 | G89: =RC[17]+RC[18]++RC[19]+RC[20]+RC[21]+RC[38]+RC[39]+RC[41] -> 0 | H89: 0 | I89: 0 | J89: =RC[-2]+RC[-1] -> 0 | K89: 0 | L89: 0 | M89: 0 | N89: =RC[15]+RC[16]+RC[17]+RC[18]+RC[19]+RC[20] -> 0 | O89: 0 | P89: 0 | Q89: 360000 | R89: 0 | S89: 0 | T89: 0 | U89: 3600 | V89: 0 | W89: 356400 | X89: 0 | Y89: 0 | Z89: 0 | AA89: 0 | AB89: 0 | AC89: 0 | AD89: 0 | AE89: 0 | AF89: 0 | AG89: 0 | AH89: 0 | AI89: 360000 | AJ89: 0 | AK89: 0 | AL89: 0 | AM89: 0 | AN89: 0 | AO89: 0 | AP89: 0 | AQ89: 0 | AR89: =1 -> 1 | AS89: 0 | AT89: 0 | AU89: =RC[-30]-RC[-29]-RC[-28]-RC[-27]-RC[-26]-RC[-25] -> 356400 | AV89: 0 | AW89: =RC[1]-RC[2] -> 0 | AX89: 0 | AY89: 0 | AZ89: =RC[-46] -> 360000 | BA89: =RC[-46] -> 0 | BB89: =RC[-46] -> 0 | BC89: =RC[-46] -> 0 | BD89: =RC[-46] -> 0 | BE89: =RC[-46] -> 0 | BF89: =RC[-46] -> 0 | BG89: =RC[-46] -> 0 | BH89: =RC[-46] -> 0 | BI89: =RC[-46] -> 0 | BJ89: =RC[-46] -> 0 | BK89: =RC[-46] -> 360000 | BL89: =RC[-46] -> 0 | BM89: =RC[-46] -> 0 | BN89: =RC[-46] -> 0 | BO89: =RC[-46] -> 3600 | BP89: =RC[-46] -> 0 | BQ89: =RC[-46] -> 356400 | BR89: =RC[-46] -> 0 | BS89: =RC[-46] -> 0 | BT89: =RC[-46] -> 0 | BU89: =RC[-46] -> 0 | BV89: =RC[-46] -> 0 | BW89: =RC[-46] -> 0 | BX89: =RC[-46] -> 0 | BY89: =RC[-46] -> 0 | BZ89: =RC[-46] -> 0 | CA89: =RC[-46] -> 0 | CB89: =RC[-46] -> 0 | CC89: =RC[-46] -> 360000 | CD89: =RC[-46] -> 0 | CE89: =RC[-46] -> 0 | CF89: =RC[-46] -> 0 | CG89: =RC[-46] -> 0 | CH89: =RC[-46] -> 0 | CI89: =RC[-46] -> 0 | CJ89: =RC[-46] -> 0 | CK89: =RC[-46] -> 0 | CL89: =RC[-46] -> 1 | CM89: =RC[-46] -> 0 | CN89: =RC[-46] -> 0 | CO89: =RC[-46] -> 356400 | CP89: =RC[-46] -> 0 | CQ89: =RC[-46] -> 0 | CR89: =RC[-46] -> 0 | CS89: =RC[-46] -> 0
A90: 11 | B90: 013739 | C90: Bùi Đình Cảnh | D90: Nhân viên Bốc xếp | F90: =RC[29]+RC[30]+RC[31]+RC[32]+RC[33]+RC[34]+RC[35]+RC[36]+RC[37] -> 360000 | G90: =RC[17]+RC[18]++RC[19]+RC[20]+RC[21]+RC[38]+RC[39]+RC[41] -> 0 | H90: 0 | I90: 0 | J90: =RC[-2]+RC[-1] -> 0 | K90: 0 | L90: 0 | M90: 0 | N90: =RC[15]+RC[16]+RC[17]+RC[18]+RC[19]+RC[20] -> 0 | O90: 0 | P90: 0 | Q90: 360000 | R90: 0 | S90: 0 | T90: 0 | U90: 3600 | V90: 0 | W90: 356400 | X90: 0 | Y90: 0 | Z90: 0 | AA90: 0 | AB90: 0 | AC90: 0 | AD90: 0 | AE90: 0 | AF90: 0 | AG90: 0 | AH90: 0 | AI90: 360000 | AJ90: 0 | AK90: 0 | AL90: 0 | AM90: 0 | AN90: 0 | AO90: 0 | AP90: 0 | AQ90: 0 | AR90: =1 -> 1 | AS90: 0 | AT90: 0 | AU90: =RC[-30]-RC[-29]-RC[-28]-RC[-27]-RC[-26]-RC[-25] -> 356400 | AV90: 0 | AW90: =RC[1]-RC[2] -> 0 | AX90: 0 | AY90: 0 | AZ90: =RC[-46] -> 360000 | BA90: =RC[-46] -> 0 | BB90: =RC[-46] -> 0 | BC90: =RC[-46] -> 0 | BD90: =RC[-46] -> 0 | BE90: =RC[-46] -> 0 | BF90: =RC[-46] -> 0 | BG90: =RC[-46] -> 0 | BH90: =RC[-46] -> 0 | BI90: =RC[-46] -> 0 | BJ90: =RC[-46] -> 0 | BK90: =RC[-46] -> 360000 | BL90: =RC[-46] -> 0 | BM90: =RC[-46] -> 0 | BN90: =RC[-46] -> 0 | BO90: =RC[-46] -> 3600 | BP90: =RC[-46] -> 0 | BQ90: =RC[-46] -> 356400 | BR90: =RC[-46] -> 0 | BS90: =RC[-46] -> 0 | BT90: =RC[-46] -> 0 | BU90: =RC[-46] -> 0 | BV90: =RC[-46] -> 0 | BW90: =RC[-46] -> 0 | BX90: =RC[-46] -> 0 | BY90: =RC[-46] -> 0 | BZ90: =RC[-46] -> 0 | CA90: =RC[-46] -> 0 | CB90: =RC[-46] -> 0 | CC90: =RC[-46] -> 360000 | CD90: =RC[-46] -> 0 | CE90: =RC[-46] -> 0 | CF90: =RC[-46] -> 0 | CG90: =RC[-46] -> 0 | CH90: =RC[-46] -> 0 | CI90: =RC[-46] -> 0 | CJ90: =RC[-46] -> 0 | CK90: =RC[-46] -> 0 | CL90: =RC[-46] -> 1 | CM90: =RC[-46] -> 0 | CN90: =RC[-46] -> 0 | CO90: =RC[-46] -> 356400 | CP90: =RC[-46] -> 0 | CQ90: =RC[-46] -> 0 | CR90: =RC[-46] -> 0 | CS90: =RC[-46] -> 0
A91: 12 | B91: 013740 | C91: Nguyễn Đức Duy | D91: Nhân viên Bốc xếp | F91: =RC[29]+RC[30]+RC[31]+RC[32]+RC[33]+RC[34]+RC[35]+RC[36]+RC[37] -> 360000 | G91: =RC[17]+RC[18]++RC[19]+RC[20]+RC[21]+RC[38]+RC[39]+RC[41] -> 0 | H91: 0 | I91: 0 | J91: =RC[-2]+RC[-1] -> 0 | K91: 0 | L91: 0 | M91: 0 | N91: =RC[15]+RC[16]+RC[17]+RC[18]+RC[19]+RC[20] -> 0 | O91: 0 | P91: 0 | Q91: 360000 | R91: 0 | S91: 0 | T91: 0 | U91: 3600 | V91: 0 | W91: 356400 | X91: 0 | Y91: 0 | Z91: 0 | AA91: 0 | AB91: 0 | AC91: 0 | AD91: 0 | AE91: 0 | AF91: 0 | AG91: 0 | AH91: 0 | AI91: 360000 | AJ91: 0 | AK91: 0 | AL91: 0 | AM91: 0 | AN91: 0 | AO91: 0 | AP91: 0 | AQ91: 0 | AR91: =1 -> 1 | AS91: 0 | AT91: 0 | AU91: =RC[-30]-RC[-29]-RC[-28]-RC[-27]-RC[-26]-RC[-25] -> 356400 | AV91: 0 | AW91: =RC[1]-RC[2] -> 0 | AX91: 0 | AY91: 0 | AZ91: =RC[-46] -> 360000 | BA91: =RC[-46] -> 0 | BB91: =RC[-46] -> 0 | BC91: =RC[-46] -> 0 | BD91: =RC[-46] -> 0 | BE91: =RC[-46] -> 0 | BF91: =RC[-46] -> 0 | BG91: =RC[-46] -> 0 | BH91: =RC[-46] -> 0 | BI91: =RC[-46] -> 0 | BJ91: =RC[-46] -> 0 | BK91: =RC[-46] -> 360000 | BL91: =RC[-46] -> 0 | BM91: =RC[-46] -> 0 | BN91: =RC[-46] -> 0 | BO91: =RC[-46] -> 3600 | BP91: =RC[-46] -> 0 | BQ91: =RC[-46] -> 356400 | BR91: =RC[-46] -> 0 | BS91: =RC[-46] -> 0 | BT91: =RC[-46] -> 0 | BU91: =RC[-46] -> 0 | BV91: =RC[-46] -> 0 | BW91: =RC[-46] -> 0 | BX91: =RC[-46] -> 0 | BY91: =RC[-46] -> 0 | BZ91: =RC[-46] -> 0 | CA91: =RC[-46] -> 0 | CB91: =RC[-46] -> 0 | CC91: =RC[-46] -> 360000 | CD91: =RC[-46] -> 0 | CE91: =RC[-46] -> 0 | CF91: =RC[-46] -> 0 | CG91: =RC[-46] -> 0 | CH91: =RC[-46] -> 0 | CI91: =RC[-46] -> 0 | CJ91: =RC[-46] -> 0 | CK91: =RC[-46] -> 0 | CL91: =RC[-46] -> 1 | CM91: =RC[-46] -> 0 | CN91: =RC[-46] -> 0 | CO91: =RC[-46] -> 356400 | CP91: =RC[-46] -> 0 | CQ91: =RC[-46] -> 0 | CR91: =RC[-46] -> 0 | CS91: =RC[-46] -> 0
A92: 13 | B92: 013741 | C92: Trương Trung Hải | D92: Nhân viên Bốc xếp | F92: =RC[29]+RC[30]+RC[31]+RC[32]+RC[33]+RC[34]+RC[35]+RC[36]+RC[37] -> 360000 | G92: =RC[17]+RC[18]++RC[19]+RC[20]+RC[21]+RC[38]+RC[39]+RC[41] -> 0 | H92: 0 | I92: 0 | J92: =RC[-2]+RC[-1] -> 0 | K92: 0 | L92: 0 | M92: 0 | N92: =RC[15]+RC[16]+RC[17]+RC[18]+RC[19]+RC[20] -> 0 | O92: 0 | P92: 0 | Q92: 360000 | R92: 0 | S92: 0 | T92: 0 | U92: 3600 | V92: 0 | W92: 356400 | X92: 0 | Y92: 0 | Z92: 0 | AA92: 0 | AB92: 0 | AC92: 0 | AD92: 0 | AE92: 0 | AF92: 0 | AG92: 0 | AH92: 0 | AI92: 360000 | AJ92: 0 | AK92: 0 | AL92: 0 | AM92: 0 | AN92: 0 | AO92: 0 | AP92: 0 | AQ92: 0 | AR92: =1 -> 1 | AS92: 0 | AT92: 0 | AU92: =RC[-30]-RC[-29]-RC[-28]-RC[-27]-RC[-26]-RC[-25] -> 356400 | AV92: 0 | AW92: =RC[1]-RC[2] -> 0 | AX92: 0 | AY92: 0 | AZ92: =RC[-46] -> 360000 | BA92: =RC[-46] -> 0 | BB92: =RC[-46] -> 0 | BC92: =RC[-46] -> 0 | BD92: =RC[-46] -> 0 | BE92: =RC[-46] -> 0 | BF92: =RC[-46] -> 0 | BG92: =RC[-46] -> 0 | BH92: =RC[-46] -> 0 | BI92: =RC[-46] -> 0 | BJ92: =RC[-46] -> 0 | BK92: =RC[-46] -> 360000 | BL92: =RC[-46] -> 0 | BM92: =RC[-46] -> 0 | BN92: =RC[-46] -> 0 | BO92: =RC[-46] -> 3600 | BP92: =RC[-46] -> 0 | BQ92: =RC[-46] -> 356400 | BR92: =RC[-46] -> 0 | BS92: =RC[-46] -> 0 | BT92: =RC[-46] -> 0 | BU92: =RC[-46] -> 0 | BV92: =RC[-46] -> 0 | BW92: =RC[-46] -> 0 | BX92: =RC[-46] -> 0 | BY92: =RC[-46] -> 0 | BZ92: =RC[-46] -> 0 | CA92: =RC[-46] -> 0 | CB92: =RC[-46] -> 0 | CC92: =RC[-46] -> 360000 | CD92: =RC[-46] -> 0 | CE92: =RC[-46] -> 0 | CF92: =RC[-46] -> 0 | CG92: =RC[-46] -> 0 | CH92: =RC[-46] -> 0 | CI92: =RC[-46] -> 0 | CJ92: =RC[-46] -> 0 | CK92: =RC[-46] -> 0 | CL92: =RC[-46] -> 1 | CM92: =RC[-46] -> 0 | CN92: =RC[-46] -> 0 | CO92: =RC[-46] -> 356400 | CP92: =RC[-46] -> 0 | CQ92: =RC[-46] -> 0 | CR92: =RC[-46] -> 0 | CS92: =RC[-46] -> 0
A93: 14 | B93: 013742 | C93: Nguyễn Hoàng Minh | D93: Nhân viên Bốc xếp | F93: =RC[29]+RC[30]+RC[31]+RC[32]+RC[33]+RC[34]+RC[35]+RC[36]+RC[37] -> 360000 | G93: =RC[17]+RC[18]++RC[19]+RC[20]+RC[21]+RC[38]+RC[39]+RC[41] -> 0 | H93: 0 | I93: 0 | J93: =RC[-2]+RC[-1] -> 0 | K93: 0 | L93: 0 | M93: 0 | N93: =RC[15]+RC[16]+RC[17]+RC[18]+RC[19]+RC[20] -> 0 | O93: 0 | P93: 0 | Q93: 360000 | R93: 0 | S93: 0 | T93: 0 | U93: 3600 | V93: 0 | W93: 356400 | X93: 0 | Y93: 0 | Z93: 0 | AA93: 0 | AB93: 0 | AC93: 0 | AD93: 0 | AE93: 0 | AF93: 0 | AG93: 0 | AH93: 0 | AI93: 360000 | AJ93: 0 | AK93: 0 | AL93: 0 | AM93: 0 | AN93: 0 | AO93: 0 | AP93: 0 | AQ93: 0 | AR93: =1 -> 1 | AS93: 0 | AT93: 0 | AU93: =RC[-30]-RC[-29]-RC[-28]-RC[-27]-RC[-26]-RC[-25] -> 356400 | AV93: 0 | AW93: =RC[1]-RC[2] -> 0 | AX93: 0 | AY93: 0 | AZ93: =RC[-46] -> 360000 | BA93: =RC[-46] -> 0 | BB93: =RC[-46] -> 0 | BC93: =RC[-46] -> 0 | BD93: =RC[-46] -> 0 | BE93: =RC[-46] -> 0 | BF93: =RC[-46] -> 0 | BG93: =RC[-46] -> 0 | BH93: =RC[-46] -> 0 | BI93: =RC[-46] -> 0 | BJ93: =RC[-46] -> 0 | BK93: =RC[-46] -> 360000 | BL93: =RC[-46] -> 0 | BM93: =RC[-46] -> 0 | BN93: =RC[-46] -> 0 | BO93: =RC[-46] -> 3600 | BP93: =RC[-46] -> 0 | BQ93: =RC[-46] -> 356400 | BR93: =RC[-46] -> 0 | BS93: =RC[-46] -> 0 | BT93: =RC[-46] -> 0 | BU93: =RC[-46] -> 0 | BV93: =RC[-46] -> 0 | BW93: =RC[-46] -> 0 | BX93: =RC[-46] -> 0 | BY93: =RC[-46] -> 0 | BZ93: =RC[-46] -> 0 | CA93: =RC[-46] -> 0 | CB93: =RC[-46] -> 0 | CC93: =RC[-46] -> 360000 | CD93: =RC[-46] -> 0 | CE93: =RC[-46] -> 0 | CF93: =RC[-46] -> 0 | CG93: =RC[-46] -> 0 | CH93: =RC[-46] -> 0 | CI93: =RC[-46] -> 0 | CJ93: =RC[-46] -> 0 | CK93: =RC[-46] -> 0 | CL93: =RC[-46] -> 1 | CM93: =RC[-46] -> 0 | CN93: =RC[-46] -> 0 | CO93: =RC[-46] -> 356400 | CP93: =RC[-46] -> 0 | CQ93: =RC[-46] -> 0 | CR93: =RC[-46] -> 0 | CS93: =RC[-46] -> 0
A94: 15 | B94: 013817 | C94: Cù Quốc Trịnh | D94: Nhân viên Bốc xếp | F94: =RC[29]+RC[30]+RC[31]+RC[32]+RC[33]+RC[34]+RC[35]+RC[36]+RC[37] -> 360000 | G94: =RC[17]+RC[18]++RC[19]+RC[20]+RC[21]+RC[38]+RC[39]+RC[41] -> 0 | H94: 0 | I94: 0 | J94: =RC[-2]+RC[-1] -> 0 | K94: 0 | L94: 0 | M94: 0 | N94: =RC[15]+RC[16]+RC[17]+RC[18]+RC[19]+RC[20] -> 0 | O94: 0 | P94: 0 | Q94: 360000 | R94: 0 | S94: 0 | T94: 0 | U94: 3600 | V94: 0 | W94: 356400 | X94: 0 | Y94: 0 | Z94: 0 | AA94: 0 | AB94: 0 | AC94: 0 | AD94: 0 | AE94: 0 | AF94: 0 | AG94: 0 | AH94: 0 | AI94: 360000 | AJ94: 0 | AK94: 0 | AL94: 0 | AM94: 0 | AN94: 0 | AO94: 0 | AP94: 0 | AQ94: 0 | AR94: =1 -> 1 | AS94: 0 | AT94: 0 | AU94: =RC[-30]-RC[-29]-RC[-28]-RC[-27]-RC[-26]-RC[-25] -> 356400 | AV94: 0 | AW94: =RC[1]-RC[2] -> 0 | AX94: 0 | AY94: 0 | AZ94: =RC[-46] -> 360000 | BA94: =RC[-46] -> 0 | BB94: =RC[-46] -> 0 | BC94: =RC[-46] -> 0 | BD94: =RC[-46] -> 0 | BE94: =RC[-46] -> 0 | BF94: =RC[-46] -> 0 | BG94: =RC[-46] -> 0 | BH94: =RC[-46] -> 0 | BI94: =RC[-46] -> 0 | BJ94: =RC[-46] -> 0 | BK94: =RC[-46] -> 360000 | BL94: =RC[-46] -> 0 | BM94: =RC[-46] -> 0 | BN94: =RC[-46] -> 0 | BO94: =RC[-46] -> 3600 | BP94: =RC[-46] -> 0 | BQ94: =RC[-46] -> 356400 | BR94: =RC[-46] -> 0 | BS94: =RC[-46] -> 0 | BT94: =RC[-46] -> 0 | BU94: =RC[-46] -> 0 | BV94: =RC[-46] -> 0 | BW94: =RC[-46] -> 0 | BX94: =RC[-46] -> 0 | BY94: =RC[-46] -> 0 | BZ94: =RC[-46] -> 0 | CA94: =RC[-46] -> 0 | CB94: =RC[-46] -> 0 | CC94: =RC[-46] -> 360000 | CD94: =RC[-46] -> 0 | CE94: =RC[-46] -> 0 | CF94: =RC[-46] -> 0 | CG94: =RC[-46] -> 0 | CH94: =RC[-46] -> 0 | CI94: =RC[-46] -> 0 | CJ94: =RC[-46] -> 0 | CK94: =RC[-46] -> 0 | CL94: =RC[-46] -> 1 | CM94: =RC[-46] -> 0 | CN94: =RC[-46] -> 0 | CO94: =RC[-46] -> 356400 | CP94: =RC[-46] -> 0 | CQ94: =RC[-46] -> 0 | CR94: =RC[-46] -> 0 | CS94: =RC[-46] -> 0
A95: 16 | B95: 013750 | C95: Lê Anh Hùng | D95: NV Lái xe - VHTTB | F95: =RC[29]+RC[30]+RC[31]+RC[32]+RC[33]+RC[34]+RC[35]+RC[36]+RC[37] -> 360000 | G95: =RC[17]+RC[18]++RC[19]+RC[20]+RC[21]+RC[38]+RC[39]+RC[41] -> 0 | H95: 0 | I95: 0 | J95: =RC[-2]+RC[-1] -> 0 | K95: 0 | L95: 0 | M95: 0 | N95: =RC[15]+RC[16]+RC[17]+RC[18]+RC[19]+RC[20] -> 0 | O95: 0 | P95: 0 | Q95: 360000 | R95: 0 | S95: 0 | T95: 0 | U95: 3600 | V95: 0 | W95: 356400 | X95: 0 | Y95: 0 | Z95: 0 | AA95: 0 | AB95: 0 | AC95: 0 | AD95: 0 | AE95: 0 | AF95: 0 | AG95: 0 | AH95: 0 | AI95: 360000 | AJ95: 0 | AK95: 0 | AL95: 0 | AM95: 0 | AN95: 0 | AO95: 0 | AP95: 0 | AQ95: 0 | AR95: =1 -> 1 | AS95: 0 | AT95: 0 | AU95: =RC[-30]-RC[-29]-RC[-28]-RC[-27]-RC[-26]-RC[-25] -> 356400 | AV95: 0 | AW95: =RC[1]-RC[2] -> 0 | AX95: 0 | AY95: 0 | AZ95: =RC[-46] -> 360000 | BA95: =RC[-46] -> 0 | BB95: =RC[-46] -> 0 | BC95: =RC[-46] -> 0 | BD95: =RC[-46] -> 0 | BE95: =RC[-46] -> 0 | BF95: =RC[-46] -> 0 | BG95: =RC[-46] -> 0 | BH95: =RC[-46] -> 0 | BI95: =RC[-46] -> 0 | BJ95: =RC[-46] -> 0 | BK95: =RC[-46] -> 360000 | BL95: =RC[-46] -> 0 | BM95: =RC[-46] -> 0 | BN95: =RC[-46] -> 0 | BO95: =RC[-46] -> 3600 | BP95: =RC[-46] -> 0 | BQ95: =RC[-46] -> 356400 | BR95: =RC[-46] -> 0 | BS95: =RC[-46] -> 0 | BT95: =RC[-46] -> 0 | BU95: =RC[-46] -> 0 | BV95: =RC[-46] -> 0 | BW95: =RC[-46] -> 0 | BX95: =RC[-46] -> 0 | BY95: =RC[-46] -> 0 | BZ95: =RC[-46] -> 0 | CA95: =RC[-46] -> 0 | CB95: =RC[-46] -> 0 | CC95: =RC[-46] -> 360000 | CD95: =RC[-46] -> 0 | CE95: =RC[-46] -> 0 | CF95: =RC[-46] -> 0 | CG95: =RC[-46] -> 0 | CH95: =RC[-46] -> 0 | CI95: =RC[-46] -> 0 | CJ95: =RC[-46] -> 0 | CK95: =RC[-46] -> 0 | CL95: =RC[-46] -> 1 | CM95: =RC[-46] -> 0 | CN95: =RC[-46] -> 0 | CO95: =RC[-46] -> 356400 | CP95: =RC[-46] -> 0 | CQ95: =RC[-46] -> 0 | CR95: =RC[-46] -> 0 | CS95: =RC[-46] -> 0
A96: 17 | B96: 013751 | C96: Nguyễn Mạnh Hùng | D96: NV Lái xe - VHTTB | F96: =RC[29]+RC[30]+RC[31]+RC[32]+RC[33]+RC[34]+RC[35]+RC[36]+RC[37] -> 360000 | G96: =RC[17]+RC[18]++RC[19]+RC[20]+RC[21]+RC[38]+RC[39]+RC[41] -> 0 | H96: 0 | I96: 0 | J96: =RC[-2]+RC[-1] -> 0 | K96: 0 | L96: 0 | M96: 0 | N96: =RC[15]+RC[16]+RC[17]+RC[18]+RC[19]+RC[20] -> 0 | O96: 0 | P96: 0 | Q96: 360000 | R96: 0 | S96: 0 | T96: 0 | U96: 3600 | V96: 0 | W96: 356400 | X96: 0 | Y96: 0 | Z96: 0 | AA96: 0 | AB96: 0 | AC96: 0 | AD96: 0 | AE96: 0 | AF96: 0 | AG96: 0 | AH96: 0 | AI96: 360000 | AJ96: 0 | AK96: 0 | AL96: 0 | AM96: 0 | AN96: 0 | AO96: 0 | AP96: 0 | AQ96: 0 | AR96: =1 -> 1 | AS96: 0 | AT96: 0 | AU96: =RC[-30]-RC[-29]-RC[-28]-RC[-27]-RC[-26]-RC[-25] -> 356400 | AV96: 0 | AW96: =RC[1]-RC[2] -> 0 | AX96: 0 | AY96: 0 | AZ96: =RC[-46] -> 360000 | BA96: =RC[-46] -> 0 | BB96: =RC[-46] -> 0 | BC96: =RC[-46] -> 0 | BD96: =RC[-46] -> 0 | BE96: =RC[-46] -> 0 | BF96: =RC[-46] -> 0 | BG96: =RC[-46] -> 0 | BH96: =RC[-46] -> 0 | BI96: =RC[-46] -> 0 | BJ96: =RC[-46] -> 0 | BK96: =RC[-46] -> 360000 | BL96: =RC[-46] -> 0 | BM96: =RC[-46] -> 0 | BN96: =RC[-46] -> 0 | BO96: =RC[-46] -> 3600 | BP96: =RC[-46] -> 0 | BQ96: =RC[-46] -> 356400 | BR96: =RC[-46] -> 0 | BS96: =RC[-46] -> 0 | BT96: =RC[-46] -> 0 | BU96: =RC[-46] -> 0 | BV96: =RC[-46] -> 0 | BW96: =RC[-46] -> 0 | BX96: =RC[-46] -> 0 | BY96: =RC[-46] -> 0 | BZ96: =RC[-46] -> 0 | CA96: =RC[-46] -> 0 | CB96: =RC[-46] -> 0 | CC96: =RC[-46] -> 360000 | CD96: =RC[-46] -> 0 | CE96: =RC[-46] -> 0 | CF96: =RC[-46] -> 0 | CG96: =RC[-46] -> 0 | CH96: =RC[-46] -> 0 | CI96: =RC[-46] -> 0 | CJ96: =RC[-46] -> 0 | CK96: =RC[-46] -> 0 | CL96: =RC[-46] -> 1 | CM96: =RC[-46] -> 0 | CN96: =RC[-46] -> 0 | CO96: =RC[-46] -> 356400 | CP96: =RC[-46] -> 0 | CQ96: =RC[-46] -> 0 | CR96: =RC[-46] -> 0 | CS96: =RC[-46] -> 0
A97: Đội phục vụ hành lý hàng hóa (HGS) | F97: =SUM(R[-17]C:R[-1]C) -> 6120000 | G97: =SUM(R[-17]C:R[-1]C) -> 0 | H97: =SUM(R[-17]C:R[-1]C) -> 0 | I97: =SUM(R[-17]C:R[-1]C) -> 0 | J97: =SUM(R[-17]C:R[-1]C) -> 0 | K97: =SUM(R[-17]C:R[-1]C) -> 0 | L97: =SUM(R[-17]C:R[-1]C) -> 0 | M97: =SUM(R[-17]C:R[-1]C) -> 0 | N97: =SUM(R[-17]C:R[-1]C) -> 0 | O97: =SUM(R[-17]C:R[-1]C) -> 0 | P97: =SUM(R[-17]C:R[-1]C) -> 0 | Q97: =SUM(R[-17]C:R[-1]C) -> 6120000 | R97: =SUM(R[-17]C:R[-1]C) -> 0 | S97: =SUM(R[-17]C:R[-1]C) -> 0 | T97: =SUM(R[-17]C:R[-1]C) -> 0 | U97: =SUM(R[-17]C:R[-1]C) -> 61200 | V97: =SUM(R[-17]C:R[-1]C) -> 0 | W97: =SUM(R[-17]C:R[-1]C) -> 6058800 | X97: =SUM(R[-17]C:R[-1]C) -> 0 | Y97: =SUM(R[-17]C:R[-1]C) -> 0 | Z97: =SUM(R[-17]C:R[-1]C) -> 0 | AA97: =SUM(R[-17]C:R[-1]C) -> 0 | AB97: =SUM(R[-17]C:R[-1]C) -> 0 | AC97: =SUM(R[-17]C:R[-1]C) -> 0 | AD97: =SUM(R[-17]C:R[-1]C) -> 0 | AE97: =SUM(R[-17]C:R[-1]C) -> 0 | AF97: =SUM(R[-17]C:R[-1]C) -> 0 | AG97: =SUM(R[-17]C:R[-1]C) -> 0 | AH97: =SUM(R[-17]C:R[-1]C) -> 0 | AI97: =SUM(R[-17]C:R[-1]C) -> 6120000 | AJ97: =SUM(R[-17]C:R[-1]C) -> 0 | AK97: =SUM(R[-17]C:R[-1]C) -> 0 | AL97: =SUM(R[-17]C:R[-1]C) -> 0 | AM97: =SUM(R[-17]C:R[-1]C) -> 0 | AN97: =SUM(R[-17]C:R[-1]C) -> 0 | AO97: =SUM(R[-17]C:R[-1]C) -> 0 | AP97: =SUM(R[-17]C:R[-1]C) -> 0 | AQ97: =SUM(R[-17]C:R[-1]C) -> 0 | AR97: =SUM(R[-17]C:R[-1]C) -> 17 | AS97: =SUM(R[-17]C:R[-1]C) -> 0 | AT97: =SUM(R[-17]C:R[-1]C) -> 0 | AU97: =SUM(R[-17]C:R[-1]C) -> 6058800 | AV97: =SUM(R[-17]C:R[-1]C) -> 0 | AW97: =SUM(R[-17]C:R[-1]C) -> 0 | AX97: =SUM(R[-17]C:R[-1]C) -> 0 | AY97: =SUM(R[-17]C:R[-1]C) -> 0
A98: Đội phục vụ tàu bay (HGS) | F98: =R[7]C -> 2160000 | G98: =R[7]C -> 0 | H98: =R[7]C -> 0 | I98: =R[7]C -> 0 | J98: =R[7]C -> 0 | K98: =R[7]C -> 0 | L98: =R[7]C -> 0 | M98: =R[7]C -> 0 | N98: =R[7]C -> 0 | O98: =R[7]C -> 0 | P98: =R[7]C -> 0 | Q98: =R[7]C -> 2160000 | R98: =R[7]C -> 0 | S98: =R[7]C -> 0 | T98: =R[7]C -> 0 | U98: =R[7]C -> 21600 | V98: =R[7]C -> 0 | W98: =R[7]C -> 2138400 | X98: =R[7]C -> 0 | Y98: =R[7]C -> 0 | Z98: =R[7]C -> 0 | AA98: =R[7]C -> 0 | AB98: =R[7]C -> 0 | AC98: =R[7]C -> 0 | AD98: =R[7]C -> 0 | AE98: =R[7]C -> 0 | AF98: =R[7]C -> 0 | AG98: =R[7]C -> 0 | AH98: =R[7]C -> 0 | AI98: =R[7]C -> 2160000 | AJ98: =R[7]C -> 0 | AK98: =R[7]C -> 0 | AL98: =R[7]C -> 0 | AM98: =R[7]C -> 0 | AN98: =R[7]C -> 0 | AO98: =R[7]C -> 0 | AP98: =R[7]C -> 0 | AQ98: =R[7]C -> 0 | AR98: =R[7]C -> 6 | AS98: =R[7]C -> 0 | AT98: =R[7]C -> 0 | AU98: =R[7]C -> 2138400 | AW98: =R[7]C -> 0 | AX98: =R[7]C -> 0 | AY98: =R[7]C -> 0
A99: 1 | B99: 013728 | C99: Nguyễn Thị Thanh | D99: Nv vệ sinh | F99: =RC[29]+RC[30]+RC[31]+RC[32]+RC[33]+RC[34]+RC[35]+RC[36]+RC[37] -> 360000 | G99: =RC[17]+RC[18]++RC[19]+RC[20]+RC[21]+RC[38]+RC[39]+RC[41] -> 0 | H99: 0 | I99: 0 | J99: =RC[-2]+RC[-1] -> 0 | K99: 0 | L99: 0 | M99: 0 | N99: =RC[15]+RC[16]+RC[17]+RC[18]+RC[19]+RC[20] -> 0 | O99: 0 | P99: 0 | Q99: 360000 | R99: 0 | S99: 0 | T99: 0 | U99: 3600 | V99: 0 | W99: 356400 | X99: 0 | Y99: 0 | Z99: 0 | AA99: 0 | AB99: 0 | AC99: 0 | AD99: 0 | AE99: 0 | AF99: 0 | AG99: 0 | AH99: 0 | AI99: 360000 | AJ99: 0 | AK99: 0 | AL99: 0 | AM99: 0 | AN99: 0 | AO99: 0 | AP99: 0 | AQ99: 0 | AR99: =1 -> 1 | AS99: 0 | AT99: 0 | AU99: =RC[-30]-RC[-29]-RC[-28]-RC[-27]-RC[-26]-RC[-25] -> 356400 | AV99: 0 | AW99: =RC[1]-RC[2] -> 0 | AX99: 0 | AY99: 0 | AZ99: =RC[-46] -> 360000 | BA99: =RC[-46] -> 0 | BB99: =RC[-46] -> 0 | BC99: =RC[-46] -> 0 | BD99: =RC[-46] -> 0 | BE99: =RC[-46] -> 0 | BF99: =RC[-46] -> 0 | BG99: =RC[-46] -> 0 | BH99: =RC[-46] -> 0 | BI99: =RC[-46] -> 0 | BJ99: =RC[-46] -> 0 | BK99: =RC[-46] -> 360000 | BL99: =RC[-46] -> 0 | BM99: =RC[-46] -> 0 | BN99: =RC[-46] -> 0 | BO99: =RC[-46] -> 3600 | BP99: =RC[-46] -> 0 | BQ99: =RC[-46] -> 356400 | BR99: =RC[-46] -> 0 | BS99: =RC[-46] -> 0 | BT99: =RC[-46] -> 0 | BU99: =RC[-46] -> 0 | BV99: =RC[-46] -> 0 | BW99: =RC[-46] -> 0 | BX99: =RC[-46] -> 0 | BY99: =RC[-46] -> 0 | BZ99: =RC[-46] -> 0 | CA99: =RC[-46] -> 0 | CB99: =RC[-46] -> 0 | CC99: =RC[-46] -> 360000 | CD99: =RC[-46] -> 0 | CE99: =RC[-46] -> 0 | CF99: =RC[-46] -> 0 | CG99: =RC[-46] -> 0 | CH99: =RC[-46] -> 0 | CI99: =RC[-46] -> 0 | CJ99: =RC[-46] -> 0 | CK99: =RC[-46] -> 0 | CL99: =RC[-46] -> 1 | CM99: =RC[-46] -> 0 | CN99: =RC[-46] -> 0 | CO99: =RC[-46] -> 356400 | CP99: =RC[-46] -> 0 | CQ99: =RC[-46] -> 0 | CR99: =RC[-46] -> 0 | CS99: =RC[-46] -> 0
A100: 2 | B100: 013745 | C100: Nguyễn Thị Hoài Hương | D100: Nv vệ sinh | F100: =RC[29]+RC[30]+RC[31]+RC[32]+RC[33]+RC[34]+RC[35]+RC[36]+RC[37] -> 360000 | G100: =RC[17]+RC[18]++RC[19]+RC[20]+RC[21]+RC[38]+RC[39]+RC[41] -> 0 | H100: 0 | I100: 0 | J100: =RC[-2]+RC[-1] -> 0 | K100: 0 | L100: 0 | M100: 0 | N100: =RC[15]+RC[16]+RC[17]+RC[18]+RC[19]+RC[20] -> 0 | O100: 0 | P100: 0 | Q100: 360000 | R100: 0 | S100: 0 | T100: 0 | U100: 3600 | V100: 0 | W100: 356400 | X100: 0 | Y100: 0 | Z100: 0 | AA100: 0 | AB100: 0 | AC100: 0 | AD100: 0 | AE100: 0 | AF100: 0 | AG100: 0 | AH100: 0 | AI100: 360000 | AJ100: 0 | AK100: 0 | AL100: 0 | AM100: 0 | AN100: 0 | AO100: 0 | AP100: 0 | AQ100: 0 | AR100: =1 -> 1 | AS100: 0 | AT100: 0 | AU100: =RC[-30]-RC[-29]-RC[-28]-RC[-27]-RC[-26]-RC[-25] -> 356400 | AV100: 0 | AW100: =RC[1]-RC[2] -> 0 | AX100: 0 | AY100: 0 | AZ100: =RC[-46] -> 360000 | BA100: =RC[-46] -> 0 | BB100: =RC[-46] -> 0 | BC100: =RC[-46] -> 0 | BD100: =RC[-46] -> 0 | BE100: =RC[-46] -> 0 | BF100: =RC[-46] -> 0 | BG100: =RC[-46] -> 0 | BH100: =RC[-46] -> 0 | BI100: =RC[-46] -> 0 | BJ100: =RC[-46] -> 0 | BK100: =RC[-46] -> 360000 | BL100: =RC[-46] -> 0 | BM100: =RC[-46] -> 0 | BN100: =RC[-46] -> 0 | BO100: =RC[-46] -> 3600 | BP100: =RC[-46] -> 0 | BQ100: =RC[-46] -> 356400 | BR100: =RC[-46] -> 0 | BS100: =RC[-46] -> 0 | BT100: =RC[-46] -> 0 | BU100: =RC[-46] -> 0 | BV100: =RC[-46] -> 0 | BW100: =RC[-46] -> 0 | BX100: =RC[-46] -> 0 | BY100: =RC[-46] -> 0 | BZ100: =RC[-46] -> 0 | CA100: =RC[-46] -> 0 | CB100: =RC[-46] -> 0 | CC100: =RC[-46] -> 360000 | CD100: =RC[-46] -> 0 | CE100: =RC[-46] -> 0 | CF100: =RC[-46] -> 0 | CG100: =RC[-46] -> 0 | CH100: =RC[-46] -> 0 | CI100: =RC[-46] -> 0 | CJ100: =RC[-46] -> 0 | CK100: =RC[-46] -> 0 | CL100: =RC[-46] -> 1 | CM100: =RC[-46] -> 0 | CN100: =RC[-46] -> 0 | CO100: =RC[-46] -> 356400 | CP100: =RC[-46] -> 0 | CQ100: =RC[-46] -> 0 | CR100: =RC[-46] -> 0 | CS100: =RC[-46] -> 0
A101: 3 | B101: 013746 | C101: Nguyễn Minh Tuấn | D101: Nv vệ sinh | F101: =RC[29]+RC[30]+RC[31]+RC[32]+RC[33]+RC[34]+RC[35]+RC[36]+RC[37] -> 360000 | G101: =RC[17]+RC[18]++RC[19]+RC[20]+RC[21]+RC[38]+RC[39]+RC[41] -> 0 | H101: 0 | I101: 0 | J101: =RC[-2]+RC[-1] -> 0 | K101: 0 | L101: 0 | M101: 0 | N101: =RC[15]+RC[16]+RC[17]+RC[18]+RC[19]+RC[20] -> 0 | O101: 0 | P101: 0 | Q101: 360000 | R101: 0 | S101: 0 | T101: 0 | U101: 3600 | V101: 0 | W101: 356400 | X101: 0 | Y101: 0 | Z101: 0 | AA101: 0 | AB101: 0 | AC101: 0 | AD101: 0 | AE101: 0 | AF101: 0 | AG101: 0 | AH101: 0 | AI101: 360000 | AJ101: 0 | AK101: 0 | AL101: 0 | AM101: 0 | AN101: 0 | AO101: 0 | AP101: 0 | AQ101: 0 | AR101: =1 -> 1 | AS101: 0 | AT101: 0 | AU101: =RC[-30]-RC[-29]-RC[-28]-RC[-27]-RC[-26]-RC[-25] -> 356400 | AV101: 0 | AW101: =RC[1]-RC[2] -> 0 | AX101: 0 | AY101: 0 | AZ101: =RC[-46] -> 360000 | BA101: =RC[-46] -> 0 | BB101: =RC[-46] -> 0 | BC101: =RC[-46] -> 0 | BD101: =RC[-46] -> 0 | BE101: =RC[-46] -> 0 | BF101: =RC[-46] -> 0 | BG101: =RC[-46] -> 0 | BH101: =RC[-46] -> 0 | BI101: =RC[-46] -> 0 | BJ101: =RC[-46] -> 0 | BK101: =RC[-46] -> 360000 | BL101: =RC[-46] -> 0 | BM101: =RC[-46] -> 0 | BN101: =RC[-46] -> 0 | BO101: =RC[-46] -> 3600 | BP101: =RC[-46] -> 0 | BQ101: =RC[-46] -> 356400 | BR101: =RC[-46] -> 0 | BS101: =RC[-46] -> 0 | BT101: =RC[-46] -> 0 | BU101: =RC[-46] -> 0 | BV101: =RC[-46] -> 0 | BW101: =RC[-46] -> 0 | BX101: =RC[-46] -> 0 | BY101: =RC[-46] -> 0 | BZ101: =RC[-46] -> 0 | CA101: =RC[-46] -> 0 | CB101: =RC[-46] -> 0 | CC101: =RC[-46] -> 360000 | CD101: =RC[-46] -> 0 | CE101: =RC[-46] -> 0 | CF101: =RC[-46] -> 0 | CG101: =RC[-46] -> 0 | CH101: =RC[-46] -> 0 | CI101: =RC[-46] -> 0 | CJ101: =RC[-46] -> 0 | CK101: =RC[-46] -> 0 | CL101: =RC[-46] -> 1 | CM101: =RC[-46] -> 0 | CN101: =RC[-46] -> 0 | CO101: =RC[-46] -> 356400 | CP101: =RC[-46] -> 0 | CQ101: =RC[-46] -> 0 | CR101: =RC[-46] -> 0 | CS101: =RC[-46] -> 0
A102: 4 | B102: 013747 | C102: Nguyễn Thị Liên | D102: Nv vệ sinh | F102: =RC[29]+RC[30]+RC[31]+RC[32]+RC[33]+RC[34]+RC[35]+RC[36]+RC[37] -> 360000 | G102: =RC[17]+RC[18]++RC[19]+RC[20]+RC[21]+RC[38]+RC[39]+RC[41] -> 0 | H102: 0 | I102: 0 | J102: =RC[-2]+RC[-1] -> 0 | K102: 0 | L102: 0 | M102: 0 | N102: =RC[15]+RC[16]+RC[17]+RC[18]+RC[19]+RC[20] -> 0 | O102: 0 | P102: 0 | Q102: 360000 | R102: 0 | S102: 0 | T102: 0 | U102: 3600 | V102: 0 | W102: 356400 | X102: 0 | Y102: 0 | Z102: 0 | AA102: 0 | AB102: 0 | AC102: 0 | AD102: 0 | AE102: 0 | AF102: 0 | AG102: 0 | AH102: 0 | AI102: 360000 | AJ102: 0 | AK102: 0 | AL102: 0 | AM102: 0 | AN102: 0 | AO102: 0 | AP102: 0 | AQ102: 0 | AR102: =1 -> 1 | AS102: 0 | AT102: 0 | AU102: =RC[-30]-RC[-29]-RC[-28]-RC[-27]-RC[-26]-RC[-25] -> 356400 | AV102: 0 | AW102: =RC[1]-RC[2] -> 0 | AX102: 0 | AY102: 0 | AZ102: =RC[-46] -> 360000 | BA102: =RC[-46] -> 0 | BB102: =RC[-46] -> 0 | BC102: =RC[-46] -> 0 | BD102: =RC[-46] -> 0 | BE102: =RC[-46] -> 0 | BF102: =RC[-46] -> 0 | BG102: =RC[-46] -> 0 | BH102: =RC[-46] -> 0 | BI102: =RC[-46] -> 0 | BJ102: =RC[-46] -> 0 | BK102: =RC[-46] -> 360000 | BL102: =RC[-46] -> 0 | BM102: =RC[-46] -> 0 | BN102: =RC[-46] -> 0 | BO102: =RC[-46] -> 3600 | BP102: =RC[-46] -> 0 | BQ102: =RC[-46] -> 356400 | BR102: =RC[-46] -> 0 | BS102: =RC[-46] -> 0 | BT102: =RC[-46] -> 0 | BU102: =RC[-46] -> 0 | BV102: =RC[-46] -> 0 | BW102: =RC[-46] -> 0 | BX102: =RC[-46] -> 0 | BY102: =RC[-46] -> 0 | BZ102: =RC[-46] -> 0 | CA102: =RC[-46] -> 0 | CB102: =RC[-46] -> 0 | CC102: =RC[-46] -> 360000 | CD102: =RC[-46] -> 0 | CE102: =RC[-46] -> 0 | CF102: =RC[-46] -> 0 | CG102: =RC[-46] -> 0 | CH102: =RC[-46] -> 0 | CI102: =RC[-46] -> 0 | CJ102: =RC[-46] -> 0 | CK102: =RC[-46] -> 0 | CL102: =RC[-46] -> 1 | CM102: =RC[-46] -> 0 | CN102: =RC[-46] -> 0 | CO102: =RC[-46] -> 356400 | CP102: =RC[-46] -> 0 | CQ102: =RC[-46] -> 0 | CR102: =RC[-46] -> 0 | CS102: =RC[-46] -> 0
A103: 5 | B103: 013748 | C103: Thiều Thị Thu Lan | D103: Nv vệ sinh | F103: =RC[29]+RC[30]+RC[31]+RC[32]+RC[33]+RC[34]+RC[35]+RC[36]+RC[37] -> 360000 | G103: =RC[17]+RC[18]++RC[19]+RC[20]+RC[21]+RC[38]+RC[39]+RC[41] -> 0 | H103: 0 | I103: 0 | J103: =RC[-2]+RC[-1] -> 0 | K103: 0 | L103: 0 | M103: 0 | N103: =RC[15]+RC[16]+RC[17]+RC[18]+RC[19]+RC[20] -> 0 | O103: 0 | P103: 0 | Q103: 360000 | R103: 0 | S103: 0 | T103: 0 | U103: 3600 | V103: 0 | W103: 356400 | X103: 0 | Y103: 0 | Z103: 0 | AA103: 0 | AB103: 0 | AC103: 0 | AD103: 0 | AE103: 0 | AF103: 0 | AG103: 0 | AH103: 0 | AI103: 360000 | AJ103: 0 | AK103: 0 | AL103: 0 | AM103: 0 | AN103: 0 | AO103: 0 | AP103: 0 | AQ103: 0 | AR103: =1 -> 1 | AS103: 0 | AT103: 0 | AU103: =RC[-30]-RC[-29]-RC[-28]-RC[-27]-RC[-26]-RC[-25] -> 356400 | AV103: 0 | AW103: =RC[1]-RC[2] -> 0 | AX103: 0 | AY103: 0 | AZ103: =RC[-46] -> 360000 | BA103: =RC[-46] -> 0 | BB103: =RC[-46] -> 0 | BC103: =RC[-46] -> 0 | BD103: =RC[-46] -> 0 | BE103: =RC[-46] -> 0 | BF103: =RC[-46] -> 0 | BG103: =RC[-46] -> 0 | BH103: =RC[-46] -> 0 | BI103: =RC[-46] -> 0 | BJ103: =RC[-46] -> 0 | BK103: =RC[-46] -> 360000 | BL103: =RC[-46] -> 0 | BM103: =RC[-46] -> 0 | BN103: =RC[-46] -> 0 | BO103: =RC[-46] -> 3600 | BP103: =RC[-46] -> 0 | BQ103: =RC[-46] -> 356400 | BR103: =RC[-46] -> 0 | BS103: =RC[-46] -> 0 | BT103: =RC[-46] -> 0 | BU103: =RC[-46] -> 0 | BV103: =RC[-46] -> 0 | BW103: =RC[-46] -> 0 | BX103: =RC[-46] -> 0 | BY103: =RC[-46] -> 0 | BZ103: =RC[-46] -> 0 | CA103: =RC[-46] -> 0 | CB103: =RC[-46] -> 0 | CC103: =RC[-46] -> 360000 | CD103: =RC[-46] -> 0 | CE103: =RC[-46] -> 0 | CF103: =RC[-46] -> 0 | CG103: =RC[-46] -> 0 | CH103: =RC[-46] -> 0 | CI103: =RC[-46] -> 0 | CJ103: =RC[-46] -> 0 | CK103: =RC[-46] -> 0 | CL103: =RC[-46] -> 1 | CM103: =RC[-46] -> 0 | CN103: =RC[-46] -> 0 | CO103: =RC[-46] -> 356400 | CP103: =RC[-46] -> 0 | CQ103: =RC[-46] -> 0 | CR103: =RC[-46] -> 0 | CS103: =RC[-46] -> 0
A104: 6 | B104: 013749 | C104: Chu Phương Thảo | D104: Nv vệ sinh | F104: =RC[29]+RC[30]+RC[31]+RC[32]+RC[33]+RC[34]+RC[35]+RC[36]+RC[37] -> 360000 | G104: =RC[17]+RC[18]++RC[19]+RC[20]+RC[21]+RC[38]+RC[39]+RC[41] -> 0 | H104: 0 | I104: 0 | J104: =RC[-2]+RC[-1] -> 0 | K104: 0 | L104: 0 | M104: 0 | N104: =RC[15]+RC[16]+RC[17]+RC[18]+RC[19]+RC[20] -> 0 | O104: 0 | P104: 0 | Q104: 360000 | R104: 0 | S104: 0 | T104: 0 | U104: 3600 | V104: 0 | W104: 356400 | X104: 0 | Y104: 0 | Z104: 0 | AA104: 0 | AB104: 0 | AC104: 0 | AD104: 0 | AE104: 0 | AF104: 0 | AG104: 0 | AH104: 0 | AI104: 360000 | AJ104: 0 | AK104: 0 | AL104: 0 | AM104: 0 | AN104: 0 | AO104: 0 | AP104: 0 | AQ104: 0 | AR104: =1 -> 1 | AS104: 0 | AT104: 0 | AU104: =RC[-30]-RC[-29]-RC[-28]-RC[-27]-RC[-26]-RC[-25] -> 356400 | AV104: 0 | AW104: =RC[1]-RC[2] -> 0 | AX104: 0 | AY104: 0 | AZ104: =RC[-46] -> 360000 | BA104: =RC[-46] -> 0 | BB104: =RC[-46] -> 0 | BC104: =RC[-46] -> 0 | BD104: =RC[-46] -> 0 | BE104: =RC[-46] -> 0 | BF104: =RC[-46] -> 0 | BG104: =RC[-46] -> 0 | BH104: =RC[-46] -> 0 | BI104: =RC[-46] -> 0 | BJ104: =RC[-46] -> 0 | BK104: =RC[-46] -> 360000 | BL104: =RC[-46] -> 0 | BM104: =RC[-46] -> 0 | BN104: =RC[-46] -> 0 | BO104: =RC[-46] -> 3600 | BP104: =RC[-46] -> 0 | BQ104: =RC[-46] -> 356400 | BR104: =RC[-46] -> 0 | BS104: =RC[-46] -> 0 | BT104: =RC[-46] -> 0 | BU104: =RC[-46] -> 0 | BV104: =RC[-46] -> 0 | BW104: =RC[-46] -> 0 | BX104: =RC[-46] -> 0 | BY104: =RC[-46] -> 0 | BZ104: =RC[-46] -> 0 | CA104: =RC[-46] -> 0 | CB104: =RC[-46] -> 0 | CC104: =RC[-46] -> 360000 | CD104: =RC[-46] -> 0 | CE104: =RC[-46] -> 0 | CF104: =RC[-46] -> 0 | CG104: =RC[-46] -> 0 | CH104: =RC[-46] -> 0 | CI104: =RC[-46] -> 0 | CJ104: =RC[-46] -> 0 | CK104: =RC[-46] -> 0 | CL104: =RC[-46] -> 1 | CM104: =RC[-46] -> 0 | CN104: =RC[-46] -> 0 | CO104: =RC[-46] -> 356400 | CP104: =RC[-46] -> 0 | CQ104: =RC[-46] -> 0 | CR104: =RC[-46] -> 0 | CS104: =RC[-46] -> 0
A105: Đội phục vụ tàu bay (HGS) | F105: =SUM(R[-6]C:R[-1]C) -> 2160000 | G105: =SUM(R[-6]C:R[-1]C) -> 0 | H105: =SUM(R[-6]C:R[-1]C) -> 0 | I105: =SUM(R[-6]C:R[-1]C) -> 0 | J105: =SUM(R[-6]C:R[-1]C) -> 0 | K105: =SUM(R[-6]C:R[-1]C) -> 0 | L105: =SUM(R[-6]C:R[-1]C) -> 0 | M105: =SUM(R[-6]C:R[-1]C) -> 0 | N105: =SUM(R[-6]C:R[-1]C) -> 0 | O105: =SUM(R[-6]C:R[-1]C) -> 0 | P105: =SUM(R[-6]C:R[-1]C) -> 0 | Q105: =SUM(R[-6]C:R[-1]C) -> 2160000 | R105: =SUM(R[-6]C:R[-1]C) -> 0 | S105: =SUM(R[-6]C:R[-1]C) -> 0 | T105: =SUM(R[-6]C:R[-1]C) -> 0 | U105: =SUM(R[-6]C:R[-1]C) -> 21600 | V105: =SUM(R[-6]C:R[-1]C) -> 0 | W105: =SUM(R[-6]C:R[-1]C) -> 2138400 | X105: =SUM(R[-6]C:R[-1]C) -> 0 | Y105: =SUM(R[-6]C:R[-1]C) -> 0 | Z105: =SUM(R[-6]C:R[-1]C) -> 0 | AA105: =SUM(R[-6]C:R[-1]C) -> 0 | AB105: =SUM(R[-6]C:R[-1]C) -> 0 | AC105: =SUM(R[-6]C:R[-1]C) -> 0 | AD105: =SUM(R[-6]C:R[-1]C) -> 0 | AE105: =SUM(R[-6]C:R[-1]C) -> 0 | AF105: =SUM(R[-6]C:R[-1]C) -> 0 | AG105: =SUM(R[-6]C:R[-1]C) -> 0 | AH105: =SUM(R[-6]C:R[-1]C) -> 0 | AI105: =SUM(R[-6]C:R[-1]C) -> 2160000 | AJ105: =SUM(R[-6]C:R[-1]C) -> 0 | AK105: =SUM(R[-6]C:R[-1]C) -> 0 | AL105: =SUM(R[-6]C:R[-1]C) -> 0 | AM105: =SUM(R[-6]C:R[-1]C) -> 0 | AN105: =SUM(R[-6]C:R[-1]C) -> 0 | AO105: =SUM(R[-6]C:R[-1]C) -> 0 | AP105: =SUM(R[-6]C:R[-1]C) -> 0 | AQ105: =SUM(R[-6]C:R[-1]C) -> 0 | AR105: =SUM(R[-6]C:R[-1]C) -> 6 | AS105: =SUM(R[-6]C:R[-1]C) -> 0 | AT105: =SUM(R[-6]C:R[-1]C) -> 0 | AU105: =SUM(R[-6]C:R[-1]C) -> 2138400 | AV105: =SUM(R[-6]C:R[-1]C) -> 0 | AW105: =SUM(R[-6]C:R[-1]C) -> 0 | AX105: =SUM(R[-6]C:R[-1]C) -> 0 | AY105: =SUM(R[-6]C:R[-1]C) -> 0
A106: Phòng Phục vụ kỹ thuật sân đỗ (HGS) | F106: =SUM(R[-27]C[46]:R[-1]C[46]) -> 8280000 | G106: =SUM(R[-27]C[46]:R[-1]C[46]) -> 0 | H106: =SUM(R[-27]C[46]:R[-1]C[46]) -> 0 | I106: =SUM(R[-27]C[46]:R[-1]C[46]) -> 0 | J106: =SUM(R[-27]C[46]:R[-1]C[46]) -> 0 | K106: =SUM(R[-27]C[46]:R[-1]C[46]) -> 0 | L106: =SUM(R[-27]C[46]:R[-1]C[46]) -> 0 | M106: =SUM(R[-27]C[46]:R[-1]C[46]) -> 0 | N106: =SUM(R[-27]C[46]:R[-1]C[46]) -> 0 | O106: =SUM(R[-27]C[46]:R[-1]C[46]) -> 0 | P106: =SUM(R[-27]C[46]:R[-1]C[46]) -> 0 | Q106: =SUM(R[-27]C[46]:R[-1]C[46]) -> 8280000 | R106: =SUM(R[-27]C[46]:R[-1]C[46]) -> 0 | S106: =SUM(R[-27]C[46]:R[-1]C[46]) -> 0 | T106: =SUM(R[-27]C[46]:R[-1]C[46]) -> 0 | U106: =SUM(R[-27]C[46]:R[-1]C[46]) -> 82800 | V106: =SUM(R[-27]C[46]:R[-1]C[46]) -> 0 | W106: =SUM(R[-27]C[46]:R[-1]C[46]) -> 8197200 | X106: =SUM(R[-27]C[46]:R[-1]C[46]) -> 0 | Y106: =SUM(R[-27]C[46]:R[-1]C[46]) -> 0 | Z106: =SUM(R[-27]C[46]:R[-1]C[46]) -> 0 | AA106: =SUM(R[-27]C[46]:R[-1]C[46]) -> 0 | AB106: =SUM(R[-27]C[46]:R[-1]C[46]) -> 0 | AC106: =SUM(R[-27]C[46]:R[-1]C[46]) -> 0 | AD106: =SUM(R[-27]C[46]:R[-1]C[46]) -> 0 | AE106: =SUM(R[-27]C[46]:R[-1]C[46]) -> 0 | AF106: =SUM(R[-27]C[46]:R[-1]C[46]) -> 0 | AG106: =SUM(R[-27]C[46]:R[-1]C[46]) -> 0 | AH106: =SUM(R[-27]C[46]:R[-1]C[46]) -> 0 | AI106: =SUM(R[-27]C[46]:R[-1]C[46]) -> 8280000 | AJ106: =SUM(R[-27]C[46]:R[-1]C[46]) -> 0 | AK106: =SUM(R[-27]C[46]:R[-1]C[46]) -> 0 | AL106: =SUM(R[-27]C[46]:R[-1]C[46]) -> 0 | AM106: =SUM(R[-27]C[46]:R[-1]C[46]) -> 0 | AN106: =SUM(R[-27]C[46]:R[-1]C[46]) -> 0 | AO106: =SUM(R[-27]C[46]:R[-1]C[46]) -> 0 | AP106: =SUM(R[-27]C[46]:R[-1]C[46]) -> 0 | AQ106: =SUM(R[-27]C[46]:R[-1]C[46]) -> 0 | AR106: =SUM(R[-27]C[46]:R[-1]C[46]) -> 23 | AS106: =SUM(R[-27]C[46]:R[-1]C[46]) -> 0 | AT106: =SUM(R[-27]C[46]:R[-1]C[46]) -> 0 | AU106: =SUM(R[-27]C[46]:R[-1]C[46]) -> 8197200 | AV106: =SUM(R[-27]C[46]:R[-1]C[46]) -> 0 | AW106: =SUM(R[-27]C[46]:R[-1]C[46]) -> 0 | AX106: =SUM(R[-27]C[46]:R[-1]C[46]) -> 0 | AY106: =SUM(R[-27]C[46]:R[-1]C[46]) -> 0
A107: Công ty Phục vụ mặt đất Hà Nội (HGS) | B107: =RC[42] -> 79 | C107: TỔNG CỘNG: | F107: =SUM(R[-97]C[46]:R[-1]C[46]) -> 28440000 | G107: =SUM(R[-97]C[46]:R[-1]C[46]) -> 0 | H107: =SUM(R[-97]C[46]:R[-1]C[46]) -> 0 | I107: =SUM(R[-97]C[46]:R[-1]C[46]) -> 0 | J107: =SUM(R[-97]C[46]:R[-1]C[46]) -> 0 | K107: =SUM(R[-97]C[46]:R[-1]C[46]) -> 0 | L107: =SUM(R[-97]C[46]:R[-1]C[46]) -> 0 | M107: =SUM(R[-97]C[46]:R[-1]C[46]) -> 0 | N107: =SUM(R[-97]C[46]:R[-1]C[46]) -> 0 | O107: =SUM(R[-97]C[46]:R[-1]C[46]) -> 0 | P107: =SUM(R[-97]C[46]:R[-1]C[46]) -> 0 | Q107: =SUM(R[-97]C[46]:R[-1]C[46]) -> 28440000 | R107: =SUM(R[-97]C[46]:R[-1]C[46]) -> 0 | S107: =SUM(R[-97]C[46]:R[-1]C[46]) -> 0 | T107: =SUM(R[-97]C[46]:R[-1]C[46]) -> 0 | U107: =SUM(R[-97]C[46]:R[-1]C[46]) -> 284400 | V107: =SUM(R[-97]C[46]:R[-1]C[46]) -> 0 | W107: =SUM(R[-97]C[46]:R[-1]C[46]) -> 28155600 | X107: =SUM(R[-97]C[46]:R[-1]C[46]) -> 0 | Y107: =SUM(R[-97]C[46]:R[-1]C[46]) -> 0 | Z107: =SUM(R[-97]C[46]:R[-1]C[46]) -> 0 | AA107: =SUM(R[-97]C[46]:R[-1]C[46]) -> 0 | AB107: =SUM(R[-97]C[46]:R[-1]C[46]) -> 0 | AC107: =SUM(R[-97]C[46]:R[-1]C[46]) -> 0 | AD107: =SUM(R[-97]C[46]:R[-1]C[46]) -> 0 | AE107: =SUM(R[-97]C[46]:R[-1]C[46]) -> 0 | AF107: =SUM(R[-97]C[46]:R[-1]C[46]) -> 0 | AG107: =SUM(R[-97]C[46]:R[-1]C[46]) -> 0 | AH107: =SUM(R[-97]C[46]:R[-1]C[46]) -> 0 | AI107: =SUM(R[-97]C[46]:R[-1]C[46]) -> 28440000 | AJ107: =SUM(R[-97]C[46]:R[-1]C[46]) -> 0 | AK107: =SUM(R[-97]C[46]:R[-1]C[46]) -> 0 | AL107: =SUM(R[-97]C[46]:R[-1]C[46]) -> 0 | AM107: =SUM(R[-97]C[46]:R[-1]C[46]) -> 0 | AN107: =SUM(R[-97]C[46]:R[-1]C[46]) -> 0 | AO107: =SUM(R[-97]C[46]:R[-1]C[46]) -> 0 | AP107: =SUM(R[-97]C[46]:R[-1]C[46]) -> 0 | AQ107: =SUM(R[-97]C[46]:R[-1]C[46]) -> 0 | AR107: =SUM(R[-97]C[46]:R[-1]C[46]) -> 79 | AS107: =SUM(R[-97]C[46]:R[-1]C[46]) -> 0 | AT107: =SUM(R[-97]C[46]:R[-1]C[46]) -> 0 | AU107: =SUM(R[-97]C[46]:R[-1]C[46]) -> 28155600 | AV107: =SUM(R[-97]C[46]:R[-1]C[46]) -> 0 | AW107: =SUM(R[-97]C[46]:R[-1]C[46]) -> 0 | AX107: =SUM(R[-97]C[46]:R[-1]C[46]) -> 0 | AY107: =SUM(R[-97]C[46]:R[-1]C[46]) -> 0
C109: NGƯỜI LẬP BẢNG | H109: THỦ TRƯỞNG ĐƠN VỊ | J109: THỦ TRƯỞNG ĐƠN VỊ | O109: BAN TCCB-LĐTL | U109: BAN TCKT