Sheet: ExcelTemplate
A2: CÔNG TY CỔ PHẦN PHỤC VỤ MẶT ĐẤT HÀ NỘI | G2: Ngày ___ tháng ___ năm _____
A3: ="ĐƠN VỊ :"&R[7]C -> ĐƠN VỊ :Công ty Phục vụ mặt đất Hà Nội (HGS)
A5: ="BẢNG TIỀN THƯỞNG LỄ 30/04 & 01/05 NĂM"&LEFT(RC[9],5) -> BẢNG TIỀN THƯỞNG LỄ 30/04 & 01/05 NĂM 2015 | J5: 2015/04
A8: STT | B8: MÃ NV | C8: HỌ VÀ TÊN | D8: CHỨC DANH CÔNG VIỆC | E8: SỐ THÁNG LÀM VIỆC | F8: SỐ TIỀN ĐƯỢC LĨNH | G8: KÝ NHẬN
A9: 1 | C9: 2 | D9: 3 | E9: 4 | F9: 5 | G9: 6
A10: Công ty Phục vụ mặt đất Hà Nội (HGS)
A11: Ban Giám đốc (HGS)
A13: 1 | B13: 010530 | C13: Bùi Tuấn Anh | D13: Giám đốc | E13: 12 | F13: 3600000 | G13: =VLOOKUP(RC[-5],'\HOA VE\LUONG\Luong phan mem 2015\Thang 3\[Bang tien lan 2 thang 3 TNCN.xls]ExcelTemplate'!R9C[-5]:R404C[10],16,0) -> 27067338 | H13: =1 -> 1 | I13: =RC[-4] -> 12 | J13: =RC[-4] -> 3600000 | K13: =RC[-3] -> 1
A14: 2 | B14: 010531 | C14: Nguyễn Huy Luân | D14: Phó Giám đốc | E14: 12 | F14: 3600000 | G14: =VLOOKUP(RC[-5],'\HOA VE\LUONG\Luong phan mem 2015\Thang 3\[Bang tien lan 2 thang 3 TNCN.xls]ExcelTemplate'!R9C[-5]:R404C[10],16,0) -> 22493385 | H14: =1 -> 1 | I14: =RC[-4] -> 12 | J14: =RC[-4] -> 3600000 | K14: =RC[-3] -> 1
A15: 3 | B15: 010532 | C15: Vũ Trung Thành | D15: Phó Giám đốc | E15: 12 | F15: 3600000 | G15: =VLOOKUP(RC[-5],'\HOA VE\LUONG\Luong phan mem 2015\Thang 3\[Bang tien lan 2 thang 3 TNCN.xls]ExcelTemplate'!R9C[-5]:R404C[10],16,0) -> 22455953 | H15: =1 -> 1 | I15: =RC[-4] -> 12 | J15: =RC[-4] -> 3600000 | K15: =RC[-3] -> 1
A16: 4 | B16: 010806 | C16: Phương Hồng Minh | D16: Phó Giám đốc | E16: 12 | F16: 3600000 | G16: =VLOOKUP(RC[-5],'\HOA VE\LUONG\Luong phan mem 2015\Thang 3\[Bang tien lan 2 thang 3 TNCN.xls]ExcelTemplate'!R9C[-5]:R404C[10],16,0) -> 21351405 | H16: =1 -> 1 | I16: =RC[-4] -> 12 | J16: =RC[-4] -> 3600000 | K16: =RC[-3] -> 1
E17: =SUM(R[-4]C:R[-1]C) -> 48 | F17: =SUM(R[-4]C:R[-1]C) -> 14400000 | G17: =VLOOKUP(RC[-5],'\HOA VE\LUONG\Luong phan mem 2015\Thang 3\[Bang tien lan 2 thang 3 TNCN.xls]ExcelTemplate'!R9C[-5]:R404C[10],16,0) -> #N/A | H17: =SUM(R[-4]C:R[-1]C) -> 4
A18: Ban Giám đốc (HGS) | E18: =SUM(R[-6]C[4]:R[-1]C[4]) -> 48 | F18: =SUM(R[-6]C[4]:R[-1]C[4]) -> 14400000 | G18: =VLOOKUP(RC[-5],'\HOA VE\LUONG\Luong phan mem 2015\Thang 3\[Bang tien lan 2 thang 3 TNCN.xls]ExcelTemplate'!R9C[-5]:R404C[10],16,0) -> #N/A | H18: =SUM(R[-6]C[3]:R[-1]C[3]) -> 4
A19: Phòng Điều hành, tài liệu và hướng dẫn chất xếp (HGS) | G19: =VLOOKUP(RC[-5],'\HOA VE\LUONG\Luong phan mem 2015\Thang 3\[Bang tien lan 2 thang 3 TNCN.xls]ExcelTemplate'!R9C[-5]:R404C[10],16,0) -> #N/A
G20: =VLOOKUP(RC[-5],'\HOA VE\LUONG\Luong phan mem 2015\Thang 3\[Bang tien lan 2 thang 3 TNCN.xls]ExcelTemplate'!R9C[-5]:R404C[10],16,0) -> #N/A
A21: 1 | B21: 010555 | C21: Nguyễn Ngọc Nguyên | D21: Trưởng phòng | E21: 12 | F21: 3600000 | G21: =VLOOKUP(RC[-5],'\HOA VE\LUONG\Luong phan mem 2015\Thang 3\[Bang tien lan 2 thang 3 TNCN.xls]ExcelTemplate'!R9C[-5]:R404C[10],16,0) -> 17258053 | H21: =1 -> 1 | I21: =RC[-4] -> 12 | J21: =RC[-4] -> 3600000 | K21: =RC[-3] -> 1
A22: 2 | B22: 010554 | C22: Nguyễn Đình Tuyến | D22: Phó Trưởng Phòng | E22: 12 | F22: 3600000 | G22: =VLOOKUP(RC[-5],'\HOA VE\LUONG\Luong phan mem 2015\Thang 3\[Bang tien lan 2 thang 3 TNCN.xls]ExcelTemplate'!R9C[-5]:R404C[10],16,0) -> 16461396 | H22: =1 -> 1 | I22: =RC[-4] -> 12 | J22: =RC[-4] -> 3600000 | K22: =RC[-3] -> 1
A23: 3 | B23: 010534 | C23: Nguyễn Tiến Hải | D23: KS CNTT | E23: 12 | F23: 3600000 | G23: =VLOOKUP(RC[-5],'\HOA VE\LUONG\Luong phan mem 2015\Thang 3\[Bang tien lan 2 thang 3 TNCN.xls]ExcelTemplate'!R9C[-5]:R404C[10],16,0) -> 9215254 | H23: =1 -> 1 | I23: =RC[-4] -> 12 | J23: =RC[-4] -> 3600000 | K23: =RC[-3] -> 1
A24: 4 | B24: 011084 | C24: Ngô Trí Dũng | D24: KS CNTT | E24: 12 | F24: 3600000 | G24: =VLOOKUP(RC[-5],'\HOA VE\LUONG\Luong phan mem 2015\Thang 3\[Bang tien lan 2 thang 3 TNCN.xls]ExcelTemplate'!R9C[-5]:R404C[10],16,0) -> 7674836 | H24: =1 -> 1 | I24: =RC[-4] -> 12 | J24: =RC[-4] -> 3600000 | K24: =RC[-3] -> 1
A25: 5 | B25: 011085 | C25: Phạm Văn Chiến | D25: KS CNTT | E25: 12 | F25: 3600000 | G25: =VLOOKUP(RC[-5],'\HOA VE\LUONG\Luong phan mem 2015\Thang 3\[Bang tien lan 2 thang 3 TNCN.xls]ExcelTemplate'!R9C[-5]:R404C[10],16,0) -> 7816586 | H25: =1 -> 1 | I25: =RC[-4] -> 12 | J25: =RC[-4] -> 3600000 | K25: =RC[-3] -> 1
A26: 6 | B26: 011862 | C26: Đỗ Việt Anh | D26: Nhân viên CNTT | E26: 12 | F26: 3600000 | G26: =VLOOKUP(RC[-5],'\HOA VE\LUONG\Luong phan mem 2015\Thang 3\[Bang tien lan 2 thang 3 TNCN.xls]ExcelTemplate'!R9C[-5]:R404C[10],16,0) -> 8010450 | H26: =1 -> 1 | I26: =RC[-4] -> 12 | J26: =RC[-4] -> 3600000 | K26: =RC[-3] -> 1
A27: 7 | B27: 011767 | C27: Nguyễn Thành Trung | D27: NV HDCX - CBTT | E27: 12 | F27: 3600000 | G27: =VLOOKUP(RC[-5],'\HOA VE\LUONG\Luong phan mem 2015\Thang 3\[Bang tien lan 2 thang 3 TNCN.xls]ExcelTemplate'!R9C[-5]:R404C[10],16,0) -> 6304811 | H27: =1 -> 1 | I27: =RC[-4] -> 12 | J27: =RC[-4] -> 3600000 | K27: =RC[-3] -> 1
A28: 8 | B28: 010537 | C28: Bùi Anh Khắc | D28: NV Tài liệu và HDCX | E28: 12 | F28: 3600000 | G28: =VLOOKUP(RC[-5],'\HOA VE\LUONG\Luong phan mem 2015\Thang 3\[Bang tien lan 2 thang 3 TNCN.xls]ExcelTemplate'!R9C[-5]:R404C[10],16,0) -> 8928957 | H28: =1 -> 1 | I28: =RC[-4] -> 12 | J28: =RC[-4] -> 3600000 | K28: =RC[-3] -> 1
A29: 9 | B29: 010538 | C29: Nguyễn Danh Trường | D29: NV Tài liệu và HDCX | E29: 12 | F29: 3600000 | G29: =VLOOKUP(RC[-5],'\HOA VE\LUONG\Luong phan mem 2015\Thang 3\[Bang tien lan 2 thang 3 TNCN.xls]ExcelTemplate'!R9C[-5]:R404C[10],16,0) -> 6967928 | H29: =1 -> 1 | I29: =RC[-4] -> 12 | J29: =RC[-4] -> 3600000 | K29: =RC[-3] -> 1
A30: 10 | B30: 010540 | C30: Nguyễn Thị Việt Hà | D30: NV Tài liệu và HDCX | E30: 12 | F30: 3600000 | G30: =VLOOKUP(RC[-5],'\HOA VE\LUONG\Luong phan mem 2015\Thang 3\[Bang tien lan 2 thang 3 TNCN.xls]ExcelTemplate'!R9C[-5]:R404C[10],16,0) -> 6450730 | H30: =1 -> 1 | I30: =RC[-4] -> 12 | J30: =RC[-4] -> 3600000 | K30: =RC[-3] -> 1
A31: 11 | B31: 010542 | C31: Trần Minh Hải | D31: NV Tài liệu và HDCX | E31: 12 | F31: 3600000 | G31: =VLOOKUP(RC[-5],'\HOA VE\LUONG\Luong phan mem 2015\Thang 3\[Bang tien lan 2 thang 3 TNCN.xls]ExcelTemplate'!R9C[-5]:R404C[10],16,0) -> 8531031 | H31: =1 -> 1 | I31: =RC[-4] -> 12 | J31: =RC[-4] -> 3600000 | K31: =RC[-3] -> 1
A32: 12 | B32: 010543 | C32: Nguyễn Thị Thơm | D32: NV Tài liệu và HDCX | E32: 12 | F32: 3600000 | G32: =VLOOKUP(RC[-5],'\HOA VE\LUONG\Luong phan mem 2015\Thang 3\[Bang tien lan 2 thang 3 TNCN.xls]ExcelTemplate'!R9C[-5]:R404C[10],16,0) -> 2387237 | H32: =1 -> 1 | I32: =RC[-4] -> 12 | J32: =RC[-4] -> 3600000 | K32: =RC[-3] -> 1
A33: 13 | B33: 010544 | C33: Trần Thị Yến Nga | D33: NV Tài liệu và HDCX | E33: 12 | F33: 3600000 | G33: =VLOOKUP(RC[-5],'\HOA VE\LUONG\Luong phan mem 2015\Thang 3\[Bang tien lan 2 thang 3 TNCN.xls]ExcelTemplate'!R9C[-5]:R404C[10],16,0) -> 4690115 | H33: =1 -> 1 | I33: =RC[-4] -> 12 | J33: =RC[-4] -> 3600000 | K33: =RC[-3] -> 1
A34: 14 | B34: 010545 | C34: Ngô Thanh Hiệp | D34: NV Tài liệu và HDCX | E34: 12 | F34: 3600000 | G34: =VLOOKUP(RC[-5],'\HOA VE\LUONG\Luong phan mem 2015\Thang 3\[Bang tien lan 2 thang 3 TNCN.xls]ExcelTemplate'!R9C[-5]:R404C[10],16,0) -> 8663089 | H34: =1 -> 1 | I34: =RC[-4] -> 12 | J34: =RC[-4] -> 3600000 | K34: =RC[-3] -> 1
A35: 15 | B35: 010546 | C35: Tạ Đăng Việt | D35: NV Tài liệu và HDCX | E35: 12 | F35: 3600000 | G35: =VLOOKUP(RC[-5],'\HOA VE\LUONG\Luong phan mem 2015\Thang 3\[Bang tien lan 2 thang 3 TNCN.xls]ExcelTemplate'!R9C[-5]:R404C[10],16,0) -> 7246140 | H35: =1 -> 1 | I35: =RC[-4] -> 12 | J35: =RC[-4] -> 3600000 | K35: =RC[-3] -> 1
A36: 16 | B36: 010547 | C36: Đào Thanh Hải | D36: NV Tài liệu và HDCX | E36: 12 | F36: 3600000 | G36: =VLOOKUP(RC[-5],'\HOA VE\LUONG\Luong phan mem 2015\Thang 3\[Bang tien lan 2 thang 3 TNCN.xls]ExcelTemplate'!R9C[-5]:R404C[10],16,0) -> 6472466 | H36: =1 -> 1 | I36: =RC[-4] -> 12 | J36: =RC[-4] -> 3600000 | K36: =RC[-3] -> 1
A37: 17 | B37: 010549 | C37: Nguyễn Thanh Hải | D37: NV Tài liệu và HDCX | E37: 12 | F37: 3600000 | G37: =VLOOKUP(RC[-5],'\HOA VE\LUONG\Luong phan mem 2015\Thang 3\[Bang tien lan 2 thang 3 TNCN.xls]ExcelTemplate'!R9C[-5]:R404C[10],16,0) -> 7488934 | H37: =1 -> 1 | I37: =RC[-4] -> 12 | J37: =RC[-4] -> 3600000 | K37: =RC[-3] -> 1
A38: 18 | B38: 010550 | C38: Vũ Đức Thiện | D38: NV Tài liệu và HDCX | E38: 12 | F38: 3600000 | G38: =VLOOKUP(RC[-5],'\HOA VE\LUONG\Luong phan mem 2015\Thang 3\[Bang tien lan 2 thang 3 TNCN.xls]ExcelTemplate'!R9C[-5]:R404C[10],16,0) -> 7354688 | H38: =1 -> 1 | I38: =RC[-4] -> 12 | J38: =RC[-4] -> 3600000 | K38: =RC[-3] -> 1
A39: 19 | B39: 010551 | C39: Ngô Ngọc Long | D39: NV Tài liệu và HDCX | E39: 12 | F39: 3600000 | G39: =VLOOKUP(RC[-5],'\HOA VE\LUONG\Luong phan mem 2015\Thang 3\[Bang tien lan 2 thang 3 TNCN.xls]ExcelTemplate'!R9C[-5]:R404C[10],16,0) -> 9111383 | H39: =1 -> 1 | I39: =RC[-4] -> 12 | J39: =RC[-4] -> 3600000 | K39: =RC[-3] -> 1
A40: 20 | B40: 010552 | C40: Nguyễn Thuý Hà | D40: NV Tài liệu và HDCX | E40: 12 | F40: 3600000 | G40: =VLOOKUP(RC[-5],'\HOA VE\LUONG\Luong phan mem 2015\Thang 3\[Bang tien lan 2 thang 3 TNCN.xls]ExcelTemplate'!R9C[-5]:R404C[10],16,0) -> 7156772 | H40: =1 -> 1 | I40: =RC[-4] -> 12 | J40: =RC[-4] -> 3600000 | K40: =RC[-3] -> 1
A41: 21 | B41: 010553 | C41: Đỗ Thanh Tùng | D41: NV Tài liệu và HDCX | E41: 12 | F41: 3600000 | G41: =VLOOKUP(RC[-5],'\HOA VE\LUONG\Luong phan mem 2015\Thang 3\[Bang tien lan 2 thang 3 TNCN.xls]ExcelTemplate'!R9C[-5]:R404C[10],16,0) -> 8241218 | H41: =1 -> 1 | I41: =RC[-4] -> 12 | J41: =RC[-4] -> 3600000 | K41: =RC[-3] -> 1
A42: 22 | B42: 011126 | C42: Nguyễn Thị Thanh Hoa | D42: NV Tài liệu và HDCX | E42: 12 | F42: 3600000 | G42: =VLOOKUP(RC[-5],'\HOA VE\LUONG\Luong phan mem 2015\Thang 3\[Bang tien lan 2 thang 3 TNCN.xls]ExcelTemplate'!R9C[-5]:R404C[10],16,0) -> 6182239 | H42: =1 -> 1 | I42: =RC[-4] -> 12 | J42: =RC[-4] -> 3600000 | K42: =RC[-3] -> 1
A43: 23 | B43: 011127 | C43: Phí Thị Huyền Trang | D43: NV Tài liệu và HDCX | E43: 12 | F43: 3600000 | G43: =VLOOKUP(RC[-5],'\HOA VE\LUONG\Luong phan mem 2015\Thang 3\[Bang tien lan 2 thang 3 TNCN.xls]ExcelTemplate'!R9C[-5]:R404C[10],16,0) -> 6326547 | H43: =1 -> 1 | I43: =RC[-4] -> 12 | J43: =RC[-4] -> 3600000 | K43: =RC[-3] -> 1
A44: 24 | B44: 011128 | C44: Hoàng Thị Yến | D44: NV Tài liệu và HDCX | E44: 12 | F44: 3600000 | G44: =VLOOKUP(RC[-5],'\HOA VE\LUONG\Luong phan mem 2015\Thang 3\[Bang tien lan 2 thang 3 TNCN.xls]ExcelTemplate'!R9C[-5]:R404C[10],16,0) -> 6450730 | H44: =1 -> 1 | I44: =RC[-4] -> 12 | J44: =RC[-4] -> 3600000 | K44: =RC[-3] -> 1
A45: 25 | B45: 011130 | C45: Nguyễn Đình Trung | D45: NV Tài liệu và HDCX | E45: 12 | F45: 3600000 | G45: =VLOOKUP(RC[-5],'\HOA VE\LUONG\Luong phan mem 2015\Thang 3\[Bang tien lan 2 thang 3 TNCN.xls]ExcelTemplate'!R9C[-5]:R404C[10],16,0) -> 6596649 | H45: =1 -> 1 | I45: =RC[-4] -> 12 | J45: =RC[-4] -> 3600000 | K45: =RC[-3] -> 1
A46: 26 | B46: 011131 | C46: Vũ Tuấn Anh | D46: NV Tài liệu và HDCX | E46: 12 | F46: 3600000 | G46: =VLOOKUP(RC[-5],'\HOA VE\LUONG\Luong phan mem 2015\Thang 3\[Bang tien lan 2 thang 3 TNCN.xls]ExcelTemplate'!R9C[-5]:R404C[10],16,0) -> 6472466 | H46: =1 -> 1 | I46: =RC[-4] -> 12 | J46: =RC[-4] -> 3600000 | K46: =RC[-3] -> 1
A47: 27 | B47: 012552 | C47: Mai Hoàng Phương | D47: NV Tài liệu và HDCX | E47: 10 | F47: 3000000 | G47: =VLOOKUP(RC[-5],'\HOA VE\LUONG\Luong phan mem 2015\Thang 3\[Bang tien lan 2 thang 3 TNCN.xls]ExcelTemplate'!R9C[-5]:R404C[10],16,0) -> 6567465 | H47: =1 -> 1 | I47: =RC[-4] -> 10 | J47: =RC[-4] -> 3000000 | K47: =RC[-3] -> 1
A48: 28 | B48: 012553 | C48: Phạm Duy Hải | D48: NV Tài liệu và HDCX | E48: 10 | F48: 3000000 | G48: =VLOOKUP(RC[-5],'\HOA VE\LUONG\Luong phan mem 2015\Thang 3\[Bang tien lan 2 thang 3 TNCN.xls]ExcelTemplate'!R9C[-5]:R404C[10],16,0) -> 6428993 | H48: =1 -> 1 | I48: =RC[-4] -> 10 | J48: =RC[-4] -> 3000000 | K48: =RC[-3] -> 1
A49: 29 | B49: 012565 | C49: Vũ Trọng Nghĩa | D49: NV Tài liệu và HDCX | E49: 10 | F49: 3000000 | G49: =VLOOKUP(RC[-5],'\HOA VE\LUONG\Luong phan mem 2015\Thang 3\[Bang tien lan 2 thang 3 TNCN.xls]ExcelTemplate'!R9C[-5]:R404C[10],16,0) -> 6180628 | H49: =1 -> 1 | I49: =RC[-4] -> 10 | J49: =RC[-4] -> 3000000 | K49: =RC[-3] -> 1
A50: 30 | B50: 012566 | C50: Hoàng Duy Thái | D50: NV Tài liệu và HDCX | E50: 10 | F50: 3000000 | G50: =VLOOKUP(RC[-5],'\HOA VE\LUONG\Luong phan mem 2015\Thang 3\[Bang tien lan 2 thang 3 TNCN.xls]ExcelTemplate'!R9C[-5]:R404C[10],16,0) -> 6567465 | H50: =1 -> 1 | I50: =RC[-4] -> 10 | J50: =RC[-4] -> 3000000 | K50: =RC[-3] -> 1
A51: 31 | B51: 013356 | C51: Trần Anh Sơn | D51: NV Tài liệu và HDCX | E51: 4 | F51: 1200000 | G51: =VLOOKUP(RC[-5],'\HOA VE\LUONG\Luong phan mem 2015\Thang 3\[Bang tien lan 2 thang 3 TNCN.xls]ExcelTemplate'!R9C[-5]:R404C[10],16,0) -> 4357163 | H51: =1 -> 1 | I51: =RC[-4] -> 4 | J51: =RC[-4] -> 1200000 | K51: =RC[-3] -> 1
A52: 32 | B52: 013357 | C52: Nguyễn Trường Giang | D52: NV Tài liệu và HDCX | E52: 4 | F52: 1200000 | G52: =VLOOKUP(RC[-5],'\HOA VE\LUONG\Luong phan mem 2015\Thang 3\[Bang tien lan 2 thang 3 TNCN.xls]ExcelTemplate'!R9C[-5]:R404C[10],16,0) -> 4357163 | H52: =1 -> 1 | I52: =RC[-4] -> 4 | J52: =RC[-4] -> 1200000 | K52: =RC[-3] -> 1
A53: 33 | B53: 013358 | C53: Phan Thế Chung | D53: NV Tài liệu và HDCX | E53: 4 | F53: 1200000 | G53: =VLOOKUP(RC[-5],'\HOA VE\LUONG\Luong phan mem 2015\Thang 3\[Bang tien lan 2 thang 3 TNCN.xls]ExcelTemplate'!R9C[-5]:R404C[10],16,0) -> 4357163 | H53: =1 -> 1 | I53: =RC[-4] -> 4 | J53: =RC[-4] -> 1200000 | K53: =RC[-3] -> 1
A54: 34 | B54: 013359 | C54: Dương Đức An | D54: NV Tài liệu và HDCX | E54: 4 | F54: 1200000 | G54: =VLOOKUP(RC[-5],'\HOA VE\LUONG\Luong phan mem 2015\Thang 3\[Bang tien lan 2 thang 3 TNCN.xls]ExcelTemplate'!R9C[-5]:R404C[10],16,0) -> 4357163 | H54: =1 -> 1 | I54: =RC[-4] -> 4 | J54: =RC[-4] -> 1200000 | K54: =RC[-3] -> 1
A55: 35 | B55: 013360 | C55: Nguyễn Tự Tuyền | D55: NV Tài liệu và HDCX | E55: 4 | F55: 1200000 | G55: =VLOOKUP(RC[-5],'\HOA VE\LUONG\Luong phan mem 2015\Thang 3\[Bang tien lan 2 thang 3 TNCN.xls]ExcelTemplate'!R9C[-5]:R404C[10],16,0) -> 4357163 | H55: =1 -> 1 | I55: =RC[-4] -> 4 | J55: =RC[-4] -> 1200000 | K55: =RC[-3] -> 1
A56: 36 | B56: 010535 | C56: Nguyễn Văn Duẩn | D56: Nv Thống kê | E56: 12 | F56: 3600000 | G56: =VLOOKUP(RC[-5],'\HOA VE\LUONG\Luong phan mem 2015\Thang 3\[Bang tien lan 2 thang 3 TNCN.xls]ExcelTemplate'!R9C[-5]:R404C[10],16,0) -> 7386621 | H56: =1 -> 1 | I56: =RC[-4] -> 12 | J56: =RC[-4] -> 3600000 | K56: =RC[-3] -> 1
A57: 37 | B57: 013527 | C57: Chu Lữ Thu Phương | D57: NV Thủ tục bay, không báo | E57: 3 | F57: 900000 | G57: =VLOOKUP(RC[-5],'\HOA VE\LUONG\Luong phan mem 2015\Thang 3\[Bang tien lan 2 thang 3 TNCN.xls]ExcelTemplate'!R9C[-5]:R404C[10],16,0) -> 4561450 | H57: =1 -> 1 | I57: =RC[-4] -> 3 | J57: =RC[-4] -> 900000 | K57: =RC[-3] -> 1
A58: 38 | B58: 013528 | C58: Cao Thị Trà Giang | D58: NV Thủ tục bay, không báo | E58: 3 | F58: 900000 | G58: =VLOOKUP(RC[-5],'\HOA VE\LUONG\Luong phan mem 2015\Thang 3\[Bang tien lan 2 thang 3 TNCN.xls]ExcelTemplate'!R9C[-5]:R404C[10],16,0) -> 4561450 | H58: =1 -> 1 | I58: =RC[-4] -> 3 | J58: =RC[-4] -> 900000 | K58: =RC[-3] -> 1
A59: 39 | B59: 010536 | C59: Nguyễn Tiến Dũng | D59: NV ULD | E59: 12 | F59: 3600000 | G59: =VLOOKUP(RC[-5],'\HOA VE\LUONG\Luong phan mem 2015\Thang 3\[Bang tien lan 2 thang 3 TNCN.xls]ExcelTemplate'!R9C[-5]:R404C[10],16,0) -> 5876714 | H59: =1 -> 1 | I59: =RC[-4] -> 12 | J59: =RC[-4] -> 3600000 | K59: =RC[-3] -> 1
A60: 40 | B60: 011355 | C60: Văn Anh Tuấn | D60: NV ULD | E60: 12 | F60: 3600000 | G60: =VLOOKUP(RC[-5],'\HOA VE\LUONG\Luong phan mem 2015\Thang 3\[Bang tien lan 2 thang 3 TNCN.xls]ExcelTemplate'!R9C[-5]:R404C[10],16,0) -> 5818347 | H60: =1 -> 1 | I60: =RC[-4] -> 12 | J60: =RC[-4] -> 3600000 | K60: =RC[-3] -> 1
A61: 41 | B61: 012593 | C61: Phạm Trần Tuấn Minh | D61: NV ULD | E61: 10 | F61: 3000000 | G61: =VLOOKUP(RC[-5],'\HOA VE\LUONG\Luong phan mem 2015\Thang 3\[Bang tien lan 2 thang 3 TNCN.xls]ExcelTemplate'!R9C[-5]:R404C[10],16,0) -> 5584876 | H61: =1 -> 1 | I61: =RC[-4] -> 10 | J61: =RC[-4] -> 3000000 | K61: =RC[-3] -> 1
A62: 42 | B62: 012594 | C62: Đỗ Đình Quân | D62: NV ULD | E62: 10 | F62: 3000000 | G62: =VLOOKUP(RC[-5],'\HOA VE\LUONG\Luong phan mem 2015\Thang 3\[Bang tien lan 2 thang 3 TNCN.xls]ExcelTemplate'!R9C[-5]:R404C[10],16,0) -> 5584876 | H62: =1 -> 1 | I62: =RC[-4] -> 10 | J62: =RC[-4] -> 3000000 | K62: =RC[-3] -> 1
A63: 43 | B63: 012595 | C63: Lê Văn Lương | D63: NV ULD | E63: 10 | F63: 3000000 | G63: =VLOOKUP(RC[-5],'\HOA VE\LUONG\Luong phan mem 2015\Thang 3\[Bang tien lan 2 thang 3 TNCN.xls]ExcelTemplate'!R9C[-5]:R404C[10],16,0) -> 5584876 | H63: =1 -> 1 | I63: =RC[-4] -> 10 | J63: =RC[-4] -> 3000000 | K63: =RC[-3] -> 1
A64: 44 | B64: 013669 | C64: Nguyễn Duy Hải | D64: NV ULD | E64: 1 | F64: 300000 | G64: =VLOOKUP(RC[-5],'\HOA VE\LUONG\Luong phan mem 2015\Thang 3\[Bang tien lan 2 thang 3 TNCN.xls]ExcelTemplate'!R9C[-5]:R404C[10],16,0) -> #N/A | H64: =1 -> 1 | I64: =RC[-4] -> 1 | J64: =RC[-4] -> 300000 | K64: =RC[-3] -> 1
A65: 45 | B65: 013102 | C65: Ngô Văn Sơn | D65: Nviên HDCX | E65: 6 | F65: 1800000 | G65: =VLOOKUP(RC[-5],'\HOA VE\LUONG\Luong phan mem 2015\Thang 3\[Bang tien lan 2 thang 3 TNCN.xls]ExcelTemplate'!R9C[-5]:R404C[10],16,0) -> 4357163 | H65: =1 -> 1 | I65: =RC[-4] -> 6 | J65: =RC[-4] -> 1800000 | K65: =RC[-3] -> 1
E66: =SUM(R[-45]C:R[-1]C) -> 451 | F66: =SUM(R[-45]C:R[-1]C) -> 135300000 | G66: =VLOOKUP(RC[-5],'\HOA VE\LUONG\Luong phan mem 2015\Thang 3\[Bang tien lan 2 thang 3 TNCN.xls]ExcelTemplate'!R9C[-5]:R404C[10],16,0) -> #N/A | H66: =SUM(R[-45]C:R[-1]C) -> 45
A67: Phòng Điều hành, tài liệu và hướng dẫn chất xếp (HGS) | E67: =SUM(R[-47]C[4]:R[-1]C[4]) -> 451 | F67: =SUM(R[-47]C[4]:R[-1]C[4]) -> 135300000 | G67: =VLOOKUP(RC[-5],'\HOA VE\LUONG\Luong phan mem 2015\Thang 3\[Bang tien lan 2 thang 3 TNCN.xls]ExcelTemplate'!R9C[-5]:R404C[10],16,0) -> #N/A | H67: =SUM(R[-47]C[3]:R[-1]C[3]) -> 45
A68: Phòng Kế hoạch - Kinh doanh (HGS) | G68: =VLOOKUP(RC[-5],'\HOA VE\LUONG\Luong phan mem 2015\Thang 3\[Bang tien lan 2 thang 3 TNCN.xls]ExcelTemplate'!R9C[-5]:R404C[10],16,0) -> #N/A
G69: =VLOOKUP(RC[-5],'\HOA VE\LUONG\Luong phan mem 2015\Thang 3\[Bang tien lan 2 thang 3 TNCN.xls]ExcelTemplate'!R9C[-5]:R404C[10],16,0) -> #N/A
A70: 1 | B70: 010642 | C70: Lương Văn Thăng | D70: Trưởng phòng | E70: 12 | F70: 3600000 | G70: =VLOOKUP(RC[-5],'\HOA VE\LUONG\Luong phan mem 2015\Thang 3\[Bang tien lan 2 thang 3 TNCN.xls]ExcelTemplate'!R9C[-5]:R404C[10],16,0) -> 14906404 | H70: =1 -> 1 | I70: =RC[-4] -> 12 | J70: =RC[-4] -> 3600000 | K70: =RC[-3] -> 1
A71: 2 | B71: 010559 | C71: Nguyễn Tiến Hiệp | D71: NV Kế hoạch | E71: 12 | F71: 3600000 | G71: =VLOOKUP(RC[-5],'\HOA VE\LUONG\Luong phan mem 2015\Thang 3\[Bang tien lan 2 thang 3 TNCN.xls]ExcelTemplate'!R9C[-5]:R404C[10],16,0) -> 8599859 | H71: =1 -> 1 | I71: =RC[-4] -> 12 | J71: =RC[-4] -> 3600000 | K71: =RC[-3] -> 1
A72: 3 | B72: 010594 | C72: Lê Thị Thu Huyền | D72: NV Kế hoạch | E72: 12 | F72: 3600000 | G72: =VLOOKUP(RC[-5],'\HOA VE\LUONG\Luong phan mem 2015\Thang 3\[Bang tien lan 2 thang 3 TNCN.xls]ExcelTemplate'!R9C[-5]:R404C[10],16,0) -> 5598314 | H72: =1 -> 1 | I72: =RC[-4] -> 12 | J72: =RC[-4] -> 3600000 | K72: =RC[-3] -> 1
A73: 4 | B73: 011146 | C73: Trần Việt Phương | D73: NV Kế hoạch | E73: 12 | F73: 3600000 | G73: =VLOOKUP(RC[-5],'\HOA VE\LUONG\Luong phan mem 2015\Thang 3\[Bang tien lan 2 thang 3 TNCN.xls]ExcelTemplate'!R9C[-5]:R404C[10],16,0) -> 7749310 | H73: =1 -> 1 | I73: =RC[-4] -> 12 | J73: =RC[-4] -> 3600000 | K73: =RC[-3] -> 1
A74: 5 | B74: 010623 | C74: Bùi Đức Hưng | D74: NV Marketing | E74: 12 | F74: 3600000 | G74: =VLOOKUP(RC[-5],'\HOA VE\LUONG\Luong phan mem 2015\Thang 3\[Bang tien lan 2 thang 3 TNCN.xls]ExcelTemplate'!R9C[-5]:R404C[10],16,0) -> 8553974 | H74: =1 -> 1 | I74: =RC[-4] -> 12 | J74: =RC[-4] -> 3600000 | K74: =RC[-3] -> 1
A75: 6 | B75: 011129 | C75: Nguyễn Văn Hiệp | D75: NV Tài liệu và HDCX | E75: 12 | F75: 3600000 | G75: =VLOOKUP(RC[-5],'\HOA VE\LUONG\Luong phan mem 2015\Thang 3\[Bang tien lan 2 thang 3 TNCN.xls]ExcelTemplate'!R9C[-5]:R404C[10],16,0) -> 8508089 | H75: =1 -> 1 | I75: =RC[-4] -> 12 | J75: =RC[-4] -> 3600000 | K75: =RC[-3] -> 1
A76: 7 | B76: 010561 | C76: Vũ Quảng Ba | D76: NV Thủ kho | E76: 12 | F76: 3600000 | G76: =VLOOKUP(RC[-5],'\HOA VE\LUONG\Luong phan mem 2015\Thang 3\[Bang tien lan 2 thang 3 TNCN.xls]ExcelTemplate'!R9C[-5]:R404C[10],16,0) -> 7648664 | H76: =1 -> 1 | I76: =RC[-4] -> 12 | J76: =RC[-4] -> 3600000 | K76: =RC[-3] -> 1
A77: 8 | B77: 010784 | C77: Lê Thị Thạch | D77: Nv VS MB | E77: 12 | F77: 3600000 | G77: =VLOOKUP(RC[-5],'\HOA VE\LUONG\Luong phan mem 2015\Thang 3\[Bang tien lan 2 thang 3 TNCN.xls]ExcelTemplate'!R9C[-5]:R404C[10],16,0) -> 6064895 | H77: =1 -> 1 | I77: =RC[-4] -> 12 | J77: =RC[-4] -> 3600000 | K77: =RC[-3] -> 1
A78: 9 | B78: 010558 | C78: Vương Hoàng Linh | D78: Chuyên viên pháp lý | E78: 12 | F78: 3600000 | G78: =VLOOKUP(RC[-5],'\HOA VE\LUONG\Luong phan mem 2015\Thang 3\[Bang tien lan 2 thang 3 TNCN.xls]ExcelTemplate'!R9C[-5]:R404C[10],16,0) -> 8237578 | H78: =1 -> 1 | I78: =RC[-4] -> 12 | J78: =RC[-4] -> 3600000 | K78: =RC[-3] -> 1
E79: =SUM(R[-9]C:R[-1]C) -> 108 | F79: =SUM(R[-9]C:R[-1]C) -> 32400000 | G79: =VLOOKUP(RC[-5],'\HOA VE\LUONG\Luong phan mem 2015\Thang 3\[Bang tien lan 2 thang 3 TNCN.xls]ExcelTemplate'!R9C[-5]:R404C[10],16,0) -> #N/A | H79: =SUM(R[-9]C:R[-1]C) -> 9
A80: Phòng Kế hoạch - Kinh doanh (HGS) | E80: =SUM(R[-11]C[4]:R[-1]C[4]) -> 108 | F80: =SUM(R[-11]C[4]:R[-1]C[4]) -> 32400000 | G80: =VLOOKUP(RC[-5],'\HOA VE\LUONG\Luong phan mem 2015\Thang 3\[Bang tien lan 2 thang 3 TNCN.xls]ExcelTemplate'!R9C[-5]:R404C[10],16,0) -> #N/A | H80: =SUM(R[-11]C[3]:R[-1]C[3]) -> 9
A81: Phòng Phục vụ hành khách (HGS) | G81: =VLOOKUP(RC[-5],'\HOA VE\LUONG\Luong phan mem 2015\Thang 3\[Bang tien lan 2 thang 3 TNCN.xls]ExcelTemplate'!R9C[-5]:R404C[10],16,0) -> #N/A
A82: Bộ phận nghiệp vụ PPVHK (HGS) | G82: =VLOOKUP(RC[-5],'\HOA VE\LUONG\Luong phan mem 2015\Thang 3\[Bang tien lan 2 thang 3 TNCN.xls]ExcelTemplate'!R9C[-5]:R404C[10],16,0) -> #N/A
A83: 1 | B83: 010564 | C83: Nguyễn Thị Quỳnh Anh | D83: Nv Thống kê | E83: 12 | F83: 3600000 | G83: =VLOOKUP(RC[-5],'\HOA VE\LUONG\Luong phan mem 2015\Thang 3\[Bang tien lan 2 thang 3 TNCN.xls]ExcelTemplate'!R9C[-5]:R404C[10],16,0) -> 7363678 | H83: =1 -> 1 | I83: =RC[-4] -> 12 | J83: =RC[-4] -> 3600000 | K83: =RC[-3] -> 1
A84: Bộ phận nghiệp vụ PPVHK (HGS) | E84: =SUM(R[-1]C:R[-1]C) -> 12 | F84: =SUM(R[-1]C:R[-1]C) -> 3600000 | G84: =VLOOKUP(RC[-5],'\HOA VE\LUONG\Luong phan mem 2015\Thang 3\[Bang tien lan 2 thang 3 TNCN.xls]ExcelTemplate'!R9C[-5]:R404C[10],16,0) -> #N/A | H84: =SUM(R[-1]C:R[-1]C) -> 1
A85: Cán bộ Phòng Phục vụ Hành khách (HGS) | G85: =VLOOKUP(RC[-5],'\HOA VE\LUONG\Luong phan mem 2015\Thang 3\[Bang tien lan 2 thang 3 TNCN.xls]ExcelTemplate'!R9C[-5]:R404C[10],16,0) -> #N/A
A86: 1 | B86: 010641 | C86: Nguyễn Kim Oanh | D86: Trưởng phòng | E86: 12 | F86: 3600000 | G86: =VLOOKUP(RC[-5],'\HOA VE\LUONG\Luong phan mem 2015\Thang 3\[Bang tien lan 2 thang 3 TNCN.xls]ExcelTemplate'!R9C[-5]:R404C[10],16,0) -> 19130135 | H86: =1 -> 1 | I86: =RC[-4] -> 12 | J86: =RC[-4] -> 3600000 | K86: =RC[-3] -> 1
A87: 2 | B87: 010640 | C87: Trần Phương Dung | D87: Phó Trưởng Phòng | E87: 12 | F87: 3600000 | G87: =VLOOKUP(RC[-5],'\HOA VE\LUONG\Luong phan mem 2015\Thang 3\[Bang tien lan 2 thang 3 TNCN.xls]ExcelTemplate'!R9C[-5]:R404C[10],16,0) -> 16474678 | H87: =1 -> 1 | I87: =RC[-4] -> 12 | J87: =RC[-4] -> 3600000 | K87: =RC[-3] -> 1
A88: Cán bộ Phòng Phục vụ Hành khách (HGS) | E88: =SUM(R[-2]C:R[-1]C) -> 24 | F88: =SUM(R[-2]C:R[-1]C) -> 7200000 | G88: =VLOOKUP(RC[-5],'\HOA VE\LUONG\Luong phan mem 2015\Thang 3\[Bang tien lan 2 thang 3 TNCN.xls]ExcelTemplate'!R9C[-5]:R404C[10],16,0) -> #N/A | H88: =SUM(R[-2]C:R[-1]C) -> 2
A89: Đội phục vụ hành khách đến (HGS) | G89: =VLOOKUP(RC[-5],'\HOA VE\LUONG\Luong phan mem 2015\Thang 3\[Bang tien lan 2 thang 3 TNCN.xls]ExcelTemplate'!R9C[-5]:R404C[10],16,0) -> #N/A
A90: 1 | B90: 010629 | C90: Nguyễn Thị Cúc | D90: Đội trưởng | E90: 12 | F90: 3600000 | G90: =VLOOKUP(RC[-5],'\HOA VE\LUONG\Luong phan mem 2015\Thang 3\[Bang tien lan 2 thang 3 TNCN.xls]ExcelTemplate'!R9C[-5]:R404C[10],16,0) -> 5859928 | H90: =1 -> 1 | I90: =RC[-4] -> 12 | J90: =RC[-4] -> 3600000 | K90: =RC[-3] -> 1
A91: 2 | B91: 010628 | C91: Nguyễn Thị Thu Hà | D91: Đội phó | E91: 12 | F91: 3600000 | G91: =VLOOKUP(RC[-5],'\HOA VE\LUONG\Luong phan mem 2015\Thang 3\[Bang tien lan 2 thang 3 TNCN.xls]ExcelTemplate'!R9C[-5]:R404C[10],16,0) -> 10766383 | H91: =1 -> 1 | I91: =RC[-4] -> 12 | J91: =RC[-4] -> 3600000 | K91: =RC[-3] -> 1
A92: 3 | B92: 012555 | C92: Đinh Thanh Ngân | D92: Nhân viên phục vụ hành khách hàng hóa | E92: 10 | F92: 3000000 | G92: =VLOOKUP(RC[-5],'\HOA VE\LUONG\Luong phan mem 2015\Thang 3\[Bang tien lan 2 thang 3 TNCN.xls]ExcelTemplate'!R9C[-5]:R404C[10],16,0) -> 5833221 | H92: =1 -> 1 | I92: =RC[-4] -> 10 | J92: =RC[-4] -> 3000000 | K92: =RC[-3] -> 1
A93: 4 | B93: 012561 | C93: Lê Thị Hồng Vân | D93: Nhân viên phục vụ hành khách hàng hóa | E93: 10 | F93: 3000000 | G93: =VLOOKUP(RC[-5],'\HOA VE\LUONG\Luong phan mem 2015\Thang 3\[Bang tien lan 2 thang 3 TNCN.xls]ExcelTemplate'!R9C[-5]:R404C[10],16,0) -> 5833221 | H93: =1 -> 1 | I93: =RC[-4] -> 10 | J93: =RC[-4] -> 3000000 | K93: =RC[-3] -> 1
A94: 5 | B94: 012564 | C94: Đặng Thị Thu Hà | D94: Nhân viên phục vụ hành khách hàng hóa | E94: 10 | F94: 3000000 | G94: =VLOOKUP(RC[-5],'\HOA VE\LUONG\Luong phan mem 2015\Thang 3\[Bang tien lan 2 thang 3 TNCN.xls]ExcelTemplate'!R9C[-5]:R404C[10],16,0) -> 5833221 | H94: =1 -> 1 | I94: =RC[-4] -> 10 | J94: =RC[-4] -> 3000000 | K94: =RC[-3] -> 1
A95: 6 | B95: 012569 | C95: Cấn Hà An | D95: Nhân viên phục vụ hành khách hàng hóa | E95: 10 | F95: 3000000 | G95: =VLOOKUP(RC[-5],'\HOA VE\LUONG\Luong phan mem 2015\Thang 3\[Bang tien lan 2 thang 3 TNCN.xls]ExcelTemplate'!R9C[-5]:R404C[10],16,0) -> 5833221 | H95: =1 -> 1 | I95: =RC[-4] -> 10 | J95: =RC[-4] -> 3000000 | K95: =RC[-3] -> 1
A96: 7 | B96: 012570 | C96: Nguyễn Hoàng Hải | D96: Nhân viên phục vụ hành khách hàng hóa | E96: 10 | F96: 3000000 | G96: =VLOOKUP(RC[-5],'\HOA VE\LUONG\Luong phan mem 2015\Thang 3\[Bang tien lan 2 thang 3 TNCN.xls]ExcelTemplate'!R9C[-5]:R404C[10],16,0) -> 5833221 | H96: =1 -> 1 | I96: =RC[-4] -> 10 | J96: =RC[-4] -> 3000000 | K96: =RC[-3] -> 1
A97: 8 | B97: 013382 | C97: Nguyễn Thị Bích Thảo | D97: Nhân viên phục vụ hành khách hàng hóa | E97: 4 | F97: 1200000 | G97: =VLOOKUP(RC[-5],'\HOA VE\LUONG\Luong phan mem 2015\Thang 3\[Bang tien lan 2 thang 3 TNCN.xls]ExcelTemplate'!R9C[-5]:R404C[10],16,0) -> 3948589 | H97: =1 -> 1 | I97: =RC[-4] -> 4 | J97: =RC[-4] -> 1200000 | K97: =RC[-3] -> 1
A98: 9 | B98: 010570 | C98: Phạm Anh Dũng | D98: NV PVHK | E98: 12 | F98: 3600000 | G98: =VLOOKUP(RC[-5],'\HOA VE\LUONG\Luong phan mem 2015\Thang 3\[Bang tien lan 2 thang 3 TNCN.xls]ExcelTemplate'!R9C[-5]:R404C[10],16,0) -> 6955877 | H98: =1 -> 1 | I98: =RC[-4] -> 12 | J98: =RC[-4] -> 3600000 | K98: =RC[-3] -> 1
A99: 10 | B99: 010583 | C99: Nguyễn Thanh Huy | D99: NV PVHK | E99: 12 | F99: 3600000 | G99: =VLOOKUP(RC[-5],'\HOA VE\LUONG\Luong phan mem 2015\Thang 3\[Bang tien lan 2 thang 3 TNCN.xls]ExcelTemplate'!R9C[-5]:R404C[10],16,0) -> 6708736 | H99: =1 -> 1 | I99: =RC[-4] -> 12 | J99: =RC[-4] -> 3600000 | K99: =RC[-3] -> 1
A100: 11 | B100: 010585 | C100: Nguyễn Thị Minh Thu | D100: NV PVHK | E100: 12 | F100: 3600000 | G100: =VLOOKUP(RC[-5],'\HOA VE\LUONG\Luong phan mem 2015\Thang 3\[Bang tien lan 2 thang 3 TNCN.xls]ExcelTemplate'!R9C[-5]:R404C[10],16,0) -> 6708736 | H100: =1 -> 1 | I100: =RC[-4] -> 12 | J100: =RC[-4] -> 3600000 | K100: =RC[-3] -> 1
A101: 12 | B101: 010586 | C101: Nguyễn Thu Hằng | D101: NV PVHK | E101: 12 | F101: 3600000 | G101: =VLOOKUP(RC[-5],'\HOA VE\LUONG\Luong phan mem 2015\Thang 3\[Bang tien lan 2 thang 3 TNCN.xls]ExcelTemplate'!R9C[-5]:R404C[10],16,0) -> 6708736 | H101: =1 -> 1 | I101: =RC[-4] -> 12 | J101: =RC[-4] -> 3600000 | K101: =RC[-3] -> 1
A102: 13 | B102: 010600 | C102: Nguyễn Thị Vân Anh | D102: NV PVHK | E102: 12 | F102: 3600000 | G102: =VLOOKUP(RC[-5],'\HOA VE\LUONG\Luong phan mem 2015\Thang 3\[Bang tien lan 2 thang 3 TNCN.xls]ExcelTemplate'!R9C[-5]:R404C[10],16,0) -> 5833221 | H102: =1 -> 1 | I102: =RC[-4] -> 12 | J102: =RC[-4] -> 3600000 | K102: =RC[-3] -> 1
A103: 14 | B103: 010601 | C103: Phan Thị Hạnh | D103: NV PVHK | E103: 12 | F103: 3600000 | G103: =VLOOKUP(RC[-5],'\HOA VE\LUONG\Luong phan mem 2015\Thang 3\[Bang tien lan 2 thang 3 TNCN.xls]ExcelTemplate'!R9C[-5]:R404C[10],16,0) -> 2156685 | H103: =1 -> 1 | I103: =RC[-4] -> 12 | J103: =RC[-4] -> 3600000 | K103: =RC[-3] -> 1
A104: 15 | B104: 010608 | C104: Nguyễn Thị Hương | D104: NV PVHK | E104: 12 | F104: 3600000 | G104: =VLOOKUP(RC[-5],'\HOA VE\LUONG\Luong phan mem 2015\Thang 3\[Bang tien lan 2 thang 3 TNCN.xls]ExcelTemplate'!R9C[-5]:R404C[10],16,0) -> 6209726 | H104: =1 -> 1 | I104: =RC[-4] -> 12 | J104: =RC[-4] -> 3600000 | K104: =RC[-3] -> 1
A105: 16 | B105: 010624 | C105: Nguyễn Huyền Trang | D105: NV PVHK | E105: 12 | F105: 3600000 | G105: =VLOOKUP(RC[-5],'\HOA VE\LUONG\Luong phan mem 2015\Thang 3\[Bang tien lan 2 thang 3 TNCN.xls]ExcelTemplate'!R9C[-5]:R404C[10],16,0) -> 3695072 | H105: =1 -> 1 | I105: =RC[-4] -> 12 | J105: =RC[-4] -> 3600000 | K105: =RC[-3] -> 1
A106: 17 | B106: 010625 | C106: Vương Thị Thanh Nhàn | D106: NV PVHK | E106: 12 | F106: 3600000 | G106: =VLOOKUP(RC[-5],'\HOA VE\LUONG\Luong phan mem 2015\Thang 3\[Bang tien lan 2 thang 3 TNCN.xls]ExcelTemplate'!R9C[-5]:R404C[10],16,0) -> 7213605 | H106: =1 -> 1 | I106: =RC[-4] -> 12 | J106: =RC[-4] -> 3600000 | K106: =RC[-3] -> 1
A107: 18 | B107: 010633 | C107: Quàng Thị Phúc | D107: NV PVHK | E107: 12 | F107: 3600000 | G107: =VLOOKUP(RC[-5],'\HOA VE\LUONG\Luong phan mem 2015\Thang 3\[Bang tien lan 2 thang 3 TNCN.xls]ExcelTemplate'!R9C[-5]:R404C[10],16,0) -> 6618854 | H107: =1 -> 1 | I107: =RC[-4] -> 12 | J107: =RC[-4] -> 3600000 | K107: =RC[-3] -> 1
A108: 19 | B108: 010634 | C108: Phạm Thị Thanh Hoa | D108: NV PVHK | E108: 12 | F108: 3600000 | G108: =VLOOKUP(RC[-5],'\HOA VE\LUONG\Luong phan mem 2015\Thang 3\[Bang tien lan 2 thang 3 TNCN.xls]ExcelTemplate'!R9C[-5]:R404C[10],16,0) -> 7213605 | H108: =1 -> 1 | I108: =RC[-4] -> 12 | J108: =RC[-4] -> 3600000 | K108: =RC[-3] -> 1
A109: 20 | B109: 010635 | C109: Đào Thị Mận | D109: NV PVHK | E109: 12 | F109: 3600000 | G109: =VLOOKUP(RC[-5],'\HOA VE\LUONG\Luong phan mem 2015\Thang 3\[Bang tien lan 2 thang 3 TNCN.xls]ExcelTemplate'!R9C[-5]:R404C[10],16,0) -> 6327016 | H109: =1 -> 1 | I109: =RC[-4] -> 12 | J109: =RC[-4] -> 3600000 | K109: =RC[-3] -> 1
A110: 21 | B110: 011104 | C110: Lê Thị Thanh Huyền | D110: NV PVHK | E110: 12 | F110: 3600000 | G110: =VLOOKUP(RC[-5],'\HOA VE\LUONG\Luong phan mem 2015\Thang 3\[Bang tien lan 2 thang 3 TNCN.xls]ExcelTemplate'!R9C[-5]:R404C[10],16,0) -> 5833221 | H110: =1 -> 1 | I110: =RC[-4] -> 12 | J110: =RC[-4] -> 3600000 | K110: =RC[-3] -> 1
A111: 22 | B111: 011105 | C111: Ngô Minh Thanh | D111: NV PVHK | E111: 12 | F111: 3600000 | G111: =VLOOKUP(RC[-5],'\HOA VE\LUONG\Luong phan mem 2015\Thang 3\[Bang tien lan 2 thang 3 TNCN.xls]ExcelTemplate'!R9C[-5]:R404C[10],16,0) -> 5833221 | H111: =1 -> 1 | I111: =RC[-4] -> 12 | J111: =RC[-4] -> 3600000 | K111: =RC[-3] -> 1
A112: 23 | B112: 011106 | C112: Lê Thị Trang Nhung | D112: NV PVHK | E112: 12 | F112: 3600000 | G112: =VLOOKUP(RC[-5],'\HOA VE\LUONG\Luong phan mem 2015\Thang 3\[Bang tien lan 2 thang 3 TNCN.xls]ExcelTemplate'!R9C[-5]:R404C[10],16,0) -> 5590913 | H112: =1 -> 1 | I112: =RC[-4] -> 12 | J112: =RC[-4] -> 3600000 | K112: =RC[-3] -> 1
A113: 24 | B113: 011107 | C113: Vũ Thị Thơm | D113: NV PVHK | E113: 12 | F113: 3600000 | G113: =VLOOKUP(RC[-5],'\HOA VE\LUONG\Luong phan mem 2015\Thang 3\[Bang tien lan 2 thang 3 TNCN.xls]ExcelTemplate'!R9C[-5]:R404C[10],16,0) -> 2334706 | H113: =1 -> 1 | I113: =RC[-4] -> 12 | J113: =RC[-4] -> 3600000 | K113: =RC[-3] -> 1
A114: 25 | B114: 011108 | C114: Phạm Thùy Dung | D114: NV PVHK | E114: 12 | F114: 3600000 | G114: =VLOOKUP(RC[-5],'\HOA VE\LUONG\Luong phan mem 2015\Thang 3\[Bang tien lan 2 thang 3 TNCN.xls]ExcelTemplate'!R9C[-5]:R404C[10],16,0) -> 2156685 | H114: =1 -> 1 | I114: =RC[-4] -> 12 | J114: =RC[-4] -> 3600000 | K114: =RC[-3] -> 1
A115: 26 | B115: 011109 | C115: Phạm Thành Việt | D115: NV PVHK | E115: 12 | F115: 3600000 | G115: =VLOOKUP(RC[-5],'\HOA VE\LUONG\Luong phan mem 2015\Thang 3\[Bang tien lan 2 thang 3 TNCN.xls]ExcelTemplate'!R9C[-5]:R404C[10],16,0) -> 5833221 | H115: =1 -> 1 | I115: =RC[-4] -> 12 | J115: =RC[-4] -> 3600000 | K115: =RC[-3] -> 1
A116: 27 | B116: 011766 | C116: Nguyễn Thị Vân | D116: NV PVHK | E116: 12 | F116: 3600000 | G116: =VLOOKUP(RC[-5],'\HOA VE\LUONG\Luong phan mem 2015\Thang 3\[Bang tien lan 2 thang 3 TNCN.xls]ExcelTemplate'!R9C[-5]:R404C[10],16,0) -> 2334706 | H116: =1 -> 1 | I116: =RC[-4] -> 12 | J116: =RC[-4] -> 3600000 | K116: =RC[-3] -> 1
A117: 28 | B117: 013096 | C117: Đinh Văn Long | D117: NV PVHK | E117: 6 | F117: 1800000 | G117: =VLOOKUP(RC[-5],'\HOA VE\LUONG\Luong phan mem 2015\Thang 3\[Bang tien lan 2 thang 3 TNCN.xls]ExcelTemplate'!R9C[-5]:R404C[10],16,0) -> 3948589 | H117: =1 -> 1 | I117: =RC[-4] -> 6 | J117: =RC[-4] -> 1800000 | K117: =RC[-3] -> 1
A118: 29 | B118: 010778 | C118: Nguyễn Thị Hồng Anh | D118: Nv VS MB | E118: 12 | F118: 3600000 | G118: =VLOOKUP(RC[-5],'\HOA VE\LUONG\Luong phan mem 2015\Thang 3\[Bang tien lan 2 thang 3 TNCN.xls]ExcelTemplate'!R9C[-5]:R404C[10],16,0) -> 5697133 | H118: =1 -> 1 | I118: =RC[-4] -> 12 | J118: =RC[-4] -> 3600000 | K118: =RC[-3] -> 1
A119: Đội phục vụ hành khách đến (HGS) | E119: =SUM(R[-29]C:R[-1]C) -> 324 | F119: =SUM(R[-29]C:R[-1]C) -> 97200000 | G119: =VLOOKUP(RC[-5],'\HOA VE\LUONG\Luong phan mem 2015\Thang 3\[Bang tien lan 2 thang 3 TNCN.xls]ExcelTemplate'!R9C[-5]:R404C[10],16,0) -> #N/A | H119: =SUM(R[-29]C:R[-1]C) -> 29
A120: Đội phục vụ hành khách đi (HGS) | G120: =VLOOKUP(RC[-5],'\HOA VE\LUONG\Luong phan mem 2015\Thang 3\[Bang tien lan 2 thang 3 TNCN.xls]ExcelTemplate'!R9C[-5]:R404C[10],16,0) -> #N/A
A121: 1 | B121: 011765 | C121: Hoàng Thị Hồng Nhung | D121: NV PVHK | E121: 12 | F121: 3600000 | G121: =VLOOKUP(RC[-5],'\HOA VE\LUONG\Luong phan mem 2015\Thang 3\[Bang tien lan 2 thang 3 TNCN.xls]ExcelTemplate'!R9C[-5]:R404C[10],16,0) -> 5833221 | H121: =1 -> 1 | I121: =RC[-4] -> 12 | J121: =RC[-4] -> 3600000 | K121: =RC[-3] -> 1
A122: Đội phục vụ hành khách đi (HGS) | E122: =SUM(R[-1]C:R[-1]C) -> 12 | F122: =SUM(R[-1]C:R[-1]C) -> 3600000 | G122: =VLOOKUP(RC[-5],'\HOA VE\LUONG\Luong phan mem 2015\Thang 3\[Bang tien lan 2 thang 3 TNCN.xls]ExcelTemplate'!R9C[-5]:R404C[10],16,0) -> #N/A | H122: =SUM(R[-1]C:R[-1]C) -> 1
A123: Đội Phục Vụ Hành Khách Đi Nội Địa (HGS) | G123: =VLOOKUP(RC[-5],'\HOA VE\LUONG\Luong phan mem 2015\Thang 3\[Bang tien lan 2 thang 3 TNCN.xls]ExcelTemplate'!R9C[-5]:R404C[10],16,0) -> #N/A
A124: 1 | B124: 010631 | C124: Nguyễn Thị Phương Mai | D124: Đội trưởng | E124: 12 | F124: 3600000 | G124: =VLOOKUP(RC[-5],'\HOA VE\LUONG\Luong phan mem 2015\Thang 3\[Bang tien lan 2 thang 3 TNCN.xls]ExcelTemplate'!R9C[-5]:R404C[10],16,0) -> 12418126 | H124: =1 -> 1 | I124: =RC[-4] -> 12 | J124: =RC[-4] -> 3600000 | K124: =RC[-3] -> 1
A125: 2 | B125: 010630 | C125: Nguyễn Thị Thu Hương | D125: Đội phó | E125: 12 | F125: 3600000 | G125: =VLOOKUP(RC[-5],'\HOA VE\LUONG\Luong phan mem 2015\Thang 3\[Bang tien lan 2 thang 3 TNCN.xls]ExcelTemplate'!R9C[-5]:R404C[10],16,0) -> 10716876 | H125: =1 -> 1 | I125: =RC[-4] -> 12 | J125: =RC[-4] -> 3600000 | K125: =RC[-3] -> 1
A126: 3 | B126: 012549 | C126: Nguyễn Tuấn Linh | D126: Nhân viên phục vụ hành khách hàng hóa | E126: 10 | F126: 3000000 | G126: =VLOOKUP(RC[-5],'\HOA VE\LUONG\Luong phan mem 2015\Thang 3\[Bang tien lan 2 thang 3 TNCN.xls]ExcelTemplate'!R9C[-5]:R404C[10],16,0) -> 5833221 | H126: =1 -> 1 | I126: =RC[-4] -> 10 | J126: =RC[-4] -> 3000000 | K126: =RC[-3] -> 1
A127: 4 | B127: 012568 | C127: Nguyễn Thị Hồng Minh | D127: Nhân viên phục vụ hành khách hàng hóa | E127: 10 | F127: 3000000 | G127: =VLOOKUP(RC[-5],'\HOA VE\LUONG\Luong phan mem 2015\Thang 3\[Bang tien lan 2 thang 3 TNCN.xls]ExcelTemplate'!R9C[-5]:R404C[10],16,0) -> 5833221 | H127: =1 -> 1 | I127: =RC[-4] -> 10 | J127: =RC[-4] -> 3000000 | K127: =RC[-3] -> 1
A128: 5 | B128: 012571 | C128: Ngô Thị Diễm Quỳnh | D128: Nhân viên phục vụ hành khách hàng hóa | E128: 10 | F128: 3000000 | G128: =VLOOKUP(RC[-5],'\HOA VE\LUONG\Luong phan mem 2015\Thang 3\[Bang tien lan 2 thang 3 TNCN.xls]ExcelTemplate'!R9C[-5]:R404C[10],16,0) -> 5833221 | H128: =1 -> 1 | I128: =RC[-4] -> 10 | J128: =RC[-4] -> 3000000 | K128: =RC[-3] -> 1
A129: 6 | B129: 013370 | C129: Đinh Đức Điệp | D129: Nhân viên phục vụ hành khách hàng hóa | E129: 4 | F129: 1200000 | G129: =VLOOKUP(RC[-5],'\HOA VE\LUONG\Luong phan mem 2015\Thang 3\[Bang tien lan 2 thang 3 TNCN.xls]ExcelTemplate'!R9C[-5]:R404C[10],16,0) -> 3948589 | H129: =1 -> 1 | I129: =RC[-4] -> 4 | J129: =RC[-4] -> 1200000 | K129: =RC[-3] -> 1
A130: 7 | B130: 013372 | C130: Trần Thị Hoa Lý | D130: Nhân viên phục vụ hành khách hàng hóa | E130: 4 | F130: 1200000 | G130: =VLOOKUP(RC[-5],'\HOA VE\LUONG\Luong phan mem 2015\Thang 3\[Bang tien lan 2 thang 3 TNCN.xls]ExcelTemplate'!R9C[-5]:R404C[10],16,0) -> 3948589 | H130: =1 -> 1 | I130: =RC[-4] -> 4 | J130: =RC[-4] -> 1200000 | K130: =RC[-3] -> 1
A131: 8 | B131: 013376 | C131: Vũ Thùy Linh | D131: Nhân viên phục vụ hành khách hàng hóa | E131: 4 | F131: 1200000 | G131: =VLOOKUP(RC[-5],'\HOA VE\LUONG\Luong phan mem 2015\Thang 3\[Bang tien lan 2 thang 3 TNCN.xls]ExcelTemplate'!R9C[-5]:R404C[10],16,0) -> 3948589 | H131: =1 -> 1 | I131: =RC[-4] -> 4 | J131: =RC[-4] -> 1200000 | K131: =RC[-3] -> 1
A132: 9 | B132: 013377 | C132: Vũ Thị Bích Dung | D132: Nhân viên phục vụ hành khách hàng hóa | E132: 4 | F132: 1200000 | G132: =VLOOKUP(RC[-5],'\HOA VE\LUONG\Luong phan mem 2015\Thang 3\[Bang tien lan 2 thang 3 TNCN.xls]ExcelTemplate'!R9C[-5]:R404C[10],16,0) -> 3948589 | H132: =1 -> 1 | I132: =RC[-4] -> 4 | J132: =RC[-4] -> 1200000 | K132: =RC[-3] -> 1
A133: 10 | B133: 013378 | C133: Nguyễn Bảo Ngân | D133: Nhân viên phục vụ hành khách hàng hóa | E133: 4 | F133: 1200000 | G133: =VLOOKUP(RC[-5],'\HOA VE\LUONG\Luong phan mem 2015\Thang 3\[Bang tien lan 2 thang 3 TNCN.xls]ExcelTemplate'!R9C[-5]:R404C[10],16,0) -> 3948589 | H133: =1 -> 1 | I133: =RC[-4] -> 4 | J133: =RC[-4] -> 1200000 | K133: =RC[-3] -> 1
A134: 11 | B134: 013379 | C134: Nguyễn Thùy Linh | D134: Nhân viên phục vụ hành khách hàng hóa | E134: 4 | F134: 1200000 | G134: =VLOOKUP(RC[-5],'\HOA VE\LUONG\Luong phan mem 2015\Thang 3\[Bang tien lan 2 thang 3 TNCN.xls]ExcelTemplate'!R9C[-5]:R404C[10],16,0) -> 3948589 | H134: =1 -> 1 | I134: =RC[-4] -> 4 | J134: =RC[-4] -> 1200000 | K134: =RC[-3] -> 1
A135: 12 | B135: 013674 | C135: Lê Thị Minh Phượng | D135: Nhân viên phục vụ hành khách hàng hóa | E135: 1 | F135: 300000 | G135: =VLOOKUP(RC[-5],'\HOA VE\LUONG\Luong phan mem 2015\Thang 3\[Bang tien lan 2 thang 3 TNCN.xls]ExcelTemplate'!R9C[-5]:R404C[10],16,0) -> #N/A | H135: =1 -> 1 | I135: =RC[-4] -> 1 | J135: =RC[-4] -> 300000 | K135: =RC[-3] -> 1
A136: 13 | B136: 013675 | C136: Võ Thị Kiều Oanh | D136: Nhân viên phục vụ hành khách hàng hóa | E136: 1 | F136: 300000 | G136: =VLOOKUP(RC[-5],'\HOA VE\LUONG\Luong phan mem 2015\Thang 3\[Bang tien lan 2 thang 3 TNCN.xls]ExcelTemplate'!R9C[-5]:R404C[10],16,0) -> #N/A | H136: =1 -> 1 | I136: =RC[-4] -> 1 | J136: =RC[-4] -> 300000 | K136: =RC[-3] -> 1
A137: 14 | B137: 013676 | C137: Trần Thị Bích Ngọc | D137: Nhân viên phục vụ hành khách hàng hóa | E137: 1 | F137: 300000 | G137: =VLOOKUP(RC[-5],'\HOA VE\LUONG\Luong phan mem 2015\Thang 3\[Bang tien lan 2 thang 3 TNCN.xls]ExcelTemplate'!R9C[-5]:R404C[10],16,0) -> #N/A | H137: =1 -> 1 | I137: =RC[-4] -> 1 | J137: =RC[-4] -> 300000 | K137: =RC[-3] -> 1
A138: 15 | B138: 010569 | C138: Đàm Thu Hường | D138: NV PVHK | E138: 12 | F138: 3600000 | G138: =VLOOKUP(RC[-5],'\HOA VE\LUONG\Luong phan mem 2015\Thang 3\[Bang tien lan 2 thang 3 TNCN.xls]ExcelTemplate'!R9C[-5]:R404C[10],16,0) -> 8194781 | H138: =1 -> 1 | I138: =RC[-4] -> 12 | J138: =RC[-4] -> 3600000 | K138: =RC[-3] -> 1
A139: 16 | B139: 010571 | C139: Nguyễn Thị Thuỳ Dung | D139: NV PVHK | E139: 12 | F139: 3600000 | G139: =VLOOKUP(RC[-5],'\HOA VE\LUONG\Luong phan mem 2015\Thang 3\[Bang tien lan 2 thang 3 TNCN.xls]ExcelTemplate'!R9C[-5]:R404C[10],16,0) -> 7464631 | H139: =1 -> 1 | I139: =RC[-4] -> 12 | J139: =RC[-4] -> 3600000 | K139: =RC[-3] -> 1
A140: 17 | B140: 010578 | C140: Bùi Việt Quang | D140: NV PVHK | E140: 12 | F140: 3600000 | G140: =VLOOKUP(RC[-5],'\HOA VE\LUONG\Luong phan mem 2015\Thang 3\[Bang tien lan 2 thang 3 TNCN.xls]ExcelTemplate'!R9C[-5]:R404C[10],16,0) -> 7029758 | H140: =1 -> 1 | I140: =RC[-4] -> 12 | J140: =RC[-4] -> 3600000 | K140: =RC[-3] -> 1
A141: 18 | B141: 010589 | C141: Phạm Thị Ba | D141: NV PVHK | E141: 12 | F141: 3600000 | G141: =VLOOKUP(RC[-5],'\HOA VE\LUONG\Luong phan mem 2015\Thang 3\[Bang tien lan 2 thang 3 TNCN.xls]ExcelTemplate'!R9C[-5]:R404C[10],16,0) -> 6822587 | H141: =1 -> 1 | I141: =RC[-4] -> 12 | J141: =RC[-4] -> 3600000 | K141: =RC[-3] -> 1
A142: 19 | B142: 010591 | C142: Vũ Phương Thanh | D142: NV PVHK | E142: 12 | F142: 3600000 | G142: =VLOOKUP(RC[-5],'\HOA VE\LUONG\Luong phan mem 2015\Thang 3\[Bang tien lan 2 thang 3 TNCN.xls]ExcelTemplate'!R9C[-5]:R404C[10],16,0) -> 6268094 | H142: =1 -> 1 | I142: =RC[-4] -> 12 | J142: =RC[-4] -> 3600000 | K142: =RC[-3] -> 1
A143: 20 | B143: 010596 | C143: Phạm Thị Ánh Hồng | D143: NV PVHK | E143: 12 | F143: 3600000 | G143: =VLOOKUP(RC[-5],'\HOA VE\LUONG\Luong phan mem 2015\Thang 3\[Bang tien lan 2 thang 3 TNCN.xls]ExcelTemplate'!R9C[-5]:R404C[10],16,0) -> 6416898 | H143: =1 -> 1 | I143: =RC[-4] -> 12 | J143: =RC[-4] -> 3600000 | K143: =RC[-3] -> 1
A144: 21 | B144: 010597 | C144: Nguyễn Thị Thu Sang | D144: NV PVHK | E144: 12 | F144: 3600000 | G144: =VLOOKUP(RC[-5],'\HOA VE\LUONG\Luong phan mem 2015\Thang 3\[Bang tien lan 2 thang 3 TNCN.xls]ExcelTemplate'!R9C[-5]:R404C[10],16,0) -> 6416898 | H144: =1 -> 1 | I144: =RC[-4] -> 12 | J144: =RC[-4] -> 3600000 | K144: =RC[-3] -> 1
A145: 22 | B145: 010598 | C145: Nguyễn Ngọc Quân | D145: NV PVHK | E145: 12 | F145: 3600000 | G145: =VLOOKUP(RC[-5],'\HOA VE\LUONG\Luong phan mem 2015\Thang 3\[Bang tien lan 2 thang 3 TNCN.xls]ExcelTemplate'!R9C[-5]:R404C[10],16,0) -> 7029758 | H145: =1 -> 1 | I145: =RC[-4] -> 12 | J145: =RC[-4] -> 3600000 | K145: =RC[-3] -> 1
A146: 23 | B146: 010602 | C146: Nguyễn Thị Thu Trang | D146: NV PVHK | E146: 12 | F146: 3600000 | G146: =VLOOKUP(RC[-5],'\HOA VE\LUONG\Luong phan mem 2015\Thang 3\[Bang tien lan 2 thang 3 TNCN.xls]ExcelTemplate'!R9C[-5]:R404C[10],16,0) -> 6192294 | H146: =1 -> 1 | I146: =RC[-4] -> 12 | J146: =RC[-4] -> 3600000 | K146: =RC[-3] -> 1
A147: 24 | B147: 010603 | C147: Nguyễn Thị Vân Anh | D147: NV PVHK | E147: 12 | F147: 3600000 | G147: =VLOOKUP(RC[-5],'\HOA VE\LUONG\Luong phan mem 2015\Thang 3\[Bang tien lan 2 thang 3 TNCN.xls]ExcelTemplate'!R9C[-5]:R404C[10],16,0) -> 5833221 | H147: =1 -> 1 | I147: =RC[-4] -> 12 | J147: =RC[-4] -> 3600000 | K147: =RC[-3] -> 1
A148: 25 | B148: 010606 | C148: Lê Thị Thao | D148: NV PVHK | E148: 11 | F148: 3300000 | G148: =VLOOKUP(RC[-5],'\HOA VE\LUONG\Luong phan mem 2015\Thang 3\[Bang tien lan 2 thang 3 TNCN.xls]ExcelTemplate'!R9C[-5]:R404C[10],16,0) -> 6671165 | H148: =1 -> 1 | I148: =RC[-4] -> 11 | J148: =RC[-4] -> 3300000 | K148: =RC[-3] -> 1
A149: 26 | B149: 010618 | C149: Nguyễn Thị Hằng | D149: NV PVHK | E149: 12 | F149: 3600000 | G149: =VLOOKUP(RC[-5],'\HOA VE\LUONG\Luong phan mem 2015\Thang 3\[Bang tien lan 2 thang 3 TNCN.xls]ExcelTemplate'!R9C[-5]:R404C[10],16,0) -> 6822587 | H149: =1 -> 1 | I149: =RC[-4] -> 12 | J149: =RC[-4] -> 3600000 | K149: =RC[-3] -> 1
A150: 27 | B150: 010619 | C150: Phạm Thị Thu Hương | D150: NV PVHK | E150: 12 | F150: 3600000 | G150: =VLOOKUP(RC[-5],'\HOA VE\LUONG\Luong phan mem 2015\Thang 3\[Bang tien lan 2 thang 3 TNCN.xls]ExcelTemplate'!R9C[-5]:R404C[10],16,0) -> 7114425 | H150: =1 -> 1 | I150: =RC[-4] -> 12 | J150: =RC[-4] -> 3600000 | K150: =RC[-3] -> 1
A151: 28 | B151: 010620 | C151: Trần Thị Thu | D151: NV PVHK | E151: 12 | F151: 3600000 | G151: =VLOOKUP(RC[-5],'\HOA VE\LUONG\Luong phan mem 2015\Thang 3\[Bang tien lan 2 thang 3 TNCN.xls]ExcelTemplate'!R9C[-5]:R404C[10],16,0) -> 2480626 | H151: =1 -> 1 | I151: =RC[-4] -> 12 | J151: =RC[-4] -> 3600000 | K151: =RC[-3] -> 1
A152: 29 | B152: 010621 | C152: Hoàng Anh Trang | D152: NV PVHK | E152: 11 | F152: 3300000 | G152: =VLOOKUP(RC[-5],'\HOA VE\LUONG\Luong phan mem 2015\Thang 3\[Bang tien lan 2 thang 3 TNCN.xls]ExcelTemplate'!R9C[-5]:R404C[10],16,0) -> 6209726 | H152: =1 -> 1 | I152: =RC[-4] -> 11 | J152: =RC[-4] -> 3300000 | K152: =RC[-3] -> 1
A153: 30 | B153: 011111 | C153: Phạm Kim Hoàn | D153: NV PVHK | E153: 12 | F153: 3600000 | G153: =VLOOKUP(RC[-5],'\HOA VE\LUONG\Luong phan mem 2015\Thang 3\[Bang tien lan 2 thang 3 TNCN.xls]ExcelTemplate'!R9C[-5]:R404C[10],16,0) -> 5833221 | H153: =1 -> 1 | I153: =RC[-4] -> 12 | J153: =RC[-4] -> 3600000 | K153: =RC[-3] -> 1
A154: 31 | B154: 011116 | C154: Đỗ Thanh Bình | D154: NV PVHK | E154: 12 | F154: 3600000 | G154: =VLOOKUP(RC[-5],'\HOA VE\LUONG\Luong phan mem 2015\Thang 3\[Bang tien lan 2 thang 3 TNCN.xls]ExcelTemplate'!R9C[-5]:R404C[10],16,0) -> 6416898 | H154: =1 -> 1 | I154: =RC[-4] -> 12 | J154: =RC[-4] -> 3600000 | K154: =RC[-3] -> 1
A155: 32 | B155: 011119 | C155: Nguyễn Hương Quỳnh | D155: NV PVHK | E155: 12 | F155: 3600000 | G155: =VLOOKUP(RC[-5],'\HOA VE\LUONG\Luong phan mem 2015\Thang 3\[Bang tien lan 2 thang 3 TNCN.xls]ExcelTemplate'!R9C[-5]:R404C[10],16,0) -> 6416898 | H155: =1 -> 1 | I155: =RC[-4] -> 12 | J155: =RC[-4] -> 3600000 | K155: =RC[-3] -> 1
A156: 33 | B156: 011123 | C156: Bùi Thị Bảo Ngọc | D156: NV PVHK | E156: 12 | F156: 3600000 | G156: =VLOOKUP(RC[-5],'\HOA VE\LUONG\Luong phan mem 2015\Thang 3\[Bang tien lan 2 thang 3 TNCN.xls]ExcelTemplate'!R9C[-5]:R404C[10],16,0) -> 5833221 | H156: =1 -> 1 | I156: =RC[-4] -> 12 | J156: =RC[-4] -> 3600000 | K156: =RC[-3] -> 1
A157: 34 | B157: 011764 | C157: Nguyễn Thu Huyền | D157: NV PVHK | E157: 9 | F157: 2700000 | G157: =VLOOKUP(RC[-5],'\HOA VE\LUONG\Luong phan mem 2015\Thang 3\[Bang tien lan 2 thang 3 TNCN.xls]ExcelTemplate'!R9C[-5]:R404C[10],16,0) -> 0 | H157: =1 -> 1 | I157: =RC[-4] -> 9 | J157: =RC[-4] -> 2700000 | K157: =RC[-3] -> 1
A158: 35 | B158: 012281 | C158: Nguyễn Minh Phương | D158: NV PVHK | E158: 12 | F158: 3600000 | G158: =VLOOKUP(RC[-5],'\HOA VE\LUONG\Luong phan mem 2015\Thang 3\[Bang tien lan 2 thang 3 TNCN.xls]ExcelTemplate'!R9C[-5]:R404C[10],16,0) -> 2334706 | H158: =1 -> 1 | I158: =RC[-4] -> 12 | J158: =RC[-4] -> 3600000 | K158: =RC[-3] -> 1
A159: 36 | B159: 013097 | C159: Nguyễn Thu Quỳnh | D159: NV PVHK | E159: 6 | F159: 1800000 | G159: =VLOOKUP(RC[-5],'\HOA VE\LUONG\Luong phan mem 2015\Thang 3\[Bang tien lan 2 thang 3 TNCN.xls]ExcelTemplate'!R9C[-5]:R404C[10],16,0) -> 3948589 | H159: =1 -> 1 | I159: =RC[-4] -> 6 | J159: =RC[-4] -> 1800000 | K159: =RC[-3] -> 1
A160: 37 | B160: 013101 | C160: Trần Thị Huệ | D160: NV PVHK | E160: 6 | F160: 1800000 | G160: =VLOOKUP(RC[-5],'\HOA VE\LUONG\Luong phan mem 2015\Thang 3\[Bang tien lan 2 thang 3 TNCN.xls]ExcelTemplate'!R9C[-5]:R404C[10],16,0) -> 3948589 | H160: =1 -> 1 | I160: =RC[-4] -> 6 | J160: =RC[-4] -> 1800000 | K160: =RC[-3] -> 1
A161: 38 | B161: 013532 | C161: Nguyễn Tuấn Cường | D161: NV PVHK | E161: 3 | F161: 900000 | G161: =VLOOKUP(RC[-5],'\HOA VE\LUONG\Luong phan mem 2015\Thang 3\[Bang tien lan 2 thang 3 TNCN.xls]ExcelTemplate'!R9C[-5]:R404C[10],16,0) -> 3948589 | H161: =1 -> 1 | I161: =RC[-4] -> 3 | J161: =RC[-4] -> 900000 | K161: =RC[-3] -> 1
A162: 39 | B162: 011357 | C162: Nguyễn Việt Dũng | D162: NV PVHKĐB | E162: 12 | F162: 3600000 | G162: =VLOOKUP(RC[-5],'\HOA VE\LUONG\Luong phan mem 2015\Thang 3\[Bang tien lan 2 thang 3 TNCN.xls]ExcelTemplate'!R9C[-5]:R404C[10],16,0) -> 6416898 | H162: =1 -> 1 | I162: =RC[-4] -> 12 | J162: =RC[-4] -> 3600000 | K162: =RC[-3] -> 1
A163: Đội Phục Vụ Hành Khách Đi Nội Địa (HGS) | E163: =SUM(R[-39]C:R[-1]C) -> 355 | F163: =SUM(R[-39]C:R[-1]C) -> 106500000 | G163: =VLOOKUP(RC[-5],'\HOA VE\LUONG\Luong phan mem 2015\Thang 3\[Bang tien lan 2 thang 3 TNCN.xls]ExcelTemplate'!R9C[-5]:R404C[10],16,0) -> #N/A | H163: =SUM(R[-39]C:R[-1]C) -> 39
A164: Đội Phục Vụ Hành Khách Đi Quốc Tế (HGS) | G164: =VLOOKUP(RC[-5],'\HOA VE\LUONG\Luong phan mem 2015\Thang 3\[Bang tien lan 2 thang 3 TNCN.xls]ExcelTemplate'!R9C[-5]:R404C[10],16,0) -> #N/A
A165: 1 | B165: 010632 | C165: Trần Thanh Hiếu | D165: Đội phó | E165: 12 | F165: 3600000 | G165: =VLOOKUP(RC[-5],'\HOA VE\LUONG\Luong phan mem 2015\Thang 3\[Bang tien lan 2 thang 3 TNCN.xls]ExcelTemplate'!R9C[-5]:R404C[10],16,0) -> 10766383 | H165: =1 -> 1 | I165: =RC[-4] -> 12 | J165: =RC[-4] -> 3600000 | K165: =RC[-3] -> 1
A166: 2 | B166: 012557 | C166: Nguyễn Thị Lan | D166: Nhân viên phục vụ hành khách hàng hóa | E166: 10 | F166: 3000000 | G166: =VLOOKUP(RC[-5],'\HOA VE\LUONG\Luong phan mem 2015\Thang 3\[Bang tien lan 2 thang 3 TNCN.xls]ExcelTemplate'!R9C[-5]:R404C[10],16,0) -> 5833221 | H166: =1 -> 1 | I166: =RC[-4] -> 10 | J166: =RC[-4] -> 3000000 | K166: =RC[-3] -> 1
A167: 3 | B167: 012559 | C167: Phạm Thị Mai Giang | D167: Nhân viên phục vụ hành khách hàng hóa | E167: 9 | F167: 2700000 | G167: =VLOOKUP(RC[-5],'\HOA VE\LUONG\Luong phan mem 2015\Thang 3\[Bang tien lan 2 thang 3 TNCN.xls]ExcelTemplate'!R9C[-5]:R404C[10],16,0) -> 4564200 | H167: =1 -> 1 | I167: =RC[-4] -> 9 | J167: =RC[-4] -> 2700000 | K167: =RC[-3] -> 1
A168: 4 | B168: 012562 | C168: Đỗ Thị Thu Trang | D168: Nhân viên phục vụ hành khách hàng hóa | E168: 10 | F168: 3000000 | G168: =VLOOKUP(RC[-5],'\HOA VE\LUONG\Luong phan mem 2015\Thang 3\[Bang tien lan 2 thang 3 TNCN.xls]ExcelTemplate'!R9C[-5]:R404C[10],16,0) -> 5833221 | H168: =1 -> 1 | I168: =RC[-4] -> 10 | J168: =RC[-4] -> 3000000 | K168: =RC[-3] -> 1
A169: 5 | B169: 012563 | C169: Trịnh Khánh Linh | D169: Nhân viên phục vụ hành khách hàng hóa | E169: 10 | F169: 3000000 | G169: =VLOOKUP(RC[-5],'\HOA VE\LUONG\Luong phan mem 2015\Thang 3\[Bang tien lan 2 thang 3 TNCN.xls]ExcelTemplate'!R9C[-5]:R404C[10],16,0) -> 5833221 | H169: =1 -> 1 | I169: =RC[-4] -> 10 | J169: =RC[-4] -> 3000000 | K169: =RC[-3] -> 1
A170: 6 | B170: 012567 | C170: Nguyễn Thị Hải Yến | D170: Nhân viên phục vụ hành khách hàng hóa | E170: 10 | F170: 3000000 | G170: =VLOOKUP(RC[-5],'\HOA VE\LUONG\Luong phan mem 2015\Thang 3\[Bang tien lan 2 thang 3 TNCN.xls]ExcelTemplate'!R9C[-5]:R404C[10],16,0) -> 5833221 | H170: =1 -> 1 | I170: =RC[-4] -> 10 | J170: =RC[-4] -> 3000000 | K170: =RC[-3] -> 1
A171: 7 | B171: 013361 | C171: Mai Thế Anh | D171: Nhân viên phục vụ hành khách hàng hóa | E171: 4 | F171: 1200000 | G171: =VLOOKUP(RC[-5],'\HOA VE\LUONG\Luong phan mem 2015\Thang 3\[Bang tien lan 2 thang 3 TNCN.xls]ExcelTemplate'!R9C[-5]:R404C[10],16,0) -> 3948589 | H171: =1 -> 1 | I171: =RC[-4] -> 4 | J171: =RC[-4] -> 1200000 | K171: =RC[-3] -> 1
A172: 8 | B172: 013373 | C172: Trần Thị Sơn | D172: Nhân viên phục vụ hành khách hàng hóa | E172: 4 | F172: 1200000 | G172: =VLOOKUP(RC[-5],'\HOA VE\LUONG\Luong phan mem 2015\Thang 3\[Bang tien lan 2 thang 3 TNCN.xls]ExcelTemplate'!R9C[-5]:R404C[10],16,0) -> 3948589 | H172: =1 -> 1 | I172: =RC[-4] -> 4 | J172: =RC[-4] -> 1200000 | K172: =RC[-3] -> 1
A173: 9 | B173: 013374 | C173: Trần Thị Ngọc Hoa | D173: Nhân viên phục vụ hành khách hàng hóa | E173: 4 | F173: 1200000 | G173: =VLOOKUP(RC[-5],'\HOA VE\LUONG\Luong phan mem 2015\Thang 3\[Bang tien lan 2 thang 3 TNCN.xls]ExcelTemplate'!R9C[-5]:R404C[10],16,0) -> 3948589 | H173: =1 -> 1 | I173: =RC[-4] -> 4 | J173: =RC[-4] -> 1200000 | K173: =RC[-3] -> 1
A174: 10 | B174: 013380 | C174: Nguyễn Thị Yến Hương | D174: Nhân viên phục vụ hành khách hàng hóa | E174: 4 | F174: 1200000 | G174: =VLOOKUP(RC[-5],'\HOA VE\LUONG\Luong phan mem 2015\Thang 3\[Bang tien lan 2 thang 3 TNCN.xls]ExcelTemplate'!R9C[-5]:R404C[10],16,0) -> 3948589 | H174: =1 -> 1 | I174: =RC[-4] -> 4 | J174: =RC[-4] -> 1200000 | K174: =RC[-3] -> 1
A175: 11 | B175: 013405 | C175: Nguyễn Thị Thúy Hằng | D175: Nhân viên phục vụ hành khách hàng hóa | E175: 4 | F175: 1200000 | G175: =VLOOKUP(RC[-5],'\HOA VE\LUONG\Luong phan mem 2015\Thang 3\[Bang tien lan 2 thang 3 TNCN.xls]ExcelTemplate'!R9C[-5]:R404C[10],16,0) -> 3948589 | H175: =1 -> 1 | I175: =RC[-4] -> 4 | J175: =RC[-4] -> 1200000 | K175: =RC[-3] -> 1
A176: 12 | B176: 013670 | C176: Nguyễn Thảo Ly | D176: Nhân viên phục vụ hành khách hàng hóa | E176: 1 | F176: 300000 | G176: =VLOOKUP(RC[-5],'\HOA VE\LUONG\Luong phan mem 2015\Thang 3\[Bang tien lan 2 thang 3 TNCN.xls]ExcelTemplate'!R9C[-5]:R404C[10],16,0) -> #N/A | H176: =1 -> 1 | I176: =RC[-4] -> 1 | J176: =RC[-4] -> 300000 | K176: =RC[-3] -> 1
A177: 13 | B177: 013671 | C177: Nguyễn Thị Phương Thảo | D177: Nhân viên phục vụ hành khách hàng hóa | E177: 1 | F177: 300000 | G177: =VLOOKUP(RC[-5],'\HOA VE\LUONG\Luong phan mem 2015\Thang 3\[Bang tien lan 2 thang 3 TNCN.xls]ExcelTemplate'!R9C[-5]:R404C[10],16,0) -> #N/A | H177: =1 -> 1 | I177: =RC[-4] -> 1 | J177: =RC[-4] -> 300000 | K177: =RC[-3] -> 1
A178: 14 | B178: 013672 | C178: Mai Thị Huyền Trang | D178: Nhân viên phục vụ hành khách hàng hóa | E178: 1 | F178: 300000 | G178: =VLOOKUP(RC[-5],'\HOA VE\LUONG\Luong phan mem 2015\Thang 3\[Bang tien lan 2 thang 3 TNCN.xls]ExcelTemplate'!R9C[-5]:R404C[10],16,0) -> #N/A | H178: =1 -> 1 | I178: =RC[-4] -> 1 | J178: =RC[-4] -> 300000 | K178: =RC[-3] -> 1
A179: 15 | B179: 013673 | C179: Đỗ Văn Thắng | D179: Nhân viên phục vụ hành khách hàng hóa | E179: 1 | F179: 300000 | G179: =VLOOKUP(RC[-5],'\HOA VE\LUONG\Luong phan mem 2015\Thang 3\[Bang tien lan 2 thang 3 TNCN.xls]ExcelTemplate'!R9C[-5]:R404C[10],16,0) -> #N/A | H179: =1 -> 1 | I179: =RC[-4] -> 1 | J179: =RC[-4] -> 300000 | K179: =RC[-3] -> 1
A180: 16 | B180: 010572 | C180: Võ Thị Hồng Minh | D180: NV PVHK | E180: 12 | F180: 3600000 | G180: =VLOOKUP(RC[-5],'\HOA VE\LUONG\Luong phan mem 2015\Thang 3\[Bang tien lan 2 thang 3 TNCN.xls]ExcelTemplate'!R9C[-5]:R404C[10],16,0) -> 7464631 | H180: =1 -> 1 | I180: =RC[-4] -> 12 | J180: =RC[-4] -> 3600000 | K180: =RC[-3] -> 1
A181: 17 | B181: 010574 | C181: Nguyễn Thị Hồng Duyên | D181: NV PVHK | E181: 12 | F181: 3600000 | G181: =VLOOKUP(RC[-5],'\HOA VE\LUONG\Luong phan mem 2015\Thang 3\[Bang tien lan 2 thang 3 TNCN.xls]ExcelTemplate'!R9C[-5]:R404C[10],16,0) -> 7563811 | H181: =1 -> 1 | I181: =RC[-4] -> 12 | J181: =RC[-4] -> 3600000 | K181: =RC[-3] -> 1
A182: 18 | B182: 010575 | C182: Phan Thị Thu Hường | D182: NV PVHK | E182: 12 | F182: 3600000 | G182: =VLOOKUP(RC[-5],'\HOA VE\LUONG\Luong phan mem 2015\Thang 3\[Bang tien lan 2 thang 3 TNCN.xls]ExcelTemplate'!R9C[-5]:R404C[10],16,0) -> 5538348 | H182: =1 -> 1 | I182: =RC[-4] -> 12 | J182: =RC[-4] -> 3600000 | K182: =RC[-3] -> 1
A183: 19 | B183: 010579 | C183: Tạ Thị Cẩm Vân | D183: NV PVHK | E183: 9 | F183: 2700000 | G183: =VLOOKUP(RC[-5],'\HOA VE\LUONG\Luong phan mem 2015\Thang 3\[Bang tien lan 2 thang 3 TNCN.xls]ExcelTemplate'!R9C[-5]:R404C[10],16,0) -> 7029758 | H183: =1 -> 1 | I183: =RC[-4] -> 9 | J183: =RC[-4] -> 2700000 | K183: =RC[-3] -> 1
A184: 20 | B184: 010581 | C184: Nguyễn Thị Hoài | D184: NV PVHK | E184: 12 | F184: 3600000 | G184: =VLOOKUP(RC[-5],'\HOA VE\LUONG\Luong phan mem 2015\Thang 3\[Bang tien lan 2 thang 3 TNCN.xls]ExcelTemplate'!R9C[-5]:R404C[10],16,0) -> 6708736 | H184: =1 -> 1 | I184: =RC[-4] -> 12 | J184: =RC[-4] -> 3600000 | K184: =RC[-3] -> 1
A185: 21 | B185: 010587 | C185: Nguyễn Thị Tú Oanh | D185: NV PVHK | E185: 12 | F185: 3600000 | G185: =VLOOKUP(RC[-5],'\HOA VE\LUONG\Luong phan mem 2015\Thang 3\[Bang tien lan 2 thang 3 TNCN.xls]ExcelTemplate'!R9C[-5]:R404C[10],16,0) -> 2772464 | H185: =1 -> 1 | I185: =RC[-4] -> 12 | J185: =RC[-4] -> 3600000 | K185: =RC[-3] -> 1
A186: 22 | B186: 010592 | C186: Trần Thị Thu Huyền | D186: NV PVHK | E186: 12 | F186: 3600000 | G186: =VLOOKUP(RC[-5],'\HOA VE\LUONG\Luong phan mem 2015\Thang 3\[Bang tien lan 2 thang 3 TNCN.xls]ExcelTemplate'!R9C[-5]:R404C[10],16,0) -> 5716626 | H186: =1 -> 1 | I186: =RC[-4] -> 12 | J186: =RC[-4] -> 3600000 | K186: =RC[-3] -> 1
A187: 23 | B187: 010604 | C187: Nguyễn Thị Hồng | D187: NV PVHK | E187: 12 | F187: 3600000 | G187: =VLOOKUP(RC[-5],'\HOA VE\LUONG\Luong phan mem 2015\Thang 3\[Bang tien lan 2 thang 3 TNCN.xls]ExcelTemplate'!R9C[-5]:R404C[10],16,0) -> 5734330 | H187: =1 -> 1 | I187: =RC[-4] -> 12 | J187: =RC[-4] -> 3600000 | K187: =RC[-3] -> 1
A188: 24 | B188: 010605 | C188: Nguyễn Thị Thuỳ Dương | D188: NV PVHK | E188: 12 | F188: 3600000 | G188: =VLOOKUP(RC[-5],'\HOA VE\LUONG\Luong phan mem 2015\Thang 3\[Bang tien lan 2 thang 3 TNCN.xls]ExcelTemplate'!R9C[-5]:R404C[10],16,0) -> 6933708 | H188: =1 -> 1 | I188: =RC[-4] -> 12 | J188: =RC[-4] -> 3600000 | K188: =RC[-3] -> 1
A189: 25 | B189: 010611 | C189: Hoàng Thị Huyền Diệu | D189: NV PVHK | E189: 12 | F189: 3600000 | G189: =VLOOKUP(RC[-5],'\HOA VE\LUONG\Luong phan mem 2015\Thang 3\[Bang tien lan 2 thang 3 TNCN.xls]ExcelTemplate'!R9C[-5]:R404C[10],16,0) -> 7464631 | H189: =1 -> 1 | I189: =RC[-4] -> 12 | J189: =RC[-4] -> 3600000 | K189: =RC[-3] -> 1
A190: 26 | B190: 010612 | C190: Tạ Thị Phượng | D190: NV PVHK | E190: 12 | F190: 3600000 | G190: =VLOOKUP(RC[-5],'\HOA VE\LUONG\Luong phan mem 2015\Thang 3\[Bang tien lan 2 thang 3 TNCN.xls]ExcelTemplate'!R9C[-5]:R404C[10],16,0) -> 7114425 | H190: =1 -> 1 | I190: =RC[-4] -> 12 | J190: =RC[-4] -> 3600000 | K190: =RC[-3] -> 1
A191: 27 | B191: 010613 | C191: Nguyễn Thị Hường | D191: NV PVHK | E191: 12 | F191: 3600000 | G191: =VLOOKUP(RC[-5],'\HOA VE\LUONG\Luong phan mem 2015\Thang 3\[Bang tien lan 2 thang 3 TNCN.xls]ExcelTemplate'!R9C[-5]:R404C[10],16,0) -> 7464631 | H191: =1 -> 1 | I191: =RC[-4] -> 12 | J191: =RC[-4] -> 3600000 | K191: =RC[-3] -> 1
A192: 28 | B192: 010616 | C192: Đỗ Thanh Thuỷ | D192: NV PVHK | E192: 12 | F192: 3600000 | G192: =VLOOKUP(RC[-5],'\HOA VE\LUONG\Luong phan mem 2015\Thang 3\[Bang tien lan 2 thang 3 TNCN.xls]ExcelTemplate'!R9C[-5]:R404C[10],16,0) -> 7464631 | H192: =1 -> 1 | I192: =RC[-4] -> 12 | J192: =RC[-4] -> 3600000 | K192: =RC[-3] -> 1
A193: 29 | B193: 010617 | C193: Ngô Thị Hường | D193: NV PVHK | E193: 12 | F193: 3600000 | G193: =VLOOKUP(RC[-5],'\HOA VE\LUONG\Luong phan mem 2015\Thang 3\[Bang tien lan 2 thang 3 TNCN.xls]ExcelTemplate'!R9C[-5]:R404C[10],16,0) -> 7464631 | H193: =1 -> 1 | I193: =RC[-4] -> 12 | J193: =RC[-4] -> 3600000 | K193: =RC[-3] -> 1
A194: 30 | B194: 010627 | C194: Trần Thị Thu | D194: NV PVHK | E194: 12 | F194: 3600000 | G194: =VLOOKUP(RC[-5],'\HOA VE\LUONG\Luong phan mem 2015\Thang 3\[Bang tien lan 2 thang 3 TNCN.xls]ExcelTemplate'!R9C[-5]:R404C[10],16,0) -> 7114425 | H194: =1 -> 1 | I194: =RC[-4] -> 12 | J194: =RC[-4] -> 3600000 | K194: =RC[-3] -> 1
A195: 31 | B195: 011110 | C195: Đinh Thị Vân Anh | D195: NV PVHK | E195: 12 | F195: 3600000 | G195: =VLOOKUP(RC[-5],'\HOA VE\LUONG\Luong phan mem 2015\Thang 3\[Bang tien lan 2 thang 3 TNCN.xls]ExcelTemplate'!R9C[-5]:R404C[10],16,0) -> 6416898 | H195: =1 -> 1 | I195: =RC[-4] -> 12 | J195: =RC[-4] -> 3600000 | K195: =RC[-3] -> 1
A196: 32 | B196: 011112 | C196: Đào Xuân Tuân | D196: NV PVHK | E196: 12 | F196: 3600000 | G196: =VLOOKUP(RC[-5],'\HOA VE\LUONG\Luong phan mem 2015\Thang 3\[Bang tien lan 2 thang 3 TNCN.xls]ExcelTemplate'!R9C[-5]:R404C[10],16,0) -> 6466428 | H196: =1 -> 1 | I196: =RC[-4] -> 12 | J196: =RC[-4] -> 3600000 | K196: =RC[-3] -> 1
A197: 33 | B197: 011113 | C197: Trịnh Thị Hạnh | D197: NV PVHK | E197: 12 | F197: 3600000 | G197: =VLOOKUP(RC[-5],'\HOA VE\LUONG\Luong phan mem 2015\Thang 3\[Bang tien lan 2 thang 3 TNCN.xls]ExcelTemplate'!R9C[-5]:R404C[10],16,0) -> 4401880 | H197: =1 -> 1 | I197: =RC[-4] -> 12 | J197: =RC[-4] -> 3600000 | K197: =RC[-3] -> 1
A198: 34 | B198: 011114 | C198: Đoàn Thu Hoa | D198: NV PVHK | E198: 12 | F198: 3600000 | G198: =VLOOKUP(RC[-5],'\HOA VE\LUONG\Luong phan mem 2015\Thang 3\[Bang tien lan 2 thang 3 TNCN.xls]ExcelTemplate'!R9C[-5]:R404C[10],16,0) -> 6708736 | H198: =1 -> 1 | I198: =RC[-4] -> 12 | J198: =RC[-4] -> 3600000 | K198: =RC[-3] -> 1
A199: 35 | B199: 011115 | C199: Mai Thị Ngọc | D199: NV PVHK | E199: 12 | F199: 3600000 | G199: =VLOOKUP(RC[-5],'\HOA VE\LUONG\Luong phan mem 2015\Thang 3\[Bang tien lan 2 thang 3 TNCN.xls]ExcelTemplate'!R9C[-5]:R404C[10],16,0) -> 6416898 | H199: =1 -> 1 | I199: =RC[-4] -> 12 | J199: =RC[-4] -> 3600000 | K199: =RC[-3] -> 1
A200: 36 | B200: 011118 | C200: Lã Thị Thu Hương | D200: NV PVHK | E200: 12 | F200: 3600000 | G200: =VLOOKUP(RC[-5],'\HOA VE\LUONG\Luong phan mem 2015\Thang 3\[Bang tien lan 2 thang 3 TNCN.xls]ExcelTemplate'!R9C[-5]:R404C[10],16,0) -> 2772464 | H200: =1 -> 1 | I200: =RC[-4] -> 12 | J200: =RC[-4] -> 3600000 | K200: =RC[-3] -> 1
A201: 37 | B201: 011120 | C201: Đỗ Hương Trà | D201: NV PVHK | E201: 12 | F201: 3600000 | G201: =VLOOKUP(RC[-5],'\HOA VE\LUONG\Luong phan mem 2015\Thang 3\[Bang tien lan 2 thang 3 TNCN.xls]ExcelTemplate'!R9C[-5]:R404C[10],16,0) -> 6416898 | H201: =1 -> 1 | I201: =RC[-4] -> 12 | J201: =RC[-4] -> 3600000 | K201: =RC[-3] -> 1
A202: 38 | B202: 011121 | C202: Nguyễn Hiền Hạnh | D202: NV PVHK | E202: 12 | F202: 3600000 | G202: =VLOOKUP(RC[-5],'\HOA VE\LUONG\Luong phan mem 2015\Thang 3\[Bang tien lan 2 thang 3 TNCN.xls]ExcelTemplate'!R9C[-5]:R404C[10],16,0) -> 6708736 | H202: =1 -> 1 | I202: =RC[-4] -> 12 | J202: =RC[-4] -> 3600000 | K202: =RC[-3] -> 1
A203: 39 | B203: 011122 | C203: Nguyễn Thị Huyền | D203: NV PVHK | E203: 12 | F203: 3600000 | G203: =VLOOKUP(RC[-5],'\HOA VE\LUONG\Luong phan mem 2015\Thang 3\[Bang tien lan 2 thang 3 TNCN.xls]ExcelTemplate'!R9C[-5]:R404C[10],16,0) -> 6466428 | H203: =1 -> 1 | I203: =RC[-4] -> 12 | J203: =RC[-4] -> 3600000 | K203: =RC[-3] -> 1
A204: Đội Phục Vụ Hành Khách Đi Quốc Tế (HGS) | E204: =SUM(R[-39]C:R[-1]C) -> 370 | F204: =SUM(R[-39]C:R[-1]C) -> 111000000 | G204: =VLOOKUP(RC[-5],'\HOA VE\LUONG\Luong phan mem 2015\Thang 3\[Bang tien lan 2 thang 3 TNCN.xls]ExcelTemplate'!R9C[-5]:R404C[10],16,0) -> #N/A | H204: =SUM(R[-39]C:R[-1]C) -> 39
A205: Phòng Phục vụ hành khách (HGS) | E205: =SUM(R[-123]C[4]:R[-1]C[4]) -> 1097 | F205: =SUM(R[-123]C[4]:R[-1]C[4]) -> 329100000 | G205: =VLOOKUP(RC[-5],'\HOA VE\LUONG\Luong phan mem 2015\Thang 3\[Bang tien lan 2 thang 3 TNCN.xls]ExcelTemplate'!R9C[-5]:R404C[10],16,0) -> #N/A | H205: =SUM(R[-123]C[3]:R[-1]C[3]) -> 111
A206: Phòng Phục vụ kỹ thuật sân đỗ (HGS) | G206: =VLOOKUP(RC[-5],'\HOA VE\LUONG\Luong phan mem 2015\Thang 3\[Bang tien lan 2 thang 3 TNCN.xls]ExcelTemplate'!R9C[-5]:R404C[10],16,0) -> #N/A
A207: Bộ phận nghiệp vụ PKTSĐ (HGS) | G207: =VLOOKUP(RC[-5],'\HOA VE\LUONG\Luong phan mem 2015\Thang 3\[Bang tien lan 2 thang 3 TNCN.xls]ExcelTemplate'!R9C[-5]:R404C[10],16,0) -> #N/A
A208: 1 | B208: 010599 | C208: Đào Thu Giang | D208: NV PVHK | E208: 12 | F208: 3600000 | G208: =VLOOKUP(RC[-5],'\HOA VE\LUONG\Luong phan mem 2015\Thang 3\[Bang tien lan 2 thang 3 TNCN.xls]ExcelTemplate'!R9C[-5]:R404C[10],16,0) -> 6495612 | H208: =1 -> 1 | I208: =RC[-4] -> 12 | J208: =RC[-4] -> 3600000 | K208: =RC[-3] -> 1
A209: 2 | B209: 010765 | C209: Nguyễn Thị Thuý | D209: Nv Thống kê | E209: 12 | F209: 3600000 | G209: =VLOOKUP(RC[-5],'\HOA VE\LUONG\Luong phan mem 2015\Thang 3\[Bang tien lan 2 thang 3 TNCN.xls]ExcelTemplate'!R9C[-5]:R404C[10],16,0) -> 6442278 | H209: =1 -> 1 | I209: =RC[-4] -> 12 | J209: =RC[-4] -> 3600000 | K209: =RC[-3] -> 1
A210: Bộ phận nghiệp vụ PKTSĐ (HGS) | E210: =SUM(R[-2]C:R[-1]C) -> 24 | F210: =SUM(R[-2]C:R[-1]C) -> 7200000 | G210: =VLOOKUP(RC[-5],'\HOA VE\LUONG\Luong phan mem 2015\Thang 3\[Bang tien lan 2 thang 3 TNCN.xls]ExcelTemplate'!R9C[-5]:R404C[10],16,0) -> #N/A | H210: =SUM(R[-2]C:R[-1]C) -> 2
A211: Cán bộ Phòng Phục vụ Kỹ thuật sân đỗ (HGS) | G211: =VLOOKUP(RC[-5],'\HOA VE\LUONG\Luong phan mem 2015\Thang 3\[Bang tien lan 2 thang 3 TNCN.xls]ExcelTemplate'!R9C[-5]:R404C[10],16,0) -> #N/A
A212: 1 | B212: 010787 | C212: Lê Đình Tuấn | D212: Trưởng phòng | E212: 12 | F212: 3600000 | G212: =VLOOKUP(RC[-5],'\HOA VE\LUONG\Luong phan mem 2015\Thang 3\[Bang tien lan 2 thang 3 TNCN.xls]ExcelTemplate'!R9C[-5]:R404C[10],16,0) -> 17295485 | H212: =1 -> 1 | I212: =RC[-4] -> 12 | J212: =RC[-4] -> 3600000 | K212: =RC[-3] -> 1
A213: 2 | B213: 010753 | C213: Hoàng Việt Cường | D213: Phó Trưởng Phòng | E213: 12 | F213: 3600000 | G213: =VLOOKUP(RC[-5],'\HOA VE\LUONG\Luong phan mem 2015\Thang 3\[Bang tien lan 2 thang 3 TNCN.xls]ExcelTemplate'!R9C[-5]:R404C[10],16,0) -> 12537669 | H213: =1 -> 1 | I213: =RC[-4] -> 12 | J213: =RC[-4] -> 3600000 | K213: =RC[-3] -> 1
A214: 3 | B214: 010785 | C214: Nguyễn Duy Thái | D214: Phó Trưởng Phòng | E214: 12 | F214: 3600000 | G214: =VLOOKUP(RC[-5],'\HOA VE\LUONG\Luong phan mem 2015\Thang 3\[Bang tien lan 2 thang 3 TNCN.xls]ExcelTemplate'!R9C[-5]:R404C[10],16,0) -> 16498828 | H214: =1 -> 1 | I214: =RC[-4] -> 12 | J214: =RC[-4] -> 3600000 | K214: =RC[-3] -> 1
A215: 4 | B215: 010786 | C215: Nguyễn Hà Thanh | D215: Phó Trưởng Phòng | E215: 12 | F215: 3600000 | G215: =VLOOKUP(RC[-5],'\HOA VE\LUONG\Luong phan mem 2015\Thang 3\[Bang tien lan 2 thang 3 TNCN.xls]ExcelTemplate'!R9C[-5]:R404C[10],16,0) -> 15117013 | H215: =1 -> 1 | I215: =RC[-4] -> 12 | J215: =RC[-4] -> 3600000 | K215: =RC[-3] -> 1
A216: Cán bộ Phòng Phục vụ Kỹ thuật sân đỗ (HGS) | E216: =SUM(R[-4]C:R[-1]C) -> 48 | F216: =SUM(R[-4]C:R[-1]C) -> 14400000 | G216: =VLOOKUP(RC[-5],'\HOA VE\LUONG\Luong phan mem 2015\Thang 3\[Bang tien lan 2 thang 3 TNCN.xls]ExcelTemplate'!R9C[-5]:R404C[10],16,0) -> #N/A | H216: =SUM(R[-4]C:R[-1]C) -> 4
A217: Đội cầu, xe kéo đẩy (HGS) | G217: =VLOOKUP(RC[-5],'\HOA VE\LUONG\Luong phan mem 2015\Thang 3\[Bang tien lan 2 thang 3 TNCN.xls]ExcelTemplate'!R9C[-5]:R404C[10],16,0) -> #N/A
A218: 1 | B218: 010704 | C218: Ngô Quốc Khánh | D218: Đội phó | E218: 12 | F218: 3600000 | G218: =VLOOKUP(RC[-5],'\HOA VE\LUONG\Luong phan mem 2015\Thang 3\[Bang tien lan 2 thang 3 TNCN.xls]ExcelTemplate'!R9C[-5]:R404C[10],16,0) -> 11467178 | H218: =1 -> 1 | I218: =RC[-4] -> 12 | J218: =RC[-4] -> 3600000 | K218: =RC[-3] -> 1
A219: 2 | B219: 010686 | C219: Đỗ Anh Tuấn | D219: NV Lái xe - VHTTB | E219: 12 | F219: 3600000 | G219: =VLOOKUP(RC[-5],'\HOA VE\LUONG\Luong phan mem 2015\Thang 3\[Bang tien lan 2 thang 3 TNCN.xls]ExcelTemplate'!R9C[-5]:R404C[10],16,0) -> 7907470 | H219: =1 -> 1 | I219: =RC[-4] -> 12 | J219: =RC[-4] -> 3600000 | K219: =RC[-3] -> 1
A220: 3 | B220: 010687 | C220: Lê Hồng Nam | D220: NV Lái xe - VHTTB | E220: 12 | F220: 3600000 | G220: =VLOOKUP(RC[-5],'\HOA VE\LUONG\Luong phan mem 2015\Thang 3\[Bang tien lan 2 thang 3 TNCN.xls]ExcelTemplate'!R9C[-5]:R404C[10],16,0) -> 8683698 | H220: =1 -> 1 | I220: =RC[-4] -> 12 | J220: =RC[-4] -> 3600000 | K220: =RC[-3] -> 1
A221: 4 | B221: 010688 | C221: Cao Thế Vinh | D221: NV Lái xe - VHTTB | E221: 12 | F221: 3600000 | G221: =VLOOKUP(RC[-5],'\HOA VE\LUONG\Luong phan mem 2015\Thang 3\[Bang tien lan 2 thang 3 TNCN.xls]ExcelTemplate'!R9C[-5]:R404C[10],16,0) -> 9080536 | H221: =1 -> 1 | I221: =RC[-4] -> 12 | J221: =RC[-4] -> 3600000 | K221: =RC[-3] -> 1
A222: 5 | B222: 010689 | C222: Đỗ Minh Hải | D222: NV Lái xe - VHTTB | E222: 12 | F222: 3600000 | G222: =VLOOKUP(RC[-5],'\HOA VE\LUONG\Luong phan mem 2015\Thang 3\[Bang tien lan 2 thang 3 TNCN.xls]ExcelTemplate'!R9C[-5]:R404C[10],16,0) -> 8683698 | H222: =1 -> 1 | I222: =RC[-4] -> 12 | J222: =RC[-4] -> 3600000 | K222: =RC[-3] -> 1
A223: 6 | B223: 010690 | C223: Phạm Đăng Khoa | D223: NV Lái xe - VHTTB | E223: 12 | F223: 3600000 | G223: =VLOOKUP(RC[-5],'\HOA VE\LUONG\Luong phan mem 2015\Thang 3\[Bang tien lan 2 thang 3 TNCN.xls]ExcelTemplate'!R9C[-5]:R404C[10],16,0) -> 7907470 | H223: =1 -> 1 | I223: =RC[-4] -> 12 | J223: =RC[-4] -> 3600000 | K223: =RC[-3] -> 1
A224: 7 | B224: 010691 | C224: Hoàng Văn Thanh | D224: NV Lái xe - VHTTB | E224: 12 | F224: 3600000 | G224: =VLOOKUP(RC[-5],'\HOA VE\LUONG\Luong phan mem 2015\Thang 3\[Bang tien lan 2 thang 3 TNCN.xls]ExcelTemplate'!R9C[-5]:R404C[10],16,0) -> 8417488 | H224: =1 -> 1 | I224: =RC[-4] -> 12 | J224: =RC[-4] -> 3600000 | K224: =RC[-3] -> 1
A225: 8 | B225: 010692 | C225: Đỗ Quang Tiến | D225: NV Lái xe - VHTTB | E225: 12 | F225: 3600000 | G225: =VLOOKUP(RC[-5],'\HOA VE\LUONG\Luong phan mem 2015\Thang 3\[Bang tien lan 2 thang 3 TNCN.xls]ExcelTemplate'!R9C[-5]:R404C[10],16,0) -> 7907470 | H225: =1 -> 1 | I225: =RC[-4] -> 12 | J225: =RC[-4] -> 3600000 | K225: =RC[-3] -> 1
A226: 9 | B226: 010693 | C226: Hoàng Sơn | D226: NV Lái xe - VHTTB | E226: 12 | F226: 3600000 | G226: =VLOOKUP(RC[-5],'\HOA VE\LUONG\Luong phan mem 2015\Thang 3\[Bang tien lan 2 thang 3 TNCN.xls]ExcelTemplate'!R9C[-5]:R404C[10],16,0) -> 6699926 | H226: =1 -> 1 | I226: =RC[-4] -> 12 | J226: =RC[-4] -> 3600000 | K226: =RC[-3] -> 1
A227: 10 | B227: 010694 | C227: Trần Văn Trà | D227: NV Lái xe - VHTTB | E227: 12 | F227: 3600000 | G227: =VLOOKUP(RC[-5],'\HOA VE\LUONG\Luong phan mem 2015\Thang 3\[Bang tien lan 2 thang 3 TNCN.xls]ExcelTemplate'!R9C[-5]:R404C[10],16,0) -> 6699926 | H227: =1 -> 1 | I227: =RC[-4] -> 12 | J227: =RC[-4] -> 3600000 | K227: =RC[-3] -> 1
A228: 11 | B228: 010696 | C228: Nguyễn Đình Thiện | D228: NV Lái xe - VHTTB | E228: 12 | F228: 3600000 | G228: =VLOOKUP(RC[-5],'\HOA VE\LUONG\Luong phan mem 2015\Thang 3\[Bang tien lan 2 thang 3 TNCN.xls]ExcelTemplate'!R9C[-5]:R404C[10],16,0) -> 7907470 | H228: =1 -> 1 | I228: =RC[-4] -> 12 | J228: =RC[-4] -> 3600000 | K228: =RC[-3] -> 1
A229: 12 | B229: 010697 | C229: Trần Hưng Nhân | D229: NV Lái xe - VHTTB | E229: 12 | F229: 3600000 | G229: =VLOOKUP(RC[-5],'\HOA VE\LUONG\Luong phan mem 2015\Thang 3\[Bang tien lan 2 thang 3 TNCN.xls]ExcelTemplate'!R9C[-5]:R404C[10],16,0) -> 7907470 | H229: =1 -> 1 | I229: =RC[-4] -> 12 | J229: =RC[-4] -> 3600000 | K229: =RC[-3] -> 1
A230: 13 | B230: 010698 | C230: Nguyễn Ngọc Toàn | D230: NV Lái xe - VHTTB | E230: 12 | F230: 3600000 | G230: =VLOOKUP(RC[-5],'\HOA VE\LUONG\Luong phan mem 2015\Thang 3\[Bang tien lan 2 thang 3 TNCN.xls]ExcelTemplate'!R9C[-5]:R404C[10],16,0) -> 8219737 | H230: =1 -> 1 | I230: =RC[-4] -> 12 | J230: =RC[-4] -> 3600000 | K230: =RC[-3] -> 1
A231: 14 | B231: 010700 | C231: Đặng Đức Mạnh | D231: NV Lái xe - VHTTB | E231: 12 | F231: 3600000 | G231: =VLOOKUP(RC[-5],'\HOA VE\LUONG\Luong phan mem 2015\Thang 3\[Bang tien lan 2 thang 3 TNCN.xls]ExcelTemplate'!R9C[-5]:R404C[10],16,0) -> 8219737 | H231: =1 -> 1 | I231: =RC[-4] -> 12 | J231: =RC[-4] -> 3600000 | K231: =RC[-3] -> 1
A232: 15 | B232: 010701 | C232: Đỗ Ngọc Lân | D232: NV Lái xe - VHTTB | E232: 12 | F232: 3600000 | G232: =VLOOKUP(RC[-5],'\HOA VE\LUONG\Luong phan mem 2015\Thang 3\[Bang tien lan 2 thang 3 TNCN.xls]ExcelTemplate'!R9C[-5]:R404C[10],16,0) -> 7907470 | H232: =1 -> 1 | I232: =RC[-4] -> 12 | J232: =RC[-4] -> 3600000 | K232: =RC[-3] -> 1
A233: 16 | B233: 010702 | C233: Nguyễn Tuấn Anh | D233: NV Lái xe - VHTTB | E233: 12 | F233: 3600000 | G233: =VLOOKUP(RC[-5],'\HOA VE\LUONG\Luong phan mem 2015\Thang 3\[Bang tien lan 2 thang 3 TNCN.xls]ExcelTemplate'!R9C[-5]:R404C[10],16,0) -> 7907470 | H233: =1 -> 1 | I233: =RC[-4] -> 12 | J233: =RC[-4] -> 3600000 | K233: =RC[-3] -> 1
A234: 17 | B234: 010703 | C234: Trần Văn Dậu | D234: NV Lái xe - VHTTB | E234: 12 | F234: 3600000 | G234: =VLOOKUP(RC[-5],'\HOA VE\LUONG\Luong phan mem 2015\Thang 3\[Bang tien lan 2 thang 3 TNCN.xls]ExcelTemplate'!R9C[-5]:R404C[10],16,0) -> 7907470 | H234: =1 -> 1 | I234: =RC[-4] -> 12 | J234: =RC[-4] -> 3600000 | K234: =RC[-3] -> 1
A235: 18 | B235: 011140 | C235: Nguyễn Chí Công | D235: NV Lái xe - VHTTB | E235: 12 | F235: 3600000 | G235: =VLOOKUP(RC[-5],'\HOA VE\LUONG\Luong phan mem 2015\Thang 3\[Bang tien lan 2 thang 3 TNCN.xls]ExcelTemplate'!R9C[-5]:R404C[10],16,0) -> 6102978 | H235: =1 -> 1 | I235: =RC[-4] -> 12 | J235: =RC[-4] -> 3600000 | K235: =RC[-3] -> 1
A236: Đội cầu, xe kéo đẩy (HGS) | E236: =SUM(R[-18]C:R[-1]C) -> 216 | F236: =SUM(R[-18]C:R[-1]C) -> 64800000 | G236: =VLOOKUP(RC[-5],'\HOA VE\LUONG\Luong phan mem 2015\Thang 3\[Bang tien lan 2 thang 3 TNCN.xls]ExcelTemplate'!R9C[-5]:R404C[10],16,0) -> #N/A | H236: =SUM(R[-18]C:R[-1]C) -> 18
A237: Đội phục vụ hành lý hàng hóa (HGS) | G237: =VLOOKUP(RC[-5],'\HOA VE\LUONG\Luong phan mem 2015\Thang 3\[Bang tien lan 2 thang 3 TNCN.xls]ExcelTemplate'!R9C[-5]:R404C[10],16,0) -> #N/A
A238: 1 | B238: 010685 | C238: Hà Minh Trí | D238: Đội trưởng | E238: 12 | F238: 3600000 | G238: =VLOOKUP(RC[-5],'\HOA VE\LUONG\Luong phan mem 2015\Thang 3\[Bang tien lan 2 thang 3 TNCN.xls]ExcelTemplate'!R9C[-5]:R404C[10],16,0) -> 11464908 | H238: =1 -> 1 | I238: =RC[-4] -> 12 | J238: =RC[-4] -> 3600000 | K238: =RC[-3] -> 1
A239: 2 | B239: 010709 | C239: Lê Hữu Thịnh | D239: Đội phó | E239: 12 | F239: 3600000 | G239: =VLOOKUP(RC[-5],'\HOA VE\LUONG\Luong phan mem 2015\Thang 3\[Bang tien lan 2 thang 3 TNCN.xls]ExcelTemplate'!R9C[-5]:R404C[10],16,0) -> 10410229 | H239: =1 -> 1 | I239: =RC[-4] -> 12 | J239: =RC[-4] -> 3600000 | K239: =RC[-3] -> 1
A240: 3 | B240: 010715 | C240: Trần Văn Lộc | D240: Đội phó | E240: 12 | F240: 3600000 | G240: =VLOOKUP(RC[-5],'\HOA VE\LUONG\Luong phan mem 2015\Thang 3\[Bang tien lan 2 thang 3 TNCN.xls]ExcelTemplate'!R9C[-5]:R404C[10],16,0) -> 10885926 | H240: =1 -> 1 | I240: =RC[-4] -> 12 | J240: =RC[-4] -> 3600000 | K240: =RC[-3] -> 1
A241: 4 | B241: 010734 | C241: Trần Duy Hải | D241: Đội phó | E241: 12 | F241: 3600000 | G241: =VLOOKUP(RC[-5],'\HOA VE\LUONG\Luong phan mem 2015\Thang 3\[Bang tien lan 2 thang 3 TNCN.xls]ExcelTemplate'!R9C[-5]:R404C[10],16,0) -> 10776043 | H241: =1 -> 1 | I241: =RC[-4] -> 12 | J241: =RC[-4] -> 3600000 | K241: =RC[-3] -> 1
A242: 5 | B242: 010646 | C242: Lê Ngọc Cường | D242: Nhân viên Bốc xếp | E242: 12 | F242: 3600000 | G242: =VLOOKUP(RC[-5],'\HOA VE\LUONG\Luong phan mem 2015\Thang 3\[Bang tien lan 2 thang 3 TNCN.xls]ExcelTemplate'!R9C[-5]:R404C[10],16,0) -> 5935242 | H242: =1 -> 1 | I242: =RC[-4] -> 12 | J242: =RC[-4] -> 3600000 | K242: =RC[-3] -> 1
A243: 6 | B243: 010647 | C243: Nguyễn Tiến Anh | D243: Nhân viên Bốc xếp | E243: 12 | F243: 3600000 | G243: =VLOOKUP(RC[-5],'\HOA VE\LUONG\Luong phan mem 2015\Thang 3\[Bang tien lan 2 thang 3 TNCN.xls]ExcelTemplate'!R9C[-5]:R404C[10],16,0) -> 5529288 | H243: =1 -> 1 | I243: =RC[-4] -> 12 | J243: =RC[-4] -> 3600000 | K243: =RC[-3] -> 1
A244: 7 | B244: 010648 | C244: Phạm Minh Thành | D244: Nhân viên Bốc xếp | E244: 12 | F244: 3600000 | G244: =VLOOKUP(RC[-5],'\HOA VE\LUONG\Luong phan mem 2015\Thang 3\[Bang tien lan 2 thang 3 TNCN.xls]ExcelTemplate'!R9C[-5]:R404C[10],16,0) -> 5791942 | H244: =1 -> 1 | I244: =RC[-4] -> 12 | J244: =RC[-4] -> 3600000 | K244: =RC[-3] -> 1
A245: 8 | B245: 010649 | C245: Vũ Minh Tú | D245: Nhân viên Bốc xếp | E245: 12 | F245: 3600000 | G245: =VLOOKUP(RC[-5],'\HOA VE\LUONG\Luong phan mem 2015\Thang 3\[Bang tien lan 2 thang 3 TNCN.xls]ExcelTemplate'!R9C[-5]:R404C[10],16,0) -> 5791942 | H245: =1 -> 1 | I245: =RC[-4] -> 12 | J245: =RC[-4] -> 3600000 | K245: =RC[-3] -> 1
A246: 9 | B246: 010650 | C246: Ngô Ngọc Hảo | D246: Nhân viên Bốc xếp | E246: 12 | F246: 3600000 | G246: =VLOOKUP(RC[-5],'\HOA VE\LUONG\Luong phan mem 2015\Thang 3\[Bang tien lan 2 thang 3 TNCN.xls]ExcelTemplate'!R9C[-5]:R404C[10],16,0) -> 6025413 | H246: =1 -> 1 | I246: =RC[-4] -> 12 | J246: =RC[-4] -> 3600000 | K246: =RC[-3] -> 1
A247: 10 | B247: 010651 | C247: Đỗ Văn Chính | D247: Nhân viên Bốc xếp | E247: 12 | F247: 3600000 | G247: =VLOOKUP(RC[-5],'\HOA VE\LUONG\Luong phan mem 2015\Thang 3\[Bang tien lan 2 thang 3 TNCN.xls]ExcelTemplate'!R9C[-5]:R404C[10],16,0) -> 5529288 | H247: =1 -> 1 | I247: =RC[-4] -> 12 | J247: =RC[-4] -> 3600000 | K247: =RC[-3] -> 1
A248: 11 | B248: 010652 | C248: Trương Văn Triệu | D248: Nhân viên Bốc xếp | E248: 11 | F248: 3300000 | G248: =VLOOKUP(RC[-5],'\HOA VE\LUONG\Luong phan mem 2015\Thang 3\[Bang tien lan 2 thang 3 TNCN.xls]ExcelTemplate'!R9C[-5]:R404C[10],16,0) -> 5529288 | H248: =1 -> 1 | I248: =RC[-4] -> 11 | J248: =RC[-4] -> 3300000 | K248: =RC[-3] -> 1
A249: 12 | B249: 010653 | C249: Nguyễn Ngọc Nam | D249: Nhân viên Bốc xếp | E249: 12 | F249: 3600000 | G249: =VLOOKUP(RC[-5],'\HOA VE\LUONG\Luong phan mem 2015\Thang 3\[Bang tien lan 2 thang 3 TNCN.xls]ExcelTemplate'!R9C[-5]:R404C[10],16,0) -> 5748166 | H249: =1 -> 1 | I249: =RC[-4] -> 12 | J249: =RC[-4] -> 3600000 | K249: =RC[-3] -> 1
A250: 13 | B250: 010655 | C250: Nguyễn Chiến Thắng | D250: Nhân viên Bốc xếp | E250: 12 | F250: 3600000 | G250: =VLOOKUP(RC[-5],'\HOA VE\LUONG\Luong phan mem 2015\Thang 3\[Bang tien lan 2 thang 3 TNCN.xls]ExcelTemplate'!R9C[-5]:R404C[10],16,0) -> 4321774 | H250: =1 -> 1 | I250: =RC[-4] -> 12 | J250: =RC[-4] -> 3600000 | K250: =RC[-3] -> 1
A251: 14 | B251: 010656 | C251: Bùi Việt Bắc | D251: Nhân viên Bốc xếp | E251: 12 | F251: 3600000 | G251: =VLOOKUP(RC[-5],'\HOA VE\LUONG\Luong phan mem 2015\Thang 3\[Bang tien lan 2 thang 3 TNCN.xls]ExcelTemplate'!R9C[-5]:R404C[10],16,0) -> 5791942 | H251: =1 -> 1 | I251: =RC[-4] -> 12 | J251: =RC[-4] -> 3600000 | K251: =RC[-3] -> 1
A252: 15 | B252: 010658 | C252: Nguyễn Phương Tuấn | D252: Nhân viên Bốc xếp | E252: 12 | F252: 3600000 | G252: =VLOOKUP(RC[-5],'\HOA VE\LUONG\Luong phan mem 2015\Thang 3\[Bang tien lan 2 thang 3 TNCN.xls]ExcelTemplate'!R9C[-5]:R404C[10],16,0) -> 4391118 | H252: =1 -> 1 | I252: =RC[-4] -> 12 | J252: =RC[-4] -> 3600000 | K252: =RC[-3] -> 1
A253: 16 | B253: 010659 | C253: Ngô Ngọc Tiến | D253: Nhân viên Bốc xếp | E253: 12 | F253: 3600000 | G253: =VLOOKUP(RC[-5],'\HOA VE\LUONG\Luong phan mem 2015\Thang 3\[Bang tien lan 2 thang 3 TNCN.xls]ExcelTemplate'!R9C[-5]:R404C[10],16,0) -> 5529288 | H253: =1 -> 1 | I253: =RC[-4] -> 12 | J253: =RC[-4] -> 3600000 | K253: =RC[-3] -> 1
A254: 17 | B254: 010662 | C254: Trần Văn Tĩnh | D254: Nhân viên Bốc xếp | E254: 12 | F254: 3600000 | G254: =VLOOKUP(RC[-5],'\HOA VE\LUONG\Luong phan mem 2015\Thang 3\[Bang tien lan 2 thang 3 TNCN.xls]ExcelTemplate'!R9C[-5]:R404C[10],16,0) -> 5791942 | H254: =1 -> 1 | I254: =RC[-4] -> 12 | J254: =RC[-4] -> 3600000 | K254: =RC[-3] -> 1
A255: 18 | B255: 010663 | C255: Khổng Vũ Hùng | D255: Nhân viên Bốc xếp | E255: 12 | F255: 3600000 | G255: =VLOOKUP(RC[-5],'\HOA VE\LUONG\Luong phan mem 2015\Thang 3\[Bang tien lan 2 thang 3 TNCN.xls]ExcelTemplate'!R9C[-5]:R404C[10],16,0) -> 5748166 | H255: =1 -> 1 | I255: =RC[-4] -> 12 | J255: =RC[-4] -> 3600000 | K255: =RC[-3] -> 1
A256: 19 | B256: 010664 | C256: Phan Bá Tráng | D256: Nhân viên Bốc xếp | E256: 11 | F256: 3300000 | G256: =VLOOKUP(RC[-5],'\HOA VE\LUONG\Luong phan mem 2015\Thang 3\[Bang tien lan 2 thang 3 TNCN.xls]ExcelTemplate'!R9C[-5]:R404C[10],16,0) -> 5529288 | H256: =1 -> 1 | I256: =RC[-4] -> 11 | J256: =RC[-4] -> 3300000 | K256: =RC[-3] -> 1
A257: 20 | B257: 010665 | C257: Trần Hồng Sơn | D257: Nhân viên Bốc xếp | E257: 12 | F257: 3600000 | G257: =VLOOKUP(RC[-5],'\HOA VE\LUONG\Luong phan mem 2015\Thang 3\[Bang tien lan 2 thang 3 TNCN.xls]ExcelTemplate'!R9C[-5]:R404C[10],16,0) -> 5791942 | H257: =1 -> 1 | I257: =RC[-4] -> 12 | J257: =RC[-4] -> 3600000 | K257: =RC[-3] -> 1
A258: 21 | B258: 010666 | C258: Phạm Quang Trung | D258: Nhân viên Bốc xếp | E258: 12 | F258: 3600000 | G258: =VLOOKUP(RC[-5],'\HOA VE\LUONG\Luong phan mem 2015\Thang 3\[Bang tien lan 2 thang 3 TNCN.xls]ExcelTemplate'!R9C[-5]:R404C[10],16,0) -> 5135306 | H258: =1 -> 1 | I258: =RC[-4] -> 12 | J258: =RC[-4] -> 3600000 | K258: =RC[-3] -> 1
A259: 22 | B259: 010667 | C259: Nguyễn Phi Trường | D259: Nhân viên Bốc xếp | E259: 11 | F259: 3300000 | G259: =VLOOKUP(RC[-5],'\HOA VE\LUONG\Luong phan mem 2015\Thang 3\[Bang tien lan 2 thang 3 TNCN.xls]ExcelTemplate'!R9C[-5]:R404C[10],16,0) -> 5141366 | H259: =1 -> 1 | I259: =RC[-4] -> 11 | J259: =RC[-4] -> 3300000 | K259: =RC[-3] -> 1
A260: 23 | B260: 010668 | C260: Đới Minh Khoa | D260: Nhân viên Bốc xếp | E260: 12 | F260: 3600000 | G260: =VLOOKUP(RC[-5],'\HOA VE\LUONG\Luong phan mem 2015\Thang 3\[Bang tien lan 2 thang 3 TNCN.xls]ExcelTemplate'!R9C[-5]:R404C[10],16,0) -> 5943636 | H260: =1 -> 1 | I260: =RC[-4] -> 12 | J260: =RC[-4] -> 3600000 | K260: =RC[-3] -> 1
A261: 24 | B261: 010669 | C261: Nguyễn Xuân Tân | D261: Nhân viên Bốc xếp | E261: 12 | F261: 3600000 | G261: =VLOOKUP(RC[-5],'\HOA VE\LUONG\Luong phan mem 2015\Thang 3\[Bang tien lan 2 thang 3 TNCN.xls]ExcelTemplate'!R9C[-5]:R404C[10],16,0) -> 5529288 | H261: =1 -> 1 | I261: =RC[-4] -> 12 | J261: =RC[-4] -> 3600000 | K261: =RC[-3] -> 1
A262: 25 | B262: 010670 | C262: Nguyễn Văn Toàn | D262: Nhân viên Bốc xếp | E262: 12 | F262: 3600000 | G262: =VLOOKUP(RC[-5],'\HOA VE\LUONG\Luong phan mem 2015\Thang 3\[Bang tien lan 2 thang 3 TNCN.xls]ExcelTemplate'!R9C[-5]:R404C[10],16,0) -> 7246704 | H262: =1 -> 1 | I262: =RC[-4] -> 12 | J262: =RC[-4] -> 3600000 | K262: =RC[-3] -> 1
A263: 26 | B263: 010671 | C263: Lê Đức Duy | D263: Nhân viên Bốc xếp | E263: 12 | F263: 3600000 | G263: =VLOOKUP(RC[-5],'\HOA VE\LUONG\Luong phan mem 2015\Thang 3\[Bang tien lan 2 thang 3 TNCN.xls]ExcelTemplate'!R9C[-5]:R404C[10],16,0) -> 5916045 | H263: =1 -> 1 | I263: =RC[-4] -> 12 | J263: =RC[-4] -> 3600000 | K263: =RC[-3] -> 1
A264: 27 | B264: 010672 | C264: Triệu Tuấn Anh | D264: Nhân viên Bốc xếp | E264: 12 | F264: 3600000 | G264: =VLOOKUP(RC[-5],'\HOA VE\LUONG\Luong phan mem 2015\Thang 3\[Bang tien lan 2 thang 3 TNCN.xls]ExcelTemplate'!R9C[-5]:R404C[10],16,0) -> 6180387 | H264: =1 -> 1 | I264: =RC[-4] -> 12 | J264: =RC[-4] -> 3600000 | K264: =RC[-3] -> 1
A265: 28 | B265: 010673 | C265: Đặng Xuân Sơn | D265: Nhân viên Bốc xếp | E265: 12 | F265: 3600000 | G265: =VLOOKUP(RC[-5],'\HOA VE\LUONG\Luong phan mem 2015\Thang 3\[Bang tien lan 2 thang 3 TNCN.xls]ExcelTemplate'!R9C[-5]:R404C[10],16,0) -> 5869351 | H265: =1 -> 1 | I265: =RC[-4] -> 12 | J265: =RC[-4] -> 3600000 | K265: =RC[-3] -> 1
A266: 29 | B266: 010674 | C266: Nguyễn Văn Tuế | D266: Nhân viên Bốc xếp | E266: 12 | F266: 3600000 | G266: =VLOOKUP(RC[-5],'\HOA VE\LUONG\Luong phan mem 2015\Thang 3\[Bang tien lan 2 thang 3 TNCN.xls]ExcelTemplate'!R9C[-5]:R404C[10],16,0) -> 6188780 | H266: =1 -> 1 | I266: =RC[-4] -> 12 | J266: =RC[-4] -> 3600000 | K266: =RC[-3] -> 1
A267: 30 | B267: 010675 | C267: Phạm Văn Bảy | D267: Nhân viên Bốc xếp | E267: 12 | F267: 3600000 | G267: =VLOOKUP(RC[-5],'\HOA VE\LUONG\Luong phan mem 2015\Thang 3\[Bang tien lan 2 thang 3 TNCN.xls]ExcelTemplate'!R9C[-5]:R404C[10],16,0) -> 5541091 | H267: =1 -> 1 | I267: =RC[-4] -> 12 | J267: =RC[-4] -> 3600000 | K267: =RC[-3] -> 1
A268: 31 | B268: 010676 | C268: Vương Khắc Hoà | D268: Nhân viên Bốc xếp | E268: 12 | F268: 3600000 | G268: =VLOOKUP(RC[-5],'\HOA VE\LUONG\Luong phan mem 2015\Thang 3\[Bang tien lan 2 thang 3 TNCN.xls]ExcelTemplate'!R9C[-5]:R404C[10],16,0) -> 5935242 | H268: =1 -> 1 | I268: =RC[-4] -> 12 | J268: =RC[-4] -> 3600000 | K268: =RC[-3] -> 1
A269: 32 | B269: 010677 | C269: Vũ Văn Thành | D269: Nhân viên Bốc xếp | E269: 12 | F269: 3600000 | G269: =VLOOKUP(RC[-5],'\HOA VE\LUONG\Luong phan mem 2015\Thang 3\[Bang tien lan 2 thang 3 TNCN.xls]ExcelTemplate'!R9C[-5]:R404C[10],16,0) -> 4963513 | H269: =1 -> 1 | I269: =RC[-4] -> 12 | J269: =RC[-4] -> 3600000 | K269: =RC[-3] -> 1
A270: 33 | B270: 010678 | C270: Phạm Thanh Quang | D270: Nhân viên Bốc xếp | E270: 12 | F270: 3600000 | G270: =VLOOKUP(RC[-5],'\HOA VE\LUONG\Luong phan mem 2015\Thang 3\[Bang tien lan 2 thang 3 TNCN.xls]ExcelTemplate'!R9C[-5]:R404C[10],16,0) -> 5529288 | H270: =1 -> 1 | I270: =RC[-4] -> 12 | J270: =RC[-4] -> 3600000 | K270: =RC[-3] -> 1
A271: 34 | B271: 010679 | C271: Lã Văn Thảo | D271: Nhân viên Bốc xếp | E271: 12 | F271: 3600000 | G271: =VLOOKUP(RC[-5],'\HOA VE\LUONG\Luong phan mem 2015\Thang 3\[Bang tien lan 2 thang 3 TNCN.xls]ExcelTemplate'!R9C[-5]:R404C[10],16,0) -> 5791942 | H271: =1 -> 1 | I271: =RC[-4] -> 12 | J271: =RC[-4] -> 3600000 | K271: =RC[-3] -> 1
A272: 35 | B272: 010680 | C272: Nguyễn Thanh Bình | D272: Nhân viên Bốc xếp | E272: 12 | F272: 3600000 | G272: =VLOOKUP(RC[-5],'\HOA VE\LUONG\Luong phan mem 2015\Thang 3\[Bang tien lan 2 thang 3 TNCN.xls]ExcelTemplate'!R9C[-5]:R404C[10],16,0) -> 6151649 | H272: =1 -> 1 | I272: =RC[-4] -> 12 | J272: =RC[-4] -> 3600000 | K272: =RC[-3] -> 1
A273: 36 | B273: 011086 | C273: Nguyễn Quốc Dũng | D273: Nhân viên Bốc xếp | E273: 12 | F273: 3600000 | G273: =VLOOKUP(RC[-5],'\HOA VE\LUONG\Luong phan mem 2015\Thang 3\[Bang tien lan 2 thang 3 TNCN.xls]ExcelTemplate'!R9C[-5]:R404C[10],16,0) -> 5748166 | H273: =1 -> 1 | I273: =RC[-4] -> 12 | J273: =RC[-4] -> 3600000 | K273: =RC[-3] -> 1
A274: 37 | B274: 011087 | C274: Phan Thế Hòa | D274: Nhân viên Bốc xếp | E274: 12 | F274: 3600000 | G274: =VLOOKUP(RC[-5],'\HOA VE\LUONG\Luong phan mem 2015\Thang 3\[Bang tien lan 2 thang 3 TNCN.xls]ExcelTemplate'!R9C[-5]:R404C[10],16,0) -> 5529288 | H274: =1 -> 1 | I274: =RC[-4] -> 12 | J274: =RC[-4] -> 3600000 | K274: =RC[-3] -> 1
A275: 38 | B275: 011091 | C275: Nguyễn Như Cương | D275: Nhân viên Bốc xếp | E275: 12 | F275: 3600000 | G275: =VLOOKUP(RC[-5],'\HOA VE\LUONG\Luong phan mem 2015\Thang 3\[Bang tien lan 2 thang 3 TNCN.xls]ExcelTemplate'!R9C[-5]:R404C[10],16,0) -> 5310409 | H275: =1 -> 1 | I275: =RC[-4] -> 12 | J275: =RC[-4] -> 3600000 | K275: =RC[-3] -> 1
A276: 39 | B276: 011092 | C276: Nguyễn Thành Long | D276: Nhân viên Bốc xếp | E276: 12 | F276: 3600000 | G276: =VLOOKUP(RC[-5],'\HOA VE\LUONG\Luong phan mem 2015\Thang 3\[Bang tien lan 2 thang 3 TNCN.xls]ExcelTemplate'!R9C[-5]:R404C[10],16,0) -> 5529288 | H276: =1 -> 1 | I276: =RC[-4] -> 12 | J276: =RC[-4] -> 3600000 | K276: =RC[-3] -> 1
A277: 40 | B277: 011093 | C277: Đỗ Chí Thanh | D277: Nhân viên Bốc xếp | E277: 12 | F277: 3600000 | G277: =VLOOKUP(RC[-5],'\HOA VE\LUONG\Luong phan mem 2015\Thang 3\[Bang tien lan 2 thang 3 TNCN.xls]ExcelTemplate'!R9C[-5]:R404C[10],16,0) -> 5748166 | H277: =1 -> 1 | I277: =RC[-4] -> 12 | J277: =RC[-4] -> 3600000 | K277: =RC[-3] -> 1
A278: 41 | B278: 011094 | C278: Nguyễn Xuân Đỏ | D278: Nhân viên Bốc xếp | E278: 12 | F278: 3600000 | G278: =VLOOKUP(RC[-5],'\HOA VE\LUONG\Luong phan mem 2015\Thang 3\[Bang tien lan 2 thang 3 TNCN.xls]ExcelTemplate'!R9C[-5]:R404C[10],16,0) -> 4835104 | H278: =1 -> 1 | I278: =RC[-4] -> 12 | J278: =RC[-4] -> 3600000 | K278: =RC[-3] -> 1
A279: 42 | B279: 011095 | C279: Đỗ Văn Phụng | D279: Nhân viên Bốc xếp | E279: 12 | F279: 3600000 | G279: =VLOOKUP(RC[-5],'\HOA VE\LUONG\Luong phan mem 2015\Thang 3\[Bang tien lan 2 thang 3 TNCN.xls]ExcelTemplate'!R9C[-5]:R404C[10],16,0) -> 4835104 | H279: =1 -> 1 | I279: =RC[-4] -> 12 | J279: =RC[-4] -> 3600000 | K279: =RC[-3] -> 1
A280: 43 | B280: 011097 | C280: Trần Đình Thăng | D280: Nhân viên Bốc xếp | E280: 12 | F280: 3600000 | G280: =VLOOKUP(RC[-5],'\HOA VE\LUONG\Luong phan mem 2015\Thang 3\[Bang tien lan 2 thang 3 TNCN.xls]ExcelTemplate'!R9C[-5]:R404C[10],16,0) -> 5748166 | H280: =1 -> 1 | I280: =RC[-4] -> 12 | J280: =RC[-4] -> 3600000 | K280: =RC[-3] -> 1
A281: 44 | B281: 011098 | C281: Lương Bá Huỳnh | D281: Nhân viên Bốc xếp | E281: 12 | F281: 3600000 | G281: =VLOOKUP(RC[-5],'\HOA VE\LUONG\Luong phan mem 2015\Thang 3\[Bang tien lan 2 thang 3 TNCN.xls]ExcelTemplate'!R9C[-5]:R404C[10],16,0) -> 5310409 | H281: =1 -> 1 | I281: =RC[-4] -> 12 | J281: =RC[-4] -> 3600000 | K281: =RC[-3] -> 1
A282: 45 | B282: 012572 | C282: Trần Quốc Việt | D282: Nhân viên Bốc xếp | E282: 10 | F282: 3000000 | G282: =VLOOKUP(RC[-5],'\HOA VE\LUONG\Luong phan mem 2015\Thang 3\[Bang tien lan 2 thang 3 TNCN.xls]ExcelTemplate'!R9C[-5]:R404C[10],16,0) -> 5091530 | H282: =1 -> 1 | I282: =RC[-4] -> 10 | J282: =RC[-4] -> 3000000 | K282: =RC[-3] -> 1
A283: 46 | B283: 012573 | C283: Trần Thế Khánh | D283: Nhân viên Bốc xếp | E283: 10 | F283: 3000000 | G283: =VLOOKUP(RC[-5],'\HOA VE\LUONG\Luong phan mem 2015\Thang 3\[Bang tien lan 2 thang 3 TNCN.xls]ExcelTemplate'!R9C[-5]:R404C[10],16,0) -> 4895999 | H283: =1 -> 1 | I283: =RC[-4] -> 10 | J283: =RC[-4] -> 3000000 | K283: =RC[-3] -> 1
A284: 47 | B284: 012574 | C284: Lê Văn Hùng | D284: Nhân viên Bốc xếp | E284: 10 | F284: 3000000 | G284: =VLOOKUP(RC[-5],'\HOA VE\LUONG\Luong phan mem 2015\Thang 3\[Bang tien lan 2 thang 3 TNCN.xls]ExcelTemplate'!R9C[-5]:R404C[10],16,0) -> 5091530 | H284: =1 -> 1 | I284: =RC[-4] -> 10 | J284: =RC[-4] -> 3000000 | K284: =RC[-3] -> 1
A285: 48 | B285: 012575 | C285: Nguyễn Văn Thắng | D285: Nhân viên Bốc xếp | E285: 10 | F285: 3000000 | G285: =VLOOKUP(RC[-5],'\HOA VE\LUONG\Luong phan mem 2015\Thang 3\[Bang tien lan 2 thang 3 TNCN.xls]ExcelTemplate'!R9C[-5]:R404C[10],16,0) -> 4067178 | H285: =1 -> 1 | I285: =RC[-4] -> 10 | J285: =RC[-4] -> 3000000 | K285: =RC[-3] -> 1
A286: 49 | B286: 012576 | C286: Nguyễn Tùng Giang | D286: Nhân viên Bốc xếp | E286: 9 | F286: 2700000 | G286: =VLOOKUP(RC[-5],'\HOA VE\LUONG\Luong phan mem 2015\Thang 3\[Bang tien lan 2 thang 3 TNCN.xls]ExcelTemplate'!R9C[-5]:R404C[10],16,0) -> 4855280 | H286: =1 -> 1 | I286: =RC[-4] -> 9 | J286: =RC[-4] -> 2700000 | K286: =RC[-3] -> 1
A287: 50 | B287: 012577 | C287: Lê Ngọc Hùng | D287: Nhân viên Bốc xếp | E287: 10 | F287: 3000000 | G287: =VLOOKUP(RC[-5],'\HOA VE\LUONG\Luong phan mem 2015\Thang 3\[Bang tien lan 2 thang 3 TNCN.xls]ExcelTemplate'!R9C[-5]:R404C[10],16,0) -> 5091530 | H287: =1 -> 1 | I287: =RC[-4] -> 10 | J287: =RC[-4] -> 3000000 | K287: =RC[-3] -> 1
A288: 51 | B288: 012578 | C288: Bùi Bảo Long | D288: Nhân viên Bốc xếp | E288: 10 | F288: 3000000 | G288: =VLOOKUP(RC[-5],'\HOA VE\LUONG\Luong phan mem 2015\Thang 3\[Bang tien lan 2 thang 3 TNCN.xls]ExcelTemplate'!R9C[-5]:R404C[10],16,0) -> 4855280 | H288: =1 -> 1 | I288: =RC[-4] -> 10 | J288: =RC[-4] -> 3000000 | K288: =RC[-3] -> 1
A289: 52 | B289: 012579 | C289: Nguyễn Ngọc Công | D289: Nhân viên Bốc xếp | E289: 10 | F289: 3000000 | G289: =VLOOKUP(RC[-5],'\HOA VE\LUONG\Luong phan mem 2015\Thang 3\[Bang tien lan 2 thang 3 TNCN.xls]ExcelTemplate'!R9C[-5]:R404C[10],16,0) -> 5091530 | H289: =1 -> 1 | I289: =RC[-4] -> 10 | J289: =RC[-4] -> 3000000 | K289: =RC[-3] -> 1
A290: 53 | B290: 012580 | C290: Đào Công Duẩn | D290: Nhân viên Bốc xếp | E290: 10 | F290: 3000000 | G290: =VLOOKUP(RC[-5],'\HOA VE\LUONG\Luong phan mem 2015\Thang 3\[Bang tien lan 2 thang 3 TNCN.xls]ExcelTemplate'!R9C[-5]:R404C[10],16,0) -> 4067178 | H290: =1 -> 1 | I290: =RC[-4] -> 10 | J290: =RC[-4] -> 3000000 | K290: =RC[-3] -> 1
A291: 54 | B291: 012581 | C291: Nguyễn Gia Thắng | D291: Nhân viên Bốc xếp | E291: 10 | F291: 3000000 | G291: =VLOOKUP(RC[-5],'\HOA VE\LUONG\Luong phan mem 2015\Thang 3\[Bang tien lan 2 thang 3 TNCN.xls]ExcelTemplate'!R9C[-5]:R404C[10],16,0) -> 5091530 | H291: =1 -> 1 | I291: =RC[-4] -> 10 | J291: =RC[-4] -> 3000000 | K291: =RC[-3] -> 1
A292: 55 | B292: 012583 | C292: Nguyễn Huy Đáp | D292: Nhân viên Bốc xếp | E292: 10 | F292: 3000000 | G292: =VLOOKUP(RC[-5],'\HOA VE\LUONG\Luong phan mem 2015\Thang 3\[Bang tien lan 2 thang 3 TNCN.xls]ExcelTemplate'!R9C[-5]:R404C[10],16,0) -> 5091530 | H292: =1 -> 1 | I292: =RC[-4] -> 10 | J292: =RC[-4] -> 3000000 | K292: =RC[-3] -> 1
A293: 56 | B293: 012584 | C293: Lê Văn Thịnh | D293: Nhân viên Bốc xếp | E293: 10 | F293: 3000000 | G293: =VLOOKUP(RC[-5],'\HOA VE\LUONG\Luong phan mem 2015\Thang 3\[Bang tien lan 2 thang 3 TNCN.xls]ExcelTemplate'!R9C[-5]:R404C[10],16,0) -> 5091530 | H293: =1 -> 1 | I293: =RC[-4] -> 10 | J293: =RC[-4] -> 3000000 | K293: =RC[-3] -> 1
A294: 57 | B294: 012585 | C294: Nguyễn Tuấn Anh | D294: Nhân viên Bốc xếp | E294: 10 | F294: 3000000 | G294: =VLOOKUP(RC[-5],'\HOA VE\LUONG\Luong phan mem 2015\Thang 3\[Bang tien lan 2 thang 3 TNCN.xls]ExcelTemplate'!R9C[-5]:R404C[10],16,0) -> 5289980 | H294: =1 -> 1 | I294: =RC[-4] -> 10 | J294: =RC[-4] -> 3000000 | K294: =RC[-3] -> 1
A295: 58 | B295: 012586 | C295: Phạm Văn Trường | D295: Nhân viên Bốc xếp | E295: 10 | F295: 3000000 | G295: =VLOOKUP(RC[-5],'\HOA VE\LUONG\Luong phan mem 2015\Thang 3\[Bang tien lan 2 thang 3 TNCN.xls]ExcelTemplate'!R9C[-5]:R404C[10],16,0) -> 5053730 | H295: =1 -> 1 | I295: =RC[-4] -> 10 | J295: =RC[-4] -> 3000000 | K295: =RC[-3] -> 1
A296: 59 | B296: 012587 | C296: Nguyễn Minh Dũng | D296: Nhân viên Bốc xếp | E296: 10 | F296: 3000000 | G296: =VLOOKUP(RC[-5],'\HOA VE\LUONG\Luong phan mem 2015\Thang 3\[Bang tien lan 2 thang 3 TNCN.xls]ExcelTemplate'!R9C[-5]:R404C[10],16,0) -> 5091530 | H296: =1 -> 1 | I296: =RC[-4] -> 10 | J296: =RC[-4] -> 3000000 | K296: =RC[-3] -> 1
A297: 60 | B297: 012588 | C297: Đào Huy Phong | D297: Nhân viên Bốc xếp | E297: 10 | F297: 3000000 | G297: =VLOOKUP(RC[-5],'\HOA VE\LUONG\Luong phan mem 2015\Thang 3\[Bang tien lan 2 thang 3 TNCN.xls]ExcelTemplate'!R9C[-5]:R404C[10],16,0) -> 5091530 | H297: =1 -> 1 | I297: =RC[-4] -> 10 | J297: =RC[-4] -> 3000000 | K297: =RC[-3] -> 1
A298: 61 | B298: 012589 | C298: Lê Văn Thiện | D298: Nhân viên Bốc xếp | E298: 10 | F298: 3000000 | G298: =VLOOKUP(RC[-5],'\HOA VE\LUONG\Luong phan mem 2015\Thang 3\[Bang tien lan 2 thang 3 TNCN.xls]ExcelTemplate'!R9C[-5]:R404C[10],16,0) -> 4855280 | H298: =1 -> 1 | I298: =RC[-4] -> 10 | J298: =RC[-4] -> 3000000 | K298: =RC[-3] -> 1
A299: 62 | B299: 012591 | C299: Nguyễn Xuân Quý | D299: Nhân viên Bốc xếp | E299: 10 | F299: 3000000 | G299: =VLOOKUP(RC[-5],'\HOA VE\LUONG\Luong phan mem 2015\Thang 3\[Bang tien lan 2 thang 3 TNCN.xls]ExcelTemplate'!R9C[-5]:R404C[10],16,0) -> 5091530 | H299: =1 -> 1 | I299: =RC[-4] -> 10 | J299: =RC[-4] -> 3000000 | K299: =RC[-3] -> 1
A300: 63 | B300: 012592 | C300: Lê Minh Huy | D300: Nhân viên Bốc xếp | E300: 10 | F300: 3000000 | G300: =VLOOKUP(RC[-5],'\HOA VE\LUONG\Luong phan mem 2015\Thang 3\[Bang tien lan 2 thang 3 TNCN.xls]ExcelTemplate'!R9C[-5]:R404C[10],16,0) -> 4502017 | H300: =1 -> 1 | I300: =RC[-4] -> 10 | J300: =RC[-4] -> 3000000 | K300: =RC[-3] -> 1
A301: 64 | B301: 013424 | C301: Bùi Tuấn Anh | D301: Nhân viên Bốc xếp | E301: 4 | F301: 1200000 | G301: =VLOOKUP(RC[-5],'\HOA VE\LUONG\Luong phan mem 2015\Thang 3\[Bang tien lan 2 thang 3 TNCN.xls]ExcelTemplate'!R9C[-5]:R404C[10],16,0) -> 3744302 | H301: =1 -> 1 | I301: =RC[-4] -> 4 | J301: =RC[-4] -> 1200000 | K301: =RC[-3] -> 1
A302: 65 | B302: 013425 | C302: Nguyễn Duy Trinh | D302: Nhân viên Bốc xếp | E302: 4 | F302: 1200000 | G302: =VLOOKUP(RC[-5],'\HOA VE\LUONG\Luong phan mem 2015\Thang 3\[Bang tien lan 2 thang 3 TNCN.xls]ExcelTemplate'!R9C[-5]:R404C[10],16,0) -> 3744302 | H302: =1 -> 1 | I302: =RC[-4] -> 4 | J302: =RC[-4] -> 1200000 | K302: =RC[-3] -> 1
A303: 66 | B303: 013436 | C303: Lê Văn Thư | D303: Nhân viên Bốc xếp | E303: 4 | F303: 1200000 | G303: =VLOOKUP(RC[-5],'\HOA VE\LUONG\Luong phan mem 2015\Thang 3\[Bang tien lan 2 thang 3 TNCN.xls]ExcelTemplate'!R9C[-5]:R404C[10],16,0) -> 3744302 | H303: =1 -> 1 | I303: =RC[-4] -> 4 | J303: =RC[-4] -> 1200000 | K303: =RC[-3] -> 1
A304: 67 | B304: 013437 | C304: Phạm Ngọc Huấn | D304: Nhân viên Bốc xếp | E304: 4 | F304: 1200000 | G304: =VLOOKUP(RC[-5],'\HOA VE\LUONG\Luong phan mem 2015\Thang 3\[Bang tien lan 2 thang 3 TNCN.xls]ExcelTemplate'!R9C[-5]:R404C[10],16,0) -> 3744302 | H304: =1 -> 1 | I304: =RC[-4] -> 4 | J304: =RC[-4] -> 1200000 | K304: =RC[-3] -> 1
A305: 68 | B305: 013446 | C305: Dương Công Tú | D305: Nhân viên Bốc xếp | E305: 4 | F305: 1200000 | G305: =VLOOKUP(RC[-5],'\HOA VE\LUONG\Luong phan mem 2015\Thang 3\[Bang tien lan 2 thang 3 TNCN.xls]ExcelTemplate'!R9C[-5]:R404C[10],16,0) -> 3744302 | H305: =1 -> 1 | I305: =RC[-4] -> 4 | J305: =RC[-4] -> 1200000 | K305: =RC[-3] -> 1
A306: 69 | B306: 013448 | C306: Nguyễn Hùng Anh | D306: Nhân viên Bốc xếp | E306: 4 | F306: 1200000 | G306: =VLOOKUP(RC[-5],'\HOA VE\LUONG\Luong phan mem 2015\Thang 3\[Bang tien lan 2 thang 3 TNCN.xls]ExcelTemplate'!R9C[-5]:R404C[10],16,0) -> 3744302 | H306: =1 -> 1 | I306: =RC[-4] -> 4 | J306: =RC[-4] -> 1200000 | K306: =RC[-3] -> 1
A307: 70 | B307: 013450 | C307: Phạm Văn Mạnh | D307: Nhân viên Bốc xếp | E307: 4 | F307: 1200000 | G307: =VLOOKUP(RC[-5],'\HOA VE\LUONG\Luong phan mem 2015\Thang 3\[Bang tien lan 2 thang 3 TNCN.xls]ExcelTemplate'!R9C[-5]:R404C[10],16,0) -> 3744302 | H307: =1 -> 1 | I307: =RC[-4] -> 4 | J307: =RC[-4] -> 1200000 | K307: =RC[-3] -> 1
A308: 71 | B308: 013451 | C308: Vũ Minh Tiến | D308: Nhân viên Bốc xếp | E308: 4 | F308: 1200000 | G308: =VLOOKUP(RC[-5],'\HOA VE\LUONG\Luong phan mem 2015\Thang 3\[Bang tien lan 2 thang 3 TNCN.xls]ExcelTemplate'!R9C[-5]:R404C[10],16,0) -> 3744302 | H308: =1 -> 1 | I308: =RC[-4] -> 4 | J308: =RC[-4] -> 1200000 | K308: =RC[-3] -> 1
A309: 72 | B309: 013453 | C309: Nguyễn Văn Khiêm | D309: Nhân viên Bốc xếp | E309: 4 | F309: 1200000 | G309: =VLOOKUP(RC[-5],'\HOA VE\LUONG\Luong phan mem 2015\Thang 3\[Bang tien lan 2 thang 3 TNCN.xls]ExcelTemplate'!R9C[-5]:R404C[10],16,0) -> 3744302 | H309: =1 -> 1 | I309: =RC[-4] -> 4 | J309: =RC[-4] -> 1200000 | K309: =RC[-3] -> 1
A310: 73 | B310: 013454 | C310: Nguyễn Xuân Hải | D310: Nhân viên Bốc xếp | E310: 4 | F310: 1200000 | G310: =VLOOKUP(RC[-5],'\HOA VE\LUONG\Luong phan mem 2015\Thang 3\[Bang tien lan 2 thang 3 TNCN.xls]ExcelTemplate'!R9C[-5]:R404C[10],16,0) -> 3744302 | H310: =1 -> 1 | I310: =RC[-4] -> 4 | J310: =RC[-4] -> 1200000 | K310: =RC[-3] -> 1
A311: 74 | B311: 013455 | C311: Nguyễn Như Tuấn | D311: Nhân viên Bốc xếp | E311: 4 | F311: 1200000 | G311: =VLOOKUP(RC[-5],'\HOA VE\LUONG\Luong phan mem 2015\Thang 3\[Bang tien lan 2 thang 3 TNCN.xls]ExcelTemplate'!R9C[-5]:R404C[10],16,0) -> 3744302 | H311: =1 -> 1 | I311: =RC[-4] -> 4 | J311: =RC[-4] -> 1200000 | K311: =RC[-3] -> 1
A312: 75 | B312: 013457 | C312: Trần Thanh Tuấn | D312: Nhân viên Bốc xếp | E312: 4 | F312: 1200000 | G312: =VLOOKUP(RC[-5],'\HOA VE\LUONG\Luong phan mem 2015\Thang 3\[Bang tien lan 2 thang 3 TNCN.xls]ExcelTemplate'!R9C[-5]:R404C[10],16,0) -> 3744302 | H312: =1 -> 1 | I312: =RC[-4] -> 4 | J312: =RC[-4] -> 1200000 | K312: =RC[-3] -> 1
A313: 76 | B313: 013458 | C313: Nguyễn Việt Hải | D313: Nhân viên Bốc xếp | E313: 4 | F313: 1200000 | G313: =VLOOKUP(RC[-5],'\HOA VE\LUONG\Luong phan mem 2015\Thang 3\[Bang tien lan 2 thang 3 TNCN.xls]ExcelTemplate'!R9C[-5]:R404C[10],16,0) -> 3744302 | H313: =1 -> 1 | I313: =RC[-4] -> 4 | J313: =RC[-4] -> 1200000 | K313: =RC[-3] -> 1
A314: 77 | B314: 013461 | C314: Cao Văn Mạnh | D314: Nhân viên Bốc xếp | E314: 4 | F314: 1200000 | G314: =VLOOKUP(RC[-5],'\HOA VE\LUONG\Luong phan mem 2015\Thang 3\[Bang tien lan 2 thang 3 TNCN.xls]ExcelTemplate'!R9C[-5]:R404C[10],16,0) -> 3744302 | H314: =1 -> 1 | I314: =RC[-4] -> 4 | J314: =RC[-4] -> 1200000 | K314: =RC[-3] -> 1
A315: 78 | B315: 013464 | C315: Phạm Văn Dũng | D315: Nhân viên Bốc xếp | E315: 4 | F315: 1200000 | G315: =VLOOKUP(RC[-5],'\HOA VE\LUONG\Luong phan mem 2015\Thang 3\[Bang tien lan 2 thang 3 TNCN.xls]ExcelTemplate'!R9C[-5]:R404C[10],16,0) -> 3744302 | H315: =1 -> 1 | I315: =RC[-4] -> 4 | J315: =RC[-4] -> 1200000 | K315: =RC[-3] -> 1
A316: 79 | B316: 013465 | C316: Vũ Văn Tuyền | D316: Nhân viên Bốc xếp | E316: 4 | F316: 1200000 | G316: =VLOOKUP(RC[-5],'\HOA VE\LUONG\Luong phan mem 2015\Thang 3\[Bang tien lan 2 thang 3 TNCN.xls]ExcelTemplate'!R9C[-5]:R404C[10],16,0) -> 3744302 | H316: =1 -> 1 | I316: =RC[-4] -> 4 | J316: =RC[-4] -> 1200000 | K316: =RC[-3] -> 1
A317: 80 | B317: 013466 | C317: Nguyễn Viết Phi | D317: Nhân viên Bốc xếp | E317: 4 | F317: 1200000 | G317: =VLOOKUP(RC[-5],'\HOA VE\LUONG\Luong phan mem 2015\Thang 3\[Bang tien lan 2 thang 3 TNCN.xls]ExcelTemplate'!R9C[-5]:R404C[10],16,0) -> 3744302 | H317: =1 -> 1 | I317: =RC[-4] -> 4 | J317: =RC[-4] -> 1200000 | K317: =RC[-3] -> 1
A318: 81 | B318: 013467 | C318: Tăng Văn Hải | D318: Nhân viên Bốc xếp | E318: 4 | F318: 1200000 | G318: =VLOOKUP(RC[-5],'\HOA VE\LUONG\Luong phan mem 2015\Thang 3\[Bang tien lan 2 thang 3 TNCN.xls]ExcelTemplate'!R9C[-5]:R404C[10],16,0) -> 3744302 | H318: =1 -> 1 | I318: =RC[-4] -> 4 | J318: =RC[-4] -> 1200000 | K318: =RC[-3] -> 1
A319: 82 | B319: 013468 | C319: Lê Trọng Tài | D319: Nhân viên Bốc xếp | E319: 4 | F319: 1200000 | G319: =VLOOKUP(RC[-5],'\HOA VE\LUONG\Luong phan mem 2015\Thang 3\[Bang tien lan 2 thang 3 TNCN.xls]ExcelTemplate'!R9C[-5]:R404C[10],16,0) -> 3744302 | H319: =1 -> 1 | I319: =RC[-4] -> 4 | J319: =RC[-4] -> 1200000 | K319: =RC[-3] -> 1
A320: 83 | B320: 010681 | C320: Trần Văn Minh | D320: NV Lái xe - VHTTB | E320: 12 | F320: 3600000 | G320: =VLOOKUP(RC[-5],'\HOA VE\LUONG\Luong phan mem 2015\Thang 3\[Bang tien lan 2 thang 3 TNCN.xls]ExcelTemplate'!R9C[-5]:R404C[10],16,0) -> 7554845 | H320: =1 -> 1 | I320: =RC[-4] -> 12 | J320: =RC[-4] -> 3600000 | K320: =RC[-3] -> 1
A321: 84 | B321: 010682 | C321: Nguyễn Gia Chiến | D321: NV Lái xe - VHTTB | E321: 12 | F321: 3600000 | G321: =VLOOKUP(RC[-5],'\HOA VE\LUONG\Luong phan mem 2015\Thang 3\[Bang tien lan 2 thang 3 TNCN.xls]ExcelTemplate'!R9C[-5]:R404C[10],16,0) -> 7356010 | H321: =1 -> 1 | I321: =RC[-4] -> 12 | J321: =RC[-4] -> 3600000 | K321: =RC[-3] -> 1
A322: 85 | B322: 010683 | C322: Nguyễn Trung Sơn | D322: NV Lái xe - VHTTB | E322: 12 | F322: 3600000 | G322: =VLOOKUP(RC[-5],'\HOA VE\LUONG\Luong phan mem 2015\Thang 3\[Bang tien lan 2 thang 3 TNCN.xls]ExcelTemplate'!R9C[-5]:R404C[10],16,0) -> 7286331 | H322: =1 -> 1 | I322: =RC[-4] -> 12 | J322: =RC[-4] -> 3600000 | K322: =RC[-3] -> 1
A323: 86 | B323: 010684 | C323: Lê Quang Hợp | D323: NV Lái xe - VHTTB | E323: 12 | F323: 3600000 | G323: =VLOOKUP(RC[-5],'\HOA VE\LUONG\Luong phan mem 2015\Thang 3\[Bang tien lan 2 thang 3 TNCN.xls]ExcelTemplate'!R9C[-5]:R404C[10],16,0) -> 7407283 | H323: =1 -> 1 | I323: =RC[-4] -> 12 | J323: =RC[-4] -> 3600000 | K323: =RC[-3] -> 1
A324: 87 | B324: 010705 | C324: Nguyễn Hữu Nam | D324: NV Lái xe - VHTTB | E324: 12 | F324: 3600000 | G324: =VLOOKUP(RC[-5],'\HOA VE\LUONG\Luong phan mem 2015\Thang 3\[Bang tien lan 2 thang 3 TNCN.xls]ExcelTemplate'!R9C[-5]:R404C[10],16,0) -> 7262141 | H324: =1 -> 1 | I324: =RC[-4] -> 12 | J324: =RC[-4] -> 3600000 | K324: =RC[-3] -> 1
A325: 88 | B325: 010706 | C325: Đặng Đình Phương | D325: NV Lái xe - VHTTB | E325: 12 | F325: 3600000 | G325: =VLOOKUP(RC[-5],'\HOA VE\LUONG\Luong phan mem 2015\Thang 3\[Bang tien lan 2 thang 3 TNCN.xls]ExcelTemplate'!R9C[-5]:R404C[10],16,0) -> 8336044 | H325: =1 -> 1 | I325: =RC[-4] -> 12 | J325: =RC[-4] -> 3600000 | K325: =RC[-3] -> 1
A326: 89 | B326: 010707 | C326: Phù Trung Ninh | D326: NV Lái xe - VHTTB | E326: 12 | F326: 3600000 | G326: =VLOOKUP(RC[-5],'\HOA VE\LUONG\Luong phan mem 2015\Thang 3\[Bang tien lan 2 thang 3 TNCN.xls]ExcelTemplate'!R9C[-5]:R404C[10],16,0) -> 8009185 | H326: =1 -> 1 | I326: =RC[-4] -> 12 | J326: =RC[-4] -> 3600000 | K326: =RC[-3] -> 1
A327: 90 | B327: 010708 | C327: Phạm Đình Thuần | D327: NV Lái xe - VHTTB | E327: 12 | F327: 3600000 | G327: =VLOOKUP(RC[-5],'\HOA VE\LUONG\Luong phan mem 2015\Thang 3\[Bang tien lan 2 thang 3 TNCN.xls]ExcelTemplate'!R9C[-5]:R404C[10],16,0) -> 7832480 | H327: =1 -> 1 | I327: =RC[-4] -> 12 | J327: =RC[-4] -> 3600000 | K327: =RC[-3] -> 1
A328: 91 | B328: 010710 | C328: Nguyễn Anh Dũng | D328: NV Lái xe - VHTTB | E328: 12 | F328: 3600000 | G328: =VLOOKUP(RC[-5],'\HOA VE\LUONG\Luong phan mem 2015\Thang 3\[Bang tien lan 2 thang 3 TNCN.xls]ExcelTemplate'!R9C[-5]:R404C[10],16,0) -> 8406024 | H328: =1 -> 1 | I328: =RC[-4] -> 12 | J328: =RC[-4] -> 3600000 | K328: =RC[-3] -> 1
A329: 92 | B329: 010711 | C329: Nguyễn Ngọc Hà | D329: NV Lái xe - VHTTB | E329: 12 | F329: 3600000 | G329: =VLOOKUP(RC[-5],'\HOA VE\LUONG\Luong phan mem 2015\Thang 3\[Bang tien lan 2 thang 3 TNCN.xls]ExcelTemplate'!R9C[-5]:R404C[10],16,0) -> 7556898 | H329: =1 -> 1 | I329: =RC[-4] -> 12 | J329: =RC[-4] -> 3600000 | K329: =RC[-3] -> 1
A330: 93 | B330: 010712 | C330: Phạm Đức Long | D330: NV Lái xe - VHTTB | E330: 12 | F330: 3600000 | G330: =VLOOKUP(RC[-5],'\HOA VE\LUONG\Luong phan mem 2015\Thang 3\[Bang tien lan 2 thang 3 TNCN.xls]ExcelTemplate'!R9C[-5]:R404C[10],16,0) -> 7262141 | H330: =1 -> 1 | I330: =RC[-4] -> 12 | J330: =RC[-4] -> 3600000 | K330: =RC[-3] -> 1
A331: 94 | B331: 010713 | C331: Trịnh Văn Mạnh | D331: NV Lái xe - VHTTB | E331: 12 | F331: 3600000 | G331: =VLOOKUP(RC[-5],'\HOA VE\LUONG\Luong phan mem 2015\Thang 3\[Bang tien lan 2 thang 3 TNCN.xls]ExcelTemplate'!R9C[-5]:R404C[10],16,0) -> 7612347 | H331: =1 -> 1 | I331: =RC[-4] -> 12 | J331: =RC[-4] -> 3600000 | K331: =RC[-3] -> 1
A332: 95 | B332: 010714 | C332: Phạm Văn Hải | D332: NV Lái xe - VHTTB | E332: 12 | F332: 3600000 | G332: =VLOOKUP(RC[-5],'\HOA VE\LUONG\Luong phan mem 2015\Thang 3\[Bang tien lan 2 thang 3 TNCN.xls]ExcelTemplate'!R9C[-5]:R404C[10],16,0) -> 8229318 | H332: =1 -> 1 | I332: =RC[-4] -> 12 | J332: =RC[-4] -> 3600000 | K332: =RC[-3] -> 1
A333: 96 | B333: 010716 | C333: Bùi Văn Thành | D333: NV Lái xe - VHTTB | E333: 12 | F333: 3600000 | G333: =VLOOKUP(RC[-5],'\HOA VE\LUONG\Luong phan mem 2015\Thang 3\[Bang tien lan 2 thang 3 TNCN.xls]ExcelTemplate'!R9C[-5]:R404C[10],16,0) -> 6941119 | H333: =1 -> 1 | I333: =RC[-4] -> 12 | J333: =RC[-4] -> 3600000 | K333: =RC[-3] -> 1
A334: 97 | B334: 010717 | C334: Bùi Chí Công | D334: NV Lái xe - VHTTB | E334: 12 | F334: 3600000 | G334: =VLOOKUP(RC[-5],'\HOA VE\LUONG\Luong phan mem 2015\Thang 3\[Bang tien lan 2 thang 3 TNCN.xls]ExcelTemplate'!R9C[-5]:R404C[10],16,0) -> 6941119 | H334: =1 -> 1 | I334: =RC[-4] -> 12 | J334: =RC[-4] -> 3600000 | K334: =RC[-3] -> 1
A335: 98 | B335: 010718 | C335: Nguyễn Văn Định | D335: NV Lái xe - VHTTB | E335: 12 | F335: 3600000 | G335: =VLOOKUP(RC[-5],'\HOA VE\LUONG\Luong phan mem 2015\Thang 3\[Bang tien lan 2 thang 3 TNCN.xls]ExcelTemplate'!R9C[-5]:R404C[10],16,0) -> 7221284 | H335: =1 -> 1 | I335: =RC[-4] -> 12 | J335: =RC[-4] -> 3600000 | K335: =RC[-3] -> 1
A336: 99 | B336: 010719 | C336: Nguyễn Hải Anh | D336: NV Lái xe - VHTTB | E336: 12 | F336: 3600000 | G336: =VLOOKUP(RC[-5],'\HOA VE\LUONG\Luong phan mem 2015\Thang 3\[Bang tien lan 2 thang 3 TNCN.xls]ExcelTemplate'!R9C[-5]:R404C[10],16,0) -> 6941119 | H336: =1 -> 1 | I336: =RC[-4] -> 12 | J336: =RC[-4] -> 3600000 | K336: =RC[-3] -> 1
A337: 100 | B337: 010720 | C337: Bùi Kiên Trung | D337: NV Lái xe - VHTTB | E337: 12 | F337: 3600000 | G337: =VLOOKUP(RC[-5],'\HOA VE\LUONG\Luong phan mem 2015\Thang 3\[Bang tien lan 2 thang 3 TNCN.xls]ExcelTemplate'!R9C[-5]:R404C[10],16,0) -> 6941119 | H337: =1 -> 1 | I337: =RC[-4] -> 12 | J337: =RC[-4] -> 3600000 | K337: =RC[-3] -> 1
A338: 101 | B338: 010721 | C338: Vũ Quốc Cường | D338: NV Lái xe - VHTTB | E338: 12 | F338: 3600000 | G338: =VLOOKUP(RC[-5],'\HOA VE\LUONG\Luong phan mem 2015\Thang 3\[Bang tien lan 2 thang 3 TNCN.xls]ExcelTemplate'!R9C[-5]:R404C[10],16,0) -> 6472225 | H338: =1 -> 1 | I338: =RC[-4] -> 12 | J338: =RC[-4] -> 3600000 | K338: =RC[-3] -> 1
A339: 102 | B339: 010722 | C339: Vũ Văn Dương | D339: NV Lái xe - VHTTB | E339: 12 | F339: 3600000 | G339: =VLOOKUP(RC[-5],'\HOA VE\LUONG\Luong phan mem 2015\Thang 3\[Bang tien lan 2 thang 3 TNCN.xls]ExcelTemplate'!R9C[-5]:R404C[10],16,0) -> 6231343 | H339: =1 -> 1 | I339: =RC[-4] -> 12 | J339: =RC[-4] -> 3600000 | K339: =RC[-3] -> 1
A340: 103 | B340: 010723 | C340: Vũ Văn Thái | D340: NV Lái xe - VHTTB | E340: 12 | F340: 3600000 | G340: =VLOOKUP(RC[-5],'\HOA VE\LUONG\Luong phan mem 2015\Thang 3\[Bang tien lan 2 thang 3 TNCN.xls]ExcelTemplate'!R9C[-5]:R404C[10],16,0) -> 7327722 | H340: =1 -> 1 | I340: =RC[-4] -> 12 | J340: =RC[-4] -> 3600000 | K340: =RC[-3] -> 1
A341: 104 | B341: 010725 | C341: Phạm Quang Sơn | D341: NV Lái xe - VHTTB | E341: 12 | F341: 3600000 | G341: =VLOOKUP(RC[-5],'\HOA VE\LUONG\Luong phan mem 2015\Thang 3\[Bang tien lan 2 thang 3 TNCN.xls]ExcelTemplate'!R9C[-5]:R404C[10],16,0) -> 6472225 | H341: =1 -> 1 | I341: =RC[-4] -> 12 | J341: =RC[-4] -> 3600000 | K341: =RC[-3] -> 1
A342: 105 | B342: 010726 | C342: Vũ Mạnh Hùng | D342: NV Lái xe - VHTTB | E342: 12 | F342: 3600000 | G342: =VLOOKUP(RC[-5],'\HOA VE\LUONG\Luong phan mem 2015\Thang 3\[Bang tien lan 2 thang 3 TNCN.xls]ExcelTemplate'!R9C[-5]:R404C[10],16,0) -> 6267938 | H342: =1 -> 1 | I342: =RC[-4] -> 12 | J342: =RC[-4] -> 3600000 | K342: =RC[-3] -> 1
A343: 106 | B343: 010727 | C343: Trần Mạnh Hùng | D343: NV Lái xe - VHTTB | E343: 12 | F343: 3600000 | G343: =VLOOKUP(RC[-5],'\HOA VE\LUONG\Luong phan mem 2015\Thang 3\[Bang tien lan 2 thang 3 TNCN.xls]ExcelTemplate'!R9C[-5]:R404C[10],16,0) -> 6159958 | H343: =1 -> 1 | I343: =RC[-4] -> 12 | J343: =RC[-4] -> 3600000 | K343: =RC[-3] -> 1
A344: 107 | B344: 010728 | C344: Nguyễn Mạnh Hùng | D344: NV Lái xe - VHTTB | E344: 12 | F344: 3600000 | G344: =VLOOKUP(RC[-5],'\HOA VE\LUONG\Luong phan mem 2015\Thang 3\[Bang tien lan 2 thang 3 TNCN.xls]ExcelTemplate'!R9C[-5]:R404C[10],16,0) -> 6530593 | H344: =1 -> 1 | I344: =RC[-4] -> 12 | J344: =RC[-4] -> 3600000 | K344: =RC[-3] -> 1
A345: 108 | B345: 010729 | C345: Nguyễn Thanh Quyết | D345: NV Lái xe - VHTTB | E345: 12 | F345: 3600000 | G345: =VLOOKUP(RC[-5],'\HOA VE\LUONG\Luong phan mem 2015\Thang 3\[Bang tien lan 2 thang 3 TNCN.xls]ExcelTemplate'!R9C[-5]:R404C[10],16,0) -> 6530593 | H345: =1 -> 1 | I345: =RC[-4] -> 12 | J345: =RC[-4] -> 3600000 | K345: =RC[-3] -> 1
A346: 109 | B346: 010730 | C346: Nguyễn Thanh Bình | D346: NV Lái xe - VHTTB | E346: 12 | F346: 3600000 | G346: =VLOOKUP(RC[-5],'\HOA VE\LUONG\Luong phan mem 2015\Thang 3\[Bang tien lan 2 thang 3 TNCN.xls]ExcelTemplate'!R9C[-5]:R404C[10],16,0) -> 7612347 | H346: =1 -> 1 | I346: =RC[-4] -> 12 | J346: =RC[-4] -> 3600000 | K346: =RC[-3] -> 1
A347: 110 | B347: 010731 | C347: Vũ Tiến Lịch | D347: NV Lái xe - VHTTB | E347: 12 | F347: 3600000 | G347: =VLOOKUP(RC[-5],'\HOA VE\LUONG\Luong phan mem 2015\Thang 3\[Bang tien lan 2 thang 3 TNCN.xls]ExcelTemplate'!R9C[-5]:R404C[10],16,0) -> 6530593 | H347: =1 -> 1 | I347: =RC[-4] -> 12 | J347: =RC[-4] -> 3600000 | K347: =RC[-3] -> 1
A348: 111 | B348: 010732 | C348: Nguyễn Xuân Hợi | D348: NV Lái xe - VHTTB | E348: 12 | F348: 3600000 | G348: =VLOOKUP(RC[-5],'\HOA VE\LUONG\Luong phan mem 2015\Thang 3\[Bang tien lan 2 thang 3 TNCN.xls]ExcelTemplate'!R9C[-5]:R404C[10],16,0) -> 6472225 | H348: =1 -> 1 | I348: =RC[-4] -> 12 | J348: =RC[-4] -> 3600000 | K348: =RC[-3] -> 1
A349: 112 | B349: 010733 | C349: Nguyễn Văn Sơn | D349: NV Lái xe - VHTTB | E349: 12 | F349: 3600000 | G349: =VLOOKUP(RC[-5],'\HOA VE\LUONG\Luong phan mem 2015\Thang 3\[Bang tien lan 2 thang 3 TNCN.xls]ExcelTemplate'!R9C[-5]:R404C[10],16,0) -> 6472225 | H349: =1 -> 1 | I349: =RC[-4] -> 12 | J349: =RC[-4] -> 3600000 | K349: =RC[-3] -> 1
A350: 113 | B350: 011132 | C350: Nguyễn Hữu Chức | D350: NV Lái xe - VHTTB | E350: 12 | F350: 3600000 | G350: =VLOOKUP(RC[-5],'\HOA VE\LUONG\Luong phan mem 2015\Thang 3\[Bang tien lan 2 thang 3 TNCN.xls]ExcelTemplate'!R9C[-5]:R404C[10],16,0) -> 6102978 | H350: =1 -> 1 | I350: =RC[-4] -> 12 | J350: =RC[-4] -> 3600000 | K350: =RC[-3] -> 1
A351: 114 | B351: 011133 | C351: Phù Định | D351: NV Lái xe - VHTTB | E351: 12 | F351: 3600000 | G351: =VLOOKUP(RC[-5],'\HOA VE\LUONG\Luong phan mem 2015\Thang 3\[Bang tien lan 2 thang 3 TNCN.xls]ExcelTemplate'!R9C[-5]:R404C[10],16,0) -> 6348122 | H351: =1 -> 1 | I351: =RC[-4] -> 12 | J351: =RC[-4] -> 3600000 | K351: =RC[-3] -> 1
A352: 115 | B352: 011134 | C352: Hồ Ngọc Hà | D352: NV Lái xe - VHTTB | E352: 12 | F352: 3600000 | G352: =VLOOKUP(RC[-5],'\HOA VE\LUONG\Luong phan mem 2015\Thang 3\[Bang tien lan 2 thang 3 TNCN.xls]ExcelTemplate'!R9C[-5]:R404C[10],16,0) -> 5589809 | H352: =1 -> 1 | I352: =RC[-4] -> 12 | J352: =RC[-4] -> 3600000 | K352: =RC[-3] -> 1
A353: 116 | B353: 011135 | C353: Nguyễn Đắc Thanh | D353: NV Lái xe - VHTTB | E353: 12 | F353: 3600000 | G353: =VLOOKUP(RC[-5],'\HOA VE\LUONG\Luong phan mem 2015\Thang 3\[Bang tien lan 2 thang 3 TNCN.xls]ExcelTemplate'!R9C[-5]:R404C[10],16,0) -> 6102978 | H353: =1 -> 1 | I353: =RC[-4] -> 12 | J353: =RC[-4] -> 3600000 | K353: =RC[-3] -> 1
A354: 117 | B354: 011136 | C354: Nguyễn Huy Dũng | D354: NV Lái xe - VHTTB | E354: 12 | F354: 3600000 | G354: =VLOOKUP(RC[-5],'\HOA VE\LUONG\Luong phan mem 2015\Thang 3\[Bang tien lan 2 thang 3 TNCN.xls]ExcelTemplate'!R9C[-5]:R404C[10],16,0) -> 5857833 | H354: =1 -> 1 | I354: =RC[-4] -> 12 | J354: =RC[-4] -> 3600000 | K354: =RC[-3] -> 1
A355: 118 | B355: 011137 | C355: Nguyễn Văn Phong | D355: NV Lái xe - VHTTB | E355: 12 | F355: 3600000 | G355: =VLOOKUP(RC[-5],'\HOA VE\LUONG\Luong phan mem 2015\Thang 3\[Bang tien lan 2 thang 3 TNCN.xls]ExcelTemplate'!R9C[-5]:R404C[10],16,0) -> 5367545 | H355: =1 -> 1 | I355: =RC[-4] -> 12 | J355: =RC[-4] -> 3600000 | K355: =RC[-3] -> 1
A356: 119 | B356: 011138 | C356: Phạm Việt Tùng | D356: NV Lái xe - VHTTB | E356: 12 | F356: 3600000 | G356: =VLOOKUP(RC[-5],'\HOA VE\LUONG\Luong phan mem 2015\Thang 3\[Bang tien lan 2 thang 3 TNCN.xls]ExcelTemplate'!R9C[-5]:R404C[10],16,0) -> 6102978 | H356: =1 -> 1 | I356: =RC[-4] -> 12 | J356: =RC[-4] -> 3600000 | K356: =RC[-3] -> 1
A357: 120 | B357: 011139 | C357: Phùng Viết Dũng | D357: NV Lái xe - VHTTB | E357: 12 | F357: 3600000 | G357: =VLOOKUP(RC[-5],'\HOA VE\LUONG\Luong phan mem 2015\Thang 3\[Bang tien lan 2 thang 3 TNCN.xls]ExcelTemplate'!R9C[-5]:R404C[10],16,0) -> 6102978 | H357: =1 -> 1 | I357: =RC[-4] -> 12 | J357: =RC[-4] -> 3600000 | K357: =RC[-3] -> 1
A358: 121 | B358: 011141 | C358: Lê Trọng Lệ | D358: NV Lái xe - VHTTB | E358: 12 | F358: 3600000 | G358: =VLOOKUP(RC[-5],'\HOA VE\LUONG\Luong phan mem 2015\Thang 3\[Bang tien lan 2 thang 3 TNCN.xls]ExcelTemplate'!R9C[-5]:R404C[10],16,0) -> 4429588 | H358: =1 -> 1 | I358: =RC[-4] -> 12 | J358: =RC[-4] -> 3600000 | K358: =RC[-3] -> 1
A359: 122 | B359: 011142 | C359: Trần Văn Chính | D359: NV Lái xe - VHTTB | E359: 12 | F359: 3600000 | G359: =VLOOKUP(RC[-5],'\HOA VE\LUONG\Luong phan mem 2015\Thang 3\[Bang tien lan 2 thang 3 TNCN.xls]ExcelTemplate'!R9C[-5]:R404C[10],16,0) -> 5857833 | H359: =1 -> 1 | I359: =RC[-4] -> 12 | J359: =RC[-4] -> 3600000 | K359: =RC[-3] -> 1
A360: 123 | B360: 011143 | C360: Phù Xuân Tiền | D360: NV Lái xe - VHTTB | E360: 12 | F360: 3600000 | G360: =VLOOKUP(RC[-5],'\HOA VE\LUONG\Luong phan mem 2015\Thang 3\[Bang tien lan 2 thang 3 TNCN.xls]ExcelTemplate'!R9C[-5]:R404C[10],16,0) -> 6348122 | H360: =1 -> 1 | I360: =RC[-4] -> 12 | J360: =RC[-4] -> 3600000 | K360: =RC[-3] -> 1
A361: 124 | B361: 011144 | C361: Đinh Văn Bền | D361: NV Lái xe - VHTTB | E361: 12 | F361: 3600000 | G361: =VLOOKUP(RC[-5],'\HOA VE\LUONG\Luong phan mem 2015\Thang 3\[Bang tien lan 2 thang 3 TNCN.xls]ExcelTemplate'!R9C[-5]:R404C[10],16,0) -> 5857833 | H361: =1 -> 1 | I361: =RC[-4] -> 12 | J361: =RC[-4] -> 3600000 | K361: =RC[-3] -> 1
A362: 125 | B362: 011145 | C362: Nguyễn Tiến Ngọc | D362: NV Lái xe - VHTTB | E362: 12 | F362: 3600000 | G362: =VLOOKUP(RC[-5],'\HOA VE\LUONG\Luong phan mem 2015\Thang 3\[Bang tien lan 2 thang 3 TNCN.xls]ExcelTemplate'!R9C[-5]:R404C[10],16,0) -> 4827644 | H362: =1 -> 1 | I362: =RC[-4] -> 12 | J362: =RC[-4] -> 3600000 | K362: =RC[-3] -> 1
A363: 126 | B363: 013406 | C363: Hoàng Đình Mạnh | D363: NV Lái xe - VHTTB | E363: 4 | F363: 1200000 | G363: =VLOOKUP(RC[-5],'\HOA VE\LUONG\Luong phan mem 2015\Thang 3\[Bang tien lan 2 thang 3 TNCN.xls]ExcelTemplate'!R9C[-5]:R404C[10],16,0) -> 780000 | H363: =1 -> 1 | I363: =RC[-4] -> 4 | J363: =RC[-4] -> 1200000 | K363: =RC[-3] -> 1
A364: 127 | B364: 013407 | C364: Vương Văn Tiến | D364: NV Lái xe - VHTTB | E364: 4 | F364: 1200000 | G364: =VLOOKUP(RC[-5],'\HOA VE\LUONG\Luong phan mem 2015\Thang 3\[Bang tien lan 2 thang 3 TNCN.xls]ExcelTemplate'!R9C[-5]:R404C[10],16,0) -> 780000 | H364: =1 -> 1 | I364: =RC[-4] -> 4 | J364: =RC[-4] -> 1200000 | K364: =RC[-3] -> 1
A365: 128 | B365: 013408 | C365: Nguyễn Phương Thắng | D365: NV Lái xe - VHTTB | E365: 4 | F365: 1200000 | G365: =VLOOKUP(RC[-5],'\HOA VE\LUONG\Luong phan mem 2015\Thang 3\[Bang tien lan 2 thang 3 TNCN.xls]ExcelTemplate'!R9C[-5]:R404C[10],16,0) -> 780000 | H365: =1 -> 1 | I365: =RC[-4] -> 4 | J365: =RC[-4] -> 1200000 | K365: =RC[-3] -> 1
A366: 129 | B366: 013409 | C366: Lê Tuấn Anh | D366: NV Lái xe - VHTTB | E366: 4 | F366: 1200000 | G366: =VLOOKUP(RC[-5],'\HOA VE\LUONG\Luong phan mem 2015\Thang 3\[Bang tien lan 2 thang 3 TNCN.xls]ExcelTemplate'!R9C[-5]:R404C[10],16,0) -> 780000 | H366: =1 -> 1 | I366: =RC[-4] -> 4 | J366: =RC[-4] -> 1200000 | K366: =RC[-3] -> 1
A367: 130 | B367: 013410 | C367: Đoàn Văn Phương | D367: NV Lái xe - VHTTB | E367: 4 | F367: 1200000 | G367: =VLOOKUP(RC[-5],'\HOA VE\LUONG\Luong phan mem 2015\Thang 3\[Bang tien lan 2 thang 3 TNCN.xls]ExcelTemplate'!R9C[-5]:R404C[10],16,0) -> 780000 | H367: =1 -> 1 | I367: =RC[-4] -> 4 | J367: =RC[-4] -> 1200000 | K367: =RC[-3] -> 1
A368: 131 | B368: 013411 | C368: Nguyễn Văn Hà | D368: NV Lái xe - VHTTB | E368: 4 | F368: 1200000 | G368: =VLOOKUP(RC[-5],'\HOA VE\LUONG\Luong phan mem 2015\Thang 3\[Bang tien lan 2 thang 3 TNCN.xls]ExcelTemplate'!R9C[-5]:R404C[10],16,0) -> 780000 | H368: =1 -> 1 | I368: =RC[-4] -> 4 | J368: =RC[-4] -> 1200000 | K368: =RC[-3] -> 1
A369: 132 | B369: 013412 | C369: Nguyễn Mạnh Hiếu | D369: NV Lái xe - VHTTB | E369: 4 | F369: 1200000 | G369: =VLOOKUP(RC[-5],'\HOA VE\LUONG\Luong phan mem 2015\Thang 3\[Bang tien lan 2 thang 3 TNCN.xls]ExcelTemplate'!R9C[-5]:R404C[10],16,0) -> 780000 | H369: =1 -> 1 | I369: =RC[-4] -> 4 | J369: =RC[-4] -> 1200000 | K369: =RC[-3] -> 1
A370: 133 | B370: 013413 | C370: Vũ Việt Hùng | D370: NV Lái xe - VHTTB | E370: 4 | F370: 1200000 | G370: =VLOOKUP(RC[-5],'\HOA VE\LUONG\Luong phan mem 2015\Thang 3\[Bang tien lan 2 thang 3 TNCN.xls]ExcelTemplate'!R9C[-5]:R404C[10],16,0) -> 780000 | H370: =1 -> 1 | I370: =RC[-4] -> 4 | J370: =RC[-4] -> 1200000 | K370: =RC[-3] -> 1
A371: 134 | B371: 013414 | C371: Lê Hữu Hóa | D371: NV Lái xe - VHTTB | E371: 4 | F371: 1200000 | G371: =VLOOKUP(RC[-5],'\HOA VE\LUONG\Luong phan mem 2015\Thang 3\[Bang tien lan 2 thang 3 TNCN.xls]ExcelTemplate'!R9C[-5]:R404C[10],16,0) -> 780000 | H371: =1 -> 1 | I371: =RC[-4] -> 4 | J371: =RC[-4] -> 1200000 | K371: =RC[-3] -> 1
A372: 135 | B372: 013415 | C372: Đinh Văn Duyên | D372: NV Lái xe - VHTTB | E372: 4 | F372: 1200000 | G372: =VLOOKUP(RC[-5],'\HOA VE\LUONG\Luong phan mem 2015\Thang 3\[Bang tien lan 2 thang 3 TNCN.xls]ExcelTemplate'!R9C[-5]:R404C[10],16,0) -> 780000 | H372: =1 -> 1 | I372: =RC[-4] -> 4 | J372: =RC[-4] -> 1200000 | K372: =RC[-3] -> 1
A373: 136 | B373: 013530 | C373: Lương Văn Dư | D373: NV Lái xe - VHTTB | E373: 3 | F373: 900000 | G373: =VLOOKUP(RC[-5],'\HOA VE\LUONG\Luong phan mem 2015\Thang 3\[Bang tien lan 2 thang 3 TNCN.xls]ExcelTemplate'!R9C[-5]:R404C[10],16,0) -> 780000 | H373: =1 -> 1 | I373: =RC[-4] -> 3 | J373: =RC[-4] -> 900000 | K373: =RC[-3] -> 1
A374: 137 | B374: 013529 | C374: Cao Thế Vĩnh | D374: NV Thủ tục bay, không báo | E374: 3 | F374: 900000 | G374: =VLOOKUP(RC[-5],'\HOA VE\LUONG\Luong phan mem 2015\Thang 3\[Bang tien lan 2 thang 3 TNCN.xls]ExcelTemplate'!R9C[-5]:R404C[10],16,0) -> 780000 | H374: =1 -> 1 | I374: =RC[-4] -> 3 | J374: =RC[-4] -> 900000 | K374: =RC[-3] -> 1
A375: Đội phục vụ hành lý hàng hóa (HGS) | E375: =SUM(R[-137]C:R[-1]C) -> 1352 | F375: =SUM(R[-137]C:R[-1]C) -> 405600000 | G375: =VLOOKUP(RC[-5],'\HOA VE\LUONG\Luong phan mem 2015\Thang 3\[Bang tien lan 2 thang 3 TNCN.xls]ExcelTemplate'!R9C[-5]:R404C[10],16,0) -> #N/A | H375: =SUM(R[-137]C:R[-1]C) -> 137
A376: Đội phục vụ tàu bay (HGS) | G376: =VLOOKUP(RC[-5],'\HOA VE\LUONG\Luong phan mem 2015\Thang 3\[Bang tien lan 2 thang 3 TNCN.xls]ExcelTemplate'!R9C[-5]:R404C[10],16,0) -> #N/A
A377: 1 | B377: 010758 | C377: Trương Thị Minh Phượng | D377: Đội phó | E377: 12 | F377: 3600000 | G377: =VLOOKUP(RC[-5],'\HOA VE\LUONG\Luong phan mem 2015\Thang 3\[Bang tien lan 2 thang 3 TNCN.xls]ExcelTemplate'!R9C[-5]:R404C[10],16,0) -> 8722308 | H377: =1 -> 1 | I377: =RC[-4] -> 12 | J377: =RC[-4] -> 3600000 | K377: =RC[-3] -> 1
A378: 2 | B378: 010644 | C378: Nguyễn Văn Bình | D378: KTV mặt đất | E378: 12 | F378: 3600000 | G378: =VLOOKUP(RC[-5],'\HOA VE\LUONG\Luong phan mem 2015\Thang 3\[Bang tien lan 2 thang 3 TNCN.xls]ExcelTemplate'!R9C[-5]:R404C[10],16,0) -> 8768193 | H378: =1 -> 1 | I378: =RC[-4] -> 12 | J378: =RC[-4] -> 3600000 | K378: =RC[-3] -> 1
A379: 3 | B379: 010645 | C379: Thân Hoài Nam | D379: KTV mặt đất | E379: 12 | F379: 3600000 | G379: =VLOOKUP(RC[-5],'\HOA VE\LUONG\Luong phan mem 2015\Thang 3\[Bang tien lan 2 thang 3 TNCN.xls]ExcelTemplate'!R9C[-5]:R404C[10],16,0) -> 10173982 | H379: =1 -> 1 | I379: =RC[-4] -> 12 | J379: =RC[-4] -> 3600000 | K379: =RC[-3] -> 1
A380: 4 | B380: 013531 | C380: Võ Thị Vân | D380: Nhân viên vệ sinh khu bay | E380: 3 | F380: 900000 | G380: =VLOOKUP(RC[-5],'\HOA VE\LUONG\Luong phan mem 2015\Thang 3\[Bang tien lan 2 thang 3 TNCN.xls]ExcelTemplate'!R9C[-5]:R404C[10],16,0) -> 3685935 | H380: =1 -> 1 | I380: =RC[-4] -> 3 | J380: =RC[-4] -> 900000 | K380: =RC[-3] -> 1
A381: 5 | B381: 012508 | C381: Nguyễn Hồng Nhung | D381: Nv vệ sinh | E381: 8 | F381: 2400000 | G381: =VLOOKUP(RC[-5],'\HOA VE\LUONG\Luong phan mem 2015\Thang 3\[Bang tien lan 2 thang 3 TNCN.xls]ExcelTemplate'!R9C[-5]:R404C[10],16,0) -> 2130337 | H381: =1 -> 1 | I381: =RC[-4] -> 8 | J381: =RC[-4] -> 2400000 | K381: =RC[-3] -> 1
A382: 6 | B382: 012596 | C382: Phan Thị Hải Yến | D382: Nv vệ sinh | E382: 10 | F382: 3000000 | G382: =VLOOKUP(RC[-5],'\HOA VE\LUONG\Luong phan mem 2015\Thang 3\[Bang tien lan 2 thang 3 TNCN.xls]ExcelTemplate'!R9C[-5]:R404C[10],16,0) -> 4918079 | H382: =1 -> 1 | I382: =RC[-4] -> 10 | J382: =RC[-4] -> 3000000 | K382: =RC[-3] -> 1
A383: 7 | B383: 012597 | C383: Doãn Thị Thanh Hà | D383: Nv vệ sinh | E383: 10 | F383: 3000000 | G383: =VLOOKUP(RC[-5],'\HOA VE\LUONG\Luong phan mem 2015\Thang 3\[Bang tien lan 2 thang 3 TNCN.xls]ExcelTemplate'!R9C[-5]:R404C[10],16,0) -> 4842201 | H383: =1 -> 1 | I383: =RC[-4] -> 10 | J383: =RC[-4] -> 3000000 | K383: =RC[-3] -> 1
A384: 8 | B384: 013098 | C384: Đặng Thị Thúy Hằng | D384: Nv vệ sinh | E384: 6 | F384: 1800000 | G384: =VLOOKUP(RC[-5],'\HOA VE\LUONG\Luong phan mem 2015\Thang 3\[Bang tien lan 2 thang 3 TNCN.xls]ExcelTemplate'!R9C[-5]:R404C[10],16,0) -> 4725466 | H384: =1 -> 1 | I384: =RC[-4] -> 6 | J384: =RC[-4] -> 1800000 | K384: =RC[-3] -> 1
A385: 9 | B385: 013100 | C385: Nguyễn Thị Mến | D385: Nv vệ sinh | E385: 6 | F385: 1800000 | G385: =VLOOKUP(RC[-5],'\HOA VE\LUONG\Luong phan mem 2015\Thang 3\[Bang tien lan 2 thang 3 TNCN.xls]ExcelTemplate'!R9C[-5]:R404C[10],16,0) -> 4725466 | H385: =1 -> 1 | I385: =RC[-4] -> 6 | J385: =RC[-4] -> 1800000 | K385: =RC[-3] -> 1
A386: 10 | B386: 010754 | C386: Đào Hồng Phúc | D386: Nv VS MB | E386: 12 | F386: 3600000 | G386: =VLOOKUP(RC[-5],'\HOA VE\LUONG\Luong phan mem 2015\Thang 3\[Bang tien lan 2 thang 3 TNCN.xls]ExcelTemplate'!R9C[-5]:R404C[10],16,0) -> 5773057 | H386: =1 -> 1 | I386: =RC[-4] -> 12 | J386: =RC[-4] -> 3600000 | K386: =RC[-3] -> 1
A387: 11 | B387: 010755 | C387: Quàng Thị Hạnh | D387: Nv VS MB | E387: 12 | F387: 3600000 | G387: =VLOOKUP(RC[-5],'\HOA VE\LUONG\Luong phan mem 2015\Thang 3\[Bang tien lan 2 thang 3 TNCN.xls]ExcelTemplate'!R9C[-5]:R404C[10],16,0) -> 6185645 | H387: =1 -> 1 | I387: =RC[-4] -> 12 | J387: =RC[-4] -> 3600000 | K387: =RC[-3] -> 1
A388: 12 | B388: 010756 | C388: Nguyễn Thị Bình Minh | D388: Nv VS MB | E388: 12 | F388: 3600000 | G388: =VLOOKUP(RC[-5],'\HOA VE\LUONG\Luong phan mem 2015\Thang 3\[Bang tien lan 2 thang 3 TNCN.xls]ExcelTemplate'!R9C[-5]:R404C[10],16,0) -> 6185645 | H388: =1 -> 1 | I388: =RC[-4] -> 12 | J388: =RC[-4] -> 3600000 | K388: =RC[-3] -> 1
A389: 13 | B389: 010757 | C389: Nguyễn Văn Quý | D389: Nv VS MB | E389: 12 | F389: 3600000 | G389: =VLOOKUP(RC[-5],'\HOA VE\LUONG\Luong phan mem 2015\Thang 3\[Bang tien lan 2 thang 3 TNCN.xls]ExcelTemplate'!R9C[-5]:R404C[10],16,0) -> 6180387 | H389: =1 -> 1 | I389: =RC[-4] -> 12 | J389: =RC[-4] -> 3600000 | K389: =RC[-3] -> 1
A390: 14 | B390: 010759 | C390: Nguyễn Anh Đức | D390: Nv VS MB | E390: 12 | F390: 3600000 | G390: =VLOOKUP(RC[-5],'\HOA VE\LUONG\Luong phan mem 2015\Thang 3\[Bang tien lan 2 thang 3 TNCN.xls]ExcelTemplate'!R9C[-5]:R404C[10],16,0) -> 5773057 | H390: =1 -> 1 | I390: =RC[-4] -> 12 | J390: =RC[-4] -> 3600000 | K390: =RC[-3] -> 1
A391: 15 | B391: 010760 | C391: Trần Thị Ngọc Lan | D391: Nv VS MB | E391: 12 | F391: 3600000 | G391: =VLOOKUP(RC[-5],'\HOA VE\LUONG\Luong phan mem 2015\Thang 3\[Bang tien lan 2 thang 3 TNCN.xls]ExcelTemplate'!R9C[-5]:R404C[10],16,0) -> 2407666 | H391: =1 -> 1 | I391: =RC[-4] -> 12 | J391: =RC[-4] -> 3600000 | K391: =RC[-3] -> 1
A392: 16 | B392: 010761 | C392: Nguyễn Thị Anh Thơ | D392: Nv VS MB | E392: 12 | F392: 3600000 | G392: =VLOOKUP(RC[-5],'\HOA VE\LUONG\Luong phan mem 2015\Thang 3\[Bang tien lan 2 thang 3 TNCN.xls]ExcelTemplate'!R9C[-5]:R404C[10],16,0) -> 5773057 | H392: =1 -> 1 | I392: =RC[-4] -> 12 | J392: =RC[-4] -> 3600000 | K392: =RC[-3] -> 1
A393: 17 | B393: 010762 | C393: Nguyễn Thị Kim Thu | D393: Nv VS MB | E393: 12 | F393: 3600000 | G393: =VLOOKUP(RC[-5],'\HOA VE\LUONG\Luong phan mem 2015\Thang 3\[Bang tien lan 2 thang 3 TNCN.xls]ExcelTemplate'!R9C[-5]:R404C[10],16,0) -> 4780026 | H393: =1 -> 1 | I393: =RC[-4] -> 12 | J393: =RC[-4] -> 3600000 | K393: =RC[-3] -> 1
A394: 18 | B394: 010763 | C394: Nguyễn Thị Ngà | D394: Nv VS MB | E394: 12 | F394: 3600000 | G394: =VLOOKUP(RC[-5],'\HOA VE\LUONG\Luong phan mem 2015\Thang 3\[Bang tien lan 2 thang 3 TNCN.xls]ExcelTemplate'!R9C[-5]:R404C[10],16,0) -> 6119233 | H394: =1 -> 1 | I394: =RC[-4] -> 12 | J394: =RC[-4] -> 3600000 | K394: =RC[-3] -> 1
A395: 19 | B395: 010764 | C395: Nguyễn Thị Kim Anh | D395: Nv VS MB | E395: 12 | F395: 3600000 | G395: =VLOOKUP(RC[-5],'\HOA VE\LUONG\Luong phan mem 2015\Thang 3\[Bang tien lan 2 thang 3 TNCN.xls]ExcelTemplate'!R9C[-5]:R404C[10],16,0) -> 5773057 | H395: =1 -> 1 | I395: =RC[-4] -> 12 | J395: =RC[-4] -> 3600000 | K395: =RC[-3] -> 1
A396: 20 | B396: 010766 | C396: Nguyễn Thị Mai | D396: Nv VS MB | E396: 12 | F396: 3600000 | G396: =VLOOKUP(RC[-5],'\HOA VE\LUONG\Luong phan mem 2015\Thang 3\[Bang tien lan 2 thang 3 TNCN.xls]ExcelTemplate'!R9C[-5]:R404C[10],16,0) -> 5163223 | H396: =1 -> 1 | I396: =RC[-4] -> 12 | J396: =RC[-4] -> 3600000 | K396: =RC[-3] -> 1
A397: 21 | B397: 010767 | C397: Nguyễn Thị Huệ | D397: Nv VS MB | E397: 12 | F397: 3600000 | G397: =VLOOKUP(RC[-5],'\HOA VE\LUONG\Luong phan mem 2015\Thang 3\[Bang tien lan 2 thang 3 TNCN.xls]ExcelTemplate'!R9C[-5]:R404C[10],16,0) -> 5201863 | H397: =1 -> 1 | I397: =RC[-4] -> 12 | J397: =RC[-4] -> 3600000 | K397: =RC[-3] -> 1
A398: 22 | B398: 010768 | C398: Trần Duyên Hải | D398: Nv VS MB | E398: 12 | F398: 3600000 | G398: =VLOOKUP(RC[-5],'\HOA VE\LUONG\Luong phan mem 2015\Thang 3\[Bang tien lan 2 thang 3 TNCN.xls]ExcelTemplate'!R9C[-5]:R404C[10],16,0) -> 5163223 | H398: =1 -> 1 | I398: =RC[-4] -> 12 | J398: =RC[-4] -> 3600000 | K398: =RC[-3] -> 1
A399: 23 | B399: 010769 | C399: Nguyễn Thị Hải Yến | D399: Nv VS MB | E399: 12 | F399: 3600000 | G399: =VLOOKUP(RC[-5],'\HOA VE\LUONG\Luong phan mem 2015\Thang 3\[Bang tien lan 2 thang 3 TNCN.xls]ExcelTemplate'!R9C[-5]:R404C[10],16,0) -> 5163223 | H399: =1 -> 1 | I399: =RC[-4] -> 12 | J399: =RC[-4] -> 3600000 | K399: =RC[-3] -> 1
A400: 24 | B400: 010770 | C400: Trần Trọng Anh Chí | D400: Nv VS MB | E400: 12 | F400: 3600000 | G400: =VLOOKUP(RC[-5],'\HOA VE\LUONG\Luong phan mem 2015\Thang 3\[Bang tien lan 2 thang 3 TNCN.xls]ExcelTemplate'!R9C[-5]:R404C[10],16,0) -> 5357069 | H400: =1 -> 1 | I400: =RC[-4] -> 12 | J400: =RC[-4] -> 3600000 | K400: =RC[-3] -> 1
A401: 25 | B401: 010771 | C401: Trần Thị Thu Thuỷ | D401: Nv VS MB | E401: 12 | F401: 3600000 | G401: =VLOOKUP(RC[-5],'\HOA VE\LUONG\Luong phan mem 2015\Thang 3\[Bang tien lan 2 thang 3 TNCN.xls]ExcelTemplate'!R9C[-5]:R404C[10],16,0) -> 2145012 | H401: =1 -> 1 | I401: =RC[-4] -> 12 | J401: =RC[-4] -> 3600000 | K401: =RC[-3] -> 1
A402: 26 | B402: 010772 | C402: Đậu Thị Hồng Nguyệt | D402: Nv VS MB | E402: 12 | F402: 3600000 | G402: =VLOOKUP(RC[-5],'\HOA VE\LUONG\Luong phan mem 2015\Thang 3\[Bang tien lan 2 thang 3 TNCN.xls]ExcelTemplate'!R9C[-5]:R404C[10],16,0) -> 5464518 | H402: =1 -> 1 | I402: =RC[-4] -> 12 | J402: =RC[-4] -> 3600000 | K402: =RC[-3] -> 1
A403: 27 | B403: 010773 | C403: Nguyễn Thị Mến | D403: Nv VS MB | E403: 12 | F403: 3600000 | G403: =VLOOKUP(RC[-5],'\HOA VE\LUONG\Luong phan mem 2015\Thang 3\[Bang tien lan 2 thang 3 TNCN.xls]ExcelTemplate'!R9C[-5]:R404C[10],16,0) -> 5773057 | H403: =1 -> 1 | I403: =RC[-4] -> 12 | J403: =RC[-4] -> 3600000 | K403: =RC[-3] -> 1
A404: 28 | B404: 010774 | C404: Lò Thị Phượng | D404: Nv VS MB | E404: 12 | F404: 3600000 | G404: =VLOOKUP(RC[-5],'\HOA VE\LUONG\Luong phan mem 2015\Thang 3\[Bang tien lan 2 thang 3 TNCN.xls]ExcelTemplate'!R9C[-5]:R404C[10],16,0) -> 4845926 | H404: =1 -> 1 | I404: =RC[-4] -> 12 | J404: =RC[-4] -> 3600000 | K404: =RC[-3] -> 1
A405: 29 | B405: 010775 | C405: Đặng Thị Thu Hường | D405: Nv VS MB | E405: 12 | F405: 3600000 | G405: =VLOOKUP(RC[-5],'\HOA VE\LUONG\Luong phan mem 2015\Thang 3\[Bang tien lan 2 thang 3 TNCN.xls]ExcelTemplate'!R9C[-5]:R404C[10],16,0) -> 6185645 | H405: =1 -> 1 | I405: =RC[-4] -> 12 | J405: =RC[-4] -> 3600000 | K405: =RC[-3] -> 1
A406: 30 | B406: 010776 | C406: Nguyễn Thị Thu | D406: Nv VS MB | E406: 12 | F406: 3600000 | G406: =VLOOKUP(RC[-5],'\HOA VE\LUONG\Luong phan mem 2015\Thang 3\[Bang tien lan 2 thang 3 TNCN.xls]ExcelTemplate'!R9C[-5]:R404C[10],16,0) -> 2276339 | H406: =1 -> 1 | I406: =RC[-4] -> 12 | J406: =RC[-4] -> 3600000 | K406: =RC[-3] -> 1
A407: 31 | B407: 010777 | C407: Nguyễn Thị Lý | D407: Nv VS MB | E407: 12 | F407: 3600000 | G407: =VLOOKUP(RC[-5],'\HOA VE\LUONG\Luong phan mem 2015\Thang 3\[Bang tien lan 2 thang 3 TNCN.xls]ExcelTemplate'!R9C[-5]:R404C[10],16,0) -> 5464518 | H407: =1 -> 1 | I407: =RC[-4] -> 12 | J407: =RC[-4] -> 3600000 | K407: =RC[-3] -> 1
A408: 32 | B408: 010780 | C408: Hoàng Hải Yến | D408: Nv VS MB | E408: 12 | F408: 3600000 | G408: =VLOOKUP(RC[-5],'\HOA VE\LUONG\Luong phan mem 2015\Thang 3\[Bang tien lan 2 thang 3 TNCN.xls]ExcelTemplate'!R9C[-5]:R404C[10],16,0) -> 5464518 | H408: =1 -> 1 | I408: =RC[-4] -> 12 | J408: =RC[-4] -> 3600000 | K408: =RC[-3] -> 1
A409: 33 | B409: 010781 | C409: Lê Phương Huyền | D409: Nv VS MB | E409: 12 | F409: 3600000 | G409: =VLOOKUP(RC[-5],'\HOA VE\LUONG\Luong phan mem 2015\Thang 3\[Bang tien lan 2 thang 3 TNCN.xls]ExcelTemplate'!R9C[-5]:R404C[10],16,0) -> 5692152 | H409: =1 -> 1 | I409: =RC[-4] -> 12 | J409: =RC[-4] -> 3600000 | K409: =RC[-3] -> 1
A410: 34 | B410: 010782 | C410: Phạm Thị Lan Phương | D410: Nv VS MB | E410: 12 | F410: 3600000 | G410: =VLOOKUP(RC[-5],'\HOA VE\LUONG\Luong phan mem 2015\Thang 3\[Bang tien lan 2 thang 3 TNCN.xls]ExcelTemplate'!R9C[-5]:R404C[10],16,0) -> 5379184 | H410: =1 -> 1 | I410: =RC[-4] -> 12 | J410: =RC[-4] -> 3600000 | K410: =RC[-3] -> 1
A411: 35 | B411: 010783 | C411: Phạm Thị Thuý Ngà | D411: Nv VS MB | E411: 12 | F411: 3600000 | G411: =VLOOKUP(RC[-5],'\HOA VE\LUONG\Luong phan mem 2015\Thang 3\[Bang tien lan 2 thang 3 TNCN.xls]ExcelTemplate'!R9C[-5]:R404C[10],16,0) -> 6119233 | H411: =1 -> 1 | I411: =RC[-4] -> 12 | J411: =RC[-4] -> 3600000 | K411: =RC[-3] -> 1
A412: 36 | B412: 011769 | C412: Ngô Thị Hường | D412: Nv VS MB | E412: 12 | F412: 3600000 | G412: =VLOOKUP(RC[-5],'\HOA VE\LUONG\Luong phan mem 2015\Thang 3\[Bang tien lan 2 thang 3 TNCN.xls]ExcelTemplate'!R9C[-5]:R404C[10],16,0) -> 5163223 | H412: =1 -> 1 | I412: =RC[-4] -> 12 | J412: =RC[-4] -> 3600000 | K412: =RC[-3] -> 1
A413: Đội phục vụ tàu bay (HGS) | E413: =SUM(R[-36]C:R[-1]C) -> 403 | F413: =SUM(R[-36]C:R[-1]C) -> 120900000 | G413: =VLOOKUP(RC[-5],'\HOA VE\LUONG\Luong phan mem 2015\Thang 3\[Bang tien lan 2 thang 3 TNCN.xls]ExcelTemplate'!R9C[-5]:R404C[10],16,0) -> #N/A | H413: =SUM(R[-36]C:R[-1]C) -> 36
A414: Đội sửa chữa, bảo dưỡng trang thiết bị (HGS) | G414: =VLOOKUP(RC[-5],'\HOA VE\LUONG\Luong phan mem 2015\Thang 3\[Bang tien lan 2 thang 3 TNCN.xls]ExcelTemplate'!R9C[-5]:R404C[10],16,0) -> #N/A
A415: 1 | B415: 011082 | C415: Hoàng Trung Dũng | D415: CV Kỹ thuật | E415: 12 | F415: 3600000 | G415: =VLOOKUP(RC[-5],'\HOA VE\LUONG\Luong phan mem 2015\Thang 3\[Bang tien lan 2 thang 3 TNCN.xls]ExcelTemplate'!R9C[-5]:R404C[10],16,0) -> 8550351 | H415: =1 -> 1 | I415: =RC[-4] -> 12 | J415: =RC[-4] -> 3600000 | K415: =RC[-3] -> 1
A416: 2 | B416: 011083 | C416: Bùi Văn Nam | D416: CV Kỹ thuật | E416: 12 | F416: 3600000 | G416: =VLOOKUP(RC[-5],'\HOA VE\LUONG\Luong phan mem 2015\Thang 3\[Bang tien lan 2 thang 3 TNCN.xls]ExcelTemplate'!R9C[-5]:R404C[10],16,0) -> 8929741 | H416: =1 -> 1 | I416: =RC[-4] -> 12 | J416: =RC[-4] -> 3600000 | K416: =RC[-3] -> 1
A417: 3 | B417: 010643 | C417: Nguyễn Văn Thành | D417: KTV mặt đất | E417: 12 | F417: 3600000 | G417: =VLOOKUP(RC[-5],'\HOA VE\LUONG\Luong phan mem 2015\Thang 3\[Bang tien lan 2 thang 3 TNCN.xls]ExcelTemplate'!R9C[-5]:R404C[10],16,0) -> 7478391 | H417: =1 -> 1 | I417: =RC[-4] -> 12 | J417: =RC[-4] -> 3600000 | K417: =RC[-3] -> 1
A418: 4 | B418: 013049 | C418: Nguyễn Đức Anh | D418: Nhân viên kỹ thuật | E418: 7 | F418: 2100000 | G418: =VLOOKUP(RC[-5],'\HOA VE\LUONG\Luong phan mem 2015\Thang 3\[Bang tien lan 2 thang 3 TNCN.xls]ExcelTemplate'!R9C[-5]:R404C[10],16,0) -> 6338622 | H418: =1 -> 1 | I418: =RC[-4] -> 7 | J418: =RC[-4] -> 2100000 | K418: =RC[-3] -> 1
A419: Đội sửa chữa, bảo dưỡng trang thiết bị (HGS) | E419: =SUM(R[-4]C:R[-1]C) -> 43 | F419: =SUM(R[-4]C:R[-1]C) -> 12900000 | G419: =VLOOKUP(RC[-5],'\HOA VE\LUONG\Luong phan mem 2015\Thang 3\[Bang tien lan 2 thang 3 TNCN.xls]ExcelTemplate'!R9C[-5]:R404C[10],16,0) -> #N/A | H419: =SUM(R[-4]C:R[-1]C) -> 4
A420: Phòng Phục vụ kỹ thuật sân đỗ (HGS) | E420: =SUM(R[-213]C[4]:R[-1]C[4]) -> 2086 | F420: =SUM(R[-213]C[4]:R[-1]C[4]) -> 625800000 | G420: =VLOOKUP(RC[-5],'\HOA VE\LUONG\Luong phan mem 2015\Thang 3\[Bang tien lan 2 thang 3 TNCN.xls]ExcelTemplate'!R9C[-5]:R404C[10],16,0) -> #N/A | H420: =SUM(R[-213]C[3]:R[-1]C[3]) -> 201
A421: Phòng Tài chính - Kế toán (HGS) | G421: =VLOOKUP(RC[-5],'\HOA VE\LUONG\Luong phan mem 2015\Thang 3\[Bang tien lan 2 thang 3 TNCN.xls]ExcelTemplate'!R9C[-5]:R404C[10],16,0) -> #N/A
G422: =VLOOKUP(RC[-5],'\HOA VE\LUONG\Luong phan mem 2015\Thang 3\[Bang tien lan 2 thang 3 TNCN.xls]ExcelTemplate'!R9C[-5]:R404C[10],16,0) -> #N/A
A423: 1 | B423: 010796 | C423: Trần Thị Thúy Oanh | D423: Trưởng phòng | E423: 12 | F423: 3600000 | G423: =VLOOKUP(RC[-5],'\HOA VE\LUONG\Luong phan mem 2015\Thang 3\[Bang tien lan 2 thang 3 TNCN.xls]ExcelTemplate'!R9C[-5]:R404C[10],16,0) -> 19205000 | H423: =1 -> 1 | I423: =RC[-4] -> 12 | J423: =RC[-4] -> 3600000 | K423: =RC[-3] -> 1
A424: 2 | B424: 010595 | C424: Lê Thị Mai | D424: Nhân viên kế toán | E424: 12 | F424: 3600000 | G424: =VLOOKUP(RC[-5],'\HOA VE\LUONG\Luong phan mem 2015\Thang 3\[Bang tien lan 2 thang 3 TNCN.xls]ExcelTemplate'!R9C[-5]:R404C[10],16,0) -> 6488163 | H424: =1 -> 1 | I424: =RC[-4] -> 12 | J424: =RC[-4] -> 3600000 | K424: =RC[-3] -> 1
A425: 3 | B425: 010793 | C425: Lê Thị Thuý | D425: Nhân viên kế toán | E425: 12 | F425: 3600000 | G425: =VLOOKUP(RC[-5],'\HOA VE\LUONG\Luong phan mem 2015\Thang 3\[Bang tien lan 2 thang 3 TNCN.xls]ExcelTemplate'!R9C[-5]:R404C[10],16,0) -> 8531031 | H425: =1 -> 1 | I425: =RC[-4] -> 12 | J425: =RC[-4] -> 3600000 | K425: =RC[-3] -> 1
A426: 4 | B426: 012660 | C426: Bùi Thị Thu | D426: Nhân viên kế toán | E426: 10 | F426: 3000000 | G426: =VLOOKUP(RC[-5],'\HOA VE\LUONG\Luong phan mem 2015\Thang 3\[Bang tien lan 2 thang 3 TNCN.xls]ExcelTemplate'!R9C[-5]:R404C[10],16,0) -> 7382998 | H426: =1 -> 1 | I426: =RC[-4] -> 10 | J426: =RC[-4] -> 3000000 | K426: =RC[-3] -> 1
A427: 5 | B427: 010794 | C427: Nguyễn Thị Kim Huệ | D427: NV Thủ Quỹ | E427: 12 | F427: 3600000 | G427: =VLOOKUP(RC[-5],'\HOA VE\LUONG\Luong phan mem 2015\Thang 3\[Bang tien lan 2 thang 3 TNCN.xls]ExcelTemplate'!R9C[-5]:R404C[10],16,0) -> 7159391 | H427: =1 -> 1 | I427: =RC[-4] -> 12 | J427: =RC[-4] -> 3600000 | K427: =RC[-3] -> 1
A428: 6 | B428: 010788 | C428: Phạm Thị Thu Hiền | D428: Chuyên viên TCKT | E428: 12 | F428: 3600000 | G428: =VLOOKUP(RC[-5],'\HOA VE\LUONG\Luong phan mem 2015\Thang 3\[Bang tien lan 2 thang 3 TNCN.xls]ExcelTemplate'!R9C[-5]:R404C[10],16,0) -> 9521667 | H428: =1 -> 1 | I428: =RC[-4] -> 12 | J428: =RC[-4] -> 3600000 | K428: =RC[-3] -> 1
A429: 7 | B429: 010789 | C429: Hoàng Thị Trang Nhung | D429: Chuyên viên TCKT | E429: 12 | F429: 3600000 | G429: =VLOOKUP(RC[-5],'\HOA VE\LUONG\Luong phan mem 2015\Thang 3\[Bang tien lan 2 thang 3 TNCN.xls]ExcelTemplate'!R9C[-5]:R404C[10],16,0) -> 5387206 | H429: =1 -> 1 | I429: =RC[-4] -> 12 | J429: =RC[-4] -> 3600000 | K429: =RC[-3] -> 1
A430: 8 | B430: 010790 | C430: Đào Thị Chín | D430: Chuyên viên TCKT | E430: 12 | F430: 3600000 | G430: =VLOOKUP(RC[-5],'\HOA VE\LUONG\Luong phan mem 2015\Thang 3\[Bang tien lan 2 thang 3 TNCN.xls]ExcelTemplate'!R9C[-5]:R404C[10],16,0) -> 9521667 | H430: =1 -> 1 | I430: =RC[-4] -> 12 | J430: =RC[-4] -> 3600000 | K430: =RC[-3] -> 1
A431: 9 | B431: 010791 | C431: Trần Thu Trang | D431: Chuyên viên TCKT | E431: 12 | F431: 3600000 | G431: =VLOOKUP(RC[-5],'\HOA VE\LUONG\Luong phan mem 2015\Thang 3\[Bang tien lan 2 thang 3 TNCN.xls]ExcelTemplate'!R9C[-5]:R404C[10],16,0) -> 8245826 | H431: =1 -> 1 | I431: =RC[-4] -> 12 | J431: =RC[-4] -> 3600000 | K431: =RC[-3] -> 1
A432: 10 | B432: 011147 | C432: Vũ Chí Kiên | D432: Chuyên viên TCKT | E432: 12 | F432: 3600000 | G432: =VLOOKUP(RC[-5],'\HOA VE\LUONG\Luong phan mem 2015\Thang 3\[Bang tien lan 2 thang 3 TNCN.xls]ExcelTemplate'!R9C[-5]:R404C[10],16,0) -> 10046976 | H432: =1 -> 1 | I432: =RC[-4] -> 12 | J432: =RC[-4] -> 3600000 | K432: =RC[-3] -> 1
E433: =SUM(R[-10]C:R[-1]C) -> 118 | F433: =SUM(R[-10]C:R[-1]C) -> 35400000 | G433: =VLOOKUP(RC[-5],'\HOA VE\LUONG\Luong phan mem 2015\Thang 3\[Bang tien lan 2 thang 3 TNCN.xls]ExcelTemplate'!R9C[-5]:R404C[10],16,0) -> #N/A | H433: =SUM(R[-10]C:R[-1]C) -> 10
A434: Phòng Tài chính - Kế toán (HGS) | E434: =SUM(R[-12]C[4]:R[-1]C[4]) -> 118 | F434: =SUM(R[-12]C[4]:R[-1]C[4]) -> 35400000 | G434: =VLOOKUP(RC[-5],'\HOA VE\LUONG\Luong phan mem 2015\Thang 3\[Bang tien lan 2 thang 3 TNCN.xls]ExcelTemplate'!R9C[-5]:R404C[10],16,0) -> #N/A | H434: =SUM(R[-12]C[3]:R[-1]C[3]) -> 10
A435: Phòng Tổ chức - Hành chính (HGS) | G435: =VLOOKUP(RC[-5],'\HOA VE\LUONG\Luong phan mem 2015\Thang 3\[Bang tien lan 2 thang 3 TNCN.xls]ExcelTemplate'!R9C[-5]:R404C[10],16,0) -> #N/A
G436: =VLOOKUP(RC[-5],'\HOA VE\LUONG\Luong phan mem 2015\Thang 3\[Bang tien lan 2 thang 3 TNCN.xls]ExcelTemplate'!R9C[-5]:R404C[10],16,0) -> #N/A
A437: 1 | B437: 010563 | C437: Lưu Xuân Cường | D437: Trưởng phòng | E437: 12 | F437: 3600000 | G437: =VLOOKUP(RC[-5],'\HOA VE\LUONG\Luong phan mem 2015\Thang 3\[Bang tien lan 2 thang 3 TNCN.xls]ExcelTemplate'!R9C[-5]:R404C[10],16,0) -> 16461396 | H437: =1 -> 1 | I437: =RC[-4] -> 12 | J437: =RC[-4] -> 3600000 | K437: =RC[-3] -> 1
A438: 2 | B438: 010556 | C438: Nguyễn Thị Thuỳ Linh | D438: Phó Trưởng Phòng | E438: 12 | F438: 3600000 | G438: =VLOOKUP(RC[-5],'\HOA VE\LUONG\Luong phan mem 2015\Thang 3\[Bang tien lan 2 thang 3 TNCN.xls]ExcelTemplate'!R9C[-5]:R404C[10],16,0) -> 7888204 | H438: =1 -> 1 | I438: =RC[-4] -> 12 | J438: =RC[-4] -> 3600000 | K438: =RC[-3] -> 1
A439: 3 | B439: 010797 | C439: Nguyễn Hữu Hạ | D439: CV Đảng Đoàn - Thi đua | E439: 12 | F439: 3600000 | G439: =VLOOKUP(RC[-5],'\HOA VE\LUONG\Luong phan mem 2015\Thang 3\[Bang tien lan 2 thang 3 TNCN.xls]ExcelTemplate'!R9C[-5]:R404C[10],16,0) -> 9262823 | H439: =1 -> 1 | I439: =RC[-4] -> 12 | J439: =RC[-4] -> 3600000 | K439: =RC[-3] -> 1
A440: 4 | B440: 010803 | C440: Hà Duyên Lâm | D440: Lái xe CT | E440: 12 | F440: 3600000 | G440: =VLOOKUP(RC[-5],'\HOA VE\LUONG\Luong phan mem 2015\Thang 3\[Bang tien lan 2 thang 3 TNCN.xls]ExcelTemplate'!R9C[-5]:R404C[10],16,0) -> 7535143 | H440: =1 -> 1 | I440: =RC[-4] -> 12 | J440: =RC[-4] -> 3600000 | K440: =RC[-3] -> 1
A441: 5 | B441: 010800 | C441: Hoàng Thuỳ Lan | D441: NV đào tạo huấn luyện | E441: 12 | F441: 3600000 | G441: =VLOOKUP(RC[-5],'\HOA VE\LUONG\Luong phan mem 2015\Thang 3\[Bang tien lan 2 thang 3 TNCN.xls]ExcelTemplate'!R9C[-5]:R404C[10],16,0) -> 7251161 | H441: =1 -> 1 | I441: =RC[-4] -> 12 | J441: =RC[-4] -> 3600000 | K441: =RC[-3] -> 1
A442: 6 | B442: 010801 | C442: Diệu Linh | D442: NV đào tạo huấn luyện | E442: 12 | F442: 3600000 | G442: =VLOOKUP(RC[-5],'\HOA VE\LUONG\Luong phan mem 2015\Thang 3\[Bang tien lan 2 thang 3 TNCN.xls]ExcelTemplate'!R9C[-5]:R404C[10],16,0) -> 8651176 | H442: =1 -> 1 | I442: =RC[-4] -> 12 | J442: =RC[-4] -> 3600000 | K442: =RC[-3] -> 1
A443: 7 | B443: 010802 | C443: Hà Phương Thảo | D443: NV hành chính | E443: 12 | F443: 3600000 | G443: =VLOOKUP(RC[-5],'\HOA VE\LUONG\Luong phan mem 2015\Thang 3\[Bang tien lan 2 thang 3 TNCN.xls]ExcelTemplate'!R9C[-5]:R404C[10],16,0) -> 6809185 | H443: =1 -> 1 | I443: =RC[-4] -> 12 | J443: =RC[-4] -> 3600000 | K443: =RC[-3] -> 1
A444: 8 | B444: 010805 | C444: Trịnh Thị Thu Hằng | D444: NV Hành chính - VT | E444: 11 | F444: 3300000 | G444: =VLOOKUP(RC[-5],'\HOA VE\LUONG\Luong phan mem 2015\Thang 3\[Bang tien lan 2 thang 3 TNCN.xls]ExcelTemplate'!R9C[-5]:R404C[10],16,0) -> 6161308 | H444: =1 -> 1 | I444: =RC[-4] -> 11 | J444: =RC[-4] -> 3300000 | K444: =RC[-3] -> 1
A445: 9 | B445: 010566 | C445: Nguyễn Thị Ngọc | D445: NV Kế hoạch - Quản lý chất lượng | E445: 12 | F445: 3600000 | G445: =VLOOKUP(RC[-5],'\HOA VE\LUONG\Luong phan mem 2015\Thang 3\[Bang tien lan 2 thang 3 TNCN.xls]ExcelTemplate'!R9C[-5]:R404C[10],16,0) -> 7386621 | H445: =1 -> 1 | I445: =RC[-4] -> 12 | J445: =RC[-4] -> 3600000 | K445: =RC[-3] -> 1
A446: 10 | B446: 010804 | C446: Vũ Thị Hoà | D446: NV Lao động tiền lương | E446: 12 | F446: 3600000 | G446: =VLOOKUP(RC[-5],'\HOA VE\LUONG\Luong phan mem 2015\Thang 3\[Bang tien lan 2 thang 3 TNCN.xls]ExcelTemplate'!R9C[-5]:R404C[10],16,0) -> 8531031 | H446: =1 -> 1 | I446: =RC[-4] -> 12 | J446: =RC[-4] -> 3600000 | K446: =RC[-3] -> 1
A447: 11 | B447: 011117 | C447: Nguyễn Hương Giang | D447: NV PVHK | E447: 12 | F447: 3600000 | G447: =VLOOKUP(RC[-5],'\HOA VE\LUONG\Luong phan mem 2015\Thang 3\[Bang tien lan 2 thang 3 TNCN.xls]ExcelTemplate'!R9C[-5]:R404C[10],16,0) -> 5590913 | H447: =1 -> 1 | I447: =RC[-4] -> 12 | J447: =RC[-4] -> 3600000 | K447: =RC[-3] -> 1
A448: 12 | B448: 010735 | C448: Nguyễn Thị Phương Lan | D448: NV Thống kê - Tổng hợp | E448: 12 | F448: 3600000 | G448: =VLOOKUP(RC[-5],'\HOA VE\LUONG\Luong phan mem 2015\Thang 3\[Bang tien lan 2 thang 3 TNCN.xls]ExcelTemplate'!R9C[-5]:R404C[10],16,0) -> 7386621 | H448: =1 -> 1 | I448: =RC[-4] -> 12 | J448: =RC[-4] -> 3600000 | K448: =RC[-3] -> 1
A449: 13 | B449: 010562 | C449: Phạm Thị Thịnh | D449: NV Thủ kho | E449: 12 | F449: 3600000 | G449: =VLOOKUP(RC[-5],'\HOA VE\LUONG\Luong phan mem 2015\Thang 3\[Bang tien lan 2 thang 3 TNCN.xls]ExcelTemplate'!R9C[-5]:R404C[10],16,0) -> 6820053 | H449: =1 -> 1 | I449: =RC[-4] -> 12 | J449: =RC[-4] -> 3600000 | K449: =RC[-3] -> 1
A450: 14 | B450: 010637 | C450: Trần Đình Cát | D450: NV trông giữ hành lý | E450: 12 | F450: 3600000 | G450: =VLOOKUP(RC[-5],'\HOA VE\LUONG\Luong phan mem 2015\Thang 3\[Bang tien lan 2 thang 3 TNCN.xls]ExcelTemplate'!R9C[-5]:R404C[10],16,0) -> 6134319 | H450: =1 -> 1 | I450: =RC[-4] -> 12 | J450: =RC[-4] -> 3600000 | K450: =RC[-3] -> 1
A451: 15 | B451: 010799 | C451: Phương Lan | D451: Chuyên viên lao động tiền lương | E451: 12 | F451: 3600000 | G451: =VLOOKUP(RC[-5],'\HOA VE\LUONG\Luong phan mem 2015\Thang 3\[Bang tien lan 2 thang 3 TNCN.xls]ExcelTemplate'!R9C[-5]:R404C[10],16,0) -> 9521667 | H451: =1 -> 1 | I451: =RC[-4] -> 12 | J451: =RC[-4] -> 3600000 | K451: =RC[-3] -> 1
E452: =SUM(R[-15]C:R[-1]C) -> 179 | F452: =SUM(R[-15]C:R[-1]C) -> 53700000 | G452: =VLOOKUP(RC[-5],'\HOA VE\LUONG\Luong phan mem 2015\Thang 3\[Bang tien lan 2 thang 3 TNCN.xls]ExcelTemplate'!R9C[-5]:R404C[10],16,0) -> #N/A | H452: =SUM(R[-15]C:R[-1]C) -> 15
A453: Phòng Tổ chức - Hành chính (HGS) | E453: =SUM(R[-17]C[4]:R[-1]C[4]) -> 179 | F453: =SUM(R[-17]C[4]:R[-1]C[4]) -> 53700000 | G453: =VLOOKUP(RC[-5],'\HOA VE\LUONG\Luong phan mem 2015\Thang 3\[Bang tien lan 2 thang 3 TNCN.xls]ExcelTemplate'!R9C[-5]:R404C[10],16,0) -> #N/A | H453: =SUM(R[-17]C[3]:R[-1]C[3]) -> 15
A454: Công ty Phục vụ mặt đất Hà Nội (HGS) | B454: =RC[6] -> 395 | C454: Tổng cộng: | E454: =SUM(R[-443]C[4]:R[-1]C[4]) -> 4087 | F454: =SUM(R[-443]C[4]:R[-1]C[4]) -> 1226100000 | G454: =VLOOKUP(RC[-5],'\HOA VE\LUONG\Luong phan mem 2015\Thang 3\[Bang tien lan 2 thang 3 TNCN.xls]ExcelTemplate'!R9C[-5]:R404C[10],16,0) -> #N/A | H454: =SUM(R[-443]C[3]:R[-1]C[3]) -> 395
F455: =1223700000-R[-1]C -> -2400000
B457: NGƯỜI LẬP BẢNG | D457: PHÒNG TỔ CHỨC HÀNH CHÍNH | E457: PHÒNG TÀI CHÍNH KẾ TOÁN | F457: THỦ TRƯỞNG ĐƠN VỊ